,ID,Author,body,Comment,Score,Created On,Replies,Submission,Subreddit,Subreddit_ID,Distinguished,Edited,Is_submitter,link_id,Parent_id,Permalink
177,ius6j42,herewego199209,"Any oil that you eat in large quantities is bad for you. It's excess calories. Seed oils like sunflower oil, canola oil, etc are calorie bombs with very little health benefits to them. The main arguments against them being that they're being the cause of inflammation, free radicals, etc are unfounded, but we'll never know any of this because we can't do randomized controlled trials where we give people canola oil every day for 20 years and then give someone olive oils for twenty years and then give someone ghee for 20 years and see what the health outcomes are. I quit using seed oils when I did Keto last year and my inflammation markers all went away. Does that mean the keto and paleo zealots are correct? Or is it a mere coincidence. Who knows. I think the main point is eating tons of butter and tallow, etc instead of vegetable oil like the keto and paleo zealots say  is not going to be healthier.  All of this is moderation and calories in and calories out.","Any oil that you eat in large quantities is bad for you. It's excess calories. Seed oils like sunflower oil, canola oil, etc are calorie bombs with very little health benefits to them. The main arguments against them being that they're being the cause of inflammation, free radicals, etc are unfounded, but we'll never know any of this because we can't do randomized controlled trials where we give people canola oil every day for 20 years and then give someone olive oils for twenty years and then give someone ghee for 20 years and see what the health outcomes are. I quit using seed oils when I did Keto last year and my inflammation markers all went away. Does that mean the keto and paleo zealots are correct? Or is it a mere coincidence. Who knows. I think the main point is eating tons of butter and tallow, etc instead of vegetable oil like the keto and paleo zealots say  is not going to be healthier.  All of this is moderation and calories in and calories out.",1,2022-11-02 17:07:54,<praw.models.comment_forest.CommentForest object at 0x0000022EF31AED00>,yk8skt,nutrition,t5_2qoox,,False,False,t3_yk8skt,t3_yk8skt,/r/nutrition/comments/yk8skt/where_did_the_conspiracy_theory_that_seed_oils/ius6j42/
178,ius6fnj,Technical-Berry8471,"There does not seem to be any scientific support for the view that seed oils are unhealthy, 

https://consensus.app/results/?q=Are%20seed%20oils%20healthy%3F%20

I did try Googling a combination of unhealthy + seed oil, but all I got was a lot of assertions and YouTubers making faces in supermarkets.","There does not seem to be any scientific support for the view that seed oils are unhealthy, 

https://consensus.app/results/?q=Are%20seed%20oils%20healthy%3F%20

I did try Googling a combination of unhealthy + seed oil, but all I got was a lot of assertions and YouTubers making faces in supermarkets.",1,2022-11-02 17:07:16,<praw.models.comment_forest.CommentForest object at 0x0000022EF31AEE80>,yk8skt,nutrition,t5_2qoox,,False,False,t3_yk8skt,t3_yk8skt,/r/nutrition/comments/yk8skt/where_did_the_conspiracy_theory_that_seed_oils/ius6fnj/
179,ius6uwz,frozenmollusk,https://www.consumerreports.org/healthy-eating/do-seed-oils-make-you-sick-a1363483895/ if you search for #seedoilfree on instagram and tiktok you‘ll probably find some influencers that push this,https://www.consumerreports.org/healthy-eating/do-seed-oils-make-you-sick-a1363483895/ if you search for #seedoilfree on instagram and tiktok you‘ll probably find some influencers that push this,1,2022-11-02 17:10:00,<praw.models.comment_forest.CommentForest object at 0x0000022EF3190160>,yk8skt,nutrition,t5_2qoox,,False,False,t3_yk8skt,t3_yk8skt,/r/nutrition/comments/yk8skt/where_did_the_conspiracy_theory_that_seed_oils/ius6uwz/
180,iutakm2,Repulsive_Ad_1272,"I’ve done a bit of research on this, but admittedly am very much an amateur. I believe the issue isn’t that they’re inherently worse to begin with, but the process of how they’re extracted is worrisome. 

The same could be said about olive oil if it were heavily refined, typically only first/cold pressed EVOO is considered as the “super healthy” kind, and that’s simply because it’s as close to “raw” and “unprocessed” as you can get. 

From my understanding, seed oils are typically milked for all their worth, and they’re cheap. More importantly, they’re commonly used for high heat cooking, where contrary to popular belief, they’re actually far less stable than EVOO would be. 

I could link a bunch of science to it, but Cobram Estates makes a pretty good explanation of it [here.](https://www.cobramestate.com/blogs/all-blogs/shattering-the-myth-can-you-cook-with-extra-virgin-olive-oil)

I understand Cobram would want olive oil viewed as the holy grail of oils given it’s what they sell, but it seems like sound science to a simpleton such as myself.

Edit: I realize I didn’t clarify this earlier, but the cheapness of seed oils to me stands out because their price is their appeal. I think their suitability for high heat cooking is arguable, especially commercially where the same batch of oil is used multiple times, thus making it less stable/more carcinogenic.","I’ve done a bit of research on this, but admittedly am very much an amateur. I believe the issue isn’t that they’re inherently worse to begin with, but the process of how they’re extracted is worrisome. 

The same could be said about olive oil if it were heavily refined, typically only first/cold pressed EVOO is considered as the “super healthy” kind, and that’s simply because it’s as close to “raw” and “unprocessed” as you can get. 

From my understanding, seed oils are typically milked for all their worth, and they’re cheap. More importantly, they’re commonly used for high heat cooking, where contrary to popular belief, they’re actually far less stable than EVOO would be. 

I could link a bunch of science to it, but Cobram Estates makes a pretty good explanation of it [here.](https://www.cobramestate.com/blogs/all-blogs/shattering-the-myth-can-you-cook-with-extra-virgin-olive-oil)

I understand Cobram would want olive oil viewed as the holy grail of oils given it’s what they sell, but it seems like sound science to a simpleton such as myself.

Edit: I realize I didn’t clarify this earlier, but the cheapness of seed oils to me stands out because their price is their appeal. I think their suitability for high heat cooking is arguable, especially commercially where the same batch of oil is used multiple times, thus making it less stable/more carcinogenic.",1,2022-11-02 21:23:01,<praw.models.comment_forest.CommentForest object at 0x0000022EF31902E0>,yk8skt,nutrition,t5_2qoox,,False,False,t3_yk8skt,t3_yk8skt,/r/nutrition/comments/yk8skt/where_did_the_conspiracy_theory_that_seed_oils/iutakm2/
181,ius11hz,HighSierraGuy,"The Keto diet charlatans and grifters, which is why you can understand it’s not based on science whatsoever.","The Keto diet charlatans and grifters, which is why you can understand it’s not based on science whatsoever.",-3,2022-11-02 16:32:55,<praw.models.comment_forest.CommentForest object at 0x0000022EF3190340>,yk8skt,nutrition,t5_2qoox,,False,False,t3_yk8skt,t3_yk8skt,/r/nutrition/comments/yk8skt/where_did_the_conspiracy_theory_that_seed_oils/ius11hz/
182,ius2c09,Dazed811,Low carb flat earthers needed something to blame for CVD rates caused by saturated fat,Low carb flat earthers needed something to blame for CVD rates caused by saturated fat,-1,2022-11-02 16:41:12,<praw.models.comment_forest.CommentForest object at 0x0000022EF3190400>,yk8skt,nutrition,t5_2qoox,,False,False,t3_yk8skt,t3_yk8skt,/r/nutrition/comments/yk8skt/where_did_the_conspiracy_theory_that_seed_oils/ius2c09/
183,ius5dex,,Joe Rogan,Joe Rogan,1,2022-11-02 17:00:24,<praw.models.comment_forest.CommentForest object at 0x0000022EF3190640>,yk8skt,nutrition,t5_2qoox,,False,False,t3_yk8skt,t3_yk8skt,/r/nutrition/comments/yk8skt/where_did_the_conspiracy_theory_that_seed_oils/ius5dex/
184,ius12a4,Xtasyaa,"Bro if it's widely available and cheap asf, its no-bueno. No conspiracy needed","Bro if it's widely available and cheap asf, its no-bueno. No conspiracy needed",-3,2022-11-02 16:33:04,<praw.models.comment_forest.CommentForest object at 0x0000022EF31906A0>,yk8skt,nutrition,t5_2qoox,,False,False,t3_yk8skt,t3_yk8skt,/r/nutrition/comments/yk8skt/where_did_the_conspiracy_theory_that_seed_oils/ius12a4/
185,ius5ney,Andrew199617,"Its empty calories. Has way less benefits compared to actually eating the seeds. Especially if its fried. 

Highly recommend watching this video.
https://youtu.be/xXZcwY6NTKY","Its empty calories. Has way less benefits compared to actually eating the seeds. Especially if its fried. 

Highly recommend watching this video.
https://youtu.be/xXZcwY6NTKY",-2,2022-11-02 17:02:11,<praw.models.comment_forest.CommentForest object at 0x0000022EF3190700>,yk8skt,nutrition,t5_2qoox,,False,False,t3_yk8skt,t3_yk8skt,/r/nutrition/comments/yk8skt/where_did_the_conspiracy_theory_that_seed_oils/ius5ney/
186,iutaqcn,unstillable,"Bro, don't worry about it, just go back watching tv and sipping from your canola oil bottle. You'll be fine!","Bro, don't worry about it, just go back watching tv and sipping from your canola oil bottle. You'll be fine!",-1,2022-11-02 21:24:06,<praw.models.comment_forest.CommentForest object at 0x0000022EF3190820>,yk8skt,nutrition,t5_2qoox,,False,False,t3_yk8skt,t3_yk8skt,/r/nutrition/comments/yk8skt/where_did_the_conspiracy_theory_that_seed_oils/iutaqcn/
187,iuvje4g,Fabulous_Archer4999,[You should be minimising consumption of all oils.](https://youtu.be/CqXAvYUAZjE),[You should be minimising consumption of all oils.](https://youtu.be/CqXAvYUAZjE),-1,2022-11-03 10:03:34,<praw.models.comment_forest.CommentForest object at 0x0000022EF3190940>,yk8skt,nutrition,t5_2qoox,,False,False,t3_yk8skt,t3_yk8skt,/r/nutrition/comments/yk8skt/where_did_the_conspiracy_theory_that_seed_oils/iuvje4g/
188,iutjv09,MlNDB0MB,I think it started with the observation that seed oils are in potato chips. The issue is that I could replace the seed oils with palm oil and it wouldn't make the chips magically healthy. They would actually become worse.,I think it started with the observation that seed oils are in potato chips. The issue is that I could replace the seed oils with palm oil and it wouldn't make the chips magically healthy. They would actually become worse.,-1,2022-11-02 22:26:44,<praw.models.comment_forest.CommentForest object at 0x0000022EF31909A0>,yk8skt,nutrition,t5_2qoox,,False,False,t3_yk8skt,t3_yk8skt,/r/nutrition/comments/yk8skt/where_did_the_conspiracy_theory_that_seed_oils/iutjv09/
189,iuwa9kj,blabbityblah01,"# Big Avocado

^(/s)","# Big Avocado

^(/s)",1,2022-11-03 14:15:01,<praw.models.comment_forest.CommentForest object at 0x0000022EF3190B20>,yk8skt,nutrition,t5_2qoox,,False,False,t3_yk8skt,t3_yk8skt,/r/nutrition/comments/yk8skt/where_did_the_conspiracy_theory_that_seed_oils/iuwa9kj/
190,ius7ed5,frozenmollusk,"https://pubmed.ncbi.nlm.nih.gov/29566193/ 

They followed nearly 2,500 men for an average of 22 years and found that those with the highest blood levels of linoleic acid had a 43 percent lower risk of dying from any disease during the study period than those with the lowest. it‘s just observational ofc","https://pubmed.ncbi.nlm.nih.gov/29566193/ 

They followed nearly 2,500 men for an average of 22 years and found that those with the highest blood levels of linoleic acid had a 43 percent lower risk of dying from any disease during the study period than those with the lowest. it‘s just observational ofc",8,2022-11-02 17:13:27,<praw.models.comment_forest.CommentForest object at 0x0000022EF31785E0>,yk8skt,nutrition,t5_2qoox,,1667409420.0,False,t3_yk8skt,t1_ius2tox,/r/nutrition/comments/yk8skt/where_did_the_conspiracy_theory_that_seed_oils/ius7ed5/
191,iurxx0t,mikasakoa,I don’t think so… but the questions is where did it start? Who started this misinformation trend?,I don’t think so… but the questions is where did it start? Who started this misinformation trend?,-28,2022-11-02 16:12:54,<praw.models.comment_forest.CommentForest object at 0x0000022EF31786A0>,yk8skt,nutrition,t5_2qoox,,False,True,t3_yk8skt,t1_iurxiar,/r/nutrition/comments/yk8skt/where_did_the_conspiracy_theory_that_seed_oils/iurxx0t/
192,ius721b,mwb213,"Definitely the Paleo circle, who hated seeds/grains to begin with. It was an easy swap to ""oils from seeds are bad too, mmkay?""

Then it got further adopted by many in the overly-restrictive-but-unfortunately-also-overly-vocal end of the plant-based diet community. Then people began to accept it as common knowledge despite the fact that the fatty acid profile (poly v mono v saturated fatty acids) is far more important than the fact that it was processed.","Definitely the Paleo circle, who hated seeds/grains to begin with. It was an easy swap to ""oils from seeds are bad too, mmkay?""

Then it got further adopted by many in the overly-restrictive-but-unfortunately-also-overly-vocal end of the plant-based diet community. Then people began to accept it as common knowledge despite the fact that the fatty acid profile (poly v mono v saturated fatty acids) is far more important than the fact that it was processed.",5,2022-11-02 17:11:16,<praw.models.comment_forest.CommentForest object at 0x0000022EF3178880>,yk8skt,nutrition,t5_2qoox,,False,False,t3_yk8skt,t1_ius5bho,/r/nutrition/comments/yk8skt/where_did_the_conspiracy_theory_that_seed_oils/ius721b/
193,iv0a1ah,lordm30,">and experience high rates of coronary heart disease.

No surprise there.  High amounts of linoleic acid is toxic.",">and experience high rates of coronary heart disease.

No surprise there.  High amounts of linoleic acid is toxic.",2,2022-11-04 09:55:20,<praw.models.comment_forest.CommentForest object at 0x0000022EF3178B20>,yk8skt,nutrition,t5_2qoox,,False,False,t3_yk8skt,t1_ius9qg0,/r/nutrition/comments/yk8skt/where_did_the_conspiracy_theory_that_seed_oils/iv0a1ah/
194,ius34ek,mikasakoa,"I mean, do you have anything constructive to add? Or are you just going to be rude?","I mean, do you have anything constructive to add? Or are you just going to be rude?",-10,2022-11-02 16:46:15,<praw.models.comment_forest.CommentForest object at 0x0000022EF3178C40>,yk8skt,nutrition,t5_2qoox,,False,True,t3_yk8skt,t1_ius1sjd,/r/nutrition/comments/yk8skt/where_did_the_conspiracy_theory_that_seed_oils/ius34ek/
195,iurxkpv,mikasakoa,I’m looking for which influencer or blog started or reignited the spread of this bit of misinformation,I’m looking for which influencer or blog started or reignited the spread of this bit of misinformation,-14,2022-11-02 16:10:40,<praw.models.comment_forest.CommentForest object at 0x0000022EF3178DC0>,yk8skt,nutrition,t5_2qoox,,False,True,t3_yk8skt,t1_iurvjwd,/r/nutrition/comments/yk8skt/where_did_the_conspiracy_theory_that_seed_oils/iurxkpv/
196,iut154x,InTheEndEntropyWins,"Except for when it comes to mortality and health, where we have lots of high quality RCT showing benefits of switching from saturated to unsaturated fats. 

Do you have any Cochrane or good quality meta studies looking at RCT in humans showing otherwise?","Except for when it comes to mortality and health, where we have lots of high quality RCT showing benefits of switching from saturated to unsaturated fats. 

Do you have any Cochrane or good quality meta studies looking at RCT in humans showing otherwise?",5,2022-11-02 20:22:10,<praw.models.comment_forest.CommentForest object at 0x0000022EF31AE160>,yk8skt,nutrition,t5_2qoox,,False,False,t3_yk8skt,t1_ius51os,/r/nutrition/comments/yk8skt/where_did_the_conspiracy_theory_that_seed_oils/iut154x/
197,iusi625,mikasakoa,Oh yeah? What makes you say that?,Oh yeah? What makes you say that?,1,2022-11-02 18:21:49,<praw.models.comment_forest.CommentForest object at 0x0000022EF31AE8E0>,yk8skt,nutrition,t5_2qoox,,False,True,t3_yk8skt,t1_iush8oa,/r/nutrition/comments/yk8skt/where_did_the_conspiracy_theory_that_seed_oils/iusi625/
198,iut1fto,InTheEndEntropyWins,"I think the data is actually fairly clear, which is why pretty much every single health organisation in the world has materially the same advice.","I think the data is actually fairly clear, which is why pretty much every single health organisation in the world has materially the same advice.",-3,2022-11-02 20:24:03,<praw.models.comment_forest.CommentForest object at 0x0000022EF31AEA60>,yk8skt,nutrition,t5_2qoox,,False,False,t3_yk8skt,t1_iuskvjs,/r/nutrition/comments/yk8skt/where_did_the_conspiracy_theory_that_seed_oils/iut1fto/
199,iuwh45w,mikasakoa,This is 100% incorrect - where on earth did you hear that one?,This is 100% incorrect - where on earth did you hear that one?,-2,2022-11-03 15:01:28,<praw.models.comment_forest.CommentForest object at 0x0000022EF31AEC40>,yk8skt,nutrition,t5_2qoox,,False,True,t3_yk8skt,t1_iuvffcc,/r/nutrition/comments/yk8skt/where_did_the_conspiracy_theory_that_seed_oils/iuwh45w/
200,iuslo4p,Woody2shoez,Idk man Mediterranean diets are considered top tier and they eat olive oil like their life depended on it,Idk man Mediterranean diets are considered top tier and they eat olive oil like their life depended on it,5,2022-11-02 18:43:58,<praw.models.comment_forest.CommentForest object at 0x0000022EF3190040>,yk8skt,nutrition,t5_2qoox,,False,False,t3_yk8skt,t1_ius6j42,/r/nutrition/comments/yk8skt/where_did_the_conspiracy_theory_that_seed_oils/iuslo4p/
201,iutc798,mikasakoa,"I mean… I don’t think these people are a good source of information on nutrition … they are olive oil mongers not nutrition scientists. Also I have no idea who wrote that blog post , it’s signed “Franchesca” who I guess is their content person?","I mean… I don’t think these people are a good source of information on nutrition … they are olive oil mongers not nutrition scientists. Also I have no idea who wrote that blog post , it’s signed “Franchesca” who I guess is their content person?",0,2022-11-02 21:34:18,<praw.models.comment_forest.CommentForest object at 0x0000022EF31903A0>,yk8skt,nutrition,t5_2qoox,,False,True,t3_yk8skt,t1_iutakm2,/r/nutrition/comments/yk8skt/where_did_the_conspiracy_theory_that_seed_oils/iutc798/
202,iut7xhc,Minute-Object,Water is widely available and cheap. Sweet potatoes too.,Water is widely available and cheap. Sweet potatoes too.,2,2022-11-02 21:05:23,<praw.models.comment_forest.CommentForest object at 0x0000022EF3190760>,yk8skt,nutrition,t5_2qoox,,False,False,t3_yk8skt,t1_ius12a4,/r/nutrition/comments/yk8skt/where_did_the_conspiracy_theory_that_seed_oils/iut7xhc/
203,ius30hd,mikasakoa,So cheap is bad? So the vegetables that I grow in my garden that I pay nothing for are bad because they are cheap?,So cheap is bad? So the vegetables that I grow in my garden that I pay nothing for are bad because they are cheap?,-4,2022-11-02 16:45:33,<praw.models.comment_forest.CommentForest object at 0x0000022EF31907C0>,yk8skt,nutrition,t5_2qoox,,False,True,t3_yk8skt,t1_ius12a4,/r/nutrition/comments/yk8skt/where_did_the_conspiracy_theory_that_seed_oils/ius30hd/
204,iuxhc7q,mikasakoa,"I’m just curious - do you even know who this guy is? I was searching for Mic the Vegan and I can’t find his real name or credentials anywhere. It just says he has a BSc in sustainability (but from where? Is it a legit school or a diploma mill) and that he is pursuing a MPH (again where, and MPH does not mean nutrition focus, in fact usually nutrition is not the main focus of MPH programs )","I’m just curious - do you even know who this guy is? I was searching for Mic the Vegan and I can’t find his real name or credentials anywhere. It just says he has a BSc in sustainability (but from where? Is it a legit school or a diploma mill) and that he is pursuing a MPH (again where, and MPH does not mean nutrition focus, in fact usually nutrition is not the main focus of MPH programs )",2,2022-11-03 18:54:15,<praw.models.comment_forest.CommentForest object at 0x0000022EF3190A00>,yk8skt,nutrition,t5_2qoox,,False,True,t3_yk8skt,t1_iuvje4g,/r/nutrition/comments/yk8skt/where_did_the_conspiracy_theory_that_seed_oils/iuxhc7q/
205,iuwgjpv,mikasakoa,This one belongs in r/conspiracy,This one belongs in r/conspiracy,1,2022-11-03 14:57:42,<praw.models.comment_forest.CommentForest object at 0x0000022EF3190A60>,yk8skt,nutrition,t5_2qoox,,False,True,t3_yk8skt,t1_iuvje4g,/r/nutrition/comments/yk8skt/where_did_the_conspiracy_theory_that_seed_oils/iuwgjpv/
206,ius2t9m,,"It's true though. Seed oils are everywhere in ""unhealthy"" foods. Anything fried, any condiment, chips, breads, they are everywhere.","It's true though. Seed oils are everywhere in ""unhealthy"" foods. Anything fried, any condiment, chips, breads, they are everywhere.",15,2022-11-02 16:44:16,<praw.models.comment_forest.CommentForest object at 0x0000022EF3178760>,yk8skt,nutrition,t5_2qoox,,False,False,t3_yk8skt,t1_iurxx0t,/r/nutrition/comments/yk8skt/where_did_the_conspiracy_theory_that_seed_oils/ius2t9m/
207,ius36lm,VoteLobster,"I think the recent revival of it came in part from What I’ve Learned on YouTube. He has a talent for lying about data and cherry-picking the few studies that support his few. Then people like Tucker Goodrich and Paul Saladino can get on podcasts, use a few sciency-sounding words to push a spooky contrarian narrative (americans love that shit), and convince people in the general public (who aren’t literate enough in that field to weed out the bullshit) that all the experts are wrong and that a couple podcast hosts have a better understanding of biochemistry and epidemiology than actual biochemists and epidemiologists.

It’s funny because for the longest time it was the low-fat no-oil vegan types who pushed the “oil is toxic” narrative, and now it’s the low carb/carnivore types. Shit’s wild lmao","I think the recent revival of it came in part from What I’ve Learned on YouTube. He has a talent for lying about data and cherry-picking the few studies that support his few. Then people like Tucker Goodrich and Paul Saladino can get on podcasts, use a few sciency-sounding words to push a spooky contrarian narrative (americans love that shit), and convince people in the general public (who aren’t literate enough in that field to weed out the bullshit) that all the experts are wrong and that a couple podcast hosts have a better understanding of biochemistry and epidemiology than actual biochemists and epidemiologists.

It’s funny because for the longest time it was the low-fat no-oil vegan types who pushed the “oil is toxic” narrative, and now it’s the low carb/carnivore types. Shit’s wild lmao",5,2022-11-02 16:46:38,<praw.models.comment_forest.CommentForest object at 0x0000022EF31787C0>,yk8skt,nutrition,t5_2qoox,,False,False,t3_yk8skt,t1_iurxx0t,/r/nutrition/comments/yk8skt/where_did_the_conspiracy_theory_that_seed_oils/ius36lm/
208,iv0l63l,emmagorgon,Right! Funny it’s called a paradox..,Right! Funny it’s called a paradox..,2,2022-11-04 12:03:07,<praw.models.comment_forest.CommentForest object at 0x0000022EF3178BE0>,yk8skt,nutrition,t5_2qoox,,False,False,t3_yk8skt,t1_iv0a1ah,/r/nutrition/comments/yk8skt/where_did_the_conspiracy_theory_that_seed_oils/iv0l63l/
209,iury5k5,djmedakev,What makes you say seed oils are healthy? I'm not sure it was one influence or one blog post that is behind that information. I understand the extraction method for many seed oils is incredibly unnatural and industrialized.,What makes you say seed oils are healthy? I'm not sure it was one influence or one blog post that is behind that information. I understand the extraction method for many seed oils is incredibly unnatural and industrialized.,7,2022-11-02 16:14:25,<praw.models.comment_forest.CommentForest object at 0x0000022EF3178E80>,yk8skt,nutrition,t5_2qoox,,False,False,t3_yk8skt,t1_iurxkpv,/r/nutrition/comments/yk8skt/where_did_the_conspiracy_theory_that_seed_oils/iury5k5/
210,iv0bfbu,lordm30,"I can share my experience. I listened to a keto podcast that had Tucker Goodrich as a guest. Heard about the dangers of too much omega 6 from him as first time.

Generally not sure if there was ONE person who started this. As others pointed out, paleo diets already excluded seed oils from consumption (among other food items).","I can share my experience. I listened to a keto podcast that had Tucker Goodrich as a guest. Heard about the dangers of too much omega 6 from him as first time.

Generally not sure if there was ONE person who started this. As others pointed out, paleo diets already excluded seed oils from consumption (among other food items).",2,2022-11-04 10:14:02,<praw.models.comment_forest.CommentForest object at 0x0000022EF3178EE0>,yk8skt,nutrition,t5_2qoox,,False,False,t3_yk8skt,t1_iurxkpv,/r/nutrition/comments/yk8skt/where_did_the_conspiracy_theory_that_seed_oils/iv0bfbu/
