,ID,Author,body,Comment,Score,Created On,Replies,Submission,Subreddit,Subreddit_ID,Distinguished,Edited,Is_submitter,link_id,Parent_id,Permalink
0,ixpjh0s,AutoModerator,"#### About participation in the comments of /r/nutrition  

Discussion in this subreddit should be rooted in science rather than ""cuz I sed"" or entertainment pieces. Always be wary of unsupported and poorly supported claims and especially those which are wrapped in any manner of hostility. You should provide peer reviewed sources to support your claims when debating and confine that debate to the science, not opinions of other people.

**Good** - it is grounded in science and includes citation of peer reviewed sources.  Debate is a civil and respectful exchange focusing on actual science and avoids commentary about others  

**Bad** - it utilizes generalizations, assumptions, infotainment sources, no sources, or complaints without specifics about agenda, bias, or funding. At best, these rise to an extremely weak basis for science based discussion. Also, off topic discussion  

**Ugly** - (removal or ban territory) it involves attacks / antagonism / hostility towards individuals or groups, downvote complaining, trolling, crusading, shaming, refutation of all science, or claims that all research / science is a conspiracy

*Please vote accordingly and report any uglies*

---


*I am a bot, and this action was performed automatically. Please [contact the moderators of this subreddit](/message/compose/?to=/r/nutrition) if you have any questions or concerns.*","#### About participation in the comments of /r/nutrition  

Discussion in this subreddit should be rooted in science rather than ""cuz I sed"" or entertainment pieces. Always be wary of unsupported and poorly supported claims and especially those which are wrapped in any manner of hostility. You should provide peer reviewed sources to support your claims when debating and confine that debate to the science, not opinions of other people.

**Good** - it is grounded in science and includes citation of peer reviewed sources.  Debate is a civil and respectful exchange focusing on actual science and avoids commentary about others  

**Bad** - it utilizes generalizations, assumptions, infotainment sources, no sources, or complaints without specifics about agenda, bias, or funding. At best, these rise to an extremely weak basis for science based discussion. Also, off topic discussion  

**Ugly** - (removal or ban territory) it involves attacks / antagonism / hostility towards individuals or groups, downvote complaining, trolling, crusading, shaming, refutation of all science, or claims that all research / science is a conspiracy

*Please vote accordingly and report any uglies*

---


*I am a bot, and this action was performed automatically. Please [contact the moderators of this subreddit](/message/compose/?to=/r/nutrition) if you have any questions or concerns.*",1,2022-11-25 07:44:07,<praw.models.comment_forest.CommentForest object at 0x0000022EF57F80A0>,z47fna,nutrition,t5_2qoox,moderator,False,False,t3_z47fna,t3_z47fna,/r/nutrition/comments/z47fna/just_found_superfoods_that_fight_depression_list/ixpjh0s/
1,ixq10st,,"The artical looks like the typical ""buy our product and all you problems will be fixed"", seems like this is basicaly just and ad for the book/ online course..","The artical looks like the typical ""buy our product and all you problems will be fixed"", seems like this is basicaly just and ad for the book/ online course..",31,2022-11-25 12:03:17,<praw.models.comment_forest.CommentForest object at 0x0000022EF57F8220>,z47fna,nutrition,t5_2qoox,,False,False,t3_z47fna,t3_z47fna,/r/nutrition/comments/z47fna/just_found_superfoods_that_fight_depression_list/ixq10st/
2,ixpulkm,DoveMot,Do you know of any real research on this? If so I’d be interested in reading it,Do you know of any real research on this? If so I’d be interested in reading it,18,2022-11-25 10:31:06,<praw.models.comment_forest.CommentForest object at 0x0000022EF57F83A0>,z47fna,nutrition,t5_2qoox,,False,False,t3_z47fna,t3_z47fna,/r/nutrition/comments/z47fna/just_found_superfoods_that_fight_depression_list/ixpulkm/
3,ixq253n,frankhav,This is not a good source lol,This is not a good source lol,16,2022-11-25 12:17:13,<praw.models.comment_forest.CommentForest object at 0x0000022EF57F86A0>,z47fna,nutrition,t5_2qoox,,False,False,t3_z47fna,t3_z47fna,/r/nutrition/comments/z47fna/just_found_superfoods_that_fight_depression_list/ixq253n/
4,ixpp181,GlobularLobule,We synthesise serotonin from the amino acid tryptophan. Foods high in tryptophan are on that list.,We synthesise serotonin from the amino acid tryptophan. Foods high in tryptophan are on that list.,12,2022-11-25 09:05:08,<praw.models.comment_forest.CommentForest object at 0x0000022EF57F8CA0>,z47fna,nutrition,t5_2qoox,,False,False,t3_z47fna,t3_z47fna,/r/nutrition/comments/z47fna/just_found_superfoods_that_fight_depression_list/ixpp181/
5,ixqdku3,MyNameIsSkittles,Superfood is a buzzword and this book looks like a marketing wet dream and not anything informative,Superfood is a buzzword and this book looks like a marketing wet dream and not anything informative,4,2022-11-25 14:17:08,<praw.models.comment_forest.CommentForest object at 0x0000022EF57F7160>,z47fna,nutrition,t5_2qoox,,False,False,t3_z47fna,t3_z47fna,/r/nutrition/comments/z47fna/just_found_superfoods_that_fight_depression_list/ixqdku3/
6,ixqe4hl,big_face_killah,That low serotonin theory of depression is pretty much dead just fyi https://www.psychologytoday.com/ca/blog/side-effects/202207/decisive-blow-the-serotonin-hypothesis-depression,That low serotonin theory of depression is pretty much dead just fyi https://www.psychologytoday.com/ca/blog/side-effects/202207/decisive-blow-the-serotonin-hypothesis-depression,8,2022-11-25 14:21:58,<praw.models.comment_forest.CommentForest object at 0x0000022EF57F72E0>,z47fna,nutrition,t5_2qoox,,False,False,t3_z47fna,t3_z47fna,/r/nutrition/comments/z47fna/just_found_superfoods_that_fight_depression_list/ixqe4hl/
7,ixps5aa,AtHomeInTheUniverse,"I'll add my personal two: dark chocolate (70%+) and high quality beef (other meats are high in tryptophan too, but I find the biggest effect with beef).

https://www.tandfonline.com/doi/full/10.1080/10408398.2021.1974336","I'll add my personal two: dark chocolate (70%+) and high quality beef (other meats are high in tryptophan too, but I find the biggest effect with beef).

https://www.tandfonline.com/doi/full/10.1080/10408398.2021.1974336",5,2022-11-25 09:52:51,<praw.models.comment_forest.CommentForest object at 0x0000022EF57F7460>,z47fna,nutrition,t5_2qoox,,False,False,t3_z47fna,t3_z47fna,/r/nutrition/comments/z47fna/just_found_superfoods_that_fight_depression_list/ixps5aa/
8,ixqjh28,GZSyphilis,"Just wandering around finding uncommon and rare lists of superfoods laying around, a real life scientist must've just dropped this secret four bullet point list.","Just wandering around finding uncommon and rare lists of superfoods laying around, a real life scientist must've just dropped this secret four bullet point list.",2,2022-11-25 15:07:40,<praw.models.comment_forest.CommentForest object at 0x0000022EF57F75E0>,z47fna,nutrition,t5_2qoox,,False,False,t3_z47fna,t3_z47fna,/r/nutrition/comments/z47fna/just_found_superfoods_that_fight_depression_list/ixqjh28/
9,ixqwbr5,MostRadiant,Raw organic Broccoli always does it for me.,Raw organic Broccoli always does it for me.,2,2022-11-25 16:47:44,<praw.models.comment_forest.CommentForest object at 0x0000022EF57F7760>,z47fna,nutrition,t5_2qoox,,False,False,t3_z47fna,t3_z47fna,/r/nutrition/comments/z47fna/just_found_superfoods_that_fight_depression_list/ixqwbr5/
10,ixrlbcb,rhiannonla,I don’t believe in superfood… but I do believe in limiting junk & highly processed foods.,I don’t believe in superfood… but I do believe in limiting junk & highly processed foods.,2,2022-11-25 19:51:24,<praw.models.comment_forest.CommentForest object at 0x0000022EF57F78E0>,z47fna,nutrition,t5_2qoox,,False,False,t3_z47fna,t3_z47fna,/r/nutrition/comments/z47fna/just_found_superfoods_that_fight_depression_list/ixrlbcb/
11,ixqnnvu,trees-for-breakfast,r/wowthanksimcured,r/wowthanksimcured,2,2022-11-25 15:41:18,<praw.models.comment_forest.CommentForest object at 0x0000022EF57F7A60>,z47fna,nutrition,t5_2qoox,,False,False,t3_z47fna,t3_z47fna,/r/nutrition/comments/z47fna/just_found_superfoods_that_fight_depression_list/ixqnnvu/
12,ixprby0,AwkwardSympathy7,Thanks for sharing  ❤️,Thanks for sharing  ❤️,-2,2022-11-25 09:40:16,<praw.models.comment_forest.CommentForest object at 0x0000022EF57F7BE0>,z47fna,nutrition,t5_2qoox,,False,False,t3_z47fna,t3_z47fna,/r/nutrition/comments/z47fna/just_found_superfoods_that_fight_depression_list/ixprby0/
13,ixpmk7c,,[deleted],[deleted],-9,2022-11-25 08:28:08,<praw.models.comment_forest.CommentForest object at 0x0000022EF57F7E20>,z47fna,nutrition,t5_2qoox,,1669386483.0,False,t3_z47fna,t3_z47fna,/r/nutrition/comments/z47fna/just_found_superfoods_that_fight_depression_list/ixpmk7c/
14,ixqpx61,Objective_Suspect122,Magic truffels. Take 1 gram every 2 days.. you re welcome,Magic truffels. Take 1 gram every 2 days.. you re welcome,1,2022-11-25 15:58:43,<praw.models.comment_forest.CommentForest object at 0x0000022EF57F7EE0>,z47fna,nutrition,t5_2qoox,,False,False,t3_z47fna,t3_z47fna,/r/nutrition/comments/z47fna/just_found_superfoods_that_fight_depression_list/ixqpx61/
15,ixqwscb,Redbird_ml,"If this works for you, I’m happy that it does.","If this works for you, I’m happy that it does.",1,2022-11-25 16:51:06,<praw.models.comment_forest.CommentForest object at 0x0000022EF57FA100>,z47fna,nutrition,t5_2qoox,,False,False,t3_z47fna,t3_z47fna,/r/nutrition/comments/z47fna/just_found_superfoods_that_fight_depression_list/ixqwscb/
16,ixr1kx8,AlluEUNE,"I personally don't believe in ""superfoods"", but all those listed make up a healthy diet and that itself can help with depression and mood in general.","I personally don't believe in ""superfoods"", but all those listed make up a healthy diet and that itself can help with depression and mood in general.",1,2022-11-25 17:26:12,<praw.models.comment_forest.CommentForest object at 0x0000022EF4D39F40>,z47fna,nutrition,t5_2qoox,,False,False,t3_z47fna,t3_z47fna,/r/nutrition/comments/z47fna/just_found_superfoods_that_fight_depression_list/ixr1kx8/
17,ixs64oc,1BrokeStoner,Is cocaine and whiskey on the list?,Is cocaine and whiskey on the list?,1,2022-11-25 22:26:41,<praw.models.comment_forest.CommentForest object at 0x0000022EF4D5B280>,z47fna,nutrition,t5_2qoox,,False,False,t3_z47fna,t3_z47fna,/r/nutrition/comments/z47fna/just_found_superfoods_that_fight_depression_list/ixs64oc/
18,ixsiohb,Double_Requirement_4,Ty for this,Ty for this,1,2022-11-26 00:09:11,<praw.models.comment_forest.CommentForest object at 0x0000022EF4D5B400>,z47fna,nutrition,t5_2qoox,,False,False,t3_z47fna,t3_z47fna,/r/nutrition/comments/z47fna/just_found_superfoods_that_fight_depression_list/ixsiohb/
19,ixs2eep,314cheesecake,"it is superfood you know, like real super food","it is superfood you know, like real super food",1,2022-11-25 21:56:57,<praw.models.comment_forest.CommentForest object at 0x0000022EF57F8520>,z47fna,nutrition,t5_2qoox,,False,False,t3_z47fna,t1_ixq10st,/r/nutrition/comments/z47fna/just_found_superfoods_that_fight_depression_list/ixs2eep/
20,ixq3ir7,CharityNo9966,"Omega 3 Is part of salmon, there are several studies that suggest Omega 3 may help with   depression but It Is not a scientific fact.","Omega 3 Is part of salmon, there are several studies that suggest Omega 3 may help with   depression but It Is not a scientific fact.",9,2022-11-25 12:34:01,<praw.models.comment_forest.CommentForest object at 0x0000022EF57F8820>,z47fna,nutrition,t5_2qoox,,False,False,t3_z47fna,t1_ixpulkm,/r/nutrition/comments/z47fna/just_found_superfoods_that_fight_depression_list/ixq3ir7/
21,ixslkr4,Hippoman36,The Serotonic Theory of Depression has been severely weakened.,The Serotonic Theory of Depression has been severely weakened.,2,2022-11-26 00:33:43,<praw.models.comment_forest.CommentForest object at 0x0000022EF57F89A0>,z47fna,nutrition,t5_2qoox,,False,False,t3_z47fna,t1_ixpulkm,/r/nutrition/comments/z47fna/just_found_superfoods_that_fight_depression_list/ixslkr4/
22,ixpw07v,nikhonit,Not really. But comments seem to verify this. The book is really informative,Not really. But comments seem to verify this. The book is really informative,-27,2022-11-25 10:52:29,<praw.models.comment_forest.CommentForest object at 0x0000022EF57F8B20>,z47fna,nutrition,t5_2qoox,,False,True,t3_z47fna,t1_ixpulkm,/r/nutrition/comments/z47fna/just_found_superfoods_that_fight_depression_list/ixpw07v/
23,ixqdhfl,MyNameIsSkittles,Serotonin is made in the gut and brain. You don't ingest it,Serotonin is made in the gut and brain. You don't ingest it,1,2022-11-25 14:16:18,<praw.models.comment_forest.CommentForest object at 0x0000022EF57FA0A0>,z47fna,nutrition,t5_2qoox,,False,False,t3_z47fna,t1_ixpmk7c,/r/nutrition/comments/z47fna/just_found_superfoods_that_fight_depression_list/ixqdhfl/
24,ixq3osj,DoveMot,Does the book cite many scientific papers?,Does the book cite many scientific papers?,10,2022-11-25 12:36:03,<praw.models.comment_forest.CommentForest object at 0x0000022EF57F8E20>,z47fna,nutrition,t5_2qoox,,False,False,t3_z47fna,t1_ixpw07v,/r/nutrition/comments/z47fna/just_found_superfoods_that_fight_depression_list/ixq3osj/
25,ixq957m,justsomeplainmeadows,"Just remember to keep an objective view of how you feel if you try eating more of those foods. Does it really affect you, or do you just believe it does? I'd be interested to hear an update in a few weeks if you notice any different","Just remember to keep an objective view of how you feel if you try eating more of those foods. Does it really affect you, or do you just believe it does? I'd be interested to hear an update in a few weeks if you notice any different",5,2022-11-25 13:35:43,<praw.models.comment_forest.CommentForest object at 0x0000022EF57F8FA0>,z47fna,nutrition,t5_2qoox,,False,False,t3_z47fna,t1_ixpw07v,/r/nutrition/comments/z47fna/just_found_superfoods_that_fight_depression_list/ixq957m/
26,ixqexk5,,[deleted],[deleted],1,2022-11-25 14:29:07,<praw.models.comment_forest.CommentForest object at 0x0000022EF4D39D90>,z47fna,nutrition,t5_2qoox,,False,False,t3_z47fna,t1_ixqdhfl,/r/nutrition/comments/z47fna/just_found_superfoods_that_fight_depression_list/ixqexk5/
27,ixqfczc,MyNameIsSkittles,Yes a very easy to get amino acid,Yes a very easy to get amino acid,1,2022-11-25 14:32:53,<praw.models.comment_forest.CommentForest object at 0x0000022EF4D5B100>,z47fna,nutrition,t5_2qoox,,False,False,t3_z47fna,t1_ixqexk5,/r/nutrition/comments/z47fna/just_found_superfoods_that_fight_depression_list/ixqfczc/
28,jakp361,AutoModerator,"#### About participation in the comments of /r/nutrition  

Discussion in this subreddit should be rooted in science rather than ""cuz I sed"" or entertainment pieces. Always be wary of unsupported and poorly supported claims and especially those which are wrapped in any manner of hostility. You should provide peer reviewed sources to support your claims when debating and confine that debate to the science, not opinions of other people.

**Good** - it is grounded in science and includes citation of peer reviewed sources.  Debate is a civil and respectful exchange focusing on actual science and avoids commentary about others  

**Bad** - it utilizes generalizations, assumptions, infotainment sources, no sources, or complaints without specifics about agenda, bias, or funding. At best, these rise to an extremely weak basis for science based discussion. Also, off topic discussion  

**Ugly** - (removal or ban territory) it involves attacks / antagonism / hostility towards individuals or groups, downvote complaining, trolling, crusading, shaming, refutation of all science, or claims that all research / science is a conspiracy

*Please vote accordingly and report any uglies*

---


*I am a bot, and this action was performed automatically. Please [contact the moderators of this subreddit](/message/compose/?to=/r/nutrition) if you have any questions or concerns.*","#### About participation in the comments of /r/nutrition  

Discussion in this subreddit should be rooted in science rather than ""cuz I sed"" or entertainment pieces. Always be wary of unsupported and poorly supported claims and especially those which are wrapped in any manner of hostility. You should provide peer reviewed sources to support your claims when debating and confine that debate to the science, not opinions of other people.

**Good** - it is grounded in science and includes citation of peer reviewed sources.  Debate is a civil and respectful exchange focusing on actual science and avoids commentary about others  

**Bad** - it utilizes generalizations, assumptions, infotainment sources, no sources, or complaints without specifics about agenda, bias, or funding. At best, these rise to an extremely weak basis for science based discussion. Also, off topic discussion  

**Ugly** - (removal or ban territory) it involves attacks / antagonism / hostility towards individuals or groups, downvote complaining, trolling, crusading, shaming, refutation of all science, or claims that all research / science is a conspiracy

*Please vote accordingly and report any uglies*

---


*I am a bot, and this action was performed automatically. Please [contact the moderators of this subreddit](/message/compose/?to=/r/nutrition) if you have any questions or concerns.*",1,2023-03-02 02:50:29,<praw.models.comment_forest.CommentForest object at 0x0000022EF50BD580>,11fqox5,nutrition,t5_2qoox,moderator,False,False,t3_11fqox5,t3_11fqox5,/r/nutrition/comments/11fqox5/why_do_people_still_think_red_meat_is_bad_for_you/jakp361/
29,jakurq0,CalmSofa,What does evolution have to do with anything? The meat (and everything else) that we eat now is nothing like the food humans were eating even 200 years ago… much less tens of thousands of years ago.,What does evolution have to do with anything? The meat (and everything else) that we eat now is nothing like the food humans were eating even 200 years ago… much less tens of thousands of years ago.,59,2023-03-02 03:34:29,<praw.models.comment_forest.CommentForest object at 0x0000022EF50BDD00>,11fqox5,nutrition,t5_2qoox,,False,False,t3_11fqox5,t3_11fqox5,/r/nutrition/comments/11fqox5/why_do_people_still_think_red_meat_is_bad_for_you/jakurq0/
30,jakxkbo,Dopamine_ADD_ict,"Any exact meal plan of what our human ancestors ate is not known. Don't believe anyone telling you they know what it was. The only thing for certain was that there was a wide variety of human diets. There was red meat, shellfish, fish, fruits, green vegetables, root vegetables, berries, wild grains, birds, honey, and wild beans. Christina Warriner has a TED talk about this

Evolution selects for performance up until reproductive age. It would be bad to assume that performance = longevity. If we were to travel back in time and give our ancestors steroids, they would perform better and be more likely to stay alive and reproduce, however, they would die faster too. This is just one example of how something could be prioritized by evolution while being bad for long term health.

And don't believe cave paintings. In fact, the cave paintings seem to suggest to me that meat was NOT an everyday occurrence. Do you have pictures up on your wall of something that is very mundane and commonplace in your life?","Any exact meal plan of what our human ancestors ate is not known. Don't believe anyone telling you they know what it was. The only thing for certain was that there was a wide variety of human diets. There was red meat, shellfish, fish, fruits, green vegetables, root vegetables, berries, wild grains, birds, honey, and wild beans. Christina Warriner has a TED talk about this

Evolution selects for performance up until reproductive age. It would be bad to assume that performance = longevity. If we were to travel back in time and give our ancestors steroids, they would perform better and be more likely to stay alive and reproduce, however, they would die faster too. This is just one example of how something could be prioritized by evolution while being bad for long term health.

And don't believe cave paintings. In fact, the cave paintings seem to suggest to me that meat was NOT an everyday occurrence. Do you have pictures up on your wall of something that is very mundane and commonplace in your life?",30,2023-03-02 03:57:31,<praw.models.comment_forest.CommentForest object at 0x0000022EF50BD610>,11fqox5,nutrition,t5_2qoox,,1677755026.0,False,t3_11fqox5,t3_11fqox5,/r/nutrition/comments/11fqox5/why_do_people_still_think_red_meat_is_bad_for_you/jakxkbo/
31,jal2quy,VeganTRT,"Don’t look at things from a evolutionary standpoint too much. 

We have changed our environment extensively. 

Just look at the example of adaptive metabolism. Why don’t we burn thousands of more calories so we don’t become overweight or obese? Given our environment we have right now, it would be better to have a faster metabolism. 

But, if we go back just a few centuries, having a slower metabolism meant you were more likely to survive as food was almost impossible to come by for most. 

Also, our ancestors had to eat anything to survive, we also don’t evolve to adapt to everything. Otherwise, we would have just adapted to the point we wouldn’t need sleep or other necessary parts of life. 

We can’t adapt to everything (in a evolutionary sense)","Don’t look at things from a evolutionary standpoint too much. 

We have changed our environment extensively. 

Just look at the example of adaptive metabolism. Why don’t we burn thousands of more calories so we don’t become overweight or obese? Given our environment we have right now, it would be better to have a faster metabolism. 

But, if we go back just a few centuries, having a slower metabolism meant you were more likely to survive as food was almost impossible to come by for most. 

Also, our ancestors had to eat anything to survive, we also don’t evolve to adapt to everything. Otherwise, we would have just adapted to the point we wouldn’t need sleep or other necessary parts of life. 

We can’t adapt to everything (in a evolutionary sense)",13,2023-03-02 04:43:59,<praw.models.comment_forest.CommentForest object at 0x0000022E803B43A0>,11fqox5,nutrition,t5_2qoox,,False,False,t3_11fqox5,t3_11fqox5,/r/nutrition/comments/11fqox5/why_do_people_still_think_red_meat_is_bad_for_you/jal2quy/
32,jakrjl5,SnooPineapples8744,"Because there's overwhelming evidence.... 


Obviously you can do what you want, eat whatever tastes good and that's ok. Great.

Again, I don't care what you do personally, but passing off opinion as scientific fact (without any evidence at all)  is misinformation.","Because there's overwhelming evidence.... 


Obviously you can do what you want, eat whatever tastes good and that's ok. Great.

Again, I don't care what you do personally, but passing off opinion as scientific fact (without any evidence at all)  is misinformation.",50,2023-03-02 03:09:05,<praw.models.comment_forest.CommentForest object at 0x0000022E803B4400>,11fqox5,nutrition,t5_2qoox,,1678045572.0,False,t3_11fqox5,t3_11fqox5,/r/nutrition/comments/11fqox5/why_do_people_still_think_red_meat_is_bad_for_you/jakrjl5/
33,jalmshu,AdInternal81,"Because there are many studies that show it and a lot of people follow peer reviewed studies like gospel. However most if not all studies that follow a large sample base that I've seen do not differentiate between chicken nuggets with fries/taco bell with ultra factory farmed beef and grass fed, free range beef with rice and veg. (If you read this and think bullshit please show me a thorough study where they compare ""clean meats vs dirty meats"")

That being said there are health risks to anything, but if you compare those to things like sedentary lifestyle the risks aren't even comparable","Because there are many studies that show it and a lot of people follow peer reviewed studies like gospel. However most if not all studies that follow a large sample base that I've seen do not differentiate between chicken nuggets with fries/taco bell with ultra factory farmed beef and grass fed, free range beef with rice and veg. (If you read this and think bullshit please show me a thorough study where they compare ""clean meats vs dirty meats"")

That being said there are health risks to anything, but if you compare those to things like sedentary lifestyle the risks aren't even comparable",7,2023-03-02 08:38:10,<praw.models.comment_forest.CommentForest object at 0x0000022E803B4130>,11fqox5,nutrition,t5_2qoox,,False,False,t3_11fqox5,t3_11fqox5,/r/nutrition/comments/11fqox5/why_do_people_still_think_red_meat_is_bad_for_you/jalmshu/
34,jal0b93,txhodlem00,Colon cancer?,Colon cancer?,17,2023-03-02 04:21:23,<praw.models.comment_forest.CommentForest object at 0x0000022EEE55A400>,11fqox5,nutrition,t5_2qoox,,False,False,t3_11fqox5,t3_11fqox5,/r/nutrition/comments/11fqox5/why_do_people_still_think_red_meat_is_bad_for_you/jal0b93/
