,ID,Author,body,Comment,Score,Created On,Replies,Submission,Subreddit,Subreddit_ID,Distinguished,Edited,Is_submitter,link_id,Parent_id,Permalink
1074,jumjsgb,Demented-Turtle,"The errors aren't based off of human bias explicitly. They are from biased, non-diverse datasets","The errors aren't based off of human bias explicitly. They are from biased, non-diverse datasets",4,2023-08-03 14:49:44,<praw.models.comment_forest.CommentForest object at 0x000002541F682490>,15gmxcr,nottheonion,t5_2qnts,,False,False,t3_15gmxcr,t1_juli0qv,/r/nottheonion/comments/15gmxcr/an_asian_woman_asked_ai_to_improve_her_headshot/jumjsgb/
1075,jul9bzf,anivex,"If you really think hiphop is 80% nwords, you are seriously deprived of some of the best hiphop out there.","If you really think hiphop is 80% nwords, you are seriously deprived of some of the best hiphop out there.",62,2023-08-03 07:38:50,<praw.models.comment_forest.CommentForest object at 0x000002541F682A90>,15gmxcr,nottheonion,t5_2qnts,,False,False,t3_15gmxcr,t1_jukxxov,/r/nottheonion/comments/15gmxcr/an_asian_woman_asked_ai_to_improve_her_headshot/jul9bzf/
1076,jul2zs4,EpicalBeb,This is the worst comparison ever. Do you listen to hip hop? Wtf are you on about,This is the worst comparison ever. Do you listen to hip hop? Wtf are you on about,11,2023-08-03 06:23:06,<praw.models.comment_forest.CommentForest object at 0x000002541F6824F0>,15gmxcr,nottheonion,t5_2qnts,,False,False,t3_15gmxcr,t1_jukxxov,/r/nottheonion/comments/15gmxcr/an_asian_woman_asked_ai_to_improve_her_headshot/jul2zs4/
1077,jul281a,dingbling369,Only 80%? Those are rookie numbers. https://youtu.be/G2zDW9me-IY,Only 80%? Those are rookie numbers. https://youtu.be/G2zDW9me-IY,6,2023-08-03 06:14:07,<praw.models.comment_forest.CommentForest object at 0x000002541F682EE0>,15gmxcr,nottheonion,t5_2qnts,,False,False,t3_15gmxcr,t1_jukxxov,/r/nottheonion/comments/15gmxcr/an_asian_woman_asked_ai_to_improve_her_headshot/jul281a/
1078,jul3g45,VERMlTHOR,?? 80% of hiphop is not the N-word Lmfao and anyone who says it is obviously has not listened to anything beyond what they find on the radio or top charts,?? 80% of hiphop is not the N-word Lmfao and anyone who says it is obviously has not listened to anything beyond what they find on the radio or top charts,8,2023-08-03 06:28:21,<praw.models.comment_forest.CommentForest object at 0x000002541F682550>,15gmxcr,nottheonion,t5_2qnts,,1691045544.0,False,t3_15gmxcr,t1_jukxxov,/r/nottheonion/comments/15gmxcr/an_asian_woman_asked_ai_to_improve_her_headshot/jul3g45/
1079,julvccy,ImprovementCareless9,Itd be easier if folks didn’t do things that they’re offended if other people do. If you don’t wanna hear certain words then you yourself shouldn’t be saying them. Just don’t get that one.,Itd be easier if folks didn’t do things that they’re offended if other people do. If you don’t wanna hear certain words then you yourself shouldn’t be saying them. Just don’t get that one.,0,2023-08-03 11:51:32,<praw.models.comment_forest.CommentForest object at 0x000002541F6947C0>,15gmxcr,nottheonion,t5_2qnts,,False,False,t3_15gmxcr,t1_jukxxov,/r/nottheonion/comments/15gmxcr/an_asian_woman_asked_ai_to_improve_her_headshot/julvccy/
1080,jul3y1c,ChillaVen,"Okay, now try and explain away how her eye color, nose shape and lips all changed. Because that sure wasn’t because of Asian colorism.","Okay, now try and explain away how her eye color, nose shape and lips all changed. Because that sure wasn’t because of Asian colorism.",59,2023-08-03 06:34:14,<praw.models.comment_forest.CommentForest object at 0x000002541F682C10>,15gmxcr,nottheonion,t5_2qnts,,False,False,t3_15gmxcr,t1_jukw56q,/r/nottheonion/comments/15gmxcr/an_asian_woman_asked_ai_to_improve_her_headshot/jul3y1c/
1081,jul0fel,lqku,the woman in the picture already has pale skin. the AI changed her race.,the woman in the picture already has pale skin. the AI changed her race.,47,2023-08-03 05:53:40,<praw.models.comment_forest.CommentForest object at 0x000002541F682040>,15gmxcr,nottheonion,t5_2qnts,,False,False,t3_15gmxcr,t1_jukw56q,/r/nottheonion/comments/15gmxcr/an_asian_woman_asked_ai_to_improve_her_headshot/jul0fel/
1082,julwivz,Sylvurphlame,"Yeah the skin tone  wasn’t actually what was shocking. It was the eye color, nose shape and hair texture changes. You know basically 95% of the appearance.","Yeah the skin tone  wasn’t actually what was shocking. It was the eye color, nose shape and hair texture changes. You know basically 95% of the appearance.",4,2023-08-03 12:02:00,<praw.models.comment_forest.CommentForest object at 0x000002541F6821C0>,15gmxcr,nottheonion,t5_2qnts,,False,False,t3_15gmxcr,t1_jukw56q,/r/nottheonion/comments/15gmxcr/an_asian_woman_asked_ai_to_improve_her_headshot/julwivz/
1083,jul32iq,teethybrit,Many East Asian women are even paler than Europeans,Many East Asian women are even paler than Europeans,3,2023-08-03 06:23:56,<praw.models.comment_forest.CommentForest object at 0x000002541F6821F0>,15gmxcr,nottheonion,t5_2qnts,,False,False,t3_15gmxcr,t1_jukw56q,/r/nottheonion/comments/15gmxcr/an_asian_woman_asked_ai_to_improve_her_headshot/jul32iq/
1084,jul6drv,,[removed],[removed],1,2023-08-03 07:03:08,<praw.models.comment_forest.CommentForest object at 0x000002547C4A7E20>,15gmxcr,nottheonion,t5_2qnts,,1691046457.0,False,t3_15gmxcr,t1_jukw56q,/r/nottheonion/comments/15gmxcr/an_asian_woman_asked_ai_to_improve_her_headshot/jul6drv/
1085,jul6e2b,,[removed],[removed],1,2023-08-03 07:03:14,<praw.models.comment_forest.CommentForest object at 0x000002541F81A2B0>,15gmxcr,nottheonion,t5_2qnts,,False,False,t3_15gmxcr,t1_jukw56q,/r/nottheonion/comments/15gmxcr/an_asian_woman_asked_ai_to_improve_her_headshot/jul6e2b/
1086,jukwrz8,samosamancer,"There are MOUNTAINS’ worth of research on precisely this. AI = algorithms created by people and trained on whatever people feed into it - and both tend to be affluent white cis men, many of whom who don’t recognize their own internal biases. And the AI output reflects that. Go look it up. Entire segments of industry and research are devoted to tech ethics and algorithmic fairness and justice.","There are MOUNTAINS’ worth of research on precisely this. AI = algorithms created by people and trained on whatever people feed into it - and both tend to be affluent white cis men, many of whom who don’t recognize their own internal biases. And the AI output reflects that. Go look it up. Entire segments of industry and research are devoted to tech ethics and algorithmic fairness and justice.",14,2023-08-03 05:13:37,<praw.models.comment_forest.CommentForest object at 0x000002541C838400>,15gmxcr,nottheonion,t5_2qnts,,False,False,t3_15gmxcr,t1_jukpi2u,/r/nottheonion/comments/15gmxcr/an_asian_woman_asked_ai_to_improve_her_headshot/jukwrz8/
1087,jukr4fp,dedicated-pedestrian,"It's really just human input in the sense that people don't go out of their way to train for diversity.

She asked the AI to make her image look more professional, and guess what color of person shows up when you Google.

If anything, the stock photo companies are racist. 🤔","It's really just human input in the sense that people don't go out of their way to train for diversity.

She asked the AI to make her image look more professional, and guess what color of person shows up when you Google.

If anything, the stock photo companies are racist. 🤔",8,2023-08-03 04:16:19,<praw.models.comment_forest.CommentForest object at 0x000002541C827E50>,15gmxcr,nottheonion,t5_2qnts,,False,False,t3_15gmxcr,t1_jukpi2u,/r/nottheonion/comments/15gmxcr/an_asian_woman_asked_ai_to_improve_her_headshot/jukr4fp/
1088,jukrdvw,palkiajack,"No, that's exactly how AI works. It's trained on human inputs. If the human inputs are flawed, so is the AI. The one in the original post was likely trained primarily on white models meeting western beauty standards, so it made the Asian lady white.","No, that's exactly how AI works. It's trained on human inputs. If the human inputs are flawed, so is the AI. The one in the original post was likely trained primarily on white models meeting western beauty standards, so it made the Asian lady white.",23,2023-08-03 04:18:51,<praw.models.comment_forest.CommentForest object at 0x000002541C8395E0>,15gmxcr,nottheonion,t5_2qnts,,False,False,t3_15gmxcr,t1_jukq9jk,/r/nottheonion/comments/15gmxcr/an_asian_woman_asked_ai_to_improve_her_headshot/jukrdvw/
1089,jum0wv9,Mediocretes1,Never willingly installing anything like that on my system.  If it's required for work or something they can provide me with a work PC with that stuff installed.,Never willingly installing anything like that on my system.  If it's required for work or something they can provide me with a work PC with that stuff installed.,35,2023-08-03 12:38:40,<praw.models.comment_forest.CommentForest object at 0x000002541F6832B0>,15gmxcr,nottheonion,t5_2qnts,,False,False,t3_15gmxcr,t1_juktp8d,/r/nottheonion/comments/15gmxcr/an_asian_woman_asked_ai_to_improve_her_headshot/jum0wv9/
1090,jukmds9,arcose,Ehh you win some you loss some,Ehh you win some you loss some,1,2023-08-03 03:33:16,<praw.models.comment_forest.CommentForest object at 0x000002541F7E2280>,15gmxcr,nottheonion,t5_2qnts,,False,False,t3_15gmxcr,t1_jukkriu,/r/nottheonion/comments/15gmxcr/an_asian_woman_asked_ai_to_improve_her_headshot/jukmds9/
1091,jum43kw,joomla00,People think anything that is automated is ai now.  And racist apparently.,People think anything that is automated is ai now.  And racist apparently.,7,2023-08-03 13:03:45,<praw.models.comment_forest.CommentForest object at 0x000002541F6838B0>,15gmxcr,nottheonion,t5_2qnts,,False,False,t3_15gmxcr,t1_julkdru,/r/nottheonion/comments/15gmxcr/an_asian_woman_asked_ai_to_improve_her_headshot/jum43kw/
1092,jumqd1i,Demented-Turtle,"Is that racist or just a constraint of the problem domain? Like if they adjust it to work easier for darker skin, could that cause other problems with normal operation, like triggering for no reason?","Is that racist or just a constraint of the problem domain? Like if they adjust it to work easier for darker skin, could that cause other problems with normal operation, like triggering for no reason?",3,2023-08-03 15:30:11,<praw.models.comment_forest.CommentForest object at 0x000002541F683910>,15gmxcr,nottheonion,t5_2qnts,,False,False,t3_15gmxcr,t1_julkdru,/r/nottheonion/comments/15gmxcr/an_asian_woman_asked_ai_to_improve_her_headshot/jumqd1i/
1093,jul5npy,FlowersInMyGun,An automatic faucet is just designed for people. They don't even require skin colour. There's no need to use AI for an automatic faucet - even for white people it makes no sense.,An automatic faucet is just designed for people. They don't even require skin colour. There's no need to use AI for an automatic faucet - even for white people it makes no sense.,9,2023-08-03 06:54:32,<praw.models.comment_forest.CommentForest object at 0x000002541F7E26A0>,15gmxcr,nottheonion,t5_2qnts,,False,False,t3_15gmxcr,t1_jukomyi,/r/nottheonion/comments/15gmxcr/an_asian_woman_asked_ai_to_improve_her_headshot/jul5npy/
1094,jukvihr,Feinberg,This AI isn't trained on 'white faces'. It's trained on huge collections of millions of pictures from all over the world. You're looking at a single data point and describing a thing you don't even understand.,This AI isn't trained on 'white faces'. It's trained on huge collections of millions of pictures from all over the world. You're looking at a single data point and describing a thing you don't even understand.,5,2023-08-03 05:00:13,<praw.models.comment_forest.CommentForest object at 0x000002541F7E2760>,15gmxcr,nottheonion,t5_2qnts,,False,False,t3_15gmxcr,t1_jukomyi,/r/nottheonion/comments/15gmxcr/an_asian_woman_asked_ai_to_improve_her_headshot/jukvihr/
1095,juop7t6,MechanicalHorse,"> but engineers and marketers not bothering to test and accommodate for other races is racist

No it's not. It's carelessness at most.","> but engineers and marketers not bothering to test and accommodate for other races is racist

No it's not. It's carelessness at most.",1,2023-08-03 22:42:35,<praw.models.comment_forest.CommentForest object at 0x000002541F80FF10>,15gmxcr,nottheonion,t5_2qnts,,False,False,t3_15gmxcr,t1_juoldev,/r/nottheonion/comments/15gmxcr/an_asian_woman_asked_ai_to_improve_her_headshot/juop7t6/
1096,juogx5i,RobsEvilTwin,You summarised that beautifully mate :D,You summarised that beautifully mate :D,1,2023-08-03 21:47:17,<praw.models.comment_forest.CommentForest object at 0x000002541C675A60>,15gmxcr,nottheonion,t5_2qnts,,False,False,t3_15gmxcr,t1_juo7wy4,/r/nottheonion/comments/15gmxcr/an_asian_woman_asked_ai_to_improve_her_headshot/juogx5i/
1097,juomg17,Hoopaboi,"It is bad engineering but not racism

What's your definition of racism?","It is bad engineering but not racism

What's your definition of racism?",0,2023-08-03 22:23:39,<praw.models.comment_forest.CommentForest object at 0x000002547C4B41F0>,15gmxcr,nottheonion,t5_2qnts,,False,False,t3_15gmxcr,t1_juojp7d,/r/nottheonion/comments/15gmxcr/an_asian_woman_asked_ai_to_improve_her_headshot/juomg17/
1098,juohzne,Hoopaboi,">but engineers and marketers not bothering to test and accommodate for other races is racist. It's why the term systemic racism exists

How is that racist though?

There is no intent

If your definition of systemic racism only requires disparate outcomes, then the conclusion would be that the sun is racist",">but engineers and marketers not bothering to test and accommodate for other races is racist. It's why the term systemic racism exists

How is that racist though?

There is no intent

If your definition of systemic racism only requires disparate outcomes, then the conclusion would be that the sun is racist",2,2023-08-03 21:54:04,<praw.models.comment_forest.CommentForest object at 0x000002541F80F280>,15gmxcr,nottheonion,t5_2qnts,,False,False,t3_15gmxcr,t1_juogswl,/r/nottheonion/comments/15gmxcr/an_asian_woman_asked_ai_to_improve_her_headshot/juohzne/
1099,jun5o6h,sticklebat,"They didn’t “train” faucet sensors. Faucet sensors have nothing to do with AI. They’re simple infrared lights and sensors that are programmed to activate when they register the infrared light bouncing off of your skin. Dark skin reflects less infrared light, making it less likely to be detected by the sensors. 

It is a minor engineering challenge/additional expense to adjust the sensitivity to reliably detect dark skin without also being susceptible to false activation due to things like signal noise or variable lighting conditions. Whether this is a problem because some manufacturers didn’t think to test their products with darker skin colors and thus didn’t recognize the problem, or because some of them recognized the problem but didn’t think addressing it was worth the cost, I don’t know.

But faucet sensors have got nothing to do with AI, and they are not “trained” in the way AI or machine learning algorithms are. They’re *way* simpler than that. The bias in technology like this is due to physical differences in skin color and explicit human bias, whereas AI forming biases by being trained on incidentally biased training data have similar outcomes but arise from very different mechanism.","They didn’t “train” faucet sensors. Faucet sensors have nothing to do with AI. They’re simple infrared lights and sensors that are programmed to activate when they register the infrared light bouncing off of your skin. Dark skin reflects less infrared light, making it less likely to be detected by the sensors. 

It is a minor engineering challenge/additional expense to adjust the sensitivity to reliably detect dark skin without also being susceptible to false activation due to things like signal noise or variable lighting conditions. Whether this is a problem because some manufacturers didn’t think to test their products with darker skin colors and thus didn’t recognize the problem, or because some of them recognized the problem but didn’t think addressing it was worth the cost, I don’t know.

But faucet sensors have got nothing to do with AI, and they are not “trained” in the way AI or machine learning algorithms are. They’re *way* simpler than that. The bias in technology like this is due to physical differences in skin color and explicit human bias, whereas AI forming biases by being trained on incidentally biased training data have similar outcomes but arise from very different mechanism.",2,2023-08-03 17:05:10,<praw.models.comment_forest.CommentForest object at 0x000002541C8275E0>,15gmxcr,nottheonion,t5_2qnts,,1691091222.0,False,t3_15gmxcr,t1_jukx69a,/r/nottheonion/comments/15gmxcr/an_asian_woman_asked_ai_to_improve_her_headshot/jun5o6h/
1100,jukxfc4,,"White skin reflects light. Dark skin does not.

Physics is racist.","White skin reflects light. Dark skin does not.

Physics is racist.",-11,2023-08-03 05:20:38,<praw.models.comment_forest.CommentForest object at 0x000002541C838700>,15gmxcr,nottheonion,t5_2qnts,,False,False,t3_15gmxcr,t1_jukx69a,/r/nottheonion/comments/15gmxcr/an_asian_woman_asked_ai_to_improve_her_headshot/jukxfc4/
1101,jul0jul,_Dreamer_Deceiver_,"They're saying it's not racist because light can't be racist and the tap has a light sensor therefore it's not racist to design a tap that only works for light skin ...
Even though the option of using a sensor that works for darker skin does exist and just proves that either the designers were actually racist and specifically designed it to not work with dark skin or the more likely scenario of subconscious biased where they don't know they are doing it but they are assuming if it works for a person with light skin then it must work for everyone regardless of skin colour and didn't even think to have a down or black person test it","They're saying it's not racist because light can't be racist and the tap has a light sensor therefore it's not racist to design a tap that only works for light skin ...
Even though the option of using a sensor that works for darker skin does exist and just proves that either the designers were actually racist and specifically designed it to not work with dark skin or the more likely scenario of subconscious biased where they don't know they are doing it but they are assuming if it works for a person with light skin then it must work for everyone regardless of skin colour and didn't even think to have a down or black person test it",8,2023-08-03 05:55:01,<praw.models.comment_forest.CommentForest object at 0x000002541C838190>,15gmxcr,nottheonion,t5_2qnts,,False,False,t3_15gmxcr,t1_jukxt2l,/r/nottheonion/comments/15gmxcr/an_asian_woman_asked_ai_to_improve_her_headshot/jul0jul/
1102,juldmls,,[deleted],[deleted],1,2023-08-03 08:33:06,<praw.models.comment_forest.CommentForest object at 0x000002541C838850>,15gmxcr,nottheonion,t5_2qnts,,False,False,t3_15gmxcr,t1_jul76hr,/r/nottheonion/comments/15gmxcr/an_asian_woman_asked_ai_to_improve_her_headshot/juldmls/
1103,juk90d3,Thick-McRunFast,Ken Leeeee tilibidibidouchu!!,Ken Leeeee tilibidibidouchu!!,56,2023-08-03 01:48:21,<praw.models.comment_forest.CommentForest object at 0x000002541F683E50>,15gmxcr,nottheonion,t5_2qnts,,False,False,t3_15gmxcr,t1_juk5zdb,/r/nottheonion/comments/15gmxcr/an_asian_woman_asked_ai_to_improve_her_headshot/juk90d3/
1104,juk9yw4,AtLeastThisIsntImgur,"Probably because of the famous korean-american man, Lincoln Park","Probably because of the famous korean-american man, Lincoln Park",94,2023-08-03 01:55:18,<praw.models.comment_forest.CommentForest object at 0x000002541F6610D0>,15gmxcr,nottheonion,t5_2qnts,,False,False,t3_15gmxcr,t1_juk72y3,/r/nottheonion/comments/15gmxcr/an_asian_woman_asked_ai_to_improve_her_headshot/juk9yw4/
1105,julrpgp,Stravven,And then there is Vietnam with Nguyen.,And then there is Vietnam with Nguyen.,37,2023-08-03 11:17:17,<praw.models.comment_forest.CommentForest object at 0x000002541F6612B0>,15gmxcr,nottheonion,t5_2qnts,,False,False,t3_15gmxcr,t1_jukf8mj,/r/nottheonion/comments/15gmxcr/an_asian_woman_asked_ai_to_improve_her_headshot/julrpgp/
1106,juku032,weirdplacetogoonfire,"IMO, it's great. Given names are a little more varied, but still enough that there is a huge amount of overlap!  Which means if people try to google you, the noise to signal ratio is through the roof! Unless you're famous, you're pretty ambiguous online even if people search using your full name.","IMO, it's great. Given names are a little more varied, but still enough that there is a huge amount of overlap!  Which means if people try to google you, the noise to signal ratio is through the roof! Unless you're famous, you're pretty ambiguous online even if people search using your full name.",10,2023-08-03 04:44:39,<praw.models.comment_forest.CommentForest object at 0x000002541F661310>,15gmxcr,nottheonion,t5_2qnts,,False,False,t3_15gmxcr,t1_jukf8mj,/r/nottheonion/comments/15gmxcr/an_asian_woman_asked_ai_to_improve_her_headshot/juku032/
1107,jum19oe,Mediocretes1,Now do Brazil and Dasilva.,Now do Brazil and Dasilva.,10,2023-08-03 12:41:27,<praw.models.comment_forest.CommentForest object at 0x000002541F6613D0>,15gmxcr,nottheonion,t5_2qnts,,False,False,t3_15gmxcr,t1_jukf8mj,/r/nottheonion/comments/15gmxcr/an_asian_woman_asked_ai_to_improve_her_headshot/jum19oe/
1108,jukx0hl,andereandre,https://www.youtube.com/watch?v=bNBy1D1Y0h4,https://www.youtube.com/watch?v=bNBy1D1Y0h4,2,2023-08-03 05:16:11,<praw.models.comment_forest.CommentForest object at 0x000002541F661490>,15gmxcr,nottheonion,t5_2qnts,,False,False,t3_15gmxcr,t1_jukf8mj,/r/nottheonion/comments/15gmxcr/an_asian_woman_asked_ai_to_improve_her_headshot/jukx0hl/
1109,jum7p3s,username_elephant,"I wonder how this changes if you account for all the variations on Smith though.

A few notable ones: Herrero, Herrera, Ferrera, Ferrero, Schmidt... But there are many others https://en.m.wikipedia.org/wiki/Smith_(surname)","I wonder how this changes if you account for all the variations on Smith though.

A few notable ones: Herrero, Herrera, Ferrera, Ferrero, Schmidt... But there are many others https://en.m.wikipedia.org/wiki/Smith_(surname)",1,2023-08-03 13:30:38,<praw.models.comment_forest.CommentForest object at 0x000002547C4BF3D0>,15gmxcr,nottheonion,t5_2qnts,,False,False,t3_15gmxcr,t1_jukf8mj,/r/nottheonion/comments/15gmxcr/an_asian_woman_asked_ai_to_improve_her_headshot/jum7p3s/
1110,jukotfw,isha_v,Jim….James…..Jimothy?,Jim….James…..Jimothy?,2,2023-08-03 03:54:43,<praw.models.comment_forest.CommentForest object at 0x000002541F661610>,15gmxcr,nottheonion,t5_2qnts,,False,False,t3_15gmxcr,t1_jukcjum,/r/nottheonion/comments/15gmxcr/an_asian_woman_asked_ai_to_improve_her_headshot/jukotfw/
1111,juomn2c,its_not_you_its_ye,"He’s referring to “John,” not “Jon”. If someone goes by “Jon”, they’ve pretty much always shortened “Jonathan,” which he’s saying is related to “Nathan,” not to “John.”

So he learned Jonathan —> John = false, but Nathan —> Jonathan = true. Independently of what he’s discussing, Jonathan —> Jon is still true.","He’s referring to “John,” not “Jon”. If someone goes by “Jon”, they’ve pretty much always shortened “Jonathan,” which he’s saying is related to “Nathan,” not to “John.”

So he learned Jonathan —> John = false, but Nathan —> Jonathan = true. Independently of what he’s discussing, Jonathan —> Jon is still true.",1,2023-08-03 22:24:57,<praw.models.comment_forest.CommentForest object at 0x000002541F68ED30>,15gmxcr,nottheonion,t5_2qnts,,False,False,t3_15gmxcr,t1_junzdal,/r/nottheonion/comments/15gmxcr/an_asian_woman_asked_ai_to_improve_her_headshot/juomn2c/
1112,jukeslu,Mehhish,"He's just currently at war with Aqua Man and Atlantis, he inherited the war from his dad.","He's just currently at war with Aqua Man and Atlantis, he inherited the war from his dad.",3,2023-08-03 02:31:30,<praw.models.comment_forest.CommentForest object at 0x000002547AC9B910>,15gmxcr,nottheonion,t5_2qnts,,False,False,t3_15gmxcr,t1_juk8dgf,/r/nottheonion/comments/15gmxcr/an_asian_woman_asked_ai_to_improve_her_headshot/jukeslu/
1113,jula7i2,Dense-Direction-1352,"Yeah, that works pretty well, and is more normal. I think linzei sounds a little closer, it even gives you a bit of the plosive d sound.","Yeah, that works pretty well, and is more normal. I think linzei sounds a little closer, it even gives you a bit of the plosive d sound.",5,2023-08-03 07:49:50,<praw.models.comment_forest.CommentForest object at 0x000002541F661970>,15gmxcr,nottheonion,t5_2qnts,,False,False,t3_15gmxcr,t1_jukov3z,/r/nottheonion/comments/15gmxcr/an_asian_woman_asked_ai_to_improve_her_headshot/jula7i2/
1114,jultzkk,German_Irish_chicken,"Racism, of course.","Racism, of course.",6,2023-08-03 11:39:06,<praw.models.comment_forest.CommentForest object at 0x000002541F661F70>,15gmxcr,nottheonion,t5_2qnts,,False,False,t3_15gmxcr,t1_jukmbop,/r/nottheonion/comments/15gmxcr/an_asian_woman_asked_ai_to_improve_her_headshot/jultzkk/
1115,juolmfo,DavesPetFrog,God damn. I need one of those jobs. How and where do I get one?,God damn. I need one of those jobs. How and where do I get one?,2,2023-08-03 22:18:09,<praw.models.comment_forest.CommentForest object at 0x000002541F661FD0>,15gmxcr,nottheonion,t5_2qnts,,False,False,t3_15gmxcr,t1_jukmbop,/r/nottheonion/comments/15gmxcr/an_asian_woman_asked_ai_to_improve_her_headshot/juolmfo/
1116,jul1tmi,LamboTalk,So many Asian people are truly a bunch of bootlickers for white people and it’s disgusting,So many Asian people are truly a bunch of bootlickers for white people and it’s disgusting,-12,2023-08-03 06:09:25,<praw.models.comment_forest.CommentForest object at 0x000002547C4BB190>,15gmxcr,nottheonion,t5_2qnts,,False,False,t3_15gmxcr,t1_jukmbop,/r/nottheonion/comments/15gmxcr/an_asian_woman_asked_ai_to_improve_her_headshot/jul1tmi/
