,ID,Author,body,Comment,Score,Created On,Replies,Submission,Subreddit,Subreddit_ID,Distinguished,Edited,Is_submitter,link_id,Parent_id,Permalink
0,jujzkjp,lackingchill,This is like the time during the pandemic where my university had an AI proctor to look for cheating. The thing flagged me and all the other Asian students the entire time because our eyes were “supposedly looking elsewhere from the screen”,This is like the time during the pandemic where my university had an AI proctor to look for cheating. The thing flagged me and all the other Asian students the entire time because our eyes were “supposedly looking elsewhere from the screen”,9580,2023-08-03 00:39:55,<praw.models.comment_forest.CommentForest object at 0x000002547C4A3070>,15gmxcr,nottheonion,t5_2qnts,,False,False,t3_15gmxcr,t3_15gmxcr,/r/nottheonion/comments/15gmxcr/an_asian_woman_asked_ai_to_improve_her_headshot/jujzkjp/
1,jujvo44,NuggetBuilder,Kim to Kimberly,Kim to Kimberly,3010,2023-08-03 00:11:22,<praw.models.comment_forest.CommentForest object at 0x000002547C4A30D0>,15gmxcr,nottheonion,t5_2qnts,,False,False,t3_15gmxcr,t3_15gmxcr,/r/nottheonion/comments/15gmxcr/an_asian_woman_asked_ai_to_improve_her_headshot/jujvo44/
2,jujwa21,ohbabyho,Linh to Lindsey,Linh to Lindsey,993,2023-08-03 00:15:56,<praw.models.comment_forest.CommentForest object at 0x000002541F6836D0>,15gmxcr,nottheonion,t5_2qnts,,False,False,t3_15gmxcr,t3_15gmxcr,/r/nottheonion/comments/15gmxcr/an_asian_woman_asked_ai_to_improve_her_headshot/jujwa21/
3,jujwd4j,Permission_Civil,My colorist Asian mom would like to know where she can contact this AI.,My colorist Asian mom would like to know where she can contact this AI.,759,2023-08-03 00:16:34,<praw.models.comment_forest.CommentForest object at 0x000002541F6616D0>,15gmxcr,nottheonion,t5_2qnts,,False,False,t3_15gmxcr,t3_15gmxcr,/r/nottheonion/comments/15gmxcr/an_asian_woman_asked_ai_to_improve_her_headshot/jujwd4j/
4,jujvf4p,Dynasuarez-Wrecks,"Not even gonna lie, I fuckin' lol'd.","Not even gonna lie, I fuckin' lol'd.",1167,2023-08-03 00:09:30,<praw.models.comment_forest.CommentForest object at 0x000002541F661A90>,15gmxcr,nottheonion,t5_2qnts,,False,False,t3_15gmxcr,t3_15gmxcr,/r/nottheonion/comments/15gmxcr/an_asian_woman_asked_ai_to_improve_her_headshot/jujvf4p/
5,jujwrc0,not_creative1,"AI trained on stock photo of “professionals” makes her white. Are we surprised? 

She asked the AI to make her headshot more professional. Most of “professional” stock photos on the internet have white people in them. 


If she had asked the AI to turn her photo into an NBA player, it would have turned her black.

These tools are only as good as the data they are trained on","AI trained on stock photo of “professionals” makes her white. Are we surprised? 

She asked the AI to make her headshot more professional. Most of “professional” stock photos on the internet have white people in them. 


If she had asked the AI to turn her photo into an NBA player, it would have turned her black.

These tools are only as good as the data they are trained on",2400,2023-08-03 00:19:31,<praw.models.comment_forest.CommentForest object at 0x000002541F661D90>,15gmxcr,nottheonion,t5_2qnts,,False,False,t3_15gmxcr,t3_15gmxcr,/r/nottheonion/comments/15gmxcr/an_asian_woman_asked_ai_to_improve_her_headshot/jujwrc0/
6,julilzz,1nv1s1blek1d,"My first question is, how detailed was the prompt given? If the request is pretty generic or general, the AI’s parameters have only so much to work with.","My first question is, how detailed was the prompt given? If the request is pretty generic or general, the AI’s parameters have only so much to work with.",20,2023-08-03 09:35:58,<praw.models.comment_forest.CommentForest object at 0x000002541F66D250>,15gmxcr,nottheonion,t5_2qnts,,1691055687.0,False,t3_15gmxcr,t3_15gmxcr,/r/nottheonion/comments/15gmxcr/an_asian_woman_asked_ai_to_improve_her_headshot/julilzz/
7,jujwi0b,konwik,To be honest Playground AI image editor failed the task not only because of changing race of the subject but also by not producing a professional Linkedin photo that was requested.,To be honest Playground AI image editor failed the task not only because of changing race of the subject but also by not producing a professional Linkedin photo that was requested.,151,2023-08-03 00:17:36,<praw.models.comment_forest.CommentForest object at 0x000002541F69E370>,15gmxcr,nottheonion,t5_2qnts,,False,False,t3_15gmxcr,t3_15gmxcr,/r/nottheonion/comments/15gmxcr/an_asian_woman_asked_ai_to_improve_her_headshot/jujwi0b/
8,jujznnw,,[deleted],[deleted],92,2023-08-03 00:40:33,<praw.models.comment_forest.CommentForest object at 0x000002541F69E430>,15gmxcr,nottheonion,t5_2qnts,,False,False,t3_15gmxcr,t3_15gmxcr,/r/nottheonion/comments/15gmxcr/an_asian_woman_asked_ai_to_improve_her_headshot/jujznnw/
9,jujxmrb,AuburnElvis,"Playground AI's CEO Suhail Doshi's response was pretty interesting: 

>If I roll a dice just once and get the number 1, does that mean I will always get the number 1? Should I conclude based on a single observation that the dice is biased to the number 1 and was trained to be predisposed to rolling a 1?","Playground AI's CEO Suhail Doshi's response was pretty interesting: 

>If I roll a dice just once and get the number 1, does that mean I will always get the number 1? Should I conclude based on a single observation that the dice is biased to the number 1 and was trained to be predisposed to rolling a 1?",197,2023-08-03 00:25:52,<praw.models.comment_forest.CommentForest object at 0x000002541F69E790>,15gmxcr,nottheonion,t5_2qnts,,False,False,t3_15gmxcr,t3_15gmxcr,/r/nottheonion/comments/15gmxcr/an_asian_woman_asked_ai_to_improve_her_headshot/jujxmrb/
10,jukfufh,Pathetian,"This story is the AI version of ""my GPS told me to drive into a lake"".","This story is the AI version of ""my GPS told me to drive into a lake"".",85,2023-08-03 02:39:32,<praw.models.comment_forest.CommentForest object at 0x000002541F69E850>,15gmxcr,nottheonion,t5_2qnts,,False,False,t3_15gmxcr,t3_15gmxcr,/r/nottheonion/comments/15gmxcr/an_asian_woman_asked_ai_to_improve_her_headshot/jukfufh/
11,jukbzc2,lanky-emef,"Nobody gonna mention how vague her prompt is? ""give the girl from the original photo a professional LinkedIn profile photo"" isn't exactly a sentence that an ai can work with. In this case all the program would've registered was ""girl"" ""photo"" ""professional"" ""LinkedIn"", then used a blurred version of the original photo to get the overall composition. Haven't used playground, but most AI tools also have a chaos setting that can adjust how much blur is applied before generation (i.e. how much detail is lost from the original, including age, gender, or ethnicity).

Just to give you an idea of how limited these programs really are, it looks like the AI registered the word ""professional"" more as ""professional photography"" rather than ""professional business person"". On top of that the AI isn't going to read ""the girl from the original photo"" and think ""Aah, I should turn down my chaos settings for this one."", it's just going to look through its dataset for photos tagged with each individual word.

If her prompt had been ""Professional businesswoman, LinkedIn profile picture, Asian-American, brown eyes, mid-20's, straight black hair"" and iterated her prompt a few times this wouldn't have been a problem.

But besides all that, crop the sweatshirt out and the original photo is fine for a business profile. She could toss a nice shirt/blazer on, cross her arms, and take another photo under natural light if she wants it to look more professional. I think the deeper issue here is people thinking they can't use a pfp that isn't AI-enhanced.

At least from the interview it sounds like she's not taking it too seriously.","Nobody gonna mention how vague her prompt is? ""give the girl from the original photo a professional LinkedIn profile photo"" isn't exactly a sentence that an ai can work with. In this case all the program would've registered was ""girl"" ""photo"" ""professional"" ""LinkedIn"", then used a blurred version of the original photo to get the overall composition. Haven't used playground, but most AI tools also have a chaos setting that can adjust how much blur is applied before generation (i.e. how much detail is lost from the original, including age, gender, or ethnicity).

Just to give you an idea of how limited these programs really are, it looks like the AI registered the word ""professional"" more as ""professional photography"" rather than ""professional business person"". On top of that the AI isn't going to read ""the girl from the original photo"" and think ""Aah, I should turn down my chaos settings for this one."", it's just going to look through its dataset for photos tagged with each individual word.

If her prompt had been ""Professional businesswoman, LinkedIn profile picture, Asian-American, brown eyes, mid-20's, straight black hair"" and iterated her prompt a few times this wouldn't have been a problem.

But besides all that, crop the sweatshirt out and the original photo is fine for a business profile. She could toss a nice shirt/blazer on, cross her arms, and take another photo under natural light if she wants it to look more professional. I think the deeper issue here is people thinking they can't use a pfp that isn't AI-enhanced.

At least from the interview it sounds like she's not taking it too seriously.",100,2023-08-03 02:10:10,<praw.models.comment_forest.CommentForest object at 0x000002541F69E970>,15gmxcr,nottheonion,t5_2qnts,,False,False,t3_15gmxcr,t3_15gmxcr,/r/nottheonion/comments/15gmxcr/an_asian_woman_asked_ai_to_improve_her_headshot/jukbzc2/
12,juk0z8j,matlynar,"Sure, now go to the [most popular Stable Diffusion model website](https://civitai.com/) and look at the images on the front page.

You'll see an absurd number of asian women (almost 50% of the non-anime models are represented by them) to the point where you'd assume being asian is a desired trait.

How is that less relevant that ""one woman typed a dumb prompt into a website and they generated a white woman""?

Also keep in mind that she typed ""Linkedin"", so anyone familiar with how prompts currently work know it's more likely that the AI searched for the average linkedin woman, not what it thinks is a professional women because *image AI doesn't have an opinion.*

In short, this is just an AI ragebait article.","Sure, now go to the [most popular Stable Diffusion model website](https://civitai.com/) and look at the images on the front page.

You'll see an absurd number of asian women (almost 50% of the non-anime models are represented by them) to the point where you'd assume being asian is a desired trait.

How is that less relevant that ""one woman typed a dumb prompt into a website and they generated a white woman""?

Also keep in mind that she typed ""Linkedin"", so anyone familiar with how prompts currently work know it's more likely that the AI searched for the average linkedin woman, not what it thinks is a professional women because *image AI doesn't have an opinion.*

In short, this is just an AI ragebait article.",120,2023-08-03 00:50:09,<praw.models.comment_forest.CommentForest object at 0x000002541F69EA30>,15gmxcr,nottheonion,t5_2qnts,,1691024204.0,False,t3_15gmxcr,t3_15gmxcr,/r/nottheonion/comments/15gmxcr/an_asian_woman_asked_ai_to_improve_her_headshot/juk0z8j/
13,juk8np0,b0x3r_,This is almost certainly bullshit. Quickly google her and you’ll see she’s recently been accused of plagiarizing an entire book. This is just her latest scam.,This is almost certainly bullshit. Quickly google her and you’ll see she’s recently been accused of plagiarizing an entire book. This is just her latest scam.,41,2023-08-03 01:45:46,<praw.models.comment_forest.CommentForest object at 0x000002541F69EC70>,15gmxcr,nottheonion,t5_2qnts,,False,False,t3_15gmxcr,t3_15gmxcr,/r/nottheonion/comments/15gmxcr/an_asian_woman_asked_ai_to_improve_her_headshot/juk8np0/
14,junon28,hideousfridgemagnet,My racist Korean phone makes eyes bigger when taking a selfie,My racist Korean phone makes eyes bigger when taking a selfie,6,2023-08-03 18:56:37,<praw.models.comment_forest.CommentForest object at 0x000002541F674370>,15gmxcr,nottheonion,t5_2qnts,,False,False,t3_15gmxcr,t3_15gmxcr,/r/nottheonion/comments/15gmxcr/an_asian_woman_asked_ai_to_improve_her_headshot/junon28/
15,juk8cr7,tavirabon,"Getting kinda tired of seeing this tbh, this is user error and not some malicious or even accidental bias. I can do this right now and cover all the races in a few minutes because the model *does not know who I am*","Getting kinda tired of seeing this tbh, this is user error and not some malicious or even accidental bias. I can do this right now and cover all the races in a few minutes because the model *does not know who I am*",19,2023-08-03 01:43:36,<praw.models.comment_forest.CommentForest object at 0x000002541F674430>,15gmxcr,nottheonion,t5_2qnts,,False,False,t3_15gmxcr,t3_15gmxcr,/r/nottheonion/comments/15gmxcr/an_asian_woman_asked_ai_to_improve_her_headshot/juk8cr7/
16,juk1un3,,[deleted],[deleted],32,2023-08-03 00:56:30,<praw.models.comment_forest.CommentForest object at 0x000002541F6744F0>,15gmxcr,nottheonion,t5_2qnts,,False,False,t3_15gmxcr,t3_15gmxcr,/r/nottheonion/comments/15gmxcr/an_asian_woman_asked_ai_to_improve_her_headshot/juk1un3/
17,jujxl9y,PrairieCanadian,"This is amusing.

I didn't pay for it but a lot of the free AI confuse my face too for some reason. It makes me Asian or black a lot (even though I'm white, of Nordic background). I assumed it was the bias of the AI in some way. That is the AI was developed then trained in Asia or something.","This is amusing.

I didn't pay for it but a lot of the free AI confuse my face too for some reason. It makes me Asian or black a lot (even though I'm white, of Nordic background). I assumed it was the bias of the AI in some way. That is the AI was developed then trained in Asia or something.",8,2023-08-03 00:25:34,<praw.models.comment_forest.CommentForest object at 0x000002541F674550>,15gmxcr,nottheonion,t5_2qnts,,1691079406.0,False,t3_15gmxcr,t3_15gmxcr,/r/nottheonion/comments/15gmxcr/an_asian_woman_asked_ai_to_improve_her_headshot/jujxl9y/
18,jul0rrs,AsterJ,This is fucking moronic.  Check the AI models on civit.ai  there is an obvious huge bias TOWARDS asian women.  Asian women are very overrepresented in the training data so much so that people have to make loras to make the models less biased towards asian features.,This is fucking moronic.  Check the AI models on civit.ai  there is an obvious huge bias TOWARDS asian women.  Asian women are very overrepresented in the training data so much so that people have to make loras to make the models less biased towards asian features.,9,2023-08-03 05:57:27,<praw.models.comment_forest.CommentForest object at 0x000002541F6745B0>,15gmxcr,nottheonion,t5_2qnts,,False,False,t3_15gmxcr,t3_15gmxcr,/r/nottheonion/comments/15gmxcr/an_asian_woman_asked_ai_to_improve_her_headshot/jul0rrs/
19,juk8umj,KrustyBoomer,Doesn't even look based on the same pic.  Completely different girl.  Fake as shit,Doesn't even look based on the same pic.  Completely different girl.  Fake as shit,7,2023-08-03 01:47:10,<praw.models.comment_forest.CommentForest object at 0x000002541F674610>,15gmxcr,nottheonion,t5_2qnts,,False,False,t3_15gmxcr,t3_15gmxcr,/r/nottheonion/comments/15gmxcr/an_asian_woman_asked_ai_to_improve_her_headshot/juk8umj/
20,jul6ox5,Liesmith424,"It's not a fucking meeseeks, asking it do so something so subjective is going to give weird results.","It's not a fucking meeseeks, asking it do so something so subjective is going to give weird results.",4,2023-08-03 07:06:49,<praw.models.comment_forest.CommentForest object at 0x000002541F674670>,15gmxcr,nottheonion,t5_2qnts,,False,False,t3_15gmxcr,t3_15gmxcr,/r/nottheonion/comments/15gmxcr/an_asian_woman_asked_ai_to_improve_her_headshot/jul6ox5/
21,jul9kpb,SomeWeirdoOnTheNet,"""AI! Where did you learn such awful behaviour?""

""I learned it from watching u/!""","""AI! Where did you learn such awful behaviour?""

""I learned it from watching u/!""",4,2023-08-03 07:41:51,<praw.models.comment_forest.CommentForest object at 0x000002541F6746D0>,15gmxcr,nottheonion,t5_2qnts,,False,False,t3_15gmxcr,t3_15gmxcr,/r/nottheonion/comments/15gmxcr/an_asian_woman_asked_ai_to_improve_her_headshot/jul9kpb/
22,jupsqij,Tyler_Zoro,"This is a great example, of people misusing technology and thinking they've discovered that it's the tech that's broken.

What she did was put her image into a generative AI (probably Stable Diffusion-based) and prompted it with ""give the girl from the original photo a professional linkedin profile photo.""

Diffusion models don't understand what you're typing. They're not LLMs like ChatGPT. They just break up your prompt into words and phrases that it's been trained on and make the image look more like that.

So it probably saw that as something like, ""give, the girl, from, the, original photo, a professional, linkedin, profile photo"". The prompt ""tokens"" that had the most impact were probably ""the girl,"" ""a professional,"" and, ""profile photo.""

The original input photo is then treated as ""damaged"" (because that's what diffusion is all about: fixing noise in images to extract what it's been told to) and turns it into a professional girl's profile photo.

Hit ""Generate"" 100 times, and you'll probably get a slightly average mix of ethnic appearances, with a bit of weighting toward white or Asian depending on exactly which model you are using.

The odds of getting back a white woman were high.

It definitely has no idea that she was asking for the input image's face to be mostly unmodified. That's just not how the AI works.","This is a great example, of people misusing technology and thinking they've discovered that it's the tech that's broken.

What she did was put her image into a generative AI (probably Stable Diffusion-based) and prompted it with ""give the girl from the original photo a professional linkedin profile photo.""

Diffusion models don't understand what you're typing. They're not LLMs like ChatGPT. They just break up your prompt into words and phrases that it's been trained on and make the image look more like that.

So it probably saw that as something like, ""give, the girl, from, the, original photo, a professional, linkedin, profile photo"". The prompt ""tokens"" that had the most impact were probably ""the girl,"" ""a professional,"" and, ""profile photo.""

The original input photo is then treated as ""damaged"" (because that's what diffusion is all about: fixing noise in images to extract what it's been told to) and turns it into a professional girl's profile photo.

Hit ""Generate"" 100 times, and you'll probably get a slightly average mix of ethnic appearances, with a bit of weighting toward white or Asian depending on exactly which model you are using.

The odds of getting back a white woman were high.

It definitely has no idea that she was asking for the input image's face to be mostly unmodified. That's just not how the AI works.",3,2023-08-04 03:43:08,<praw.models.comment_forest.CommentForest object at 0x000002541F674730>,15gmxcr,nottheonion,t5_2qnts,,False,False,t3_15gmxcr,t3_15gmxcr,/r/nottheonion/comments/15gmxcr/an_asian_woman_asked_ai_to_improve_her_headshot/jupsqij/
23,jujwky5,,"AI is fed from the internet data, which is like a sewer. What do you expect is going to happen?","AI is fed from the internet data, which is like a sewer. What do you expect is going to happen?",13,2023-08-03 00:18:12,<praw.models.comment_forest.CommentForest object at 0x000002541F674790>,15gmxcr,nottheonion,t5_2qnts,,False,False,t3_15gmxcr,t3_15gmxcr,/r/nottheonion/comments/15gmxcr/an_asian_woman_asked_ai_to_improve_her_headshot/jujwky5/
24,jujvmo0,TruthOf42,Well that's what happens when the data models you train it on are all white people.,Well that's what happens when the data models you train it on are all white people.,31,2023-08-03 00:11:04,<praw.models.comment_forest.CommentForest object at 0x000002541F6747F0>,15gmxcr,nottheonion,t5_2qnts,,False,False,t3_15gmxcr,t3_15gmxcr,/r/nottheonion/comments/15gmxcr/an_asian_woman_asked_ai_to_improve_her_headshot/jujvmo0/
25,jujwddt,zugi,"She wanted the photo for LinkedIn, maybe the AI [knew she was applying to Harvard](https://www.bbc.com/news/world-us-canada-44505355) and was trying to do her a favor?","She wanted the photo for LinkedIn, maybe the AI [knew she was applying to Harvard](https://www.bbc.com/news/world-us-canada-44505355) and was trying to do her a favor?",18,2023-08-03 00:16:37,<praw.models.comment_forest.CommentForest object at 0x000002541F674850>,15gmxcr,nottheonion,t5_2qnts,,False,False,t3_15gmxcr,t3_15gmxcr,/r/nottheonion/comments/15gmxcr/an_asian_woman_asked_ai_to_improve_her_headshot/jujwddt/
26,jukxjj7,omelas21,I’m white and all of mine come out Asian,I’m white and all of mine come out Asian,7,2023-08-03 05:21:52,<praw.models.comment_forest.CommentForest object at 0x000002541F674970>,15gmxcr,nottheonion,t5_2qnts,,False,False,t3_15gmxcr,t3_15gmxcr,/r/nottheonion/comments/15gmxcr/an_asian_woman_asked_ai_to_improve_her_headshot/jukxjj7/
27,jukjopx,keith2600,"""an Asian woman shamelessly tricks AI trained with predominantly Caucasian business photos into producing an image used for anti-AI propaganda""

There I fixed the title.","""an Asian woman shamelessly tricks AI trained with predominantly Caucasian business photos into producing an image used for anti-AI propaganda""

There I fixed the title.",10,2023-08-03 03:10:10,<praw.models.comment_forest.CommentForest object at 0x000002541F674AF0>,15gmxcr,nottheonion,t5_2qnts,,False,False,t3_15gmxcr,t3_15gmxcr,/r/nottheonion/comments/15gmxcr/an_asian_woman_asked_ai_to_improve_her_headshot/jukjopx/
28,juk0arz,EvidenceBasedSwamp,The AI knows,The AI knows,7,2023-08-03 00:45:15,<praw.models.comment_forest.CommentForest object at 0x000002541F674BB0>,15gmxcr,nottheonion,t5_2qnts,,False,False,t3_15gmxcr,t3_15gmxcr,/r/nottheonion/comments/15gmxcr/an_asian_woman_asked_ai_to_improve_her_headshot/juk0arz/
29,juka9ab,sloppyredditor,I think it’s cool that now we can use laziness & AI to come up with reasons to be angry.,I think it’s cool that now we can use laziness & AI to come up with reasons to be angry.,8,2023-08-03 01:57:25,<praw.models.comment_forest.CommentForest object at 0x000002541F674C10>,15gmxcr,nottheonion,t5_2qnts,,False,False,t3_15gmxcr,t3_15gmxcr,/r/nottheonion/comments/15gmxcr/an_asian_woman_asked_ai_to_improve_her_headshot/juka9ab/
30,juk0och,odetothefireman,Well. They are richer per capita.  Might as well troll the media with it,Well. They are richer per capita.  Might as well troll the media with it,3,2023-08-03 00:47:59,<praw.models.comment_forest.CommentForest object at 0x000002541F674C70>,15gmxcr,nottheonion,t5_2qnts,,False,False,t3_15gmxcr,t3_15gmxcr,/r/nottheonion/comments/15gmxcr/an_asian_woman_asked_ai_to_improve_her_headshot/juk0och/
31,juk22mx,strolpol,"This is a giant market in Asia for a reason, skin whitening for beauty reasons is an issue around the world and not just in the West. It also has a lot tied up in both pre-existing culture ideas about skin color AND colonialism, so there’s something for everyone. An AI that is trying to increase whatever the user has defined as “attractive” could easily get this result.","This is a giant market in Asia for a reason, skin whitening for beauty reasons is an issue around the world and not just in the West. It also has a lot tied up in both pre-existing culture ideas about skin color AND colonialism, so there’s something for everyone. An AI that is trying to increase whatever the user has defined as “attractive” could easily get this result.",3,2023-08-03 00:58:06,<praw.models.comment_forest.CommentForest object at 0x000002541F674CD0>,15gmxcr,nottheonion,t5_2qnts,,False,False,t3_15gmxcr,t3_15gmxcr,/r/nottheonion/comments/15gmxcr/an_asian_woman_asked_ai_to_improve_her_headshot/juk22mx/
32,juk4js8,Nightruin,"I think what would have made this even more compelling is if she submitted the original photo and the ai-improved photo for jobs as separate people with the same qualifications and seen which one was more accepted.

I think we know the answer but it would’ve helped point out that the AI isn’t wrong, it’s the entire system the AI learned from that’s racist.","I think what would have made this even more compelling is if she submitted the original photo and the ai-improved photo for jobs as separate people with the same qualifications and seen which one was more accepted.

I think we know the answer but it would’ve helped point out that the AI isn’t wrong, it’s the entire system the AI learned from that’s racist.",3,2023-08-03 01:15:57,<praw.models.comment_forest.CommentForest object at 0x000002541F674D30>,15gmxcr,nottheonion,t5_2qnts,,False,False,t3_15gmxcr,t3_15gmxcr,/r/nottheonion/comments/15gmxcr/an_asian_woman_asked_ai_to_improve_her_headshot/juk4js8/
