,ID,Author,body,Comment,Score,Created On,Replies,Submission,Subreddit,Subreddit_ID,Distinguished,Edited,Is_submitter,link_id,Parent_id,Permalink
446,juk4f4n,LukeR_666,I'm sorry that sucks for you and your fellow students but I burst out laughing at this.,I'm sorry that sucks for you and your fellow students but I burst out laughing at this.,141,2023-08-03 01:15:01,<praw.models.comment_forest.CommentForest object at 0x000002541F6830D0>,15gmxcr,nottheonion,t5_2qnts,,False,False,t3_15gmxcr,t1_jujzkjp,/r/nottheonion/comments/15gmxcr/an_asian_woman_asked_ai_to_improve_her_headshot/juk4f4n/
447,jukjtki,orokami11,LMAO what happened after that??,LMAO what happened after that??,49,2023-08-03 03:11:17,<praw.models.comment_forest.CommentForest object at 0x000002541F683250>,15gmxcr,nottheonion,t5_2qnts,,False,False,t3_15gmxcr,t1_jujzkjp,/r/nottheonion/comments/15gmxcr/an_asian_woman_asked_ai_to_improve_her_headshot/jukjtki/
448,jukjo7n,athomeamongstrangers,"That reminds me of some ""smart"" point-and-shoot camera that supposedly showed a ""Did someone blink?"" message when taking photos of Asian people.","That reminds me of some ""smart"" point-and-shoot camera that supposedly showed a ""Did someone blink?"" message when taking photos of Asian people.",23,2023-08-03 03:10:03,<praw.models.comment_forest.CommentForest object at 0x000002541F683310>,15gmxcr,nottheonion,t5_2qnts,,False,False,t3_15gmxcr,t1_jujzkjp,/r/nottheonion/comments/15gmxcr/an_asian_woman_asked_ai_to_improve_her_headshot/jukjo7n/
449,jukysys,wut3va,"I can't really fucking believe universities have stooped so low as to require you to install spy software on your computers. It's just frankly distopian. It feels like the last bastion of hope for our species, education, has fallen. 1984 was supposed to be a warning, not an instruction manual. Has your student body considered organized noncompliance?","I can't really fucking believe universities have stooped so low as to require you to install spy software on your computers. It's just frankly distopian. It feels like the last bastion of hope for our species, education, has fallen. 1984 was supposed to be a warning, not an instruction manual. Has your student body considered organized noncompliance?",65,2023-08-03 05:35:43,<praw.models.comment_forest.CommentForest object at 0x000002541F683370>,15gmxcr,nottheonion,t5_2qnts,,1691041156.0,False,t3_15gmxcr,t1_jujzkjp,/r/nottheonion/comments/15gmxcr/an_asian_woman_asked_ai_to_improve_her_headshot/jukysys/
450,jukx96w,samosamancer,"Oh man, there are AI Fairness/Ethics researchers who would love to learn more about this…","Oh man, there are AI Fairness/Ethics researchers who would love to learn more about this…",30,2023-08-03 05:18:50,<praw.models.comment_forest.CommentForest object at 0x000002541F6833D0>,15gmxcr,nottheonion,t5_2qnts,,False,False,t3_15gmxcr,t1_jujzkjp,/r/nottheonion/comments/15gmxcr/an_asian_woman_asked_ai_to_improve_her_headshot/jukx96w/
451,jukm6pc,No_Employment_2233,"Might prove the point that they aren't necessary to perform their job. Also, the AI developers may have skipped a step making their pb&j sandwich.","Might prove the point that they aren't necessary to perform their job. Also, the AI developers may have skipped a step making their pb&j sandwich.",8,2023-08-03 03:31:33,<praw.models.comment_forest.CommentForest object at 0x000002541F683550>,15gmxcr,nottheonion,t5_2qnts,,False,False,t3_15gmxcr,t1_jujzkjp,/r/nottheonion/comments/15gmxcr/an_asian_woman_asked_ai_to_improve_her_headshot/jukm6pc/
452,jukvly0,orovin,">oesn’t suggest an

do you remember what the system is called? as I'm working on a solution to the assessment proctoring problem.",">oesn’t suggest an

do you remember what the system is called? as I'm working on a solution to the assessment proctoring problem.",6,2023-08-03 05:01:14,<praw.models.comment_forest.CommentForest object at 0x000002541F6835B0>,15gmxcr,nottheonion,t5_2qnts,,False,False,t3_15gmxcr,t1_jujzkjp,/r/nottheonion/comments/15gmxcr/an_asian_woman_asked_ai_to_improve_her_headshot/jukvly0/
453,jukl5yr,DTFH_,"Bro can you please class action that shit, it is horribly hilarious as an adult and I see how it could happen, but I want to read that headline everywhere because I bet there are a multitude of students across the country who had a similar experience at their school, we need to hold these tech firms to higher standards before something can be used as a public technology.  

Similar to how we found that red light cameras increase low-speed crashes, we should have observed that through testing before public release.  Whatever version of technology provided to the school was insufficient and unable to actually perform its advertised function and the school 100% bought it.  

Tech Edu companies are the worst of friends and we could regulate them before contracts are written.","Bro can you please class action that shit, it is horribly hilarious as an adult and I see how it could happen, but I want to read that headline everywhere because I bet there are a multitude of students across the country who had a similar experience at their school, we need to hold these tech firms to higher standards before something can be used as a public technology.  

Similar to how we found that red light cameras increase low-speed crashes, we should have observed that through testing before public release.  Whatever version of technology provided to the school was insufficient and unable to actually perform its advertised function and the school 100% bought it.  

Tech Edu companies are the worst of friends and we could regulate them before contracts are written.",47,2023-08-03 03:22:43,<praw.models.comment_forest.CommentForest object at 0x000002541F683610>,15gmxcr,nottheonion,t5_2qnts,,False,False,t3_15gmxcr,t1_jujzkjp,/r/nottheonion/comments/15gmxcr/an_asian_woman_asked_ai_to_improve_her_headshot/jukl5yr/
454,jukly1n,RobsEvilTwin,"A lot of AI and automation in general is systemically racist. Taps (faucets?) that won't register black hands, and so on. 

Your example is a new level of fucked up.","A lot of AI and automation in general is systemically racist. Taps (faucets?) that won't register black hands, and so on. 

Your example is a new level of fucked up.",74,2023-08-03 03:29:28,<praw.models.comment_forest.CommentForest object at 0x000002541F683670>,15gmxcr,nottheonion,t5_2qnts,,False,False,t3_15gmxcr,t1_jujzkjp,/r/nottheonion/comments/15gmxcr/an_asian_woman_asked_ai_to_improve_her_headshot/jukly1n/
455,juldi4m,drmuffin1080,I bet the Asians who were cheating were thankful for the faulty technology,I bet the Asians who were cheating were thankful for the faulty technology,0,2023-08-03 08:31:28,<praw.models.comment_forest.CommentForest object at 0x000002547C4B46D0>,15gmxcr,nottheonion,t5_2qnts,,False,False,t3_15gmxcr,t1_jujzkjp,/r/nottheonion/comments/15gmxcr/an_asian_woman_asked_ai_to_improve_her_headshot/juldi4m/
456,jukqg63,cardboardrobot55,Lmao come on now I know that company has at least one Asian CS or software engineer they could have consulted on this lmaooooo,Lmao come on now I know that company has at least one Asian CS or software engineer they could have consulted on this lmaooooo,1,2023-08-03 04:09:50,<praw.models.comment_forest.CommentForest object at 0x000002541F85DFA0>,15gmxcr,nottheonion,t5_2qnts,,False,False,t3_15gmxcr,t1_jujzkjp,/r/nottheonion/comments/15gmxcr/an_asian_woman_asked_ai_to_improve_her_headshot/jukqg63/
457,jukvmz7,Ok_Resource_7929,Shifty.,Shifty.,1,2023-08-03 05:01:33,<praw.models.comment_forest.CommentForest object at 0x000002541F85F0D0>,15gmxcr,nottheonion,t5_2qnts,,False,False,t3_15gmxcr,t1_jujzkjp,/r/nottheonion/comments/15gmxcr/an_asian_woman_asked_ai_to_improve_her_headshot/jukvmz7/
458,jukwykw,Educational_Value826,Thats funny.,Thats funny.,1,2023-08-03 05:15:37,<praw.models.comment_forest.CommentForest object at 0x000002541F85F0A0>,15gmxcr,nottheonion,t5_2qnts,,False,False,t3_15gmxcr,t1_jujzkjp,/r/nottheonion/comments/15gmxcr/an_asian_woman_asked_ai_to_improve_her_headshot/jukwykw/
459,jukyilh,ChazJ81,Cheater!,Cheater!,1,2023-08-03 05:32:32,<praw.models.comment_forest.CommentForest object at 0x000002541F85F100>,15gmxcr,nottheonion,t5_2qnts,,False,False,t3_15gmxcr,t1_jujzkjp,/r/nottheonion/comments/15gmxcr/an_asian_woman_asked_ai_to_improve_her_headshot/jukyilh/
460,jul9o79,taipeileviathan,… but were y’all actually looking elsewhere? 🤔,… but were y’all actually looking elsewhere? 🤔,1,2023-08-03 07:43:04,<praw.models.comment_forest.CommentForest object at 0x000002547A61BDF0>,15gmxcr,nottheonion,t5_2qnts,,False,False,t3_15gmxcr,t1_jujzkjp,/r/nottheonion/comments/15gmxcr/an_asian_woman_asked_ai_to_improve_her_headshot/jul9o79/
461,julena4,The_One_Muffin,This reminds me of when I had to renew my UK passport. I did it online through their website and the system kept warning me that my eyes were closed on the photo I uploaded. Thankfully there was an override option and the reason I put was pretty much because I'm Asian and my eyes are just like that.,This reminds me of when I had to renew my UK passport. I did it online through their website and the system kept warning me that my eyes were closed on the photo I uploaded. Thankfully there was an override option and the reason I put was pretty much because I'm Asian and my eyes are just like that.,1,2023-08-03 08:46:12,<praw.models.comment_forest.CommentForest object at 0x000002547A61BB20>,15gmxcr,nottheonion,t5_2qnts,,False,False,t3_15gmxcr,t1_jujzkjp,/r/nottheonion/comments/15gmxcr/an_asian_woman_asked_ai_to_improve_her_headshot/julena4/
462,julhz66,lan60000,Plot twist: it turns out they actually were cheating,Plot twist: it turns out they actually were cheating,1,2023-08-03 09:28:07,<praw.models.comment_forest.CommentForest object at 0x000002547A61BE50>,15gmxcr,nottheonion,t5_2qnts,,False,False,t3_15gmxcr,t1_jujzkjp,/r/nottheonion/comments/15gmxcr/an_asian_woman_asked_ai_to_improve_her_headshot/julhz66/
463,julquqk,eothings,Hahaha amazingly funny,Hahaha amazingly funny,1,2023-08-03 11:08:40,<praw.models.comment_forest.CommentForest object at 0x000002547A61B220>,15gmxcr,nottheonion,t5_2qnts,,False,False,t3_15gmxcr,t1_jujzkjp,/r/nottheonion/comments/15gmxcr/an_asian_woman_asked_ai_to_improve_her_headshot/julquqk/
464,jult900,Donblon_Rebirthed,"I don’t want to state the obvious but ai is racist in multiple ways, and it’s only going to worsen racial disparities in tech.","I don’t want to state the obvious but ai is racist in multiple ways, and it’s only going to worsen racial disparities in tech.",1,2023-08-03 11:32:07,<praw.models.comment_forest.CommentForest object at 0x000002547A61B7C0>,15gmxcr,nottheonion,t5_2qnts,,False,False,t3_15gmxcr,t1_jujzkjp,/r/nottheonion/comments/15gmxcr/an_asian_woman_asked_ai_to_improve_her_headshot/jult900/
465,julylxr,JakefromTRPB,"That was definitely a problem but this is not the same thing. This lady from MIT forgot to use negative prompts, the correct model, LoRa training, or appropriate positive prompting. What you experienced for testing and what this incompetent MIT student experienced when prompting AI is not the same.","That was definitely a problem but this is not the same thing. This lady from MIT forgot to use negative prompts, the correct model, LoRa training, or appropriate positive prompting. What you experienced for testing and what this incompetent MIT student experienced when prompting AI is not the same.",1,2023-08-03 12:19:55,<praw.models.comment_forest.CommentForest object at 0x000002547A61BB50>,15gmxcr,nottheonion,t5_2qnts,,False,False,t3_15gmxcr,t1_jujzkjp,/r/nottheonion/comments/15gmxcr/an_asian_woman_asked_ai_to_improve_her_headshot/julylxr/
466,julzn5y,Felix_Von_Doom,"Mmm...would this happen to have been called LockDown? 

My community college tried to get me to install it... Told them no I'm not when it said you had to give them a room scan. Which is illegal.","Mmm...would this happen to have been called LockDown? 

My community college tried to get me to install it... Told them no I'm not when it said you had to give them a room scan. Which is illegal.",1,2023-08-03 12:28:27,<praw.models.comment_forest.CommentForest object at 0x000002547A61B820>,15gmxcr,nottheonion,t5_2qnts,,False,False,t3_15gmxcr,t1_jujzkjp,/r/nottheonion/comments/15gmxcr/an_asian_woman_asked_ai_to_improve_her_headshot/julzn5y/
467,jum0j2z,SeaPresentation163,"Well the people who tend to dominate tech are white supremacists with guilty consciences.

These are people who believe white people are so superior that ""white privilege"" is the ONLY explaination for any form of success.


Then these people train AI with that bias and are shocked when the AI returns results implying white people are privileged and superior to other races.","Well the people who tend to dominate tech are white supremacists with guilty consciences.

These are people who believe white people are so superior that ""white privilege"" is the ONLY explaination for any form of success.


Then these people train AI with that bias and are shocked when the AI returns results implying white people are privileged and superior to other races.",1,2023-08-03 12:35:37,<praw.models.comment_forest.CommentForest object at 0x000002547A61B7F0>,15gmxcr,nottheonion,t5_2qnts,,False,False,t3_15gmxcr,t1_jujzkjp,/r/nottheonion/comments/15gmxcr/an_asian_woman_asked_ai_to_improve_her_headshot/jum0j2z/
468,jum44c5,ronaldo69messi,i wonder if it would have flagged then if they actually looked away,i wonder if it would have flagged then if they actually looked away,1,2023-08-03 13:03:55,<praw.models.comment_forest.CommentForest object at 0x000002547A61B640>,15gmxcr,nottheonion,t5_2qnts,,False,False,t3_15gmxcr,t1_jujzkjp,/r/nottheonion/comments/15gmxcr/an_asian_woman_asked_ai_to_improve_her_headshot/jum44c5/
469,jum73mc,Taaswaas,Wow! I never thought I'd hear about a racist AI! I bet it tells all the other AI a bunch of uncomfortable jokes until they all tell it to go away.,Wow! I never thought I'd hear about a racist AI! I bet it tells all the other AI a bunch of uncomfortable jokes until they all tell it to go away.,1,2023-08-03 13:26:13,<praw.models.comment_forest.CommentForest object at 0x000002547A61B850>,15gmxcr,nottheonion,t5_2qnts,,False,False,t3_15gmxcr,t1_jujzkjp,/r/nottheonion/comments/15gmxcr/an_asian_woman_asked_ai_to_improve_her_headshot/jum73mc/
470,jumt0dm,Andrew5329,"The thing about ""AI"" is that it's basically pattern recognition that identifies a consensus result from a training set. You could prepare race specific training sets, but that's probably more problematic than a universal algorithm.

The consensus behavior it's probably looking for is when people squint to focus their eyes on something off-camera. Seems pretty logical that people with narrow eyes will have more false positives, the consensus result is based on the average of the training population, which if it matches the demographics of the student population in the US, is going to weight to Caucasian/Latino features.

At the end of the day, it's an imperfect tool, which is why it kicks the actual determination to a Human proctor.","The thing about ""AI"" is that it's basically pattern recognition that identifies a consensus result from a training set. You could prepare race specific training sets, but that's probably more problematic than a universal algorithm.

The consensus behavior it's probably looking for is when people squint to focus their eyes on something off-camera. Seems pretty logical that people with narrow eyes will have more false positives, the consensus result is based on the average of the training population, which if it matches the demographics of the student population in the US, is going to weight to Caucasian/Latino features.

At the end of the day, it's an imperfect tool, which is why it kicks the actual determination to a Human proctor.",1,2023-08-03 15:46:08,<praw.models.comment_forest.CommentForest object at 0x000002547A61BE80>,15gmxcr,nottheonion,t5_2qnts,,False,False,t3_15gmxcr,t1_jujzkjp,/r/nottheonion/comments/15gmxcr/an_asian_woman_asked_ai_to_improve_her_headshot/jumt0dm/
471,jumuf8o,Heathen_Mushroom,"The problem is demographic. Pick 100 people in the US or Europe to calibrate a sensor or AI, and even if you have say, 50% overrepresentation of POC, the data is still going to skew towards Caucasian features because there are just so many Caucasians in these regions of the world.

For proper calibration, you can't simply have a representative sample of the population as a whole (like 100 people with representative proportions of each race, i.e. 13 black people, 7 Asians (2 of whom are South Asian), 10 non-White Hispanics, etc.

You would want to have 100 of *each*.

And then like in OP's case, if you were looking to ""professionalize"" a headshot, you would want to prompt the AI that the subject is east Asian so that it will seek professional looking Asians to modify the headshot rather than the general pool of ""professional looking"" people, which in a Western society with a demographic majority of White people is going to have a high proportion of White faces that the AI, not knowing what OP is looking for, will select data from. Or better yet, teach the AI to determine the race of the person in the source data in the first place.","The problem is demographic. Pick 100 people in the US or Europe to calibrate a sensor or AI, and even if you have say, 50% overrepresentation of POC, the data is still going to skew towards Caucasian features because there are just so many Caucasians in these regions of the world.

For proper calibration, you can't simply have a representative sample of the population as a whole (like 100 people with representative proportions of each race, i.e. 13 black people, 7 Asians (2 of whom are South Asian), 10 non-White Hispanics, etc.

You would want to have 100 of *each*.

And then like in OP's case, if you were looking to ""professionalize"" a headshot, you would want to prompt the AI that the subject is east Asian so that it will seek professional looking Asians to modify the headshot rather than the general pool of ""professional looking"" people, which in a Western society with a demographic majority of White people is going to have a high proportion of White faces that the AI, not knowing what OP is looking for, will select data from. Or better yet, teach the AI to determine the race of the person in the source data in the first place.",1,2023-08-03 15:54:32,<praw.models.comment_forest.CommentForest object at 0x000002547A61B520>,15gmxcr,nottheonion,t5_2qnts,,False,False,t3_15gmxcr,t1_jujzkjp,/r/nottheonion/comments/15gmxcr/an_asian_woman_asked_ai_to_improve_her_headshot/jumuf8o/
472,jumzmkc,psyfren,That's so fucking dystopian,That's so fucking dystopian,1,2023-08-03 16:28:06,<praw.models.comment_forest.CommentForest object at 0x000002547A61BD60>,15gmxcr,nottheonion,t5_2qnts,,False,False,t3_15gmxcr,t1_jujzkjp,/r/nottheonion/comments/15gmxcr/an_asian_woman_asked_ai_to_improve_her_headshot/jumzmkc/
473,jun8ft8,PMMEBITCOINPLZ,"Kind of a low tech example when I worked at the newspaper. Black people would send in pictures for community pages, which were printed in black and white. Then they’d call us and say we darkened their skin because we were racist. It was just how those photos looked after being printed in our press. If they were high quality or professionally shot they looked fine, but low quality snapshots taken with a flash it was going to happen. I think the editors took to lightening them in Photoshop.","Kind of a low tech example when I worked at the newspaper. Black people would send in pictures for community pages, which were printed in black and white. Then they’d call us and say we darkened their skin because we were racist. It was just how those photos looked after being printed in our press. If they were high quality or professionally shot they looked fine, but low quality snapshots taken with a flash it was going to happen. I think the editors took to lightening them in Photoshop.",1,2023-08-03 17:21:27,<praw.models.comment_forest.CommentForest object at 0x000002547A61B2B0>,15gmxcr,nottheonion,t5_2qnts,,False,False,t3_15gmxcr,t1_jujzkjp,/r/nottheonion/comments/15gmxcr/an_asian_woman_asked_ai_to_improve_her_headshot/jun8ft8/
474,jun9t08,WomenAreFemaleWhat,Even if it wasn't racist thats stupid. I stare off to the side when I'm thinking. Or if my eyes need a break from the screen.,Even if it wasn't racist thats stupid. I stare off to the side when I'm thinking. Or if my eyes need a break from the screen.,1,2023-08-03 17:29:25,<praw.models.comment_forest.CommentForest object at 0x000002547A61B430>,15gmxcr,nottheonion,t5_2qnts,,False,False,t3_15gmxcr,t1_jujzkjp,/r/nottheonion/comments/15gmxcr/an_asian_woman_asked_ai_to_improve_her_headshot/jun9t08/
475,junpgtj,mlc885,"Oh my God, that is so much worse than this example. If your AI test software only works for white people then it does not work at all!","Oh my God, that is so much worse than this example. If your AI test software only works for white people then it does not work at all!",1,2023-08-03 19:01:34,<praw.models.comment_forest.CommentForest object at 0x000002547A61B3D0>,15gmxcr,nottheonion,t5_2qnts,,False,False,t3_15gmxcr,t1_jujzkjp,/r/nottheonion/comments/15gmxcr/an_asian_woman_asked_ai_to_improve_her_headshot/junpgtj/
476,junre2w,MinkOfCups,The way my mouth just dropped open—,The way my mouth just dropped open—,1,2023-08-03 19:13:11,<praw.models.comment_forest.CommentForest object at 0x000002547A61B310>,15gmxcr,nottheonion,t5_2qnts,,False,False,t3_15gmxcr,t1_jujzkjp,/r/nottheonion/comments/15gmxcr/an_asian_woman_asked_ai_to_improve_her_headshot/junre2w/
477,juoaln6,TQILA-mockingbird,Jesus H,Jesus H,1,2023-08-03 21:07:51,<praw.models.comment_forest.CommentForest object at 0x000002547A603070>,15gmxcr,nottheonion,t5_2qnts,,False,False,t3_15gmxcr,t1_jujzkjp,/r/nottheonion/comments/15gmxcr/an_asian_woman_asked_ai_to_improve_her_headshot/juoaln6/
478,juobap1,cannibalisticbiscuit,"I have a friend who’s Korean and owns a Tesla. He had to turn off one of the safety functions because it kept going off, claiming he wasn’t looking at the road while driving…","I have a friend who’s Korean and owns a Tesla. He had to turn off one of the safety functions because it kept going off, claiming he wasn’t looking at the road while driving…",1,2023-08-03 21:12:02,<praw.models.comment_forest.CommentForest object at 0x000002547A603040>,15gmxcr,nottheonion,t5_2qnts,,False,False,t3_15gmxcr,t1_jujzkjp,/r/nottheonion/comments/15gmxcr/an_asian_woman_asked_ai_to_improve_her_headshot/juobap1/
479,juov5tz,HackTheNight,That is so incredibly awkward.,That is so incredibly awkward.,1,2023-08-03 23:24:17,<praw.models.comment_forest.CommentForest object at 0x000002547A6030A0>,15gmxcr,nottheonion,t5_2qnts,,False,False,t3_15gmxcr,t1_jujzkjp,/r/nottheonion/comments/15gmxcr/an_asian_woman_asked_ai_to_improve_her_headshot/juov5tz/
480,jup6as1,,[removed],[removed],1,2023-08-04 00:46:06,<praw.models.comment_forest.CommentForest object at 0x000002547A603130>,15gmxcr,nottheonion,t5_2qnts,,False,False,t3_15gmxcr,t1_jujzkjp,/r/nottheonion/comments/15gmxcr/an_asian_woman_asked_ai_to_improve_her_headshot/jup6as1/
481,jurl490,ItsyaboyDa2nd,I knew you guys were always cheating.. /k,I knew you guys were always cheating.. /k,1,2023-08-04 14:36:38,<praw.models.comment_forest.CommentForest object at 0x000002547A603250>,15gmxcr,nottheonion,t5_2qnts,,False,False,t3_15gmxcr,t1_jujzkjp,/r/nottheonion/comments/15gmxcr/an_asian_woman_asked_ai_to_improve_her_headshot/jurl490/
482,jutlz4g,LilG1984,-.- as a fellow Asian our eyes can be hard to see. -.-,-.- as a fellow Asian our eyes can be hard to see. -.-,1,2023-08-04 22:19:42,<praw.models.comment_forest.CommentForest object at 0x000002547A6032E0>,15gmxcr,nottheonion,t5_2qnts,,False,False,t3_15gmxcr,t1_jujzkjp,/r/nottheonion/comments/15gmxcr/an_asian_woman_asked_ai_to_improve_her_headshot/jutlz4g/
483,juuxdto,,[removed],[removed],1,2023-08-05 04:43:40,<praw.models.comment_forest.CommentForest object at 0x000002547A603370>,15gmxcr,nottheonion,t5_2qnts,,False,False,t3_15gmxcr,t1_jujzkjp,/r/nottheonion/comments/15gmxcr/an_asian_woman_asked_ai_to_improve_her_headshot/juuxdto/
484,juvnw7r,sodapop_curtiss,Remember those digital cameras that would tell you when someone blinked? I lived in South Korea when they came out and it always said someone blinked when we took photos with our Korean friends.,Remember those digital cameras that would tell you when someone blinked? I lived in South Korea when they came out and it always said someone blinked when we took photos with our Korean friends.,1,2023-08-05 10:06:16,<praw.models.comment_forest.CommentForest object at 0x000002547A603490>,15gmxcr,nottheonion,t5_2qnts,,False,False,t3_15gmxcr,t1_jujzkjp,/r/nottheonion/comments/15gmxcr/an_asian_woman_asked_ai_to_improve_her_headshot/juvnw7r/
