,ID,Author,body,Comment,Score,Created On,Replies,Submission,Subreddit,Subreddit_ID,Distinguished,Edited,Is_submitter,link_id,Parent_id,Permalink
795,juk47hf,MrWhiteTruffle,"Well, since the woman is American, I’m gonna guess the AI took stock from more American sources

Which are predominantly white","Well, since the woman is American, I’m gonna guess the AI took stock from more American sources

Which are predominantly white",17,2023-08-03 01:13:29,<praw.models.comment_forest.CommentForest object at 0x000002541F69E1F0>,15gmxcr,nottheonion,t5_2qnts,,False,False,t3_15gmxcr,t1_juk2wmc,/r/nottheonion/comments/15gmxcr/an_asian_woman_asked_ai_to_improve_her_headshot/juk47hf/
796,jul9n1j,What_Do_It,"1) China keeps its internet separate from the rest of the world  
2) The dataset is specifically scraped form the English speaking internet which is going to be predominantly from the US, Canada, England, or Australia. If you wanted to use data from China or Japan you'd have to manually tag each image to maintain the dataset's quality. The alternative would be to use an image recognition AI to tag the images or to translate the existing tags associated with the images from their native language. Both would result in a much lower quality dataset.","1) China keeps its internet separate from the rest of the world  
2) The dataset is specifically scraped form the English speaking internet which is going to be predominantly from the US, Canada, England, or Australia. If you wanted to use data from China or Japan you'd have to manually tag each image to maintain the dataset's quality. The alternative would be to use an image recognition AI to tag the images or to translate the existing tags associated with the images from their native language. Both would result in a much lower quality dataset.",2,2023-08-03 07:42:38,<praw.models.comment_forest.CommentForest object at 0x000002541F69E250>,15gmxcr,nottheonion,t5_2qnts,,False,False,t3_15gmxcr,t1_juk2wmc,/r/nottheonion/comments/15gmxcr/an_asian_woman_asked_ai_to_improve_her_headshot/jul9n1j/
797,julb1qn,aDoreVelr,.... China doesn't make up half of the human population.. What the fuck.,.... China doesn't make up half of the human population.. What the fuck.,1,2023-08-03 08:00:18,<praw.models.comment_forest.CommentForest object at 0x000002547C4AEE50>,15gmxcr,nottheonion,t5_2qnts,,False,False,t3_15gmxcr,t1_juk2wmc,/r/nottheonion/comments/15gmxcr/an_asian_woman_asked_ai_to_improve_her_headshot/julb1qn/
798,jum7fd9,throw838028,"She specifically prompted in for ""professional linkedin profile photo.""","She specifically prompted in for ""professional linkedin profile photo.""",1,2023-08-03 13:28:38,<praw.models.comment_forest.CommentForest object at 0x000002541CEB1340>,15gmxcr,nottheonion,t5_2qnts,,False,False,t3_15gmxcr,t1_juk2wmc,/r/nottheonion/comments/15gmxcr/an_asian_woman_asked_ai_to_improve_her_headshot/jum7fd9/
799,julpyie,acathode,"It's not humans being biased that causes a lot of these ""problems"" with AI - it's *reality* being biased.

For example, the vast majority of construction workers are men - hence the vast majority of stock images and other freely available images of construction workers that can be fed into a dataset will be men. Hence, when you ask most AIs to generate an image of ""Construction worker at a construction site"", it will spit out a man. 

Is the AI sexist, was this caused by human bias and unconscious sexism when putting together the dataset? No, of course not. The AI output just reflects the given dataset, and the dataset just reflects reality. This is really not a problem, if you do not want a male construction worker, you can just specify that in the prompt...","It's not humans being biased that causes a lot of these ""problems"" with AI - it's *reality* being biased.

For example, the vast majority of construction workers are men - hence the vast majority of stock images and other freely available images of construction workers that can be fed into a dataset will be men. Hence, when you ask most AIs to generate an image of ""Construction worker at a construction site"", it will spit out a man. 

Is the AI sexist, was this caused by human bias and unconscious sexism when putting together the dataset? No, of course not. The AI output just reflects the given dataset, and the dataset just reflects reality. This is really not a problem, if you do not want a male construction worker, you can just specify that in the prompt...",-1,2023-08-03 10:59:35,<praw.models.comment_forest.CommentForest object at 0x000002547C4917F0>,15gmxcr,nottheonion,t5_2qnts,,False,False,t3_15gmxcr,t1_juk6gv9,/r/nottheonion/comments/15gmxcr/an_asian_woman_asked_ai_to_improve_her_headshot/julpyie/
800,jukm9k2,vierolyn,"Apparently neither a MIT grad nor the person who wrote the article knows what you claim & how ""ai models"" work. Or it would've been mentioned somewhere.","Apparently neither a MIT grad nor the person who wrote the article knows what you claim & how ""ai models"" work. Or it would've been mentioned somewhere.",0,2023-08-03 03:32:15,<praw.models.comment_forest.CommentForest object at 0x000002541F84B940>,15gmxcr,nottheonion,t5_2qnts,,False,False,t3_15gmxcr,t1_jukct7f,/r/nottheonion/comments/15gmxcr/an_asian_woman_asked_ai_to_improve_her_headshot/jukm9k2/
801,jumym9u,MickAtNight,"Right, it did exactly what was asked which was ""Give the girl from the original photo a professional linkedin profile photo"". I'm surprised it didn't just give the student a completely random dude as its output. What a shit prompt, she didn't even ask the AI to modify the uploaded image.... total failure of understanding how AI works","Right, it did exactly what was asked which was ""Give the girl from the original photo a professional linkedin profile photo"". I'm surprised it didn't just give the student a completely random dude as its output. What a shit prompt, she didn't even ask the AI to modify the uploaded image.... total failure of understanding how AI works",1,2023-08-03 16:19:39,<praw.models.comment_forest.CommentForest object at 0x000002541F85D580>,15gmxcr,nottheonion,t5_2qnts,,False,False,t3_15gmxcr,t1_jumoabf,/r/nottheonion/comments/15gmxcr/an_asian_woman_asked_ai_to_improve_her_headshot/jumym9u/
802,jum2myx,_Dreamer_Deceiver_,"You should have to specify ""by the way Im Asian, have black hair, brown eyes""?","You should have to specify ""by the way Im Asian, have black hair, brown eyes""?",2,2023-08-03 12:52:17,<praw.models.comment_forest.CommentForest object at 0x000002541F69E490>,15gmxcr,nottheonion,t5_2qnts,,False,False,t3_15gmxcr,t1_julrikd,/r/nottheonion/comments/15gmxcr/an_asian_woman_asked_ai_to_improve_her_headshot/jum2myx/
803,juryhk1,nhadams2112,"no, shes showing that the tool was made using a bias dataset. That dataset might be random or whatever, but if that gives bias results then that should be accounted for. Datasets need to be diverse","no, shes showing that the tool was made using a bias dataset. That dataset might be random or whatever, but if that gives bias results then that should be accounted for. Datasets need to be diverse",2,2023-08-04 16:00:25,<praw.models.comment_forest.CommentForest object at 0x000002541F69E4F0>,15gmxcr,nottheonion,t5_2qnts,,False,False,t3_15gmxcr,t1_julrikd,/r/nottheonion/comments/15gmxcr/an_asian_woman_asked_ai_to_improve_her_headshot/juryhk1/
804,jupti6f,Tyler_Zoro,"Yeah, she thought she was talking to a chatbot like GPT.","Yeah, she thought she was talking to a chatbot like GPT.",1,2023-08-04 03:50:01,<praw.models.comment_forest.CommentForest object at 0x000002541F66A460>,15gmxcr,nottheonion,t5_2qnts,,False,False,t3_15gmxcr,t1_jul3iir,/r/nottheonion/comments/15gmxcr/an_asian_woman_asked_ai_to_improve_her_headshot/jupti6f/
805,juldjlj,bs000,if i knew i could get this kind of engagement every time i've used an AI and it spit out something stupid or ridiculous like this i would be rich,if i knew i could get this kind of engagement every time i've used an AI and it spit out something stupid or ridiculous like this i would be rich,8,2023-08-03 08:32:00,<praw.models.comment_forest.CommentForest object at 0x000002541F69E730>,15gmxcr,nottheonion,t5_2qnts,,False,False,t3_15gmxcr,t1_jujyfb7,/r/nottheonion/comments/15gmxcr/an_asian_woman_asked_ai_to_improve_her_headshot/juldjlj/
806,jukxcaf,,[deleted],[deleted],11,2023-08-03 05:19:45,<praw.models.comment_forest.CommentForest object at 0x000002541C824070>,15gmxcr,nottheonion,t5_2qnts,,False,False,t3_15gmxcr,t1_juk1p95,/r/nottheonion/comments/15gmxcr/an_asian_woman_asked_ai_to_improve_her_headshot/jukxcaf/
807,juk3gnm,SpaceShipRat,"AI of the current sort is inherently biased because it literally consists of a set of biases: statistical predictions of what something usually looks like. 

Racist is a word for the uses you make of it.","AI of the current sort is inherently biased because it literally consists of a set of biases: statistical predictions of what something usually looks like. 

Racist is a word for the uses you make of it.",4,2023-08-03 01:08:05,<praw.models.comment_forest.CommentForest object at 0x000002541C83C8E0>,15gmxcr,nottheonion,t5_2qnts,,False,False,t3_15gmxcr,t1_juk1p95,/r/nottheonion/comments/15gmxcr/an_asian_woman_asked_ai_to_improve_her_headshot/juk3gnm/
808,jul6vky,acathode,"> I mean, intentionally or not (usually not intentionally) the result is what would be considered racist

No, we have absolutely no idea from just 1 sample if the model have ""racist"" biases.

AI image generators are *very* finicky and can run off in very strange directions, the fact that it generated a white version of her this time could be entirely up to randomness since her prompt was extremely vague and nonspecific. 

If she does this a 1000 times and she gets back a white version almost all the time, that's the point where you start seeing that there are biases in the model - but from just one try you have no clue at all.

Just to give some examples, some AI image gen models are known to skew towards generating South Korean women - because the training data used skewed heavy to pics of female Korean models - but that doesn't mean that you get a South Korean women every time you prompt it for ""a sexy woman in a dress"". 

15 out of 100 times, you might still get a western looking woman, because you didn't specify ethnicity or skin-color, so there's nothing reigning the model in, and it can run away in the direction of all the various pics of ""sexy white women"" it's been trained on.","> I mean, intentionally or not (usually not intentionally) the result is what would be considered racist

No, we have absolutely no idea from just 1 sample if the model have ""racist"" biases.

AI image generators are *very* finicky and can run off in very strange directions, the fact that it generated a white version of her this time could be entirely up to randomness since her prompt was extremely vague and nonspecific. 

If she does this a 1000 times and she gets back a white version almost all the time, that's the point where you start seeing that there are biases in the model - but from just one try you have no clue at all.

Just to give some examples, some AI image gen models are known to skew towards generating South Korean women - because the training data used skewed heavy to pics of female Korean models - but that doesn't mean that you get a South Korean women every time you prompt it for ""a sexy woman in a dress"". 

15 out of 100 times, you might still get a western looking woman, because you didn't specify ethnicity or skin-color, so there's nothing reigning the model in, and it can run away in the direction of all the various pics of ""sexy white women"" it's been trained on.",2,2023-08-03 07:08:59,<praw.models.comment_forest.CommentForest object at 0x000002541C83CF70>,15gmxcr,nottheonion,t5_2qnts,,False,False,t3_15gmxcr,t1_juk1p95,/r/nottheonion/comments/15gmxcr/an_asian_woman_asked_ai_to_improve_her_headshot/jul6vky/
809,jukq64o,AutoModerator,"Sorry, but your account is too new to post.  Your account needs to be either 2 weeks old or have at least 250 combined link and comment karma.  Don't modmail us about this, just wait it out or get more karma.


*I am a bot, and this action was performed automatically. Please [contact the moderators of this subreddit](/message/compose/?to=/r/nottheonion) if you have any questions or concerns.*","Sorry, but your account is too new to post.  Your account needs to be either 2 weeks old or have at least 250 combined link and comment karma.  Don't modmail us about this, just wait it out or get more karma.


*I am a bot, and this action was performed automatically. Please [contact the moderators of this subreddit](/message/compose/?to=/r/nottheonion) if you have any questions or concerns.*",1,2023-08-03 04:07:13,<praw.models.comment_forest.CommentForest object at 0x000002541C83CB50>,15gmxcr,nottheonion,t5_2qnts,moderator,False,False,t3_15gmxcr,t1_jukq61t,/r/nottheonion/comments/15gmxcr/an_asian_woman_asked_ai_to_improve_her_headshot/jukq64o/
810,juloa4g,Cory123125,"What I really love is that reddit hid your comment by default, despite being the only one to knock down the typical right wing ""lets ignore any racism problem unless I agree with it"" (its against white men, or I think it hurts the races I don't like) rhetoric.","What I really love is that reddit hid your comment by default, despite being the only one to knock down the typical right wing ""lets ignore any racism problem unless I agree with it"" (its against white men, or I think it hurts the races I don't like) rhetoric.",-11,2023-08-03 10:41:59,<praw.models.comment_forest.CommentForest object at 0x000002547C4AD400>,15gmxcr,nottheonion,t5_2qnts,,False,False,t3_15gmxcr,t1_jukx5ub,/r/nottheonion/comments/15gmxcr/an_asian_woman_asked_ai_to_improve_her_headshot/juloa4g/
811,jultwes,Donblon_Rebirthed,"It’s funny, because her team is not technically to blame for this. She could have easily blamed it on systematic racism and how our existing datasets are racist, and how then the machine interprets it is biased. And then she could have said that they’re going to look into this and be aware of these racial biases going forward to make their ai not racist. 

So her initial response was a choice.","It’s funny, because her team is not technically to blame for this. She could have easily blamed it on systematic racism and how our existing datasets are racist, and how then the machine interprets it is biased. And then she could have said that they’re going to look into this and be aware of these racial biases going forward to make their ai not racist. 

So her initial response was a choice.",-6,2023-08-03 11:38:16,<praw.models.comment_forest.CommentForest object at 0x000002541F7E9910>,15gmxcr,nottheonion,t5_2qnts,,False,False,t3_15gmxcr,t1_jukx5ub,/r/nottheonion/comments/15gmxcr/an_asian_woman_asked_ai_to_improve_her_headshot/jultwes/
812,jukyj6a,sandhoper,"Guys like this are the reason why I have so much faith in AI now, we're fucked.","Guys like this are the reason why I have so much faith in AI now, we're fucked.",-4,2023-08-03 05:32:42,<praw.models.comment_forest.CommentForest object at 0x000002541ED8D6A0>,15gmxcr,nottheonion,t5_2qnts,,False,False,t3_15gmxcr,t1_jujzwl0,/r/nottheonion/comments/15gmxcr/an_asian_woman_asked_ai_to_improve_her_headshot/jukyj6a/
813,juk3c1k,balancedisbest,"Well... Given that damn near every piece of ""AI"" kit out there has a retry option, and with the *exact same prompt*, give a *different output* based on that. Its almost like these tools are not simply 1+1=2, with exacting repeatable outputs... 

And yes, this is still based on the data they train it on, so you can in fact have two models trained on the same data and they may give different answers or outputs.","Well... Given that damn near every piece of ""AI"" kit out there has a retry option, and with the *exact same prompt*, give a *different output* based on that. Its almost like these tools are not simply 1+1=2, with exacting repeatable outputs... 

And yes, this is still based on the data they train it on, so you can in fact have two models trained on the same data and they may give different answers or outputs.",18,2023-08-03 01:07:09,<praw.models.comment_forest.CommentForest object at 0x000002547A639220>,15gmxcr,nottheonion,t5_2qnts,,False,False,t3_15gmxcr,t1_juk20ub,/r/nottheonion/comments/15gmxcr/an_asian_woman_asked_ai_to_improve_her_headshot/juk3c1k/
814,juk3cis,i_wayyy_over_think,"The method for generating AI images is based on a diffusion process that starts off by taking random noise and based on the prompt iteratively sculpts it into an image. 
One of the most popular applications for this is called “automatic1111”. The icon for choosing the base seed which determines the RNG used to generate the base blurred image is literally a dice. If their AI tool is using img2img under the settings with a high denoising setting then the final transformed image could indeed be very random and highly dependent on the seed. Img2img starts with a base image then slightly blurs it back to noise so it can reinterpret the base image to the new prompt i.e. “professional”If the base image (the photo of the woman) was erased/blurred too much (denoise strength setting is too high) then you can end up with a very different image like an Asian person turning into a white person. In that case you’d need to rerun the img2img several times to know if the AI really does have a bias. But a sample size of 1 would not tell you if there’s a bias there.","The method for generating AI images is based on a diffusion process that starts off by taking random noise and based on the prompt iteratively sculpts it into an image. 
One of the most popular applications for this is called “automatic1111”. The icon for choosing the base seed which determines the RNG used to generate the base blurred image is literally a dice. If their AI tool is using img2img under the settings with a high denoising setting then the final transformed image could indeed be very random and highly dependent on the seed. Img2img starts with a base image then slightly blurs it back to noise so it can reinterpret the base image to the new prompt i.e. “professional”If the base image (the photo of the woman) was erased/blurred too much (denoise strength setting is too high) then you can end up with a very different image like an Asian person turning into a white person. In that case you’d need to rerun the img2img several times to know if the AI really does have a bias. But a sample size of 1 would not tell you if there’s a bias there.",6,2023-08-03 01:07:15,<praw.models.comment_forest.CommentForest object at 0x000002547A611730>,15gmxcr,nottheonion,t5_2qnts,,1691025903.0,False,t3_15gmxcr,t1_juk20ub,/r/nottheonion/comments/15gmxcr/an_asian_woman_asked_ai_to_improve_her_headshot/juk3cis/
815,juk2ozv,BlademasterFlash,"I think they’re trying to say the AI might not always do this, but unless they can show examples to the contrary it’s just empty damage control","I think they’re trying to say the AI might not always do this, but unless they can show examples to the contrary it’s just empty damage control",25,2023-08-03 01:02:30,<praw.models.comment_forest.CommentForest object at 0x000002547A6118E0>,15gmxcr,nottheonion,t5_2qnts,,False,False,t3_15gmxcr,t1_juk20ub,/r/nottheonion/comments/15gmxcr/an_asian_woman_asked_ai_to_improve_her_headshot/juk2ozv/
816,juk4ace,restless_vagabond,"An AI has setting to allow smaller or larger degrees of variation in the output on multiple attempts.  OP also didn't share her prompt or more importantly how many times she re-rolled this prompt to get her very successful ragebait. .  

Tldr: prompt engineering is a thing. So is ragebait.","An AI has setting to allow smaller or larger degrees of variation in the output on multiple attempts.  OP also didn't share her prompt or more importantly how many times she re-rolled this prompt to get her very successful ragebait. .  

Tldr: prompt engineering is a thing. So is ragebait.",12,2023-08-03 01:14:04,<praw.models.comment_forest.CommentForest object at 0x000002547A611940>,15gmxcr,nottheonion,t5_2qnts,,False,False,t3_15gmxcr,t1_juk20ub,/r/nottheonion/comments/15gmxcr/an_asian_woman_asked_ai_to_improve_her_headshot/juk4ace/
817,jukts5w,Feinberg,"The program literally uses a random seed, you nit.","The program literally uses a random seed, you nit.",4,2023-08-03 04:42:25,<praw.models.comment_forest.CommentForest object at 0x000002547A6077C0>,15gmxcr,nottheonion,t5_2qnts,,False,False,t3_15gmxcr,t1_juk20ub,/r/nottheonion/comments/15gmxcr/an_asian_woman_asked_ai_to_improve_her_headshot/jukts5w/
818,jukjhq5,SCtester,"Yes it literally is RNG. Each image generation is based on a particular seed (a string of numbers) that determines the structure of the image that's generated. Seeds are randomly generated for each generation, creating different outputs even if the prompt stays the same. Things like ethnicity will absolutely vary from seed to seed.","Yes it literally is RNG. Each image generation is based on a particular seed (a string of numbers) that determines the structure of the image that's generated. Seeds are randomly generated for each generation, creating different outputs even if the prompt stays the same. Things like ethnicity will absolutely vary from seed to seed.",3,2023-08-03 03:08:33,<praw.models.comment_forest.CommentForest object at 0x000002547A607850>,15gmxcr,nottheonion,t5_2qnts,,False,False,t3_15gmxcr,t1_juk20ub,/r/nottheonion/comments/15gmxcr/an_asian_woman_asked_ai_to_improve_her_headshot/jukjhq5/
819,juk3ls0,eviljelloman,Yeah comparing your supposedly sophisticated algorithm with a random fucking die roll is certainly a weird flex. These AI companies are trash.,Yeah comparing your supposedly sophisticated algorithm with a random fucking die roll is certainly a weird flex. These AI companies are trash.,5,2023-08-03 01:09:06,<praw.models.comment_forest.CommentForest object at 0x000002547A607A00>,15gmxcr,nottheonion,t5_2qnts,,False,False,t3_15gmxcr,t1_juk20ub,/r/nottheonion/comments/15gmxcr/an_asian_woman_asked_ai_to_improve_her_headshot/juk3ls0/
820,jukdt9d,sprint6864,You've pissed off the AI nerds,You've pissed off the AI nerds,-3,2023-08-03 02:24:05,<praw.models.comment_forest.CommentForest object at 0x000002547A607DF0>,15gmxcr,nottheonion,t5_2qnts,,False,False,t3_15gmxcr,t1_juk20ub,/r/nottheonion/comments/15gmxcr/an_asian_woman_asked_ai_to_improve_her_headshot/jukdt9d/
821,juk3tnx,Delta_Lantanoir,"Sorry, but the mistakes are killing me. Die. A die. I can roll a *die* or a can roll 2 or more *dice*. It's like saying you eat with a forks.","Sorry, but the mistakes are killing me. Die. A die. I can roll a *die* or a can roll 2 or more *dice*. It's like saying you eat with a forks.",-6,2023-08-03 01:10:41,<praw.models.comment_forest.CommentForest object at 0x000002547A607F10>,15gmxcr,nottheonion,t5_2qnts,,False,False,t3_15gmxcr,t1_juk20ub,/r/nottheonion/comments/15gmxcr/an_asian_woman_asked_ai_to_improve_her_headshot/juk3tnx/
822,julxvh7,Stormfly,"But we only have 1 roll.

That was his point.

I don't doubt that AI will lean towards the training data, which is probably white people with typically attractive features (wide blue eyes, clear skin, etc) but we'd need a lot more examples before we decided it was racist and not just mistaken. It's given a vague prompt and it just tried to make it look like other pictures with those keywords.","But we only have 1 roll.

That was his point.

I don't doubt that AI will lean towards the training data, which is probably white people with typically attractive features (wide blue eyes, clear skin, etc) but we'd need a lot more examples before we decided it was racist and not just mistaken. It's given a vague prompt and it just tried to make it look like other pictures with those keywords.",5,2023-08-03 12:13:37,<praw.models.comment_forest.CommentForest object at 0x000002541C827220>,15gmxcr,nottheonion,t5_2qnts,,False,False,t3_15gmxcr,t1_jul9xae,/r/nottheonion/comments/15gmxcr/an_asian_woman_asked_ai_to_improve_her_headshot/julxvh7/
823,juncw6s,,You don't think it's important to highlight that racial biases can be and are built into many AI algorithms?,You don't think it's important to highlight that racial biases can be and are built into many AI algorithms?,0,2023-08-03 17:47:30,<praw.models.comment_forest.CommentForest object at 0x000002541ED98730>,15gmxcr,nottheonion,t5_2qnts,,False,False,t3_15gmxcr,t1_julfi0t,/r/nottheonion/comments/15gmxcr/an_asian_woman_asked_ai_to_improve_her_headshot/juncw6s/
824,jumiyn9,Beargit,Both are true. Racism in AI is a real issue that has yet to be solved. Could use a much better example than this one though.,Both are true. Racism in AI is a real issue that has yet to be solved. Could use a much better example than this one though.,8,2023-08-03 14:44:33,<praw.models.comment_forest.CommentForest object at 0x000002541F69EB50>,15gmxcr,nottheonion,t5_2qnts,,False,False,t3_15gmxcr,t1_juktojw,/r/nottheonion/comments/15gmxcr/an_asian_woman_asked_ai_to_improve_her_headshot/jumiyn9/
825,jul8uv6,MetaCommando,Just reduce the denoising strength and mess with the CFG to get what you want,Just reduce the denoising strength and mess with the CFG to get what you want,2,2023-08-03 07:33:02,<praw.models.comment_forest.CommentForest object at 0x000002541F69EBB0>,15gmxcr,nottheonion,t5_2qnts,,False,False,t3_15gmxcr,t1_juktojw,/r/nottheonion/comments/15gmxcr/an_asian_woman_asked_ai_to_improve_her_headshot/jul8uv6/
