,ID,Author,body,Comment,Score,Created On,Replies,Submission,Subreddit,Subreddit_ID,Distinguished,Edited,Is_submitter,link_id,Parent_id,Permalink
89,jobumlp,Sechecopar,"Do you feel the same about all arcs that are not strictly the main story?  


And yeah, maybe the proportion is a bit more than the real world, but rather them overcorrect than ignore the issue wouldn't you agree?  


At the very least overcorrecting the previous discrimination is a trend that is working towards normalising said kinds of characters. That's fine tbh, I can get behind that.   


It just feels a bit disingenous when people say ""they don't mind a bit of LGBTQ"" and then point out how they do mind and are hyper-aware of it.","Do you feel the same about all arcs that are not strictly the main story?  


And yeah, maybe the proportion is a bit more than the real world, but rather them overcorrect than ignore the issue wouldn't you agree?  


At the very least overcorrecting the previous discrimination is a trend that is working towards normalising said kinds of characters. That's fine tbh, I can get behind that.   


It just feels a bit disingenous when people say ""they don't mind a bit of LGBTQ"" and then point out how they do mind and are hyper-aware of it.",2,2023-06-16 08:49:11,<praw.models.comment_forest.CommentForest object at 0x000001BA5DFE09D0>,14aql1t,NetflixBestOf,t5_2ro0h,,False,False,t3_14aql1t,t1_jobt4vz,/r/NetflixBestOf/comments/14aql1t/discussion_is_it_just_me_or_yall_too_think/jobumlp/
90,jofrq6e,CutestGay,Think of all of media of all time. Then the ratio changes.,Think of all of media of all time. Then the ratio changes.,1,2023-06-17 04:57:07,<praw.models.comment_forest.CommentForest object at 0x000001BA5DFE0A90>,14aql1t,NetflixBestOf,t5_2ro0h,,False,False,t3_14aql1t,t1_jobt4vz,/r/NetflixBestOf/comments/14aql1t/discussion_is_it_just_me_or_yall_too_think/jofrq6e/
91,jochinx,NiobeTonks,"It depends where you live and who your friendship group is. Out of my closest friend group, only of 10 2 are straight","It depends where you live and who your friendship group is. Out of my closest friend group, only of 10 2 are straight",7,2023-06-16 13:09:17,<praw.models.comment_forest.CommentForest object at 0x000001BA5DFE0CD0>,14aql1t,NetflixBestOf,t5_2ro0h,,False,False,t3_14aql1t,t1_joc83x5,/r/NetflixBestOf/comments/14aql1t/discussion_is_it_just_me_or_yall_too_think/jochinx/
92,jofrt37,CutestGay,I have maybe three straight friends.,I have maybe three straight friends.,2,2023-06-17 04:58:04,<praw.models.comment_forest.CommentForest object at 0x000001BA5DFE0D90>,14aql1t,NetflixBestOf,t5_2ro0h,,False,False,t3_14aql1t,t1_joc83x5,/r/NetflixBestOf/comments/14aql1t/discussion_is_it_just_me_or_yall_too_think/jofrt37/
93,jocj3ld,starfleetbrat,That actually does mirror real life in some communities.,That actually does mirror real life in some communities.,3,2023-06-16 13:22:17,<praw.models.comment_forest.CommentForest object at 0x000001BA5DFE0DF0>,14aql1t,NetflixBestOf,t5_2ro0h,,False,False,t3_14aql1t,t1_joc83x5,/r/NetflixBestOf/comments/14aql1t/discussion_is_it_just_me_or_yall_too_think/jocj3ld/
94,joydsp7,AkaleoNow,Oh you mean the basic confused point? 😂😂😂,Oh you mean the basic confused point? 😂😂😂,1,2023-06-21 12:45:59,<praw.models.comment_forest.CommentForest object at 0x000001BA5DFE0EB0>,14aql1t,NetflixBestOf,t5_2ro0h,,False,False,t3_14aql1t,t1_joyb8pi,/r/NetflixBestOf/comments/14aql1t/discussion_is_it_just_me_or_yall_too_think/joydsp7/
95,jodtqys,Possible-Company-154,I never claimed you were homophobic. There was a second option and likely more options that I didn't list why you might've misused the word. But how defensive you got is interesting.,I never claimed you were homophobic. There was a second option and likely more options that I didn't list why you might've misused the word. But how defensive you got is interesting.,1,2023-06-16 18:54:41,<praw.models.comment_forest.CommentForest object at 0x000001BA5DFE0670>,14aql1t,NetflixBestOf,t5_2ro0h,,False,False,t3_14aql1t,t1_jocb0e1,/r/NetflixBestOf/comments/14aql1t/discussion_is_it_just_me_or_yall_too_think/jodtqys/
96,jodtai9,Possible-Company-154,"If you don't care about the show whatsoever, then why are you bothered about characters you don't care about being changed?","If you don't care about the show whatsoever, then why are you bothered about characters you don't care about being changed?",2,2023-06-16 18:51:28,<praw.models.comment_forest.CommentForest object at 0x000001BA5DFE0790>,14aql1t,NetflixBestOf,t5_2ro0h,,False,False,t3_14aql1t,t1_jocb2q1,/r/NetflixBestOf/comments/14aql1t/discussion_is_it_just_me_or_yall_too_think/jodtai9/
97,jodsznn,Possible-Company-154,There was nothing sad or worthless about my reply. It's not my fault people misuse words to hide their bigotry.,There was nothing sad or worthless about my reply. It's not my fault people misuse words to hide their bigotry.,1,2023-06-16 18:49:21,<praw.models.comment_forest.CommentForest object at 0x000001BA5DFE08B0>,14aql1t,NetflixBestOf,t5_2ro0h,,False,False,t3_14aql1t,t1_jocgoa8,/r/NetflixBestOf/comments/14aql1t/discussion_is_it_just_me_or_yall_too_think/jodsznn/
98,jodo8gg,FirmBodybuilder2754,Not sure 1 in every 5 young people are LGBTQ. That seems too high to be accurate,Not sure 1 in every 5 young people are LGBTQ. That seems too high to be accurate,3,2023-06-16 18:15:26,<praw.models.comment_forest.CommentForest object at 0x000001BA5DFE0A30>,14aql1t,NetflixBestOf,t5_2ro0h,,False,False,t3_14aql1t,t1_jocf60k,/r/NetflixBestOf/comments/14aql1t/discussion_is_it_just_me_or_yall_too_think/jodo8gg/
99,jobvq41,ghjm,"Perhaps I shouldn't have said the main story.  Most shows have an A and a B plot, and that's not what I'm trying to talk about.

What I mean is that sometimes you have these cases where all the plot and character elements are put on hold, and we have a sex scene and/or LGBTQ pandering scene, that is disjointed from the rest of the story and will have no effect whatsoever on anything that comes after.  It's not unlike a product placement scene, where the characters take a break from their problems to sit around talking about how good Coke is for a minute or two.

Imagine AMC calling up Vince Gilligan during production of Breaking Bad and saying ""we like what you're doing, but you need to make it 20% more gay.  We need two and a half minutes of gayness per episode.""  That's the kind of thing I think most people are objecting to.","Perhaps I shouldn't have said the main story.  Most shows have an A and a B plot, and that's not what I'm trying to talk about.

What I mean is that sometimes you have these cases where all the plot and character elements are put on hold, and we have a sex scene and/or LGBTQ pandering scene, that is disjointed from the rest of the story and will have no effect whatsoever on anything that comes after.  It's not unlike a product placement scene, where the characters take a break from their problems to sit around talking about how good Coke is for a minute or two.

Imagine AMC calling up Vince Gilligan during production of Breaking Bad and saying ""we like what you're doing, but you need to make it 20% more gay.  We need two and a half minutes of gayness per episode.""  That's the kind of thing I think most people are objecting to.",6,2023-06-16 09:05:22,<praw.models.comment_forest.CommentForest object at 0x000001BA5DFE0B50>,14aql1t,NetflixBestOf,t5_2ro0h,,False,False,t3_14aql1t,t1_jobumlp,/r/NetflixBestOf/comments/14aql1t/discussion_is_it_just_me_or_yall_too_think/jobvq41/
100,joyhbsq,Key-Relationship3259,"They’re saying that LGBTQ+ community is being over sexualized in shows for more views and it doesn’t add to the plot of the show at all, and it’s an inaccurate representation of that type of relationship. Tell me they’re wrong. What are you even saying right you sound like an idiot","They’re saying that LGBTQ+ community is being over sexualized in shows for more views and it doesn’t add to the plot of the show at all, and it’s an inaccurate representation of that type of relationship. Tell me they’re wrong. What are you even saying right you sound like an idiot",0,2023-06-21 13:15:31,<praw.models.comment_forest.CommentForest object at 0x000001BA5DFE0F70>,14aql1t,NetflixBestOf,t5_2ro0h,,False,False,t3_14aql1t,t1_joydsp7,/r/NetflixBestOf/comments/14aql1t/discussion_is_it_just_me_or_yall_too_think/joyhbsq/
101,joyhzda,Key-Relationship3259,Have you even watched a lot of those shows nowadays? As someone who is apart of that community we are being over sexualized 100%. They don’t even give us major plots to even root for it’s just like oh they’re fucking again. Like it’s not reality at all,Have you even watched a lot of those shows nowadays? As someone who is apart of that community we are being over sexualized 100%. They don’t even give us major plots to even root for it’s just like oh they’re fucking again. Like it’s not reality at all,1,2023-06-21 13:20:50,<praw.models.comment_forest.CommentForest object at 0x000001BA5DFE0FD0>,14aql1t,NetflixBestOf,t5_2ro0h,,False,False,t3_14aql1t,t1_joydsp7,/r/NetflixBestOf/comments/14aql1t/discussion_is_it_just_me_or_yall_too_think/joyhzda/
102,jodv83u,LeosCool746,Meh I just don’t take peoples shit,Meh I just don’t take peoples shit,0,2023-06-16 19:05:14,<praw.models.comment_forest.CommentForest object at 0x000001BA5DFE0730>,14aql1t,NetflixBestOf,t5_2ro0h,,False,False,t3_14aql1t,t1_jodtqys,/r/NetflixBestOf/comments/14aql1t/discussion_is_it_just_me_or_yall_too_think/jodv83u/
103,jodv4vl,LeosCool746,I’m not you stupid fuck i literally just used it as an example,I’m not you stupid fuck i literally just used it as an example,1,2023-06-16 19:04:35,<praw.models.comment_forest.CommentForest object at 0x000001BA5DFE0850>,14aql1t,NetflixBestOf,t5_2ro0h,,False,False,t3_14aql1t,t1_jodtai9,/r/NetflixBestOf/comments/14aql1t/discussion_is_it_just_me_or_yall_too_think/jodv4vl/
104,joebv3j,MadCatterInAHatter,"Here’s a source:

[https://www.nbcnews.com/news/amp/rcna36147](https://www.nbcnews.com/news/amp/rcna36147)","Here’s a source:

[https://www.nbcnews.com/news/amp/rcna36147](https://www.nbcnews.com/news/amp/rcna36147)",3,2023-06-16 21:03:21,<praw.models.comment_forest.CommentForest object at 0x000001BA5DFE0AF0>,14aql1t,NetflixBestOf,t5_2ro0h,,False,False,t3_14aql1t,t1_jodo8gg,/r/NetflixBestOf/comments/14aql1t/discussion_is_it_just_me_or_yall_too_think/joebv3j/
105,joc9w9s,sruckus,"It shouldn’t be too objected to any more than the extra sex added to each show/movie, especially when the percentage of time real life sex is going on is MUCH less.","It shouldn’t be too objected to any more than the extra sex added to each show/movie, especially when the percentage of time real life sex is going on is MUCH less.",0,2023-06-16 12:00:13,<praw.models.comment_forest.CommentForest object at 0x000001BA5DFE0C70>,14aql1t,NetflixBestOf,t5_2ro0h,,False,False,t3_14aql1t,t1_jobvq41,/r/NetflixBestOf/comments/14aql1t/discussion_is_it_just_me_or_yall_too_think/joc9w9s/
106,joyoii7,AkaleoNow,Thanks for your Cliff Notes version. That’s not what was in the post so go take a shit in the ocean.,Thanks for your Cliff Notes version. That’s not what was in the post so go take a shit in the ocean.,1,2023-06-21 14:10:44,<praw.models.comment_forest.CommentForest object at 0x000001BA5DFEC070>,14aql1t,NetflixBestOf,t5_2ro0h,,False,False,t3_14aql1t,t1_joyhbsq,/r/NetflixBestOf/comments/14aql1t/discussion_is_it_just_me_or_yall_too_think/joyoii7/
107,joyo8i8,AkaleoNow,"Television isn’t going to reflect reality ever, nor should it. My statement about mirroring reality was a way of saying that representation matters and that gay characters in shows don’t really need to be justified simply because people think there are too many. Everything on tv and movies is hypersexualized. It’s dull and lazy storytelling, but I digress because that’s an entirely different point.","Television isn’t going to reflect reality ever, nor should it. My statement about mirroring reality was a way of saying that representation matters and that gay characters in shows don’t really need to be justified simply because people think there are too many. Everything on tv and movies is hypersexualized. It’s dull and lazy storytelling, but I digress because that’s an entirely different point.",1,2023-06-21 14:08:43,<praw.models.comment_forest.CommentForest object at 0x000001BA5DFEC130>,14aql1t,NetflixBestOf,t5_2ro0h,,False,False,t3_14aql1t,t1_joyhzda,/r/NetflixBestOf/comments/14aql1t/discussion_is_it_just_me_or_yall_too_think/joyo8i8/
108,joiyk40,FirmBodybuilder2754,Not sure that's the most accurate of sources. Also it's only referring to the USA. Although admittedly the OP post is mostly about American TV shows. Still doesn't ring true for me though. But hey in defence of your argument I will admit I've not run my own personal scoreboard,Not sure that's the most accurate of sources. Also it's only referring to the USA. Although admittedly the OP post is mostly about American TV shows. Still doesn't ring true for me though. But hey in defence of your argument I will admit I've not run my own personal scoreboard,2,2023-06-17 23:30:53,<praw.models.comment_forest.CommentForest object at 0x000001BA5DFE0BB0>,14aql1t,NetflixBestOf,t5_2ro0h,,False,False,t3_14aql1t,t1_joebv3j,/r/NetflixBestOf/comments/14aql1t/discussion_is_it_just_me_or_yall_too_think/joiyk40/
109,jodxaa1,ghjm,"Yes, which is why I'm objecting to both, the same amount.","Yes, which is why I'm objecting to both, the same amount.",0,2023-06-16 19:19:40,<praw.models.comment_forest.CommentForest object at 0x000001BA5DFE0D30>,14aql1t,NetflixBestOf,t5_2ro0h,,False,False,t3_14aql1t,t1_joc9w9s,/r/NetflixBestOf/comments/14aql1t/discussion_is_it_just_me_or_yall_too_think/jodxaa1/
110,k4j7ym2,Redscream667,"Except it has and does on multiple occassions reflect parts of reality, it may exagerate the representation but it's still a representation.","Except it has and does on multiple occassions reflect parts of reality, it may exagerate the representation but it's still a representation.",0,2023-10-12 07:40:01,<praw.models.comment_forest.CommentForest object at 0x000001BA5DFEC1F0>,14aql1t,NetflixBestOf,t5_2ro0h,,False,False,t3_14aql1t,t1_joyo8i8,/r/NetflixBestOf/comments/14aql1t/discussion_is_it_just_me_or_yall_too_think/k4j7ym2/
