,ID,Author,body,Comment,Score,Created On,Replies,Submission,Subreddit,Subreddit_ID,Distinguished,Edited,Is_submitter,link_id,Parent_id,Permalink
59,fdccnwt,,To who?  The mods here have been asleep for years.,To who?  The mods here have been asleep for years.,5,2020-01-06 00:48:10,<praw.models.comment_forest.CommentForest object at 0x000001BA5D6F9DF0>,ekgyeg,NetflixBestOf,t5_2ro0h,,False,False,t3_ekgyeg,t1_fdc1d5r,/r/NetflixBestOf/comments/ekgyeg/meta_i_ranked_netflix_films_available_in_the_us/fdccnwt/
60,fdeqi0c,PooPooDooDoo,Good question. Guess they can remove it a few years from now?,Good question. Guess they can remove it a few years from now?,1,2020-01-06 21:01:36,<praw.models.comment_forest.CommentForest object at 0x000001BA5D6F9EB0>,ekgyeg,NetflixBestOf,t5_2ro0h,,False,False,t3_ekgyeg,t1_fdccnwt,/r/NetflixBestOf/comments/ekgyeg/meta_i_ranked_netflix_films_available_in_the_us/fdeqi0c/
61,jocd8c9,monsterosaleviosa,Do you think that media generally has too many plot lines involving relationships and sex?,Do you think that media generally has too many plot lines involving relationships and sex?,19,2023-06-16 12:31:52,<praw.models.comment_forest.CommentForest object at 0x000001BA5DFF3FD0>,14aql1t,NetflixBestOf,t5_2ro0h,,False,False,t3_14aql1t,t3_14aql1t,/r/NetflixBestOf/comments/14aql1t/discussion_is_it_just_me_or_yall_too_think/jocd8c9/
62,jobtb1h,Fantastic_Puppeter,"Let's go back to general good practices of writing (for TV, movies, novels, etc.): details should serve the story.

If Bob's sexual preferences do not matter for the narrative, I see no problem mentioning that he is gay, or straight, or bi, or... as a quick aside.  This can enrich the character and add a touch or realism.  Nothing wrong with that. The writer should just not spend too much time on it and it should come naturally in the story.

If the fact that Jenny is bi matters to the story, then I expect that is *does* matter. Are we in a romantic comedy and Jenny must decide between Bob  and Barb? Are we in a drama and Jenny is a manipulative bi\*\*\* using sex as a tool? Are we far in the future and mores have changed and everyone is bi now?

Edit: Please note that the above applies if / when the writer states explicitly that a character is straight.

Edit 2: All I'm saying really is that good writing will make any mention of a character's sexual orientation a ""natural"" part of the narrative. Clumsy writing will make it, well, clumsy.","Let's go back to general good practices of writing (for TV, movies, novels, etc.): details should serve the story.

If Bob's sexual preferences do not matter for the narrative, I see no problem mentioning that he is gay, or straight, or bi, or... as a quick aside.  This can enrich the character and add a touch or realism.  Nothing wrong with that. The writer should just not spend too much time on it and it should come naturally in the story.

If the fact that Jenny is bi matters to the story, then I expect that is *does* matter. Are we in a romantic comedy and Jenny must decide between Bob  and Barb? Are we in a drama and Jenny is a manipulative bi\*\*\* using sex as a tool? Are we far in the future and mores have changed and everyone is bi now?

Edit: Please note that the above applies if / when the writer states explicitly that a character is straight.

Edit 2: All I'm saying really is that good writing will make any mention of a character's sexual orientation a ""natural"" part of the narrative. Clumsy writing will make it, well, clumsy.",18,2023-06-16 08:29:37,<praw.models.comment_forest.CommentForest object at 0x000001BA5DFE0070>,14aql1t,NetflixBestOf,t5_2ro0h,,1686924453.0,False,t3_14aql1t,t3_14aql1t,/r/NetflixBestOf/comments/14aql1t/discussion_is_it_just_me_or_yall_too_think/jobtb1h/
63,jocj2ah,Nemineminini,My dude ..  queer people do not exist to advance the plot,My dude ..  queer people do not exist to advance the plot,18,2023-06-16 13:22:00,<praw.models.comment_forest.CommentForest object at 0x000001BA5DFE0130>,14aql1t,NetflixBestOf,t5_2ro0h,,False,False,t3_14aql1t,t3_14aql1t,/r/NetflixBestOf/comments/14aql1t/discussion_is_it_just_me_or_yall_too_think/jocj2ah/
64,jocjee8,Nemineminini,Is it just me or y'all too think Netflix (and literally any other media) is showing toooo much of the straight couple and it doesn't even add up any value to the story...,Is it just me or y'all too think Netflix (and literally any other media) is showing toooo much of the straight couple and it doesn't even add up any value to the story...,23,2023-06-16 13:24:45,<praw.models.comment_forest.CommentForest object at 0x000001BA5DFE0190>,14aql1t,NetflixBestOf,t5_2ro0h,,False,False,t3_14aql1t,t3_14aql1t,/r/NetflixBestOf/comments/14aql1t/discussion_is_it_just_me_or_yall_too_think/jocjee8/
65,jogoes3,Diligent_Dharma_1086,Just give it time; LGBTQ+ is the current media cause celebre and all of the major players are scrambling to capitalize on it before another distraction comes along.,Just give it time; LGBTQ+ is the current media cause celebre and all of the major players are scrambling to capitalize on it before another distraction comes along.,5,2023-06-17 12:20:11,<praw.models.comment_forest.CommentForest object at 0x000001BA5DFE0250>,14aql1t,NetflixBestOf,t5_2ro0h,,False,False,t3_14aql1t,t3_14aql1t,/r/NetflixBestOf/comments/14aql1t/discussion_is_it_just_me_or_yall_too_think/jogoes3/
66,jobx4le,simlew86,Is it not just to show that LGBTQ+ people exist in the world? Same deal with including people who aren’t white. Their sexuality shouldn’t have to exist only as a plot device.,Is it not just to show that LGBTQ+ people exist in the world? Same deal with including people who aren’t white. Their sexuality shouldn’t have to exist only as a plot device.,22,2023-06-16 09:26:12,<praw.models.comment_forest.CommentForest object at 0x000001BA5DFE0310>,14aql1t,NetflixBestOf,t5_2ro0h,,False,False,t3_14aql1t,t3_14aql1t,/r/NetflixBestOf/comments/14aql1t/discussion_is_it_just_me_or_yall_too_think/jobx4le/
67,joc2u19,LeosCool746,I believe the word that you’re trying to find is forced representation sadly yes it happens a lot like do you remember the new Scooby Doo thing? It didn’t need to have so many changes and that’s why so many people didn’t like it,I believe the word that you’re trying to find is forced representation sadly yes it happens a lot like do you remember the new Scooby Doo thing? It didn’t need to have so many changes and that’s why so many people didn’t like it,10,2023-06-16 10:43:22,<praw.models.comment_forest.CommentForest object at 0x000001BA5DFE0370>,14aql1t,NetflixBestOf,t5_2ro0h,,False,False,t3_14aql1t,t3_14aql1t,/r/NetflixBestOf/comments/14aql1t/discussion_is_it_just_me_or_yall_too_think/joc2u19/
68,jobru2z,AkaleoNow,"It’s just you thinking that LGBTQ+ characters can’t exist simply for the sake of mirroring real life. The way you describe it, LGBTQ+ characters must exist only to move the story along. Try flipping your question and check for your own bias. Like this: “Do you think Netflix is showing too many straight characters that aren’t central to the story? It’s like they’re adding unnecessary punchlines.”","It’s just you thinking that LGBTQ+ characters can’t exist simply for the sake of mirroring real life. The way you describe it, LGBTQ+ characters must exist only to move the story along. Try flipping your question and check for your own bias. Like this: “Do you think Netflix is showing too many straight characters that aren’t central to the story? It’s like they’re adding unnecessary punchlines.”",21,2023-06-16 08:08:16,<praw.models.comment_forest.CommentForest object at 0x000001BA5DFE0430>,14aql1t,NetflixBestOf,t5_2ro0h,,False,False,t3_14aql1t,t3_14aql1t,/r/NetflixBestOf/comments/14aql1t/discussion_is_it_just_me_or_yall_too_think/jobru2z/
69,joi0zi1,Realistic_Seesaw5671,I agree honestly there's no issue making lgbtq+ a normal things in shows i have no issue with that. Or even if the character has a arc where it makes sense like in Sabrina. My issue is when they make their whole personality them being lgbtq+ if its a part of their character cool im down with that but if its their only character trait its just bad writing and trying to check a box to apeal to teens. I honestly don't know why people get so triggered over this topic i thought it was pretty widely known that shows most of the time are writing these from a straight white man personal view and basically only characterize them with stereotypes. A lot of the time that should be more offensive then just saying lgbtq+ are over represented,I agree honestly there's no issue making lgbtq+ a normal things in shows i have no issue with that. Or even if the character has a arc where it makes sense like in Sabrina. My issue is when they make their whole personality them being lgbtq+ if its a part of their character cool im down with that but if its their only character trait its just bad writing and trying to check a box to apeal to teens. I honestly don't know why people get so triggered over this topic i thought it was pretty widely known that shows most of the time are writing these from a straight white man personal view and basically only characterize them with stereotypes. A lot of the time that should be more offensive then just saying lgbtq+ are over represented,2,2023-06-17 18:59:59,<praw.models.comment_forest.CommentForest object at 0x000001BA5DFE0550>,14aql1t,NetflixBestOf,t5_2ro0h,,False,False,t3_14aql1t,t3_14aql1t,/r/NetflixBestOf/comments/14aql1t/discussion_is_it_just_me_or_yall_too_think/joi0zi1/
70,joc7zrs,Pascalwb,"Yea, if the shows were good it would be maybe ok, but they are not even good. But it is so weird when the show has like 10 characters and each has different orientation, skin color and gender. Like how unrealistic do they want it to be?","Yea, if the shows were good it would be maybe ok, but they are not even good. But it is so weird when the show has like 10 characters and each has different orientation, skin color and gender. Like how unrealistic do they want it to be?",0,2023-06-16 11:41:14,<praw.models.comment_forest.CommentForest object at 0x000001BA5DFE0E50>,14aql1t,NetflixBestOf,t5_2ro0h,,False,False,t3_14aql1t,t3_14aql1t,/r/NetflixBestOf/comments/14aql1t/discussion_is_it_just_me_or_yall_too_think/joc7zrs/
71,jocujhg,Ok_Emergency_1765,They forcing it at this point man I'm not homophobic but i will always love women,They forcing it at this point man I'm not homophobic but i will always love women,-3,2023-06-16 14:48:32,<praw.models.comment_forest.CommentForest object at 0x000001BA5DFE0F10>,14aql1t,NetflixBestOf,t5_2ro0h,,False,False,t3_14aql1t,t3_14aql1t,/r/NetflixBestOf/comments/14aql1t/discussion_is_it_just_me_or_yall_too_think/jocujhg/
72,joe86vn,ThrowmerSimpson,"I’m significantly more offended at how many Netflix films contain Adam Sandler, Kevin James and David Spade but then again, I guess unfunny people also need representation…","I’m significantly more offended at how many Netflix films contain Adam Sandler, Kevin James and David Spade but then again, I guess unfunny people also need representation…",1,2023-06-16 20:36:57,<praw.models.comment_forest.CommentForest object at 0x000001BA5DFEC0D0>,14aql1t,NetflixBestOf,t5_2ro0h,,False,False,t3_14aql1t,t3_14aql1t,/r/NetflixBestOf/comments/14aql1t/discussion_is_it_just_me_or_yall_too_think/joe86vn/
73,jojkpaq,JuDaddy,Netflix has gone full woke. Where’ve you been? After the last seasons of cobra Kai and Stranger things Netflix is going bye bye.,Netflix has gone full woke. Where’ve you been? After the last seasons of cobra Kai and Stranger things Netflix is going bye bye.,1,2023-06-18 02:54:02,<praw.models.comment_forest.CommentForest object at 0x000001BA5DFEC250>,14aql1t,NetflixBestOf,t5_2ro0h,,False,False,t3_14aql1t,t3_14aql1t,/r/NetflixBestOf/comments/14aql1t/discussion_is_it_just_me_or_yall_too_think/jojkpaq/
74,k057vve,Amazing-Toe-8896,"The issue is when shows use 'sex' or 'gender' as part of the main story with horrible writing.  Its an excuse for writers to call you a homophobe or sexist when their shows get poor ratings for an overall bad show. They make characters who are not straight or are trans, but completely forget the fact that they are human beings and have personalities. This is not just happening for Netflix shows, but also for Disney + shows and others. This is how Disney botched the Star Wars series. They put in Rey who was essentially just a Mary Sue with no personality and called you a sexist for disliking the movies for that very reason.

&#x200B;

Now look at the Last of Us show, Bill and Frank are depicted as gay characters and there is also a sex scene between them.  But that didnt bother me. Why? Because they were good written characters and the chemistry showcased between them were some of my favourite moments in  the show.

&#x200B;

(Now, to me, sex scenes regardless of whether you are straight or not are completely unnecessary in movies and shows. Like, there is no point, mostly just fan service because these sex scenes are  visually shown with thrusting and moaning, like, just show them lying in bed, all of us can understand they had sex, if I wanted to watch pOrN, I would've went to the hub. It completely takes away from the immersion. But that's a debate to be had another time.)","The issue is when shows use 'sex' or 'gender' as part of the main story with horrible writing.  Its an excuse for writers to call you a homophobe or sexist when their shows get poor ratings for an overall bad show. They make characters who are not straight or are trans, but completely forget the fact that they are human beings and have personalities. This is not just happening for Netflix shows, but also for Disney + shows and others. This is how Disney botched the Star Wars series. They put in Rey who was essentially just a Mary Sue with no personality and called you a sexist for disliking the movies for that very reason.

&#x200B;

Now look at the Last of Us show, Bill and Frank are depicted as gay characters and there is also a sex scene between them.  But that didnt bother me. Why? Because they were good written characters and the chemistry showcased between them were some of my favourite moments in  the show.

&#x200B;

(Now, to me, sex scenes regardless of whether you are straight or not are completely unnecessary in movies and shows. Like, there is no point, mostly just fan service because these sex scenes are  visually shown with thrusting and moaning, like, just show them lying in bed, all of us can understand they had sex, if I wanted to watch pOrN, I would've went to the hub. It completely takes away from the immersion. But that's a debate to be had another time.)",1,2023-09-11 18:27:53,<praw.models.comment_forest.CommentForest object at 0x000001BA5DFEC2B0>,14aql1t,NetflixBestOf,t5_2ro0h,,False,False,t3_14aql1t,t3_14aql1t,/r/NetflixBestOf/comments/14aql1t/discussion_is_it_just_me_or_yall_too_think/k057vve/
75,k432s4i,Party_Choice2479,"Ikr, and before this, Nexflix used to over romance a bunch of stuff with straight characters and it also didn't do much for the story. Suddenly, now it's a big deal tho","Ikr, and before this, Nexflix used to over romance a bunch of stuff with straight characters and it also didn't do much for the story. Suddenly, now it's a big deal tho",1,2023-10-09 03:33:24,<praw.models.comment_forest.CommentForest object at 0x000001BA5DFE00D0>,14aql1t,NetflixBestOf,t5_2ro0h,,False,False,t3_14aql1t,t1_jocd8c9,/r/NetflixBestOf/comments/14aql1t/discussion_is_it_just_me_or_yall_too_think/k432s4i/
76,jodsupl,chrisk365,"In their minds, some of them do. *sips tea*","In their minds, some of them do. *sips tea*",4,2023-06-16 18:48:23,<praw.models.comment_forest.CommentForest object at 0x000001BA5DFE01F0>,14aql1t,NetflixBestOf,t5_2ro0h,,False,False,t3_14aql1t,t1_jocj2ah,/r/NetflixBestOf/comments/14aql1t/discussion_is_it_just_me_or_yall_too_think/jodsupl/
77,jog2fp5,Flanelman2,"I'm straight and I do. I'm sick of seeing people in love, I just wanna see people sending it on extreme water slides or something. Gimmie something relatable, you know?","I'm straight and I do. I'm sick of seeing people in love, I just wanna see people sending it on extreme water slides or something. Gimmie something relatable, you know?",4,2023-06-17 07:16:54,<praw.models.comment_forest.CommentForest object at 0x000001BA5DFE02B0>,14aql1t,NetflixBestOf,t5_2ro0h,,False,False,t3_14aql1t,t1_jocjee8,/r/NetflixBestOf/comments/14aql1t/discussion_is_it_just_me_or_yall_too_think/jog2fp5/
78,joi1fyg,Realistic_Seesaw5671,I agree it doesn't have to be a plot device but it should NOT be their only character trait imo thats just bad writing and that might be what the main poster was mainly tryna get at a lot of the time its not to show that they exist its mainly cause teens are usually more progressive so if a show targets that demographic they basically always have a token lgbtq+ character and usually the writers have no personal experience with the lgbtq+ scene and kind of just rely on stereotypes,I agree it doesn't have to be a plot device but it should NOT be their only character trait imo thats just bad writing and that might be what the main poster was mainly tryna get at a lot of the time its not to show that they exist its mainly cause teens are usually more progressive so if a show targets that demographic they basically always have a token lgbtq+ character and usually the writers have no personal experience with the lgbtq+ scene and kind of just rely on stereotypes,2,2023-06-17 19:03:34,<praw.models.comment_forest.CommentForest object at 0x000001BA5DFE03D0>,14aql1t,NetflixBestOf,t5_2ro0h,,1687028802.0,False,t3_14aql1t,t1_jobx4le,/r/NetflixBestOf/comments/14aql1t/discussion_is_it_just_me_or_yall_too_think/joi1fyg/
79,jocqo9p,SableyeEyeThief,"I’m Puerto Rican and I HATE token latinos/Puerto Ricans. Don’t get me wrong, representation is nice and you do feel as if you could relate with certain characters which is great! The problem is when they overdo it. Some roles do feel very forced and I hate that. Also, I like characters being created with us in mind. For example, if you’re having a Puerto Rican super hero then create him as such or transition into him as you would with Miles Morales in Spiderman. But when Captain America is out of the blue Captain Puerto Rico I find that lazy.","I’m Puerto Rican and I HATE token latinos/Puerto Ricans. Don’t get me wrong, representation is nice and you do feel as if you could relate with certain characters which is great! The problem is when they overdo it. Some roles do feel very forced and I hate that. Also, I like characters being created with us in mind. For example, if you’re having a Puerto Rican super hero then create him as such or transition into him as you would with Miles Morales in Spiderman. But when Captain America is out of the blue Captain Puerto Rico I find that lazy.",5,2023-06-16 14:20:40,<praw.models.comment_forest.CommentForest object at 0x000001BA5DFE0490>,14aql1t,NetflixBestOf,t5_2ro0h,,False,False,t3_14aql1t,t1_joc2u19,/r/NetflixBestOf/comments/14aql1t/discussion_is_it_just_me_or_yall_too_think/jocqo9p/
80,joc636a,Possible-Company-154,"The meaning behind forced representation is when diversity is misused. Like, for example, the Anne Boleyn series where they cast a black actress. Or if they made a historical figure gay or bisexual when they weren't.

People much like yourself who're using the term because you're annoyed LGBTQ+ and POC people are being represented, or they changed something about a character/show you liked, are clouding the real meaning behind it.","The meaning behind forced representation is when diversity is misused. Like, for example, the Anne Boleyn series where they cast a black actress. Or if they made a historical figure gay or bisexual when they weren't.

People much like yourself who're using the term because you're annoyed LGBTQ+ and POC people are being represented, or they changed something about a character/show you liked, are clouding the real meaning behind it.",-11,2023-06-16 11:20:55,<praw.models.comment_forest.CommentForest object at 0x000001BA5DFE04F0>,14aql1t,NetflixBestOf,t5_2ro0h,,False,False,t3_14aql1t,t1_joc2u19,/r/NetflixBestOf/comments/14aql1t/discussion_is_it_just_me_or_yall_too_think/joc636a/
81,jobt4vz,ghjm,"If TV were mirroring real life, then about 7% of the characters would be LGBTQ.  It does feel to me like the percentage on Netflix is considerably higher than that.  There's definitely some pandering going on.  Which is fine, until it gets to the point of stopping the main story to have an LGBTQ interlude.  And before you ask, yes, I feel the same way about hetero sex scenes that don't advance the plot.","If TV were mirroring real life, then about 7% of the characters would be LGBTQ.  It does feel to me like the percentage on Netflix is considerably higher than that.  There's definitely some pandering going on.  Which is fine, until it gets to the point of stopping the main story to have an LGBTQ interlude.  And before you ask, yes, I feel the same way about hetero sex scenes that don't advance the plot.",12,2023-06-16 08:27:05,<praw.models.comment_forest.CommentForest object at 0x000001BA5DFE07F0>,14aql1t,NetflixBestOf,t5_2ro0h,,False,False,t3_14aql1t,t1_jobru2z,/r/NetflixBestOf/comments/14aql1t/discussion_is_it_just_me_or_yall_too_think/jobt4vz/
82,joc83x5,Pascalwb,But it does not really mirror real life. If out of 10 characters 7 are lgbt.,But it does not really mirror real life. If out of 10 characters 7 are lgbt.,3,2023-06-16 11:42:26,<praw.models.comment_forest.CommentForest object at 0x000001BA5DFE0910>,14aql1t,NetflixBestOf,t5_2ro0h,,False,False,t3_14aql1t,t1_jobru2z,/r/NetflixBestOf/comments/14aql1t/discussion_is_it_just_me_or_yall_too_think/joc83x5/
83,joyb8pi,Key-Relationship3259,I think you missed their point lmaoo,I think you missed their point lmaoo,0,2023-06-21 12:23:24,<praw.models.comment_forest.CommentForest object at 0x000001BA5DFE0C10>,14aql1t,NetflixBestOf,t5_2ro0h,,False,False,t3_14aql1t,t1_jobru2z,/r/NetflixBestOf/comments/14aql1t/discussion_is_it_just_me_or_yall_too_think/joyb8pi/
84,k4j8062,Redscream667,Weird to get downvoted for saying this,Weird to get downvoted for saying this,1,2023-10-12 07:40:36,<praw.models.comment_forest.CommentForest object at 0x000001BA5DFEC190>,14aql1t,NetflixBestOf,t5_2ro0h,,False,False,t3_14aql1t,t1_jocujhg,/r/NetflixBestOf/comments/14aql1t/discussion_is_it_just_me_or_yall_too_think/k4j8062/
85,jocb0e1,LeosCool746,"Whoa, do not fucking come after me. I am not homophobic in anyway I’m sorry I accidentally miss used a fucking word don’t call me homophobic","Whoa, do not fucking come after me. I am not homophobic in anyway I’m sorry I accidentally miss used a fucking word don’t call me homophobic",9,2023-06-16 12:10:56,<praw.models.comment_forest.CommentForest object at 0x000001BA5DFE05B0>,14aql1t,NetflixBestOf,t5_2ro0h,,False,False,t3_14aql1t,t1_joc636a,/r/NetflixBestOf/comments/14aql1t/discussion_is_it_just_me_or_yall_too_think/jocb0e1/
86,jocb2q1,LeosCool746,"Also, I do not care about the fucking shows whatsoever. I’m just using it as an example, because many people seemed uncomfortable with said show about sad topic.","Also, I do not care about the fucking shows whatsoever. I’m just using it as an example, because many people seemed uncomfortable with said show about sad topic.",5,2023-06-16 12:11:32,<praw.models.comment_forest.CommentForest object at 0x000001BA5DFE0610>,14aql1t,NetflixBestOf,t5_2ro0h,,False,False,t3_14aql1t,t1_joc636a,/r/NetflixBestOf/comments/14aql1t/discussion_is_it_just_me_or_yall_too_think/jocb2q1/
87,jocgoa8,Still-Air6938,What a sad and completely worthless reply.  You’re the type of person that makes this kind of stuff worse,What a sad and completely worthless reply.  You’re the type of person that makes this kind of stuff worse,-1,2023-06-16 13:02:13,<praw.models.comment_forest.CommentForest object at 0x000001BA5DFE06D0>,14aql1t,NetflixBestOf,t5_2ro0h,,False,False,t3_14aql1t,t1_joc636a,/r/NetflixBestOf/comments/14aql1t/discussion_is_it_just_me_or_yall_too_think/jocgoa8/
88,jocf60k,MadCatterInAHatter,"Also, the proportion of people who are LGBTQ is significantly higher among young people (about 20%). A lot of shows focus on young people so it makes sense to represent this part of their identity","Also, the proportion of people who are LGBTQ is significantly higher among young people (about 20%). A lot of shows focus on young people so it makes sense to represent this part of their identity",10,2023-06-16 12:49:16,<praw.models.comment_forest.CommentForest object at 0x000001BA5DFE0970>,14aql1t,NetflixBestOf,t5_2ro0h,,False,False,t3_14aql1t,t1_jobt4vz,/r/NetflixBestOf/comments/14aql1t/discussion_is_it_just_me_or_yall_too_think/jocf60k/
