,ID,Author,body,Comment,Score,Created On,Replies,Submission,Subreddit,Subreddit_ID,Distinguished,Edited,Is_submitter,link_id,Parent_id,Permalink
0,fdc5hfs,vvv561,"> Last Updated: February 21, 2016","> Last Updated: February 21, 2016",80,2020-01-05 23:38:09,<praw.models.comment_forest.CommentForest object at 0x000001BA5D6F96D0>,ekgyeg,NetflixBestOf,t5_2ro0h,,False,False,t3_ekgyeg,t3_ekgyeg,/r/NetflixBestOf/comments/ekgyeg/meta_i_ranked_netflix_films_available_in_the_us/fdc5hfs/
1,fdbce3f,mrtwr18,Too bad half of these aren't available in the US currently.   Thanks for verifying the 2016 vs now OP...,Too bad half of these aren't available in the US currently.   Thanks for verifying the 2016 vs now OP...,285,2020-01-05 20:25:54,<praw.models.comment_forest.CommentForest object at 0x000001BA5D6F97C0>,ekgyeg,NetflixBestOf,t5_2ro0h,,False,False,t3_ekgyeg,t3_ekgyeg,/r/NetflixBestOf/comments/ekgyeg/meta_i_ranked_netflix_films_available_in_the_us/fdbce3f/
2,fdbmlts,Maessttrro,What kind of fucking cancer is that link you posted?,What kind of fucking cancer is that link you posted?,99,2020-01-05 21:14:12,<praw.models.comment_forest.CommentForest object at 0x000001BA5D6F9850>,ekgyeg,NetflixBestOf,t5_2ro0h,,1578262008.0,False,t3_ekgyeg,t3_ekgyeg,/r/NetflixBestOf/comments/ekgyeg/meta_i_ranked_netflix_films_available_in_the_us/fdbmlts/
3,fdbwuxy,Quirky_Flight,Why the fuck are you using four year old data for a platform that changes monthly? So many of these aren’t actually available to the point this is just a shitpost,Why the fuck are you using four year old data for a platform that changes monthly? So many of these aren’t actually available to the point this is just a shitpost,93,2020-01-05 22:25:36,<praw.models.comment_forest.CommentForest object at 0x000001BA5D6F9B50>,ekgyeg,NetflixBestOf,t5_2ro0h,,False,False,t3_ekgyeg,t3_ekgyeg,/r/NetflixBestOf/comments/ekgyeg/meta_i_ranked_netflix_films_available_in_the_us/fdbwuxy/
4,fdbrzru,,Most of these titles are not available on Netflix streaming.,Most of these titles are not available on Netflix streaming.,13,2020-01-05 21:52:00,<praw.models.comment_forest.CommentForest object at 0x000001BA5D6F9E50>,ekgyeg,NetflixBestOf,t5_2ro0h,,False,False,t3_ekgyeg,t3_ekgyeg,/r/NetflixBestOf/comments/ekgyeg/meta_i_ranked_netflix_films_available_in_the_us/fdbrzru/
5,fdb9q6p,derpfft,"Don't forget The Departed. 270, 8.5, 91, 94","Don't forget The Departed. 270, 8.5, 91, 94",61,2020-01-05 20:13:45,<praw.models.comment_forest.CommentForest object at 0x000001BA5D6F9FD0>,ekgyeg,NetflixBestOf,t5_2ro0h,,False,False,t3_ekgyeg,t3_ekgyeg,/r/NetflixBestOf/comments/ekgyeg/meta_i_ranked_netflix_films_available_in_the_us/fdb9q6p/
6,fdbtiak,jboy12345,Spam post,Spam post,20,2020-01-05 22:03:39,<praw.models.comment_forest.CommentForest object at 0x000001BA5D6F6070>,ekgyeg,NetflixBestOf,t5_2ro0h,,False,False,t3_ekgyeg,t3_ekgyeg,/r/NetflixBestOf/comments/ekgyeg/meta_i_ranked_netflix_films_available_in_the_us/fdbtiak/
7,fdat9te,crackeddryice,"You know how if you've seen one romcom, you've seen them all? Just go to the source for all romcom's since and watch Roman Holiday.","You know how if you've seen one romcom, you've seen them all? Just go to the source for all romcom's since and watch Roman Holiday.",17,2020-01-05 18:43:58,<praw.models.comment_forest.CommentForest object at 0x000001BA5D6F60D0>,ekgyeg,NetflixBestOf,t5_2ro0h,,False,False,t3_ekgyeg,t3_ekgyeg,/r/NetflixBestOf/comments/ekgyeg/meta_i_ranked_netflix_films_available_in_the_us/fdat9te/
8,fdbdqi7,BangThyHead,Isn't Inception rated very highly?,Isn't Inception rated very highly?,17,2020-01-05 20:33:13,<praw.models.comment_forest.CommentForest object at 0x000001BA5D6F6130>,ekgyeg,NetflixBestOf,t5_2ro0h,,False,False,t3_ekgyeg,t3_ekgyeg,/r/NetflixBestOf/comments/ekgyeg/meta_i_ranked_netflix_films_available_in_the_us/fdbdqi7/
9,fdaweex,Stormy-Monday,"Blue is the Warmest Color, lol?  Closest you’ll get to porn on Netflix.  Really close, in fact.","Blue is the Warmest Color, lol?  Closest you’ll get to porn on Netflix.  Really close, in fact.",25,2020-01-05 19:05:30,<praw.models.comment_forest.CommentForest object at 0x000001BA5D6F61F0>,ekgyeg,NetflixBestOf,t5_2ro0h,,False,False,t3_ekgyeg,t3_ekgyeg,/r/NetflixBestOf/comments/ekgyeg/meta_i_ranked_netflix_films_available_in_the_us/fdaweex/
10,fdbil3y,Vault420Overseer,This was fucking 4 years ago who cares.,This was fucking 4 years ago who cares.,15,2020-01-05 20:55:43,<praw.models.comment_forest.CommentForest object at 0x000001BA5D6F6250>,ekgyeg,NetflixBestOf,t5_2ro0h,,False,False,t3_ekgyeg,t3_ekgyeg,/r/NetflixBestOf/comments/ekgyeg/meta_i_ranked_netflix_films_available_in_the_us/fdbil3y/
11,fdc24o0,cjpeltz,This is the site I use for finding movies based on a number of rating systems. https://reelgood.com/,This is the site I use for finding movies based on a number of rating systems. https://reelgood.com/,3,2020-01-05 23:06:40,<praw.models.comment_forest.CommentForest object at 0x000001BA5D6F6310>,ekgyeg,NetflixBestOf,t5_2ro0h,,False,False,t3_ekgyeg,t3_ekgyeg,/r/NetflixBestOf/comments/ekgyeg/meta_i_ranked_netflix_films_available_in_the_us/fdc24o0/
12,fdc71ib,frozen-silver,"I didn't know The Man Who Shot Liberty Valence, Let the Right One In, Cinema Paradiso, and Fantasia were on Netflix.

Edit: Guess these are old ratings. Explains the lack of Irishman, Marriage Story, and Roma :(","I didn't know The Man Who Shot Liberty Valence, Let the Right One In, Cinema Paradiso, and Fantasia were on Netflix.

Edit: Guess these are old ratings. Explains the lack of Irishman, Marriage Story, and Roma :(",3,2020-01-05 23:52:39,<praw.models.comment_forest.CommentForest object at 0x000001BA5D6F6370>,ekgyeg,NetflixBestOf,t5_2ro0h,,False,False,t3_ekgyeg,t3_ekgyeg,/r/NetflixBestOf/comments/ekgyeg/meta_i_ranked_netflix_films_available_in_the_us/fdc71ib/
13,fdbopkk,roseffin,Thanks for nothing?,Thanks for nothing?,8,2020-01-05 21:26:22,<praw.models.comment_forest.CommentForest object at 0x000001BA5D6F63D0>,ekgyeg,NetflixBestOf,t5_2ro0h,,False,False,t3_ekgyeg,t3_ekgyeg,/r/NetflixBestOf/comments/ekgyeg/meta_i_ranked_netflix_films_available_in_the_us/fdbopkk/
14,fdb9spa,yampidad,In Bruges is such a great movie. Just showed it my wife for the first time and we were both howling.,In Bruges is such a great movie. Just showed it my wife for the first time and we were both howling.,7,2020-01-05 20:14:10,<praw.models.comment_forest.CommentForest object at 0x000001BA5D6F6430>,ekgyeg,NetflixBestOf,t5_2ro0h,,False,False,t3_ekgyeg,t3_ekgyeg,/r/NetflixBestOf/comments/ekgyeg/meta_i_ranked_netflix_films_available_in_the_us/fdb9spa/
15,fdch4e4,throwmeaway9021ooo,Which The Hunt? The Thomas Vinterberg movie or the Damon Lindelof movie? Neither is on a Netflix any more.,Which The Hunt? The Thomas Vinterberg movie or the Damon Lindelof movie? Neither is on a Netflix any more.,2,2020-01-06 01:39:15,<praw.models.comment_forest.CommentForest object at 0x000001BA5D6F6490>,ekgyeg,NetflixBestOf,t5_2ro0h,,False,False,t3_ekgyeg,t3_ekgyeg,/r/NetflixBestOf/comments/ekgyeg/meta_i_ranked_netflix_films_available_in_the_us/fdch4e4/
16,fdbfkya,,[deleted],[deleted],4,2020-01-05 20:41:21,<praw.models.comment_forest.CommentForest object at 0x000001BA5D6F66D0>,ekgyeg,NetflixBestOf,t5_2ro0h,,1583113367.0,False,t3_ekgyeg,t3_ekgyeg,/r/NetflixBestOf/comments/ekgyeg/meta_i_ranked_netflix_films_available_in_the_us/fdbfkya/
17,fdc890w,Venusss_E_Sublime,City of God is SO GOOD.,City of God is SO GOOD.,1,2020-01-06 00:03:48,<praw.models.comment_forest.CommentForest object at 0x000001BA5D6F6790>,ekgyeg,NetflixBestOf,t5_2ro0h,,False,False,t3_ekgyeg,t3_ekgyeg,/r/NetflixBestOf/comments/ekgyeg/meta_i_ranked_netflix_films_available_in_the_us/fdc890w/
18,fdcfihy,Any1canC00k,Hotel Rwanda is a fucked up movie. That guy was an ASSHOLE in real life.,Hotel Rwanda is a fucked up movie. That guy was an ASSHOLE in real life.,1,2020-01-06 01:20:31,<praw.models.comment_forest.CommentForest object at 0x000001BA5D6F6850>,ekgyeg,NetflixBestOf,t5_2ro0h,,False,False,t3_ekgyeg,t3_ekgyeg,/r/NetflixBestOf/comments/ekgyeg/meta_i_ranked_netflix_films_available_in_the_us/fdcfihy/
19,fdcjpz4,DecoyOrbison,Y’all do know the app and website ReelGood will do this for multiple streaming services right?,Y’all do know the app and website ReelGood will do this for multiple streaming services right?,1,2020-01-06 02:10:03,<praw.models.comment_forest.CommentForest object at 0x000001BA5D6F68B0>,ekgyeg,NetflixBestOf,t5_2ro0h,,False,False,t3_ekgyeg,t3_ekgyeg,/r/NetflixBestOf/comments/ekgyeg/meta_i_ranked_netflix_films_available_in_the_us/fdcjpz4/
20,fddl6mq,bartturner,Thanks for doing this.,Thanks for doing this.,1,2020-01-06 13:14:54,<praw.models.comment_forest.CommentForest object at 0x000001BA5D6F6910>,ekgyeg,NetflixBestOf,t5_2ro0h,,False,False,t3_ekgyeg,t3_ekgyeg,/r/NetflixBestOf/comments/ekgyeg/meta_i_ranked_netflix_films_available_in_the_us/fddl6mq/
21,fdduflr,,"Okay, I'm late to this thread but I have a question and some venting to do. First is there an app or filter that will show the entire Netflix library and not just the most recent thing Netflix is pushing? I always hear the same thing, Netflix doesn't want you to know how small their library is but I would argue just the opposite. I had no idea that about 40 of these movies were on their and Netflix will never suggest them because I'll see some vampire movie in 15 different categories. The way they display their catalog actually makes it look significantly smaller than it actually is. Even their older original content is buried under heaps of what ever is popular that week.","Okay, I'm late to this thread but I have a question and some venting to do. First is there an app or filter that will show the entire Netflix library and not just the most recent thing Netflix is pushing? I always hear the same thing, Netflix doesn't want you to know how small their library is but I would argue just the opposite. I had no idea that about 40 of these movies were on their and Netflix will never suggest them because I'll see some vampire movie in 15 different categories. The way they display their catalog actually makes it look significantly smaller than it actually is. Even their older original content is buried under heaps of what ever is popular that week.",1,2020-01-06 15:24:06,<praw.models.comment_forest.CommentForest object at 0x000001BA5D6F6970>,ekgyeg,NetflixBestOf,t5_2ro0h,,False,False,t3_ekgyeg,t3_ekgyeg,/r/NetflixBestOf/comments/ekgyeg/meta_i_ranked_netflix_films_available_in_the_us/fdduflr/
22,fde4jnp,koebelin,Drunk Reddit Bot would want to downvote this to help it learn. 2016? Downvote to help the drunk.,Drunk Reddit Bot would want to downvote this to help it learn. 2016? Downvote to help the drunk.,1,2020-01-06 17:17:01,<praw.models.comment_forest.CommentForest object at 0x000001BA5D6F69D0>,ekgyeg,NetflixBestOf,t5_2ro0h,,False,False,t3_ekgyeg,t3_ekgyeg,/r/NetflixBestOf/comments/ekgyeg/meta_i_ranked_netflix_films_available_in_the_us/fde4jnp/
23,fdihvbt,VThOKiEsRule,QT dominating.,QT dominating.,1,2020-01-08 00:27:48,<praw.models.comment_forest.CommentForest object at 0x000001BA5D6F6A30>,ekgyeg,NetflixBestOf,t5_2ro0h,,False,False,t3_ekgyeg,t3_ekgyeg,/r/NetflixBestOf/comments/ekgyeg/meta_i_ranked_netflix_films_available_in_the_us/fdihvbt/
24,fdb08a7,AprilBrooks,"Thank you!!!!
Edit:  Don’t forget Malcolm X","Thank you!!!!
Edit:  Don’t forget Malcolm X",0,2020-01-05 19:24:57,<praw.models.comment_forest.CommentForest object at 0x000001BA5D6F6A90>,ekgyeg,NetflixBestOf,t5_2ro0h,,False,False,t3_ekgyeg,t3_ekgyeg,/r/NetflixBestOf/comments/ekgyeg/meta_i_ranked_netflix_films_available_in_the_us/fdb08a7/
25,fdcam9z,lowkeyantisocial420,Would you mind doing the same with tv series,Would you mind doing the same with tv series,0,2020-01-06 00:27:10,<praw.models.comment_forest.CommentForest object at 0x000001BA5D6F6AF0>,ekgyeg,NetflixBestOf,t5_2ro0h,,False,False,t3_ekgyeg,t3_ekgyeg,/r/NetflixBestOf/comments/ekgyeg/meta_i_ranked_netflix_films_available_in_the_us/fdcam9z/
26,fdcypsn,Tacohead223,Opinions are a thing,Opinions are a thing,0,2020-01-06 05:24:53,<praw.models.comment_forest.CommentForest object at 0x000001BA5D6F6B50>,ekgyeg,NetflixBestOf,t5_2ro0h,,False,False,t3_ekgyeg,t3_ekgyeg,/r/NetflixBestOf/comments/ekgyeg/meta_i_ranked_netflix_films_available_in_the_us/fdcypsn/
27,fdczm1d,DuckMasterFlexxx,For later,For later,0,2020-01-06 05:38:40,<praw.models.comment_forest.CommentForest object at 0x000001BA5D6F6BB0>,ekgyeg,NetflixBestOf,t5_2ro0h,,False,False,t3_ekgyeg,t3_ekgyeg,/r/NetflixBestOf/comments/ekgyeg/meta_i_ranked_netflix_films_available_in_the_us/fdczm1d/
28,fdd5mcj,jazzbuh,r/DataIsBeautiful,r/DataIsBeautiful,0,2020-01-06 07:30:24,<praw.models.comment_forest.CommentForest object at 0x000001BA5D6F6C10>,ekgyeg,NetflixBestOf,t5_2ro0h,,False,False,t3_ekgyeg,t3_ekgyeg,/r/NetflixBestOf/comments/ekgyeg/meta_i_ranked_netflix_films_available_in_the_us/fdd5mcj/
29,fdc7oib,Nugget-has-nuggets,"I’m surprised The Expendables aren’t on here

Edit: you guys don’t like the expendables movies???","I’m surprised The Expendables aren’t on here

Edit: you guys don’t like the expendables movies???",-2,2020-01-05 23:58:31,<praw.models.comment_forest.CommentForest object at 0x000001BA5D6F6C70>,ekgyeg,NetflixBestOf,t5_2ro0h,,1578764577.0,False,t3_ekgyeg,t3_ekgyeg,/r/NetflixBestOf/comments/ekgyeg/meta_i_ranked_netflix_films_available_in_the_us/fdc7oib/
30,fdbznnf,checklistmaker,Well done.,Well done.,-3,2020-01-05 22:46:20,<praw.models.comment_forest.CommentForest object at 0x000001BA5D6F6CD0>,ekgyeg,NetflixBestOf,t5_2ro0h,,False,False,t3_ekgyeg,t3_ekgyeg,/r/NetflixBestOf/comments/ekgyeg/meta_i_ranked_netflix_films_available_in_the_us/fdbznnf/
31,fdbtqcg,npti25,"What about the LOTR movies? (  It might not be availalbe in the USA, but here, in Hungary it is).","What about the LOTR movies? (  It might not be availalbe in the USA, but here, in Hungary it is).",-4,2020-01-05 22:05:55,<praw.models.comment_forest.CommentForest object at 0x000001BA5D6F6D30>,ekgyeg,NetflixBestOf,t5_2ro0h,,False,False,t3_ekgyeg,t3_ekgyeg,/r/NetflixBestOf/comments/ekgyeg/meta_i_ranked_netflix_films_available_in_the_us/fdbtqcg/
32,fdbfd1t,GaryNOVA,"IMO

The Shining, Inglorious Basterds & Who framed Roger Rabbit all need to be top 5.  Also The Departed didn’t even make the list?  That’s top 5
Also.     Drive, Zodiac, The Fighter?    

Clerks and American Beauty is top ten.","IMO

The Shining, Inglorious Basterds & Who framed Roger Rabbit all need to be top 5.  Also The Departed didn’t even make the list?  That’s top 5
Also.     Drive, Zodiac, The Fighter?    

Clerks and American Beauty is top ten.",-5,2020-01-05 20:40:14,<praw.models.comment_forest.CommentForest object at 0x000001BA5D6F6D90>,ekgyeg,NetflixBestOf,t5_2ro0h,,1578268297.0,False,t3_ekgyeg,t3_ekgyeg,/r/NetflixBestOf/comments/ekgyeg/meta_i_ranked_netflix_films_available_in_the_us/fdbfd1t/
33,fdccg67,idyl,It's a bot.  Look at its history.,It's a bot.  Look at its history.,68,2020-01-06 00:45:54,<praw.models.comment_forest.CommentForest object at 0x000001BA5D6F98B0>,ekgyeg,NetflixBestOf,t5_2ro0h,,False,False,t3_ekgyeg,t1_fdbce3f,/r/NetflixBestOf/comments/ekgyeg/meta_i_ranked_netflix_films_available_in_the_us/fdccg67/
34,fdcbk19,GregSays,Let’s all kindly downvote the post.,Let’s all kindly downvote the post.,18,2020-01-06 00:36:48,<praw.models.comment_forest.CommentForest object at 0x000001BA5D6F9910>,ekgyeg,NetflixBestOf,t5_2ro0h,,False,False,t3_ekgyeg,t1_fdbce3f,/r/NetflixBestOf/comments/ekgyeg/meta_i_ranked_netflix_films_available_in_the_us/fdcbk19/
35,fdcp745,PurelyCreative,"The highest rated movie that’s on this list and US netflix is City of God. If you haven’t seen it, I’d highly recommend it.","The highest rated movie that’s on this list and US netflix is City of God. If you haven’t seen it, I’d highly recommend it.",4,2020-01-06 03:15:48,<praw.models.comment_forest.CommentForest object at 0x000001BA5D6F9A90>,ekgyeg,NetflixBestOf,t5_2ro0h,,False,False,t3_ekgyeg,t1_fdbce3f,/r/NetflixBestOf/comments/ekgyeg/meta_i_ranked_netflix_films_available_in_the_us/fdcp745/
36,fdc149g,,"Canada :,)","Canada :,)",-12,2020-01-05 22:57:49,<praw.models.comment_forest.CommentForest object at 0x000001BA5D6F9AF0>,ekgyeg,NetflixBestOf,t5_2ro0h,,False,False,t3_ekgyeg,t1_fdbce3f,/r/NetflixBestOf/comments/ekgyeg/meta_i_ranked_netflix_films_available_in_the_us/fdc149g/
37,fdbyjj4,PooPooDooDoo,Why is this being commented on as if it wasn’t cancer?,Why is this being commented on as if it wasn’t cancer?,12,2020-01-05 22:38:08,<praw.models.comment_forest.CommentForest object at 0x000001BA5D6F9BB0>,ekgyeg,NetflixBestOf,t5_2ro0h,,False,False,t3_ekgyeg,t1_fdbmlts,/r/NetflixBestOf/comments/ekgyeg/meta_i_ranked_netflix_films_available_in_the_us/fdbyjj4/
38,fdbtrk3,ExtraGloves,Serouisly.  That was some old school install some spyware link...,Serouisly.  That was some old school install some spyware link...,17,2020-01-05 22:06:15,<praw.models.comment_forest.CommentForest object at 0x000001BA5D6F9C10>,ekgyeg,NetflixBestOf,t5_2ro0h,,False,False,t3_ekgyeg,t1_fdbmlts,/r/NetflixBestOf/comments/ekgyeg/meta_i_ranked_netflix_films_available_in_the_us/fdbtrk3/
39,fde4n9d,koebelin,DrunkRedditBot!,DrunkRedditBot!,1,2020-01-06 17:18:04,<praw.models.comment_forest.CommentForest object at 0x000001BA5D6F9CD0>,ekgyeg,NetflixBestOf,t5_2ro0h,,False,False,t3_ekgyeg,t1_fdbmlts,/r/NetflixBestOf/comments/ekgyeg/meta_i_ranked_netflix_films_available_in_the_us/fde4n9d/
40,fdd4xwy,GitEmSteveDave,It's a bot reposting to get karma for some nefarious purpose.  It goes on subs and reposts old top posts: https://www.reddit.com/r/NetflixBestOf/comments/45xuux/meta_i_ranked_netflix_films_available_in_the_us/,It's a bot reposting to get karma for some nefarious purpose.  It goes on subs and reposts old top posts: https://www.reddit.com/r/NetflixBestOf/comments/45xuux/meta_i_ranked_netflix_films_available_in_the_us/,20,2020-01-06 07:16:19,<praw.models.comment_forest.CommentForest object at 0x000001BA5D6F9F70>,ekgyeg,NetflixBestOf,t5_2ro0h,,False,False,t3_ekgyeg,t1_fdbwuxy,/r/NetflixBestOf/comments/ekgyeg/meta_i_ranked_netflix_films_available_in_the_us/fdd4xwy/
41,fdbnw00,SwissQueso,"I hate to be that nerd, but I’ve actually heard that Shakespeare’s “Much Ado About Nothing” is the original romcom.","I hate to be that nerd, but I’ve actually heard that Shakespeare’s “Much Ado About Nothing” is the original romcom.",8,2020-01-05 21:20:40,<praw.models.comment_forest.CommentForest object at 0x000001BA5D6F6190>,ekgyeg,NetflixBestOf,t5_2ro0h,,False,False,t3_ekgyeg,t1_fdat9te,/r/NetflixBestOf/comments/ekgyeg/meta_i_ranked_netflix_films_available_in_the_us/fdbnw00/
42,fdb8ing,,Good movie tho.  Great movie to watch with the parents on movie night.,Good movie tho.  Great movie to watch with the parents on movie night.,33,2020-01-05 20:08:24,<praw.models.comment_forest.CommentForest object at 0x000001BA5D6F62B0>,ekgyeg,NetflixBestOf,t5_2ro0h,,False,False,t3_ekgyeg,t1_fdaweex,/r/NetflixBestOf/comments/ekgyeg/meta_i_ranked_netflix_films_available_in_the_us/fdb8ing/
43,fdbdlwt,michaelswallace,Did you call her an inanimate fucking object?,Did you call her an inanimate fucking object?,6,2020-01-05 20:32:27,<praw.models.comment_forest.CommentForest object at 0x000001BA5D6F64F0>,ekgyeg,NetflixBestOf,t5_2ro0h,,False,False,t3_ekgyeg,t1_fdb9spa,/r/NetflixBestOf/comments/ekgyeg/meta_i_ranked_netflix_films_available_in_the_us/fdbdlwt/
44,fdbe3tb,BangThyHead,The absolute best. If you like something a little darker try watching Filth. It's got James McAvoy who I'm a major fan off. You love hate him in this. It's depressing and thrilling at the same time.,The absolute best. If you like something a little darker try watching Filth. It's got James McAvoy who I'm a major fan off. You love hate him in this. It's depressing and thrilling at the same time.,5,2020-01-05 20:35:17,<praw.models.comment_forest.CommentForest object at 0x000001BA5D6F6550>,ekgyeg,NetflixBestOf,t5_2ro0h,,False,False,t3_ekgyeg,t1_fdb9spa,/r/NetflixBestOf/comments/ekgyeg/meta_i_ranked_netflix_films_available_in_the_us/fdbe3tb/
45,fdbkcnl,BeavMcloud,"What region are you in? In Bruges got taken off in the US, and it's ruined my life.","What region are you in? In Bruges got taken off in the US, and it's ruined my life.",3,2020-01-05 21:03:10,<praw.models.comment_forest.CommentForest object at 0x000001BA5D6F6610>,ekgyeg,NetflixBestOf,t5_2ro0h,,False,False,t3_ekgyeg,t1_fdb9spa,/r/NetflixBestOf/comments/ekgyeg/meta_i_ranked_netflix_films_available_in_the_us/fdbkcnl/
46,fdcjrk2,D_Row,"They did, I looked for it yesterday coincidentally. This post is bullshit, data is from 2016.","They did, I looked for it yesterday coincidentally. This post is bullshit, data is from 2016.",2,2020-01-06 02:10:33,<praw.models.comment_forest.CommentForest object at 0x000001BA5D6F67F0>,ekgyeg,NetflixBestOf,t5_2ro0h,,False,False,t3_ekgyeg,t1_fdbfkya,/r/NetflixBestOf/comments/ekgyeg/meta_i_ranked_netflix_films_available_in_the_us/fdcjrk2/
47,fdcukhc,SendNudez123,Can you read in hungry? It literally says IN US.,Can you read in hungry? It literally says IN US.,2,2020-01-06 04:25:32,<praw.models.comment_forest.CommentForest object at 0x000001BA5D6F6DF0>,ekgyeg,NetflixBestOf,t5_2ro0h,,False,False,t3_ekgyeg,t1_fdbtqcg,/r/NetflixBestOf/comments/ekgyeg/meta_i_ranked_netflix_films_available_in_the_us/fdcukhc/
48,fdc9ehe,AstronautPoseidon,"Your top 5 is pulp fiction, the shining, inglorious basterds, who framed roger rabbit, and the departed? Lmao with a top ten rounded out with clerks and American beauty? Hoot and a half I tell ya","Your top 5 is pulp fiction, the shining, inglorious basterds, who framed roger rabbit, and the departed? Lmao with a top ten rounded out with clerks and American beauty? Hoot and a half I tell ya",-1,2020-01-06 00:15:03,<praw.models.comment_forest.CommentForest object at 0x000001BA5D6F6EB0>,ekgyeg,NetflixBestOf,t5_2ro0h,,False,False,t3_ekgyeg,t1_fdbfd1t,/r/NetflixBestOf/comments/ekgyeg/meta_i_ranked_netflix_films_available_in_the_us/fdc9ehe/
49,fdcenzy,soxfan4life78,It's a bot. Look at its name,It's a bot. Look at its name,44,2020-01-06 01:10:44,<praw.models.comment_forest.CommentForest object at 0x000001BA5D6F9970>,ekgyeg,NetflixBestOf,t5_2ro0h,,False,False,t3_ekgyeg,t1_fdccg67,/r/NetflixBestOf/comments/ekgyeg/meta_i_ranked_netflix_films_available_in_the_us/fdcenzy/
50,fdd89io,justsomechickyo,"How tf does this bot work?  It's got so many random things within minutes of each other! Even comments too, maybe I'm retarded but how does that even work?","How tf does this bot work?  It's got so many random things within minutes of each other! Even comments too, maybe I'm retarded but how does that even work?",2,2020-01-06 08:28:34,<praw.models.comment_forest.CommentForest object at 0x000001BA5D6F99D0>,ekgyeg,NetflixBestOf,t5_2ro0h,,False,False,t3_ekgyeg,t1_fdccg67,/r/NetflixBestOf/comments/ekgyeg/meta_i_ranked_netflix_films_available_in_the_us/fdd89io/
51,fdbz2g3,Maessttrro,"I know right, it looks like all the comments are automated","I know right, it looks like all the comments are automated",7,2020-01-05 22:41:10,<praw.models.comment_forest.CommentForest object at 0x000001BA5D6F9C70>,ekgyeg,NetflixBestOf,t5_2ro0h,,False,False,t3_ekgyeg,t1_fdbyjj4,/r/NetflixBestOf/comments/ekgyeg/meta_i_ranked_netflix_films_available_in_the_us/fdbz2g3/
52,fdbu2gh,Maessttrro,"Oh, it's a bot","Oh, it's a bot",12,2020-01-05 22:08:12,<praw.models.comment_forest.CommentForest object at 0x000001BA5D6F9D90>,ekgyeg,NetflixBestOf,t5_2ro0h,,False,False,t3_ekgyeg,t1_fdbtrk3,/r/NetflixBestOf/comments/ekgyeg/meta_i_ranked_netflix_films_available_in_the_us/fdbu2gh/
53,fdbenj9,yampidad,I swear I never touched it.,I swear I never touched it.,1,2020-01-05 20:37:00,<praw.models.comment_forest.CommentForest object at 0x000001BA5D6F65B0>,ekgyeg,NetflixBestOf,t5_2ro0h,,False,False,t3_ekgyeg,t1_fdbdlwt,/r/NetflixBestOf/comments/ekgyeg/meta_i_ranked_netflix_films_available_in_the_us/fdbenj9/
54,fdbe8sf,yampidad,I’ll give it a go.,I’ll give it a go.,1,2020-01-05 20:35:59,<praw.models.comment_forest.CommentForest object at 0x000001BA5D6F6670>,ekgyeg,NetflixBestOf,t5_2ro0h,,False,False,t3_ekgyeg,t1_fdbe3tb,/r/NetflixBestOf/comments/ekgyeg/meta_i_ranked_netflix_films_available_in_the_us/fdbe8sf/
55,fdcxdt0,yampidad,🇬🇧,🇬🇧,2,2020-01-06 05:05:14,<praw.models.comment_forest.CommentForest object at 0x000001BA5D6F6730>,ekgyeg,NetflixBestOf,t5_2ro0h,,False,False,t3_ekgyeg,t1_fdbkcnl,/r/NetflixBestOf/comments/ekgyeg/meta_i_ranked_netflix_films_available_in_the_us/fdcxdt0/
56,fdcnzpa,Ballaki,Thank you,Thank you,3,2020-01-06 03:01:02,<praw.models.comment_forest.CommentForest object at 0x000001BA5D6F9A30>,ekgyeg,NetflixBestOf,t5_2ro0h,,False,False,t3_ekgyeg,t1_fdcenzy,/r/NetflixBestOf/comments/ekgyeg/meta_i_ranked_netflix_films_available_in_the_us/fdcnzpa/
57,fdc1d5r,PooPooDooDoo,I just reported it,I just reported it,4,2020-01-05 23:00:02,<praw.models.comment_forest.CommentForest object at 0x000001BA5D6F9D30>,ekgyeg,NetflixBestOf,t5_2ro0h,,False,False,t3_ekgyeg,t1_fdbz2g3,/r/NetflixBestOf/comments/ekgyeg/meta_i_ranked_netflix_films_available_in_the_us/fdc1d5r/
58,fdc2hsv,zizzybalumba,And a drunk bot at that.,And a drunk bot at that.,3,2020-01-05 23:10:07,<praw.models.comment_forest.CommentForest object at 0x000001BA5D6F9F10>,ekgyeg,NetflixBestOf,t5_2ro0h,,False,False,t3_ekgyeg,t1_fdbu2gh,/r/NetflixBestOf/comments/ekgyeg/meta_i_ranked_netflix_films_available_in_the_us/fdc2hsv/
