,ID,Author,body,Comment,Score,Created On,Replies,Submission,Subreddit,Subreddit_ID,Distinguished,Edited,Is_submitter,link_id,Parent_id,Permalink
114,hrad157,,"Yeah I was like, who tf didn’t know this? Then it dawned on me","Yeah I was like, who tf didn’t know this? Then it dawned on me",2,2022-01-05 00:35:14,<praw.models.comment_forest.CommentForest object at 0x000002541B0EF580>,rw44gu,todayilearned,t5_2qqjc,,False,False,t3_rw44gu,t1_hr9d7d2,/r/todayilearned/comments/rw44gu/til_the_original_purpose_of_electric_outlets_in/hrad157/
115,hrapedd,beerguyBA,"I was there, Gandalf, 3000 years ago...","I was there, Gandalf, 3000 years ago...",2,2022-01-05 02:01:17,<praw.models.comment_forest.CommentForest object at 0x000002541B0EF3D0>,rw44gu,todayilearned,t5_2qqjc,,False,False,t3_rw44gu,t1_hr9d7d2,/r/todayilearned/comments/rw44gu/til_the_original_purpose_of_electric_outlets_in/hrapedd/
116,hr9fhk7,Sh0wMeY0urTits,Lol right 😅,Lol right 😅,1,2022-01-04 20:55:01,<praw.models.comment_forest.CommentForest object at 0x000002541B0EF6A0>,rw44gu,todayilearned,t5_2qqjc,,False,False,t3_rw44gu,t1_hr9d7d2,/r/todayilearned/comments/rw44gu/til_the_original_purpose_of_electric_outlets_in/hr9fhk7/
117,hr9hhm6,,Yeah...,Yeah...,1,2022-01-04 21:07:42,<praw.models.comment_forest.CommentForest object at 0x000002541B0EF220>,rw44gu,todayilearned,t5_2qqjc,,False,False,t3_rw44gu,t1_hr9d7d2,/r/todayilearned/comments/rw44gu/til_the_original_purpose_of_electric_outlets_in/hr9hhm6/
118,hr9oxpp,snogirl0403,Yeah. Same. 💔,Yeah. Same. 💔,1,2022-01-04 21:54:56,<praw.models.comment_forest.CommentForest object at 0x000002541B0EF250>,rw44gu,todayilearned,t5_2qqjc,,False,False,t3_rw44gu,t1_hr9d7d2,/r/todayilearned/comments/rw44gu/til_the_original_purpose_of_electric_outlets_in/hr9oxpp/
119,hr9q68j,iamnotableto,"I get seniors discounts (55+) now so yeah, me too.","I get seniors discounts (55+) now so yeah, me too.",1,2022-01-04 22:02:57,<praw.models.comment_forest.CommentForest object at 0x000002541B0EF190>,rw44gu,todayilearned,t5_2qqjc,,False,False,t3_rw44gu,t1_hr9d7d2,/r/todayilearned/comments/rw44gu/til_the_original_purpose_of_electric_outlets_in/hr9q68j/
120,hrbkpix,DaftPump,r/fuckimold,r/fuckimold,1,2022-01-05 06:09:37,<praw.models.comment_forest.CommentForest object at 0x000002541B0EF280>,rw44gu,todayilearned,t5_2qqjc,,False,False,t3_rw44gu,t1_hr9d7d2,/r/todayilearned/comments/rw44gu/til_the_original_purpose_of_electric_outlets_in/hrbkpix/
121,hrdearx,Dangerous-Honey-4481,"No, OP is young.  They probably don't remember a time before cell phones, or driven (seen?) a manual transmission or had a car without ABS brakes.","No, OP is young.  They probably don't remember a time before cell phones, or driven (seen?) a manual transmission or had a car without ABS brakes.",1,2022-01-05 16:36:51,<praw.models.comment_forest.CommentForest object at 0x000002541B0EF910>,rw44gu,todayilearned,t5_2qqjc,,False,False,t3_rw44gu,t1_hr9d7d2,/r/todayilearned/comments/rw44gu/til_the_original_purpose_of_electric_outlets_in/hrdearx/
122,hre7gk9,ECHIDNASBARK,I came to say the same thing 😂,I came to say the same thing 😂,1,2022-01-05 19:34:19,<praw.models.comment_forest.CommentForest object at 0x000002541E47D2B0>,rw44gu,todayilearned,t5_2qqjc,,False,False,t3_rw44gu,t1_hr9d7d2,/r/todayilearned/comments/rw44gu/til_the_original_purpose_of_electric_outlets_in/hre7gk9/
123,hr9gw0g,-null,Right… those first adapters to turn them into an outlet was like black magic.,Right… those first adapters to turn them into an outlet was like black magic.,35,2022-01-04 21:03:52,<praw.models.comment_forest.CommentForest object at 0x000002541E47D280>,rw44gu,todayilearned,t5_2qqjc,,False,False,t3_rw44gu,t1_hr9da21,/r/todayilearned/comments/rw44gu/til_the_original_purpose_of_electric_outlets_in/hr9gw0g/
124,hr9f9ym,AlGeee,Same,Same,8,2022-01-04 20:53:42,<praw.models.comment_forest.CommentForest object at 0x000002541E47DEB0>,rw44gu,todayilearned,t5_2qqjc,,False,False,t3_rw44gu,t1_hr9da21,/r/todayilearned/comments/rw44gu/til_the_original_purpose_of_electric_outlets_in/hr9f9ym/
125,hr9mev0,Kayback2,"My 2016 Nissan X trail has two sockets in the front, one with a cigarette lighter in it. It also came with a removable ashtray in one cup holder.","My 2016 Nissan X trail has two sockets in the front, one with a cigarette lighter in it. It also came with a removable ashtray in one cup holder.",2,2022-01-04 21:38:51,<praw.models.comment_forest.CommentForest object at 0x000002541E47DDF0>,rw44gu,todayilearned,t5_2qqjc,,False,False,t3_rw44gu,t1_hr9da21,/r/todayilearned/comments/rw44gu/til_the_original_purpose_of_electric_outlets_in/hr9mev0/
126,hr9eir0,Dicska,"TIL people before 2031 used the rubbish containers on car doors as ashtrays for their so-called ""cigarettes"".","TIL people before 2031 used the rubbish containers on car doors as ashtrays for their so-called ""cigarettes"".",17,2022-01-04 20:48:55,<praw.models.comment_forest.CommentForest object at 0x000002541E47D160>,rw44gu,todayilearned,t5_2qqjc,,False,False,t3_rw44gu,t1_hr9dkqs,/r/todayilearned/comments/rw44gu/til_the_original_purpose_of_electric_outlets_in/hr9eir0/
127,hr9e7cb,,"my last car still had ashtrays😂I think it was a 2000, I got it in 2008.","my last car still had ashtrays😂I think it was a 2000, I got it in 2008.",4,2022-01-04 20:46:56,<praw.models.comment_forest.CommentForest object at 0x000002541E47D0D0>,rw44gu,todayilearned,t5_2qqjc,,False,False,t3_rw44gu,t1_hr9dkqs,/r/todayilearned/comments/rw44gu/til_the_original_purpose_of_electric_outlets_in/hr9e7cb/
128,hr9fmh2,bolanrox,My 89 mercury had both lol,My 89 mercury had both lol,2,2022-01-04 20:55:53,<praw.models.comment_forest.CommentForest object at 0x000002541E47DBB0>,rw44gu,todayilearned,t5_2qqjc,,False,False,t3_rw44gu,t1_hr9dkqs,/r/todayilearned/comments/rw44gu/til_the_original_purpose_of_electric_outlets_in/hr9fmh2/
129,hr9jbhw,keetojm,Some of the more expensive cars had lights and ash trays in the arm rests of the back seat,Some of the more expensive cars had lights and ash trays in the arm rests of the back seat,2,2022-01-04 21:19:15,<praw.models.comment_forest.CommentForest object at 0x000002541E47DB20>,rw44gu,todayilearned,t5_2qqjc,,False,False,t3_rw44gu,t1_hr9dkqs,/r/todayilearned/comments/rw44gu/til_the_original_purpose_of_electric_outlets_in/hr9jbhw/
130,hrcgm3i,Qwerty2511,"Okay, I knew about the cigarette lighters, but I never new those things where ashtrays.","Okay, I knew about the cigarette lighters, but I never new those things where ashtrays.",1,2022-01-05 12:26:55,<praw.models.comment_forest.CommentForest object at 0x000002541E47D970>,rw44gu,todayilearned,t5_2qqjc,,False,False,t3_rw44gu,t1_hr9dkqs,/r/todayilearned/comments/rw44gu/til_the_original_purpose_of_electric_outlets_in/hrcgm3i/
131,hr9edgb,WeirdFlexCapacitor,"For sure. Spiral burn on the finger tip looked pretty cool, though.","For sure. Spiral burn on the finger tip looked pretty cool, though.",7,2022-01-04 20:48:01,<praw.models.comment_forest.CommentForest object at 0x000002541E47D190>,rw44gu,todayilearned,t5_2qqjc,,False,False,t3_rw44gu,t1_hr9dib9,/r/todayilearned/comments/rw44gu/til_the_original_purpose_of_electric_outlets_in/hr9edgb/
132,hr9gch6,Baxterftw,Ever had it shoot out red hot?,Ever had it shoot out red hot?,4,2022-01-04 21:00:26,<praw.models.comment_forest.CommentForest object at 0x000002541E47D670>,rw44gu,todayilearned,t5_2qqjc,,False,False,t3_rw44gu,t1_hr9dib9,/r/todayilearned/comments/rw44gu/til_the_original_purpose_of_electric_outlets_in/hr9gch6/
133,hr9eqf1,,3.5 inch floppy disk. Wonder how many people have also used the 5 inch floppy. Lol,3.5 inch floppy disk. Wonder how many people have also used the 5 inch floppy. Lol,27,2022-01-04 20:50:15,<praw.models.comment_forest.CommentForest object at 0x000002541E497400>,rw44gu,todayilearned,t5_2qqjc,,False,False,t3_rw44gu,t1_hr9dbcc,/r/todayilearned/comments/rw44gu/til_the_original_purpose_of_electric_outlets_in/hr9eqf1/
134,hr9g61c,jackatman,That's the save icon silly.,That's the save icon silly.,13,2022-01-04 20:59:19,<praw.models.comment_forest.CommentForest object at 0x000002541E4973A0>,rw44gu,todayilearned,t5_2qqjc,,False,False,t3_rw44gu,t1_hr9dbcc,/r/todayilearned/comments/rw44gu/til_the_original_purpose_of_electric_outlets_in/hr9g61c/
135,hr9i8u4,elcheapodeluxe,"It is a picture of a 3.5"", DS/DD 720k floppy disk with the write-protect tab set to ""not protected"". If it was a 1.44mb DS/HD disk it would have an additional hole in one corner.","It is a picture of a 3.5"", DS/DD 720k floppy disk with the write-protect tab set to ""not protected"". If it was a 1.44mb DS/HD disk it would have an additional hole in one corner.",8,2022-01-04 21:12:30,<praw.models.comment_forest.CommentForest object at 0x000002541E497B50>,rw44gu,todayilearned,t5_2qqjc,,False,False,t3_rw44gu,t1_hr9dbcc,/r/todayilearned/comments/rw44gu/til_the_original_purpose_of_electric_outlets_in/hr9i8u4/
136,hr9dtqf,qs420,"oh haha i just said that, lolololololol. fuuuuuuck meeeeeee how are we old already","oh haha i just said that, lolololololol. fuuuuuuck meeeeeee how are we old already",5,2022-01-04 20:44:33,<praw.models.comment_forest.CommentForest object at 0x000002541E497AC0>,rw44gu,todayilearned,t5_2qqjc,,False,False,t3_rw44gu,t1_hr9dbcc,/r/todayilearned/comments/rw44gu/til_the_original_purpose_of_electric_outlets_in/hr9dtqf/
137,hr9emik,ausamerika,"It's a diskette. Floppy discs were the 5.25"" discs which preceded these.","It's a diskette. Floppy discs were the 5.25"" discs which preceded these.",12,2022-01-04 20:49:34,<praw.models.comment_forest.CommentForest object at 0x000002541E497850>,rw44gu,todayilearned,t5_2qqjc,,False,False,t3_rw44gu,t1_hr9dbcc,/r/todayilearned/comments/rw44gu/til_the_original_purpose_of_electric_outlets_in/hr9emik/
138,hr9fuiy,RSParmchairRanger,Don’t know. Didn’t fit in my Commodore 64!,Don’t know. Didn’t fit in my Commodore 64!,3,2022-01-04 20:57:17,<praw.models.comment_forest.CommentForest object at 0x000002541E4978B0>,rw44gu,todayilearned,t5_2qqjc,,False,False,t3_rw44gu,t1_hr9dbcc,/r/todayilearned/comments/rw44gu/til_the_original_purpose_of_electric_outlets_in/hr9fuiy/
139,hr9dicg,debbymck2018,Its a floppy xx,Its a floppy xx,2,2022-01-04 20:42:35,<praw.models.comment_forest.CommentForest object at 0x000002541E497670>,rw44gu,todayilearned,t5_2qqjc,,False,False,t3_rw44gu,t1_hr9dbcc,/r/todayilearned/comments/rw44gu/til_the_original_purpose_of_electric_outlets_in/hr9dicg/
140,hr9geaq,shrivledrivle,"Means save, you think millennials know nothing don't you. Well shows you wrong doesn't it. Huh.","Means save, you think millennials know nothing don't you. Well shows you wrong doesn't it. Huh.",2,2022-01-04 21:00:45,<praw.models.comment_forest.CommentForest object at 0x00000254212AAE50>,rw44gu,todayilearned,t5_2qqjc,,False,False,t3_rw44gu,t1_hr9dbcc,/r/todayilearned/comments/rw44gu/til_the_original_purpose_of_electric_outlets_in/hr9geaq/
141,hr9mkfs,bluecamel17,That's an emoji.,That's an emoji.,2,2022-01-04 21:39:51,<praw.models.comment_forest.CommentForest object at 0x00000254212AAE80>,rw44gu,todayilearned,t5_2qqjc,,False,False,t3_rw44gu,t1_hr9dbcc,/r/todayilearned/comments/rw44gu/til_the_original_purpose_of_electric_outlets_in/hr9mkfs/
142,hra3f83,fazalmajid,"Hey Dad, you 3D-printed the “Save” icon!","Hey Dad, you 3D-printed the “Save” icon!",2,2022-01-04 23:29:59,<praw.models.comment_forest.CommentForest object at 0x00000254212AAB20>,rw44gu,todayilearned,t5_2qqjc,,False,False,t3_rw44gu,t1_hr9dbcc,/r/todayilearned/comments/rw44gu/til_the_original_purpose_of_electric_outlets_in/hra3f83/
143,hr9dfz6,,Floppy,Floppy,1,2022-01-04 20:42:11,<praw.models.comment_forest.CommentForest object at 0x00000254212AA9D0>,rw44gu,todayilearned,t5_2qqjc,,False,False,t3_rw44gu,t1_hr9dbcc,/r/todayilearned/comments/rw44gu/til_the_original_purpose_of_electric_outlets_in/hr9dfz6/
144,hr9e512,Darahian,Staaahp! I feeel old! 🤣🤣🤣,Staaahp! I feeel old! 🤣🤣🤣,1,2022-01-04 20:46:31,<praw.models.comment_forest.CommentForest object at 0x00000254212AAAF0>,rw44gu,todayilearned,t5_2qqjc,,False,False,t3_rw44gu,t1_hr9dbcc,/r/todayilearned/comments/rw44gu/til_the_original_purpose_of_electric_outlets_in/hr9e512/
145,hr9f1li,Darahian,"Hey, one of my friends actually tried to save mp3 files on these floppies. Sliced them into archives and had CRC error problems when he wanted to save them on his PC. I didn't believe it... 😬","Hey, one of my friends actually tried to save mp3 files on these floppies. Sliced them into archives and had CRC error problems when he wanted to save them on his PC. I didn't believe it... 😬",1,2022-01-04 20:52:13,<praw.models.comment_forest.CommentForest object at 0x00000254212AAA60>,rw44gu,todayilearned,t5_2qqjc,,False,False,t3_rw44gu,t1_hr9dbcc,/r/todayilearned/comments/rw44gu/til_the_original_purpose_of_electric_outlets_in/hr9f1li/
146,hr9fobo,Unique9FL,Hahha,Hahha,1,2022-01-04 20:56:13,<praw.models.comment_forest.CommentForest object at 0x00000254212AA9A0>,rw44gu,todayilearned,t5_2qqjc,,False,False,t3_rw44gu,t1_hr9dbcc,/r/todayilearned/comments/rw44gu/til_the_original_purpose_of_electric_outlets_in/hr9fobo/
147,hr9ftlu,Unique9FL,What speed was your first modem?  What do modems sound like for $100,What speed was your first modem?  What do modems sound like for $100,1,2022-01-04 20:57:08,<praw.models.comment_forest.CommentForest object at 0x00000254212AA7F0>,rw44gu,todayilearned,t5_2qqjc,,False,False,t3_rw44gu,t1_hr9dbcc,/r/todayilearned/comments/rw44gu/til_the_original_purpose_of_electric_outlets_in/hr9ftlu/
148,hr9g0mg,Unique9FL,https://imgur.com/9u9CQ5S.jpg,https://imgur.com/9u9CQ5S.jpg,1,2022-01-04 20:58:22,<praw.models.comment_forest.CommentForest object at 0x00000254212AA880>,rw44gu,todayilearned,t5_2qqjc,,False,False,t3_rw44gu,t1_hr9dbcc,/r/todayilearned/comments/rw44gu/til_the_original_purpose_of_electric_outlets_in/hr9g0mg/
149,hr9fck9,Darahian,"Hey, i guess we can agree we've been waiting for this moment to release a true laugh seeing this post, huh? So OP should have my upvote. Hey #OP, thanks!","Hey, i guess we can agree we've been waiting for this moment to release a true laugh seeing this post, huh? So OP should have my upvote. Hey #OP, thanks!",-1,2022-01-04 20:54:08,<praw.models.comment_forest.CommentForest object at 0x00000254212AA730>,rw44gu,todayilearned,t5_2qqjc,,False,False,t3_rw44gu,t1_hr9euvs,/r/todayilearned/comments/rw44gu/til_the_original_purpose_of_electric_outlets_in/hr9fck9/
150,hs69gcf,Mitch_from_Boston,He probably joined when he was like 13.,He probably joined when he was like 13.,1,2022-01-11 05:54:25,<praw.models.comment_forest.CommentForest object at 0x00000254212AA520>,rw44gu,todayilearned,t5_2qqjc,,False,False,t3_rw44gu,t1_hr9euvs,/r/todayilearned/comments/rw44gu/til_the_original_purpose_of_electric_outlets_in/hs69gcf/
151,hr9kt5c,project23,"While the 12v power port is still common in cars, I don't think any of them actually come with cigarette lighters anymore.","While the 12v power port is still common in cars, I don't think any of them actually come with cigarette lighters anymore.",1,2022-01-04 21:28:37,<praw.models.comment_forest.CommentForest object at 0x00000254212AA580>,rw44gu,todayilearned,t5_2qqjc,,False,False,t3_rw44gu,t1_hr9f1c9,/r/todayilearned/comments/rw44gu/til_the_original_purpose_of_electric_outlets_in/hr9kt5c/
152,hr9drhh,yuk_dum_boo_bum,A buddy of mine in Texas owned a 60-something Mercedes with a clearly labelled CIGAR LIGHTER.,A buddy of mine in Texas owned a 60-something Mercedes with a clearly labelled CIGAR LIGHTER.,12,2022-01-04 20:44:10,<praw.models.comment_forest.CommentForest object at 0x00000254212AA490>,rw44gu,todayilearned,t5_2qqjc,,False,False,t3_rw44gu,t1_hr9dfzc,/r/todayilearned/comments/rw44gu/til_the_original_purpose_of_electric_outlets_in/hr9drhh/
153,hr9fcuj,,[deleted],[deleted],2,2022-01-04 20:54:11,<praw.models.comment_forest.CommentForest object at 0x00000254212AA460>,rw44gu,todayilearned,t5_2qqjc,,False,False,t3_rw44gu,t1_hr9dfzc,/r/todayilearned/comments/rw44gu/til_the_original_purpose_of_electric_outlets_in/hr9fcuj/
154,hrag2kb,TommyBoy825,"IIRC on the options lists on American cars they were called cigar lighters, but everyone called them cigarette lighters.","IIRC on the options lists on American cars they were called cigar lighters, but everyone called them cigarette lighters.",2,2022-01-05 00:56:00,<praw.models.comment_forest.CommentForest object at 0x00000254212AA310>,rw44gu,todayilearned,t5_2qqjc,,False,False,t3_rw44gu,t1_hr9dfzc,/r/todayilearned/comments/rw44gu/til_the_original_purpose_of_electric_outlets_in/hrag2kb/
155,hrava36,em3am,I'm guessing OP is ten.,I'm guessing OP is ten.,1,2022-01-05 02:42:20,<praw.models.comment_forest.CommentForest object at 0x00000254212AA190>,rw44gu,todayilearned,t5_2qqjc,,False,False,t3_rw44gu,t1_hr9dsc1,/r/todayilearned/comments/rw44gu/til_the_original_purpose_of_electric_outlets_in/hrava36/
156,hr9fucq,neurofly,I remember using it and it taking the tobacco out the top of the cigarette,I remember using it and it taking the tobacco out the top of the cigarette,4,2022-01-04 20:57:16,<praw.models.comment_forest.CommentForest object at 0x0000025421293FD0>,rw44gu,todayilearned,t5_2qqjc,,False,False,t3_rw44gu,t1_hr9eo6r,/r/todayilearned/comments/rw44gu/til_the_original_purpose_of_electric_outlets_in/hr9fucq/
157,hr9fefr,bolanrox,Yep me too.  Or my mom actually using one to light cigarettes,Yep me too.  Or my mom actually using one to light cigarettes,1,2022-01-04 20:54:28,<praw.models.comment_forest.CommentForest object at 0x0000025421293F40>,rw44gu,todayilearned,t5_2qqjc,,False,False,t3_rw44gu,t1_hr9eo6r,/r/todayilearned/comments/rw44gu/til_the_original_purpose_of_electric_outlets_in/hr9fefr/
158,hra8lg1,Make-Believe_Macabre,It really isn’t that obvious unless you live with smokers. I’m 21 and have never seen this used other than for charging devices.,It really isn’t that obvious unless you live with smokers. I’m 21 and have never seen this used other than for charging devices.,-1,2022-01-05 00:04:56,<praw.models.comment_forest.CommentForest object at 0x0000025421293DF0>,rw44gu,todayilearned,t5_2qqjc,,False,False,t3_rw44gu,t1_hr9i0u6,/r/todayilearned/comments/rw44gu/til_the_original_purpose_of_electric_outlets_in/hra8lg1/
159,hr9gcsf,acmethunder,">	There are people that don’t know this?

This is the real TIL here.",">	There are people that don’t know this?

This is the real TIL here.",8,2022-01-04 21:00:30,<praw.models.comment_forest.CommentForest object at 0x0000025421293850>,rw44gu,todayilearned,t5_2qqjc,,False,False,t3_rw44gu,t1_hr9e9ib,/r/todayilearned/comments/rw44gu/til_the_original_purpose_of_electric_outlets_in/hr9gcsf/
160,hr9ewzs,Star_Cop_Geno,"Yeah but I don't think I've ever met someone in my over three decades on Earth who ever actually used this thing to light a cigarette, even back in the day. People just use the lighter they brought with them.

And most smokers I know don't smoke in their cars any more. They definitely used to.","Yeah but I don't think I've ever met someone in my over three decades on Earth who ever actually used this thing to light a cigarette, even back in the day. People just use the lighter they brought with them.

And most smokers I know don't smoke in their cars any more. They definitely used to.",2,2022-01-04 20:51:25,<praw.models.comment_forest.CommentForest object at 0x0000025421293970>,rw44gu,todayilearned,t5_2qqjc,,False,False,t3_rw44gu,t1_hr9e9ib,/r/todayilearned/comments/rw44gu/til_the_original_purpose_of_electric_outlets_in/hr9ewzs/
161,hr9fj05,bolanrox,Do you have to buy the lighter after market though. Can't remember the last car I had that came with one.,Do you have to buy the lighter after market though. Can't remember the last car I had that came with one.,1,2022-01-04 20:55:16,<praw.models.comment_forest.CommentForest object at 0x00000254212938B0>,rw44gu,todayilearned,t5_2qqjc,,False,False,t3_rw44gu,t1_hr9e9ib,/r/todayilearned/comments/rw44gu/til_the_original_purpose_of_electric_outlets_in/hr9fj05/
162,hrahlua,TommyBoy825,But you learned not to do that again!,But you learned not to do that again!,1,2022-01-05 01:06:38,<praw.models.comment_forest.CommentForest object at 0x0000025421293400>,rw44gu,todayilearned,t5_2qqjc,,False,False,t3_rw44gu,t1_hr9gdvv,/r/todayilearned/comments/rw44gu/til_the_original_purpose_of_electric_outlets_in/hrahlua/
163,hrt23ws,MoonLightSongBunny,x2 ToT,x2 ToT,1,2022-01-08 18:29:41,<praw.models.comment_forest.CommentForest object at 0x0000025421276A90>,rw44gu,todayilearned,t5_2qqjc,,False,False,t3_rw44gu,t1_hr9m7sy,/r/todayilearned/comments/rw44gu/til_the_original_purpose_of_electric_outlets_in/hrt23ws/
164,hr9lufw,SamIwas118,"I have used one regularly for that very purpose, when I smoked.","I have used one regularly for that very purpose, when I smoked.",1,2022-01-04 21:35:15,<praw.models.comment_forest.CommentForest object at 0x0000025421276910>,rw44gu,todayilearned,t5_2qqjc,,False,False,t3_rw44gu,t1_hr9l2aa,/r/todayilearned/comments/rw44gu/til_the_original_purpose_of_electric_outlets_in/hr9lufw/
165,hraivvf,TommyBoy825,I always used the cigarette lighter back when I smoked. That is until they didn't have them anymore.,I always used the cigarette lighter back when I smoked. That is until they didn't have them anymore.,1,2022-01-05 01:15:32,<praw.models.comment_forest.CommentForest object at 0x0000025421276730>,rw44gu,todayilearned,t5_2qqjc,,False,False,t3_rw44gu,t1_hr9l2aa,/r/todayilearned/comments/rw44gu/til_the_original_purpose_of_electric_outlets_in/hraivvf/
166,hraj2il,TommyBoy825,My first car had an AM radio,My first car had an AM radio,1,2022-01-05 01:16:50,<praw.models.comment_forest.CommentForest object at 0x00000254212766A0>,rw44gu,todayilearned,t5_2qqjc,,False,False,t3_rw44gu,t1_hr9vbqx,/r/todayilearned/comments/rw44gu/til_the_original_purpose_of_electric_outlets_in/hraj2il/
167,hr9eqm9,CockroachJohnson,Rude.,Rude.,-2,2022-01-04 20:50:17,<praw.models.comment_forest.CommentForest object at 0x000002542129B970>,rw44gu,todayilearned,t5_2qqjc,,False,False,t3_rw44gu,t1_hr9eesl,/r/todayilearned/comments/rw44gu/til_the_original_purpose_of_electric_outlets_in/hr9eqm9/
168,hrp1ipw,Sigma-42,"Considering a 10 year old account posted this, it's hard to believe.","Considering a 10 year old account posted this, it's hard to believe.",1,2022-01-07 21:53:50,<praw.models.comment_forest.CommentForest object at 0x000002542129B8E0>,rw44gu,todayilearned,t5_2qqjc,,False,False,t3_rw44gu,t1_hracu9s,/r/todayilearned/comments/rw44gu/til_the_original_purpose_of_electric_outlets_in/hrp1ipw/
169,hraqo9i,,Never underestimate the naivety of the younger generation.,Never underestimate the naivety of the younger generation.,22,2022-01-05 02:10:15,<praw.models.comment_forest.CommentForest object at 0x000002547A654550>,rw44gu,todayilearned,t5_2qqjc,,False,False,t3_rw44gu,t1_hr9fmlt,/r/todayilearned/comments/rw44gu/til_the_original_purpose_of_electric_outlets_in/hraqo9i/
170,hrpws6t,ShadowSwipe,It's hilarious it got downvoted to zero. Lmfao,It's hilarious it got downvoted to zero. Lmfao,1,2022-01-08 01:25:19,<praw.models.comment_forest.CommentForest object at 0x000002547A654580>,rw44gu,todayilearned,t5_2qqjc,,False,False,t3_rw44gu,t1_hr9fmlt,/r/todayilearned/comments/rw44gu/til_the_original_purpose_of_electric_outlets_in/hrpws6t/
171,hsbk4dl,,"They're different now, try putting an old school lighter into one of the new 12 volt power ports, it won't stay pushed down. Idk if you could hold it to make it heat up, I've never had that much patience","They're different now, try putting an old school lighter into one of the new 12 volt power ports, it won't stay pushed down. Idk if you could hold it to make it heat up, I've never had that much patience",1,2022-01-12 07:07:30,<praw.models.comment_forest.CommentForest object at 0x000002547A6546D0>,rw44gu,todayilearned,t5_2qqjc,,False,False,t3_rw44gu,t1_hr9fmlt,/r/todayilearned/comments/rw44gu/til_the_original_purpose_of_electric_outlets_in/hsbk4dl/
172,hr9dkrt,JaTheRed,No slightly younger with better reflexes,No slightly younger with better reflexes,62,2022-01-04 20:43:00,<praw.models.comment_forest.CommentForest object at 0x000002547A6546A0>,rw44gu,todayilearned,t5_2qqjc,,False,False,t3_rw44gu,t1_hr9dflr,/r/todayilearned/comments/rw44gu/til_the_original_purpose_of_electric_outlets_in/hr9dkrt/
173,hrcyew6,R1CHARDCRANIUM,"He got up earlier. So yeah, older than you.","He got up earlier. So yeah, older than you.",1,2022-01-05 14:53:16,<praw.models.comment_forest.CommentForest object at 0x000002547A654820>,rw44gu,todayilearned,t5_2qqjc,,False,False,t3_rw44gu,t1_hr9dflr,/r/todayilearned/comments/rw44gu/til_the_original_purpose_of_electric_outlets_in/hrcyew6/
174,hr9gas1,nekomoo,Even though you probably use it mostly as a phone charger?,Even though you probably use it mostly as a phone charger?,3,2022-01-04 21:00:08,<praw.models.comment_forest.CommentForest object at 0x000002547A654D30>,rw44gu,todayilearned,t5_2qqjc,,1641330782.0,False,t3_rw44gu,t1_hr9flep,/r/todayilearned/comments/rw44gu/til_the_original_purpose_of_electric_outlets_in/hr9gas1/
175,hr9fp85,,Knew about it or burned your fingers because you played with one as a kid?,Knew about it or burned your fingers because you played with one as a kid?,32,2022-01-04 20:56:22,<praw.models.comment_forest.CommentForest object at 0x000002547A654970>,rw44gu,todayilearned,t5_2qqjc,,False,False,t3_rw44gu,t1_hr9f1h3,/r/todayilearned/comments/rw44gu/til_the_original_purpose_of_electric_outlets_in/hr9fp85/
176,hr9ggdp,BDMayhem,"Haha, you're old.","Haha, you're old.",1,2022-01-04 21:01:07,<praw.models.comment_forest.CommentForest object at 0x000002547A6547F0>,rw44gu,todayilearned,t5_2qqjc,,False,False,t3_rw44gu,t1_hr9f1h3,/r/todayilearned/comments/rw44gu/til_the_original_purpose_of_electric_outlets_in/hr9ggdp/
