,ID,Author,body,Comment,Score,Created On,Replies,Submission,Subreddit,Subreddit_ID,Distinguished,Edited,Is_submitter,link_id,Parent_id,Permalink
54,hra5y83,PrideofPicktown,What was the last vehicle produced with an actual lighter?,What was the last vehicle produced with an actual lighter?,2,2022-01-04 23:46:56,<praw.models.comment_forest.CommentForest object at 0x00000254212764F0>,rw44gu,todayilearned,t5_2qqjc,,False,False,t3_rw44gu,t3_rw44gu,/r/todayilearned/comments/rw44gu/til_the_original_purpose_of_electric_outlets_in/hra5y83/
55,hra60fb,,You're kidding right? (Please say yes),You're kidding right? (Please say yes),2,2022-01-04 23:47:22,<praw.models.comment_forest.CommentForest object at 0x0000025421276340>,rw44gu,todayilearned,t5_2qqjc,,False,False,t3_rw44gu,t3_rw44gu,/r/todayilearned/comments/rw44gu/til_the_original_purpose_of_electric_outlets_in/hra60fb/
56,hraa2ux,isaiahvacha,r/todaygenzlearned,r/todaygenzlearned,2,2022-01-05 00:15:08,<praw.models.comment_forest.CommentForest object at 0x0000025421276250>,rw44gu,todayilearned,t5_2qqjc,,False,False,t3_rw44gu,t3_rw44gu,/r/todayilearned/comments/rw44gu/til_the_original_purpose_of_electric_outlets_in/hraa2ux/
57,hrabvu7,Girthanthiclopz,Please no more posts like this. Makes me feel old.,Please no more posts like this. Makes me feel old.,2,2022-01-05 00:27:24,<praw.models.comment_forest.CommentForest object at 0x0000025421276370>,rw44gu,todayilearned,t5_2qqjc,,False,False,t3_rw44gu,t3_rw44gu,/r/todayilearned/comments/rw44gu/til_the_original_purpose_of_electric_outlets_in/hrabvu7/
58,hraeomx,bookant,"This has to be a joke, no fucking way OP really didn't know this.","This has to be a joke, no fucking way OP really didn't know this.",2,2022-01-05 00:46:31,<praw.models.comment_forest.CommentForest object at 0x0000025421276D60>,rw44gu,todayilearned,t5_2qqjc,,False,False,t3_rw44gu,t3_rw44gu,/r/todayilearned/comments/rw44gu/til_the_original_purpose_of_electric_outlets_in/hraeomx/
59,hrapujv,,I thought it was for Goofy to heat up soup.,I thought it was for Goofy to heat up soup.,2,2022-01-05 02:04:28,<praw.models.comment_forest.CommentForest object at 0x00000254212760D0>,rw44gu,todayilearned,t5_2qqjc,,False,False,t3_rw44gu,t3_rw44gu,/r/todayilearned/comments/rw44gu/til_the_original_purpose_of_electric_outlets_in/hrapujv/
60,hrayzxd,Cautious_Mistakes,Mods this is lame,Mods this is lame,2,2022-01-05 03:09:02,<praw.models.comment_forest.CommentForest object at 0x0000025421276B80>,rw44gu,todayilearned,t5_2qqjc,,False,False,t3_rw44gu,t3_rw44gu,/r/todayilearned/comments/rw44gu/til_the_original_purpose_of_electric_outlets_in/hrayzxd/
61,hrcxlrv,,I still have the lighter. I even have ash trays in the front and back. Holy fuck im getting old....,I still have the lighter. I even have ash trays in the front and back. Holy fuck im getting old....,2,2022-01-05 14:47:38,<praw.models.comment_forest.CommentForest object at 0x0000025421276130>,rw44gu,todayilearned,t5_2qqjc,,False,False,t3_rw44gu,t3_rw44gu,/r/todayilearned/comments/rw44gu/til_the_original_purpose_of_electric_outlets_in/hrcxlrv/
62,hrr1t17,chadslc,SPOILER: OP is less than 22 years old.,SPOILER: OP is less than 22 years old.,2,2022-01-08 07:13:41,<praw.models.comment_forest.CommentForest object at 0x0000025421276100>,rw44gu,todayilearned,t5_2qqjc,,False,False,t3_rw44gu,t3_rw44gu,/r/todayilearned/comments/rw44gu/til_the_original_purpose_of_electric_outlets_in/hrr1t17/
63,hr9ga2y,zomboromcom,Featured prominently in the first scene of Deadpool.,Featured prominently in the first scene of Deadpool.,2,2022-01-04 21:00:01,<praw.models.comment_forest.CommentForest object at 0x0000025421276190>,rw44gu,todayilearned,t5_2qqjc,,False,False,t3_rw44gu,t3_rw44gu,/r/todayilearned/comments/rw44gu/til_the_original_purpose_of_electric_outlets_in/hr9ga2y/
64,hr9eesl,Jtherrien12,No shit sherlock,No shit sherlock,1,2022-01-04 20:48:14,<praw.models.comment_forest.CommentForest object at 0x000002542129BAC0>,rw44gu,todayilearned,t5_2qqjc,,False,False,t3_rw44gu,t3_rw44gu,/r/todayilearned/comments/rw44gu/til_the_original_purpose_of_electric_outlets_in/hr9eesl/
65,hra8dh9,Make-Believe_Macabre,I feel bad for OP. They genuinely learned an interesting thing about their world worth sharing and the millennial majority on this site are calling them a stupid kid.,I feel bad for OP. They genuinely learned an interesting thing about their world worth sharing and the millennial majority on this site are calling them a stupid kid.,1,2022-01-05 00:03:25,<praw.models.comment_forest.CommentForest object at 0x000002542129BA60>,rw44gu,todayilearned,t5_2qqjc,,1641396309.0,False,t3_rw44gu,t3_rw44gu,/r/todayilearned/comments/rw44gu/til_the_original_purpose_of_electric_outlets_in/hra8dh9/
66,hracu9s,explicitlarynx,Can we stop downvoting op for making us feel old?,Can we stop downvoting op for making us feel old?,1,2022-01-05 00:33:55,<praw.models.comment_forest.CommentForest object at 0x000002542129BA00>,rw44gu,todayilearned,t5_2qqjc,,False,False,t3_rw44gu,t3_rw44gu,/r/todayilearned/comments/rw44gu/til_the_original_purpose_of_electric_outlets_in/hracu9s/
67,hv51y79,maluminse,lol So funny to see this on a TIL... Yep they would get very hot.,lol So funny to see this on a TIL... Yep they would get very hot.,0,2022-02-01 15:06:47,<praw.models.comment_forest.CommentForest object at 0x000002542129B9A0>,rw44gu,todayilearned,t5_2qqjc,,False,False,t3_rw44gu,t3_rw44gu,/r/todayilearned/comments/rw44gu/til_the_original_purpose_of_electric_outlets_in/hv51y79/
68,hr9pjm6,Ineedavodka2019,How old are you?,How old are you?,1,2022-01-04 21:58:53,<praw.models.comment_forest.CommentForest object at 0x000002542129B910>,rw44gu,todayilearned,t5_2qqjc,,False,False,t3_rw44gu,t3_rw44gu,/r/todayilearned/comments/rw44gu/til_the_original_purpose_of_electric_outlets_in/hr9pjm6/
69,hr9pq9o,FuriouSherman,You didn't know that?,You didn't know that?,1,2022-01-04 22:00:05,<praw.models.comment_forest.CommentForest object at 0x000002542129B8B0>,rw44gu,todayilearned,t5_2qqjc,,False,False,t3_rw44gu,t3_rw44gu,/r/todayilearned/comments/rw44gu/til_the_original_purpose_of_electric_outlets_in/hr9pq9o/
70,hr9pu2o,JellyB33ns,God I feel old. There were still cigarette lighters in cars in the early 2000s I swear.,God I feel old. There were still cigarette lighters in cars in the early 2000s I swear.,1,2022-01-04 22:00:46,<praw.models.comment_forest.CommentForest object at 0x000002542129B7F0>,rw44gu,todayilearned,t5_2qqjc,,False,False,t3_rw44gu,t3_rw44gu,/r/todayilearned/comments/rw44gu/til_the_original_purpose_of_electric_outlets_in/hr9pu2o/
71,hr9qhga,New_Rip_3957,terrible device,terrible device,1,2022-01-04 22:04:59,<praw.models.comment_forest.CommentForest object at 0x000002542129B760>,rw44gu,todayilearned,t5_2qqjc,,False,False,t3_rw44gu,t3_rw44gu,/r/todayilearned/comments/rw44gu/til_the_original_purpose_of_electric_outlets_in/hr9qhga/
72,hr9tzee,,"Aren't they still referred to as ""cigarette lighter adapters""?","Aren't they still referred to as ""cigarette lighter adapters""?",1,2022-01-04 22:27:45,<praw.models.comment_forest.CommentForest object at 0x000002542129B700>,rw44gu,todayilearned,t5_2qqjc,,False,False,t3_rw44gu,t3_rw44gu,/r/todayilearned/comments/rw44gu/til_the_original_purpose_of_electric_outlets_in/hr9tzee/
73,hr9wilp,canuckwithasig,Used light grand dad's smoke for him in the old Geo tracker!,Used light grand dad's smoke for him in the old Geo tracker!,1,2022-01-04 22:44:18,<praw.models.comment_forest.CommentForest object at 0x000002542129B5B0>,rw44gu,todayilearned,t5_2qqjc,,False,False,t3_rw44gu,t3_rw44gu,/r/todayilearned/comments/rw44gu/til_the_original_purpose_of_electric_outlets_in/hr9wilp/
74,hr9x1j0,LarrBearLV,TIL I'm old because I thought everyone knew this.,TIL I'm old because I thought everyone knew this.,1,2022-01-04 22:47:47,<praw.models.comment_forest.CommentForest object at 0x000002542129B6D0>,rw44gu,todayilearned,t5_2qqjc,,False,False,t3_rw44gu,t3_rw44gu,/r/todayilearned/comments/rw44gu/til_the_original_purpose_of_electric_outlets_in/hr9x1j0/
75,hr9ycei,bullmanbottom,"When i was growing up they had a cigarette lighter as a standard. Essentially a coil that heated up. 

My first brand new motor in 99 had the lighter fitted. My second 18 months later just intentionally had a blank - no coil. UK","When i was growing up they had a cigarette lighter as a standard. Essentially a coil that heated up. 

My first brand new motor in 99 had the lighter fitted. My second 18 months later just intentionally had a blank - no coil. UK",1,2022-01-04 22:56:17,<praw.models.comment_forest.CommentForest object at 0x000002542129B640>,rw44gu,todayilearned,t5_2qqjc,,False,False,t3_rw44gu,t3_rw44gu,/r/todayilearned/comments/rw44gu/til_the_original_purpose_of_electric_outlets_in/hr9ycei/
76,hra0m0c,HypETM_,🥴😵‍💫🤣,🥴😵‍💫🤣,1,2022-01-04 23:11:22,<praw.models.comment_forest.CommentForest object at 0x000002542129B580>,rw44gu,todayilearned,t5_2qqjc,,False,False,t3_rw44gu,t3_rw44gu,/r/todayilearned/comments/rw44gu/til_the_original_purpose_of_electric_outlets_in/hra0m0c/
77,hra1irp,ElfMage83,"Well, yes. This makes sense when you realize that smoking was popular for decades.","Well, yes. This makes sense when you realize that smoking was popular for decades.",1,2022-01-04 23:17:26,<praw.models.comment_forest.CommentForest object at 0x000002542129B520>,rw44gu,todayilearned,t5_2qqjc,,False,False,t3_rw44gu,t3_rw44gu,/r/todayilearned/comments/rw44gu/til_the_original_purpose_of_electric_outlets_in/hra1irp/
78,hra2kod,00sweege,May sound antiqued to some... now it's a vape charger,May sound antiqued to some... now it's a vape charger,1,2022-01-04 23:24:22,<praw.models.comment_forest.CommentForest object at 0x000002542129B3D0>,rw44gu,todayilearned,t5_2qqjc,,False,False,t3_rw44gu,t3_rw44gu,/r/todayilearned/comments/rw44gu/til_the_original_purpose_of_electric_outlets_in/hra2kod/
79,hradg3b,LordMandrews,Today?!,Today?!,1,2022-01-05 00:38:06,<praw.models.comment_forest.CommentForest object at 0x000002542129B4F0>,rw44gu,todayilearned,t5_2qqjc,,False,False,t3_rw44gu,t3_rw44gu,/r/todayilearned/comments/rw44gu/til_the_original_purpose_of_electric_outlets_in/hradg3b/
80,hrae3ck,mellowmarsII,"I used to pretend to punch them in for the grown-ups ""like a big girl""; but I wanted these people to *live* & let me live... (very 80s/90's reaction to tobacco smoke).
So, I'd fake it & say ""It's... still not working. Dirty, you think?"" & show it to them all white like the coils were clogged.
""Yeah, i gotta clean it out. Forget it.""
I'd put it back & sigh in relief - while they were prolly having a nic fit. 
I feel remorse in hindsight. I started smoking at 11 until... not anymore.","I used to pretend to punch them in for the grown-ups ""like a big girl""; but I wanted these people to *live* & let me live... (very 80s/90's reaction to tobacco smoke).
So, I'd fake it & say ""It's... still not working. Dirty, you think?"" & show it to them all white like the coils were clogged.
""Yeah, i gotta clean it out. Forget it.""
I'd put it back & sigh in relief - while they were prolly having a nic fit. 
I feel remorse in hindsight. I started smoking at 11 until... not anymore.",1,2022-01-05 00:42:28,<praw.models.comment_forest.CommentForest object at 0x000002542129B460>,rw44gu,todayilearned,t5_2qqjc,,False,False,t3_rw44gu,t3_rw44gu,/r/todayilearned/comments/rw44gu/til_the_original_purpose_of_electric_outlets_in/hrae3ck/
81,hraeqqg,NickoNitsua,"My 2007 ranger is standard with a cig lighter. Wouldn’t have it any other way. Btw if your car has one and it doesn’t work, it’s probably a cheap fuse.","My 2007 ranger is standard with a cig lighter. Wouldn’t have it any other way. Btw if your car has one and it doesn’t work, it’s probably a cheap fuse.",1,2022-01-05 00:46:55,<praw.models.comment_forest.CommentForest object at 0x000002542129B3A0>,rw44gu,todayilearned,t5_2qqjc,,False,False,t3_rw44gu,t3_rw44gu,/r/todayilearned/comments/rw44gu/til_the_original_purpose_of_electric_outlets_in/hraeqqg/
82,hrahfyw,,Damn I still remember when Max and Goofy had a father n son moment in the car. He warmed up a can of soup with one of these bad boys...,Damn I still remember when Max and Goofy had a father n son moment in the car. He warmed up a can of soup with one of these bad boys...,1,2022-01-05 01:05:30,<praw.models.comment_forest.CommentForest object at 0x000002542129B340>,rw44gu,todayilearned,t5_2qqjc,,False,False,t3_rw44gu,t3_rw44gu,/r/todayilearned/comments/rw44gu/til_the_original_purpose_of_electric_outlets_in/hrahfyw/
83,hrahox7,brenghol,You must be young...,You must be young...,1,2022-01-05 01:07:13,<praw.models.comment_forest.CommentForest object at 0x000002542129B2B0>,rw44gu,todayilearned,t5_2qqjc,,False,False,t3_rw44gu,t3_rw44gu,/r/todayilearned/comments/rw44gu/til_the_original_purpose_of_electric_outlets_in/hrahox7/
84,hramo6s,troc18,I feel like some 12yr old kid wrote this,I feel like some 12yr old kid wrote this,1,2022-01-05 01:42:14,<praw.models.comment_forest.CommentForest object at 0x000002542129B280>,rw44gu,todayilearned,t5_2qqjc,,False,False,t3_rw44gu,t3_rw44gu,/r/todayilearned/comments/rw44gu/til_the_original_purpose_of_electric_outlets_in/hramo6s/
85,hrar9ff,dmah2004,TIL should require OP to state their age so we can learn the cutoff of common knowledge.,TIL should require OP to state their age so we can learn the cutoff of common knowledge.,1,2022-01-05 02:14:23,<praw.models.comment_forest.CommentForest object at 0x000002542129B1C0>,rw44gu,todayilearned,t5_2qqjc,,False,False,t3_rw44gu,t3_rw44gu,/r/todayilearned/comments/rw44gu/til_the_original_purpose_of_electric_outlets_in/hrar9ff/
86,hrav7ce,Goshdudette,"Okay I’m dying! The little plug that took out to plug in my cell phone charger, i assumed it was a cigarette lighter, am I so old and out of date that I missed that it is no longer a lighter? Car from 2010 lol","Okay I’m dying! The little plug that took out to plug in my cell phone charger, i assumed it was a cigarette lighter, am I so old and out of date that I missed that it is no longer a lighter? Car from 2010 lol",1,2022-01-05 02:41:48,<praw.models.comment_forest.CommentForest object at 0x000002542129B190>,rw44gu,todayilearned,t5_2qqjc,,False,False,t3_rw44gu,t3_rw44gu,/r/todayilearned/comments/rw44gu/til_the_original_purpose_of_electric_outlets_in/hrav7ce/
87,hrcnvw1,Luvbeers,"""What is that pull-out tray underneath the phone charger plug? It is too small for my iPhone15""","""What is that pull-out tray underneath the phone charger plug? It is too small for my iPhone15""",1,2022-01-05 13:33:16,<praw.models.comment_forest.CommentForest object at 0x000002542129B0D0>,rw44gu,todayilearned,t5_2qqjc,,False,False,t3_rw44gu,t3_rw44gu,/r/todayilearned/comments/rw44gu/til_the_original_purpose_of_electric_outlets_in/hrcnvw1/
88,hrs5uvk,Will-Bo-Baggins,"Pmy car has one, its fantastic","Pmy car has one, its fantastic",1,2022-01-08 14:49:47,<praw.models.comment_forest.CommentForest object at 0x000002542129B070>,rw44gu,todayilearned,t5_2qqjc,,False,False,t3_rw44gu,t3_rw44gu,/r/todayilearned/comments/rw44gu/til_the_original_purpose_of_electric_outlets_in/hrs5uvk/
89,hrsatvf,_Life-is-Relative_,I still call it that and I don't smoke.,I still call it that and I don't smoke.,1,2022-01-08 15:27:07,<praw.models.comment_forest.CommentForest object at 0x000002542129BF10>,rw44gu,todayilearned,t5_2qqjc,,False,False,t3_rw44gu,t3_rw44gu,/r/todayilearned/comments/rw44gu/til_the_original_purpose_of_electric_outlets_in/hrsatvf/
90,hru6b59,Messingwithgreen,"pffff,,

Kids these days.....

:)","pffff,,

Kids these days.....

:)",1,2022-01-08 22:58:11,<praw.models.comment_forest.CommentForest object at 0x000002542129BE50>,rw44gu,todayilearned,t5_2qqjc,,False,False,t3_rw44gu,t3_rw44gu,/r/todayilearned/comments/rw44gu/til_the_original_purpose_of_electric_outlets_in/hru6b59/
91,hs0i2tx,Thatoneplaceonce,Oh my God we've reached this time in our lives?,Oh my God we've reached this time in our lives?,1,2022-01-10 03:39:55,<praw.models.comment_forest.CommentForest object at 0x000002542129BE80>,rw44gu,todayilearned,t5_2qqjc,,False,False,t3_rw44gu,t3_rw44gu,/r/todayilearned/comments/rw44gu/til_the_original_purpose_of_electric_outlets_in/hs0i2tx/
92,hs1ka97,infodawg,"Damn, I feel old","Damn, I feel old",1,2022-01-10 09:32:07,<praw.models.comment_forest.CommentForest object at 0x000002542129BDC0>,rw44gu,todayilearned,t5_2qqjc,,False,False,t3_rw44gu,t3_rw44gu,/r/todayilearned/comments/rw44gu/til_the_original_purpose_of_electric_outlets_in/hs1ka97/
93,hta8uae,Broken-Butterfly,That's why they're called lighters...,That's why they're called lighters...,1,2022-01-19 05:52:18,<praw.models.comment_forest.CommentForest object at 0x000002542129BEB0>,rw44gu,todayilearned,t5_2qqjc,,False,False,t3_rw44gu,t3_rw44gu,/r/todayilearned/comments/rw44gu/til_the_original_purpose_of_electric_outlets_in/hta8uae/
94,htr8jvp,crazy_days2go,I kinda always wondered why they don't  have standard plug-in outlets instead of the cigarette lighter outlet.,I kinda always wondered why they don't  have standard plug-in outlets instead of the cigarette lighter outlet.,1,2022-01-22 16:07:27,<praw.models.comment_forest.CommentForest object at 0x000002542129BD00>,rw44gu,todayilearned,t5_2qqjc,,False,False,t3_rw44gu,t3_rw44gu,/r/todayilearned/comments/rw44gu/til_the_original_purpose_of_electric_outlets_in/htr8jvp/
95,i530gfo,coffee2323,The original purpose was to stop the battery over charging you would press in the button every 5 mkns or so. Then they worked out you light smokes with them.,The original purpose was to stop the battery over charging you would press in the button every 5 mkns or so. Then they worked out you light smokes with them.,1,2022-04-17 14:11:49,<praw.models.comment_forest.CommentForest object at 0x000002542129BDF0>,rw44gu,todayilearned,t5_2qqjc,,False,False,t3_rw44gu,t3_rw44gu,/r/todayilearned/comments/rw44gu/til_the_original_purpose_of_electric_outlets_in/i530gfo/
96,j6x3sje,justinw3184,Thank you OP you made me feel old this morning. I'm not even 40 yet......get off my lawn.,Thank you OP you made me feel old this morning. I'm not even 40 yet......get off my lawn.,1,2023-02-02 14:48:24,<praw.models.comment_forest.CommentForest object at 0x000002542129BD30>,rw44gu,todayilearned,t5_2qqjc,,False,False,t3_rw44gu,t3_rw44gu,/r/todayilearned/comments/rw44gu/til_the_original_purpose_of_electric_outlets_in/j6x3sje/
97,hr9fmlt,Unique9FL,🤣🤣🤣😅 WAIT this info has made it to TIL? Insane! I'm floored.,🤣🤣🤣😅 WAIT this info has made it to TIL? Insane! I'm floored.,137,2022-01-04 20:55:54,<praw.models.comment_forest.CommentForest object at 0x000002547A654280>,rw44gu,todayilearned,t5_2qqjc,,False,False,t3_rw44gu,t1_hr9d7d2,/r/todayilearned/comments/rw44gu/til_the_original_purpose_of_electric_outlets_in/hr9fmlt/
98,hr9dflr,84020g8r,"You beat me to it.  

Does that mean you must be older than me?","You beat me to it.  

Does that mean you must be older than me?",71,2022-01-04 20:42:07,<praw.models.comment_forest.CommentForest object at 0x000002547A654790>,rw44gu,todayilearned,t5_2qqjc,,False,False,t3_rw44gu,t1_hr9d7d2,/r/todayilearned/comments/rw44gu/til_the_original_purpose_of_electric_outlets_in/hr9dflr/
99,hr9flep,SadPanthersFan,"Yeah, I still call it the cigarette lighter.","Yeah, I still call it the cigarette lighter.",34,2022-01-04 20:55:42,<praw.models.comment_forest.CommentForest object at 0x000002547A654A90>,rw44gu,todayilearned,t5_2qqjc,,False,False,t3_rw44gu,t1_hr9d7d2,/r/todayilearned/comments/rw44gu/til_the_original_purpose_of_electric_outlets_in/hr9flep/
100,hr9f1h3,MrGeekman,I’m only 27 and yet I already knew about it.,I’m only 27 and yet I already knew about it.,26,2022-01-04 20:52:12,<praw.models.comment_forest.CommentForest object at 0x000002547A654F40>,rw44gu,todayilearned,t5_2qqjc,,False,False,t3_rw44gu,t1_hr9d7d2,/r/todayilearned/comments/rw44gu/til_the_original_purpose_of_electric_outlets_in/hr9f1h3/
101,hr9fizs,CitizenLaim,"Well look who we have here, mr. Fancy no seatbelts whatsoever or headrests, smoking inside windows rolled up, kids jumping around. 

Basically the world was built for (and by) grownups. Kids just had to not die a lot to become one and then you were safe (house, job, etc).","Well look who we have here, mr. Fancy no seatbelts whatsoever or headrests, smoking inside windows rolled up, kids jumping around. 

Basically the world was built for (and by) grownups. Kids just had to not die a lot to become one and then you were safe (house, job, etc).",13,2022-01-04 20:55:16,<praw.models.comment_forest.CommentForest object at 0x000002547A654B50>,rw44gu,todayilearned,t5_2qqjc,,False,False,t3_rw44gu,t1_hr9d7d2,/r/todayilearned/comments/rw44gu/til_the_original_purpose_of_electric_outlets_in/hr9fizs/
102,hr9ktix,matolandio,you’re not old. this is bait.,you’re not old. this is bait.,4,2022-01-04 21:28:41,<praw.models.comment_forest.CommentForest object at 0x000002547AA9F490>,rw44gu,todayilearned,t5_2qqjc,,False,False,t3_rw44gu,t1_hr9d7d2,/r/todayilearned/comments/rw44gu/til_the_original_purpose_of_electric_outlets_in/hr9ktix/
103,hr9wc9u,TristanaRiggle,"I remember when the ""coin drawer"" was still an ash tray.","I remember when the ""coin drawer"" was still an ash tray.",4,2022-01-04 22:43:08,<praw.models.comment_forest.CommentForest object at 0x000002541B0EFD90>,rw44gu,todayilearned,t5_2qqjc,,False,False,t3_rw44gu,t1_hr9d7d2,/r/todayilearned/comments/rw44gu/til_the_original_purpose_of_electric_outlets_in/hr9wc9u/
104,hr9duiv,shrivledrivle,Fell into that trap didn't you....,Fell into that trap didn't you....,5,2022-01-04 20:44:41,<praw.models.comment_forest.CommentForest object at 0x000002541B0EFFD0>,rw44gu,todayilearned,t5_2qqjc,,False,False,t3_rw44gu,t1_hr9d7d2,/r/todayilearned/comments/rw44gu/til_the_original_purpose_of_electric_outlets_in/hr9duiv/
105,hr9f3ct,MrJones-,Just said the same thing to myself mate…,Just said the same thing to myself mate…,3,2022-01-04 20:52:32,<praw.models.comment_forest.CommentForest object at 0x000002541B0EF130>,rw44gu,todayilearned,t5_2qqjc,,False,False,t3_rw44gu,t1_hr9d7d2,/r/todayilearned/comments/rw44gu/til_the_original_purpose_of_electric_outlets_in/hr9f3ct/
106,hr9kmui,FAQUA,For real lol. That was basically what you did while your mom was in the store while you waited in the car. Just push the cigarette lighter in and out.,For real lol. That was basically what you did while your mom was in the store while you waited in the car. Just push the cigarette lighter in and out.,3,2022-01-04 21:27:31,<praw.models.comment_forest.CommentForest object at 0x000002541B0EFC10>,rw44gu,todayilearned,t5_2qqjc,,False,False,t3_rw44gu,t1_hr9d7d2,/r/todayilearned/comments/rw44gu/til_the_original_purpose_of_electric_outlets_in/hr9kmui/
107,hr9glvv,Bogey01,"Na, it's just the teenagers on reddit.","Na, it's just the teenagers on reddit.",2,2022-01-04 21:02:05,<praw.models.comment_forest.CommentForest object at 0x000002541B0EFA90>,rw44gu,todayilearned,t5_2qqjc,,False,False,t3_rw44gu,t1_hr9d7d2,/r/todayilearned/comments/rw44gu/til_the_original_purpose_of_electric_outlets_in/hr9glvv/
108,hr9jflf,wutinthehail,Knew this was going to be the first comment. I'm with you buddy,Knew this was going to be the first comment. I'm with you buddy,2,2022-01-04 21:19:58,<praw.models.comment_forest.CommentForest object at 0x000002541B0EF760>,rw44gu,todayilearned,t5_2qqjc,,False,False,t3_rw44gu,t1_hr9d7d2,/r/todayilearned/comments/rw44gu/til_the_original_purpose_of_electric_outlets_in/hr9jflf/
109,hr9jh3z,Drought_God,Same.,Same.,2,2022-01-04 21:20:14,<praw.models.comment_forest.CommentForest object at 0x000002541B0EF6D0>,rw44gu,todayilearned,t5_2qqjc,,False,False,t3_rw44gu,t1_hr9d7d2,/r/todayilearned/comments/rw44gu/til_the_original_purpose_of_electric_outlets_in/hr9jh3z/
110,hr9ju7x,RedSonGamble,"I know I was like oh buddy. 

Remember when you use to pop it out and throw it down your buddies shirt and he would start screaming thinking it was hot. Oh good times.","I know I was like oh buddy. 

Remember when you use to pop it out and throw it down your buddies shirt and he would start screaming thinking it was hot. Oh good times.",2,2022-01-04 21:22:31,<praw.models.comment_forest.CommentForest object at 0x000002541B0EF5E0>,rw44gu,todayilearned,t5_2qqjc,,False,False,t3_rw44gu,t1_hr9d7d2,/r/todayilearned/comments/rw44gu/til_the_original_purpose_of_electric_outlets_in/hr9ju7x/
111,hr9lchi,Prestigious_Lab_8356,"Me too friend, me too.  I hope this is satire.","Me too friend, me too.  I hope this is satire.",2,2022-01-04 21:32:04,<praw.models.comment_forest.CommentForest object at 0x000002541B0EF700>,rw44gu,todayilearned,t5_2qqjc,,False,False,t3_rw44gu,t1_hr9d7d2,/r/todayilearned/comments/rw44gu/til_the_original_purpose_of_electric_outlets_in/hr9lchi/
112,hr9rkd3,GaryTheSoulReaper,I feel like my 2000 model pathfinder still came with a cigarette lighter. I actually have one of the spirals I kept but it won’t work in a modern 12v socket,I feel like my 2000 model pathfinder still came with a cigarette lighter. I actually have one of the spirals I kept but it won’t work in a modern 12v socket,2,2022-01-04 22:12:04,<praw.models.comment_forest.CommentForest object at 0x000002541B0EF640>,rw44gu,todayilearned,t5_2qqjc,,False,False,t3_rw44gu,t1_hr9d7d2,/r/todayilearned/comments/rw44gu/til_the_original_purpose_of_electric_outlets_in/hr9rkd3/
113,hra3pwh,rugbat,Me too. I thought this was common knowledge.,Me too. I thought this was common knowledge.,2,2022-01-04 23:31:56,<praw.models.comment_forest.CommentForest object at 0x000002541B0EF820>,rw44gu,todayilearned,t5_2qqjc,,False,False,t3_rw44gu,t1_hr9d7d2,/r/todayilearned/comments/rw44gu/til_the_original_purpose_of_electric_outlets_in/hra3pwh/
