,ID,Author,body,Comment,Score,Created On,Replies,Submission,Subreddit,Subreddit_ID,Distinguished,Edited,Is_submitter,link_id,Parent_id,Permalink
231,hrbrsjp,ytilonhdbfgvds,"I actually flew through the back window of a pickup as a kid.  Do not recommend surfing in the truck bed, unless you're as or more lucky than I am.  I had not a scratch or bruise on me.","I actually flew through the back window of a pickup as a kid.  Do not recommend surfing in the truck bed, unless you're as or more lucky than I am.  I had not a scratch or bruise on me.",1,2022-01-05 07:26:35,<praw.models.comment_forest.CommentForest object at 0x000002547AA9F400>,rw44gu,todayilearned,t5_2qqjc,,False,False,t3_rw44gu,t1_hrakcwx,/r/todayilearned/comments/rw44gu/til_the_original_purpose_of_electric_outlets_in/hrbrsjp/
232,hrar5y6,FerrisBuellersDayOff,If she was your step sister you can stop that story right now mister! LOL,If she was your step sister you can stop that story right now mister! LOL,1,2022-01-05 02:13:42,<praw.models.comment_forest.CommentForest object at 0x000002541B0EFEE0>,rw44gu,todayilearned,t5_2qqjc,,False,False,t3_rw44gu,t1_hr9u66l,/r/todayilearned/comments/rw44gu/til_the_original_purpose_of_electric_outlets_in/hrar5y6/
233,hr9ehy0,Star_Cop_Geno,I'm not even close to elderly and I knew what the cigarette lighter in the car was for.,I'm not even close to elderly and I knew what the cigarette lighter in the car was for.,7,2022-01-04 20:48:47,<praw.models.comment_forest.CommentForest object at 0x000002541B0EF040>,rw44gu,todayilearned,t5_2qqjc,,False,False,t3_rw44gu,t1_hr9e1ao,/r/todayilearned/comments/rw44gu/til_the_original_purpose_of_electric_outlets_in/hr9ehy0/
234,hr9hio1,shrivledrivle,"Nope, deep hot flanges I was thinking..","Nope, deep hot flanges I was thinking..",0,2022-01-04 21:07:54,<praw.models.comment_forest.CommentForest object at 0x000002541B0EFB50>,rw44gu,todayilearned,t5_2qqjc,,False,False,t3_rw44gu,t1_hr9e1ao,/r/todayilearned/comments/rw44gu/til_the_original_purpose_of_electric_outlets_in/hr9hio1/
235,hrdwo4w,Dangerous-Honey-4481,"Better keep it in good shape.  I dare say by the end of this decade, manuals will be no more...  Not to mention that I.C.E. cars will be a thing of the past by say 2040 when manufacturers go all electric.","Better keep it in good shape.  I dare say by the end of this decade, manuals will be no more...  Not to mention that I.C.E. cars will be a thing of the past by say 2040 when manufacturers go all electric.",2,2022-01-05 18:26:27,<praw.models.comment_forest.CommentForest object at 0x000002541E47DF70>,rw44gu,todayilearned,t5_2qqjc,,False,False,t3_rw44gu,t1_hrdhpud,/r/todayilearned/comments/rw44gu/til_the_original_purpose_of_electric_outlets_in/hrdwo4w/
236,hr9pd2b,smurfsundermybed,"So, like analog vapes?","So, like analog vapes?",20,2022-01-04 21:57:42,<praw.models.comment_forest.CommentForest object at 0x000002541E47DC70>,rw44gu,todayilearned,t5_2qqjc,,False,False,t3_rw44gu,t1_hr9jrdl,/r/todayilearned/comments/rw44gu/til_the_original_purpose_of_electric_outlets_in/hr9pd2b/
237,hr9fo7e,Star_Cop_Geno,"You could always burn spirals onto all of your victim's fingertips. Blend in with the crowd, those spirals could belong to anyone who was there at the time.

Then the news could give you a cool nickname like the Spiral Stealer.","You could always burn spirals onto all of your victim's fingertips. Blend in with the crowd, those spirals could belong to anyone who was there at the time.

Then the news could give you a cool nickname like the Spiral Stealer.",3,2022-01-04 20:56:11,<praw.models.comment_forest.CommentForest object at 0x000002541E47D5E0>,rw44gu,todayilearned,t5_2qqjc,,False,False,t3_rw44gu,t1_hr9esgx,/r/todayilearned/comments/rw44gu/til_the_original_purpose_of_electric_outlets_in/hr9fo7e/
238,hr9ua7g,WeirdFlexCapacitor,I think that’s why I touched it? Because it looked so similar to a finger print.,I think that’s why I touched it? Because it looked so similar to a finger print.,2,2022-01-04 22:29:41,<praw.models.comment_forest.CommentForest object at 0x000002541E47D9A0>,rw44gu,todayilearned,t5_2qqjc,,False,False,t3_rw44gu,t1_hr9l0np,/r/todayilearned/comments/rw44gu/til_the_original_purpose_of_electric_outlets_in/hr9ua7g/
239,hr9gbqb,,Doesn’t it always?? Lol,Doesn’t it always?? Lol,9,2022-01-04 21:00:19,<praw.models.comment_forest.CommentForest object at 0x000002541E4971C0>,rw44gu,todayilearned,t5_2qqjc,,False,False,t3_rw44gu,t1_hr9fm62,/r/todayilearned/comments/rw44gu/til_the_original_purpose_of_electric_outlets_in/hr9gbqb/
240,hr9gia6,Raving_Lunatic69,"Been there, done that, lost my mind looking for a transposed 01","Been there, done that, lost my mind looking for a transposed 01",8,2022-01-04 21:01:27,<praw.models.comment_forest.CommentForest object at 0x000002541E497220>,rw44gu,todayilearned,t5_2qqjc,,False,False,t3_rw44gu,t1_hr9g0xs,/r/todayilearned/comments/rw44gu/til_the_original_purpose_of_electric_outlets_in/hr9gia6/
241,hr9gkg0,,Oh my….. glad I missed those days,Oh my….. glad I missed those days,1,2022-01-04 21:01:51,<praw.models.comment_forest.CommentForest object at 0x000002541E497130>,rw44gu,todayilearned,t5_2qqjc,,False,False,t3_rw44gu,t1_hr9g0xs,/r/todayilearned/comments/rw44gu/til_the_original_purpose_of_electric_outlets_in/hr9gkg0/
242,hra88ud,razldazlbradybazzell,And what fun that is,And what fun that is,1,2022-01-05 00:02:33,<praw.models.comment_forest.CommentForest object at 0x000002541E497E80>,rw44gu,todayilearned,t5_2qqjc,,False,False,t3_rw44gu,t1_hr9g0xs,/r/todayilearned/comments/rw44gu/til_the_original_purpose_of_electric_outlets_in/hra88ud/
243,hraevv8,TommyBoy825,"Did not bend easily. If you were really frustrated, they would bend before they broke.","Did not bend easily. If you were really frustrated, they would bend before they broke.",2,2022-01-05 00:47:54,<praw.models.comment_forest.CommentForest object at 0x000002541E497CD0>,rw44gu,todayilearned,t5_2qqjc,,False,False,t3_rw44gu,t1_hr9wpwl,/r/todayilearned/comments/rw44gu/til_the_original_purpose_of_electric_outlets_in/hraevv8/
244,hra674e,Doobage,Are you still confused why they are called that?,Are you still confused why they are called that?,1,2022-01-04 23:48:35,<praw.models.comment_forest.CommentForest object at 0x000002541E497160>,rw44gu,todayilearned,t5_2qqjc,,1641340392.0,False,t3_rw44gu,t1_hr9wpwl,/r/todayilearned/comments/rw44gu/til_the_original_purpose_of_electric_outlets_in/hra674e/
245,hr9fhok,,I gotcha. 7-8 for me. 😆,I gotcha. 7-8 for me. 😆,2,2022-01-04 20:55:03,<praw.models.comment_forest.CommentForest object at 0x000002541E497D30>,rw44gu,todayilearned,t5_2qqjc,,False,False,t3_rw44gu,t1_hr9f2tx,/r/todayilearned/comments/rw44gu/til_the_original_purpose_of_electric_outlets_in/hr9fhok/
246,hr9velk,elcheapodeluxe,They made little punchers - like paper hole punchers - that fit on the disk in exactly the right spot to make the hole in exactly the right shape. I think they were about $5 for the punch.,They made little punchers - like paper hole punchers - that fit on the disk in exactly the right spot to make the hole in exactly the right shape. I think they were about $5 for the punch.,2,2022-01-04 22:37:00,<praw.models.comment_forest.CommentForest object at 0x000002541E497970>,rw44gu,todayilearned,t5_2qqjc,,False,False,t3_rw44gu,t1_hr9p0do,/r/todayilearned/comments/rw44gu/til_the_original_purpose_of_electric_outlets_in/hr9velk/
247,hr9eyx6,ausamerika,Don't tell the OP that I learned to program... on punch-cards,Don't tell the OP that I learned to program... on punch-cards,11,2022-01-04 20:51:45,<praw.models.comment_forest.CommentForest object at 0x000002541E497730>,rw44gu,todayilearned,t5_2qqjc,,False,False,t3_rw44gu,t1_hr9et9v,/r/todayilearned/comments/rw44gu/til_the_original_purpose_of_electric_outlets_in/hr9eyx6/
248,hr9gstd,ausamerika,"Are you sure that's not a retronym? I clearly remember distinctions in advertising and sales from around that time wherein the 5.25"" discs were called floppies and the new, plastic 3.5"" discs were called diskettes... because they weren't floppy.","Are you sure that's not a retronym? I clearly remember distinctions in advertising and sales from around that time wherein the 5.25"" discs were called floppies and the new, plastic 3.5"" discs were called diskettes... because they weren't floppy.",0,2022-01-04 21:03:19,<praw.models.comment_forest.CommentForest object at 0x000002541E4975B0>,rw44gu,todayilearned,t5_2qqjc,,False,False,t3_rw44gu,t1_hr9g24l,/r/todayilearned/comments/rw44gu/til_the_original_purpose_of_electric_outlets_in/hr9gstd/
249,hr9fcq3,AlGeee,Bill Gates?,Bill Gates?,5,2022-01-04 20:54:10,<praw.models.comment_forest.CommentForest object at 0x00000254212AAD30>,rw44gu,todayilearned,t5_2qqjc,,False,False,t3_rw44gu,t1_hr9eqld,/r/todayilearned/comments/rw44gu/til_the_original_purpose_of_electric_outlets_in/hr9fcq3/
250,hra7epg,debbymck2018,Wowzers xx,Wowzers xx,1,2022-01-04 23:56:47,<praw.models.comment_forest.CommentForest object at 0x00000254212AAC40>,rw44gu,todayilearned,t5_2qqjc,,False,False,t3_rw44gu,t1_hra3oj1,/r/todayilearned/comments/rw44gu/til_the_original_purpose_of_electric_outlets_in/hra7epg/
251,hr9huxk,obversation,My first computer didn't have software to view jpgs.  I had to take my disk with one single image that took all night to download to a friend's house in order to see the image.  The filename was something like bplug_023.jpg.  14 year old me was not prepared to see the image contents.,My first computer didn't have software to view jpgs.  I had to take my disk with one single image that took all night to download to a friend's house in order to see the image.  The filename was something like bplug_023.jpg.  14 year old me was not prepared to see the image contents.,3,2022-01-04 21:10:01,<praw.models.comment_forest.CommentForest object at 0x00000254212AA910>,rw44gu,todayilearned,t5_2qqjc,,False,False,t3_rw44gu,t1_hr9fby6,/r/todayilearned/comments/rw44gu/til_the_original_purpose_of_electric_outlets_in/hr9huxk/
252,hr9mc2q,Unique9FL,"Hehe I think my modem was 14.4kb a second.  And my first Intel was 166mghrz. I was mad my buddy got his computer few months later and it came in all black, 244mghrz processor and 28.8kb modem and it was half price my IBM. I was 🤬","Hehe I think my modem was 14.4kb a second.  And my first Intel was 166mghrz. I was mad my buddy got his computer few months later and it came in all black, 244mghrz processor and 28.8kb modem and it was half price my IBM. I was 🤬",1,2022-01-04 21:38:21,<praw.models.comment_forest.CommentForest object at 0x00000254212AA610>,rw44gu,todayilearned,t5_2qqjc,,False,False,t3_rw44gu,t1_hr9iejz,/r/todayilearned/comments/rw44gu/til_the_original_purpose_of_electric_outlets_in/hr9mc2q/
253,hr9l38j,project23,Then you freak out and rip the cigarette out of your mouth which was of course stuck to some dry lip flesh and AAAAAAAAHHHHHHHHHHH... yah.... So glad I stopped smoking.,Then you freak out and rip the cigarette out of your mouth which was of course stuck to some dry lip flesh and AAAAAAAAHHHHHHHHHHH... yah.... So glad I stopped smoking.,2,2022-01-04 21:30:25,<praw.models.comment_forest.CommentForest object at 0x0000025421293C70>,rw44gu,todayilearned,t5_2qqjc,,False,False,t3_rw44gu,t1_hr9ixt5,/r/todayilearned/comments/rw44gu/til_the_original_purpose_of_electric_outlets_in/hr9l38j/
254,hr9h0jr,bolanrox,makes sense i know for sure none of my hondas (all base models as far as i remember) since 2008 have had them.  and i know that my 2000's fords didnt either.,makes sense i know for sure none of my hondas (all base models as far as i remember) since 2008 have had them.  and i know that my 2000's fords didnt either.,1,2022-01-04 21:04:40,<praw.models.comment_forest.CommentForest object at 0x0000025421293550>,rw44gu,todayilearned,t5_2qqjc,,False,False,t3_rw44gu,t1_hr9gvqn,/r/todayilearned/comments/rw44gu/til_the_original_purpose_of_electric_outlets_in/hr9h0jr/
255,hrdtrf9,,True. I’m teaching my kids to smoke today.,True. I’m teaching my kids to smoke today.,3,2022-01-05 18:09:13,<praw.models.comment_forest.CommentForest object at 0x000002547A654E50>,rw44gu,todayilearned,t5_2qqjc,,False,False,t3_rw44gu,t1_hrdfz4h,/r/todayilearned/comments/rw44gu/til_the_original_purpose_of_electric_outlets_in/hrdtrf9/
256,hunvok0,Broken-Butterfly,I'd assume lack of a flange in the barrell. Plugs also don't stay in them as well.,I'd assume lack of a flange in the barrell. Plugs also don't stay in them as well.,1,2022-01-29 01:25:00,<praw.models.comment_forest.CommentForest object at 0x000002547A6549D0>,rw44gu,todayilearned,t5_2qqjc,,False,False,t3_rw44gu,t1_hsdrigf,/r/todayilearned/comments/rw44gu/til_the_original_purpose_of_electric_outlets_in/hunvok0/
257,hra1f3q,JaTheRed,Haha 'Youth and exuberance will fall to experience and deception',Haha 'Youth and exuberance will fall to experience and deception',4,2022-01-04 23:16:45,<praw.models.comment_forest.CommentForest object at 0x000002547A654CD0>,rw44gu,todayilearned,t5_2qqjc,,False,False,t3_rw44gu,t1_hr9l3et,/r/todayilearned/comments/rw44gu/til_the_original_purpose_of_electric_outlets_in/hra1f3q/
258,hr9pcrn,JonnyxKarate,_This_ comment,_This_ comment,2,2022-01-04 21:57:39,<praw.models.comment_forest.CommentForest object at 0x000002547A654D90>,rw44gu,todayilearned,t5_2qqjc,,False,False,t3_rw44gu,t1_hr9hheq,/r/todayilearned/comments/rw44gu/til_the_original_purpose_of_electric_outlets_in/hr9pcrn/
259,hr9h9v9,zoinks690,I'm old enough to know what a hot cigarette lighter used for its stated purpose smells like.,I'm old enough to know what a hot cigarette lighter used for its stated purpose smells like.,12,2022-01-04 21:06:18,<praw.models.comment_forest.CommentForest object at 0x000002547AA9FE20>,rw44gu,todayilearned,t5_2qqjc,,False,False,t3_rw44gu,t1_hr9g89z,/r/todayilearned/comments/rw44gu/til_the_original_purpose_of_electric_outlets_in/hr9h9v9/
260,hrd0zb6,me_bails,i'm poor enough to have got my 1st car *without* one in the last year and a half.,i'm poor enough to have got my 1st car *without* one in the last year and a half.,1,2022-01-05 15:10:55,<praw.models.comment_forest.CommentForest object at 0x000002547AA9FF70>,rw44gu,todayilearned,t5_2qqjc,,False,False,t3_rw44gu,t1_hr9g89z,/r/todayilearned/comments/rw44gu/til_the_original_purpose_of_electric_outlets_in/hrd0zb6/
261,hs559eu,fricks_with_dogs,">When I was younger...

Just how old are you? The car I drive now has a cigarette lighter in it. It's an '02 granted... But I wouldn't consider that terribly old.",">When I was younger...

Just how old are you? The car I drive now has a cigarette lighter in it. It's an '02 granted... But I wouldn't consider that terribly old.",1,2022-01-11 01:01:33,<praw.models.comment_forest.CommentForest object at 0x000002547AA9FE50>,rw44gu,todayilearned,t5_2qqjc,,False,False,t3_rw44gu,t1_hr9g89z,/r/todayilearned/comments/rw44gu/til_the_original_purpose_of_electric_outlets_in/hs559eu/
262,hrb5v1v,Nicktastic6,Thats not thay important. It's what they were named. The whole time. Juuuust saying i think it is pretty expected a 27 year old would know what it is.,Thats not thay important. It's what they were named. The whole time. Juuuust saying i think it is pretty expected a 27 year old would know what it is.,1,2022-01-05 04:00:51,<praw.models.comment_forest.CommentForest object at 0x000002547AA9F220>,rw44gu,todayilearned,t5_2qqjc,,False,False,t3_rw44gu,t1_hrb5fko,/r/todayilearned/comments/rw44gu/til_the_original_purpose_of_electric_outlets_in/hrb5v1v/
263,hre68lm,rdmille,"I don't recommend it, either. I survived, but like I said, it's a freaking miracle.","I don't recommend it, either. I survived, but like I said, it's a freaking miracle.",1,2022-01-05 19:26:31,<praw.models.comment_forest.CommentForest object at 0x000002541B0EFE20>,rw44gu,todayilearned,t5_2qqjc,,False,False,t3_rw44gu,t1_hrbrsjp,/r/todayilearned/comments/rw44gu/til_the_original_purpose_of_electric_outlets_in/hre68lm/
264,hrb1q1n,seattleque,😂,😂,1,2022-01-05 03:29:14,<praw.models.comment_forest.CommentForest object at 0x000002541B0EFF70>,rw44gu,todayilearned,t5_2qqjc,,False,False,t3_rw44gu,t1_hrar5y6,/r/todayilearned/comments/rw44gu/til_the_original_purpose_of_electric_outlets_in/hrb1q1n/
265,hr9lxxq,Penquinn14,That's a band name if I've ever heard one,That's a band name if I've ever heard one,6,2022-01-04 21:35:51,<praw.models.comment_forest.CommentForest object at 0x000002541B0EF9D0>,rw44gu,todayilearned,t5_2qqjc,,False,False,t3_rw44gu,t1_hr9hio1,/r/todayilearned/comments/rw44gu/til_the_original_purpose_of_electric_outlets_in/hr9lxxq/
266,hreripd,JaTheRed,Yeah I agree I'm buying one more new one next year and that'll be it for me have to baby it for a couple decades lol,Yeah I agree I'm buying one more new one next year and that'll be it for me have to baby it for a couple decades lol,2,2022-01-05 21:52:12,<praw.models.comment_forest.CommentForest object at 0x000002541E47D220>,rw44gu,todayilearned,t5_2qqjc,,False,False,t3_rw44gu,t1_hrdwo4w,/r/todayilearned/comments/rw44gu/til_the_original_purpose_of_electric_outlets_in/hreripd/
267,hrbz77z,1284X,acoustic vapes,acoustic vapes,4,2022-01-05 08:57:33,<praw.models.comment_forest.CommentForest object at 0x000002541E47DCA0>,rw44gu,todayilearned,t5_2qqjc,,False,False,t3_rw44gu,t1_hr9pd2b,/r/todayilearned/comments/rw44gu/til_the_original_purpose_of_electric_outlets_in/hrbz77z/
268,hr9gc59,Capepoints,"Well yeah, as long as your brought a late model Civic with you to every crime. 

“Give me your wallet…..ok now wait a few minutes. Gotta warm up the engine……”","Well yeah, as long as your brought a late model Civic with you to every crime. 

“Give me your wallet…..ok now wait a few minutes. Gotta warm up the engine……”",4,2022-01-04 21:00:23,<praw.models.comment_forest.CommentForest object at 0x000002541E47D7F0>,rw44gu,todayilearned,t5_2qqjc,,False,False,t3_rw44gu,t1_hr9fo7e,/r/todayilearned/comments/rw44gu/til_the_original_purpose_of_electric_outlets_in/hr9gc59/
269,hr9h85c,NnyBees,I'm sure the desire to delete it all and start again was strong...especially if there was a typo in the printed code as I'm sure must have happened on occasion.  Though I think arson or homicide would be the stronger urge in that case.,I'm sure the desire to delete it all and start again was strong...especially if there was a typo in the printed code as I'm sure must have happened on occasion.  Though I think arson or homicide would be the stronger urge in that case.,1,2022-01-04 21:06:00,<praw.models.comment_forest.CommentForest object at 0x000002541E497F40>,rw44gu,todayilearned,t5_2qqjc,,False,False,t3_rw44gu,t1_hr9gia6,/r/todayilearned/comments/rw44gu/til_the_original_purpose_of_electric_outlets_in/hr9h85c/
270,hra3mlw,spf1971, Nothing worse than typing it all out only to realize you made a typo somewhere and had to search for it., Nothing worse than typing it all out only to realize you made a typo somewhere and had to search for it.,1,2022-01-04 23:31:20,<praw.models.comment_forest.CommentForest object at 0x000002541E497100>,rw44gu,todayilearned,t5_2qqjc,,False,False,t3_rw44gu,t1_hr9gia6,/r/todayilearned/comments/rw44gu/til_the_original_purpose_of_electric_outlets_in/hra3mlw/
271,hrh9ex2,Wonderful_Discount59,"Worst thing were the ""10 line programs"" that some magazines published. Which usually meant normal lenght programmes compressed into 20 lines by using really bad programming techniques.","Worst thing were the ""10 line programs"" that some magazines published. Which usually meant normal lenght programmes compressed into 20 lines by using really bad programming techniques.",1,2022-01-06 11:33:07,<praw.models.comment_forest.CommentForest object at 0x000002541E497070>,rw44gu,todayilearned,t5_2qqjc,,False,False,t3_rw44gu,t1_hr9gia6,/r/todayilearned/comments/rw44gu/til_the_original_purpose_of_electric_outlets_in/hrh9ex2/
272,hr9i3nz,NnyBees,I remember waiting 4-6 weeks for a box to come in the mail with 3 floppies for a single game.,I remember waiting 4-6 weeks for a box to come in the mail with 3 floppies for a single game.,2,2022-01-04 21:11:35,<praw.models.comment_forest.CommentForest object at 0x000002541E497D90>,rw44gu,todayilearned,t5_2qqjc,,False,False,t3_rw44gu,t1_hr9gkg0,/r/todayilearned/comments/rw44gu/til_the_original_purpose_of_electric_outlets_in/hr9i3nz/
273,hr9fh52,ne-toy,Be our leader!,Be our leader!,4,2022-01-04 20:54:57,<praw.models.comment_forest.CommentForest object at 0x000002541E4974C0>,rw44gu,todayilearned,t5_2qqjc,,False,False,t3_rw44gu,t1_hr9eyx6,/r/todayilearned/comments/rw44gu/til_the_original_purpose_of_electric_outlets_in/hr9fh52/
274,hr9i4rk,ryschwith,"My memory coincides with /u/PeaValue here. Both were referred to as floppy discs/diskettes because of the floppy magnetic disk inside the case, compared to the hard metal platters of a hard drive.","My memory coincides with /u/PeaValue here. Both were referred to as floppy discs/diskettes because of the floppy magnetic disk inside the case, compared to the hard metal platters of a hard drive.",9,2022-01-04 21:11:47,<praw.models.comment_forest.CommentForest object at 0x000002541E4977C0>,rw44gu,todayilearned,t5_2qqjc,,False,False,t3_rw44gu,t1_hr9gstd,/r/todayilearned/comments/rw44gu/til_the_original_purpose_of_electric_outlets_in/hr9i4rk/
275,hr9l24h,PeaValue,I was born in 1981 and my first few home PCs and our Macintosh II all used floppy discs. I certainly remember it the way Wikipedia records it. And I remember being confused at the time as a child because some of the floppy discs were not floppy.,I was born in 1981 and my first few home PCs and our Macintosh II all used floppy discs. I certainly remember it the way Wikipedia records it. And I remember being confused at the time as a child because some of the floppy discs were not floppy.,6,2022-01-04 21:30:13,<praw.models.comment_forest.CommentForest object at 0x00000254212AA0A0>,rw44gu,todayilearned,t5_2qqjc,,1641332004.0,False,t3_rw44gu,t1_hr9gstd,/r/todayilearned/comments/rw44gu/til_the_original_purpose_of_electric_outlets_in/hr9l24h/
276,hr9ol51,NemosGhost,"The 3.5 were still called floppy disks.

Also there were bigger ones before the 5.25s.","The 3.5 were still called floppy disks.

Also there were bigger ones before the 5.25s.",4,2022-01-04 21:52:41,<praw.models.comment_forest.CommentForest object at 0x00000254212AAFA0>,rw44gu,todayilearned,t5_2qqjc,,False,False,t3_rw44gu,t1_hr9gstd,/r/todayilearned/comments/rw44gu/til_the_original_purpose_of_electric_outlets_in/hr9ol51/
277,hr9fyjf,SteveWundRBaum,"We have a winner - your prize is some more wrinkles under your eyes, fellow old man, lol!","We have a winner - your prize is some more wrinkles under your eyes, fellow old man, lol!",3,2022-01-04 20:58:00,<praw.models.comment_forest.CommentForest object at 0x00000254212AACD0>,rw44gu,todayilearned,t5_2qqjc,,False,False,t3_rw44gu,t1_hr9fcq3,/r/todayilearned/comments/rw44gu/til_the_original_purpose_of_electric_outlets_in/hr9fyjf/
278,hr9lfn5,NnyBees,"Haha forgot about that part! I'm glad I quit too, especially because the habit costs more than a car payment these days.","Haha forgot about that part! I'm glad I quit too, especially because the habit costs more than a car payment these days.",1,2022-01-04 21:32:37,<praw.models.comment_forest.CommentForest object at 0x0000025421293C40>,rw44gu,todayilearned,t5_2qqjc,,False,False,t3_rw44gu,t1_hr9l38j,/r/todayilearned/comments/rw44gu/til_the_original_purpose_of_electric_outlets_in/hr9lfn5/
279,hrdw1by,Unique9FL,I bet somebody is going to go buy one of the lighter parts to stick in those bare sockets now. Because of this TIL. 😅🤔,I bet somebody is going to go buy one of the lighter parts to stick in those bare sockets now. Because of this TIL. 😅🤔,2,2022-01-05 18:22:43,<praw.models.comment_forest.CommentForest object at 0x000002547A654BE0>,rw44gu,todayilearned,t5_2qqjc,,False,False,t3_rw44gu,t1_hrdtrf9,/r/todayilearned/comments/rw44gu/til_the_original_purpose_of_electric_outlets_in/hrdw1by/
280,hraie4l,AlfredoCervantes30,"When I was a kid my family had a then 10ish year old car. There are only 2 things I distinctly remember about it:

1) the dark red La-z-boy material cloth interior

2) each seat had it's own cigarette lighter and ashtray built in to their armrest behind a spring loaded door

Nobody in my family smoked. I'm pretty sure I still have scars on my fingertips from those damn things.","When I was a kid my family had a then 10ish year old car. There are only 2 things I distinctly remember about it:

1) the dark red La-z-boy material cloth interior

2) each seat had it's own cigarette lighter and ashtray built in to their armrest behind a spring loaded door

Nobody in my family smoked. I'm pretty sure I still have scars on my fingertips from those damn things.",4,2022-01-05 01:12:08,<praw.models.comment_forest.CommentForest object at 0x000002547AA9FD60>,rw44gu,todayilearned,t5_2qqjc,,False,False,t3_rw44gu,t1_hr9h9v9,/r/todayilearned/comments/rw44gu/til_the_original_purpose_of_electric_outlets_in/hraie4l/
281,hr9hpub,MrGeekman,"Yeah, smoking was mostly on the way out by the time I came along.","Yeah, smoking was mostly on the way out by the time I came along.",1,2022-01-04 21:09:08,<praw.models.comment_forest.CommentForest object at 0x000002547AA9FC10>,rw44gu,todayilearned,t5_2qqjc,,False,False,t3_rw44gu,t1_hr9h9v9,/r/todayilearned/comments/rw44gu/til_the_original_purpose_of_electric_outlets_in/hr9hpub/
282,hr9i2w7,MrGeekman,"Yeah, smoking was mostly on the way out by the time I came along.","Yeah, smoking was mostly on the way out by the time I came along.",0,2022-01-04 21:11:27,<praw.models.comment_forest.CommentForest object at 0x000002547AA9FCA0>,rw44gu,todayilearned,t5_2qqjc,,False,False,t3_rw44gu,t1_hr9h9v9,/r/todayilearned/comments/rw44gu/til_the_original_purpose_of_electric_outlets_in/hr9i2w7/
