,ID,Author,body,Comment,Score,Created On,Replies,Submission,Subreddit,Subreddit_ID,Distinguished,Edited,Is_submitter,link_id,Parent_id,Permalink
0,hr9d7d2,JaTheRed,Holy shit I am old.,Holy shit I am old.,658,2022-01-04 20:40:41,<praw.models.comment_forest.CommentForest object at 0x000002547A654640>,rw44gu,todayilearned,t5_2qqjc,,False,False,t3_rw44gu,t3_rw44gu,/r/todayilearned/comments/rw44gu/til_the_original_purpose_of_electric_outlets_in/hr9d7d2/
1,hr9da21,Simms1401,"Good grief, this just shows how old I am, I remember it being an oddity that they could charge equipment instead of lighting cigarettes.","Good grief, this just shows how old I am, I remember it being an oddity that they could charge equipment instead of lighting cigarettes.",182,2022-01-04 20:41:09,<praw.models.comment_forest.CommentForest object at 0x000002547A654B80>,rw44gu,todayilearned,t5_2qqjc,,False,False,t3_rw44gu,t3_rw44gu,/r/todayilearned/comments/rw44gu/til_the_original_purpose_of_electric_outlets_in/hr9da21/
2,hr9dkqs,Mat_CYSTM,Wait until you see the ashtrays on the arm rests in the back seat!,Wait until you see the ashtrays on the arm rests in the back seat!,85,2022-01-04 20:43:00,<praw.models.comment_forest.CommentForest object at 0x000002541E47D340>,rw44gu,todayilearned,t5_2qqjc,,False,False,t3_rw44gu,t3_rw44gu,/r/todayilearned/comments/rw44gu/til_the_original_purpose_of_electric_outlets_in/hr9dkqs/
3,hr9d8i9,atomichumbucker,"Well, TIL That I’m apparently very old.","Well, TIL That I’m apparently very old.",48,2022-01-04 20:40:53,<praw.models.comment_forest.CommentForest object at 0x000002541E47DF10>,rw44gu,todayilearned,t5_2qqjc,,False,False,t3_rw44gu,t3_rw44gu,/r/todayilearned/comments/rw44gu/til_the_original_purpose_of_electric_outlets_in/hr9d8i9/
4,hr9dkya,chicagoman9876,How old are you OP?,How old are you OP?,37,2022-01-04 20:43:02,<praw.models.comment_forest.CommentForest object at 0x000002541E47D880>,rw44gu,todayilearned,t5_2qqjc,,False,False,t3_rw44gu,t3_rw44gu,/r/todayilearned/comments/rw44gu/til_the_original_purpose_of_electric_outlets_in/hr9dkya/
5,hr9dib9,Capepoints,"It was clearly to burn overly curious kids.

I know from experience. 1/10, would not recommend.","It was clearly to burn overly curious kids.

I know from experience. 1/10, would not recommend.",35,2022-01-04 20:42:35,<praw.models.comment_forest.CommentForest object at 0x000002541E47DD00>,rw44gu,todayilearned,t5_2qqjc,,False,False,t3_rw44gu,t3_rw44gu,/r/todayilearned/comments/rw44gu/til_the_original_purpose_of_electric_outlets_in/hr9dib9/
6,hr9dbcc,ne-toy,Quick age test. Do you know what is this 💾?,Quick age test. Do you know what is this 💾?,52,2022-01-04 20:41:23,<praw.models.comment_forest.CommentForest object at 0x000002541E47D8E0>,rw44gu,todayilearned,t5_2qqjc,,False,False,t3_rw44gu,t3_rw44gu,/r/todayilearned/comments/rw44gu/til_the_original_purpose_of_electric_outlets_in/hr9dbcc/
7,hr9euvs,siggy1986,OP has been on Reddit for 9 years. They are definitely old enough that this is not a real TIL.,OP has been on Reddit for 9 years. They are definitely old enough that this is not a real TIL.,52,2022-01-04 20:51:03,<praw.models.comment_forest.CommentForest object at 0x000002541E47D430>,rw44gu,todayilearned,t5_2qqjc,,False,False,t3_rw44gu,t3_rw44gu,/r/todayilearned/comments/rw44gu/til_the_original_purpose_of_electric_outlets_in/hr9euvs/
8,hr9f1c9,matolandio,next you’re gonna tell me that’s why LITERALLY EVERYONE calls them cigarette lighters.,next you’re gonna tell me that’s why LITERALLY EVERYONE calls them cigarette lighters.,17,2022-01-04 20:52:10,<praw.models.comment_forest.CommentForest object at 0x00000254212AA760>,rw44gu,todayilearned,t5_2qqjc,,False,False,t3_rw44gu,t3_rw44gu,/r/todayilearned/comments/rw44gu/til_the_original_purpose_of_electric_outlets_in/hr9f1c9/
9,hr9dfzc,Dicska,In my language they are still called cigar lighters. Not even just cigarettes; cigars. In a relatively poor(ish) Eastern European country.,In my language they are still called cigar lighters. Not even just cigarettes; cigars. In a relatively poor(ish) Eastern European country.,13,2022-01-04 20:42:11,<praw.models.comment_forest.CommentForest object at 0x00000254212AA640>,rw44gu,todayilearned,t5_2qqjc,,False,False,t3_rw44gu,t3_rw44gu,/r/todayilearned/comments/rw44gu/til_the_original_purpose_of_electric_outlets_in/hr9dfzc/
10,hr9dsc1,theonePappabox,# WTF! When did I get old!,# WTF! When did I get old!,19,2022-01-04 20:44:18,<praw.models.comment_forest.CommentForest object at 0x00000254212AA550>,rw44gu,todayilearned,t5_2qqjc,,False,False,t3_rw44gu,t3_rw44gu,/r/todayilearned/comments/rw44gu/til_the_original_purpose_of_electric_outlets_in/hr9dsc1/
11,hr9q4ue,ductapemonster,"I'll take How to tell the internet that you're under 30, for $200 Alex","I'll take How to tell the internet that you're under 30, for $200 Alex",9,2022-01-04 22:02:43,<praw.models.comment_forest.CommentForest object at 0x00000254212AA160>,rw44gu,todayilearned,t5_2qqjc,,False,False,t3_rw44gu,t3_rw44gu,/r/todayilearned/comments/rw44gu/til_the_original_purpose_of_electric_outlets_in/hr9q4ue/
12,hr9dnit,Craig_E_W,"Oh, my sweet summer child...","Oh, my sweet summer child...",20,2022-01-04 20:43:29,<praw.models.comment_forest.CommentForest object at 0x00000254212AA0D0>,rw44gu,todayilearned,t5_2qqjc,,False,False,t3_rw44gu,t3_rw44gu,/r/todayilearned/comments/rw44gu/til_the_original_purpose_of_electric_outlets_in/hr9dnit/
13,hr9dpub,qs420,"i love all these ""holy fuck i'm old"" comments bc that's exactly what i thought. next up for the yung'uns : TIL the save icon on computers was actually a thing they once used called a floppy disk. fuck i'm old  !!!!!!!","i love all these ""holy fuck i'm old"" comments bc that's exactly what i thought. next up for the yung'uns : TIL the save icon on computers was actually a thing they once used called a floppy disk. fuck i'm old  !!!!!!!",8,2022-01-04 20:43:53,<praw.models.comment_forest.CommentForest object at 0x00000254212AA100>,rw44gu,todayilearned,t5_2qqjc,,False,False,t3_rw44gu,t3_rw44gu,/r/todayilearned/comments/rw44gu/til_the_original_purpose_of_electric_outlets_in/hr9dpub/
14,hr9eo6r,Bonecloak,I just felt old for the first time. I remember very well scorching my finger on those.,I just felt old for the first time. I remember very well scorching my finger on those.,6,2022-01-04 20:49:52,<praw.models.comment_forest.CommentForest object at 0x00000254212AAFD0>,rw44gu,todayilearned,t5_2qqjc,,False,False,t3_rw44gu,t3_rw44gu,/r/todayilearned/comments/rw44gu/til_the_original_purpose_of_electric_outlets_in/hr9eo6r/
15,hr9i0u6,findasafespace,No shit sherlock. Smh.,No shit sherlock. Smh.,6,2022-01-04 21:11:04,<praw.models.comment_forest.CommentForest object at 0x00000254212AA430>,rw44gu,todayilearned,t5_2qqjc,,False,False,t3_rw44gu,t3_rw44gu,/r/todayilearned/comments/rw44gu/til_the_original_purpose_of_electric_outlets_in/hr9i0u6/
16,hr9gfdz,johnnyringo117,"So when I was a kid and you could ride in the front seat (no seatbelts required) I watched my dad light a cigarette with the dashboard lighter. Wanting to be like my father but not having a smoke, I figured my finger would be a good substitute. It was dark so no one noticed when I pulled the lighter out of the dash, put the knuckle of my first finger up to my mouth and “lit” my finger tip. The screaming that followed almost made my dad crash the car and I had to hop out and stick my finger in a snow bank for some relief. Cut me some slack, I was around 3 or 4 at the time.😂","So when I was a kid and you could ride in the front seat (no seatbelts required) I watched my dad light a cigarette with the dashboard lighter. Wanting to be like my father but not having a smoke, I figured my finger would be a good substitute. It was dark so no one noticed when I pulled the lighter out of the dash, put the knuckle of my first finger up to my mouth and “lit” my finger tip. The screaming that followed almost made my dad crash the car and I had to hop out and stick my finger in a snow bank for some relief. Cut me some slack, I was around 3 or 4 at the time.😂",7,2022-01-04 21:00:56,<praw.models.comment_forest.CommentForest object at 0x0000025421293D90>,rw44gu,todayilearned,t5_2qqjc,,False,False,t3_rw44gu,t3_rw44gu,/r/todayilearned/comments/rw44gu/til_the_original_purpose_of_electric_outlets_in/hr9gfdz/
17,hr9uefp,NetDork,"Wait till they find out why we say ""roll up the window"".","Wait till they find out why we say ""roll up the window"".",5,2022-01-04 22:30:27,<praw.models.comment_forest.CommentForest object at 0x0000025421293B80>,rw44gu,todayilearned,t5_2qqjc,,False,False,t3_rw44gu,t3_rw44gu,/r/todayilearned/comments/rw44gu/til_the_original_purpose_of_electric_outlets_in/hr9uefp/
18,hr9dhz1,Erreur_420,You have 14?,You have 14?,5,2022-01-04 20:42:32,<praw.models.comment_forest.CommentForest object at 0x0000025421293B50>,rw44gu,todayilearned,t5_2qqjc,,False,False,t3_rw44gu,t3_rw44gu,/r/todayilearned/comments/rw44gu/til_the_original_purpose_of_electric_outlets_in/hr9dhz1/
19,hr9e9ib,drkrthnthspeedofliht,There are people that don’t know this? People still smoke.,There are people that don’t know this? People still smoke.,7,2022-01-04 20:47:18,<praw.models.comment_forest.CommentForest object at 0x0000025421293A00>,rw44gu,todayilearned,t5_2qqjc,,False,False,t3_rw44gu,t3_rw44gu,/r/todayilearned/comments/rw44gu/til_the_original_purpose_of_electric_outlets_in/hr9e9ib/
20,hraf1ji,Bl4ckb100d,Til you can tell how old redditors are by looking at what they post here.,Til you can tell how old redditors are by looking at what they post here.,5,2022-01-05 00:48:58,<praw.models.comment_forest.CommentForest object at 0x0000025421293910>,rw44gu,todayilearned,t5_2qqjc,,False,False,t3_rw44gu,t3_rw44gu,/r/todayilearned/comments/rw44gu/til_the_original_purpose_of_electric_outlets_in/hraf1ji/
21,hr9di1g,lettherebetoast,When did I suddenly become old?,When did I suddenly become old?,5,2022-01-04 20:42:32,<praw.models.comment_forest.CommentForest object at 0x0000025421293700>,rw44gu,todayilearned,t5_2qqjc,,False,False,t3_rw44gu,t3_rw44gu,/r/todayilearned/comments/rw44gu/til_the_original_purpose_of_electric_outlets_in/hr9di1g/
22,hr9gdvv,shioj,"I still remember my first time learning what a cigarette lighter was. Pushed it in, it popped out and I burnt the shit out of my fingers.","I still remember my first time learning what a cigarette lighter was. Pushed it in, it popped out and I burnt the shit out of my fingers.",5,2022-01-04 21:00:41,<praw.models.comment_forest.CommentForest object at 0x0000025421293490>,rw44gu,todayilearned,t5_2qqjc,,False,False,t3_rw44gu,t3_rw44gu,/r/todayilearned/comments/rw44gu/til_the_original_purpose_of_electric_outlets_in/hr9gdvv/
23,hr9geof,Truth_Learning_Curve,Fuck off - you’ve just made me feel so old by saying TIL this,Fuck off - you’ve just made me feel so old by saying TIL this,5,2022-01-04 21:00:49,<praw.models.comment_forest.CommentForest object at 0x00000254212934C0>,rw44gu,todayilearned,t5_2qqjc,,False,False,t3_rw44gu,t3_rw44gu,/r/todayilearned/comments/rw44gu/til_the_original_purpose_of_electric_outlets_in/hr9geof/
24,hr9haky,CensoredColour,"Going through high school, this was the only way to light blunts when routing since they would not sell us lighters.

This was when cell phones became more common, but we were still resourceful.","Going through high school, this was the only way to light blunts when routing since they would not sell us lighters.

This was when cell phones became more common, but we were still resourceful.",4,2022-01-04 21:06:25,<praw.models.comment_forest.CommentForest object at 0x0000025421293340>,rw44gu,todayilearned,t5_2qqjc,,False,False,t3_rw44gu,t3_rw44gu,/r/todayilearned/comments/rw44gu/til_the_original_purpose_of_electric_outlets_in/hr9haky/
25,hr9j51z,Otherwise-Window823,"I’m so old they taught match safety in elementary school. This summer my great grandson was visiting I asked if he could build a campfire. He said “of course”
(he’s 9 years old). I asked “what elements do you need for fire?”  He answered. I challenged him to build a campfire, he would have to gather all the materials and that I would only give him 3 matches. He thought for a moment, “what’s a match?” I laughed and asked “how do you start a campfire?”  He replied 
“With a lighter” he smiled.","I’m so old they taught match safety in elementary school. This summer my great grandson was visiting I asked if he could build a campfire. He said “of course”
(he’s 9 years old). I asked “what elements do you need for fire?”  He answered. I challenged him to build a campfire, he would have to gather all the materials and that I would only give him 3 matches. He thought for a moment, “what’s a match?” I laughed and asked “how do you start a campfire?”  He replied 
“With a lighter” he smiled.",4,2022-01-04 21:18:09,<praw.models.comment_forest.CommentForest object at 0x0000025421293430>,rw44gu,todayilearned,t5_2qqjc,,False,False,t3_rw44gu,t3_rw44gu,/r/todayilearned/comments/rw44gu/til_the_original_purpose_of_electric_outlets_in/hr9j51z/
26,hr9pwp4,CoupleTechnical6795,I remember when smoking in cars with your kids was so common I used to light my mom's smokes with that thing. Jesus I'm old.,I remember when smoking in cars with your kids was so common I used to light my mom's smokes with that thing. Jesus I'm old.,3,2022-01-04 22:01:15,<praw.models.comment_forest.CommentForest object at 0x0000025421293280>,rw44gu,todayilearned,t5_2qqjc,,False,False,t3_rw44gu,t3_rw44gu,/r/todayilearned/comments/rw44gu/til_the_original_purpose_of_electric_outlets_in/hr9pwp4/
27,hrbgoga,onairmastering,"Holy moly, a teenage bot!","Holy moly, a teenage bot!",3,2022-01-05 05:31:18,<praw.models.comment_forest.CommentForest object at 0x0000025421293190>,rw44gu,todayilearned,t5_2qqjc,,False,False,t3_rw44gu,t3_rw44gu,/r/todayilearned/comments/rw44gu/til_the_original_purpose_of_electric_outlets_in/hrbgoga/
28,hr9havo,sean488,Jesus H....,Jesus H....,3,2022-01-04 21:06:29,<praw.models.comment_forest.CommentForest object at 0x00000254212932B0>,rw44gu,todayilearned,t5_2qqjc,,False,False,t3_rw44gu,t3_rw44gu,/r/todayilearned/comments/rw44gu/til_the_original_purpose_of_electric_outlets_in/hr9havo/
29,hr9hb9e,,Waiting for some whippersnapper to invent a device for doing dabs out of one of them heater holes,Waiting for some whippersnapper to invent a device for doing dabs out of one of them heater holes,3,2022-01-04 21:06:33,<praw.models.comment_forest.CommentForest object at 0x0000025421293100>,rw44gu,todayilearned,t5_2qqjc,,False,False,t3_rw44gu,t3_rw44gu,/r/todayilearned/comments/rw44gu/til_the_original_purpose_of_electric_outlets_in/hr9hb9e/
30,hr9irlz,Germs15,Technically it was for burning your fingers after getting sent out of church to wait in the car.,Technically it was for burning your fingers after getting sent out of church to wait in the car.,3,2022-01-04 21:15:49,<praw.models.comment_forest.CommentForest object at 0x0000025421293040>,rw44gu,todayilearned,t5_2qqjc,,False,False,t3_rw44gu,t3_rw44gu,/r/todayilearned/comments/rw44gu/til_the_original_purpose_of_electric_outlets_in/hr9irlz/
31,hr9j4cf,Square-Cod3410,Fuck I’m old,Fuck I’m old,3,2022-01-04 21:18:01,<praw.models.comment_forest.CommentForest object at 0x0000025421293070>,rw44gu,todayilearned,t5_2qqjc,,False,False,t3_rw44gu,t3_rw44gu,/r/todayilearned/comments/rw44gu/til_the_original_purpose_of_electric_outlets_in/hr9j4cf/
32,hr9kl7d,FattyPepperonicci69,This is a TIL?,This is a TIL?,3,2022-01-04 21:27:13,<praw.models.comment_forest.CommentForest object at 0x0000025421293940>,rw44gu,todayilearned,t5_2qqjc,,False,False,t3_rw44gu,t3_rw44gu,/r/todayilearned/comments/rw44gu/til_the_original_purpose_of_electric_outlets_in/hr9kl7d/
33,hr9m7sy,iamatwork24,TIL I’m old.,TIL I’m old.,3,2022-01-04 21:37:36,<praw.models.comment_forest.CommentForest object at 0x0000025421276C70>,rw44gu,todayilearned,t5_2qqjc,,False,False,t3_rw44gu,t3_rw44gu,/r/todayilearned/comments/rw44gu/til_the_original_purpose_of_electric_outlets_in/hr9m7sy/
34,hr9t41y,imyyuuuu,"umm...    
just how old ARE you?","umm...    
just how old ARE you?",3,2022-01-04 22:22:07,<praw.models.comment_forest.CommentForest object at 0x0000025421276EB0>,rw44gu,todayilearned,t5_2qqjc,,False,False,t3_rw44gu,t3_rw44gu,/r/todayilearned/comments/rw44gu/til_the_original_purpose_of_electric_outlets_in/hr9t41y/
35,hr9u9of,MiniDelo,Fucker. I feel old AF now.,Fucker. I feel old AF now.,3,2022-01-04 22:29:36,<praw.models.comment_forest.CommentForest object at 0x0000025421276D00>,rw44gu,todayilearned,t5_2qqjc,,False,False,t3_rw44gu,t3_rw44gu,/r/todayilearned/comments/rw44gu/til_the_original_purpose_of_electric_outlets_in/hr9u9of/
36,hr9ux2s,Scopebuddy,This is how you know the war was won against smoking.,This is how you know the war was won against smoking.,3,2022-01-04 22:33:51,<praw.models.comment_forest.CommentForest object at 0x0000025421276A60>,rw44gu,todayilearned,t5_2qqjc,,False,False,t3_rw44gu,t3_rw44gu,/r/todayilearned/comments/rw44gu/til_the_original_purpose_of_electric_outlets_in/hr9ux2s/
37,hra8iii,olagorie,"😂🤣🤣🤣🤣🤣

Seriously??","😂🤣🤣🤣🤣🤣

Seriously??",3,2022-01-05 00:04:23,<praw.models.comment_forest.CommentForest object at 0x0000025421276CA0>,rw44gu,todayilearned,t5_2qqjc,,False,False,t3_rw44gu,t3_rw44gu,/r/todayilearned/comments/rw44gu/til_the_original_purpose_of_electric_outlets_in/hra8iii/
38,hra8p5a,lokiofsaassgaard,I just died of old age,I just died of old age,3,2022-01-05 00:05:39,<praw.models.comment_forest.CommentForest object at 0x0000025421276F70>,rw44gu,todayilearned,t5_2qqjc,,False,False,t3_rw44gu,t3_rw44gu,/r/todayilearned/comments/rw44gu/til_the_original_purpose_of_electric_outlets_in/hra8p5a/
39,hr9hj6s,ChuckChuckelson,We used to drop weed on a hot lighter and inhale through toilet paper tube. Called it shotgun.,We used to drop weed on a hot lighter and inhale through toilet paper tube. Called it shotgun.,4,2022-01-04 21:07:59,<praw.models.comment_forest.CommentForest object at 0x0000025421276EE0>,rw44gu,todayilearned,t5_2qqjc,,False,False,t3_rw44gu,t3_rw44gu,/r/todayilearned/comments/rw44gu/til_the_original_purpose_of_electric_outlets_in/hr9hj6s/
40,hr9hwdh,_Abe_Froman_SKOC,"Tell me you're under 25 without telling me your exact age...

I can remember when those outlets were **only** for lighting cigarettes... and maybe powering radar detectors.","Tell me you're under 25 without telling me your exact age...

I can remember when those outlets were **only** for lighting cigarettes... and maybe powering radar detectors.",6,2022-01-04 21:10:16,<praw.models.comment_forest.CommentForest object at 0x0000025421276A00>,rw44gu,todayilearned,t5_2qqjc,,False,False,t3_rw44gu,t3_rw44gu,/r/todayilearned/comments/rw44gu/til_the_original_purpose_of_electric_outlets_in/hr9hwdh/
41,hr9g51c,Baxterftw,Comments gonna be good in this one,Comments gonna be good in this one,2,2022-01-04 20:59:08,<praw.models.comment_forest.CommentForest object at 0x0000025421276C40>,rw44gu,todayilearned,t5_2qqjc,,False,False,t3_rw44gu,t3_rw44gu,/r/todayilearned/comments/rw44gu/til_the_original_purpose_of_electric_outlets_in/hr9g51c/
42,hr9g8bj,Baxterftw,The best is when it would shoot out red hot,The best is when it would shoot out red hot,2,2022-01-04 20:59:43,<praw.models.comment_forest.CommentForest object at 0x0000025421276D30>,rw44gu,todayilearned,t5_2qqjc,,False,False,t3_rw44gu,t3_rw44gu,/r/todayilearned/comments/rw44gu/til_the_original_purpose_of_electric_outlets_in/hr9g8bj/
43,hr9hnep,smellllikebeef,Today I remembered that cars have cigarette lighters,Today I remembered that cars have cigarette lighters,2,2022-01-04 21:08:43,<praw.models.comment_forest.CommentForest object at 0x0000025421276CD0>,rw44gu,todayilearned,t5_2qqjc,,False,False,t3_rw44gu,t3_rw44gu,/r/todayilearned/comments/rw44gu/til_the_original_purpose_of_electric_outlets_in/hr9hnep/
44,hr9hpp0,,I remember my mom lighting up with these things. I'm old now,I remember my mom lighting up with these things. I'm old now,2,2022-01-04 21:09:06,<praw.models.comment_forest.CommentForest object at 0x0000025421276B20>,rw44gu,todayilearned,t5_2qqjc,,False,False,t3_rw44gu,t3_rw44gu,/r/todayilearned/comments/rw44gu/til_the_original_purpose_of_electric_outlets_in/hr9hpp0/
45,hr9jeh2,parl,Pepperidge Farms remembers. And so do I.,Pepperidge Farms remembers. And so do I.,2,2022-01-04 21:19:47,<praw.models.comment_forest.CommentForest object at 0x0000025421276E80>,rw44gu,todayilearned,t5_2qqjc,,False,False,t3_rw44gu,t3_rw44gu,/r/todayilearned/comments/rw44gu/til_the_original_purpose_of_electric_outlets_in/hr9jeh2/
46,hr9l2aa,elcheapodeluxe,"When I grew up a number of our cars had these. My '88 Benz still has one - though I keep the lighter itself out of the socket and stored in the glove box. (Tomorrow's TIL: where the name glove box came from. You won't believe it. Don't repost the dashboard one again, please, or I'll cut my throat).

Still, in all that time I've never seen anyone actually light anything with one. In a movie, sure, but I've never seen a person use one of these to light a cigarette, a cigar, a paper crane... nothing! I usually see smokers pull out their bic lighter or something instead. Nor will anyone ever use the one in my Benz for said purpose. You smoke in my car, I cut you.","When I grew up a number of our cars had these. My '88 Benz still has one - though I keep the lighter itself out of the socket and stored in the glove box. (Tomorrow's TIL: where the name glove box came from. You won't believe it. Don't repost the dashboard one again, please, or I'll cut my throat).

Still, in all that time I've never seen anyone actually light anything with one. In a movie, sure, but I've never seen a person use one of these to light a cigarette, a cigar, a paper crane... nothing! I usually see smokers pull out their bic lighter or something instead. Nor will anyone ever use the one in my Benz for said purpose. You smoke in my car, I cut you.",2,2022-01-04 21:30:15,<praw.models.comment_forest.CommentForest object at 0x0000025421276E50>,rw44gu,todayilearned,t5_2qqjc,,False,False,t3_rw44gu,t3_rw44gu,/r/todayilearned/comments/rw44gu/til_the_original_purpose_of_electric_outlets_in/hr9l2aa/
47,hr9niip,Rebel_bass,"I bought a used luxury car two years ago, made in Slovakia in 2011. Imagine my surprise when it came with an actual cigarette lighter and removable ashtrays in the front console and back armrests. Younger me who loved the blunts would have had a great time rolling with the crew. 

Got kids now, so no smoking in the car of course.","I bought a used luxury car two years ago, made in Slovakia in 2011. Imagine my surprise when it came with an actual cigarette lighter and removable ashtrays in the front console and back armrests. Younger me who loved the blunts would have had a great time rolling with the crew. 

Got kids now, so no smoking in the car of course.",2,2022-01-04 21:45:55,<praw.models.comment_forest.CommentForest object at 0x0000025421276E20>,rw44gu,todayilearned,t5_2qqjc,,False,False,t3_rw44gu,t3_rw44gu,/r/todayilearned/comments/rw44gu/til_the_original_purpose_of_electric_outlets_in/hr9niip/
48,hr9pfhe,paige7son,Oh you sweet summer child.,Oh you sweet summer child.,2,2022-01-04 21:58:09,<praw.models.comment_forest.CommentForest object at 0x0000025421276550>,rw44gu,todayilearned,t5_2qqjc,,False,False,t3_rw44gu,t3_rw44gu,/r/todayilearned/comments/rw44gu/til_the_original_purpose_of_electric_outlets_in/hr9pfhe/
49,hr9q76d,CajuNerd,"Good lord. My 2010 Hyundai has an ashtray and a lighter. Something that was available 12 years ago shouldn't be considered ancient.

I'm old, but I'm not ***that*** old.","Good lord. My 2010 Hyundai has an ashtray and a lighter. Something that was available 12 years ago shouldn't be considered ancient.

I'm old, but I'm not ***that*** old.",2,2022-01-04 22:03:08,<praw.models.comment_forest.CommentForest object at 0x00000254212767F0>,rw44gu,todayilearned,t5_2qqjc,,False,False,t3_rw44gu,t3_rw44gu,/r/todayilearned/comments/rw44gu/til_the_original_purpose_of_electric_outlets_in/hr9q76d/
50,hr9vbqx,lorddrezz,My first car had an 8 track player.....,My first car had an 8 track player.....,2,2022-01-04 22:36:29,<praw.models.comment_forest.CommentForest object at 0x0000025421276670>,rw44gu,todayilearned,t5_2qqjc,,False,False,t3_rw44gu,t3_rw44gu,/r/todayilearned/comments/rw44gu/til_the_original_purpose_of_electric_outlets_in/hr9vbqx/
51,hr9wh19,pobody,Why did you think it was such a stupid plug that you can stick your fingers into?,Why did you think it was such a stupid plug that you can stick your fingers into?,2,2022-01-04 22:44:00,<praw.models.comment_forest.CommentForest object at 0x0000025421276580>,rw44gu,todayilearned,t5_2qqjc,,False,False,t3_rw44gu,t3_rw44gu,/r/todayilearned/comments/rw44gu/til_the_original_purpose_of_electric_outlets_in/hr9wh19/
52,hr9ytfp,,I'm pretty sure everyone born before 2005 always knew this?,I'm pretty sure everyone born before 2005 always knew this?,2,2022-01-04 22:59:25,<praw.models.comment_forest.CommentForest object at 0x00000254212764C0>,rw44gu,todayilearned,t5_2qqjc,,False,False,t3_rw44gu,t3_rw44gu,/r/todayilearned/comments/rw44gu/til_the_original_purpose_of_electric_outlets_in/hr9ytfp/
53,hr9z9fh,,"Now it's an ""optional extra"" if you want an actual lighter in there. But I think these days pretty much everyone has a USB charger in there.","Now it's an ""optional extra"" if you want an actual lighter in there. But I think these days pretty much everyone has a USB charger in there.",2,2022-01-04 23:02:21,<praw.models.comment_forest.CommentForest object at 0x00000254212763D0>,rw44gu,todayilearned,t5_2qqjc,,False,False,t3_rw44gu,t3_rw44gu,/r/todayilearned/comments/rw44gu/til_the_original_purpose_of_electric_outlets_in/hr9z9fh/
