,ID,Author,body,Comment,Score,Created On,Replies,Submission,Subreddit,Subreddit_ID,Distinguished,Edited,Is_submitter,link_id,Parent_id,Permalink
93,j5m6api,cheese_touch_mcghee,"""HIGH"" for 4 hours will cause the liquid to boil off and result in a dry dish/recipe.

Typically, stew and other ""long-cooked"" dishes are brought to a boil on ""HIGH"" and then the pot is covered with the heat turned down to ""LOW"" or ""MEDIUM-LOW"".  This ""low and slow"" cooking technique results in tender meat and beans (if using).

Hope this helps with whatever the problem was...🙏🤞🤷🏻","""HIGH"" for 4 hours will cause the liquid to boil off and result in a dry dish/recipe.

Typically, stew and other ""long-cooked"" dishes are brought to a boil on ""HIGH"" and then the pot is covered with the heat turned down to ""LOW"" or ""MEDIUM-LOW"".  This ""low and slow"" cooking technique results in tender meat and beans (if using).

Hope this helps with whatever the problem was...🙏🤞🤷🏻",-1,2023-01-23 23:59:27,<praw.models.comment_forest.CommentForest object at 0x0000022EF4D77370>,10jh214,slowcooking,t5_2s64w,,False,False,t3_10jh214,t3_10jh214,/r/slowcooking/comments/10jh214/what_went_wrong_how_to_improve/j5m6api/
94,j5kosvo,nich3play3r,No step for “line crock with plastic bag.” Better luck next time. 🤷🏻‍♂️,No step for “line crock with plastic bag.” Better luck next time. 🤷🏻‍♂️,-7,2023-01-23 18:16:51,<praw.models.comment_forest.CommentForest object at 0x0000022EF4D77430>,10jh214,slowcooking,t5_2s64w,,False,False,t3_10jh214,t3_10jh214,/r/slowcooking/comments/10jh214/what_went_wrong_how_to_improve/j5kosvo/
95,j5kt51z,such_scurty256,Add 4-5 Serrano peppers to it for that extra spice and flavor!,Add 4-5 Serrano peppers to it for that extra spice and flavor!,1,2023-01-23 18:43:35,<praw.models.comment_forest.CommentForest object at 0x0000022EF4D77490>,10jh214,slowcooking,t5_2s64w,,False,False,t3_10jh214,t3_10jh214,/r/slowcooking/comments/10jh214/what_went_wrong_how_to_improve/j5kt51z/
96,j5kvlxr,mitchij2004,"Green Bell pepper is the only pepper which is maybe the worst pepper in a chili (I use poblano)

No chili powder

Need to know what tomatoes you’re using here and how they are prepared

Less tomato paste that seems like 2x the amount I’d like

More spice overall 

Cook slower, and let rest for like 12 hrs in fridge chili needs time to come together","Green Bell pepper is the only pepper which is maybe the worst pepper in a chili (I use poblano)

No chili powder

Need to know what tomatoes you’re using here and how they are prepared

Less tomato paste that seems like 2x the amount I’d like

More spice overall 

Cook slower, and let rest for like 12 hrs in fridge chili needs time to come together",1,2023-01-23 18:58:49,<praw.models.comment_forest.CommentForest object at 0x0000022EF4D774F0>,10jh214,slowcooking,t5_2s64w,,False,False,t3_10jh214,t3_10jh214,/r/slowcooking/comments/10jh214/what_went_wrong_how_to_improve/j5kvlxr/
97,j5kvmc7,j_b90,Dark chocolate 👀,Dark chocolate 👀,1,2023-01-23 18:58:53,<praw.models.comment_forest.CommentForest object at 0x0000022EF4D77550>,10jh214,slowcooking,t5_2s64w,,False,False,t3_10jh214,t3_10jh214,/r/slowcooking/comments/10jh214/what_went_wrong_how_to_improve/j5kvmc7/
98,j5kvo7i,SonicSuper50,"You were high for 4 hours, that's the issue.","You were high for 4 hours, that's the issue.",1,2023-01-23 18:59:12,<praw.models.comment_forest.CommentForest object at 0x0000022EF4D775B0>,10jh214,slowcooking,t5_2s64w,,False,False,t3_10jh214,t3_10jh214,/r/slowcooking/comments/10jh214/what_went_wrong_how_to_improve/j5kvo7i/
99,j5kvpfz,Saiph_orion,Not enough Tenorman's.,Not enough Tenorman's.,1,2023-01-23 18:59:24,<praw.models.comment_forest.CommentForest object at 0x0000022EF4D77610>,10jh214,slowcooking,t5_2s64w,,False,False,t3_10jh214,t3_10jh214,/r/slowcooking/comments/10jh214/what_went_wrong_how_to_improve/j5kvpfz/
100,j5kw9hr,plumbus_hun,Smoked paprika levels it up 100%,Smoked paprika levels it up 100%,1,2023-01-23 19:02:52,<praw.models.comment_forest.CommentForest object at 0x0000022EF4D77670>,10jh214,slowcooking,t5_2s64w,,False,False,t3_10jh214,t3_10jh214,/r/slowcooking/comments/10jh214/what_went_wrong_how_to_improve/j5kw9hr/
101,j5kwp6f,chiefpeaeater,The oregano and bay leaves,The oregano and bay leaves,1,2023-01-23 19:05:38,<praw.models.comment_forest.CommentForest object at 0x0000022EF4D776D0>,10jh214,slowcooking,t5_2s64w,,False,False,t3_10jh214,t3_10jh214,/r/slowcooking/comments/10jh214/what_went_wrong_how_to_improve/j5kwp6f/
102,j5kyw05,thedeepfield79,More seasoning for sure. Plenty of garlic. A wee bit of cocoa or dark chocolate and some acid. Lime juice or vinegar. Hot take: no need to brown the beef. It'll be much more tender if you just let it simmer. If you need more beef flavour add a stock cube or some Marmite.,More seasoning for sure. Plenty of garlic. A wee bit of cocoa or dark chocolate and some acid. Lime juice or vinegar. Hot take: no need to brown the beef. It'll be much more tender if you just let it simmer. If you need more beef flavour add a stock cube or some Marmite.,1,2023-01-23 19:19:22,<praw.models.comment_forest.CommentForest object at 0x0000022EF4D77730>,10jh214,slowcooking,t5_2s64w,,False,False,t3_10jh214,t3_10jh214,/r/slowcooking/comments/10jh214/what_went_wrong_how_to_improve/j5kyw05/
103,j5l2xwo,Brummie49,"As well as the other advice, it's always worth storing for a few days to let the flavours develop. I try to cook chilli in advance.","As well as the other advice, it's always worth storing for a few days to let the flavours develop. I try to cook chilli in advance.",1,2023-01-23 19:44:59,<praw.models.comment_forest.CommentForest object at 0x0000022EF4D77790>,10jh214,slowcooking,t5_2s64w,,False,False,t3_10jh214,t3_10jh214,/r/slowcooking/comments/10jh214/what_went_wrong_how_to_improve/j5l2xwo/
104,j5l67o2,Lofi-weeb000,"I see the problem, your not just chucking it in and then tasting along the way! (I'm kidding BTW I would say it all looks good except add more of the spices, seems like to little. Hope this helps 😁)","I see the problem, your not just chucking it in and then tasting along the way! (I'm kidding BTW I would say it all looks good except add more of the spices, seems like to little. Hope this helps 😁)",1,2023-01-23 20:05:28,<praw.models.comment_forest.CommentForest object at 0x0000022EF4D777F0>,10jh214,slowcooking,t5_2s64w,,False,False,t3_10jh214,t3_10jh214,/r/slowcooking/comments/10jh214/what_went_wrong_how_to_improve/j5l67o2/
105,j5ldmkn,Sea-Hour-6063,"Roast the peppers in the oven before hand and add in for the last hour. Changed the paprika for smoked and double it. Switch mince for brisket cut into decent sized chunks. 4 decent sized squares of dark chocolate added in the last half hour.

Oh and add some chilli’s","Roast the peppers in the oven before hand and add in for the last hour. Changed the paprika for smoked and double it. Switch mince for brisket cut into decent sized chunks. 4 decent sized squares of dark chocolate added in the last half hour.

Oh and add some chilli’s",1,2023-01-23 20:51:19,<praw.models.comment_forest.CommentForest object at 0x0000022EF4D77850>,10jh214,slowcooking,t5_2s64w,,False,False,t3_10jh214,t3_10jh214,/r/slowcooking/comments/10jh214/what_went_wrong_how_to_improve/j5ldmkn/
106,j5ly10t,notQanonwink,There is no chili powder,There is no chili powder,1,2023-01-23 23:02:19,<praw.models.comment_forest.CommentForest object at 0x0000022EF4D778B0>,10jh214,slowcooking,t5_2s64w,,False,False,t3_10jh214,t3_10jh214,/r/slowcooking/comments/10jh214/what_went_wrong_how_to_improve/j5ly10t/
107,j5m9w63,GiraffeDry437,Use Henderson's relish instead of Worcestershire sauce,Use Henderson's relish instead of Worcestershire sauce,1,2023-01-24 00:25:07,<praw.models.comment_forest.CommentForest object at 0x0000022EF4D77910>,10jh214,slowcooking,t5_2s64w,,False,False,t3_10jh214,t3_10jh214,/r/slowcooking/comments/10jh214/what_went_wrong_how_to_improve/j5m9w63/
108,j5my9qy,,Brown onion and mince IN the slow cooker. You’re losing a lot of flavour in the pan you’ve browned it in.,Brown onion and mince IN the slow cooker. You’re losing a lot of flavour in the pan you’ve browned it in.,1,2023-01-24 03:24:49,<praw.models.comment_forest.CommentForest object at 0x0000022EF4D77970>,10jh214,slowcooking,t5_2s64w,,False,False,t3_10jh214,t3_10jh214,/r/slowcooking/comments/10jh214/what_went_wrong_how_to_improve/j5my9qy/
109,j5myab6,mmmshanrio,"*Low and slow*, if a chili isn’t cooked for at least 6 hours I don’t want it. Chili also tastes better the next day. You need more seasonings, spices, and Worcestershire sauce. Brown the bell peppers with the onions. Add jalapeño or poblano. I also add cinnamon, chocolate, or coffee, or a combination of them— it sounds weird, but trust me, it works.","*Low and slow*, if a chili isn’t cooked for at least 6 hours I don’t want it. Chili also tastes better the next day. You need more seasonings, spices, and Worcestershire sauce. Brown the bell peppers with the onions. Add jalapeño or poblano. I also add cinnamon, chocolate, or coffee, or a combination of them— it sounds weird, but trust me, it works.",1,2023-01-24 03:24:57,<praw.models.comment_forest.CommentForest object at 0x0000022EF4D779D0>,10jh214,slowcooking,t5_2s64w,,False,False,t3_10jh214,t3_10jh214,/r/slowcooking/comments/10jh214/what_went_wrong_how_to_improve/j5myab6/
110,j5nyv8i,Ok-Progress-4464,A grating of dark (at least 70%) chocolate.,A grating of dark (at least 70%) chocolate.,1,2023-01-24 10:18:05,<praw.models.comment_forest.CommentForest object at 0x0000022EF4D77A30>,10jh214,slowcooking,t5_2s64w,,False,False,t3_10jh214,t3_10jh214,/r/slowcooking/comments/10jh214/what_went_wrong_how_to_improve/j5nyv8i/
111,j5ock9z,Mrcooper10,Smoked paprika more chilli and a better beef stock.,Smoked paprika more chilli and a better beef stock.,1,2023-01-24 12:59:03,<praw.models.comment_forest.CommentForest object at 0x0000022EF4D77A90>,10jh214,slowcooking,t5_2s64w,,False,False,t3_10jh214,t3_10jh214,/r/slowcooking/comments/10jh214/what_went_wrong_how_to_improve/j5ock9z/
112,j5ollox,Equivalent_Store_645,"no chilis, not even chili powder? where the heck do you find such a terrible recipe?","no chilis, not even chili powder? where the heck do you find such a terrible recipe?",1,2023-01-24 14:13:59,<praw.models.comment_forest.CommentForest object at 0x0000022EF4D77AF0>,10jh214,slowcooking,t5_2s64w,,False,False,t3_10jh214,t3_10jh214,/r/slowcooking/comments/10jh214/what_went_wrong_how_to_improve/j5ollox/
113,j5po2ze,climbingthro,"As others were saying, add plenty of chili powder, and my personal tip:

Brown both meats before putting them in the slow cooker and then put them on a paper towel to remove excess grease.

If you find your chili is too watery after this, try mixing in tablespoon of powdered gelatin to the beef stock before adding it.","As others were saying, add plenty of chili powder, and my personal tip:

Brown both meats before putting them in the slow cooker and then put them on a paper towel to remove excess grease.

If you find your chili is too watery after this, try mixing in tablespoon of powdered gelatin to the beef stock before adding it.",1,2023-01-24 18:21:39,<praw.models.comment_forest.CommentForest object at 0x0000022EF4D77B50>,10jh214,slowcooking,t5_2s64w,,False,False,t3_10jh214,t3_10jh214,/r/slowcooking/comments/10jh214/what_went_wrong_how_to_improve/j5po2ze/
114,j5sc8ev,C3POdreamer,"The kidney beans were canned or presoaked and cooked, right?","The kidney beans were canned or presoaked and cooked, right?",1,2023-01-25 05:24:36,<praw.models.comment_forest.CommentForest object at 0x0000022EF4D77BB0>,10jh214,slowcooking,t5_2s64w,,False,False,t3_10jh214,t3_10jh214,/r/slowcooking/comments/10jh214/what_went_wrong_how_to_improve/j5sc8ev/
115,j5sshku,KwietKabal,"Not enough information to answer what went wrong, except two cloves of garlic is simply not enough! ;)","Not enough information to answer what went wrong, except two cloves of garlic is simply not enough! ;)",1,2023-01-25 08:38:28,<praw.models.comment_forest.CommentForest object at 0x0000022EF4D77C10>,10jh214,slowcooking,t5_2s64w,,False,False,t3_10jh214,t3_10jh214,/r/slowcooking/comments/10jh214/what_went_wrong_how_to_improve/j5sshku/
116,j5ty4pc,Pristine_Farmer_9907,Let's agree to disagree...,Let's agree to disagree...,1,2023-01-25 15:32:17,<praw.models.comment_forest.CommentForest object at 0x0000022EF4D77C70>,10jh214,slowcooking,t5_2s64w,,False,False,t3_10jh214,t3_10jh214,/r/slowcooking/comments/10jh214/what_went_wrong_how_to_improve/j5ty4pc/
117,j5kreuf,theRealMrBrownstone,Should change it to mystery con carne,Should change it to mystery con carne,140,2023-01-23 18:32:55,<praw.models.comment_forest.CommentForest object at 0x0000022EF4D90FD0>,10jh214,slowcooking,t5_2s64w,,False,False,t3_10jh214,t1_j5km3fz,/r/slowcooking/comments/10jh214/what_went_wrong_how_to_improve/j5kreuf/
118,j5ovj3v,zeke235,"I mean, the recipe doesn't call for cayenne pepper, which is weird for chili. Also, it doesn't specify what kind of chorizo. Is it in a casing? Is it loose? Are you throwing loose, raw chorizo into a crock pot? That's gonna be insanely greasy.

At a glance, what went wrong was using this recipe.

Edit: Oh, and what the hell is rice doing in the recipe?!","I mean, the recipe doesn't call for cayenne pepper, which is weird for chili. Also, it doesn't specify what kind of chorizo. Is it in a casing? Is it loose? Are you throwing loose, raw chorizo into a crock pot? That's gonna be insanely greasy.

At a glance, what went wrong was using this recipe.

Edit: Oh, and what the hell is rice doing in the recipe?!",10,2023-01-24 15:23:44,<praw.models.comment_forest.CommentForest object at 0x0000022EF4D6E070>,10jh214,slowcooking,t5_2s64w,,False,False,t3_10jh214,t1_j5km3fz,/r/slowcooking/comments/10jh214/what_went_wrong_how_to_improve/j5ovj3v/
119,j5nq2oz,jhole89,"For sure. My chili recipe has 4x tsp smoked paprika, 2x tsp hot chili powder, 2x tsp hot sauce. 1tsp paprika is not nearly enough. Also, add more beans in, don't just stick to kidney beans, a can of black beans and a can of haricot adds more variety and protein.","For sure. My chili recipe has 4x tsp smoked paprika, 2x tsp hot chili powder, 2x tsp hot sauce. 1tsp paprika is not nearly enough. Also, add more beans in, don't just stick to kidney beans, a can of black beans and a can of haricot adds more variety and protein.",5,2023-01-24 08:12:49,<praw.models.comment_forest.CommentForest object at 0x0000022EF4D6E1F0>,10jh214,slowcooking,t5_2s64w,,False,False,t3_10jh214,t1_j5kbo47,/r/slowcooking/comments/10jh214/what_went_wrong_how_to_improve/j5nq2oz/
120,j5kmnj4,cornbreadsdirtysheet,Yes about two heaping tablespoons of dark chili powder and magically you’ll have chili.,Yes about two heaping tablespoons of dark chili powder and magically you’ll have chili.,29,2023-01-23 18:03:27,<praw.models.comment_forest.CommentForest object at 0x0000022EF4D6E2B0>,10jh214,slowcooking,t5_2s64w,,False,False,t3_10jh214,t1_j5kcrsr,/r/slowcooking/comments/10jh214/what_went_wrong_how_to_improve/j5kmnj4/
121,j5kpnfh,foxvipus,"The diced onion went in the Pan.

This is what OP meant by their words. I write my recipes the same. 

I find a lot of Americans make comments like yours that make me have to explain it again. 

People don't have time for long winded explanations.

🥑

🔪

🕳️","The diced onion went in the Pan.

This is what OP meant by their words. I write my recipes the same. 

I find a lot of Americans make comments like yours that make me have to explain it again. 

People don't have time for long winded explanations.

🥑

🔪

🕳️",-8,2023-01-23 18:22:04,<praw.models.comment_forest.CommentForest object at 0x0000022EF4D6EE50>,10jh214,slowcooking,t5_2s64w,,False,False,t3_10jh214,t1_j5kiap3,/r/slowcooking/comments/10jh214/what_went_wrong_how_to_improve/j5kpnfh/
122,j5krhdl,Pixielo,"Plus, you need to cook kidney beans at the boil for a minimum of 30 minutes to deactivate the lectin.

https://www.foodsafetynews.com/2021/05/how-to-avoid-poisoning-from-red-beans/","Plus, you need to cook kidney beans at the boil for a minimum of 30 minutes to deactivate the lectin.

https://www.foodsafetynews.com/2021/05/how-to-avoid-poisoning-from-red-beans/",0,2023-01-23 18:33:21,<praw.models.comment_forest.CommentForest object at 0x0000022EF4D77250>,10jh214,slowcooking,t5_2s64w,,False,False,t3_10jh214,t1_j5kq3fd,/r/slowcooking/comments/10jh214/what_went_wrong_how_to_improve/j5krhdl/
123,j5lm2kn,Tofunugg,Zoinks Scoob,Zoinks Scoob,9,2023-01-23 21:43:46,<praw.models.comment_forest.CommentForest object at 0x0000022EF4D6E0D0>,10jh214,slowcooking,t5_2s64w,,False,False,t3_10jh214,t1_j5kreuf,/r/slowcooking/comments/10jh214/what_went_wrong_how_to_improve/j5lm2kn/
124,j5scdly,C3POdreamer,Rice should be cooked separately. This is the sane as my mother's method: [https://www.marthastewart.com/347002/perfect-white-rice](https://www.marthastewart.com/347002/perfect-white-rice),Rice should be cooked separately. This is the sane as my mother's method: [https://www.marthastewart.com/347002/perfect-white-rice](https://www.marthastewart.com/347002/perfect-white-rice),2,2023-01-25 05:26:00,<praw.models.comment_forest.CommentForest object at 0x0000022EF4D6E190>,10jh214,slowcooking,t5_2s64w,,False,False,t3_10jh214,t1_j5ovj3v,/r/slowcooking/comments/10jh214/what_went_wrong_how_to_improve/j5scdly/
125,j5ko8t6,thedevilsgame,I mean you could do this but chili powder isn't necessarily necessary as it is just a combination of spices.  If they up the spices they currently using then they could end up with a really good chili without the need of a chili powder. That being said the easiest way would be just adding chili powder,I mean you could do this but chili powder isn't necessarily necessary as it is just a combination of spices.  If they up the spices they currently using then they could end up with a really good chili without the need of a chili powder. That being said the easiest way would be just adding chili powder,-18,2023-01-23 18:13:21,<praw.models.comment_forest.CommentForest object at 0x0000022EF4D6E370>,10jh214,slowcooking,t5_2s64w,,False,False,t3_10jh214,t1_j5kmnj4,/r/slowcooking/comments/10jh214/what_went_wrong_how_to_improve/j5ko8t6/
126,j5kta9g,Xeibra,It was a joke lol.,It was a joke lol.,6,2023-01-23 18:44:29,<praw.models.comment_forest.CommentForest object at 0x0000022EF4D6EF10>,10jh214,slowcooking,t5_2s64w,,False,False,t3_10jh214,t1_j5kpnfh,/r/slowcooking/comments/10jh214/what_went_wrong_how_to_improve/j5kta9g/
127,j5ktrhv,historicbookworm,Not if they are canned.,Not if they are canned.,6,2023-01-23 18:47:27,<praw.models.comment_forest.CommentForest object at 0x0000022EF4D77310>,10jh214,slowcooking,t5_2s64w,,False,False,t3_10jh214,t1_j5krhdl,/r/slowcooking/comments/10jh214/what_went_wrong_how_to_improve/j5ktrhv/
128,j5l78u0,kaki024,Chili powder is dried and pulverized chiles. It’s not like “Taco Seasoning”. It’s actual chili peppers.,Chili powder is dried and pulverized chiles. It’s not like “Taco Seasoning”. It’s actual chili peppers.,11,2023-01-23 20:11:54,<praw.models.comment_forest.CommentForest object at 0x0000022EF4D6E430>,10jh214,slowcooking,t5_2s64w,,False,False,t3_10jh214,t1_j5ko8t6,/r/slowcooking/comments/10jh214/what_went_wrong_how_to_improve/j5l78u0/
129,j5kqblz,JusticeRhino,"The secret is in the name of the dish. Chili. I use rehydrated anchos, fresh jalapeños and habaneros in mine. Also, Kidney beans do NOT go in chili. If you have to use beans, try pintos.","The secret is in the name of the dish. Chili. I use rehydrated anchos, fresh jalapeños and habaneros in mine. Also, Kidney beans do NOT go in chili. If you have to use beans, try pintos.",-31,2023-01-23 18:26:12,<praw.models.comment_forest.CommentForest object at 0x0000022EF4D6E490>,10jh214,slowcooking,t5_2s64w,,False,False,t3_10jh214,t1_j5ko8t6,/r/slowcooking/comments/10jh214/what_went_wrong_how_to_improve/j5kqblz/
130,j5kxhif,foxvipus,How is making annoying comments on their post funny?,How is making annoying comments on their post funny?,-7,2023-01-23 19:10:31,<praw.models.comment_forest.CommentForest object at 0x0000022EF4D6EFD0>,10jh214,slowcooking,t5_2s64w,,False,False,t3_10jh214,t1_j5kta9g,/r/slowcooking/comments/10jh214/what_went_wrong_how_to_improve/j5kxhif/
131,j5l0y7z,Pixielo,"Yes? And I was responding to the above comment asking if they were dried, or canned, thus the info.

If someone isn't putting chili powder in chili, do you trust them to know to cook dried beans, so they don't kill anyone?","Yes? And I was responding to the above comment asking if they were dried, or canned, thus the info.

If someone isn't putting chili powder in chili, do you trust them to know to cook dried beans, so they don't kill anyone?",3,2023-01-23 19:32:26,<praw.models.comment_forest.CommentForest object at 0x0000022EF4D773D0>,10jh214,slowcooking,t5_2s64w,,False,False,t3_10jh214,t1_j5ktrhv,/r/slowcooking/comments/10jh214/what_went_wrong_how_to_improve/j5l0y7z/
132,j5l97mz,thedevilsgame,"No Chile powder is dried ground chiles chili powder is a mix of several spices


https://www.southernliving.com/food/seasonings/spices/chile-powder","No Chile powder is dried ground chiles chili powder is a mix of several spices


https://www.southernliving.com/food/seasonings/spices/chile-powder",-2,2023-01-23 20:24:05,<praw.models.comment_forest.CommentForest object at 0x0000022EF4D6E4F0>,10jh214,slowcooking,t5_2s64w,,False,False,t3_10jh214,t1_j5l78u0,/r/slowcooking/comments/10jh214/what_went_wrong_how_to_improve/j5l97mz/
133,j5l9avs,Masters-lil-sub,"Jalapeños and anchos are what I put in mine as well, and agree on the kidney bean stance.  We are a minority, but my honey is adamantly against beans in chili.  Lol","Jalapeños and anchos are what I put in mine as well, and agree on the kidney bean stance.  We are a minority, but my honey is adamantly against beans in chili.  Lol",0,2023-01-23 20:24:38,<praw.models.comment_forest.CommentForest object at 0x0000022EF4D6E610>,10jh214,slowcooking,t5_2s64w,,False,False,t3_10jh214,t1_j5kqblz,/r/slowcooking/comments/10jh214/what_went_wrong_how_to_improve/j5l9avs/
134,j5l1yw9,hothat66,How is insulting Americans for a joke helpful?,How is insulting Americans for a joke helpful?,1,2023-01-23 19:38:51,<praw.models.comment_forest.CommentForest object at 0x0000022EF4D770D0>,10jh214,slowcooking,t5_2s64w,,False,False,t3_10jh214,t1_j5kxhif,/r/slowcooking/comments/10jh214/what_went_wrong_how_to_improve/j5l1yw9/
135,jao9tbp,kaki024,I just checked my chili powder and I stand corrected!!,I just checked my chili powder and I stand corrected!!,1,2023-03-02 21:29:03,<praw.models.comment_forest.CommentForest object at 0x0000022EF4D6E5B0>,10jh214,slowcooking,t5_2s64w,,False,False,t3_10jh214,t1_j5l97mz,/r/slowcooking/comments/10jh214/what_went_wrong_how_to_improve/jao9tbp/
136,j5lklim,JusticeRhino,This is the most I’ve ever been downvoted on reddit. It seems the kidney bean note touched a chord.,This is the most I’ve ever been downvoted on reddit. It seems the kidney bean note touched a chord.,0,2023-01-23 21:34:36,<praw.models.comment_forest.CommentForest object at 0x0000022EF4D6E6D0>,10jh214,slowcooking,t5_2s64w,,False,False,t3_10jh214,t1_j5l9avs,/r/slowcooking/comments/10jh214/what_went_wrong_how_to_improve/j5lklim/
137,j5l2g65,foxvipus,How is my observation an insult? Your comment is case in point - unnecessary.,How is my observation an insult? Your comment is case in point - unnecessary.,-4,2023-01-23 19:41:53,<praw.models.comment_forest.CommentForest object at 0x0000022EF4D77190>,10jh214,slowcooking,t5_2s64w,,False,False,t3_10jh214,t1_j5l1yw9,/r/slowcooking/comments/10jh214/what_went_wrong_how_to_improve/j5l2g65/
