,ID,Author,body,Comment,Score,Created On,Replies,Submission,Subreddit,Subreddit_ID,Distinguished,Edited,Is_submitter,link_id,Parent_id,Permalink
0,j4y5s5l,sheepj1,"you’ve got about 30 seconds before you’ve got people yelling at you for posting The Soup, or making angry posts about you posting The Soup. godspeed","you’ve got about 30 seconds before you’ve got people yelling at you for posting The Soup, or making angry posts about you posting The Soup. godspeed",39,2023-01-19 01:59:46,<praw.models.comment_forest.CommentForest object at 0x0000022EF0CE0FD0>,10fp3pn,slowcooking,t5_2s64w,,False,False,t3_10fp3pn,t3_10fp3pn,/r/slowcooking/comments/10fp3pn/so_i_made_the_soup/j4y5s5l/
1,j4y53pq,TheMeanGirl,Was it terrible?,Was it terrible?,16,2023-01-19 01:54:51,<praw.models.comment_forest.CommentForest object at 0x0000022EF0CDE220>,10fp3pn,slowcooking,t5_2s64w,,False,False,t3_10fp3pn,t3_10fp3pn,/r/slowcooking/comments/10fp3pn/so_i_made_the_soup/j4y53pq/
2,j4y57l7,vadieblue,"And it was meh. 

I followed the recipe except for:

-garlic olive oil (instead of regular olive oil)
-3/4 shredded Parmesan (instead of 1/2)
-added shredded Parmesan to the top upon serving 

I think if Romano was used instead of Parmesan then it might be more appealing or possibly doing a mixture of the two. Also, even with the garlic olive oil, I don’t think it was enough so if I make it again I will use 3 or 4 cloves of garlic. 

My husband loved it. I just can’t figure how to make it better.  I thought it was bland.

Also, a friend suggested that the soup would taste better on day two. I’m here to confirm that it was still bland and meh on day 2. 

Bummer, I had such high hopes.","And it was meh. 

I followed the recipe except for:

-garlic olive oil (instead of regular olive oil)
-3/4 shredded Parmesan (instead of 1/2)
-added shredded Parmesan to the top upon serving 

I think if Romano was used instead of Parmesan then it might be more appealing or possibly doing a mixture of the two. Also, even with the garlic olive oil, I don’t think it was enough so if I make it again I will use 3 or 4 cloves of garlic. 

My husband loved it. I just can’t figure how to make it better.  I thought it was bland.

Also, a friend suggested that the soup would taste better on day two. I’m here to confirm that it was still bland and meh on day 2. 

Bummer, I had such high hopes.",18,2023-01-19 01:55:38,<praw.models.comment_forest.CommentForest object at 0x0000022EF0CDE2B0>,10fp3pn,slowcooking,t5_2s64w,,False,True,t3_10fp3pn,t3_10fp3pn,/r/slowcooking/comments/10fp3pn/so_i_made_the_soup/j4y57l7/
3,j4ya5kc,GBreezy,"Unlike a lot of people, I support you and your cooking endeavors!","Unlike a lot of people, I support you and your cooking endeavors!",15,2023-01-19 02:31:38,<praw.models.comment_forest.CommentForest object at 0x0000022EF0CDE310>,10fp3pn,slowcooking,t5_2s64w,,False,False,t3_10fp3pn,t3_10fp3pn,/r/slowcooking/comments/10fp3pn/so_i_made_the_soup/j4ya5kc/
4,j5ckafe,crimbuscarol,"Imagine you are me, you joined this sub a week ago for some fun ideas. And now every damn post is this soup.","Imagine you are me, you joined this sub a week ago for some fun ideas. And now every damn post is this soup.",3,2023-01-22 00:36:03,<praw.models.comment_forest.CommentForest object at 0x0000022EF0CDE5B0>,10fp3pn,slowcooking,t5_2s64w,,False,False,t3_10fp3pn,t3_10fp3pn,/r/slowcooking/comments/10fp3pn/so_i_made_the_soup/j5ckafe/
5,j4ydgcx,Risto_08,r/downvotethesoup,r/downvotethesoup,10,2023-01-19 02:55:43,<praw.models.comment_forest.CommentForest object at 0x0000022EF0CDE610>,10fp3pn,slowcooking,t5_2s64w,,False,False,t3_10fp3pn,t3_10fp3pn,/r/slowcooking/comments/10fp3pn/so_i_made_the_soup/j4ydgcx/
6,j58fqjs,CharlieA44,"I just made ""The Soup"" today. When I went to my pantry to get the diced tomatoes, I found I didn't have any. (even though I was sure I had a couple of cans of fire roasted diced tomatoes) I just ended up adding about a pint of crushed tomatoes I had left over from making pizza sauce. It was ok, but I'm definitely adding more spices next time, even though I probably added 1.5x basil and 2x pepper, and a spoonful of better than boullion roasted chicken to my unsalted chicken stock.  I'm thinking red pepper, oregano & rosemary at least, and maybe some thyme. I'll also do the onions & roux in a pan instead of the microwave.","I just made ""The Soup"" today. When I went to my pantry to get the diced tomatoes, I found I didn't have any. (even though I was sure I had a couple of cans of fire roasted diced tomatoes) I just ended up adding about a pint of crushed tomatoes I had left over from making pizza sauce. It was ok, but I'm definitely adding more spices next time, even though I probably added 1.5x basil and 2x pepper, and a spoonful of better than boullion roasted chicken to my unsalted chicken stock.  I'm thinking red pepper, oregano & rosemary at least, and maybe some thyme. I'll also do the onions & roux in a pan instead of the microwave.",2,2023-01-21 03:16:17,<praw.models.comment_forest.CommentForest object at 0x0000022EF0CDE670>,10fp3pn,slowcooking,t5_2s64w,,False,False,t3_10fp3pn,t3_10fp3pn,/r/slowcooking/comments/10fp3pn/so_i_made_the_soup/j58fqjs/
7,j4zerqu,CHLORINE_DRINKER_69,this is my final straw,this is my final straw,4,2023-01-19 09:16:13,<praw.models.comment_forest.CommentForest object at 0x0000022EF0CDE790>,10fp3pn,slowcooking,t5_2s64w,,False,False,t3_10fp3pn,t3_10fp3pn,/r/slowcooking/comments/10fp3pn/so_i_made_the_soup/j4zerqu/
8,j4y4fmf,vadieblue,Recipe:  https://www.365daysofcrockpot.com/slow-cooker-tortellini-spinach-soup/,Recipe:  https://www.365daysofcrockpot.com/slow-cooker-tortellini-spinach-soup/,4,2023-01-19 01:50:02,<praw.models.comment_forest.CommentForest object at 0x0000022EF0CDE7F0>,10fp3pn,slowcooking,t5_2s64w,,False,True,t3_10fp3pn,t3_10fp3pn,/r/slowcooking/comments/10fp3pn/so_i_made_the_soup/j4y4fmf/
9,j4yg8y5,TimeIsBunk,I feel like the guy that asked about the poop knife right now. I'm so lost.,I feel like the guy that asked about the poop knife right now. I'm so lost.,2,2023-01-19 03:16:41,<praw.models.comment_forest.CommentForest object at 0x0000022EF0CDE850>,10fp3pn,slowcooking,t5_2s64w,,False,False,t3_10fp3pn,t3_10fp3pn,/r/slowcooking/comments/10fp3pn/so_i_made_the_soup/j4yg8y5/
10,j50p0vq,NameInProgressTM,Ok what am I missing about the soup? Why are we downvoting it? What makes this soup THE soup? Should I make and post about making the soup?,Ok what am I missing about the soup? Why are we downvoting it? What makes this soup THE soup? Should I make and post about making the soup?,1,2023-01-19 16:18:01,<praw.models.comment_forest.CommentForest object at 0x0000022EF0CDE8B0>,10fp3pn,slowcooking,t5_2s64w,,False,False,t3_10fp3pn,t3_10fp3pn,/r/slowcooking/comments/10fp3pn/so_i_made_the_soup/j50p0vq/
11,j4ybshs,GingerIsTheBestSpice,I added a LOT more spices and also some sausage and it was pretty good,I added a LOT more spices and also some sausage and it was pretty good,10,2023-01-19 02:43:35,<praw.models.comment_forest.CommentForest object at 0x0000022EF0CDE370>,10fp3pn,slowcooking,t5_2s64w,,False,False,t3_10fp3pn,t1_j4y57l7,/r/slowcooking/comments/10fp3pn/so_i_made_the_soup/j4ybshs/
12,j530az7,chrisco7030,"Switch out the chicken for hot Italian sausage and it will be much, much better. I made it for the first time this past Sunday and haven't been able to stop eating it all week.","Switch out the chicken for hot Italian sausage and it will be much, much better. I made it for the first time this past Sunday and haven't been able to stop eating it all week.",8,2023-01-20 01:10:08,<praw.models.comment_forest.CommentForest object at 0x0000022EF0CDE3D0>,10fp3pn,slowcooking,t5_2s64w,,False,False,t3_10fp3pn,t1_j4y57l7,/r/slowcooking/comments/10fp3pn/so_i_made_the_soup/j530az7/
13,j522hzf,Fuzzy_Ambassador7784,"I want to find the original posters of this f\*\*king soup because I feel so duped. I think it was all a PsyOp by big tortellini to increase sales. But yes, totally ""meh""","I want to find the original posters of this f\*\*king soup because I feel so duped. I think it was all a PsyOp by big tortellini to increase sales. But yes, totally ""meh""",8,2023-01-19 21:16:10,<praw.models.comment_forest.CommentForest object at 0x0000022EF0CDE430>,10fp3pn,slowcooking,t5_2s64w,,False,False,t3_10fp3pn,t1_j4y57l7,/r/slowcooking/comments/10fp3pn/so_i_made_the_soup/j522hzf/
14,j4y850l,VoxR4710,"Don't try to bend the soup, that's impossible. Instead only try to realize the truth.","Don't try to bend the soup, that's impossible. Instead only try to realize the truth.",7,2023-01-19 02:16:58,<praw.models.comment_forest.CommentForest object at 0x0000022EF0CDE490>,10fp3pn,slowcooking,t5_2s64w,,False,False,t3_10fp3pn,t1_j4y57l7,/r/slowcooking/comments/10fp3pn/so_i_made_the_soup/j4y850l/
15,j4y8fld,6417725,"I used 5 cloves and added Dominican oregano, rosemary, toasted red pepper flakes, and white pepper. I also shredded sweet onion very very fine","I used 5 cloves and added Dominican oregano, rosemary, toasted red pepper flakes, and white pepper. I also shredded sweet onion very very fine",3,2023-01-19 02:19:05,<praw.models.comment_forest.CommentForest object at 0x0000022EF0CDE550>,10fp3pn,slowcooking,t5_2s64w,,False,False,t3_10fp3pn,t1_j4y57l7,/r/slowcooking/comments/10fp3pn/so_i_made_the_soup/j4y8fld/
16,j4yflgl,shoodBwurqin,"I appreciate your goal, my dude.","I appreciate your goal, my dude.",6,2023-01-19 03:11:38,<praw.models.comment_forest.CommentForest object at 0x0000022EF0CDE6D0>,10fp3pn,slowcooking,t5_2s64w,,False,False,t3_10fp3pn,t1_j4ydgcx,/r/slowcooking/comments/10fp3pn/so_i_made_the_soup/j4yflgl/
17,j50u5xt,ThrowRA__spirit,Thank god I thought I was the only one who immediately downvotes when I see the word soup,Thank god I thought I was the only one who immediately downvotes when I see the word soup,2,2023-01-19 16:49:58,<praw.models.comment_forest.CommentForest object at 0x0000022EF0CDE730>,10fp3pn,slowcooking,t5_2s64w,,False,False,t3_10fp3pn,t1_j4ydgcx,/r/slowcooking/comments/10fp3pn/so_i_made_the_soup/j50u5xt/
18,j4yrxxd,chewingcudcow,"I’m lost too, no worries lol","I’m lost too, no worries lol",1,2023-01-19 04:52:15,<praw.models.comment_forest.CommentForest object at 0x0000022EF0CDE910>,10fp3pn,slowcooking,t5_2s64w,,False,False,t3_10fp3pn,t1_j4yg8y5,/r/slowcooking/comments/10fp3pn/so_i_made_the_soup/j4yrxxd/
19,j52ppk5,sheepj1,"it’s easy to make/beginner friendly, and one of the most popular things to get made and posted on this sub. we’re talking multiple posts a day recently - it’s pretty cyclical as you can imagine, someone posts the soup and those who haven’t seen it are intrigued and go make the soup and post about it, repeat ad infinitum. i’m pretty sure there are also people posting ironically just to make others mad. anyway, there are a lot of people here who get mad about the amount of posts about the soup and downvote/post passive aggressively/announce their departure from the sub over it. it doesn’t help that the soup is aggressively average unless you majorly doctor it up lol","it’s easy to make/beginner friendly, and one of the most popular things to get made and posted on this sub. we’re talking multiple posts a day recently - it’s pretty cyclical as you can imagine, someone posts the soup and those who haven’t seen it are intrigued and go make the soup and post about it, repeat ad infinitum. i’m pretty sure there are also people posting ironically just to make others mad. anyway, there are a lot of people here who get mad about the amount of posts about the soup and downvote/post passive aggressively/announce their departure from the sub over it. it doesn’t help that the soup is aggressively average unless you majorly doctor it up lol",6,2023-01-19 23:55:39,<praw.models.comment_forest.CommentForest object at 0x0000022EF0CDE9D0>,10fp3pn,slowcooking,t5_2s64w,,False,False,t3_10fp3pn,t1_j50p0vq,/r/slowcooking/comments/10fp3pn/so_i_made_the_soup/j52ppk5/
20,j52jn1s,blacklaagger,I too am new to The Soup.,I too am new to The Soup.,3,2023-01-19 23:11:39,<praw.models.comment_forest.CommentForest object at 0x0000022EF0CDEA30>,10fp3pn,slowcooking,t5_2s64w,,False,False,t3_10fp3pn,t1_j50p0vq,/r/slowcooking/comments/10fp3pn/so_i_made_the_soup/j52jn1s/
21,j571tdh,johnjohnsonsdickhole,Big tortellini LOL,Big tortellini LOL,6,2023-01-20 21:12:55,<praw.models.comment_forest.CommentForest object at 0x0000022EF0CDE4F0>,10fp3pn,slowcooking,t5_2s64w,,False,False,t3_10fp3pn,t1_j522hzf,/r/slowcooking/comments/10fp3pn/so_i_made_the_soup/j571tdh/
22,j98oayy,AugustSun29,"In my opinion, it is not as great as everyone says.","In my opinion, it is not as great as everyone says.",62,2023-02-20 02:32:19,<praw.models.comment_forest.CommentForest object at 0x0000022EF0CEF3A0>,116ogk8,slowcooking,t5_2s64w,,False,False,t3_116ogk8,t3_116ogk8,/r/slowcooking/comments/116ogk8/wtf_is_the_soup/j98oayy/
23,j97kvmq,chriswhitewrites,"It's in the sidebar, although I know that some apps don't show the sidebar. It's the creamy tortellini soup: https://www.reddit.com/r/slowcooking/wiki/index#wiki_creamy_tortellini_soup_with_chicken_.26amp.3B_spinach","It's in the sidebar, although I know that some apps don't show the sidebar. It's the creamy tortellini soup: https://www.reddit.com/r/slowcooking/wiki/index#wiki_creamy_tortellini_soup_with_chicken_.26amp.3B_spinach",37,2023-02-19 21:31:31,<praw.models.comment_forest.CommentForest object at 0x0000022EF0CEF490>,116ogk8,slowcooking,t5_2s64w,,False,False,t3_116ogk8,t3_116ogk8,/r/slowcooking/comments/116ogk8/wtf_is_the_soup/j97kvmq/
24,j98vaa9,FormicaDinette33,It’s just a soup with tortellini in it. I’m my opinion there was way too much tortellini as it really expands.,It’s just a soup with tortellini in it. I’m my opinion there was way too much tortellini as it really expands.,7,2023-02-20 03:30:54,<praw.models.comment_forest.CommentForest object at 0x0000022EF0CEF7F0>,116ogk8,slowcooking,t5_2s64w,,False,False,t3_116ogk8,t3_116ogk8,/r/slowcooking/comments/116ogk8/wtf_is_the_soup/j98vaa9/
25,j98hdp4,ryanhedden1,Overrated,Overrated,13,2023-02-20 01:35:31,<praw.models.comment_forest.CommentForest object at 0x0000022EF0CEFAF0>,116ogk8,slowcooking,t5_2s64w,,False,False,t3_116ogk8,t3_116ogk8,/r/slowcooking/comments/116ogk8/wtf_is_the_soup/j98hdp4/
26,j98nc7m,Lanky_Accountant_712,"A lot of people are saying it’s overrated. I made it the other day and loved it but customised it. Added bacon, vegeta and a few other herbs. I read on another thread that it should be used as a template, and add to it what you like eg sausages.  Also quality of ingredients is super important","A lot of people are saying it’s overrated. I made it the other day and loved it but customised it. Added bacon, vegeta and a few other herbs. I read on another thread that it should be used as a template, and add to it what you like eg sausages.  Also quality of ingredients is super important",8,2023-02-20 02:24:21,<praw.models.comment_forest.CommentForest object at 0x0000022EF0CEFC70>,116ogk8,slowcooking,t5_2s64w,,False,False,t3_116ogk8,t3_116ogk8,/r/slowcooking/comments/116ogk8/wtf_is_the_soup/j98nc7m/
27,j9bkkee,sizeofanoceansize,"I’ve made it 4 times in the last couple months. I love it. I add chorizo sausage and replace half of the tortellini with spinach gnocchi. 

It’s lovely. Everyone I’ve given some to also loves it.","I’ve made it 4 times in the last couple months. I love it. I add chorizo sausage and replace half of the tortellini with spinach gnocchi. 

It’s lovely. Everyone I’ve given some to also loves it.",3,2023-02-20 18:53:04,<praw.models.comment_forest.CommentForest object at 0x0000022EF0CEFDF0>,116ogk8,slowcooking,t5_2s64w,,False,False,t3_116ogk8,t3_116ogk8,/r/slowcooking/comments/116ogk8/wtf_is_the_soup/j9bkkee/
28,j9da78t,Rude-Zucchini-369,Don’t bother,Don’t bother,2,2023-02-21 02:01:05,<praw.models.comment_forest.CommentForest object at 0x0000022EF0CEFFD0>,116ogk8,slowcooking,t5_2s64w,,False,False,t3_116ogk8,t3_116ogk8,/r/slowcooking/comments/116ogk8/wtf_is_the_soup/j9da78t/
29,j9j6qcp,JimboCruntz,"It’s a recipe invented by someone who can’t really  cook that seems to have got out of hand. 

It’s just as many ingredients as possible together and call it a new recipe. There’s no thought or technique besides “tortellini cooked in soup might be nice”. It could be, but it needs a better soup and more thought put in to the cooking process.","It’s a recipe invented by someone who can’t really  cook that seems to have got out of hand. 

It’s just as many ingredients as possible together and call it a new recipe. There’s no thought or technique besides “tortellini cooked in soup might be nice”. It could be, but it needs a better soup and more thought put in to the cooking process.",2,2023-02-22 10:23:05,<praw.models.comment_forest.CommentForest object at 0x0000022EF0CF3070>,116ogk8,slowcooking,t5_2s64w,,False,False,t3_116ogk8,t3_116ogk8,/r/slowcooking/comments/116ogk8/wtf_is_the_soup/j9j6qcp/
30,j98l3r2,SilentSamizdat,What’s a sidebar and why don’t I see one on my screen?,What’s a sidebar and why don’t I see one on my screen?,0,2023-02-20 02:05:57,<praw.models.comment_forest.CommentForest object at 0x0000022EF0CF30D0>,116ogk8,slowcooking,t5_2s64w,,False,False,t3_116ogk8,t3_116ogk8,/r/slowcooking/comments/116ogk8/wtf_is_the_soup/j98l3r2/
31,j99vpef,heyimhereok,"Check this Google Doc out mate. I have it saved on my phone.

https://www.reddit.com/r/slowcooking/comments/yrpm22/i_have_updated_the_tried_and_true_slow_cooking/?utm_source=share&utm_medium=android_app&utm_name=androidcss&utm_term=1&utm_content=share_button","Check this Google Doc out mate. I have it saved on my phone.

https://www.reddit.com/r/slowcooking/comments/yrpm22/i_have_updated_the_tried_and_true_slow_cooking/?utm_source=share&utm_medium=android_app&utm_name=androidcss&utm_term=1&utm_content=share_button",1,2023-02-20 10:40:36,<praw.models.comment_forest.CommentForest object at 0x0000022EF0CF3190>,116ogk8,slowcooking,t5_2s64w,,False,False,t3_116ogk8,t3_116ogk8,/r/slowcooking/comments/116ogk8/wtf_is_the_soup/j99vpef/
32,j9a7pc1,MRamskill,"I had to Google it yesterday to see, it looks quite nice actually","I had to Google it yesterday to see, it looks quite nice actually",1,2023-02-20 13:05:04,<praw.models.comment_forest.CommentForest object at 0x0000022EF0CF31F0>,116ogk8,slowcooking,t5_2s64w,,False,False,t3_116ogk8,t3_116ogk8,/r/slowcooking/comments/116ogk8/wtf_is_the_soup/j9a7pc1/
33,j9awlpq,beenbanned12321,"""Now thats a soup question..""","""Now thats a soup question..""",1,2023-02-20 16:17:49,<praw.models.comment_forest.CommentForest object at 0x0000022EF0CF3250>,116ogk8,slowcooking,t5_2s64w,,False,False,t3_116ogk8,t3_116ogk8,/r/slowcooking/comments/116ogk8/wtf_is_the_soup/j9awlpq/
34,j9mbw1a,Rosieapples,I think it’s delicious.,I think it’s delicious.,1,2023-02-23 00:19:16,<praw.models.comment_forest.CommentForest object at 0x0000022EF0CF32B0>,116ogk8,slowcooking,t5_2s64w,,False,False,t3_116ogk8,t3_116ogk8,/r/slowcooking/comments/116ogk8/wtf_is_the_soup/j9mbw1a/
35,j9dma2r,McCoovy,The recipe tells you to put all the pasta in when you cook it. It's so amateur. You can't store pasta in liquid so only people who plan on eating it all should combine the pasta before it's served.,The recipe tells you to put all the pasta in when you cook it. It's so amateur. You can't store pasta in liquid so only people who plan on eating it all should combine the pasta before it's served.,7,2023-02-21 03:36:52,<praw.models.comment_forest.CommentForest object at 0x0000022EF0CEF4F0>,116ogk8,slowcooking,t5_2s64w,,False,False,t3_116ogk8,t1_j98oayy,/r/slowcooking/comments/116ogk8/wtf_is_the_soup/j9dma2r/
36,j9cae7a,TerryTwoOh,"Agreed. It’s pretty good, it’s easy, I like it. But the way people talk about it now is like the same fluffed up way that bacon was talked about in the 2012 era.","Agreed. It’s pretty good, it’s easy, I like it. But the way people talk about it now is like the same fluffed up way that bacon was talked about in the 2012 era.",5,2023-02-20 21:41:09,<praw.models.comment_forest.CommentForest object at 0x0000022EF0CEF5B0>,116ogk8,slowcooking,t5_2s64w,,False,False,t3_116ogk8,t1_j98oayy,/r/slowcooking/comments/116ogk8/wtf_is_the_soup/j9cae7a/
37,j99uyr9,katemary77,I really disliked it.,I really disliked it.,5,2023-02-20 10:30:04,<praw.models.comment_forest.CommentForest object at 0x0000022EF0CEF6A0>,116ogk8,slowcooking,t5_2s64w,,False,False,t3_116ogk8,t1_j98oayy,/r/slowcooking/comments/116ogk8/wtf_is_the_soup/j99uyr9/
38,j9941il,afooltobesure,Can’t know until I try it. Recipe plz??,Can’t know until I try it. Recipe plz??,3,2023-02-20 04:50:50,<praw.models.comment_forest.CommentForest object at 0x0000022EF0CEF730>,116ogk8,slowcooking,t5_2s64w,,False,True,t3_116ogk8,t1_j98oayy,/r/slowcooking/comments/116ogk8/wtf_is_the_soup/j9941il/
39,j99qw6y,Aev_ACNH,I hear it’s good with bacon,I hear it’s good with bacon,5,2023-02-20 09:31:21,<praw.models.comment_forest.CommentForest object at 0x0000022EF0CEF970>,116ogk8,slowcooking,t5_2s64w,,False,False,t3_116ogk8,t1_j97kvmq,/r/slowcooking/comments/116ogk8/wtf_is_the_soup/j99qw6y/
40,j97lhqa,afooltobesure,"thx man i appreciate it lol. i'm using old reddit so it doesn't show. i love to cook though, so i'll give it a shot","thx man i appreciate it lol. i'm using old reddit so it doesn't show. i love to cook though, so i'll give it a shot",8,2023-02-19 21:35:52,<praw.models.comment_forest.CommentForest object at 0x0000022EF0CEF9D0>,116ogk8,slowcooking,t5_2s64w,,False,True,t3_116ogk8,t1_j97kvmq,/r/slowcooking/comments/116ogk8/wtf_is_the_soup/j97lhqa/
41,j98dymq,Borkton,I'm on a desktop and it doesn't show up in the sidebar.,I'm on a desktop and it doesn't show up in the sidebar.,1,2023-02-20 01:08:18,<praw.models.comment_forest.CommentForest object at 0x0000022EF0CEFA90>,116ogk8,slowcooking,t5_2s64w,,False,False,t3_116ogk8,t1_j97kvmq,/r/slowcooking/comments/116ogk8/wtf_is_the_soup/j98dymq/
42,j9dmgfe,McCoovy,It's an idiotic recipe. You have to eat it all because it won't keep well.,It's an idiotic recipe. You have to eat it all because it won't keep well.,5,2023-02-21 03:38:20,<praw.models.comment_forest.CommentForest object at 0x0000022EF0CEFBB0>,116ogk8,slowcooking,t5_2s64w,,False,False,t3_116ogk8,t1_j98vaa9,/r/slowcooking/comments/116ogk8/wtf_is_the_soup/j9dmgfe/
43,j993zm6,afooltobesure,Shoot me the recipe plz. I like slow cooking,Shoot me the recipe plz. I like slow cooking,1,2023-02-20 04:50:18,<praw.models.comment_forest.CommentForest object at 0x0000022EF0CEFC10>,116ogk8,slowcooking,t5_2s64w,,False,True,t3_116ogk8,t1_j98vaa9,/r/slowcooking/comments/116ogk8/wtf_is_the_soup/j993zm6/
44,j98ja7f,afooltobesure,how would i know if i've ever tried?,how would i know if i've ever tried?,5,2023-02-20 01:51:00,<praw.models.comment_forest.CommentForest object at 0x0000022EF0CEFD90>,116ogk8,slowcooking,t5_2s64w,,False,True,t3_116ogk8,t1_j98hdp4,/r/slowcooking/comments/116ogk8/wtf_is_the_soup/j98ja7f/
45,j98w2u4,Da5ftAssassin,TIL that you were not cooking a super saiyan,TIL that you were not cooking a super saiyan,16,2023-02-20 03:37:43,<praw.models.comment_forest.CommentForest object at 0x0000022EF0CEFF10>,116ogk8,slowcooking,t5_2s64w,,False,False,t3_116ogk8,t1_j98nc7m,/r/slowcooking/comments/116ogk8/wtf_is_the_soup/j98w2u4/
46,j9nnu71,afooltobesure,That perfectly explains it. Thank you. I’ll give it a shot and see how it turns out!,That perfectly explains it. Thank you. I’ll give it a shot and see how it turns out!,0,2023-02-23 07:06:34,<praw.models.comment_forest.CommentForest object at 0x0000022EF0CF3130>,116ogk8,slowcooking,t5_2s64w,,False,True,t3_116ogk8,t1_j9j6qcp,/r/slowcooking/comments/116ogk8/wtf_is_the_soup/j9nnu71/
47,j9nnk0g,afooltobesure,It looks good I to me. Gonna give it a shot tmw,It looks good I to me. Gonna give it a shot tmw,1,2023-02-23 07:03:09,<praw.models.comment_forest.CommentForest object at 0x0000022EF0CF3370>,116ogk8,slowcooking,t5_2s64w,,False,True,t3_116ogk8,t1_j9mbw1a,/r/slowcooking/comments/116ogk8/wtf_is_the_soup/j9nnk0g/
48,j9a8td7,AugustSun29,"Same! I was thinking it was the worst soup I've ever made. Granted, I have made many soups, but still.","Same! I was thinking it was the worst soup I've ever made. Granted, I have made many soups, but still.",7,2023-02-20 13:15:44,<praw.models.comment_forest.CommentForest object at 0x0000022EF0CEF790>,116ogk8,slowcooking,t5_2s64w,,False,False,t3_116ogk8,t1_j99uyr9,/r/slowcooking/comments/116ogk8/wtf_is_the_soup/j9a8td7/
49,j9a8xc6,AugustSun29,"If you are on the app, go to the slow cooking page, hit the three dots at the top, and choose community info. It's the tortellini soup.","If you are on the app, go to the slow cooking page, hit the three dots at the top, and choose community info. It's the tortellini soup.",8,2023-02-20 13:16:46,<praw.models.comment_forest.CommentForest object at 0x0000022EF0CEF850>,116ogk8,slowcooking,t5_2s64w,,1676899278.0,False,t3_116ogk8,t1_j9941il,/r/slowcooking/comments/116ogk8/wtf_is_the_soup/j9a8xc6/
50,j9abvz1,twill41385,Google upvote soup.,Google upvote soup.,6,2023-02-20 13:43:53,<praw.models.comment_forest.CommentForest object at 0x0000022EF0CEF8B0>,116ogk8,slowcooking,t5_2s64w,,False,False,t3_116ogk8,t1_j9941il,/r/slowcooking/comments/116ogk8/wtf_is_the_soup/j9abvz1/
51,j9ftoci,YoungSuavo,swap the chicken for mild Italian sausage. Levels it up quite a bit especially after browning it first.,swap the chicken for mild Italian sausage. Levels it up quite a bit especially after browning it first.,2,2023-02-21 16:50:03,<praw.models.comment_forest.CommentForest object at 0x0000022EF0CEF910>,116ogk8,slowcooking,t5_2s64w,,False,False,t3_116ogk8,t1_j9941il,/r/slowcooking/comments/116ogk8/wtf_is_the_soup/j9ftoci/
