,ID,Author,body,Comment,Score,Created On,Replies,Submission,Subreddit,Subreddit_ID,Distinguished,Edited,Is_submitter,link_id,Parent_id,Permalink
337,gl2a2a3,p5ych00n5,"I mean look what Hitler did, pulled up Germany out of economic ruin, and set up the modern National Park model for the country and also introduced harsh penalties for Animal Cruelty, but people ONLY talk about those other pesky things he attempted","I mean look what Hitler did, pulled up Germany out of economic ruin, and set up the modern National Park model for the country and also introduced harsh penalties for Animal Cruelty, but people ONLY talk about those other pesky things he attempted",1,2021-01-28 07:46:50,<praw.models.comment_forest.CommentForest object at 0x000002541F665A30>,l3ytdy,GetMotivated,t5_2rmfx,,False,False,t3_l3ytdy,t1_gkl9z40,/r/GetMotivated/comments/l3ytdy/image_actually_there_are_more_people_who_will_be/gl2a2a3/
338,gkkka63,,[removed],[removed],-6,2021-01-24 14:17:14,<praw.models.comment_forest.CommentForest object at 0x000002541F665820>,l3ytdy,GetMotivated,t5_2rmfx,,False,False,t3_l3ytdy,t1_gkkhd57,/r/GetMotivated/comments/l3ytdy/image_actually_there_are_more_people_who_will_be/gkkka63/
339,gl29oc3,p5ych00n5,"I mean if he didn't take Apartheid blood money, pulled up his own bootstraps and not continuously exploit his own workers, they wouldn't rail against him so much","I mean if he didn't take Apartheid blood money, pulled up his own bootstraps and not continuously exploit his own workers, they wouldn't rail against him so much",1,2021-01-28 07:41:43,<praw.models.comment_forest.CommentForest object at 0x000002541F665A90>,l3ytdy,GetMotivated,t5_2rmfx,,False,False,t3_l3ytdy,t1_gkncy3g,/r/GetMotivated/comments/l3ytdy/image_actually_there_are_more_people_who_will_be/gl29oc3/
340,h8dvaf2,AutoModerator,"Hi there! GetMotivated has a new, friendly, discord server and would love for you to join and check it out https://discord.gg/tfwPhhfrCY.  Please excuse this stickied comment, we just want to get the word out.  We will turn it off after a short while, enjoy your day!

*I am a bot, and this action was performed automatically. Please [contact the moderators of this subreddit](/message/compose/?to=/r/GetMotivated) if you have any questions or concerns.*","Hi there! GetMotivated has a new, friendly, discord server and would love for you to join and check it out https://discord.gg/tfwPhhfrCY.  Please excuse this stickied comment, we just want to get the word out.  We will turn it off after a short while, enjoy your day!

*I am a bot, and this action was performed automatically. Please [contact the moderators of this subreddit](/message/compose/?to=/r/GetMotivated) if you have any questions or concerns.*",1,2021-08-10 07:21:27,<praw.models.comment_forest.CommentForest object at 0x000002541F69ED60>,p1kb9e,GetMotivated,t5_2rmfx,moderator,False,False,t3_p1kb9e,t3_p1kb9e,/r/GetMotivated/comments/p1kb9e/image_had_the_idea_for_this_poster_on_a_walk_back/h8dvaf2/
341,h8dxf2y,ackarthur,"Good things come to get off their ass, those who & do shit.","Good things come to get off their ass, those who & do shit.",21,2021-08-10 07:52:26,<praw.models.comment_forest.CommentForest object at 0x000002541F69EA60>,p1kb9e,GetMotivated,t5_2rmfx,,False,False,t3_p1kb9e,t3_p1kb9e,/r/GetMotivated/comments/p1kb9e/image_had_the_idea_for_this_poster_on_a_walk_back/h8dxf2y/
342,h8e2irv,OhHiFelicia,"Don't Dead, Open Inside.","Don't Dead, Open Inside.",15,2021-08-10 09:08:34,<praw.models.comment_forest.CommentForest object at 0x000002541F69E910>,p1kb9e,GetMotivated,t5_2rmfx,,False,False,t3_p1kb9e,t3_p1kb9e,/r/GetMotivated/comments/p1kb9e/image_had_the_idea_for_this_poster_on_a_walk_back/h8e2irv/
343,h8dvza3,Dreamininacasket,This format is just bad.,This format is just bad.,10,2021-08-10 07:31:19,<praw.models.comment_forest.CommentForest object at 0x000002541F69E8B0>,p1kb9e,GetMotivated,t5_2rmfx,,False,False,t3_p1kb9e,t3_p1kb9e,/r/GetMotivated/comments/p1kb9e/image_had_the_idea_for_this_poster_on_a_walk_back/h8dvza3/
344,h8dvfcg,justingolden21,Mobile / portrait available upon request,Mobile / portrait available upon request,0,2021-08-10 07:23:22,<praw.models.comment_forest.CommentForest object at 0x000002541F69EA90>,p1kb9e,GetMotivated,t5_2rmfx,,False,True,t3_p1kb9e,t3_p1kb9e,/r/GetMotivated/comments/p1kb9e/image_had_the_idea_for_this_poster_on_a_walk_back/h8dvfcg/
345,h8dzg6c,letchluthor,https://media.thetab.com/blogs.dir/90/files/2019/11/womanyellingcat-940x480.jpg,https://media.thetab.com/blogs.dir/90/files/2019/11/womanyellingcat-940x480.jpg,2,2021-08-10 08:22:19,<praw.models.comment_forest.CommentForest object at 0x000002541F69E8E0>,p1kb9e,GetMotivated,t5_2rmfx,,False,False,t3_p1kb9e,t1_h8dxf2y,/r/GetMotivated/comments/p1kb9e/image_had_the_idea_for_this_poster_on_a_walk_back/h8dzg6c/
346,h8e4xnp,justingolden21,Yeah I see that now... I tried to make it obvious but I think I failed,Yeah I see that now... I tried to make it obvious but I think I failed,0,2021-08-10 09:45:22,<praw.models.comment_forest.CommentForest object at 0x000002541F69E790>,p1kb9e,GetMotivated,t5_2rmfx,,False,True,t3_p1kb9e,t1_h8e2irv,/r/GetMotivated/comments/p1kb9e/image_had_the_idea_for_this_poster_on_a_walk_back/h8e4xnp/
347,h8e51cm,OhHiFelicia,"You did a good thing OP, don't be disheartened, a little rejig and it will be great.","You did a good thing OP, don't be disheartened, a little rejig and it will be great.",8,2021-08-10 09:46:53,<praw.models.comment_forest.CommentForest object at 0x000002541F69E880>,p1kb9e,GetMotivated,t5_2rmfx,,False,False,t3_p1kb9e,t1_h8e4xnp,/r/GetMotivated/comments/p1kb9e/image_had_the_idea_for_this_poster_on_a_walk_back/h8e51cm/
348,h8e5a1r,justingolden21,"Thanks : )

I might try my hand at that tomorrow.","Thanks : )

I might try my hand at that tomorrow.",3,2021-08-10 09:50:26,<praw.models.comment_forest.CommentForest object at 0x000002541F69E5B0>,p1kb9e,GetMotivated,t5_2rmfx,,False,True,t3_p1kb9e,t1_h8e51cm,/r/GetMotivated/comments/p1kb9e/image_had_the_idea_for_this_poster_on_a_walk_back/h8e5a1r/
349,h8e5bjl,OhHiFelicia,I look forward to seeing it.,I look forward to seeing it.,1,2021-08-10 09:51:02,<praw.models.comment_forest.CommentForest object at 0x000002541F69E580>,p1kb9e,GetMotivated,t5_2rmfx,,False,False,t3_p1kb9e,t1_h8e5a1r,/r/GetMotivated/comments/p1kb9e/image_had_the_idea_for_this_poster_on_a_walk_back/h8e5bjl/
350,igm92z5,Performer-Careful,r/terriblefacebookmemes,r/terriblefacebookmemes,13,2022-07-18 07:58:44,<praw.models.comment_forest.CommentForest object at 0x000002541F692100>,w1tfrv,GetMotivated,t5_2rmfx,,False,False,t3_w1tfrv,t3_w1tfrv,/r/GetMotivated/comments/w1tfrv/image/igm92z5/
351,igmfnrx,Vegemyeet,"That’s a hard “yeah, nah” from me dog.","That’s a hard “yeah, nah” from me dog.",13,2022-07-18 09:31:40,<praw.models.comment_forest.CommentForest object at 0x000002541F692160>,w1tfrv,GetMotivated,t5_2rmfx,,False,False,t3_w1tfrv,t3_w1tfrv,/r/GetMotivated/comments/w1tfrv/image/igmfnrx/
352,igmjg9y,Good_Beautiful1724,"I get what you're trying to say, but anything that life that is framed as grinding (= ""oppressive and seemingly without end"") is not healthy to body and soul.","I get what you're trying to say, but anything that life that is framed as grinding (= ""oppressive and seemingly without end"") is not healthy to body and soul.",9,2022-07-18 10:23:06,<praw.models.comment_forest.CommentForest object at 0x000002541F6921C0>,w1tfrv,GetMotivated,t5_2rmfx,,False,False,t3_w1tfrv,t3_w1tfrv,/r/GetMotivated/comments/w1tfrv/image/igmjg9y/
353,igmt1az,Just_Ban_Me_Already,No. Get out.,No. Get out.,5,2022-07-18 12:11:55,<praw.models.comment_forest.CommentForest object at 0x000002541F692220>,w1tfrv,GetMotivated,t5_2rmfx,,False,False,t3_w1tfrv,t3_w1tfrv,/r/GetMotivated/comments/w1tfrv/image/igmt1az/
354,igqsmdc,Green_Prompt_6386,Fuck grind culture.,Fuck grind culture.,3,2022-07-19 05:50:27,<praw.models.comment_forest.CommentForest object at 0x000002541F692280>,w1tfrv,GetMotivated,t5_2rmfx,,False,False,t3_w1tfrv,t3_w1tfrv,/r/GetMotivated/comments/w1tfrv/image/igqsmdc/
355,ignr1i4,AtroKahn,Yep,Yep,0,2022-07-18 16:24:42,<praw.models.comment_forest.CommentForest object at 0x000002541F6922E0>,w1tfrv,GetMotivated,t5_2rmfx,,False,False,t3_w1tfrv,t3_w1tfrv,/r/GetMotivated/comments/w1tfrv/image/ignr1i4/
356,gs9ul5p,AutoModerator,"Hi there! GetMotivated has a new, friendly, discord server and would love for you to join and check it out https://discord.gg/tfwPhhfrCY.  Please excuse this stickied comment, we just want to get the word out.  We will turn it off after a short while, enjoy your day!

*I am a bot, and this action was performed automatically. Please [contact the moderators of this subreddit](/message/compose/?to=/r/GetMotivated) if you have any questions or concerns.*","Hi there! GetMotivated has a new, friendly, discord server and would love for you to join and check it out https://discord.gg/tfwPhhfrCY.  Please excuse this stickied comment, we just want to get the word out.  We will turn it off after a short while, enjoy your day!

*I am a bot, and this action was performed automatically. Please [contact the moderators of this subreddit](/message/compose/?to=/r/GetMotivated) if you have any questions or concerns.*",1,2021-03-26 09:27:37,<praw.models.comment_forest.CommentForest object at 0x000002541F6821C0>,mdktgp,GetMotivated,t5_2rmfx,moderator,False,False,t3_mdktgp,t3_mdktgp,/r/GetMotivated/comments/mdktgp/image_be_so_busy_that_you_have_no_time_to_be_sad/gs9ul5p/
357,gs9vtqr,ThaDirtMerchant,"Ohh look, it's the recipe for complete mental breakdown","Ohh look, it's the recipe for complete mental breakdown",29,2021-03-26 09:47:47,<praw.models.comment_forest.CommentForest object at 0x000002541F682220>,mdktgp,GetMotivated,t5_2rmfx,,False,False,t3_mdktgp,t3_mdktgp,/r/GetMotivated/comments/mdktgp/image_be_so_busy_that_you_have_no_time_to_be_sad/gs9vtqr/
358,gs9unzk,Custardpaws,Not great advice lol.  It's never a good thing to over work yourself so you won't feel sad.,Not great advice lol.  It's never a good thing to over work yourself so you won't feel sad.,14,2021-03-26 09:28:57,<praw.models.comment_forest.CommentForest object at 0x000002541F682280>,mdktgp,GetMotivated,t5_2rmfx,,False,False,t3_mdktgp,t3_mdktgp,/r/GetMotivated/comments/mdktgp/image_be_so_busy_that_you_have_no_time_to_be_sad/gs9unzk/
359,gs9vfdl,itsgottabegab,"Yeah dealing with your problems isn't a good idea, bury them under being busy then crumple into a mess later on.","Yeah dealing with your problems isn't a good idea, bury them under being busy then crumple into a mess later on.",8,2021-03-26 09:41:25,<praw.models.comment_forest.CommentForest object at 0x000002541F682340>,mdktgp,GetMotivated,t5_2rmfx,,False,False,t3_mdktgp,t3_mdktgp,/r/GetMotivated/comments/mdktgp/image_be_so_busy_that_you_have_no_time_to_be_sad/gs9vfdl/
360,gs9vl9b,zznf,Sounds like terrible advice tbh,Sounds like terrible advice tbh,6,2021-03-26 09:44:03,<praw.models.comment_forest.CommentForest object at 0x000002541F682400>,mdktgp,GetMotivated,t5_2rmfx,,False,False,t3_mdktgp,t3_mdktgp,/r/GetMotivated/comments/mdktgp/image_be_so_busy_that_you_have_no_time_to_be_sad/gs9vl9b/
361,gs9ush2,minuss1309,Or happy...?,Or happy...?,2,2021-03-26 09:31:03,<praw.models.comment_forest.CommentForest object at 0x000002541F682460>,mdktgp,GetMotivated,t5_2rmfx,,False,False,t3_mdktgp,t3_mdktgp,/r/GetMotivated/comments/mdktgp/image_be_so_busy_that_you_have_no_time_to_be_sad/gs9ush2/
362,gs9uwrp,NOraJollian001,"I want to keep myself busy .. but in what... ? There is no work I think.. actually there is work but I am tired, I don't want to do anything I think... I just wanted to be free ....","I want to keep myself busy .. but in what... ? There is no work I think.. actually there is work but I am tired, I don't want to do anything I think... I just wanted to be free ....",2,2021-03-26 09:32:59,<praw.models.comment_forest.CommentForest object at 0x000002541F6824C0>,mdktgp,GetMotivated,t5_2rmfx,,False,False,t3_mdktgp,t3_mdktgp,/r/GetMotivated/comments/mdktgp/image_be_so_busy_that_you_have_no_time_to_be_sad/gs9uwrp/
363,gs9w1al,iOSIRIX-REx,I live in italy and everything is pretty much closed so I’m stuck home with nothing to do other than staring at my pc screen or reading a book.,I live in italy and everything is pretty much closed so I’m stuck home with nothing to do other than staring at my pc screen or reading a book.,2,2021-03-26 09:51:08,<praw.models.comment_forest.CommentForest object at 0x000002541F682520>,mdktgp,GetMotivated,t5_2rmfx,,False,False,t3_mdktgp,t3_mdktgp,/r/GetMotivated/comments/mdktgp/image_be_so_busy_that_you_have_no_time_to_be_sad/gs9w1al/
364,gs9x1ip,pr13st1,"Sounds good, doesn't work.","Sounds good, doesn't work.",2,2021-03-26 10:07:02,<praw.models.comment_forest.CommentForest object at 0x000002541F682580>,mdktgp,GetMotivated,t5_2rmfx,,False,False,t3_mdktgp,t3_mdktgp,/r/GetMotivated/comments/mdktgp/image_be_so_busy_that_you_have_no_time_to_be_sad/gs9x1ip/
365,gs9wvbo,unsanctionedhero,"That's workaholism, you literally just defined being a workaholic.","That's workaholism, you literally just defined being a workaholic.",2,2021-03-26 10:04:20,<praw.models.comment_forest.CommentForest object at 0x000002541F6825E0>,mdktgp,GetMotivated,t5_2rmfx,,False,False,t3_mdktgp,t3_mdktgp,/r/GetMotivated/comments/mdktgp/image_be_so_busy_that_you_have_no_time_to_be_sad/gs9wvbo/
366,gs9wvf5,very_nice_how_much,The greatest lie we’ve been told is that we’re supposed to be happy all the time and that something is wrong if we’re not.,The greatest lie we’ve been told is that we’re supposed to be happy all the time and that something is wrong if we’re not.,2,2021-03-26 10:04:23,<praw.models.comment_forest.CommentForest object at 0x000002541F682640>,mdktgp,GetMotivated,t5_2rmfx,,False,False,t3_mdktgp,t3_mdktgp,/r/GetMotivated/comments/mdktgp/image_be_so_busy_that_you_have_no_time_to_be_sad/gs9wvf5/
367,gs9vyep,airksh,Anyone who can give an insight on how to be so busy?,Anyone who can give an insight on how to be so busy?,1,2021-03-26 09:49:52,<praw.models.comment_forest.CommentForest object at 0x000002541F6826A0>,mdktgp,GetMotivated,t5_2rmfx,,False,False,t3_mdktgp,t3_mdktgp,/r/GetMotivated/comments/mdktgp/image_be_so_busy_that_you_have_no_time_to_be_sad/gs9vyep/
368,gs9yy8i,,Isn’t this the North American ethos?,Isn’t this the North American ethos?,7,2021-03-26 10:36:18,<praw.models.comment_forest.CommentForest object at 0x000002541F6822E0>,mdktgp,GetMotivated,t5_2rmfx,,False,False,t3_mdktgp,t1_gs9vtqr,/r/GetMotivated/comments/mdktgp/image_be_so_busy_that_you_have_no_time_to_be_sad/gs9yy8i/
369,gsa1wod,ChefMoToronto,"I have done this a lot. Now I'm just a workaholic with no friends, my family never sees me and I'm still poor.","I have done this a lot. Now I'm just a workaholic with no friends, my family never sees me and I'm still poor.",1,2021-03-26 11:16:51,<praw.models.comment_forest.CommentForest object at 0x000002541F6823A0>,mdktgp,GetMotivated,t5_2rmfx,,False,False,t3_mdktgp,t1_gs9unzk,/r/GetMotivated/comments/mdktgp/image_be_so_busy_that_you_have_no_time_to_be_sad/gsa1wod/
370,ff2d6wy,emejim,"Working smart = having $100,000 to buy an excavator.","Working smart = having $100,000 to buy an excavator.",57,2020-01-20 06:23:22,<praw.models.comment_forest.CommentForest object at 0x000002541F696340>,er8w0d,GetMotivated,t5_2rmfx,,False,False,t3_er8w0d,t3_er8w0d,/r/GetMotivated/comments/er8w0d/image_working_hard_will_only_lead_you_to_success/ff2d6wy/
371,ff2bs9z,Leomon_died,These posts are so fucking cringe,These posts are so fucking cringe,42,2020-01-20 05:59:25,<praw.models.comment_forest.CommentForest object at 0x000002541F6963A0>,er8w0d,GetMotivated,t5_2rmfx,,False,False,t3_er8w0d,t3_er8w0d,/r/GetMotivated/comments/er8w0d/image_working_hard_will_only_lead_you_to_success/ff2bs9z/
372,ff2b64v,chains059,"Digging 2 tunnels underneath something that heavy is a good way to get smashed... also if the gold is in a pit that is accessible from the top why would u dig?

Is this where undermining comes from!?","Digging 2 tunnels underneath something that heavy is a good way to get smashed... also if the gold is in a pit that is accessible from the top why would u dig?

Is this where undermining comes from!?",16,2020-01-20 05:49:12,<praw.models.comment_forest.CommentForest object at 0x000002541F6964C0>,er8w0d,GetMotivated,t5_2rmfx,,False,False,t3_er8w0d,t3_er8w0d,/r/GetMotivated/comments/er8w0d/image_working_hard_will_only_lead_you_to_success/ff2b64v/
373,ff2b4wz,Cardonutss,those are some very well dug tunnels to be able to support that caterpillar with that amount. everybody likes a good tunnel digger.,those are some very well dug tunnels to be able to support that caterpillar with that amount. everybody likes a good tunnel digger.,6,2020-01-20 05:48:39,<praw.models.comment_forest.CommentForest object at 0x000002541F696580>,er8w0d,GetMotivated,t5_2rmfx,,False,False,t3_er8w0d,t3_er8w0d,/r/GetMotivated/comments/er8w0d/image_working_hard_will_only_lead_you_to_success/ff2b4wz/
374,ff2h59w,Simpledoo,"What the picture fails to say is that the person who is using the excavator has the financial means (and other conveniences) that allow her to get the gold faster. It doesn't necessarily mean that she has the same discipline as the other too..but she did work smarter in the sense that she knew how to use what she has to her advantage. On the other hand, maybe she took a loan in order to buy the excavator to ""speed up the process"", and will have to pay the debt for many many years if she doesnt locate and get the gold as fast as the other two. Its a gamble. 

The two people digging at the bottom has the same circumstances. Both of them are doing their best based on the means they have. Maybe they could have tried to use another tool that didnt require so much manual labor and is within their budget. In this way, they weren't working smart or efficiently.

The difference between the both of them could be time. Maybe they worked at a different pace. The girl didnt take any breaks, reached there sooner but got burnt out and gave up.  

The guy is still going at it but he might not find any gold because excavator girl will probably get there first.

Not every situation is the same. Just do both i guess (work hard & work smart).","What the picture fails to say is that the person who is using the excavator has the financial means (and other conveniences) that allow her to get the gold faster. It doesn't necessarily mean that she has the same discipline as the other too..but she did work smarter in the sense that she knew how to use what she has to her advantage. On the other hand, maybe she took a loan in order to buy the excavator to ""speed up the process"", and will have to pay the debt for many many years if she doesnt locate and get the gold as fast as the other two. Its a gamble. 

The two people digging at the bottom has the same circumstances. Both of them are doing their best based on the means they have. Maybe they could have tried to use another tool that didnt require so much manual labor and is within their budget. In this way, they weren't working smart or efficiently.

The difference between the both of them could be time. Maybe they worked at a different pace. The girl didnt take any breaks, reached there sooner but got burnt out and gave up.  

The guy is still going at it but he might not find any gold because excavator girl will probably get there first.

Not every situation is the same. Just do both i guess (work hard & work smart).",5,2020-01-20 07:38:37,<praw.models.comment_forest.CommentForest object at 0x000002541F6965E0>,er8w0d,GetMotivated,t5_2rmfx,,False,False,t3_er8w0d,t3_er8w0d,/r/GetMotivated/comments/er8w0d/image_working_hard_will_only_lead_you_to_success/ff2h59w/
375,ff33asc,Bonezone420,"While everyone is focused on the monetary facet represented by the industrial machine - there is yet another aspect to this image that bothers me, and that's the implicit class bias.

It's a lot easier to dig down, than it is to dig an entire tunnel; in this case the rich and privileged not only have an easier, luxurious time actually getting the gold - but their trip to it is shorter, easier and borderline automated. And then they have the gall to market it as ""working smart"" and act like the poorest members of society are just a bunch of quitters for getting the fuck out of there before two tunnels collapse on top of them and what little gold they had managed to gather is torn from their bloody, crushed hands by the steel claw of the upper crust.","While everyone is focused on the monetary facet represented by the industrial machine - there is yet another aspect to this image that bothers me, and that's the implicit class bias.

It's a lot easier to dig down, than it is to dig an entire tunnel; in this case the rich and privileged not only have an easier, luxurious time actually getting the gold - but their trip to it is shorter, easier and borderline automated. And then they have the gall to market it as ""working smart"" and act like the poorest members of society are just a bunch of quitters for getting the fuck out of there before two tunnels collapse on top of them and what little gold they had managed to gather is torn from their bloody, crushed hands by the steel claw of the upper crust.",4,2020-01-20 15:02:57,<praw.models.comment_forest.CommentForest object at 0x000002541F696640>,er8w0d,GetMotivated,t5_2rmfx,,False,False,t3_er8w0d,t3_er8w0d,/r/GetMotivated/comments/er8w0d/image_working_hard_will_only_lead_you_to_success/ff33asc/
376,ff9o2cy,Vegas_paid_off,Appears to be working smart when in truth is about collapse into a poorly supported position. Ego will do it every time.,Appears to be working smart when in truth is about collapse into a poorly supported position. Ego will do it every time.,2,2020-01-22 18:17:08,<praw.models.comment_forest.CommentForest object at 0x000002541F6966A0>,er8w0d,GetMotivated,t5_2rmfx,,False,False,t3_er8w0d,t3_er8w0d,/r/GetMotivated/comments/er8w0d/image_working_hard_will_only_lead_you_to_success/ff9o2cy/
377,ff2hrpx,,*working rich,*working rich,1,2020-01-20 07:51:32,<praw.models.comment_forest.CommentForest object at 0x000002541F696700>,er8w0d,GetMotivated,t5_2rmfx,,False,False,t3_er8w0d,t3_er8w0d,/r/GetMotivated/comments/er8w0d/image_working_hard_will_only_lead_you_to_success/ff2hrpx/
378,ff90z8z,Azstex,"i agree with everyone else, this is stupid

working smart also requires alot of knowledge that simply alot of individual do not posses, or dont have the money for.

Working smart also most cases requires money investment what also alot of individual posses...","i agree with everyone else, this is stupid

working smart also requires alot of knowledge that simply alot of individual do not posses, or dont have the money for.

Working smart also most cases requires money investment what also alot of individual posses...",1,2020-01-22 14:08:17,<praw.models.comment_forest.CommentForest object at 0x000002541F696760>,er8w0d,GetMotivated,t5_2rmfx,,False,False,t3_er8w0d,t3_er8w0d,/r/GetMotivated/comments/er8w0d/image_working_hard_will_only_lead_you_to_success/ff90z8z/
379,ff2hr3y,,The true lesson is that the rich have advantages that we'll never have,The true lesson is that the rich have advantages that we'll never have,34,2020-01-20 07:51:13,<praw.models.comment_forest.CommentForest object at 0x000002541F696400>,er8w0d,GetMotivated,t5_2rmfx,,False,False,t3_er8w0d,t1_ff2d6wy,/r/GetMotivated/comments/er8w0d/image_working_hard_will_only_lead_you_to_success/ff2hr3y/
380,ff2dxju,spideracrossastar,And risking the life of two hard working people by placing the excavator over their tunels,And risking the life of two hard working people by placing the excavator over their tunels,21,2020-01-20 06:36:29,<praw.models.comment_forest.CommentForest object at 0x000002541F696460>,er8w0d,GetMotivated,t5_2rmfx,,False,False,t3_er8w0d,t1_ff2d6wy,/r/GetMotivated/comments/er8w0d/image_working_hard_will_only_lead_you_to_success/ff2dxju/
381,ff2eocd,emejim,"She's headed for corporate. ""Employees, an expendable commodity.""","She's headed for corporate. ""Employees, an expendable commodity.""",14,2020-01-20 06:50:14,<praw.models.comment_forest.CommentForest object at 0x000002541F696520>,er8w0d,GetMotivated,t5_2rmfx,,False,False,t3_er8w0d,t1_ff2dxju,/r/GetMotivated/comments/er8w0d/image_working_hard_will_only_lead_you_to_success/ff2eocd/
382,fhsvyib,Shouia,Or... you could manage your time behind the screen and stick to watching meaningful things. Like a good documentary. Or some caberet to improve your own wit. Or an excersize/braintraining program. Or some real life story to learn how some person dealt with a problem in their life. The possibilities are endless!,Or... you could manage your time behind the screen and stick to watching meaningful things. Like a good documentary. Or some caberet to improve your own wit. Or an excersize/braintraining program. Or some real life story to learn how some person dealt with a problem in their life. The possibilities are endless!,10,2020-02-16 15:16:32,<praw.models.comment_forest.CommentForest object at 0x000002541F67C3A0>,f4pb30,GetMotivated,t5_2rmfx,,False,False,t3_f4pb30,t3_f4pb30,/r/GetMotivated/comments/f4pb30/image_free_your_mind_kill_your_tv/fhsvyib/
383,fhs3hqo,ZhumaDiyar,But I have Netflix on my TV,But I have Netflix on my TV,9,2020-02-16 11:19:45,<praw.models.comment_forest.CommentForest object at 0x000002541F67C490>,f4pb30,GetMotivated,t5_2rmfx,,False,False,t3_f4pb30,t3_f4pb30,/r/GetMotivated/comments/f4pb30/image_free_your_mind_kill_your_tv/fhs3hqo/
