,ID,Author,body,Comment,Score,Created On,Replies,Submission,Subreddit,Subreddit_ID,Distinguished,Edited,Is_submitter,link_id,Parent_id,Permalink
0,h93hasy,AutoModerator,"Hi there! GetMotivated has a new, friendly, discord server and would love for you to join and check it out https://discord.gg/tfwPhhfrCY.  Please excuse this stickied comment, we just want to get the word out.  We will turn it off after a short while, enjoy your day!

*I am a bot, and this action was performed automatically. Please [contact the moderators of this subreddit](/message/compose/?to=/r/GetMotivated) if you have any questions or concerns.*","Hi there! GetMotivated has a new, friendly, discord server and would love for you to join and check it out https://discord.gg/tfwPhhfrCY.  Please excuse this stickied comment, we just want to get the word out.  We will turn it off after a short while, enjoy your day!

*I am a bot, and this action was performed automatically. Please [contact the moderators of this subreddit](/message/compose/?to=/r/GetMotivated) if you have any questions or concerns.*",1,2021-08-16 00:18:54,<praw.models.comment_forest.CommentForest object at 0x000002547B347BE0>,p553rq,GetMotivated,t5_2rmfx,moderator,False,False,t3_p553rq,t3_p553rq,/r/GetMotivated/comments/p553rq/finally_someone_said_it_image/h93hasy/
1,h93n39s,ominouspollywog,It made me curious so i did some homework. In the US ~44% of entrepreneurs have a college degree. Compare that to ~42% of the US general population has a higher education degree. This would suggest to me that schooling:entrepreneurship have little to no bearing on each other as they are pretty reflective of the general pop,It made me curious so i did some homework. In the US ~44% of entrepreneurs have a college degree. Compare that to ~42% of the US general population has a higher education degree. This would suggest to me that schooling:entrepreneurship have little to no bearing on each other as they are pretty reflective of the general pop,272,2021-08-16 01:06:28,<praw.models.comment_forest.CommentForest object at 0x000002547B347C40>,p553rq,GetMotivated,t5_2rmfx,,False,False,t3_p553rq,t3_p553rq,/r/GetMotivated/comments/p553rq/finally_someone_said_it_image/h93n39s/
2,h946nui,,Says the guy who inherited his dad’s 7 figure business lmaoooo,Says the guy who inherited his dad’s 7 figure business lmaoooo,93,2021-08-16 03:53:31,<praw.models.comment_forest.CommentForest object at 0x000002547B347CA0>,p553rq,GetMotivated,t5_2rmfx,,False,False,t3_p553rq,t3_p553rq,/r/GetMotivated/comments/p553rq/finally_someone_said_it_image/h946nui/
3,h93o5ex,bxncwzz,"I’m watching Shark Tank and every entrepreneur that has pitched so far said they graduated from a school, lol. You can learn to run a business and be an entrepreneur in school. This guy speaks to wannabe entrepreneurs who can’t hold a job, so they pick up a “how to get rich” book or watch one of his videos and get that dangerous “fuck the man and work for yourself” mentality. 

In actuality most successful entrepreneurs are people who excelled and learned the innings at a “regular job” and translated that to a successful business. Every CEO will tell you they worked at x Fortune 500 company for x years first.","I’m watching Shark Tank and every entrepreneur that has pitched so far said they graduated from a school, lol. You can learn to run a business and be an entrepreneur in school. This guy speaks to wannabe entrepreneurs who can’t hold a job, so they pick up a “how to get rich” book or watch one of his videos and get that dangerous “fuck the man and work for yourself” mentality. 

In actuality most successful entrepreneurs are people who excelled and learned the innings at a “regular job” and translated that to a successful business. Every CEO will tell you they worked at x Fortune 500 company for x years first.",141,2021-08-16 01:15:19,<praw.models.comment_forest.CommentForest object at 0x000002547B347E20>,p553rq,GetMotivated,t5_2rmfx,,False,False,t3_p553rq,t3_p553rq,/r/GetMotivated/comments/p553rq/finally_someone_said_it_image/h93o5ex/
4,h93tgyk,TheKnightIsForPlebs,This some sigma male grindset bullshit,This some sigma male grindset bullshit,103,2021-08-16 01:59:20,<praw.models.comment_forest.CommentForest object at 0x000002547B35B220>,p553rq,GetMotivated,t5_2rmfx,,False,False,t3_p553rq,t3_p553rq,/r/GetMotivated/comments/p553rq/finally_someone_said_it_image/h93tgyk/
5,h93hsad,BitOBear,But that doesn't mean that you're a natural entrepreneur just 'cuz you failed school.,But that doesn't mean that you're a natural entrepreneur just 'cuz you failed school.,133,2021-08-16 00:22:48,<praw.models.comment_forest.CommentForest object at 0x000002547B35B400>,p553rq,GetMotivated,t5_2rmfx,,False,False,t3_p553rq,t3_p553rq,/r/GetMotivated/comments/p553rq/finally_someone_said_it_image/h93hsad/
6,h94gion,StatueTear,"Because obviously workers are less worthy than ""entrepreneurs""","Because obviously workers are less worthy than ""entrepreneurs""",26,2021-08-16 05:36:44,<praw.models.comment_forest.CommentForest object at 0x000002547B35B460>,p553rq,GetMotivated,t5_2rmfx,,False,False,t3_p553rq,t3_p553rq,/r/GetMotivated/comments/p553rq/finally_someone_said_it_image/h94gion/
7,h93lof8,Damn_I_Love_Milfs,This guy's a fucking loudmouthed clown,This guy's a fucking loudmouthed clown,111,2021-08-16 00:54:43,<praw.models.comment_forest.CommentForest object at 0x000002547B35B5E0>,p553rq,GetMotivated,t5_2rmfx,,False,False,t3_p553rq,t3_p553rq,/r/GetMotivated/comments/p553rq/finally_someone_said_it_image/h93lof8/
8,h93r3e7,DrAlanGrantinathong,"I didn't fail school, school failed me.

&#x200B;

&#x200B;

Found the lazy sack of shit that always missed class and never studied.","I didn't fail school, school failed me.

&#x200B;

&#x200B;

Found the lazy sack of shit that always missed class and never studied.",83,2021-08-16 01:39:41,<praw.models.comment_forest.CommentForest object at 0x000002547B35B700>,p553rq,GetMotivated,t5_2rmfx,,False,False,t3_p553rq,t3_p553rq,/r/GetMotivated/comments/p553rq/finally_someone_said_it_image/h93r3e7/
9,h93x7a0,DogInTheDark,So…entrepreneurs don’t work?,So…entrepreneurs don’t work?,32,2021-08-16 02:30:23,<praw.models.comment_forest.CommentForest object at 0x000002547B35B880>,p553rq,GetMotivated,t5_2rmfx,,False,False,t3_p553rq,t3_p553rq,/r/GetMotivated/comments/p553rq/finally_someone_said_it_image/h93x7a0/
10,h94dfs7,arnodorian96,That type of thinking is why people are now anti vaccines and Q anons.,That type of thinking is why people are now anti vaccines and Q anons.,14,2021-08-16 05:01:53,<praw.models.comment_forest.CommentForest object at 0x000002547B35BA00>,p553rq,GetMotivated,t5_2rmfx,,False,False,t3_p553rq,t3_p553rq,/r/GetMotivated/comments/p553rq/finally_someone_said_it_image/h94dfs7/
11,h94mn39,lawbag1,"The guy in the photo (whether he said it or not) is Gary V, a known conman who makes money selling courses to help people start their own business. 

His business model is based on selling dreams to others.","The guy in the photo (whether he said it or not) is Gary V, a known conman who makes money selling courses to help people start their own business. 

His business model is based on selling dreams to others.",12,2021-08-16 06:51:39,<praw.models.comment_forest.CommentForest object at 0x000002547B35BAC0>,p553rq,GetMotivated,t5_2rmfx,,False,False,t3_p553rq,t3_p553rq,/r/GetMotivated/comments/p553rq/finally_someone_said_it_image/h94mn39/
12,h93tcf7,bkornblith,This is some dumb shit in large capital letters said by a loud white man who is not worth listening to,This is some dumb shit in large capital letters said by a loud white man who is not worth listening to,23,2021-08-16 01:58:19,<praw.models.comment_forest.CommentForest object at 0x000002547B35BB20>,p553rq,GetMotivated,t5_2rmfx,,False,False,t3_p553rq,t3_p553rq,/r/GetMotivated/comments/p553rq/finally_someone_said_it_image/h93tcf7/
13,h9440jx,Zlifbar,"Entrepreneurs who need to downtalk anything...school, other businesses, etc. are just showing their insecurity and really would be better off remaining silent.","Entrepreneurs who need to downtalk anything...school, other businesses, etc. are just showing their insecurity and really would be better off remaining silent.",12,2021-08-16 03:29:08,<praw.models.comment_forest.CommentForest object at 0x000002547B35BBE0>,p553rq,GetMotivated,t5_2rmfx,,False,False,t3_p553rq,t3_p553rq,/r/GetMotivated/comments/p553rq/finally_someone_said_it_image/h9440jx/
14,h946e9m,,Yes because 2+2=5 if you’re an entrepreneur.,Yes because 2+2=5 if you’re an entrepreneur.,5,2021-08-16 03:50:58,<praw.models.comment_forest.CommentForest object at 0x000002547B35BC40>,p553rq,GetMotivated,t5_2rmfx,,False,False,t3_p553rq,t3_p553rq,/r/GetMotivated/comments/p553rq/finally_someone_said_it_image/h946e9m/
15,h94elzd,,Lol who the fuck signs a quote,Lol who the fuck signs a quote,4,2021-08-16 05:14:54,<praw.models.comment_forest.CommentForest object at 0x000002547B35BCA0>,p553rq,GetMotivated,t5_2rmfx,,False,False,t3_p553rq,t3_p553rq,/r/GetMotivated/comments/p553rq/finally_someone_said_it_image/h94elzd/
16,h94he9e,Background-Ad-4440,What a load of snowflakey bullshit...,What a load of snowflakey bullshit...,4,2021-08-16 05:47:13,<praw.models.comment_forest.CommentForest object at 0x000002547B35BD00>,p553rq,GetMotivated,t5_2rmfx,,False,False,t3_p553rq,t3_p553rq,/r/GetMotivated/comments/p553rq/finally_someone_said_it_image/h94he9e/
17,h94hlz9,klippinit,If your mind is not open to learning from whatever the source you are missing potential useful information,If your mind is not open to learning from whatever the source you are missing potential useful information,5,2021-08-16 05:49:47,<praw.models.comment_forest.CommentForest object at 0x000002547B35BD60>,p553rq,GetMotivated,t5_2rmfx,,False,False,t3_p553rq,t3_p553rq,/r/GetMotivated/comments/p553rq/finally_someone_said_it_image/h94hlz9/
18,h93rgtr,koopa72,I failed too bro but I ain't making excuses about it,I failed too bro but I ain't making excuses about it,14,2021-08-16 01:42:45,<praw.models.comment_forest.CommentForest object at 0x000002547B35BDC0>,p553rq,GetMotivated,t5_2rmfx,,False,False,t3_p553rq,t3_p553rq,/r/GetMotivated/comments/p553rq/finally_someone_said_it_image/h93rgtr/
19,h9407oz,IngenuityFine3627,So - entrepreneurs aren’t workers?  That explains a lot.,So - entrepreneurs aren’t workers?  That explains a lot.,5,2021-08-16 02:55:43,<praw.models.comment_forest.CommentForest object at 0x000002547B35BE20>,p553rq,GetMotivated,t5_2rmfx,,False,False,t3_p553rq,t3_p553rq,/r/GetMotivated/comments/p553rq/finally_someone_said_it_image/h9407oz/
20,h943dlj,Urasquirrel,Lol nah. I'm one and I taught myself everything I know. Schools introduced it to me.... they did that well. I passed.,Lol nah. I'm one and I taught myself everything I know. Schools introduced it to me.... they did that well. I passed.,5,2021-08-16 03:23:25,<praw.models.comment_forest.CommentForest object at 0x000002547B35BE80>,p553rq,GetMotivated,t5_2rmfx,,False,False,t3_p553rq,t3_p553rq,/r/GetMotivated/comments/p553rq/finally_someone_said_it_image/h943dlj/
21,h93p89n,Unfiltered_Soul,Who is this guy?,Who is this guy?,11,2021-08-16 01:24:15,<praw.models.comment_forest.CommentForest object at 0x000002547B35BEE0>,p553rq,GetMotivated,t5_2rmfx,,False,False,t3_p553rq,t3_p553rq,/r/GetMotivated/comments/p553rq/finally_someone_said_it_image/h93p89n/
22,h94i3a3,motomarket,My experience has been that school was actually super important to learn the rules/data everyone else uses. The next (and harder) step was then learning how to ignore/break those rules effectively,My experience has been that school was actually super important to learn the rules/data everyone else uses. The next (and harder) step was then learning how to ignore/break those rules effectively,7,2021-08-16 05:55:35,<praw.models.comment_forest.CommentForest object at 0x000002547B35BF40>,p553rq,GetMotivated,t5_2rmfx,,False,False,t3_p553rq,t3_p553rq,/r/GetMotivated/comments/p553rq/finally_someone_said_it_image/h94i3a3/
23,h94zk7z,vonkendu,"Lol someone got kicked out of community college and is now mad


School didn't fail you, you are just dumb","Lol someone got kicked out of community college and is now mad


School didn't fail you, you are just dumb",3,2021-08-16 09:50:46,<praw.models.comment_forest.CommentForest object at 0x000002547B35BFA0>,p553rq,GetMotivated,t5_2rmfx,,False,False,t3_p553rq,t3_p553rq,/r/GetMotivated/comments/p553rq/finally_someone_said_it_image/h94zk7z/
24,h94zzkh,MommalovesJay,"Sounds like my ex. Doesn’t believe in basic education. But lots to spout random things to our daughter. Tells her he’s going to be a millionaire, buy a big house and toy store for her. After seven years, I think she understands that he’s all talk.","Sounds like my ex. Doesn’t believe in basic education. But lots to spout random things to our daughter. Tells her he’s going to be a millionaire, buy a big house and toy store for her. After seven years, I think she understands that he’s all talk.",3,2021-08-16 09:56:36,<praw.models.comment_forest.CommentForest object at 0x000002547B358040>,p553rq,GetMotivated,t5_2rmfx,,False,False,t3_p553rq,t3_p553rq,/r/GetMotivated/comments/p553rq/finally_someone_said_it_image/h94zzkh/
25,h954g1c,FriendlyFellowDboy,"""And I built this program for 9 easy payments of 999.99 to teach you how to stop being a worker.""","""And I built this program for 9 easy payments of 999.99 to teach you how to stop being a worker.""",3,2021-08-16 10:54:27,<praw.models.comment_forest.CommentForest object at 0x000002547B3580A0>,p553rq,GetMotivated,t5_2rmfx,,False,False,t3_p553rq,t3_p553rq,/r/GetMotivated/comments/p553rq/finally_someone_said_it_image/h954g1c/
26,h955jog,emrish,"Don’t mean to be a bummer, but this guy is a total hack. Please don’t look to him for advice.","Don’t mean to be a bummer, but this guy is a total hack. Please don’t look to him for advice.",3,2021-08-16 11:07:27,<praw.models.comment_forest.CommentForest object at 0x000002547B358100>,p553rq,GetMotivated,t5_2rmfx,,False,False,t3_p553rq,t3_p553rq,/r/GetMotivated/comments/p553rq/finally_someone_said_it_image/h955jog/
27,h97t1ba,POCKALEELEE,"No, school almost certainly did NOT fail him.
Fuck this asshole.  Schools, by necessity, are designed to give every student a little bit of knowledge in every area and let them explore until they find what they like. And if you want schools to do better, fund them and make teaching a career worth pursuing that pays wages according to the value imparted. Don't bitch because school didn't hold your hand through everything.","No, school almost certainly did NOT fail him.
Fuck this asshole.  Schools, by necessity, are designed to give every student a little bit of knowledge in every area and let them explore until they find what they like. And if you want schools to do better, fund them and make teaching a career worth pursuing that pays wages according to the value imparted. Don't bitch because school didn't hold your hand through everything.",3,2021-08-16 22:30:27,<praw.models.comment_forest.CommentForest object at 0x000002547B358160>,p553rq,GetMotivated,t5_2rmfx,,False,False,t3_p553rq,t3_p553rq,/r/GetMotivated/comments/p553rq/finally_someone_said_it_image/h97t1ba/
28,h93vb6z,,I hear that there is no work involved in being an entrepreneur /s,I hear that there is no work involved in being an entrepreneur /s,2,2021-08-16 02:14:32,<praw.models.comment_forest.CommentForest object at 0x000002547B3581C0>,p553rq,GetMotivated,t5_2rmfx,,False,False,t3_p553rq,t3_p553rq,/r/GetMotivated/comments/p553rq/finally_someone_said_it_image/h93vb6z/
29,h942h1j,skweenison,Jesus,Jesus,2,2021-08-16 03:15:22,<praw.models.comment_forest.CommentForest object at 0x000002547B358220>,p553rq,GetMotivated,t5_2rmfx,,False,False,t3_p553rq,t3_p553rq,/r/GetMotivated/comments/p553rq/finally_someone_said_it_image/h942h1j/
30,h945k9z,celestial_eyes,"There are alot of things that need to be improved on in education but, I'm not in denial I failed school because I was irresponsible,and a procrastinator.","There are alot of things that need to be improved on in education but, I'm not in denial I failed school because I was irresponsible,and a procrastinator.",2,2021-08-16 03:43:13,<praw.models.comment_forest.CommentForest object at 0x000002547B358280>,p553rq,GetMotivated,t5_2rmfx,,False,False,t3_p553rq,t3_p553rq,/r/GetMotivated/comments/p553rq/finally_someone_said_it_image/h945k9z/
31,h94jn9q,,Getting an education will open so many doors & can help fund your entrepreneurial endeavours. A degree or even a diploma will make you employable and help give you skills need. Nothing wrong with finding success with or without it :) Find success your own way :),Getting an education will open so many doors & can help fund your entrepreneurial endeavours. A degree or even a diploma will make you employable and help give you skills need. Nothing wrong with finding success with or without it :) Find success your own way :),2,2021-08-16 06:14:28,<praw.models.comment_forest.CommentForest object at 0x000002547B358340>,p553rq,GetMotivated,t5_2rmfx,,False,False,t3_p553rq,t3_p553rq,/r/GetMotivated/comments/p553rq/finally_someone_said_it_image/h94jn9q/
32,h94kad9,,Ah yes the text that never was said by the person. Classic.,Ah yes the text that never was said by the person. Classic.,2,2021-08-16 06:22:21,<praw.models.comment_forest.CommentForest object at 0x000002547B358400>,p553rq,GetMotivated,t5_2rmfx,,False,False,t3_p553rq,t3_p553rq,/r/GetMotivated/comments/p553rq/finally_someone_said_it_image/h94kad9/
33,h94ld74,iamDJDan,This guy gives our terrible advice to kids on tik tok. Telling them resumes don’t matter and fuck college. RESUMES DO MATTER KIDS PLASE DONT LISTEN TO GARY HE INHERITED HIS PARENTS HARD WORK HIS ADVICE DOESNT WORK FOR EVERYONE.,This guy gives our terrible advice to kids on tik tok. Telling them resumes don’t matter and fuck college. RESUMES DO MATTER KIDS PLASE DONT LISTEN TO GARY HE INHERITED HIS PARENTS HARD WORK HIS ADVICE DOESNT WORK FOR EVERYONE.,2,2021-08-16 06:35:41,<praw.models.comment_forest.CommentForest object at 0x000002547B358460>,p553rq,GetMotivated,t5_2rmfx,,False,False,t3_p553rq,t3_p553rq,/r/GetMotivated/comments/p553rq/finally_someone_said_it_image/h94ld74/
34,h94rt2c,ccnomad,Maybe swap out ‘entrepreneurs’ for ‘artists/creatives’ and you’d have something a little less incorrect,Maybe swap out ‘entrepreneurs’ for ‘artists/creatives’ and you’d have something a little less incorrect,2,2021-08-16 08:01:12,<praw.models.comment_forest.CommentForest object at 0x000002547B3584C0>,p553rq,GetMotivated,t5_2rmfx,,False,False,t3_p553rq,t3_p553rq,/r/GetMotivated/comments/p553rq/finally_someone_said_it_image/h94rt2c/
35,h94u8dp,Gluebald,"This point of view is inherently wrong. School offers a wide variety of subjects to teach kids the basics of our understanding of the world, our species and the way we communicate with eachother. Your average joe working in an Amazon logistics centre has no need for biology, languages, arts, religion, history, science, etc - yet school offers all those classes. That alone should disprove the argument ""school creates workers"". Capitalism creates a need for workers, school creates oppertunities. What you do with those oppertunities is up to you. That's not accounting for socialeconomic background etc mind you.","This point of view is inherently wrong. School offers a wide variety of subjects to teach kids the basics of our understanding of the world, our species and the way we communicate with eachother. Your average joe working in an Amazon logistics centre has no need for biology, languages, arts, religion, history, science, etc - yet school offers all those classes. That alone should disprove the argument ""school creates workers"". Capitalism creates a need for workers, school creates oppertunities. What you do with those oppertunities is up to you. That's not accounting for socialeconomic background etc mind you.",2,2021-08-16 08:35:24,<praw.models.comment_forest.CommentForest object at 0x000002547B358520>,p553rq,GetMotivated,t5_2rmfx,,False,False,t3_p553rq,t3_p553rq,/r/GetMotivated/comments/p553rq/finally_someone_said_it_image/h94u8dp/
36,h94xpi2,BakedZDBruh,Cringe lmao,Cringe lmao,2,2021-08-16 09:25:02,<praw.models.comment_forest.CommentForest object at 0x000002547B358580>,p553rq,GetMotivated,t5_2rmfx,,False,False,t3_p553rq,t3_p553rq,/r/GetMotivated/comments/p553rq/finally_someone_said_it_image/h94xpi2/
37,h950txm,wizartjay,To the workers : this doesn't mean you are any less amazing!!,To the workers : this doesn't mean you are any less amazing!!,2,2021-08-16 10:08:01,<praw.models.comment_forest.CommentForest object at 0x000002547B3585E0>,p553rq,GetMotivated,t5_2rmfx,,False,False,t3_p553rq,t3_p553rq,/r/GetMotivated/comments/p553rq/finally_someone_said_it_image/h950txm/
38,h9537g3,SpaizKadett,"Yeah, it is never your own fault, it is always somebody else that failed you. SMDH!","Yeah, it is never your own fault, it is always somebody else that failed you. SMDH!",2,2021-08-16 10:39:03,<praw.models.comment_forest.CommentForest object at 0x000002547B358640>,p553rq,GetMotivated,t5_2rmfx,,False,False,t3_p553rq,t3_p553rq,/r/GetMotivated/comments/p553rq/finally_someone_said_it_image/h9537g3/
39,h9543hi,krat0s5,"I didn't fail school, school failed me! Not because I'm an entrepreneur but because Sociopathic ass holes who think strangling a kid is an acceptable way to behave are allowed to be teachers.","I didn't fail school, school failed me! Not because I'm an entrepreneur but because Sociopathic ass holes who think strangling a kid is an acceptable way to behave are allowed to be teachers.",2,2021-08-16 10:50:08,<praw.models.comment_forest.CommentForest object at 0x000002547B3586A0>,p553rq,GetMotivated,t5_2rmfx,,False,False,t3_p553rq,t3_p553rq,/r/GetMotivated/comments/p553rq/finally_someone_said_it_image/h9543hi/
40,h9591gd,Killieboy16,And again the glorification of lack of an education.,And again the glorification of lack of an education.,2,2021-08-16 11:45:36,<praw.models.comment_forest.CommentForest object at 0x000002547B358700>,p553rq,GetMotivated,t5_2rmfx,,False,False,t3_p553rq,t3_p553rq,/r/GetMotivated/comments/p553rq/finally_someone_said_it_image/h9591gd/
41,h95et83,run_ywa,Lol stfu Gary,Lol stfu Gary,2,2021-08-16 12:41:22,<praw.models.comment_forest.CommentForest object at 0x000002547B358760>,p553rq,GetMotivated,t5_2rmfx,,False,False,t3_p553rq,t3_p553rq,/r/GetMotivated/comments/p553rq/finally_someone_said_it_image/h95et83/
42,h94450s,skinsrich,Entrepreneur is just a lazy person with an idea.,Entrepreneur is just a lazy person with an idea.,2,2021-08-16 03:30:16,<praw.models.comment_forest.CommentForest object at 0x000002547B3587C0>,p553rq,GetMotivated,t5_2rmfx,,False,False,t3_p553rq,t3_p553rq,/r/GetMotivated/comments/p553rq/finally_someone_said_it_image/h94450s/
43,h953qfc,TexOrleanian24,…Said every “creative” student that hates working.,…Said every “creative” student that hates working.,1,2021-08-16 10:45:38,<praw.models.comment_forest.CommentForest object at 0x000002547B358820>,p553rq,GetMotivated,t5_2rmfx,,False,False,t3_p553rq,t3_p553rq,/r/GetMotivated/comments/p553rq/finally_someone_said_it_image/h953qfc/
44,h93o1rh,Psycheau,If it’s not training for seat warmers why do kids stay at school for 6 or more hours when they only do 2 hours of actual school work?,If it’s not training for seat warmers why do kids stay at school for 6 or more hours when they only do 2 hours of actual school work?,-16,2021-08-16 01:14:28,<praw.models.comment_forest.CommentForest object at 0x000002547B3588E0>,p553rq,GetMotivated,t5_2rmfx,,False,False,t3_p553rq,t3_p553rq,/r/GetMotivated/comments/p553rq/finally_someone_said_it_image/h93o1rh/
45,h93jmwu,,[removed],[removed],-6,2021-08-16 00:37:52,<praw.models.comment_forest.CommentForest object at 0x000002547B358940>,p553rq,GetMotivated,t5_2rmfx,,False,False,t3_p553rq,t3_p553rq,/r/GetMotivated/comments/p553rq/finally_someone_said_it_image/h93jmwu/
46,h93wmfe,turralye,"Yes!!! Exactly! And at almost 40 years old, I still don't ""fit the mold"" of the perfect ""worker.""","Yes!!! Exactly! And at almost 40 years old, I still don't ""fit the mold"" of the perfect ""worker.""",-9,2021-08-16 02:25:31,<praw.models.comment_forest.CommentForest object at 0x000002547B358A00>,p553rq,GetMotivated,t5_2rmfx,,False,False,t3_p553rq,t3_p553rq,/r/GetMotivated/comments/p553rq/finally_someone_said_it_image/h93wmfe/
47,h93nu9u,Psycheau,"This is so true. Schools are designed to produce obedient workers not entrepreneurs or original thinkers, it’s designed to produce luke warm intellects and obedient drones for the use of the rich capitalist.","This is so true. Schools are designed to produce obedient workers not entrepreneurs or original thinkers, it’s designed to produce luke warm intellects and obedient drones for the use of the rich capitalist.",-23,2021-08-16 01:12:44,<praw.models.comment_forest.CommentForest object at 0x000002547B358BE0>,p553rq,GetMotivated,t5_2rmfx,,False,False,t3_p553rq,t3_p553rq,/r/GetMotivated/comments/p553rq/finally_someone_said_it_image/h93nu9u/
