,ID,Author,body,Comment,Score,Created On,Replies,Submission,Subreddit,Subreddit_ID,Distinguished,Edited,Is_submitter,link_id,Parent_id,Permalink
94,h93r4c5,Psycheau,"So you have no real answer just reasons with no conclusion or justification. I'd rather they stay home and are educated by their mother, father, uncle, brother. For the sake of 2 hours of actual work all the other stuff you mentioned could easily be done at home. If women weren't forced to work and wages weren't so, low they have to work, children would be much better off at home with a parent, than wasting an entire day being taught to be a worker drone and nothing more, often by an adult who is less intelligent than the student. Not to mention the abuse they get at school (and online) from the other wild animals at public schools.","So you have no real answer just reasons with no conclusion or justification. I'd rather they stay home and are educated by their mother, father, uncle, brother. For the sake of 2 hours of actual work all the other stuff you mentioned could easily be done at home. If women weren't forced to work and wages weren't so, low they have to work, children would be much better off at home with a parent, than wasting an entire day being taught to be a worker drone and nothing more, often by an adult who is less intelligent than the student. Not to mention the abuse they get at school (and online) from the other wild animals at public schools.",-18,2021-08-16 01:39:53,<praw.models.comment_forest.CommentForest object at 0x000002547B358A60>,p553rq,GetMotivated,t5_2rmfx,,False,False,t3_p553rq,t1_h93q96p,/r/GetMotivated/comments/p553rq/finally_someone_said_it_image/h93r4c5/
95,h99t7ie,Psycheau,My grandkids primary school has an office for a commerce officer who liaises with the head master and teachers to keep them on track with industry needs.,My grandkids primary school has an office for a commerce officer who liaises with the head master and teachers to keep them on track with industry needs.,2,2021-08-17 10:12:46,<praw.models.comment_forest.CommentForest object at 0x000002547B358D60>,p553rq,GetMotivated,t5_2rmfx,,False,False,t3_p553rq,t1_h93wlks,/r/GetMotivated/comments/p553rq/finally_someone_said_it_image/h99t7ie/
96,h96fvzl,Fatherof10,"Ok you should get some counseling for that. My post history shows how passionate I am about business and helping others. I also had a hand in building some very successful companies over the years.

I had schooling over the years it was called work. I studied ever position at every company I worked for obsessively.

I did borrow the money to file the sole proprietorship and DBA $50+$5 here in Dallas, and the rest was used to open a business checking account at Chase. 

If you want the rest you can go look it up in my history.

I find that people who hold a grudge against ""self made"" people often are hitting a barrier and need a hand. I SOUGHT OUT PLENTY of guidance over the last 20+ years and still spend an hour a day learning. IF you do want and need some help, I am here and will give all of the knowledge, network, and guidance I can to help you make it happen too. Look at my comments, I'm not fooling you. A rising tide raises all ships.

No rocket ship here. We now are building and flipping RV parks, self storage and oil and Gas leases with our capital.","Ok you should get some counseling for that. My post history shows how passionate I am about business and helping others. I also had a hand in building some very successful companies over the years.

I had schooling over the years it was called work. I studied ever position at every company I worked for obsessively.

I did borrow the money to file the sole proprietorship and DBA $50+$5 here in Dallas, and the rest was used to open a business checking account at Chase. 

If you want the rest you can go look it up in my history.

I find that people who hold a grudge against ""self made"" people often are hitting a barrier and need a hand. I SOUGHT OUT PLENTY of guidance over the last 20+ years and still spend an hour a day learning. IF you do want and need some help, I am here and will give all of the knowledge, network, and guidance I can to help you make it happen too. Look at my comments, I'm not fooling you. A rising tide raises all ships.

No rocket ship here. We now are building and flipping RV parks, self storage and oil and Gas leases with our capital.",0,2021-08-16 17:02:58,<praw.models.comment_forest.CommentForest object at 0x000002547B358F40>,p553rq,GetMotivated,t5_2rmfx,,False,False,t3_p553rq,t1_h9448gb,/r/GetMotivated/comments/p553rq/finally_someone_said_it_image/h96fvzl/
97,h95gljm,Mandula123,Tai Lopez type beat,Tai Lopez type beat,9,2021-08-16 12:56:48,<praw.models.comment_forest.CommentForest object at 0x000002547B347E80>,p553rq,GetMotivated,t5_2rmfx,,False,False,t3_p553rq,t1_h94q264,/r/GetMotivated/comments/p553rq/finally_someone_said_it_image/h95gljm/
98,h9c5csa,DivergingUnity,"Hey, I'm sorry to make this request of you, but a close friend of mine has been increasingly invested in Gary V's whole thing. 

This friend of mine is in a very vulnerable place in his life, and it seems like his worshiping of the guy could be really harmful to his mental health and life skills. 

I've already told my friend that I think Gary is cheesy at best and mostly misguided advice. 

My friend is super insecure about his masculinity and is clearly depressed in a lot of ways. He has motivation issues and low self-esteem as well. He has expressed interest in going to therapy but he's making no effort to find a professional to meet with. For now he's just binge watching Gary's videos and working out like once a week while reciting his mantras. 

What can I tell my friend to get him to understand that this Gary guy is not going to help him in the long run? My friend is super gullible and falls for shiny shit every time, so I need to explain to him succinctly that his infatuation with this public figure is not helping him. 

Do you have any catchphrases I could use to try and change my friend's opinion on this guy?

Edit- just realized Gary literally looks just like my friend's dad lmao","Hey, I'm sorry to make this request of you, but a close friend of mine has been increasingly invested in Gary V's whole thing. 

This friend of mine is in a very vulnerable place in his life, and it seems like his worshiping of the guy could be really harmful to his mental health and life skills. 

I've already told my friend that I think Gary is cheesy at best and mostly misguided advice. 

My friend is super insecure about his masculinity and is clearly depressed in a lot of ways. He has motivation issues and low self-esteem as well. He has expressed interest in going to therapy but he's making no effort to find a professional to meet with. For now he's just binge watching Gary's videos and working out like once a week while reciting his mantras. 

What can I tell my friend to get him to understand that this Gary guy is not going to help him in the long run? My friend is super gullible and falls for shiny shit every time, so I need to explain to him succinctly that his infatuation with this public figure is not helping him. 

Do you have any catchphrases I could use to try and change my friend's opinion on this guy?

Edit- just realized Gary literally looks just like my friend's dad lmao",2,2021-08-17 21:28:27,<praw.models.comment_forest.CommentForest object at 0x000002547B347EE0>,p553rq,GetMotivated,t5_2rmfx,,1629236969.0,False,t3_p553rq,t1_h94q264,/r/GetMotivated/comments/p553rq/finally_someone_said_it_image/h9c5csa/
99,h959jrr,HassanGodside,Weird because all this guy preaches is to work your ass off and never take days off.,Weird because all this guy preaches is to work your ass off and never take days off.,1,2021-08-16 11:50:43,<praw.models.comment_forest.CommentForest object at 0x000002547B35B760>,p553rq,GetMotivated,t5_2rmfx,,False,False,t3_p553rq,t1_h94mpzp,/r/GetMotivated/comments/p553rq/finally_someone_said_it_image/h959jrr/
100,h93rm3z,uhohoreolas,">If women weren't forced to work

No need to say any more, my guy. This tells me all I need to know about you",">If women weren't forced to work

No need to say any more, my guy. This tells me all I need to know about you",14,2021-08-16 01:43:58,<praw.models.comment_forest.CommentForest object at 0x000002547B358B20>,p553rq,GetMotivated,t5_2rmfx,,False,False,t3_p553rq,t1_h93r4c5,/r/GetMotivated/comments/p553rq/finally_someone_said_it_image/h93rm3z/
101,h955763,daydaywang,"So you have no real answers, just reasons with no conclusion or justification. 😔","So you have no real answers, just reasons with no conclusion or justification. 😔",1,2021-08-16 11:03:29,<praw.models.comment_forest.CommentForest object at 0x000002547B358B80>,p553rq,GetMotivated,t5_2rmfx,,False,False,t3_p553rq,t1_h93r4c5,/r/GetMotivated/comments/p553rq/finally_someone_said_it_image/h955763/
102,h9aq3j5,Fatherof10,"That sounds like an approach that could see better results due to attention being put on the long term goals.  
I feel like school can be and is a very positive tool for all people. My wife is a master reading teacher and has worked as a college anatomy/physiology professor for decades. Her teaching passions are preK-3rd grade and adult life skill programs (low level handicapped). I see the changes she makes in a diverse set of peoples lives and she homeschooled her 3 (our oldest children). We now homeschool our youngest daughter, and wish we could our other 6 but I only have 50/50 custody.   
I think having real world interaction and focused caring attention is a very helpful tool for learning.","That sounds like an approach that could see better results due to attention being put on the long term goals.  
I feel like school can be and is a very positive tool for all people. My wife is a master reading teacher and has worked as a college anatomy/physiology professor for decades. Her teaching passions are preK-3rd grade and adult life skill programs (low level handicapped). I see the changes she makes in a diverse set of peoples lives and she homeschooled her 3 (our oldest children). We now homeschool our youngest daughter, and wish we could our other 6 but I only have 50/50 custody.   
I think having real world interaction and focused caring attention is a very helpful tool for learning.",1,2021-08-17 15:02:42,<praw.models.comment_forest.CommentForest object at 0x000002547B358E20>,p553rq,GetMotivated,t5_2rmfx,,False,False,t3_p553rq,t1_h99t7ie,/r/GetMotivated/comments/p553rq/finally_someone_said_it_image/h9aq3j5/
103,h95q4cn,Clickum245,I hope that idiot died in the pool he rented to make videos to lie about how rich he is,I hope that idiot died in the pool he rented to make videos to lie about how rich he is,6,2021-08-16 14:11:29,<praw.models.comment_forest.CommentForest object at 0x000002547B347F40>,p553rq,GetMotivated,t5_2rmfx,,False,False,t3_p553rq,t1_h95gljm,/r/GetMotivated/comments/p553rq/finally_someone_said_it_image/h95q4cn/
104,h9chbar,MisterEChops,Maybe just share something like this? https://youtu.be/v5yueuy0new,Maybe just share something like this? https://youtu.be/v5yueuy0new,1,2021-08-17 23:00:44,<praw.models.comment_forest.CommentForest object at 0x000002547B35B040>,p553rq,GetMotivated,t5_2rmfx,,False,False,t3_p553rq,t1_h9c5csa,/r/GetMotivated/comments/p553rq/finally_someone_said_it_image/h9chbar/
105,h95d5tg,DragonBank,Which is funny because he forgets to preach inheriting the family retail wine business.,Which is funny because he forgets to preach inheriting the family retail wine business.,5,2021-08-16 12:26:26,<praw.models.comment_forest.CommentForest object at 0x000002547B35B820>,p553rq,GetMotivated,t5_2rmfx,,False,False,t3_p553rq,t1_h959jrr,/r/GetMotivated/comments/p553rq/finally_someone_said_it_image/h95d5tg/
106,h9cq758,Psycheau,"Excellent results for industry yes, for individuals no. The individual child is ignored over the needs of industry, sorry but that is not a formula education should be using.","Excellent results for industry yes, for individuals no. The individual child is ignored over the needs of industry, sorry but that is not a formula education should be using.",2,2021-08-18 00:14:58,<praw.models.comment_forest.CommentForest object at 0x000002547B358EE0>,p553rq,GetMotivated,t5_2rmfx,,False,False,t3_p553rq,t1_h9aq3j5,/r/GetMotivated/comments/p553rq/finally_someone_said_it_image/h9cq758/
107,h95swz3,HassanGodside,If you work hard enough you too can inherit your family’s multi-million dollar business.,If you work hard enough you too can inherit your family’s multi-million dollar business.,2,2021-08-16 14:31:18,<praw.models.comment_forest.CommentForest object at 0x000002547B35B8E0>,p553rq,GetMotivated,t5_2rmfx,,False,False,t3_p553rq,t1_h95d5tg,/r/GetMotivated/comments/p553rq/finally_someone_said_it_image/h95swz3/
108,fytevsn,,"Lmao. This is dumb af. If you love each other you love each other. Why do people relate love with money? This is basically saying a woman will leave if the man isn’t rich, and a rich man will just leave if he’s rich.  And it’s somehow “amazing” and “motivating” if they don’t leave eachother","Lmao. This is dumb af. If you love each other you love each other. Why do people relate love with money? This is basically saying a woman will leave if the man isn’t rich, and a rich man will just leave if he’s rich.  And it’s somehow “amazing” and “motivating” if they don’t leave eachother",24,2020-07-21 23:07:31,<praw.models.comment_forest.CommentForest object at 0x000002547B35A790>,hv8rjn,GetMotivated,t5_2rmfx,,False,False,t3_hv8rjn,t3_hv8rjn,/r/GetMotivated/comments/hv8rjn/image/fytevsn/
109,fyrzslp,HisOrHerpes,"How in the absolute fuck is this motivational? Ridiculous gender assignment aside, how is this even remotely making someone think “you know, that’s motivating!” This is some high school sophomore level Facebook shared nonsense","How in the absolute fuck is this motivational? Ridiculous gender assignment aside, how is this even remotely making someone think “you know, that’s motivating!” This is some high school sophomore level Facebook shared nonsense",135,2020-07-21 16:09:31,<praw.models.comment_forest.CommentForest object at 0x000002547B35A7F0>,hv8rjn,GetMotivated,t5_2rmfx,,False,False,t3_hv8rjn,t3_hv8rjn,/r/GetMotivated/comments/hv8rjn/image/fyrzslp/
110,fys0jbj,Jello_hell,"Ah yes, all women are shallow and only interested in material things and all men are dogs. Very motivational.","Ah yes, all women are shallow and only interested in material things and all men are dogs. Very motivational.",61,2020-07-21 16:15:35,<praw.models.comment_forest.CommentForest object at 0x000002547B35AA60>,hv8rjn,GetMotivated,t5_2rmfx,,False,False,t3_hv8rjn,t3_hv8rjn,/r/GetMotivated/comments/hv8rjn/image/fys0jbj/
111,fyrx5fu,,"Michelle has always been such a classy, gorgeous lady.","Michelle has always been such a classy, gorgeous lady.",21,2020-07-21 15:47:37,<praw.models.comment_forest.CommentForest object at 0x000002547B35AE80>,hv8rjn,GetMotivated,t5_2rmfx,,False,False,t3_hv8rjn,t3_hv8rjn,/r/GetMotivated/comments/hv8rjn/image/fyrx5fu/
112,fys2emg,cereal-kills-me,They were both always relatively wealthy and met at Harvard so I mean they were good,They were both always relatively wealthy and met at Harvard so I mean they were good,14,2020-07-21 16:30:49,<praw.models.comment_forest.CommentForest object at 0x000002547B340250>,hv8rjn,GetMotivated,t5_2rmfx,,False,False,t3_hv8rjn,t3_hv8rjn,/r/GetMotivated/comments/hv8rjn/image/fys2emg/
113,fyryfdd,AnonDooDoo,The fuck is up with the people in this comment section,The fuck is up with the people in this comment section,16,2020-07-21 15:58:15,<praw.models.comment_forest.CommentForest object at 0x000002547B3402B0>,hv8rjn,GetMotivated,t5_2rmfx,,False,False,t3_hv8rjn,t3_hv8rjn,/r/GetMotivated/comments/hv8rjn/image/fyryfdd/
114,fys2i8d,Buttersschotch,"""When her man has nothing"" they were both born into the upper class and studied at Harvard together,  hardly call that having nothing...","""When her man has nothing"" they were both born into the upper class and studied at Harvard together,  hardly call that having nothing...",8,2020-07-21 16:31:39,<praw.models.comment_forest.CommentForest object at 0x000002547B3403D0>,hv8rjn,GetMotivated,t5_2rmfx,,False,False,t3_hv8rjn,t3_hv8rjn,/r/GetMotivated/comments/hv8rjn/image/fys2i8d/
115,fysmmdd,vodilica,Absolute stupidity,Absolute stupidity,3,2020-07-21 19:13:13,<praw.models.comment_forest.CommentForest object at 0x000002547B340580>,hv8rjn,GetMotivated,t5_2rmfx,,False,False,t3_hv8rjn,t3_hv8rjn,/r/GetMotivated/comments/hv8rjn/image/fysmmdd/
116,fyz8x7t,deedaker,Michelle for Vice President!,Michelle for Vice President!,2,2020-07-23 13:41:05,<praw.models.comment_forest.CommentForest object at 0x000002547B340610>,hv8rjn,GetMotivated,t5_2rmfx,,False,False,t3_hv8rjn,t3_hv8rjn,/r/GetMotivated/comments/hv8rjn/image/fyz8x7t/
117,fyu1qgb,eoliveri,"Except that Barry had tremendous potential, and Michelle recognized it.","Except that Barry had tremendous potential, and Michelle recognized it.",1,2020-07-22 02:50:46,<praw.models.comment_forest.CommentForest object at 0x000002547B3406D0>,hv8rjn,GetMotivated,t5_2rmfx,,False,False,t3_hv8rjn,t3_hv8rjn,/r/GetMotivated/comments/hv8rjn/image/fyu1qgb/
118,fyubdil,ground_report69,Will Smith 😶😐,Will Smith 😶😐,1,2020-07-22 04:36:30,<praw.models.comment_forest.CommentForest object at 0x000002547B340730>,hv8rjn,GetMotivated,t5_2rmfx,,False,False,t3_hv8rjn,t3_hv8rjn,/r/GetMotivated/comments/hv8rjn/image/fyubdil/
119,fyz4abv,moujujup,Both are men.,Both are men.,1,2020-07-23 12:52:20,<praw.models.comment_forest.CommentForest object at 0x000002547B340790>,hv8rjn,GetMotivated,t5_2rmfx,,False,False,t3_hv8rjn,t3_hv8rjn,/r/GetMotivated/comments/hv8rjn/image/fyz4abv/
120,fyrsfga,,[removed],[removed],-75,2020-07-21 15:07:43,<praw.models.comment_forest.CommentForest object at 0x000002547B3407F0>,hv8rjn,GetMotivated,t5_2rmfx,,False,False,t3_hv8rjn,t3_hv8rjn,/r/GetMotivated/comments/hv8rjn/image/fyrsfga/
121,fyrwcu7,,[removed],[removed],-64,2020-07-21 15:41:01,<praw.models.comment_forest.CommentForest object at 0x000002547B340850>,hv8rjn,GetMotivated,t5_2rmfx,,False,False,t3_hv8rjn,t3_hv8rjn,/r/GetMotivated/comments/hv8rjn/image/fyrwcu7/
122,fyrxonk,,[removed],[removed],-57,2020-07-21 15:52:05,<praw.models.comment_forest.CommentForest object at 0x000002547B340A60>,hv8rjn,GetMotivated,t5_2rmfx,,False,False,t3_hv8rjn,t3_hv8rjn,/r/GetMotivated/comments/hv8rjn/image/fyrxonk/
123,fyryxb0,,Propaganda,Propaganda,-37,2020-07-21 16:02:22,<praw.models.comment_forest.CommentForest object at 0x000002547B340B80>,hv8rjn,GetMotivated,t5_2rmfx,,False,False,t3_hv8rjn,t3_hv8rjn,/r/GetMotivated/comments/hv8rjn/image/fyryxb0/
124,fyt7r3b,outerspaceNH,"Motivating because it's love. It shows they went through plenty of problems, fights, even with politics in the way, and still came out on top. That takes motivation, buddy.","Motivating because it's love. It shows they went through plenty of problems, fights, even with politics in the way, and still came out on top. That takes motivation, buddy.",-6,2020-07-21 22:02:21,<praw.models.comment_forest.CommentForest object at 0x000002547B35AA30>,hv8rjn,GetMotivated,t5_2rmfx,,False,False,t3_hv8rjn,t1_fyrzslp,/r/GetMotivated/comments/hv8rjn/image/fyt7r3b/
125,fys1pdo,qwert66787,">How in the absolute fuck is this motivational? Ridiculous gender assignment aside, how is this even remotely making someone think “you know, that’s motivating!” This is some high school sophomore level Facebook shared nonsense

Women have a right to be masculine, a male has the right to be feminine. gender role evolution Is a well-proven fact and a certain gender type - masculinity has more to do with responsibility. but we cannot force a certain gender to act a certain role, you decide that yourself. If a female wants to succeed in society, she usually has to be masculine psychologically. this is about masculine responsibility. (again which does not prohibit to a certain gender but all gender can choose to be so.)",">How in the absolute fuck is this motivational? Ridiculous gender assignment aside, how is this even remotely making someone think “you know, that’s motivating!” This is some high school sophomore level Facebook shared nonsense

Women have a right to be masculine, a male has the right to be feminine. gender role evolution Is a well-proven fact and a certain gender type - masculinity has more to do with responsibility. but we cannot force a certain gender to act a certain role, you decide that yourself. If a female wants to succeed in society, she usually has to be masculine psychologically. this is about masculine responsibility. (again which does not prohibit to a certain gender but all gender can choose to be so.)",-14,2020-07-21 16:25:06,<praw.models.comment_forest.CommentForest object at 0x000002547B35AB50>,hv8rjn,GetMotivated,t5_2rmfx,,False,False,t3_hv8rjn,t1_fyrzslp,/r/GetMotivated/comments/hv8rjn/image/fys1pdo/
126,fys1vpt,claraboldlygoes,Right this is r/pointlesslygendered as well as just offensive??? Wtf,Right this is r/pointlesslygendered as well as just offensive??? Wtf,19,2020-07-21 16:26:33,<praw.models.comment_forest.CommentForest object at 0x000002547B3401C0>,hv8rjn,GetMotivated,t5_2rmfx,,False,False,t3_hv8rjn,t1_fys0jbj,/r/GetMotivated/comments/hv8rjn/image/fys1vpt/
127,fysd62l,,How dare you break the media spectacle little man. Go back to looking for motivation so you can work hard to be like who the media wants you to try to be like.,How dare you break the media spectacle little man. Go back to looking for motivation so you can work hard to be like who the media wants you to try to be like.,2,2020-07-21 17:57:34,<praw.models.comment_forest.CommentForest object at 0x000002547B340310>,hv8rjn,GetMotivated,t5_2rmfx,,False,False,t3_hv8rjn,t1_fys2emg,/r/GetMotivated/comments/hv8rjn/image/fysd62l/
128,fyvfffr,_JustDefy_,"Michelle LaVaughn Robinson was born on January 17, 1964, in Chicago, Illinois, to Fraser Robinson III (1935–1991),[3] a city water plant employee and Democratic precinct captain, and Marian Shields Robinson (b. July 30, 1937), a secretary at Spiegel's catalog store.[4] Her mother was a full-time homemaker until Michelle entered high school.[5]

Yeah man, her family really had that ""old money"", water plant workers are def in the top 1%. Wasn't  the south side of Chicago in the 1960s known for being super affluent?

https://en.m.wikipedia.org/wiki/Michelle_Obama","Michelle LaVaughn Robinson was born on January 17, 1964, in Chicago, Illinois, to Fraser Robinson III (1935–1991),[3] a city water plant employee and Democratic precinct captain, and Marian Shields Robinson (b. July 30, 1937), a secretary at Spiegel's catalog store.[4] Her mother was a full-time homemaker until Michelle entered high school.[5]

Yeah man, her family really had that ""old money"", water plant workers are def in the top 1%. Wasn't  the south side of Chicago in the 1960s known for being super affluent?

https://en.m.wikipedia.org/wiki/Michelle_Obama",2,2020-07-22 14:01:41,<praw.models.comment_forest.CommentForest object at 0x000002547B340370>,hv8rjn,GetMotivated,t5_2rmfx,,False,False,t3_hv8rjn,t1_fys2emg,/r/GetMotivated/comments/hv8rjn/image/fyvfffr/
129,fys0eev,paone22,The amount of people who will believe in disproved conspiracy theories is insane man.,The amount of people who will believe in disproved conspiracy theories is insane man.,7,2020-07-21 16:14:28,<praw.models.comment_forest.CommentForest object at 0x000002547B340430>,hv8rjn,GetMotivated,t5_2rmfx,,False,False,t3_hv8rjn,t1_fyryfdd,/r/GetMotivated/comments/hv8rjn/image/fys0eev/
130,fyrzg7a,spliffwizard,"I had never heard about this conspiracy til now and there's three of them haha. 

Also I'm from the UK but Michele was the best and most interesting first lady in my lifetime imo","I had never heard about this conspiracy til now and there's three of them haha. 

Also I'm from the UK but Michele was the best and most interesting first lady in my lifetime imo",9,2020-07-21 16:06:40,<praw.models.comment_forest.CommentForest object at 0x000002547B340490>,hv8rjn,GetMotivated,t5_2rmfx,,False,False,t3_hv8rjn,t1_fyryfdd,/r/GetMotivated/comments/hv8rjn/image/fyrzg7a/
131,fyrysp0,roboanubhab,Reddit being weird again,Reddit being weird again,4,2020-07-21 16:01:19,<praw.models.comment_forest.CommentForest object at 0x000002547B3404F0>,hv8rjn,GetMotivated,t5_2rmfx,,False,False,t3_hv8rjn,t1_fyryfdd,/r/GetMotivated/comments/hv8rjn/image/fyrysp0/
132,fyrwgcc,,what is wrong with you,what is wrong with you,26,2020-07-21 15:41:48,<praw.models.comment_forest.CommentForest object at 0x000002547B3408E0>,hv8rjn,GetMotivated,t5_2rmfx,,False,False,t3_hv8rjn,t1_fyrsfga,/r/GetMotivated/comments/hv8rjn/image/fyrwgcc/
133,fyrxset,,Prettiest first lady we have had since I have been alive.,Prettiest first lady we have had since I have been alive.,15,2020-07-21 15:52:57,<praw.models.comment_forest.CommentForest object at 0x000002547B340940>,hv8rjn,GetMotivated,t5_2rmfx,,False,False,t3_hv8rjn,t1_fyrsfga,/r/GetMotivated/comments/hv8rjn/image/fyrxset/
134,fytr8kf,Mayyonnaisse,All these salty hoes,All these salty hoes,1,2020-07-22 01:06:15,<praw.models.comment_forest.CommentForest object at 0x000002547B3409A0>,hv8rjn,GetMotivated,t5_2rmfx,,False,False,t3_hv8rjn,t1_fyrsfga,/r/GetMotivated/comments/hv8rjn/image/fytr8kf/
