,ID,Author,body,Comment,Score,Created On,Replies,Submission,Subreddit,Subreddit_ID,Distinguished,Edited,Is_submitter,link_id,Parent_id,Permalink
187,iyjf00p,llfoso,"This is anti-homeless propaganda. The ways the guy without legs has been lucky and gotten help, and the ways in which the homeless guy has been unlucky, are invisible.","This is anti-homeless propaganda. The ways the guy without legs has been lucky and gotten help, and the ways in which the homeless guy has been unlucky, are invisible.",21,2022-12-01 21:03:24,<praw.models.comment_forest.CommentForest object at 0x000002541F667EB0>,z9xqzx,GetMotivated,t5_2rmfx,,1669928813.0,False,t3_z9xqzx,t3_z9xqzx,/r/GetMotivated/comments/z9xqzx/hence_introduce_some_inner_engineering_into_your/iyjf00p/
188,iyj8uzv,hljoorbrandr,"I..honestly don’t know how to react to this, like it’s clearly ableist but I don’t feel like I can correctly articulate why it is.","I..honestly don’t know how to react to this, like it’s clearly ableist but I don’t feel like I can correctly articulate why it is.",10,2022-12-01 20:24:59,<praw.models.comment_forest.CommentForest object at 0x000002541F667FD0>,z9xqzx,GetMotivated,t5_2rmfx,,False,False,t3_z9xqzx,t3_z9xqzx,/r/GetMotivated/comments/z9xqzx/hence_introduce_some_inner_engineering_into_your/iyj8uzv/
189,iyjdref,jdamwyk,"This mf is definitely mentally disabled. He should be in a wheelchair, not crutches.","This mf is definitely mentally disabled. He should be in a wheelchair, not crutches.",6,2022-12-01 20:55:53,<praw.models.comment_forest.CommentForest object at 0x000002541F66D130>,z9xqzx,GetMotivated,t5_2rmfx,,False,False,t3_z9xqzx,t3_z9xqzx,/r/GetMotivated/comments/z9xqzx/hence_introduce_some_inner_engineering_into_your/iyjdref/
190,iyjhv6i,Alwaysunder_thegun,And what about mental disability? What about opportunity? Some of us get them some of us don't.,And what about mental disability? What about opportunity? Some of us get them some of us don't.,4,2022-12-01 21:21:31,<praw.models.comment_forest.CommentForest object at 0x000002541F66D250>,z9xqzx,GetMotivated,t5_2rmfx,,False,False,t3_z9xqzx,t3_z9xqzx,/r/GetMotivated/comments/z9xqzx/hence_introduce_some_inner_engineering_into_your/iyjhv6i/
191,iyjk06f,Hyalopterous,TIL my mind isn't part of my body,TIL my mind isn't part of my body,3,2022-12-01 21:35:21,<praw.models.comment_forest.CommentForest object at 0x000002541F66D310>,z9xqzx,GetMotivated,t5_2rmfx,,False,False,t3_z9xqzx,t3_z9xqzx,/r/GetMotivated/comments/z9xqzx/hence_introduce_some_inner_engineering_into_your/iyjk06f/
192,iyjb375,jdamwyk,Mr. Crutches must have a mental disability. Why else would he be using two crutches with no legs when he could be in a wheel chair?,Mr. Crutches must have a mental disability. Why else would he be using two crutches with no legs when he could be in a wheel chair?,2,2022-12-01 20:38:52,<praw.models.comment_forest.CommentForest object at 0x000002541F66D430>,z9xqzx,GetMotivated,t5_2rmfx,,False,False,t3_z9xqzx,t3_z9xqzx,/r/GetMotivated/comments/z9xqzx/hence_introduce_some_inner_engineering_into_your/iyjb375/
193,iyn3jik,freifickmuschimann,"No I think I see what you’re saying and I can dig it 

I’ve put a lot of effort into the machine itself without necessarily using it for all that it’s capable of; no reason to make and maintain such a functional meat vehicle if I’m not going to take full advantage of it lol","No I think I see what you’re saying and I can dig it 

I’ve put a lot of effort into the machine itself without necessarily using it for all that it’s capable of; no reason to make and maintain such a functional meat vehicle if I’m not going to take full advantage of it lol",1,2022-12-02 17:00:27,<praw.models.comment_forest.CommentForest object at 0x000002541F66D490>,z9xqzx,GetMotivated,t5_2rmfx,,False,False,t3_z9xqzx,t3_z9xqzx,/r/GetMotivated/comments/z9xqzx/hence_introduce_some_inner_engineering_into_your/iyn3jik/
194,iyja2re,aggi_pidugu,"Just to clear your doubts about this image .. here is what it means 

The one who is begging is alright in his body but has a weak mind.. so he gave up on life..

But the one who is giving money is physically disabled but in his mind he is strong hence he is able to earn and live well.","Just to clear your doubts about this image .. here is what it means 

The one who is begging is alright in his body but has a weak mind.. so he gave up on life..

But the one who is giving money is physically disabled but in his mind he is strong hence he is able to earn and live well.",-3,2022-12-01 20:32:17,<praw.models.comment_forest.CommentForest object at 0x000002541F66D4F0>,z9xqzx,GetMotivated,t5_2rmfx,,False,True,t3_z9xqzx,t3_z9xqzx,/r/GetMotivated/comments/z9xqzx/hence_introduce_some_inner_engineering_into_your/iyja2re/
195,iyjjkaw,IcyClearly,"I think the quote is accurate, but the image is judgmental to the homeless guy needing help","I think the quote is accurate, but the image is judgmental to the homeless guy needing help",0,2022-12-01 21:32:30,<praw.models.comment_forest.CommentForest object at 0x000002541F66D550>,z9xqzx,GetMotivated,t5_2rmfx,,False,False,t3_z9xqzx,t3_z9xqzx,/r/GetMotivated/comments/z9xqzx/hence_introduce_some_inner_engineering_into_your/iyjjkaw/
196,iyjh20r,the3dverse,i was wondering if that is ~~psychically~~ physically possible or not... i'm leaning toward not,i was wondering if that is ~~psychically~~ physically possible or not... i'm leaning toward not,5,2022-12-01 21:16:19,<praw.models.comment_forest.CommentForest object at 0x000002541F667880>,z9xqzx,GetMotivated,t5_2rmfx,,1670141957.0,False,t3_z9xqzx,t1_iyjdn4e,/r/GetMotivated/comments/z9xqzx/hence_introduce_some_inner_engineering_into_your/iyjh20r/
197,iyjdwbd,aggi_pidugu,Instead of taking the positive message you are nitpicking here unnecessarily.,Instead of taking the positive message you are nitpicking here unnecessarily.,-11,2022-12-01 20:56:44,<praw.models.comment_forest.CommentForest object at 0x000002541F6678B0>,z9xqzx,GetMotivated,t5_2rmfx,,False,True,t3_z9xqzx,t1_iyjdn4e,/r/GetMotivated/comments/z9xqzx/hence_introduce_some_inner_engineering_into_your/iyjdwbd/
198,iyj90vk,aggi_pidugu,"The one who is begging is alright in his body but has a weak mind.. so he gave up on life..

But the one who is giving money is physically disabled but in his mind he is strong hence he is able to earn and live well.","The one who is begging is alright in his body but has a weak mind.. so he gave up on life..

But the one who is giving money is physically disabled but in his mind he is strong hence he is able to earn and live well.",-18,2022-12-01 20:26:00,<praw.models.comment_forest.CommentForest object at 0x000002541F667E50>,z9xqzx,GetMotivated,t5_2rmfx,,False,True,t3_z9xqzx,t1_iyj8ojl,/r/GetMotivated/comments/z9xqzx/hence_introduce_some_inner_engineering_into_your/iyj90vk/
199,iyke6zf,aggi_pidugu,Now that I see it... I think you are right.,Now that I see it... I think you are right.,1,2022-12-02 01:15:52,<praw.models.comment_forest.CommentForest object at 0x000002541F667F70>,z9xqzx,GetMotivated,t5_2rmfx,,False,True,t3_z9xqzx,t1_iyk2ufx,/r/GetMotivated/comments/z9xqzx/hence_introduce_some_inner_engineering_into_your/iyke6zf/
200,iyqnczk,Traumfahrer,It's satire. How the fuck would someone stand upright with two missing legs on crutches.,It's satire. How the fuck would someone stand upright with two missing legs on crutches.,3,2022-12-03 12:04:15,<praw.models.comment_forest.CommentForest object at 0x000002541F66D070>,z9xqzx,GetMotivated,t5_2rmfx,,False,False,t3_z9xqzx,t1_iyjf00p,/r/GetMotivated/comments/z9xqzx/hence_introduce_some_inner_engineering_into_your/iyqnczk/
201,iyjggqc,pckldpr,I'm still trying to beat the mental programming of failure my parents have me. It's hard to be positive when you were always the failure.,I'm still trying to beat the mental programming of failure my parents have me. It's hard to be positive when you were always the failure.,4,2022-12-01 21:12:32,<praw.models.comment_forest.CommentForest object at 0x000002541F66D0D0>,z9xqzx,GetMotivated,t5_2rmfx,,False,False,t3_z9xqzx,t1_iyjf00p,/r/GetMotivated/comments/z9xqzx/hence_introduce_some_inner_engineering_into_your/iyjggqc/
202,iylgcc7,,"It's ableist because it basically uses a person with a disability as the ""lower bound"" of what should be possible for everyone else. It's saying ""If this guy with no legs can live a regular life, then anybody can"" as if missing your legs is meant to be borderline life-ending. 

It also assumes that only visible disabilities/struggles count as real problems people face. Although that's more just bullshit than specifically ableist.","It's ableist because it basically uses a person with a disability as the ""lower bound"" of what should be possible for everyone else. It's saying ""If this guy with no legs can live a regular life, then anybody can"" as if missing your legs is meant to be borderline life-ending. 

It also assumes that only visible disabilities/struggles count as real problems people face. Although that's more just bullshit than specifically ableist.",5,2022-12-02 07:00:49,<praw.models.comment_forest.CommentForest object at 0x000002541F66D190>,z9xqzx,GetMotivated,t5_2rmfx,,False,False,t3_z9xqzx,t1_iyj8uzv,/r/GetMotivated/comments/z9xqzx/hence_introduce_some_inner_engineering_into_your/iylgcc7/
203,iyj9sw7,PositiveLooper,Yea that's the vibe I got from it but I don't really know how to explain it either lol,Yea that's the vibe I got from it but I don't really know how to explain it either lol,4,2022-12-01 20:30:30,<praw.models.comment_forest.CommentForest object at 0x000002541F66D1F0>,z9xqzx,GetMotivated,t5_2rmfx,,False,False,t3_z9xqzx,t1_iyj8uzv,/r/GetMotivated/comments/z9xqzx/hence_introduce_some_inner_engineering_into_your/iyj9sw7/
204,iyjd84p,jdamwyk,In his mind he’s definitely disabled. He should be in a wheel chair not on crutches.,In his mind he’s definitely disabled. He should be in a wheel chair not on crutches.,12,2022-12-01 20:52:31,<praw.models.comment_forest.CommentForest object at 0x000002541F66D5B0>,z9xqzx,GetMotivated,t5_2rmfx,,False,False,t3_z9xqzx,t1_iyja2re,/r/GetMotivated/comments/z9xqzx/hence_introduce_some_inner_engineering_into_your/iyjd84p/
205,iyjhezk,,"Physically, btw","Physically, btw",2,2022-12-01 21:18:39,<praw.models.comment_forest.CommentForest object at 0x000002541F6678E0>,z9xqzx,GetMotivated,t5_2rmfx,,False,False,t3_z9xqzx,t1_iyjh20r,/r/GetMotivated/comments/z9xqzx/hence_introduce_some_inner_engineering_into_your/iyjhezk/
206,iynq9yr,Embarrassed-Life5402,He'd be leaning too.,He'd be leaning too.,1,2022-12-02 19:30:15,<praw.models.comment_forest.CommentForest object at 0x000002541F667A90>,z9xqzx,GetMotivated,t5_2rmfx,,False,False,t3_z9xqzx,t1_iyjh20r,/r/GetMotivated/comments/z9xqzx/hence_introduce_some_inner_engineering_into_your/iynq9yr/
207,iyje35o,jdamwyk,"I’m not nitpicking, it was a joke 🙄 
You’re taking this a little too seriously. If anything this message is condescending. Not all disabilities are visible bro.","I’m not nitpicking, it was a joke 🙄 
You’re taking this a little too seriously. If anything this message is condescending. Not all disabilities are visible bro.",15,2022-12-01 20:57:53,<praw.models.comment_forest.CommentForest object at 0x000002541F667C70>,z9xqzx,GetMotivated,t5_2rmfx,,False,False,t3_z9xqzx,t1_iyjdwbd,/r/GetMotivated/comments/z9xqzx/hence_introduce_some_inner_engineering_into_your/iyje35o/
208,iynqdvk,Embarrassed-Life5402,"It's a horribly drawn comic with an Andrew Tate/Joe Rogan level take. I.e., total shit.","It's a horribly drawn comic with an Andrew Tate/Joe Rogan level take. I.e., total shit.",3,2022-12-02 19:31:01,<praw.models.comment_forest.CommentForest object at 0x000002541F667CD0>,z9xqzx,GetMotivated,t5_2rmfx,,False,False,t3_z9xqzx,t1_iyjdwbd,/r/GetMotivated/comments/z9xqzx/hence_introduce_some_inner_engineering_into_your/iynqdvk/
209,iyji110,lunadanger,"What positive message, exactly? Please enlighten the group with some anti-homeless rhetoric.","What positive message, exactly? Please enlighten the group with some anti-homeless rhetoric.",2,2022-12-01 21:22:33,<praw.models.comment_forest.CommentForest object at 0x000002541F667D30>,z9xqzx,GetMotivated,t5_2rmfx,,False,False,t3_z9xqzx,t1_iyjdwbd,/r/GetMotivated/comments/z9xqzx/hence_introduce_some_inner_engineering_into_your/iyji110/
210,iyj9msu,PositiveLooper,Ohh ok thank you for taking the time to explain btw :),Ohh ok thank you for taking the time to explain btw :),4,2022-12-01 20:29:30,<praw.models.comment_forest.CommentForest object at 0x000002541F667F10>,z9xqzx,GetMotivated,t5_2rmfx,,False,False,t3_z9xqzx,t1_iyj90vk,/r/GetMotivated/comments/z9xqzx/hence_introduce_some_inner_engineering_into_your/iyj9msu/
211,iyjjc52,hljoorbrandr,"Like, the guy receiving money may have an invisible disability like ADHD or diabetes? I think that is why I see it so ableist. It is like “look at this amputee giving money to someone - he can do it so can you”","Like, the guy receiving money may have an invisible disability like ADHD or diabetes? I think that is why I see it so ableist. It is like “look at this amputee giving money to someone - he can do it so can you”",6,2022-12-01 21:31:01,<praw.models.comment_forest.CommentForest object at 0x000002541F66D2B0>,z9xqzx,GetMotivated,t5_2rmfx,,False,False,t3_z9xqzx,t1_iyj9sw7,/r/GetMotivated/comments/z9xqzx/hence_introduce_some_inner_engineering_into_your/iyjjc52/
212,iyjedc4,Ramental,"Right? If these are 2 crutches, that must be insanely difficult and quite dangerous to use it this way. If one of those is an artificial leg, then why is it only one leg? Clearly he has money to install a second one and hugely improve his quality of life. 

Weird. I get the point of the picture, but there is clearly a lack of understanding of the disabled by the author, questioning his ability to give an advice on the topic.","Right? If these are 2 crutches, that must be insanely difficult and quite dangerous to use it this way. If one of those is an artificial leg, then why is it only one leg? Clearly he has money to install a second one and hugely improve his quality of life. 

Weird. I get the point of the picture, but there is clearly a lack of understanding of the disabled by the author, questioning his ability to give an advice on the topic.",7,2022-12-01 20:59:35,<praw.models.comment_forest.CommentForest object at 0x000002541F66D670>,z9xqzx,GetMotivated,t5_2rmfx,,False,False,t3_z9xqzx,t1_iyjd84p,/r/GetMotivated/comments/z9xqzx/hence_introduce_some_inner_engineering_into_your/iyjedc4/
213,iyjdpp4,aggi_pidugu,You are reading too much between the lines mate.,You are reading too much between the lines mate.,-3,2022-12-01 20:55:35,<praw.models.comment_forest.CommentForest object at 0x000002541F66D6D0>,z9xqzx,GetMotivated,t5_2rmfx,,False,True,t3_z9xqzx,t1_iyjd84p,/r/GetMotivated/comments/z9xqzx/hence_introduce_some_inner_engineering_into_your/iyjdpp4/
214,iyupfre,the3dverse,you are correct. ugh and because it's a word spellcheck didn't pick it up,you are correct. ugh and because it's a word spellcheck didn't pick it up,2,2022-12-04 08:18:41,<praw.models.comment_forest.CommentForest object at 0x000002541F667AC0>,z9xqzx,GetMotivated,t5_2rmfx,,False,False,t3_z9xqzx,t1_iyjhezk,/r/GetMotivated/comments/z9xqzx/hence_introduce_some_inner_engineering_into_your/iyupfre/
215,iyk4kqu,DrownmeinIslay,Schizophrenia? Maybe OP is throwing shade at mental illness.,Schizophrenia? Maybe OP is throwing shade at mental illness.,3,2022-12-02 00:01:24,<praw.models.comment_forest.CommentForest object at 0x000002541F66D370>,z9xqzx,GetMotivated,t5_2rmfx,,False,False,t3_z9xqzx,t1_iyjjc52,/r/GetMotivated/comments/z9xqzx/hence_introduce_some_inner_engineering_into_your/iyk4kqu/
216,izy6jdn,UltraAlphaOne,"I think the part about that that is true is “look at that person with challenges, they’ve overcome them and so can you!” Which is motivating.","I think the part about that that is true is “look at that person with challenges, they’ve overcome them and so can you!” Which is motivating.",2,2022-12-12 18:48:22,<praw.models.comment_forest.CommentForest object at 0x000002541F66D3D0>,z9xqzx,GetMotivated,t5_2rmfx,,False,False,t3_z9xqzx,t1_iyjjc52,/r/GetMotivated/comments/z9xqzx/hence_introduce_some_inner_engineering_into_your/izy6jdn/
217,iyjduv1,jdamwyk,"I was kidding bro, that was a joke. Just something i think the artist overlooked.","I was kidding bro, that was a joke. Just something i think the artist overlooked.",2,2022-12-01 20:56:28,<praw.models.comment_forest.CommentForest object at 0x000002541F66D790>,z9xqzx,GetMotivated,t5_2rmfx,,False,False,t3_z9xqzx,t1_iyjdpp4,/r/GetMotivated/comments/z9xqzx/hence_introduce_some_inner_engineering_into_your/iyjduv1/
218,iyjebm6,PositiveLooper,Got a laugh from me,Got a laugh from me,2,2022-12-01 20:59:18,<praw.models.comment_forest.CommentForest object at 0x000002541F66D850>,z9xqzx,GetMotivated,t5_2rmfx,,False,False,t3_z9xqzx,t1_iyjduv1,/r/GetMotivated/comments/z9xqzx/hence_introduce_some_inner_engineering_into_your/iyjebm6/
219,hsushml,detoxifiedjosh,There's nothing motivational about religion if you're not a member of their cult.,There's nothing motivational about religion if you're not a member of their cult.,4,2022-01-16 03:18:03,<praw.models.comment_forest.CommentForest object at 0x000002541F660550>,s4wbc6,GetMotivated,t5_2rmfx,,False,False,t3_s4wbc6,t3_s4wbc6,/r/GetMotivated/comments/s4wbc6/image_claiming_it/hsushml/
220,hstp4os,GammaLambdaBeta,"Thanks, God for all the horrific monstrous shit you and your followers do in your name. Bring it all on you fucking asshole.","Thanks, God for all the horrific monstrous shit you and your followers do in your name. Bring it all on you fucking asshole.",12,2022-01-15 22:40:14,<praw.models.comment_forest.CommentForest object at 0x000002541F660760>,s4wbc6,GetMotivated,t5_2rmfx,,False,False,t3_s4wbc6,t3_s4wbc6,/r/GetMotivated/comments/s4wbc6/image_claiming_it/hstp4os/
221,hsv9uzg,,"What are you thanking him in advance for?

1. Humans have free will so you have no idea what’s going to happen over the years you still have on this planet.

2. If you’re thanking him for Heaven then it’s a tad presumptuous, you might not get in.

3. It’s this kind of inane meaningless drivel that turns people off of religion.","What are you thanking him in advance for?

1. Humans have free will so you have no idea what’s going to happen over the years you still have on this planet.

2. If you’re thanking him for Heaven then it’s a tad presumptuous, you might not get in.

3. It’s this kind of inane meaningless drivel that turns people off of religion.",2,2022-01-16 05:46:21,<praw.models.comment_forest.CommentForest object at 0x000002541F660850>,s4wbc6,GetMotivated,t5_2rmfx,,False,False,t3_s4wbc6,t3_s4wbc6,/r/GetMotivated/comments/s4wbc6/image_claiming_it/hsv9uzg/
222,hsu04z4,jkeyeuk,Thank you I needed this today,Thank you I needed this today,3,2022-01-15 23:55:59,<praw.models.comment_forest.CommentForest object at 0x000002541F660A90>,s4wbc6,GetMotivated,t5_2rmfx,,False,False,t3_s4wbc6,t3_s4wbc6,/r/GetMotivated/comments/s4wbc6/image_claiming_it/hsu04z4/
223,hsuiuzg,mhill595,"I love this, thank you.","I love this, thank you.",2,2022-01-16 02:08:28,<praw.models.comment_forest.CommentForest object at 0x000002541F660B50>,s4wbc6,GetMotivated,t5_2rmfx,,False,False,t3_s4wbc6,t3_s4wbc6,/r/GetMotivated/comments/s4wbc6/image_claiming_it/hsuiuzg/
224,hsw6ak8,GammaLambdaBeta,Preach it. 🙏,Preach it. 🙏,1,2022-01-16 12:26:11,<praw.models.comment_forest.CommentForest object at 0x000002541F6607F0>,s4wbc6,GetMotivated,t5_2rmfx,,False,False,t3_s4wbc6,t1_hsushml,/r/GetMotivated/comments/s4wbc6/image_claiming_it/hsw6ak8/
225,hstq9pq,KaiserVIII,"I respectfully disagree with your take, however will reconsider my point if you come with good argumentation or the truth might be in the middle. You do as if we humans don't have free will. Secondly, more people were killed by leaders like Stalin and Mao. They weren't religious. Religion is used as a tool most of the time to let the populace stay obedient to the authority of the people above them that don't care about the same societal rules.","I respectfully disagree with your take, however will reconsider my point if you come with good argumentation or the truth might be in the middle. You do as if we humans don't have free will. Secondly, more people were killed by leaders like Stalin and Mao. They weren't religious. Religion is used as a tool most of the time to let the populace stay obedient to the authority of the people above them that don't care about the same societal rules.",-2,2022-01-15 22:48:04,<praw.models.comment_forest.CommentForest object at 0x000002541F6608B0>,s4wbc6,GetMotivated,t5_2rmfx,,False,False,t3_s4wbc6,t1_hstp4os,/r/GetMotivated/comments/s4wbc6/image_claiming_it/hstq9pq/
226,hstv1rh,a-mage-ing,I feel sorry for you.,I feel sorry for you.,-3,2022-01-15 23:20:52,<praw.models.comment_forest.CommentForest object at 0x000002541F660910>,s4wbc6,GetMotivated,t5_2rmfx,,False,False,t3_s4wbc6,t1_hstp4os,/r/GetMotivated/comments/s4wbc6/image_claiming_it/hstv1rh/
227,hsu22sg,,So edgy. Are you emo too? Why can’t people like you just let others believe what they want?,So edgy. Are you emo too? Why can’t people like you just let others believe what they want?,-4,2022-01-16 00:09:27,<praw.models.comment_forest.CommentForest object at 0x000002541F6609D0>,s4wbc6,GetMotivated,t5_2rmfx,,1642292087.0,False,t3_s4wbc6,t1_hstp4os,/r/GetMotivated/comments/s4wbc6/image_claiming_it/hsu22sg/
228,hsu37ry,S3dekick,Happy to help 🙏 you got this,Happy to help 🙏 you got this,3,2022-01-16 00:17:37,<praw.models.comment_forest.CommentForest object at 0x000002541F660C10>,s4wbc6,GetMotivated,t5_2rmfx,,False,True,t3_s4wbc6,t1_hsu04z4,/r/GetMotivated/comments/s4wbc6/image_claiming_it/hsu37ry/
229,hsukgj4,S3dekick,Happy to put it out there ❤️,Happy to put it out there ❤️,1,2022-01-16 02:19:42,<praw.models.comment_forest.CommentForest object at 0x000002541F660D30>,s4wbc6,GetMotivated,t5_2rmfx,,False,True,t3_s4wbc6,t1_hsuiuzg,/r/GetMotivated/comments/s4wbc6/image_claiming_it/hsukgj4/
230,hsttbpb,Open-Sea8388,And religion is the is. Religion can be anything. You follow your football team 'religiously. You vote for your party' religiously. Christianity is relationship based. God is our father who sacrificed his son to save us from our sins if we believe. It's not easy as people say. You face ridicule and hatred. But the reward is worth it,And religion is the is. Religion can be anything. You follow your football team 'religiously. You vote for your party' religiously. Christianity is relationship based. God is our father who sacrificed his son to save us from our sins if we believe. It's not easy as people say. You face ridicule and hatred. But the reward is worth it,-3,2022-01-15 23:08:53,<praw.models.comment_forest.CommentForest object at 0x000002541F660970>,s4wbc6,GetMotivated,t5_2rmfx,,False,False,t3_s4wbc6,t1_hstq9pq,/r/GetMotivated/comments/s4wbc6/image_claiming_it/hsttbpb/
231,hstylgh,GammaLambdaBeta,"Back atcha, pal. 🤟","Back atcha, pal. 🤟",3,2022-01-15 23:45:17,<praw.models.comment_forest.CommentForest object at 0x000002541F660A30>,s4wbc6,GetMotivated,t5_2rmfx,,False,False,t3_s4wbc6,t1_hstv1rh,/r/GetMotivated/comments/s4wbc6/image_claiming_it/hstylgh/
232,hsud3b3,GammaLambdaBeta,I don't see how I'm stopping anyone from doing anything. If people want to believe in a genocidal psychopathic god that is their business. But it sure as shit isn't motivational.,I don't see how I'm stopping anyone from doing anything. If people want to believe in a genocidal psychopathic god that is their business. But it sure as shit isn't motivational.,5,2022-01-16 01:27:21,<praw.models.comment_forest.CommentForest object at 0x000002541F660AF0>,s4wbc6,GetMotivated,t5_2rmfx,,False,False,t3_s4wbc6,t1_hsu22sg,/r/GetMotivated/comments/s4wbc6/image_claiming_it/hsud3b3/
233,hsueomz,,Literally there are other comments from people saying it is. What you’re saying isn’t achieving anything and it’s just you talking shit about peoples beliefs. Why comment at all if you’re just trying to bother people?,Literally there are other comments from people saying it is. What you’re saying isn’t achieving anything and it’s just you talking shit about peoples beliefs. Why comment at all if you’re just trying to bother people?,-4,2022-01-16 01:38:28,<praw.models.comment_forest.CommentForest object at 0x000002541F660BB0>,s4wbc6,GetMotivated,t5_2rmfx,,False,False,t3_s4wbc6,t1_hsud3b3,/r/GetMotivated/comments/s4wbc6/image_claiming_it/hsueomz/
