,ID,Author,body,Comment,Score,Created On,Replies,Submission,Subreddit,Subreddit_ID,Distinguished,Edited,Is_submitter,link_id,Parent_id,Permalink
108,ia1jo2j,Twisted_nano,"In a male dominated world, us men seem to admire it.","In a male dominated world, us men seem to admire it.",-12,2022-05-26 08:34:46,<praw.models.comment_forest.CommentForest object at 0x0000022EEDF7A7C0>,uxyw09,drawing,t5_2qvp9,,False,True,t3_uxyw09,t1_ia1gax7,/r/drawing/comments/uxyw09/asian_beauty/ia1jo2j/
109,ia1dc9d,Twisted_nano,Who cares? The point is there’s always a woman throwing shade when they see an art piece of a naked woman as if it’s gonna stop everyone from enjoying it.,Who cares? The point is there’s always a woman throwing shade when they see an art piece of a naked woman as if it’s gonna stop everyone from enjoying it.,-3,2022-05-26 07:02:06,<praw.models.comment_forest.CommentForest object at 0x0000022EEDF7AB80>,uxyw09,drawing,t5_2qvp9,,False,True,t3_uxyw09,t1_ia1cegh,/r/drawing/comments/uxyw09/asian_beauty/ia1dc9d/
110,ikbad6m,HubCitySwami,What talent do you have other than crying over a2 month old comment? And if all you get for that is 70 bucks then you're better off as a security guard.,What talent do you have other than crying over a2 month old comment? And if all you get for that is 70 bucks then you're better off as a security guard.,8,2022-08-14 23:02:22,<praw.models.comment_forest.CommentForest object at 0x0000022EEDF7C0A0>,uxyw09,drawing,t5_2qvp9,,False,False,t3_uxyw09,t1_ikayuao,/r/drawing/comments/uxyw09/asian_beauty/ikbad6m/
111,ikb6bcu,AutumnLeaves1939,"*says something OP doesn’t like*

“You’re just a Karen!” 

Ok buddy. If I was you I’d practice on improving my art so it actually looked skillfully done instead of wasting my time arguing.","*says something OP doesn’t like*

“You’re just a Karen!” 

Ok buddy. If I was you I’d practice on improving my art so it actually looked skillfully done instead of wasting my time arguing.",7,2022-08-14 22:32:05,<praw.models.comment_forest.CommentForest object at 0x0000022EEDF7C400>,uxyw09,drawing,t5_2qvp9,,False,False,t3_uxyw09,t1_ikb5vla,/r/drawing/comments/uxyw09/asian_beauty/ikb6bcu/
112,ia1g5n0,PlasticBread221,Maybe you should care. Who’s to say.,Maybe you should care. Who’s to say.,9,2022-05-26 07:42:21,<praw.models.comment_forest.CommentForest object at 0x0000022EEDF7AC40>,uxyw09,drawing,t5_2qvp9,,False,False,t3_uxyw09,t1_ia1dc9d,/r/drawing/comments/uxyw09/asian_beauty/ia1g5n0/
113,ikbycng,Twisted_nano,It's more the fact that you thought I wouldn't respond that makes me laugh. And yes $70 considering the size and the clientele  I have at the moment. But it's all good. Keep hating.,It's more the fact that you thought I wouldn't respond that makes me laugh. And yes $70 considering the size and the clientele  I have at the moment. But it's all good. Keep hating.,2,2022-08-15 02:10:23,<praw.models.comment_forest.CommentForest object at 0x0000022EEDF7C160>,uxyw09,drawing,t5_2qvp9,,False,True,t3_uxyw09,t1_ikbad6m,/r/drawing/comments/uxyw09/asian_beauty/ikbycng/
114,ikb6wle,Twisted_nano,It was done well enough to sell. I don't see any skills worth even mentioning on your page. Lol,It was done well enough to sell. I don't see any skills worth even mentioning on your page. Lol,1,2022-08-14 22:36:28,<praw.models.comment_forest.CommentForest object at 0x0000022EEDF7C4C0>,uxyw09,drawing,t5_2qvp9,,False,True,t3_uxyw09,t1_ikb6bcu,/r/drawing/comments/uxyw09/asian_beauty/ikb6wle/
115,ia1k0h5,Twisted_nano,Well I don’t. So what now?,Well I don’t. So what now?,-1,2022-05-26 08:39:58,<praw.models.comment_forest.CommentForest object at 0x0000022EEDF7AD00>,uxyw09,drawing,t5_2qvp9,,False,True,t3_uxyw09,t1_ia1g5n0,/r/drawing/comments/uxyw09/asian_beauty/ia1k0h5/
116,ikc564a,HubCitySwami,"If I was hating I'd have made friend remarks about your talent. Don't sell shit for 70 bucks! Tf is wrong with you? I never said you were without talent. I like it but the shit just doesn't move me.
When I used to draw for folks I'd refuse to even pick up my pen without a 200 dollar deposit. Cash right now. I learned that lesson long ago. If THEY can't draw it then they gotta pay ME for MY talent. 70 bucks is good for a stick figure artist but not for you. Don't sell yourself short.
The next time someone wants to give you 70 bucks to draw something then draw them a stick figure because that's what they paid for.","If I was hating I'd have made friend remarks about your talent. Don't sell shit for 70 bucks! Tf is wrong with you? I never said you were without talent. I like it but the shit just doesn't move me.
When I used to draw for folks I'd refuse to even pick up my pen without a 200 dollar deposit. Cash right now. I learned that lesson long ago. If THEY can't draw it then they gotta pay ME for MY talent. 70 bucks is good for a stick figure artist but not for you. Don't sell yourself short.
The next time someone wants to give you 70 bucks to draw something then draw them a stick figure because that's what they paid for.",3,2022-08-15 03:06:40,<praw.models.comment_forest.CommentForest object at 0x0000022EEDF7C220>,uxyw09,drawing,t5_2qvp9,,False,False,t3_uxyw09,t1_ikbycng,/r/drawing/comments/uxyw09/asian_beauty/ikc564a/
117,ikb7tto,AutumnLeaves1939,Surprise surprise there are men online that are more desperate and horny than you lol,Surprise surprise there are men online that are more desperate and horny than you lol,6,2022-08-14 22:43:19,<praw.models.comment_forest.CommentForest object at 0x0000022EEDF7C580>,uxyw09,drawing,t5_2qvp9,,False,False,t3_uxyw09,t1_ikb6wle,/r/drawing/comments/uxyw09/asian_beauty/ikb7tto/
118,ia1sf8d,PlasticBread221,"Simple, you keep being an ass. 🤷","Simple, you keep being an ass. 🤷",6,2022-05-26 10:40:10,<praw.models.comment_forest.CommentForest object at 0x0000022EEDF7A130>,uxyw09,drawing,t5_2qvp9,,False,False,t3_uxyw09,t1_ia1k0h5,/r/drawing/comments/uxyw09/asian_beauty/ia1sf8d/
119,ikc99b2,Twisted_nano,This whole time you been hating on me for drawing nudity 😆 as if I'm supposed to stop doing erotic art just because one broad has an issue with it....,This whole time you been hating on me for drawing nudity 😆 as if I'm supposed to stop doing erotic art just because one broad has an issue with it....,2,2022-08-15 03:43:02,<praw.models.comment_forest.CommentForest object at 0x0000022EEDF511C0>,uxyw09,drawing,t5_2qvp9,,False,True,t3_uxyw09,t1_ikc564a,/r/drawing/comments/uxyw09/asian_beauty/ikc99b2/
120,ia2o5bp,Twisted_nano,Strong words of a hater.,Strong words of a hater.,1,2022-05-26 15:11:21,<praw.models.comment_forest.CommentForest object at 0x0000022EEDF7C790>,uxyw09,drawing,t5_2qvp9,,False,True,t3_uxyw09,t1_ia1sf8d,/r/drawing/comments/uxyw09/asian_beauty/ia2o5bp/
121,ikca8y3,HubCitySwami,"You really are clueless, aren't you? No wonder you're selling art for 70 bucks a pop. I know a man who sells prints for no less than 150 and your dumb ass is languishing in obscurity and selling shit for 70 bucks and I top of that you're actually bragging about it. I guess it's ok if you're a smoked out meth fiend but for those of us who don't smoke the stuff 70 bucks ain't gonna cut it.
You're probably drawing nude women because women ain't getting nude around you.","You really are clueless, aren't you? No wonder you're selling art for 70 bucks a pop. I know a man who sells prints for no less than 150 and your dumb ass is languishing in obscurity and selling shit for 70 bucks and I top of that you're actually bragging about it. I guess it's ok if you're a smoked out meth fiend but for those of us who don't smoke the stuff 70 bucks ain't gonna cut it.
You're probably drawing nude women because women ain't getting nude around you.",3,2022-08-15 03:52:17,<praw.models.comment_forest.CommentForest object at 0x0000022EEDF74BB0>,uxyw09,drawing,t5_2qvp9,,False,False,t3_uxyw09,t1_ikc99b2,/r/drawing/comments/uxyw09/asian_beauty/ikca8y3/
122,ikcjhen,Twisted_nano,"Ha ha ha ha. Whatever the reason may be, I'm totally satisfied with my business. There's always a Karen coming out of the woodwork preaching about the lack of respect for women and criticizing someone's work as if the entire universe revolves around you.","Ha ha ha ha. Whatever the reason may be, I'm totally satisfied with my business. There's always a Karen coming out of the woodwork preaching about the lack of respect for women and criticizing someone's work as if the entire universe revolves around you.",2,2022-08-15 05:27:08,<praw.models.comment_forest.CommentForest object at 0x0000022EEDF7CB80>,uxyw09,drawing,t5_2qvp9,,False,True,t3_uxyw09,t1_ikca8y3,/r/drawing/comments/uxyw09/asian_beauty/ikcjhen/
123,ikgzmui,HubCitySwami,Quit being a cry baby. It's unmanly.,Quit being a cry baby. It's unmanly.,3,2022-08-16 02:57:07,<praw.models.comment_forest.CommentForest object at 0x0000022EEDF7CD60>,uxyw09,drawing,t5_2qvp9,,False,False,t3_uxyw09,t1_ikcjhen,/r/drawing/comments/uxyw09/asian_beauty/ikgzmui/
124,ikhbf1z,Twisted_nano,Quit being a troll. It's cowardly.,Quit being a troll. It's cowardly.,2,2022-08-16 04:41:37,<praw.models.comment_forest.CommentForest object at 0x0000022EEDF7CCD0>,uxyw09,drawing,t5_2qvp9,,False,True,t3_uxyw09,t1_ikgzmui,/r/drawing/comments/uxyw09/asian_beauty/ikhbf1z/
125,ivtahfg,MinutePass4386,"You’re the cry baby here, complaining about nudity. 
Objectively, it is art, wether you find it obscene or not is subjective and only depend on your point of view.","You’re the cry baby here, complaining about nudity. 
Objectively, it is art, wether you find it obscene or not is subjective and only depend on your point of view.",1,2022-11-10 13:30:20,<praw.models.comment_forest.CommentForest object at 0x0000022EEDF7C850>,uxyw09,drawing,t5_2qvp9,,False,False,t3_uxyw09,t1_ikgzmui,/r/drawing/comments/uxyw09/asian_beauty/ivtahfg/
126,iwaduqk,HubCitySwami,"Really? You're actively crying over a dormant thread? Seriously? You gotta be kidding me. You actually replied to a months old thread just so you could cry about my opinions?
Ok...I guess.","Really? You're actively crying over a dormant thread? Seriously? You gotta be kidding me. You actually replied to a months old thread just so you could cry about my opinions?
Ok...I guess.",2,2022-11-14 03:54:31,<praw.models.comment_forest.CommentForest object at 0x0000022EEDF7CBB0>,uxyw09,drawing,t5_2qvp9,,False,False,t3_uxyw09,t1_ivtahfg,/r/drawing/comments/uxyw09/asian_beauty/iwaduqk/
127,k0ko7um,AutoModerator,"Thank you for your submission! Want to share your artwork, meet other artists, promote your content, and chat in a relaxed environment? Join our community Discord server here! https://discord.gg/chuunhpqsU


*I am a bot, and this action was performed automatically. Please [contact the moderators of this subreddit](/message/compose/?to=/r/drawing) if you have any questions or concerns.*","Thank you for your submission! Want to share your artwork, meet other artists, promote your content, and chat in a relaxed environment? Join our community Discord server here! https://discord.gg/chuunhpqsU


*I am a bot, and this action was performed automatically. Please [contact the moderators of this subreddit](/message/compose/?to=/r/drawing) if you have any questions or concerns.*",1,2023-09-14 16:53:41,<praw.models.comment_forest.CommentForest object at 0x0000022EEDF843D0>,16injau,drawing,t5_2qvp9,moderator,False,False,t3_16injau,t3_16injau,/r/drawing/comments/16injau/velma_sketch/k0ko7um/
128,k0l09nu,DoppelGirlMula,"i expected a normal picture of Velma, not porn of her...","i expected a normal picture of Velma, not porn of her...",14,2023-09-14 18:03:39,<praw.models.comment_forest.CommentForest object at 0x0000022EEDF844C0>,16injau,drawing,t5_2qvp9,,False,False,t3_16injau,t3_16injau,/r/drawing/comments/16injau/velma_sketch/k0l09nu/
129,k0l1qxs,Eepy-Cheepy,Childhood ruined...,Childhood ruined...,9,2023-09-14 18:12:27,<praw.models.comment_forest.CommentForest object at 0x0000022EEDF84550>,16injau,drawing,t5_2qvp9,,False,False,t3_16injau,t3_16injau,/r/drawing/comments/16injau/velma_sketch/k0l1qxs/
130,k0l8eud,Legal_Win4322,Gross,Gross,7,2023-09-14 18:51:29,<praw.models.comment_forest.CommentForest object at 0x0000022EEDF84610>,16injau,drawing,t5_2qvp9,,False,False,t3_16injau,t3_16injau,/r/drawing/comments/16injau/velma_sketch/k0l8eud/
131,k0lsjga,MosesDozer,I joined drawing because I genuinely like seeing peoples artwork. Since joining tho I’ve pretty much only seen you perverts draw big titty cartoon characters… it’s weird to complain about that but I am,I joined drawing because I genuinely like seeing peoples artwork. Since joining tho I’ve pretty much only seen you perverts draw big titty cartoon characters… it’s weird to complain about that but I am,7,2023-09-14 20:49:35,<praw.models.comment_forest.CommentForest object at 0x0000022EEDF84670>,16injau,drawing,t5_2qvp9,,False,False,t3_16injau,t3_16injau,/r/drawing/comments/16injau/velma_sketch/k0lsjga/
132,k0kz9nj,Echo61089,Zoinks,Zoinks,4,2023-09-14 17:57:48,<praw.models.comment_forest.CommentForest object at 0x0000022EEDF846D0>,16injau,drawing,t5_2qvp9,,False,False,t3_16injau,t3_16injau,/r/drawing/comments/16injau/velma_sketch/k0kz9nj/
133,k0kt4os,Cloud_Station,The only good thing to come out of that (shit)show.,The only good thing to come out of that (shit)show.,1,2023-09-14 17:22:04,<praw.models.comment_forest.CommentForest object at 0x0000022EEDF84730>,16injau,drawing,t5_2qvp9,,False,False,t3_16injau,t3_16injau,/r/drawing/comments/16injau/velma_sketch/k0kt4os/
134,k0l1ox5,sora_1000,Again,Again,1,2023-09-14 18:12:07,<praw.models.comment_forest.CommentForest object at 0x0000022EEDF84790>,16injau,drawing,t5_2qvp9,,False,False,t3_16injau,t3_16injau,/r/drawing/comments/16injau/velma_sketch/k0l1ox5/
135,k0np1dm,Lansalette,"How can you look at a character from your childhood and think Oh, let‘s draw porn of that💀Disgusting man","How can you look at a character from your childhood and think Oh, let‘s draw porn of that💀Disgusting man",1,2023-09-15 05:02:41,<praw.models.comment_forest.CommentForest object at 0x0000022EEDF84850>,16injau,drawing,t5_2qvp9,,False,False,t3_16injau,t3_16injau,/r/drawing/comments/16injau/velma_sketch/k0np1dm/
136,k0ld8ee,FruityGamer,"Same, I didn't think about it being NSFW. I just saw Velma scetch and thought Cool.","Same, I didn't think about it being NSFW. I just saw Velma scetch and thought Cool.",3,2023-09-14 19:19:47,<praw.models.comment_forest.CommentForest object at 0x0000022EEDF845B0>,16injau,drawing,t5_2qvp9,,False,False,t3_16injau,t1_k0l09nu,/r/drawing/comments/16injau/velma_sketch/k0ld8ee/
137,k0kto4h,QuantumPolarBear1337,Ayyy love word play!,Ayyy love word play!,1,2023-09-14 17:25:16,<praw.models.comment_forest.CommentForest object at 0x0000022EEDF847F0>,16injau,drawing,t5_2qvp9,,False,False,t3_16injau,t1_k0kt4os,/r/drawing/comments/16injau/velma_sketch/k0kto4h/
138,k0np4qi,ArtsForever,Lol 😂 what it’s funny besides I grew up with astronomy as my childhood,Lol 😂 what it’s funny besides I grew up with astronomy as my childhood,1,2023-09-15 05:03:39,<praw.models.comment_forest.CommentForest object at 0x0000022EEDF84910>,16injau,drawing,t5_2qvp9,,False,True,t3_16injau,t1_k0np1dm,/r/drawing/comments/16injau/velma_sketch/k0np4qi/
139,iyei1z8,StarsArePrettyCoool,"This is very much meant to be sexual and whatever but there are a lot of anatomy issues you can work on!

The shoulder is way too small, the breasts don't hang like that.  When they're large they don't really perk up like that.  Think of them as sandbags hanging from your neck in a way.  
The waist is extremely thin especially compared to the size of her thighs.  Sketching poses and different body types will help you a lot.","This is very much meant to be sexual and whatever but there are a lot of anatomy issues you can work on!

The shoulder is way too small, the breasts don't hang like that.  When they're large they don't really perk up like that.  Think of them as sandbags hanging from your neck in a way.  
The waist is extremely thin especially compared to the size of her thighs.  Sketching poses and different body types will help you a lot.",30,2022-11-30 20:15:31,<praw.models.comment_forest.CommentForest object at 0x0000022EEDFA1610>,z9070l,drawing,t5_2qvp9,,False,False,t3_z9070l,t3_z9070l,/r/drawing/comments/z9070l/do_you_like_my_thigh_highs_by_me/iyei1z8/
140,iyeepma,A_Soft_Fart,r/mendrawingwomen,r/mendrawingwomen,58,2022-11-30 19:54:02,<praw.models.comment_forest.CommentForest object at 0x0000022EEDFA18E0>,z9070l,drawing,t5_2qvp9,,False,False,t3_z9070l,t3_z9070l,/r/drawing/comments/z9070l/do_you_like_my_thigh_highs_by_me/iyeepma/
141,iyf4gqy,CostAccomplished1163,ngl these OP responses to critique are the most passive aggressive thing I've seen for a while,ngl these OP responses to critique are the most passive aggressive thing I've seen for a while,18,2022-11-30 22:44:23,<praw.models.comment_forest.CommentForest object at 0x0000022EEDFA1A90>,z9070l,drawing,t5_2qvp9,,False,False,t3_z9070l,t3_z9070l,/r/drawing/comments/z9070l/do_you_like_my_thigh_highs_by_me/iyf4gqy/
142,iyebj48,,Too much tits,Too much tits,22,2022-11-30 19:34:02,<praw.models.comment_forest.CommentForest object at 0x0000022EEDFA1CA0>,z9070l,drawing,t5_2qvp9,,False,False,t3_z9070l,t3_z9070l,/r/drawing/comments/z9070l/do_you_like_my_thigh_highs_by_me/iyebj48/
143,iygez9s,No_Security_4460,ugh. you are an artless person,ugh. you are an artless person,8,2022-12-01 04:52:21,<praw.models.comment_forest.CommentForest object at 0x0000022EEDFA1E50>,z9070l,drawing,t5_2qvp9,,False,False,t3_z9070l,t3_z9070l,/r/drawing/comments/z9070l/do_you_like_my_thigh_highs_by_me/iygez9s/
144,iyefbbl,carrot_stickmann,Her tit is bigger than her waist.,Her tit is bigger than her waist.,12,2022-11-30 19:57:52,<praw.models.comment_forest.CommentForest object at 0x0000022EEDFA4100>,z9070l,drawing,t5_2qvp9,,False,False,t3_z9070l,t3_z9070l,/r/drawing/comments/z9070l/do_you_like_my_thigh_highs_by_me/iyefbbl/
145,iyf1tz9,MerpGaming,Nipples do not look like sippy cups my guy,Nipples do not look like sippy cups my guy,10,2022-11-30 22:25:29,<praw.models.comment_forest.CommentForest object at 0x0000022EEDFA4310>,z9070l,drawing,t5_2qvp9,,1669847724.0,False,t3_z9070l,t3_z9070l,/r/drawing/comments/z9070l/do_you_like_my_thigh_highs_by_me/iyf1tz9/
146,iyfvphc,PaleAsFuck90,Small head. Big on top. Small af arms. Small waiste and big on the bottom. Looks like different parts that belongs to different women. Like a Frankenstein's monster.,Small head. Big on top. Small af arms. Small waiste and big on the bottom. Looks like different parts that belongs to different women. Like a Frankenstein's monster.,4,2022-12-01 02:13:08,<praw.models.comment_forest.CommentForest object at 0x0000022EEDFA44C0>,z9070l,drawing,t5_2qvp9,,False,False,t3_z9070l,t3_z9070l,/r/drawing/comments/z9070l/do_you_like_my_thigh_highs_by_me/iyfvphc/
147,iygxhf5,CubieArt,The way you draw folds is good. Anatomy needs a lot of work,The way you draw folds is good. Anatomy needs a lot of work,1,2022-12-01 08:37:07,<praw.models.comment_forest.CommentForest object at 0x0000022EEDFA4760>,z9070l,drawing,t5_2qvp9,,False,False,t3_z9070l,t3_z9070l,/r/drawing/comments/z9070l/do_you_like_my_thigh_highs_by_me/iygxhf5/
148,iyfjl9w,Numerous_Budget_9176,I'm sorry but this is not always true. My ex wife had titties that pointed straight at the ground my ex girlfriend has perky ones that still point straight up at the sky they are both in their forties. Neither one has had plastic surgery.,I'm sorry but this is not always true. My ex wife had titties that pointed straight at the ground my ex girlfriend has perky ones that still point straight up at the sky they are both in their forties. Neither one has had plastic surgery.,4,2022-12-01 00:38:37,<praw.models.comment_forest.CommentForest object at 0x0000022EEDFA1A30>,z9070l,drawing,t5_2qvp9,,False,False,t3_z9070l,t1_iyei1z8,/r/drawing/comments/z9070l/do_you_like_my_thigh_highs_by_me/iyfjl9w/
149,iyf56mk,Supraxskyline,Lolol,Lolol,-2,2022-11-30 22:49:29,<praw.models.comment_forest.CommentForest object at 0x0000022EEDFA1D60>,z9070l,drawing,t5_2qvp9,,False,True,t3_z9070l,t1_iyf4gqy,/r/drawing/comments/z9070l/do_you_like_my_thigh_highs_by_me/iyf56mk/
150,iyecsby,Supraxskyline,They not even big as her head,They not even big as her head,-1,2022-11-30 19:41:46,<praw.models.comment_forest.CommentForest object at 0x0000022EEDFA1F70>,z9070l,drawing,t5_2qvp9,,False,True,t3_z9070l,t1_iyebj48,/r/drawing/comments/z9070l/do_you_like_my_thigh_highs_by_me/iyecsby/
151,iyefeqj,Supraxskyline,Ya,Ya,1,2022-11-30 19:58:28,<praw.models.comment_forest.CommentForest object at 0x0000022EEDFA43D0>,z9070l,drawing,t5_2qvp9,,False,True,t3_z9070l,t1_iyefbbl,/r/drawing/comments/z9070l/do_you_like_my_thigh_highs_by_me/iyefeqj/
152,iyf2snd,Supraxskyline,This is meant to look like the ones from doujinshis,This is meant to look like the ones from doujinshis,3,2022-11-30 22:32:24,<praw.models.comment_forest.CommentForest object at 0x0000022EEDFA45E0>,z9070l,drawing,t5_2qvp9,,False,True,t3_z9070l,t1_iyf1tz9,/r/drawing/comments/z9070l/do_you_like_my_thigh_highs_by_me/iyf2snd/
153,iyfvshb,Supraxskyline,Lol y u mad,Lol y u mad,1,2022-12-01 02:13:47,<praw.models.comment_forest.CommentForest object at 0x0000022EEDFA4940>,z9070l,drawing,t5_2qvp9,,False,True,t3_z9070l,t1_iyfvphc,/r/drawing/comments/z9070l/do_you_like_my_thigh_highs_by_me/iyfvshb/
154,iyhpr7d,Supraxskyline,Thank you,Thank you,2,2022-12-01 14:16:55,<praw.models.comment_forest.CommentForest object at 0x0000022EEDFA4B80>,z9070l,drawing,t5_2qvp9,,False,True,t3_z9070l,t1_iygxhf5,/r/drawing/comments/z9070l/do_you_like_my_thigh_highs_by_me/iyhpr7d/
155,iyfk9oa,StarsArePrettyCoool,"I am someone with large breasts, I know they're not always the same however the way the artist drew them isn't natural and it was obvious he wasn't going for something stylised.  He drew them extremely low down and also drew them extremely massive compared to the body.  Like I do know breasts don't look the same, it just doesn't change the fact that the artist does need to improve on his anatomy to improve on how he draws breasts.","I am someone with large breasts, I know they're not always the same however the way the artist drew them isn't natural and it was obvious he wasn't going for something stylised.  He drew them extremely low down and also drew them extremely massive compared to the body.  Like I do know breasts don't look the same, it just doesn't change the fact that the artist does need to improve on his anatomy to improve on how he draws breasts.",12,2022-12-01 00:43:58,<praw.models.comment_forest.CommentForest object at 0x0000022EEDFA1B50>,z9070l,drawing,t5_2qvp9,,False,False,t3_z9070l,t1_iyfjl9w,/r/drawing/comments/z9070l/do_you_like_my_thigh_highs_by_me/iyfk9oa/
156,iyfv94j,PaleAsFuck90,But is the boobs that are perky this large. Or are they a more modest size?,But is the boobs that are perky this large. Or are they a more modest size?,3,2022-12-01 02:09:35,<praw.models.comment_forest.CommentForest object at 0x0000022EEDFA1C40>,z9070l,drawing,t5_2qvp9,,False,False,t3_z9070l,t1_iyfjl9w,/r/drawing/comments/z9070l/do_you_like_my_thigh_highs_by_me/iyfv94j/
157,iyf59ck,CostAccomplished1163,What did I say,What did I say,4,2022-11-30 22:50:01,<praw.models.comment_forest.CommentForest object at 0x0000022EEDFA1EB0>,z9070l,drawing,t5_2qvp9,,False,False,t3_z9070l,t1_iyf56mk,/r/drawing/comments/z9070l/do_you_like_my_thigh_highs_by_me/iyf59ck/
158,iyedgep,sircrooko,'Not even' 😂,'Not even' 😂,22,2022-11-30 19:46:05,<praw.models.comment_forest.CommentForest object at 0x0000022EEDFA42B0>,z9070l,drawing,t5_2qvp9,,False,False,t3_z9070l,t1_iyecsby,/r/drawing/comments/z9070l/do_you_like_my_thigh_highs_by_me/iyedgep/
159,iyefls4,carrot_stickmann,"Go to life drawing, with an instructor. 4 months of that and you'll see huge improvement","Go to life drawing, with an instructor. 4 months of that and you'll see huge improvement",16,2022-11-30 19:59:46,<praw.models.comment_forest.CommentForest object at 0x0000022EEDFA4520>,z9070l,drawing,t5_2qvp9,,False,False,t3_z9070l,t1_iyefeqj,/r/drawing/comments/z9070l/do_you_like_my_thigh_highs_by_me/iyefls4/
160,iyf3cwn,MerpGaming,I just think it’s important to learn real anatomy before stylizing.,I just think it’s important to learn real anatomy before stylizing.,8,2022-11-30 22:36:24,<praw.models.comment_forest.CommentForest object at 0x0000022EEDFA4820>,z9070l,drawing,t5_2qvp9,,False,False,t3_z9070l,t1_iyf2snd,/r/drawing/comments/z9070l/do_you_like_my_thigh_highs_by_me/iyf3cwn/
161,iyfvy4u,PaleAsFuck90,No you?,No you?,4,2022-12-01 02:15:00,<praw.models.comment_forest.CommentForest object at 0x0000022EEDFA4AC0>,z9070l,drawing,t5_2qvp9,,False,False,t3_z9070l,t1_iyfvshb,/r/drawing/comments/z9070l/do_you_like_my_thigh_highs_by_me/iyfvy4u/
162,iyfw15a,PaleAsFuck90,"Do i sound mad?

Just making an observation.","Do i sound mad?

Just making an observation.",4,2022-12-01 02:15:40,<praw.models.comment_forest.CommentForest object at 0x0000022EEDFA4B20>,z9070l,drawing,t5_2qvp9,,False,False,t3_z9070l,t1_iyfvshb,/r/drawing/comments/z9070l/do_you_like_my_thigh_highs_by_me/iyfw15a/
163,iyf5knj,Supraxskyline,"You looking in too much to my response lol, my response is only a response. nothing more","You looking in too much to my response lol, my response is only a response. nothing more",0,2022-11-30 22:52:13,<praw.models.comment_forest.CommentForest object at 0x0000022EEDFA40A0>,z9070l,drawing,t5_2qvp9,,False,True,t3_z9070l,t1_iyf59ck,/r/drawing/comments/z9070l/do_you_like_my_thigh_highs_by_me/iyf5knj/
164,iyejohp,Supraxskyline,I see,I see,2,2022-11-30 20:25:52,<praw.models.comment_forest.CommentForest object at 0x0000022EEDFA46D0>,z9070l,drawing,t5_2qvp9,,False,True,t3_z9070l,t1_iyefls4,/r/drawing/comments/z9070l/do_you_like_my_thigh_highs_by_me/iyejohp/
