,ID,Author,body,Comment,Score,Created On,Replies,Submission,Subreddit,Subreddit_ID,Distinguished,Edited,Is_submitter,link_id,Parent_id,Permalink
211,k1jh5bo,Toddryck,"I see what you mean about the arm, but with all due respect, I believe you can never really stop learning whatever skill you’re practicing, so we’re all going to remain in the “learning stage” no matter how much we improve.","I see what you mean about the arm, but with all due respect, I believe you can never really stop learning whatever skill you’re practicing, so we’re all going to remain in the “learning stage” no matter how much we improve.",1,2023-09-21 09:22:37,<praw.models.comment_forest.CommentForest object at 0x0000022EEDFC1610>,169h6jn,drawing,t5_2qvp9,,False,True,t3_169h6jn,t1_k1jcgpg,/r/drawing/comments/169h6jn/very_new_to_drawing_anything_like_this_tell_me/k1jh5bo/
212,jz2aqkl,Toddryck,"Alright, cheers!","Alright, cheers!",1,2023-09-04 07:07:34,<praw.models.comment_forest.CommentForest object at 0x0000022EEDFC1910>,169h6jn,drawing,t5_2qvp9,,False,True,t3_169h6jn,t1_jz2aip7,/r/drawing/comments/169h6jn/very_new_to_drawing_anything_like_this_tell_me/jz2aqkl/
213,jz1xr7e,Neat-Championship447,"That sounds good. Curious, though, why a hermaphrodite as your first nude?","That sounds good. Curious, though, why a hermaphrodite as your first nude?",1,2023-09-04 04:57:18,<praw.models.comment_forest.CommentForest object at 0x0000022EEDFBFDF0>,169h6jn,drawing,t5_2qvp9,,False,False,t3_169h6jn,t1_jz1xh36,/r/drawing/comments/169h6jn/very_new_to_drawing_anything_like_this_tell_me/jz1xr7e/
214,jz3dhpu,TG-Winter_crow56,"Aight, you win I guess. 🤷‍♂️","Aight, you win I guess. 🤷‍♂️",2,2023-09-04 13:37:33,<praw.models.comment_forest.CommentForest object at 0x0000022EEDFC1130>,169h6jn,drawing,t5_2qvp9,,False,False,t3_169h6jn,t1_jz26ask,/r/drawing/comments/169h6jn/very_new_to_drawing_anything_like_this_tell_me/jz3dhpu/
215,jz28ooa,amogus547,Why are people downvoting this 😕,Why are people downvoting this 😕,5,2023-09-04 06:45:37,<praw.models.comment_forest.CommentForest object at 0x0000022EEDFC1190>,169h6jn,drawing,t5_2qvp9,,False,False,t3_169h6jn,t1_jz26ask,/r/drawing/comments/169h6jn/very_new_to_drawing_anything_like_this_tell_me/jz28ooa/
216,k1jhfjp,alienmonkei,"That makes sense, I understand.

My apologies if I’m wrong; my suspicion was that you’re in the early stages of learning how to draw, at least that’s what I was trying to imply.

I only say this because I was the same when I first started drawing, obsessed with detail detail detail….when really my time should be spent elsewhere else","That makes sense, I understand.

My apologies if I’m wrong; my suspicion was that you’re in the early stages of learning how to draw, at least that’s what I was trying to imply.

I only say this because I was the same when I first started drawing, obsessed with detail detail detail….when really my time should be spent elsewhere else",1,2023-09-21 09:26:26,<praw.models.comment_forest.CommentForest object at 0x0000022EEDFC16D0>,169h6jn,drawing,t5_2qvp9,,False,False,t3_169h6jn,t1_k1jh5bo,/r/drawing/comments/169h6jn/very_new_to_drawing_anything_like_this_tell_me/k1jhfjp/
217,jz1xwqi,Toddryck,"Not sure that’s the term I’d use as it’s seen as offensive by some, but I’m not sure, honestly. It just sort of happened.","Not sure that’s the term I’d use as it’s seen as offensive by some, but I’m not sure, honestly. It just sort of happened.",0,2023-09-04 04:58:45,<praw.models.comment_forest.CommentForest object at 0x0000022EEDFBFEB0>,169h6jn,drawing,t5_2qvp9,,False,True,t3_169h6jn,t1_jz1xr7e,/r/drawing/comments/169h6jn/very_new_to_drawing_anything_like_this_tell_me/jz1xwqi/
218,jz28v2q,Toddryck,"I had no idea they were, tbh. They’re probably just transphobic or ignorant.","I had no idea they were, tbh. They’re probably just transphobic or ignorant.",3,2023-09-04 06:47:29,<praw.models.comment_forest.CommentForest object at 0x0000022EEDFC1250>,169h6jn,drawing,t5_2qvp9,,False,True,t3_169h6jn,t1_jz28ooa,/r/drawing/comments/169h6jn/very_new_to_drawing_anything_like_this_tell_me/jz28v2q/
219,jz50brc,MrBelgium2019,Because it is a lie,Because it is a lie,0,2023-09-04 20:01:41,<praw.models.comment_forest.CommentForest object at 0x0000022EEDFC12B0>,169h6jn,drawing,t5_2qvp9,,False,False,t3_169h6jn,t1_jz28ooa,/r/drawing/comments/169h6jn/very_new_to_drawing_anything_like_this_tell_me/jz50brc/
220,k1jiznw,Toddryck,"I have a knack for not leaving a drawing alone when I should, so I suppose there’s that, but I’m not sure I’d call myself a beginner. I’ve been drawing for a couple decades now.","I have a knack for not leaving a drawing alone when I should, so I suppose there’s that, but I’m not sure I’d call myself a beginner. I’ve been drawing for a couple decades now.",1,2023-09-21 09:46:43,<praw.models.comment_forest.CommentForest object at 0x0000022EEDFC1790>,169h6jn,drawing,t5_2qvp9,,False,True,t3_169h6jn,t1_k1jhfjp,/r/drawing/comments/169h6jn/very_new_to_drawing_anything_like_this_tell_me/k1jiznw/
221,jz1y5qi,Neat-Championship447,"Oh, sorry if it seemed rude. I couldn't think of a better way to say it without it bring winded. Trans perhaps might work? Frankly, I am not used to conversing about things like that.","Oh, sorry if it seemed rude. I couldn't think of a better way to say it without it bring winded. Trans perhaps might work? Frankly, I am not used to conversing about things like that.",2,2023-09-04 05:01:05,<praw.models.comment_forest.CommentForest object at 0x0000022EEDFBFF70>,169h6jn,drawing,t5_2qvp9,,False,False,t3_169h6jn,t1_jz1xwqi,/r/drawing/comments/169h6jn/very_new_to_drawing_anything_like_this_tell_me/jz1y5qi/
222,jz1y8h9,Toddryck,"That’s okay! I wasn’t telling you off, lol.","That’s okay! I wasn’t telling you off, lol.",0,2023-09-04 05:01:49,<praw.models.comment_forest.CommentForest object at 0x0000022EEDFC1070>,169h6jn,drawing,t5_2qvp9,,False,True,t3_169h6jn,t1_jz1y5qi,/r/drawing/comments/169h6jn/very_new_to_drawing_anything_like_this_tell_me/jz1y8h9/
223,idpjb9p,xMrDeex,am sure angels dont reproduce lol,am sure angels dont reproduce lol,16,2022-06-25 17:27:05,<praw.models.comment_forest.CommentForest object at 0x0000022EEDFC6100>,vkjj4s,drawing,t5_2qvp9,,False,False,t3_vkjj4s,t3_vkjj4s,/r/drawing/comments/vkjj4s/a_sketch_of_my_depiction_of_a_biblically_accurate/idpjb9p/
224,ih92dcs,FoeleeToast,I don’t think this is accurate man sorry,I don’t think this is accurate man sorry,5,2022-07-22 22:44:29,<praw.models.comment_forest.CommentForest object at 0x0000022EEDFC6220>,vkjj4s,drawing,t5_2qvp9,,False,False,t3_vkjj4s,t3_vkjj4s,/r/drawing/comments/vkjj4s/a_sketch_of_my_depiction_of_a_biblically_accurate/ih92dcs/
225,idpjzes,Lf4M9,i am sure they have 15 foot horse cock,i am sure they have 15 foot horse cock,16,2022-06-25 17:32:07,<praw.models.comment_forest.CommentForest object at 0x0000022EEDFC62B0>,vkjj4s,drawing,t5_2qvp9,,False,False,t3_vkjj4s,t1_idpjb9p,/r/drawing/comments/vkjj4s/a_sketch_of_my_depiction_of_a_biblically_accurate/idpjzes/
226,idpvco2,blueboybubbles,yep,yep,-3,2022-06-25 18:58:50,<praw.models.comment_forest.CommentForest object at 0x0000022EEDFC6310>,vkjj4s,drawing,t5_2qvp9,,False,True,t3_vkjj4s,t1_idpjb9p,/r/drawing/comments/vkjj4s/a_sketch_of_my_depiction_of_a_biblically_accurate/idpvco2/
227,ipvrx7q,blueboybubbles,Idc,Idc,2,2022-09-25 20:02:38,<praw.models.comment_forest.CommentForest object at 0x0000022EEDFC6430>,vkjj4s,drawing,t5_2qvp9,,False,True,t3_vkjj4s,t1_ih92dcs,/r/drawing/comments/vkjj4s/a_sketch_of_my_depiction_of_a_biblically_accurate/ipvrx7q/
228,idpvdpw,blueboybubbles,yep,yep,-4,2022-06-25 18:59:04,<praw.models.comment_forest.CommentForest object at 0x0000022EEDFC6370>,vkjj4s,drawing,t5_2qvp9,,False,True,t3_vkjj4s,t1_idpjzes,/r/drawing/comments/vkjj4s/a_sketch_of_my_depiction_of_a_biblically_accurate/idpvdpw/
229,iawkqxq,chumplifecarlito,"This guy is a troll. He is 12, 13 or 15 depending on which post he posts his plagiarized art to 😂","This guy is a troll. He is 12, 13 or 15 depending on which post he posts his plagiarized art to 😂",32,2022-06-02 12:30:03,<praw.models.comment_forest.CommentForest object at 0x0000022EEE011970>,v32hmi,drawing,t5_2qvp9,,False,False,t3_v32hmi,t3_v32hmi,/r/drawing/comments/v32hmi/all_my_marvel_drawingkeep_in_mind_im_less_than_15/iawkqxq/
230,iawo7wt,anadart,"Ok I won't say tracing is the worst thing to do. If you do it to learn and get better then go ahead, but where I draw the line is when you don't make the artwork your own after that. Trace is ok if you want exact proportions, fine. But after that you need to put in your style, make the art stand out, make it unique and different. If you even copy the art style and colors too, then it isn't a unique drawing. 

You say you are less than 15, cool, you have much time to learn and get better. These are good as a new artist's fanart but you would need to make them in your own style if you are to progress. And yes less of trace too as you progress.

Not hating on your efforts just encouraging you to make art your own.","Ok I won't say tracing is the worst thing to do. If you do it to learn and get better then go ahead, but where I draw the line is when you don't make the artwork your own after that. Trace is ok if you want exact proportions, fine. But after that you need to put in your style, make the art stand out, make it unique and different. If you even copy the art style and colors too, then it isn't a unique drawing. 

You say you are less than 15, cool, you have much time to learn and get better. These are good as a new artist's fanart but you would need to make them in your own style if you are to progress. And yes less of trace too as you progress.

Not hating on your efforts just encouraging you to make art your own.",15,2022-06-02 13:01:22,<praw.models.comment_forest.CommentForest object at 0x0000022EEE011C40>,v32hmi,drawing,t5_2qvp9,,False,False,t3_v32hmi,t3_v32hmi,/r/drawing/comments/v32hmi/all_my_marvel_drawingkeep_in_mind_im_less_than_15/iawo7wt/
231,iavtsn4,cheez-it-consumer71,these look traced,these look traced,29,2022-06-02 06:32:45,<praw.models.comment_forest.CommentForest object at 0x0000022EEE011F40>,v32hmi,drawing,t5_2qvp9,,False,False,t3_v32hmi,t3_v32hmi,/r/drawing/comments/v32hmi/all_my_marvel_drawingkeep_in_mind_im_less_than_15/iavtsn4/
232,iawc2o6,SnooCompliments5439,It’s traced and has low resolution. looks kindo shit imo. (Keep in mind i couldn’t care less about your age) Why even include your age? ez upvotes? these tracings aren’t original or impressive.,It’s traced and has low resolution. looks kindo shit imo. (Keep in mind i couldn’t care less about your age) Why even include your age? ez upvotes? these tracings aren’t original or impressive.,20,2022-06-02 10:57:21,<praw.models.comment_forest.CommentForest object at 0x0000022EEE013070>,v32hmi,drawing,t5_2qvp9,,False,False,t3_v32hmi,t3_v32hmi,/r/drawing/comments/v32hmi/all_my_marvel_drawingkeep_in_mind_im_less_than_15/iawc2o6/
233,iax9dbe,styrofoam_bby,Traced + ur 12 get off of Reddit,Traced + ur 12 get off of Reddit,9,2022-06-02 15:43:38,<praw.models.comment_forest.CommentForest object at 0x0000022EEE0133A0>,v32hmi,drawing,t5_2qvp9,,False,False,t3_v32hmi,t3_v32hmi,/r/drawing/comments/v32hmi/all_my_marvel_drawingkeep_in_mind_im_less_than_15/iax9dbe/
234,ih0sbq5,ShortAttitude7102,Is this traced or not,Is this traced or not,6,2022-07-21 07:15:58,<praw.models.comment_forest.CommentForest object at 0x0000022EEE0151C0>,v32hmi,drawing,t5_2qvp9,,False,False,t3_v32hmi,t3_v32hmi,/r/drawing/comments/v32hmi/all_my_marvel_drawingkeep_in_mind_im_less_than_15/ih0sbq5/
235,ib9ycv3,noahhdrums,bro stop tracing,bro stop tracing,4,2022-06-05 18:03:03,<praw.models.comment_forest.CommentForest object at 0x0000022EEE015520>,v32hmi,drawing,t5_2qvp9,,False,False,t3_v32hmi,t3_v32hmi,/r/drawing/comments/v32hmi/all_my_marvel_drawingkeep_in_mind_im_less_than_15/ib9ycv3/
236,ibmkt4f,Ok-Attempt-5201,it is completely fine to trace to learn. just dont post your stuff like you did it from scratch.,it is completely fine to trace to learn. just dont post your stuff like you did it from scratch.,4,2022-06-08 16:41:38,<praw.models.comment_forest.CommentForest object at 0x0000022EEE015820>,v32hmi,drawing,t5_2qvp9,,False,False,t3_v32hmi,t3_v32hmi,/r/drawing/comments/v32hmi/all_my_marvel_drawingkeep_in_mind_im_less_than_15/ibmkt4f/
237,iavx0nt,Clotz12,"Really well done, mate. Keep it up!","Really well done, mate. Keep it up!",5,2022-06-02 07:18:04,<praw.models.comment_forest.CommentForest object at 0x0000022EEE015A60>,v32hmi,drawing,t5_2qvp9,,False,False,t3_v32hmi,t3_v32hmi,/r/drawing/comments/v32hmi/all_my_marvel_drawingkeep_in_mind_im_less_than_15/iavx0nt/
238,iax4zrw,art_management,Looks traced my guy,Looks traced my guy,2,2022-06-02 15:12:24,<praw.models.comment_forest.CommentForest object at 0x0000022EEE015B20>,v32hmi,drawing,t5_2qvp9,,False,False,t3_v32hmi,t3_v32hmi,/r/drawing/comments/v32hmi/all_my_marvel_drawingkeep_in_mind_im_less_than_15/iax4zrw/
239,iaxhnx3,fivekatz,No,No,2,2022-06-02 16:42:33,<praw.models.comment_forest.CommentForest object at 0x0000022EEE015CA0>,v32hmi,drawing,t5_2qvp9,,False,False,t3_v32hmi,t3_v32hmi,/r/drawing/comments/v32hmi/all_my_marvel_drawingkeep_in_mind_im_less_than_15/iaxhnx3/
240,iax6mdl,chumplifecarlito,"Why would you spend a ""ton of time"" on the proportions when you just traced? Cringe","Why would you spend a ""ton of time"" on the proportions when you just traced? Cringe",3,2022-06-02 15:23:55,<praw.models.comment_forest.CommentForest object at 0x0000022EEE015D60>,v32hmi,drawing,t5_2qvp9,,False,False,t3_v32hmi,t3_v32hmi,/r/drawing/comments/v32hmi/all_my_marvel_drawingkeep_in_mind_im_less_than_15/iax6mdl/
241,iavtqkw,Brettinabox,These are really good. I would like to know how you create them to see if you are making good habits 🤔,These are really good. I would like to know how you create them to see if you are making good habits 🤔,2,2022-06-02 06:31:55,<praw.models.comment_forest.CommentForest object at 0x0000022EEE015E20>,v32hmi,drawing,t5_2qvp9,,False,False,t3_v32hmi,t3_v32hmi,/r/drawing/comments/v32hmi/all_my_marvel_drawingkeep_in_mind_im_less_than_15/iavtqkw/
242,iax6gmd,chumplifecarlito,Either way you suck. Tracing and pretending you drew something is cringe. Its not even a good trace LMAO,Either way you suck. Tracing and pretending you drew something is cringe. Its not even a good trace LMAO,2,2022-06-02 15:22:46,<praw.models.comment_forest.CommentForest object at 0x0000022EEE015EE0>,v32hmi,drawing,t5_2qvp9,,False,False,t3_v32hmi,t3_v32hmi,/r/drawing/comments/v32hmi/all_my_marvel_drawingkeep_in_mind_im_less_than_15/iax6gmd/
243,iavu22v,BROShawnBoyWithUke,SHOUT OUT!!!!! each drawing took OVER a week to make.,SHOUT OUT!!!!! each drawing took OVER a week to make.,-1,2022-06-02 06:36:24,<praw.models.comment_forest.CommentForest object at 0x0000022EEE0182E0>,v32hmi,drawing,t5_2qvp9,,False,True,t3_v32hmi,t3_v32hmi,/r/drawing/comments/v32hmi/all_my_marvel_drawingkeep_in_mind_im_less_than_15/iavu22v/
244,iax3ob8,BROShawnBoyWithUke,"idiot is said less then 15 on this post and on the boy with uke post there was a clear typo!!

I AM 13!!!!!!!!!!!!!!!","idiot is said less then 15 on this post and on the boy with uke post there was a clear typo!!

I AM 13!!!!!!!!!!!!!!!",2,2022-06-02 15:02:44,<praw.models.comment_forest.CommentForest object at 0x0000022EEE011CA0>,v32hmi,drawing,t5_2qvp9,,False,True,t3_v32hmi,t1_iawkqxq,/r/drawing/comments/v32hmi/all_my_marvel_drawingkeep_in_mind_im_less_than_15/iax3ob8/
245,iaw1z75,NewAccount971,"They are very obviously traced and eyedroppered with the correct colors.

Good learning tool but it's a bad look to claim obvious tracing isn't tracing.","They are very obviously traced and eyedroppered with the correct colors.

Good learning tool but it's a bad look to claim obvious tracing isn't tracing.",24,2022-06-02 08:32:32,<praw.models.comment_forest.CommentForest object at 0x0000022EEE0130D0>,v32hmi,drawing,t5_2qvp9,,False,False,t3_v32hmi,t1_iavtsn4,/r/drawing/comments/v32hmi/all_my_marvel_drawingkeep_in_mind_im_less_than_15/iaw1z75/
246,iavud4z,BROShawnBoyWithUke,"this is a drawing so why wouldnt mine be:

https://www.reddit.com/r/drawing/comments/v2eq6e/finally\_finished\_my\_moon\_knight\_drawing\_im\_a\_bit/","this is a drawing so why wouldnt mine be:

https://www.reddit.com/r/drawing/comments/v2eq6e/finally\_finished\_my\_moon\_knight\_drawing\_im\_a\_bit/",0,2022-06-02 06:40:45,<praw.models.comment_forest.CommentForest object at 0x0000022EEE013190>,v32hmi,drawing,t5_2qvp9,,False,True,t3_v32hmi,t1_iavtsn4,/r/drawing/comments/v32hmi/all_my_marvel_drawingkeep_in_mind_im_less_than_15/iavud4z/
247,iavtv6l,BROShawnBoyWithUke,then let them look that way(there just good drawings),then let them look that way(there just good drawings),-8,2022-06-02 06:33:43,<praw.models.comment_forest.CommentForest object at 0x0000022EEE013280>,v32hmi,drawing,t5_2qvp9,,False,True,t3_v32hmi,t1_iavtsn4,/r/drawing/comments/v32hmi/all_my_marvel_drawingkeep_in_mind_im_less_than_15/iavtv6l/
248,iawrk06,Ass-Flower,I fully agree,I fully agree,8,2022-06-02 13:29:21,<praw.models.comment_forest.CommentForest object at 0x0000022EEE0138E0>,v32hmi,drawing,t5_2qvp9,,False,False,t3_v32hmi,t1_iawc2o6,/r/drawing/comments/v32hmi/all_my_marvel_drawingkeep_in_mind_im_less_than_15/iawrk06/
249,iax45hg,BROShawnBoyWithUke,"is my art too good for you or what!

if its drawn well the its acused of tracing! All you critisizers are idiots","is my art too good for you or what!

if its drawn well the its acused of tracing! All you critisizers are idiots",-4,2022-06-02 15:06:16,<praw.models.comment_forest.CommentForest object at 0x0000022EEE013E80>,v32hmi,drawing,t5_2qvp9,,False,True,t3_v32hmi,t1_iawc2o6,/r/drawing/comments/v32hmi/all_my_marvel_drawingkeep_in_mind_im_less_than_15/iax45hg/
250,iax4c1s,,[removed],[removed],-4,2022-06-02 15:07:36,<praw.models.comment_forest.CommentForest object at 0x0000022EEE015040>,v32hmi,drawing,t5_2qvp9,,False,False,t3_v32hmi,t1_iawc2o6,/r/drawing/comments/v32hmi/all_my_marvel_drawingkeep_in_mind_im_less_than_15/iax4c1s/
251,iaweb9z,CatoftheNile,"Hey stop being angry at art, even if it was traced, it's still great art","Hey stop being angry at art, even if it was traced, it's still great art",-7,2022-06-02 11:23:27,<praw.models.comment_forest.CommentForest object at 0x0000022EEE015100>,v32hmi,drawing,t5_2qvp9,,False,False,t3_v32hmi,t1_iawc2o6,/r/drawing/comments/v32hmi/all_my_marvel_drawingkeep_in_mind_im_less_than_15/iaweb9z/
252,iax9hf8,BROShawnBoyWithUke,im not 12 im 13 that was a typo in the heading,im not 12 im 13 that was a typo in the heading,2,2022-06-02 15:44:26,<praw.models.comment_forest.CommentForest object at 0x0000022EEE015340>,v32hmi,drawing,t5_2qvp9,,False,True,t3_v32hmi,t1_iax9dbe,/r/drawing/comments/v32hmi/all_my_marvel_drawingkeep_in_mind_im_less_than_15/iax9hf8/
253,iax9j82,BROShawnBoyWithUke,i posted comparisons with my references goo see them,i posted comparisons with my references goo see them,2,2022-06-02 15:44:48,<praw.models.comment_forest.CommentForest object at 0x0000022EEE015460>,v32hmi,drawing,t5_2qvp9,,False,True,t3_v32hmi,t1_iax9dbe,/r/drawing/comments/v32hmi/all_my_marvel_drawingkeep_in_mind_im_less_than_15/iax9j82/
254,ih0sesd,BROShawnBoyWithUke,"to be honest

my older brother drew these a while ago and i wanted to look cool so i copied his art

(traced his art)","to be honest

my older brother drew these a while ago and i wanted to look cool so i copied his art

(traced his art)",4,2022-07-21 07:17:04,<praw.models.comment_forest.CommentForest object at 0x0000022EEE0155E0>,v32hmi,drawing,t5_2qvp9,,False,True,t3_v32hmi,t1_ih0sbq5,/r/drawing/comments/v32hmi/all_my_marvel_drawingkeep_in_mind_im_less_than_15/ih0sesd/
255,ih0shr2,BROShawnBoyWithUke,i was lying for 1 month to make people believe this art but i got caught by my brother and i confessed,i was lying for 1 month to make people believe this art but i got caught by my brother and i confessed,1,2022-07-21 07:18:07,<praw.models.comment_forest.CommentForest object at 0x0000022EEE0156A0>,v32hmi,drawing,t5_2qvp9,,False,True,t3_v32hmi,t1_ih0sbq5,/r/drawing/comments/v32hmi/all_my_marvel_drawingkeep_in_mind_im_less_than_15/ih0shr2/
256,ibc2fjl,BROShawnBoyWithUke,i dont trace i sent a drawing of deadpool in spider man pose and there was no eye dropping colors or anything just me,i dont trace i sent a drawing of deadpool in spider man pose and there was no eye dropping colors or anything just me,0,2022-06-06 05:06:49,<praw.models.comment_forest.CommentForest object at 0x0000022EEE0159A0>,v32hmi,drawing,t5_2qvp9,,False,True,t3_v32hmi,t1_ib9ycv3,/r/drawing/comments/v32hmi/all_my_marvel_drawingkeep_in_mind_im_less_than_15/ibc2fjl/
257,iavyrek,BROShawnBoyWithUke,thanks alot,thanks alot,0,2022-06-02 07:43:23,<praw.models.comment_forest.CommentForest object at 0x0000022EEE015C40>,v32hmi,drawing,t5_2qvp9,,False,True,t3_v32hmi,t1_iavx0nt,/r/drawing/comments/v32hmi/all_my_marvel_drawingkeep_in_mind_im_less_than_15/iavyrek/
258,iax56u2,BROShawnBoyWithUke,it looks traced cause its good huh?,it looks traced cause its good huh?,1,2022-06-02 15:13:48,<praw.models.comment_forest.CommentForest object at 0x0000022EEE015D00>,v32hmi,drawing,t5_2qvp9,,False,True,t3_v32hmi,t1_iax4zrw,/r/drawing/comments/v32hmi/all_my_marvel_drawingkeep_in_mind_im_less_than_15/iax56u2/
259,ib01tsa,BROShawnBoyWithUke,what no,what no,2,2022-06-03 04:31:44,<praw.models.comment_forest.CommentForest object at 0x0000022EEE015DC0>,v32hmi,drawing,t5_2qvp9,,False,True,t3_v32hmi,t1_iaxhnx3,/r/drawing/comments/v32hmi/all_my_marvel_drawingkeep_in_mind_im_less_than_15/ib01tsa/
260,iax6qwi,,[removed],[removed],2,2022-06-02 15:24:49,<praw.models.comment_forest.CommentForest object at 0x0000022EEE015E80>,v32hmi,drawing,t5_2qvp9,,False,False,t3_v32hmi,t1_iax6mdl,/r/drawing/comments/v32hmi/all_my_marvel_drawingkeep_in_mind_im_less_than_15/iax6qwi/
261,iawcdt0,SnooCompliments5439,He just traces them with a picture it’s quite easy to do.,He just traces them with a picture it’s quite easy to do.,6,2022-06-02 11:01:05,<praw.models.comment_forest.CommentForest object at 0x0000022EEE015FA0>,v32hmi,drawing,t5_2qvp9,,False,False,t3_v32hmi,t1_iavtqkw,/r/drawing/comments/v32hmi/all_my_marvel_drawingkeep_in_mind_im_less_than_15/iawcdt0/
262,iavttfj,BROShawnBoyWithUke,i use the pre installed app paint 3d on my laptop,i use the pre installed app paint 3d on my laptop,2,2022-06-02 06:33:02,<praw.models.comment_forest.CommentForest object at 0x0000022EEE0180A0>,v32hmi,drawing,t5_2qvp9,,False,True,t3_v32hmi,t1_iavtqkw,/r/drawing/comments/v32hmi/all_my_marvel_drawingkeep_in_mind_im_less_than_15/iavttfj/
263,iax6vbt,BROShawnBoyWithUke,why dont you try to trace it while i drew it from scratch,why dont you try to trace it while i drew it from scratch,2,2022-06-02 15:25:41,<praw.models.comment_forest.CommentForest object at 0x0000022EEE0183A0>,v32hmi,drawing,t5_2qvp9,,False,True,t3_v32hmi,t1_iax6gmd,/r/drawing/comments/v32hmi/all_my_marvel_drawingkeep_in_mind_im_less_than_15/iax6vbt/
264,iawcjau,SnooCompliments5439,“NO WAY DUDE EPIC 15 YEAR OLD TRACES IMAGES AND IT TOOK HIM OVER A WEEK SHOUT OUT 🚨 🚨 🚨 “,“NO WAY DUDE EPIC 15 YEAR OLD TRACES IMAGES AND IT TOOK HIM OVER A WEEK SHOUT OUT 🚨 🚨 🚨 “,13,2022-06-02 11:02:48,<praw.models.comment_forest.CommentForest object at 0x0000022EEE0185E0>,v32hmi,drawing,t5_2qvp9,,False,False,t3_v32hmi,t1_iavu22v,/r/drawing/comments/v32hmi/all_my_marvel_drawingkeep_in_mind_im_less_than_15/iawcjau/
265,iavylvr,GethAttack,You chose a picture that was traced as a defense for yours being traced?,You chose a picture that was traced as a defense for yours being traced?,19,2022-06-02 07:41:13,<praw.models.comment_forest.CommentForest object at 0x0000022EEE0132E0>,v32hmi,drawing,t5_2qvp9,,False,False,t3_v32hmi,t1_iavud4z,/r/drawing/comments/v32hmi/all_my_marvel_drawingkeep_in_mind_im_less_than_15/iavylvr/
266,iavwtd7,King-Bomber-Kill,"You know when people tell you it is traced without sending the link of the drawing in question just ignore them. They are only jealous of your skill. Still I looked over the internet some of the poses you used are heavily used I don’t think you copy an image. Thus, there is no reason to criticize you. On the other hand, in order to avoid those kind of comment, I suggest you to put the image where the character takes that positions and mention it in the comment as a reference. So that no one can argue you copy it.","You know when people tell you it is traced without sending the link of the drawing in question just ignore them. They are only jealous of your skill. Still I looked over the internet some of the poses you used are heavily used I don’t think you copy an image. Thus, there is no reason to criticize you. On the other hand, in order to avoid those kind of comment, I suggest you to put the image where the character takes that positions and mention it in the comment as a reference. So that no one can argue you copy it.",-5,2022-06-02 07:15:07,<praw.models.comment_forest.CommentForest object at 0x0000022EEE0134F0>,v32hmi,drawing,t5_2qvp9,,False,False,t3_v32hmi,t1_iavtv6l,/r/drawing/comments/v32hmi/all_my_marvel_drawingkeep_in_mind_im_less_than_15/iavwtd7/
267,iaxbul0,SnooCompliments5439,"No it’s not good, pretty sure i pointed that out.","No it’s not good, pretty sure i pointed that out.",12,2022-06-02 16:01:21,<praw.models.comment_forest.CommentForest object at 0x0000022EEE0150A0>,v32hmi,drawing,t5_2qvp9,,False,False,t3_v32hmi,t1_iax45hg,/r/drawing/comments/v32hmi/all_my_marvel_drawingkeep_in_mind_im_less_than_15/iaxbul0/
