,ID,Author,body,Comment,Score,Created On,Replies,Submission,Subreddit,Subreddit_ID,Distinguished,Edited,Is_submitter,link_id,Parent_id,Permalink
381,j0xvsce,iBluefoot,"There is lots of great advice suggesting drawing from a reference. I suggest you draw from life, photos, and even copy well drawn pictures by other artists. DaVinci has some great toddler sketches you can copy. I think copying would be a good place for you to start based on where you are at. Sometimes we need to see an effective rendering to know how to translate life to a page.","There is lots of great advice suggesting drawing from a reference. I suggest you draw from life, photos, and even copy well drawn pictures by other artists. DaVinci has some great toddler sketches you can copy. I think copying would be a good place for you to start based on where you are at. Sometimes we need to see an effective rendering to know how to translate life to a page.",1,2022-12-20 05:34:57,<praw.models.comment_forest.CommentForest object at 0x0000022EEE05B100>,zpui9x,drawing,t5_2qvp9,,False,False,t3_zpui9x,t3_zpui9x,/r/drawing/comments/zpui9x/tried_drawing_a_toddler_for_first_time_are_the/j0xvsce/
382,j0xwui5,clevelandexile,"It’s the pose, toddlers are flat footed and take short steps, your drawing looks like he is on tippy toes which is rare. Toddlers also have stout torsos and struggle with balance. They usually keep their hands close to their bodies as a result. Yours has his outstretched as if dancing gracefully, unusual for toddler. Finally because their motor skills are still in the early stage of development most toddlers don’t move their heads too much and rarely look up as in your drawing. A typical toddler pose would be looking straight ahead or down, focused on something.

Your character is posed like a 6 or 8 year old child moving gracefully. One thing toddlers ain’t is graceful.","It’s the pose, toddlers are flat footed and take short steps, your drawing looks like he is on tippy toes which is rare. Toddlers also have stout torsos and struggle with balance. They usually keep their hands close to their bodies as a result. Yours has his outstretched as if dancing gracefully, unusual for toddler. Finally because their motor skills are still in the early stage of development most toddlers don’t move their heads too much and rarely look up as in your drawing. A typical toddler pose would be looking straight ahead or down, focused on something.

Your character is posed like a 6 or 8 year old child moving gracefully. One thing toddlers ain’t is graceful.",1,2022-12-20 05:46:23,<praw.models.comment_forest.CommentForest object at 0x0000022EEE05B160>,zpui9x,drawing,t5_2qvp9,,False,False,t3_zpui9x,t3_zpui9x,/r/drawing/comments/zpui9x/tried_drawing_a_toddler_for_first_time_are_the/j0xwui5/
383,j0y2b99,Harizzium,It’s like a prototype of Mark Zuckerberg before technology allowed a fully working adult,It’s like a prototype of Mark Zuckerberg before technology allowed a fully working adult,1,2022-12-20 06:49:29,<praw.models.comment_forest.CommentForest object at 0x0000022EEE05B1C0>,zpui9x,drawing,t5_2qvp9,,False,False,t3_zpui9x,t3_zpui9x,/r/drawing/comments/zpui9x/tried_drawing_a_toddler_for_first_time_are_the/j0y2b99/
384,j0y5jqb,instrumentality45,"I think the problem is that toddlers are rounder (think of a fatter pudgier build) and have slightly larger heads. This is true for newborns, infants, and babies in general","I think the problem is that toddlers are rounder (think of a fatter pudgier build) and have slightly larger heads. This is true for newborns, infants, and babies in general",1,2022-12-20 07:30:22,<praw.models.comment_forest.CommentForest object at 0x0000022EEE05B220>,zpui9x,drawing,t5_2qvp9,,False,False,t3_zpui9x,t3_zpui9x,/r/drawing/comments/zpui9x/tried_drawing_a_toddler_for_first_time_are_the/j0y5jqb/
385,jibilca,Glass-Drummer-7997,Looks like Karl from Mr. Beast team 😂,Looks like Karl from Mr. Beast team 😂,1,2023-04-30 16:08:14,<praw.models.comment_forest.CommentForest object at 0x0000022EEE05B280>,zpui9x,drawing,t5_2qvp9,,False,False,t3_zpui9x,t3_zpui9x,/r/drawing/comments/zpui9x/tried_drawing_a_toddler_for_first_time_are_the/jibilca/
386,j0uqwma,, I think of it as a 10-11 year old kid when I see the drawing., I think of it as a 10-11 year old kid when I see the drawing.,30,2022-12-19 15:58:55,<praw.models.comment_forest.CommentForest object at 0x0000022EEE057BE0>,zpui9x,drawing,t5_2qvp9,,False,False,t3_zpui9x,t1_j0uojxy,/r/drawing/comments/zpui9x/tried_drawing_a_toddler_for_first_time_are_the/j0uqwma/
387,j0uubew,floweresarepretty,"Yea you are right, will try to fix it, it looked even more like an older child I thought I fixed it guess not lol","Yea you are right, will try to fix it, it looked even more like an older child I thought I fixed it guess not lol",1,2022-12-19 16:22:25,<praw.models.comment_forest.CommentForest object at 0x0000022EEE057C40>,zpui9x,drawing,t5_2qvp9,,False,True,t3_zpui9x,t1_j0uojxy,/r/drawing/comments/zpui9x/tried_drawing_a_toddler_for_first_time_are_the/j0uubew/
388,j0uv2p4,floweresarepretty,"https://preview.redd.it/2dtqlvtaax6a1.png?width=720&format=pjpg&auto=webp&s=a655d6272b330f85f71681f4bdf60f2ddabe693d

Does it look more like a toddler?","https://preview.redd.it/2dtqlvtaax6a1.png?width=720&format=pjpg&auto=webp&s=a655d6272b330f85f71681f4bdf60f2ddabe693d

Does it look more like a toddler?",-2,2022-12-19 16:27:32,<praw.models.comment_forest.CommentForest object at 0x0000022EEE057D00>,zpui9x,drawing,t5_2qvp9,,False,True,t3_zpui9x,t1_j0uojxy,/r/drawing/comments/zpui9x/tried_drawing_a_toddler_for_first_time_are_the/j0uv2p4/
389,j0ywnze,CitizenEveryone,"I think the neck is also too long for a toddler, and the head is too small. Babies' heads are disproportionately large compared to more mature bodies.","I think the neck is also too long for a toddler, and the head is too small. Babies' heads are disproportionately large compared to more mature bodies.",1,2022-12-20 13:16:17,<praw.models.comment_forest.CommentForest object at 0x0000022EEE057DC0>,zpui9x,drawing,t5_2qvp9,,False,False,t3_zpui9x,t1_j0uojxy,/r/drawing/comments/zpui9x/tried_drawing_a_toddler_for_first_time_are_the/j0ywnze/
390,j0uukeu,floweresarepretty,"💀💀

Also like I don't want to say it but mark Zuckerberg... with a nappie","💀💀

Also like I don't want to say it but mark Zuckerberg... with a nappie",8,2022-12-19 16:24:06,<praw.models.comment_forest.CommentForest object at 0x0000022EEE057F40>,zpui9x,drawing,t5_2qvp9,,1671481629.0,True,t3_zpui9x,t1_j0uslka,/r/drawing/comments/zpui9x/tried_drawing_a_toddler_for_first_time_are_the/j0uukeu/
391,j0wccz8,kingyosie,Yes but it’s supposed to be a toddler not a baby doll so I would go more in this direction but not completely,Yes but it’s supposed to be a toddler not a baby doll so I would go more in this direction but not completely,4,2022-12-19 22:18:06,<praw.models.comment_forest.CommentForest object at 0x0000022EEE059100>,zpui9x,drawing,t5_2qvp9,,False,False,t3_zpui9x,t1_j0vtgvu,/r/drawing/comments/zpui9x/tried_drawing_a_toddler_for_first_time_are_the/j0wccz8/
392,j0vuxg5,floweresarepretty,"That's pretty extreme though lmao, but I get it I will try better next time","That's pretty extreme though lmao, but I get it I will try better next time",1,2022-12-19 20:21:41,<praw.models.comment_forest.CommentForest object at 0x0000022EEE0591C0>,zpui9x,drawing,t5_2qvp9,,False,True,t3_zpui9x,t1_j0vtgvu,/r/drawing/comments/zpui9x/tried_drawing_a_toddler_for_first_time_are_the/j0vuxg5/
393,j0vvv0j,floweresarepretty,"Noo😂😂😂, that's amazing","Noo😂😂😂, that's amazing",4,2022-12-19 20:27:47,<praw.models.comment_forest.CommentForest object at 0x0000022EEE0594C0>,zpui9x,drawing,t5_2qvp9,,False,True,t3_zpui9x,t1_j0vvrbp,/r/drawing/comments/zpui9x/tried_drawing_a_toddler_for_first_time_are_the/j0vvv0j/
394,j0uxvta,floweresarepretty,"I already attempted to fix it along other comment's advise, is this better? I can try re-doing it again if not

https://preview.redd.it/kig54y7odx6a1.png?width=720&format=pjpg&auto=webp&s=2dd23da3e48289ea03571a5e8f18011573f90a90","I already attempted to fix it along other comment's advise, is this better? I can try re-doing it again if not

https://preview.redd.it/kig54y7odx6a1.png?width=720&format=pjpg&auto=webp&s=2dd23da3e48289ea03571a5e8f18011573f90a90",0,2022-12-19 16:46:26,<praw.models.comment_forest.CommentForest object at 0x0000022EEE0595E0>,zpui9x,drawing,t5_2qvp9,,False,True,t3_zpui9x,t1_j0ux8hq,/r/drawing/comments/zpui9x/tried_drawing_a_toddler_for_first_time_are_the/j0uxvta/
395,j0uxe6p,floweresarepretty,"https://preview.redd.it/mydqrwb3dx6a1.png?width=720&format=pjpg&auto=webp&s=10b96105a63b0a01a195305894cd5b7fea451a53

Will keep that in mind, I tried to fix it after other comment advised me something, do you think this looks better or not?","https://preview.redd.it/mydqrwb3dx6a1.png?width=720&format=pjpg&auto=webp&s=10b96105a63b0a01a195305894cd5b7fea451a53

Will keep that in mind, I tried to fix it after other comment advised me something, do you think this looks better or not?",-4,2022-12-19 16:43:11,<praw.models.comment_forest.CommentForest object at 0x0000022EEE0599A0>,zpui9x,drawing,t5_2qvp9,,False,True,t3_zpui9x,t1_j0uwpfq,/r/drawing/comments/zpui9x/tried_drawing_a_toddler_for_first_time_are_the/j0uxe6p/
396,j0v9s5k,floweresarepretty,There is correction in replies to other comments,There is correction in replies to other comments,1,2022-12-19 18:03:53,<praw.models.comment_forest.CommentForest object at 0x0000022EEE059D60>,zpui9x,drawing,t5_2qvp9,,False,True,t3_zpui9x,t1_j0v9as2,/r/drawing/comments/zpui9x/tried_drawing_a_toddler_for_first_time_are_the/j0v9s5k/
397,jibz24e,floweresarepretty,"Noo why is this being recommend, I thought it was long forgotten, it's gonna haunt me😂😂","Noo why is this being recommend, I thought it was long forgotten, it's gonna haunt me😂😂",1,2023-04-30 18:00:11,<praw.models.comment_forest.CommentForest object at 0x0000022EEE05B340>,zpui9x,drawing,t5_2qvp9,,False,True,t3_zpui9x,t1_jibilca,/r/drawing/comments/zpui9x/tried_drawing_a_toddler_for_first_time_are_the/jibz24e/
398,j0uue9b,floweresarepretty,10-11 year old with a nappie lol,10-11 year old with a nappie lol,5,2022-12-19 16:22:57,<praw.models.comment_forest.CommentForest object at 0x0000022EEE057CA0>,zpui9x,drawing,t5_2qvp9,,1671481546.0,True,t3_zpui9x,t1_j0uqwma,/r/drawing/comments/zpui9x/tried_drawing_a_toddler_for_first_time_are_the/j0uue9b/
399,j0v44eg,Slicksuzie,"Close, now shorten the neck see if that helps

Little kids are kinda stubby lol","Close, now shorten the neck see if that helps

Little kids are kinda stubby lol",3,2022-12-19 17:27:23,<praw.models.comment_forest.CommentForest object at 0x0000022EEE057E20>,zpui9x,drawing,t5_2qvp9,,False,False,t3_zpui9x,t1_j0uv2p4,/r/drawing/comments/zpui9x/tried_drawing_a_toddler_for_first_time_are_the/j0v44eg/
400,j0wtijo,KarenNoMore,Ya lol agreed.,Ya lol agreed.,1,2022-12-20 00:22:39,<praw.models.comment_forest.CommentForest object at 0x0000022EEE059460>,zpui9x,drawing,t5_2qvp9,,False,False,t3_zpui9x,t1_j0vuxg5,/r/drawing/comments/zpui9x/tried_drawing_a_toddler_for_first_time_are_the/j0wtijo/
401,j0vw9lx,heyIfoundaname,":DD

Glad you had a laugh. Good luck with the drawing! 

It may not look like a toddler, but it's a perfect Mark Zucc! I love it!",":DD

Glad you had a laugh. Good luck with the drawing! 

It may not look like a toddler, but it's a perfect Mark Zucc! I love it!",3,2022-12-19 20:30:28,<praw.models.comment_forest.CommentForest object at 0x0000022EEE059580>,zpui9x,drawing,t5_2qvp9,,False,False,t3_zpui9x,t1_j0vvv0j,/r/drawing/comments/zpui9x/tried_drawing_a_toddler_for_first_time_are_the/j0vw9lx/
402,j0v1776,,Try lowering the head a bit closer to shoulder girdle and enlarging head even more. But it's looking better. I would further thicken everything from neck down.,Try lowering the head a bit closer to shoulder girdle and enlarging head even more. But it's looking better. I would further thicken everything from neck down.,6,2022-12-19 17:08:16,<praw.models.comment_forest.CommentForest object at 0x0000022EEE0596A0>,zpui9x,drawing,t5_2qvp9,,False,False,t3_zpui9x,t1_j0uxvta,/r/drawing/comments/zpui9x/tried_drawing_a_toddler_for_first_time_are_the/j0v1776/
403,j0vnqmh,KarenNoMore,"You need to fatten everything. The younger you are going for the less definition to the body. The head size looks fine but fatten ( shorten)the neck, torso, upper arms, waist and upper thighs. Think like there is no bone structure to the body. The younger you want them to look the less bone structure. Babies are butter balls of fat and skin and don't have much bone mass or muscle tone. Make him more squishy looking. Even fatten the cheeks some.","You need to fatten everything. The younger you are going for the less definition to the body. The head size looks fine but fatten ( shorten)the neck, torso, upper arms, waist and upper thighs. Think like there is no bone structure to the body. The younger you want them to look the less bone structure. Babies are butter balls of fat and skin and don't have much bone mass or muscle tone. Make him more squishy looking. Even fatten the cheeks some.",3,2022-12-19 19:34:54,<praw.models.comment_forest.CommentForest object at 0x0000022EEE059700>,zpui9x,drawing,t5_2qvp9,,False,False,t3_zpui9x,t1_j0uxvta,/r/drawing/comments/zpui9x/tried_drawing_a_toddler_for_first_time_are_the/j0vnqmh/
404,j0uzkvy,carinavet,"I had to open the two pics in two tabs and flip back and forth to see what the difference was.

Shortening the torso definitely helped with the proportions, but the limbs need to be shorter too, and everything needs to be rounder. Toddlers are not skinny: they're saving fat for a future growth spurt. They've got round bellies, chunky arms, and thunder thighs. Stubby little fingers. Almost no neck yet. A big diaper is also going to affect the silhouette.","I had to open the two pics in two tabs and flip back and forth to see what the difference was.

Shortening the torso definitely helped with the proportions, but the limbs need to be shorter too, and everything needs to be rounder. Toddlers are not skinny: they're saving fat for a future growth spurt. They've got round bellies, chunky arms, and thunder thighs. Stubby little fingers. Almost no neck yet. A big diaper is also going to affect the silhouette.",8,2022-12-19 16:57:36,<praw.models.comment_forest.CommentForest object at 0x0000022EEE059A60>,zpui9x,drawing,t5_2qvp9,,False,False,t3_zpui9x,t1_j0uxe6p,/r/drawing/comments/zpui9x/tried_drawing_a_toddler_for_first_time_are_the/j0uzkvy/
405,j0uur2q,,Yup you got it.,Yup you got it.,7,2022-12-19 16:25:21,<praw.models.comment_forest.CommentForest object at 0x0000022EEE057D60>,zpui9x,drawing,t5_2qvp9,,False,False,t3_zpui9x,t1_j0uue9b,/r/drawing/comments/zpui9x/tried_drawing_a_toddler_for_first_time_are_the/j0uur2q/
406,j0va3am,floweresarepretty,"https://preview.redd.it/c4fq7okurx6a1.png?width=720&format=pjpg&auto=webp&s=365776b39bade0110c14e91a7ac02eb33f153a5d

Short enough?","https://preview.redd.it/c4fq7okurx6a1.png?width=720&format=pjpg&auto=webp&s=365776b39bade0110c14e91a7ac02eb33f153a5d

Short enough?",1,2022-12-19 18:05:54,<praw.models.comment_forest.CommentForest object at 0x0000022EEE057EE0>,zpui9x,drawing,t5_2qvp9,,False,True,t3_zpui9x,t1_j0v44eg,/r/drawing/comments/zpui9x/tried_drawing_a_toddler_for_first_time_are_the/j0va3am/
407,j0vsiig,floweresarepretty,"Thanks for advice, I will use that next time I have spent way too much time with this drawing, helpful though

this is my last version

https://preview.redd.it/9obuhcs9dy6a1.png?width=720&format=pjpg&auto=webp&s=f66e800cd2f3a141f947fdb0b2f7964cce5f7d02","Thanks for advice, I will use that next time I have spent way too much time with this drawing, helpful though

this is my last version

https://preview.redd.it/9obuhcs9dy6a1.png?width=720&format=pjpg&auto=webp&s=f66e800cd2f3a141f947fdb0b2f7964cce5f7d02",2,2022-12-19 20:05:58,<praw.models.comment_forest.CommentForest object at 0x0000022EEE0597C0>,zpui9x,drawing,t5_2qvp9,,False,True,t3_zpui9x,t1_j0vnqmh,/r/drawing/comments/zpui9x/tried_drawing_a_toddler_for_first_time_are_the/j0vsiig/
408,j0vvpli,floweresarepretty,Ok,Ok,1,2022-12-19 20:26:48,<praw.models.comment_forest.CommentForest object at 0x0000022EEE059B20>,zpui9x,drawing,t5_2qvp9,,False,True,t3_zpui9x,t1_j0uzkvy,/r/drawing/comments/zpui9x/tried_drawing_a_toddler_for_first_time_are_the/j0vvpli/
409,j0vax5f,ithinkilikegirlstoo,Ooh shortening the neck was a good call- maybe even a little more. Also maybe make the belly a little more round? The big eyes are wonderful,Ooh shortening the neck was a good call- maybe even a little more. Also maybe make the belly a little more round? The big eyes are wonderful,5,2022-12-19 18:11:14,<praw.models.comment_forest.CommentForest object at 0x0000022EEE057FA0>,zpui9x,drawing,t5_2qvp9,,False,False,t3_zpui9x,t1_j0va3am,/r/drawing/comments/zpui9x/tried_drawing_a_toddler_for_first_time_are_the/j0vax5f/
410,j0xpdw3,,"&#x200B;

https://preview.redd.it/weop2mhlv07a1.jpeg?width=380&format=pjpg&auto=webp&s=445212a8969aa512968d864a364e81d14f24ea16","&#x200B;

https://preview.redd.it/weop2mhlv07a1.jpeg?width=380&format=pjpg&auto=webp&s=445212a8969aa512968d864a364e81d14f24ea16",5,2022-12-20 04:32:23,<praw.models.comment_forest.CommentForest object at 0x0000022EEE059880>,zpui9x,drawing,t5_2qvp9,,False,False,t3_zpui9x,t1_j0vsiig,/r/drawing/comments/zpui9x/tried_drawing_a_toddler_for_first_time_are_the/j0xpdw3/
411,j0wum9s,KarenNoMore,Looks better but tbh I think it is partly the choice of clothes. Maybe put some flannel PJ's or untuck the shirt. But is looking much better. There are so many drawings I have stopped working on then go back months later and see flaws that I don't like. The main thing is that you continue working at it. Never stop drawing and the better you will get. I miss it myself but life has gotten too crazy for me to be able to concentrate and sit still long enough.,Looks better but tbh I think it is partly the choice of clothes. Maybe put some flannel PJ's or untuck the shirt. But is looking much better. There are so many drawings I have stopped working on then go back months later and see flaws that I don't like. The main thing is that you continue working at it. Never stop drawing and the better you will get. I miss it myself but life has gotten too crazy for me to be able to concentrate and sit still long enough.,1,2022-12-20 00:30:58,<praw.models.comment_forest.CommentForest object at 0x0000022EEE0598E0>,zpui9x,drawing,t5_2qvp9,,False,False,t3_zpui9x,t1_j0vsiig,/r/drawing/comments/zpui9x/tried_drawing_a_toddler_for_first_time_are_the/j0wum9s/
412,j0vps0b,floweresarepretty,"https://preview.redd.it/7v8u74zdby6a1.png?width=720&format=pjpg&auto=webp&s=e7529fa3711524046b92ce483599b48c613abe6c

Tried that, also thanks for the eyes","https://preview.redd.it/7v8u74zdby6a1.png?width=720&format=pjpg&auto=webp&s=e7529fa3711524046b92ce483599b48c613abe6c

Tried that, also thanks for the eyes",3,2022-12-19 19:48:17,<praw.models.comment_forest.CommentForest object at 0x0000022EEE0590A0>,zpui9x,drawing,t5_2qvp9,,1671479725.0,True,t3_zpui9x,t1_j0vax5f,/r/drawing/comments/zpui9x/tried_drawing_a_toddler_for_first_time_are_the/j0vps0b/
413,j0xxa96,,"Or this, the archetypal toddler model...

https://preview.redd.it/3hye4rtd917a1.png?width=275&format=png&auto=webp&s=b2a1cb75c5aeca21a9919756d1167846370537ab","Or this, the archetypal toddler model...

https://preview.redd.it/3hye4rtd917a1.png?width=275&format=png&auto=webp&s=b2a1cb75c5aeca21a9919756d1167846370537ab",2,2022-12-20 05:51:08,<praw.models.comment_forest.CommentForest object at 0x0000022EEE059940>,zpui9x,drawing,t5_2qvp9,,False,False,t3_zpui9x,t1_j0xpdw3,/r/drawing/comments/zpui9x/tried_drawing_a_toddler_for_first_time_are_the/j0xxa96/
414,j0vroap,floweresarepretty,"Also, tried bigger head

https://preview.redd.it/rwl72yybcy6a1.png?width=720&format=pjpg&auto=webp&s=9131d97feef43f2cd8525c43a20bb640d8ec3cd3","Also, tried bigger head

https://preview.redd.it/rwl72yybcy6a1.png?width=720&format=pjpg&auto=webp&s=9131d97feef43f2cd8525c43a20bb640d8ec3cd3",9,2022-12-19 20:00:33,<praw.models.comment_forest.CommentForest object at 0x0000022EEE059160>,zpui9x,drawing,t5_2qvp9,,False,True,t3_zpui9x,t1_j0vps0b,/r/drawing/comments/zpui9x/tried_drawing_a_toddler_for_first_time_are_the/j0vroap/
415,j0w27rl,Slicksuzie,"This is a lot closer, now maybe make the torso stockier...little kids don't really have defined waists","This is a lot closer, now maybe make the torso stockier...little kids don't really have defined waists",9,2022-12-19 21:09:31,<praw.models.comment_forest.CommentForest object at 0x0000022EEE059220>,zpui9x,drawing,t5_2qvp9,,False,False,t3_zpui9x,t1_j0vroap,/r/drawing/comments/zpui9x/tried_drawing_a_toddler_for_first_time_are_the/j0w27rl/
416,j0vvr77,ithinkilikegirlstoo,This is the best iteration so far! Larger head is a good call,This is the best iteration so far! Larger head is a good call,4,2022-12-19 20:27:05,<praw.models.comment_forest.CommentForest object at 0x0000022EEE059280>,zpui9x,drawing,t5_2qvp9,,False,False,t3_zpui9x,t1_j0vroap,/r/drawing/comments/zpui9x/tried_drawing_a_toddler_for_first_time_are_the/j0vvr77/
417,j0wclrt,kingyosie,I would actually make the head even bigger. Babies heads grow very little and are at least 70% of the side of an adults when they’re born,I would actually make the head even bigger. Babies heads grow very little and are at least 70% of the side of an adults when they’re born,1,2022-12-19 22:19:48,<praw.models.comment_forest.CommentForest object at 0x0000022EEE059340>,zpui9x,drawing,t5_2qvp9,,False,False,t3_zpui9x,t1_j0vroap,/r/drawing/comments/zpui9x/tried_drawing_a_toddler_for_first_time_are_the/j0wclrt/
418,j0w7b6j,floweresarepretty,"its not really waist I feel like a lot of people got this wrong it's the nappie, but I agree with making toddlers stockier will try that next time I am drawing one","its not really waist I feel like a lot of people got this wrong it's the nappie, but I agree with making toddlers stockier will try that next time I am drawing one",0,2022-12-19 21:43:19,<praw.models.comment_forest.CommentForest object at 0x0000022EEE0592E0>,zpui9x,drawing,t5_2qvp9,,False,True,t3_zpui9x,t1_j0w27rl,/r/drawing/comments/zpui9x/tried_drawing_a_toddler_for_first_time_are_the/j0w7b6j/
419,j0xcwx2,ellominnowpea,"I like the fix.  I disagree with the crit on making the belly rounder—not all toddlers have that and sometimes ones that do will only have it after eating.

I initially thought the arms were slightly too long, but within range of normality.  I also thought the neck was too long and like how you’ve fixed it—it could still be shorter, but now feels much more natural.  Good job!","I like the fix.  I disagree with the crit on making the belly rounder—not all toddlers have that and sometimes ones that do will only have it after eating.

I initially thought the arms were slightly too long, but within range of normality.  I also thought the neck was too long and like how you’ve fixed it—it could still be shorter, but now feels much more natural.  Good job!",3,2022-12-20 02:49:41,<praw.models.comment_forest.CommentForest object at 0x0000022EEE0593A0>,zpui9x,drawing,t5_2qvp9,,False,False,t3_zpui9x,t1_j0w7b6j,/r/drawing/comments/zpui9x/tried_drawing_a_toddler_for_first_time_are_the/j0xcwx2/
420,igxj4mr,Epic_RiffMSM,"The fingers are all the same length, but I really hope you don't mean criticism=hate...","The fingers are all the same length, but I really hope you don't mean criticism=hate...",13,2022-07-20 15:55:16,<praw.models.comment_forest.CommentForest object at 0x0000022EEE05BD60>,w3o8sd,drawing,t5_2qvp9,,1658376281.0,False,t3_w3o8sd,t3_w3o8sd,/r/drawing/comments/w3o8sd/no_hate_please/igxj4mr/
421,igzv26c,ElderberryPrudent144,I can't give you hate. You already hate yourself💀.,I can't give you hate. You already hate yourself💀.,10,2022-07-21 01:53:57,<praw.models.comment_forest.CommentForest object at 0x0000022EEE05BE50>,w3o8sd,drawing,t5_2qvp9,,False,False,t3_w3o8sd,t3_w3o8sd,/r/drawing/comments/w3o8sd/no_hate_please/igzv26c/
422,igxoqis,duffman886,I’m not gonna say anything about your drawing but criticism is a great tool to improve and it’s important not feel to feel bad about criticism take it in and always improve on yourself. When you improve little by little you get better and better you’ll see huge difference in yourself.,I’m not gonna say anything about your drawing but criticism is a great tool to improve and it’s important not feel to feel bad about criticism take it in and always improve on yourself. When you improve little by little you get better and better you’ll see huge difference in yourself.,8,2022-07-20 16:30:36,<praw.models.comment_forest.CommentForest object at 0x0000022EEE05BFA0>,w3o8sd,drawing,t5_2qvp9,,False,False,t3_w3o8sd,t3_w3o8sd,/r/drawing/comments/w3o8sd/no_hate_please/igxoqis/
423,igxd8vj,VanCityHunter,The middle finger is your longest finger. Keep that in mind for the next hand you draw.,The middle finger is your longest finger. Keep that in mind for the next hand you draw.,10,2022-07-20 15:18:01,<praw.models.comment_forest.CommentForest object at 0x0000022EEE061040>,w3o8sd,drawing,t5_2qvp9,,False,False,t3_w3o8sd,t3_w3o8sd,/r/drawing/comments/w3o8sd/no_hate_please/igxd8vj/
