,ID,Author,body,Comment,Score,Created On,Replies,Submission,Subreddit,Subreddit_ID,Distinguished,Edited,Is_submitter,link_id,Parent_id,Permalink
0,jwy2fw0,AutoModerator,"Thank you for your submission! Want to share your artwork, meet other artists, promote your content, and chat in a relaxed environment? Join our community Discord server here! https://discord.gg/chuunhpqsU


*I am a bot, and this action was performed automatically. Please [contact the moderators of this subreddit](/message/compose/?to=/r/drawing) if you have any questions or concerns.*","Thank you for your submission! Want to share your artwork, meet other artists, promote your content, and chat in a relaxed environment? Join our community Discord server here! https://discord.gg/chuunhpqsU


*I am a bot, and this action was performed automatically. Please [contact the moderators of this subreddit](/message/compose/?to=/r/drawing) if you have any questions or concerns.*",1,2023-08-20 02:18:14,<praw.models.comment_forest.CommentForest object at 0x0000022EEDF42160>,15vys2o,drawing,t5_2qvp9,moderator,False,False,t3_15vys2o,t3_15vys2o,/r/drawing/comments/15vys2o/dragon_girl_laid_an_egg/jwy2fw0/
1,jwy4c0m,SorryNoNameYet,What the fuck.,What the fuck.,86,2023-08-20 02:33:29,<praw.models.comment_forest.CommentForest object at 0x0000022EEDF42190>,15vys2o,drawing,t5_2qvp9,,False,False,t3_15vys2o,t3_15vys2o,/r/drawing/comments/15vys2o/dragon_girl_laid_an_egg/jwy4c0m/
2,jwyaiet,TheHallowsCourt,Wth,Wth,26,2023-08-20 03:24:31,<praw.models.comment_forest.CommentForest object at 0x0000022EEDF42340>,15vys2o,drawing,t5_2qvp9,,False,False,t3_15vys2o,t3_15vys2o,/r/drawing/comments/15vys2o/dragon_girl_laid_an_egg/jwyaiet/
3,jwy82ha,spookyballsHD,Huh...,Huh...,21,2023-08-20 03:04:09,<praw.models.comment_forest.CommentForest object at 0x0000022EEDF423A0>,15vys2o,drawing,t5_2qvp9,,False,False,t3_15vys2o,t3_15vys2o,/r/drawing/comments/15vys2o/dragon_girl_laid_an_egg/jwy82ha/
4,jwyijmn,,dude. why.,dude. why.,14,2023-08-20 04:37:28,<praw.models.comment_forest.CommentForest object at 0x0000022EEDF42580>,15vys2o,drawing,t5_2qvp9,,False,False,t3_15vys2o,t3_15vys2o,/r/drawing/comments/15vys2o/dragon_girl_laid_an_egg/jwyijmn/
5,jwybssa,iamtimmah,"Somebody skipped biology. But hey, it's all fantasy, whatever makes you happy :)","Somebody skipped biology. But hey, it's all fantasy, whatever makes you happy :)",14,2023-08-20 03:35:38,<praw.models.comment_forest.CommentForest object at 0x0000022EEDF426A0>,15vys2o,drawing,t5_2qvp9,,False,False,t3_15vys2o,t3_15vys2o,/r/drawing/comments/15vys2o/dragon_girl_laid_an_egg/jwybssa/
6,jwyzm9d,bish-its-me-yoda,I think this belongs in r/picturehentai or just r/hentai,I think this belongs in r/picturehentai or just r/hentai,6,2023-08-20 07:52:09,<praw.models.comment_forest.CommentForest object at 0x0000022EEDF42760>,15vys2o,drawing,t5_2qvp9,,False,False,t3_15vys2o,t3_15vys2o,/r/drawing/comments/15vys2o/dragon_girl_laid_an_egg/jwyzm9d/
7,jwy7gmp,Creonix1,Her knees look so fucked up like there’s no lower leg and it’s just a flap of squishy flesh,Her knees look so fucked up like there’s no lower leg and it’s just a flap of squishy flesh,13,2023-08-20 02:59:05,<praw.models.comment_forest.CommentForest object at 0x0000022EEDF42820>,15vys2o,drawing,t5_2qvp9,,False,False,t3_15vys2o,t3_15vys2o,/r/drawing/comments/15vys2o/dragon_girl_laid_an_egg/jwy7gmp/
8,jx1utbj,Sweet_Finish4245,"This is just straight up porn but uh... shading is good ig? 

Questionable thumbs ups 👍👍","This is just straight up porn but uh... shading is good ig? 

Questionable thumbs ups 👍👍",6,2023-08-20 21:41:20,<praw.models.comment_forest.CommentForest object at 0x0000022EEDF429A0>,15vys2o,drawing,t5_2qvp9,,False,False,t3_15vys2o,t3_15vys2o,/r/drawing/comments/15vys2o/dragon_girl_laid_an_egg/jx1utbj/
9,jwy7987,Every_Traffic_8973,Game of thrones,Game of thrones,9,2023-08-20 02:57:23,<praw.models.comment_forest.CommentForest object at 0x0000022EEDF42A60>,15vys2o,drawing,t5_2qvp9,,False,False,t3_15vys2o,t3_15vys2o,/r/drawing/comments/15vys2o/dragon_girl_laid_an_egg/jwy7987/
10,jwyqffa,Professional_Tie5523,Overly sexualized woman again....,Overly sexualized woman again....,7,2023-08-20 05:59:24,<praw.models.comment_forest.CommentForest object at 0x0000022EEDF42B20>,15vys2o,drawing,t5_2qvp9,,False,False,t3_15vys2o,t3_15vys2o,/r/drawing/comments/15vys2o/dragon_girl_laid_an_egg/jwyqffa/
11,jwyw5lw,TekneaGHOUL,I hate this sub. Stop posting porn.,I hate this sub. Stop posting porn.,6,2023-08-20 07:07:37,<praw.models.comment_forest.CommentForest object at 0x0000022EEDF42C40>,15vys2o,drawing,t5_2qvp9,,False,False,t3_15vys2o,t3_15vys2o,/r/drawing/comments/15vys2o/dragon_girl_laid_an_egg/jwyw5lw/
12,jwz9bj4,Ok_Performance2650,Looks like she paid 25 Schmeckles for those dragon egg boobies! And that she would topple over being that top heavy.,Looks like she paid 25 Schmeckles for those dragon egg boobies! And that she would topple over being that top heavy.,2,2023-08-20 10:00:38,<praw.models.comment_forest.CommentForest object at 0x0000022EEDF42D60>,15vys2o,drawing,t5_2qvp9,,False,False,t3_15vys2o,t3_15vys2o,/r/drawing/comments/15vys2o/dragon_girl_laid_an_egg/jwz9bj4/
13,jx1tpgd,Critterchops,It’s cool I like it!…always be yourself and you will never regret it!… and you can be proud that you were never fake!!,It’s cool I like it!…always be yourself and you will never regret it!… and you can be proud that you were never fake!!,2,2023-08-20 21:33:42,<praw.models.comment_forest.CommentForest object at 0x0000022EEDF42E20>,15vys2o,drawing,t5_2qvp9,,False,False,t3_15vys2o,t3_15vys2o,/r/drawing/comments/15vys2o/dragon_girl_laid_an_egg/jx1tpgd/
14,jzxejhl,Killthegoodboi,congrats on top controversial post of all time,congrats on top controversial post of all time,2,2023-09-10 07:18:55,<praw.models.comment_forest.CommentForest object at 0x0000022EEDF44040>,15vys2o,drawing,t5_2qvp9,,False,False,t3_15vys2o,t3_15vys2o,/r/drawing/comments/15vys2o/dragon_girl_laid_an_egg/jzxejhl/
15,jwzl65k,SageKakashiHatake,Great job. I'ma bust a quick one in your honour 🫡,Great job. I'ma bust a quick one in your honour 🫡,2,2023-08-20 12:14:54,<praw.models.comment_forest.CommentForest object at 0x0000022EEDF440A0>,15vys2o,drawing,t5_2qvp9,,False,False,t3_15vys2o,t3_15vys2o,/r/drawing/comments/15vys2o/dragon_girl_laid_an_egg/jwzl65k/
16,jwyd15f,bostiq,Next time I see a chesty girl I can finally say “look at those plump dragon egg size boobies “,Next time I see a chesty girl I can finally say “look at those plump dragon egg size boobies “,1,2023-08-20 03:46:15,<praw.models.comment_forest.CommentForest object at 0x0000022EEDF44160>,15vys2o,drawing,t5_2qvp9,,False,False,t3_15vys2o,t3_15vys2o,/r/drawing/comments/15vys2o/dragon_girl_laid_an_egg/jwyd15f/
17,jwzi9ys,TheLastLoli,"This is a really great drawing OP, don’t let the soy people sniveling about the subject matter bring you down. The shading is great, the gradients are smooth and the Contrast of light and dark is used excellently. With some improvement to anatomical accuracy and dynamic positioning with forced perspective, your going to be truly incredible.
Also, she has beautiful boobies ✨","This is a really great drawing OP, don’t let the soy people sniveling about the subject matter bring you down. The shading is great, the gradients are smooth and the Contrast of light and dark is used excellently. With some improvement to anatomical accuracy and dynamic positioning with forced perspective, your going to be truly incredible.
Also, she has beautiful boobies ✨",1,2023-08-20 11:46:33,<praw.models.comment_forest.CommentForest object at 0x0000022EEDF44220>,15vys2o,drawing,t5_2qvp9,,False,False,t3_15vys2o,t3_15vys2o,/r/drawing/comments/15vys2o/dragon_girl_laid_an_egg/jwzi9ys/
18,jxczli0,onetimeidp,Looks great,Looks great,1,2023-08-23 02:23:50,<praw.models.comment_forest.CommentForest object at 0x0000022EEDF44280>,15vys2o,drawing,t5_2qvp9,,False,False,t3_15vys2o,t3_15vys2o,/r/drawing/comments/15vys2o/dragon_girl_laid_an_egg/jxczli0/
19,jwy4gdu,Due-Pin-3884,When a mommy dragon and daddy dragon love each other very much.....,When a mommy dragon and daddy dragon love each other very much.....,4,2023-08-20 02:34:28,<praw.models.comment_forest.CommentForest object at 0x0000022EEDF42370>,15vys2o,drawing,t5_2qvp9,,False,True,t3_15vys2o,t1_jwy4c0m,/r/drawing/comments/15vys2o/dragon_girl_laid_an_egg/jwy4gdu/
20,jwybsyb,Due-Pin-3884,https://preview.redd.it/lw5uegf0r6jb1.jpeg?width=700&format=pjpg&auto=webp&s=affd44a06a25adb887d721d9ae916c485b43229f,https://preview.redd.it/lw5uegf0r6jb1.jpeg?width=700&format=pjpg&auto=webp&s=affd44a06a25adb887d721d9ae916c485b43229f,-1,2023-08-20 03:35:41,<praw.models.comment_forest.CommentForest object at 0x0000022EEDF42640>,15vys2o,drawing,t5_2qvp9,,False,True,t3_15vys2o,t1_jwy82ha,/r/drawing/comments/15vys2o/dragon_girl_laid_an_egg/jwybsyb/
21,jwyipyp,Due-Pin-3884,Once I thought of it I couldn't stop thinking about it until I got it out of my brain. I'm sorry.,Once I thought of it I couldn't stop thinking about it until I got it out of my brain. I'm sorry.,5,2023-08-20 04:39:06,<praw.models.comment_forest.CommentForest object at 0x0000022EEDF42700>,15vys2o,drawing,t5_2qvp9,,False,True,t3_15vys2o,t1_jwyijmn,/r/drawing/comments/15vys2o/dragon_girl_laid_an_egg/jwyipyp/
22,jwyc0sz,Due-Pin-3884,It's a thing in pathfinder https://pathfinderwiki.com/wiki/Half-dragon,It's a thing in pathfinder https://pathfinderwiki.com/wiki/Half-dragon,2,2023-08-20 03:37:34,<praw.models.comment_forest.CommentForest object at 0x0000022EEDF427C0>,15vys2o,drawing,t5_2qvp9,,False,True,t3_15vys2o,t1_jwybssa,/r/drawing/comments/15vys2o/dragon_girl_laid_an_egg/jwyc0sz/
23,jwzu4z0,Due-Pin-3884,Maybe we need a r/drawinghentai,Maybe we need a r/drawinghentai,2,2023-08-20 13:33:27,<praw.models.comment_forest.CommentForest object at 0x0000022EEDF428E0>,15vys2o,drawing,t5_2qvp9,,False,True,t3_15vys2o,t1_jwyzm9d,/r/drawing/comments/15vys2o/dragon_girl_laid_an_egg/jwzu4z0/
24,jwy7msr,Due-Pin-3884,"Yeah, I couldn't see any lower leg on the model I used, so that's how it turned out. Thanks for the feedback.","Yeah, I couldn't see any lower leg on the model I used, so that's how it turned out. Thanks for the feedback.",1,2023-08-20 03:00:31,<praw.models.comment_forest.CommentForest object at 0x0000022EEDF42A00>,15vys2o,drawing,t5_2qvp9,,False,True,t3_15vys2o,t1_jwy7gmp,/r/drawing/comments/15vys2o/dragon_girl_laid_an_egg/jwy7msr/
25,jwyjlhr,messy_brainz,Tame my Groans,Tame my Groans,7,2023-08-20 04:47:43,<praw.models.comment_forest.CommentForest object at 0x0000022EEDF42BE0>,15vys2o,drawing,t5_2qvp9,,False,False,t3_15vys2o,t1_jwy7987,/r/drawing/comments/15vys2o/dragon_girl_laid_an_egg/jwyjlhr/
26,jwz13tg,birdb0p,"It gets so old honestly, the ones with clear intention of sexual objectification irk me. 

May these artists never learn to draw hands and may their paper rip when they erase, amen 🙏","It gets so old honestly, the ones with clear intention of sexual objectification irk me. 

May these artists never learn to draw hands and may their paper rip when they erase, amen 🙏",3,2023-08-20 08:11:35,<praw.models.comment_forest.CommentForest object at 0x0000022EEDF42CA0>,15vys2o,drawing,t5_2qvp9,,False,False,t3_15vys2o,t1_jwyqffa,/r/drawing/comments/15vys2o/dragon_girl_laid_an_egg/jwz13tg/
27,jwyqkz6,Due-Pin-3884,"""overly"" is a matter of opinion. Also I have drawn a lot more if you want to see them.","""overly"" is a matter of opinion. Also I have drawn a lot more if you want to see them.",-3,2023-08-20 06:01:10,<praw.models.comment_forest.CommentForest object at 0x0000022EEDF42D00>,15vys2o,drawing,t5_2qvp9,,1692511698.0,True,t3_15vys2o,t1_jwyqffa,/r/drawing/comments/15vys2o/dragon_girl_laid_an_egg/jwyqkz6/
28,jwywfxa,Due-Pin-3884,"Stop being a prude, they're just boobs.","Stop being a prude, they're just boobs.",-3,2023-08-20 07:11:11,<praw.models.comment_forest.CommentForest object at 0x0000022EEDF42DC0>,15vys2o,drawing,t5_2qvp9,,False,True,t3_15vys2o,t1_jwyw5lw,/r/drawing/comments/15vys2o/dragon_girl_laid_an_egg/jwywfxa/
29,jwz9ce4,SchmeckMichBot,"25.00 schmeckles is:

USD|SHM|EUR|GBP|CAD|RUB|CNY  
---|------|---|---|---|---|---  
31.65|0.25|29.06|24.85|42.94|2978.30|230.45

***
^([exchange rate source](http://api.ratesapi.io/2023-08-20?base=USD) | created by [u/Nissingmo](http://reddit.com/u/nissingmo))","25.00 schmeckles is:

USD|SHM|EUR|GBP|CAD|RUB|CNY  
---|------|---|---|---|---|---  
31.65|0.25|29.06|24.85|42.94|2978.30|230.45

***
^([exchange rate source](http://api.ratesapi.io/2023-08-20?base=USD) | created by [u/Nissingmo](http://reddit.com/u/nissingmo))",1,2023-08-20 10:00:57,<praw.models.comment_forest.CommentForest object at 0x0000022EEDF42EE0>,15vys2o,drawing,t5_2qvp9,,False,False,t3_15vys2o,t1_jwz9bj4,/r/drawing/comments/15vys2o/dragon_girl_laid_an_egg/jwz9ce4/
30,jzyefnk,Due-Pin-3884,Lol thanks!,Lol thanks!,1,2023-09-10 12:35:01,<praw.models.comment_forest.CommentForest object at 0x0000022EEDF44100>,15vys2o,drawing,t5_2qvp9,,False,True,t3_15vys2o,t1_jzxejhl,/r/drawing/comments/15vys2o/dragon_girl_laid_an_egg/jzyefnk/
31,jx0ldzl,Due-Pin-3884,Thank you for your most high compliment:D,Thank you for your most high compliment:D,1,2023-08-20 16:43:55,<praw.models.comment_forest.CommentForest object at 0x0000022EEDF441C0>,15vys2o,drawing,t5_2qvp9,,False,True,t3_15vys2o,t1_jwzl65k,/r/drawing/comments/15vys2o/dragon_girl_laid_an_egg/jx0ldzl/
32,jwztzuf,Due-Pin-3884,Thank you! I will keep practicing!,Thank you! I will keep practicing!,0,2023-08-20 13:32:16,<praw.models.comment_forest.CommentForest object at 0x0000022EEDF442E0>,15vys2o,drawing,t5_2qvp9,,False,True,t3_15vys2o,t1_jwzi9ys,/r/drawing/comments/15vys2o/dragon_girl_laid_an_egg/jwztzuf/
33,jwzl4qu,SorryNoNameYet,"They enter your mind, for some reason...","They enter your mind, for some reason...",8,2023-08-20 12:14:33,<praw.models.comment_forest.CommentForest object at 0x0000022EEDF42520>,15vys2o,drawing,t5_2qvp9,,False,False,t3_15vys2o,t1_jwy4gdu,/r/drawing/comments/15vys2o/dragon_girl_laid_an_egg/jwzl4qu/
34,jwycujh,iamtimmah,"Cool. I imagine something/one that can lay a dragon egg, would probably look more like a dragon.","Cool. I imagine something/one that can lay a dragon egg, would probably look more like a dragon.",2,2023-08-20 03:44:44,<praw.models.comment_forest.CommentForest object at 0x0000022EEDF42880>,15vys2o,drawing,t5_2qvp9,,False,False,t3_15vys2o,t1_jwyc0sz,/r/drawing/comments/15vys2o/dragon_girl_laid_an_egg/jwycujh/
35,jwycd1e,vonlucifer_art,"It doesn't look that bad imo, I just think her legs would have to be a bit closer to each other to not see the under legs and/or feet. That, or she would have to be sitting closer to the ground.","It doesn't look that bad imo, I just think her legs would have to be a bit closer to each other to not see the under legs and/or feet. That, or she would have to be sitting closer to the ground.",1,2023-08-20 03:40:31,<praw.models.comment_forest.CommentForest object at 0x0000022EEDF42AC0>,15vys2o,drawing,t5_2qvp9,,False,False,t3_15vys2o,t1_jwy7msr,/r/drawing/comments/15vys2o/dragon_girl_laid_an_egg/jwycd1e/
36,jwywmr6,TekneaGHOUL,This is literally a kink that I'm sure you have.,This is literally a kink that I'm sure you have.,5,2023-08-20 07:13:35,<praw.models.comment_forest.CommentForest object at 0x0000022EEDF42E80>,15vys2o,drawing,t5_2qvp9,,False,False,t3_15vys2o,t1_jwywfxa,/r/drawing/comments/15vys2o/dragon_girl_laid_an_egg/jwywmr6/
37,jx04kfq,himalayan-saiyan,"Please for the love of god never touch a pencil or paper as long as you have these thoughts. This is just dirty, tasteless & downright disgusting- I like the way in which you drew that dragon, it's pretty decent but the overall message & topic of the drawing is disturbing.","Please for the love of god never touch a pencil or paper as long as you have these thoughts. This is just dirty, tasteless & downright disgusting- I like the way in which you drew that dragon, it's pretty decent but the overall message & topic of the drawing is disturbing.",2,2023-08-20 14:51:08,<praw.models.comment_forest.CommentForest object at 0x0000022EEDF443A0>,15vys2o,drawing,t5_2qvp9,,False,False,t3_15vys2o,t1_jwztzuf,/r/drawing/comments/15vys2o/dragon_girl_laid_an_egg/jx04kfq/
38,jx0meqa,Due-Pin-3884,"I don't have ""Let's Get Weird"" tattooed on my chest for no reason!","I don't have ""Let's Get Weird"" tattooed on my chest for no reason!",2,2023-08-20 16:50:40,<praw.models.comment_forest.CommentForest object at 0x0000022EEDF425E0>,15vys2o,drawing,t5_2qvp9,,False,True,t3_15vys2o,t1_jwzl4qu,/r/drawing/comments/15vys2o/dragon_girl_laid_an_egg/jx0meqa/
39,jwydanu,Due-Pin-3884,"The egg thing was my own idea on the topic but oddly enough, the half dragon half elf thing has been fairly well explored. Ultimately, it's magic, I just thought it was a cool, different idea.
 https://www.reddit.com/r/dndnext/comments/132cp3e/if_a_silver_dragon_shape_changes_into_a_high_elf/?utm_source=share&utm_medium=android_app&utm_name=androidcss&utm_term=1&utm_content=1","The egg thing was my own idea on the topic but oddly enough, the half dragon half elf thing has been fairly well explored. Ultimately, it's magic, I just thought it was a cool, different idea.
 https://www.reddit.com/r/dndnext/comments/132cp3e/if_a_silver_dragon_shape_changes_into_a_high_elf/?utm_source=share&utm_medium=android_app&utm_name=androidcss&utm_term=1&utm_content=1",3,2023-08-20 03:48:29,<praw.models.comment_forest.CommentForest object at 0x0000022EEDF42940>,15vys2o,drawing,t5_2qvp9,,False,True,t3_15vys2o,t1_jwycujh,/r/drawing/comments/15vys2o/dragon_girl_laid_an_egg/jwydanu/
40,jwyclzu,Due-Pin-3884,"Yeah I intended for her to look like she was sitting closer to the ground, but as happens so often, it didn't come out like that. I'm still learning and will use this experience to do better the next time a dragon knocks up an elf in my brain.","Yeah I intended for her to look like she was sitting closer to the ground, but as happens so often, it didn't come out like that. I'm still learning and will use this experience to do better the next time a dragon knocks up an elf in my brain.",1,2023-08-20 03:42:42,<praw.models.comment_forest.CommentForest object at 0x0000022EEDF42B80>,15vys2o,drawing,t5_2qvp9,,False,True,t3_15vys2o,t1_jwycd1e,/r/drawing/comments/15vys2o/dragon_girl_laid_an_egg/jwyclzu/
41,jwywtpv,Due-Pin-3884,"Ok. So whats your point? That people can't draw and post what they like, only what you approve of?

How about this instead: block me and never see anything I draw again and we will both be happier :)","Ok. So whats your point? That people can't draw and post what they like, only what you approve of?

How about this instead: block me and never see anything I draw again and we will both be happier :)",3,2023-08-20 07:16:03,<praw.models.comment_forest.CommentForest object at 0x0000022EEDF42F40>,15vys2o,drawing,t5_2qvp9,,False,True,t3_15vys2o,t1_jwywmr6,/r/drawing/comments/15vys2o/dragon_girl_laid_an_egg/jwywtpv/
42,jwz0mzr,birdb0p,"Right, I was entirely certain this was ovipositor kink related. Seems like op just likes pathfinder????","Right, I was entirely certain this was ovipositor kink related. Seems like op just likes pathfinder????",1,2023-08-20 08:05:27,<praw.models.comment_forest.CommentForest object at 0x0000022EEDF42FA0>,15vys2o,drawing,t5_2qvp9,,False,False,t3_15vys2o,t1_jwywmr6,/r/drawing/comments/15vys2o/dragon_girl_laid_an_egg/jwz0mzr/
43,jx0ct5z,Due-Pin-3884,">the overall message & topic of the drawing is disturbing

To you. 

I don't consider it dirty, tasteless or disgusting.

Thanks for sharing your opinion though.",">the overall message & topic of the drawing is disturbing

To you. 

I don't consider it dirty, tasteless or disgusting.

Thanks for sharing your opinion though.",0,2023-08-20 15:47:12,<praw.models.comment_forest.CommentForest object at 0x0000022EEDF44460>,15vys2o,drawing,t5_2qvp9,,False,True,t3_15vys2o,t1_jx04kfq,/r/drawing/comments/15vys2o/dragon_girl_laid_an_egg/jx0ct5z/
44,i96xbho,BattleLars,Aint this litterarly just porn,Aint this litterarly just porn,27,2022-05-19 12:00:57,<praw.models.comment_forest.CommentForest object at 0x0000022EEDF4F580>,ut018e,drawing,t5_2qvp9,,False,False,t3_ut018e,t3_ut018e,/r/drawing/comments/ut018e/breathless_by_me/i96xbho/
45,i96y17j,,"Nudity is one thing, now we're just getting belligerent with straight up porn 😂","Nudity is one thing, now we're just getting belligerent with straight up porn 😂",15,2022-05-19 12:07:50,<praw.models.comment_forest.CommentForest object at 0x0000022EEDF4F5E0>,ut018e,drawing,t5_2qvp9,,False,False,t3_ut018e,t3_ut018e,/r/drawing/comments/ut018e/breathless_by_me/i96y17j/
46,i972ops,kross0ver,This is just trolling.,This is just trolling.,5,2022-05-19 12:51:00,<praw.models.comment_forest.CommentForest object at 0x0000022EEDF4F640>,ut018e,drawing,t5_2qvp9,,False,False,t3_ut018e,t3_ut018e,/r/drawing/comments/ut018e/breathless_by_me/i972ops/
47,i97139e,ADodson88,Go away. We're tired of seeing your shitty porn.,Go away. We're tired of seeing your shitty porn.,8,2022-05-19 12:36:46,<praw.models.comment_forest.CommentForest object at 0x0000022EEDF4F6A0>,ut018e,drawing,t5_2qvp9,,False,False,t3_ut018e,t3_ut018e,/r/drawing/comments/ut018e/breathless_by_me/i97139e/
48,i986g5e,Warm_Masterpiece716,I'm sick of these retarded troll porn post on this sub do to a subreddit made for porn drawings ffs,I'm sick of these retarded troll porn post on this sub do to a subreddit made for porn drawings ffs,2,2022-05-19 17:33:21,<praw.models.comment_forest.CommentForest object at 0x0000022EEDF4F700>,ut018e,drawing,t5_2qvp9,,False,False,t3_ut018e,t3_ut018e,/r/drawing/comments/ut018e/breathless_by_me/i986g5e/
49,i98ot0z,BigHardDkNBubblegum,"This was very well done 👍

Don't get discouraged by the haters. 

Intractable impotence takes a hefty psychological toll on some guys, and anything that reminds them just how utterly useless their manhood has become tends to make them a little cranky.","This was very well done 👍

Don't get discouraged by the haters. 

Intractable impotence takes a hefty psychological toll on some guys, and anything that reminds them just how utterly useless their manhood has become tends to make them a little cranky.",2,2022-05-19 19:37:57,<praw.models.comment_forest.CommentForest object at 0x0000022EEDF4F7C0>,ut018e,drawing,t5_2qvp9,,False,False,t3_ut018e,t3_ut018e,/r/drawing/comments/ut018e/breathless_by_me/i98ot0z/
50,i990uag,HubCitySwami,This ain't porn. Cinemax at the most.,This ain't porn. Cinemax at the most.,2,2022-05-19 21:14:04,<praw.models.comment_forest.CommentForest object at 0x0000022EEDF4F880>,ut018e,drawing,t5_2qvp9,,False,False,t3_ut018e,t3_ut018e,/r/drawing/comments/ut018e/breathless_by_me/i990uag/
51,i988hmq,Apocalypticeuphoria,Lol sorry for the ppl who got offended but this is literally flaired nsfw so I don't understand why you're pissed..? it's still art..it's drawing..maybe you should just choose the option in your settings that blurrs nsfw.,Lol sorry for the ppl who got offended but this is literally flaired nsfw so I don't understand why you're pissed..? it's still art..it's drawing..maybe you should just choose the option in your settings that blurrs nsfw.,3,2022-05-19 17:46:55,<praw.models.comment_forest.CommentForest object at 0x0000022EEDF4F8E0>,ut018e,drawing,t5_2qvp9,,False,True,t3_ut018e,t3_ut018e,/r/drawing/comments/ut018e/breathless_by_me/i988hmq/
52,i97b8z8,Dense_Look8596,Don’t listen to these people I live for this kind of art. Fuck the haters!,Don’t listen to these people I live for this kind of art. Fuck the haters!,1,2022-05-19 13:59:25,<praw.models.comment_forest.CommentForest object at 0x0000022EEDF4F940>,ut018e,drawing,t5_2qvp9,,False,False,t3_ut018e,t3_ut018e,/r/drawing/comments/ut018e/breathless_by_me/i97b8z8/
53,i989e9c,,"Also: braless!

It's a beautiful drawing ♡","Also: braless!

It's a beautiful drawing ♡",0,2022-05-19 17:52:58,<praw.models.comment_forest.CommentForest object at 0x0000022EEDF4FAC0>,ut018e,drawing,t5_2qvp9,,False,False,t3_ut018e,t3_ut018e,/r/drawing/comments/ut018e/breathless_by_me/i989e9c/
54,i96xx57,Wretchhh,Booba,Booba,-2,2022-05-19 12:06:45,<praw.models.comment_forest.CommentForest object at 0x0000022EEDF4FB80>,ut018e,drawing,t5_2qvp9,,False,False,t3_ut018e,t3_ut018e,/r/drawing/comments/ut018e/breathless_by_me/i96xx57/
55,iyp2r4r,LowOptimal6259,I know this one! It’s by Candy Love on PornHub,I know this one! It’s by Candy Love on PornHub,1,2022-12-03 01:25:46,<praw.models.comment_forest.CommentForest object at 0x0000022EEDF4FBE0>,ut018e,drawing,t5_2qvp9,,False,False,t3_ut018e,t3_ut018e,/r/drawing/comments/ut018e/breathless_by_me/iyp2r4r/
56,i976j47,SilasWater,"Good work, :) it’s beautiful. & you even managed to push the buttons of a redditor who doesn’t get any.","Good work, :) it’s beautiful. & you even managed to push the buttons of a redditor who doesn’t get any.",-4,2022-05-19 13:22:55,<praw.models.comment_forest.CommentForest object at 0x0000022EEDF4F760>,ut018e,drawing,t5_2qvp9,,False,False,t3_ut018e,t1_i97139e,/r/drawing/comments/ut018e/breathless_by_me/i976j47/
57,ia9h8pi,,I think it was just due to timing. There was a post saying there's way too much nudity posted and this post seemed to be like it was intentionally perpetuating it is all.,I think it was just due to timing. There was a post saying there's way too much nudity posted and this post seemed to be like it was intentionally perpetuating it is all.,2,2022-05-28 01:19:19,<praw.models.comment_forest.CommentForest object at 0x0000022EEDF4F9A0>,ut018e,drawing,t5_2qvp9,,False,False,t3_ut018e,t1_i988hmq,/r/drawing/comments/ut018e/breathless_by_me/ia9h8pi/
