,ID,Author,body,Comment,Score,Created On,Replies,Submission,Subreddit,Subreddit_ID,Distinguished,Edited,Is_submitter,link_id,Parent_id,Permalink
317,j5tmj4j,legionzero_net,"I’ve found that seminal shows and movies the phrase “you had to be there” applies heavily (apologies for the assumption, but this is the vibe I get). 
Is it overrated by today’s standards. Yes, absolutely. 
Was it overrated when it came out. No, it subverted expectations and was a very fresh type of story. It felt like something new from the Star Wars universe (sans Jedi) a sci-fi western, which was very cool and something that hasn’t been done right since recently with the Mandalorian. It’s not perfect. 

Also, early 2000’s was filled with reality tv, it was so nice to have a good sci-fi show that wasn’t a cheap spin off.

Personally I do think it holds it’s place next to Farscape, Star Trek, BSG and other great sci-fi shows.","I’ve found that seminal shows and movies the phrase “you had to be there” applies heavily (apologies for the assumption, but this is the vibe I get). 
Is it overrated by today’s standards. Yes, absolutely. 
Was it overrated when it came out. No, it subverted expectations and was a very fresh type of story. It felt like something new from the Star Wars universe (sans Jedi) a sci-fi western, which was very cool and something that hasn’t been done right since recently with the Mandalorian. It’s not perfect. 

Also, early 2000’s was filled with reality tv, it was so nice to have a good sci-fi show that wasn’t a cheap spin off.

Personally I do think it holds it’s place next to Farscape, Star Trek, BSG and other great sci-fi shows.",6,2023-01-25 14:12:37,<praw.models.comment_forest.CommentForest object at 0x0000022EF3AE14C0>,10kgt1u,scifi,t5_2qh2z,,False,False,t3_10kgt1u,t3_10kgt1u,/r/scifi/comments/10kgt1u/am_i_the_only_one_that_thinks_firefly_is_terribly/j5tmj4j/
318,j5qjekp,New_Persimmon_77,"I have heard this sentiment a lot over the years. Especially from folks that didn't experience the disappointment of the cancelation announcement. I honestly don't think it would be as talked about if that didn't happen. I am a fan too, but feel that has more attraction than the content of the show.","I have heard this sentiment a lot over the years. Especially from folks that didn't experience the disappointment of the cancelation announcement. I honestly don't think it would be as talked about if that didn't happen. I am a fan too, but feel that has more attraction than the content of the show.",13,2023-01-24 21:32:34,<praw.models.comment_forest.CommentForest object at 0x0000022EF3AE1520>,10kgt1u,scifi,t5_2qh2z,,False,False,t3_10kgt1u,t3_10kgt1u,/r/scifi/comments/10kgt1u/am_i_the_only_one_that_thinks_firefly_is_terribly/j5qjekp/
319,j5sp579,wgr-aw,"I rewatched recently and didn't find the first couple of episodes as good as I remembered

But it does pick up after about episode 3 or 4

It also was ground breaking at the time and really original, whereas there's more copies of it these days (cough guardians of the galaxy) to scratch some of the itch. Still good in its own right but not as good and as original.","I rewatched recently and didn't find the first couple of episodes as good as I remembered

But it does pick up after about episode 3 or 4

It also was ground breaking at the time and really original, whereas there's more copies of it these days (cough guardians of the galaxy) to scratch some of the itch. Still good in its own right but not as good and as original.",4,2023-01-25 07:53:26,<praw.models.comment_forest.CommentForest object at 0x0000022EF3AE15E0>,10kgt1u,scifi,t5_2qh2z,,False,False,t3_10kgt1u,t3_10kgt1u,/r/scifi/comments/10kgt1u/am_i_the_only_one_that_thinks_firefly_is_terribly/j5sp579/
320,j5qjj7g,Halaku,"It has a very unique voice, and it either sings to you or it doesn't.","It has a very unique voice, and it either sings to you or it doesn't.",14,2023-01-24 21:33:22,<praw.models.comment_forest.CommentForest object at 0x0000022EF3AE16A0>,10kgt1u,scifi,t5_2qh2z,,False,False,t3_10kgt1u,t3_10kgt1u,/r/scifi/comments/10kgt1u/am_i_the_only_one_that_thinks_firefly_is_terribly/j5qjj7g/
321,j5qyiol,Arfguy,"For me, the characters are what makes Firefly a cut above every other science fiction show.

There are plenty of ensemble shows that if you take any two characters and just have them interact, it can be mindnumbingly boring.

With Firefly, I can't imagine any sequence where there was interaction between two characters that I would ever consider fast forwarding through. Each character was really well established and each of the actors were so perfect in their role, that it's impossible for me to not love it.

Best ensemble to ever grace TV, IMO.","For me, the characters are what makes Firefly a cut above every other science fiction show.

There are plenty of ensemble shows that if you take any two characters and just have them interact, it can be mindnumbingly boring.

With Firefly, I can't imagine any sequence where there was interaction between two characters that I would ever consider fast forwarding through. Each character was really well established and each of the actors were so perfect in their role, that it's impossible for me to not love it.

Best ensemble to ever grace TV, IMO.",10,2023-01-24 23:09:09,<praw.models.comment_forest.CommentForest object at 0x0000022EF3AE1760>,10kgt1u,scifi,t5_2qh2z,,False,False,t3_10kgt1u,t3_10kgt1u,/r/scifi/comments/10kgt1u/am_i_the_only_one_that_thinks_firefly_is_terribly/j5qyiol/
322,j5qw2vw,McVapeNL,"I liked Firefly and the Serenity but if I had to compare it with Farscape then I would honestly say Farscape was far better (and yes I know they had 4 seasons + 2 part mini).  
Had Firefly been given the chance to grow, it might have been even better than it already was, but Fox is known for cancelling shows for no reason that makes any real sense.","I liked Firefly and the Serenity but if I had to compare it with Farscape then I would honestly say Farscape was far better (and yes I know they had 4 seasons + 2 part mini).  
Had Firefly been given the chance to grow, it might have been even better than it already was, but Fox is known for cancelling shows for no reason that makes any real sense.",8,2023-01-24 22:53:09,<praw.models.comment_forest.CommentForest object at 0x0000022EF3AE1880>,10kgt1u,scifi,t5_2qh2z,,False,False,t3_10kgt1u,t3_10kgt1u,/r/scifi/comments/10kgt1u/am_i_the_only_one_that_thinks_firefly_is_terribly/j5qw2vw/
323,j5qsjgv,BlueEyedPumpkinHead,Blasphemer!,Blasphemer!,13,2023-01-24 22:30:00,<praw.models.comment_forest.CommentForest object at 0x0000022EF3AE1940>,10kgt1u,scifi,t5_2qh2z,,False,False,t3_10kgt1u,t3_10kgt1u,/r/scifi/comments/10kgt1u/am_i_the_only_one_that_thinks_firefly_is_terribly/j5qsjgv/
324,j5qj29q,MX-Nacho,"Not every series is for everyone. 

I never really liked Star Wars, for example. Too wishy-washy.","Not every series is for everyone. 

I never really liked Star Wars, for example. Too wishy-washy.",12,2023-01-24 21:30:28,<praw.models.comment_forest.CommentForest object at 0x0000022EF3AE19A0>,10kgt1u,scifi,t5_2qh2z,,False,False,t3_10kgt1u,t3_10kgt1u,/r/scifi/comments/10kgt1u/am_i_the_only_one_that_thinks_firefly_is_terribly/j5qj29q/
325,j5qpeic,ZPGuru,Its like Buffy to me. It was awesome at the time when I was a child. It aged extremely poorly and is too cheesy and campy to watch now.,Its like Buffy to me. It was awesome at the time when I was a child. It aged extremely poorly and is too cheesy and campy to watch now.,7,2023-01-24 22:09:45,<praw.models.comment_forest.CommentForest object at 0x0000022EF3AE1A00>,10kgt1u,scifi,t5_2qh2z,,False,False,t3_10kgt1u,t3_10kgt1u,/r/scifi/comments/10kgt1u/am_i_the_only_one_that_thinks_firefly_is_terribly/j5qpeic/
326,j5qnsjh,Tuchaka7,You might be? I think it was great.,You might be? I think it was great.,8,2023-01-24 21:59:28,<praw.models.comment_forest.CommentForest object at 0x0000022EF3AE1AC0>,10kgt1u,scifi,t5_2qh2z,,False,False,t3_10kgt1u,t3_10kgt1u,/r/scifi/comments/10kgt1u/am_i_the_only_one_that_thinks_firefly_is_terribly/j5qnsjh/
327,j5r3ux8,dogged_jon,"I'm 67yo, and I think of Firefly a bit like the early seasons of M.A.S.H.   M.A.S.H started out as just another straight comedy/farce, and the show and characters grew from there.  I think Firefly could have used some changes(less old west firearms&clothes?),  but I still think it was great and wish it could have continued.  I bought the dvds","I'm 67yo, and I think of Firefly a bit like the early seasons of M.A.S.H.   M.A.S.H started out as just another straight comedy/farce, and the show and characters grew from there.  I think Firefly could have used some changes(less old west firearms&clothes?),  but I still think it was great and wish it could have continued.  I bought the dvds",5,2023-01-24 23:44:40,<praw.models.comment_forest.CommentForest object at 0x0000022EF3AE1B80>,10kgt1u,scifi,t5_2qh2z,,False,False,t3_10kgt1u,t3_10kgt1u,/r/scifi/comments/10kgt1u/am_i_the_only_one_that_thinks_firefly_is_terribly/j5r3ux8/
328,j5qzuei,razordreamz,I thought it was amazing,I thought it was amazing,5,2023-01-24 23:17:58,<praw.models.comment_forest.CommentForest object at 0x0000022EF3AE1BE0>,10kgt1u,scifi,t5_2qh2z,,False,False,t3_10kgt1u,t3_10kgt1u,/r/scifi/comments/10kgt1u/am_i_the_only_one_that_thinks_firefly_is_terribly/j5qzuei/
329,j5u3r27,Top_Glass7974,"You’re not wrong. Borrowed the DVDs from a friend watched the first couple episodes. It started strong. I like the attempt at realism (no sound in space) but then as I watched the episodes I lost interest. I quit watching at the start of the episode where they rob a train or something. Even tried reading the comic book that came out about 4 years ago. Nothing. Didn’t care about any characters. Nothing.

People call it a space western like it’s a badge of honor. All it means to me is you can turn Serenity into a stagecoach and not miss a beat. Just watch a western then.","You’re not wrong. Borrowed the DVDs from a friend watched the first couple episodes. It started strong. I like the attempt at realism (no sound in space) but then as I watched the episodes I lost interest. I quit watching at the start of the episode where they rob a train or something. Even tried reading the comic book that came out about 4 years ago. Nothing. Didn’t care about any characters. Nothing.

People call it a space western like it’s a badge of honor. All it means to me is you can turn Serenity into a stagecoach and not miss a beat. Just watch a western then.",2,2023-01-25 16:08:18,<praw.models.comment_forest.CommentForest object at 0x0000022EF3AE1C40>,10kgt1u,scifi,t5_2qh2z,,False,False,t3_10kgt1u,t3_10kgt1u,/r/scifi/comments/10kgt1u/am_i_the_only_one_that_thinks_firefly_is_terribly/j5u3r27/
330,j5uwkig,bankrobberdub,Yes.,Yes.,2,2023-01-25 19:05:41,<praw.models.comment_forest.CommentForest object at 0x0000022EF3AE1CA0>,10kgt1u,scifi,t5_2qh2z,,False,False,t3_10kgt1u,t3_10kgt1u,/r/scifi/comments/10kgt1u/am_i_the_only_one_that_thinks_firefly_is_terribly/j5uwkig/
331,j5v0i8f,thorleywinston,"I like Firefly but after fifteen plus years of hearing Browcoats highjack nearly ever sci fi message board I've been on to complain about it being canceled, I've gotten the point where I delight in tormenting them about it.

;)

All kidding aside - it was a good show in terms of writing and characters.  I wouldn't put it in my top ten sci fi franchises though but I think it's an important part of the Whedonverse.","I like Firefly but after fifteen plus years of hearing Browcoats highjack nearly ever sci fi message board I've been on to complain about it being canceled, I've gotten the point where I delight in tormenting them about it.

;)

All kidding aside - it was a good show in terms of writing and characters.  I wouldn't put it in my top ten sci fi franchises though but I think it's an important part of the Whedonverse.",2,2023-01-25 19:29:52,<praw.models.comment_forest.CommentForest object at 0x0000022EF3AE1D00>,10kgt1u,scifi,t5_2qh2z,,False,False,t3_10kgt1u,t3_10kgt1u,/r/scifi/comments/10kgt1u/am_i_the_only_one_that_thinks_firefly_is_terribly/j5v0i8f/
332,j5wp08n,boardjock,"Yes, you are the only one who thinks that.","Yes, you are the only one who thinks that.",2,2023-01-26 02:08:59,<praw.models.comment_forest.CommentForest object at 0x0000022EF3AE1D60>,10kgt1u,scifi,t5_2qh2z,,False,False,t3_10kgt1u,t3_10kgt1u,/r/scifi/comments/10kgt1u/am_i_the_only_one_that_thinks_firefly_is_terribly/j5wp08n/
333,j63e6s7,BeefyKeith420,I think you're pretty overrated,I think you're pretty overrated,2,2023-01-27 12:55:54,<praw.models.comment_forest.CommentForest object at 0x0000022EF3AE1DC0>,10kgt1u,scifi,t5_2qh2z,,False,False,t3_10kgt1u,t3_10kgt1u,/r/scifi/comments/10kgt1u/am_i_the_only_one_that_thinks_firefly_is_terribly/j63e6s7/
334,j680qji,pfemme2,I really enjoyed it back when I first watched it! Then I tried to re-watch it many years later and… meh? It doesn’t seem to have much re-watch value. I didn’t sink into it with any excitement or nostalgia. I’m not sure why not. Maybe there was never all that much there there. I found it pleasant! I watched a couple eps and was done.,I really enjoyed it back when I first watched it! Then I tried to re-watch it many years later and… meh? It doesn’t seem to have much re-watch value. I didn’t sink into it with any excitement or nostalgia. I’m not sure why not. Maybe there was never all that much there there. I found it pleasant! I watched a couple eps and was done.,2,2023-01-28 11:28:49,<praw.models.comment_forest.CommentForest object at 0x0000022EF3AE1E80>,10kgt1u,scifi,t5_2qh2z,,False,False,t3_10kgt1u,t3_10kgt1u,/r/scifi/comments/10kgt1u/am_i_the_only_one_that_thinks_firefly_is_terribly/j680qji/
335,j5qyu61,SnooPaintings5597,"I tried to share Firefly with a friend at work.  He couldn’t watch more than 20 minutes before he turned it off in disgust.  I felt that way too when I watched it when it came out on TV.  I didn’t actually watch it until years later at the behest of a different friend who insisted I watch all the way.  I think it’s great but one must power through their initial opinion to get to the real joy.

My guy at work REFUSES and actually stopped taking my recommendations for sometime after that… he absolutely hated it.","I tried to share Firefly with a friend at work.  He couldn’t watch more than 20 minutes before he turned it off in disgust.  I felt that way too when I watched it when it came out on TV.  I didn’t actually watch it until years later at the behest of a different friend who insisted I watch all the way.  I think it’s great but one must power through their initial opinion to get to the real joy.

My guy at work REFUSES and actually stopped taking my recommendations for sometime after that… he absolutely hated it.",5,2023-01-24 23:11:16,<praw.models.comment_forest.CommentForest object at 0x0000022EF3AE1FA0>,10kgt1u,scifi,t5_2qh2z,,False,False,t3_10kgt1u,t3_10kgt1u,/r/scifi/comments/10kgt1u/am_i_the_only_one_that_thinks_firefly_is_terribly/j5qyu61/
336,j5rcmov,itsgoingtobeebanned,"There's an episode that starts with a dead cow fetus display while two characters are dating- its probably one of the funniest lines of TV ever. 

It's not a great sci fi show but it is an AMAZING Western set in space. Same reason Buffy got a culture following - Whedon writes great characters with relatable and witty dialogue.","There's an episode that starts with a dead cow fetus display while two characters are dating- its probably one of the funniest lines of TV ever. 

It's not a great sci fi show but it is an AMAZING Western set in space. Same reason Buffy got a culture following - Whedon writes great characters with relatable and witty dialogue.",2,2023-01-25 00:45:25,<praw.models.comment_forest.CommentForest object at 0x0000022EF3AE30A0>,10kgt1u,scifi,t5_2qh2z,,False,False,t3_10kgt1u,t3_10kgt1u,/r/scifi/comments/10kgt1u/am_i_the_only_one_that_thinks_firefly_is_terribly/j5rcmov/
337,j5r2sb8,Sage-Like_Wisdom,"I tried to give it a shot this year. I’m 38 and a huge sci-fi nerd. I don’t like it much. I think it could be good if redone today, but it’s cringey at times. Stargate remains the GOAT.","I tried to give it a shot this year. I’m 38 and a huge sci-fi nerd. I don’t like it much. I think it could be good if redone today, but it’s cringey at times. Stargate remains the GOAT.",3,2023-01-24 23:37:27,<praw.models.comment_forest.CommentForest object at 0x0000022EF3AE3160>,10kgt1u,scifi,t5_2qh2z,,False,False,t3_10kgt1u,t3_10kgt1u,/r/scifi/comments/10kgt1u/am_i_the_only_one_that_thinks_firefly_is_terribly/j5r2sb8/
338,j5qluvl,Beech_driver,Just my $0.02 cents of anecdotal experience. I never watched the series when it first came out because I was in the military overseas and didn’t have cable so never even had a chance. Later I watched the movie Serenity and thought it was good so afterwards decided to try the series. I watched a couple episodes and lost interest ……,Just my $0.02 cents of anecdotal experience. I never watched the series when it first came out because I was in the military overseas and didn’t have cable so never even had a chance. Later I watched the movie Serenity and thought it was good so afterwards decided to try the series. I watched a couple episodes and lost interest ……,4,2023-01-24 21:47:37,<praw.models.comment_forest.CommentForest object at 0x0000022EF3AE3220>,10kgt1u,scifi,t5_2qh2z,,False,False,t3_10kgt1u,t3_10kgt1u,/r/scifi/comments/10kgt1u/am_i_the_only_one_that_thinks_firefly_is_terribly/j5qluvl/
339,j5r8hl5,shambolika,"I'm generally a snob with my sci-fi. ,I find a lot of stuff with huge fandoms don't do it for me, therefore I put off watching Firefly until a couple of weeks ago, didn't expect much but was pleasantly surprised. 
so here's this snob's rating:
Even tho it's dated and I'm sure the Chinese pronunciation is terrible and there's very few Chinese characters despite them all speaking Chinese (how the f does that work?), it's so *white* and straight, even tho there are times when the writers are trying too hard to get across some moral message instead of just shooting or airlocking a mofo, I am still watching it to the end (final episode this evening). 3.25 stars","I'm generally a snob with my sci-fi. ,I find a lot of stuff with huge fandoms don't do it for me, therefore I put off watching Firefly until a couple of weeks ago, didn't expect much but was pleasantly surprised. 
so here's this snob's rating:
Even tho it's dated and I'm sure the Chinese pronunciation is terrible and there's very few Chinese characters despite them all speaking Chinese (how the f does that work?), it's so *white* and straight, even tho there are times when the writers are trying too hard to get across some moral message instead of just shooting or airlocking a mofo, I am still watching it to the end (final episode this evening). 3.25 stars",2,2023-01-25 00:16:32,<praw.models.comment_forest.CommentForest object at 0x0000022EF3AE3280>,10kgt1u,scifi,t5_2qh2z,,False,False,t3_10kgt1u,t3_10kgt1u,/r/scifi/comments/10kgt1u/am_i_the_only_one_that_thinks_firefly_is_terribly/j5r8hl5/
340,j5rfy3c,Pyrofoo,"It was definitely overhyped for me before I saw it. I did enjoy it quite a bit. It wasn't the greatest show ever, but it definitely scratched an itch and was solid sci fi entertainment on a major network. Firefly and Serenity are both great watches, but I still don't think either lives up to the hype I was initially sold.","It was definitely overhyped for me before I saw it. I did enjoy it quite a bit. It wasn't the greatest show ever, but it definitely scratched an itch and was solid sci fi entertainment on a major network. Firefly and Serenity are both great watches, but I still don't think either lives up to the hype I was initially sold.",2,2023-01-25 01:09:11,<praw.models.comment_forest.CommentForest object at 0x0000022EF3AE32E0>,10kgt1u,scifi,t5_2qh2z,,False,False,t3_10kgt1u,t3_10kgt1u,/r/scifi/comments/10kgt1u/am_i_the_only_one_that_thinks_firefly_is_terribly/j5rfy3c/
341,j5rr52s,budcub,"I'm with you. I think it was around 2012 when Facebook was full of Firefly memes being all ""greatest show on television ever made"" so I went and watched the whole thing on streaming. It was alright, it had some good moments but not legendary TV.","I'm with you. I think it was around 2012 when Facebook was full of Firefly memes being all ""greatest show on television ever made"" so I went and watched the whole thing on streaming. It was alright, it had some good moments but not legendary TV.",2,2023-01-25 02:30:54,<praw.models.comment_forest.CommentForest object at 0x0000022EF3AE3340>,10kgt1u,scifi,t5_2qh2z,,False,False,t3_10kgt1u,t3_10kgt1u,/r/scifi/comments/10kgt1u/am_i_the_only_one_that_thinks_firefly_is_terribly/j5rr52s/
342,j5r8fnu,penubly,"I watched  all the episodes, thought it was decent but not spectacular. I never want to watch them again and that is my measure of a good show. My overall thought is this: If it hadn't been canceled, the very people who love it so much would the ones talking about how bad it was.","I watched  all the episodes, thought it was decent but not spectacular. I never want to watch them again and that is my measure of a good show. My overall thought is this: If it hadn't been canceled, the very people who love it so much would the ones talking about how bad it was.",1,2023-01-25 00:16:10,<praw.models.comment_forest.CommentForest object at 0x0000022EF3AE33A0>,10kgt1u,scifi,t5_2qh2z,,False,False,t3_10kgt1u,t3_10kgt1u,/r/scifi/comments/10kgt1u/am_i_the_only_one_that_thinks_firefly_is_terribly/j5r8fnu/
343,j5tr8f7,CNTrash,"Nah, you're correct. There are a few good episodes and some quippy, quotable  lines. The characters are charming and the actors are good in their roles. The aesthetic is neat—Space Westerns have been done before but not live action with an okay budget.

Maybe it would have gotten good after another season or two. I doubt it, and here's why:

* It is fundamentally based on racism. There's a glorification of the Confederate side in the iconography and themes, which I don't think you can excise from the backstory. There's the apparent genocide of all Chinese people after they spoke into space, with everyone cursing in Mandarin but no Asians in sight.
* We know where Inarra's plot would have gone thanks to Whedon's notes, and it's absolutely ghastly—both misogynist claptrap and just bad writing.
* The movie indicates that Whedon would have just fallen into his usual writing traps and shorthands and his weird fetishism of tiny girls with tiny feet kicking ass.

In conclusion, just watch *Farscape* again. It did all the same tropes but much better.","Nah, you're correct. There are a few good episodes and some quippy, quotable  lines. The characters are charming and the actors are good in their roles. The aesthetic is neat—Space Westerns have been done before but not live action with an okay budget.

Maybe it would have gotten good after another season or two. I doubt it, and here's why:

* It is fundamentally based on racism. There's a glorification of the Confederate side in the iconography and themes, which I don't think you can excise from the backstory. There's the apparent genocide of all Chinese people after they spoke into space, with everyone cursing in Mandarin but no Asians in sight.
* We know where Inarra's plot would have gone thanks to Whedon's notes, and it's absolutely ghastly—both misogynist claptrap and just bad writing.
* The movie indicates that Whedon would have just fallen into his usual writing traps and shorthands and his weird fetishism of tiny girls with tiny feet kicking ass.

In conclusion, just watch *Farscape* again. It did all the same tropes but much better.",1,2023-01-25 14:46:19,<praw.models.comment_forest.CommentForest object at 0x0000022EF3AE3400>,10kgt1u,scifi,t5_2qh2z,,False,False,t3_10kgt1u,t3_10kgt1u,/r/scifi/comments/10kgt1u/am_i_the_only_one_that_thinks_firefly_is_terribly/j5tr8f7/
344,j5r32ez,neonandcircuitry,Yes,Yes,2,2023-01-24 23:39:21,<praw.models.comment_forest.CommentForest object at 0x0000022EF3AE3460>,10kgt1u,scifi,t5_2qh2z,,False,False,t3_10kgt1u,t3_10kgt1u,/r/scifi/comments/10kgt1u/am_i_the_only_one_that_thinks_firefly_is_terribly/j5r32ez/
345,j5qzl6e,AJSLS6,"I know I'll get flamed for this but I wa5ched firefly when it cam3 out and hated it, hated the aesthetic and the tropish characters and the simplistic stories. I stopped watching a few eps in and forgot about it til Serenity came out.  Loved the movie, now I love the show, though I still recognize the things that made it a hard watch first time round. 

I really really didn't like westerns when I was younger so I was definitely biased against it.","I know I'll get flamed for this but I wa5ched firefly when it cam3 out and hated it, hated the aesthetic and the tropish characters and the simplistic stories. I stopped watching a few eps in and forgot about it til Serenity came out.  Loved the movie, now I love the show, though I still recognize the things that made it a hard watch first time round. 

I really really didn't like westerns when I was younger so I was definitely biased against it.",2,2023-01-24 23:16:16,<praw.models.comment_forest.CommentForest object at 0x0000022EF3AE3520>,10kgt1u,scifi,t5_2qh2z,,False,False,t3_10kgt1u,t3_10kgt1u,/r/scifi/comments/10kgt1u/am_i_the_only_one_that_thinks_firefly_is_terribly/j5qzl6e/
