,ID,Author,body,Comment,Score,Created On,Replies,Submission,Subreddit,Subreddit_ID,Distinguished,Edited,Is_submitter,link_id,Parent_id,Permalink
522,jc8msjv,Cthucoocachoo,I was the target age group when these books came out. I thought they sucked then and I think they suck now. Suzanne Collins stole the idea from Battle Royal and poorly tried to jam 1984 into it. It was bland in 2009 and it spawned dozens of blander copycat books and films,I was the target age group when these books came out. I thought they sucked then and I think they suck now. Suzanne Collins stole the idea from Battle Royal and poorly tried to jam 1984 into it. It was bland in 2009 and it spawned dozens of blander copycat books and films,3,2023-03-15 02:00:39,<praw.models.comment_forest.CommentForest object at 0x0000022EF3B34250>,11rab3m,scifi,t5_2qh2z,,False,False,t3_11rab3m,t3_11rab3m,/r/scifi/comments/11rab3m/this_is_the_reason_the_hunger_games_stands_out/jc8msjv/
523,jc8015d,FanaticEgalitarian,Red Rising is the best YA dystopia series. Fite me,Red Rising is the best YA dystopia series. Fite me,2,2023-03-14 18:30:32,<praw.models.comment_forest.CommentForest object at 0x0000022EF3B342B0>,11rab3m,scifi,t5_2qh2z,,False,False,t3_11rab3m,t3_11rab3m,/r/scifi/comments/11rab3m/this_is_the_reason_the_hunger_games_stands_out/jc8015d/
524,jc8n5rb,Mister-Matrix,"If you don't want to read the entire article, click on this block of text for their reasoning...

(Spoiler Alert)

>!However, what truly sets The Hunger Games apart from other YA dystopias is something at the very core of its world-building: the bleakness ingrained in its universe and its materialist system of oppression.!<","If you don't want to read the entire article, click on this block of text for their reasoning...

(Spoiler Alert)

>!However, what truly sets The Hunger Games apart from other YA dystopias is something at the very core of its world-building: the bleakness ingrained in its universe and its materialist system of oppression.!<",2,2023-03-15 02:03:06,<praw.models.comment_forest.CommentForest object at 0x0000022EF3B34310>,11rab3m,scifi,t5_2qh2z,,False,False,t3_11rab3m,t3_11rab3m,/r/scifi/comments/11rab3m/this_is_the_reason_the_hunger_games_stands_out/jc8n5rb/
525,jc7qqbf,sabrinajestar,"I never thought it was particularly good, but here's how I remember this: the ""YA Dystopia"" genre did not exist until after *The Hunger Games* came out. Because of its popularity it was predictably followed by a bunch of quickly-churned-out copycats.","I never thought it was particularly good, but here's how I remember this: the ""YA Dystopia"" genre did not exist until after *The Hunger Games* came out. Because of its popularity it was predictably followed by a bunch of quickly-churned-out copycats.",-1,2023-03-14 17:32:32,<praw.models.comment_forest.CommentForest object at 0x0000022EF3B34370>,11rab3m,scifi,t5_2qh2z,,False,False,t3_11rab3m,t3_11rab3m,/r/scifi/comments/11rab3m/this_is_the_reason_the_hunger_games_stands_out/jc7qqbf/
526,jcffe8l,soapinthepeehole,"Seriously.  It stands out because it has better production value, bigger stars, and a slightly more archetypal story than the others.","Seriously.  It stands out because it has better production value, bigger stars, and a slightly more archetypal story than the others.",1,2023-03-16 13:27:07,<praw.models.comment_forest.CommentForest object at 0x0000022EF3B33FD0>,11rab3m,scifi,t5_2qh2z,,False,False,t3_11rab3m,t1_jc7iro8,/r/scifi/comments/11rab3m/this_is_the_reason_the_hunger_games_stands_out/jcffe8l/
527,jqylk40,kjm6351,Talk about a pretentious literary wannabe lol.,Talk about a pretentious literary wannabe lol.,1,2023-07-07 00:08:15,<praw.models.comment_forest.CommentForest object at 0x0000022EF3B34130>,11rab3m,scifi,t5_2qh2z,,False,False,t3_11rab3m,t1_jc7mq6d,/r/scifi/comments/11rab3m/this_is_the_reason_the_hunger_games_stands_out/jqylk40/
528,jc8lgzd,VampyreOfNazareth,The truth is always simple.,The truth is always simple.,2,2023-03-15 01:51:56,<praw.models.comment_forest.CommentForest object at 0x0000022EF3B341F0>,11rab3m,scifi,t5_2qh2z,,False,False,t3_11rab3m,t1_jc7pmgi,/r/scifi/comments/11rab3m/this_is_the_reason_the_hunger_games_stands_out/jc8lgzd/
529,jc7u2l4,DistortedReflector,"“A Wrinkle in Time” was published decades earlier, and “The Giver” was out 5 years prior which would have been the actual catalyst for the ~2010 glut of YA dystopian novels and subsequent movies.","“A Wrinkle in Time” was published decades earlier, and “The Giver” was out 5 years prior which would have been the actual catalyst for the ~2010 glut of YA dystopian novels and subsequent movies.",6,2023-03-14 17:53:17,<praw.models.comment_forest.CommentForest object at 0x0000022EF3B34430>,11rab3m,scifi,t5_2qh2z,,False,False,t3_11rab3m,t1_jc7qqbf,/r/scifi/comments/11rab3m/this_is_the_reason_the_hunger_games_stands_out/jc7u2l4/
530,jc7rd58,boundegar,"I'm quite sure it did exist, not only for my Millennial son, but for my own Boomer childhood.","I'm quite sure it did exist, not only for my Millennial son, but for my own Boomer childhood.",5,2023-03-14 17:36:30,<praw.models.comment_forest.CommentForest object at 0x0000022EF3B34490>,11rab3m,scifi,t5_2qh2z,,False,False,t3_11rab3m,t1_jc7qqbf,/r/scifi/comments/11rab3m/this_is_the_reason_the_hunger_games_stands_out/jc7rd58/
531,jc8mzrt,troyofearth,"The original, as far as I know, is John Wyndham's the Chrysalids, which is 1955. Teenage main character, must escape the oppressive society that developed due to nuclear radiation. To me that's the core YA story. I'd be interested to know if there are any earlier examples though.","The original, as far as I know, is John Wyndham's the Chrysalids, which is 1955. Teenage main character, must escape the oppressive society that developed due to nuclear radiation. To me that's the core YA story. I'd be interested to know if there are any earlier examples though.",1,2023-03-15 02:01:59,<praw.models.comment_forest.CommentForest object at 0x0000022EF3B344F0>,11rab3m,scifi,t5_2qh2z,,False,False,t3_11rab3m,t1_jc7u2l4,/r/scifi/comments/11rab3m/this_is_the_reason_the_hunger_games_stands_out/jc8mzrt/
532,hj0drzu,AthKaElGal,"after having watched foundation, dune is a masterpiece in adaptation. i've watched all adaptations of Dune and imo, Villenueve's Dune is the best adaptation of them all.","after having watched foundation, dune is a masterpiece in adaptation. i've watched all adaptations of Dune and imo, Villenueve's Dune is the best adaptation of them all.",13,2021-11-02 13:43:46,<praw.models.comment_forest.CommentForest object at 0x0000022EF0DF5D60>,qkzfw4,scifi,t5_2qh2z,,False,False,t3_qkzfw4,t3_qkzfw4,/r/scifi/comments/qkzfw4/saw_the_dune_movie_and_didnt_really_enjoy_it/hj0drzu/
533,hj05gkz,Smugallo,"Man I loved it.  Been waiting form 25 years for a big budget adaption, I have a few nitpicks but overall I'm impressed.  Looking forward to part 2.  Just remember at one point 10 years ago Peter Berg was attached to direct and write, thank fuck that never happened.","Man I loved it.  Been waiting form 25 years for a big budget adaption, I have a few nitpicks but overall I'm impressed.  Looking forward to part 2.  Just remember at one point 10 years ago Peter Berg was attached to direct and write, thank fuck that never happened.",10,2021-11-02 12:34:37,<praw.models.comment_forest.CommentForest object at 0x0000022EF0DF5EE0>,qkzfw4,scifi,t5_2qh2z,,False,False,t3_qkzfw4,t3_qkzfw4,/r/scifi/comments/qkzfw4/saw_the_dune_movie_and_didnt_really_enjoy_it/hj05gkz/
534,hj0zxfk,8livesdown,"That's fine. It's a heavy book.  If they'd made it an action movie, it would be yet another failed Hollywood adaptation.","That's fine. It's a heavy book.  If they'd made it an action movie, it would be yet another failed Hollywood adaptation.",3,2021-11-02 16:20:02,<praw.models.comment_forest.CommentForest object at 0x0000022EF0DF60A0>,qkzfw4,scifi,t5_2qh2z,,False,False,t3_qkzfw4,t3_qkzfw4,/r/scifi/comments/qkzfw4/saw_the_dune_movie_and_didnt_really_enjoy_it/hj0zxfk/
535,hj02u2x,Cpl_Hicks76,"Second movie isn’t a ‘sequel’, it’s part two of the same story.","Second movie isn’t a ‘sequel’, it’s part two of the same story.",7,2021-11-02 12:09:27,<praw.models.comment_forest.CommentForest object at 0x0000022EF0DF63A0>,qkzfw4,scifi,t5_2qh2z,,False,False,t3_qkzfw4,t3_qkzfw4,/r/scifi/comments/qkzfw4/saw_the_dune_movie_and_didnt_really_enjoy_it/hj02u2x/
536,hj2paau,TheWoodSloth,"This may seem like an odd gripe, but I would have really like a few montages instead of the cinematic dead pans. I really don't get why montages and direct exposition are out of vogue. Instead they add those slow singular shots of like the pile of bodies. Without directly explaining a lot of the bat-shit crazy sci Fi ideas it felt both cluttered and haphazard in its pacing. I would thought it is a good movie, and would recommend a watch; but I did not find it ground breaking or visionary. That just feels weird, for what dune is.","This may seem like an odd gripe, but I would have really like a few montages instead of the cinematic dead pans. I really don't get why montages and direct exposition are out of vogue. Instead they add those slow singular shots of like the pile of bodies. Without directly explaining a lot of the bat-shit crazy sci Fi ideas it felt both cluttered and haphazard in its pacing. I would thought it is a good movie, and would recommend a watch; but I did not find it ground breaking or visionary. That just feels weird, for what dune is.",2,2021-11-02 22:59:46,<praw.models.comment_forest.CommentForest object at 0x0000022EF0DF66A0>,qkzfw4,scifi,t5_2qh2z,,False,False,t3_qkzfw4,t3_qkzfw4,/r/scifi/comments/qkzfw4/saw_the_dune_movie_and_didnt_really_enjoy_it/hj2paau/
537,hizrm39,livinginlouth,It all felt rushed. No time taken to develop anything. I felt really let down by it.,It all felt rushed. No time taken to develop anything. I felt really let down by it.,1,2021-11-02 09:53:01,<praw.models.comment_forest.CommentForest object at 0x0000022EF0DF6820>,qkzfw4,scifi,t5_2qh2z,,False,False,t3_qkzfw4,t3_qkzfw4,/r/scifi/comments/qkzfw4/saw_the_dune_movie_and_didnt_really_enjoy_it/hizrm39/
538,hizmhje,deepfield67,"I do feel that it's a sci-fi movie where none of the sci-fi aspects get explored. It should more accurately be called high fantasy. I liked it a lot for the atmosphere and overall aesthetic. I liked the actors, the sets, the script, the CGI looked great, score was good, but I would have liked to have seen the science fleshed out a little bit more, and a more in depth exploration of the mythos. Presumably part two will focus more on the Fremen and we'll learn more about the culture and language and philosophy that's hinted at in part one. I wouldn't have minded a 3 part movie where each was a bit shorter and focused in on the ideas they presented a little more. But overall I enjoyed it a lot.

Edit: Oh, I instantly realized why this sub sucks. It's full of bandwagoners. Every post in here criticizing it has been down voted to hell and back. Good job, everyone, this is why most people think scifi nerds are a bunch of elitist, neckbearded basement dwellers.","I do feel that it's a sci-fi movie where none of the sci-fi aspects get explored. It should more accurately be called high fantasy. I liked it a lot for the atmosphere and overall aesthetic. I liked the actors, the sets, the script, the CGI looked great, score was good, but I would have liked to have seen the science fleshed out a little bit more, and a more in depth exploration of the mythos. Presumably part two will focus more on the Fremen and we'll learn more about the culture and language and philosophy that's hinted at in part one. I wouldn't have minded a 3 part movie where each was a bit shorter and focused in on the ideas they presented a little more. But overall I enjoyed it a lot.

Edit: Oh, I instantly realized why this sub sucks. It's full of bandwagoners. Every post in here criticizing it has been down voted to hell and back. Good job, everyone, this is why most people think scifi nerds are a bunch of elitist, neckbearded basement dwellers.",2,2021-11-02 08:34:10,<praw.models.comment_forest.CommentForest object at 0x0000022EF0DF69A0>,qkzfw4,scifi,t5_2qh2z,,1635892700.0,False,t3_qkzfw4,t3_qkzfw4,/r/scifi/comments/qkzfw4/saw_the_dune_movie_and_didnt_really_enjoy_it/hizmhje/
539,hizs0y5,manudanz,Interesting review - Can't wait to see it - Star wars episode 1 & 2 had the exact same feel you describe here.,Interesting review - Can't wait to see it - Star wars episode 1 & 2 had the exact same feel you describe here.,1,2021-11-02 09:59:03,<praw.models.comment_forest.CommentForest object at 0x0000022EF0DF6FA0>,qkzfw4,scifi,t5_2qh2z,,False,False,t3_qkzfw4,t3_qkzfw4,/r/scifi/comments/qkzfw4/saw_the_dune_movie_and_didnt_really_enjoy_it/hizs0y5/
540,hizvgfo,kai_ekael,"Characters were simply offensive to me.

Leto: Duke? No. Showing fear, uncertainty in front of an Emperor representative? No, not Leto.

Jessica: They completely ruined her. Whining, fearful, crying mess.

Gurney: Who? Oh, loud instructor. No quips, no music.

Duncan: Well, maybe not bad here other than the lack of beard. That was just...weird. I'm not a fan of Duncan in general.

The Baron: Oh great, another Evil worthy of worship because he is so, damn, scary and cleary so smart you're already dead. Roman wastoid looking for tasty children? Nope.

Last, Shai-Hulud: Turn'em into a big circle mouth? Ignore 50 year old art? Shame.","Characters were simply offensive to me.

Leto: Duke? No. Showing fear, uncertainty in front of an Emperor representative? No, not Leto.

Jessica: They completely ruined her. Whining, fearful, crying mess.

Gurney: Who? Oh, loud instructor. No quips, no music.

Duncan: Well, maybe not bad here other than the lack of beard. That was just...weird. I'm not a fan of Duncan in general.

The Baron: Oh great, another Evil worthy of worship because he is so, damn, scary and cleary so smart you're already dead. Roman wastoid looking for tasty children? Nope.

Last, Shai-Hulud: Turn'em into a big circle mouth? Ignore 50 year old art? Shame.",-9,2021-11-02 10:45:31,<praw.models.comment_forest.CommentForest object at 0x0000022EF0DF7160>,qkzfw4,scifi,t5_2qh2z,,False,False,t3_qkzfw4,t3_qkzfw4,/r/scifi/comments/qkzfw4/saw_the_dune_movie_and_didnt_really_enjoy_it/hizvgfo/
541,hiztsa1,2_Fingers_of_Whiskey,"I do feel like the director played it safe. It’s very “by the numbers” Dune. Paul’s mom is too young, when I first saw a pic of them together I thought she was playing Chani. I enjoyed Oscar Isaac & Jason Momoa’s performances. I think part two will be a lot more interesting. I’ve read the book twice and saw the Lynch film.","I do feel like the director played it safe. It’s very “by the numbers” Dune. Paul’s mom is too young, when I first saw a pic of them together I thought she was playing Chani. I enjoyed Oscar Isaac & Jason Momoa’s performances. I think part two will be a lot more interesting. I’ve read the book twice and saw the Lynch film.",-5,2021-11-02 10:23:25,<praw.models.comment_forest.CommentForest object at 0x0000022EF0DF72E0>,qkzfw4,scifi,t5_2qh2z,,False,False,t3_qkzfw4,t3_qkzfw4,/r/scifi/comments/qkzfw4/saw_the_dune_movie_and_didnt_really_enjoy_it/hiztsa1/
542,hizqmjv,Son_of_Atreus,"Damn, OP just saw this and the repost on r/truefilm back to back in my feed. Thought it was funny. Carry on with the analysis.","Damn, OP just saw this and the repost on r/truefilm back to back in my feed. Thought it was funny. Carry on with the analysis.",-2,2021-11-02 09:38:40,<praw.models.comment_forest.CommentForest object at 0x0000022EF0DF75E0>,qkzfw4,scifi,t5_2qh2z,,False,False,t3_qkzfw4,t3_qkzfw4,/r/scifi/comments/qkzfw4/saw_the_dune_movie_and_didnt_really_enjoy_it/hizqmjv/
543,hizw1xy,Xaser125,"Yeah, lets see if theres a part2 to fix it up if ever","Yeah, lets see if theres a part2 to fix it up if ever",-2,2021-11-02 10:53:11,<praw.models.comment_forest.CommentForest object at 0x0000022EF0DF7BE0>,qkzfw4,scifi,t5_2qh2z,,False,False,t3_qkzfw4,t3_qkzfw4,/r/scifi/comments/qkzfw4/saw_the_dune_movie_and_didnt_really_enjoy_it/hizw1xy/
544,hizpbda,donmcs,"Wow. we are on the same page!
I didn't care for any single character.","Wow. we are on the same page!
I didn't care for any single character.",-6,2021-11-02 09:18:47,<praw.models.comment_forest.CommentForest object at 0x0000022EF0DF80A0>,qkzfw4,scifi,t5_2qh2z,,False,False,t3_qkzfw4,t3_qkzfw4,/r/scifi/comments/qkzfw4/saw_the_dune_movie_and_didnt_really_enjoy_it/hizpbda/
545,hizmdbq,enfreezd,"Great review, why did you write extraordinary as extra ordinary, i feel like the the word already captures the essence of what you were trying to convey","Great review, why did you write extraordinary as extra ordinary, i feel like the the word already captures the essence of what you were trying to convey",-11,2021-11-02 08:32:21,<praw.models.comment_forest.CommentForest object at 0x0000022EF0E1CEE0>,qkzfw4,scifi,t5_2qh2z,,False,False,t3_qkzfw4,t3_qkzfw4,/r/scifi/comments/qkzfw4/saw_the_dune_movie_and_didnt_really_enjoy_it/hizmdbq/
546,iqf2hag,pjx1,You watched the wrong one. Go enjoy the David Lynch version.,You watched the wrong one. Go enjoy the David Lynch version.,1,2022-09-29 21:16:17,<praw.models.comment_forest.CommentForest object at 0x0000022EF0E1E220>,qkzfw4,scifi,t5_2qh2z,,False,False,t3_qkzfw4,t3_qkzfw4,/r/scifi/comments/qkzfw4/saw_the_dune_movie_and_didnt_really_enjoy_it/iqf2hag/
547,hjpvwq0,TheShreester,"I have a lot of nitpicks, so I can't rate it 10/10 or even 9, but it's a solid 8 for me and the best film adaptation yet. The BBC TV series is a 7 while Lynch's 1984 movie is a 6.","I have a lot of nitpicks, so I can't rate it 10/10 or even 9, but it's a solid 8 for me and the best film adaptation yet. The BBC TV series is a 7 while Lynch's 1984 movie is a 6.",1,2021-11-07 20:32:35,<praw.models.comment_forest.CommentForest object at 0x0000022EF0DF6220>,qkzfw4,scifi,t5_2qh2z,,False,False,t3_qkzfw4,t1_hj05gkz,/r/scifi/comments/qkzfw4/saw_the_dune_movie_and_didnt_really_enjoy_it/hjpvwq0/
548,hj34alu,Make-Believe_Macabre,"Really? I felt that it dragged, especially in the beginning. It felt like the pilot episode on an HBO miniseries.","Really? I felt that it dragged, especially in the beginning. It felt like the pilot episode on an HBO miniseries.",2,2021-11-03 00:43:05,<praw.models.comment_forest.CommentForest object at 0x0000022EF0DF6B20>,qkzfw4,scifi,t5_2qh2z,,False,False,t3_qkzfw4,t1_hizrm39,/r/scifi/comments/qkzfw4/saw_the_dune_movie_and_didnt_really_enjoy_it/hj34alu/
549,hj2ij98,kilgore_ted,They took 5 years what are you talking about,They took 5 years what are you talking about,1,2021-11-02 22:13:46,<praw.models.comment_forest.CommentForest object at 0x0000022EF0DF6CA0>,qkzfw4,scifi,t5_2qh2z,,False,False,t3_qkzfw4,t1_hizrm39,/r/scifi/comments/qkzfw4/saw_the_dune_movie_and_didnt_really_enjoy_it/hj2ij98/
550,hj2mngs,deepfield67,"Sorry your thought-out reply got down voted. It says a lot about the people in this sub. Better agree with the Dune circle jerkers or you get bandwagoned to death for having an opinion they don't like. A clear misuse of the voting system. Everyone in this thread criticizing the movie at all has been down voted several times. It's gross, I won't be coming back.","Sorry your thought-out reply got down voted. It says a lot about the people in this sub. Better agree with the Dune circle jerkers or you get bandwagoned to death for having an opinion they don't like. A clear misuse of the voting system. Everyone in this thread criticizing the movie at all has been down voted several times. It's gross, I won't be coming back.",0,2021-11-02 22:41:42,<praw.models.comment_forest.CommentForest object at 0x0000022EF0DF7460>,qkzfw4,scifi,t5_2qh2z,,False,False,t3_qkzfw4,t1_hizvgfo,/r/scifi/comments/qkzfw4/saw_the_dune_movie_and_didnt_really_enjoy_it/hj2mngs/
551,hizutr9,LawRecordings,"Hey man, Rebecca Ferguson is fit as fuck so keep your opinions about her being too young to yourself please. EDIT: meant to convey a tongue-in-cheek tone which wasn't apparent from my original post.","Hey man, Rebecca Ferguson is fit as fuck so keep your opinions about her being too young to yourself please. EDIT: meant to convey a tongue-in-cheek tone which wasn't apparent from my original post.",-1,2021-11-02 10:37:22,<praw.models.comment_forest.CommentForest object at 0x0000022EF0DF78E0>,qkzfw4,scifi,t5_2qh2z,,1635856407.0,False,t3_qkzfw4,t1_hiztsa1,/r/scifi/comments/qkzfw4/saw_the_dune_movie_and_didnt_really_enjoy_it/hizutr9/
552,hj1kceo,exelion18120,Part two was green lit last week,Part two was green lit last week,2,2021-11-02 18:34:38,<praw.models.comment_forest.CommentForest object at 0x0000022EF0DF8280>,qkzfw4,scifi,t5_2qh2z,,False,False,t3_qkzfw4,t1_hizw1xy,/r/scifi/comments/qkzfw4/saw_the_dune_movie_and_didnt_really_enjoy_it/hj1kceo/
553,hjpvjvv,TheShreester,"Part 2 won't fix Part 1 and it's idiotic to think it would.
They're just two parts of one story that was too long to make into a single film.","Part 2 won't fix Part 1 and it's idiotic to think it would.
They're just two parts of one story that was too long to make into a single film.",1,2021-11-07 20:30:16,<praw.models.comment_forest.CommentForest object at 0x0000022EF0E1CBE0>,qkzfw4,scifi,t5_2qh2z,,False,False,t3_qkzfw4,t1_hizw1xy,/r/scifi/comments/qkzfw4/saw_the_dune_movie_and_didnt_really_enjoy_it/hjpvjvv/
554,hizmhdb,FreedomEagle76,"I didnt notice tbh, thanks for letting me know.","I didnt notice tbh, thanks for letting me know.",-4,2021-11-02 08:34:05,<praw.models.comment_forest.CommentForest object at 0x0000022EF0E1E3A0>,qkzfw4,scifi,t5_2qh2z,,1635842343.0,True,t3_qkzfw4,t1_hizmdbq,/r/scifi/comments/qkzfw4/saw_the_dune_movie_and_didnt_really_enjoy_it/hizmhdb/
555,hjpyylg,Smugallo,"I believe time will be kind to this movie, and part will elevate it.  I have not picks too, but damn they done a great job.  Wife followed the plot no issue and we had a great conversation about it afterwards.  A win in my book.","I believe time will be kind to this movie, and part will elevate it.  I have not picks too, but damn they done a great job.  Wife followed the plot no issue and we had a great conversation about it afterwards.  A win in my book.",2,2021-11-07 20:52:12,<praw.models.comment_forest.CommentForest object at 0x0000022EF0DF6520>,qkzfw4,scifi,t5_2qh2z,,False,False,t3_qkzfw4,t1_hjpvwq0,/r/scifi/comments/qkzfw4/saw_the_dune_movie_and_didnt_really_enjoy_it/hjpyylg/
556,hj35gzy,livinginlouth,"Out of interest, how familiar are you with the book and other adaptations?

I wonder, as I know I bring a lot of expectations of the story I'd like to see. If that makes sense.","Out of interest, how familiar are you with the book and other adaptations?

I wonder, as I know I bring a lot of expectations of the story I'd like to see. If that makes sense.",2,2021-11-03 00:51:17,<praw.models.comment_forest.CommentForest object at 0x0000022EF0DF6E20>,qkzfw4,scifi,t5_2qh2z,,False,False,t3_qkzfw4,t1_hj34alu,/r/scifi/comments/qkzfw4/saw_the_dune_movie_and_didnt_really_enjoy_it/hj35gzy/
557,hj2onhi,kai_ekael,"Meh, got plenty up plus somewhere else. Probably HBO workers! :D

Read Dune for the first time when I was 13 or so, back in the eighties. The movie really felt like a let down to me.","Meh, got plenty up plus somewhere else. Probably HBO workers! :D

Read Dune for the first time when I was 13 or so, back in the eighties. The movie really felt like a let down to me.",1,2021-11-02 22:55:21,<praw.models.comment_forest.CommentForest object at 0x0000022EF0DF7760>,qkzfw4,scifi,t5_2qh2z,,False,False,t3_qkzfw4,t1_hj2mngs,/r/scifi/comments/qkzfw4/saw_the_dune_movie_and_didnt_really_enjoy_it/hj2onhi/
558,hizyn7p,not_an_Alien_Robot,She's 38. Timothy is 25. I'll let you do the math. It's not as bad for age casting as the Lynch version but it's not great.,She's 38. Timothy is 25. I'll let you do the math. It's not as bad for age casting as the Lynch version but it's not great.,1,2021-11-02 11:24:41,<praw.models.comment_forest.CommentForest object at 0x0000022EF0DF7FA0>,qkzfw4,scifi,t5_2qh2z,,False,False,t3_qkzfw4,t1_hizutr9,/r/scifi/comments/qkzfw4/saw_the_dune_movie_and_didnt_really_enjoy_it/hizyn7p/
559,hj1uwgf,Xaser125,"Oh, i wana see what comes out","Oh, i wana see what comes out",-1,2021-11-02 19:42:32,<praw.models.comment_forest.CommentForest object at 0x0000022EF0E1CD60>,qkzfw4,scifi,t5_2qh2z,,False,False,t3_qkzfw4,t1_hj1kceo,/r/scifi/comments/qkzfw4/saw_the_dune_movie_and_didnt_really_enjoy_it/hj1uwgf/
560,hjq603w,Xaser125,"Well the old one is in one part :)
If they make lord of the rings that long, they could do something like that here as well","Well the old one is in one part :)
If they make lord of the rings that long, they could do something like that here as well",1,2021-11-07 21:39:12,<praw.models.comment_forest.CommentForest object at 0x0000022EF0E1E0A0>,qkzfw4,scifi,t5_2qh2z,,False,False,t3_qkzfw4,t1_hjpvjvv,/r/scifi/comments/qkzfw4/saw_the_dune_movie_and_didnt_really_enjoy_it/hjq603w/
