,ID,Author,body,Comment,Score,Created On,Replies,Submission,Subreddit,Subreddit_ID,Distinguished,Edited,Is_submitter,link_id,Parent_id,Permalink
202,gy70rwn,,"A little late on this breaking news, no?","A little late on this breaking news, no?",34,2021-05-15 08:13:34,<praw.models.comment_forest.CommentForest object at 0x0000022EF3A0D9D0>,nctaei,scifi,t5_2qh2z,,False,False,t3_nctaei,t3_nctaei,/r/scifi/comments/nctaei/matrix_4_officially_a_go_with_keanu_reeves/gy70rwn/
203,gy72g20,Saw_Boss,They're onto post production now. Bit late with this one.,They're onto post production now. Bit late with this one.,24,2021-05-15 08:41:03,<praw.models.comment_forest.CommentForest object at 0x0000022EF3A0DB80>,nctaei,scifi,t5_2qh2z,,False,False,t3_nctaei,t3_nctaei,/r/scifi/comments/nctaei/matrix_4_officially_a_go_with_keanu_reeves/gy72g20/
204,gy7403z,Drakeer,Sweet. They were doing so well at the end of the last movie. Will be good to see how they settled down after the war ended.,Sweet. They were doing so well at the end of the last movie. Will be good to see how they settled down after the war ended.,8,2021-05-15 09:06:44,<praw.models.comment_forest.CommentForest object at 0x0000022EF3A0DC10>,nctaei,scifi,t5_2qh2z,,False,False,t3_nctaei,t3_nctaei,/r/scifi/comments/nctaei/matrix_4_officially_a_go_with_keanu_reeves/gy7403z/
205,gy7jl10,thrakkerzog,Why would they jump straight to four after the first one?,Why would they jump straight to four after the first one?,7,2021-05-15 12:43:40,<praw.models.comment_forest.CommentForest object at 0x0000022EF3A0DFA0>,nctaei,scifi,t5_2qh2z,,False,False,t3_nctaei,t3_nctaei,/r/scifi/comments/nctaei/matrix_4_officially_a_go_with_keanu_reeves/gy7jl10/
206,gy801g0,RepostSleuthBot,"This link has been shared 66 times.

First Seen [Here](https://redd.it/ct5aya) on 2019-08-20. Last Seen [Here](https://redd.it/idwv4e) on 2020-08-21

Feedback? Hate? Visit r/repostsleuthbot - 

---

**Scope:** Reddit | **Check Title:** False | **Max Age:** 99999 | **Searched Links:** 100,622,135 | **Search Time:** 0.0s","This link has been shared 66 times.

First Seen [Here](https://redd.it/ct5aya) on 2019-08-20. Last Seen [Here](https://redd.it/idwv4e) on 2020-08-21

Feedback? Hate? Visit r/repostsleuthbot - 

---

**Scope:** Reddit | **Check Title:** False | **Max Age:** 99999 | **Searched Links:** 100,622,135 | **Search Time:** 0.0s",5,2021-05-15 15:13:25,<praw.models.comment_forest.CommentForest object at 0x0000022EF3A0F040>,nctaei,scifi,t5_2qh2z,,False,False,t3_nctaei,t3_nctaei,/r/scifi/comments/nctaei/matrix_4_officially_a_go_with_keanu_reeves/gy801g0/
207,gy77qwf,LessWorseMoreBad,Didn't trinity die?..,Didn't trinity die?..,3,2021-05-15 10:07:54,<praw.models.comment_forest.CommentForest object at 0x0000022EF3A0F1C0>,nctaei,scifi,t5_2qh2z,,False,False,t3_nctaei,t3_nctaei,/r/scifi/comments/nctaei/matrix_4_officially_a_go_with_keanu_reeves/gy77qwf/
208,gy9efsj,Snugmeatsock,After Jupiter Ascending I’m not very hopeful,After Jupiter Ascending I’m not very hopeful,3,2021-05-15 22:09:21,<praw.models.comment_forest.CommentForest object at 0x0000022EF3A0F1F0>,nctaei,scifi,t5_2qh2z,,False,False,t3_nctaei,t3_nctaei,/r/scifi/comments/nctaei/matrix_4_officially_a_go_with_keanu_reeves/gy9efsj/
209,gy7lmmu,muduke,"Man, imagine OPs delight when they hear it's coming out in 6 months.","Man, imagine OPs delight when they hear it's coming out in 6 months.",2,2021-05-15 13:04:25,<praw.models.comment_forest.CommentForest object at 0x0000022EF3A0F7C0>,nctaei,scifi,t5_2qh2z,,False,False,t3_nctaei,t3_nctaei,/r/scifi/comments/nctaei/matrix_4_officially_a_go_with_keanu_reeves/gy7lmmu/
210,gy7e5dz,,"Wait, did I miss 2 and 3?","Wait, did I miss 2 and 3?",0,2021-05-15 11:40:06,<praw.models.comment_forest.CommentForest object at 0x0000022EF3A0F820>,nctaei,scifi,t5_2qh2z,,False,False,t3_nctaei,t3_nctaei,/r/scifi/comments/nctaei/matrix_4_officially_a_go_with_keanu_reeves/gy7e5dz/
211,gy7m6t1,stefantalpalaru,"> and Lana Wachowski

It's going to be terrible, won't it?","> and Lana Wachowski

It's going to be terrible, won't it?",-6,2021-05-15 13:10:09,<praw.models.comment_forest.CommentForest object at 0x0000022EF3A0F880>,nctaei,scifi,t5_2qh2z,,False,False,t3_nctaei,t3_nctaei,/r/scifi/comments/nctaei/matrix_4_officially_a_go_with_keanu_reeves/gy7m6t1/
212,gy70kdp,,"only half the wackos?
edit : uh. you guys really dont like that comment. i just think its weird because they made the matrix together.","only half the wackos?
edit : uh. you guys really dont like that comment. i just think its weird because they made the matrix together.",-21,2021-05-15 08:10:09,<praw.models.comment_forest.CommentForest object at 0x0000022EF3A0FA00>,nctaei,scifi,t5_2qh2z,,1621068624.0,False,t3_nctaei,t3_nctaei,/r/scifi/comments/nctaei/matrix_4_officially_a_go_with_keanu_reeves/gy70kdp/
213,gy8hsgp,SlowCrates,They landed the moon!!!!!,They landed the moon!!!!!,0,2021-05-15 17:36:04,<praw.models.comment_forest.CommentForest object at 0x0000022EF3A0FC40>,nctaei,scifi,t5_2qh2z,,False,False,t3_nctaei,t3_nctaei,/r/scifi/comments/nctaei/matrix_4_officially_a_go_with_keanu_reeves/gy8hsgp/
214,gym2k0x,AliB3,"IMDb says it’s coming December 2021 but still no plot or trailer, I have doubts.","IMDb says it’s coming December 2021 but still no plot or trailer, I have doubts.",1,2021-05-18 20:22:37,<praw.models.comment_forest.CommentForest object at 0x0000022EF3A0FD00>,nctaei,scifi,t5_2qh2z,,False,False,t3_nctaei,t3_nctaei,/r/scifi/comments/nctaei/matrix_4_officially_a_go_with_keanu_reeves/gym2k0x/
215,gz0xjrb,DanLewisFW,Isnt this done filming? I think the officially a go happened before they started filming.,Isnt this done filming? I think the officially a go happened before they started filming.,1,2021-05-22 04:48:56,<praw.models.comment_forest.CommentForest object at 0x0000022EF3A0FDC0>,nctaei,scifi,t5_2qh2z,,False,False,t3_nctaei,t3_nctaei,/r/scifi/comments/nctaei/matrix_4_officially_a_go_with_keanu_reeves/gz0xjrb/
216,gy792xg,GillyMonster18,"This is the glitch in the matrix, something’s been changed.","This is the glitch in the matrix, something’s been changed.",7,2021-05-15 10:28:57,<praw.models.comment_forest.CommentForest object at 0x0000022EF3A0DBB0>,nctaei,scifi,t5_2qh2z,,False,False,t3_nctaei,t1_gy70rwn,/r/scifi/comments/nctaei/matrix_4_officially_a_go_with_keanu_reeves/gy792xg/
217,gy790ow,GillyMonster18,Yep.  Stabbed through the torso and limbs by like six different pieces of rebar.,Yep.  Stabbed through the torso and limbs by like six different pieces of rebar.,5,2021-05-15 10:27:59,<praw.models.comment_forest.CommentForest object at 0x0000022EF3A0F220>,nctaei,scifi,t5_2qh2z,,False,False,t3_nctaei,t1_gy77qwf,/r/scifi/comments/nctaei/matrix_4_officially_a_go_with_keanu_reeves/gy790ow/
218,gy7e3gs,BallClamps,They both died.,They both died.,4,2021-05-15 11:39:25,<praw.models.comment_forest.CommentForest object at 0x0000022EF3A0F3D0>,nctaei,scifi,t5_2qh2z,,False,False,t3_nctaei,t1_gy77qwf,/r/scifi/comments/nctaei/matrix_4_officially_a_go_with_keanu_reeves/gy7e3gs/
219,gy7r9we,gmuslera,"Matrix can revive them from their brain images of the time they were connected, Neuromancer 2.0

Or do like Terminator and new agents looks like them.","Matrix can revive them from their brain images of the time they were connected, Neuromancer 2.0

Or do like Terminator and new agents looks like them.",1,2021-05-15 13:59:07,<praw.models.comment_forest.CommentForest object at 0x0000022EF3A0F700>,nctaei,scifi,t5_2qh2z,,False,False,t3_nctaei,t1_gy77qwf,/r/scifi/comments/nctaei/matrix_4_officially_a_go_with_keanu_reeves/gy7r9we/
220,gy7fid9,godset,"If you didn’t see them, then yes","If you didn’t see them, then yes",4,2021-05-15 11:57:00,<praw.models.comment_forest.CommentForest object at 0x0000022EF3A0F8E0>,nctaei,scifi,t5_2qh2z,,False,False,t3_nctaei,t1_gy7e5dz,/r/scifi/comments/nctaei/matrix_4_officially_a_go_with_keanu_reeves/gy7fid9/
221,gy7fh9w,,[deleted],[deleted],0,2021-05-15 11:56:38,<praw.models.comment_forest.CommentForest object at 0x0000022EF3A0F940>,nctaei,scifi,t5_2qh2z,,False,False,t3_nctaei,t1_gy7e5dz,/r/scifi/comments/nctaei/matrix_4_officially_a_go_with_keanu_reeves/gy7fh9w/
222,gy8ghf8,poorloko,Well... it's her world. What makes you worried about it? All I know of her work is the Matrix movies.,Well... it's her world. What makes you worried about it? All I know of her work is the Matrix movies.,1,2021-05-15 17:25:30,<praw.models.comment_forest.CommentForest object at 0x0000022EF3A0FB20>,nctaei,scifi,t5_2qh2z,,False,False,t3_nctaei,t1_gy7m6t1,/r/scifi/comments/nctaei/matrix_4_officially_a_go_with_keanu_reeves/gy8ghf8/
223,gy8ahcm,zz9zzza2,Yup. But it will have Correct Opinions.,Yup. But it will have Correct Opinions.,-3,2021-05-15 16:37:32,<praw.models.comment_forest.CommentForest object at 0x0000022EF3A0FB80>,nctaei,scifi,t5_2qh2z,,False,False,t3_nctaei,t1_gy7m6t1,/r/scifi/comments/nctaei/matrix_4_officially_a_go_with_keanu_reeves/gy8ahcm/
224,gy79zmt,timmaeus,OP is a black cat,OP is a black cat,2,2021-05-15 10:42:58,<praw.models.comment_forest.CommentForest object at 0x0000022EF3A0DF70>,nctaei,scifi,t5_2qh2z,,False,False,t3_nctaei,t1_gy792xg,/r/scifi/comments/nctaei/matrix_4_officially_a_go_with_keanu_reeves/gy79zmt/
225,gy7944j,ibrudiiv,And Neo became jesus,And Neo became jesus,4,2021-05-15 10:29:28,<praw.models.comment_forest.CommentForest object at 0x0000022EF3A0F400>,nctaei,scifi,t5_2qh2z,,False,False,t3_nctaei,t1_gy790ow,/r/scifi/comments/nctaei/matrix_4_officially_a_go_with_keanu_reeves/gy7944j/
226,gy7hr2v,LessWorseMoreBad,That shit'll buff out,That shit'll buff out,4,2021-05-15 12:23:41,<praw.models.comment_forest.CommentForest object at 0x0000022EF3A0F430>,nctaei,scifi,t5_2qh2z,,False,False,t3_nctaei,t1_gy790ow,/r/scifi/comments/nctaei/matrix_4_officially_a_go_with_keanu_reeves/gy7hr2v/
227,gy7s08o,,"Jokes aren't funny when you explain them, but hey... there was a meme a while ago where everyone just pretended The Matrix 2 and 3 weren't made, because they're so bad. Apparently it's no longer a meme.","Jokes aren't funny when you explain them, but hey... there was a meme a while ago where everyone just pretended The Matrix 2 and 3 weren't made, because they're so bad. Apparently it's no longer a meme.",-6,2021-05-15 14:05:41,<praw.models.comment_forest.CommentForest object at 0x0000022EF3A0F9A0>,nctaei,scifi,t5_2qh2z,,False,False,t3_nctaei,t1_gy7fid9,/r/scifi/comments/nctaei/matrix_4_officially_a_go_with_keanu_reeves/gy7s08o/
228,gy7s2x6,,"Jokes aren't funny when you explain them, but hey... there was a meme a while ago where everyone just pretended The Matrix 2 and 3 weren't made, because they're so bad. Apparently it's no longer a meme.","Jokes aren't funny when you explain them, but hey... there was a meme a while ago where everyone just pretended The Matrix 2 and 3 weren't made, because they're so bad. Apparently it's no longer a meme.",-8,2021-05-15 14:06:19,<praw.models.comment_forest.CommentForest object at 0x0000022EF3A0FAC0>,nctaei,scifi,t5_2qh2z,,False,False,t3_nctaei,t1_gy7fh9w,/r/scifi/comments/nctaei/matrix_4_officially_a_go_with_keanu_reeves/gy7s2x6/
229,gy8lpet,stefantalpalaru,"> All I know of her work is the Matrix movies.

Oh, you sweet summer child...","> All I know of her work is the Matrix movies.

Oh, you sweet summer child...",-1,2021-05-15 18:06:54,<praw.models.comment_forest.CommentForest object at 0x0000022EF3A0FBE0>,nctaei,scifi,t5_2qh2z,,False,False,t3_nctaei,t1_gy8ghf8,/r/scifi/comments/nctaei/matrix_4_officially_a_go_with_keanu_reeves/gy8lpet/
230,gy7a14t,timmaeus,"I watched the sequels once, and I forget almost all the details except for the Neo Jesus. The rest is a fever dream.","I watched the sequels once, and I forget almost all the details except for the Neo Jesus. The rest is a fever dream.",4,2021-05-15 10:43:36,<praw.models.comment_forest.CommentForest object at 0x0000022EF3A0F5E0>,nctaei,scifi,t5_2qh2z,,False,False,t3_nctaei,t1_gy7944j,/r/scifi/comments/nctaei/matrix_4_officially_a_go_with_keanu_reeves/gy7a14t/
231,gzzfdwc,Keanu990321,"I mean... he was played by Keanu Reeves, what did you expect?","I mean... he was played by Keanu Reeves, what did you expect?",1,2021-05-30 15:40:49,<praw.models.comment_forest.CommentForest object at 0x0000022EF3A0F610>,nctaei,scifi,t5_2qh2z,,False,False,t3_nctaei,t1_gy7944j,/r/scifi/comments/nctaei/matrix_4_officially_a_go_with_keanu_reeves/gzzfdwc/
232,gy7sev1,godset,Oh ok haha sorry for ruining your joke... I did not know that,Oh ok haha sorry for ruining your joke... I did not know that,-1,2021-05-15 14:09:14,<praw.models.comment_forest.CommentForest object at 0x0000022EF3A0FA60>,nctaei,scifi,t5_2qh2z,,False,False,t3_nctaei,t1_gy7s08o,/r/scifi/comments/nctaei/matrix_4_officially_a_go_with_keanu_reeves/gy7sev1/
233,gy8o363,poorloko,"Right, that's what I'm saying. What else should I look at to better qualify her as a filmmaker?","Right, that's what I'm saying. What else should I look at to better qualify her as a filmmaker?",2,2021-05-15 18:25:46,<praw.models.comment_forest.CommentForest object at 0x0000022EF3A0FCA0>,nctaei,scifi,t5_2qh2z,,False,False,t3_nctaei,t1_gy8lpet,/r/scifi/comments/nctaei/matrix_4_officially_a_go_with_keanu_reeves/gy8o363/
234,gysht6k,ibrudiiv,"Matrix 4 definitely has to be a prequel of sorts, or a story somewhere in between. Otherwise there's gonna be some real cheese going on, more than has already happened lol","Matrix 4 definitely has to be a prequel of sorts, or a story somewhere in between. Otherwise there's gonna be some real cheese going on, more than has already happened lol",1,2021-05-20 05:43:38,<praw.models.comment_forest.CommentForest object at 0x0000022EF3A0F640>,nctaei,scifi,t5_2qh2z,,False,False,t3_nctaei,t1_gy7a14t,/r/scifi/comments/nctaei/matrix_4_officially_a_go_with_keanu_reeves/gysht6k/
235,gy8pvd8,stefantalpalaru,"> What else should I look at to better qualify her as a filmmaker?

https://en.wikipedia.org/wiki/Sense8","> What else should I look at to better qualify her as a filmmaker?

https://en.wikipedia.org/wiki/Sense8",0,2021-05-15 18:40:14,<praw.models.comment_forest.CommentForest object at 0x0000022EF3A0FD60>,nctaei,scifi,t5_2qh2z,,False,False,t3_nctaei,t1_gy8o363,/r/scifi/comments/nctaei/matrix_4_officially_a_go_with_keanu_reeves/gy8pvd8/
236,gzzfful,Keanu990321,"Nope, it's a full sequel set after Revolutions.","Nope, it's a full sequel set after Revolutions.",1,2021-05-30 15:41:17,<praw.models.comment_forest.CommentForest object at 0x0000022EF3A0F760>,nctaei,scifi,t5_2qh2z,,False,False,t3_nctaei,t1_gysht6k,/r/scifi/comments/nctaei/matrix_4_officially_a_go_with_keanu_reeves/gzzfful/
237,gy8rxzd,poorloko,"Wikipedia says both seasons were met with warm critical reception. Seems you're just not a fan of her work, which is fine! I was hoping you'd make some kind of point since you were invested enough to post that you think it'll be bad. Anyway, thanks for sharing! Hope you're doing well.","Wikipedia says both seasons were met with warm critical reception. Seems you're just not a fan of her work, which is fine! I was hoping you'd make some kind of point since you were invested enough to post that you think it'll be bad. Anyway, thanks for sharing! Hope you're doing well.",1,2021-05-15 18:57:14,<praw.models.comment_forest.CommentForest object at 0x0000022EF3A0FE20>,nctaei,scifi,t5_2qh2z,,False,False,t3_nctaei,t1_gy8pvd8,/r/scifi/comments/nctaei/matrix_4_officially_a_go_with_keanu_reeves/gy8rxzd/
238,gy8ug54,AAVale,"The receptions seemed pretty tepid, and it was cancelled because the viewership was passionate, but not numerous.","The receptions seemed pretty tepid, and it was cancelled because the viewership was passionate, but not numerous.",1,2021-05-15 19:18:04,<praw.models.comment_forest.CommentForest object at 0x0000022EF3A0FEE0>,nctaei,scifi,t5_2qh2z,,False,False,t3_nctaei,t1_gy8rxzd,/r/scifi/comments/nctaei/matrix_4_officially_a_go_with_keanu_reeves/gy8ug54/
239,gy8s84y,stefantalpalaru,"> I was hoping you'd make some kind of point

I was hoping you were interested in watching her work.

> Hope you're doing well.

And the horse you rode on!","> I was hoping you'd make some kind of point

I was hoping you were interested in watching her work.

> Hope you're doing well.

And the horse you rode on!",0,2021-05-15 18:59:33,<praw.models.comment_forest.CommentForest object at 0x0000022EF3A0FF40>,nctaei,scifi,t5_2qh2z,,False,False,t3_nctaei,t1_gy8rxzd,/r/scifi/comments/nctaei/matrix_4_officially_a_go_with_keanu_reeves/gy8s84y/
240,gy8vbaf,poorloko,"Gotcha, that clarifies things. Thanks! I heard Netflix cancels anything that doesn't bring in new subscribers. Pretty harsh, but I get it.","Gotcha, that clarifies things. Thanks! I heard Netflix cancels anything that doesn't bring in new subscribers. Pretty harsh, but I get it.",2,2021-05-15 19:25:23,<praw.models.comment_forest.CommentForest object at 0x0000022EF3A0FFA0>,nctaei,scifi,t5_2qh2z,,False,False,t3_nctaei,t1_gy8ug54,/r/scifi/comments/nctaei/matrix_4_officially_a_go_with_keanu_reeves/gy8vbaf/
241,gy8ucjx,poorloko,"Well... I'm not going to sit and watch two seasons of a tv show just to continue a discussion with someone who isn't showing an interest in discussing anything. I'm sincere when I say I hope you're doing well, though. Feel free to keep responding if you'd like to talk more about Wachowski's movies or other works! I'd be glad to hear your opinions. Otherwise, I hope you have a good rest of your Saturday.","Well... I'm not going to sit and watch two seasons of a tv show just to continue a discussion with someone who isn't showing an interest in discussing anything. I'm sincere when I say I hope you're doing well, though. Feel free to keep responding if you'd like to talk more about Wachowski's movies or other works! I'd be glad to hear your opinions. Otherwise, I hope you have a good rest of your Saturday.",1,2021-05-15 19:17:13,<praw.models.comment_forest.CommentForest object at 0x0000022EF3A120A0>,nctaei,scifi,t5_2qh2z,,False,False,t3_nctaei,t1_gy8s84y,/r/scifi/comments/nctaei/matrix_4_officially_a_go_with_keanu_reeves/gy8ucjx/
242,gyevh5f,APeacefulWarrior,"Just to jump in, the Wachowskis' live-action Speed Racer has gained a big cult following over the years.  It bombed on release, but a lot of people (myself included) basically think it was misunderstood.  The visuals and use of visual storytelling are amazing.

Just be aware, it's nothing like the Matrix.  It's a movie ostensibly aimed at kids, based on a kids' show, and it revels in being the ultimate ""inner 8 year old"" movie.  Which is probably a big part of why it failed.

Or if you're in the mood for something more philosophical, check out ""Cloud Atlas.""  But it's very much a love-it-or-hate-it movie, which tends to produce very strong opinions on both sides.","Just to jump in, the Wachowskis' live-action Speed Racer has gained a big cult following over the years.  It bombed on release, but a lot of people (myself included) basically think it was misunderstood.  The visuals and use of visual storytelling are amazing.

Just be aware, it's nothing like the Matrix.  It's a movie ostensibly aimed at kids, based on a kids' show, and it revels in being the ultimate ""inner 8 year old"" movie.  Which is probably a big part of why it failed.

Or if you're in the mood for something more philosophical, check out ""Cloud Atlas.""  But it's very much a love-it-or-hate-it movie, which tends to produce very strong opinions on both sides.",2,2021-05-17 05:29:56,<praw.models.comment_forest.CommentForest object at 0x0000022EF3A12160>,nctaei,scifi,t5_2qh2z,,1621233590.0,False,t3_nctaei,t1_gy8ucjx,/r/scifi/comments/nctaei/matrix_4_officially_a_go_with_keanu_reeves/gyevh5f/
243,gyfr4gj,poorloko,They did Cloud Atlas? Ohhhhhhhh my. That really was... something. Now I get why the Wachowski's are a tough pair to pin down in terms of quality. Thanks for your comment!,They did Cloud Atlas? Ohhhhhhhh my. That really was... something. Now I get why the Wachowski's are a tough pair to pin down in terms of quality. Thanks for your comment!,2,2021-05-17 12:25:52,<praw.models.comment_forest.CommentForest object at 0x0000022EF3A12220>,nctaei,scifi,t5_2qh2z,,False,False,t3_nctaei,t1_gyevh5f,/r/scifi/comments/nctaei/matrix_4_officially_a_go_with_keanu_reeves/gyfr4gj/
244,gygtgqy,APeacefulWarrior,"Yeah, haha.  They do indeed have a very interesting body of work.

Oh, and I forgot to mention ""Bound,"" which was their first movie.  It's a low-budget crime thriller about a mobster's unappreciated girlfriend who hooks up with the apartment complex's handywoman, and then they scheme to rip off the mob while framing the boyfriend.  Definitely not the Wachowskis' most cerebral movie, but it's a lot of fun, and shows how visually creative they were right from the start.","Yeah, haha.  They do indeed have a very interesting body of work.

Oh, and I forgot to mention ""Bound,"" which was their first movie.  It's a low-budget crime thriller about a mobster's unappreciated girlfriend who hooks up with the apartment complex's handywoman, and then they scheme to rip off the mob while framing the boyfriend.  Definitely not the Wachowskis' most cerebral movie, but it's a lot of fun, and shows how visually creative they were right from the start.",2,2021-05-17 17:13:52,<praw.models.comment_forest.CommentForest object at 0x0000022EF3A0D940>,nctaei,scifi,t5_2qh2z,,False,False,t3_nctaei,t1_gyfr4gj,/r/scifi/comments/nctaei/matrix_4_officially_a_go_with_keanu_reeves/gygtgqy/
245,gyh7kzr,poorloko,"Oh that sounds like fun! I'll have to check that one out. 

As someone that seeks media as a form of escapism, I think I can respect the Wachowskis pretty well. Why make fantasy/sci Fi/[insert genre here] unless you're swinging for the fences? Cloud Atlas might not have been the greatest flick, but I'm glad it exists. Seemed like they were trying for a Blade Runner or Space Odyssey type of movie. With the concept and Tom Hanks in leading roles, it could've landed somewhere high in the pantheon. I think it may be worth a rewatch, too.","Oh that sounds like fun! I'll have to check that one out. 

As someone that seeks media as a form of escapism, I think I can respect the Wachowskis pretty well. Why make fantasy/sci Fi/[insert genre here] unless you're swinging for the fences? Cloud Atlas might not have been the greatest flick, but I'm glad it exists. Seemed like they were trying for a Blade Runner or Space Odyssey type of movie. With the concept and Tom Hanks in leading roles, it could've landed somewhere high in the pantheon. I think it may be worth a rewatch, too.",2,2021-05-17 18:50:57,<praw.models.comment_forest.CommentForest object at 0x0000022EF3A0FEB0>,nctaei,scifi,t5_2qh2z,,False,False,t3_nctaei,t1_gygtgqy,/r/scifi/comments/nctaei/matrix_4_officially_a_go_with_keanu_reeves/gyh7kzr/
246,j8zoyej,CobaltAzurean,GL's actual talent was taking the oldest fantasy tropes and putting it in space with surround sound.,GL's actual talent was taking the oldest fantasy tropes and putting it in space with surround sound.,143,2023-02-18 02:49:44,<praw.models.comment_forest.CommentForest object at 0x0000022EF3A3B5B0>,1154f9k,scifi,t5_2qh2z,,False,False,t3_1154f9k,t3_1154f9k,/r/scifi/comments/1154f9k/is_this_accurate_or_cringe_i_can_see_it_either_way/j8zoyej/
247,j8zogfs,Unable-Ladder-9190,"It doesn’t even make sense. First, his talent comes from his view? No, his story came from his view. His talent allowed him to write the story.
But if he truly had the whole story planned out why did he have the twin brother and sister kiss?
He wrote Star Wars and when it blew up that’s when he planned the sequel. The way the films play out bears this out. 
In Episodes 1-3 (prequels) we learn Ben Kenobi trained Anakin Skywalker so he would have known Princess Leia was a Skywalker and he would have known Luke was her twin. Yet he doesn’t tell Luke? Why not? 
Also, Anakin supposedly built C-3PO yet in Episode IV C-3PO never mentions that Darth Vader built him, and Vader nor Kenobi never mention it. 
There are plenty of instances that show that Lucas never had the extended story planned out, it was developed after the immense success of Star Wars (which did not have the title A New Hope until years later- A New Hope was only ever mentioned in the scrolling opening prologue for years)","It doesn’t even make sense. First, his talent comes from his view? No, his story came from his view. His talent allowed him to write the story.
But if he truly had the whole story planned out why did he have the twin brother and sister kiss?
He wrote Star Wars and when it blew up that’s when he planned the sequel. The way the films play out bears this out. 
In Episodes 1-3 (prequels) we learn Ben Kenobi trained Anakin Skywalker so he would have known Princess Leia was a Skywalker and he would have known Luke was her twin. Yet he doesn’t tell Luke? Why not? 
Also, Anakin supposedly built C-3PO yet in Episode IV C-3PO never mentions that Darth Vader built him, and Vader nor Kenobi never mention it. 
There are plenty of instances that show that Lucas never had the extended story planned out, it was developed after the immense success of Star Wars (which did not have the title A New Hope until years later- A New Hope was only ever mentioned in the scrolling opening prologue for years)",30,2023-02-18 02:45:36,<praw.models.comment_forest.CommentForest object at 0x0000022EF3A3B610>,1154f9k,scifi,t5_2qh2z,,False,False,t3_1154f9k,t3_1154f9k,/r/scifi/comments/1154f9k/is_this_accurate_or_cringe_i_can_see_it_either_way/j8zogfs/
