,ID,Author,body,Comment,Score,Created On,Replies,Submission,Subreddit,Subreddit_ID,Distinguished,Edited,Is_submitter,link_id,Parent_id,Permalink
384,j5raulg,ashmasterJ,">Part of it might be your expectations as a modern viewer.

I agree with everything you said except this line.  I HATE how the stock response to criticism of entertainment is 'manage your expectations.'  

It's basically decent advice from the legal/corporate world where things are murky, imperfect, and kafka-esque UTTERLY MISAPPLIED to the world of creativity.  As modern viewers we can and should expect transcendent excellence from everything.  This stems from the deep, universal, and mythological roots of creativity.

If, as you say, someone doesn't think early Tarantino or 1950's TZ is transcendently excellent, it speaks more to their taste, not the work itself.  One of the things about people is that their tastes change over the course of their lives.  The same exact work could, for instance, speak to you much more as a retiree than as a teenager, or vice versa.

It's much more accurate to say that consumption of all art is a purely subjective experience that cannot be controlled.  It is often a fool's errand to dissect WHY something works or does not work for any given viewer.",">Part of it might be your expectations as a modern viewer.

I agree with everything you said except this line.  I HATE how the stock response to criticism of entertainment is 'manage your expectations.'  

It's basically decent advice from the legal/corporate world where things are murky, imperfect, and kafka-esque UTTERLY MISAPPLIED to the world of creativity.  As modern viewers we can and should expect transcendent excellence from everything.  This stems from the deep, universal, and mythological roots of creativity.

If, as you say, someone doesn't think early Tarantino or 1950's TZ is transcendently excellent, it speaks more to their taste, not the work itself.  One of the things about people is that their tastes change over the course of their lives.  The same exact work could, for instance, speak to you much more as a retiree than as a teenager, or vice versa.

It's much more accurate to say that consumption of all art is a purely subjective experience that cannot be controlled.  It is often a fool's errand to dissect WHY something works or does not work for any given viewer.",2,2023-01-25 00:32:53,<praw.models.comment_forest.CommentForest object at 0x0000022EF3AE1100>,10kgt1u,scifi,t5_2qh2z,,False,False,t3_10kgt1u,t1_j5qzoin,/r/scifi/comments/10kgt1u/am_i_the_only_one_that_thinks_firefly_is_terribly/j5raulg/
385,j5troy5,CNTrash,"I disagree—I saw it on television when it aired because I'm old, and didn't think it was good. I later rewatched it with friends who tried to convince me it was good, and went along with them for awhile, and then I rewatched it a third time and decided that I was right the first time. 

Whereas I can watch old *Doctor Who*, which has absolute shit production values and weird pacing and tons of inconsistencies and recognize that while TV was different then, there's some hardcore excellent storytelling in there.","I disagree—I saw it on television when it aired because I'm old, and didn't think it was good. I later rewatched it with friends who tried to convince me it was good, and went along with them for awhile, and then I rewatched it a third time and decided that I was right the first time. 

Whereas I can watch old *Doctor Who*, which has absolute shit production values and weird pacing and tons of inconsistencies and recognize that while TV was different then, there's some hardcore excellent storytelling in there.",1,2023-01-25 14:49:29,<praw.models.comment_forest.CommentForest object at 0x0000022EF3AE11C0>,10kgt1u,scifi,t5_2qh2z,,False,False,t3_10kgt1u,t1_j5qzoin,/r/scifi/comments/10kgt1u/am_i_the_only_one_that_thinks_firefly_is_terribly/j5troy5/
386,j5qkupe,zincdeclercq,🤝,🤝,5,2023-01-24 21:41:24,<praw.models.comment_forest.CommentForest object at 0x0000022EF3AE17C0>,10kgt1u,scifi,t5_2qh2z,,False,True,t3_10kgt1u,t1_j5qkhfv,/r/scifi/comments/10kgt1u/am_i_the_only_one_that_thinks_firefly_is_terribly/j5qkupe/
387,j63ge58,zincdeclercq,"Chupar mi verga, puto","Chupar mi verga, puto",2,2023-01-27 13:15:35,<praw.models.comment_forest.CommentForest object at 0x0000022EF3AE3100>,10kgt1u,scifi,t5_2qh2z,,False,True,t3_10kgt1u,t1_j63erhc,/r/scifi/comments/10kgt1u/am_i_the_only_one_that_thinks_firefly_is_terribly/j63ge58/
388,j5vanlt,amberdragonfly5,"Yeah, that's pretty awful. I mean, the concept of having some repercussion to r*** is interesting, and I can kind of see where he wanted to go in terms of Mal's shift in attitude toward her. But I really hope the writers room would have significantly altered or changed the circumstances if the show had continued forward.","Yeah, that's pretty awful. I mean, the concept of having some repercussion to r*** is interesting, and I can kind of see where he wanted to go in terms of Mal's shift in attitude toward her. But I really hope the writers room would have significantly altered or changed the circumstances if the show had continued forward.",2,2023-01-25 20:31:39,<praw.models.comment_forest.CommentForest object at 0x0000022EF3AE3640>,10kgt1u,scifi,t5_2qh2z,,False,False,t3_10kgt1u,t1_j5v12y1,/r/scifi/comments/10kgt1u/am_i_the_only_one_that_thinks_firefly_is_terribly/j5vanlt/
389,j5rk1nq,Fishermans_Worf,"You're absolutely right and that is certainly a big part of it, but I'd say there's an overall shift in the tone of—let's call em genre shows—towards snappy sarcastic dialogue that's remarkably casual regarding the level of danger onscreen.  JW had a considerable amount of cred at the time—all gone now.","You're absolutely right and that is certainly a big part of it, but I'd say there's an overall shift in the tone of—let's call em genre shows—towards snappy sarcastic dialogue that's remarkably casual regarding the level of danger onscreen.  JW had a considerable amount of cred at the time—all gone now.",2,2023-01-25 01:39:07,<praw.models.comment_forest.CommentForest object at 0x0000022EF3AE1160>,10kgt1u,scifi,t5_2qh2z,,False,False,t3_10kgt1u,t1_j5rhpnn,/r/scifi/comments/10kgt1u/am_i_the_only_one_that_thinks_firefly_is_terribly/j5rk1nq/
390,j5rhwz3,Fishermans_Worf,">I agree with everything you said except this line. I HATE how the stock response to criticism of entertainment is 'manage your expectations.'

Explaining context isn't telling the viewer to manage their expectations—it's explains why their expectations didn't align with what they saw.  I never said manage your expectations, just this is why they may not have been met.

The time and circumstances a piece of art was made in substantially shifts our perception of it. Sometimes all we need to appreciate a piece of art that we couldn't connect with before is knowing the context in when it was made.  It doesn't mean we have to.  That's up to us.  

A lot of old master paintings are actually pretty bad... but they were developing the techniques, technologies and knowledge base that makes realistic painting so easy today.  You might see a painting and think ""eh, it's just a lot of blue."" But then you learn just how expensive blue was, ground from a semi precious gemstone that lost its colour if overground, and you look at the painting in a new way.  You understand that the painting wasn't about looking good, it was about looking expensive.

Managing your expectations isn't adjusting them down—it's knowing what you're getting into.

&#x200B;

>It's much more accurate to say that consumption of all art is a purely subjective experience that cannot be controlled. It is often a fool's errand to dissect WHY something works or does not work for any given viewer.

This is a perfectly legitimate *choice* to make for yourself, but it's really not true.  I'm an artist, and there is far more objective technique than you might realize.  We use those techniques to manipulate and relate subjective experiences.

It's much more accurate to say that art is deeply influenced by subjective experiences, but works on principles than can be manipulated in a reliable way.  It's why stage magic works, and why Stranger Things is an emotional rollercoaster you immediately forget.

There ain't nothing wrong with sitting back and enjoying the ride—but if you choose to manage your expectations you get to see *more*.",">I agree with everything you said except this line. I HATE how the stock response to criticism of entertainment is 'manage your expectations.'

Explaining context isn't telling the viewer to manage their expectations—it's explains why their expectations didn't align with what they saw.  I never said manage your expectations, just this is why they may not have been met.

The time and circumstances a piece of art was made in substantially shifts our perception of it. Sometimes all we need to appreciate a piece of art that we couldn't connect with before is knowing the context in when it was made.  It doesn't mean we have to.  That's up to us.  

A lot of old master paintings are actually pretty bad... but they were developing the techniques, technologies and knowledge base that makes realistic painting so easy today.  You might see a painting and think ""eh, it's just a lot of blue."" But then you learn just how expensive blue was, ground from a semi precious gemstone that lost its colour if overground, and you look at the painting in a new way.  You understand that the painting wasn't about looking good, it was about looking expensive.

Managing your expectations isn't adjusting them down—it's knowing what you're getting into.

&#x200B;

>It's much more accurate to say that consumption of all art is a purely subjective experience that cannot be controlled. It is often a fool's errand to dissect WHY something works or does not work for any given viewer.

This is a perfectly legitimate *choice* to make for yourself, but it's really not true.  I'm an artist, and there is far more objective technique than you might realize.  We use those techniques to manipulate and relate subjective experiences.

It's much more accurate to say that art is deeply influenced by subjective experiences, but works on principles than can be manipulated in a reliable way.  It's why stage magic works, and why Stranger Things is an emotional rollercoaster you immediately forget.

There ain't nothing wrong with sitting back and enjoying the ride—but if you choose to manage your expectations you get to see *more*.",9,2023-01-25 01:23:36,<praw.models.comment_forest.CommentForest object at 0x0000022EF3AE1280>,10kgt1u,scifi,t5_2qh2z,,False,False,t3_10kgt1u,t1_j5raulg,/r/scifi/comments/10kgt1u/am_i_the_only_one_that_thinks_firefly_is_terribly/j5rhwz3/
391,j5uofvm,Fishermans_Worf,"I'm not sure we actually disagree...

As I said

>even when it came out, it was either a you love it or hate it show for most people.

Doctor Who is often the same way.  They're both quirky and those quirks can really grate the wrong person.  

I can talk about the zeitgeist, and understanding it can help connect you with it's fiction but it's never ubiquitous.","I'm not sure we actually disagree...

As I said

>even when it came out, it was either a you love it or hate it show for most people.

Doctor Who is often the same way.  They're both quirky and those quirks can really grate the wrong person.  

I can talk about the zeitgeist, and understanding it can help connect you with it's fiction but it's never ubiquitous.",3,2023-01-25 18:16:40,<praw.models.comment_forest.CommentForest object at 0x0000022EF3AE13A0>,10kgt1u,scifi,t5_2qh2z,,False,False,t3_10kgt1u,t1_j5troy5,/r/scifi/comments/10kgt1u/am_i_the_only_one_that_thinks_firefly_is_terribly/j5uofvm/
392,j63ghjk,BeefyKeith420,ምንድን?,ምንድን?,2,2023-01-27 13:16:24,<praw.models.comment_forest.CommentForest object at 0x0000022EF3AE31C0>,10kgt1u,scifi,t5_2qh2z,,False,False,t3_10kgt1u,t1_j63ge58,/r/scifi/comments/10kgt1u/am_i_the_only_one_that_thinks_firefly_is_terribly/j63ghjk/
393,j5rla9x,_learned_foot_,"I honestly think that was the style of some, including JW, then took off when avengers (JW) made it big and a proven formula. Which makes it a recent example of a standard trend - some folks push an idea, it finally clicks, lots follow that.","I honestly think that was the style of some, including JW, then took off when avengers (JW) made it big and a proven formula. Which makes it a recent example of a standard trend - some folks push an idea, it finally clicks, lots follow that.",3,2023-01-25 01:48:13,<praw.models.comment_forest.CommentForest object at 0x0000022EF3AE1220>,10kgt1u,scifi,t5_2qh2z,,False,False,t3_10kgt1u,t1_j5rk1nq,/r/scifi/comments/10kgt1u/am_i_the_only_one_that_thinks_firefly_is_terribly/j5rla9x/
394,j5sbdmb,SpikeyBlackHardEdged,"Iow""I guess you just had to be there"" 🙃","Iow""I guess you just had to be there"" 🙃",2,2023-01-25 05:16:28,<praw.models.comment_forest.CommentForest object at 0x0000022EF3AE1340>,10kgt1u,scifi,t5_2qh2z,,False,False,t3_10kgt1u,t1_j5rhwz3,/r/scifi/comments/10kgt1u/am_i_the_only_one_that_thinks_firefly_is_terribly/j5sbdmb/
395,ihund1v,bailey_1138,"As I sit here in a Rocinante t-shirt I can confidently say it's one of my favorite book series and one of the few to stick the landing, IMHO. Obviously, YMMV.","As I sit here in a Rocinante t-shirt I can confidently say it's one of my favorite book series and one of the few to stick the landing, IMHO. Obviously, YMMV.",87,2022-07-27 13:44:39,<praw.models.comment_forest.CommentForest object at 0x0000022EF3B2C0A0>,w9epjd,scifi,t5_2qh2z,,False,False,t3_w9epjd,t3_w9epjd,/r/scifi/comments/w9epjd/am_i_the_only_one_who_was_disappointed_with_the/ihund1v/
396,ihuqba3,ClarkeBrower,"The Culture is my favourite sci-fi universe but The Expanse is my favourite series. Cool world building, a few great characters and fun action","The Culture is my favourite sci-fi universe but The Expanse is my favourite series. Cool world building, a few great characters and fun action",27,2022-07-27 14:05:50,<praw.models.comment_forest.CommentForest object at 0x0000022EF3B2C0D0>,w9epjd,scifi,t5_2qh2z,,False,False,t3_w9epjd,t3_w9epjd,/r/scifi/comments/w9epjd/am_i_the_only_one_who_was_disappointed_with_the/ihuqba3/
397,ihv0lxd,b00nish,"I agree that the later books don't reach the quality of the earlier books, yes.

We also have to consider that the first book had this special ""detective story"" vibe thanks to Miller, that for obvious reasons completely disappeared later.","I agree that the later books don't reach the quality of the earlier books, yes.

We also have to consider that the first book had this special ""detective story"" vibe thanks to Miller, that for obvious reasons completely disappeared later.",17,2022-07-27 15:15:04,<praw.models.comment_forest.CommentForest object at 0x0000022EF3B2C2B0>,w9epjd,scifi,t5_2qh2z,,False,False,t3_w9epjd,t3_w9epjd,/r/scifi/comments/w9epjd/am_i_the_only_one_who_was_disappointed_with_the/ihv0lxd/
398,ihulcy0,seanrok,I’d ask what other series or authors you do like and have read through.,I’d ask what other series or authors you do like and have read through.,6,2022-07-27 13:29:50,<praw.models.comment_forest.CommentForest object at 0x0000022EF3B2C430>,w9epjd,scifi,t5_2qh2z,,False,False,t3_w9epjd,t3_w9epjd,/r/scifi/comments/w9epjd/am_i_the_only_one_who_was_disappointed_with_the/ihulcy0/
399,ihun0e6,bowak,"The biggest problem I had was the jump from 6 to 7 felt like it didn't really make sense and that the timeline was forced to keep the same characters, who also felt frozen in time so far as their interpersonal relationships went. The last 3 books could easily have been just 2.

Also, I thought book 2 was crap and I originally stopped reading the series there, but luckily gave 3 a try when I had a voucher and loved that one.","The biggest problem I had was the jump from 6 to 7 felt like it didn't really make sense and that the timeline was forced to keep the same characters, who also felt frozen in time so far as their interpersonal relationships went. The last 3 books could easily have been just 2.

Also, I thought book 2 was crap and I originally stopped reading the series there, but luckily gave 3 a try when I had a voucher and loved that one.",12,2022-07-27 13:42:05,<praw.models.comment_forest.CommentForest object at 0x0000022EF3B2C5B0>,w9epjd,scifi,t5_2qh2z,,False,False,t3_w9epjd,t3_w9epjd,/r/scifi/comments/w9epjd/am_i_the_only_one_who_was_disappointed_with_the/ihun0e6/
400,ihuldpz,TrippingBearBalls,Would you like to share why you didn't like them?,Would you like to share why you didn't like them?,11,2022-07-27 13:29:59,<praw.models.comment_forest.CommentForest object at 0x0000022EF3B2C730>,w9epjd,scifi,t5_2qh2z,,False,False,t3_w9epjd,t3_w9epjd,/r/scifi/comments/w9epjd/am_i_the_only_one_who_was_disappointed_with_the/ihuldpz/
401,ihuubqg,BlackSedanMan,One of my favorite series ever.,One of my favorite series ever.,14,2022-07-27 14:33:25,<praw.models.comment_forest.CommentForest object at 0x0000022EF3B2CC70>,w9epjd,scifi,t5_2qh2z,,False,False,t3_w9epjd,t3_w9epjd,/r/scifi/comments/w9epjd/am_i_the_only_one_who_was_disappointed_with_the/ihuubqg/
402,ihuvym5,show-me-the-numbers,I gave up around book three.,I gave up around book three.,11,2022-07-27 14:44:24,<praw.models.comment_forest.CommentForest object at 0x0000022EF3B2E0D0>,w9epjd,scifi,t5_2qh2z,,False,False,t3_w9epjd,t3_w9epjd,/r/scifi/comments/w9epjd/am_i_the_only_one_who_was_disappointed_with_the/ihuvym5/
403,ihuzfil,talllankywhiteboy,"I went in with super high hopes into the first book and left pretty disappointed. The world-building was definitely my favorite part, and a huge part of sci-fi is making an interesting setting. But I couldn't get fully into the book, which was a huge bummer because I was really hoping to get super into a dope-sounding sci-fi series.

Some of the points that rubbed me the wrong way:

* Holden and his buds are the sole survivors of >!three separate mass destruction events!<. It didn't feel like they did this by survivor instinct but rather by having plot armor. I could almost hear the author saying ""Well they can't die, they are the main characters!"" It felt like during >!one of those three events!< Holden should have >!died and someone else become a main viewpoint character!<. 
* The two main characters were like the definition of your stereotypical grizzled cop and naive hero protagonists. The characters never really surprised me by breaking out of those molds which made them predictable. Holden's particular naivety was the type that drove me crazy. There's the scene in the book where an >!evil scientist confesses that he intentionally sacrificed thousands of humans lives in an experiment (and possibly did this with the government's approval though I can't recall exactly). Miller responds to this confession of mass murder by killing the scientist, and Holden gets all up in arms that the scientist deserved a fair trial. Maybe I'm just jaded, but why in the world would you to drag someone across the solar system to get them a trial for mass murder that they confessed to you? The scientist clearly had some connections that would be able to get him out of it. Just accept that he confessed, realize a trial isn't practical, let Miller kill him, and move on. Instead the naive farm boy can't accept the situation and tosses Miller out of his group or whatever.!<
* A **very** minor complaint, but Holden is described as being a pale dude from Montana. Meanwhile his friend/lover Naomi is described as being ""racially ambiguous"" with features from several different ethnicities all mixed together. Now if I told you that one of those characters was genetically the child of eight different biological parents, and the other just has the standard biological mom and dad, which family background would you imagine goes with which character? It was just so strange to me to make the white bread farm boy from Montana the one who had the eight different parents and have his companion be the diverse one. Just seemed like a weird mixed opportunity (that probably could be construed by some more receptive readers as an intentional commentary by the author).

I'm glad that other people love the series, but it seemed a bit over-hyped to me.","I went in with super high hopes into the first book and left pretty disappointed. The world-building was definitely my favorite part, and a huge part of sci-fi is making an interesting setting. But I couldn't get fully into the book, which was a huge bummer because I was really hoping to get super into a dope-sounding sci-fi series.

Some of the points that rubbed me the wrong way:

* Holden and his buds are the sole survivors of >!three separate mass destruction events!<. It didn't feel like they did this by survivor instinct but rather by having plot armor. I could almost hear the author saying ""Well they can't die, they are the main characters!"" It felt like during >!one of those three events!< Holden should have >!died and someone else become a main viewpoint character!<. 
* The two main characters were like the definition of your stereotypical grizzled cop and naive hero protagonists. The characters never really surprised me by breaking out of those molds which made them predictable. Holden's particular naivety was the type that drove me crazy. There's the scene in the book where an >!evil scientist confesses that he intentionally sacrificed thousands of humans lives in an experiment (and possibly did this with the government's approval though I can't recall exactly). Miller responds to this confession of mass murder by killing the scientist, and Holden gets all up in arms that the scientist deserved a fair trial. Maybe I'm just jaded, but why in the world would you to drag someone across the solar system to get them a trial for mass murder that they confessed to you? The scientist clearly had some connections that would be able to get him out of it. Just accept that he confessed, realize a trial isn't practical, let Miller kill him, and move on. Instead the naive farm boy can't accept the situation and tosses Miller out of his group or whatever.!<
* A **very** minor complaint, but Holden is described as being a pale dude from Montana. Meanwhile his friend/lover Naomi is described as being ""racially ambiguous"" with features from several different ethnicities all mixed together. Now if I told you that one of those characters was genetically the child of eight different biological parents, and the other just has the standard biological mom and dad, which family background would you imagine goes with which character? It was just so strange to me to make the white bread farm boy from Montana the one who had the eight different parents and have his companion be the diverse one. Just seemed like a weird mixed opportunity (that probably could be construed by some more receptive readers as an intentional commentary by the author).

I'm glad that other people love the series, but it seemed a bit over-hyped to me.",6,2022-07-27 15:07:16,<praw.models.comment_forest.CommentForest object at 0x0000022EF3B2E430>,w9epjd,scifi,t5_2qh2z,,False,False,t3_w9epjd,t3_w9epjd,/r/scifi/comments/w9epjd/am_i_the_only_one_who_was_disappointed_with_the/ihuzfil/
404,ihuxazx,OttawaDog,"I really like the first three books, and their first three seasons of the show. IMO that's a great stopping point in either case.","I really like the first three books, and their first three seasons of the show. IMO that's a great stopping point in either case.",3,2022-07-27 14:53:18,<praw.models.comment_forest.CommentForest object at 0x0000022EF3B2E4F0>,w9epjd,scifi,t5_2qh2z,,False,False,t3_w9epjd,t3_w9epjd,/r/scifi/comments/w9epjd/am_i_the_only_one_who_was_disappointed_with_the/ihuxazx/
405,ihv0k3x,HumanSieve,Yeah I thought that the show was way better than the books. The writing is mediocre and the characters are so cardboard that I couldn't even tell Amos and Alex apart for a couple of books. All stereotypes.,Yeah I thought that the show was way better than the books. The writing is mediocre and the characters are so cardboard that I couldn't even tell Amos and Alex apart for a couple of books. All stereotypes.,3,2022-07-27 15:14:44,<praw.models.comment_forest.CommentForest object at 0x0000022EF3B2E6D0>,w9epjd,scifi,t5_2qh2z,,False,False,t3_w9epjd,t3_w9epjd,/r/scifi/comments/w9epjd/am_i_the_only_one_who_was_disappointed_with_the/ihv0k3x/
406,ihv13eu,TheRealRevBem,Same here. Got three deep and just could not will myself to continue. This has never happened to me before.,Same here. Got three deep and just could not will myself to continue. This has never happened to me before.,3,2022-07-27 15:18:12,<praw.models.comment_forest.CommentForest object at 0x0000022EF3B2E730>,w9epjd,scifi,t5_2qh2z,,False,False,t3_w9epjd,t3_w9epjd,/r/scifi/comments/w9epjd/am_i_the_only_one_who_was_disappointed_with_the/ihv13eu/
