,ID,Author,body,Comment,Score,Created On,Replies,Submission,Subreddit,Subreddit_ID,Distinguished,Edited,Is_submitter,link_id,Parent_id,Permalink
0,k1280qx,that_one_wierd_guy,"can't think of any gays in space at the moment, but you made me remember [jews in space](https://youtu.be/ZAZhtT-dUyo?si=MHnrIWM6wvmvFtCs)","can't think of any gays in space at the moment, but you made me remember [jews in space](https://youtu.be/ZAZhtT-dUyo?si=MHnrIWM6wvmvFtCs)",48,2023-09-18 00:27:28,<praw.models.comment_forest.CommentForest object at 0x0000022EF39F1B80>,16lge1r,scifi,t5_2qh2z,,False,False,t3_16lge1r,t3_16lge1r,/r/scifi/comments/16lge1r/gays_in_space/k1280qx/
1,k1290z4,Snatch_Pastry,"The Expanse takes a very egalitarian view of sexual relationships. There are straights, gays, bi (I legitimately don't know how to correctly pluralize that), various types of group arrangements, and all of it is seen as simply normal.","The Expanse takes a very egalitarian view of sexual relationships. There are straights, gays, bi (I legitimately don't know how to correctly pluralize that), various types of group arrangements, and all of it is seen as simply normal.",65,2023-09-18 00:34:56,<praw.models.comment_forest.CommentForest object at 0x0000022EF39F1BE0>,16lge1r,scifi,t5_2qh2z,,False,False,t3_16lge1r,t3_16lge1r,/r/scifi/comments/16lge1r/gays_in_space/k1290z4/
2,k137njg,fratbronson,Surprised no one said The Locked Tomb Series (Gideon the Ninth) by Tamsyn Muir.,Surprised no one said The Locked Tomb Series (Gideon the Ninth) by Tamsyn Muir.,22,2023-09-18 05:19:45,<praw.models.comment_forest.CommentForest object at 0x0000022EF39F1D60>,16lge1r,scifi,t5_2qh2z,,False,False,t3_16lge1r,t3_16lge1r,/r/scifi/comments/16lge1r/gays_in_space/k137njg/
3,k13uuno,Pyrostemplar,The Left Hand of Darkness. Not in space though.,The Left Hand of Darkness. Not in space though.,9,2023-09-18 10:15:10,<praw.models.comment_forest.CommentForest object at 0x0000022EF39F3820>,16lge1r,scifi,t5_2qh2z,,False,False,t3_16lge1r,t3_16lge1r,/r/scifi/comments/16lge1r/gays_in_space/k13uuno/
4,k12a94i,BabsieAllen,Star Trek Discovery. Paul Stammets and Hugh Culber.,Star Trek Discovery. Paul Stammets and Hugh Culber.,30,2023-09-18 00:43:55,<praw.models.comment_forest.CommentForest object at 0x0000022EF39F38E0>,16lge1r,scifi,t5_2qh2z,,False,False,t3_16lge1r,t3_16lge1r,/r/scifi/comments/16lge1r/gays_in_space/k12a94i/
5,k12t56z,ElricVonDaniken,"The Songs of Distant Earth & Imperial Earth, both by Arthur C. Clarke

Triton  (aka Trouble on Triton) by Samuel R. Delany","The Songs of Distant Earth & Imperial Earth, both by Arthur C. Clarke

Triton  (aka Trouble on Triton) by Samuel R. Delany",8,2023-09-18 03:05:08,<praw.models.comment_forest.CommentForest object at 0x0000022EF39F3A60>,16lge1r,scifi,t5_2qh2z,,False,False,t3_16lge1r,t3_16lge1r,/r/scifi/comments/16lge1r/gays_in_space/k12t56z/
6,k13hw5q,nagidon,The Expanse features a pirate polycule.  And the lingering affection between Camina and Naomi is always very sweet.,The Expanse features a pirate polycule.  And the lingering affection between Camina and Naomi is always very sweet.,7,2023-09-18 07:21:34,<praw.models.comment_forest.CommentForest object at 0x0000022EF39F52E0>,16lge1r,scifi,t5_2qh2z,,False,False,t3_16lge1r,t3_16lge1r,/r/scifi/comments/16lge1r/gays_in_space/k13hw5q/
7,k139z4t,BoatMan01,"""A Long Way to a Small Angry Planet."" Check it out.","""A Long Way to a Small Angry Planet."" Check it out.",7,2023-09-18 05:45:30,<praw.models.comment_forest.CommentForest object at 0x0000022EF39F5640>,16lge1r,scifi,t5_2qh2z,,False,False,t3_16lge1r,t3_16lge1r,/r/scifi/comments/16lge1r/gays_in_space/k139z4t/
8,k138xrx,gdtimmy,1992 gayni&$@&s from outer space,1992 gayni&$@&s from outer space,6,2023-09-18 05:34:00,<praw.models.comment_forest.CommentForest object at 0x0000022EF39F5700>,16lge1r,scifi,t5_2qh2z,,False,False,t3_16lge1r,t3_16lge1r,/r/scifi/comments/16lge1r/gays_in_space/k138xrx/
9,k13hkmn,PlutoDelic,"Old Man's War has a stunning take on homosexuality :). It's really worth a shot.

Edit: impressive response people. Scifi gives us a glance of the future, and it's heartwarming how accepting the vision is.","Old Man's War has a stunning take on homosexuality :). It's really worth a shot.

Edit: impressive response people. Scifi gives us a glance of the future, and it's heartwarming how accepting the vision is.",7,2023-09-18 07:17:29,<praw.models.comment_forest.CommentForest object at 0x0000022EF39F57C0>,16lge1r,scifi,t5_2qh2z,,1695024405.0,False,t3_16lge1r,t3_16lge1r,/r/scifi/comments/16lge1r/gays_in_space/k13hkmn/
10,k128ob0,Torino1O,"The Forever War by Joe Haldman is a book that I always thought would make a good movie as it had soldiers that would return home with decades having passed after there last visit, one time they returned and sexual norms had changed. The war was expected to last forever due to the fact that as you got closer to your opponent they became more advanced and vice versa.","The Forever War by Joe Haldman is a book that I always thought would make a good movie as it had soldiers that would return home with decades having passed after there last visit, one time they returned and sexual norms had changed. The war was expected to last forever due to the fact that as you got closer to your opponent they became more advanced and vice versa.",15,2023-09-18 00:32:19,<praw.models.comment_forest.CommentForest object at 0x0000022EF39F5880>,16lge1r,scifi,t5_2qh2z,,False,False,t3_16lge1r,t3_16lge1r,/r/scifi/comments/16lge1r/gays_in_space/k128ob0/
11,k12a68h,Dingusu,"not so much in space but a Psalm for the Wild Built by Becky Chambers stars an enby protagonist on a utopian moon who befriends a robot.

Super cozy vibes. Pairs great with tea and you can breeze through the book in an evening","not so much in space but a Psalm for the Wild Built by Becky Chambers stars an enby protagonist on a utopian moon who befriends a robot.

Super cozy vibes. Pairs great with tea and you can breeze through the book in an evening",15,2023-09-18 00:43:19,<praw.models.comment_forest.CommentForest object at 0x0000022EF39F58E0>,16lge1r,scifi,t5_2qh2z,,False,False,t3_16lge1r,t3_16lge1r,/r/scifi/comments/16lge1r/gays_in_space/k12a68h/
12,k134c5f,Top3879,"I can recommend the game Haven where you play a couple stranded on a planet. You can choose between two girls, two boys or mixed.","I can recommend the game Haven where you play a couple stranded on a planet. You can choose between two girls, two boys or mixed.",4,2023-09-18 04:44:54,<praw.models.comment_forest.CommentForest object at 0x0000022EF39F59A0>,16lge1r,scifi,t5_2qh2z,,False,False,t3_16lge1r,t3_16lge1r,/r/scifi/comments/16lge1r/gays_in_space/k134c5f/
13,k1362me,dmun,Samuel Delaney. Full stop.,Samuel Delaney. Full stop.,5,2023-09-18 05:02:51,<praw.models.comment_forest.CommentForest object at 0x0000022EF39F5A60>,16lge1r,scifi,t5_2qh2z,,False,False,t3_16lge1r,t3_16lge1r,/r/scifi/comments/16lge1r/gays_in_space/k1362me/
14,k145og0,BravoOneDelta,"even as a straight man, I enjoyed how Star Trek 'made' Sulu into a gay man. If I remember, they added a scene to one of the newer movies and 'updated' him to reflect George Takei's sexuality. 

I may be completely misremembering or miswording myself here, so please dont come at me for this. I used the ' as more of a stand in in case the words I was using did not exactly describe what I was trying to say.","even as a straight man, I enjoyed how Star Trek 'made' Sulu into a gay man. If I remember, they added a scene to one of the newer movies and 'updated' him to reflect George Takei's sexuality. 

I may be completely misremembering or miswording myself here, so please dont come at me for this. I used the ' as more of a stand in in case the words I was using did not exactly describe what I was trying to say.",5,2023-09-18 12:07:15,<praw.models.comment_forest.CommentForest object at 0x0000022EF39F5AC0>,16lge1r,scifi,t5_2qh2z,,False,False,t3_16lge1r,t3_16lge1r,/r/scifi/comments/16lge1r/gays_in_space/k145og0/
15,k129777,bmeisler,"A Memory Called Empire has a bunch of same sex relationships, and best of all treats them as completely unremarkable. Great book, think it won the Hugo.","A Memory Called Empire has a bunch of same sex relationships, and best of all treats them as completely unremarkable. Great book, think it won the Hugo.",15,2023-09-18 00:36:12,<praw.models.comment_forest.CommentForest object at 0x0000022EF39F5B80>,16lge1r,scifi,t5_2qh2z,,False,False,t3_16lge1r,t3_16lge1r,/r/scifi/comments/16lge1r/gays_in_space/k129777/
16,k130jm7,Dry-Patient5282,Becky Chambers’s Wayfarers series,Becky Chambers’s Wayfarers series,8,2023-09-18 04:07:54,<praw.models.comment_forest.CommentForest object at 0x0000022EF39F5BE0>,16lge1r,scifi,t5_2qh2z,,False,False,t3_16lge1r,t3_16lge1r,/r/scifi/comments/16lge1r/gays_in_space/k130jm7/
17,k13bedx,ThirdTurnip,"Peter F Hamilton - The Night's Dawn Trilogy isn't super gay by present day standards but the villain is gay and there's a bit of cock action.

In my experience that was uncommon in the 90s.

Later series set in the same universe introduce other gay (and non-villainous) characters.","Peter F Hamilton - The Night's Dawn Trilogy isn't super gay by present day standards but the villain is gay and there's a bit of cock action.

In my experience that was uncommon in the 90s.

Later series set in the same universe introduce other gay (and non-villainous) characters.",3,2023-09-18 06:01:48,<praw.models.comment_forest.CommentForest object at 0x0000022EF39F5CA0>,16lge1r,scifi,t5_2qh2z,,False,False,t3_16lge1r,t3_16lge1r,/r/scifi/comments/16lge1r/gays_in_space/k13bedx/
18,k13iwzk,Traconias,"The Orville's Moclans are a ""gay species"" though not without a very discordant note: female-born moclans are turned into men by a forced operation.

Tons of reference you'll find in this article:  
https://en.wikipedia.org/wiki/LGBT\_themes\_in\_speculative\_fiction#Film\_and\_television","The Orville's Moclans are a ""gay species"" though not without a very discordant note: female-born moclans are turned into men by a forced operation.

Tons of reference you'll find in this article:  
https://en.wikipedia.org/wiki/LGBT\_themes\_in\_speculative\_fiction#Film\_and\_television",3,2023-09-18 07:35:02,<praw.models.comment_forest.CommentForest object at 0x0000022EF39F5D00>,16lge1r,scifi,t5_2qh2z,,False,False,t3_16lge1r,t3_16lge1r,/r/scifi/comments/16lge1r/gays_in_space/k13iwzk/
19,k13nbzi,Thrawnsartdealer,The Children of Time trilogy makes casual mention of bisexual relationships among crew members. It’s not relevant to the story or character development. It’s more of a small world/culture-building detail.,The Children of Time trilogy makes casual mention of bisexual relationships among crew members. It’s not relevant to the story or character development. It’s more of a small world/culture-building detail.,4,2023-09-18 08:35:26,<praw.models.comment_forest.CommentForest object at 0x0000022EF39F5E80>,16lge1r,scifi,t5_2qh2z,,False,False,t3_16lge1r,t3_16lge1r,/r/scifi/comments/16lge1r/gays_in_space/k13nbzi/
20,k13p9rq,b13476,Gideon the ninth is about gay necromancers in space. I know it sounds weird but it's a good read.,Gideon the ninth is about gay necromancers in space. I know it sounds weird but it's a good read.,3,2023-09-18 09:02:02,<praw.models.comment_forest.CommentForest object at 0x0000022EF39F5F40>,16lge1r,scifi,t5_2qh2z,,False,False,t3_16lge1r,t3_16lge1r,/r/scifi/comments/16lge1r/gays_in_space/k13p9rq/
21,k13rnf7,wildskipper,"Very surprised no one has mentioned any of the books in the Culture series by Iain M Banks. Within the Culture citizens freely change sex (so I suppose that makes defining a relationship as gay in that culture difficult, as one or more of the people in a relationship are able to change sex during that relationship). Citizens can also change species if they wish!","Very surprised no one has mentioned any of the books in the Culture series by Iain M Banks. Within the Culture citizens freely change sex (so I suppose that makes defining a relationship as gay in that culture difficult, as one or more of the people in a relationship are able to change sex during that relationship). Citizens can also change species if they wish!",4,2023-09-18 09:34:01,<praw.models.comment_forest.CommentForest object at 0x0000022EF39F5FA0>,16lge1r,scifi,t5_2qh2z,,False,False,t3_16lge1r,t3_16lge1r,/r/scifi/comments/16lge1r/gays_in_space/k13rnf7/
22,k13rtuz,FaithlessnessOld7089,"Well it depends on what you'd consider ""gay"". Anyway, you'll enjoy Anvil of Stars by Greg Bear.","Well it depends on what you'd consider ""gay"". Anyway, you'll enjoy Anvil of Stars by Greg Bear.",5,2023-09-18 09:36:22,<praw.models.comment_forest.CommentForest object at 0x0000022EF39F8040>,16lge1r,scifi,t5_2qh2z,,False,False,t3_16lge1r,t3_16lge1r,/r/scifi/comments/16lge1r/gays_in_space/k13rtuz/
23,k13vxmu,ChrisOz,"Ethan of Athos by Lois McMaster Bujold. 

The main character is from a planet that outlawed women and has been happily getting by just fine for centuries.","Ethan of Athos by Lois McMaster Bujold. 

The main character is from a planet that outlawed women and has been happily getting by just fine for centuries.",3,2023-09-18 10:28:06,<praw.models.comment_forest.CommentForest object at 0x0000022EF39F80A0>,16lge1r,scifi,t5_2qh2z,,False,False,t3_16lge1r,t3_16lge1r,/r/scifi/comments/16lge1r/gays_in_space/k13vxmu/
24,k128vzn,thedoogster,"Nightflyers, by George R. R. Martin.","Nightflyers, by George R. R. Martin.",8,2023-09-18 00:33:53,<praw.models.comment_forest.CommentForest object at 0x0000022EF39F8100>,16lge1r,scifi,t5_2qh2z,,False,False,t3_16lge1r,t3_16lge1r,/r/scifi/comments/16lge1r/gays_in_space/k128vzn/
25,k13sz0d,FalconBurcham,"All four Mass Effect games have gay romances if you play the games that way. They are full relationships too, not just sexual encounters. 

The SF games Outer Worlds and Starfield also allow you to play a gay character. That’s the real test of queer inclusiveness, in my opinion. Full relationships.

Lower Decks has the only on-screen lesbian romance I’ve ever seen on Star Trek outside of a supposed relationship on Picard (two women may have kissed once? I’m not sure because they never acted like they were a couple). Star Trek isn’t big on lesbians. But Discovery does have a solid full relationship between two men.","All four Mass Effect games have gay romances if you play the games that way. They are full relationships too, not just sexual encounters. 

The SF games Outer Worlds and Starfield also allow you to play a gay character. That’s the real test of queer inclusiveness, in my opinion. Full relationships.

Lower Decks has the only on-screen lesbian romance I’ve ever seen on Star Trek outside of a supposed relationship on Picard (two women may have kissed once? I’m not sure because they never acted like they were a couple). Star Trek isn’t big on lesbians. But Discovery does have a solid full relationship between two men.",7,2023-09-18 09:51:29,<praw.models.comment_forest.CommentForest object at 0x0000022EF39F8160>,16lge1r,scifi,t5_2qh2z,,False,False,t3_16lge1r,t3_16lge1r,/r/scifi/comments/16lge1r/gays_in_space/k13sz0d/
26,k12t577,thefringeseanmachine,"why the fuck is this being so aggressively downvoted? LGBTQ issues are a legitimate issue in speculative fiction. 

fuck off, ya phobes.","why the fuck is this being so aggressively downvoted? LGBTQ issues are a legitimate issue in speculative fiction. 

fuck off, ya phobes.",37,2023-09-18 03:05:08,<praw.models.comment_forest.CommentForest object at 0x0000022EF39F81C0>,16lge1r,scifi,t5_2qh2z,,False,False,t3_16lge1r,t3_16lge1r,/r/scifi/comments/16lge1r/gays_in_space/k12t577/
27,k133gke,Wombattery,"""Ethan of Athos"" by Lois McAlister Bujold. Ethan sets out from a misogynist , male only planet in search of reproductive material. He encounters women for the first time in the universe of the Vorksigon saga. Hilarity ensues.","""Ethan of Athos"" by Lois McAlister Bujold. Ethan sets out from a misogynist , male only planet in search of reproductive material. He encounters women for the first time in the universe of the Vorksigon saga. Hilarity ensues.",7,2023-09-18 04:36:04,<praw.models.comment_forest.CommentForest object at 0x0000022EF39F8220>,16lge1r,scifi,t5_2qh2z,,False,False,t3_16lge1r,t3_16lge1r,/r/scifi/comments/16lge1r/gays_in_space/k133gke/
28,k135ljx,alice456123,2312 by Kim Stanley Robinson has some glimpses of a different kind of sexuality beyond homosexuality.,2312 by Kim Stanley Robinson has some glimpses of a different kind of sexuality beyond homosexuality.,3,2023-09-18 04:57:53,<praw.models.comment_forest.CommentForest object at 0x0000022EF39F8340>,16lge1r,scifi,t5_2qh2z,,False,False,t3_16lge1r,t3_16lge1r,/r/scifi/comments/16lge1r/gays_in_space/k135ljx/
29,k13doiy,FridgeParade,"Oscar Monroe in the commonwealth books by Peter F Hamilton.

And he creates a whole gender neutral branch of humanity called Omnia in the Salvation series.","Oscar Monroe in the commonwealth books by Peter F Hamilton.

And he creates a whole gender neutral branch of humanity called Omnia in the Salvation series.",3,2023-09-18 06:29:08,<praw.models.comment_forest.CommentForest object at 0x0000022EF39F8400>,16lge1r,scifi,t5_2qh2z,,False,False,t3_16lge1r,t3_16lge1r,/r/scifi/comments/16lge1r/gays_in_space/k13doiy/
30,k13fqk2,Technical-County-727,"Gateway by Frederik Pohl - it’s bit clunky on the gay -side, but I have to give it a hat off it being written in the 70s","Gateway by Frederik Pohl - it’s bit clunky on the gay -side, but I have to give it a hat off it being written in the 70s",3,2023-09-18 06:54:13,<praw.models.comment_forest.CommentForest object at 0x0000022EF39F84C0>,16lge1r,scifi,t5_2qh2z,,False,False,t3_16lge1r,t3_16lge1r,/r/scifi/comments/16lge1r/gays_in_space/k13fqk2/
31,k13hpd5,Thornshrike,"Some Desperate Glory by Emily Tesh has gay characters.

Definitely seconding Gideon the Ninth and rest of the books by Tamsyn Muir, although they're more space fantasy. And there are no happy relationships/endings so far either. 

This Is How You Lose a Time War is an epistolary novel with two women, and time travel.

Going beyond these, Ada Palmer's Too Like Lightning books (Terra Ignota series) do weird things with gender. So there are some gay relationships, but it's a bit hard to tell with how it's all set up.","Some Desperate Glory by Emily Tesh has gay characters.

Definitely seconding Gideon the Ninth and rest of the books by Tamsyn Muir, although they're more space fantasy. And there are no happy relationships/endings so far either. 

This Is How You Lose a Time War is an epistolary novel with two women, and time travel.

Going beyond these, Ada Palmer's Too Like Lightning books (Terra Ignota series) do weird things with gender. So there are some gay relationships, but it's a bit hard to tell with how it's all set up.",3,2023-09-18 07:19:12,<praw.models.comment_forest.CommentForest object at 0x0000022EF39F8580>,16lge1r,scifi,t5_2qh2z,,False,False,t3_16lge1r,t3_16lge1r,/r/scifi/comments/16lge1r/gays_in_space/k13hpd5/
32,k14dnn4,Select_Design75,All the Vorkosigan saga from Bujold has quite normalized LGBT presence.,All the Vorkosigan saga from Bujold has quite normalized LGBT presence.,3,2023-09-18 13:11:19,<praw.models.comment_forest.CommentForest object at 0x0000022EF39F8640>,16lge1r,scifi,t5_2qh2z,,False,False,t3_16lge1r,t3_16lge1r,/r/scifi/comments/16lge1r/gays_in_space/k14dnn4/
33,k157g0c,You11NeverKn0w,"The novel series Red Rising.

The fascist society that has colonized our solar system is very sexually fluid. Not everyone is gay but homo and bi sexuality aren’t frowned upon, so many characters are at least bi.

One of the POV characters in the 4th book was married to another male character from book 3 who was killed, and he has many conversations reminiscing about his husband.

Excellent series","The novel series Red Rising.

The fascist society that has colonized our solar system is very sexually fluid. Not everyone is gay but homo and bi sexuality aren’t frowned upon, so many characters are at least bi.

One of the POV characters in the 4th book was married to another male character from book 3 who was killed, and he has many conversations reminiscing about his husband.

Excellent series",3,2023-09-18 16:21:00,<praw.models.comment_forest.CommentForest object at 0x0000022EF39F8700>,16lge1r,scifi,t5_2qh2z,,False,False,t3_16lge1r,t3_16lge1r,/r/scifi/comments/16lge1r/gays_in_space/k157g0c/
34,k16p07g,curiouscat86,"I have a list. I collect these books.

* *Ocean's Echo* by Everina Maxwell. Telepathy, unknown alien technology, two men forced into a dangerous military mission try to survive without betraying each other. 
* *Ancillary Justice.* A sentient Ship AI, confined to one surviving human body, is on a mission to kill the emperor she once served. Along for the ride is one of the officers who once served aboard, and has never gotten over her.
* *Ninefox Gambit.* The empire is under attack; they resurrect their most infamous general to defeat their foe, except this general hates them and will do anything in his power to avoid his duty. That's why he's bound to the body of a loyal soldier. Endless bloody plotting between the branches of the government happens behind the scenes. Also, a religion and weapons system based on calendrical math
* *A Memory Called Empire* & sequel. An ambassador from a remote space station travels to the galactic capitol after her predecessor is murdered. She and her local guide start investigating and discover plots and treason abound. 
* *Gideon the Ninth* and sequels. The first book is a locked room mystery and barely in space, later ones are much more space-focused. Extremely goth space Catholics who worship a necromantic God and sit at the helm of a rapidly-expanding empire of death spend a lot of time trying to kill each other. Our heroes also do this, but we like them and so they do it for (mostly) justified reasons. Book 3 is probably my favorite book I've read this year. 
* *First Sister* by Linden Lewis. People who live on Mars are in a protracted war against people who live on Venus & Mercury--they have two entirely separate societies based on how they survive their respective planets. A set of vulnerable young people from both sides are caught up in a series of events that test their loyalty.","I have a list. I collect these books.

* *Ocean's Echo* by Everina Maxwell. Telepathy, unknown alien technology, two men forced into a dangerous military mission try to survive without betraying each other. 
* *Ancillary Justice.* A sentient Ship AI, confined to one surviving human body, is on a mission to kill the emperor she once served. Along for the ride is one of the officers who once served aboard, and has never gotten over her.
* *Ninefox Gambit.* The empire is under attack; they resurrect their most infamous general to defeat their foe, except this general hates them and will do anything in his power to avoid his duty. That's why he's bound to the body of a loyal soldier. Endless bloody plotting between the branches of the government happens behind the scenes. Also, a religion and weapons system based on calendrical math
* *A Memory Called Empire* & sequel. An ambassador from a remote space station travels to the galactic capitol after her predecessor is murdered. She and her local guide start investigating and discover plots and treason abound. 
* *Gideon the Ninth* and sequels. The first book is a locked room mystery and barely in space, later ones are much more space-focused. Extremely goth space Catholics who worship a necromantic God and sit at the helm of a rapidly-expanding empire of death spend a lot of time trying to kill each other. Our heroes also do this, but we like them and so they do it for (mostly) justified reasons. Book 3 is probably my favorite book I've read this year. 
* *First Sister* by Linden Lewis. People who live on Mars are in a protracted war against people who live on Venus & Mercury--they have two entirely separate societies based on how they survive their respective planets. A set of vulnerable young people from both sides are caught up in a series of events that test their loyalty.",3,2023-09-18 21:38:47,<praw.models.comment_forest.CommentForest object at 0x0000022EF39F8760>,16lge1r,scifi,t5_2qh2z,,False,False,t3_16lge1r,t3_16lge1r,/r/scifi/comments/16lge1r/gays_in_space/k16p07g/
35,k126l8c,AlwaysNeverNotFresh,Aniara! Sci Fi movie in space. Lead actress is in a relationship with a woman,Aniara! Sci Fi movie in space. Lead actress is in a relationship with a woman,10,2023-09-18 00:17:06,<praw.models.comment_forest.CommentForest object at 0x0000022EF39F87C0>,16lge1r,scifi,t5_2qh2z,,False,False,t3_16lge1r,t3_16lge1r,/r/scifi/comments/16lge1r/gays_in_space/k126l8c/
36,k12jjql,roboticcheeseburger,Foundation on Apple+,Foundation on Apple+,6,2023-09-18 01:52:33,<praw.models.comment_forest.CommentForest object at 0x0000022EF39F8820>,16lge1r,scifi,t5_2qh2z,,False,False,t3_16lge1r,t3_16lge1r,/r/scifi/comments/16lge1r/gays_in_space/k12jjql/
37,k12af3l,Severnrose,Lots in Starfield,Lots in Starfield,8,2023-09-18 00:45:08,<praw.models.comment_forest.CommentForest object at 0x0000022EF39F8880>,16lge1r,scifi,t5_2qh2z,,False,False,t3_16lge1r,t3_16lge1r,/r/scifi/comments/16lge1r/gays_in_space/k12af3l/
38,k13c191,Hermeticrux,"Boy do I have the thing for you.  Brb


Ok got it

https://www.imdb.com/title/tt0274518/","Boy do I have the thing for you.  Brb


Ok got it

https://www.imdb.com/title/tt0274518/",6,2023-09-18 06:09:14,<praw.models.comment_forest.CommentForest object at 0x0000022EF39F88E0>,16lge1r,scifi,t5_2qh2z,,False,False,t3_16lge1r,t3_16lge1r,/r/scifi/comments/16lge1r/gays_in_space/k13c191/
