,ID,Author,body,Comment,Score,Created On,Replies,Submission,Subreddit,Subreddit_ID,Distinguished,Edited,Is_submitter,link_id,Parent_id,Permalink
521,hz0ypsr,biscuit_pirate,"I'm relieved at least that the authorities have acknowledged this and appear to be taking it seriously.


https://mobile.twitter.com/lesiavasylenko/status/1498387994759335944?s=21

I'm a minority but for Ukraine in this, don't get me wrong. I wholeheartedly condemn what Putin has done to the Ukrainian people.","I'm relieved at least that the authorities have acknowledged this and appear to be taking it seriously.


https://mobile.twitter.com/lesiavasylenko/status/1498387994759335944?s=21

I'm a minority but for Ukraine in this, don't get me wrong. I wholeheartedly condemn what Putin has done to the Ukrainian people.",2,2022-03-02 08:24:41,<praw.models.comment_forest.CommentForest object at 0x0000021CDA9B1460>,t33xq0,worldnews,t5_2qh13,,False,False,t3_t33xq0,t3_t33xq0,/r/worldnews/comments/t33xq0/africans_trying_to_flee_ukraine_complain_of_being/hz0ypsr/
522,hysh0d6,,It's all fun and games until one of them blacks pull out an American passport and start filming live.  All them racist Ukrainians will quickly start covering their face.,It's all fun and games until one of them blacks pull out an American passport and start filming live.  All them racist Ukrainians will quickly start covering their face.,5,2022-02-28 15:57:47,<praw.models.comment_forest.CommentForest object at 0x0000021CDA9B1520>,t33xq0,worldnews,t5_2qh13,,False,False,t3_t33xq0,t3_t33xq0,/r/worldnews/comments/t33xq0/africans_trying_to_flee_ukraine_complain_of_being/hysh0d6/
523,hyq5505,ydalv_,"Same with Indians and other people of color. I support Ukraine, but that shit needs to stop. Ukrainians are racist fucks, it's not possible to change that during a war, but holy fucking damn, leadership should better reprimand their troops (and population) to treat foreigners with respect. When people outside of Ukraine see this, it would cost Ukraine a fair bit of support. And for what reason? To be able to be racist? I don't think that's worth it to lose some support against Russia. Jezus fucking christ. That it even needs to be said. Even if you're a racist fuck, treat them with respect for the benefit of your country.","Same with Indians and other people of color. I support Ukraine, but that shit needs to stop. Ukrainians are racist fucks, it's not possible to change that during a war, but holy fucking damn, leadership should better reprimand their troops (and population) to treat foreigners with respect. When people outside of Ukraine see this, it would cost Ukraine a fair bit of support. And for what reason? To be able to be racist? I don't think that's worth it to lose some support against Russia. Jezus fucking christ. That it even needs to be said. Even if you're a racist fuck, treat them with respect for the benefit of your country.",12,2022-02-28 02:18:23,<praw.models.comment_forest.CommentForest object at 0x0000021CDA9B1580>,t33xq0,worldnews,t5_2qh13,,False,False,t3_t33xq0,t3_t33xq0,/r/worldnews/comments/t33xq0/africans_trying_to_flee_ukraine_complain_of_being/hyq5505/
524,hyq9l3u,hconfiance,"Why arent their embassies helping them? I know Egypt and Seychelles organised charter flights to get their citizens out. Are we relying , again , on the goodwill of the West to protect us again? Remember that in this new world, people are looking out for their own. Poles are helping fellow Slavs from across the borders. Why doesnt the African Union organise a repat flight for Africans in Ukraine? They have a budget of almost US$2b....","Why arent their embassies helping them? I know Egypt and Seychelles organised charter flights to get their citizens out. Are we relying , again , on the goodwill of the West to protect us again? Remember that in this new world, people are looking out for their own. Poles are helping fellow Slavs from across the borders. Why doesnt the African Union organise a repat flight for Africans in Ukraine? They have a budget of almost US$2b....",4,2022-02-28 02:52:27,<praw.models.comment_forest.CommentForest object at 0x0000021CDA9B15E0>,t33xq0,worldnews,t5_2qh13,,False,False,t3_t33xq0,t3_t33xq0,/r/worldnews/comments/t33xq0/africans_trying_to_flee_ukraine_complain_of_being/hyq9l3u/
525,hyq3xhq,No-Quarter6015,Ukraine really is ready for EU admission!,Ukraine really is ready for EU admission!,4,2022-02-28 02:09:03,<praw.models.comment_forest.CommentForest object at 0x0000021CDA9B1E20>,t33xq0,worldnews,t5_2qh13,,False,False,t3_t33xq0,t3_t33xq0,/r/worldnews/comments/t33xq0/africans_trying_to_flee_ukraine_complain_of_being/hyq3xhq/
526,hyqazvm,,idc about the west. yall can settle your own shit. I pray for the people of colour to get home safe. fuck racism. fuck war.,idc about the west. yall can settle your own shit. I pray for the people of colour to get home safe. fuck racism. fuck war.,5,2022-02-28 03:03:13,<praw.models.comment_forest.CommentForest object at 0x0000021CDA9B1EE0>,t33xq0,worldnews,t5_2qh13,,False,False,t3_t33xq0,t3_t33xq0,/r/worldnews/comments/t33xq0/africans_trying_to_flee_ukraine_complain_of_being/hyqazvm/
527,hyqbqfb,mikeybagodonuts, Can we verify if this is not a Poland directive before we throw Ukraine under the bus. Poland has a real big racism problem themselves., Can we verify if this is not a Poland directive before we throw Ukraine under the bus. Poland has a real big racism problem themselves.,2,2022-02-28 03:08:54,<praw.models.comment_forest.CommentForest object at 0x0000021CDA9B1F40>,t33xq0,worldnews,t5_2qh13,,False,False,t3_t33xq0,t3_t33xq0,/r/worldnews/comments/t33xq0/africans_trying_to_flee_ukraine_complain_of_being/hyqbqfb/
528,hyq4emj,,[removed],[removed],2,2022-02-28 02:12:43,<praw.models.comment_forest.CommentForest object at 0x0000021CDA9D3100>,t33xq0,worldnews,t5_2qh13,,False,False,t3_t33xq0,t3_t33xq0,/r/worldnews/comments/t33xq0/africans_trying_to_flee_ukraine_complain_of_being/hyq4emj/
529,hyq2rze,,[removed],[removed],-8,2022-02-28 02:00:12,<praw.models.comment_forest.CommentForest object at 0x0000021CDA9D3340>,t33xq0,worldnews,t5_2qh13,,False,False,t3_t33xq0,t3_t33xq0,/r/worldnews/comments/t33xq0/africans_trying_to_flee_ukraine_complain_of_being/hyq2rze/
530,hyqob3w,,[deleted],[deleted],-2,2022-02-28 04:53:07,<praw.models.comment_forest.CommentForest object at 0x0000021CDA9D3580>,t33xq0,worldnews,t5_2qh13,,False,False,t3_t33xq0,t3_t33xq0,/r/worldnews/comments/t33xq0/africans_trying_to_flee_ukraine_complain_of_being/hyqob3w/
531,hyqcohe,Ha-Gorri,"I'd like to share something from the spanish tv, I'm by no meand downplaying or denying there is racism going on, but spanish citicens and others, specially males, are being blocked or are trapped in ukraine because the run away its a mess and they load in children and women first.

If you see the people boarding the trains it's an apocaliptic scene, almost looking like if they are are running away from the end of times, it's  a very hard situation, there is even one man followed by the spanish media that is going to enter Ukraine himself to get his two sons and wife out, because they havent managed to leave.

Also, the only country can travel into EU territory without documentation is Ukraine, the necessary changes in law havent been made for the rest of countries, which may add to this problem, just a reminder that Russia wants this to be the truth, shills are pushing this with all their might and I myself have seen black american people crossing the polish border in a bus with no major troubles live on tv.

&#x200B;

**BEWARE OF RUSSIAN PROPAGANDA FOLKS**  


Edit: Downvoted without answers, I guess putin cocksuckers and russian bots are full course ahead, glad this post got 0 upvotes, keep losing shills.","I'd like to share something from the spanish tv, I'm by no meand downplaying or denying there is racism going on, but spanish citicens and others, specially males, are being blocked or are trapped in ukraine because the run away its a mess and they load in children and women first.

If you see the people boarding the trains it's an apocaliptic scene, almost looking like if they are are running away from the end of times, it's  a very hard situation, there is even one man followed by the spanish media that is going to enter Ukraine himself to get his two sons and wife out, because they havent managed to leave.

Also, the only country can travel into EU territory without documentation is Ukraine, the necessary changes in law havent been made for the rest of countries, which may add to this problem, just a reminder that Russia wants this to be the truth, shills are pushing this with all their might and I myself have seen black american people crossing the polish border in a bus with no major troubles live on tv.

&#x200B;

**BEWARE OF RUSSIAN PROPAGANDA FOLKS**  


Edit: Downvoted without answers, I guess putin cocksuckers and russian bots are full course ahead, glad this post got 0 upvotes, keep losing shills.",-6,2022-02-28 03:16:13,<praw.models.comment_forest.CommentForest object at 0x0000021CDA9D3640>,t33xq0,worldnews,t5_2qh13,,1646024862.0,False,t3_t33xq0,t3_t33xq0,/r/worldnews/comments/t33xq0/africans_trying_to_flee_ukraine_complain_of_being/hyqcohe/
532,hyu8q73,Gilgamesh107,Doesn't surprise me.,Doesn't surprise me.,1,2022-02-28 22:51:03,<praw.models.comment_forest.CommentForest object at 0x0000021CDA9D3880>,t33xq0,worldnews,t5_2qh13,,False,False,t3_t33xq0,t3_t33xq0,/r/worldnews/comments/t33xq0/africans_trying_to_flee_ukraine_complain_of_being/hyu8q73/
533,hzfuzz1,fnatic440,How is this controversial?,How is this controversial?,1,2022-03-05 11:10:09,<praw.models.comment_forest.CommentForest object at 0x0000021CDA9D39A0>,t33xq0,worldnews,t5_2qh13,,False,False,t3_t33xq0,t3_t33xq0,/r/worldnews/comments/t33xq0/africans_trying_to_flee_ukraine_complain_of_being/hzfuzz1/
534,i0xzqg8,,If you have to choose between two live id rather choose the white,If you have to choose between two live id rather choose the white,1,2022-03-16 22:27:17,<praw.models.comment_forest.CommentForest object at 0x0000021CDA9D3A60>,t33xq0,worldnews,t5_2qh13,,False,False,t3_t33xq0,t3_t33xq0,/r/worldnews/comments/t33xq0/africans_trying_to_flee_ukraine_complain_of_being/i0xzqg8/
535,hyqc6fn,Migmatite,"Yes. Poland has already released a statement in regards to this.  A number of troll accounts have been spreading the same information to flame war between people.

Russia, particularly Putin, refuses to realize that we can hate racism and him. And we can work systematically to end any type of racism taking place, support our allies, and oppose him all at once.

 Widespread racism in border crossing for fleeing citizens isn't happening.  Poland investigated the allegations and corrected any that were possibly at the border.

Meanwhile, the South African ambassador in Warsaw personally went to the border with Ukraine to deal with the case. So the embassy is doing their job. 

As for getting access to the border.  Some of the reason students find themselves stranded is traffic.

Translated from [Polish statement;](https://wiadomosci.gazeta.pl/wiadomosci/7,114881,28162766,problemy-studentow-z-afryki-na-granicy-polsko-ukrainskiej-sg.html)

""We were able to talk to Samuel. The problem turned out to be not just crossing the border, but getting to it. On Saturday evening, when we talked about it, it was about 30 km from the Medic's passage and there was already a traffic jam to the border. - 'I left Kiev 3 days ago. Now we're stuck here and it's impossible to move on. We had food, but it was over,' Samuel told us.""

So the situation is being handled as best as it can be with the resources on hand.  Let me clarify; widespread racism isn't happening, but small scale individual racism could be.  In which case, fleeing individuals who believe they have experienced racism should contact their country's embassy for help.","Yes. Poland has already released a statement in regards to this.  A number of troll accounts have been spreading the same information to flame war between people.

Russia, particularly Putin, refuses to realize that we can hate racism and him. And we can work systematically to end any type of racism taking place, support our allies, and oppose him all at once.

 Widespread racism in border crossing for fleeing citizens isn't happening.  Poland investigated the allegations and corrected any that were possibly at the border.

Meanwhile, the South African ambassador in Warsaw personally went to the border with Ukraine to deal with the case. So the embassy is doing their job. 

As for getting access to the border.  Some of the reason students find themselves stranded is traffic.

Translated from [Polish statement;](https://wiadomosci.gazeta.pl/wiadomosci/7,114881,28162766,problemy-studentow-z-afryki-na-granicy-polsko-ukrainskiej-sg.html)

""We were able to talk to Samuel. The problem turned out to be not just crossing the border, but getting to it. On Saturday evening, when we talked about it, it was about 30 km from the Medic's passage and there was already a traffic jam to the border. - 'I left Kiev 3 days ago. Now we're stuck here and it's impossible to move on. We had food, but it was over,' Samuel told us.""

So the situation is being handled as best as it can be with the resources on hand.  Let me clarify; widespread racism isn't happening, but small scale individual racism could be.  In which case, fleeing individuals who believe they have experienced racism should contact their country's embassy for help.",24,2022-02-28 03:12:19,<praw.models.comment_forest.CommentForest object at 0x0000021CDA9CA2E0>,t33xq0,worldnews,t5_2qh13,,False,False,t3_t33xq0,t1_hyq3mjj,/r/worldnews/comments/t33xq0/africans_trying_to_flee_ukraine_complain_of_being/hyqc6fn/
536,hyq8erv,ydalv_,"Yes, I've seen their videos on Twitter, but that doesn't excuse everything though.","Yes, I've seen their videos on Twitter, but that doesn't excuse everything though.",8,2022-02-28 02:43:26,<praw.models.comment_forest.CommentForest object at 0x0000021CDA9CA340>,t33xq0,worldnews,t5_2qh13,,False,False,t3_t33xq0,t1_hyq3mjj,/r/worldnews/comments/t33xq0/africans_trying_to_flee_ukraine_complain_of_being/hyq8erv/
537,i0xzr7q,,If you have to choose between two live id rather choose the white,If you have to choose between two live id rather choose the white,1,2022-03-16 22:27:25,<praw.models.comment_forest.CommentForest object at 0x0000021CDA9CA6A0>,t33xq0,worldnews,t5_2qh13,,False,False,t3_t33xq0,t1_hyq3mjj,/r/worldnews/comments/t33xq0/africans_trying_to_flee_ukraine_complain_of_being/i0xzr7q/
538,hyqd3sj,saeculacrossing,"Thank you for saying this. We can support Ukraine and also acknowledge that there's likely truth in this issue. Racism doesn't disappear because there's a war, but tensions are high and propaganda is flowing so I think people are trying to downplay that this could even be happening.","Thank you for saying this. We can support Ukraine and also acknowledge that there's likely truth in this issue. Racism doesn't disappear because there's a war, but tensions are high and propaganda is flowing so I think people are trying to downplay that this could even be happening.",29,2022-02-28 03:19:34,<praw.models.comment_forest.CommentForest object at 0x0000021CDA9CA760>,t33xq0,worldnews,t5_2qh13,,False,False,t3_t33xq0,t1_hyq4wx2,/r/worldnews/comments/t33xq0/africans_trying_to_flee_ukraine_complain_of_being/hyqd3sj/
539,hyq83oi,ydalv_,"Your attitude is appreciated, the people who flat out try to deny it make my blood boil. I hope Ukrainians kick Putin's ass and then work on reducing discrimination, holy damn.","Your attitude is appreciated, the people who flat out try to deny it make my blood boil. I hope Ukrainians kick Putin's ass and then work on reducing discrimination, holy damn.",37,2022-02-28 02:41:04,<praw.models.comment_forest.CommentForest object at 0x0000021CDA9CA7C0>,t33xq0,worldnews,t5_2qh13,,False,False,t3_t33xq0,t1_hyq4wx2,/r/worldnews/comments/t33xq0/africans_trying_to_flee_ukraine_complain_of_being/hyq83oi/
540,hystoa3,-Disgruntled-Goat-,so they dont like a certain kind of people and are not letting them leave? wouldn't it be better to let them leave and not come back? It make no sense,so they dont like a certain kind of people and are not letting them leave? wouldn't it be better to let them leave and not come back? It make no sense,2,2022-02-28 17:20:16,<praw.models.comment_forest.CommentForest object at 0x0000021CDA9CA820>,t33xq0,worldnews,t5_2qh13,,False,False,t3_t33xq0,t1_hyq4wx2,/r/worldnews/comments/t33xq0/africans_trying_to_flee_ukraine_complain_of_being/hystoa3/
541,hyq7777,,[deleted],[deleted],-6,2022-02-28 02:34:09,<praw.models.comment_forest.CommentForest object at 0x0000021CDA9CA880>,t33xq0,worldnews,t5_2qh13,,False,False,t3_t33xq0,t1_hyq4wx2,/r/worldnews/comments/t33xq0/africans_trying_to_flee_ukraine_complain_of_being/hyq7777/
542,hyqenf6,Happyfuntimeyay,"Also, priority to citizens of the country by their own army isn't crazy or out of line.... Students have embassies, and should have been gone already, not fleeing at the last possible moment and then screaming racism when Ukraine takes care of Ukrainians first.  Not saying there isn't racism there or that it isn't in play, but there is a literal war happening and they aren't citizens and aren't the priority.","Also, priority to citizens of the country by their own army isn't crazy or out of line.... Students have embassies, and should have been gone already, not fleeing at the last possible moment and then screaming racism when Ukraine takes care of Ukrainians first.  Not saying there isn't racism there or that it isn't in play, but there is a literal war happening and they aren't citizens and aren't the priority.",-9,2022-02-28 03:31:38,<praw.models.comment_forest.CommentForest object at 0x0000021CDA9CA940>,t33xq0,worldnews,t5_2qh13,,False,False,t3_t33xq0,t1_hyq4wx2,/r/worldnews/comments/t33xq0/africans_trying_to_flee_ukraine_complain_of_being/hyqenf6/
543,hyqqw80,3_subject_notebook,"Yeah its sad that people here arent acknowledging this is an issue, and insist it must be Russian propaganda or something...

I was surprised I saw this on Instagram first, and the comments there were more sane.","Yeah its sad that people here arent acknowledging this is an issue, and insist it must be Russian propaganda or something...

I was surprised I saw this on Instagram first, and the comments there were more sane.",19,2022-02-28 05:17:00,<praw.models.comment_forest.CommentForest object at 0x0000021CDA9CABE0>,t33xq0,worldnews,t5_2qh13,,False,False,t3_t33xq0,t1_hyqeef7,/r/worldnews/comments/t33xq0/africans_trying_to_flee_ukraine_complain_of_being/hyqqw80/
544,hyxtzgg,Miserable_Mr_Masle,Ignored *on Reddit* since that's the platform we're on where it's being downvoted. Reddit users are mostly white males so it shouldn't be too surprising that racism is ignored.,Ignored *on Reddit* since that's the platform we're on where it's being downvoted. Reddit users are mostly white males so it shouldn't be too surprising that racism is ignored.,6,2022-03-01 18:05:13,<praw.models.comment_forest.CommentForest object at 0x0000021CDA9CACA0>,t33xq0,worldnews,t5_2qh13,,False,False,t3_t33xq0,t1_hyqeef7,/r/worldnews/comments/t33xq0/africans_trying_to_flee_ukraine_complain_of_being/hyxtzgg/
545,hysukh1,-Disgruntled-Goat-,no. it is the propaganda tied to it.,no. it is the propaganda tied to it.,-3,2022-02-28 17:25:56,<praw.models.comment_forest.CommentForest object at 0x0000021CDA9CAFA0>,t33xq0,worldnews,t5_2qh13,,False,False,t3_t33xq0,t1_hyqeef7,/r/worldnews/comments/t33xq0/africans_trying_to_flee_ukraine_complain_of_being/hysukh1/
546,hyu90f6,Manor-Estate,Its amazing how whist being invaded they still find the time and energy to be racist anyways. Some real r/awfuleverything material.,Its amazing how whist being invaded they still find the time and energy to be racist anyways. Some real r/awfuleverything material.,12,2022-02-28 22:53:02,<praw.models.comment_forest.CommentForest object at 0x0000021CDA9DC100>,t33xq0,worldnews,t5_2qh13,,False,False,t3_t33xq0,t1_hyq5k5a,/r/worldnews/comments/t33xq0/africans_trying_to_flee_ukraine_complain_of_being/hyu90f6/
547,hyq6wk9,ydalv_,"Yeah, they're racist fucks. It's verifiably true. Now isn't the moment to change that obviously, but holy damn, Ukrainian command should reprimand their troop (and population) to remind them to treat foreigners well. If this would hit global media, it would cost Ukraine a fair bit of support - which it cannot afford. If not for being a decent person, the racist fucks who treat foreigners like shit, should change their ways to help support their country instead of giving it a bad look.","Yeah, they're racist fucks. It's verifiably true. Now isn't the moment to change that obviously, but holy damn, Ukrainian command should reprimand their troop (and population) to remind them to treat foreigners well. If this would hit global media, it would cost Ukraine a fair bit of support - which it cannot afford. If not for being a decent person, the racist fucks who treat foreigners like shit, should change their ways to help support their country instead of giving it a bad look.",21,2022-02-28 02:31:57,<praw.models.comment_forest.CommentForest object at 0x0000021CDA9DC160>,t33xq0,worldnews,t5_2qh13,,False,False,t3_t33xq0,t1_hyq5k5a,/r/worldnews/comments/t33xq0/africans_trying_to_flee_ukraine_complain_of_being/hyq6wk9/
548,hyq5x0o,,[deleted],[deleted],-6,2022-02-28 02:24:19,<praw.models.comment_forest.CommentForest object at 0x0000021CDA9DC1C0>,t33xq0,worldnews,t5_2qh13,,False,False,t3_t33xq0,t1_hyq5k5a,/r/worldnews/comments/t33xq0/africans_trying_to_flee_ukraine_complain_of_being/hyq5x0o/
549,hyq7nbh,ydalv_,"It's no reason to stop supporting Ukrainians in their war. But Ukrainian authorities should remind their population to treat foreigners well. Tackling racism in general is an issue for AFTER the war, because priorities.","It's no reason to stop supporting Ukrainians in their war. But Ukrainian authorities should remind their population to treat foreigners well. Tackling racism in general is an issue for AFTER the war, because priorities.",11,2022-02-28 02:37:33,<praw.models.comment_forest.CommentForest object at 0x0000021CDA9DC400>,t33xq0,worldnews,t5_2qh13,,False,False,t3_t33xq0,t1_hyq76y9,/r/worldnews/comments/t33xq0/africans_trying_to_flee_ukraine_complain_of_being/hyq7nbh/
550,hz6nwcy,Hlknn,"And what's worse: these airheads don't know that supporting Ukraine, also implies supporting a nazi junta that's being ruling that country since 2014, with over 15 thousand civilians killed since then, sponsored and silenced by western propaganda.

And if someone wants to make a remark that nobody did anything back then, let me remind you that russian government spent the last 8 years using diplomacy to not come to this point, but you morons, elected a cabal of old, senile and stupid boomers, with delusions of grandeur, declining popularity that needed the perfect scapegoat, to boost their already plummeted polls.","And what's worse: these airheads don't know that supporting Ukraine, also implies supporting a nazi junta that's being ruling that country since 2014, with over 15 thousand civilians killed since then, sponsored and silenced by western propaganda.

And if someone wants to make a remark that nobody did anything back then, let me remind you that russian government spent the last 8 years using diplomacy to not come to this point, but you morons, elected a cabal of old, senile and stupid boomers, with delusions of grandeur, declining popularity that needed the perfect scapegoat, to boost their already plummeted polls.",2,2022-03-03 14:18:20,<praw.models.comment_forest.CommentForest object at 0x0000021CDA9DC460>,t33xq0,worldnews,t5_2qh13,,False,False,t3_t33xq0,t1_hyq76y9,/r/worldnews/comments/t33xq0/africans_trying_to_flee_ukraine_complain_of_being/hz6nwcy/
551,hyqey1l,Happyfuntimeyay,"It isn't being ignored at all, you are literally posting on a story about it.... Students that didn't leave aren't exactly the Ukrainian militaries priority in an invasion, stop screaming racism. It's incredibly stupid of you.","It isn't being ignored at all, you are literally posting on a story about it.... Students that didn't leave aren't exactly the Ukrainian militaries priority in an invasion, stop screaming racism. It's incredibly stupid of you.",0,2022-02-28 03:33:58,<praw.models.comment_forest.CommentForest object at 0x0000021CDA9DC520>,t33xq0,worldnews,t5_2qh13,,False,False,t3_t33xq0,t1_hyq76y9,/r/worldnews/comments/t33xq0/africans_trying_to_flee_ukraine_complain_of_being/hyqey1l/
552,hysuvf7,-Disgruntled-Goat-,"no, use some common sense. A government would stop a hated group from leaving ? If they hated them they would let them leave but not come back","no, use some common sense. A government would stop a hated group from leaving ? If they hated them they would let them leave but not come back",-1,2022-02-28 17:27:53,<praw.models.comment_forest.CommentForest object at 0x0000021CDA9DCA00>,t33xq0,worldnews,t5_2qh13,,False,False,t3_t33xq0,t1_hyq76y9,/r/worldnews/comments/t33xq0/africans_trying_to_flee_ukraine_complain_of_being/hysuvf7/
553,hyrh3ja,SarcasticAssBag,"> Public service message to white people

Public service message to you: Don't automatically and uncritically believe every grievance you see posted just because it fits your personal politics.","> Public service message to white people

Public service message to you: Don't automatically and uncritically believe every grievance you see posted just because it fits your personal politics.",4,2022-02-28 10:30:01,<praw.models.comment_forest.CommentForest object at 0x0000021CDA9DCF40>,t33xq0,worldnews,t5_2qh13,,False,False,t3_t33xq0,t1_hyqsx8m,/r/worldnews/comments/t33xq0/africans_trying_to_flee_ukraine_complain_of_being/hyrh3ja/
