,ID,Author,body,Comment,Score,Created On,Replies,Submission,Subreddit,Subreddit_ID,Distinguished,Edited,Is_submitter,link_id,Parent_id,Permalink
200,jf48eld,NothingGlad1024,"That is what the article says and there is some initial wave of wierdos trying to say that's not what it says, but that is what it says. HOWEVER it also says some industries have very little pay difference, but some still have big ones, even a historically female dominated industry like education.

The data is normalized by industry and position level, so it's not about men holding down long term higher up positions. That's people making excuses and sticking their fingers in their ears.","That is what the article says and there is some initial wave of wierdos trying to say that's not what it says, but that is what it says. HOWEVER it also says some industries have very little pay difference, but some still have big ones, even a historically female dominated industry like education.

The data is normalized by industry and position level, so it's not about men holding down long term higher up positions. That's people making excuses and sticking their fingers in their ears.",1,2023-04-05 23:12:49,<praw.models.comment_forest.CommentForest object at 0x0000021CDC6241F0>,12cvmtj,worldnews,t5_2qh13,,False,False,t3_12cvmtj,t1_jf3ghxw,/r/worldnews/comments/12cvmtj/eight_out_of_ten_firms_pay_men_more_than_women/jf48eld/
201,jf45fmj,Devourer_of_felines,Curious why the median pay gap is a newsworthy travesty but women outnumbering men 3:2 in college enrolment is something worth boasting about,Curious why the median pay gap is a newsworthy travesty but women outnumbering men 3:2 in college enrolment is something worth boasting about,13,2023-04-05 22:50:35,<praw.models.comment_forest.CommentForest object at 0x0000021CDC624460>,12cvmtj,worldnews,t5_2qh13,,False,False,t3_12cvmtj,t1_jf3tchc,/r/worldnews/comments/12cvmtj/eight_out_of_ten_firms_pay_men_more_than_women/jf45fmj/
202,jf4bqla,fictionalicon,I'm not scared.  It's the same topic wage equity.   Are you a racist or a nationalist?,I'm not scared.  It's the same topic wage equity.   Are you a racist or a nationalist?,2,2023-04-05 23:37:59,<praw.models.comment_forest.CommentForest object at 0x0000021CDC611340>,12cvmtj,worldnews,t5_2qh13,,False,False,t3_12cvmtj,t1_jf49br1,/r/worldnews/comments/12cvmtj/eight_out_of_ten_firms_pay_men_more_than_women/jf4bqla/
203,jfbyyhj,blade740,"If a company is hiring more women in lower-paying positions and more men at higher-paying positions, isn't that still a notable bias?  Normalizing by job title seems like a great way to pretend that bias doesn't exist.  

If anything you'd have to normalize by something like level of experience/education prior to applying for the job.  If a company hires two equally-qualified candidates, one male and one female, but the male is more likely to get promoted to management, that's a bias.  Using median salary company-wide means the statistic is comparing both base salary and opportunities for advancement.","If a company is hiring more women in lower-paying positions and more men at higher-paying positions, isn't that still a notable bias?  Normalizing by job title seems like a great way to pretend that bias doesn't exist.  

If anything you'd have to normalize by something like level of experience/education prior to applying for the job.  If a company hires two equally-qualified candidates, one male and one female, but the male is more likely to get promoted to management, that's a bias.  Using median salary company-wide means the statistic is comparing both base salary and opportunities for advancement.",1,2023-04-07 16:03:29,<praw.models.comment_forest.CommentForest object at 0x0000021CDC6249D0>,12cvmtj,worldnews,t5_2qh13,,False,False,t3_12cvmtj,t1_jfbtxmh,/r/worldnews/comments/12cvmtj/eight_out_of_ten_firms_pay_men_more_than_women/jfbyyhj/
204,jf4fguv,green_flash,"Same thing. Women are not less qualified, in fact young women are on average better educated than young men these days.","Same thing. Women are not less qualified, in fact young women are on average better educated than young men these days.",-9,2023-04-06 00:06:20,<praw.models.comment_forest.CommentForest object at 0x0000021CDC624CD0>,12cvmtj,worldnews,t5_2qh13,,False,False,t3_12cvmtj,t1_jf3wane,/r/worldnews/comments/12cvmtj/eight_out_of_ten_firms_pay_men_more_than_women/jf4fguv/
205,jf4n9ys,green_flash,"You're describing exactly what's wrong, but apparently you are so accustomed to it that you fail to see it as wrong.","You're describing exactly what's wrong, but apparently you are so accustomed to it that you fail to see it as wrong.",-8,2023-04-06 01:05:17,<praw.models.comment_forest.CommentForest object at 0x0000021CDC624E50>,12cvmtj,worldnews,t5_2qh13,,False,False,t3_12cvmtj,t1_jf4mghp,/r/worldnews/comments/12cvmtj/eight_out_of_ten_firms_pay_men_more_than_women/jf4n9ys/
206,jf3l60l,SomeoneWhoBelieves,Oh my goodness 🤣,Oh my goodness 🤣,13,2023-04-05 20:32:23,<praw.models.comment_forest.CommentForest object at 0x0000021CDC6240A0>,12cvmtj,worldnews,t5_2qh13,,False,False,t3_12cvmtj,t1_jf3k19c,/r/worldnews/comments/12cvmtj/eight_out_of_ten_firms_pay_men_more_than_women/jf3l60l/
207,jf3spek,green_flash,"Yes, the actual issue is that for decades women were not promoted into leadership positions because of misogynist biases. Nowadays, it is happening more and more, but it takes time to rectify the existing imbalance.","Yes, the actual issue is that for decades women were not promoted into leadership positions because of misogynist biases. Nowadays, it is happening more and more, but it takes time to rectify the existing imbalance.",-3,2023-04-05 21:20:35,<praw.models.comment_forest.CommentForest object at 0x0000021CDC624280>,12cvmtj,worldnews,t5_2qh13,,False,False,t3_12cvmtj,t1_jf3gyuk,/r/worldnews/comments/12cvmtj/eight_out_of_ten_firms_pay_men_more_than_women/jf3spek/
208,jf48v2f,NothingGlad1024,"Because the data is normalized by industry and job level, so women IN CERTAIN INDUSTRIES are getting paid 20% less... as the pretty graphic in the article says if any of your would bother to read it vs believe the first BS comment you read that confirms your biases and fluffs your ego.","Because the data is normalized by industry and job level, so women IN CERTAIN INDUSTRIES are getting paid 20% less... as the pretty graphic in the article says if any of your would bother to read it vs believe the first BS comment you read that confirms your biases and fluffs your ego.",-1,2023-04-05 23:16:15,<praw.models.comment_forest.CommentForest object at 0x0000021CDC6244F0>,12cvmtj,worldnews,t5_2qh13,,False,False,t3_12cvmtj,t1_jf45fmj,/r/worldnews/comments/12cvmtj/eight_out_of_ten_firms_pay_men_more_than_women/jf48v2f/
209,jfc15yt,Devourer_of_felines,"> If a company is hiring more women in lower-paying positions and more men at higher-paying positions, isn't that still a notable bias? 

No, and frankly that’s a rather obtuse view of economics. A software engineer and BA working at the same company will not make the same salary, likewise it’d be inane to expect office admin for a shipping company to earn the same as the truckers. 

> If a company hires two equally-qualified candidates, one male and one female, but the male is more likely to get promoted to management, that's a bias.

because as we all know, job performance can’t possibly differ for two people with similar on paper qualifications when they started the job right?","> If a company is hiring more women in lower-paying positions and more men at higher-paying positions, isn't that still a notable bias? 

No, and frankly that’s a rather obtuse view of economics. A software engineer and BA working at the same company will not make the same salary, likewise it’d be inane to expect office admin for a shipping company to earn the same as the truckers. 

> If a company hires two equally-qualified candidates, one male and one female, but the male is more likely to get promoted to management, that's a bias.

because as we all know, job performance can’t possibly differ for two people with similar on paper qualifications when they started the job right?",3,2023-04-07 16:18:03,<praw.models.comment_forest.CommentForest object at 0x0000021CDC624B50>,12cvmtj,worldnews,t5_2qh13,,False,False,t3_12cvmtj,t1_jfbyyhj,/r/worldnews/comments/12cvmtj/eight_out_of_ten_firms_pay_men_more_than_women/jfc15yt/
210,jf7m4dx,FaithlessnessCute204,"In some of these fields it’s a population issue, if the field is split 80/20 based on gender you would expect to see a 4:1 makeup in management. In fact if it start to trend away from population you know outside factors are at work","In some of these fields it’s a population issue, if the field is split 80/20 based on gender you would expect to see a 4:1 makeup in management. In fact if it start to trend away from population you know outside factors are at work",5,2023-04-06 17:33:13,<praw.models.comment_forest.CommentForest object at 0x0000021CDC624C10>,12cvmtj,worldnews,t5_2qh13,,False,False,t3_12cvmtj,t1_jf4fguv,/r/worldnews/comments/12cvmtj/eight_out_of_ten_firms_pay_men_more_than_women/jf7m4dx/
211,jf59mp3,,[removed],[removed],5,2023-04-06 04:07:31,<praw.models.comment_forest.CommentForest object at 0x0000021CDC624D30>,12cvmtj,worldnews,t5_2qh13,,False,False,t3_12cvmtj,t1_jf4fguv,/r/worldnews/comments/12cvmtj/eight_out_of_ten_firms_pay_men_more_than_women/jf59mp3/
212,jf6g9qi,ottawacanuk,What would your solution be?,What would your solution be?,2,2023-04-06 12:46:56,<praw.models.comment_forest.CommentForest object at 0x0000021CDC624EB0>,12cvmtj,worldnews,t5_2qh13,,False,False,t3_12cvmtj,t1_jf4n9ys,/r/worldnews/comments/12cvmtj/eight_out_of_ten_firms_pay_men_more_than_women/jf6g9qi/
213,jf48ljj,,[removed],[removed],-1,2023-04-05 23:14:16,<praw.models.comment_forest.CommentForest object at 0x0000021CDC624310>,12cvmtj,worldnews,t5_2qh13,,False,False,t3_12cvmtj,t1_jf3spek,/r/worldnews/comments/12cvmtj/eight_out_of_ten_firms_pay_men_more_than_women/jf48ljj/
214,jf4xsgh,Devourer_of_felines,Have you ever worked at all? It doesn’t sound like it or you’d understand working in the same industry != doing the same work.,Have you ever worked at all? It doesn’t sound like it or you’d understand working in the same industry != doing the same work.,6,2023-04-06 02:25:26,<praw.models.comment_forest.CommentForest object at 0x0000021CDC624520>,12cvmtj,worldnews,t5_2qh13,,False,False,t3_12cvmtj,t1_jf48v2f,/r/worldnews/comments/12cvmtj/eight_out_of_ten_firms_pay_men_more_than_women/jf4xsgh/
215,jfc7cl0,blade740,">If a company is hiring more women in lower-paying positions and more men at higher-paying positions, isn't that still a notable bias? 
>
>>No, and frankly that’s a rather obtuse view of economics. A software engineer and BA working at the same company will not make the same salary, likewise it’d be inane to expect office admin for a shipping company to earn the same as the truckers. 

It feels like you completely missed the point I was making.  I agree that comparing two different job titles is apples to oranges.  However, if a company has a tendency to NOT hire women for higher-paying positions that is still a bias that will be completely HIDDEN by looking strictly at pay for the same position.  

If a company only ever hires women in secretarial and janitorial positions, and consistently hires only men into management, would you agree that this is an example of biased hiring practices?  What sort of statistical analysis would you use to detect such a bias?

>If a company hires two equally-qualified candidates, one male and one female, but the male is more likely to get promoted to management, that's a bias.
>
>>because as we all know, job performance can’t possibly differ for two people with similar on paper qualifications when they started the job right?

Sure, on an individual level.  But we're talking about statistically, company-wide.  If everything is equal, men are just as likely to outperform women as vice versa, and you'd expect them to be promoted at roughly equal rates on average, right?",">If a company is hiring more women in lower-paying positions and more men at higher-paying positions, isn't that still a notable bias? 
>
>>No, and frankly that’s a rather obtuse view of economics. A software engineer and BA working at the same company will not make the same salary, likewise it’d be inane to expect office admin for a shipping company to earn the same as the truckers. 

It feels like you completely missed the point I was making.  I agree that comparing two different job titles is apples to oranges.  However, if a company has a tendency to NOT hire women for higher-paying positions that is still a bias that will be completely HIDDEN by looking strictly at pay for the same position.  

If a company only ever hires women in secretarial and janitorial positions, and consistently hires only men into management, would you agree that this is an example of biased hiring practices?  What sort of statistical analysis would you use to detect such a bias?

>If a company hires two equally-qualified candidates, one male and one female, but the male is more likely to get promoted to management, that's a bias.
>
>>because as we all know, job performance can’t possibly differ for two people with similar on paper qualifications when they started the job right?

Sure, on an individual level.  But we're talking about statistically, company-wide.  If everything is equal, men are just as likely to outperform women as vice versa, and you'd expect them to be promoted at roughly equal rates on average, right?",0,2023-04-07 16:58:05,<praw.models.comment_forest.CommentForest object at 0x0000021CDC624AF0>,12cvmtj,worldnews,t5_2qh13,,1680886894.0,False,t3_12cvmtj,t1_jfc15yt,/r/worldnews/comments/12cvmtj/eight_out_of_ten_firms_pay_men_more_than_women/jfc7cl0/
216,jf4g17i,green_flash,"No it doesn't say that. In fact, it explicitly says that it's not normalized by job position.

> The data is based on the difference in pay between the middle-ranking woman and the middle-ranking man, the so-called ""median"" pay gap.

> This is different to unequal pay - paying women less for the same work - which is illegal.","No it doesn't say that. In fact, it explicitly says that it's not normalized by job position.

> The data is based on the difference in pay between the middle-ranking woman and the middle-ranking man, the so-called ""median"" pay gap.

> This is different to unequal pay - paying women less for the same work - which is illegal.",5,2023-04-06 00:10:35,<praw.models.comment_forest.CommentForest object at 0x0000021CDC624340>,12cvmtj,worldnews,t5_2qh13,,False,False,t3_12cvmtj,t1_jf48ljj,/r/worldnews/comments/12cvmtj/eight_out_of_ten_firms_pay_men_more_than_women/jf4g17i/
217,jfcdgqp,Devourer_of_felines,"> if a company has a tendency to NOT hire women for higher-paying positions that is still a bias that will be completely HIDDEN by looking strictly at pay for the same position.

That’s hold true if there’s an equal distribution of qualified women and men for those jobs. Which is not true if you look at how few women actually go into the tech sector with tech related qualifications, or into any of the high manual labour trades.

> If a company only ever hires women in secretarial and janitorial positions, and consistently hires only men into management, would you agree that this is an example of biased hiring practices?

Yes it would be. And such a company would be raked over the coals by lawsuits and cease to exist.

You and the article’s writers seem very focused on the handful of positions in management whilst ignoring the majority of the workforce for any given company - an office admin and a construction foreman both work “in the same industry” but the former is a higher paying but much less cushy position that statistically women do not go for.","> if a company has a tendency to NOT hire women for higher-paying positions that is still a bias that will be completely HIDDEN by looking strictly at pay for the same position.

That’s hold true if there’s an equal distribution of qualified women and men for those jobs. Which is not true if you look at how few women actually go into the tech sector with tech related qualifications, or into any of the high manual labour trades.

> If a company only ever hires women in secretarial and janitorial positions, and consistently hires only men into management, would you agree that this is an example of biased hiring practices?

Yes it would be. And such a company would be raked over the coals by lawsuits and cease to exist.

You and the article’s writers seem very focused on the handful of positions in management whilst ignoring the majority of the workforce for any given company - an office admin and a construction foreman both work “in the same industry” but the former is a higher paying but much less cushy position that statistically women do not go for.",3,2023-04-07 17:38:06,<praw.models.comment_forest.CommentForest object at 0x0000021CDC624850>,12cvmtj,worldnews,t5_2qh13,,False,False,t3_12cvmtj,t1_jfc7cl0,/r/worldnews/comments/12cvmtj/eight_out_of_ten_firms_pay_men_more_than_women/jfcdgqp/
218,jfcgtmi,blade740,"> if a company has a tendency to NOT hire women for higher-paying positions that is still a bias that will be completely HIDDEN by looking strictly at pay for the same position.
> 
>> That’s hold true if there’s an equal distribution of qualified women and men for those jobs. Which is not true if you look at how few women actually go into the tech sector with tech related qualifications, or into any of the high manual labour trades.

That's true and I don't disagree, but the fact still stands that if such a bias existed in a company, it would be completely hidden by strictly comparing men vs women's pay for the same position.  

> You and the article’s writers seem very focused on the handful of positions in management whilst ignoring the majority of the workforce for any given company - an office admin and a construction foreman both work “in the same industry” but the former is a higher paying but much less cushy position that statistically women do not go for.

Sure - there are very few women in the trades with the experience necessary to become a construction foreman (or software developer, or whatever).  And yet, if you were to, as I mentioned above, normalize for the level of experience prior to applying, you would likely find that a woman that DID have the requisite experience still has a harder time getting hired as a construction foreman than a man with the same level of experience.  Anecdotally, I've seen it happen - I work in a construction industry that is 99% male dominated, and the few women that do come through face intense discrimination - largely from other coworkers - that makes it difficult for them to advance.  I've seen the same thing in the tech sector, and heard plenty of anecdotal stories about how the few women that DO manage to get hired in still tend to face quite a bit of opposition.

And don't forget those handful of positions in management still matter.  If women are being driven out of entry level jobs and prevented from advancing in their careers, then they're going to find it harder, on average, to amass the experience needed to qualify for those management positions - through no fault of their own.  

Anyway, my point is this: while it's true that looking strictly at median salary at a company does not tell the whole story, neither does looking at salary on a position-by-position basis.  A large portion of the discrimination that women face in the workplace is not being considered for higher-paying jobs in the first place, as well as difficulties in gaining experience in male-dominated fields.  To properly assess the extent of the issue would require looking at hiring rates, average salaries, and long-term advancement opportunities for male and female employees with the same qualifications.","> if a company has a tendency to NOT hire women for higher-paying positions that is still a bias that will be completely HIDDEN by looking strictly at pay for the same position.
> 
>> That’s hold true if there’s an equal distribution of qualified women and men for those jobs. Which is not true if you look at how few women actually go into the tech sector with tech related qualifications, or into any of the high manual labour trades.

That's true and I don't disagree, but the fact still stands that if such a bias existed in a company, it would be completely hidden by strictly comparing men vs women's pay for the same position.  

> You and the article’s writers seem very focused on the handful of positions in management whilst ignoring the majority of the workforce for any given company - an office admin and a construction foreman both work “in the same industry” but the former is a higher paying but much less cushy position that statistically women do not go for.

Sure - there are very few women in the trades with the experience necessary to become a construction foreman (or software developer, or whatever).  And yet, if you were to, as I mentioned above, normalize for the level of experience prior to applying, you would likely find that a woman that DID have the requisite experience still has a harder time getting hired as a construction foreman than a man with the same level of experience.  Anecdotally, I've seen it happen - I work in a construction industry that is 99% male dominated, and the few women that do come through face intense discrimination - largely from other coworkers - that makes it difficult for them to advance.  I've seen the same thing in the tech sector, and heard plenty of anecdotal stories about how the few women that DO manage to get hired in still tend to face quite a bit of opposition.

And don't forget those handful of positions in management still matter.  If women are being driven out of entry level jobs and prevented from advancing in their careers, then they're going to find it harder, on average, to amass the experience needed to qualify for those management positions - through no fault of their own.  

Anyway, my point is this: while it's true that looking strictly at median salary at a company does not tell the whole story, neither does looking at salary on a position-by-position basis.  A large portion of the discrimination that women face in the workplace is not being considered for higher-paying jobs in the first place, as well as difficulties in gaining experience in male-dominated fields.  To properly assess the extent of the issue would require looking at hiring rates, average salaries, and long-term advancement opportunities for male and female employees with the same qualifications.",0,2023-04-07 18:00:14,<praw.models.comment_forest.CommentForest object at 0x0000021CDC624970>,12cvmtj,worldnews,t5_2qh13,,False,False,t3_12cvmtj,t1_jfcdgqp,/r/worldnews/comments/12cvmtj/eight_out_of_ten_firms_pay_men_more_than_women/jfcgtmi/
219,iolhkj1,PEVEI,"It’s an interesting report, but I expected something… more. I expected abuse, examples of employment being denied, but instead it was just a lot of, “People have stereotypical notions about Muslims” with a bit of, “Stop judging Muslim women by the headscarf, also let them wear it to work.”

The only part that seemed to be really concerning was this: 

> Sexism plays out within the broader discriminatory context, especially for women who wear headscarves. The report concluded that Muslim women are less likely to receive sexual health screenings or have claims of sexual violence against them be taken seriously. The same goes for treatment of resulting trauma.

That’s not great, but the article makes it unclear if this is down to the inadequacy of services, a problem typical of their socioeconomic stratum, targeted racism, or the result of family/spousal control.","It’s an interesting report, but I expected something… more. I expected abuse, examples of employment being denied, but instead it was just a lot of, “People have stereotypical notions about Muslims” with a bit of, “Stop judging Muslim women by the headscarf, also let them wear it to work.”

The only part that seemed to be really concerning was this: 

> Sexism plays out within the broader discriminatory context, especially for women who wear headscarves. The report concluded that Muslim women are less likely to receive sexual health screenings or have claims of sexual violence against them be taken seriously. The same goes for treatment of resulting trauma.

That’s not great, but the article makes it unclear if this is down to the inadequacy of services, a problem typical of their socioeconomic stratum, targeted racism, or the result of family/spousal control.",40,2022-09-15 23:22:48,<praw.models.comment_forest.CommentForest object at 0x0000021CD7205130>,xfag3k,worldnews,t5_2qh13,,False,False,t3_xfag3k,t3_xfag3k,/r/worldnews/comments/xfag3k/report_uncovers_germanys_structural_racism/iolhkj1/
220,iolizxy,,What a sham of a report. Fools gold.,What a sham of a report. Fools gold.,42,2022-09-15 23:33:58,<praw.models.comment_forest.CommentForest object at 0x0000021CD7205310>,xfag3k,worldnews,t5_2qh13,,False,False,t3_xfag3k,t3_xfag3k,/r/worldnews/comments/xfag3k/report_uncovers_germanys_structural_racism/iolizxy/
221,iole57r,Jibaron,Since when is Muslim a race?,Since when is Muslim a race?,56,2022-09-15 22:56:48,<praw.models.comment_forest.CommentForest object at 0x0000021CD7205490>,xfag3k,worldnews,t5_2qh13,,False,False,t3_xfag3k,t3_xfag3k,/r/worldnews/comments/xfag3k/report_uncovers_germanys_structural_racism/iole57r/
