,ID,Author,body,Comment,Score,Created On,Replies,Submission,Subreddit,Subreddit_ID,Distinguished,Edited,Is_submitter,link_id,Parent_id,Permalink
337,htkuiey,,"Despite everything that's happening, the world population is growing quite consistently and is expected to reach 11 billion by 2100. 

How many people do we need for Mars exactly? And how is it that growing the population by like 30% for the next century is still not enough? Will we even be able to send say 10k people to Mars in the next century? 

Elon has said a lot of questionable stuff, but this is incredibly idiotic. I thought he'd have a bit more self-respect and at least try to sound smart. This is just blatant bullshitting.","Despite everything that's happening, the world population is growing quite consistently and is expected to reach 11 billion by 2100. 

How many people do we need for Mars exactly? And how is it that growing the population by like 30% for the next century is still not enough? Will we even be able to send say 10k people to Mars in the next century? 

Elon has said a lot of questionable stuff, but this is incredibly idiotic. I thought he'd have a bit more self-respect and at least try to sound smart. This is just blatant bullshitting.",80,2022-01-21 09:26:05,<praw.models.comment_forest.CommentForest object at 0x0000021CD78D3F40>,s963x4,worldnews,t5_2qh13,,False,False,t3_s963x4,t3_s963x4,/r/worldnews/comments/s963x4/there_wont_be_enough_people_for_mars_elon_musk/htkuiey/
338,htkv4ef,p4ntsl0rd,"The population of the world has doubled since 1973, I would be terrified if the rate of growth hadn't slowed. The world population in 1973 was about 3.9 billion. It seems that in 1900 the population was about 1.65 billion. If the world population was to keep doubling in less than a century I feel like we'd hit trouble pretty soon.

https://en.wikipedia.org/wiki/Estimates_of_historical_world_population

I don't think we want the world population to grow that much more? I imagine as a species we don't want the total population to decrease too much, but the biggest problem is that assholes like Musk don't want to pay a living wage so people can't actually afford to have children.","The population of the world has doubled since 1973, I would be terrified if the rate of growth hadn't slowed. The world population in 1973 was about 3.9 billion. It seems that in 1900 the population was about 1.65 billion. If the world population was to keep doubling in less than a century I feel like we'd hit trouble pretty soon.

https://en.wikipedia.org/wiki/Estimates_of_historical_world_population

I don't think we want the world population to grow that much more? I imagine as a species we don't want the total population to decrease too much, but the biggest problem is that assholes like Musk don't want to pay a living wage so people can't actually afford to have children.",19,2022-01-21 09:34:15,<praw.models.comment_forest.CommentForest object at 0x0000021CD78E6100>,s963x4,worldnews,t5_2qh13,,False,False,t3_s963x4,t3_s963x4,/r/worldnews/comments/s963x4/there_wont_be_enough_people_for_mars_elon_musk/htkv4ef/
339,htkrptx,,Fuck this guy!,Fuck this guy!,72,2022-01-21 08:49:57,<praw.models.comment_forest.CommentForest object at 0x0000021CD78E6AC0>,s963x4,worldnews,t5_2qh13,,False,False,t3_s963x4,t3_s963x4,/r/worldnews/comments/s963x4/there_wont_be_enough_people_for_mars_elon_musk/htkrptx/
340,htkqjzk,FARDCLoyalist_,This dude is a scumbag it’s too bad people worship him,This dude is a scumbag it’s too bad people worship him,71,2022-01-21 08:35:05,<praw.models.comment_forest.CommentForest object at 0x0000021CD78E6E80>,s963x4,worldnews,t5_2qh13,,False,False,t3_s963x4,t3_s963x4,/r/worldnews/comments/s963x4/there_wont_be_enough_people_for_mars_elon_musk/htkqjzk/
341,htkudca,Masschunkahunkafuss,From the same bloke who said machines will take the majority of our jobs.  Dont the machines want to go to Mars?,From the same bloke who said machines will take the majority of our jobs.  Dont the machines want to go to Mars?,13,2022-01-21 09:24:12,<praw.models.comment_forest.CommentForest object at 0x0000021CD78E6F40>,s963x4,worldnews,t5_2qh13,,False,False,t3_s963x4,t3_s963x4,/r/worldnews/comments/s963x4/there_wont_be_enough_people_for_mars_elon_musk/htkudca/
342,htkr4x9,kenbewdy8000,It is all about him and has never been about us. His Mars colony has always been the pointless fantasy of an unrestrained egotist.,It is all about him and has never been about us. His Mars colony has always been the pointless fantasy of an unrestrained egotist.,28,2022-01-21 08:42:32,<praw.models.comment_forest.CommentForest object at 0x0000021CD78DF9A0>,s963x4,worldnews,t5_2qh13,,False,False,t3_s963x4,t3_s963x4,/r/worldnews/comments/s963x4/there_wont_be_enough_people_for_mars_elon_musk/htkr4x9/
343,htkx3ob,Sad_Literature_8657,Elon is going to come up with a plan b for his slave labor.,Elon is going to come up with a plan b for his slave labor.,4,2022-01-21 10:01:00,<praw.models.comment_forest.CommentForest object at 0x0000021CD78DFCA0>,s963x4,worldnews,t5_2qh13,,False,False,t3_s963x4,t3_s963x4,/r/worldnews/comments/s963x4/there_wont_be_enough_people_for_mars_elon_musk/htkx3ob/
344,htltqan,Odd_so_Star_so_Odd,"If you think about which ethnicities birth-rates are still going strong, actually making the world population grow as a result, this quote takes on a whole new meaning..","If you think about which ethnicities birth-rates are still going strong, actually making the world population grow as a result, this quote takes on a whole new meaning..",4,2022-01-21 15:09:10,<praw.models.comment_forest.CommentForest object at 0x0000021CD78DFE20>,s963x4,worldnews,t5_2qh13,,False,False,t3_s963x4,t3_s963x4,/r/worldnews/comments/s963x4/there_wont_be_enough_people_for_mars_elon_musk/htltqan/
345,htkqnm9,funkymunkPDX,Ahhh shucks... How are we going to destroy another planet without cheap and impoverished labor? Let me get my tea cup for them tears,Ahhh shucks... How are we going to destroy another planet without cheap and impoverished labor? Let me get my tea cup for them tears,22,2022-01-21 08:36:22,<praw.models.comment_forest.CommentForest object at 0x0000021CD78DFE80>,s963x4,worldnews,t5_2qh13,,False,False,t3_s963x4,t3_s963x4,/r/worldnews/comments/s963x4/there_wont_be_enough_people_for_mars_elon_musk/htkqnm9/
346,htksv4b,packsackback,We ain't going to mars man!  But we will be coming for you in your bunker...,We ain't going to mars man!  But we will be coming for you in your bunker...,9,2022-01-21 09:04:36,<praw.models.comment_forest.CommentForest object at 0x0000021CD78DFEE0>,s963x4,worldnews,t5_2qh13,,False,False,t3_s963x4,t3_s963x4,/r/worldnews/comments/s963x4/there_wont_be_enough_people_for_mars_elon_musk/htksv4b/
347,htkxqir,,Cunt,Cunt,7,2022-01-21 10:09:37,<praw.models.comment_forest.CommentForest object at 0x0000021CD78DFFA0>,s963x4,worldnews,t5_2qh13,,False,False,t3_s963x4,t3_s963x4,/r/worldnews/comments/s963x4/there_wont_be_enough_people_for_mars_elon_musk/htkxqir/
348,htkxahr,morbihann,How about this cunt keeps his cockholster closed for a while.,How about this cunt keeps his cockholster closed for a while.,3,2022-01-21 10:03:34,<praw.models.comment_forest.CommentForest object at 0x0000021CD78CB160>,s963x4,worldnews,t5_2qh13,,False,False,t3_s963x4,t3_s963x4,/r/worldnews/comments/s963x4/there_wont_be_enough_people_for_mars_elon_musk/htkxahr/
349,htl9gu7,,"r/ABoringDystopia via the Boring Company.

Let's not forget Jeff Bezos said the earth would become a vacation destination... you know, for those who can't afford to live in the Taj Mahal.

Hope you like space mining corridors, because that's where we're headed.","r/ABoringDystopia via the Boring Company.

Let's not forget Jeff Bezos said the earth would become a vacation destination... you know, for those who can't afford to live in the Taj Mahal.

Hope you like space mining corridors, because that's where we're headed.",3,2022-01-21 12:30:18,<praw.models.comment_forest.CommentForest object at 0x0000021CD78CB1C0>,s963x4,worldnews,t5_2qh13,,False,False,t3_s963x4,t3_s963x4,/r/worldnews/comments/s963x4/there_wont_be_enough_people_for_mars_elon_musk/htl9gu7/
350,htkytck,beattles12,"“The multi-millionare has seven children himself.” Fuck off, asshole I can barely afford food.","“The multi-millionare has seven children himself.” Fuck off, asshole I can barely afford food.",7,2022-01-21 10:24:17,<praw.models.comment_forest.CommentForest object at 0x0000021CD78CB220>,s963x4,worldnews,t5_2qh13,,False,False,t3_s963x4,t3_s963x4,/r/worldnews/comments/s963x4/there_wont_be_enough_people_for_mars_elon_musk/htkytck/
351,htktt9d,FrancisDrake97,A population collapse that Is also caused by psycopaths like him,A population collapse that Is also caused by psycopaths like him,6,2022-01-21 09:16:57,<praw.models.comment_forest.CommentForest object at 0x0000021CD78CB280>,s963x4,worldnews,t5_2qh13,,False,False,t3_s963x4,t3_s963x4,/r/worldnews/comments/s963x4/there_wont_be_enough_people_for_mars_elon_musk/htktt9d/
352,htku4sr,,[removed],[removed],4,2022-01-21 09:21:07,<praw.models.comment_forest.CommentForest object at 0x0000021CD78CB2E0>,s963x4,worldnews,t5_2qh13,,False,False,t3_s963x4,t3_s963x4,/r/worldnews/comments/s963x4/there_wont_be_enough_people_for_mars_elon_musk/htku4sr/
353,htkw26g,TheManWhoFightsThe,Red Faction Guerilla energy right here,Red Faction Guerilla energy right here,2,2022-01-21 09:46:53,<praw.models.comment_forest.CommentForest object at 0x0000021CD78CB3A0>,s963x4,worldnews,t5_2qh13,,False,False,t3_s963x4,t3_s963x4,/r/worldnews/comments/s963x4/there_wont_be_enough_people_for_mars_elon_musk/htkw26g/
354,htkxu7f,bikbar1,There would be enough people to populate the whole solar system.,There would be enough people to populate the whole solar system.,2,2022-01-21 10:11:03,<praw.models.comment_forest.CommentForest object at 0x0000021CD78CB4C0>,s963x4,worldnews,t5_2qh13,,False,False,t3_s963x4,t3_s963x4,/r/worldnews/comments/s963x4/there_wont_be_enough_people_for_mars_elon_musk/htkxu7f/
355,htkzpv0,Dreuh2001,Garbage headline misinforms the true story. He was talking about the drop in the birth rate and used Mars as an example,Garbage headline misinforms the true story. He was talking about the drop in the birth rate and used Mars as an example,2,2022-01-21 10:36:21,<praw.models.comment_forest.CommentForest object at 0x0000021CD78CB580>,s963x4,worldnews,t5_2qh13,,False,False,t3_s963x4,t3_s963x4,/r/worldnews/comments/s963x4/there_wont_be_enough_people_for_mars_elon_musk/htkzpv0/
356,htkztia,M-Dubz,Can Elon just fuck off,Can Elon just fuck off,2,2022-01-21 10:37:42,<praw.models.comment_forest.CommentForest object at 0x0000021CD78CB700>,s963x4,worldnews,t5_2qh13,,False,False,t3_s963x4,t3_s963x4,/r/worldnews/comments/s963x4/there_wont_be_enough_people_for_mars_elon_musk/htkztia/
357,htl0kmr,AffectionateHope,Fuck Elon Musk,Fuck Elon Musk,2,2022-01-21 10:47:30,<praw.models.comment_forest.CommentForest object at 0x0000021CD78CB880>,s963x4,worldnews,t5_2qh13,,False,False,t3_s963x4,t3_s963x4,/r/worldnews/comments/s963x4/there_wont_be_enough_people_for_mars_elon_musk/htl0kmr/
358,htl0lrn,k3surfacer,"Last time I checked, we ""the people"" were on earth. We need to restore earth to a healthy state before it gets angry at us and defends itself. 

Earth is our mother. If you want to go to Mars get your workers from aliens.","Last time I checked, we ""the people"" were on earth. We need to restore earth to a healthy state before it gets angry at us and defends itself. 

Earth is our mother. If you want to go to Mars get your workers from aliens.",2,2022-01-21 10:47:55,<praw.models.comment_forest.CommentForest object at 0x0000021CD78CBA00>,s963x4,worldnews,t5_2qh13,,1642793503.0,False,t3_s963x4,t3_s963x4,/r/worldnews/comments/s963x4/there_wont_be_enough_people_for_mars_elon_musk/htl0lrn/
359,htl8ob3,QueenOfQuok,"I'm gonna keep it real with you, billionaire dumbass Elon  Musk, this is not going to help Earth's declining birth rate","I'm gonna keep it real with you, billionaire dumbass Elon  Musk, this is not going to help Earth's declining birth rate",2,2022-01-21 12:22:13,<praw.models.comment_forest.CommentForest object at 0x0000021CD78CBAC0>,s963x4,worldnews,t5_2qh13,,False,False,t3_s963x4,t3_s963x4,/r/worldnews/comments/s963x4/there_wont_be_enough_people_for_mars_elon_musk/htl8ob3/
360,htlabfa,DeanCorso11,"Ah, now he says Mars not ok. Talk about covering his ass. He’s pretty stupid, but just smart enough to know he can’t follow through.","Ah, now he says Mars not ok. Talk about covering his ass. He’s pretty stupid, but just smart enough to know he can’t follow through.",2,2022-01-21 12:38:43,<praw.models.comment_forest.CommentForest object at 0x0000021CD78CBB80>,s963x4,worldnews,t5_2qh13,,False,False,t3_s963x4,t3_s963x4,/r/worldnews/comments/s963x4/there_wont_be_enough_people_for_mars_elon_musk/htlabfa/
361,htlfftf,brianlefevre87,It would be interesting to know how much paternity and maternity leave Tesla offers employees? Maybe that's a place to start?,It would be interesting to know how much paternity and maternity leave Tesla offers employees? Maybe that's a place to start?,2,2022-01-21 13:24:52,<praw.models.comment_forest.CommentForest object at 0x0000021CD78CBC40>,s963x4,worldnews,t5_2qh13,,False,False,t3_s963x4,t3_s963x4,/r/worldnews/comments/s963x4/there_wont_be_enough_people_for_mars_elon_musk/htlfftf/
362,htlj2l1,CasualObserverNine,Is he taking Howard Hughes tonic?,Is he taking Howard Hughes tonic?,2,2022-01-21 13:53:45,<praw.models.comment_forest.CommentForest object at 0x0000021CD78CBCA0>,s963x4,worldnews,t5_2qh13,,False,False,t3_s963x4,t3_s963x4,/r/worldnews/comments/s963x4/there_wont_be_enough_people_for_mars_elon_musk/htlj2l1/
363,htmi9ys,roundearthervaxxer,People are going to hate living on Mars,People are going to hate living on Mars,2,2022-01-21 17:42:17,<praw.models.comment_forest.CommentForest object at 0x0000021CD78CBD00>,s963x4,worldnews,t5_2qh13,,False,False,t3_s963x4,t3_s963x4,/r/worldnews/comments/s963x4/there_wont_be_enough_people_for_mars_elon_musk/htmi9ys/
364,htoth0v,,I think what he’s saying is that his companies are limited to Us regulations and thus is saying western populations aren’t growing enough to compete with certain countries in the same rat race to Mars,I think what he’s saying is that his companies are limited to Us regulations and thus is saying western populations aren’t growing enough to compete with certain countries in the same rat race to Mars,2,2022-01-22 02:32:15,<praw.models.comment_forest.CommentForest object at 0x0000021CD78CBD60>,s963x4,worldnews,t5_2qh13,,False,False,t3_s963x4,t3_s963x4,/r/worldnews/comments/s963x4/there_wont_be_enough_people_for_mars_elon_musk/htoth0v/
365,htpk746,northeastunion,"Friends, Musk is pointing that most developed states will reduce their population by 2100. Some of them by half, such as Spain, Russia, China, Japan","Friends, Musk is pointing that most developed states will reduce their population by 2100. Some of them by half, such as Spain, Russia, China, Japan",2,2022-01-22 06:02:55,<praw.models.comment_forest.CommentForest object at 0x0000021CD78CBDC0>,s963x4,worldnews,t5_2qh13,,False,False,t3_s963x4,t3_s963x4,/r/worldnews/comments/s963x4/there_wont_be_enough_people_for_mars_elon_musk/htpk746/
366,htkwdwg,HexagonStorms,fuck elon musk,fuck elon musk,2,2022-01-21 09:51:14,<praw.models.comment_forest.CommentForest object at 0x0000021CD78CBE20>,s963x4,worldnews,t5_2qh13,,False,False,t3_s963x4,t3_s963x4,/r/worldnews/comments/s963x4/there_wont_be_enough_people_for_mars_elon_musk/htkwdwg/
367,htkwoyl,Abradolf1948,"I mean, I highly expect humanity to collapse before Mars becomes an option, so he's not wrong.","I mean, I highly expect humanity to collapse before Mars becomes an option, so he's not wrong.",2,2022-01-21 09:55:22,<praw.models.comment_forest.CommentForest object at 0x0000021CD78CBE80>,s963x4,worldnews,t5_2qh13,,False,False,t3_s963x4,t3_s963x4,/r/worldnews/comments/s963x4/there_wont_be_enough_people_for_mars_elon_musk/htkwoyl/
368,htkwy35,Special_Tay,"God, I am so f*cking sick of this guy.","God, I am so f*cking sick of this guy.",2,2022-01-21 09:58:52,<praw.models.comment_forest.CommentForest object at 0x0000021CD78CBEE0>,s963x4,worldnews,t5_2qh13,,False,False,t3_s963x4,t3_s963x4,/r/worldnews/comments/s963x4/there_wont_be_enough_people_for_mars_elon_musk/htkwy35/
369,htkve8p,majortvjunkie,"This guy talks to hear himself talk.

*in Bethenny Frankel voice* Go to space!! GO TO SPACE!!!!","This guy talks to hear himself talk.

*in Bethenny Frankel voice* Go to space!! GO TO SPACE!!!!",2,2022-01-21 09:37:53,<praw.models.comment_forest.CommentForest object at 0x0000021CD78CBF40>,s963x4,worldnews,t5_2qh13,,False,False,t3_s963x4,t3_s963x4,/r/worldnews/comments/s963x4/there_wont_be_enough_people_for_mars_elon_musk/htkve8p/
370,htkvp4d,twarr1,Musk keeps proving how ignorant he is yet people still throw $$$ at him and worship him. Mankind is doomed,Musk keeps proving how ignorant he is yet people still throw $$$ at him and worship him. Mankind is doomed,1,2022-01-21 09:42:00,<praw.models.comment_forest.CommentForest object at 0x0000021CD78CBFA0>,s963x4,worldnews,t5_2qh13,,False,False,t3_s963x4,t3_s963x4,/r/worldnews/comments/s963x4/there_wont_be_enough_people_for_mars_elon_musk/htkvp4d/
371,htlcc5z,RadamA,Isnt it that the number of births is within few percent of the largest ever? Tho uneven.,Isnt it that the number of births is within few percent of the largest ever? Tho uneven.,1,2022-01-21 12:57:42,<praw.models.comment_forest.CommentForest object at 0x0000021CD78FE040>,s963x4,worldnews,t5_2qh13,,False,False,t3_s963x4,t3_s963x4,/r/worldnews/comments/s963x4/there_wont_be_enough_people_for_mars_elon_musk/htlcc5z/
372,htkwnwn,Konstapeln1,He means not enough rich people. They are probably the only ones who can leave when everything goes to shit.,He means not enough rich people. They are probably the only ones who can leave when everything goes to shit.,1,2022-01-21 09:54:57,<praw.models.comment_forest.CommentForest object at 0x0000021CD78FE0A0>,s963x4,worldnews,t5_2qh13,,False,False,t3_s963x4,t3_s963x4,/r/worldnews/comments/s963x4/there_wont_be_enough_people_for_mars_elon_musk/htkwnwn/
373,htkwpk6,juggernaut006,This guy loves to hear himself talk.,This guy loves to hear himself talk.,1,2022-01-21 09:55:35,<praw.models.comment_forest.CommentForest object at 0x0000021CD78FE100>,s963x4,worldnews,t5_2qh13,,False,False,t3_s963x4,t3_s963x4,/r/worldnews/comments/s963x4/there_wont_be_enough_people_for_mars_elon_musk/htkwpk6/
374,htlm0x5,RattledSabre,"So lobby your government to redistribute wealth so that more people can realistically afford to reproduce and support children.  


No? Must not be *that* big of a problem then.","So lobby your government to redistribute wealth so that more people can realistically afford to reproduce and support children.  


No? Must not be *that* big of a problem then.",1,2022-01-21 14:15:55,<praw.models.comment_forest.CommentForest object at 0x0000021CD78FE160>,s963x4,worldnews,t5_2qh13,,False,False,t3_s963x4,t3_s963x4,/r/worldnews/comments/s963x4/there_wont_be_enough_people_for_mars_elon_musk/htlm0x5/
375,htkt5qz,,Ah so that's the excuse....,Ah so that's the excuse....,0,2022-01-21 09:08:27,<praw.models.comment_forest.CommentForest object at 0x0000021CD78FE1C0>,s963x4,worldnews,t5_2qh13,,False,False,t3_s963x4,t3_s963x4,/r/worldnews/comments/s963x4/there_wont_be_enough_people_for_mars_elon_musk/htkt5qz/
376,htktg24,SamOfEclia,We don't even know how to make mars earth yet.,We don't even know how to make mars earth yet.,0,2022-01-21 09:12:12,<praw.models.comment_forest.CommentForest object at 0x0000021CD78FE220>,s963x4,worldnews,t5_2qh13,,False,False,t3_s963x4,t3_s963x4,/r/worldnews/comments/s963x4/there_wont_be_enough_people_for_mars_elon_musk/htktg24/
377,htkyprx,xitzengyigglz,Shut the fuck up Peter Isherwell,Shut the fuck up Peter Isherwell,0,2022-01-21 10:22:57,<praw.models.comment_forest.CommentForest object at 0x0000021CD78FE280>,s963x4,worldnews,t5_2qh13,,False,False,t3_s963x4,t3_s963x4,/r/worldnews/comments/s963x4/there_wont_be_enough_people_for_mars_elon_musk/htkyprx/
378,htkwckz,erictricc,Can someone explain to me why our global population has anything to do with colonizing mars?,Can someone explain to me why our global population has anything to do with colonizing mars?,-1,2022-01-21 09:50:44,<praw.models.comment_forest.CommentForest object at 0x0000021CD78FE340>,s963x4,worldnews,t5_2qh13,,False,False,t3_s963x4,t3_s963x4,/r/worldnews/comments/s963x4/there_wont_be_enough_people_for_mars_elon_musk/htkwckz/
379,htkwtbb,HalPrentice,Who gives a fuck?,Who gives a fuck?,-1,2022-01-21 09:57:00,<praw.models.comment_forest.CommentForest object at 0x0000021CD78FE3A0>,s963x4,worldnews,t5_2qh13,,False,False,t3_s963x4,t3_s963x4,/r/worldnews/comments/s963x4/there_wont_be_enough_people_for_mars_elon_musk/htkwtbb/
380,htkwvp8,,Does Elon know about sex?,Does Elon know about sex?,1,2022-01-21 09:57:56,<praw.models.comment_forest.CommentForest object at 0x0000021CD78FE400>,s963x4,worldnews,t5_2qh13,,False,False,t3_s963x4,t3_s963x4,/r/worldnews/comments/s963x4/there_wont_be_enough_people_for_mars_elon_musk/htkwvp8/
381,htkxk1a,IAmJohnny5ive,"Penal colony it is then... Marstralia here we come!

But seriously there's still so much of the Earth's surface and oceans that isn't being used and is perfectly habitable - either Earth has to become more uninhabitable - or the population does have to significantly increase to occupy every liveable bit of land and ocean - in order to make Mars a truly viable destination for anything beyond scientific/exploratory expeditions.","Penal colony it is then... Marstralia here we come!

But seriously there's still so much of the Earth's surface and oceans that isn't being used and is perfectly habitable - either Earth has to become more uninhabitable - or the population does have to significantly increase to occupy every liveable bit of land and ocean - in order to make Mars a truly viable destination for anything beyond scientific/exploratory expeditions.",1,2022-01-21 10:07:09,<praw.models.comment_forest.CommentForest object at 0x0000021CD78FE460>,s963x4,worldnews,t5_2qh13,,False,False,t3_s963x4,t3_s963x4,/r/worldnews/comments/s963x4/there_wont_be_enough_people_for_mars_elon_musk/htkxk1a/
382,htky0vw,amoderate_84,Both sides don’t take into account basic human nature responding to crises related to an imbalance in population growth. We are going to be fine.,Both sides don’t take into account basic human nature responding to crises related to an imbalance in population growth. We are going to be fine.,1,2022-01-21 10:13:38,<praw.models.comment_forest.CommentForest object at 0x0000021CD78FE4C0>,s963x4,worldnews,t5_2qh13,,False,False,t3_s963x4,t3_s963x4,/r/worldnews/comments/s963x4/there_wont_be_enough_people_for_mars_elon_musk/htky0vw/
383,htkz47d,Borikua7,He means not enough billionaires.,He means not enough billionaires.,1,2022-01-21 10:28:25,<praw.models.comment_forest.CommentForest object at 0x0000021CD78FE580>,s963x4,worldnews,t5_2qh13,,False,False,t3_s963x4,t3_s963x4,/r/worldnews/comments/s963x4/there_wont_be_enough_people_for_mars_elon_musk/htkz47d/
384,htl5n1a,,Is it possible to block the word musk from my internet feed,Is it possible to block the word musk from my internet feed,1,2022-01-21 11:49:29,<praw.models.comment_forest.CommentForest object at 0x0000021CD78FE5E0>,s963x4,worldnews,t5_2qh13,,False,False,t3_s963x4,t3_s963x4,/r/worldnews/comments/s963x4/there_wont_be_enough_people_for_mars_elon_musk/htl5n1a/
385,htl5pka,Any_Nail_637,Colonies on Mars is a great idea.  You go outside and you die.  Thanks for coming earth idiots.,Colonies on Mars is a great idea.  You go outside and you die.  Thanks for coming earth idiots.,1,2022-01-21 11:50:15,<praw.models.comment_forest.CommentForest object at 0x0000021CD78FE640>,s963x4,worldnews,t5_2qh13,,False,False,t3_s963x4,t3_s963x4,/r/worldnews/comments/s963x4/there_wont_be_enough_people_for_mars_elon_musk/htl5pka/
386,htl6c2w,ceres20,Elon Musk won’t be needing to go to Mars since Earth is gonna become one in his lifetime…,Elon Musk won’t be needing to go to Mars since Earth is gonna become one in his lifetime…,1,2022-01-21 11:57:14,<praw.models.comment_forest.CommentForest object at 0x0000021CD78FE6A0>,s963x4,worldnews,t5_2qh13,,False,False,t3_s963x4,t3_s963x4,/r/worldnews/comments/s963x4/there_wont_be_enough_people_for_mars_elon_musk/htl6c2w/
387,htlbw36,xvdrk,Mars is saved,Mars is saved,1,2022-01-21 12:53:33,<praw.models.comment_forest.CommentForest object at 0x0000021CD78FE700>,s963x4,worldnews,t5_2qh13,,False,False,t3_s963x4,t3_s963x4,/r/worldnews/comments/s963x4/there_wont_be_enough_people_for_mars_elon_musk/htlbw36/
388,htlc2b3,FiLThYnuTmEgs,Work on earth. Mars doesn’t need a new douchebag,Work on earth. Mars doesn’t need a new douchebag,1,2022-01-21 12:55:09,<praw.models.comment_forest.CommentForest object at 0x0000021CD78FE760>,s963x4,worldnews,t5_2qh13,,False,False,t3_s963x4,t3_s963x4,/r/worldnews/comments/s963x4/there_wont_be_enough_people_for_mars_elon_musk/htlc2b3/
389,htm9hzj,panda4sleep,Womb tanks. Universal Parent Income.,Womb tanks. Universal Parent Income.,1,2022-01-21 16:48:40,<praw.models.comment_forest.CommentForest object at 0x0000021CD78FE7C0>,s963x4,worldnews,t5_2qh13,,False,False,t3_s963x4,t3_s963x4,/r/worldnews/comments/s963x4/there_wont_be_enough_people_for_mars_elon_musk/htm9hzj/
390,htmafvy,,This guy is the worst.,This guy is the worst.,1,2022-01-21 16:54:23,<praw.models.comment_forest.CommentForest object at 0x0000021CD78FE820>,s963x4,worldnews,t5_2qh13,,False,False,t3_s963x4,t3_s963x4,/r/worldnews/comments/s963x4/there_wont_be_enough_people_for_mars_elon_musk/htmafvy/
