,ID,Author,body,Comment,Score,Created On,Replies,Submission,Subreddit,Subreddit_ID,Distinguished,Edited,Is_submitter,link_id,Parent_id,Permalink
0,hvql6ku,AutoModerator,"Users often report submissions from this site and ask us to ban it for sensationalized articles. At /r/worldnews, we oppose blanket banning any news source. Readers have a responsibility to be skeptical, check sources, and comment on any flaws.

You can help improve this thread by linking to media that verifies or questions this article's claims. Your link could help readers better understand this issue. If you do find evidence that this article or its title are false or misleading, contact the moderators who will review it

*I am a bot, and this action was performed automatically. Please [contact the moderators of this subreddit](/message/compose/?to=/r/worldnews) if you have any questions or concerns.*","Users often report submissions from this site and ask us to ban it for sensationalized articles. At /r/worldnews, we oppose blanket banning any news source. Readers have a responsibility to be skeptical, check sources, and comment on any flaws.

You can help improve this thread by linking to media that verifies or questions this article's claims. Your link could help readers better understand this issue. If you do find evidence that this article or its title are false or misleading, contact the moderators who will review it

*I am a bot, and this action was performed automatically. Please [contact the moderators of this subreddit](/message/compose/?to=/r/worldnews) if you have any questions or concerns.*",1,2022-02-05 20:44:11,<praw.models.comment_forest.CommentForest object at 0x0000021CD5AED340>,slg74b,worldnews,t5_2qh13,moderator,False,False,t3_slg74b,t3_slg74b,/r/worldnews/comments/slg74b/ukrainians_will_be_rounded_up_in_internment_camps/hvql6ku/
1,hvr3vim,Extrontale,Just as a side-note: Bild is not allowed to be called a newspaper in Germany because they do not meet the minimum requirement of truthful reporting. This is not a joke.,Just as a side-note: Bild is not allowed to be called a newspaper in Germany because they do not meet the minimum requirement of truthful reporting. This is not a joke.,126,2022-02-05 23:06:45,<praw.models.comment_forest.CommentForest object at 0x0000021CD5AED400>,slg74b,worldnews,t5_2qh13,,False,False,t3_slg74b,t3_slg74b,/r/worldnews/comments/slg74b/ukrainians_will_be_rounded_up_in_internment_camps/hvr3vim/
2,hvqqdcg,funwithtentacles,"For those that don't know the Bild...

The Bild will call the neighbour's cat's pet hamster a 'reliable source' if it gets them clicks...

They aren't exactly... what's the word... 'reliable' themselves.","For those that don't know the Bild...

The Bild will call the neighbour's cat's pet hamster a 'reliable source' if it gets them clicks...

They aren't exactly... what's the word... 'reliable' themselves.",114,2022-02-05 21:25:11,<praw.models.comment_forest.CommentForest object at 0x0000021CD5AED460>,slg74b,worldnews,t5_2qh13,,False,False,t3_slg74b,t3_slg74b,/r/worldnews/comments/slg74b/ukrainians_will_be_rounded_up_in_internment_camps/hvqqdcg/
3,hvqp7w1,alpopa85,"My God, these people are truly sick. Who comes up w these stories?!

Secret service my ass.

Fuck all these warmongers.","My God, these people are truly sick. Who comes up w these stories?!

Secret service my ass.

Fuck all these warmongers.",63,2022-02-05 21:16:07,<praw.models.comment_forest.CommentForest object at 0x0000021CD5AED8E0>,slg74b,worldnews,t5_2qh13,,False,False,t3_slg74b,t3_slg74b,/r/worldnews/comments/slg74b/ukrainians_will_be_rounded_up_in_internment_camps/hvqp7w1/
4,hvqvyva,LightGhillieTTV,Ah the warmongering is strong with this one.,Ah the warmongering is strong with this one.,28,2022-02-05 22:07:37,<praw.models.comment_forest.CommentForest object at 0x0000021CD5AEDBE0>,slg74b,worldnews,t5_2qh13,,False,False,t3_slg74b,t3_slg74b,/r/worldnews/comments/slg74b/ukrainians_will_be_rounded_up_in_internment_camps/hvqvyva/
5,hvqmx34,CptnSeeSharp,What a crock of shit.,What a crock of shit.,29,2022-02-05 20:58:06,<praw.models.comment_forest.CommentForest object at 0x0000021CD5AEDCA0>,slg74b,worldnews,t5_2qh13,,False,False,t3_slg74b,t3_slg74b,/r/worldnews/comments/slg74b/ukrainians_will_be_rounded_up_in_internment_camps/hvqmx34/
6,hvqmjh6,,Fear mongering,Fear mongering,26,2022-02-05 20:55:07,<praw.models.comment_forest.CommentForest object at 0x0000021CD5AEDD00>,slg74b,worldnews,t5_2qh13,,False,False,t3_slg74b,t3_slg74b,/r/worldnews/comments/slg74b/ukrainians_will_be_rounded_up_in_internment_camps/hvqmjh6/
7,hvqlkgb,Jubba911,"Isn't daily mail one of them untrustworthy ""news"" organizations? 

That aside, if true, thats a bad fuckin idea on an international relations level. BUT seeing as how nobody has done anything with all the shit they have pulled so far, it will just be another tuesday I guess...","Isn't daily mail one of them untrustworthy ""news"" organizations? 

That aside, if true, thats a bad fuckin idea on an international relations level. BUT seeing as how nobody has done anything with all the shit they have pulled so far, it will just be another tuesday I guess...",33,2022-02-05 20:47:21,<praw.models.comment_forest.CommentForest object at 0x0000021CD5AEDD60>,slg74b,worldnews,t5_2qh13,,False,False,t3_slg74b,t3_slg74b,/r/worldnews/comments/slg74b/ukrainians_will_be_rounded_up_in_internment_camps/hvqlkgb/
8,hvqoyok,,I'm not sure that makes much sense and I suspect many Russians would be pissed. It's not like Russians and Ukrainians don't share a shit ton of culture and history.,I'm not sure that makes much sense and I suspect many Russians would be pissed. It's not like Russians and Ukrainians don't share a shit ton of culture and history.,22,2022-02-05 21:14:11,<praw.models.comment_forest.CommentForest object at 0x0000021CD5AEDDC0>,slg74b,worldnews,t5_2qh13,,False,False,t3_slg74b,t3_slg74b,/r/worldnews/comments/slg74b/ukrainians_will_be_rounded_up_in_internment_camps/hvqoyok/
9,hvr5a5j,MMBerlin,"*Bild* is a print product, not a newspaper.","*Bild* is a print product, not a newspaper.",9,2022-02-05 23:17:21,<praw.models.comment_forest.CommentForest object at 0x0000021CD5B161C0>,slg74b,worldnews,t5_2qh13,,False,False,t3_slg74b,t3_slg74b,/r/worldnews/comments/slg74b/ukrainians_will_be_rounded_up_in_internment_camps/hvr5a5j/
10,hvr98rq,level89whitemage,This is inflammatory propaganda.,This is inflammatory propaganda.,14,2022-02-05 23:47:00,<praw.models.comment_forest.CommentForest object at 0x0000021CD5B16280>,slg74b,worldnews,t5_2qh13,,False,False,t3_slg74b,t3_slg74b,/r/worldnews/comments/slg74b/ukrainians_will_be_rounded_up_in_internment_camps/hvr98rq/
11,hvre9yo,redditsupportaccount,"What a complete load of horse shit. The Russophobes will make up anything. Fucking ridiculous.

&#x200B;

Reminds me of the bullshit propaganda before the Iraq war, but worse. This bullshit can start WW3","What a complete load of horse shit. The Russophobes will make up anything. Fucking ridiculous.

&#x200B;

Reminds me of the bullshit propaganda before the Iraq war, but worse. This bullshit can start WW3",11,2022-02-06 00:25:20,<praw.models.comment_forest.CommentForest object at 0x0000021CD5B16340>,slg74b,worldnews,t5_2qh13,,False,False,t3_slg74b,t3_slg74b,/r/worldnews/comments/slg74b/ukrainians_will_be_rounded_up_in_internment_camps/hvre9yo/
12,hvsa902,aw_heeell_no,Russia placed a quarter of the Chechen population in “filtration camps”. It wouldn’t surprise me if the Russians apply it here.,Russia placed a quarter of the Chechen population in “filtration camps”. It wouldn’t surprise me if the Russians apply it here.,4,2022-02-06 07:07:48,<praw.models.comment_forest.CommentForest object at 0x0000021CD5B16400>,slg74b,worldnews,t5_2qh13,,False,False,t3_slg74b,t3_slg74b,/r/worldnews/comments/slg74b/ukrainians_will_be_rounded_up_in_internment_camps/hvsa902/
13,hvr9mfz,aaaanoon,"Yeah of you are interested in the Ukraine conflict, try watching RT at the same time as your local news. Interesting to see the dramatically different opinions.","Yeah of you are interested in the Ukraine conflict, try watching RT at the same time as your local news. Interesting to see the dramatically different opinions.",7,2022-02-05 23:49:52,<praw.models.comment_forest.CommentForest object at 0x0000021CD5B164C0>,slg74b,worldnews,t5_2qh13,,False,False,t3_slg74b,t3_slg74b,/r/worldnews/comments/slg74b/ukrainians_will_be_rounded_up_in_internment_camps/hvr9mfz/
14,hvri4j3,T-Lightning,"You would think a subreddit with 27,000,000 subscribers would have rules about posting illegitimate sources. I guess that wouldn’t be good for business.","You would think a subreddit with 27,000,000 subscribers would have rules about posting illegitimate sources. I guess that wouldn’t be good for business.",5,2022-02-06 00:55:07,<praw.models.comment_forest.CommentForest object at 0x0000021CD5B16520>,slg74b,worldnews,t5_2qh13,,False,False,t3_slg74b,t3_slg74b,/r/worldnews/comments/slg74b/ukrainians_will_be_rounded_up_in_internment_camps/hvri4j3/
15,hvv2mh3,Elohimboi,Absolute conjecture and German projection. The nerve of the ex-Nazis to accuse their victims of using Nazi tactics,Absolute conjecture and German projection. The nerve of the ex-Nazis to accuse their victims of using Nazi tactics,3,2022-02-06 21:38:18,<praw.models.comment_forest.CommentForest object at 0x0000021CD5B16580>,slg74b,worldnews,t5_2qh13,,False,False,t3_slg74b,t3_slg74b,/r/worldnews/comments/slg74b/ukrainians_will_be_rounded_up_in_internment_camps/hvv2mh3/
16,hvqlhym,map00p00,Well it's the daily mail so it must be true.,Well it's the daily mail so it must be true.,9,2022-02-05 20:46:45,<praw.models.comment_forest.CommentForest object at 0x0000021CD5B16640>,slg74b,worldnews,t5_2qh13,,False,False,t3_slg74b,t3_slg74b,/r/worldnews/comments/slg74b/ukrainians_will_be_rounded_up_in_internment_camps/hvqlhym/
17,hvqp3i9,redarlsen,"Jesus Christ, more lies.

They sure are working overtime churning out unverified / unverifiable intelligence nonsense in the NATO propaganda factories this week. 

Noone* wants war and it would take no effort to deescalate the situation. all Russia really needs is a *re-commitment*. Stop NATO expansion into ex-SSRs... ie honour the existing agreement.



Edit: (*obviously someone must want conflict else we wouldn’t be seeing ‘em trying so hard to sell it)","Jesus Christ, more lies.

They sure are working overtime churning out unverified / unverifiable intelligence nonsense in the NATO propaganda factories this week. 

Noone* wants war and it would take no effort to deescalate the situation. all Russia really needs is a *re-commitment*. Stop NATO expansion into ex-SSRs... ie honour the existing agreement.



Edit: (*obviously someone must want conflict else we wouldn’t be seeing ‘em trying so hard to sell it)",14,2022-02-05 21:15:13,<praw.models.comment_forest.CommentForest object at 0x0000021CD5B166A0>,slg74b,worldnews,t5_2qh13,,1644100720.0,False,t3_slg74b,t3_slg74b,/r/worldnews/comments/slg74b/ukrainians_will_be_rounded_up_in_internment_camps/hvqp3i9/
18,hvqlcp4,Miamiara,[https://www.bild.de/wa/ll/bild-de/unangemeldet-42925516.bild.html](https://www.bild.de/wa/ll/bild-de/unangemeldet-42925516.bild.html) \- article from Bild in German,[https://www.bild.de/wa/ll/bild-de/unangemeldet-42925516.bild.html](https://www.bild.de/wa/ll/bild-de/unangemeldet-42925516.bild.html) \- article from Bild in German,4,2022-02-05 20:45:33,<praw.models.comment_forest.CommentForest object at 0x0000021CD5B16760>,slg74b,worldnews,t5_2qh13,,False,True,t3_slg74b,t3_slg74b,/r/worldnews/comments/slg74b/ukrainians_will_be_rounded_up_in_internment_camps/hvqlcp4/
19,hvwvr6p,Ok-Abbreviations9272,"I've heard these kind of statements before, coming out of the mouths of friends of mine who were associated with the Tea Party in the past...

I don't think Putin is that dumb since he's trying to get other Nations of the world to accept that, ""Russian Government Matters!"" Please love us, we've changed!!!

No, I'm more inclined to believe this is something out of the CIA playbook and/or from NATO intelligence networks!!? 👁️🧐","I've heard these kind of statements before, coming out of the mouths of friends of mine who were associated with the Tea Party in the past...

I don't think Putin is that dumb since he's trying to get other Nations of the world to accept that, ""Russian Government Matters!"" Please love us, we've changed!!!

No, I'm more inclined to believe this is something out of the CIA playbook and/or from NATO intelligence networks!!? 👁️🧐",2,2022-02-07 06:07:13,<praw.models.comment_forest.CommentForest object at 0x0000021CD5B16A00>,slg74b,worldnews,t5_2qh13,,False,False,t3_slg74b,t3_slg74b,/r/worldnews/comments/slg74b/ukrainians_will_be_rounded_up_in_internment_camps/hvwvr6p/
20,hvrqphs,Specific-Secret769,How the hell is the West getting this info? It’s so particular.,How the hell is the West getting this info? It’s so particular.,4,2022-02-06 02:01:37,<praw.models.comment_forest.CommentForest object at 0x0000021CD5B16B80>,slg74b,worldnews,t5_2qh13,,False,False,t3_slg74b,t3_slg74b,/r/worldnews/comments/slg74b/ukrainians_will_be_rounded_up_in_internment_camps/hvrqphs/
21,hvswiby,koassde,"Bild is a mouthpiece of the CIA, you shouldn't believe a single word they're writing no matter what.","Bild is a mouthpiece of the CIA, you shouldn't believe a single word they're writing no matter what.",4,2022-02-06 12:01:05,<praw.models.comment_forest.CommentForest object at 0x0000021CD5B16C40>,slg74b,worldnews,t5_2qh13,,False,False,t3_slg74b,t3_slg74b,/r/worldnews/comments/slg74b/ukrainians_will_be_rounded_up_in_internment_camps/hvswiby/
22,hvtjje9,theclient2021,Maybe that’s why Putin and Pooh Bear recently held talks. To discuss intermittent camp strategy?,Maybe that’s why Putin and Pooh Bear recently held talks. To discuss intermittent camp strategy?,2,2022-02-06 15:29:16,<praw.models.comment_forest.CommentForest object at 0x0000021CD5B16DC0>,slg74b,worldnews,t5_2qh13,,False,False,t3_slg74b,t3_slg74b,/r/worldnews/comments/slg74b/ukrainians_will_be_rounded_up_in_internment_camps/hvtjje9/
23,hvsu6ci,TigerOnVacation,"If the west keep throwing everything at the wall, something is bound to stick.","If the west keep throwing everything at the wall, something is bound to stick.",2,2022-02-06 11:30:42,<praw.models.comment_forest.CommentForest object at 0x0000021CD5B16E80>,slg74b,worldnews,t5_2qh13,,False,False,t3_slg74b,t3_slg74b,/r/worldnews/comments/slg74b/ukrainians_will_be_rounded_up_in_internment_camps/hvsu6ci/
24,hvriago,VhenRa,"Honestly? 

While the sourcing is stupid and implication is even more stupid... there might legitimately be a plan like this for an invasion. As part of the contingency planning for ""Large scale insurgency ensues"". 

A key part of support for an insurgency is the civilian population supporting insurgents with things like food and shelter. 

There is a solution to that if you feel like being an arsehole. Pull a 2nd Boer War and break out the concentration camps. No civilian population to hide in makes hunting down insurgents so much easier.","Honestly? 

While the sourcing is stupid and implication is even more stupid... there might legitimately be a plan like this for an invasion. As part of the contingency planning for ""Large scale insurgency ensues"". 

A key part of support for an insurgency is the civilian population supporting insurgents with things like food and shelter. 

There is a solution to that if you feel like being an arsehole. Pull a 2nd Boer War and break out the concentration camps. No civilian population to hide in makes hunting down insurgents so much easier.",1,2022-02-06 00:56:27,<praw.models.comment_forest.CommentForest object at 0x0000021CD5B16EE0>,slg74b,worldnews,t5_2qh13,,False,False,t3_slg74b,t3_slg74b,/r/worldnews/comments/slg74b/ukrainians_will_be_rounded_up_in_internment_camps/hvriago/
25,hvs3jp0,Federal_Promotion_44,"Just another instigative thread. Jeez.  It’s like the human race wants to kill themselves.   Oh wait, we do.  Until the meaning of money and power changes we are all doomed.","Just another instigative thread. Jeez.  It’s like the human race wants to kill themselves.   Oh wait, we do.  Until the meaning of money and power changes we are all doomed.",-1,2022-02-06 04:52:49,<praw.models.comment_forest.CommentForest object at 0x0000021CD5B16FA0>,slg74b,worldnews,t5_2qh13,,False,False,t3_slg74b,t3_slg74b,/r/worldnews/comments/slg74b/ukrainians_will_be_rounded_up_in_internment_camps/hvs3jp0/
26,hvqod10,MrsMacio,"Today one of Germany's new portal published an article stating that Ukraine is divided internally and just 33% of them expressed their will to defend the country. That Poroshenko's decision from 2018 to eradicate russian language from Ukraine stung deeply over half of Ukrainians who then voted for Zelensky in hope that he would ease that decree. 

It is also said that Tucker Carlson claims that no Americans want to fight for Ukraine nor send their troops there. 

There is also an interesting article about Ukraine : 
https://foreignpolicy.com/2022/01/21/weapons-ukraine-russia-invasion-military/

as well as several regarding why Ukrainians actually do not like Americans and view them as ""curators"" rather than allies (try to google "" American curators leave Ukraine"" and check yourself).","Today one of Germany's new portal published an article stating that Ukraine is divided internally and just 33% of them expressed their will to defend the country. That Poroshenko's decision from 2018 to eradicate russian language from Ukraine stung deeply over half of Ukrainians who then voted for Zelensky in hope that he would ease that decree. 

It is also said that Tucker Carlson claims that no Americans want to fight for Ukraine nor send their troops there. 

There is also an interesting article about Ukraine : 
https://foreignpolicy.com/2022/01/21/weapons-ukraine-russia-invasion-military/

as well as several regarding why Ukrainians actually do not like Americans and view them as ""curators"" rather than allies (try to google "" American curators leave Ukraine"" and check yourself).",-5,2022-02-05 21:09:28,<praw.models.comment_forest.CommentForest object at 0x0000021CD5AE2040>,slg74b,worldnews,t5_2qh13,,False,False,t3_slg74b,t3_slg74b,/r/worldnews/comments/slg74b/ukrainians_will_be_rounded_up_in_internment_camps/hvqod10/
27,hvs3j3o,Federal_Promotion_44,"Just another instigative thread. Jeez.  It’s like the human race wants to kill themselves.   Oh wait, we do.  Until the meaning of money and power changes we are all doomed.","Just another instigative thread. Jeez.  It’s like the human race wants to kill themselves.   Oh wait, we do.  Until the meaning of money and power changes we are all doomed.",-1,2022-02-06 04:50:59,<praw.models.comment_forest.CommentForest object at 0x0000021CD5AE20A0>,slg74b,worldnews,t5_2qh13,,False,False,t3_slg74b,t3_slg74b,/r/worldnews/comments/slg74b/ukrainians_will_be_rounded_up_in_internment_camps/hvs3j3o/
28,hvs3jjq,Federal_Promotion_44,"Just another instigative thread. Jeez.  It’s like the human race wants to kill themselves.   Oh wait, we do.  Until the meaning of money and power changes we are all doomed.","Just another instigative thread. Jeez.  It’s like the human race wants to kill themselves.   Oh wait, we do.  Until the meaning of money and power changes we are all doomed.",-1,2022-02-06 04:52:19,<praw.models.comment_forest.CommentForest object at 0x0000021CD5AE2400>,slg74b,worldnews,t5_2qh13,,False,False,t3_slg74b,t3_slg74b,/r/worldnews/comments/slg74b/ukrainians_will_be_rounded_up_in_internment_camps/hvs3jjq/
29,hvrnhqy,happygloaming,"🎶The moon is high up on the mountain 

Lunatics taken over the asylum 

Waiting on the rapture🎶


🎶 You made a pigs ear, you made a mistake 

Paid off security got through the gate

You got away with it, but we lie in wait, eh, eh, eh......🎶","🎶The moon is high up on the mountain 

Lunatics taken over the asylum 

Waiting on the rapture🎶


🎶 You made a pigs ear, you made a mistake 

Paid off security got through the gate

You got away with it, but we lie in wait, eh, eh, eh......🎶",0,2022-02-06 01:37:10,<praw.models.comment_forest.CommentForest object at 0x0000021CD5AE2460>,slg74b,worldnews,t5_2qh13,,1644113679.0,False,t3_slg74b,t3_slg74b,/r/worldnews/comments/slg74b/ukrainians_will_be_rounded_up_in_internment_camps/hvrnhqy/
30,hwkpff2,Madjokey,Stop with this American nonsense stop looking for wars!! Non stop !! Would you like Russia to come defying you and taking Porto Rico from you... (For the greater good or some other BS backed by No1 BShitters!),Stop with this American nonsense stop looking for wars!! Non stop !! Would you like Russia to come defying you and taking Porto Rico from you... (For the greater good or some other BS backed by No1 BShitters!),0,2022-02-11 23:39:47,<praw.models.comment_forest.CommentForest object at 0x0000021CD5AE2550>,slg74b,worldnews,t5_2qh13,,False,False,t3_slg74b,t3_slg74b,/r/worldnews/comments/slg74b/ukrainians_will_be_rounded_up_in_internment_camps/hwkpff2/
31,hvqn3u5,BombSolver,The world won’t stand for that happening to white people,The world won’t stand for that happening to white people,-9,2022-02-05 20:59:37,<praw.models.comment_forest.CommentForest object at 0x0000021CD5AE2640>,slg74b,worldnews,t5_2qh13,,False,False,t3_slg74b,t3_slg74b,/r/worldnews/comments/slg74b/ukrainians_will_be_rounded_up_in_internment_camps/hvqn3u5/
32,hvr4x0t,Miamiara,"TIL that there are such requirements. Smart, actually, I'd like this law for my country.","TIL that there are such requirements. Smart, actually, I'd like this law for my country.",17,2022-02-05 23:14:35,<praw.models.comment_forest.CommentForest object at 0x0000021CD5AED4C0>,slg74b,worldnews,t5_2qh13,,False,True,t3_slg74b,t1_hvr3vim,/r/worldnews/comments/slg74b/ukrainians_will_be_rounded_up_in_internment_camps/hvr4x0t/
33,hvte0pi,MisterMysterios,"It is true that you shouldn't touch them with a 5m pole. That said, they do have some good contacts in government circles, giving them often the edge in reporting some quite big political scoops. It is still a shit paper, but it is also not right to dismiss everything they publish right away.","It is true that you shouldn't touch them with a 5m pole. That said, they do have some good contacts in government circles, giving them often the edge in reporting some quite big political scoops. It is still a shit paper, but it is also not right to dismiss everything they publish right away.",2,2022-02-06 14:47:53,<praw.models.comment_forest.CommentForest object at 0x0000021CD5AED520>,slg74b,worldnews,t5_2qh13,,False,False,t3_slg74b,t1_hvr3vim,/r/worldnews/comments/slg74b/ukrainians_will_be_rounded_up_in_internment_camps/hvte0pi/
34,hvr7q90,metrotorch,What happens if you break this rule.,What happens if you break this rule.,2,2022-02-05 23:35:37,<praw.models.comment_forest.CommentForest object at 0x0000021CD5AED700>,slg74b,worldnews,t5_2qh13,,False,False,t3_slg74b,t1_hvr3vim,/r/worldnews/comments/slg74b/ukrainians_will_be_rounded_up_in_internment_camps/hvr7q90/
35,hvrm09e,Edredunited,"And that also goes for the Daily mail here, if its the truth they won't print it.","And that also goes for the Daily mail here, if its the truth they won't print it.",19,2022-02-06 01:25:37,<praw.models.comment_forest.CommentForest object at 0x0000021CD5AEDAC0>,slg74b,worldnews,t5_2qh13,,False,False,t3_slg74b,t1_hvqqdcg,/r/worldnews/comments/slg74b/ukrainians_will_be_rounded_up_in_internment_camps/hvrm09e/
36,hvsv69z,healthydoseofsarcasm,So you are saying I can't trust Sir Fluffybutt The Third?,So you are saying I can't trust Sir Fluffybutt The Third?,5,2022-02-06 11:43:50,<praw.models.comment_forest.CommentForest object at 0x0000021CD5AEDB20>,slg74b,worldnews,t5_2qh13,,False,False,t3_slg74b,t1_hvqqdcg,/r/worldnews/comments/slg74b/ukrainians_will_be_rounded_up_in_internment_camps/hvsv69z/
37,hvup3o6,Ilunamie,"An interesting fact: an impressive share of BILD readers are Neo-Nazis and fascist, unsurprisingly but still impressive","An interesting fact: an impressive share of BILD readers are Neo-Nazis and fascist, unsurprisingly but still impressive",1,2022-02-06 20:07:06,<praw.models.comment_forest.CommentForest object at 0x0000021CD5AEDB80>,slg74b,worldnews,t5_2qh13,,False,False,t3_slg74b,t1_hvqqdcg,/r/worldnews/comments/slg74b/ukrainians_will_be_rounded_up_in_internment_camps/hvup3o6/
38,hvsteyb,Canbulibu,Daily Mail quoting Bild. That's like Bolsonaro quoting Trump. You can safely assume that the opposite of what it says is the truth.,Daily Mail quoting Bild. That's like Bolsonaro quoting Trump. You can safely assume that the opposite of what it says is the truth.,8,2022-02-06 11:20:37,<praw.models.comment_forest.CommentForest object at 0x0000021CD5AEDE20>,slg74b,worldnews,t5_2qh13,,False,False,t3_slg74b,t1_hvqlkgb,/r/worldnews/comments/slg74b/ukrainians_will_be_rounded_up_in_internment_camps/hvsteyb/
39,hvqlvi5,Miamiara,"Well, the actual news is from Bild, but it is in German. Maybe you know if they are more trustworthy than DailyMail.","Well, the actual news is from Bild, but it is in German. Maybe you know if they are more trustworthy than DailyMail.",12,2022-02-05 20:49:50,<praw.models.comment_forest.CommentForest object at 0x0000021CD5AEDE80>,slg74b,worldnews,t5_2qh13,,1644094450.0,True,t3_slg74b,t1_hvqlkgb,/r/worldnews/comments/slg74b/ukrainians_will_be_rounded_up_in_internment_camps/hvqlvi5/
40,hvqm620,radiantwave,"Upvote for ""just another Tuesday"" reference.","Upvote for ""just another Tuesday"" reference.",2,2022-02-05 20:52:10,<praw.models.comment_forest.CommentForest object at 0x0000021CD5AEDEE0>,slg74b,worldnews,t5_2qh13,,False,False,t3_slg74b,t1_hvqlkgb,/r/worldnews/comments/slg74b/ukrainians_will_be_rounded_up_in_internment_camps/hvqm620/
