,ID,Author,body,Comment,Score,Created On,Replies,Submission,Subreddit,Subreddit_ID,Distinguished,Edited,Is_submitter,link_id,Parent_id,Permalink
211,hkzcjwk,Reonlive420,I like when it goes down before my weekly buy. And it feels good to see it go up too. Either way keep buying,I like when it goes down before my weekly buy. And it feels good to see it go up too. Either way keep buying,2,2021-11-17 12:48:07,<praw.models.comment_forest.CommentForest object at 0x000001BA59B0B340>,qvpayn,Bitcoin,t5_2s3qj,,False,False,t3_qvpayn,t1_hkymbgi,/r/Bitcoin/comments/qvpayn/i_still_believe_that_btc_can_reach_100000/hkzcjwk/
212,hkyi5zz,FatherD0ng,17k is my belief,17k is my belief,0,2021-11-17 06:22:27,<praw.models.comment_forest.CommentForest object at 0x000001BA59B0B4C0>,qvpayn,Bitcoin,t5_2s3qj,,False,False,t3_qvpayn,t1_hkyf1xk,/r/Bitcoin/comments/qvpayn/i_still_believe_that_btc_can_reach_100000/hkyi5zz/
213,hky08vr,zhengsuna,"So we should have fun in time, LOL, because the future is always unknown, everything can happen","So we should have fun in time, LOL, because the future is always unknown, everything can happen",0,2021-11-17 03:35:35,<praw.models.comment_forest.CommentForest object at 0x000001BA59B0B1C0>,qvpayn,Bitcoin,t5_2s3qj,,False,True,t3_qvpayn,t1_hkxywms,/r/Bitcoin/comments/qvpayn/i_still_believe_that_btc_can_reach_100000/hky08vr/
214,hkywt2m,Jout92,"Fiat is currently how we measure buying power.
Of course a true Bitcoiner is thinking in SATs already

We could also say that USD lost [98.76% of its buying power](https://www.pricedinbitcoin21.com/) compared to Bitcoin, but most people don't fully understand what this means.

Of course we could say that 1 Bitcoin will soon be enough to buy a small flat or an entire house or we could measure how many cows and horses you can buy with one Bitcoin, but it all can be translated to graspable Fiat value for now. It's a dumb and pathetic attempt of ""GOTCHA!"" nocoiners attempt as if this means anything at all. As more people enter Bitcoin more and more people will start to measure in SATs, especially when rampant inflation continues and the meaning of Fiat vanishes even for normies","Fiat is currently how we measure buying power.
Of course a true Bitcoiner is thinking in SATs already

We could also say that USD lost [98.76% of its buying power](https://www.pricedinbitcoin21.com/) compared to Bitcoin, but most people don't fully understand what this means.

Of course we could say that 1 Bitcoin will soon be enough to buy a small flat or an entire house or we could measure how many cows and horses you can buy with one Bitcoin, but it all can be translated to graspable Fiat value for now. It's a dumb and pathetic attempt of ""GOTCHA!"" nocoiners attempt as if this means anything at all. As more people enter Bitcoin more and more people will start to measure in SATs, especially when rampant inflation continues and the meaning of Fiat vanishes even for normies",2,2021-11-17 09:33:11,<praw.models.comment_forest.CommentForest object at 0x000001BA59B0B640>,qvpayn,Bitcoin,t5_2s3qj,,False,False,t3_qvpayn,t1_hkyvbaf,/r/Bitcoin/comments/qvpayn/i_still_believe_that_btc_can_reach_100000/hkywt2m/
215,hky9e96,dirtsmurf,double top bear cope,double top bear cope,4,2021-11-17 04:53:38,<praw.models.comment_forest.CommentForest object at 0x000001BA59B0B8B0>,qvpayn,Bitcoin,t5_2s3qj,,False,False,t3_qvpayn,t1_hky23bo,/r/Bitcoin/comments/qvpayn/i_still_believe_that_btc_can_reach_100000/hky9e96/
216,hky2ext,zhengsuna,I just saw someone talking about shorting the Bitcoin market LOL through Defi. What do you think? Because I know Defi is a pretty good project and I am also working on it. But I don't mind shorting the Bitcoin market. Because I used to lose a lot of leverage,I just saw someone talking about shorting the Bitcoin market LOL through Defi. What do you think? Because I know Defi is a pretty good project and I am also working on it. But I don't mind shorting the Bitcoin market. Because I used to lose a lot of leverage,-3,2021-11-17 03:53:03,<praw.models.comment_forest.CommentForest object at 0x000001BA59B0B880>,qvpayn,Bitcoin,t5_2s3qj,,False,True,t3_qvpayn,t1_hky23bo,/r/Bitcoin/comments/qvpayn/i_still_believe_that_btc_can_reach_100000/hky2ext/
217,hky4m9t,bobbytabl3s,Thanks for your very valuable input but I'll stick to what my crystal ball is predicting.,Thanks for your very valuable input but I'll stick to what my crystal ball is predicting.,1,2021-11-17 04:11:11,<praw.models.comment_forest.CommentForest object at 0x000001BA59B0BAC0>,qvpayn,Bitcoin,t5_2s3qj,,False,False,t3_qvpayn,t1_hky23bo,/r/Bitcoin/comments/qvpayn/i_still_believe_that_btc_can_reach_100000/hky4m9t/
218,hkyj9i6,,Holy fuck this parent comment and all the ones under it seem like a total scam/bot.,Holy fuck this parent comment and all the ones under it seem like a total scam/bot.,2,2021-11-17 06:34:52,<praw.models.comment_forest.CommentForest object at 0x000001BA59B0BAF0>,qvpayn,Bitcoin,t5_2s3qj,,False,False,t3_qvpayn,t1_hkyfo3n,/r/Bitcoin/comments/qvpayn/i_still_believe_that_btc_can_reach_100000/hkyj9i6/
219,hkyg9dc,,[removed],[removed],0,2021-11-17 06:01:39,<praw.models.comment_forest.CommentForest object at 0x000001BA59B0BC10>,qvpayn,Bitcoin,t5_2s3qj,,False,False,t3_qvpayn,t1_hkyfo3n,/r/Bitcoin/comments/qvpayn/i_still_believe_that_btc_can_reach_100000/hkyg9dc/
220,hl0eczt,zhengsuna,"Yes, I think your analysis is very good. Those who don’t have investment will say all kinds of things there. They think that these people who dream of 100 years and think that tomorrow will be okay are all watching the excitement. They don’t know how to invest in bits. Why is the currency. I just know that there are aimless nonsense. In fact, I think real investors have different goals. Some are because they believe in the future of BTC, and some are for violence. Only those who watch the excitement will say some nonsense","Yes, I think your analysis is very good. Those who don’t have investment will say all kinds of things there. They think that these people who dream of 100 years and think that tomorrow will be okay are all watching the excitement. They don’t know how to invest in bits. Why is the currency. I just know that there are aimless nonsense. In fact, I think real investors have different goals. Some are because they believe in the future of BTC, and some are for violence. Only those who watch the excitement will say some nonsense",0,2021-11-17 17:26:12,<praw.models.comment_forest.CommentForest object at 0x000001BA59B0B760>,qvpayn,Bitcoin,t5_2s3qj,,False,True,t3_qvpayn,t1_hkymvt7,/r/Bitcoin/comments/qvpayn/i_still_believe_that_btc_can_reach_100000/hl0eczt/
221,hl18ixq,charlieecho,Prove it,Prove it,1,2021-11-17 20:44:13,<praw.models.comment_forest.CommentForest object at 0x000001BA59B0BC40>,qvpayn,Bitcoin,t5_2s3qj,,False,False,t3_qvpayn,t1_hkzcywf,/r/Bitcoin/comments/qvpayn/i_still_believe_that_btc_can_reach_100000/hl18ixq/
222,hky2sos,zhengsuna,"Maybe, but many investors who invest in BTC are long-term holdings, and rarely do they do short-term holdings. I choose to hold it for a long time. Because I have used leverage before and suffered a loss, I choose to hold it for a long time. There are still people who want to use Defi to short BTC. I think Defi is a good project and I am also investing. But I have a bad impression of being short and long, and I don’t like leverage","Maybe, but many investors who invest in BTC are long-term holdings, and rarely do they do short-term holdings. I choose to hold it for a long time. Because I have used leverage before and suffered a loss, I choose to hold it for a long time. There are still people who want to use Defi to short BTC. I think Defi is a good project and I am also investing. But I have a bad impression of being short and long, and I don’t like leverage",0,2021-11-17 03:56:11,<praw.models.comment_forest.CommentForest object at 0x000001BA59B0BDC0>,qvpayn,Bitcoin,t5_2s3qj,,False,True,t3_qvpayn,t1_hky29ap,/r/Bitcoin/comments/qvpayn/i_still_believe_that_btc_can_reach_100000/hky2sos/
223,hkyukae,Mr_Clumsy,Every dip and it’s like it’s the first time. How fucking stupid are these people?,Every dip and it’s like it’s the first time. How fucking stupid are these people?,20,2021-11-17 09:01:46,<praw.models.comment_forest.CommentForest object at 0x000001BA5D2FBAC0>,qvpayn,Bitcoin,t5_2s3qj,,False,False,t3_qvpayn,t1_hkygkfj,/r/Bitcoin/comments/qvpayn/i_still_believe_that_btc_can_reach_100000/hkyukae/
224,hkyrl29,heavywallet,"I’m guessing bc a lot of posts lack substance, just mindless repetition and speculation.","I’m guessing bc a lot of posts lack substance, just mindless repetition and speculation.",9,2021-11-17 08:19:58,<praw.models.comment_forest.CommentForest object at 0x000001BA5D2FBD60>,qvpayn,Bitcoin,t5_2s3qj,,False,False,t3_qvpayn,t1_hkylfi0,/r/Bitcoin/comments/qvpayn/i_still_believe_that_btc_can_reach_100000/hkyrl29/
225,hkz7ze8,Fotznbenutzernaml,Tell me you have no idea how bitcoin works,Tell me you have no idea how bitcoin works,10,2021-11-17 12:00:51,<praw.models.comment_forest.CommentForest object at 0x000001BA5D2FBF40>,qvpayn,Bitcoin,t5_2s3qj,,False,False,t3_qvpayn,t1_hkypree,/r/Bitcoin/comments/qvpayn/i_still_believe_that_btc_can_reach_100000/hkz7ze8/
226,hkzpki8,,Haha no problem. Don't get any and leave it alone then. No one cares about your doubts either.... Which are also based on zero logic.,Haha no problem. Don't get any and leave it alone then. No one cares about your doubts either.... Which are also based on zero logic.,5,2021-11-17 14:38:25,<praw.models.comment_forest.CommentForest object at 0x000001BA5D2FBFA0>,qvpayn,Bitcoin,t5_2s3qj,,False,False,t3_qvpayn,t1_hkypree,/r/Bitcoin/comments/qvpayn/i_still_believe_that_btc_can_reach_100000/hkzpki8/
227,hkyus3x,Mr_Clumsy,Wow.,Wow.,5,2021-11-17 09:04:45,<praw.models.comment_forest.CommentForest object at 0x000001BA5A00F040>,qvpayn,Bitcoin,t5_2s3qj,,False,False,t3_qvpayn,t1_hkypree,/r/Bitcoin/comments/qvpayn/i_still_believe_that_btc_can_reach_100000/hkyus3x/
228,hkyavzm,bearCatBird,Are you suggesting the world will be balls deep in bitcoin?,Are you suggesting the world will be balls deep in bitcoin?,8,2021-11-17 05:07:42,<praw.models.comment_forest.CommentForest object at 0x000001BA5A00F160>,qvpayn,Bitcoin,t5_2s3qj,,False,False,t3_qvpayn,t1_hkxwuwx,/r/Bitcoin/comments/qvpayn/i_still_believe_that_btc_can_reach_100000/hkyavzm/
229,hkxz1ni,zhengsuna,"But I think this is not the case. After being supervised in the future, more people will know that there may be limited growth at that time.","But I think this is not the case. After being supervised in the future, more people will know that there may be limited growth at that time.",-7,2021-11-17 03:26:14,<praw.models.comment_forest.CommentForest object at 0x000001BA5A00F1C0>,qvpayn,Bitcoin,t5_2s3qj,,False,True,t3_qvpayn,t1_hkxwuwx,/r/Bitcoin/comments/qvpayn/i_still_believe_that_btc_can_reach_100000/hkxz1ni/
230,hky1d7v,zhengsuna,"What I said was that when BTC fell more severely, my heart no longer cared about BTC because I always insisted on holding it for a long time.","What I said was that when BTC fell more severely, my heart no longer cared about BTC because I always insisted on holding it for a long time.",-1,2021-11-17 03:44:28,<praw.models.comment_forest.CommentForest object at 0x000001BA5A00F580>,qvpayn,Bitcoin,t5_2s3qj,,False,True,t3_qvpayn,t1_hkxz87r,/r/Bitcoin/comments/qvpayn/i_still_believe_that_btc_can_reach_100000/hky1d7v/
231,hky5ck2,ualdayan,"That poster is Michael Saylor.  He always loves talking like that.  Energy vortex there, golden cyberhornets here, etc.  I’m Jack Dorsey so I don’t get into that crazy stuff - I know Bitcoin will bring world peace, sure, but you’ll hear none of that weird talk of ‘energy pools’ or ‘encrypted cyberswarms’ with me.","That poster is Michael Saylor.  He always loves talking like that.  Energy vortex there, golden cyberhornets here, etc.  I’m Jack Dorsey so I don’t get into that crazy stuff - I know Bitcoin will bring world peace, sure, but you’ll hear none of that weird talk of ‘energy pools’ or ‘encrypted cyberswarms’ with me.",2,2021-11-17 04:17:23,<praw.models.comment_forest.CommentForest object at 0x000001BA5A00F640>,qvpayn,Bitcoin,t5_2s3qj,,False,False,t3_qvpayn,t1_hky3svr,/r/Bitcoin/comments/qvpayn/i_still_believe_that_btc_can_reach_100000/hky5ck2/
232,hkxw2nq,TheOpeningBell,Why stop there?,Why stop there?,13,2021-11-17 03:03:20,<praw.models.comment_forest.CommentForest object at 0x000001BA5A00F7C0>,qvpayn,Bitcoin,t5_2s3qj,,False,False,t3_qvpayn,t1_hkxvwxk,/r/Bitcoin/comments/qvpayn/i_still_believe_that_btc_can_reach_100000/hkxw2nq/
233,hl54ce9,BashCo,So that more people can see my instruction to use the Daily Discussion threads for this sort of thing.,So that more people can see my instruction to use the Daily Discussion threads for this sort of thing.,1,2021-11-18 17:10:21,<praw.models.comment_forest.CommentForest object at 0x000001BA5A00FA00>,qvpayn,Bitcoin,t5_2s3qj,moderator,False,False,t3_qvpayn,t1_hl03wvp,/r/Bitcoin/comments/qvpayn/i_still_believe_that_btc_can_reach_100000/hl54ce9/
234,hkz0owk,SamirSisaken,How is it not fungible? It doesn't matter to me if I buy a bitcoin which bitcoin I get right?,How is it not fungible? It doesn't matter to me if I buy a bitcoin which bitcoin I get right?,3,2021-11-17 10:28:19,<praw.models.comment_forest.CommentForest object at 0x000001BA5A00FE80>,qvpayn,Bitcoin,t5_2s3qj,,False,False,t3_qvpayn,t1_hkyoegr,/r/Bitcoin/comments/qvpayn/i_still_believe_that_btc_can_reach_100000/hkz0owk/
235,hky9l6r,xrm550,"Yea.... 16.

Where ya been?","Yea.... 16.

Where ya been?",1,2021-11-17 04:55:28,<praw.models.comment_forest.CommentForest object at 0x000001BA59B0B310>,qvpayn,Bitcoin,t5_2s3qj,,False,False,t3_qvpayn,t1_hky9h6y,/r/Bitcoin/comments/qvpayn/i_still_believe_that_btc_can_reach_100000/hky9l6r/
236,hkzgeog,cedarrapidsiaus,DCA all the way!,DCA all the way!,2,2021-11-17 13:24:25,<praw.models.comment_forest.CommentForest object at 0x000001BA59B0B0D0>,qvpayn,Bitcoin,t5_2s3qj,,False,False,t3_qvpayn,t1_hkzcjwk,/r/Bitcoin/comments/qvpayn/i_still_believe_that_btc_can_reach_100000/hkzgeog/
237,hkyl84p,RevolutionarySecond4,I’m hoping under 50k,I’m hoping under 50k,1,2021-11-17 06:57:48,<praw.models.comment_forest.CommentForest object at 0x000001BA59B0B430>,qvpayn,Bitcoin,t5_2s3qj,,False,False,t3_qvpayn,t1_hkyi5zz,/r/Bitcoin/comments/qvpayn/i_still_believe_that_btc_can_reach_100000/hkyl84p/
238,hky9tlr,savvyage,"On a long enough timeline, everything does happen","On a long enough timeline, everything does happen",2,2021-11-17 04:57:41,<praw.models.comment_forest.CommentForest object at 0x000001BA59B0B700>,qvpayn,Bitcoin,t5_2s3qj,,False,False,t3_qvpayn,t1_hky08vr,/r/Bitcoin/comments/qvpayn/i_still_believe_that_btc_can_reach_100000/hky9tlr/
239,hkykfoo,Fishypoo99,Yup I see this format all over YouTube and it pisses me off,Yup I see this format all over YouTube and it pisses me off,1,2021-11-17 06:48:22,<praw.models.comment_forest.CommentForest object at 0x000001BA59B0BB80>,qvpayn,Bitcoin,t5_2s3qj,,False,False,t3_qvpayn,t1_hkyj9i6,/r/Bitcoin/comments/qvpayn/i_still_believe_that_btc_can_reach_100000/hkykfoo/
240,hl2zxc0,honeybadgeronreddit,If it happens it would be a very cruel joke.,If it happens it would be a very cruel joke.,1,2021-11-18 04:39:36,<praw.models.comment_forest.CommentForest object at 0x000001BA59B0B970>,qvpayn,Bitcoin,t5_2s3qj,,False,False,t3_qvpayn,t1_hl18ixq,/r/Bitcoin/comments/qvpayn/i_still_believe_that_btc_can_reach_100000/hl2zxc0/
241,hky3co5,Melodic-Pear-1980,"Buying btc and waiting will end well, trying to leverage and short or long the market is probably going to be a rough ride","Buying btc and waiting will end well, trying to leverage and short or long the market is probably going to be a rough ride",1,2021-11-17 04:00:48,<praw.models.comment_forest.CommentForest object at 0x000001BA59B0BEE0>,qvpayn,Bitcoin,t5_2s3qj,,False,False,t3_qvpayn,t1_hky2sos,/r/Bitcoin/comments/qvpayn/i_still_believe_that_btc_can_reach_100000/hky3co5/
242,hkz6861,,[removed],[removed],21,2021-11-17 11:40:41,<praw.models.comment_forest.CommentForest object at 0x000001BA5D2FBB80>,qvpayn,Bitcoin,t5_2s3qj,,False,False,t3_qvpayn,t1_hkyukae,/r/Bitcoin/comments/qvpayn/i_still_believe_that_btc_can_reach_100000/hkz6861/
243,hkyryd6,,Feels like a shitcoin sub these days,Feels like a shitcoin sub these days,5,2021-11-17 08:24:56,<praw.models.comment_forest.CommentForest object at 0x000001BA5D2FBE20>,qvpayn,Bitcoin,t5_2s3qj,,False,False,t3_qvpayn,t1_hkyrl29,/r/Bitcoin/comments/qvpayn/i_still_believe_that_btc_can_reach_100000/hkyryd6/
244,hl1cwig,DengenerateVentures,I am balls deep in Bitcoin,I am balls deep in Bitcoin,2,2021-11-17 21:14:22,<praw.models.comment_forest.CommentForest object at 0x000001BA5A00F220>,qvpayn,Bitcoin,t5_2s3qj,,False,False,t3_qvpayn,t1_hkyavzm,/r/Bitcoin/comments/qvpayn/i_still_believe_that_btc_can_reach_100000/hl1cwig/
245,hkydc5q,ErrareUmanumEst,BTC isn’t about growth (for now it is). It’s about freedom from monetary oppression.,BTC isn’t about growth (for now it is). It’s about freedom from monetary oppression.,12,2021-11-17 05:31:38,<praw.models.comment_forest.CommentForest object at 0x000001BA5A00F340>,qvpayn,Bitcoin,t5_2s3qj,,False,False,t3_qvpayn,t1_hkxz1ni,/r/Bitcoin/comments/qvpayn/i_still_believe_that_btc_can_reach_100000/hkydc5q/
246,hky0z8r,SpiritmongerScaph,"Meh, who knows; I like dreaming","Meh, who knows; I like dreaming",2,2021-11-17 03:41:20,<praw.models.comment_forest.CommentForest object at 0x000001BA5A00F3A0>,qvpayn,Bitcoin,t5_2s3qj,,False,False,t3_qvpayn,t1_hkxz1ni,/r/Bitcoin/comments/qvpayn/i_still_believe_that_btc_can_reach_100000/hky0z8r/
247,hkypglt,abrireddit,I think OP has English as a foreign language,I think OP has English as a foreign language,1,2021-11-17 07:51:33,<praw.models.comment_forest.CommentForest object at 0x000001BA5A00F700>,qvpayn,Bitcoin,t5_2s3qj,,False,False,t3_qvpayn,t1_hky5ck2,/r/Bitcoin/comments/qvpayn/i_still_believe_that_btc_can_reach_100000/hkypglt/
248,hkxx196,Kaolok,*Circular reasoning intensifies*,*Circular reasoning intensifies*,18,2021-11-17 03:10:44,<praw.models.comment_forest.CommentForest object at 0x000001BA5A00F880>,qvpayn,Bitcoin,t5_2s3qj,,False,False,t3_qvpayn,t1_hkxw2nq,/r/Bitcoin/comments/qvpayn/i_still_believe_that_btc_can_reach_100000/hkxx196/
249,hkxwyo1,zhengsuna,"But we also have to accept that it grows slowly, instead of directly reaching 1,000,000 or more","But we also have to accept that it grows slowly, instead of directly reaching 1,000,000 or more",1,2021-11-17 03:10:10,<praw.models.comment_forest.CommentForest object at 0x000001BA5A00F8E0>,qvpayn,Bitcoin,t5_2s3qj,,False,True,t3_qvpayn,t1_hkxw2nq,/r/Bitcoin/comments/qvpayn/i_still_believe_that_btc_can_reach_100000/hkxwyo1/
250,hl1d7c8,DengenerateVentures,Anything under $69,Anything under $69,1,2021-11-17 21:16:26,<praw.models.comment_forest.CommentForest object at 0x000001BA59B0B610>,qvpayn,Bitcoin,t5_2s3qj,,False,False,t3_qvpayn,t1_hkyl84p,/r/Bitcoin/comments/qvpayn/i_still_believe_that_btc_can_reach_100000/hl1d7c8/
251,hl309ed,charlieecho,So it’s a joke ?,So it’s a joke ?,1,2021-11-18 04:42:29,<praw.models.comment_forest.CommentForest object at 0x000001BA59B0BD90>,qvpayn,Bitcoin,t5_2s3qj,,False,False,t3_qvpayn,t1_hl2zxc0,/r/Bitcoin/comments/qvpayn/i_still_believe_that_btc_can_reach_100000/hl309ed/
252,hl0csll,zhengsuna,"Yes, I think so too","Yes, I think so too",1,2021-11-17 17:16:07,<praw.models.comment_forest.CommentForest object at 0x000001BA5D2C3040>,qvpayn,Bitcoin,t5_2s3qj,,False,True,t3_qvpayn,t1_hky3co5,/r/Bitcoin/comments/qvpayn/i_still_believe_that_btc_can_reach_100000/hl0csll/
253,hkzn1zu,,"""Is everyone on earth a fucking moron?""

--Albert Einstein","""Is everyone on earth a fucking moron?""

--Albert Einstein",6,2021-11-17 14:19:10,<praw.models.comment_forest.CommentForest object at 0x000001BA5D2FBC40>,qvpayn,Bitcoin,t5_2s3qj,,False,False,t3_qvpayn,t1_hkz6861,/r/Bitcoin/comments/qvpayn/i_still_believe_that_btc_can_reach_100000/hkzn1zu/
254,hkz3f2w,chabacanito,All coins are shitcoins,All coins are shitcoins,0,2021-11-17 11:05:23,<praw.models.comment_forest.CommentForest object at 0x000001BA5D2FBEE0>,qvpayn,Bitcoin,t5_2s3qj,,False,False,t3_qvpayn,t1_hkyryd6,/r/Bitcoin/comments/qvpayn/i_still_believe_that_btc_can_reach_100000/hkz3f2w/
255,hl1ec9u,bearCatBird,Bitcoin doesn't discriminate.,Bitcoin doesn't discriminate.,1,2021-11-17 21:24:07,<praw.models.comment_forest.CommentForest object at 0x000001BA5A00F2E0>,qvpayn,Bitcoin,t5_2s3qj,,False,False,t3_qvpayn,t1_hl1cwig,/r/Bitcoin/comments/qvpayn/i_still_believe_that_btc_can_reach_100000/hl1ec9u/
256,hky1gst,zhengsuna,Good dream LOL,Good dream LOL,-3,2021-11-17 03:45:17,<praw.models.comment_forest.CommentForest object at 0x000001BA5A00F460>,qvpayn,Bitcoin,t5_2s3qj,,False,True,t3_qvpayn,t1_hky0z8r,/r/Bitcoin/comments/qvpayn/i_still_believe_that_btc_can_reach_100000/hky1gst/
257,hkxx9p8,TheOpeningBell,"Slowly? Was it slow to go from 10k to 60k? Nope. So why not a billion next year? It's valued on.....something....no one knows what it is....but it's something. 

Price target: 1 trillion dollars a Satoshi by 2030.","Slowly? Was it slow to go from 10k to 60k? Nope. So why not a billion next year? It's valued on.....something....no one knows what it is....but it's something. 

Price target: 1 trillion dollars a Satoshi by 2030.",5,2021-11-17 03:12:32,<praw.models.comment_forest.CommentForest object at 0x000001BA5A00F9A0>,qvpayn,Bitcoin,t5_2s3qj,,False,False,t3_qvpayn,t1_hkxwyo1,/r/Bitcoin/comments/qvpayn/i_still_believe_that_btc_can_reach_100000/hkxx9p8/
258,hl30mmm,honeybadgeronreddit,Added edit,Added edit,1,2021-11-18 04:45:47,<praw.models.comment_forest.CommentForest object at 0x000001BA59B0BE20>,qvpayn,Bitcoin,t5_2s3qj,,False,False,t3_qvpayn,t1_hl309ed,/r/Bitcoin/comments/qvpayn/i_still_believe_that_btc_can_reach_100000/hl30mmm/
259,hkzxfe6,PresterJohnsKingdom,Yes.  Pretty much.,Yes.  Pretty much.,1,2021-11-17 15:34:19,<praw.models.comment_forest.CommentForest object at 0x000001BA5D2FBD00>,qvpayn,Bitcoin,t5_2s3qj,,False,False,t3_qvpayn,t1_hkzn1zu,/r/Bitcoin/comments/qvpayn/i_still_believe_that_btc_can_reach_100000/hkzxfe6/
260,hky9a52,dirtsmurf,"it was slow from $1 to 60,000... took a decade no?","it was slow from $1 to 60,000... took a decade no?",2,2021-11-17 04:52:34,<praw.models.comment_forest.CommentForest object at 0x000001BA5A00FA60>,qvpayn,Bitcoin,t5_2s3qj,,False,False,t3_qvpayn,t1_hkxx9p8,/r/Bitcoin/comments/qvpayn/i_still_believe_that_btc_can_reach_100000/hky9a52/
261,hkxz0xb,zhengsuna,"But I think this is not the case. After being supervised in the future, more people will know that there may be limited growth at that time.","But I think this is not the case. After being supervised in the future, more people will know that there may be limited growth at that time.",1,2021-11-17 03:26:05,<praw.models.comment_forest.CommentForest object at 0x000001BA5A00FAC0>,qvpayn,Bitcoin,t5_2s3qj,,False,True,t3_qvpayn,t1_hkxx9p8,/r/Bitcoin/comments/qvpayn/i_still_believe_that_btc_can_reach_100000/hkxz0xb/
262,hl30wir,charlieecho,Define collapse,Define collapse,1,2021-11-18 04:48:17,<praw.models.comment_forest.CommentForest object at 0x000001BA59B0BE50>,qvpayn,Bitcoin,t5_2s3qj,,False,False,t3_qvpayn,t1_hl30mmm,/r/Bitcoin/comments/qvpayn/i_still_believe_that_btc_can_reach_100000/hl30wir/
263,hkyc2pt,wkw3,"A decade, to overtake the market cap of every company on Earth but five? Slow?","A decade, to overtake the market cap of every company on Earth but five? Slow?",4,2021-11-17 05:19:12,<praw.models.comment_forest.CommentForest object at 0x000001BA5A00FB20>,qvpayn,Bitcoin,t5_2s3qj,,False,False,t3_qvpayn,t1_hky9a52,/r/Bitcoin/comments/qvpayn/i_still_believe_that_btc_can_reach_100000/hkyc2pt/
264,hkxz87g,TheOpeningBell,Limited growth and Bitcoin in the same sentence? Heresy. No such thing. Number only go up.,Limited growth and Bitcoin in the same sentence? Heresy. No such thing. Number only go up.,2,2021-11-17 03:27:38,<praw.models.comment_forest.CommentForest object at 0x000001BA5A00FC40>,qvpayn,Bitcoin,t5_2s3qj,,False,False,t3_qvpayn,t1_hkxz0xb,/r/Bitcoin/comments/qvpayn/i_still_believe_that_btc_can_reach_100000/hkxz87g/
265,hkycksu,dirtsmurf,"Marketcap is a made up metric for crypto and is less useful the higher it goes. You can only compare crypto to crypto mcap, and maybe gold and silver. But not crypto vs publicly traded companies. What's bitcoins P/E?

60% of bitcoin hasn't moved at all in over 12 months.

Edit: downvote all you want but comparing the marketcap of a crypto to an company makes no sense.","Marketcap is a made up metric for crypto and is less useful the higher it goes. You can only compare crypto to crypto mcap, and maybe gold and silver. But not crypto vs publicly traded companies. What's bitcoins P/E?

60% of bitcoin hasn't moved at all in over 12 months.

Edit: downvote all you want but comparing the marketcap of a crypto to an company makes no sense.",1,2021-11-17 05:24:02,<praw.models.comment_forest.CommentForest object at 0x000001BA5A00FBE0>,qvpayn,Bitcoin,t5_2s3qj,,1637127660.0,False,t3_qvpayn,t1_hkyc2pt,/r/Bitcoin/comments/qvpayn/i_still_believe_that_btc_can_reach_100000/hkycksu/
