,ID,Author,body,Comment,Score,Created On,Replies,Submission,Subreddit,Subreddit_ID,Distinguished,Edited,Is_submitter,link_id,Parent_id,Permalink
0,i36zpie,kelv031,"Big thanks to all the users on r/bitcoin, really appreciate all the help, support and awareness you guys give to us bitcoiners out here. Saw this email as I woke,  first thing I did was check r/bitcoin to see this post warning us that it is a fake. Thanks again, you guys are great. Be safe out there ppl everyone is out to get your bitcoins. Stay bless!","Big thanks to all the users on r/bitcoin, really appreciate all the help, support and awareness you guys give to us bitcoiners out here. Saw this email as I woke,  first thing I did was check r/bitcoin to see this post warning us that it is a fake. Thanks again, you guys are great. Be safe out there ppl everyone is out to get your bitcoins. Stay bless!",103,2022-04-03 06:13:08,<praw.models.comment_forest.CommentForest object at 0x000001BA65CDA730>,tv2bip,Bitcoin,t5_2s3qj,,False,False,t3_tv2bip,t3_tv2bip,/r/Bitcoin/comments/tv2bip/warning_trezor_users_the_email_from/i36zpie/
1,i36ysa2,devonthed00d,Just assume everything via email is fake and you’ll be fairly well off.,Just assume everything via email is fake and you’ll be fairly well off.,127,2022-04-03 06:01:51,<praw.models.comment_forest.CommentForest object at 0x000001BA65CDA820>,tv2bip,Bitcoin,t5_2s3qj,,False,False,t3_tv2bip,t3_tv2bip,/r/Bitcoin/comments/tv2bip/warning_trezor_users_the_email_from/i36ysa2/
2,i377o2s,ilega_dh,It seems their email database did get compromised though. That’s a shame.,It seems their email database did get compromised though. That’s a shame.,24,2022-04-03 07:56:15,<praw.models.comment_forest.CommentForest object at 0x000001BA65CDAA30>,tv2bip,Bitcoin,t5_2s3qj,,False,False,t3_tv2bip,t3_tv2bip,/r/Bitcoin/comments/tv2bip/warning_trezor_users_the_email_from/i377o2s/
3,i37dlm4,GrahamCluley,"The bogus email links to a site which pretends to be the real Trezor website, but is in fact using a Unicode trick: ""ẹ"" rather than ""e"" in ""trezor"" (spot the underdot).

I explain more about the attack in my blog post at https://grahamcluley.com/trezor-wallets-hacked-dont-be-duped-by-phishing-attack-email/","The bogus email links to a site which pretends to be the real Trezor website, but is in fact using a Unicode trick: ""ẹ"" rather than ""e"" in ""trezor"" (spot the underdot).

I explain more about the attack in my blog post at https://grahamcluley.com/trezor-wallets-hacked-dont-be-duped-by-phishing-attack-email/",8,2022-04-03 09:17:28,<praw.models.comment_forest.CommentForest object at 0x000001BA65CCC3D0>,tv2bip,Bitcoin,t5_2s3qj,,False,False,t3_tv2bip,t3_tv2bip,/r/Bitcoin/comments/tv2bip/warning_trezor_users_the_email_from/i37dlm4/
4,i374q6x,dextersh,"ANY EMAIL that starts with DEAR CUSTOMER, is a scam! And they even put RE in the subject. What noobs.","ANY EMAIL that starts with DEAR CUSTOMER, is a scam! And they even put RE in the subject. What noobs.",13,2022-04-03 07:17:31,<praw.models.comment_forest.CommentForest object at 0x000001BA65CCCA30>,tv2bip,Bitcoin,t5_2s3qj,,False,False,t3_tv2bip,t3_tv2bip,/r/Bitcoin/comments/tv2bip/warning_trezor_users_the_email_from/i374q6x/
5,i37bjnz,Spartan3123,Hey this is a good opportunity to lose your coins in this phishing attacks if you are in the EU. If you can't use CEx for easy selling you can send your coins through a mixer and pretend all your coins were swept up in a phishing attack like this. How sad :(,Hey this is a good opportunity to lose your coins in this phishing attacks if you are in the EU. If you can't use CEx for easy selling you can send your coins through a mixer and pretend all your coins were swept up in a phishing attack like this. How sad :(,7,2022-04-03 08:48:45,<praw.models.comment_forest.CommentForest object at 0x000001BA65CCCD30>,tv2bip,Bitcoin,t5_2s3qj,,False,False,t3_tv2bip,t3_tv2bip,/r/Bitcoin/comments/tv2bip/warning_trezor_users_the_email_from/i37bjnz/
6,i371pxt,SusGreen,You guys get Trezor emails? I don't because I never gave them my email.,You guys get Trezor emails? I don't because I never gave them my email.,19,2022-04-03 06:38:22,<praw.models.comment_forest.CommentForest object at 0x000001BA65CCCDF0>,tv2bip,Bitcoin,t5_2s3qj,,False,False,t3_tv2bip,t3_tv2bip,/r/Bitcoin/comments/tv2bip/warning_trezor_users_the_email_from/i371pxt/
7,i37oef6,Photolunatic,"u/SomeBrokeChump
Thanks! Great effort buddy.","u/SomeBrokeChump
Thanks! Great effort buddy.",6,2022-04-03 11:42:40,<praw.models.comment_forest.CommentForest object at 0x000001BA65CCCF70>,tv2bip,Bitcoin,t5_2s3qj,,False,False,t3_tv2bip,t3_tv2bip,/r/Bitcoin/comments/tv2bip/warning_trezor_users_the_email_from/i37oef6/
8,i371e2m,Fisterupper,Came here looking for this. Thanks.,Came here looking for this. Thanks.,4,2022-04-03 06:34:09,<praw.models.comment_forest.CommentForest object at 0x000001BA5D2E3280>,tv2bip,Bitcoin,t5_2s3qj,,False,False,t3_tv2bip,t3_tv2bip,/r/Bitcoin/comments/tv2bip/warning_trezor_users_the_email_from/i371e2m/
9,i37avg2,sonastyinc,Did someone hack their email database or something? Or are the scammers just mass spamming?,Did someone hack their email database or something? Or are the scammers just mass spamming?,4,2022-04-03 08:39:34,<praw.models.comment_forest.CommentForest object at 0x000001BA5D2E3340>,tv2bip,Bitcoin,t5_2s3qj,,False,False,t3_tv2bip,t3_tv2bip,/r/Bitcoin/comments/tv2bip/warning_trezor_users_the_email_from/i37avg2/
10,i37d9u7,DarkSyde3000,"The email is fake but some trezor users are getting that email because there was obviously a database breach at trezor. Otherwise how would they know you even own one? The people emailing you are most likely the ones who did the hacking, obviously.","The email is fake but some trezor users are getting that email because there was obviously a database breach at trezor. Otherwise how would they know you even own one? The people emailing you are most likely the ones who did the hacking, obviously.",4,2022-04-03 09:12:53,<praw.models.comment_forest.CommentForest object at 0x000001BA5D2E3400>,tv2bip,Bitcoin,t5_2s3qj,,False,False,t3_tv2bip,t3_tv2bip,/r/Bitcoin/comments/tv2bip/warning_trezor_users_the_email_from/i37d9u7/
11,i38feo8,noahB53,I have a trezor and I never got the Email,I have a trezor and I never got the Email,5,2022-04-03 15:38:20,<praw.models.comment_forest.CommentForest object at 0x000001BA5D2E38E0>,tv2bip,Bitcoin,t5_2s3qj,,False,False,t3_tv2bip,t3_tv2bip,/r/Bitcoin/comments/tv2bip/warning_trezor_users_the_email_from/i38feo8/
12,i38p6h5,KualaLJ,"If a hardware wallet company can’t protect the database of its customer’s emails, why should it be trusted?","If a hardware wallet company can’t protect the database of its customer’s emails, why should it be trusted?",5,2022-04-03 16:46:18,<praw.models.comment_forest.CommentForest object at 0x000001BA5D2E39A0>,tv2bip,Bitcoin,t5_2s3qj,,False,False,t3_tv2bip,t3_tv2bip,/r/Bitcoin/comments/tv2bip/warning_trezor_users_the_email_from/i38p6h5/
13,i3aajg9,tkfili,Clicking on any unknown link is always going to be costly.,Clicking on any unknown link is always going to be costly.,5,2022-04-03 23:31:37,<praw.models.comment_forest.CommentForest object at 0x000001BA5D2E3B20>,tv2bip,Bitcoin,t5_2s3qj,,False,False,t3_tv2bip,t3_tv2bip,/r/Bitcoin/comments/tv2bip/warning_trezor_users_the_email_from/i3aajg9/
14,i37c244,iamjide91,Thanks for the heads up although I haven't noticed any mail as such.,Thanks for the heads up although I haven't noticed any mail as such.,3,2022-04-03 08:55:49,<praw.models.comment_forest.CommentForest object at 0x000001BA5D2E3BB0>,tv2bip,Bitcoin,t5_2s3qj,,False,False,t3_tv2bip,t3_tv2bip,/r/Bitcoin/comments/tv2bip/warning_trezor_users_the_email_from/i37c244/
15,i37pd9s,zomgitsduke,Trezor has no business knowing my email address.,Trezor has no business knowing my email address.,3,2022-04-03 11:53:58,<praw.models.comment_forest.CommentForest object at 0x000001BA5D2E3BE0>,tv2bip,Bitcoin,t5_2s3qj,,False,False,t3_tv2bip,t3_tv2bip,/r/Bitcoin/comments/tv2bip/warning_trezor_users_the_email_from/i37pd9s/
16,i38qpnl,someGuyJeez,These stupid fucks learned nothing from ledger? Seriously?!,These stupid fucks learned nothing from ledger? Seriously?!,3,2022-04-03 16:56:55,<praw.models.comment_forest.CommentForest object at 0x000001BA5D2E3CA0>,tv2bip,Bitcoin,t5_2s3qj,,False,False,t3_tv2bip,t3_tv2bip,/r/Bitcoin/comments/tv2bip/warning_trezor_users_the_email_from/i38qpnl/
17,i38waun,ryan7878,Glad my paper doesnt send me emails,Glad my paper doesnt send me emails,3,2022-04-03 17:35:06,<praw.models.comment_forest.CommentForest object at 0x000001BA5D2E3DC0>,tv2bip,Bitcoin,t5_2s3qj,,False,False,t3_tv2bip,t3_tv2bip,/r/Bitcoin/comments/tv2bip/warning_trezor_users_the_email_from/i38waun/
18,i3b7ju0,mr_crackboy,"It looked pretty real, but you should NEVER download Software via E-Mail. Its always a scam.","It looked pretty real, but you should NEVER download Software via E-Mail. Its always a scam.",3,2022-04-04 03:51:59,<praw.models.comment_forest.CommentForest object at 0x000001BA5D2E3E80>,tv2bip,Bitcoin,t5_2s3qj,,False,False,t3_tv2bip,t3_tv2bip,/r/Bitcoin/comments/tv2bip/warning_trezor_users_the_email_from/i3b7ju0/
19,i377wdm,affenstunde,"I got the same phishing mail this morning, posted some details in this post on the Trezor subreddit:

https://www.reddit.com/r/TREZOR/comments/tv31fz/trezor_data_breach/","I got the same phishing mail this morning, posted some details in this post on the Trezor subreddit:

https://www.reddit.com/r/TREZOR/comments/tv31fz/trezor_data_breach/",2,2022-04-03 07:59:20,<praw.models.comment_forest.CommentForest object at 0x000001BA5D2E3EE0>,tv2bip,Bitcoin,t5_2s3qj,,1648974209.0,False,t3_tv2bip,t3_tv2bip,/r/Bitcoin/comments/tv2bip/warning_trezor_users_the_email_from/i377wdm/
20,i3792u0,,[deleted],[deleted],2,2022-04-03 08:15:05,<praw.models.comment_forest.CommentForest object at 0x000001BA5D2E3F40>,tv2bip,Bitcoin,t5_2s3qj,,False,False,t3_tv2bip,t3_tv2bip,/r/Bitcoin/comments/tv2bip/warning_trezor_users_the_email_from/i3792u0/
21,i37jyck,BlANWA,How did they get are emails,How did they get are emails,2,2022-04-03 10:44:47,<praw.models.comment_forest.CommentForest object at 0x000001BA5D2E37F0>,tv2bip,Bitcoin,t5_2s3qj,,False,False,t3_tv2bip,t3_tv2bip,/r/Bitcoin/comments/tv2bip/warning_trezor_users_the_email_from/i37jyck/
22,i37opop,Asequamor2,So happy I keep everything in my paper wallet.,So happy I keep everything in my paper wallet.,2,2022-04-03 11:46:21,<praw.models.comment_forest.CommentForest object at 0x000001BA5D2C40D0>,tv2bip,Bitcoin,t5_2s3qj,,False,False,t3_tv2bip,t3_tv2bip,/r/Bitcoin/comments/tv2bip/warning_trezor_users_the_email_from/i37opop/
23,i3864oz,Gandhi70,"First Ledger, now Trezor. Thank God, that I bought my Ledger from Amazon. So no one besides Amazon has my e-mail address and can abuse it for phishing  or harassing mails.","First Ledger, now Trezor. Thank God, that I bought my Ledger from Amazon. So no one besides Amazon has my e-mail address and can abuse it for phishing  or harassing mails.",2,2022-04-03 14:29:36,<praw.models.comment_forest.CommentForest object at 0x000001BA5D2C4190>,tv2bip,Bitcoin,t5_2s3qj,,False,False,t3_tv2bip,t3_tv2bip,/r/Bitcoin/comments/tv2bip/warning_trezor_users_the_email_from/i3864oz/
24,i3878qi,time_wasted504,"trezor.eweess? lol

Trezor is a Czech company, why would they have a .us

trezor.io","trezor.eweess? lol

Trezor is a Czech company, why would they have a .us

trezor.io",2,2022-04-03 14:38:06,<praw.models.comment_forest.CommentForest object at 0x000001BA5D2C4250>,tv2bip,Bitcoin,t5_2s3qj,,False,False,t3_tv2bip,t3_tv2bip,/r/Bitcoin/comments/tv2bip/warning_trezor_users_the_email_from/i3878qi/
25,i38qxft,knox203,"Use https://urlscan.io (and switch to a private/unlisted scan) to check URL's before clicking. That'll show you all the redirections and 3rd party links/resources it loads to verify links are legit or not.

If you know how to look at the header info in emails then you can also check to confirm it passed the SPF check (it was actually sent from an approved server), and DKIM signed (was actually sent from an existing mailbox).","Use https://urlscan.io (and switch to a private/unlisted scan) to check URL's before clicking. That'll show you all the redirections and 3rd party links/resources it loads to verify links are legit or not.

If you know how to look at the header info in emails then you can also check to confirm it passed the SPF check (it was actually sent from an approved server), and DKIM signed (was actually sent from an existing mailbox).",2,2022-04-03 16:58:25,<praw.models.comment_forest.CommentForest object at 0x000001BA5D2C43D0>,tv2bip,Bitcoin,t5_2s3qj,,False,False,t3_tv2bip,t3_tv2bip,/r/Bitcoin/comments/tv2bip/warning_trezor_users_the_email_from/i38qxft/
26,i3cq0c5,,Why does Trezor even collect emails? This should be a no no for all hardware wallet companies.,Why does Trezor even collect emails? This should be a no no for all hardware wallet companies.,2,2022-04-04 14:01:05,<praw.models.comment_forest.CommentForest object at 0x000001BA5D2C45B0>,tv2bip,Bitcoin,t5_2s3qj,,False,False,t3_tv2bip,t3_tv2bip,/r/Bitcoin/comments/tv2bip/warning_trezor_users_the_email_from/i3cq0c5/
27,i3cswyq,davotoula,"Even better... Click on anything you want. But Never put your recovery seed in any website/app/phone call/chat.

You have a hardware wallet which main purpose is not to reveal the seed. Don't do it yourself!","Even better... Click on anything you want. But Never put your recovery seed in any website/app/phone call/chat.

You have a hardware wallet which main purpose is not to reveal the seed. Don't do it yourself!",2,2022-04-04 14:21:51,<praw.models.comment_forest.CommentForest object at 0x000001BA5D2C4610>,tv2bip,Bitcoin,t5_2s3qj,,False,False,t3_tv2bip,t3_tv2bip,/r/Bitcoin/comments/tv2bip/warning_trezor_users_the_email_from/i3cswyq/
28,i37l8gh,lexshotit,Pretty sure my wallet isn't associated with an email address...,Pretty sure my wallet isn't associated with an email address...,2,2022-04-03 11:02:10,<praw.models.comment_forest.CommentForest object at 0x000001BA5D2C4670>,tv2bip,Bitcoin,t5_2s3qj,,False,False,t3_tv2bip,t3_tv2bip,/r/Bitcoin/comments/tv2bip/warning_trezor_users_the_email_from/i37l8gh/
29,i3884np,LoneWolfSpartan,Why I got a ledger,Why I got a ledger,-6,2022-04-03 14:44:49,<praw.models.comment_forest.CommentForest object at 0x000001BA5D2C46D0>,tv2bip,Bitcoin,t5_2s3qj,,False,False,t3_tv2bip,t3_tv2bip,/r/Bitcoin/comments/tv2bip/warning_trezor_users_the_email_from/i3884np/
30,i386man,One_2_Three,"See the Seed Signer project.  Stuff like this can never happen.  Yes it may have some limitations, but I don’t need to give any info to no one.  I built the hardware side of it with stuff I had already.  I just needed to buy the screen hat.","See the Seed Signer project.  Stuff like this can never happen.  Yes it may have some limitations, but I don’t need to give any info to no one.  I built the hardware side of it with stuff I had already.  I just needed to buy the screen hat.",1,2022-04-03 14:33:22,<praw.models.comment_forest.CommentForest object at 0x000001BA5D2C4910>,tv2bip,Bitcoin,t5_2s3qj,,False,False,t3_tv2bip,t3_tv2bip,/r/Bitcoin/comments/tv2bip/warning_trezor_users_the_email_from/i386man/
31,i389yhw,shmanny0813,Forgive me if this is off topic but what is the solution for bitcoin companies to do email marketing in a world where every SaaS product in this space is becoming a target for these type of attacks?,Forgive me if this is off topic but what is the solution for bitcoin companies to do email marketing in a world where every SaaS product in this space is becoming a target for these type of attacks?,1,2022-04-03 14:58:35,<praw.models.comment_forest.CommentForest object at 0x000001BA5D2C4A90>,tv2bip,Bitcoin,t5_2s3qj,,False,False,t3_tv2bip,t3_tv2bip,/r/Bitcoin/comments/tv2bip/warning_trezor_users_the_email_from/i389yhw/
32,i3c79sn,14b755fe39,"yes its a phishing scam

so how did they obtain my email?","yes its a phishing scam

so how did they obtain my email?",1,2022-04-04 11:14:02,<praw.models.comment_forest.CommentForest object at 0x000001BA5D2C4B50>,tv2bip,Bitcoin,t5_2s3qj,,False,False,t3_tv2bip,t3_tv2bip,/r/Bitcoin/comments/tv2bip/warning_trezor_users_the_email_from/i3c79sn/
33,i3c8dc5,SpecialX,"How does this scam work? You go to the fake website, then what? Does it ask for your private key to log in or something?","How does this scam work? You go to the fake website, then what? Does it ask for your private key to log in or something?",1,2022-04-04 11:26:14,<praw.models.comment_forest.CommentForest object at 0x000001BA5D2C4CD0>,tv2bip,Bitcoin,t5_2s3qj,,False,False,t3_tv2bip,t3_tv2bip,/r/Bitcoin/comments/tv2bip/warning_trezor_users_the_email_from/i3c8dc5/
34,i3892ae,,[deleted],[deleted],13,2022-04-03 14:51:50,<praw.models.comment_forest.CommentForest object at 0x000001BA65CDA8B0>,tv2bip,Bitcoin,t5_2s3qj,,False,False,t3_tv2bip,t1_i36zpie,/r/Bitcoin/comments/tv2bip/warning_trezor_users_the_email_from/i3892ae/
35,i3bmgoe,OllieBarnes16,"same, forever grateful for this sub","same, forever grateful for this sub",2,2022-04-04 06:33:55,<praw.models.comment_forest.CommentForest object at 0x000001BA65CDA910>,tv2bip,Bitcoin,t5_2s3qj,,False,False,t3_tv2bip,t1_i36zpie,/r/Bitcoin/comments/tv2bip/warning_trezor_users_the_email_from/i3bmgoe/
36,i3bl840,highrowla,"If helping is possible by any means to anyone,we must need to do that.","If helping is possible by any means to anyone,we must need to do that.",1,2022-04-04 06:18:17,<praw.models.comment_forest.CommentForest object at 0x000001BA65CDA9D0>,tv2bip,Bitcoin,t5_2s3qj,,False,False,t3_tv2bip,t1_i36zpie,/r/Bitcoin/comments/tv2bip/warning_trezor_users_the_email_from/i3bl840/
37,i371dae,coinjaf,Yeah. The From address is pretty irrelevant in that decision.,Yeah. The From address is pretty irrelevant in that decision.,14,2022-04-03 06:33:52,<praw.models.comment_forest.CommentForest object at 0x000001BA65CDAA90>,tv2bip,Bitcoin,t5_2s3qj,,False,False,t3_tv2bip,t1_i36ysa2,/r/Bitcoin/comments/tv2bip/warning_trezor_users_the_email_from/i371dae/
38,i370yzk,mutalisken,I do this. Started 10 years ago. It was life changing.,I do this. Started 10 years ago. It was life changing.,9,2022-04-03 06:28:51,<praw.models.comment_forest.CommentForest object at 0x000001BA65CDAAF0>,tv2bip,Bitcoin,t5_2s3qj,,False,False,t3_tv2bip,t1_i36ysa2,/r/Bitcoin/comments/tv2bip/warning_trezor_users_the_email_from/i370yzk/
39,i37bc97,willmgarvey,I realized once I got my first IT job I how terribly dangerous email is compared to its potential usefulness. God forbid anyone had to use asymmetric cryptography to verify the senders identity. Apparently occasional fraud is much more cost effective than education.,I realized once I got my first IT job I how terribly dangerous email is compared to its potential usefulness. God forbid anyone had to use asymmetric cryptography to verify the senders identity. Apparently occasional fraud is much more cost effective than education.,7,2022-04-03 08:45:57,<praw.models.comment_forest.CommentForest object at 0x000001BA65CDABB0>,tv2bip,Bitcoin,t5_2s3qj,,False,False,t3_tv2bip,t1_i36ysa2,/r/Bitcoin/comments/tv2bip/warning_trezor_users_the_email_from/i37bc97/
40,i3784pd,lakimens,"This isn't a good solution, but you can train yourself recognize phishing. First you have to keep calm and go slow so you have time to recognize and fakeity.

Also have sure to always check the URL after opening the link, as links can be masked. Original

ProtonMail has this great feature which shows the link you will be opening.

Other than that, if anyone asks you for your keys, password or any similar data, don't give it to them.","This isn't a good solution, but you can train yourself recognize phishing. First you have to keep calm and go slow so you have time to recognize and fakeity.

Also have sure to always check the URL after opening the link, as links can be masked. Original

ProtonMail has this great feature which shows the link you will be opening.

Other than that, if anyone asks you for your keys, password or any similar data, don't give it to them.",14,2022-04-03 08:02:21,<praw.models.comment_forest.CommentForest object at 0x000001BA65CDAD30>,tv2bip,Bitcoin,t5_2s3qj,,False,False,t3_tv2bip,t1_i36ysa2,/r/Bitcoin/comments/tv2bip/warning_trezor_users_the_email_from/i3784pd/
41,i3abqpe,bhattihs,This is a great advise. I follow it not only in emails but other stuff too: like “every email or stock is a scam unless proven otherwise”,This is a great advise. I follow it not only in emails but other stuff too: like “every email or stock is a scam unless proven otherwise”,1,2022-04-03 23:41:07,<praw.models.comment_forest.CommentForest object at 0x000001BA65CDAEB0>,tv2bip,Bitcoin,t5_2s3qj,,False,False,t3_tv2bip,t1_i36ysa2,/r/Bitcoin/comments/tv2bip/warning_trezor_users_the_email_from/i3abqpe/
42,i3ahjlp,Serg_78,"Am I the only one,who catch any fake email just by its address.","Am I the only one,who catch any fake email just by its address.",1,2022-04-04 00:25:53,<praw.models.comment_forest.CommentForest object at 0x000001BA65CCC130>,tv2bip,Bitcoin,t5_2s3qj,,False,False,t3_tv2bip,t1_i36ysa2,/r/Bitcoin/comments/tv2bip/warning_trezor_users_the_email_from/i3ahjlp/
43,i37os9z,Photolunatic,"It was. I did not sign in for a MailChimp mailing list that they claim was compromised.
I did give them an email address to have package tracking.

I knew it was not a great idea but had faith that they are a proper company and are able to keep that data safe. Such a disappointment.","It was. I did not sign in for a MailChimp mailing list that they claim was compromised.
I did give them an email address to have package tracking.

I knew it was not a great idea but had faith that they are a proper company and are able to keep that data safe. Such a disappointment.",12,2022-04-03 11:47:13,<praw.models.comment_forest.CommentForest object at 0x000001BA65CCC490>,tv2bip,Bitcoin,t5_2s3qj,,False,False,t3_tv2bip,t1_i377o2s,/r/Bitcoin/comments/tv2bip/warning_trezor_users_the_email_from/i37os9z/
44,i3bbxo3,jdffe,Everyday we use our mail to sign up on different new account.,Everyday we use our mail to sign up on different new account.,1,2022-04-04 04:33:52,<praw.models.comment_forest.CommentForest object at 0x000001BA65CCC4F0>,tv2bip,Bitcoin,t5_2s3qj,,False,False,t3_tv2bip,t1_i377o2s,/r/Bitcoin/comments/tv2bip/warning_trezor_users_the_email_from/i3bbxo3/
45,i37emgf,GrahamCluley,"Trezor says it is investigating a possible breach of its Mailchimp-based mailing list:

https://twitter.com/Trezor/status/1510548489884815361","Trezor says it is investigating a possible breach of its Mailchimp-based mailing list:

https://twitter.com/Trezor/status/1510548489884815361",4,2022-04-03 09:31:35,<praw.models.comment_forest.CommentForest object at 0x000001BA65CCCAF0>,tv2bip,Bitcoin,t5_2s3qj,,False,False,t3_tv2bip,t1_i37dlm4,/r/Bitcoin/comments/tv2bip/warning_trezor_users_the_email_from/i37emgf/
46,i38dne7,anon13145088,"one email hit my inbox, and another got caught in the spam using a modified 't' -- 'ţrezor.com/'","one email hit my inbox, and another got caught in the spam using a modified 't' -- 'ţrezor.com/'",2,2022-04-03 15:25:43,<praw.models.comment_forest.CommentForest object at 0x000001BA65CCCB50>,tv2bip,Bitcoin,t5_2s3qj,,False,False,t3_tv2bip,t1_i37dlm4,/r/Bitcoin/comments/tv2bip/warning_trezor_users_the_email_from/i38dne7/
47,i39hc93,fude99,Everyday nearly more than 10 emails come to my mail box,Everyday nearly more than 10 emails come to my mail box,1,2022-04-03 19:59:02,<praw.models.comment_forest.CommentForest object at 0x000001BA65CCCCD0>,tv2bip,Bitcoin,t5_2s3qj,,False,False,t3_tv2bip,t1_i37dlm4,/r/Bitcoin/comments/tv2bip/warning_trezor_users_the_email_from/i39hc93/
48,i39zwix,crew681,Sometimes these types of word comes it aggreement letter and joining letter.,Sometimes these types of word comes it aggreement letter and joining letter.,1,2022-04-03 22:11:31,<praw.models.comment_forest.CommentForest object at 0x000001BA65CCCD90>,tv2bip,Bitcoin,t5_2s3qj,,False,False,t3_tv2bip,t1_i374q6x,/r/Bitcoin/comments/tv2bip/warning_trezor_users_the_email_from/i39zwix/
49,i39k1me,BitKiller79,I think now we need to change our wallet and need to shift everything.,I think now we need to change our wallet and need to shift everything.,2,2022-04-03 20:17:53,<praw.models.comment_forest.CommentForest object at 0x000001BA65CCCE50>,tv2bip,Bitcoin,t5_2s3qj,,False,False,t3_tv2bip,t1_i37bjnz,/r/Bitcoin/comments/tv2bip/warning_trezor_users_the_email_from/i39k1me/
50,i3c84pr,14b755fe39,"yes unfortunately I was a victim of this phishing attack, while on a boating trip. The crooks seem to have sent all my coins into a mixer","yes unfortunately I was a victim of this phishing attack, while on a boating trip. The crooks seem to have sent all my coins into a mixer",1,2022-04-04 11:23:35,<praw.models.comment_forest.CommentForest object at 0x000001BA65CCCEB0>,tv2bip,Bitcoin,t5_2s3qj,,False,False,t3_tv2bip,t1_i37bjnz,/r/Bitcoin/comments/tv2bip/warning_trezor_users_the_email_from/i3c84pr/
51,i37epu7,hiranfir,"Sure,

They basically just send notifications that there has been an update, without a link.

And some general crypto newsletter.","Sure,

They basically just send notifications that there has been an update, without a link.

And some general crypto newsletter.",2,2022-04-03 09:32:52,<praw.models.comment_forest.CommentForest object at 0x000001BA5D2E3040>,tv2bip,Bitcoin,t5_2s3qj,,False,False,t3_tv2bip,t1_i371pxt,/r/Bitcoin/comments/tv2bip/warning_trezor_users_the_email_from/i37epu7/
