,ID,Author,body,Comment,Score,Created On,Replies,Submission,Subreddit,Subreddit_ID,Distinguished,Edited,Is_submitter,link_id,Parent_id,Permalink
105,iihl71m,vnenkpet,"Uh I hope you're joking if you really think that. Some email service providers might be running some checks on that, but by default the sender can put literally anything in the From field.","Uh I hope you're joking if you really think that. Some email service providers might be running some checks on that, but by default the sender can put literally anything in the From field.",1,2022-08-01 09:36:07,<praw.models.comment_forest.CommentForest object at 0x000001BA65CDAC70>,tv2bip,Bitcoin,t5_2s3qj,,False,False,t3_tv2bip,t1_i3bhvgw,/r/Bitcoin/comments/tv2bip/warning_trezor_users_the_email_from/iihl71m/
106,i3b1456,Awtz09,And they swam directly to their fish tank.,And they swam directly to their fish tank.,1,2022-04-04 02:57:53,<praw.models.comment_forest.CommentForest object at 0x000001BA65CDAD90>,tv2bip,Bitcoin,t5_2s3qj,,False,False,t3_tv2bip,t1_i3aq3h3,/r/Bitcoin/comments/tv2bip/warning_trezor_users_the_email_from/i3b1456/
107,i37g9sz,willmgarvey,The sense of urgency placed in the messages makes some people freak out and lose their concentration so it’s easier to miss the signs; especially if you have never received training in identifying phishing emails.,The sense of urgency placed in the messages makes some people freak out and lose their concentration so it’s easier to miss the signs; especially if you have never received training in identifying phishing emails.,6,2022-04-03 09:54:22,<praw.models.comment_forest.CommentForest object at 0x000001BA65CDAF10>,tv2bip,Bitcoin,t5_2s3qj,,False,False,t3_tv2bip,t1_i37cqqh,/r/Bitcoin/comments/tv2bip/warning_trezor_users_the_email_from/i37g9sz/
108,i39o9y4,yjyuktbherb,I thought these type of tricks are too much old now.,I thought these type of tricks are too much old now.,1,2022-04-03 20:47:40,<praw.models.comment_forest.CommentForest object at 0x000001BA65CDAF70>,tv2bip,Bitcoin,t5_2s3qj,,False,False,t3_tv2bip,t1_i37cqqh,/r/Bitcoin/comments/tv2bip/warning_trezor_users_the_email_from/i39o9y4/
109,i37cklu,lakimens,"You can copy the link sometimes, but in HTML emails, you could have a masked link such as this one: [https://reddit.com/](https://roddit.com/).

Some email apps might not let you view the real link before opening it... But yeah, if it looks phishy, probably don't do it.

Usually, these messages will fail DMARC and a phishing warning will be shown.

I have yet to see a link which destroys you just by opening it.","You can copy the link sometimes, but in HTML emails, you could have a masked link such as this one: [https://reddit.com/](https://roddit.com/).

Some email apps might not let you view the real link before opening it... But yeah, if it looks phishy, probably don't do it.

Usually, these messages will fail DMARC and a phishing warning will be shown.

I have yet to see a link which destroys you just by opening it.",3,2022-04-03 09:03:06,<praw.models.comment_forest.CommentForest object at 0x000001BA65CCC190>,tv2bip,Bitcoin,t5_2s3qj,,False,False,t3_tv2bip,t1_i37bm7g,/r/Bitcoin/comments/tv2bip/warning_trezor_users_the_email_from/i37cklu/
110,i3bnc52,poika44,Even they use better mail address for these type of attacks.,Even they use better mail address for these type of attacks.,1,2022-04-04 06:45:16,<praw.models.comment_forest.CommentForest object at 0x000001BA65CCC1F0>,tv2bip,Bitcoin,t5_2s3qj,,False,False,t3_tv2bip,t1_i37bm7g,/r/Bitcoin/comments/tv2bip/warning_trezor_users_the_email_from/i3bnc52/
111,i3868eb,,[deleted],[deleted],7,2022-04-03 14:30:24,<praw.models.comment_forest.CommentForest object at 0x000001BA65CCC670>,tv2bip,Bitcoin,t5_2s3qj,,False,False,t3_tv2bip,t1_i37pf18,/r/Bitcoin/comments/tv2bip/warning_trezor_users_the_email_from/i3868eb/
112,i3bur7t,tradsand,Giving email address is not a concern from my side.,Giving email address is not a concern from my side.,1,2022-04-04 08:28:24,<praw.models.comment_forest.CommentForest object at 0x000001BA65CCC6D0>,tv2bip,Bitcoin,t5_2s3qj,,False,False,t3_tv2bip,t1_i37pf18,/r/Bitcoin/comments/tv2bip/warning_trezor_users_the_email_from/i3bur7t/
113,i3bwsqi,yongting1992,And in the end we have the name of our favourite crypto in it.,And in the end we have the name of our favourite crypto in it.,1,2022-04-04 08:58:05,<praw.models.comment_forest.CommentForest object at 0x000001BA65CCCC70>,tv2bip,Bitcoin,t5_2s3qj,,False,False,t3_tv2bip,t1_i37p4ax,/r/Bitcoin/comments/tv2bip/warning_trezor_users_the_email_from/i3bwsqi/
114,i399iqf,Johnny_jai,Does that mean reddit also leak their user account details.,Does that mean reddit also leak their user account details.,2,2022-04-03 19:06:06,<praw.models.comment_forest.CommentForest object at 0x000001BA5D2E3250>,tv2bip,Bitcoin,t5_2s3qj,,False,False,t3_tv2bip,t1_i387mox,/r/Bitcoin/comments/tv2bip/warning_trezor_users_the_email_from/i399iqf/
115,i37djxu,,[deleted],[deleted],3,2022-04-03 09:16:48,<praw.models.comment_forest.CommentForest object at 0x000001BA5D2E3610>,tv2bip,Bitcoin,t5_2s3qj,,False,False,t3_tv2bip,t1_i37dck5,/r/Bitcoin/comments/tv2bip/warning_trezor_users_the_email_from/i37djxu/
116,i3ahgj2,francescotonizzo,Only if in your wallet has some big amount saved then something can happened.,Only if in your wallet has some big amount saved then something can happened.,1,2022-04-04 00:25:14,<praw.models.comment_forest.CommentForest object at 0x000001BA5D2E3670>,tv2bip,Bitcoin,t5_2s3qj,,False,False,t3_tv2bip,t1_i37dck5,/r/Bitcoin/comments/tv2bip/warning_trezor_users_the_email_from/i3ahgj2/
117,i3by6en,tsvetaniliev23,"Fishing is a old method to attack, so I think everyone has a habit to get rid of it.","Fishing is a old method to attack, so I think everyone has a habit to get rid of it.",1,2022-04-04 09:18:06,<praw.models.comment_forest.CommentForest object at 0x000001BA5D2C48B0>,tv2bip,Bitcoin,t5_2s3qj,,False,False,t3_tv2bip,t1_i37mmt9,/r/Bitcoin/comments/tv2bip/warning_trezor_users_the_email_from/i3by6en/
118,i38g7yc,StoeTubby,"So you either bought a ledger before the massive hack and held them to the same standard, which is likely doubtful, or you bought after the hack and are completely uniformed. You play favoritism in both your statements as if it remotely matters. The present issue is with Trezor but as it looks right now Ledgers data security issues even if resolved were 10x worse and actually putting people in danger, whereas this currently you need to just avoid phishing emails.","So you either bought a ledger before the massive hack and held them to the same standard, which is likely doubtful, or you bought after the hack and are completely uniformed. You play favoritism in both your statements as if it remotely matters. The present issue is with Trezor but as it looks right now Ledgers data security issues even if resolved were 10x worse and actually putting people in danger, whereas this currently you need to just avoid phishing emails.",2,2022-04-03 15:44:07,<praw.models.comment_forest.CommentForest object at 0x000001BA5D2C4AF0>,tv2bip,Bitcoin,t5_2s3qj,,False,False,t3_tv2bip,t1_i38ek5f,/r/Bitcoin/comments/tv2bip/warning_trezor_users_the_email_from/i38g7yc/
119,i3buodr,allofpumper,Sometimes people did these things because of their eager.,Sometimes people did these things because of their eager.,2,2022-04-04 08:27:15,<praw.models.comment_forest.CommentForest object at 0x000001BA65CDAFD0>,tv2bip,Bitcoin,t5_2s3qj,,False,False,t3_tv2bip,t1_i37g9sz,/r/Bitcoin/comments/tv2bip/warning_trezor_users_the_email_from/i3buodr/
120,i38jip0,tucson82,All you need to do is hover over a link with your mouse and look at the bottom left corner of the screen of the screen to see where it is re-directing - in your case it was to roddit.com,All you need to do is hover over a link with your mouse and look at the bottom left corner of the screen of the screen to see where it is re-directing - in your case it was to roddit.com,3,2022-04-03 16:07:11,<praw.models.comment_forest.CommentForest object at 0x000001BA65CCC250>,tv2bip,Bitcoin,t5_2s3qj,,False,False,t3_tv2bip,t1_i37cklu,/r/Bitcoin/comments/tv2bip/warning_trezor_users_the_email_from/i38jip0/
121,i3blnq7,licorize27,I think there need a better way to get rid of these attacks.,I think there need a better way to get rid of these attacks.,1,2022-04-04 06:23:41,<praw.models.comment_forest.CommentForest object at 0x000001BA65CCC2B0>,tv2bip,Bitcoin,t5_2s3qj,,False,False,t3_tv2bip,t1_i37cklu,/r/Bitcoin/comments/tv2bip/warning_trezor_users_the_email_from/i3blnq7/
122,i38xhf7,DankShibe,"Yeah, same stuff  happened with ledger last year","Yeah, same stuff  happened with ledger last year",3,2022-04-03 17:43:05,<praw.models.comment_forest.CommentForest object at 0x000001BA65CCC730>,tv2bip,Bitcoin,t5_2s3qj,,False,False,t3_tv2bip,t1_i3868eb,/r/Bitcoin/comments/tv2bip/warning_trezor_users_the_email_from/i38xhf7/
123,i38cnlq,Photolunatic,100% Agree.,100% Agree.,2,2022-04-03 15:18:30,<praw.models.comment_forest.CommentForest object at 0x000001BA65CCC790>,tv2bip,Bitcoin,t5_2s3qj,,False,False,t3_tv2bip,t1_i3868eb,/r/Bitcoin/comments/tv2bip/warning_trezor_users_the_email_from/i38cnlq/
124,i3a0zst,viamoz,But we need to count each one even if one doesn't get on it.,But we need to count each one even if one doesn't get on it.,2,2022-04-03 22:19:31,<praw.models.comment_forest.CommentForest object at 0x000001BA65CCC850>,tv2bip,Bitcoin,t5_2s3qj,,False,False,t3_tv2bip,t1_i3868eb,/r/Bitcoin/comments/tv2bip/warning_trezor_users_the_email_from/i3a0zst/
125,i3bcbjl,nextLVLnasty,"Per their twitter it was an opt in newsletter list. This jives with my experience of being a customer, not opting in to newsletters, and not receiving this phishing email.","Per their twitter it was an opt in newsletter list. This jives with my experience of being a customer, not opting in to newsletters, and not receiving this phishing email.",1,2022-04-04 04:37:48,<praw.models.comment_forest.CommentForest object at 0x000001BA65CCC9D0>,tv2bip,Bitcoin,t5_2s3qj,,False,False,t3_tv2bip,t1_i3868eb,/r/Bitcoin/comments/tv2bip/warning_trezor_users_the_email_from/i3bcbjl/
126,i37noqw,PrawnTyas,"Confirmed 

https://twitter.com/trezor/status/1510558771944333312?s=21&t=N_e8EE6Wd4L4WoODtTF03Q","Confirmed 

https://twitter.com/trezor/status/1510558771944333312?s=21&t=N_e8EE6Wd4L4WoODtTF03Q",4,2022-04-03 11:33:59,<praw.models.comment_forest.CommentForest object at 0x000001BA5D2E36D0>,tv2bip,Bitcoin,t5_2s3qj,,False,False,t3_tv2bip,t1_i37djxu,/r/Bitcoin/comments/tv2bip/warning_trezor_users_the_email_from/i37noqw/
127,i3a4537,motynow,They are not going to invade the wallet for some penny dollars.,They are not going to invade the wallet for some penny dollars.,1,2022-04-03 22:42:44,<praw.models.comment_forest.CommentForest object at 0x000001BA5D2E3730>,tv2bip,Bitcoin,t5_2s3qj,,False,False,t3_tv2bip,t1_i37djxu,/r/Bitcoin/comments/tv2bip/warning_trezor_users_the_email_from/i3a4537/
128,i38lk0o,LoneWolfSpartan,Ok trezor boomer,Ok trezor boomer,-8,2022-04-03 16:21:16,<praw.models.comment_forest.CommentForest object at 0x000001BA5D2C4BB0>,tv2bip,Bitcoin,t5_2s3qj,,False,False,t3_tv2bip,t1_i38g7yc,/r/Bitcoin/comments/tv2bip/warning_trezor_users_the_email_from/i38lk0o/
129,i3ceonq,willmgarvey,Yes! Essentially any emotion that would want you to send information without verifying by other means first as it far too time sensitive to question the email if it was in fact true.,Yes! Essentially any emotion that would want you to send information without verifying by other means first as it far too time sensitive to question the email if it was in fact true.,1,2022-04-04 12:28:46,<praw.models.comment_forest.CommentForest object at 0x000001BA65CCC0D0>,tv2bip,Bitcoin,t5_2s3qj,,False,False,t3_tv2bip,t1_i3buodr,/r/Bitcoin/comments/tv2bip/warning_trezor_users_the_email_from/i3ceonq/
130,i39gokq,lakimens,"Some companies proxy the links through their own servers and domain, so this does not always work.","Some companies proxy the links through their own servers and domain, so this does not always work.",3,2022-04-03 19:54:30,<praw.models.comment_forest.CommentForest object at 0x000001BA65CCC310>,tv2bip,Bitcoin,t5_2s3qj,,False,False,t3_tv2bip,t1_i38jip0,/r/Bitcoin/comments/tv2bip/warning_trezor_users_the_email_from/i39gokq/
131,i39dd1i,2014minero,Make something simple and then each one of us will learn it.,Make something simple and then each one of us will learn it.,1,2022-04-03 19:31:53,<praw.models.comment_forest.CommentForest object at 0x000001BA65CCC370>,tv2bip,Bitcoin,t5_2s3qj,,False,False,t3_tv2bip,t1_i38jip0,/r/Bitcoin/comments/tv2bip/warning_trezor_users_the_email_from/i39dd1i/
132,i3b2r8h,parkranger2000,Which hardware wallet would u recommend since Trezor and ledger both had this happen,Which hardware wallet would u recommend since Trezor and ledger both had this happen,1,2022-04-04 03:11:03,<praw.models.comment_forest.CommentForest object at 0x000001BA65CCC7F0>,tv2bip,Bitcoin,t5_2s3qj,,False,False,t3_tv2bip,t1_i38xhf7,/r/Bitcoin/comments/tv2bip/warning_trezor_users_the_email_from/i3b2r8h/
133,i3br9yr,qepxdd,There must be some solution to stop these type of leak.,There must be some solution to stop these type of leak.,2,2022-04-04 07:38:24,<praw.models.comment_forest.CommentForest object at 0x000001BA65CCC910>,tv2bip,Bitcoin,t5_2s3qj,,False,False,t3_tv2bip,t1_i38cnlq,/r/Bitcoin/comments/tv2bip/warning_trezor_users_the_email_from/i3br9yr/
134,i37nsjn,,[deleted],[deleted],2,2022-04-03 11:35:16,<praw.models.comment_forest.CommentForest object at 0x000001BA5D2E3790>,tv2bip,Bitcoin,t5_2s3qj,,False,False,t3_tv2bip,t1_i37noqw,/r/Bitcoin/comments/tv2bip/warning_trezor_users_the_email_from/i37nsjn/
135,i3bx0td,RobSeller,"Not everytime Twitter tweet is right, sometime that's called promotion.","Not everytime Twitter tweet is right, sometime that's called promotion.",1,2022-04-04 09:01:17,<praw.models.comment_forest.CommentForest object at 0x000001BA5D2E3820>,tv2bip,Bitcoin,t5_2s3qj,,False,False,t3_tv2bip,t1_i37noqw,/r/Bitcoin/comments/tv2bip/warning_trezor_users_the_email_from/i3bx0td/
136,i38lv63,StoeTubby,"Definitely not a boomer, but if you are using that to describe someone who has the ability to use logic in an argument and not stoop to name calling and insults, then sure. Regardless of your age, grow up.","Definitely not a boomer, but if you are using that to describe someone who has the ability to use logic in an argument and not stoop to name calling and insults, then sure. Regardless of your age, grow up.",2,2022-04-03 16:23:27,<praw.models.comment_forest.CommentForest object at 0x000001BA5D2C4C70>,tv2bip,Bitcoin,t5_2s3qj,,False,False,t3_tv2bip,t1_i38lk0o,/r/Bitcoin/comments/tv2bip/warning_trezor_users_the_email_from/i38lv63/
137,i3c1znt,DankShibe,"Coldcard.  If I have actualy bought a BTC when I first learned about it (2014) , this is where I would store it. Sadly I  only bought a couple of sats 4 years later (all i could afford). Bitbox02 is also nice.

But Trezor still handles customer data way better than Ledger and they will release a wallet with an open source Secure chip this year or on 2023.","Coldcard.  If I have actualy bought a BTC when I first learned about it (2014) , this is where I would store it. Sadly I  only bought a couple of sats 4 years later (all i could afford). Bitbox02 is also nice.

But Trezor still handles customer data way better than Ledger and they will release a wallet with an open source Secure chip this year or on 2023.",2,2022-04-04 10:10:07,<praw.models.comment_forest.CommentForest object at 0x000001BA65CCC8B0>,tv2bip,Bitcoin,t5_2s3qj,,1649067331.0,False,t3_tv2bip,t1_i3b2r8h,/r/Bitcoin/comments/tv2bip/warning_trezor_users_the_email_from/i3c1znt/
138,i3bbfyy,380632513061,It is really a news to enjoy because we all are going to effected by it.,It is really a news to enjoy because we all are going to effected by it.,2,2022-04-04 04:28:54,<praw.models.comment_forest.CommentForest object at 0x000001BA5D2E38B0>,tv2bip,Bitcoin,t5_2s3qj,,False,False,t3_tv2bip,t1_i37nsjn,/r/Bitcoin/comments/tv2bip/warning_trezor_users_the_email_from/i3bbfyy/
139,i38m0uj,LoneWolfSpartan,Ok trezor Karen,Ok trezor Karen,-5,2022-04-03 16:24:32,<praw.models.comment_forest.CommentForest object at 0x000001BA5D2C4D30>,tv2bip,Bitcoin,t5_2s3qj,,False,False,t3_tv2bip,t1_i38lv63,/r/Bitcoin/comments/tv2bip/warning_trezor_users_the_email_from/i38m0uj/
140,i3dwhup,parkranger2000,Cool thx,Cool thx,1,2022-04-04 18:41:29,<praw.models.comment_forest.CommentForest object at 0x000001BA65CCC970>,tv2bip,Bitcoin,t5_2s3qj,,False,False,t3_tv2bip,t1_i3c1znt,/r/Bitcoin/comments/tv2bip/warning_trezor_users_the_email_from/i3dwhup/
141,hky4pyo,charlieecho,Thank you 1d account,Thank you 1d account,171,2021-11-17 04:12:03,<praw.models.comment_forest.CommentForest object at 0x000001BA5D2FB8E0>,qvpayn,Bitcoin,t5_2s3qj,,False,False,t3_qvpayn,t3_qvpayn,/r/Bitcoin/comments/qvpayn/i_still_believe_that_btc_can_reach_100000/hky4pyo/
142,hky6bma,Edvardoh,"Why tf is this trending, I honestly feel like this is a gpt3 AI bot","Why tf is this trending, I honestly feel like this is a gpt3 AI bot",140,2021-11-17 04:25:44,<praw.models.comment_forest.CommentForest object at 0x000001BA5D2FB940>,qvpayn,Bitcoin,t5_2s3qj,,False,False,t3_qvpayn,t3_qvpayn,/r/Bitcoin/comments/qvpayn/i_still_believe_that_btc_can_reach_100000/hky6bma/
143,hkydnga,,"Holy shit what are these absolute bs posts? Who cares what your beliefs are, you're just giving made up numbers with no actual logic or reasoning behind them. How is this a post??","Holy shit what are these absolute bs posts? Who cares what your beliefs are, you're just giving made up numbers with no actual logic or reasoning behind them. How is this a post??",49,2021-11-17 05:34:44,<praw.models.comment_forest.CommentForest object at 0x000001BA5D2FB9A0>,qvpayn,Bitcoin,t5_2s3qj,,False,False,t3_qvpayn,t3_qvpayn,/r/Bitcoin/comments/qvpayn/i_still_believe_that_btc_can_reach_100000/hkydnga/
144,hkxwlz6,BeOffendedDoughboy,"Bitcoin means the monetization of energy. If the world adopts bitcoin, which I believe is inevitable, it’s value is almost infinite.","Bitcoin means the monetization of energy. If the world adopts bitcoin, which I believe is inevitable, it’s value is almost infinite.",37,2021-11-17 03:07:26,<praw.models.comment_forest.CommentForest object at 0x000001BA5D2FBCA0>,qvpayn,Bitcoin,t5_2s3qj,,1637154524.0,False,t3_qvpayn,t3_qvpayn,/r/Bitcoin/comments/qvpayn/i_still_believe_that_btc_can_reach_100000/hkxwlz6/
145,hkxvqab,TheOpeningBell,Circular reasoning would dictate so. Why not a million?,Circular reasoning would dictate so. Why not a million?,10,2021-11-17 03:00:48,<praw.models.comment_forest.CommentForest object at 0x000001BA5D2FBE80>,qvpayn,Bitcoin,t5_2s3qj,,False,False,t3_qvpayn,t3_qvpayn,/r/Bitcoin/comments/qvpayn/i_still_believe_that_btc_can_reach_100000/hkxvqab/
146,hkyg00a,BashCo,Your comment belongs in the Daily Discussion thread instead of making a new post. Don't flag your posts as NSFW when they're not.,Your comment belongs in the Daily Discussion thread instead of making a new post. Don't flag your posts as NSFW when they're not.,9,2021-11-17 05:58:53,<praw.models.comment_forest.CommentForest object at 0x000001BA5A00F5E0>,qvpayn,Bitcoin,t5_2s3qj,moderator,False,False,t3_qvpayn,t3_qvpayn,/r/Bitcoin/comments/qvpayn/i_still_believe_that_btc_can_reach_100000/hkyg00a/
147,hkymatz,palpablefuckery,No shit… it’s inevitable,No shit… it’s inevitable,5,2021-11-17 07:10:55,<praw.models.comment_forest.CommentForest object at 0x000001BA5A00F760>,qvpayn,Bitcoin,t5_2s3qj,,False,False,t3_qvpayn,t3_qvpayn,/r/Bitcoin/comments/qvpayn/i_still_believe_that_btc_can_reach_100000/hkymatz/
148,hkxzzis,SamirSisaken,Why did you recommend buying btc from your friends? The whole idea is that btc is fungible.,Why did you recommend buying btc from your friends? The whole idea is that btc is fungible.,5,2021-11-17 03:33:37,<praw.models.comment_forest.CommentForest object at 0x000001BA5A00F940>,qvpayn,Bitcoin,t5_2s3qj,,False,False,t3_qvpayn,t3_qvpayn,/r/Bitcoin/comments/qvpayn/i_still_believe_that_btc_can_reach_100000/hkxzzis/
149,hkz0hhg,varikonniemi,"Oh come on now, when we go below 50k it's time for posts like this.","Oh come on now, when we go below 50k it's time for posts like this.",3,2021-11-17 10:25:30,<praw.models.comment_forest.CommentForest object at 0x000001BA5A00FB80>,qvpayn,Bitcoin,t5_2s3qj,,False,False,t3_qvpayn,t3_qvpayn,/r/Bitcoin/comments/qvpayn/i_still_believe_that_btc_can_reach_100000/hkz0hhg/
150,hkzxd5a,soldandrolled,Re-tard.,Re-tard.,3,2021-11-17 15:33:51,<praw.models.comment_forest.CommentForest object at 0x000001BA5A00FDC0>,qvpayn,Bitcoin,t5_2s3qj,,False,False,t3_qvpayn,t3_qvpayn,/r/Bitcoin/comments/qvpayn/i_still_believe_that_btc_can_reach_100000/hkzxd5a/
151,hl0npua,Redhead_Empire,AmZing,AmZing,3,2021-11-17 18:26:43,<praw.models.comment_forest.CommentForest object at 0x000001BA5A00FEE0>,qvpayn,Bitcoin,t5_2s3qj,,False,False,t3_qvpayn,t3_qvpayn,/r/Bitcoin/comments/qvpayn/i_still_believe_that_btc_can_reach_100000/hl0npua/
152,hkyt5l4,Western_Boris,"You feel like that now? FEEL???
You should educate yourself. Bitcoin has nothing to do with your feelings. It is an open source, hard coded asset class. A currency. Savings account saving everybody onboard from inflation.


You either understand Bitcoin or you don't. Feelings are not needed.


Does your feelings also state that suddenly after 100k everybody will stop appreciating this greatest currency what human kind has ever seen and price just magically stops from getting higher? So we would only maybe see 100k and thats it?


Fuck your feelings. Education is hard work. Just do it.","You feel like that now? FEEL???
You should educate yourself. Bitcoin has nothing to do with your feelings. It is an open source, hard coded asset class. A currency. Savings account saving everybody onboard from inflation.


You either understand Bitcoin or you don't. Feelings are not needed.


Does your feelings also state that suddenly after 100k everybody will stop appreciating this greatest currency what human kind has ever seen and price just magically stops from getting higher? So we would only maybe see 100k and thats it?


Fuck your feelings. Education is hard work. Just do it.",4,2021-11-17 08:41:46,<praw.models.comment_forest.CommentForest object at 0x000001BA5A00FF40>,qvpayn,Bitcoin,t5_2s3qj,,False,False,t3_qvpayn,t3_qvpayn,/r/Bitcoin/comments/qvpayn/i_still_believe_that_btc_can_reach_100000/hkyt5l4/
153,hky2w18,xrm550,Your reddit score is crazy. Just like you.,Your reddit score is crazy. Just like you.,2,2021-11-17 03:56:58,<praw.models.comment_forest.CommentForest object at 0x000001BA5A00FFA0>,qvpayn,Bitcoin,t5_2s3qj,,False,False,t3_qvpayn,t3_qvpayn,/r/Bitcoin/comments/qvpayn/i_still_believe_that_btc_can_reach_100000/hky2w18/
154,hkyc5h1,Overlord1241,Jesus approves.,Jesus approves.,2,2021-11-17 05:19:56,<praw.models.comment_forest.CommentForest object at 0x000001BA59B0B100>,qvpayn,Bitcoin,t5_2s3qj,,False,False,t3_qvpayn,t3_qvpayn,/r/Bitcoin/comments/qvpayn/i_still_believe_that_btc_can_reach_100000/hkyc5h1/
155,hkyhx6k,PassUpset5077,"I feel that it should exceed 100,000 U at the beginning of next year. At first, no one would believe btc, but they all felt that it was a bubble economy. Now, if we want to start again, the price is already high and the profit is relatively low.","I feel that it should exceed 100,000 U at the beginning of next year. At first, no one would believe btc, but they all felt that it was a bubble economy. Now, if we want to start again, the price is already high and the profit is relatively low.",2,2021-11-17 06:19:49,<praw.models.comment_forest.CommentForest object at 0x000001BA59B0B220>,qvpayn,Bitcoin,t5_2s3qj,,False,False,t3_qvpayn,t3_qvpayn,/r/Bitcoin/comments/qvpayn/i_still_believe_that_btc_can_reach_100000/hkyhx6k/
