,ID,Author,body,Comment,Score,Created On,Replies,Submission,Subreddit,Subreddit_ID,Distinguished,Edited,Is_submitter,link_id,Parent_id,Permalink
52,i3732fm,Wsemenske,"Sometimes, it could even just be phishing random emails hoping people have a Trezor account.","Sometimes, it could even just be phishing random emails hoping people have a Trezor account.",3,2022-04-03 06:55:45,<praw.models.comment_forest.CommentForest object at 0x000001BA5D2E30A0>,tv2bip,Bitcoin,t5_2s3qj,,False,False,t3_tv2bip,t1_i371pxt,/r/Bitcoin/comments/tv2bip/warning_trezor_users_the_email_from/i3732fm/
53,i3a605x,gjoonk,"But soon, and surely for once you will give your mail with your permission.","But soon, and surely for once you will give your mail with your permission.",1,2022-04-03 22:56:37,<praw.models.comment_forest.CommentForest object at 0x000001BA5D2E3100>,tv2bip,Bitcoin,t5_2s3qj,,False,False,t3_tv2bip,t1_i371pxt,/r/Bitcoin/comments/tv2bip/warning_trezor_users_the_email_from/i3a605x/
54,i3bc29s,odfxtrader,"Without everyone effort,we are not going be get secured.","Without everyone effort,we are not going be get secured.",1,2022-04-04 04:35:08,<praw.models.comment_forest.CommentForest object at 0x000001BA5D2E32E0>,tv2bip,Bitcoin,t5_2s3qj,,False,False,t3_tv2bip,t1_i37oef6,/r/Bitcoin/comments/tv2bip/warning_trezor_users_the_email_from/i3bc29s/
55,i3apv49,GangsterNsk,And in the end Reddit is the only place where user get its need fulfilled.,And in the end Reddit is the only place where user get its need fulfilled.,2,2022-04-04 01:28:49,<praw.models.comment_forest.CommentForest object at 0x000001BA5D2E33A0>,tv2bip,Bitcoin,t5_2s3qj,,False,False,t3_tv2bip,t1_i371e2m,/r/Bitcoin/comments/tv2bip/warning_trezor_users_the_email_from/i3apv49/
56,i37bv7x,,[deleted],[deleted],8,2022-04-03 08:53:08,<praw.models.comment_forest.CommentForest object at 0x000001BA5D2E3460>,tv2bip,Bitcoin,t5_2s3qj,,False,False,t3_tv2bip,t1_i37avg2,/r/Bitcoin/comments/tv2bip/warning_trezor_users_the_email_from/i37bv7x/
57,i3bi5ed,kwborg,"Their is nothing secured in their it world, everything gets tracked and saved.","Their is nothing secured in their it world, everything gets tracked and saved.",1,2022-04-04 05:40:54,<praw.models.comment_forest.CommentForest object at 0x000001BA5D2E34C0>,tv2bip,Bitcoin,t5_2s3qj,,False,False,t3_tv2bip,t1_i37avg2,/r/Bitcoin/comments/tv2bip/warning_trezor_users_the_email_from/i3bi5ed/
58,i3a7hdj,ipUnic0rn,The major issue is how they get our mail address even we would not get affected.,The major issue is how they get our mail address even we would not get affected.,1,2022-04-03 23:07:57,<praw.models.comment_forest.CommentForest object at 0x000001BA5D2E3940>,tv2bip,Bitcoin,t5_2s3qj,,False,False,t3_tv2bip,t1_i37d9u7,/r/Bitcoin/comments/tv2bip/warning_trezor_users_the_email_from/i3a7hdj/
59,i3auy9c,marclevine4,"Even you didn't get the mail,make sure to check your wallet for once.","Even you didn't get the mail,make sure to check your wallet for once.",1,2022-04-04 02:08:32,<praw.models.comment_forest.CommentForest object at 0x000001BA5D2E3A60>,tv2bip,Bitcoin,t5_2s3qj,,False,False,t3_tv2bip,t1_i38feo8,/r/Bitcoin/comments/tv2bip/warning_trezor_users_the_email_from/i3auy9c/
60,i3d0p0a,Photolunatic,Same,Same,1,2022-04-04 15:15:40,<praw.models.comment_forest.CommentForest object at 0x000001BA5D2E3B50>,tv2bip,Bitcoin,t5_2s3qj,,False,False,t3_tv2bip,t1_i38p6h5,/r/Bitcoin/comments/tv2bip/warning_trezor_users_the_email_from/i3d0p0a/
61,i3b9qlj,feliving,Not everyone is going to affected by these phising attacks.,Not everyone is going to affected by these phising attacks.,4,2022-04-04 04:12:17,<praw.models.comment_forest.CommentForest object at 0x000001BA5D2E3C40>,tv2bip,Bitcoin,t5_2s3qj,,False,False,t3_tv2bip,t1_i37c244,/r/Bitcoin/comments/tv2bip/warning_trezor_users_the_email_from/i3b9qlj/
62,i38d8r8,Photolunatic,And giving it away easily...,And giving it away easily...,2,2022-04-03 15:22:44,<praw.models.comment_forest.CommentForest object at 0x000001BA5D2E3D60>,tv2bip,Bitcoin,t5_2s3qj,,False,False,t3_tv2bip,t1_i37pd9s,/r/Bitcoin/comments/tv2bip/warning_trezor_users_the_email_from/i38d8r8/
63,i39pit2,victory2u,I hope afer these attacks people would have secured their wallet.,I hope afer these attacks people would have secured their wallet.,2,2022-04-03 20:56:31,<praw.models.comment_forest.CommentForest object at 0x000001BA5D2E3FA0>,tv2bip,Bitcoin,t5_2s3qj,,False,False,t3_tv2bip,t1_i377wdm,/r/Bitcoin/comments/tv2bip/warning_trezor_users_the_email_from/i39pit2/
64,i39cddf,VitalyKashin,This post is going to viral and so may be your comment too.,This post is going to viral and so may be your comment too.,1,2022-04-03 19:25:09,<praw.models.comment_forest.CommentForest object at 0x000001BA5D2C4070>,tv2bip,Bitcoin,t5_2s3qj,,False,False,t3_tv2bip,t1_i3792u0,/r/Bitcoin/comments/tv2bip/warning_trezor_users_the_email_from/i39cddf/
65,i3bhwx2,rancor60,May be their would be some breach in their data centers or something like that.,May be their would be some breach in their data centers or something like that.,1,2022-04-04 05:38:10,<praw.models.comment_forest.CommentForest object at 0x000001BA5D2C4130>,tv2bip,Bitcoin,t5_2s3qj,,False,False,t3_tv2bip,t1_i37jyck,/r/Bitcoin/comments/tv2bip/warning_trezor_users_the_email_from/i3bhwx2/
66,i3ahh26,karavaichernyi,Hardware wallet is always a best alternative in place of online wallet.,Hardware wallet is always a best alternative in place of online wallet.,1,2022-04-04 00:25:20,<praw.models.comment_forest.CommentForest object at 0x000001BA5D2C41F0>,tv2bip,Bitcoin,t5_2s3qj,,False,False,t3_tv2bip,t1_i37opop,/r/Bitcoin/comments/tv2bip/warning_trezor_users_the_email_from/i3ahh26/
67,i3bp2xj,SteppenWolfVG,What will happen if their is some breck in Amazon database center.,What will happen if their is some breck in Amazon database center.,1,2022-04-04 07:08:00,<praw.models.comment_forest.CommentForest object at 0x000001BA5D2C42B0>,tv2bip,Bitcoin,t5_2s3qj,,False,False,t3_tv2bip,t1_i3864oz,/r/Bitcoin/comments/tv2bip/warning_trezor_users_the_email_from/i3bp2xj/
68,i3cuiuk,ubring,"Buying from Amazon is potentially worse! It's well known, and been raised as a concern by several in the crypto community that Amazon accepts products from multiple sellers and commingles them in the same bin to be sold. 

Someone could, and if I understand correctly has, signed up as a seller on Amazon, and put hardware wallets for sale that had been compromised with malicious software.  When a user buys that wallet and puts funds on it the seller can drain it. Since Amazon commingles the product they don't know who the bad actor is and it continues.","Buying from Amazon is potentially worse! It's well known, and been raised as a concern by several in the crypto community that Amazon accepts products from multiple sellers and commingles them in the same bin to be sold. 

Someone could, and if I understand correctly has, signed up as a seller on Amazon, and put hardware wallets for sale that had been compromised with malicious software.  When a user buys that wallet and puts funds on it the seller can drain it. Since Amazon commingles the product they don't know who the bad actor is and it continues.",1,2022-04-04 14:33:10,<praw.models.comment_forest.CommentForest object at 0x000001BA5D2C4310>,tv2bip,Bitcoin,t5_2s3qj,,False,False,t3_tv2bip,t1_i3864oz,/r/Bitcoin/comments/tv2bip/warning_trezor_users_the_email_from/i3cuiuk/
69,i38dfu6,Photolunatic,let alone they lost MY data that I did not even want them to keep after the order arrived.,let alone they lost MY data that I did not even want them to keep after the order arrived.,3,2022-04-03 15:24:11,<praw.models.comment_forest.CommentForest object at 0x000001BA5D2C4490>,tv2bip,Bitcoin,t5_2s3qj,,False,False,t3_tv2bip,t1_i3878qi,/r/Bitcoin/comments/tv2bip/warning_trezor_users_the_email_from/i38dfu6/
70,i3boqrb,pavbutorin,Buying email stuffs from dark web is actually not a big deal after all.,Buying email stuffs from dark web is actually not a big deal after all.,1,2022-04-04 07:03:35,<praw.models.comment_forest.CommentForest object at 0x000001BA5D2C44F0>,tv2bip,Bitcoin,t5_2s3qj,,False,False,t3_tv2bip,t1_i3878qi,/r/Bitcoin/comments/tv2bip/warning_trezor_users_the_email_from/i3boqrb/
71,i37mhm6,SpecialX,That is correct. It's a scam.,That is correct. It's a scam.,3,2022-04-03 11:18:47,<praw.models.comment_forest.CommentForest object at 0x000001BA5D2C4730>,tv2bip,Bitcoin,t5_2s3qj,,False,False,t3_tv2bip,t1_i37l8gh,/r/Bitcoin/comments/tv2bip/warning_trezor_users_the_email_from/i37mhm6/
72,i39tvb4,btcevester,The best would be to change email address and make it secure again.,The best would be to change email address and make it secure again.,1,2022-04-03 21:27:38,<praw.models.comment_forest.CommentForest object at 0x000001BA5D2C4790>,tv2bip,Bitcoin,t5_2s3qj,,False,False,t3_tv2bip,t1_i37l8gh,/r/Bitcoin/comments/tv2bip/warning_trezor_users_the_email_from/i39tvb4/
73,i38ef1u,StoeTubby,"Lol, how easily forgotten the 10x worse hack that Ledger suffered like a year or two ago where they leaked email address and physical shipping addresses. But this recent Trezor leak related to newsletters is why you went with Ledger. Ok.","Lol, how easily forgotten the 10x worse hack that Ledger suffered like a year or two ago where they leaked email address and physical shipping addresses. But this recent Trezor leak related to newsletters is why you went with Ledger. Ok.",5,2022-04-03 15:31:15,<praw.models.comment_forest.CommentForest object at 0x000001BA5D2C4970>,tv2bip,Bitcoin,t5_2s3qj,,False,False,t3_tv2bip,t1_i3884np,/r/Bitcoin/comments/tv2bip/warning_trezor_users_the_email_from/i38ef1u/
74,i38di21,Photolunatic,Why?,Why?,1,2022-04-03 15:24:37,<praw.models.comment_forest.CommentForest object at 0x000001BA5D2C49D0>,tv2bip,Bitcoin,t5_2s3qj,,False,False,t3_tv2bip,t1_i3884np,/r/Bitcoin/comments/tv2bip/warning_trezor_users_the_email_from/i38di21/
75,i38eyrp,StoeTubby,"It's a good question, I don't think they should be for security purposes. For Trezor the main use is to give updates about the suite and notify when to update suite and your firmware. Both of those things can occur whenever you try to open up the Trezor suite it already prompts you. So if you did the right thing and verified the suite set up then it will notify you when to update already without emails. Sure they can't promote other stuff as well, but they should be fully dedicated to absolute security as that is what people look to them for.","It's a good question, I don't think they should be for security purposes. For Trezor the main use is to give updates about the suite and notify when to update suite and your firmware. Both of those things can occur whenever you try to open up the Trezor suite it already prompts you. So if you did the right thing and verified the suite set up then it will notify you when to update already without emails. Sure they can't promote other stuff as well, but they should be fully dedicated to absolute security as that is what people look to them for.",1,2022-04-03 15:35:10,<praw.models.comment_forest.CommentForest object at 0x000001BA5D2C4C10>,tv2bip,Bitcoin,t5_2s3qj,,False,False,t3_tv2bip,t1_i389yhw,/r/Bitcoin/comments/tv2bip/warning_trezor_users_the_email_from/i38eyrp/
76,i3btjsy,jeffmaster84,"Hope so,you will not do these type of mistakes again.","Hope so,you will not do these type of mistakes again.",2,2022-04-04 08:10:46,<praw.models.comment_forest.CommentForest object at 0x000001BA65CDA970>,tv2bip,Bitcoin,t5_2s3qj,,False,False,t3_tv2bip,t1_i3892ae,/r/Bitcoin/comments/tv2bip/warning_trezor_users_the_email_from/i3btjsy/
77,i3bhvgw,umutozk,"Address of e-mail is going to tell,it is really fake or not.","Address of e-mail is going to tell,it is really fake or not.",2,2022-04-04 05:37:41,<praw.models.comment_forest.CommentForest object at 0x000001BA65CDAB50>,tv2bip,Bitcoin,t5_2s3qj,,False,False,t3_tv2bip,t1_i371dae,/r/Bitcoin/comments/tv2bip/warning_trezor_users_the_email_from/i3bhvgw/
78,i3aq3h3,dsfgewfwe,And still some people mistakes by clicking fishing links.,And still some people mistakes by clicking fishing links.,1,2022-04-04 01:30:35,<praw.models.comment_forest.CommentForest object at 0x000001BA65CDACD0>,tv2bip,Bitcoin,t5_2s3qj,,False,False,t3_tv2bip,t1_i370yzk,/r/Bitcoin/comments/tv2bip/warning_trezor_users_the_email_from/i3aq3h3/
79,i3ac5dv,malcovich1999,"These things needs to learn by everyone,who uses their mail regularly.","These things needs to learn by everyone,who uses their mail regularly.",4,2022-04-03 23:44:19,<praw.models.comment_forest.CommentForest object at 0x000001BA65CDADF0>,tv2bip,Bitcoin,t5_2s3qj,,False,False,t3_tv2bip,t1_i37bc97,/r/Bitcoin/comments/tv2bip/warning_trezor_users_the_email_from/i3ac5dv/
80,i37cqqh,lakimens,"And some people fall for even the weakest phishing links, like a weebly/wix site on a weebly/wix domain with just basic no-style username/password fields asking for their service username and password.","And some people fall for even the weakest phishing links, like a weebly/wix site on a weebly/wix domain with just basic no-style username/password fields asking for their service username and password.",5,2022-04-03 09:05:24,<praw.models.comment_forest.CommentForest object at 0x000001BA65CDAE50>,tv2bip,Bitcoin,t5_2s3qj,,False,False,t3_tv2bip,t1_i37bc97,/r/Bitcoin/comments/tv2bip/warning_trezor_users_the_email_from/i37cqqh/
81,i37bm7g,dlogemann,Please don't open the link and check the URL afterwards. Don't open the link *at all*! Always open security/banking/money or similar websites in a new browser window only by using a bookmark or by typing the URL manually all by yourself. This also prevents you from getting phished by Google or other search engine ads.,Please don't open the link and check the URL afterwards. Don't open the link *at all*! Always open security/banking/money or similar websites in a new browser window only by using a bookmark or by typing the URL manually all by yourself. This also prevents you from getting phished by Google or other search engine ads.,17,2022-04-03 08:49:41,<praw.models.comment_forest.CommentForest object at 0x000001BA65CCC070>,tv2bip,Bitcoin,t5_2s3qj,,False,False,t3_tv2bip,t1_i3784pd,/r/Bitcoin/comments/tv2bip/warning_trezor_users_the_email_from/i37bm7g/
82,i3h3h64,devonthed00d,It’s half realistic. But Dot US is just lame in any scenario.,It’s half realistic. But Dot US is just lame in any scenario.,1,2022-04-05 10:55:36,<praw.models.comment_forest.CommentForest object at 0x000001BA65CCC430>,tv2bip,Bitcoin,t5_2s3qj,,1649156316.0,False,t3_tv2bip,t1_i3ahjlp,/r/Bitcoin/comments/tv2bip/warning_trezor_users_the_email_from/i3h3h64/
83,i39jzz8,timizer,Nobody signs up for MailChimp anything. You were signed up for it automatically when you gave Trezor your email.,Nobody signs up for MailChimp anything. You were signed up for it automatically when you gave Trezor your email.,2,2022-04-03 20:17:34,<praw.models.comment_forest.CommentForest object at 0x000001BA65CCC550>,tv2bip,Bitcoin,t5_2s3qj,,False,False,t3_tv2bip,t1_i37os9z,/r/Bitcoin/comments/tv2bip/warning_trezor_users_the_email_from/i39jzz8/
84,i37pf18,DankShibe,"Well even the largest coorporations of tech world(with far more resources and security on their disposal than trezor) have suffered breaches. For a company like trezzor to last for that long before a data compromise , it is still good performance.","Well even the largest coorporations of tech world(with far more resources and security on their disposal than trezor) have suffered breaches. For a company like trezzor to last for that long before a data compromise , it is still good performance.",4,2022-04-03 11:54:31,<praw.models.comment_forest.CommentForest object at 0x000001BA65CCC5B0>,tv2bip,Bitcoin,t5_2s3qj,,False,False,t3_tv2bip,t1_i37os9z,/r/Bitcoin/comments/tv2bip/warning_trezor_users_the_email_from/i37pf18/
85,i3bsmh9,RezaHussain2,Someone can buy thousands of address in a dollar or two.,Someone can buy thousands of address in a dollar or two.,1,2022-04-04 07:57:26,<praw.models.comment_forest.CommentForest object at 0x000001BA65CCC610>,tv2bip,Bitcoin,t5_2s3qj,,False,False,t3_tv2bip,t1_i37os9z,/r/Bitcoin/comments/tv2bip/warning_trezor_users_the_email_from/i3bsmh9/
86,i3br5ul,ilega_dh,"I do not. I’m using my own domain so every service has it’s own email address. For example: trezor@domain.com. 

If you ever receive spam, you can see exactly who leaked or sold your data.","I do not. I’m using my own domain so every service has it’s own email address. For example: trezor@domain.com. 

If you ever receive spam, you can see exactly who leaked or sold your data.",1,2022-04-04 07:36:43,<praw.models.comment_forest.CommentForest object at 0x000001BA65CCCA90>,tv2bip,Bitcoin,t5_2s3qj,,False,False,t3_tv2bip,t1_i3bbxo3,/r/Bitcoin/comments/tv2bip/warning_trezor_users_the_email_from/i3br5ul/
87,i37p4ax,Photolunatic,Crypto hardware company using Mailchimp for email. Such a noobs. I am seriously dissapointed.,Crypto hardware company using Mailchimp for email. Such a noobs. I am seriously dissapointed.,4,2022-04-03 11:51:03,<praw.models.comment_forest.CommentForest object at 0x000001BA65CCCBB0>,tv2bip,Bitcoin,t5_2s3qj,,False,False,t3_tv2bip,t1_i37emgf,/r/Bitcoin/comments/tv2bip/warning_trezor_users_the_email_from/i37p4ax/
88,i3aldip,shawn6502,Nothing is secured in this technological world even our mailbox too.,Nothing is secured in this technological world even our mailbox too.,1,2022-04-04 00:55:02,<praw.models.comment_forest.CommentForest object at 0x000001BA65CCCC10>,tv2bip,Bitcoin,t5_2s3qj,,False,False,t3_tv2bip,t1_i37emgf,/r/Bitcoin/comments/tv2bip/warning_trezor_users_the_email_from/i3aldip/
89,i3a8kbj,Spartan3123,That won't help unless you use something like coinswaps or mixing,That won't help unless you use something like coinswaps or mixing,1,2022-04-03 23:16:16,<praw.models.comment_forest.CommentForest object at 0x000001BA65CCCF10>,tv2bip,Bitcoin,t5_2s3qj,,False,False,t3_tv2bip,t1_i39k1me,/r/Bitcoin/comments/tv2bip/warning_trezor_users_the_email_from/i3a8kbj/
90,i3c8e8j,Spartan3123,Haha save that email to make it more legit lol,Haha save that email to make it more legit lol,1,2022-04-04 11:26:30,<praw.models.comment_forest.CommentForest object at 0x000001BA65CCCFD0>,tv2bip,Bitcoin,t5_2s3qj,,False,False,t3_tv2bip,t1_i3c84pr,/r/Bitcoin/comments/tv2bip/warning_trezor_users_the_email_from/i3c8e8j/
91,i387mox,,[deleted],[deleted],3,2022-04-03 14:41:05,<praw.models.comment_forest.CommentForest object at 0x000001BA5D2E3160>,tv2bip,Bitcoin,t5_2s3qj,,False,False,t3_tv2bip,t1_i3732fm,/r/Bitcoin/comments/tv2bip/warning_trezor_users_the_email_from/i387mox/
92,i3bdg7q,dankie44,Phising is a old technology but still u think it get it work done.,Phising is a old technology but still u think it get it work done.,1,2022-04-04 04:49:24,<praw.models.comment_forest.CommentForest object at 0x000001BA5D2E31C0>,tv2bip,Bitcoin,t5_2s3qj,,False,False,t3_tv2bip,t1_i3732fm,/r/Bitcoin/comments/tv2bip/warning_trezor_users_the_email_from/i3bdg7q/
93,i37dck5,sonastyinc,"That's not good. I have both Ledger and Trezor wallets. Hope the hackers didn't get their hands on our residential address as well. I've moved since the Ledger hack (not because of it), and now Trezor got hacked.","That's not good. I have both Ledger and Trezor wallets. Hope the hackers didn't get their hands on our residential address as well. I've moved since the Ledger hack (not because of it), and now Trezor got hacked.",2,2022-04-03 09:13:55,<praw.models.comment_forest.CommentForest object at 0x000001BA5D2E3550>,tv2bip,Bitcoin,t5_2s3qj,,False,False,t3_tv2bip,t1_i37bv7x,/r/Bitcoin/comments/tv2bip/warning_trezor_users_the_email_from/i37dck5/
94,i3bimxx,jamiewelsh1183,"Now what I think is,that's not a big deal and it happens with everyone.","Now what I think is,that's not a big deal and it happens with everyone.",1,2022-04-04 05:46:43,<praw.models.comment_forest.CommentForest object at 0x000001BA5D2E35B0>,tv2bip,Bitcoin,t5_2s3qj,,False,False,t3_tv2bip,t1_i37bv7x,/r/Bitcoin/comments/tv2bip/warning_trezor_users_the_email_from/i3bimxx/
95,i3ai0yi,DarkSyde3000, Breached a database, Breached a database,1,2022-04-04 00:29:38,<praw.models.comment_forest.CommentForest object at 0x000001BA5D2E3A00>,tv2bip,Bitcoin,t5_2s3qj,,False,False,t3_tv2bip,t1_i3a7hdj,/r/Bitcoin/comments/tv2bip/warning_trezor_users_the_email_from/i3ai0yi/
96,i3bqdc3,iamjide91,Yeah. You are right. Thanks anyway.,Yeah. You are right. Thanks anyway.,1,2022-04-04 07:25:41,<praw.models.comment_forest.CommentForest object at 0x000001BA5D2E3D00>,tv2bip,Bitcoin,t5_2s3qj,,False,False,t3_tv2bip,t1_i3b9qlj,/r/Bitcoin/comments/tv2bip/warning_trezor_users_the_email_from/i3bqdc3/
97,i3agjul,Diogom11,Buying email address in bulk in not a big address in this techy world.,Buying email address in bulk in not a big address in this techy world.,2,2022-04-04 00:18:18,<praw.models.comment_forest.CommentForest object at 0x000001BA5D2E3E20>,tv2bip,Bitcoin,t5_2s3qj,,False,False,t3_tv2bip,t1_i38d8r8,/r/Bitcoin/comments/tv2bip/warning_trezor_users_the_email_from/i3agjul/
98,i3bs7wn,Gandhi70,"Bad luck. But 1) is a break in imho not that likely,  because amazon has a lot more ressources to secure their data and 2) would the information about my ledger purchase only be a small part of all purchase information.  The needle in the haystack so to say. While during the ledger breach the purchase information was THE only relevant information.","Bad luck. But 1) is a break in imho not that likely,  because amazon has a lot more ressources to secure their data and 2) would the information about my ledger purchase only be a small part of all purchase information.  The needle in the haystack so to say. While during the ledger breach the purchase information was THE only relevant information.",1,2022-04-04 07:51:37,<praw.models.comment_forest.CommentForest object at 0x000001BA5D2C4370>,tv2bip,Bitcoin,t5_2s3qj,,False,False,t3_tv2bip,t1_i3bp2xj,/r/Bitcoin/comments/tv2bip/warning_trezor_users_the_email_from/i3bs7wn/
99,i3dhlc0,Gandhi70,"It was from Amazon Ledger store, an original sealed package and of course no pre installed seed.
Only chance this was tampered with would have been a hardware modification/hack of the Ledger device itself which is not impossible but very very hard and unheard of until today.

You cannot simply install a ""compromised software"" on the ledger.","It was from Amazon Ledger store, an original sealed package and of course no pre installed seed.
Only chance this was tampered with would have been a hardware modification/hack of the Ledger device itself which is not impossible but very very hard and unheard of until today.

You cannot simply install a ""compromised software"" on the ledger.",1,2022-04-04 17:06:10,<praw.models.comment_forest.CommentForest object at 0x000001BA5D2C4430>,tv2bip,Bitcoin,t5_2s3qj,,False,False,t3_tv2bip,t1_i3cuiuk,/r/Bitcoin/comments/tv2bip/warning_trezor_users_the_email_from/i3dhlc0/
100,i3utfnj,time_wasted504,"OH SHIT.

Thats no good. Its not really Trezor at fault here, its the fact they used MailChimp. (but by proxy they are at fault for trusting users data to a third party)

Dont Trust.......

They fucked up.","OH SHIT.

Thats no good. Its not really Trezor at fault here, its the fact they used MailChimp. (but by proxy they are at fault for trusting users data to a third party)

Dont Trust.......

They fucked up.",2,2022-04-08 03:45:32,<praw.models.comment_forest.CommentForest object at 0x000001BA5D2C4550>,tv2bip,Bitcoin,t5_2s3qj,,False,False,t3_tv2bip,t1_i38dfu6,/r/Bitcoin/comments/tv2bip/warning_trezor_users_the_email_from/i3utfnj/
101,i37mmt9,lexshotit,"Yeah I'm aware, just saying that if I had received this email it would be pretty obvious it's a scam because Trezor also knows my wallet isn't attached to an email address so wouldn't be saying that in an email.","Yeah I'm aware, just saying that if I had received this email it would be pretty obvious it's a scam because Trezor also knows my wallet isn't attached to an email address so wouldn't be saying that in an email.",3,2022-04-03 11:20:37,<praw.models.comment_forest.CommentForest object at 0x000001BA5D2C47F0>,tv2bip,Bitcoin,t5_2s3qj,,False,False,t3_tv2bip,t1_i37mhm6,/r/Bitcoin/comments/tv2bip/warning_trezor_users_the_email_from/i37mmt9/
102,i3b8twu,mdafos,"We need to see,.how many is going to be scammed from these attacks.","We need to see,.how many is going to be scammed from these attacks.",1,2022-04-04 04:03:41,<praw.models.comment_forest.CommentForest object at 0x000001BA5D2C4850>,tv2bip,Bitcoin,t5_2s3qj,,False,False,t3_tv2bip,t1_i37mhm6,/r/Bitcoin/comments/tv2bip/warning_trezor_users_the_email_from/i3b8twu/
103,i38ek5f,LoneWolfSpartan,I went with ledger way before this incident but ok Boomer. Ledger #1,I went with ledger way before this incident but ok Boomer. Ledger #1,-8,2022-04-03 15:32:16,<praw.models.comment_forest.CommentForest object at 0x000001BA5D2C4A30>,tv2bip,Bitcoin,t5_2s3qj,,False,False,t3_tv2bip,t1_i38ef1u,/r/Bitcoin/comments/tv2bip/warning_trezor_users_the_email_from/i38ek5f/
104,i3bnf5s,coinjaf,Even with the right email address it can still be fake!,Even with the right email address it can still be fake!,1,2022-04-04 06:46:20,<praw.models.comment_forest.CommentForest object at 0x000001BA65CDAC10>,tv2bip,Bitcoin,t5_2s3qj,,False,False,t3_tv2bip,t1_i3bhvgw,/r/Bitcoin/comments/tv2bip/warning_trezor_users_the_email_from/i3bnf5s/
