,ID,Author,body,Comment,Score,Created On,Replies,Submission,Subreddit,Subreddit_ID,Distinguished,Edited,Is_submitter,link_id,Parent_id,Permalink
689,hu4tuvt,,[removed],[removed],-1,2022-01-25 09:28:23,<praw.models.comment_forest.CommentForest object at 0x000002541EB4D8E0>,sc0b8p,movies,t5_2qh3s,,False,False,t3_sc0b8p,t1_hu4tqat,/r/movies/comments/sc0b8p/batgirl_officially_casts_ivory_aquino_as_first/hu4tuvt/
690,hu4s1b0,,[removed],[removed],0,2022-01-25 09:03:34,<praw.models.comment_forest.CommentForest object at 0x000002541CF56B50>,sc0b8p,movies,t5_2qh3s,,False,False,t3_sc0b8p,t1_hu4qr2g,/r/movies/comments/sc0b8p/batgirl_officially_casts_ivory_aquino_as_first/hu4s1b0/
691,hu3umg0,Matictac,I think the reee's are here.,I think the reee's are here.,-6,2022-01-25 03:23:15,<praw.models.comment_forest.CommentForest object at 0x000002547F6F9BE0>,sc0b8p,movies,t5_2qh3s,,False,False,t3_sc0b8p,t1_hu3shrf,/r/movies/comments/sc0b8p/batgirl_officially_casts_ivory_aquino_as_first/hu3umg0/
692,hu7n2tr,lchizu,"Why?  Because im sick of the racism against asian men by hollywood

Give a reason little boy, dont leave it as a fucking quip, or is that all you nerds are capable of?","Why?  Because im sick of the racism against asian men by hollywood

Give a reason little boy, dont leave it as a fucking quip, or is that all you nerds are capable of?",0,2022-01-25 22:08:45,<praw.models.comment_forest.CommentForest object at 0x000002541EB59A00>,sc0b8p,movies,t5_2qh3s,,False,False,t3_sc0b8p,t1_hu7lda6,/r/movies/comments/sc0b8p/batgirl_officially_casts_ivory_aquino_as_first/hu7n2tr/
693,hu5aygn,KillerAssassin13,"No, because I'm not a fan of Gail Simone, the creater of the character. It has nothing to do with being trans or not. I didn't say there was anything wrong.","No, because I'm not a fan of Gail Simone, the creater of the character. It has nothing to do with being trans or not. I didn't say there was anything wrong.",4,2022-01-25 12:54:02,<praw.models.comment_forest.CommentForest object at 0x000002541EB3FE80>,sc0b8p,movies,t5_2qh3s,,False,False,t3_sc0b8p,t1_hu59rmg,/r/movies/comments/sc0b8p/batgirl_officially_casts_ivory_aquino_as_first/hu5aygn/
694,huk0szr,,DC = Double Cunt,DC = Double Cunt,2,2022-01-28 07:37:40,<praw.models.comment_forest.CommentForest object at 0x000002541F816F40>,sc0b8p,movies,t5_2qh3s,,False,False,t3_sc0b8p,t1_hu7ehg5,/r/movies/comments/sc0b8p/batgirl_officially_casts_ivory_aquino_as_first/huk0szr/
695,hu5d3f6,DooDooSlinger,Is joke,Is joke,24,2022-01-25 13:13:32,<praw.models.comment_forest.CommentForest object at 0x000002541F81D160>,sc0b8p,movies,t5_2qh3s,,False,False,t3_sc0b8p,t1_hu5945g,/r/movies/comments/sc0b8p/batgirl_officially_casts_ivory_aquino_as_first/hu5d3f6/
696,hu5qwt5,,T'was a joke,T'was a joke,3,2022-01-25 14:59:40,<praw.models.comment_forest.CommentForest object at 0x000002541F81D1C0>,sc0b8p,movies,t5_2qh3s,,False,False,t3_sc0b8p,t1_hu5945g,/r/movies/comments/sc0b8p/batgirl_officially_casts_ivory_aquino_as_first/hu5qwt5/
697,hu66cwh,Maclimes,"Can you imagine if Marvel released a Captain America movie that had nothing to do with the MCU? Just a stand alone thing, new actors, new stories, completely unconnected to the existing and ongoing cinematic universe? People's minds would shatter. But if DC does that with Batman (and in fact, are doing exactly that), people say ""Cool! Batman!"" and go watch it.","Can you imagine if Marvel released a Captain America movie that had nothing to do with the MCU? Just a stand alone thing, new actors, new stories, completely unconnected to the existing and ongoing cinematic universe? People's minds would shatter. But if DC does that with Batman (and in fact, are doing exactly that), people say ""Cool! Batman!"" and go watch it.",8,2022-01-25 16:39:40,<praw.models.comment_forest.CommentForest object at 0x000002541F81D460>,sc0b8p,movies,t5_2qh3s,,False,False,t3_sc0b8p,t1_hu656pe,/r/movies/comments/sc0b8p/batgirl_officially_casts_ivory_aquino_as_first/hu66cwh/
698,hu7a6nk,SlowMoFoSho,">For Marvel we want not only the MCU to be in line with one another, we want the shows to line up as well. We want a connection to everything.

And they want teasers and foreshadowing in movies that set up other movies that won't come out for two years, demand post credits scenes in EVERY fucking movie whether it takes places in the MCU or not, etc.

I like the Marvel movies, I do not like some of the expectations that the films have given many people in the audience that should NOT necessarily apply to other movies. We have a whole generation of people who think that the MCU is _peak cinema_ because they're flashy and fun and features likable characters and it's really just a big bucket of bubble gum and that's fine.... but the very best movies offer something more. I'm not being a hater, I like them, I just think they're overrated as movies, as in the art of movies, as pretentious as I know that sounds.",">For Marvel we want not only the MCU to be in line with one another, we want the shows to line up as well. We want a connection to everything.

And they want teasers and foreshadowing in movies that set up other movies that won't come out for two years, demand post credits scenes in EVERY fucking movie whether it takes places in the MCU or not, etc.

I like the Marvel movies, I do not like some of the expectations that the films have given many people in the audience that should NOT necessarily apply to other movies. We have a whole generation of people who think that the MCU is _peak cinema_ because they're flashy and fun and features likable characters and it's really just a big bucket of bubble gum and that's fine.... but the very best movies offer something more. I'm not being a hater, I like them, I just think they're overrated as movies, as in the art of movies, as pretentious as I know that sounds.",5,2022-01-25 20:46:35,<praw.models.comment_forest.CommentForest object at 0x000002541F81D4C0>,sc0b8p,movies,t5_2qh3s,,False,False,t3_sc0b8p,t1_hu656pe,/r/movies/comments/sc0b8p/batgirl_officially_casts_ivory_aquino_as_first/hu7a6nk/
699,hu7l5zz,inksmudgedhands,"Just take to faith that unless the DC movie actually, physically says that it is connected to another DC movie, it is a stand alone movie. 

Just like how everyone saw Joker and never shelved it with the Snyderverse. That movie, Joker, was its own thing.","Just take to faith that unless the DC movie actually, physically says that it is connected to another DC movie, it is a stand alone movie. 

Just like how everyone saw Joker and never shelved it with the Snyderverse. That movie, Joker, was its own thing.",1,2022-01-25 21:56:03,<praw.models.comment_forest.CommentForest object at 0x000002541AF74820>,sc0b8p,movies,t5_2qh3s,,False,False,t3_sc0b8p,t1_hu701pg,/r/movies/comments/sc0b8p/batgirl_officially_casts_ivory_aquino_as_first/hu7l5zz/
700,hu6ayzk,dicedaman,"> How about in Iron Man S.H.I.E.L.D is a new organization, while in later movies it's been around since after WW2.

Huh? Nobody claims it's new organisation in IM1. Maybe you're thinking of Pepper saying the name is a mouthful and Coulson saying they're ""working on it""? Easy to write that off as being the default Shield response, there's nothing in IM1 that actually contradicts their post-WWII origins.

> After Eternals Ego being a Celestial becomes rather confusing cause he neither looks or acts like any of the other ones we have seen and don't really inhabit the same kind of powers.

Because Ego is the brain (or maybe soul) of a celestial without a physical form. How he lost his body we don't know, even Ego doesn't know. But Eternals didn't change or contradict anything. We already saw a celestial in physical form in GotG 1, not to mention Knowhere being the skull of a celestial (possibly even Ego's skull, who knows).

> Agents of S.H.I.E.L.D was canon until it wasn't, same with Agent Carter. All the Netflix shows were Canon, then they weren't and now they have started using actors from those shows in the mainline MCU so now the canonicity is unknown.

None of the Marvel Television productions have ever been confirmed by Fiege to be canon to the MCU, they've always just existed in a sort of Schrodinger's canon limbo. It might be frustrating if you're a fan of those shows but Marvel Studios have never been inconsistent about them because they've never actually addressed them. That might be changing with certain recent character appearances but we'll have to wait to see what they actually confirm as canon.","> How about in Iron Man S.H.I.E.L.D is a new organization, while in later movies it's been around since after WW2.

Huh? Nobody claims it's new organisation in IM1. Maybe you're thinking of Pepper saying the name is a mouthful and Coulson saying they're ""working on it""? Easy to write that off as being the default Shield response, there's nothing in IM1 that actually contradicts their post-WWII origins.

> After Eternals Ego being a Celestial becomes rather confusing cause he neither looks or acts like any of the other ones we have seen and don't really inhabit the same kind of powers.

Because Ego is the brain (or maybe soul) of a celestial without a physical form. How he lost his body we don't know, even Ego doesn't know. But Eternals didn't change or contradict anything. We already saw a celestial in physical form in GotG 1, not to mention Knowhere being the skull of a celestial (possibly even Ego's skull, who knows).

> Agents of S.H.I.E.L.D was canon until it wasn't, same with Agent Carter. All the Netflix shows were Canon, then they weren't and now they have started using actors from those shows in the mainline MCU so now the canonicity is unknown.

None of the Marvel Television productions have ever been confirmed by Fiege to be canon to the MCU, they've always just existed in a sort of Schrodinger's canon limbo. It might be frustrating if you're a fan of those shows but Marvel Studios have never been inconsistent about them because they've never actually addressed them. That might be changing with certain recent character appearances but we'll have to wait to see what they actually confirm as canon.",4,2022-01-25 17:08:18,<praw.models.comment_forest.CommentForest object at 0x0000025419330040>,sc0b8p,movies,t5_2qh3s,,False,False,t3_sc0b8p,t1_hu5cm7f,/r/movies/comments/sc0b8p/batgirl_officially_casts_ivory_aquino_as_first/hu6ayzk/
701,hu6leal,MrFluffykins,"How odd, Keaton is great but he's gotta be what, 65? 70? I can't imagine they don't do something Batman Beyond style and have him pass the cowl.","How odd, Keaton is great but he's gotta be what, 65? 70? I can't imagine they don't do something Batman Beyond style and have him pass the cowl.",3,2022-01-25 18:12:01,<praw.models.comment_forest.CommentForest object at 0x000002541F81D820>,sc0b8p,movies,t5_2qh3s,,False,False,t3_sc0b8p,t1_hu6l8lb,/r/movies/comments/sc0b8p/batgirl_officially_casts_ivory_aquino_as_first/hu6leal/
702,hu5lky4,danksquirrel,"For sure, I’m a massive marvel fanboy too, just not necessarily for Disney keeping such a tight lock on the marvel brand.  If they owned Spider-Man like everyone wanted, into the spiderverse never would have been made.

(Also doom patrol 👌)","For sure, I’m a massive marvel fanboy too, just not necessarily for Disney keeping such a tight lock on the marvel brand.  If they owned Spider-Man like everyone wanted, into the spiderverse never would have been made.

(Also doom patrol 👌)",0,2022-01-25 14:21:35,<praw.models.comment_forest.CommentForest object at 0x000002541F814640>,sc0b8p,movies,t5_2qh3s,,False,False,t3_sc0b8p,t1_hu5l4pw,/r/movies/comments/sc0b8p/batgirl_officially_casts_ivory_aquino_as_first/hu5lky4/
703,hu464o9,Hope_Burns_Bright,Full circle!,Full circle!,14,2022-01-25 04:59:06,<praw.models.comment_forest.CommentForest object at 0x000002541F7E91C0>,sc0b8p,movies,t5_2qh3s,,False,False,t3_sc0b8p,t1_hu45zb9,/r/movies/comments/sc0b8p/batgirl_officially_casts_ivory_aquino_as_first/hu464o9/
704,hu59glx,Jazzeki,"did you actually read what i wrote? yes i have no problem if they made a batgirl instead of a batman movie like that. BUT when they make both then no she's really no longer a charecter in her own right we at least need to establish what is different between batman and batgirl which means we need to figure out whoi they are in relation to one another. charecters such as robin and who else batman works with becomes relevant and most obviously Jim Gordon becomes important.

&#x200B;

but if you make the disconnection as far as suggested here you just made 2 do-overs for batman at once excpet in one it's a female version forwhatever that's worth. and at this point do-overs for batman is really not what we really need.","did you actually read what i wrote? yes i have no problem if they made a batgirl instead of a batman movie like that. BUT when they make both then no she's really no longer a charecter in her own right we at least need to establish what is different between batman and batgirl which means we need to figure out whoi they are in relation to one another. charecters such as robin and who else batman works with becomes relevant and most obviously Jim Gordon becomes important.

&#x200B;

but if you make the disconnection as far as suggested here you just made 2 do-overs for batman at once excpet in one it's a female version forwhatever that's worth. and at this point do-overs for batman is really not what we really need.",3,2022-01-25 12:39:53,<praw.models.comment_forest.CommentForest object at 0x000002541A994BB0>,sc0b8p,movies,t5_2qh3s,,False,False,t3_sc0b8p,t1_hu4pvkw,/r/movies/comments/sc0b8p/batgirl_officially_casts_ivory_aquino_as_first/hu59glx/
705,hu7db16,axefaktor,"You could certainly pick those 3 out of 27 and make a very feeble case that “MCU movies are bad,” I guess. I don’t think it holds any water, but you’re as entitled to your opinion as I am. Of the three you mentioned, TDW is the only one I actively dislike. The other two are fine, but the bar is really high in the MCU, so it’s more noticeable when a film doesn’t reach it.","You could certainly pick those 3 out of 27 and make a very feeble case that “MCU movies are bad,” I guess. I don’t think it holds any water, but you’re as entitled to your opinion as I am. Of the three you mentioned, TDW is the only one I actively dislike. The other two are fine, but the bar is really high in the MCU, so it’s more noticeable when a film doesn’t reach it.",1,2022-01-25 21:05:59,<praw.models.comment_forest.CommentForest object at 0x000002541F7E9760>,sc0b8p,movies,t5_2qh3s,,False,False,t3_sc0b8p,t1_hu7b3cx,/r/movies/comments/sc0b8p/batgirl_officially_casts_ivory_aquino_as_first/hu7db16/
706,hu46mro,QUEST50012,You really can just get by on the movies themselves. None of their 2021 movies required you to watch a TV show.,You really can just get by on the movies themselves. None of their 2021 movies required you to watch a TV show.,62,2022-01-25 05:03:36,<praw.models.comment_forest.CommentForest object at 0x000002541F7E9940>,sc0b8p,movies,t5_2qh3s,,False,False,t3_sc0b8p,t1_hu44jro,/r/movies/comments/sc0b8p/batgirl_officially_casts_ivory_aquino_as_first/hu46mro/
707,hu45xtp,JustifytheMean,"Yeah it's part of the reason I stopped watching Arrow or any of the other Arrowverse shows.....it got to a point where they'd have like 5 episode long arcs across 4 or 5 shows.  So you can't just watch one then the next, and you can't just watch the ones you like, or you just skip crossover events and miss part of the story.","Yeah it's part of the reason I stopped watching Arrow or any of the other Arrowverse shows.....it got to a point where they'd have like 5 episode long arcs across 4 or 5 shows.  So you can't just watch one then the next, and you can't just watch the ones you like, or you just skip crossover events and miss part of the story.",17,2022-01-25 04:57:23,<praw.models.comment_forest.CommentForest object at 0x000002541F7E99A0>,sc0b8p,movies,t5_2qh3s,,False,False,t3_sc0b8p,t1_hu44jro,/r/movies/comments/sc0b8p/batgirl_officially_casts_ivory_aquino_as_first/hu45xtp/
708,hu4lnkz,fuck_a_bigot,It’s not like DC has been a resounding success in the movie department. They would be fools to try to their shows essential viewing for movies that have a 50/50 success rate (and that’s being generous lol),It’s not like DC has been a resounding success in the movie department. They would be fools to try to their shows essential viewing for movies that have a 50/50 success rate (and that’s being generous lol),6,2022-01-25 07:40:56,<praw.models.comment_forest.CommentForest object at 0x000002541F7E9A60>,sc0b8p,movies,t5_2qh3s,,False,False,t3_sc0b8p,t1_hu44jro,/r/movies/comments/sc0b8p/batgirl_officially_casts_ivory_aquino_as_first/hu4lnkz/
709,hu58d1r,Redeem123,"Lol what Marvel movie has been confusing if you haven’t seen anything else?

These movies are made for 12 year olds. Sure, the TV shows can add a bit, but all the information you need is right on the screen. You could even go into Infinity War completely blank and still understand what’s going on. 

Why do people act like these movies are complex?","Lol what Marvel movie has been confusing if you haven’t seen anything else?

These movies are made for 12 year olds. Sure, the TV shows can add a bit, but all the information you need is right on the screen. You could even go into Infinity War completely blank and still understand what’s going on. 

Why do people act like these movies are complex?",4,2022-01-25 12:28:52,<praw.models.comment_forest.CommentForest object at 0x000002541F7E9D60>,sc0b8p,movies,t5_2qh3s,,False,False,t3_sc0b8p,t1_hu44jro,/r/movies/comments/sc0b8p/batgirl_officially_casts_ivory_aquino_as_first/hu58d1r/
710,hu4g0zu,FrenchCuirassier,"No I'm saying you should stop encouraging them for their mediocrity and encourage them instead to do something more unique. Don't pay for superhero movies or you'll just get more of them. Why would you want that? They don't have much to do with the comic books other than the same costume and character and occasional villain similarities. 

They are taking advantage of DC Comic and Marvel ""brand names""... And hoping you won't notice the sleight of hand.","No I'm saying you should stop encouraging them for their mediocrity and encourage them instead to do something more unique. Don't pay for superhero movies or you'll just get more of them. Why would you want that? They don't have much to do with the comic books other than the same costume and character and occasional villain similarities. 

They are taking advantage of DC Comic and Marvel ""brand names""... And hoping you won't notice the sleight of hand.",-12,2022-01-25 06:35:56,<praw.models.comment_forest.CommentForest object at 0x000002541CF61940>,sc0b8p,movies,t5_2qh3s,,False,False,t3_sc0b8p,t1_hu4erh4,/r/movies/comments/sc0b8p/batgirl_officially_casts_ivory_aquino_as_first/hu4g0zu/
711,hu4zi0d,BrockStar92,"Also Into the Spider-Verse is a fabulous stand-alone Spider-Man film. And the Netflix shows are technically canon but can easily be watched independently. Which is the way to do it. If you want stand-alone TV shows I’d argue it’s better they don’t actively dispute canon of the main universe you’re pushing, that’s the money maker and that’s what you don’t want people confused by. 

Let’s face it, if the DCEU actually had massively successful films that shook the place up like the MCU and they didn’t start losing their key characters like Batman then they’d be keeping everything canon. It’s not a deliberate choice, they didn’t avoid making a DCEU, they started one and they’ve fucked it up a bit because they’re a mess.","Also Into the Spider-Verse is a fabulous stand-alone Spider-Man film. And the Netflix shows are technically canon but can easily be watched independently. Which is the way to do it. If you want stand-alone TV shows I’d argue it’s better they don’t actively dispute canon of the main universe you’re pushing, that’s the money maker and that’s what you don’t want people confused by. 

Let’s face it, if the DCEU actually had massively successful films that shook the place up like the MCU and they didn’t start losing their key characters like Batman then they’d be keeping everything canon. It’s not a deliberate choice, they didn’t avoid making a DCEU, they started one and they’ve fucked it up a bit because they’re a mess.",4,2022-01-25 10:44:47,<praw.models.comment_forest.CommentForest object at 0x000002541F7E6220>,sc0b8p,movies,t5_2qh3s,,False,False,t3_sc0b8p,t1_hu4x73z,/r/movies/comments/sc0b8p/batgirl_officially_casts_ivory_aquino_as_first/hu4zi0d/
712,hu59abi,ThrowerWheyACount,The movie was inherently connected to people's appropriation and idolisation of the joker imo and the movie's comedic elements were distinct to the joker character (or at least a clown protagonist) rather than being already present in the Taxi Driver inspiration.,The movie was inherently connected to people's appropriation and idolisation of the joker imo and the movie's comedic elements were distinct to the joker character (or at least a clown protagonist) rather than being already present in the Taxi Driver inspiration.,2,2022-01-25 12:38:10,<praw.models.comment_forest.CommentForest object at 0x000002541F7E6280>,sc0b8p,movies,t5_2qh3s,,False,False,t3_sc0b8p,t1_hu4x73z,/r/movies/comments/sc0b8p/batgirl_officially_casts_ivory_aquino_as_first/hu59abi/
713,hu625zt,,I don't even feel like this is a response to my comment.,I don't even feel like this is a response to my comment.,1,2022-01-25 16:12:58,<praw.models.comment_forest.CommentForest object at 0x000002541F7E62E0>,sc0b8p,movies,t5_2qh3s,,False,False,t3_sc0b8p,t1_hu4x73z,/r/movies/comments/sc0b8p/batgirl_officially_casts_ivory_aquino_as_first/hu625zt/
714,hu3tvlu,nomadofwaves,https://i.imgur.com/vZpLZCC.jpg,https://i.imgur.com/vZpLZCC.jpg,-26,2022-01-25 03:17:31,<praw.models.comment_forest.CommentForest object at 0x000002541AF5CEB0>,sc0b8p,movies,t5_2qh3s,,False,False,t3_sc0b8p,t1_hu3td7w,/r/movies/comments/sc0b8p/batgirl_officially_casts_ivory_aquino_as_first/hu3tvlu/
715,hu4obcn,Mr_Blinky,"It's not the free advertising that's the problem, it's the fact that it acted as a free distraction from the fact that Mars, Nestle, and Hershey's were literally just sued for *child slavery*.","It's not the free advertising that's the problem, it's the fact that it acted as a free distraction from the fact that Mars, Nestle, and Hershey's were literally just sued for *child slavery*.",41,2022-01-25 08:13:58,<praw.models.comment_forest.CommentForest object at 0x000002541F7E6BE0>,sc0b8p,movies,t5_2qh3s,,1643136263.0,False,t3_sc0b8p,t1_hu4b0by,/r/movies/comments/sc0b8p/batgirl_officially_casts_ivory_aquino_as_first/hu4obcn/
716,hu4wk2j,Keianh,That's three days more than Fox News/Conservative media has spent defending people of color than they ever have before!,That's three days more than Fox News/Conservative media has spent defending people of color than they ever have before!,4,2022-01-25 10:05:11,<praw.models.comment_forest.CommentForest object at 0x000002541F7E6C40>,sc0b8p,movies,t5_2qh3s,,False,False,t3_sc0b8p,t1_hu4b0by,/r/movies/comments/sc0b8p/batgirl_officially_casts_ivory_aquino_as_first/hu4wk2j/
717,hu5dsfi,slickestwood,Shit that's probably why I bought M&Ms yesterday for the first time in forever,Shit that's probably why I bought M&Ms yesterday for the first time in forever,0,2022-01-25 13:19:33,<praw.models.comment_forest.CommentForest object at 0x000002541AF72670>,sc0b8p,movies,t5_2qh3s,,False,False,t3_sc0b8p,t1_hu4b0by,/r/movies/comments/sc0b8p/batgirl_officially_casts_ivory_aquino_as_first/hu5dsfi/
718,hu4sacc,Piggstein,He doesn’t give a shit about M&Ms he gives a shit about the money he gets from riling up his listeners,He doesn’t give a shit about M&Ms he gives a shit about the money he gets from riling up his listeners,9,2022-01-25 09:07:00,<praw.models.comment_forest.CommentForest object at 0x000002541F7E6E80>,sc0b8p,movies,t5_2qh3s,,False,False,t3_sc0b8p,t1_hu423d2,/r/movies/comments/sc0b8p/batgirl_officially_casts_ivory_aquino_as_first/hu4sacc/
719,hu53q18,nomadofwaves,I listen to the crazies to know what they’re up to. I’m not part of the cult.,I listen to the crazies to know what they’re up to. I’m not part of the cult.,2,2022-01-25 11:38:02,<praw.models.comment_forest.CommentForest object at 0x000002547AC9BEB0>,sc0b8p,movies,t5_2qh3s,,False,False,t3_sc0b8p,t1_hu4jhuw,/r/movies/comments/sc0b8p/batgirl_officially_casts_ivory_aquino_as_first/hu53q18/
720,hu53g1y,nomadofwaves,Why does it bother you? Lol. I don’t give a shit about the topic at all. Let me know if they get rid of peanut m&m’s and then I’ll care.,Why does it bother you? Lol. I don’t give a shit about the topic at all. Let me know if they get rid of peanut m&m’s and then I’ll care.,3,2022-01-25 11:34:41,<praw.models.comment_forest.CommentForest object at 0x00000254194D5E20>,sc0b8p,movies,t5_2qh3s,,False,False,t3_sc0b8p,t1_hu4swa1,/r/movies/comments/sc0b8p/batgirl_officially_casts_ivory_aquino_as_first/hu53g1y/
