,ID,Author,body,Comment,Score,Created On,Replies,Submission,Subreddit,Subreddit_ID,Distinguished,Edited,Is_submitter,link_id,Parent_id,Permalink
0,hu3zpnp,,"I'm super out of the loop. Is this the same Batgirl film with JK Simmons as Gordon? As in, Snyderverse's Batgirl? 

Or is this set in another continuity?","I'm super out of the loop. Is this the same Batgirl film with JK Simmons as Gordon? As in, Snyderverse's Batgirl? 

Or is this set in another continuity?",450,2022-01-25 04:04:09,<praw.models.comment_forest.CommentForest object at 0x000002541F816B20>,sc0b8p,movies,t5_2qh3s,,False,False,t3_sc0b8p,t3_sc0b8p,/r/movies/comments/sc0b8p/batgirl_officially_casts_ivory_aquino_as_first/hu3zpnp/
1,hu45uod,Bukdiah,I vaguely remember Alysia being introduced and then forgotten about shortly after...then we got Batgirl in Burnside lol.,I vaguely remember Alysia being introduced and then forgotten about shortly after...then we got Batgirl in Burnside lol.,69,2022-01-25 04:56:37,<praw.models.comment_forest.CommentForest object at 0x000002541F816B80>,sc0b8p,movies,t5_2qh3s,,False,False,t3_sc0b8p,t3_sc0b8p,/r/movies/comments/sc0b8p/batgirl_officially_casts_ivory_aquino_as_first/hu45uod/
2,hu3bfau,TieofDoom,"Alysia Yeoh is from Gail Simone's Batgirl run in 2011, so this trans character has been around for about 10 years now in the comicbooks.","Alysia Yeoh is from Gail Simone's Batgirl run in 2011, so this trans character has been around for about 10 years now in the comicbooks.",861,2022-01-25 01:04:03,<praw.models.comment_forest.CommentForest object at 0x000002541F7E6640>,sc0b8p,movies,t5_2qh3s,,False,False,t3_sc0b8p,t3_sc0b8p,/r/movies/comments/sc0b8p/batgirl_officially_casts_ivory_aquino_as_first/hu3bfau/
3,hu44rke,infamous5445,I mean if the character is trans in the comics then this shouldn't really be a big deal for people freaking out,I mean if the character is trans in the comics then this shouldn't really be a big deal for people freaking out,222,2022-01-25 04:47:04,<praw.models.comment_forest.CommentForest object at 0x000002541F7E6700>,sc0b8p,movies,t5_2qh3s,,False,False,t3_sc0b8p,t3_sc0b8p,/r/movies/comments/sc0b8p/batgirl_officially_casts_ivory_aquino_as_first/hu44rke/
4,hu3jap5,SutterCane,Isn’t this just being dropped on HBO Max? Or has it got the upgrade like *Blue Beetle*?,Isn’t this just being dropped on HBO Max? Or has it got the upgrade like *Blue Beetle*?,65,2022-01-25 02:00:25,<praw.models.comment_forest.CommentForest object at 0x000002541F7E47C0>,sc0b8p,movies,t5_2qh3s,,False,False,t3_sc0b8p,t3_sc0b8p,/r/movies/comments/sc0b8p/batgirl_officially_casts_ivory_aquino_as_first/hu3jap5/
5,hu4fg4w,anom0824,Wait is the character trans or the actress? Or both?,Wait is the character trans or the actress? Or both?,37,2022-01-25 06:29:42,<praw.models.comment_forest.CommentForest object at 0x000002541F7E4F40>,sc0b8p,movies,t5_2qh3s,,False,False,t3_sc0b8p,t3_sc0b8p,/r/movies/comments/sc0b8p/batgirl_officially_casts_ivory_aquino_as_first/hu4fg4w/
6,hu3d26t,Sisiwakanamaru,"> Both Aquino and Yeoh are transgender, marking the first time a live-action feature film adaptation of a DC Comics title will feature an openly trans character. Yeoh first appeared in a 2011 issue of “Batgirl” written by Gail Simone and penciled by Ardian Syaf.

[The Ironic thing about Ardian Syaf worked on previous Alysia Yeoh's project that he was a bigot.](https://gizmodo.com/marvel-to-discipline-x-men-gold-artist-for-controversia-1794142015)

> Marvel has announced that it will remove some artwork from X-Men Gold #1, as well as take unspecified disciplinary action against artist Ardian Syaf, after it was discovered that he included coded references to an ongoing religious and political conflict in Indonesia.

> Over the weekend, some Indonesian readers started pointing out how a few panels in the debut issue for the new comic series featured references to a currently political situation involving the Governor of Jakarta and the region’s conservative Islamic population. Specifically, Colossus’s shirt seen during a baseball match between the new members of the X-Men team, which read “QS 5:51,” and a building labeled “212"" above new X-Men leader Kitty Pryde’s head (her character is one of the most prominent Jewish heroes in Marvel Comic’s roster, a factoid that will become important shortly). 

> Last year, everything snowballed after an edited video surfaced of Tjahaja telling voters that his political opponents were using QS 5:51, a verse of the Quran, to lie to them. One translation reads: O you who have believed, do not take the Jews and the Christians as allies. They are [in fact] allies of one another. And whoever is an ally to them among you - then indeed, he is [one] of them.","> Both Aquino and Yeoh are transgender, marking the first time a live-action feature film adaptation of a DC Comics title will feature an openly trans character. Yeoh first appeared in a 2011 issue of “Batgirl” written by Gail Simone and penciled by Ardian Syaf.

[The Ironic thing about Ardian Syaf worked on previous Alysia Yeoh's project that he was a bigot.](https://gizmodo.com/marvel-to-discipline-x-men-gold-artist-for-controversia-1794142015)

> Marvel has announced that it will remove some artwork from X-Men Gold #1, as well as take unspecified disciplinary action against artist Ardian Syaf, after it was discovered that he included coded references to an ongoing religious and political conflict in Indonesia.

> Over the weekend, some Indonesian readers started pointing out how a few panels in the debut issue for the new comic series featured references to a currently political situation involving the Governor of Jakarta and the region’s conservative Islamic population. Specifically, Colossus’s shirt seen during a baseball match between the new members of the X-Men team, which read “QS 5:51,” and a building labeled “212"" above new X-Men leader Kitty Pryde’s head (her character is one of the most prominent Jewish heroes in Marvel Comic’s roster, a factoid that will become important shortly). 

> Last year, everything snowballed after an edited video surfaced of Tjahaja telling voters that his political opponents were using QS 5:51, a verse of the Quran, to lie to them. One translation reads: O you who have believed, do not take the Jews and the Christians as allies. They are [in fact] allies of one another. And whoever is an ally to them among you - then indeed, he is [one] of them.",139,2022-01-25 01:16:00,<praw.models.comment_forest.CommentForest object at 0x000002541F81AA00>,sc0b8p,movies,t5_2qh3s,,False,False,t3_sc0b8p,t3_sc0b8p,/r/movies/comments/sc0b8p/batgirl_officially_casts_ivory_aquino_as_first/hu3d26t/
7,hu38sw4,ddwcommish,They've had one all along on Supergirl with Dreamer.,They've had one all along on Supergirl with Dreamer.,71,2022-01-25 00:44:00,<praw.models.comment_forest.CommentForest object at 0x000002541F81AB80>,sc0b8p,movies,t5_2qh3s,,False,False,t3_sc0b8p,t3_sc0b8p,/r/movies/comments/sc0b8p/batgirl_officially_casts_ivory_aquino_as_first/hu38sw4/
8,hu4uy2h,,"In the final episode of Supergirl, one of the characters is fighting an alien.She shoots a gun at the alien and the alien tries to swing some punches at her.After successfully ducking his punch, the character assumes an empowered pose and fiercely says, ""No touching without consent"".

Here is a video: https://youtu.be/cLOemWJIw6w

I don't care who you cast in the movie. But if you use that as an opportunity to convey some hamfisted, politically charged and condescending message to your audience(like in the above example), expect there to be complaints.
Otherwise,I think Ivory will do a great job.","In the final episode of Supergirl, one of the characters is fighting an alien.She shoots a gun at the alien and the alien tries to swing some punches at her.After successfully ducking his punch, the character assumes an empowered pose and fiercely says, ""No touching without consent"".

Here is a video: https://youtu.be/cLOemWJIw6w

I don't care who you cast in the movie. But if you use that as an opportunity to convey some hamfisted, politically charged and condescending message to your audience(like in the above example), expect there to be complaints.
Otherwise,I think Ivory will do a great job.",62,2022-01-25 09:43:22,<praw.models.comment_forest.CommentForest object at 0x000002541F81AD60>,sc0b8p,movies,t5_2qh3s,,False,False,t3_sc0b8p,t3_sc0b8p,/r/movies/comments/sc0b8p/batgirl_officially_casts_ivory_aquino_as_first/hu4uy2h/
9,huwfxpi,hiimpandaa,Yikers,Yikers,3,2022-01-30 20:55:08,<praw.models.comment_forest.CommentForest object at 0x000002541F81AF40>,sc0b8p,movies,t5_2qh3s,,False,False,t3_sc0b8p,t3_sc0b8p,/r/movies/comments/sc0b8p/batgirl_officially_casts_ivory_aquino_as_first/huwfxpi/
10,hu4pqkc,,[removed],[removed],31,2022-01-25 08:32:24,<praw.models.comment_forest.CommentForest object at 0x000002541EB64100>,sc0b8p,movies,t5_2qh3s,,False,False,t3_sc0b8p,t3_sc0b8p,/r/movies/comments/sc0b8p/batgirl_officially_casts_ivory_aquino_as_first/hu4pqkc/
11,hu55ga3,Weekend_Squire,I can’t wait to miss this.,I can’t wait to miss this.,22,2022-01-25 11:58:03,<praw.models.comment_forest.CommentForest object at 0x000002541EB641C0>,sc0b8p,movies,t5_2qh3s,,False,False,t3_sc0b8p,t3_sc0b8p,/r/movies/comments/sc0b8p/batgirl_officially_casts_ivory_aquino_as_first/hu55ga3/
12,hu4iw9n,Lenon2012,Can't wait for the quartering's and Geeks and gamers 30 min videos on how this casting will destroy western civilization.,Can't wait for the quartering's and Geeks and gamers 30 min videos on how this casting will destroy western civilization.,17,2022-01-25 07:08:14,<praw.models.comment_forest.CommentForest object at 0x000002541EB643A0>,sc0b8p,movies,t5_2qh3s,,False,False,t3_sc0b8p,t3_sc0b8p,/r/movies/comments/sc0b8p/batgirl_officially_casts_ivory_aquino_as_first/hu4iw9n/
13,hu4m791,Japper28,Well the good news is it can't be any worse than the Batwoman series... But honestly I wonder  if anyone actually wants to see this.,Well the good news is it can't be any worse than the Batwoman series... But honestly I wonder  if anyone actually wants to see this.,18,2022-01-25 07:47:25,<praw.models.comment_forest.CommentForest object at 0x000002541EB64580>,sc0b8p,movies,t5_2qh3s,,False,False,t3_sc0b8p,t3_sc0b8p,/r/movies/comments/sc0b8p/batgirl_officially_casts_ivory_aquino_as_first/hu4m791/
14,hu4jrvm,PuzzleheadedState405,I don’t care as long as it’s good,I don’t care as long as it’s good,17,2022-01-25 07:18:28,<praw.models.comment_forest.CommentForest object at 0x000002541EB64700>,sc0b8p,movies,t5_2qh3s,,False,False,t3_sc0b8p,t3_sc0b8p,/r/movies/comments/sc0b8p/batgirl_officially_casts_ivory_aquino_as_first/hu4jrvm/
15,hu8h2y6,pearlz176,Posting before the thread gets locked.,Posting before the thread gets locked.,2,2022-01-26 01:33:14,<praw.models.comment_forest.CommentForest object at 0x000002541EB647C0>,sc0b8p,movies,t5_2qh3s,,False,False,t3_sc0b8p,t3_sc0b8p,/r/movies/comments/sc0b8p/batgirl_officially_casts_ivory_aquino_as_first/hu8h2y6/
16,hu4jm3d,randyspotboiler,"It's great that there's LGBTQ representation happening, both as a character and an actor, and I get the importance, but this unnecessary emphasis on casting actors of matching gender/sexuality/ethnicity in the attempt to do the right thing, is going to create problems. This is acting: it's ok to ACT like you're a different type of person.  That's THE POINT.","It's great that there's LGBTQ representation happening, both as a character and an actor, and I get the importance, but this unnecessary emphasis on casting actors of matching gender/sexuality/ethnicity in the attempt to do the right thing, is going to create problems. This is acting: it's ok to ACT like you're a different type of person.  That's THE POINT.",28,2022-01-25 07:16:34,<praw.models.comment_forest.CommentForest object at 0x000002541EB64A00>,sc0b8p,movies,t5_2qh3s,,False,False,t3_sc0b8p,t3_sc0b8p,/r/movies/comments/sc0b8p/batgirl_officially_casts_ivory_aquino_as_first/hu4jm3d/
17,hu5bxdv,Hellmann,"Finally.. a trans character in a comic book movie..

I wonder if everyday trans people give a fuck about these stories about “first trans person to ______!” . It just seems really fake and condescending IMO.","Finally.. a trans character in a comic book movie..

I wonder if everyday trans people give a fuck about these stories about “first trans person to ______!” . It just seems really fake and condescending IMO.",12,2022-01-25 13:03:03,<praw.models.comment_forest.CommentForest object at 0x000002541EB64AC0>,sc0b8p,movies,t5_2qh3s,,False,False,t3_sc0b8p,t3_sc0b8p,/r/movies/comments/sc0b8p/batgirl_officially_casts_ivory_aquino_as_first/hu5bxdv/
18,hu4cm3e,middlefinger456789,They got this but cant make.a good superman movie,They got this but cant make.a good superman movie,13,2022-01-25 06:00:27,<praw.models.comment_forest.CommentForest object at 0x000002541EB64FA0>,sc0b8p,movies,t5_2qh3s,,False,False,t3_sc0b8p,t3_sc0b8p,/r/movies/comments/sc0b8p/batgirl_officially_casts_ivory_aquino_as_first/hu4cm3e/
19,hu4imbz,Elladan74,"I'm so sick and tired of these fucking comics adaptations. It's utterly pointless, it will be forgotten in 6 months tops, I don't care who plays in it.
Please make it stop.","I'm so sick and tired of these fucking comics adaptations. It's utterly pointless, it will be forgotten in 6 months tops, I don't care who plays in it.
Please make it stop.",12,2022-01-25 07:05:04,<praw.models.comment_forest.CommentForest object at 0x000002541EB3E2E0>,sc0b8p,movies,t5_2qh3s,,False,False,t3_sc0b8p,t3_sc0b8p,/r/movies/comments/sc0b8p/batgirl_officially_casts_ivory_aquino_as_first/hu4imbz/
20,hu3g55i,,[removed],[removed],4,2022-01-25 01:38:01,<praw.models.comment_forest.CommentForest object at 0x000002541EB3E4C0>,sc0b8p,movies,t5_2qh3s,,False,False,t3_sc0b8p,t3_sc0b8p,/r/movies/comments/sc0b8p/batgirl_officially_casts_ivory_aquino_as_first/hu3g55i/
21,hu4ox62,,[removed],[removed],15,2022-01-25 08:21:37,<praw.models.comment_forest.CommentForest object at 0x000002541EB3E640>,sc0b8p,movies,t5_2qh3s,,False,False,t3_sc0b8p,t3_sc0b8p,/r/movies/comments/sc0b8p/batgirl_officially_casts_ivory_aquino_as_first/hu4ox62/
22,hu39enq,,[removed],[removed],15,2022-01-25 00:48:53,<praw.models.comment_forest.CommentForest object at 0x000002541EB3E700>,sc0b8p,movies,t5_2qh3s,,False,False,t3_sc0b8p,t3_sc0b8p,/r/movies/comments/sc0b8p/batgirl_officially_casts_ivory_aquino_as_first/hu39enq/
23,hu73az3,goliathfasa,We’ve gotta be running out of firsts pretty soon right?,We’ve gotta be running out of firsts pretty soon right?,3,2022-01-25 20:03:45,<praw.models.comment_forest.CommentForest object at 0x000002541EB3E7C0>,sc0b8p,movies,t5_2qh3s,,False,False,t3_sc0b8p,t3_sc0b8p,/r/movies/comments/sc0b8p/batgirl_officially_casts_ivory_aquino_as_first/hu73az3/
24,hu4jlc8,felixofthe,"1. Why is this news? 
2. Why do people have a problem with this? 
3. I don’t care. Trans people are humans. And yeah sometimes humans get cast in movies and tv. I am so sick of news and Hollywood pretending like casting non binaries is some sort of achievement. 
Make good content and the rest doesn’t matter at all. Stop hiding behind the pride flag and try and profit off it.","1. Why is this news? 
2. Why do people have a problem with this? 
3. I don’t care. Trans people are humans. And yeah sometimes humans get cast in movies and tv. I am so sick of news and Hollywood pretending like casting non binaries is some sort of achievement. 
Make good content and the rest doesn’t matter at all. Stop hiding behind the pride flag and try and profit off it.",7,2022-01-25 07:16:19,<praw.models.comment_forest.CommentForest object at 0x000002541EB401C0>,sc0b8p,movies,t5_2qh3s,,False,False,t3_sc0b8p,t3_sc0b8p,/r/movies/comments/sc0b8p/batgirl_officially_casts_ivory_aquino_as_first/hu4jlc8/
25,hu47kqt,mega345,I’m sure this will be a pleasant comment section,I’m sure this will be a pleasant comment section,5,2022-01-25 05:12:10,<praw.models.comment_forest.CommentForest object at 0x000002541EB40220>,sc0b8p,movies,t5_2qh3s,,False,False,t3_sc0b8p,t3_sc0b8p,/r/movies/comments/sc0b8p/batgirl_officially_casts_ivory_aquino_as_first/hu47kqt/
26,hu4rwo1,,[removed],[removed],2,2022-01-25 09:01:48,<praw.models.comment_forest.CommentForest object at 0x000002541EB40640>,sc0b8p,movies,t5_2qh3s,,False,False,t3_sc0b8p,t3_sc0b8p,/r/movies/comments/sc0b8p/batgirl_officially_casts_ivory_aquino_as_first/hu4rwo1/
27,hu5otep,CataclysmDM,"Wow, how... progressive? I guess?

Why is this news?

The only thing I care about is if she's a good actor who can deliver lines believably, and if the script is good. An actor being trans should be meaningless.","Wow, how... progressive? I guess?

Why is this news?

The only thing I care about is if she's a good actor who can deliver lines believably, and if the script is good. An actor being trans should be meaningless.",1,2022-01-25 14:45:06,<praw.models.comment_forest.CommentForest object at 0x000002541EB40700>,sc0b8p,movies,t5_2qh3s,,False,False,t3_sc0b8p,t3_sc0b8p,/r/movies/comments/sc0b8p/batgirl_officially_casts_ivory_aquino_as_first/hu5otep/
28,hu64efb,Small-Garbage-1233,"Is anybody even really excited for Batgirl? I really could care less about the DCEU outside of Shazam and Black Adam. After the rumors of the flash and their random bullshit projects, I just can’t stand to defend the content anymore","Is anybody even really excited for Batgirl? I really could care less about the DCEU outside of Shazam and Black Adam. After the rumors of the flash and their random bullshit projects, I just can’t stand to defend the content anymore",2,2022-01-25 16:27:09,<praw.models.comment_forest.CommentForest object at 0x000002541EB40760>,sc0b8p,movies,t5_2qh3s,,False,False,t3_sc0b8p,t3_sc0b8p,/r/movies/comments/sc0b8p/batgirl_officially_casts_ivory_aquino_as_first/hu64efb/
29,hu4l4xs,TheJudgementIsDeath,She will be known as Bat.,She will be known as Bat.,3,2022-01-25 07:34:44,<praw.models.comment_forest.CommentForest object at 0x000002541EB40820>,sc0b8p,movies,t5_2qh3s,,False,False,t3_sc0b8p,t3_sc0b8p,/r/movies/comments/sc0b8p/batgirl_officially_casts_ivory_aquino_as_first/hu4l4xs/
30,hu4ofzx,,[removed],[removed],1,2022-01-25 08:15:36,<praw.models.comment_forest.CommentForest object at 0x000002541EB408E0>,sc0b8p,movies,t5_2qh3s,,False,False,t3_sc0b8p,t3_sc0b8p,/r/movies/comments/sc0b8p/batgirl_officially_casts_ivory_aquino_as_first/hu4ofzx/
31,hu64cpx,UncleWillard5566,So pandering.,So pandering.,2,2022-01-25 16:26:50,<praw.models.comment_forest.CommentForest object at 0x000002541EB409A0>,sc0b8p,movies,t5_2qh3s,,False,False,t3_sc0b8p,t3_sc0b8p,/r/movies/comments/sc0b8p/batgirl_officially_casts_ivory_aquino_as_first/hu64cpx/
32,hu7mj0v,LynnButlertronn,"All of the comments are about how the comments are going to be anti-trans. Except I don't see any actual anti-trans comments. 

Oh, and the top thread is about 500 comments regarding how fucked up the DC continuity is.","All of the comments are about how the comments are going to be anti-trans. Except I don't see any actual anti-trans comments. 

Oh, and the top thread is about 500 comments regarding how fucked up the DC continuity is.",2,2022-01-25 22:05:00,<praw.models.comment_forest.CommentForest object at 0x000002541EB40A60>,sc0b8p,movies,t5_2qh3s,,False,False,t3_sc0b8p,t3_sc0b8p,/r/movies/comments/sc0b8p/batgirl_officially_casts_ivory_aquino_as_first/hu7mj0v/
33,hu3k07y,spacesoulboi,Please please please please be a good movie.,Please please please please be a good movie.,-10,2022-01-25 02:05:27,<praw.models.comment_forest.CommentForest object at 0x000002541EB40B20>,sc0b8p,movies,t5_2qh3s,,False,False,t3_sc0b8p,t3_sc0b8p,/r/movies/comments/sc0b8p/batgirl_officially_casts_ivory_aquino_as_first/hu3k07y/
34,hu76art,steveinbuffalo,someone watches that?,someone watches that?,3,2022-01-25 20:22:22,<praw.models.comment_forest.CommentForest object at 0x000002541EB40B80>,sc0b8p,movies,t5_2qh3s,,False,False,t3_sc0b8p,t3_sc0b8p,/r/movies/comments/sc0b8p/batgirl_officially_casts_ivory_aquino_as_first/hu76art/
35,hu52xzw,,[removed],[removed],-1,2022-01-25 11:28:37,<praw.models.comment_forest.CommentForest object at 0x000002541EB40CA0>,sc0b8p,movies,t5_2qh3s,,False,False,t3_sc0b8p,t3_sc0b8p,/r/movies/comments/sc0b8p/batgirl_officially_casts_ivory_aquino_as_first/hu52xzw/
36,hu4m08g,Invicturion,"Having seen a single episodr of Batgirl on HBO (i know they arnt related) i have litterely NO anticipation for this film.... DC needs a complete rework. Keep Aquaman, WW1 and Man of Steel pluss the Znyder cut. All else needs to be purged.","Having seen a single episodr of Batgirl on HBO (i know they arnt related) i have litterely NO anticipation for this film.... DC needs a complete rework. Keep Aquaman, WW1 and Man of Steel pluss the Znyder cut. All else needs to be purged.",2,2022-01-25 07:45:05,<praw.models.comment_forest.CommentForest object at 0x000002541EB40D60>,sc0b8p,movies,t5_2qh3s,,False,False,t3_sc0b8p,t3_sc0b8p,/r/movies/comments/sc0b8p/batgirl_officially_casts_ivory_aquino_as_first/hu4m08g/
37,hu4m5rd,,[removed],[removed],1,2022-01-25 07:46:55,<praw.models.comment_forest.CommentForest object at 0x000002541EB40EE0>,sc0b8p,movies,t5_2qh3s,,False,False,t3_sc0b8p,t3_sc0b8p,/r/movies/comments/sc0b8p/batgirl_officially_casts_ivory_aquino_as_first/hu4m5rd/
38,hu3rc8m,SlyGuy_Twenty_One,"Good for her. Hopefully it adds a lot to her career.

Downvote me all you want transphobes. I’m not going anywhere.","Good for her. Hopefully it adds a lot to her career.

Downvote me all you want transphobes. I’m not going anywhere.",-25,2022-01-25 02:58:14,<praw.models.comment_forest.CommentForest object at 0x000002541EB50040>,sc0b8p,movies,t5_2qh3s,,1643094774.0,False,t3_sc0b8p,t3_sc0b8p,/r/movies/comments/sc0b8p/batgirl_officially_casts_ivory_aquino_as_first/hu3rc8m/
39,hu3e7hw,,[deleted],[deleted],-3,2022-01-25 01:24:15,<praw.models.comment_forest.CommentForest object at 0x000002541EB500A0>,sc0b8p,movies,t5_2qh3s,,False,False,t3_sc0b8p,t3_sc0b8p,/r/movies/comments/sc0b8p/batgirl_officially_casts_ivory_aquino_as_first/hu3e7hw/
40,hu3mwx6,,[removed],[removed],1,2022-01-25 02:26:10,<praw.models.comment_forest.CommentForest object at 0x000002541EB50100>,sc0b8p,movies,t5_2qh3s,,1643078626.0,False,t3_sc0b8p,t3_sc0b8p,/r/movies/comments/sc0b8p/batgirl_officially_casts_ivory_aquino_as_first/hu3mwx6/
41,hu4j41v,Minisculptor,Finally hollywood is casting trans actors for trans roles.,Finally hollywood is casting trans actors for trans roles.,-11,2022-01-25 07:10:43,<praw.models.comment_forest.CommentForest object at 0x000002541EB50160>,sc0b8p,movies,t5_2qh3s,,False,False,t3_sc0b8p,t3_sc0b8p,/r/movies/comments/sc0b8p/batgirl_officially_casts_ivory_aquino_as_first/hu4j41v/
42,hu63mf0,subhasish10,The comments section is fucking sick. Literally anything positive about DC or insinuation that the movie might turn out to be good is getting downvoted to hell.,The comments section is fucking sick. Literally anything positive about DC or insinuation that the movie might turn out to be good is getting downvoted to hell.,0,2022-01-25 16:22:11,<praw.models.comment_forest.CommentForest object at 0x000002541EB501C0>,sc0b8p,movies,t5_2qh3s,,False,False,t3_sc0b8p,t3_sc0b8p,/r/movies/comments/sc0b8p/batgirl_officially_casts_ivory_aquino_as_first/hu63mf0/
43,hu4rwgt,ExcelBro,"Here comes the wave of ""anti woke"" protesters","Here comes the wave of ""anti woke"" protesters",-7,2022-01-25 09:01:44,<praw.models.comment_forest.CommentForest object at 0x000002541EB50220>,sc0b8p,movies,t5_2qh3s,,False,False,t3_sc0b8p,t3_sc0b8p,/r/movies/comments/sc0b8p/batgirl_officially_casts_ivory_aquino_as_first/hu4rwgt/
44,hu4cd8w,_Dusty05,I wanna know who went through this comment section and downvoted literally everything.,I wanna know who went through this comment section and downvoted literally everything.,-7,2022-01-25 05:57:58,<praw.models.comment_forest.CommentForest object at 0x000002541EB50280>,sc0b8p,movies,t5_2qh3s,,False,False,t3_sc0b8p,t3_sc0b8p,/r/movies/comments/sc0b8p/batgirl_officially_casts_ivory_aquino_as_first/hu4cd8w/
45,hu4rdi3,,[removed],[removed],-1,2022-01-25 08:54:32,<praw.models.comment_forest.CommentForest object at 0x000002541EB502E0>,sc0b8p,movies,t5_2qh3s,,False,False,t3_sc0b8p,t3_sc0b8p,/r/movies/comments/sc0b8p/batgirl_officially_casts_ivory_aquino_as_first/hu4rdi3/
46,hu3omiu,,"Damn people are angry at a /r/movies mod who’s glad to ban bigots from the sub.

I for one am all for it because then I won’t have to read how Black Panther is overrated in an unrelated thread every week. I get it, everyone gets it, let it go.","Damn people are angry at a /r/movies mod who’s glad to ban bigots from the sub.

I for one am all for it because then I won’t have to read how Black Panther is overrated in an unrelated thread every week. I get it, everyone gets it, let it go.",-36,2022-01-25 02:38:27,<praw.models.comment_forest.CommentForest object at 0x000002541EB503A0>,sc0b8p,movies,t5_2qh3s,,False,False,t3_sc0b8p,t3_sc0b8p,/r/movies/comments/sc0b8p/batgirl_officially_casts_ivory_aquino_as_first/hu3omiu/
