,ID,Author,body,Comment,Score,Created On,Replies,Submission,Subreddit,Subreddit_ID,Distinguished,Edited,Is_submitter,link_id,Parent_id,Permalink
494,hu4miac,Jazzeki,"i mean i kinda agree but then what's the point of ""batgirl"" without the context of a wider universe exactly?

why do we have both upcomeing batman and batgirl under those circumstances?

it's not even like i'm saying ""why have batgirl when we have batman"" i just do not get the point of both at the same time like this.

and whille disconnected... yeah except when they're not like suecide squad existing around this universe that is barely even half-formed because it disconnects but still relies on the references.

it certainly doesn't have to be big cinematic universe like marvel. but you can definetly also take the disconnection too far.","i mean i kinda agree but then what's the point of ""batgirl"" without the context of a wider universe exactly?

why do we have both upcomeing batman and batgirl under those circumstances?

it's not even like i'm saying ""why have batgirl when we have batman"" i just do not get the point of both at the same time like this.

and whille disconnected... yeah except when they're not like suecide squad existing around this universe that is barely even half-formed because it disconnects but still relies on the references.

it certainly doesn't have to be big cinematic universe like marvel. but you can definetly also take the disconnection too far.",12,2022-01-25 07:51:10,<praw.models.comment_forest.CommentForest object at 0x000002541F7E9580>,sc0b8p,movies,t5_2qh3s,,False,False,t3_sc0b8p,t1_hu41t0v,/r/movies/comments/sc0b8p/batgirl_officially_casts_ivory_aquino_as_first/hu4miac/
495,hu558u7,axefaktor,Yeah but the disconnected movies are mostly not very good while the 20 similar looking ones are at a minimum enjoyable if not great.,Yeah but the disconnected movies are mostly not very good while the 20 similar looking ones are at a minimum enjoyable if not great.,10,2022-01-25 11:55:40,<praw.models.comment_forest.CommentForest object at 0x000002541F7E95E0>,sc0b8p,movies,t5_2qh3s,,False,False,t3_sc0b8p,t1_hu41t0v,/r/movies/comments/sc0b8p/batgirl_officially_casts_ivory_aquino_as_first/hu558u7/
496,hu4d7e1,BactaBobomb,"To be fair, while DC's movies have lots of variety in the way they feel and look, the CW shoes do not follow that at all.  They all feel the exact same, and I would say it is even more exhausting in that context given how many hundreds of hours you have to get through if you want to get all that lore.","To be fair, while DC's movies have lots of variety in the way they feel and look, the CW shoes do not follow that at all.  They all feel the exact same, and I would say it is even more exhausting in that context given how many hundreds of hours you have to get through if you want to get all that lore.",2,2022-01-25 06:06:26,<praw.models.comment_forest.CommentForest object at 0x000002541F7E9640>,sc0b8p,movies,t5_2qh3s,,False,False,t3_sc0b8p,t1_hu41t0v,/r/movies/comments/sc0b8p/batgirl_officially_casts_ivory_aquino_as_first/hu4d7e1/
497,hu44b3h,reborn_from_ashes,Amen,Amen,1,2022-01-25 04:43:09,<praw.models.comment_forest.CommentForest object at 0x000002541F7E9700>,sc0b8p,movies,t5_2qh3s,,False,False,t3_sc0b8p,t1_hu41t0v,/r/movies/comments/sc0b8p/batgirl_officially_casts_ivory_aquino_as_first/hu44b3h/
498,hu4ajbe,FrenchCuirassier,"I prefer if movie makers stopped lying to the public by constantly writing new stories with new actors and then associating it with a known brand or character from Comic books of the past just to trick and manipulate people into the theaters.

Maybe they should write new stories with new names?

Superhero cash-cow movies need to end.","I prefer if movie makers stopped lying to the public by constantly writing new stories with new actors and then associating it with a known brand or character from Comic books of the past just to trick and manipulate people into the theaters.

Maybe they should write new stories with new names?

Superhero cash-cow movies need to end.",-11,2022-01-25 05:40:02,<praw.models.comment_forest.CommentForest object at 0x000002541AF7BC70>,sc0b8p,movies,t5_2qh3s,,False,False,t3_sc0b8p,t1_hu41t0v,/r/movies/comments/sc0b8p/batgirl_officially_casts_ivory_aquino_as_first/hu4ajbe/
499,hu58wvi,ThrowerWheyACount,"I agree but it definitely shouldn't be an either/or.

Like most fans I just pick and choose from DC and Marvel with the pros and cons for both.. so Joker, Snyder Cut, Watchmen series+movie, maybe Man of Steel and then most the old DC films all tickle my pickle.. and likewise Infinity War, CA: Winter Soldier, Guardians of the Galaxy and others seem rad to me.

I even think Fox's X-Men series should be remembered as the middle ground between current DC and Marvel.. they lacked continuity but still explored different styles like DC while also retaining most of the same cohesive look, cast and directors throughout the franchise similar to how Marvel have. But overall neither company is flawless in their output to me","I agree but it definitely shouldn't be an either/or.

Like most fans I just pick and choose from DC and Marvel with the pros and cons for both.. so Joker, Snyder Cut, Watchmen series+movie, maybe Man of Steel and then most the old DC films all tickle my pickle.. and likewise Infinity War, CA: Winter Soldier, Guardians of the Galaxy and others seem rad to me.

I even think Fox's X-Men series should be remembered as the middle ground between current DC and Marvel.. they lacked continuity but still explored different styles like DC while also retaining most of the same cohesive look, cast and directors throughout the franchise similar to how Marvel have. But overall neither company is flawless in their output to me",1,2022-01-25 12:34:28,<praw.models.comment_forest.CommentForest object at 0x000002541CF61340>,sc0b8p,movies,t5_2qh3s,,False,False,t3_sc0b8p,t1_hu41t0v,/r/movies/comments/sc0b8p/batgirl_officially_casts_ivory_aquino_as_first/hu58wvi/
500,hvmz5wl,PatGar25,"Everything except Joker and The Batman happen in the same DCEU Snyder MoS universe, after The Flash the universe will be retconned and merged with the Keaton Batman universe lore replacing Batfleck","Everything except Joker and The Batman happen in the same DCEU Snyder MoS universe, after The Flash the universe will be retconned and merged with the Keaton Batman universe lore replacing Batfleck",1,2022-02-05 00:45:10,<praw.models.comment_forest.CommentForest object at 0x000002541AF729D0>,sc0b8p,movies,t5_2qh3s,,False,False,t3_sc0b8p,t1_hu4y4n2,/r/movies/comments/sc0b8p/batgirl_officially_casts_ivory_aquino_as_first/hvmz5wl/
501,hu4svr7,,"I'm so okay with that. As flawed as it was, Marvel isn't going to do anything quite like that standalone Joker movie. 

Let one big company make the middling-to-good, formulaic movies on a schedule while the other one takes risks and tries new things. If anything, the more DC movies try to be like Marvel movies, the more they suck.","I'm so okay with that. As flawed as it was, Marvel isn't going to do anything quite like that standalone Joker movie. 

Let one big company make the middling-to-good, formulaic movies on a schedule while the other one takes risks and tries new things. If anything, the more DC movies try to be like Marvel movies, the more they suck.",0,2022-01-25 09:15:05,<praw.models.comment_forest.CommentForest object at 0x000002541F7E60A0>,sc0b8p,movies,t5_2qh3s,,False,False,t3_sc0b8p,t1_hu4hrqg,/r/movies/comments/sc0b8p/batgirl_officially_casts_ivory_aquino_as_first/hu4svr7/
502,hu7y257,funkopat,Bad decisions and bad movies are always defended while writing off criticism as fanboy rage. Ironically incredibly sexist.,Bad decisions and bad movies are always defended while writing off criticism as fanboy rage. Ironically incredibly sexist.,5,2022-01-25 23:21:41,<praw.models.comment_forest.CommentForest object at 0x000002541F7E6340>,sc0b8p,movies,t5_2qh3s,,False,False,t3_sc0b8p,t1_hu6ozx6,/r/movies/comments/sc0b8p/batgirl_officially_casts_ivory_aquino_as_first/hu7y257/
503,hu7prgj,MisfitAnthem,"Affleck has repeatedly said that [he's done with Batman](https://www.polygon.com/22837950/ben-affleck-batman-future-movies)

I think he's doing this movie to bow out gracefully","Affleck has repeatedly said that [he's done with Batman](https://www.polygon.com/22837950/ben-affleck-batman-future-movies)

I think he's doing this movie to bow out gracefully",1,2022-01-25 22:27:08,<praw.models.comment_forest.CommentForest object at 0x000002541A983280>,sc0b8p,movies,t5_2qh3s,,False,False,t3_sc0b8p,t1_hu7barh,/r/movies/comments/sc0b8p/batgirl_officially_casts_ivory_aquino_as_first/hu7prgj/
504,hu5tejc,AMoonMonkey,Too quote deadpool “these timelines are so confusing”,Too quote deadpool “these timelines are so confusing”,3,2022-01-25 15:16:43,<praw.models.comment_forest.CommentForest object at 0x000002541A983040>,sc0b8p,movies,t5_2qh3s,,False,False,t3_sc0b8p,t1_hu5tapw,/r/movies/comments/sc0b8p/batgirl_officially_casts_ivory_aquino_as_first/hu5tejc/
505,hu5ssl0,RealJohnGillman,"He is also in *The Flash*, alongside Michael Keaton, and has said that [his favourite scenes he has ever filmed as the character were shot for that film](https://www.heraldsun.com.au/lifestyle/smart/the-tender-bar-star-ben-affleck-on-figuring-out-batman-and-life/news-story/c722c23d68d8403446cbcd59f676a82c?amp&nk=c1d55acad3a8b13fd1796852da42e360-1641516500), so I would imagine he is relatively fine with it. While  a long-shot, an adaptation of [this scene](https://imgur.com/gallery/eudqk) would be nice to see be done.","He is also in *The Flash*, alongside Michael Keaton, and has said that [his favourite scenes he has ever filmed as the character were shot for that film](https://www.heraldsun.com.au/lifestyle/smart/the-tender-bar-star-ben-affleck-on-figuring-out-batman-and-life/news-story/c722c23d68d8403446cbcd59f676a82c?amp&nk=c1d55acad3a8b13fd1796852da42e360-1641516500), so I would imagine he is relatively fine with it. While  a long-shot, an adaptation of [this scene](https://imgur.com/gallery/eudqk) would be nice to see be done.",1,2022-01-25 15:12:36,<praw.models.comment_forest.CommentForest object at 0x000002541CF56070>,sc0b8p,movies,t5_2qh3s,,False,False,t3_sc0b8p,t1_hu5s5o9,/r/movies/comments/sc0b8p/batgirl_officially_casts_ivory_aquino_as_first/hu5ssl0/
506,hvmziv7,PatGar25,"He's the sole reason they are doing this, WB wanted him to continue playing Batman in the post-Flash continuity but he's quit IP movies so he quit the character and WB will bring Keaton for nostalgia pull","He's the sole reason they are doing this, WB wanted him to continue playing Batman in the post-Flash continuity but he's quit IP movies so he quit the character and WB will bring Keaton for nostalgia pull",1,2022-02-05 00:47:52,<praw.models.comment_forest.CommentForest object at 0x000002541CF56130>,sc0b8p,movies,t5_2qh3s,,False,False,t3_sc0b8p,t1_hu5s5o9,/r/movies/comments/sc0b8p/batgirl_officially_casts_ivory_aquino_as_first/hvmziv7/
507,hu76k4f,samusmcqueen,"Oh yeah, that was Hope Larson's run in 2016. Alysia's been around since but not too hard to miss.","Oh yeah, that was Hope Larson's run in 2016. Alysia's been around since but not too hard to miss.",2,2022-01-25 20:23:59,<praw.models.comment_forest.CommentForest object at 0x000002541F7E6820>,sc0b8p,movies,t5_2qh3s,,False,False,t3_sc0b8p,t1_hu6aogl,/r/movies/comments/sc0b8p/batgirl_officially_casts_ivory_aquino_as_first/hu76k4f/
508,hu3ybg5,Cyb3rSab3r,Fantastic job covering up for the child labor story they did.,Fantastic job covering up for the child labor story they did.,74,2022-01-25 03:52:38,<praw.models.comment_forest.CommentForest object at 0x000002541F7E69A0>,sc0b8p,movies,t5_2qh3s,,False,False,t3_sc0b8p,t1_hu3r1db,/r/movies/comments/sc0b8p/batgirl_officially_casts_ivory_aquino_as_first/hu3ybg5/
509,hu3t2vo,nomadofwaves,Hannity spent 30mins talking about this on his radio show. Imagine wasting energy caring about fucking m&m’s. Anything to help enrage their idiotic base.,Hannity spent 30mins talking about this on his radio show. Imagine wasting energy caring about fucking m&m’s. Anything to help enrage their idiotic base.,139,2022-01-25 03:11:18,<praw.models.comment_forest.CommentForest object at 0x000002541F7E6A00>,sc0b8p,movies,t5_2qh3s,,False,False,t3_sc0b8p,t1_hu3r1db,/r/movies/comments/sc0b8p/batgirl_officially_casts_ivory_aquino_as_first/hu3t2vo/
510,hu4ohit,WhySoSeverusSnape,"I very rarely see these people, but I see your type everywhere. Free marketing for a small group of morons.","I very rarely see these people, but I see your type everywhere. Free marketing for a small group of morons.",11,2022-01-25 08:16:09,<praw.models.comment_forest.CommentForest object at 0x000002541F7E6A60>,sc0b8p,movies,t5_2qh3s,,False,False,t3_sc0b8p,t1_hu3r1db,/r/movies/comments/sc0b8p/batgirl_officially_casts_ivory_aquino_as_first/hu4ohit/
511,hu3yaze,optiplex9000,Imagine being upset over your favorite female m&m wearing less sexy shoes 🤣,Imagine being upset over your favorite female m&m wearing less sexy shoes 🤣,20,2022-01-25 03:52:31,<praw.models.comment_forest.CommentForest object at 0x000002541F7E6F40>,sc0b8p,movies,t5_2qh3s,,False,False,t3_sc0b8p,t1_hu3r1db,/r/movies/comments/sc0b8p/batgirl_officially_casts_ivory_aquino_as_first/hu3yaze/
512,hu4p3nj,saxxy_assassin,"I'm sorry, I'm just catching up with the Carhartt's backlash. What going on with shoes and M&Ms?","I'm sorry, I'm just catching up with the Carhartt's backlash. What going on with shoes and M&Ms?",3,2022-01-25 08:23:56,<praw.models.comment_forest.CommentForest object at 0x000002541F7E6FA0>,sc0b8p,movies,t5_2qh3s,,False,False,t3_sc0b8p,t1_hu3r1db,/r/movies/comments/sc0b8p/batgirl_officially_casts_ivory_aquino_as_first/hu4p3nj/
513,hu86tk5,,How am I supposed to jerk off to the green M&M without her sexy shoes?,How am I supposed to jerk off to the green M&M without her sexy shoes?,0,2022-01-26 00:21:52,<praw.models.comment_forest.CommentForest object at 0x000002541AF8A070>,sc0b8p,movies,t5_2qh3s,,False,False,t3_sc0b8p,t1_hu3r1db,/r/movies/comments/sc0b8p/batgirl_officially_casts_ivory_aquino_as_first/hu86tk5/
514,hu3x2r0,DweEbLez0,LMFAO,LMFAO,-5,2022-01-25 03:42:31,<praw.models.comment_forest.CommentForest object at 0x000002541A9B3C10>,sc0b8p,movies,t5_2qh3s,,False,False,t3_sc0b8p,t1_hu3r1db,/r/movies/comments/sc0b8p/batgirl_officially_casts_ivory_aquino_as_first/hu3x2r0/
515,hu40vr7,Hope_Burns_Bright,"I dont think the people who spend their days trolling threads about trans actresses are getting laid, so its appropriate","I dont think the people who spend their days trolling threads about trans actresses are getting laid, so its appropriate",8,2022-01-25 04:14:04,<praw.models.comment_forest.CommentForest object at 0x000002541F7E4340>,sc0b8p,movies,t5_2qh3s,,False,False,t3_sc0b8p,t1_hu40poy,/r/movies/comments/sc0b8p/batgirl_officially_casts_ivory_aquino_as_first/hu40vr7/
516,hu3x2xp,,"~~One of the things I'll say about Batgirl as a non-fan -- I appreciate just how unashamed they are of their casting.  Maybe there is an element of virtue signaling because everyone is complex with multiple motivations.  But they cast Ruby Rose and she was openly bi and didn't give a shit.  Now Ivory Aquino with the same ""Yea, this is who we cast, isn't she great?"" attitude.~~

~~Other shows are undoubtedly taking strides (the article even mentions some), but Batgirl seems to be the one I'm always running into that's taking real positive strides.~~

Well screw you, comic book naming conventions!","~~One of the things I'll say about Batgirl as a non-fan -- I appreciate just how unashamed they are of their casting.  Maybe there is an element of virtue signaling because everyone is complex with multiple motivations.  But they cast Ruby Rose and she was openly bi and didn't give a shit.  Now Ivory Aquino with the same ""Yea, this is who we cast, isn't she great?"" attitude.~~

~~Other shows are undoubtedly taking strides (the article even mentions some), but Batgirl seems to be the one I'm always running into that's taking real positive strides.~~

Well screw you, comic book naming conventions!",-11,2022-01-25 03:42:34,<praw.models.comment_forest.CommentForest object at 0x000002541F816430>,sc0b8p,movies,t5_2qh3s,,1643083363.0,False,t3_sc0b8p,t1_hu3m328,/r/movies/comments/sc0b8p/batgirl_officially_casts_ivory_aquino_as_first/hu3x2xp/
517,hu55n39,Batmans_9th_Ab,There are only two genders: male and PoLiTiCal /s.,There are only two genders: male and PoLiTiCal /s.,7,2022-01-25 12:00:09,<praw.models.comment_forest.CommentForest object at 0x000002541F7E4580>,sc0b8p,movies,t5_2qh3s,,False,False,t3_sc0b8p,t1_hu3npmu,/r/movies/comments/sc0b8p/batgirl_officially_casts_ivory_aquino_as_first/hu55n39/
518,hu77yiz,big_hungry_joe,"It's the same conservative bullshit like with school shootings.

""Guys, it's not the fact we have widespread easy access to guns, it's clearly a mental health issue ""

""Oh, so you want affordable access to mental health resources for everyone?""

""....no.""","It's the same conservative bullshit like with school shootings.

""Guys, it's not the fact we have widespread easy access to guns, it's clearly a mental health issue ""

""Oh, so you want affordable access to mental health resources for everyone?""

""....no.""",2,2022-01-25 20:32:44,<praw.models.comment_forest.CommentForest object at 0x000002541F7E4640>,sc0b8p,movies,t5_2qh3s,,False,False,t3_sc0b8p,t1_hu76fr0,/r/movies/comments/sc0b8p/batgirl_officially_casts_ivory_aquino_as_first/hu77yiz/
519,hu3w2am,pipboy_warrior,Much appreciated! Unfortunately I never read much of the New 52 stuff outside of Swamp Thing and Animal Man.  I take it that it's a good run?,Much appreciated! Unfortunately I never read much of the New 52 stuff outside of Swamp Thing and Animal Man.  I take it that it's a good run?,11,2022-01-25 03:34:34,<praw.models.comment_forest.CommentForest object at 0x000002541F7E4760>,sc0b8p,movies,t5_2qh3s,,False,False,t3_sc0b8p,t1_hu3usdy,/r/movies/comments/sc0b8p/batgirl_officially_casts_ivory_aquino_as_first/hu3w2am/
520,hu82tiy,,[removed],[removed],-3,2022-01-25 23:54:04,<praw.models.comment_forest.CommentForest object at 0x000002541F7E4E20>,sc0b8p,movies,t5_2qh3s,,False,False,t3_sc0b8p,t1_hu6fumw,/r/movies/comments/sc0b8p/batgirl_officially_casts_ivory_aquino_as_first/hu82tiy/
521,hu6xjcf,IllustriousDealer303,I don't hate trans people nor do I care if the character is trans. But I've gotta at least admit there's a shit ton of toxicity within the trans community.,I don't hate trans people nor do I care if the character is trans. But I've gotta at least admit there's a shit ton of toxicity within the trans community.,-16,2022-01-25 19:27:52,<praw.models.comment_forest.CommentForest object at 0x000002547F6F9280>,sc0b8p,movies,t5_2qh3s,,False,False,t3_sc0b8p,t1_hu6fumw,/r/movies/comments/sc0b8p/batgirl_officially_casts_ivory_aquino_as_first/hu6xjcf/
522,hu4aym1,,[removed],[removed],0,2022-01-25 05:44:08,<praw.models.comment_forest.CommentForest object at 0x000002541F814310>,sc0b8p,movies,t5_2qh3s,,False,False,t3_sc0b8p,t1_hu499zo,/r/movies/comments/sc0b8p/batgirl_officially_casts_ivory_aquino_as_first/hu4aym1/
523,hu48w8z,HeartbreakGal,"This sub is hopeless, just check out of the thread of Elliot Page coming out and socially transitioning","This sub is hopeless, just check out of the thread of Elliot Page coming out and socially transitioning",74,2022-01-25 05:24:16,<praw.models.comment_forest.CommentForest object at 0x000002541F81A100>,sc0b8p,movies,t5_2qh3s,,False,False,t3_sc0b8p,t1_hu48kbs,/r/movies/comments/sc0b8p/batgirl_officially_casts_ivory_aquino_as_first/hu48w8z/
524,hu4jxe1,Skyreader13,"they downvote because the comment is very judgmental, which is what everyone hate regardless of space","they downvote because the comment is very judgmental, which is what everyone hate regardless of space",-26,2022-01-25 07:20:18,<praw.models.comment_forest.CommentForest object at 0x000002541F81A160>,sc0b8p,movies,t5_2qh3s,,False,False,t3_sc0b8p,t1_hu48kbs,/r/movies/comments/sc0b8p/batgirl_officially_casts_ivory_aquino_as_first/hu4jxe1/
525,hu75n2y,Hope_Burns_Bright,"Downvotes don't mean anything to me. Everyone downvoting me is either banned or too chickenshit to say something. They know what I'm saying is true and they hate being called out.

Fact is, transphobes (including TERFs) aren't welcome on the sub, and that's nowhere near a new policy. We will continue to enforce that and we're counting on people to point them out.","Downvotes don't mean anything to me. Everyone downvoting me is either banned or too chickenshit to say something. They know what I'm saying is true and they hate being called out.

Fact is, transphobes (including TERFs) aren't welcome on the sub, and that's nowhere near a new policy. We will continue to enforce that and we're counting on people to point them out.",4,2022-01-25 20:18:17,<praw.models.comment_forest.CommentForest object at 0x000002541F81A460>,sc0b8p,movies,t5_2qh3s,moderator,False,False,t3_sc0b8p,t1_hu74g9t,/r/movies/comments/sc0b8p/batgirl_officially_casts_ivory_aquino_as_first/hu75n2y/
526,hu5hdjr,TheRoyalWarlord,"Dude it don't matter if it's one time in the movie or all throughout, yall blow it way out of proportion every fucking time and act like somebody is trying to cram it down your throats. Yall did the same shit with the article about Brian Tyree's Phastos in Eternals here","Dude it don't matter if it's one time in the movie or all throughout, yall blow it way out of proportion every fucking time and act like somebody is trying to cram it down your throats. Yall did the same shit with the article about Brian Tyree's Phastos in Eternals here",8,2022-01-25 13:49:15,<praw.models.comment_forest.CommentForest object at 0x000002547A9B9160>,sc0b8p,movies,t5_2qh3s,,False,False,t3_sc0b8p,t1_hu4s933,/r/movies/comments/sc0b8p/batgirl_officially_casts_ivory_aquino_as_first/hu5hdjr/
527,hu4xqjc,EthanGodHelpMe,"If I’m reading this correctly, your comment roughly translates to:

“Trans people can exist as long as they don’t exist” 

Thank you for the courageous insight you have bestowed upon us. You must have thought long and hard and fought tooth and nail to provide your noble opinion to us humble redditors that know no better than to listen to CNN, wear skinny jeans, don’t strip others of their rights and protections, and drink starbucks unironically. /s

Edit: added a thing","If I’m reading this correctly, your comment roughly translates to:

“Trans people can exist as long as they don’t exist” 

Thank you for the courageous insight you have bestowed upon us. You must have thought long and hard and fought tooth and nail to provide your noble opinion to us humble redditors that know no better than to listen to CNN, wear skinny jeans, don’t strip others of their rights and protections, and drink starbucks unironically. /s

Edit: added a thing",21,2022-01-25 10:21:00,<praw.models.comment_forest.CommentForest object at 0x000002541E471BE0>,sc0b8p,movies,t5_2qh3s,,False,False,t3_sc0b8p,t1_hu4s933,/r/movies/comments/sc0b8p/batgirl_officially_casts_ivory_aquino_as_first/hu4xqjc/
528,hu4xkw5,demaxzero,Wow that's incorrect,Wow that's incorrect,8,2022-01-25 10:18:53,<praw.models.comment_forest.CommentForest object at 0x000002547A990EB0>,sc0b8p,movies,t5_2qh3s,,False,False,t3_sc0b8p,t1_hu4s933,/r/movies/comments/sc0b8p/batgirl_officially_casts_ivory_aquino_as_first/hu4xkw5/
529,hu4uwa1,imakefilms,give me 3 examples of it being thrown in your face.,give me 3 examples of it being thrown in your face.,24,2022-01-25 09:42:40,<praw.models.comment_forest.CommentForest object at 0x000002547A7D31C0>,sc0b8p,movies,t5_2qh3s,,False,False,t3_sc0b8p,t1_hu4s933,/r/movies/comments/sc0b8p/batgirl_officially_casts_ivory_aquino_as_first/hu4uwa1/
530,hu6t3cn,,[removed],[removed],2,2022-01-25 18:59:44,<praw.models.comment_forest.CommentForest object at 0x000002547A95AD90>,sc0b8p,movies,t5_2qh3s,,False,False,t3_sc0b8p,t1_hu6ostp,/r/movies/comments/sc0b8p/batgirl_officially_casts_ivory_aquino_as_first/hu6t3cn/
531,hu5xnt2,,"It's not about making them weaker, that's your little twist on it. Saying here's a new rendition of a classic character but turned up to eleven. It's just a little lazy imo.

What's more creative, copying someone's song or writing your own? 

Why copy and dial a superhero up to eleven to compensate when you could have an entirely new character.

The years have nothing to do with it if some like myself had the exact same opinion since initial release...","It's not about making them weaker, that's your little twist on it. Saying here's a new rendition of a classic character but turned up to eleven. It's just a little lazy imo.

What's more creative, copying someone's song or writing your own? 

Why copy and dial a superhero up to eleven to compensate when you could have an entirely new character.

The years have nothing to do with it if some like myself had the exact same opinion since initial release...",-10,2022-01-25 15:44:25,<praw.models.comment_forest.CommentForest object at 0x000002547A953D30>,sc0b8p,movies,t5_2qh3s,,False,False,t3_sc0b8p,t1_hu5w14o,/r/movies/comments/sc0b8p/batgirl_officially_casts_ivory_aquino_as_first/hu5xnt2/
532,hu3ke0t,Hope_Burns_Bright,It doesn't cheapen that milestone as much as you think it does. Let's wait and see.,It doesn't cheapen that milestone as much as you think it does. Let's wait and see.,14,2022-01-25 02:08:09,<praw.models.comment_forest.CommentForest object at 0x000002541F81A9A0>,sc0b8p,movies,t5_2qh3s,,False,False,t3_sc0b8p,t1_hu3k3wa,/r/movies/comments/sc0b8p/batgirl_officially_casts_ivory_aquino_as_first/hu3ke0t/
