,ID,Author,body,Comment,Score,Created On,Replies,Submission,Subreddit,Subreddit_ID,Distinguished,Edited,Is_submitter,link_id,Parent_id,Permalink
67,jca3vyh,agentOO0,"I've been sticking $30 worth of veggies up my ass for the past 11 years. That's about 30 veggies a day, 210 veggies a week, 10,920 veggies a year. To date, that's 120,120 veggies. Eight times the population of Anguilla. Those veggies were in my ass! You think you're better than me? Oh, you're not better than me. You eat my ass veggies every day. You pick up my ass veggies for healthy food. You throw my ass veggies in dishes and make sauces with them. You feed my ass veggies to your little daughter for snacks. You eat my ass veggies every day. All of you! You ALL eat my ass veggies! Oh, I'll laugh at you before you can laugh at me. Because your veggies have been in my ass.","I've been sticking $30 worth of veggies up my ass for the past 11 years. That's about 30 veggies a day, 210 veggies a week, 10,920 veggies a year. To date, that's 120,120 veggies. Eight times the population of Anguilla. Those veggies were in my ass! You think you're better than me? Oh, you're not better than me. You eat my ass veggies every day. You pick up my ass veggies for healthy food. You throw my ass veggies in dishes and make sauces with them. You feed my ass veggies to your little daughter for snacks. You eat my ass veggies every day. All of you! You ALL eat my ass veggies! Oh, I'll laugh at you before you can laugh at me. Because your veggies have been in my ass.",1,2023-03-15 11:33:10,<praw.models.comment_forest.CommentForest object at 0x0000025479329220>,11rgc2f,food,t5_2qh55,,False,False,t3_11rgc2f,t1_jc8iikw,/r/food/comments/11rgc2f/homemade_chicken_chow_fun_with_ass_veggies_scream/jca3vyh/
68,iltfeg5,Spazzyjizanator,That configuration is upsetting,That configuration is upsetting,71,2022-08-26 02:04:17,<praw.models.comment_forest.CommentForest object at 0x00000254213CFB50>,wxwbq4,food,t5_2qh55,,False,False,t3_wxwbq4,t3_wxwbq4,/r/food/comments/wxwbq4/i_ate_a_mac_n_cheese_smash_burger_with_pork_belly/iltfeg5/
69,iltgnpb,50_K,The ribs on top is really a poor plating choice.,The ribs on top is really a poor plating choice.,34,2022-08-26 02:13:59,<praw.models.comment_forest.CommentForest object at 0x00000254213CFBB0>,wxwbq4,food,t5_2qh55,,False,False,t3_wxwbq4,t3_wxwbq4,/r/food/comments/wxwbq4/i_ate_a_mac_n_cheese_smash_burger_with_pork_belly/iltgnpb/
70,ilth9eg,GetYourDichotomy,“That just don’t make no sense”,“That just don’t make no sense”,16,2022-08-26 02:18:40,<praw.models.comment_forest.CommentForest object at 0x00000254213CFD30>,wxwbq4,food,t5_2qh55,,False,False,t3_wxwbq4,t3_wxwbq4,/r/food/comments/wxwbq4/i_ate_a_mac_n_cheese_smash_burger_with_pork_belly/ilth9eg/
71,ilteyob,steppinonpissclams,Did it come with a defibrillator?,Did it come with a defibrillator?,20,2022-08-26 02:00:55,<praw.models.comment_forest.CommentForest object at 0x00000254213CFEB0>,wxwbq4,food,t5_2qh55,,False,False,t3_wxwbq4,t3_wxwbq4,/r/food/comments/wxwbq4/i_ate_a_mac_n_cheese_smash_burger_with_pork_belly/ilteyob/
72,iltezcq,,[deleted],[deleted],8,2022-08-26 02:01:04,<praw.models.comment_forest.CommentForest object at 0x00000254213CFF70>,wxwbq4,food,t5_2qh55,,False,False,t3_wxwbq4,t3_wxwbq4,/r/food/comments/wxwbq4/i_ate_a_mac_n_cheese_smash_burger_with_pork_belly/iltezcq/
73,iltu1pi,internetman666,Tried linking the stupid food thread and it wasn't allowed. Lol,Tried linking the stupid food thread and it wasn't allowed. Lol,3,2022-08-26 04:06:51,<praw.models.comment_forest.CommentForest object at 0x00000254792BC0D0>,wxwbq4,food,t5_2qh55,,False,False,t3_wxwbq4,t3_wxwbq4,/r/food/comments/wxwbq4/i_ate_a_mac_n_cheese_smash_burger_with_pork_belly/iltu1pi/
74,iltf1bv,moyismoy,"why would you put that in your body?

do you hate your self?","why would you put that in your body?

do you hate your self?",5,2022-08-26 02:01:29,<praw.models.comment_forest.CommentForest object at 0x00000254792BC2B0>,wxwbq4,food,t5_2qh55,,False,False,t3_wxwbq4,t3_wxwbq4,/r/food/comments/wxwbq4/i_ate_a_mac_n_cheese_smash_burger_with_pork_belly/iltf1bv/
75,iltjle6,bogantamer,This looks like bin scraps just shit every where,This looks like bin scraps just shit every where,4,2022-08-26 02:36:54,<praw.models.comment_forest.CommentForest object at 0x00000254792BC370>,wxwbq4,food,t5_2qh55,,False,False,t3_wxwbq4,t3_wxwbq4,/r/food/comments/wxwbq4/i_ate_a_mac_n_cheese_smash_burger_with_pork_belly/iltjle6/
76,iltjeyd,SluggishPrey,It almost looks like food gain consciousness and now it's trying get revenge on us,It almost looks like food gain consciousness and now it's trying get revenge on us,3,2022-08-26 02:35:29,<praw.models.comment_forest.CommentForest object at 0x00000254792BC4F0>,wxwbq4,food,t5_2qh55,,False,False,t3_wxwbq4,t3_wxwbq4,/r/food/comments/wxwbq4/i_ate_a_mac_n_cheese_smash_burger_with_pork_belly/iltjeyd/
77,iltsx84,euph_22,How are you supposed to physically eat that burger?,How are you supposed to physically eat that burger?,3,2022-08-26 03:56:18,<praw.models.comment_forest.CommentForest object at 0x00000254792BC550>,wxwbq4,food,t5_2qh55,,False,False,t3_wxwbq4,t3_wxwbq4,/r/food/comments/wxwbq4/i_ate_a_mac_n_cheese_smash_burger_with_pork_belly/iltsx84/
78,iltkzvk,Kevinmc479,You’re drunk.,You’re drunk.,2,2022-08-26 02:48:15,<praw.models.comment_forest.CommentForest object at 0x00000254792BC5B0>,wxwbq4,food,t5_2qh55,,False,False,t3_wxwbq4,t3_wxwbq4,/r/food/comments/wxwbq4/i_ate_a_mac_n_cheese_smash_burger_with_pork_belly/iltkzvk/
79,iltvy6l,ozmartian,"jfc thats the Frankestein of all burgers.

Seriously though, mac 'n cheese in a burger? Sounds awful.","jfc thats the Frankestein of all burgers.

Seriously though, mac 'n cheese in a burger? Sounds awful.",2,2022-08-26 04:25:01,<praw.models.comment_forest.CommentForest object at 0x00000254792BC610>,wxwbq4,food,t5_2qh55,,False,False,t3_wxwbq4,t3_wxwbq4,/r/food/comments/wxwbq4/i_ate_a_mac_n_cheese_smash_burger_with_pork_belly/iltvy6l/
80,ilug73c,unknown_to_I,Some ppl have to stop cooking fr,Some ppl have to stop cooking fr,2,2022-08-26 08:31:48,<praw.models.comment_forest.CommentForest object at 0x00000254792BC670>,wxwbq4,food,t5_2qh55,,False,False,t3_wxwbq4,t3_wxwbq4,/r/food/comments/wxwbq4/i_ate_a_mac_n_cheese_smash_burger_with_pork_belly/ilug73c/
81,iltrj95,lucieannegarcia,this looks nasty bruh,this looks nasty bruh,1,2022-08-26 03:43:36,<praw.models.comment_forest.CommentForest object at 0x00000254792BC6D0>,wxwbq4,food,t5_2qh55,,False,False,t3_wxwbq4,t3_wxwbq4,/r/food/comments/wxwbq4/i_ate_a_mac_n_cheese_smash_burger_with_pork_belly/iltrj95/
82,iltjst4,GayPerry_86,This looks like hot garbage,This looks like hot garbage,1,2022-08-26 02:38:33,<praw.models.comment_forest.CommentForest object at 0x00000254792BC730>,wxwbq4,food,t5_2qh55,,False,False,t3_wxwbq4,t3_wxwbq4,/r/food/comments/wxwbq4/i_ate_a_mac_n_cheese_smash_burger_with_pork_belly/iltjst4/
83,ilthciy,thechilecowboy,Imagine adding mushrooms in cream sauce...,Imagine adding mushrooms in cream sauce...,1,2022-08-26 02:19:22,<praw.models.comment_forest.CommentForest object at 0x00000254792BC790>,wxwbq4,food,t5_2qh55,,False,False,t3_wxwbq4,t3_wxwbq4,/r/food/comments/wxwbq4/i_ate_a_mac_n_cheese_smash_burger_with_pork_belly/ilthciy/
84,ilucprs,neoglow,Can you move the knife to one side so I can see where to avoid.,Can you move the knife to one side so I can see where to avoid.,1,2022-08-26 07:43:03,<praw.models.comment_forest.CommentForest object at 0x00000254792BC7F0>,wxwbq4,food,t5_2qh55,,False,False,t3_wxwbq4,t3_wxwbq4,/r/food/comments/wxwbq4/i_ate_a_mac_n_cheese_smash_burger_with_pork_belly/ilucprs/
85,iluftzh,cheesetonic,Why,Why,1,2022-08-26 08:26:39,<praw.models.comment_forest.CommentForest object at 0x00000254792BC850>,wxwbq4,food,t5_2qh55,,False,False,t3_wxwbq4,t3_wxwbq4,/r/food/comments/wxwbq4/i_ate_a_mac_n_cheese_smash_burger_with_pork_belly/iluftzh/
86,iltmpze,anthony_is_,![gif](giphy|xTiTnLEcaCn1EIrGjm),![gif](giphy|xTiTnLEcaCn1EIrGjm),-1,2022-08-26 03:02:27,<praw.models.comment_forest.CommentForest object at 0x00000254792BC8B0>,wxwbq4,food,t5_2qh55,,False,False,t3_wxwbq4,t3_wxwbq4,/r/food/comments/wxwbq4/i_ate_a_mac_n_cheese_smash_burger_with_pork_belly/iltmpze/
87,ilteu0g,AutoModerator,"Thank you for your submission, to avoid any frustrations this summer check out the sub rules [here](https://redd.it/wfg5zr).
---

*I am a bot, and this action was performed automatically. Please [contact the moderators of this subreddit](/message/compose/?to=/r/food) if you have any questions or concerns.*","Thank you for your submission, to avoid any frustrations this summer check out the sub rules [here](https://redd.it/wfg5zr).
---

*I am a bot, and this action was performed automatically. Please [contact the moderators of this subreddit](/message/compose/?to=/r/food) if you have any questions or concerns.*",0,2022-08-26 01:59:57,<praw.models.comment_forest.CommentForest object at 0x00000254792BC910>,wxwbq4,food,t5_2qh55,moderator,False,False,t3_wxwbq4,t3_wxwbq4,/r/food/comments/wxwbq4/i_ate_a_mac_n_cheese_smash_burger_with_pork_belly/ilteu0g/
88,iltf06c,jennystonermeyer,Nom nom,Nom nom,0,2022-08-26 02:01:14,<praw.models.comment_forest.CommentForest object at 0x00000254792BC970>,wxwbq4,food,t5_2qh55,,False,False,t3_wxwbq4,t3_wxwbq4,/r/food/comments/wxwbq4/i_ate_a_mac_n_cheese_smash_burger_with_pork_belly/iltf06c/
89,iltkttz,Johnny-Unitas,That would feed me and my wife.,That would feed me and my wife.,0,2022-08-26 02:46:51,<praw.models.comment_forest.CommentForest object at 0x00000254792BC9D0>,wxwbq4,food,t5_2qh55,,False,False,t3_wxwbq4,t3_wxwbq4,/r/food/comments/wxwbq4/i_ate_a_mac_n_cheese_smash_burger_with_pork_belly/iltkttz/
90,iltn0fe,No-Lab-2025,looks heavenly!!,looks heavenly!!,0,2022-08-26 03:04:51,<praw.models.comment_forest.CommentForest object at 0x00000254792BCA30>,wxwbq4,food,t5_2qh55,,False,False,t3_wxwbq4,t3_wxwbq4,/r/food/comments/wxwbq4/i_ate_a_mac_n_cheese_smash_burger_with_pork_belly/iltn0fe/
91,iltw0f9,cornbreadsdirtysheet,Psychedelic fever dream…..not in a good way.,Psychedelic fever dream…..not in a good way.,0,2022-08-26 04:25:36,<praw.models.comment_forest.CommentForest object at 0x00000254792BCA90>,wxwbq4,food,t5_2qh55,,False,False,t3_wxwbq4,t3_wxwbq4,/r/food/comments/wxwbq4/i_ate_a_mac_n_cheese_smash_burger_with_pork_belly/iltw0f9/
92,iltxxvf,lifeisbollocks,This is just wrong,This is just wrong,0,2022-08-26 04:44:52,<praw.models.comment_forest.CommentForest object at 0x00000254792BCAF0>,wxwbq4,food,t5_2qh55,,False,False,t3_wxwbq4,t3_wxwbq4,/r/food/comments/wxwbq4/i_ate_a_mac_n_cheese_smash_burger_with_pork_belly/iltxxvf/
93,ilu8l0n,ladyticasso33,this is horrible 🤢,this is horrible 🤢,0,2022-08-26 06:47:57,<praw.models.comment_forest.CommentForest object at 0x00000254792BCB50>,wxwbq4,food,t5_2qh55,,False,False,t3_wxwbq4,t3_wxwbq4,/r/food/comments/wxwbq4/i_ate_a_mac_n_cheese_smash_burger_with_pork_belly/ilu8l0n/
94,ilty4xb,Independent_Agent_36,Maybe if I was 23 instead of 43… years old.,Maybe if I was 23 instead of 43… years old.,1,2022-08-26 04:46:55,<praw.models.comment_forest.CommentForest object at 0x00000254792BCBB0>,wxwbq4,food,t5_2qh55,,False,False,t3_wxwbq4,t3_wxwbq4,/r/food/comments/wxwbq4/i_ate_a_mac_n_cheese_smash_burger_with_pork_belly/ilty4xb/
95,ilu1fvf,infoego,Did your heart stop from the saturated fat,Did your heart stop from the saturated fat,1,2022-08-26 05:22:19,<praw.models.comment_forest.CommentForest object at 0x00000254792BCC10>,wxwbq4,food,t5_2qh55,,False,False,t3_wxwbq4,t3_wxwbq4,/r/food/comments/wxwbq4/i_ate_a_mac_n_cheese_smash_burger_with_pork_belly/ilu1fvf/
96,ilu1o3c,dijonandgone,I would eat this but also lose all respect for the restaurant that served it to me,I would eat this but also lose all respect for the restaurant that served it to me,1,2022-08-26 05:24:52,<praw.models.comment_forest.CommentForest object at 0x00000254792BCC70>,wxwbq4,food,t5_2qh55,,False,False,t3_wxwbq4,t3_wxwbq4,/r/food/comments/wxwbq4/i_ate_a_mac_n_cheese_smash_burger_with_pork_belly/ilu1o3c/
97,ilu1vwn,zkwidgybananapudding,"Fuhhhhh. This is how the presiding messiah of pothead heaven dines. Ribs, burger, crispy pork, macaroni, fries…","Fuhhhhh. This is how the presiding messiah of pothead heaven dines. Ribs, burger, crispy pork, macaroni, fries…",1,2022-08-26 05:27:18,<praw.models.comment_forest.CommentForest object at 0x00000254792BCCD0>,wxwbq4,food,t5_2qh55,,False,False,t3_wxwbq4,t3_wxwbq4,/r/food/comments/wxwbq4/i_ate_a_mac_n_cheese_smash_burger_with_pork_belly/ilu1vwn/
98,ilu4yi2,aLsOne13,"wtf??.. like, WTF is this???","wtf??.. like, WTF is this???",1,2022-08-26 06:03:11,<praw.models.comment_forest.CommentForest object at 0x00000254792BCD30>,wxwbq4,food,t5_2qh55,,False,False,t3_wxwbq4,t3_wxwbq4,/r/food/comments/wxwbq4/i_ate_a_mac_n_cheese_smash_burger_with_pork_belly/ilu4yi2/
99,ilu62cv,Hashioli,It looks like a goddamn burger monster with beady eyes and sharp teeth pointing every which way,It looks like a goddamn burger monster with beady eyes and sharp teeth pointing every which way,1,2022-08-26 06:16:42,<praw.models.comment_forest.CommentForest object at 0x00000254792BCD90>,wxwbq4,food,t5_2qh55,,False,False,t3_wxwbq4,t3_wxwbq4,/r/food/comments/wxwbq4/i_ate_a_mac_n_cheese_smash_burger_with_pork_belly/ilu62cv/
100,ilu9ifg,babechonk,I didn't even notice the ribs on top of the bun😂😂 not gonna lie I'll probably order that too if I see something that interesting on the menu,I didn't even notice the ribs on top of the bun😂😂 not gonna lie I'll probably order that too if I see something that interesting on the menu,1,2022-08-26 06:59:59,<praw.models.comment_forest.CommentForest object at 0x00000254792BCDF0>,wxwbq4,food,t5_2qh55,,False,False,t3_wxwbq4,t3_wxwbq4,/r/food/comments/wxwbq4/i_ate_a_mac_n_cheese_smash_burger_with_pork_belly/ilu9ifg/
101,iluceq6,Simplebro_0,I got fat only by looking at this,I got fat only by looking at this,1,2022-08-26 07:38:53,<praw.models.comment_forest.CommentForest object at 0x00000254792BCE50>,wxwbq4,food,t5_2qh55,,False,False,t3_wxwbq4,t3_wxwbq4,/r/food/comments/wxwbq4/i_ate_a_mac_n_cheese_smash_burger_with_pork_belly/iluceq6/
102,ilufc4g,lufan132,Where's the beef?,Where's the beef?,1,2022-08-26 08:19:43,<praw.models.comment_forest.CommentForest object at 0x00000254792BCEB0>,wxwbq4,food,t5_2qh55,,False,False,t3_wxwbq4,t3_wxwbq4,/r/food/comments/wxwbq4/i_ate_a_mac_n_cheese_smash_burger_with_pork_belly/ilufc4g/
103,ilverka,,pour a can of dr. pepper over it to make it perfect!,pour a can of dr. pepper over it to make it perfect!,1,2022-08-26 14:12:46,<praw.models.comment_forest.CommentForest object at 0x00000254792BCF10>,wxwbq4,food,t5_2qh55,,False,False,t3_wxwbq4,t3_wxwbq4,/r/food/comments/wxwbq4/i_ate_a_mac_n_cheese_smash_burger_with_pork_belly/ilverka/
104,ilxj82i,HoneyShaft,"""kill me...""","""kill me...""",1,2022-08-26 22:42:38,<praw.models.comment_forest.CommentForest object at 0x00000254792BCF70>,wxwbq4,food,t5_2qh55,,False,False,t3_wxwbq4,t3_wxwbq4,/r/food/comments/wxwbq4/i_ate_a_mac_n_cheese_smash_burger_with_pork_belly/ilxj82i/
105,ilxxxkd,aylancroftor,Is a burger still a burger if you can't eat it with your hands anymore?,Is a burger still a burger if you can't eat it with your hands anymore?,1,2022-08-27 00:36:05,<praw.models.comment_forest.CommentForest object at 0x00000254792BCFD0>,wxwbq4,food,t5_2qh55,,False,False,t3_wxwbq4,t3_wxwbq4,/r/food/comments/wxwbq4/i_ate_a_mac_n_cheese_smash_burger_with_pork_belly/ilxxxkd/
106,ilyfjqk,MrCalabunga,Who dropped the plate?,Who dropped the plate?,1,2022-08-27 02:58:44,<praw.models.comment_forest.CommentForest object at 0x00000254792D3070>,wxwbq4,food,t5_2qh55,,False,False,t3_wxwbq4,t3_wxwbq4,/r/food/comments/wxwbq4/i_ate_a_mac_n_cheese_smash_burger_with_pork_belly/ilyfjqk/
107,jvxhx7k,EcstaticWoop,What am i looking at,What am i looking at,1,2023-08-12 22:30:40,<praw.models.comment_forest.CommentForest object at 0x00000254792D30D0>,wxwbq4,food,t5_2qh55,,False,False,t3_wxwbq4,t3_wxwbq4,/r/food/comments/wxwbq4/i_ate_a_mac_n_cheese_smash_burger_with_pork_belly/jvxhx7k/
108,ilu4nqv,MrXwiix,"Stunt food.

Fries on a burger- why? Makes them soggy

Burger is like the tower of Pisa, hard to eat

Shitload of sauce to make it look better and probably mask the taste/dryness of the burger. Or ruin a perfectly good burger

The ribs on top is completely unnecessary. 

Pasta on a burger... Just why? 

A lot of good food on their own doesn't make it good when thrown together on a burger bun. 

I'll pass on this one.","Stunt food.

Fries on a burger- why? Makes them soggy

Burger is like the tower of Pisa, hard to eat

Shitload of sauce to make it look better and probably mask the taste/dryness of the burger. Or ruin a perfectly good burger

The ribs on top is completely unnecessary. 

Pasta on a burger... Just why? 

A lot of good food on their own doesn't make it good when thrown together on a burger bun. 

I'll pass on this one.",14,2022-08-26 05:59:32,<praw.models.comment_forest.CommentForest object at 0x00000254213CFC10>,wxwbq4,food,t5_2qh55,,False,False,t3_wxwbq4,t1_iltfeg5,/r/food/comments/wxwbq4/i_ate_a_mac_n_cheese_smash_burger_with_pork_belly/ilu4nqv/
109,iltg9yf,jonathan42_4,"Yup agreed, once it's in the tummy she's all sorted though","Yup agreed, once it's in the tummy she's all sorted though",9,2022-08-26 02:11:01,<praw.models.comment_forest.CommentForest object at 0x00000254213CFC70>,wxwbq4,food,t5_2qh55,,False,True,t3_wxwbq4,t1_iltfeg5,/r/food/comments/wxwbq4/i_ate_a_mac_n_cheese_smash_burger_with_pork_belly/iltg9yf/
110,ilthxap,ZenithLags,Lol I was just thinking why exactly would they put it on your burger? You can’t eat your burger like that.,Lol I was just thinking why exactly would they put it on your burger? You can’t eat your burger like that.,7,2022-08-26 02:23:47,<praw.models.comment_forest.CommentForest object at 0x00000254213CFDF0>,wxwbq4,food,t5_2qh55,,False,False,t3_wxwbq4,t1_iltgnpb,/r/food/comments/wxwbq4/i_ate_a_mac_n_cheese_smash_burger_with_pork_belly/ilthxap/
111,ilti0yz,jackloganoliver,The ribs also just don't look right to me. Can't tell if it's a filter making the color grey or if they just weren't cooked properly.,The ribs also just don't look right to me. Can't tell if it's a filter making the color grey or if they just weren't cooked properly.,9,2022-08-26 02:24:34,<praw.models.comment_forest.CommentForest object at 0x00000254213CFE50>,wxwbq4,food,t5_2qh55,,False,False,t3_wxwbq4,t1_iltgnpb,/r/food/comments/wxwbq4/i_ate_a_mac_n_cheese_smash_burger_with_pork_belly/ilti0yz/
112,iltgluh,jonathan42_4,"No, just some complimentary blood pressure pills which was a nice touch","No, just some complimentary blood pressure pills which was a nice touch",2,2022-08-26 02:13:35,<praw.models.comment_forest.CommentForest object at 0x00000254792BC070>,wxwbq4,food,t5_2qh55,,False,True,t3_wxwbq4,t1_ilteyob,/r/food/comments/wxwbq4/i_ate_a_mac_n_cheese_smash_burger_with_pork_belly/iltgluh/
113,iltnfxb,vanndave,"I saw a comment somewhere recently asking how you can shorten your lifespan(jokingly). But this is how

Edit: would still eat it though tbh","I saw a comment somewhere recently asking how you can shorten your lifespan(jokingly). But this is how

Edit: would still eat it though tbh",4,2022-08-26 03:08:30,<praw.models.comment_forest.CommentForest object at 0x00000254792BC190>,wxwbq4,food,t5_2qh55,,False,False,t3_wxwbq4,t1_iltezcq,/r/food/comments/wxwbq4/i_ate_a_mac_n_cheese_smash_burger_with_pork_belly/iltnfxb/
114,iltonal,raggusfamilius,Op could be 12,Op could be 12,2,2022-08-26 03:18:39,<praw.models.comment_forest.CommentForest object at 0x00000254792BC250>,wxwbq4,food,t5_2qh55,,False,False,t3_wxwbq4,t1_iltezcq,/r/food/comments/wxwbq4/i_ate_a_mac_n_cheese_smash_burger_with_pork_belly/iltonal/
115,ilthnq3,Kawsbarr,That’s a great food I thought?![img](emote|t5_2qh55|2368),That’s a great food I thought?![img](emote|t5_2qh55|2368),2,2022-08-26 02:21:45,<praw.models.comment_forest.CommentForest object at 0x00000254792BC430>,wxwbq4,food,t5_2qh55,,False,False,t3_wxwbq4,t1_iltf1bv,/r/food/comments/wxwbq4/i_ate_a_mac_n_cheese_smash_burger_with_pork_belly/ilthnq3/
116,iltggwg,jonathan42_4,After training Back it was welcomed Cals tbh. Summers a long way off in NZ,After training Back it was welcomed Cals tbh. Summers a long way off in NZ,4,2022-08-26 02:12:32,<praw.models.comment_forest.CommentForest object at 0x00000254792BC490>,wxwbq4,food,t5_2qh55,,False,True,t3_wxwbq4,t1_iltf1bv,/r/food/comments/wxwbq4/i_ate_a_mac_n_cheese_smash_burger_with_pork_belly/iltggwg/
117,iluh0g3,Spazzyjizanator,"noodles on bread, cannot abide","noodles on bread, cannot abide",1,2022-08-26 08:43:18,<praw.models.comment_forest.CommentForest object at 0x00000254213CFCD0>,wxwbq4,food,t5_2qh55,,False,False,t3_wxwbq4,t1_ilu4nqv,/r/food/comments/wxwbq4/i_ate_a_mac_n_cheese_smash_burger_with_pork_belly/iluh0g3/
118,ilthd38,GetYourDichotomy,I don’t know you but I love your optimism.,I don’t know you but I love your optimism.,17,2022-08-26 02:19:29,<praw.models.comment_forest.CommentForest object at 0x00000254213CFD90>,wxwbq4,food,t5_2qh55,,False,False,t3_wxwbq4,t1_iltg9yf,/r/food/comments/wxwbq4/i_ate_a_mac_n_cheese_smash_burger_with_pork_belly/ilthd38/
119,ilu4wa4,Ammear,"Yeah, they look undercooked.

Also, the bones will get in the way of... everything.

Also, this isn't a ""burger"" by any stretch. Having a piece of bun at the bottom doesn't make it a burger, or even a sandwich. This is just a bunch of stuff that includes some bun.","Yeah, they look undercooked.

Also, the bones will get in the way of... everything.

Also, this isn't a ""burger"" by any stretch. Having a piece of bun at the bottom doesn't make it a burger, or even a sandwich. This is just a bunch of stuff that includes some bun.",3,2022-08-26 06:02:25,<praw.models.comment_forest.CommentForest object at 0x00000254213CFF10>,wxwbq4,food,t5_2qh55,,False,False,t3_wxwbq4,t1_ilti0yz,/r/food/comments/wxwbq4/i_ate_a_mac_n_cheese_smash_burger_with_pork_belly/ilu4wa4/
120,iltq8ja,ConsciousJohn,"Nice. Might want to add asprin, a statin and  nitroglycerin just in case","Nice. Might want to add asprin, a statin and  nitroglycerin just in case",6,2022-08-26 03:32:16,<praw.models.comment_forest.CommentForest object at 0x00000254792BC130>,wxwbq4,food,t5_2qh55,,False,False,t3_wxwbq4,t1_iltgluh,/r/food/comments/wxwbq4/i_ate_a_mac_n_cheese_smash_burger_with_pork_belly/iltq8ja/
121,iltsumj,,[deleted],[deleted],2,2022-08-26 03:55:38,<praw.models.comment_forest.CommentForest object at 0x00000254792BC310>,wxwbq4,food,t5_2qh55,,False,False,t3_wxwbq4,t1_iltonal,/r/food/comments/wxwbq4/i_ate_a_mac_n_cheese_smash_burger_with_pork_belly/iltsumj/
122,ilx4ts8,Hraesvelgr419,Having bread on the outside layer is specifically what makes something a sandwich.,Having bread on the outside layer is specifically what makes something a sandwich.,0,2022-08-26 21:01:25,<praw.models.comment_forest.CommentForest object at 0x00000254213CFFD0>,wxwbq4,food,t5_2qh55,,False,False,t3_wxwbq4,t1_ilu4wa4,/r/food/comments/wxwbq4/i_ate_a_mac_n_cheese_smash_burger_with_pork_belly/ilx4ts8/
123,ilx7bq9,LexLancet,Sprinkled with Ezetimibe and PCSK9 inhibitors.,Sprinkled with Ezetimibe and PCSK9 inhibitors.,2,2022-08-26 21:18:36,<praw.models.comment_forest.CommentForest object at 0x00000254792BC1F0>,wxwbq4,food,t5_2qh55,,False,False,t3_wxwbq4,t1_iltq8ja,/r/food/comments/wxwbq4/i_ate_a_mac_n_cheese_smash_burger_with_pork_belly/ilx7bq9/
124,iltsz32,raggusfamilius,True lol. You did say long though 🤷,True lol. You did say long though 🤷,2,2022-08-26 03:56:48,<praw.models.comment_forest.CommentForest object at 0x00000254792BC3D0>,wxwbq4,food,t5_2qh55,,False,False,t3_wxwbq4,t1_iltsumj,/r/food/comments/wxwbq4/i_ate_a_mac_n_cheese_smash_burger_with_pork_belly/iltsz32/
