,ID,Author,body,Comment,Score,Created On,Replies,Submission,Subreddit,Subreddit_ID,Distinguished,Edited,Is_submitter,link_id,Parent_id,Permalink
0,jc8b8sm,target_newbie,Scream bald eggs?,Scream bald eggs?,133,2023-03-15 00:43:57,<praw.models.comment_forest.CommentForest object at 0x0000025479321AC0>,11rgc2f,food,t5_2qh55,,False,False,t3_11rgc2f,t3_11rgc2f,/r/food/comments/11rgc2f/homemade_chicken_chow_fun_with_ass_veggies_scream/jc8b8sm/
1,jc8fe3c,GeneParmesanLives,I'm sorry with what?,I'm sorry with what?,81,2023-03-15 01:11:29,<praw.models.comment_forest.CommentForest object at 0x0000025479321B20>,11rgc2f,food,t5_2qh55,,False,False,t3_11rgc2f,t3_11rgc2f,/r/food/comments/11rgc2f/homemade_chicken_chow_fun_with_ass_veggies_scream/jc8fe3c/
2,jc8e175,turkstyx,🦴🍎🫖,🦴🍎🫖,56,2023-03-15 01:02:26,<praw.models.comment_forest.CommentForest object at 0x0000025479321E20>,11rgc2f,food,t5_2qh55,,False,False,t3_11rgc2f,t3_11rgc2f,/r/food/comments/11rgc2f/homemade_chicken_chow_fun_with_ass_veggies_scream/jc8e175/
3,jc8ag8k,crablegs_aus,I’m open as the next guy but I’m not a fan of eating ass.,I’m open as the next guy but I’m not a fan of eating ass.,78,2023-03-15 00:38:33,<praw.models.comment_forest.CommentForest object at 0x0000025479321EE0>,11rgc2f,food,t5_2qh55,,False,False,t3_11rgc2f,t3_11rgc2f,/r/food/comments/11rgc2f/homemade_chicken_chow_fun_with_ass_veggies_scream/jc8ag8k/
4,jc8g0y3,Escadon,My brain hurts.,My brain hurts.,17,2023-03-15 01:15:47,<praw.models.comment_forest.CommentForest object at 0x0000025479321F40>,11rgc2f,food,t5_2qh55,,False,False,t3_11rgc2f,t3_11rgc2f,/r/food/comments/11rgc2f/homemade_chicken_chow_fun_with_ass_veggies_scream/jc8g0y3/
5,jc8gzeb,squeezy102,"I'm sorry, *what* *kind of veggies?*","I'm sorry, *what* *kind of veggies?*",15,2023-03-15 01:22:07,<praw.models.comment_forest.CommentForest object at 0x0000025479329040>,11rgc2f,food,t5_2qh55,,False,False,t3_11rgc2f,t3_11rgc2f,/r/food/comments/11rgc2f/homemade_chicken_chow_fun_with_ass_veggies_scream/jc8gzeb/
6,jc8abay,shawnp2,Ass veggies?,Ass veggies?,28,2023-03-15 00:37:35,<praw.models.comment_forest.CommentForest object at 0x0000025479329100>,11rgc2f,food,t5_2qh55,,False,False,t3_11rgc2f,t3_11rgc2f,/r/food/comments/11rgc2f/homemade_chicken_chow_fun_with_ass_veggies_scream/jc8abay/
7,jc8gf8o,brendanb203,Not sure if I should be hungry or horny reading this post,Not sure if I should be hungry or horny reading this post,26,2023-03-15 01:18:27,<praw.models.comment_forest.CommentForest object at 0x00000254793291C0>,11rgc2f,food,t5_2qh55,,False,False,t3_11rgc2f,t3_11rgc2f,/r/food/comments/11rgc2f/homemade_chicken_chow_fun_with_ass_veggies_scream/jc8gf8o/
8,jc8q3js,GuysMcFellas,"""I'm going to make a funny post with intentional misspellings so I can get attention"".","""I'm going to make a funny post with intentional misspellings so I can get attention"".",11,2023-03-15 02:23:19,<praw.models.comment_forest.CommentForest object at 0x0000025479329340>,11rgc2f,food,t5_2qh55,,False,False,t3_11rgc2f,t3_11rgc2f,/r/food/comments/11rgc2f/homemade_chicken_chow_fun_with_ass_veggies_scream/jc8q3js/
9,jc8bssv,Longjumping-Limit827,I’ve heard of a portugese breakfast but care to elaborate further on the ass?,I’ve heard of a portugese breakfast but care to elaborate further on the ass?,7,2023-03-15 00:47:42,<praw.models.comment_forest.CommentForest object at 0x0000025479329400>,11rgc2f,food,t5_2qh55,,False,False,t3_11rgc2f,t3_11rgc2f,/r/food/comments/11rgc2f/homemade_chicken_chow_fun_with_ass_veggies_scream/jc8bssv/
10,jc8fzzd,im_a_real_boy_calico,Those veggies do look ass,Those veggies do look ass,7,2023-03-15 01:15:36,<praw.models.comment_forest.CommentForest object at 0x0000025479329460>,11rgc2f,food,t5_2qh55,,False,False,t3_11rgc2f,t3_11rgc2f,/r/food/comments/11rgc2f/homemade_chicken_chow_fun_with_ass_veggies_scream/jc8fzzd/
11,jc8le3p,,r/boneappletea,r/boneappletea,5,2023-03-15 01:51:24,<praw.models.comment_forest.CommentForest object at 0x0000025479329520>,11rgc2f,food,t5_2qh55,,False,False,t3_11rgc2f,t3_11rgc2f,/r/food/comments/11rgc2f/homemade_chicken_chow_fun_with_ass_veggies_scream/jc8le3p/
12,jc8htbn,fuckzuc798,"First off this person just blatantly throwing out that they eat ass, then boils eggs by screaming at them. Wild","First off this person just blatantly throwing out that they eat ass, then boils eggs by screaming at them. Wild",17,2023-03-15 01:27:35,<praw.models.comment_forest.CommentForest object at 0x0000025479329580>,11rgc2f,food,t5_2qh55,,False,False,t3_11rgc2f,t3_11rgc2f,/r/food/comments/11rgc2f/homemade_chicken_chow_fun_with_ass_veggies_scream/jc8htbn/
13,jc8m52n,,"There’s a bit too much ass in this version, I’m afraid.","There’s a bit too much ass in this version, I’m afraid.",3,2023-03-15 01:56:20,<praw.models.comment_forest.CommentForest object at 0x00000254793295E0>,11rgc2f,food,t5_2qh55,,False,False,t3_11rgc2f,t3_11rgc2f,/r/food/comments/11rgc2f/homemade_chicken_chow_fun_with_ass_veggies_scream/jc8m52n/
14,jc8hp9y,macph,"I upvoted to force more people to read this title. Let's get this to the top!

(edit: now that I've read the other comments it seems like this is just karma farming. Whoops)","I upvoted to force more people to read this title. Let's get this to the top!

(edit: now that I've read the other comments it seems like this is just karma farming. Whoops)",7,2023-03-15 01:26:51,<praw.models.comment_forest.CommentForest object at 0x00000254793296A0>,11rgc2f,food,t5_2qh55,,1678856408.0,False,t3_11rgc2f,t3_11rgc2f,/r/food/comments/11rgc2f/homemade_chicken_chow_fun_with_ass_veggies_scream/jc8hp9y/
15,jc8lkj6,JDS150k,*BALD EGGS!!!*,*BALD EGGS!!!*,2,2023-03-15 01:52:35,<praw.models.comment_forest.CommentForest object at 0x0000025479329700>,11rgc2f,food,t5_2qh55,,False,False,t3_11rgc2f,t3_11rgc2f,/r/food/comments/11rgc2f/homemade_chicken_chow_fun_with_ass_veggies_scream/jc8lkj6/
16,jc8otk3,ColinFCross,Everyone’s out here eatin ass these days…,Everyone’s out here eatin ass these days…,2,2023-03-15 02:14:26,<praw.models.comment_forest.CommentForest object at 0x0000025479329760>,11rgc2f,food,t5_2qh55,,False,False,t3_11rgc2f,t3_11rgc2f,/r/food/comments/11rgc2f/homemade_chicken_chow_fun_with_ass_veggies_scream/jc8otk3/
17,jvxhdht,EcstaticWoop,ASS?!,ASS?!,2,2023-08-12 22:26:39,<praw.models.comment_forest.CommentForest object at 0x00000254793297C0>,11rgc2f,food,t5_2qh55,,False,False,t3_11rgc2f,t3_11rgc2f,/r/food/comments/11rgc2f/homemade_chicken_chow_fun_with_ass_veggies_scream/jvxhdht/
18,jc8gniu,avion-gamer,Jeffrey dahmer shit,Jeffrey dahmer shit,2,2023-03-15 01:19:58,<praw.models.comment_forest.CommentForest object at 0x0000025479329820>,11rgc2f,food,t5_2qh55,,False,False,t3_11rgc2f,t3_11rgc2f,/r/food/comments/11rgc2f/homemade_chicken_chow_fun_with_ass_veggies_scream/jc8gniu/
19,jc8dzks,phantalien,"Doesn't look greasy, great job!","Doesn't look greasy, great job!",1,2023-03-15 01:02:09,<praw.models.comment_forest.CommentForest object at 0x0000025479329880>,11rgc2f,food,t5_2qh55,,False,False,t3_11rgc2f,t3_11rgc2f,/r/food/comments/11rgc2f/homemade_chicken_chow_fun_with_ass_veggies_scream/jc8dzks/
20,jc8ah0w,,[deleted],[deleted],-2,2023-03-15 00:38:42,<praw.models.comment_forest.CommentForest object at 0x00000254793298E0>,11rgc2f,food,t5_2qh55,,False,False,t3_11rgc2f,t3_11rgc2f,/r/food/comments/11rgc2f/homemade_chicken_chow_fun_with_ass_veggies_scream/jc8ah0w/
21,jc8ivj4,the-funky-breather,These people are so old school…. Ass Vegys peeps: 🥕🥒  🍆 < —- vegsy that go in asses.,These people are so old school…. Ass Vegys peeps: 🥕🥒  🍆 < —- vegsy that go in asses.,1,2023-03-15 01:34:38,<praw.models.comment_forest.CommentForest object at 0x0000025479329940>,11rgc2f,food,t5_2qh55,,False,False,t3_11rgc2f,t3_11rgc2f,/r/food/comments/11rgc2f/homemade_chicken_chow_fun_with_ass_veggies_scream/jc8ivj4/
22,jc8ixjf,niner5foxtrot,If it’s pig ass then I’m all in,If it’s pig ass then I’m all in,1,2023-03-15 01:35:01,<praw.models.comment_forest.CommentForest object at 0x0000025479329A60>,11rgc2f,food,t5_2qh55,,False,False,t3_11rgc2f,t3_11rgc2f,/r/food/comments/11rgc2f/homemade_chicken_chow_fun_with_ass_veggies_scream/jc8ixjf/
23,jc8j5kj,MakashiBlade,"Not exactly the picture I'm hoping for when I see the words ""fun with ass"" but it does look tasty","Not exactly the picture I'm hoping for when I see the words ""fun with ass"" but it does look tasty",1,2023-03-15 01:36:31,<praw.models.comment_forest.CommentForest object at 0x0000025479329AC0>,11rgc2f,food,t5_2qh55,,False,False,t3_11rgc2f,t3_11rgc2f,/r/food/comments/11rgc2f/homemade_chicken_chow_fun_with_ass_veggies_scream/jc8j5kj/
24,jc8jtyc,Jcdefore,Those ingredients are gonna make you sneeze out of your butt.,Those ingredients are gonna make you sneeze out of your butt.,1,2023-03-15 01:41:00,<praw.models.comment_forest.CommentForest object at 0x0000025479329B20>,11rgc2f,food,t5_2qh55,,False,False,t3_11rgc2f,t3_11rgc2f,/r/food/comments/11rgc2f/homemade_chicken_chow_fun_with_ass_veggies_scream/jc8jtyc/
25,jc8jzp9,jackbauer6916,"Good thing you didn't go overboard with a tiny splash.  Stuck with just a teeny tiny one, and your fun scream eggs look hella ass.","Good thing you didn't go overboard with a tiny splash.  Stuck with just a teeny tiny one, and your fun scream eggs look hella ass.",1,2023-03-15 01:42:02,<praw.models.comment_forest.CommentForest object at 0x0000025479329B80>,11rgc2f,food,t5_2qh55,,False,False,t3_11rgc2f,t3_11rgc2f,/r/food/comments/11rgc2f/homemade_chicken_chow_fun_with_ass_veggies_scream/jc8jzp9/
26,jc8lakk,Sally_twodicks,Okay. At first I thought it just said chicken chow fun with ass [period] I didn't even get to the scream bald egg yet. Idk if it was the bubble hash but I literally just cried laughing.,Okay. At first I thought it just said chicken chow fun with ass [period] I didn't even get to the scream bald egg yet. Idk if it was the bubble hash but I literally just cried laughing.,1,2023-03-15 01:50:45,<praw.models.comment_forest.CommentForest object at 0x0000025479329BE0>,11rgc2f,food,t5_2qh55,,False,False,t3_11rgc2f,t3_11rgc2f,/r/food/comments/11rgc2f/homemade_chicken_chow_fun_with_ass_veggies_scream/jc8lakk/
27,jc8lk5w,Jah_Kno_Star,All I heard was that its fun to chow ass,All I heard was that its fun to chow ass,1,2023-03-15 01:52:31,<praw.models.comment_forest.CommentForest object at 0x0000025479329C40>,11rgc2f,food,t5_2qh55,,False,False,t3_11rgc2f,t3_11rgc2f,/r/food/comments/11rgc2f/homemade_chicken_chow_fun_with_ass_veggies_scream/jc8lk5w/
28,jc8lrtb,eksyte,Ass veggies… YUM!,Ass veggies… YUM!,1,2023-03-15 01:53:54,<praw.models.comment_forest.CommentForest object at 0x0000025479329CA0>,11rgc2f,food,t5_2qh55,,False,False,t3_11rgc2f,t3_11rgc2f,/r/food/comments/11rgc2f/homemade_chicken_chow_fun_with_ass_veggies_scream/jc8lrtb/
29,jc8lsgk,future8138,Sounds like you will need ass cream instead of ass and scream,Sounds like you will need ass cream instead of ass and scream,1,2023-03-15 01:54:00,<praw.models.comment_forest.CommentForest object at 0x0000025479329D00>,11rgc2f,food,t5_2qh55,,False,False,t3_11rgc2f,t3_11rgc2f,/r/food/comments/11rgc2f/homemade_chicken_chow_fun_with_ass_veggies_scream/jc8lsgk/
30,jc8m31n,obi-whine-kenobi,I once had an ass meat platter.  10/10 would recommend.,I once had an ass meat platter.  10/10 would recommend.,1,2023-03-15 01:55:57,<praw.models.comment_forest.CommentForest object at 0x0000025479329D60>,11rgc2f,food,t5_2qh55,,False,False,t3_11rgc2f,t3_11rgc2f,/r/food/comments/11rgc2f/homemade_chicken_chow_fun_with_ass_veggies_scream/jc8m31n/
31,jc8m9d1,awakelikeanowl,Love me some ass veggies,Love me some ass veggies,1,2023-03-15 01:57:08,<praw.models.comment_forest.CommentForest object at 0x0000025479329DC0>,11rgc2f,food,t5_2qh55,,False,False,t3_11rgc2f,t3_11rgc2f,/r/food/comments/11rgc2f/homemade_chicken_chow_fun_with_ass_veggies_scream/jc8m9d1/
32,jc8mhkm,Cocobean1900,It was great - till your splash (gallon) of soy sauce (allergic here).,It was great - till your splash (gallon) of soy sauce (allergic here).,1,2023-03-15 01:58:39,<praw.models.comment_forest.CommentForest object at 0x0000025479329E20>,11rgc2f,food,t5_2qh55,,False,False,t3_11rgc2f,t3_11rgc2f,/r/food/comments/11rgc2f/homemade_chicken_chow_fun_with_ass_veggies_scream/jc8mhkm/
33,jc8njvd,masteroftrying,"To be fair, 5 bits of green onion ARE ass veggies.","To be fair, 5 bits of green onion ARE ass veggies.",1,2023-03-15 02:05:46,<praw.models.comment_forest.CommentForest object at 0x0000025479329E80>,11rgc2f,food,t5_2qh55,,False,False,t3_11rgc2f,t3_11rgc2f,/r/food/comments/11rgc2f/homemade_chicken_chow_fun_with_ass_veggies_scream/jc8njvd/
34,jc8nk2b,Grandahl13,View their post history. Really weird account.,View their post history. Really weird account.,1,2023-03-15 02:05:49,<praw.models.comment_forest.CommentForest object at 0x0000025479329EE0>,11rgc2f,food,t5_2qh55,,False,False,t3_11rgc2f,t3_11rgc2f,/r/food/comments/11rgc2f/homemade_chicken_chow_fun_with_ass_veggies_scream/jc8nk2b/
35,jc8o361,TimelyNeedleworker57,Umm…,Umm…,1,2023-03-15 02:09:23,<praw.models.comment_forest.CommentForest object at 0x0000025479329F40>,11rgc2f,food,t5_2qh55,,False,False,t3_11rgc2f,t3_11rgc2f,/r/food/comments/11rgc2f/homemade_chicken_chow_fun_with_ass_veggies_scream/jc8o361/
36,jc8o41y,Automatic_River_8180,"I'm a big BIG fan of ass veggies, YUM 🤤","I'm a big BIG fan of ass veggies, YUM 🤤",1,2023-03-15 02:09:33,<praw.models.comment_forest.CommentForest object at 0x0000025479329FA0>,11rgc2f,food,t5_2qh55,,False,False,t3_11rgc2f,t3_11rgc2f,/r/food/comments/11rgc2f/homemade_chicken_chow_fun_with_ass_veggies_scream/jc8o41y/
37,jc8q0qz,nyr_nyy_nyg_nyk,I’m sorry chow fun with what?,I’m sorry chow fun with what?,1,2023-03-15 02:22:47,<praw.models.comment_forest.CommentForest object at 0x000002547A670040>,11rgc2f,food,t5_2qh55,,False,False,t3_11rgc2f,t3_11rgc2f,/r/food/comments/11rgc2f/homemade_chicken_chow_fun_with_ass_veggies_scream/jc8q0qz/
38,jc8ry3c,PunkECat,Skip the chow fun lol https://youtu.be/9swWCH1r3bk,Skip the chow fun lol https://youtu.be/9swWCH1r3bk,1,2023-03-15 02:36:27,<praw.models.comment_forest.CommentForest object at 0x000002547A6700A0>,11rgc2f,food,t5_2qh55,,False,False,t3_11rgc2f,t3_11rgc2f,/r/food/comments/11rgc2f/homemade_chicken_chow_fun_with_ass_veggies_scream/jc8ry3c/
39,jc8rzvd,Doggo-Lovato,This looks really good. Read the title after the pic got my attention and couldn’t stop laughing. Thanks op,This looks really good. Read the title after the pic got my attention and couldn’t stop laughing. Thanks op,1,2023-03-15 02:36:49,<praw.models.comment_forest.CommentForest object at 0x000002547A670100>,11rgc2f,food,t5_2qh55,,False,False,t3_11rgc2f,t3_11rgc2f,/r/food/comments/11rgc2f/homemade_chicken_chow_fun_with_ass_veggies_scream/jc8rzvd/
40,jc8tdil,LukeSelwyn,I'm sorry... Did you just say this food was made with...ass?,I'm sorry... Did you just say this food was made with...ass?,1,2023-03-15 02:46:46,<praw.models.comment_forest.CommentForest object at 0x000002547A670160>,11rgc2f,food,t5_2qh55,,False,False,t3_11rgc2f,t3_11rgc2f,/r/food/comments/11rgc2f/homemade_chicken_chow_fun_with_ass_veggies_scream/jc8tdil/
41,jc8uqxh,softwetsausage,Ass scream bald egg.,Ass scream bald egg.,1,2023-03-15 02:56:43,<praw.models.comment_forest.CommentForest object at 0x000002547A6701C0>,11rgc2f,food,t5_2qh55,,False,False,t3_11rgc2f,t3_11rgc2f,/r/food/comments/11rgc2f/homemade_chicken_chow_fun_with_ass_veggies_scream/jc8uqxh/
42,jc8wz0u,MrsLadyZedd,Oh I love chow fun.,Oh I love chow fun.,1,2023-03-15 03:13:37,<praw.models.comment_forest.CommentForest object at 0x000002547A670220>,11rgc2f,food,t5_2qh55,,False,False,t3_11rgc2f,t3_11rgc2f,/r/food/comments/11rgc2f/homemade_chicken_chow_fun_with_ass_veggies_scream/jc8wz0u/
43,jc96px6,MidnightSunCreative,[My kind of meal!](https://www.youtube.com/watch?v=GGye1pK2ysQ),[My kind of meal!](https://www.youtube.com/watch?v=GGye1pK2ysQ),1,2023-03-15 04:36:50,<praw.models.comment_forest.CommentForest object at 0x000002547A670280>,11rgc2f,food,t5_2qh55,,False,False,t3_11rgc2f,t3_11rgc2f,/r/food/comments/11rgc2f/homemade_chicken_chow_fun_with_ass_veggies_scream/jc96px6/
44,jc9eu7j,Objective_Plan_8266,I'm still looking for the ass,I'm still looking for the ass,1,2023-03-15 06:06:17,<praw.models.comment_forest.CommentForest object at 0x000002547A6702E0>,11rgc2f,food,t5_2qh55,,False,False,t3_11rgc2f,t3_11rgc2f,/r/food/comments/11rgc2f/homemade_chicken_chow_fun_with_ass_veggies_scream/jc9eu7j/
45,jc9vcpt,Kevin4317Ot,"Wow, this food is amazing!","Wow, this food is amazing!",1,2023-03-15 09:50:30,<praw.models.comment_forest.CommentForest object at 0x000002547A670340>,11rgc2f,food,t5_2qh55,,False,False,t3_11rgc2f,t3_11rgc2f,/r/food/comments/11rgc2f/homemade_chicken_chow_fun_with_ass_veggies_scream/jc9vcpt/
46,jc9wkon,Michael5804Iu,this is great!,this is great!,1,2023-03-15 10:06:37,<praw.models.comment_forest.CommentForest object at 0x000002547A6703A0>,11rgc2f,food,t5_2qh55,,False,False,t3_11rgc2f,t3_11rgc2f,/r/food/comments/11rgc2f/homemade_chicken_chow_fun_with_ass_veggies_scream/jc9wkon/
47,jc9x4wd,Silly-mendeleev2,Looks tempting.,Looks tempting.,1,2023-03-15 10:14:00,<praw.models.comment_forest.CommentForest object at 0x000002547A670400>,11rgc2f,food,t5_2qh55,,False,False,t3_11rgc2f,t3_11rgc2f,/r/food/comments/11rgc2f/homemade_chicken_chow_fun_with_ass_veggies_scream/jc9x4wd/
48,jcb3f2z,,"Thanks, I hate  Chow Fun with Ass","Thanks, I hate  Chow Fun with Ass",1,2023-03-15 15:57:19,<praw.models.comment_forest.CommentForest object at 0x000002547A670460>,11rgc2f,food,t5_2qh55,,False,False,t3_11rgc2f,t3_11rgc2f,/r/food/comments/11rgc2f/homemade_chicken_chow_fun_with_ass_veggies_scream/jcb3f2z/
49,jc8c1ve,Franticalmond2,"OP must be absolutely wasted, lmao.","OP must be absolutely wasted, lmao.",122,2023-03-15 00:49:25,<praw.models.comment_forest.CommentForest object at 0x0000025479321B80>,11rgc2f,food,t5_2qh55,,False,False,t3_11rgc2f,t1_jc8b8sm,/r/food/comments/11rgc2f/homemade_chicken_chow_fun_with_ass_veggies_scream/jc8c1ve/
50,jc8ip7u,ITeechYoKidsArt,Goes with the ass.,Goes with the ass.,101,2023-03-15 01:33:28,<praw.models.comment_forest.CommentForest object at 0x0000025479321BE0>,11rgc2f,food,t5_2qh55,,False,False,t3_11rgc2f,t1_jc8b8sm,/r/food/comments/11rgc2f/homemade_chicken_chow_fun_with_ass_veggies_scream/jc8ip7u/
51,jc8lbav,algonquinroundtable,This is their schtick for karma farming. Their profile is full of deliberate misspellings.,This is their schtick for karma farming. Their profile is full of deliberate misspellings.,55,2023-03-15 01:50:53,<praw.models.comment_forest.CommentForest object at 0x0000025479321C40>,11rgc2f,food,t5_2qh55,,False,False,t3_11rgc2f,t1_jc8b8sm,/r/food/comments/11rgc2f/homemade_chicken_chow_fun_with_ass_veggies_scream/jc8lbav/
52,jc8hpql,the_original_Retro,"Slightly failed anagram or entirely failed pun of ""scrambled""

With the deliberate abbreviation to ""ass"", methinks it 's all OP trying to be clever.","Slightly failed anagram or entirely failed pun of ""scrambled""

With the deliberate abbreviation to ""ass"", methinks it 's all OP trying to be clever.",14,2023-03-15 01:26:56,<praw.models.comment_forest.CommentForest object at 0x0000025479321CA0>,11rgc2f,food,t5_2qh55,,False,False,t3_11rgc2f,t1_jc8b8sm,/r/food/comments/11rgc2f/homemade_chicken_chow_fun_with_ass_veggies_scream/jc8hpql/
53,jc8k34o,Giblet_,"I only eat my eggs bald. Nothing worse than a hairy egg. Not sure where the scream comes from, but guessing it's whoever the ass belongs to.","I only eat my eggs bald. Nothing worse than a hairy egg. Not sure where the scream comes from, but guessing it's whoever the ass belongs to.",6,2023-03-15 01:42:40,<praw.models.comment_forest.CommentForest object at 0x0000025479321D00>,11rgc2f,food,t5_2qh55,,False,False,t3_11rgc2f,t1_jc8b8sm,/r/food/comments/11rgc2f/homemade_chicken_chow_fun_with_ass_veggies_scream/jc8k34o/
54,jc8jeqf,elevenminutesago,"Cue [""Scream cheese""](https://tenor.com/s1Sr.gif) from Hotel Transylvania.","Cue [""Scream cheese""](https://tenor.com/s1Sr.gif) from Hotel Transylvania.",3,2023-03-15 01:38:13,<praw.models.comment_forest.CommentForest object at 0x0000025479321D60>,11rgc2f,food,t5_2qh55,,False,False,t3_11rgc2f,t1_jc8b8sm,/r/food/comments/11rgc2f/homemade_chicken_chow_fun_with_ass_veggies_scream/jc8jeqf/
55,jcc4a4o,from_the_interwebz,r/boneappletea,r/boneappletea,1,2023-03-15 19:43:57,<praw.models.comment_forest.CommentForest object at 0x0000025479321DC0>,11rgc2f,food,t5_2qh55,,False,False,t3_11rgc2f,t1_jc8b8sm,/r/food/comments/11rgc2f/homemade_chicken_chow_fun_with_ass_veggies_scream/jcc4a4o/
56,jc8qy0t,inn0cent-bystander,"Word wrap made mine say ""Chicken chow fun with ass.""","Word wrap made mine say ""Chicken chow fun with ass.""",14,2023-03-15 02:29:15,<praw.models.comment_forest.CommentForest object at 0x0000025479321E80>,11rgc2f,food,t5_2qh55,,False,False,t3_11rgc2f,t1_jc8fe3c,/r/food/comments/11rgc2f/homemade_chicken_chow_fun_with_ass_veggies_scream/jc8qy0t/
57,jc8esv0,WinkyTheFrog,Tag me in then,Tag me in then,24,2023-03-15 01:07:35,<praw.models.comment_forest.CommentForest object at 0x0000025479321FA0>,11rgc2f,food,t5_2qh55,,False,False,t3_11rgc2f,t1_jc8ag8k,/r/food/comments/11rgc2f/homemade_chicken_chow_fun_with_ass_veggies_scream/jc8esv0/
58,jc8iikw,SylvieJay,"🍆🥒🥕 y'know, ass veggies. Come now, you are browsing the veggie aisle and never thought 'hmm, that's an ass veggie'","🍆🥒🥕 y'know, ass veggies. Come now, you are browsing the veggie aisle and never thought 'hmm, that's an ass veggie'",12,2023-03-15 01:32:15,<praw.models.comment_forest.CommentForest object at 0x0000025479329160>,11rgc2f,food,t5_2qh55,,False,False,t3_11rgc2f,t1_jc8gzeb,/r/food/comments/11rgc2f/homemade_chicken_chow_fun_with_ass_veggies_scream/jc8iikw/
59,jc8hyo0,SylvieJay,"Yes, ass veggies with scream bald eggs. You ___absolutely know___ you are having a super fun time when your ass veggies scream ' bald eggs'","Yes, ass veggies with scream bald eggs. You ___absolutely know___ you are having a super fun time when your ass veggies scream ' bald eggs'",18,2023-03-15 01:28:35,<praw.models.comment_forest.CommentForest object at 0x0000025479329280>,11rgc2f,food,t5_2qh55,,False,False,t3_11rgc2f,t1_jc8abay,/r/food/comments/11rgc2f/homemade_chicken_chow_fun_with_ass_veggies_scream/jc8hyo0/
60,jc8n3md,,I heard those really stink.,I heard those really stink.,5,2023-03-15 02:02:41,<praw.models.comment_forest.CommentForest object at 0x00000254793292E0>,11rgc2f,food,t5_2qh55,,False,False,t3_11rgc2f,t1_jc8abay,/r/food/comments/11rgc2f/homemade_chicken_chow_fun_with_ass_veggies_scream/jc8n3md/
61,jc8gu0p,,¿Porqueno los dos?,¿Porqueno los dos?,6,2023-03-15 01:21:09,<praw.models.comment_forest.CommentForest object at 0x00000254793293A0>,11rgc2f,food,t5_2qh55,,False,False,t3_11rgc2f,t1_jc8gf8o,/r/food/comments/11rgc2f/homemade_chicken_chow_fun_with_ass_veggies_scream/jc8gu0p/
62,jc8gxrk,LifeInLaffy,"HE SAID CHOW FUN WITH ASS.

NOTICE THE PERIOD TO EXPRESS FINALITY","HE SAID CHOW FUN WITH ASS.

NOTICE THE PERIOD TO EXPRESS FINALITY",8,2023-03-15 01:21:49,<praw.models.comment_forest.CommentForest object at 0x00000254793294C0>,11rgc2f,food,t5_2qh55,,False,False,t3_11rgc2f,t1_jc8bssv,/r/food/comments/11rgc2f/homemade_chicken_chow_fun_with_ass_veggies_scream/jc8gxrk/
63,jc8m6zj,eksyte,"**COOK! DAMN YOU EGGS, COOK!**","**COOK! DAMN YOU EGGS, COOK!**",4,2023-03-15 01:56:41,<praw.models.comment_forest.CommentForest object at 0x0000025479329640>,11rgc2f,food,t5_2qh55,,False,False,t3_11rgc2f,t1_jc8htbn,/r/food/comments/11rgc2f/homemade_chicken_chow_fun_with_ass_veggies_scream/jc8m6zj/
64,jc8buja,Franticalmond2,How drunk are you?,How drunk are you?,4,2023-03-15 00:48:02,<praw.models.comment_forest.CommentForest object at 0x00000254793299A0>,11rgc2f,food,t5_2qh55,,False,False,t3_11rgc2f,t1_jc8ah0w,/r/food/comments/11rgc2f/homemade_chicken_chow_fun_with_ass_veggies_scream/jc8buja/
65,jc8azvj,target_newbie,Not any better,Not any better,4,2023-03-15 00:42:17,<praw.models.comment_forest.CommentForest object at 0x0000025479329A00>,11rgc2f,food,t5_2qh55,,False,False,t3_11rgc2f,t1_jc8ah0w,/r/food/comments/11rgc2f/homemade_chicken_chow_fun_with_ass_veggies_scream/jc8azvj/
66,jc8go35,,<slap>,<slap>,11,2023-03-15 01:20:04,<praw.models.comment_forest.CommentForest object at 0x00000254793290A0>,11rgc2f,food,t5_2qh55,,False,False,t3_11rgc2f,t1_jc8esv0,/r/food/comments/11rgc2f/homemade_chicken_chow_fun_with_ass_veggies_scream/jc8go35/
