,ID,Author,body,Comment,Score,Created On,Replies,Submission,Subreddit,Subreddit_ID,Distinguished,Edited,Is_submitter,link_id,Parent_id,Permalink
78,jdqwjpn,jelllybears,It’s almost like Pokémon is a game geared towards children. Go fucking figure,It’s almost like Pokémon is a game geared towards children. Go fucking figure,2,2023-03-26 14:16:25,<praw.models.comment_forest.CommentForest object at 0x0000022EEE1A4190>,122knvo,pokemon,t5_2qmeb,,False,False,t3_122knvo,t1_jdqszap,/r/pokemon/comments/122knvo/my_gf24_who_has_never_played_any_pokémon_game/jdqwjpn/
79,jdry6dk,Nyxily,Now I feel old. :(,Now I feel old. :(,11,2023-03-26 18:47:23,<praw.models.comment_forest.CommentForest object at 0x0000022EEE198C40>,122knvo,pokemon,t5_2qmeb,,False,False,t3_122knvo,t1_jdrl5g8,/r/pokemon/comments/122knvo/my_gf24_who_has_never_played_any_pokémon_game/jdry6dk/
80,jds5zki,Gamengine,At least you COULD turn it off until just over 3-4 years ago.,At least you COULD turn it off until just over 3-4 years ago.,3,2023-03-26 19:42:33,<praw.models.comment_forest.CommentForest object at 0x0000022EEE198CD0>,122knvo,pokemon,t5_2qmeb,,False,False,t3_122knvo,t1_jdrl5g8,/r/pokemon/comments/122knvo/my_gf24_who_has_never_played_any_pokémon_game/jds5zki/
81,jdqz4f9,Flu754,Happy cake day!,Happy cake day!,5,2023-03-26 14:36:46,<praw.models.comment_forest.CommentForest object at 0x0000022EEE198DC0>,122knvo,pokemon,t5_2qmeb,,False,False,t3_122knvo,t1_jdqvd1j,/r/pokemon/comments/122knvo/my_gf24_who_has_never_played_any_pokémon_game/jdqz4f9/
82,jdqvq2z,,[deleted],[deleted],0,2023-03-26 14:09:49,<praw.models.comment_forest.CommentForest object at 0x0000022EEE198E20>,122knvo,pokemon,t5_2qmeb,,False,False,t3_122knvo,t1_jdqvd1j,/r/pokemon/comments/122knvo/my_gf24_who_has_never_played_any_pokémon_game/jdqvq2z/
83,jdqwpfz,IrishSpectreN7,:D,:D,9,2023-03-26 14:17:41,<praw.models.comment_forest.CommentForest object at 0x0000022EEE198F40>,122knvo,pokemon,t5_2qmeb,,False,False,t3_122knvo,t1_jdqw9qd,/r/pokemon/comments/122knvo/my_gf24_who_has_never_played_any_pokémon_game/jdqwpfz/
84,jdtemql,9thshadowwolf,I dont think a 16 year old would be playing emerald tho. Theyd prob stick to the newer games,I dont think a 16 year old would be playing emerald tho. Theyd prob stick to the newer games,0,2023-03-27 01:16:57,<praw.models.comment_forest.CommentForest object at 0x0000022EEE1A0070>,122knvo,pokemon,t5_2qmeb,,False,False,t3_122knvo,t1_jdsfuxd,/r/pokemon/comments/122knvo/my_gf24_who_has_never_played_any_pokémon_game/jdtemql/
85,jdr4tna,Sensei_Ochiba,"Same, I get all the *very* reddit comments ragging on him but I think the tone here is very much the guy just getting caught off guard by hearing a real person say the exact opposite of what all the Gamers™ say. 

If my fiancee had this same experience I'd giggle about it too, and explain why I find it amusing.","Same, I get all the *very* reddit comments ragging on him but I think the tone here is very much the guy just getting caught off guard by hearing a real person say the exact opposite of what all the Gamers™ say. 

If my fiancee had this same experience I'd giggle about it too, and explain why I find it amusing.",-1,2023-03-26 15:19:21,<praw.models.comment_forest.CommentForest object at 0x0000022EEE1A0370>,122knvo,pokemon,t5_2qmeb,,False,False,t3_122knvo,t1_jdr0tfu,/r/pokemon/comments/122knvo/my_gf24_who_has_never_played_any_pokémon_game/jdr4tna/
86,jdr6qcw,GameSpection,"Audibly laughing about a completely fair question is making fun of her, even if unintentional. You could think it's funny but the reaction was totally inappropriate. The way they wrote ""She got kinda made that I 'made fun of her'"" in quotations also shows he's deaf to how this was uncalled for in a social situation","Audibly laughing about a completely fair question is making fun of her, even if unintentional. You could think it's funny but the reaction was totally inappropriate. The way they wrote ""She got kinda made that I 'made fun of her'"" in quotations also shows he's deaf to how this was uncalled for in a social situation",7,2023-03-26 15:33:05,<praw.models.comment_forest.CommentForest object at 0x0000022EEE1A05B0>,122knvo,pokemon,t5_2qmeb,,False,False,t3_122knvo,t1_jdqzn4i,/r/pokemon/comments/122knvo/my_gf24_who_has_never_played_any_pokémon_game/jdr6qcw/
87,jdqx483,Golden-Owl,"There’s a LOT of game design decisions in Pokémon which originate from the franchise’s rocky origins of Red/Blue. Stuff like pseudo legends, early game Mons, Exp, type specializing gym leaders, single use TMs, and so on all existed back in Gen 1 for somewhat neccessary reasons. 

But as time went on, game technology modernized, and design along with it. Many of the reasons behind those design decisions gradually faded out of necessity, but they still remained in the games for far far longer than neccessary.","There’s a LOT of game design decisions in Pokémon which originate from the franchise’s rocky origins of Red/Blue. Stuff like pseudo legends, early game Mons, Exp, type specializing gym leaders, single use TMs, and so on all existed back in Gen 1 for somewhat neccessary reasons. 

But as time went on, game technology modernized, and design along with it. Many of the reasons behind those design decisions gradually faded out of necessity, but they still remained in the games for far far longer than neccessary.",7,2023-03-26 14:21:02,<praw.models.comment_forest.CommentForest object at 0x0000022EEE1A0790>,122knvo,pokemon,t5_2qmeb,,False,False,t3_122knvo,t1_jdqwj7s,/r/pokemon/comments/122knvo/my_gf24_who_has_never_played_any_pokémon_game/jdqx483/
88,jdqq8o4,Moonerdragon,In order to combat that feeling in Scarlet i ran around work *only* a mgikarp in my party until it evolved. As soon as it hit level 15 i only used him. Didn't use any Candy or do enhancer,In order to combat that feeling in Scarlet i ran around work *only* a mgikarp in my party until it evolved. As soon as it hit level 15 i only used him. Didn't use any Candy or do enhancer,6,2023-03-26 13:23:23,<praw.models.comment_forest.CommentForest object at 0x0000022EEE1A08B0>,122knvo,pokemon,t5_2qmeb,,False,False,t3_122knvo,t1_jdqpjaa,/r/pokemon/comments/122knvo/my_gf24_who_has_never_played_any_pokémon_game/jdqq8o4/
89,jdqtspm,Ok-Inside3667,"Yeah, it's just a shame it's not an option, and it's forced on everyone","Yeah, it's just a shame it's not an option, and it's forced on everyone",29,2023-03-26 13:53:53,<praw.models.comment_forest.CommentForest object at 0x0000022EEE1A0970>,122knvo,pokemon,t5_2qmeb,,False,False,t3_122knvo,t1_jdqq78c,/r/pokemon/comments/122knvo/my_gf24_who_has_never_played_any_pokémon_game/jdqtspm/
90,jdqz3n5,DomCaboose,"I agree. I do miss the days when the Pokemon games felt like a huge challenge and if you went too far ahead you would get your ass kicked. Then you had to grind to get there and it was an accomplishment. As an adult though, I do enjoy being able to level up my favorites quickly.","I agree. I do miss the days when the Pokemon games felt like a huge challenge and if you went too far ahead you would get your ass kicked. Then you had to grind to get there and it was an accomplishment. As an adult though, I do enjoy being able to level up my favorites quickly.",5,2023-03-26 14:36:35,<praw.models.comment_forest.CommentForest object at 0x0000022EEE1A09D0>,122knvo,pokemon,t5_2qmeb,,False,False,t3_122knvo,t1_jdqq78c,/r/pokemon/comments/122knvo/my_gf24_who_has_never_played_any_pokémon_game/jdqz3n5/
91,jdqyj1z,King_ofHarts,It’s probably my favorite addition to the newer games,It’s probably my favorite addition to the newer games,2,2023-03-26 14:32:07,<praw.models.comment_forest.CommentForest object at 0x0000022EEE1A0A90>,122knvo,pokemon,t5_2qmeb,,False,False,t3_122knvo,t1_jdqq78c,/r/pokemon/comments/122knvo/my_gf24_who_has_never_played_any_pokémon_game/jdqyj1z/
92,jdrzyq2,batkave,This was my thinking too. What kind of douche canoe thinks that is acceptable?,This was my thinking too. What kind of douche canoe thinks that is acceptable?,2,2023-03-26 18:59:59,<praw.models.comment_forest.CommentForest object at 0x0000022EEE1A0DF0>,122knvo,pokemon,t5_2qmeb,,False,False,t3_122knvo,t1_jdqvgbe,/r/pokemon/comments/122knvo/my_gf24_who_has_never_played_any_pokémon_game/jdrzyq2/
93,jdr33r7,RF_91,"Yeah, it's a standard JRPG thing that your whole party gains exp (even in P5 they unlock it before you get the fifth party member), and it was just a Pokemon thing to expect you to grind each member separately.","Yeah, it's a standard JRPG thing that your whole party gains exp (even in P5 they unlock it before you get the fifth party member), and it was just a Pokemon thing to expect you to grind each member separately.",2,2023-03-26 15:06:41,<praw.models.comment_forest.CommentForest object at 0x0000022EEE1A20D0>,122knvo,pokemon,t5_2qmeb,,False,False,t3_122knvo,t1_jdqv1kj,/r/pokemon/comments/122knvo/my_gf24_who_has_never_played_any_pokémon_game/jdr33r7/
94,jdr4968,RazzleThatTazzle,Why don't you calm down my friend. I didn't mean to upset you with my opinion about what games I do or don't like.,Why don't you calm down my friend. I didn't mean to upset you with my opinion about what games I do or don't like.,1,2023-03-26 15:15:09,<praw.models.comment_forest.CommentForest object at 0x0000022EEE1A2C10>,122knvo,pokemon,t5_2qmeb,,False,False,t3_122knvo,t1_jdr2det,/r/pokemon/comments/122knvo/my_gf24_who_has_never_played_any_pokémon_game/jdr4968/
95,jfkutou,ShockLazy9794,The only thing I didn’t like about the new exp share is that you can’t turn it off,The only thing I didn’t like about the new exp share is that you can’t turn it off,1,2023-04-09 15:19:38,<praw.models.comment_forest.CommentForest object at 0x0000022EEE1A4130>,122knvo,pokemon,t5_2qmeb,,False,False,t3_122knvo,t1_jdqx4z3,/r/pokemon/comments/122knvo/my_gf24_who_has_never_played_any_pokémon_game/jfkutou/
96,jdqvzu7,DudeChillington,Awww shucks 😊,Awww shucks 😊,7,2023-03-26 14:11:59,<praw.models.comment_forest.CommentForest object at 0x0000022EEE198EE0>,122knvo,pokemon,t5_2qmeb,,False,False,t3_122knvo,t1_jdqvq2z,/r/pokemon/comments/122knvo/my_gf24_who_has_never_played_any_pokémon_game/jdqvzu7/
97,jdr96kz,glitterizer,"There, you already said it yourself: unintentional. He wasn’t making fun of her. I understand why she would think that but he can just explain after, as he did. It’s really not that serious and you people are being oversensitive and purposefully missing the point to be outraged. But what else to expect from this subreddit lol","There, you already said it yourself: unintentional. He wasn’t making fun of her. I understand why she would think that but he can just explain after, as he did. It’s really not that serious and you people are being oversensitive and purposefully missing the point to be outraged. But what else to expect from this subreddit lol",-10,2023-03-26 15:50:36,<praw.models.comment_forest.CommentForest object at 0x0000022EEE1A0670>,122knvo,pokemon,t5_2qmeb,,False,False,t3_122knvo,t1_jdr6qcw,/r/pokemon/comments/122knvo/my_gf24_who_has_never_played_any_pokémon_game/jdr96kz/
98,jdqu9u1,Kemo_Meme,"I agree with this. Make it optional and that's honestly the best way to do XP.

Screw the people who say that XP Share takes away the challenge from the game, pursuit isn't even a thing anymore and it only existed on like 2-4 specific wild encounters per game.","I agree with this. Make it optional and that's honestly the best way to do XP.

Screw the people who say that XP Share takes away the challenge from the game, pursuit isn't even a thing anymore and it only existed on like 2-4 specific wild encounters per game.",17,2023-03-26 13:57:52,<praw.models.comment_forest.CommentForest object at 0x0000022EEE1A0A30>,122knvo,pokemon,t5_2qmeb,,False,False,t3_122knvo,t1_jdqtspm,/r/pokemon/comments/122knvo/my_gf24_who_has_never_played_any_pokémon_game/jdqu9u1/
99,jdr4g8y,jelllybears,"I could give a fuck about your opinion, I’m here laughing at you for expecting a challenge from the npcs in a game made for 8 year olds","I could give a fuck about your opinion, I’m here laughing at you for expecting a challenge from the npcs in a game made for 8 year olds",1,2023-03-26 15:16:35,<praw.models.comment_forest.CommentForest object at 0x0000022EEE1A2CD0>,122knvo,pokemon,t5_2qmeb,,False,False,t3_122knvo,t1_jdr4968,/r/pokemon/comments/122knvo/my_gf24_who_has_never_played_any_pokémon_game/jdr4g8y/
100,jdqvqr7,jelllybears,And given the rng most of them would elect to hit you with odor sleuth anyway,And given the rng most of them would elect to hit you with odor sleuth anyway,3,2023-03-26 14:09:59,<praw.models.comment_forest.CommentForest object at 0x0000022EEE1A0AF0>,122knvo,pokemon,t5_2qmeb,,False,False,t3_122knvo,t1_jdqu9u1,/r/pokemon/comments/122knvo/my_gf24_who_has_never_played_any_pokémon_game/jdqvqr7/
101,jdr5shw,RazzleThatTazzle,You're clearly upset about something. I think you should look inward and try to figure out the thing that's actually bothering you. Healthy happy people don't behave this way.,You're clearly upset about something. I think you should look inward and try to figure out the thing that's actually bothering you. Healthy happy people don't behave this way.,2,2023-03-26 15:26:18,<praw.models.comment_forest.CommentForest object at 0x0000022EEE1A2D90>,122knvo,pokemon,t5_2qmeb,,False,False,t3_122knvo,t1_jdr4g8y,/r/pokemon/comments/122knvo/my_gf24_who_has_never_played_any_pokémon_game/jdr5shw/
102,jdr5vxv,jelllybears,Healthy happy people also don’t feed obvious trolls online babygirl 🥹,Healthy happy people also don’t feed obvious trolls online babygirl 🥹,-2,2023-03-26 15:26:58,<praw.models.comment_forest.CommentForest object at 0x0000022EEE1A2E50>,122knvo,pokemon,t5_2qmeb,,False,False,t3_122knvo,t1_jdr5shw,/r/pokemon/comments/122knvo/my_gf24_who_has_never_played_any_pokémon_game/jdr5vxv/
103,jdr6464,RazzleThatTazzle,"Look I'm sorry that she treated you that way, but it's no reason to be rude to strangers on the internet. Maybe if you fix your diet and exercise more you'll meet other girls? There's plenty of fish in the sea, don't get too upset.","Look I'm sorry that she treated you that way, but it's no reason to be rude to strangers on the internet. Maybe if you fix your diet and exercise more you'll meet other girls? There's plenty of fish in the sea, don't get too upset.",2,2023-03-26 15:28:38,<praw.models.comment_forest.CommentForest object at 0x0000022EEE1A2F10>,122knvo,pokemon,t5_2qmeb,,False,False,t3_122knvo,t1_jdr5vxv,/r/pokemon/comments/122knvo/my_gf24_who_has_never_played_any_pokémon_game/jdr6464/
104,jdr6khf,jelllybears,I love how you think you’re doing something. But for sure keep going,I love how you think you’re doing something. But for sure keep going,1,2023-03-26 15:31:55,<praw.models.comment_forest.CommentForest object at 0x0000022EEE1A2FD0>,122knvo,pokemon,t5_2qmeb,,False,False,t3_122knvo,t1_jdr6464,/r/pokemon/comments/122knvo/my_gf24_who_has_never_played_any_pokémon_game/jdr6khf/
105,jdrcssj,RazzleThatTazzle,I love how you think you're doing something. But for sure keep going,I love how you think you're doing something. But for sure keep going,2,2023-03-26 16:16:22,<praw.models.comment_forest.CommentForest object at 0x0000022EEE1A40D0>,122knvo,pokemon,t5_2qmeb,,False,False,t3_122knvo,t1_jdr6khf,/r/pokemon/comments/122knvo/my_gf24_who_has_never_played_any_pokémon_game/jdrcssj/
