,ID,Author,body,Comment,Score,Created On,Replies,Submission,Subreddit,Subreddit_ID,Distinguished,Edited,Is_submitter,link_id,Parent_id,Permalink
36,jdqkysg,thefruiteefrielos,This did give me a giggle!,This did give me a giggle!,-7,2023-03-26 12:33:04,<praw.models.comment_forest.CommentForest object at 0x0000022EEE1A2A30>,122knvo,pokemon,t5_2qmeb,,False,False,t3_122knvo,t3_122knvo,/r/pokemon/comments/122knvo/my_gf24_who_has_never_played_any_pokémon_game/jdqkysg/
37,jdr1h3d,RazzleThatTazzle,It's part of the reason I don't really like the new pokemon games. They made them so easy that it isn't fun. After every battle someone walks up to you and heals your whole party it seems like.,It's part of the reason I don't really like the new pokemon games. They made them so easy that it isn't fun. After every battle someone walks up to you and heals your whole party it seems like.,-1,2023-03-26 14:54:34,<praw.models.comment_forest.CommentForest object at 0x0000022EEE1A2A90>,122knvo,pokemon,t5_2qmeb,,False,False,t3_122knvo,t3_122knvo,/r/pokemon/comments/122knvo/my_gf24_who_has_never_played_any_pokémon_game/jdr1h3d/
38,jdrrqqe,Shadow_verse90,I found it annoying when it was first rolled out but I also liked it because I used to heavily lean on like three Pokemon and then would get screwed in the end game (I was a child when I played the OGs.),I found it annoying when it was first rolled out but I also liked it because I used to heavily lean on like three Pokemon and then would get screwed in the end game (I was a child when I played the OGs.),0,2023-03-26 18:01:32,<praw.models.comment_forest.CommentForest object at 0x0000022EEE1A2AF0>,122knvo,pokemon,t5_2qmeb,,False,False,t3_122knvo,t3_122knvo,/r/pokemon/comments/122knvo/my_gf24_who_has_never_played_any_pokémon_game/jdrrqqe/
39,jdtf7kn,Friglefarb989,I am so sorry for her. She had to suffer through the 2 worst games before anything decent. Send her my condolences,I am so sorry for her. She had to suffer through the 2 worst games before anything decent. Send her my condolences,0,2023-03-27 01:21:48,<praw.models.comment_forest.CommentForest object at 0x0000022EEE1A2BB0>,122knvo,pokemon,t5_2qmeb,,False,False,t3_122knvo,t3_122knvo,/r/pokemon/comments/122knvo/my_gf24_who_has_never_played_any_pokémon_game/jdtf7kn/
40,jdr0g7d,SirStego,I stopped playing because of exp share. Goddamn participation trophy.,I stopped playing because of exp share. Goddamn participation trophy.,-4,2023-03-26 14:46:54,<praw.models.comment_forest.CommentForest object at 0x0000022EEE1A2C70>,122knvo,pokemon,t5_2qmeb,,False,False,t3_122knvo,t3_122knvo,/r/pokemon/comments/122knvo/my_gf24_who_has_never_played_any_pokémon_game/jdr0g7d/
41,jdrywjb,ProfessionalOven2311,"It blew me away when I saw a post asking what it was like back in the day of getting new evolutions for old Pokemon. I knew it had been a while since we had gotten new evolutions; besides Sylveon and Galarian form evolutions, it had been about 16 years (from Diamond and Pearl in 2006 to Arceus/Scarlet and Violet in 2022).

I didn't even consider they there were any fans who didn't experience getting excited for what new evolutions would be revealed and coming up with hundreads of ideas for new evolutions or baby forms.","It blew me away when I saw a post asking what it was like back in the day of getting new evolutions for old Pokemon. I knew it had been a while since we had gotten new evolutions; besides Sylveon and Galarian form evolutions, it had been about 16 years (from Diamond and Pearl in 2006 to Arceus/Scarlet and Violet in 2022).

I didn't even consider they there were any fans who didn't experience getting excited for what new evolutions would be revealed and coming up with hundreads of ideas for new evolutions or baby forms.",-1,2023-03-26 18:52:32,<praw.models.comment_forest.CommentForest object at 0x0000022EEE1A2D30>,122knvo,pokemon,t5_2qmeb,,False,False,t3_122knvo,t3_122knvo,/r/pokemon/comments/122knvo/my_gf24_who_has_never_played_any_pokémon_game/jdrywjb/
42,jdqszap,IAreSpeshial,New mechanism is for children to make the game not require any kind of grind. Old ways were better when you gave exp share to the weakest mon,New mechanism is for children to make the game not require any kind of grind. Old ways were better when you gave exp share to the weakest mon,-18,2023-03-26 13:47:05,<praw.models.comment_forest.CommentForest object at 0x0000022EEE1A2DF0>,122knvo,pokemon,t5_2qmeb,,False,False,t3_122knvo,t3_122knvo,/r/pokemon/comments/122knvo/my_gf24_who_has_never_played_any_pokémon_game/jdqszap/
43,jdrvp3z,Whole_Suit_1591,Was it why are you playing Pokemon at 24 instead of poker?,Was it why are you playing Pokemon at 24 instead of poker?,-6,2023-03-26 18:29:47,<praw.models.comment_forest.CommentForest object at 0x0000022EEE1A2EB0>,122knvo,pokemon,t5_2qmeb,,False,False,t3_122knvo,t3_122knvo,/r/pokemon/comments/122knvo/my_gf24_who_has_never_played_any_pokémon_game/jdrvp3z/
44,jdqx3ev,Responsible_Monk4919,I’ve been in that exact same situation when I decided to play Pokémon FireRed,I’ve been in that exact same situation when I decided to play Pokémon FireRed,1,2023-03-26 14:20:51,<praw.models.comment_forest.CommentForest object at 0x0000022EEE1A41F0>,122knvo,pokemon,t5_2qmeb,,False,False,t3_122knvo,t3_122knvo,/r/pokemon/comments/122knvo/my_gf24_who_has_never_played_any_pokémon_game/jdqx3ev/
45,jdr0y3c,Plushiegamer2,"Most RPGs dole out the experience to every non-fainted party member, and sometimes even fainted party members. Pokemon is the outlier imo","Most RPGs dole out the experience to every non-fainted party member, and sometimes even fainted party members. Pokemon is the outlier imo",1,2023-03-26 14:50:37,<praw.models.comment_forest.CommentForest object at 0x0000022EEE1A4250>,122knvo,pokemon,t5_2qmeb,,False,False,t3_122knvo,t3_122knvo,/r/pokemon/comments/122knvo/my_gf24_who_has_never_played_any_pokémon_game/jdr0y3c/
46,jdrl5g8,Soafia,Is it though? It’s been that way for almost 10 years.,Is it though? It’s been that way for almost 10 years.,7,2023-03-26 17:15:15,<praw.models.comment_forest.CommentForest object at 0x0000022EEE198B80>,122knvo,pokemon,t5_2qmeb,,False,False,t3_122knvo,t1_jdqpxwc,/r/pokemon/comments/122knvo/my_gf24_who_has_never_played_any_pokémon_game/jdrl5g8/
47,jdqvd1j,DudeChillington,I'd certainly say this was one of the questions of all time,I'd certainly say this was one of the questions of all time,203,2023-03-26 14:06:56,<praw.models.comment_forest.CommentForest object at 0x0000022EEE198D30>,122knvo,pokemon,t5_2qmeb,,False,False,t3_122knvo,t1_jdqtd0b,/r/pokemon/comments/122knvo/my_gf24_who_has_never_played_any_pokémon_game/jdqvd1j/
48,jdqw9qd,jelllybears,“I just wanted to talk about exp share while also making sure everyone knows that I am a generally insufferable human being”,“I just wanted to talk about exp share while also making sure everyone knows that I am a generally insufferable human being”,126,2023-03-26 14:14:12,<praw.models.comment_forest.CommentForest object at 0x0000022EEE198D60>,122knvo,pokemon,t5_2qmeb,,False,False,t3_122knvo,t1_jdqtd0b,/r/pokemon/comments/122knvo/my_gf24_who_has_never_played_any_pokémon_game/jdqw9qd/
49,jdsfuxd,,"Based on the horrible grammar and overall immaturity present in the post I’m guessing op is 14-16, so par for the course","Based on the horrible grammar and overall immaturity present in the post I’m guessing op is 14-16, so par for the course",8,2023-03-26 20:51:20,<praw.models.comment_forest.CommentForest object at 0x0000022EEE198940>,122knvo,pokemon,t5_2qmeb,,False,False,t3_122knvo,t1_jdqvvzm,/r/pokemon/comments/122knvo/my_gf24_who_has_never_played_any_pokémon_game/jdsfuxd/
50,jdr0hn8,Mr-Phobias,"Wrong sub, but damn that gave me a chuckle. I’m gonna give you a YTA as it was loud enough to wake the baby. Lmao","Wrong sub, but damn that gave me a chuckle. I’m gonna give you a YTA as it was loud enough to wake the baby. Lmao",34,2023-03-26 14:47:11,<praw.models.comment_forest.CommentForest object at 0x0000022EEE198D00>,122knvo,pokemon,t5_2qmeb,,False,False,t3_122knvo,t1_jdqvvzm,/r/pokemon/comments/122knvo/my_gf24_who_has_never_played_any_pokémon_game/jdr0hn8/
51,jdsldfb,JuiceZee,He just laughed at the situation…. Come on dude. He clearly just thought it was funny that somerhing he had to grow up with is now foreign and backwards to newer players. I don’t think it’s super hilarious but his intention clearly wasn’t to belittle his girlfriend,He just laughed at the situation…. Come on dude. He clearly just thought it was funny that somerhing he had to grow up with is now foreign and backwards to newer players. I don’t think it’s super hilarious but his intention clearly wasn’t to belittle his girlfriend,-5,2023-03-26 21:30:50,<praw.models.comment_forest.CommentForest object at 0x0000022EEE1A00D0>,122knvo,pokemon,t5_2qmeb,,False,False,t3_122knvo,t1_jdqvvzm,/r/pokemon/comments/122knvo/my_gf24_who_has_never_played_any_pokémon_game/jdsldfb/
52,jdqx86a,RED_Kinggamer007,"Its also not funny in any way its just a normal question someone who, need i remind, only played two games in the series wich had the function and understandibly thought the others did aswell","Its also not funny in any way its just a normal question someone who, need i remind, only played two games in the series wich had the function and understandibly thought the others did aswell",34,2023-03-26 14:21:55,<praw.models.comment_forest.CommentForest object at 0x0000022EEE1A0190>,122knvo,pokemon,t5_2qmeb,,False,False,t3_122knvo,t1_jdqvc7t,/r/pokemon/comments/122knvo/my_gf24_who_has_never_played_any_pokémon_game/jdqx86a/
53,jduvngl,Due_Lion3875,“It’s funny because it’s obvious to me and it should be to everyone else!”,“It’s funny because it’s obvious to me and it should be to everyone else!”,4,2023-03-27 11:28:00,<praw.models.comment_forest.CommentForest object at 0x0000022EEE1A01F0>,122knvo,pokemon,t5_2qmeb,,False,False,t3_122knvo,t1_jdqvc7t,/r/pokemon/comments/122knvo/my_gf24_who_has_never_played_any_pokémon_game/jduvngl/
54,jdr0tfu,JuiceZee,I didn’t get that vibe from the post at all… just that he thinks it’s funny that something he grew up with is now surprising to newer crowds of playing pokemon,I didn’t get that vibe from the post at all… just that he thinks it’s funny that something he grew up with is now surprising to newer crowds of playing pokemon,6,2023-03-26 14:49:40,<praw.models.comment_forest.CommentForest object at 0x0000022EEE1A02B0>,122knvo,pokemon,t5_2qmeb,,False,False,t3_122knvo,t1_jdqwjgw,/r/pokemon/comments/122knvo/my_gf24_who_has_never_played_any_pokémon_game/jdr0tfu/
55,jdr5eam,Dripplin,yeah the xp share feels fine for the games it's meant to be used on but BDSP feels like shit with it on and you can't turn it off,yeah the xp share feels fine for the games it's meant to be used on but BDSP feels like shit with it on and you can't turn it off,0,2023-03-26 15:23:28,<praw.models.comment_forest.CommentForest object at 0x0000022EEE1A0310>,122knvo,pokemon,t5_2qmeb,,False,False,t3_122knvo,t1_jdqwjgw,/r/pokemon/comments/122knvo/my_gf24_who_has_never_played_any_pokémon_game/jdr5eam/
56,jdr4cjx,Suitable-Pea-8226,When I play an older game on an emulator I put 1.5x EXP on. Takes out the grinding without being ridiculously over leveled.,When I play an older game on an emulator I put 1.5x EXP on. Takes out the grinding without being ridiculously over leveled.,5,2023-03-26 15:15:50,<praw.models.comment_forest.CommentForest object at 0x0000022EEE1A0430>,122knvo,pokemon,t5_2qmeb,,False,False,t3_122knvo,t1_jdqurof,/r/pokemon/comments/122knvo/my_gf24_who_has_never_played_any_pokémon_game/jdr4cjx/
57,jdqzn4i,glitterizer,"He’s not making fun of her, though? He was laughing at the “irony” of the question being in reverse for her than what it is for most fans, at the situation. Not at her not knowing.","He’s not making fun of her, though? He was laughing at the “irony” of the question being in reverse for her than what it is for most fans, at the situation. Not at her not knowing.",-27,2023-03-26 14:40:43,<praw.models.comment_forest.CommentForest object at 0x0000022EEE1A04F0>,122knvo,pokemon,t5_2qmeb,,False,False,t3_122knvo,t1_jdqu7ws,/r/pokemon/comments/122knvo/my_gf24_who_has_never_played_any_pokémon_game/jdqzn4i/
58,jdrm06e,goosefucker74,"It’s an interesting thought, that maybe the shared exp is a purposeful effort to promote using wider teams. With the old system of exp earning, you kind of had to only use 6, or you’d have to spend so much time grinding. 

It makes me wonder how controversial exp share would be if players were more used to using 8-10 Pokémon in a rotation.","It’s an interesting thought, that maybe the shared exp is a purposeful effort to promote using wider teams. With the old system of exp earning, you kind of had to only use 6, or you’d have to spend so much time grinding. 

It makes me wonder how controversial exp share would be if players were more used to using 8-10 Pokémon in a rotation.",5,2023-03-26 17:21:16,<praw.models.comment_forest.CommentForest object at 0x0000022EEE1A0610>,122knvo,pokemon,t5_2qmeb,,False,False,t3_122knvo,t1_jdqvbei,/r/pokemon/comments/122knvo/my_gf24_who_has_never_played_any_pokémon_game/jdrm06e/
59,jdqwj7s,DurableSword,Finally someone making sense,Finally someone making sense,8,2023-03-26 14:16:18,<praw.models.comment_forest.CommentForest object at 0x0000022EEE1A06D0>,122knvo,pokemon,t5_2qmeb,,False,False,t3_122knvo,t1_jdqvbei,/r/pokemon/comments/122knvo/my_gf24_who_has_never_played_any_pokémon_game/jdqwj7s/
60,jdqpjaa,arq98,"i remember struggling with having magikarp in front of my party and swapping them out every battle to get them powered up to 20, good times","i remember struggling with having magikarp in front of my party and swapping them out every battle to get them powered up to 20, good times",89,2023-03-26 13:17:04,<praw.models.comment_forest.CommentForest object at 0x0000022EEE1A07F0>,122knvo,pokemon,t5_2qmeb,,False,False,t3_122knvo,t1_jdqp8lq,/r/pokemon/comments/122knvo/my_gf24_who_has_never_played_any_pokémon_game/jdqpjaa/
61,jdqq78c,WhaleMan295,"Being adult and having way less time, the new xp share is a godsend","Being adult and having way less time, the new xp share is a godsend",75,2023-03-26 13:23:02,<praw.models.comment_forest.CommentForest object at 0x0000022EEE1A0850>,122knvo,pokemon,t5_2qmeb,,False,False,t3_122knvo,t1_jdqp8lq,/r/pokemon/comments/122knvo/my_gf24_who_has_never_played_any_pokémon_game/jdqq78c/
62,jdqsqc1,LordRevan1997,"I distinctly remember not really understanding rematch mechanics, and grinding outside the exit of victory Road in emerald for hours. Medicham. Medicham. Graveller. Medicham.","I distinctly remember not really understanding rematch mechanics, and grinding outside the exit of victory Road in emerald for hours. Medicham. Medicham. Graveller. Medicham.",16,2023-03-26 13:44:57,<praw.models.comment_forest.CommentForest object at 0x0000022EEE1A0910>,122knvo,pokemon,t5_2qmeb,,False,False,t3_122knvo,t1_jdqp8lq,/r/pokemon/comments/122knvo/my_gf24_who_has_never_played_any_pokémon_game/jdqsqc1/
63,jdqtp24,batkave,It's more fun without the grind for most people.,It's more fun without the grind for most people.,9,2023-03-26 13:53:03,<praw.models.comment_forest.CommentForest object at 0x0000022EEE1A0B50>,122knvo,pokemon,t5_2qmeb,,False,False,t3_122knvo,t1_jdqp8lq,/r/pokemon/comments/122knvo/my_gf24_who_has_never_played_any_pokémon_game/jdqtp24/
64,jdqyf35,King_ofHarts,"I absolutely *love* the XP sharing. I don’t have time to grind, just let me play the game","I absolutely *love* the XP sharing. I don’t have time to grind, just let me play the game",4,2023-03-26 14:31:16,<praw.models.comment_forest.CommentForest object at 0x0000022EEE1A0BB0>,122knvo,pokemon,t5_2qmeb,,False,False,t3_122knvo,t1_jdqp8lq,/r/pokemon/comments/122knvo/my_gf24_who_has_never_played_any_pokémon_game/jdqyf35/
65,jdqwmqe,AnimaSean0724,"Honestly, after the multiple attempts I have made at my White 2 Nuzlocke, I vastly prefer the new EXP share mechanics to spending a couple hours before each gym grinding up my Pokemon, the old system was nothing but tedious, given, that being said, I think they should add an option to turn it off for those that want it off, but I will take the EXP share the way it is now, over the boring repetition that there was","Honestly, after the multiple attempts I have made at my White 2 Nuzlocke, I vastly prefer the new EXP share mechanics to spending a couple hours before each gym grinding up my Pokemon, the old system was nothing but tedious, given, that being said, I think they should add an option to turn it off for those that want it off, but I will take the EXP share the way it is now, over the boring repetition that there was",3,2023-03-26 14:17:05,<praw.models.comment_forest.CommentForest object at 0x0000022EEE1A0C10>,122knvo,pokemon,t5_2qmeb,,False,False,t3_122knvo,t1_jdqp8lq,/r/pokemon/comments/122knvo/my_gf24_who_has_never_played_any_pokémon_game/jdqwmqe/
66,jdquz83,GameSpection,Because fixing a game mechanic to make it more accessible and mollify grinding = spoiled,Because fixing a game mechanic to make it more accessible and mollify grinding = spoiled,4,2023-03-26 14:03:46,<praw.models.comment_forest.CommentForest object at 0x0000022EEE1A0C70>,122knvo,pokemon,t5_2qmeb,,False,False,t3_122knvo,t1_jdqp8lq,/r/pokemon/comments/122knvo/my_gf24_who_has_never_played_any_pokémon_game/jdquz83/
67,jdqvgbe,GameSpection,"Not gonna be a girlfriend for much longer if they introduce them to their personal hobbies and make fun of them for not understanding their personal hobbies

Like how else is that funny enough to make someone audibly laugh unless they're just being a jerk","Not gonna be a girlfriend for much longer if they introduce them to their personal hobbies and make fun of them for not understanding their personal hobbies

Like how else is that funny enough to make someone audibly laugh unless they're just being a jerk",26,2023-03-26 14:07:40,<praw.models.comment_forest.CommentForest object at 0x0000022EEE1A0D30>,122knvo,pokemon,t5_2qmeb,,False,False,t3_122knvo,t1_jdqtj5j,/r/pokemon/comments/122knvo/my_gf24_who_has_never_played_any_pokémon_game/jdqvgbe/
68,jdqwgb9,jelllybears,"Honestly I have no idea what this guy was going for

I was expecting something like “wait why did they redesign slowpoke for FireRed/LeafGreen??”

Or “I’ve trained my linoone to level 98, will it evolve soon”

That would have at least been a little amusing","Honestly I have no idea what this guy was going for

I was expecting something like “wait why did they redesign slowpoke for FireRed/LeafGreen??”

Or “I’ve trained my linoone to level 98, will it evolve soon”

That would have at least been a little amusing",15,2023-03-26 14:15:39,<praw.models.comment_forest.CommentForest object at 0x0000022EEE1A0F70>,122knvo,pokemon,t5_2qmeb,,False,False,t3_122knvo,t1_jdqu8z0,/r/pokemon/comments/122knvo/my_gf24_who_has_never_played_any_pokémon_game/jdqwgb9/
69,jdqv1kj,PanJam00,Don’t other rpgs do the shared exp thing too? I just played through persona 5 Royal and the shared exp was great because then I didn’t have to spend hours grinding party members I would only use once (and the game even offers ways to increase payout through various in game methods!).  I really don’t understand why people are super upset? Maybe scaling could be better but I think just taking the exp share away would do very little/ turn people who have limited time to play away from the games.,Don’t other rpgs do the shared exp thing too? I just played through persona 5 Royal and the shared exp was great because then I didn’t have to spend hours grinding party members I would only use once (and the game even offers ways to increase payout through various in game methods!).  I really don’t understand why people are super upset? Maybe scaling could be better but I think just taking the exp share away would do very little/ turn people who have limited time to play away from the games.,7,2023-03-26 14:04:19,<praw.models.comment_forest.CommentForest object at 0x0000022EEE1A0FD0>,122knvo,pokemon,t5_2qmeb,,False,False,t3_122knvo,t1_jdqu8z0,/r/pokemon/comments/122knvo/my_gf24_who_has_never_played_any_pokémon_game/jdqv1kj/
70,jdrbqpz,ScarletCarbuncle,"Honestly, the EXP Share mechanic always made more sense to me from a logical perspective.

How do Ash's Pokemon that have only ever participated in 5 battles beat Gym Leader's Pokemon that have fought hundreds, if not thousands? How is that Machop you just caught at lv 30 stronger than Whitney's Miltank that she's had for years?

EXP Share spreading EXP around takes the onus off pure levels and stats and puts more value on technique. It also allows more modern games to minimize grinding on wild Pokemon, which never really made sense lore-wise (Ash never fought wild Pokemon just to level up).","Honestly, the EXP Share mechanic always made more sense to me from a logical perspective.

How do Ash's Pokemon that have only ever participated in 5 battles beat Gym Leader's Pokemon that have fought hundreds, if not thousands? How is that Machop you just caught at lv 30 stronger than Whitney's Miltank that she's had for years?

EXP Share spreading EXP around takes the onus off pure levels and stats and puts more value on technique. It also allows more modern games to minimize grinding on wild Pokemon, which never really made sense lore-wise (Ash never fought wild Pokemon just to level up).",5,2023-03-26 16:08:48,<praw.models.comment_forest.CommentForest object at 0x0000022EEE1A2130>,122knvo,pokemon,t5_2qmeb,,False,False,t3_122knvo,t1_jdqx1wd,/r/pokemon/comments/122knvo/my_gf24_who_has_never_played_any_pokémon_game/jdrbqpz/
71,jdr1ymm,cyanidelemonade,Haha I like to imagine that they get exp for observing the fight. Like they can see out of the pokeballs and learn,Haha I like to imagine that they get exp for observing the fight. Like they can see out of the pokeballs and learn,2,2023-03-26 14:58:11,<praw.models.comment_forest.CommentForest object at 0x0000022EEE1A2190>,122knvo,pokemon,t5_2qmeb,,False,False,t3_122knvo,t1_jdqx1wd,/r/pokemon/comments/122knvo/my_gf24_who_has_never_played_any_pokémon_game/jdr1ymm/
72,jdrqf5s,PanJam00,Isn’t it also a requirement to evolve some mons too? Like they have to see battle to evolve? Can’t see why it wouldn’t work for others as well.,Isn’t it also a requirement to evolve some mons too? Like they have to see battle to evolve? Can’t see why it wouldn’t work for others as well.,0,2023-03-26 17:52:12,<praw.models.comment_forest.CommentForest object at 0x0000022EEE1A21F0>,122knvo,pokemon,t5_2qmeb,,False,False,t3_122knvo,t1_jdqx1wd,/r/pokemon/comments/122knvo/my_gf24_who_has_never_played_any_pokémon_game/jdrqf5s/
73,jdr1zgk,jelllybears,"Honestly how obvious is it that his gf either
- is about to dump his ass for being a tool
- “goes to another school so that’s why you don’t know her”","Honestly how obvious is it that his gf either
- is about to dump his ass for being a tool
- “goes to another school so that’s why you don’t know her”",1,2023-03-26 14:58:21,<praw.models.comment_forest.CommentForest object at 0x0000022EEE1A2490>,122knvo,pokemon,t5_2qmeb,,False,False,t3_122knvo,t1_jdqzz55,/r/pokemon/comments/122knvo/my_gf24_who_has_never_played_any_pokémon_game/jdr1zgk/
74,jdqtwwu,Nuclearstomp,The Exp All in Red is awful. Unlike the exp share in later games you will lose out on exp if you use it iirc.,The Exp All in Red is awful. Unlike the exp share in later games you will lose out on exp if you use it iirc.,2,2023-03-26 13:54:51,<praw.models.comment_forest.CommentForest object at 0x0000022EEE1A2970>,122knvo,pokemon,t5_2qmeb,,False,False,t3_122knvo,t1_jdqpme4,/r/pokemon/comments/122knvo/my_gf24_who_has_never_played_any_pokémon_game/jdqtwwu/
75,jdr2det,jelllybears,"Babe did you know these games are geared toward children

Is Go Diego Go on your list of potentially challenging games too

Go play the meta and get your ass smeared across the concrete if the base game made for children is too easy for you lmaooo","Babe did you know these games are geared toward children

Is Go Diego Go on your list of potentially challenging games too

Go play the meta and get your ass smeared across the concrete if the base game made for children is too easy for you lmaooo",3,2023-03-26 15:01:16,<praw.models.comment_forest.CommentForest object at 0x0000022EEE1A2B50>,122knvo,pokemon,t5_2qmeb,,False,False,t3_122knvo,t1_jdr1h3d,/r/pokemon/comments/122knvo/my_gf24_who_has_never_played_any_pokémon_game/jdr2det/
76,jdqx4z3,IrishSpectreN7,Grinding isn't fun. A game balanced appropriately will have the player at the appropriate level just from playing naturally.,Grinding isn't fun. A game balanced appropriately will have the player at the appropriate level just from playing naturally.,8,2023-03-26 14:21:12,<praw.models.comment_forest.CommentForest object at 0x0000022EEE1A2F70>,122knvo,pokemon,t5_2qmeb,,False,False,t3_122knvo,t1_jdqszap,/r/pokemon/comments/122knvo/my_gf24_who_has_never_played_any_pokémon_game/jdqx4z3/
77,jdqw5yc,Darkstargir,The modern Exp Share is great. Grinding is easy and boring. As everyone else says the modern is great but it should have an on/off toggle still instead of being automatic.,The modern Exp Share is great. Grinding is easy and boring. As everyone else says the modern is great but it should have an on/off toggle still instead of being automatic.,6,2023-03-26 14:13:21,<praw.models.comment_forest.CommentForest object at 0x0000022EEE1A4070>,122knvo,pokemon,t5_2qmeb,,False,False,t3_122knvo,t1_jdqszap,/r/pokemon/comments/122knvo/my_gf24_who_has_never_played_any_pokémon_game/jdqw5yc/
