,ID,Author,body,Comment,Score,Created On,Replies,Submission,Subreddit,Subreddit_ID,Distinguished,Edited,Is_submitter,link_id,Parent_id,Permalink
0,jdqpxwc,Red_Cathy,"Yeah, it's reasonably new that EXP SHARE is a default rather than something you have to find/buy. 

It's one of those things that's odd when you go back to older games, but tell her to keep up with the Emerald, that's a great game.","Yeah, it's reasonably new that EXP SHARE is a default rather than something you have to find/buy. 

It's one of those things that's odd when you go back to older games, but tell her to keep up with the Emerald, that's a great game.",222,2023-03-26 13:20:46,<praw.models.comment_forest.CommentForest object at 0x0000022EEE198AC0>,122knvo,pokemon,t5_2qmeb,,False,False,t3_122knvo,t3_122knvo,/r/pokemon/comments/122knvo/my_gf24_who_has_never_played_any_pokémon_game/jdqpxwc/
1,jdqtd0b,JohnF_ckingZoidberg,"""The most hilarious question of all time""","""The most hilarious question of all time""",391,2023-03-26 13:50:16,<praw.models.comment_forest.CommentForest object at 0x0000022EEE198B20>,122knvo,pokemon,t5_2qmeb,,False,False,t3_122knvo,t3_122knvo,/r/pokemon/comments/122knvo/my_gf24_who_has_never_played_any_pokémon_game/jdqtd0b/
2,jdqzb7p,Fonduemeinthebutt,Why would she know that? That question wasn’t funny,Why would she know that? That question wasn’t funny,42,2023-03-26 14:38:12,<praw.models.comment_forest.CommentForest object at 0x0000022EEE198BE0>,122knvo,pokemon,t5_2qmeb,,False,False,t3_122knvo,t3_122knvo,/r/pokemon/comments/122knvo/my_gf24_who_has_never_played_any_pokémon_game/jdqzb7p/
3,jdqvvzm,OwMyCandle,"‘I laughed at my gf because she didnt know a mechanic, which has existed for 10 years at this point, did not exist 20 years ago.’

YTA","‘I laughed at my gf because she didnt know a mechanic, which has existed for 10 years at this point, did not exist 20 years ago.’

YTA",203,2023-03-26 14:11:08,<praw.models.comment_forest.CommentForest object at 0x0000022EEE198E80>,122knvo,pokemon,t5_2qmeb,,False,False,t3_122knvo,t3_122knvo,/r/pokemon/comments/122knvo/my_gf24_who_has_never_played_any_pokémon_game/jdqvvzm/
4,jdqvc7t,botbattler30,"How is this a bad question? She’s played two games, both of which had the automatic exp share, and she was confused by Emerald not having it. It’s perfectly reasonable to assume that every game would have it when every game she’s played, has it.","How is this a bad question? She’s played two games, both of which had the automatic exp share, and she was confused by Emerald not having it. It’s perfectly reasonable to assume that every game would have it when every game she’s played, has it.",66,2023-03-26 14:06:45,<praw.models.comment_forest.CommentForest object at 0x0000022EEE198FD0>,122knvo,pokemon,t5_2qmeb,,False,False,t3_122knvo,t3_122knvo,/r/pokemon/comments/122knvo/my_gf24_who_has_never_played_any_pokémon_game/jdqvc7t/
5,jdqwjgw,Darkstargir,"This post screams “lol gf dumb”, like dude she didn’t know. And the team exp share is one of the best mechanic changes they’ve made. Eliminating the on/off option was dumb though.


Im assuming you also dislike the change of gaining experience for catching a Pokémon instead of just defeating.","This post screams “lol gf dumb”, like dude she didn’t know. And the team exp share is one of the best mechanic changes they’ve made. Eliminating the on/off option was dumb though.


Im assuming you also dislike the change of gaining experience for catching a Pokémon instead of just defeating.",91,2023-03-26 14:16:22,<praw.models.comment_forest.CommentForest object at 0x0000022EEE1A0130>,122knvo,pokemon,t5_2qmeb,,1679847268.0,False,t3_122knvo,t3_122knvo,/r/pokemon/comments/122knvo/my_gf24_who_has_never_played_any_pokémon_game/jdqwjgw/
6,jdqurof,Minimallycheese,"I appreciate a harder game, but personally I can’t say I miss old gen grinding. It isn’t challenging just monotonous and time consuming. 

I do wish it was still optional to avoid over-levelling though.","I appreciate a harder game, but personally I can’t say I miss old gen grinding. It isn’t challenging just monotonous and time consuming. 

I do wish it was still optional to avoid over-levelling though.",47,2023-03-26 14:02:03,<praw.models.comment_forest.CommentForest object at 0x0000022EEE1A0250>,122knvo,pokemon,t5_2qmeb,,False,False,t3_122knvo,t3_122knvo,/r/pokemon/comments/122knvo/my_gf24_who_has_never_played_any_pokémon_game/jdqurof/
7,jdqu7ws,DurableSword,"Making fun of something she had no reason to know, yeah that’s sooo funny…","Making fun of something she had no reason to know, yeah that’s sooo funny…",89,2023-03-26 13:57:25,<praw.models.comment_forest.CommentForest object at 0x0000022EEE1A03D0>,122knvo,pokemon,t5_2qmeb,,False,False,t3_122knvo,t3_122knvo,/r/pokemon/comments/122knvo/my_gf24_who_has_never_played_any_pokémon_game/jdqu7ws/
8,jdqvbei,Golden-Owl,"To be fair, that’s a completely understandable reaction

For most JRPG games, Exp is shared between all party members, in order to encourage players to regularly switch between their roster.

If Exp wasn’t shared across all party members, what ends up happening is that players will eventually lock themselves into a small, but focused party and refuse to change the team composition, because the other party members got left behind. It’s also to minimize the amount of time spent on repetitive grinding so that players can do actually fun things

Participating Pokémon only getting Exp was a somewhat old holdover from Pokemon’s earlier days, which had gotten carried forward across multiple subsequent generations. That said, as time went on, the designers became progressively better about scaling level curves, to the point that BDSP and Scarlet/Violet is overall well scaled to the players levels (considering it’s an open world game, that is). Notice how the Sinnoh E4 and Area Zero section is roughly comparable to the player’s levels.

I’m largely expecting future games to continue with the Exp Sharing system from this point onwards","To be fair, that’s a completely understandable reaction

For most JRPG games, Exp is shared between all party members, in order to encourage players to regularly switch between their roster.

If Exp wasn’t shared across all party members, what ends up happening is that players will eventually lock themselves into a small, but focused party and refuse to change the team composition, because the other party members got left behind. It’s also to minimize the amount of time spent on repetitive grinding so that players can do actually fun things

Participating Pokémon only getting Exp was a somewhat old holdover from Pokemon’s earlier days, which had gotten carried forward across multiple subsequent generations. That said, as time went on, the designers became progressively better about scaling level curves, to the point that BDSP and Scarlet/Violet is overall well scaled to the players levels (considering it’s an open world game, that is). Notice how the Sinnoh E4 and Area Zero section is roughly comparable to the player’s levels.

I’m largely expecting future games to continue with the Exp Sharing system from this point onwards",51,2023-03-26 14:06:34,<praw.models.comment_forest.CommentForest object at 0x0000022EEE1A0490>,122knvo,pokemon,t5_2qmeb,,False,False,t3_122knvo,t3_122knvo,/r/pokemon/comments/122knvo/my_gf24_who_has_never_played_any_pokémon_game/jdqvbei/
9,jdqp8lq,kumar100kpawan,"XP share mechanism from XY really spoiled people. Remember all the grinding we had to do?

edit: didn't mean it in a bad way, new xp share mech definitely is a huge timesaver and a boon for impatient people/ people who get bored easily. I was just mentioning the hard times we had to go through slaughtering entire families of zigzagoons and pelippers and tentacools to gain xp back in the day","XP share mechanism from XY really spoiled people. Remember all the grinding we had to do?

edit: didn't mean it in a bad way, new xp share mech definitely is a huge timesaver and a boon for impatient people/ people who get bored easily. I was just mentioning the hard times we had to go through slaughtering entire families of zigzagoons and pelippers and tentacools to gain xp back in the day",102,2023-03-26 13:14:21,<praw.models.comment_forest.CommentForest object at 0x0000022EEE1A0550>,122knvo,pokemon,t5_2qmeb,,1679839796.0,False,t3_122knvo,t3_122knvo,/r/pokemon/comments/122knvo/my_gf24_who_has_never_played_any_pokémon_game/jdqp8lq/
10,jdqtj5j,batkave,Why would you laugh? How was she supposed to know? Did you tip your fedora why you were at it?,Why would you laugh? How was she supposed to know? Did you tip your fedora why you were at it?,70,2023-03-26 13:51:42,<praw.models.comment_forest.CommentForest object at 0x0000022EEE1A0730>,122knvo,pokemon,t5_2qmeb,,False,False,t3_122knvo,t3_122knvo,/r/pokemon/comments/122knvo/my_gf24_who_has_never_played_any_pokémon_game/jdqtj5j/
11,jdqt7bv,Absbor,"tbf, it has been 20 years. it's understandable that she doesn't get it. damn, I wish I had time for grinding.","tbf, it has been 20 years. it's understandable that she doesn't get it. damn, I wish I had time for grinding.",13,2023-03-26 13:48:57,<praw.models.comment_forest.CommentForest object at 0x0000022EEE1A0CD0>,122knvo,pokemon,t5_2qmeb,,False,False,t3_122knvo,t3_122knvo,/r/pokemon/comments/122knvo/my_gf24_who_has_never_played_any_pokémon_game/jdqt7bv/
12,jdqw4to,jelllybears,"I do genuinely wonder if you posted this thinking “everyone on this sub is gonna make fun of my stupid stupid girlfriend” when in reality most of us read this and kind of think you’re a total fucking chode and are rooting for the gf to find a partner who won’t laugh at her when she tries to share interests with them

Also you’re probably 500x more annoying in real life too, and I’m also fairly certain you’re one of those folks who needs to be told that it’s not gay to wash between your cheeks","I do genuinely wonder if you posted this thinking “everyone on this sub is gonna make fun of my stupid stupid girlfriend” when in reality most of us read this and kind of think you’re a total fucking chode and are rooting for the gf to find a partner who won’t laugh at her when she tries to share interests with them

Also you’re probably 500x more annoying in real life too, and I’m also fairly certain you’re one of those folks who needs to be told that it’s not gay to wash between your cheeks",18,2023-03-26 14:13:06,<praw.models.comment_forest.CommentForest object at 0x0000022EEE1A0D90>,122knvo,pokemon,t5_2qmeb,,False,False,t3_122knvo,t3_122knvo,/r/pokemon/comments/122knvo/my_gf24_who_has_never_played_any_pokémon_game/jdqw4to/
13,jdqz635,pink_wraith,You did make fun of her. She didn’t know. Not everyone has played all the Pokémon games and knows about them like you.,You did make fun of her. She didn’t know. Not everyone has played all the Pokémon games and knows about them like you.,19,2023-03-26 14:37:06,<praw.models.comment_forest.CommentForest object at 0x0000022EEE1A0E50>,122knvo,pokemon,t5_2qmeb,,False,False,t3_122knvo,t3_122knvo,/r/pokemon/comments/122knvo/my_gf24_who_has_never_played_any_pokémon_game/jdqz635/
14,jdqu8z0,RF_91,"Wow, what a convoluted way to make a post saying ""lol why is exp share baseline now?/exp share baseline bad!"" 

First, let's get the obvious jokes outta the way: ""lol, a gf? You're on the Pokemon reddit, what a joke.""

Now on to the main topic: Has it really been that long since you saw a ""waaaahhh exp share always on bad!"" that we needed this poorly veiled post on it? It's been here for several games. It's not going away. And it's really not a problem. Being forced to grind to level each of your Pokemon separately adds absolutely *nothing* to the games besides increasing your playtime clock.","Wow, what a convoluted way to make a post saying ""lol why is exp share baseline now?/exp share baseline bad!"" 

First, let's get the obvious jokes outta the way: ""lol, a gf? You're on the Pokemon reddit, what a joke.""

Now on to the main topic: Has it really been that long since you saw a ""waaaahhh exp share always on bad!"" that we needed this poorly veiled post on it? It's been here for several games. It's not going away. And it's really not a problem. Being forced to grind to level each of your Pokemon separately adds absolutely *nothing* to the games besides increasing your playtime clock.",36,2023-03-26 13:57:39,<praw.models.comment_forest.CommentForest object at 0x0000022EEE1A0EB0>,122knvo,pokemon,t5_2qmeb,,False,False,t3_122knvo,t3_122knvo,/r/pokemon/comments/122knvo/my_gf24_who_has_never_played_any_pokémon_game/jdqu8z0/
15,jdqx1wd,NecRobin,Do you not invite all your pokemon to take notes during the battle? :D,Do you not invite all your pokemon to take notes during the battle? :D,4,2023-03-26 14:20:31,<praw.models.comment_forest.CommentForest object at 0x0000022EEE1A0F10>,122knvo,pokemon,t5_2qmeb,,False,False,t3_122knvo,t3_122knvo,/r/pokemon/comments/122knvo/my_gf24_who_has_never_played_any_pokémon_game/jdqx1wd/
16,jdqxesq,,"Before exp share, I used to strategically make teams of 3-4 Pokémon max just because I didn’t want to have to grind so much. The new exp share and HM improvements have been great at allowing me to use way may more Pokémon throughout a play through. Now I’ll use like 10-20 different ones depending on my mood or goals at the time.","Before exp share, I used to strategically make teams of 3-4 Pokémon max just because I didn’t want to have to grind so much. The new exp share and HM improvements have been great at allowing me to use way may more Pokémon throughout a play through. Now I’ll use like 10-20 different ones depending on my mood or goals at the time.",6,2023-03-26 14:23:21,<praw.models.comment_forest.CommentForest object at 0x0000022EEE1A2070>,122knvo,pokemon,t5_2qmeb,,False,False,t3_122knvo,t3_122knvo,/r/pokemon/comments/122knvo/my_gf24_who_has_never_played_any_pokémon_game/jdqxesq/
17,jdr68de,cameronbcarley,"I’m sure she’ll be thrilled if she finds out that not only did you make fun of her to her face, but ALSO posted it on Reddit to make sure everyone else knows you did that too.","I’m sure she’ll be thrilled if she finds out that not only did you make fun of her to her face, but ALSO posted it on Reddit to make sure everyone else knows you did that too.",6,2023-03-26 15:29:30,<praw.models.comment_forest.CommentForest object at 0x0000022EEE1A2250>,122knvo,pokemon,t5_2qmeb,,False,False,t3_122knvo,t3_122knvo,/r/pokemon/comments/122knvo/my_gf24_who_has_never_played_any_pokémon_game/jdr68de/
18,jdr281w,Inbrees,I really wish they gave an option to have exp share work like it used to. Just a simple toggle that gives us the best of both worlds.,I really wish they gave an option to have exp share work like it used to. Just a simple toggle that gives us the best of both worlds.,3,2023-03-26 15:00:08,<praw.models.comment_forest.CommentForest object at 0x0000022EEE1A22B0>,122knvo,pokemon,t5_2qmeb,,False,False,t3_122knvo,t3_122knvo,/r/pokemon/comments/122knvo/my_gf24_who_has_never_played_any_pokémon_game/jdr281w/
19,jdqvc05,froggyjm9,EXP Share is one of the best changes to the franchise. Let’s use experience and rotate a lot of Pokémon,EXP Share is one of the best changes to the franchise. Let’s use experience and rotate a lot of Pokémon,5,2023-03-26 14:06:42,<praw.models.comment_forest.CommentForest object at 0x0000022EEE1A2310>,122knvo,pokemon,t5_2qmeb,,False,False,t3_122knvo,t3_122knvo,/r/pokemon/comments/122knvo/my_gf24_who_has_never_played_any_pokémon_game/jdqvc05/
20,jdqyhxo,SazzXCV,"I mean...if she's only played the games where it IS shared to the whole party, then how would she know? It's a valid question and if your response was to belittle her, I'm not surprised she was mad.","I mean...if she's only played the games where it IS shared to the whole party, then how would she know? It's a valid question and if your response was to belittle her, I'm not surprised she was mad.",5,2023-03-26 14:31:53,<praw.models.comment_forest.CommentForest object at 0x0000022EEE1A2370>,122knvo,pokemon,t5_2qmeb,,False,False,t3_122knvo,t3_122knvo,/r/pokemon/comments/122knvo/my_gf24_who_has_never_played_any_pokémon_game/jdqyhxo/
21,jdqzz55,,[deleted],[deleted],6,2023-03-26 14:43:15,<praw.models.comment_forest.CommentForest object at 0x0000022EEE1A23D0>,122knvo,pokemon,t5_2qmeb,,False,False,t3_122knvo,t3_122knvo,/r/pokemon/comments/122knvo/my_gf24_who_has_never_played_any_pokémon_game/jdqzz55/
22,jdqrgkx,3XHAUSTD,in those days i used to trade myself exp shares from my other games so i could actually conveniently raise my pokemon. i was an impatient kid. exp all spoiled me though. imo it shouldve stayed a held item,in those days i used to trade myself exp shares from my other games so i could actually conveniently raise my pokemon. i was an impatient kid. exp all spoiled me though. imo it shouldve stayed a held item,8,2023-03-26 13:34:04,<praw.models.comment_forest.CommentForest object at 0x0000022EEE1A2430>,122knvo,pokemon,t5_2qmeb,,False,False,t3_122knvo,t3_122knvo,/r/pokemon/comments/122knvo/my_gf24_who_has_never_played_any_pokémon_game/jdqrgkx/
23,jdr021s,fireflii,"I’m failing to see the humor. Never had the same experience, but I have met assholes in my time, so I guess I have had similar experiences.","I’m failing to see the humor. Never had the same experience, but I have met assholes in my time, so I guess I have had similar experiences.",5,2023-03-26 14:43:52,<praw.models.comment_forest.CommentForest object at 0x0000022EEE1A24F0>,122knvo,pokemon,t5_2qmeb,,False,False,t3_122knvo,t3_122knvo,/r/pokemon/comments/122knvo/my_gf24_who_has_never_played_any_pokémon_game/jdr021s/
24,jdqy9vy,namiot,"I like to think that exp share is just like real life, you have a battle, one pokemon is on game, and the other five is watching. And that’s why they don’t get as much exp, they’re not learning from actually battling, but from observing it.","I like to think that exp share is just like real life, you have a battle, one pokemon is on game, and the other five is watching. And that’s why they don’t get as much exp, they’re not learning from actually battling, but from observing it.",2,2023-03-26 14:30:07,<praw.models.comment_forest.CommentForest object at 0x0000022EEE1A2550>,122knvo,pokemon,t5_2qmeb,,False,False,t3_122knvo,t3_122knvo,/r/pokemon/comments/122knvo/my_gf24_who_has_never_played_any_pokémon_game/jdqy9vy/
25,jdu71ol,Kidi_Kiderson,please be nicer to your poor girlfriend,please be nicer to your poor girlfriend,2,2023-03-27 05:49:36,<praw.models.comment_forest.CommentForest object at 0x0000022EEE1A25B0>,122knvo,pokemon,t5_2qmeb,,False,False,t3_122knvo,t3_122knvo,/r/pokemon/comments/122knvo/my_gf24_who_has_never_played_any_pokémon_game/jdu71ol/
26,jduav31,ConcernLow1979,I had a similar thing to your girlfriend cuz I started in gen 6 then went back to play the previous gen and got very annoyed lol,I had a similar thing to your girlfriend cuz I started in gen 6 then went back to play the previous gen and got very annoyed lol,2,2023-03-27 06:39:41,<praw.models.comment_forest.CommentForest object at 0x0000022EEE1A2610>,122knvo,pokemon,t5_2qmeb,,False,False,t3_122knvo,t3_122knvo,/r/pokemon/comments/122knvo/my_gf24_who_has_never_played_any_pokémon_game/jduav31/
27,jdr14t6,Protobyte_,Bro you’re a terrible bf,Bro you’re a terrible bf,4,2023-03-26 14:52:01,<praw.models.comment_forest.CommentForest object at 0x0000022EEE1A2670>,122knvo,pokemon,t5_2qmeb,,False,False,t3_122knvo,t3_122knvo,/r/pokemon/comments/122knvo/my_gf24_who_has_never_played_any_pokémon_game/jdr14t6/
28,jdqupkk,friendlywhale99,"I prefer the modern exp share(my first game had it) since it (in many cases) almost completely eliminates grinding, and unless you catch literally everything you encounter and fight every trainer, i barely find myself overlevelled(sometimes even underleveled)","I prefer the modern exp share(my first game had it) since it (in many cases) almost completely eliminates grinding, and unless you catch literally everything you encounter and fight every trainer, i barely find myself overlevelled(sometimes even underleveled)",2,2023-03-26 14:01:33,<praw.models.comment_forest.CommentForest object at 0x0000022EEE1A26D0>,122knvo,pokemon,t5_2qmeb,,False,False,t3_122knvo,t3_122knvo,/r/pokemon/comments/122knvo/my_gf24_who_has_never_played_any_pokémon_game/jdqupkk/
29,jdqz4fh,Mr-Wooloo,"I was thinking through all the things that this could be whole reddit loaded the post, like ""this game would work really well with 2d sprites,"" or ""why do you get in wild battles even when you don't touch a pokemon?""

This is just a reasonable question, and the reason why I rarely play Pokemon games from before gen 6","I was thinking through all the things that this could be whole reddit loaded the post, like ""this game would work really well with 2d sprites,"" or ""why do you get in wild battles even when you don't touch a pokemon?""

This is just a reasonable question, and the reason why I rarely play Pokemon games from before gen 6",2,2023-03-26 14:36:46,<praw.models.comment_forest.CommentForest object at 0x0000022EEE1A2730>,122knvo,pokemon,t5_2qmeb,,False,False,t3_122knvo,t3_122knvo,/r/pokemon/comments/122knvo/my_gf24_who_has_never_played_any_pokémon_game/jdqz4fh/
30,jdr24vo,_unregistered,Your neck beard must be impressive. Are you trying to kill her desire to play games? Grow up my dude,Your neck beard must be impressive. Are you trying to kill her desire to play games? Grow up my dude,4,2023-03-26 14:59:29,<praw.models.comment_forest.CommentForest object at 0x0000022EEE1A2790>,122knvo,pokemon,t5_2qmeb,,False,False,t3_122knvo,t3_122knvo,/r/pokemon/comments/122knvo/my_gf24_who_has_never_played_any_pokémon_game/jdr24vo/
31,jdr7hhg,Obvious_Drink2642,This feels like it should be on r/AmITheAsshole,This feels like it should be on r/AmITheAsshole,3,2023-03-26 15:38:25,<praw.models.comment_forest.CommentForest object at 0x0000022EEE1A27F0>,122knvo,pokemon,t5_2qmeb,,False,False,t3_122knvo,t3_122knvo,/r/pokemon/comments/122knvo/my_gf24_who_has_never_played_any_pokémon_game/jdr7hhg/
32,jdr0psy,deathflare,you’re telling me you grew up with the exp share changes over the years and weren’t expecting to explain the kind of qol changes that come with playing the old school games? to the point that you were sooo caught off-guard that you laughed in her face? do you want her to like emerald or not??,you’re telling me you grew up with the exp share changes over the years and weren’t expecting to explain the kind of qol changes that come with playing the old school games? to the point that you were sooo caught off-guard that you laughed in her face? do you want her to like emerald or not??,2,2023-03-26 14:48:54,<praw.models.comment_forest.CommentForest object at 0x0000022EEE1A2850>,122knvo,pokemon,t5_2qmeb,,False,False,t3_122knvo,t3_122knvo,/r/pokemon/comments/122knvo/my_gf24_who_has_never_played_any_pokémon_game/jdr0psy/
33,jdqpme4,RandomStuff3829,"I recently played Red via emulator, and now I'm playing Gold. The biggest mistake i made in Red was using the Exp. All too much. Won't be doing that again. Grinding it is.","I recently played Red via emulator, and now I'm playing Gold. The biggest mistake i made in Red was using the Exp. All too much. Won't be doing that again. Grinding it is.",2,2023-03-26 13:17:52,<praw.models.comment_forest.CommentForest object at 0x0000022EEE1A28B0>,122knvo,pokemon,t5_2qmeb,,False,False,t3_122knvo,t3_122knvo,/r/pokemon/comments/122knvo/my_gf24_who_has_never_played_any_pokémon_game/jdqpme4/
34,jdr5id1,,Least elitist Emerald Stan,Least elitist Emerald Stan,1,2023-03-26 15:24:17,<praw.models.comment_forest.CommentForest object at 0x0000022EEE1A2910>,122knvo,pokemon,t5_2qmeb,,False,False,t3_122knvo,t3_122knvo,/r/pokemon/comments/122knvo/my_gf24_who_has_never_played_any_pokémon_game/jdr5id1/
35,jdr7nsf,antroxdemonator,"I don't find it particularly odd. A lot of wrestlers (like Freestyle, Greco-Roman, and Folkstyle wrestling, not that faje WWE crap) can get get better from watching matches they aren't in. I can remember wrestling is high school and watching the match from my team's real good wrestler and the reigning state champ. I explained just before their next meet up, that our guy could beat him, he just needed to beat the state champ's sweep single leg. Our guy defended that sweep single like a champ, and nearly beat the state champ, losing by a single point from a lucky reversal. So it is entirely possible that Pokemon could function the same way.","I don't find it particularly odd. A lot of wrestlers (like Freestyle, Greco-Roman, and Folkstyle wrestling, not that faje WWE crap) can get get better from watching matches they aren't in. I can remember wrestling is high school and watching the match from my team's real good wrestler and the reigning state champ. I explained just before their next meet up, that our guy could beat him, he just needed to beat the state champ's sweep single leg. Our guy defended that sweep single like a champ, and nearly beat the state champ, losing by a single point from a lucky reversal. So it is entirely possible that Pokemon could function the same way.",1,2023-03-26 15:39:39,<praw.models.comment_forest.CommentForest object at 0x0000022EEE1A29D0>,122knvo,pokemon,t5_2qmeb,,False,False,t3_122knvo,t3_122knvo,/r/pokemon/comments/122knvo/my_gf24_who_has_never_played_any_pokémon_game/jdr7nsf/
