,ID,Author,body,Comment,Score,Created On,Replies,Submission,Subreddit,Subreddit_ID,Distinguished,Edited,Is_submitter,link_id,Parent_id,Permalink
321,ixrb1uw,yurtfarmer,"I guess I am not really a bag holder as there still is value in my $tsla shares, but definitely down from original purchase price .   The not scared part seems obvious. I think it could go up in value is what that means.  My advice is do what you want.  Hopefully this is helpful","I guess I am not really a bag holder as there still is value in my $tsla shares, but definitely down from original purchase price .   The not scared part seems obvious. I think it could go up in value is what that means.  My advice is do what you want.  Hopefully this is helpful",1,2022-11-25 18:35:56,<praw.models.comment_forest.CommentForest object at 0x000001BA5E33D3D0>,z4im6a,wallstreetbets,t5_2th52,,False,False,t3_z4im6a,t1_ixr15dg,/r/wallstreetbets/comments/z4im6a/opinions_on_tesla_and_elon_musk_buy_tesla_stock/ixrb1uw/
322,ixr9n1s,Fl0ting_P0tat0,"If you see big green thingys, you buy, big red thingys, you sell.","If you see big green thingys, you buy, big red thingys, you sell.",2,2022-11-25 18:25:39,<praw.models.comment_forest.CommentForest object at 0x000001BA5E337FA0>,z4im6a,wallstreetbets,t5_2th52,,False,False,t3_z4im6a,t1_ixr1sdk,/r/wallstreetbets/comments/z4im6a/opinions_on_tesla_and_elon_musk_buy_tesla_stock/ixr9n1s/
323,ixr1t9y,OSRSkarma,Examples of?,Examples of?,4,2022-11-25 17:27:55,<praw.models.comment_forest.CommentForest object at 0x000001BA5E337C70>,z4im6a,wallstreetbets,t5_2th52,,False,False,t3_z4im6a,t1_ixr1sdk,/r/wallstreetbets/comments/z4im6a/opinions_on_tesla_and_elon_musk_buy_tesla_stock/ixr1t9y/
324,iy3wzy4,,It means it expires that very same day.,It means it expires that very same day.,1,2022-11-28 15:50:48,<praw.models.comment_forest.CommentForest object at 0x000001BA5E337EB0>,z4im6a,wallstreetbets,t5_2th52,,False,False,t3_z4im6a,t1_ixs94zm,/r/wallstreetbets/comments/z4im6a/opinions_on_tesla_and_elon_musk_buy_tesla_stock/iy3wzy4/
325,ixr242p,Possible_Bar_3527,"Buy stock for years, LT story still intact. 
For trading, think we will see a bounce close to $200. 
Beyond that, depends on factors like musk focus on Twtr, economy, electricity prices","Buy stock for years, LT story still intact. 
For trading, think we will see a bounce close to $200. 
Beyond that, depends on factors like musk focus on Twtr, economy, electricity prices",4,2022-11-25 17:30:09,<praw.models.comment_forest.CommentForest object at 0x000001BA5E337370>,z4im6a,wallstreetbets,t5_2th52,,False,False,t3_z4im6a,t1_ixr1opx,/r/wallstreetbets/comments/z4im6a/opinions_on_tesla_and_elon_musk_buy_tesla_stock/ixr242p/
326,ixt6i9s,hands0megenius,"You're both wrong. Its valued on the proven explosive growth that is evident with a half second glance at Tesla's basic financial data. Valuation had gotten carried away, is now in the realm of reasonable","You're both wrong. Its valued on the proven explosive growth that is evident with a half second glance at Tesla's basic financial data. Valuation had gotten carried away, is now in the realm of reasonable",4,2022-11-26 03:40:27,<praw.models.comment_forest.CommentForest object at 0x000001BA5E337790>,z4im6a,wallstreetbets,t5_2th52,,False,False,t3_z4im6a,t1_ixrepaq,/r/wallstreetbets/comments/z4im6a/opinions_on_tesla_and_elon_musk_buy_tesla_stock/ixt6i9s/
327,ixso0q7,OG_Flushing_Toilet,"It’s not the sale of shares that should be concerning to shareholders. It’s the fact he’s leveraged a metric fuckton of them as he’s simultaneously repeating his past by misappropriating resources to help other ventures by asking autopilot engineers to review Twitter code “on their own time”. Which any fool knows means they would have done on the clock had the board not intervened. 

As the price falls, the banks become more likely to call his notes on Twitter. If that happens, they’re not sitting on those shares. They’ll be dumped. 

And there is the looming possibility he has to step down as CEO which will cause fanbois to sell off. 

All of this is way too risky for an auto manufacturer. And he can crow all he wants about them not being a car company, but that’s just bullshit.","It’s not the sale of shares that should be concerning to shareholders. It’s the fact he’s leveraged a metric fuckton of them as he’s simultaneously repeating his past by misappropriating resources to help other ventures by asking autopilot engineers to review Twitter code “on their own time”. Which any fool knows means they would have done on the clock had the board not intervened. 

As the price falls, the banks become more likely to call his notes on Twitter. If that happens, they’re not sitting on those shares. They’ll be dumped. 

And there is the looming possibility he has to step down as CEO which will cause fanbois to sell off. 

All of this is way too risky for an auto manufacturer. And he can crow all he wants about them not being a car company, but that’s just bullshit.",2,2022-11-26 00:54:48,<praw.models.comment_forest.CommentForest object at 0x000001BA5E3375B0>,z4im6a,wallstreetbets,t5_2th52,,False,False,t3_z4im6a,t1_ixr5kt9,/r/wallstreetbets/comments/z4im6a/opinions_on_tesla_and_elon_musk_buy_tesla_stock/ixso0q7/
328,ixr6bmc,College-Lumpy,"Perhaps. He’s cut their burn rate dramatically. 

Bigger question is can Tesla continue to grow and deliver cars without compromising their margins.  Demand is softening in China and I’m wondering if the demand will be here at these prices.

Overall I’m bearish but it is dropping enough that it starts to get interesting around 150.","Perhaps. He’s cut their burn rate dramatically. 

Bigger question is can Tesla continue to grow and deliver cars without compromising their margins.  Demand is softening in China and I’m wondering if the demand will be here at these prices.

Overall I’m bearish but it is dropping enough that it starts to get interesting around 150.",3,2022-11-25 18:01:08,<praw.models.comment_forest.CommentForest object at 0x000001BA5E337820>,z4im6a,wallstreetbets,t5_2th52,,False,False,t3_z4im6a,t1_ixr5kt9,/r/wallstreetbets/comments/z4im6a/opinions_on_tesla_and_elon_musk_buy_tesla_stock/ixr6bmc/
329,ixtabq2,stuckintraffic86,"Except Twitter won't fail he will at the very least triple his investment and Tesla is a   
great buy right now.","Except Twitter won't fail he will at the very least triple his investment and Tesla is a   
great buy right now.",0,2022-11-26 04:16:39,<praw.models.comment_forest.CommentForest object at 0x000001BA5E337610>,z4im6a,wallstreetbets,t5_2th52,,False,False,t3_z4im6a,t1_ixr5kt9,/r/wallstreetbets/comments/z4im6a/opinions_on_tesla_and_elon_musk_buy_tesla_stock/ixtabq2/
330,ixr4zx3,,[deleted],[deleted],13,2022-11-25 17:51:26,<praw.models.comment_forest.CommentForest object at 0x000001BA5E3374F0>,z4im6a,wallstreetbets,t5_2th52,,False,False,t3_z4im6a,t1_ixr4r09,/r/wallstreetbets/comments/z4im6a/opinions_on_tesla_and_elon_musk_buy_tesla_stock/ixr4zx3/
331,ixslv2g,beckettcat,I like your argument the most.,I like your argument the most.,3,2022-11-26 00:36:07,<praw.models.comment_forest.CommentForest object at 0x000001BA5E322FD0>,z4im6a,wallstreetbets,t5_2th52,,False,False,t3_z4im6a,t1_ixsda7g,/r/wallstreetbets/comments/z4im6a/opinions_on_tesla_and_elon_musk_buy_tesla_stock/ixslv2g/
332,ixug0zi,SirenSilver,">If competition starts building a surplus of EVs that are on lots, few of their clients are going to wait months for a Tesla. And that’s becoming more likely by the day.

Now do iPhone! An iPhone is not a cell phone an EV is not a Tesla.  


High income people in a bad market wills stop leasing BMWs, Tesla buyers are a different crowd.",">If competition starts building a surplus of EVs that are on lots, few of their clients are going to wait months for a Tesla. And that’s becoming more likely by the day.

Now do iPhone! An iPhone is not a cell phone an EV is not a Tesla.  


High income people in a bad market wills stop leasing BMWs, Tesla buyers are a different crowd.",1,2022-11-26 13:18:11,<praw.models.comment_forest.CommentForest object at 0x000001BA5E322A60>,z4im6a,wallstreetbets,t5_2th52,,False,False,t3_z4im6a,t1_ixsda7g,/r/wallstreetbets/comments/z4im6a/opinions_on_tesla_and_elon_musk_buy_tesla_stock/ixug0zi/
333,ixrgdbj,anygal,"Tesla is a premium car company, with premium car company tech and premium car company margins. They made two achievements, 1. Starting the EV revolution 2. Making the world believe that Tesla is a tech company. BYD/Toyota/VW also makes their own batteries (and most Tesla cars still have Panasonic batteries in them). Tesla solar is worth like $3-4 billion at max. Their supposed 'full self driving' is basically the same as other major (and even some minor) companies driving assistant. Just look up the driving assist tests on EuroNCAP, there are already like 13 automakers with 90%+ scores.","Tesla is a premium car company, with premium car company tech and premium car company margins. They made two achievements, 1. Starting the EV revolution 2. Making the world believe that Tesla is a tech company. BYD/Toyota/VW also makes their own batteries (and most Tesla cars still have Panasonic batteries in them). Tesla solar is worth like $3-4 billion at max. Their supposed 'full self driving' is basically the same as other major (and even some minor) companies driving assistant. Just look up the driving assist tests on EuroNCAP, there are already like 13 automakers with 90%+ scores.",3,2022-11-25 19:15:00,<praw.models.comment_forest.CommentForest object at 0x000001BA5E322E50>,z4im6a,wallstreetbets,t5_2th52,,False,False,t3_z4im6a,t1_ixr67ki,/r/wallstreetbets/comments/z4im6a/opinions_on_tesla_and_elon_musk_buy_tesla_stock/ixrgdbj/
334,ixsncqb,OG_Flushing_Toilet,"As it’s share value decreases I find it more attractive. But hold no position on it for now, and I do have F and GM. When they get a real CEO, which they inevitably will now that Musk has leveraged his shares, I’ll probably consider it after the volatility from that. As for now though, I think so many fans of his put value in him as a person, that I’m not willing to bet on his long term role in the business. Especially since he’s had a history of manipulating the stock and trying to misappropriate funding and resources for his other businesses. Most normal companies would have gotten rid of an executive like this long ago.","As it’s share value decreases I find it more attractive. But hold no position on it for now, and I do have F and GM. When they get a real CEO, which they inevitably will now that Musk has leveraged his shares, I’ll probably consider it after the volatility from that. As for now though, I think so many fans of his put value in him as a person, that I’m not willing to bet on his long term role in the business. Especially since he’s had a history of manipulating the stock and trying to misappropriate funding and resources for his other businesses. Most normal companies would have gotten rid of an executive like this long ago.",2,2022-11-26 00:48:59,<praw.models.comment_forest.CommentForest object at 0x000001BA5E322B20>,z4im6a,wallstreetbets,t5_2th52,,False,False,t3_z4im6a,t1_ixr61b6,/r/wallstreetbets/comments/z4im6a/opinions_on_tesla_and_elon_musk_buy_tesla_stock/ixsncqb/
335,ixugako,SirenSilver,">You forgot Elon is crazy.

How does that change anything at all? The rest of us are looking at the math, people like you are still irrational because you are woke and suddenly twitter=bad.",">You forgot Elon is crazy.

How does that change anything at all? The rest of us are looking at the math, people like you are still irrational because you are woke and suddenly twitter=bad.",0,2022-11-26 13:21:00,<praw.models.comment_forest.CommentForest object at 0x000001BA5E3227F0>,z4im6a,wallstreetbets,t5_2th52,,False,False,t3_z4im6a,t1_ixr61b6,/r/wallstreetbets/comments/z4im6a/opinions_on_tesla_and_elon_musk_buy_tesla_stock/ixugako/
336,ixr1weu,Resident_Spend4544,"From what I've seen, stocks that fall cuz of reasons that arnt directly related to the company bounce back fast. (like the tsla didn't get kicked out of china or they didn't burn their giga factories. All their ai tech and data is still there, the company is fairly solid. I'm hoping I'll get to 250, I wouldn't hold it longer than a year Max)","From what I've seen, stocks that fall cuz of reasons that arnt directly related to the company bounce back fast. (like the tsla didn't get kicked out of china or they didn't burn their giga factories. All their ai tech and data is still there, the company is fairly solid. I'm hoping I'll get to 250, I wouldn't hold it longer than a year Max)",3,2022-11-25 17:28:33,<praw.models.comment_forest.CommentForest object at 0x000001BA5E322730>,z4im6a,wallstreetbets,t5_2th52,,1669397784.0,False,t3_z4im6a,t1_ixr13xf,/r/wallstreetbets/comments/z4im6a/opinions_on_tesla_and_elon_musk_buy_tesla_stock/ixr1weu/
337,ixr3fj5,rrsurfer1,"If he can hold long term yup. It's a fire sale right now. For perspective, almost yearly Tesla drops over 60% then recovers. But the overall trend is up and my early shares are still over 1000% gains.","If he can hold long term yup. It's a fire sale right now. For perspective, almost yearly Tesla drops over 60% then recovers. But the overall trend is up and my early shares are still over 1000% gains.",0,2022-11-25 17:39:51,<praw.models.comment_forest.CommentForest object at 0x000001BA5E301250>,z4im6a,wallstreetbets,t5_2th52,,False,False,t3_z4im6a,t1_ixr0c0n,/r/wallstreetbets/comments/z4im6a/opinions_on_tesla_and_elon_musk_buy_tesla_stock/ixr3fj5/
338,ixugqel,SirenSilver,"Woke leftists have no principles, they'll keep buying Tesla cars.  


Do you really think they are going to show up at their summer home next July in a Hummer EV?","Woke leftists have no principles, they'll keep buying Tesla cars.  


Do you really think they are going to show up at their summer home next July in a Hummer EV?",1,2022-11-26 13:25:38,<praw.models.comment_forest.CommentForest object at 0x000001BA5E301E20>,z4im6a,wallstreetbets,t5_2th52,,False,False,t3_z4im6a,t1_ixr8ekw,/r/wallstreetbets/comments/z4im6a/opinions_on_tesla_and_elon_musk_buy_tesla_stock/ixugqel/
339,ixwx5f2,driveonsun,Oh I did.  When Elon went maga.  Kept me from losing a lot of money.   I’m smart enough to know that a green tech company is fucked when the ceo becomes an activist for climate change deniers. If you don’t think blowing hundreds of billions to get insurrectionists back onto twitter qualifies as radical political activism what would?,Oh I did.  When Elon went maga.  Kept me from losing a lot of money.   I’m smart enough to know that a green tech company is fucked when the ceo becomes an activist for climate change deniers. If you don’t think blowing hundreds of billions to get insurrectionists back onto twitter qualifies as radical political activism what would?,1,2022-11-27 00:44:47,<praw.models.comment_forest.CommentForest object at 0x000001BA5E301460>,z4im6a,wallstreetbets,t5_2th52,,False,False,t3_z4im6a,t1_ixuhimj,/r/wallstreetbets/comments/z4im6a/opinions_on_tesla_and_elon_musk_buy_tesla_stock/ixwx5f2/
340,iy21rhq,kevj1121,What industry are you looking at?  50+yr payback for Tesla.  And it's possible an entire industry is bloated.,What industry are you looking at?  50+yr payback for Tesla.  And it's possible an entire industry is bloated.,1,2022-11-28 03:38:10,<praw.models.comment_forest.CommentForest object at 0x000001BA5E32DC10>,z4im6a,wallstreetbets,t5_2th52,,False,False,t3_z4im6a,t1_ixuh3rj,/r/wallstreetbets/comments/z4im6a/opinions_on_tesla_and_elon_musk_buy_tesla_stock/iy21rhq/
341,ixsvhkx,yolo_call,It’s the lowest it’s been since March 2020 🤣 it’s a definite buy.,It’s the lowest it’s been since March 2020 🤣 it’s a definite buy.,9,2022-11-26 02:00:59,<praw.models.comment_forest.CommentForest object at 0x000001BA5E30D8B0>,z4im6a,wallstreetbets,t5_2th52,,False,False,t3_z4im6a,t1_ixrutx8,/r/wallstreetbets/comments/z4im6a/opinions_on_tesla_and_elon_musk_buy_tesla_stock/ixsvhkx/
342,ixs3n4t,Aniki722,There's no way Tesla will keep growing at 50% annually. And they only make cars. Amazon makes everything short of cars and is growing like crazy.,There's no way Tesla will keep growing at 50% annually. And they only make cars. Amazon makes everything short of cars and is growing like crazy.,5,2022-11-25 22:06:43,<praw.models.comment_forest.CommentForest object at 0x000001BA5E30D040>,z4im6a,wallstreetbets,t5_2th52,,False,False,t3_z4im6a,t1_ixrutx8,/r/wallstreetbets/comments/z4im6a/opinions_on_tesla_and_elon_musk_buy_tesla_stock/ixs3n4t/
343,ixrwstc,_Brenky,"Thanks for sending that. Informative read for this ape behind his small phone screen. 

So if i understand correctly, about 4-5billion in tesla (or spacex/boringtunnel, low chance ofc) shares are at risk. Plus the additional -forgot how many- extra debt for each year if twitters bleeds. 

That still leaves me with the opinion that tesla, in the long run, will be fine even if twitter fails. Will it hurt and move the stock tremendously? Yes probably. Will it completely kill tesla/tsla price in the long long term? Probably not.","Thanks for sending that. Informative read for this ape behind his small phone screen. 

So if i understand correctly, about 4-5billion in tesla (or spacex/boringtunnel, low chance ofc) shares are at risk. Plus the additional -forgot how many- extra debt for each year if twitters bleeds. 

That still leaves me with the opinion that tesla, in the long run, will be fine even if twitter fails. Will it hurt and move the stock tremendously? Yes probably. Will it completely kill tesla/tsla price in the long long term? Probably not.",2,2022-11-25 21:14:35,<praw.models.comment_forest.CommentForest object at 0x000001BA5E33D940>,z4im6a,wallstreetbets,t5_2th52,,False,False,t3_z4im6a,t1_ixrrcga,/r/wallstreetbets/comments/z4im6a/opinions_on_tesla_and_elon_musk_buy_tesla_stock/ixrwstc/
344,ixsqj0j,hbkx5,Dude still has a lot of liquid cash. I think he will be fine. Time will tell though. Interested to see twitter in 10 years.,Dude still has a lot of liquid cash. I think he will be fine. Time will tell though. Interested to see twitter in 10 years.,4,2022-11-26 01:17:06,<praw.models.comment_forest.CommentForest object at 0x000001BA5E33DAF0>,z4im6a,wallstreetbets,t5_2th52,,False,False,t3_z4im6a,t1_ixre2qk,/r/wallstreetbets/comments/z4im6a/opinions_on_tesla_and_elon_musk_buy_tesla_stock/ixsqj0j/
345,ixr7j10,thenumberpounder,No sane investor thinks elon is investable? lmfao what? must be a lot of insane investors since he was able to secure billions on the twitter acquisition,No sane investor thinks elon is investable? lmfao what? must be a lot of insane investors since he was able to secure billions on the twitter acquisition,-11,2022-11-25 18:10:00,<praw.models.comment_forest.CommentForest object at 0x000001BA5E33DC40>,z4im6a,wallstreetbets,t5_2th52,,1669401920.0,False,t3_z4im6a,t1_ixr5esz,/r/wallstreetbets/comments/z4im6a/opinions_on_tesla_and_elon_musk_buy_tesla_stock/ixr7j10/
346,ixt644s,hands0megenius,"Go ahead not investing in 50+% YoY growth, highest margins in the business, biggest market share in a rapidly growing subsector, because he's a mean rich man","Go ahead not investing in 50+% YoY growth, highest margins in the business, biggest market share in a rapidly growing subsector, because he's a mean rich man",0,2022-11-26 03:36:54,<praw.models.comment_forest.CommentForest object at 0x000001BA5E33DAC0>,z4im6a,wallstreetbets,t5_2th52,,False,False,t3_z4im6a,t1_ixr5esz,/r/wallstreetbets/comments/z4im6a/opinions_on_tesla_and_elon_musk_buy_tesla_stock/ixt644s/
347,ixrcp4c,Key-Marionberry-8794,"Thanks random Redditor, I enjoyed that video and his top 5 worst acquisitions ever video","Thanks random Redditor, I enjoyed that video and his top 5 worst acquisitions ever video",1,2022-11-25 18:47:52,<praw.models.comment_forest.CommentForest object at 0x000001BA5E33D880>,z4im6a,wallstreetbets,t5_2th52,,False,False,t3_z4im6a,t1_ixr25fy,/r/wallstreetbets/comments/z4im6a/opinions_on_tesla_and_elon_musk_buy_tesla_stock/ixrcp4c/
348,ixsmosw,,[deleted],[deleted],9,2022-11-26 00:43:12,<praw.models.comment_forest.CommentForest object at 0x000001BA5E33D190>,z4im6a,wallstreetbets,t5_2th52,,False,False,t3_z4im6a,t1_ixr27lj,/r/wallstreetbets/comments/z4im6a/opinions_on_tesla_and_elon_musk_buy_tesla_stock/ixsmosw/
349,ixr3er6,WhyBee92,I read that as no confidence and secretly shitting their pants,I read that as no confidence and secretly shitting their pants,2,2022-11-25 17:39:42,<praw.models.comment_forest.CommentForest object at 0x000001BA5E33D1F0>,z4im6a,wallstreetbets,t5_2th52,,False,False,t3_z4im6a,t1_ixr27lj,/r/wallstreetbets/comments/z4im6a/opinions_on_tesla_and_elon_musk_buy_tesla_stock/ixr3er6/
350,ixr46xz,BananaChanges,Deez nutz,Deez nutz,12,2022-11-25 17:45:31,<praw.models.comment_forest.CommentForest object at 0x000001BA5E337E80>,z4im6a,wallstreetbets,t5_2th52,,False,False,t3_z4im6a,t1_ixr1t9y,/r/wallstreetbets/comments/z4im6a/opinions_on_tesla_and_elon_musk_buy_tesla_stock/ixr46xz/
351,ixr28a5,a1bells,Ok,Ok,-1,2022-11-25 17:31:01,<praw.models.comment_forest.CommentForest object at 0x000001BA5E337A60>,z4im6a,wallstreetbets,t5_2th52,,False,True,t3_z4im6a,t1_ixr242p,/r/wallstreetbets/comments/z4im6a/opinions_on_tesla_and_elon_musk_buy_tesla_stock/ixr28a5/
352,ixta5u3,stuckintraffic86,"Actually, You're Troth wrong, I dont have a reason why, but argue that the treeth of you are incorrect.","Actually, You're Troth wrong, I dont have a reason why, but argue that the treeth of you are incorrect.",4,2022-11-26 04:15:03,<praw.models.comment_forest.CommentForest object at 0x000001BA5E3377F0>,z4im6a,wallstreetbets,t5_2th52,,False,False,t3_z4im6a,t1_ixt6i9s,/r/wallstreetbets/comments/z4im6a/opinions_on_tesla_and_elon_musk_buy_tesla_stock/ixta5u3/
353,ixr6nb2,Kengriffinspimp,It’s going to $69,It’s going to $69,1,2022-11-25 18:03:31,<praw.models.comment_forest.CommentForest object at 0x000001BA5E337310>,z4im6a,wallstreetbets,t5_2th52,,False,False,t3_z4im6a,t1_ixr6bmc,/r/wallstreetbets/comments/z4im6a/opinions_on_tesla_and_elon_musk_buy_tesla_stock/ixr6nb2/
354,ixrh4pq,ptizzle9,Lol,Lol,3,2022-11-25 19:20:48,<praw.models.comment_forest.CommentForest object at 0x000001BA5E3370A0>,z4im6a,wallstreetbets,t5_2th52,,False,False,t3_z4im6a,t1_ixr4zx3,/r/wallstreetbets/comments/z4im6a/opinions_on_tesla_and_elon_musk_buy_tesla_stock/ixrh4pq/
355,ixr51nw,a1bells,Why you being mean for?,Why you being mean for?,-3,2022-11-25 17:51:47,<praw.models.comment_forest.CommentForest object at 0x000001BA5E3370D0>,z4im6a,wallstreetbets,t5_2th52,,False,True,t3_z4im6a,t1_ixr4zx3,/r/wallstreetbets/comments/z4im6a/opinions_on_tesla_and_elon_musk_buy_tesla_stock/ixr51nw/
356,ixuhn9v,Kengriffinspimp,"Lolol “you want people to have access to healthcare and better working conditions”

You really insulted me with that woke line.

Tsla is down how much? Cope harder, no one wants to invest in a distracts CEO tweeting conspiracy theories.

Why do you love an oligarch so much?","Lolol “you want people to have access to healthcare and better working conditions”

You really insulted me with that woke line.

Tsla is down how much? Cope harder, no one wants to invest in a distracts CEO tweeting conspiracy theories.

Why do you love an oligarch so much?",2,2022-11-26 13:35:03,<praw.models.comment_forest.CommentForest object at 0x000001BA5E322D30>,z4im6a,wallstreetbets,t5_2th52,,False,False,t3_z4im6a,t1_ixugako,/r/wallstreetbets/comments/z4im6a/opinions_on_tesla_and_elon_musk_buy_tesla_stock/ixuhn9v/
357,ixr5p4b,Kengriffinspimp,Except their products are not good quality and people no longer trust TSLA,Except their products are not good quality and people no longer trust TSLA,3,2022-11-25 17:56:35,<praw.models.comment_forest.CommentForest object at 0x000001BA5E322760>,z4im6a,wallstreetbets,t5_2th52,,False,False,t3_z4im6a,t1_ixr1weu,/r/wallstreetbets/comments/z4im6a/opinions_on_tesla_and_elon_musk_buy_tesla_stock/ixr5p4b/
358,ixr4xhs,theNDcpa,I always buy for long term. Tesla is an amazing buy right now for long term buyers. The best company in the world when looking at financials. They will only continue to get bigger and better as the years go on.,I always buy for long term. Tesla is an amazing buy right now for long term buyers. The best company in the world when looking at financials. They will only continue to get bigger and better as the years go on.,2,2022-11-25 17:50:56,<praw.models.comment_forest.CommentForest object at 0x000001BA5E301CD0>,z4im6a,wallstreetbets,t5_2th52,,False,False,t3_z4im6a,t1_ixr3fj5,/r/wallstreetbets/comments/z4im6a/opinions_on_tesla_and_elon_musk_buy_tesla_stock/ixr4xhs/
359,ixwwxve,driveonsun,Pure ignorance.  Go browse r/electricvehicles and you’ll lose count off all the people who want an EV but not a tesla purely because of Elon.,Pure ignorance.  Go browse r/electricvehicles and you’ll lose count off all the people who want an EV but not a tesla purely because of Elon.,1,2022-11-27 00:43:06,<praw.models.comment_forest.CommentForest object at 0x000001BA5E301730>,z4im6a,wallstreetbets,t5_2th52,,False,False,t3_z4im6a,t1_ixugqel,/r/wallstreetbets/comments/z4im6a/opinions_on_tesla_and_elon_musk_buy_tesla_stock/ixwwxve/
360,iy4201g,SirenSilver,">blowing hundreds of billions to get insurrectionists back onto twitter

I think you just proved you don't have a point. Thanks.",">blowing hundreds of billions to get insurrectionists back onto twitter

I think you just proved you don't have a point. Thanks.",1,2022-11-28 16:26:01,<praw.models.comment_forest.CommentForest object at 0x000001BA5E3016D0>,z4im6a,wallstreetbets,t5_2th52,,False,False,t3_z4im6a,t1_ixwx5f2,/r/wallstreetbets/comments/z4im6a/opinions_on_tesla_and_elon_musk_buy_tesla_stock/iy4201g/
