,ID,Author,body,Comment,Score,Created On,Replies,Submission,Subreddit,Subreddit_ID,Distinguished,Edited,Is_submitter,link_id,Parent_id,Permalink
95,i84wi3z,Woodythebartender,"This sub cheers on the loss porn, so when I see these types of posts they confuse me. GME could be a bunch of bologna, but I’m willing to place a wager. Isn’t that what we’re all here for? Just my thoughts. Cheers.","This sub cheers on the loss porn, so when I see these types of posts they confuse me. GME could be a bunch of bologna, but I’m willing to place a wager. Isn’t that what we’re all here for? Just my thoughts. Cheers.",11,2022-05-11 02:44:17,<praw.models.comment_forest.CommentForest object at 0x000001BA5D200B80>,umyjua,wallstreetbets,t5_2th52,,1652240343.0,False,t3_umyjua,t1_i84v331,/r/wallstreetbets/comments/umyjua/did_some_digging_did_you_know_the_theories_gme/i84wi3z/
96,i88cbpv,Novice-Expert,Apes are the Q of finance tbh.,Apes are the Q of finance tbh.,6,2022-05-11 20:32:31,<praw.models.comment_forest.CommentForest object at 0x000001BA5D200DC0>,umyjua,wallstreetbets,t5_2th52,,False,False,t3_umyjua,t1_i84vrl1,/r/wallstreetbets/comments/umyjua/did_some_digging_did_you_know_the_theories_gme/i88cbpv/
97,i85gmea,DorkHonor,Modicum you mouth breather.,Modicum you mouth breather.,6,2022-05-11 05:54:07,<praw.models.comment_forest.CommentForest object at 0x000001BA5D200FD0>,umyjua,wallstreetbets,t5_2th52,,False,False,t3_umyjua,t1_i84vrl1,/r/wallstreetbets/comments/umyjua/did_some_digging_did_you_know_the_theories_gme/i85gmea/
98,i84xin0,Woodythebartender,I’ll take your word for it chief.,I’ll take your word for it chief.,-6,2022-05-11 02:52:08,<praw.models.comment_forest.CommentForest object at 0x000001BA5D200B50>,umyjua,wallstreetbets,t5_2th52,,False,False,t3_umyjua,t1_i84vrl1,/r/wallstreetbets/comments/umyjua/did_some_digging_did_you_know_the_theories_gme/i84xin0/
99,i87ti3f,Existing_Wrangler_15,Why was the buy button turned off? I can’t find anything explaining it,Why was the buy button turned off? I can’t find anything explaining it,-1,2022-05-11 18:29:34,<praw.models.comment_forest.CommentForest object at 0x000001BA5D200400>,umyjua,wallstreetbets,t5_2th52,,False,False,t3_umyjua,t1_i85wx5s,/r/wallstreetbets/comments/umyjua/did_some_digging_did_you_know_the_theories_gme/i87ti3f/
100,i84wp0m,Puritopian,"From OP's title. ""recycled conspiracies from over a **decade** ago"" 2022 - 10 = 2012.","From OP's title. ""recycled conspiracies from over a **decade** ago"" 2022 - 10 = 2012.",7,2022-05-11 02:45:47,<praw.models.comment_forest.CommentForest object at 0x000001BA62A41FD0>,umyjua,wallstreetbets,t5_2th52,,False,False,t3_umyjua,t1_i84vikj,/r/wallstreetbets/comments/umyjua/did_some_digging_did_you_know_the_theories_gme/i84wp0m/
101,i85kcsc,Uisce-beatha,This is an investing sub?,This is an investing sub?,14,2022-05-11 06:39:35,<praw.models.comment_forest.CommentForest object at 0x000001BA5D218880>,umyjua,wallstreetbets,t5_2th52,,False,False,t3_umyjua,t1_i858mk9,/r/wallstreetbets/comments/umyjua/did_some_digging_did_you_know_the_theories_gme/i85kcsc/
102,i859cif,IBMformatted,Information.,Information.,2,2022-05-11 04:35:21,<praw.models.comment_forest.CommentForest object at 0x000001BA5D218B50>,umyjua,wallstreetbets,t5_2th52,,False,False,t3_umyjua,t1_i858mk9,/r/wallstreetbets/comments/umyjua/did_some_digging_did_you_know_the_theories_gme/i859cif/
103,i851gzp,isucktrading,![img](emote|t5_2th52|4276),![img](emote|t5_2th52|4276),5,2022-05-11 03:24:44,<praw.models.comment_forest.CommentForest object at 0x000001BA5D218550>,umyjua,wallstreetbets,t5_2th52,,False,False,t3_umyjua,t1_i84v7u2,/r/wallstreetbets/comments/umyjua/did_some_digging_did_you_know_the_theories_gme/i851gzp/
104,i84y5sg,NewBlock,"lol, you're in for a rude awakening","lol, you're in for a rude awakening",15,2022-05-11 02:57:13,<praw.models.comment_forest.CommentForest object at 0x000001BA5D218340>,umyjua,wallstreetbets,t5_2th52,,False,False,t3_umyjua,t1_i84v7u2,/r/wallstreetbets/comments/umyjua/did_some_digging_did_you_know_the_theories_gme/i84y5sg/
105,i85ttk5,Hebnaamnodig,no they are trolling.,no they are trolling.,7,2022-05-11 08:52:32,<praw.models.comment_forest.CommentForest object at 0x000001BA5D218850>,umyjua,wallstreetbets,t5_2th52,,False,False,t3_umyjua,t1_i85mgtd,/r/wallstreetbets/comments/umyjua/did_some_digging_did_you_know_the_theories_gme/i85ttk5/
106,i87ssjq,Hedonisticbiped,"Honest question here. Who TF dedicates their entire reddit time to bashing a stock? More importantly and why?

*BeCaUSE I DuNT wAnT PEeple 2 GeT ScAmED*

Ok, so why aren't you protesting indian scammers, the IRS, carnival games, credit cards, predatory loaning companies, and the government, etc?","Honest question here. Who TF dedicates their entire reddit time to bashing a stock? More importantly and why?

*BeCaUSE I DuNT wAnT PEeple 2 GeT ScAmED*

Ok, so why aren't you protesting indian scammers, the IRS, carnival games, credit cards, predatory loaning companies, and the government, etc?",0,2022-05-11 18:24:51,<praw.models.comment_forest.CommentForest object at 0x000001BA5D2181C0>,umyjua,wallstreetbets,t5_2th52,,False,False,t3_umyjua,t1_i866k5i,/r/wallstreetbets/comments/umyjua/did_some_digging_did_you_know_the_theories_gme/i87ssjq/
107,i85gmqc,DixieNormous76,"Because they didn't have enough collateral to cover the margin requirements imposed in them by the dtcc. Every trade increased these requirements so they stopped people buying. This has been well documented...

You agreed to the Ts and Cs of these trading platforms. They have the right to restrict trading whenever they want.

https://www.google.com/amp/s/fortune.com/2021/02/02/robinhood-gamestop-restricted-trading-meme-stocks-gme-amc-vlad-tenev-nscc/amp/","Because they didn't have enough collateral to cover the margin requirements imposed in them by the dtcc. Every trade increased these requirements so they stopped people buying. This has been well documented...

You agreed to the Ts and Cs of these trading platforms. They have the right to restrict trading whenever they want.

https://www.google.com/amp/s/fortune.com/2021/02/02/robinhood-gamestop-restricted-trading-meme-stocks-gme-amc-vlad-tenev-nscc/amp/",12,2022-05-11 05:54:13,<praw.models.comment_forest.CommentForest object at 0x000001BA5D21A250>,umyjua,wallstreetbets,t5_2th52,,1652249589.0,True,t3_umyjua,t1_i8545q9,/r/wallstreetbets/comments/umyjua/did_some_digging_did_you_know_the_theories_gme/i85gmqc/
108,i864tkx,teteban79,"No, they were (are?) incompetent in the sense that they were (are?) underfunded for the scale of their operation, and any tail event would have left them lacking collateral","No, they were (are?) incompetent in the sense that they were (are?) underfunded for the scale of their operation, and any tail event would have left them lacking collateral",10,2022-05-11 11:16:29,<praw.models.comment_forest.CommentForest object at 0x000001BA5D21A550>,umyjua,wallstreetbets,t5_2th52,,False,False,t3_umyjua,t1_i852usi,/r/wallstreetbets/comments/umyjua/did_some_digging_did_you_know_the_theories_gme/i864tkx/
109,i84x86r,AutoModerator,"Squeeze these nuts you fuckin nerd.

*I am a bot, and this action was performed automatically. Please [contact the moderators of this subreddit](/message/compose/?to=/r/wallstreetbets) if you have any questions or concerns.*","Squeeze these nuts you fuckin nerd.

*I am a bot, and this action was performed automatically. Please [contact the moderators of this subreddit](/message/compose/?to=/r/wallstreetbets) if you have any questions or concerns.*",14,2022-05-11 02:49:54,<praw.models.comment_forest.CommentForest object at 0x000001BA5D212BB0>,umyjua,wallstreetbets,t5_2th52,moderator,False,False,t3_umyjua,t1_i84wvhj,/r/wallstreetbets/comments/umyjua/did_some_digging_did_you_know_the_theories_gme/i84x86r/
110,i84x3ih,DixieNormous76,Please look up what happened with CMKM. The directors issued billions of shares illegally into the market and then blamed naked shorting for the crazy volumes.,Please look up what happened with CMKM. The directors issued billions of shares illegally into the market and then blamed naked shorting for the crazy volumes.,14,2022-05-11 02:48:56,<praw.models.comment_forest.CommentForest object at 0x000001BA5D212D90>,umyjua,wallstreetbets,t5_2th52,,False,True,t3_umyjua,t1_i84wvhj,/r/wallstreetbets/comments/umyjua/did_some_digging_did_you_know_the_theories_gme/i84x3ih/
111,i85v9y7,DixieNormous76,"Right, so someone writes a 10k word post on SS which makes baseless accusations using misinterpreted data and they are literally a God amongst mortals. But I write some DD to show how people have been falling for the same conspiracy for decades and I'm a troll. Got it, thanks ape!","Right, so someone writes a 10k word post on SS which makes baseless accusations using misinterpreted data and they are literally a God amongst mortals. But I write some DD to show how people have been falling for the same conspiracy for decades and I'm a troll. Got it, thanks ape!",12,2022-05-11 09:13:25,<praw.models.comment_forest.CommentForest object at 0x000001BA5D212FA0>,umyjua,wallstreetbets,t5_2th52,,False,True,t3_umyjua,t1_i85ty5p,/r/wallstreetbets/comments/umyjua/did_some_digging_did_you_know_the_theories_gme/i85v9y7/
112,i8747f8,pqisp0,"I find it hard to follow your logic. YTD per end of April GME is down 16%, AMC is down 44% and citadel is up 12%.","I find it hard to follow your logic. YTD per end of April GME is down 16%, AMC is down 44% and citadel is up 12%.",9,2022-05-11 15:45:36,<praw.models.comment_forest.CommentForest object at 0x000001BA5D2122B0>,umyjua,wallstreetbets,t5_2th52,,False,False,t3_umyjua,t1_i86u0so,/r/wallstreetbets/comments/umyjua/did_some_digging_did_you_know_the_theories_gme/i8747f8/
113,i84ue6s,ManicmondayNFB,I know you’re trying to be the “well actually” guy but you’re just reinforcing my point,I know you’re trying to be the “well actually” guy but you’re just reinforcing my point,-3,2022-05-11 02:27:53,<praw.models.comment_forest.CommentForest object at 0x000001BA5D2124F0>,umyjua,wallstreetbets,t5_2th52,,False,False,t3_umyjua,t1_i84tqp0,/r/wallstreetbets/comments/umyjua/did_some_digging_did_you_know_the_theories_gme/i84ue6s/
114,i84yno6,QSX_The_White__,remember that time the SEC released that report that said clear as day there was no evidence of  naked short selling or whatever else the fuck you retarded apes have been spewing,remember that time the SEC released that report that said clear as day there was no evidence of  naked short selling or whatever else the fuck you retarded apes have been spewing,2,2022-05-11 03:01:13,<praw.models.comment_forest.CommentForest object at 0x000001BA5D200430>,umyjua,wallstreetbets,t5_2th52,,1652238357.0,False,t3_umyjua,t1_i84xin0,/r/wallstreetbets/comments/umyjua/did_some_digging_did_you_know_the_theories_gme/i84yno6/
115,i88blyh,DixieNormous76,https://www.google.com/amp/s/fortune.com/2021/02/02/robinhood-gamestop-restricted-trading-meme-stocks-gme-amc-vlad-tenev-nscc/amp/,https://www.google.com/amp/s/fortune.com/2021/02/02/robinhood-gamestop-restricted-trading-meme-stocks-gme-amc-vlad-tenev-nscc/amp/,3,2022-05-11 20:27:48,<praw.models.comment_forest.CommentForest object at 0x000001BA5D200820>,umyjua,wallstreetbets,t5_2th52,,False,True,t3_umyjua,t1_i87ti3f,/r/wallstreetbets/comments/umyjua/did_some_digging_did_you_know_the_theories_gme/i88blyh/
116,i85af60,,[deleted],[deleted],3,2022-05-11 04:46:07,<praw.models.comment_forest.CommentForest object at 0x000001BA5D2188B0>,umyjua,wallstreetbets,t5_2th52,,False,False,t3_umyjua,t1_i859cif,/r/wallstreetbets/comments/umyjua/did_some_digging_did_you_know_the_theories_gme/i85af60/
117,i88cgol,DixieNormous76,"Honest question here. Who TF dedicates their entire reddit time to shilling for GME? More importantly and why?

BeCaUSE I  wAnT PEeple 2 GeT inTERgenRaTIOnal WEalTh

Ok, so why aren't you promoting indian scammers, the IRS, carnival games, credit cards, predatory loaning companies, and the government, etc?","Honest question here. Who TF dedicates their entire reddit time to shilling for GME? More importantly and why?

BeCaUSE I  wAnT PEeple 2 GeT inTERgenRaTIOnal WEalTh

Ok, so why aren't you promoting indian scammers, the IRS, carnival games, credit cards, predatory loaning companies, and the government, etc?",11,2022-05-11 20:33:26,<praw.models.comment_forest.CommentForest object at 0x000001BA5D218280>,umyjua,wallstreetbets,t5_2th52,,False,True,t3_umyjua,t1_i87ssjq,/r/wallstreetbets/comments/umyjua/did_some_digging_did_you_know_the_theories_gme/i88cgol/
118,i88fm6g,WreckNRepeat,"The main reason is that you guys are so damn hilarious. Carnivals and predatory lending companies know that they're scamming people, but you guys genuinely believe that billionaires across the globe are monitoring your subs and paying interns to engage in ""PsyOp"" attacks on anyone holding GME. You have to understand how hilarious that is to anyone who didn't eat paint chips as a baby.

Moreover, since most scammers don't have any conviction in what they're selling, you can't really say, ""I told you so"" to them. Sure, I might be able to say ""I told you so"" to the victims of these scams, but who would want to do that? With GME apes, I can say I told you so to the idiots who are literally shilling for a billion dollar corporation. And you can't imagine how satisfying it is to rub your arrogant faces in it when your bold predictions, as always, fail miserably.

Finally, GME is far more popular on Reddit than any of these other scams. I can go on all day about how payday loans are a trap, but most people on Reddit already know that. And there certainly aren't swathes of people shilling for payday loans on Reddit. But Reddit? Y'all are everywhere, and you genuinely are hurting countless vulnerable people. And if you never got any push-back, you'd be hurting even more people.

So there are plenty of reasons to go after GME apes rather than trying to find a way to go after other scammers.","The main reason is that you guys are so damn hilarious. Carnivals and predatory lending companies know that they're scamming people, but you guys genuinely believe that billionaires across the globe are monitoring your subs and paying interns to engage in ""PsyOp"" attacks on anyone holding GME. You have to understand how hilarious that is to anyone who didn't eat paint chips as a baby.

Moreover, since most scammers don't have any conviction in what they're selling, you can't really say, ""I told you so"" to them. Sure, I might be able to say ""I told you so"" to the victims of these scams, but who would want to do that? With GME apes, I can say I told you so to the idiots who are literally shilling for a billion dollar corporation. And you can't imagine how satisfying it is to rub your arrogant faces in it when your bold predictions, as always, fail miserably.

Finally, GME is far more popular on Reddit than any of these other scams. I can go on all day about how payday loans are a trap, but most people on Reddit already know that. And there certainly aren't swathes of people shilling for payday loans on Reddit. But Reddit? Y'all are everywhere, and you genuinely are hurting countless vulnerable people. And if you never got any push-back, you'd be hurting even more people.

So there are plenty of reasons to go after GME apes rather than trying to find a way to go after other scammers.",10,2022-05-11 20:54:17,<praw.models.comment_forest.CommentForest object at 0x000001BA5D218130>,umyjua,wallstreetbets,t5_2th52,,False,False,t3_umyjua,t1_i87ssjq,/r/wallstreetbets/comments/umyjua/did_some_digging_did_you_know_the_theories_gme/i88fm6g/
119,i890av7,parlaymyodds,"Because it’s hilarious, shill","Because it’s hilarious, shill",1,2022-05-11 23:21:34,<praw.models.comment_forest.CommentForest object at 0x000001BA5D21AF70>,umyjua,wallstreetbets,t5_2th52,,False,False,t3_umyjua,t1_i87ssjq,/r/wallstreetbets/comments/umyjua/did_some_digging_did_you_know_the_theories_gme/i890av7/
120,i85yzg6,pqisp0,I admire your patience. Truly.,I admire your patience. Truly.,7,2022-05-11 10:05:58,<praw.models.comment_forest.CommentForest object at 0x000001BA5D21AB50>,umyjua,wallstreetbets,t5_2th52,,False,False,t3_umyjua,t1_i85gmqc,/r/wallstreetbets/comments/umyjua/did_some_digging_did_you_know_the_theories_gme/i85yzg6/
121,i85suq9,,[deleted],[deleted],0,2022-05-11 08:38:35,<praw.models.comment_forest.CommentForest object at 0x000001BA5D21A460>,umyjua,wallstreetbets,t5_2th52,,False,False,t3_umyjua,t1_i85gmqc,/r/wallstreetbets/comments/umyjua/did_some_digging_did_you_know_the_theories_gme/i85suq9/
122,i84xftx,Pestelence2020,*squeezes*,*squeezes*,0,2022-05-11 02:51:32,<praw.models.comment_forest.CommentForest object at 0x000001BA5D212E20>,umyjua,wallstreetbets,t5_2th52,,False,False,t3_umyjua,t1_i84x86r,/r/wallstreetbets/comments/umyjua/did_some_digging_did_you_know_the_theories_gme/i84xftx/
123,i84xht0,Pestelence2020,I am not going to waste my time on your cherry picked crap.,I am not going to waste my time on your cherry picked crap.,-3,2022-05-11 02:51:58,<praw.models.comment_forest.CommentForest object at 0x000001BA5D212BE0>,umyjua,wallstreetbets,t5_2th52,,False,False,t3_umyjua,t1_i84x3ih,/r/wallstreetbets/comments/umyjua/did_some_digging_did_you_know_the_theories_gme/i84xht0/
124,i8768j6,IBMformatted,"Citedal has never claimed holding a position on GME or AmC, Melvin did. Since you bring up Citedal, I've always thought dude was brilliant as much as he is arrogant, bed post aside. If Melvin closed why is Plotkin trying to start over? I never understood the cash infusion from Citedal and point72, idk of anyone being altruistic in the billions.","Citedal has never claimed holding a position on GME or AmC, Melvin did. Since you bring up Citedal, I've always thought dude was brilliant as much as he is arrogant, bed post aside. If Melvin closed why is Plotkin trying to start over? I never understood the cash infusion from Citedal and point72, idk of anyone being altruistic in the billions.",1,2022-05-11 15:58:45,<praw.models.comment_forest.CommentForest object at 0x000001BA5D212580>,umyjua,wallstreetbets,t5_2th52,,False,False,t3_umyjua,t1_i8747f8,/r/wallstreetbets/comments/umyjua/did_some_digging_did_you_know_the_theories_gme/i8768j6/
125,i84uq0v,gregfromsolutions,"I’m not though, I’m trying to figure out what you’re referring to lol

What conspiracy theorists were jailed and killed for thinking the earth is round??","I’m not though, I’m trying to figure out what you’re referring to lol

What conspiracy theorists were jailed and killed for thinking the earth is round??",3,2022-05-11 02:30:26,<praw.models.comment_forest.CommentForest object at 0x000001BA5D212130>,umyjua,wallstreetbets,t5_2th52,,False,False,t3_umyjua,t1_i84ue6s,/r/wallstreetbets/comments/umyjua/did_some_digging_did_you_know_the_theories_gme/i84uq0v/
126,i850on2,Woodythebartender,"It was a SEC staff report, and this is the conclusion on short selling

“. Short selling and market dynamics. While short selling and calls on social media for short squeezes received a great deal of media attention, the interplay between shorting and price dynamics is more complex than these narratives would suggest. Improved reporting of short sales would allow regulators to better track these dynamics.”

Did you read the report? Clear as mud.","It was a SEC staff report, and this is the conclusion on short selling

“. Short selling and market dynamics. While short selling and calls on social media for short squeezes received a great deal of media attention, the interplay between shorting and price dynamics is more complex than these narratives would suggest. Improved reporting of short sales would allow regulators to better track these dynamics.”

Did you read the report? Clear as mud.",4,2022-05-11 03:18:07,<praw.models.comment_forest.CommentForest object at 0x000001BA5D200A90>,umyjua,wallstreetbets,t5_2th52,,False,False,t3_umyjua,t1_i84yno6,/r/wallstreetbets/comments/umyjua/did_some_digging_did_you_know_the_theories_gme/i850on2/
127,i85bwnx,IBMformatted,Same reason why you read a newspaper.,Same reason why you read a newspaper.,0,2022-05-11 05:01:27,<praw.models.comment_forest.CommentForest object at 0x000001BA5D218E80>,umyjua,wallstreetbets,t5_2th52,,False,False,t3_umyjua,t1_i85af60,/r/wallstreetbets/comments/umyjua/did_some_digging_did_you_know_the_theories_gme/i85bwnx/
128,i88g8gy,Hedonisticbiped,"So, no answer. 👍 good job. Cood copy pasta.","So, no answer. 👍 good job. Cood copy pasta.",-1,2022-05-11 20:58:23,<praw.models.comment_forest.CommentForest object at 0x000001BA5D21AAC0>,umyjua,wallstreetbets,t5_2th52,,False,False,t3_umyjua,t1_i88cgol,/r/wallstreetbets/comments/umyjua/did_some_digging_did_you_know_the_theories_gme/i88g8gy/
129,i88hdxg,Hedonisticbiped,"Aren't you the retard trying shilling for meltdown sub?

All ypur pushback has been met with downvotes, seems like no one wants your *help*

Furthermore your disguise of *morality* trying to help people to support a manipulated market is gross. You're gross. You should be ashamed.","Aren't you the retard trying shilling for meltdown sub?

All ypur pushback has been met with downvotes, seems like no one wants your *help*

Furthermore your disguise of *morality* trying to help people to support a manipulated market is gross. You're gross. You should be ashamed.",2,2022-05-11 21:05:56,<praw.models.comment_forest.CommentForest object at 0x000001BA5D21AA90>,umyjua,wallstreetbets,t5_2th52,,1652303498.0,False,t3_umyjua,t1_i88fm6g,/r/wallstreetbets/comments/umyjua/did_some_digging_did_you_know_the_theories_gme/i88hdxg/
130,i85zqjd,DixieNormous76,Not sure why that bloke blocked me. Thought we were just having a normal convo 😂,Not sure why that bloke blocked me. Thought we were just having a normal convo 😂,8,2022-05-11 10:16:02,<praw.models.comment_forest.CommentForest object at 0x000001BA5D21A820>,umyjua,wallstreetbets,t5_2th52,,False,True,t3_umyjua,t1_i85yzg6,/r/wallstreetbets/comments/umyjua/did_some_digging_did_you_know_the_theories_gme/i85zqjd/
131,i85sycx,DixieNormous76,"Yeah that's right, because people would have been even more pissed off of they couldn't sell their bags. Turning off buying iis waayyyyy better than turning off selling. It's in an interview with Vlad somewhere btw. He explains exactly why they only restricted buying. Please remember this was a black Swan, there was no rule book for this. Not saying it was the right move btw!! 

Then people shouldn't have agreed to them, sorry. Oh and I guess I'll also apologies for using the colloquial term for terms and conditions that literally everyone know.","Yeah that's right, because people would have been even more pissed off of they couldn't sell their bags. Turning off buying iis waayyyyy better than turning off selling. It's in an interview with Vlad somewhere btw. He explains exactly why they only restricted buying. Please remember this was a black Swan, there was no rule book for this. Not saying it was the right move btw!! 

Then people shouldn't have agreed to them, sorry. Oh and I guess I'll also apologies for using the colloquial term for terms and conditions that literally everyone know.",7,2022-05-11 08:40:01,<praw.models.comment_forest.CommentForest object at 0x000001BA5D21A7F0>,umyjua,wallstreetbets,t5_2th52,,1652259047.0,True,t3_umyjua,t1_i85suq9,/r/wallstreetbets/comments/umyjua/did_some_digging_did_you_know_the_theories_gme/i85sycx/
132,i850s9j,DixieNormous76,Gotta say short squeeze my man,Gotta say short squeeze my man,4,2022-05-11 03:18:58,<praw.models.comment_forest.CommentForest object at 0x000001BA5D212AF0>,umyjua,wallstreetbets,t5_2th52,,False,True,t3_umyjua,t1_i84xftx,/r/wallstreetbets/comments/umyjua/did_some_digging_did_you_know_the_theories_gme/i850s9j/
133,i84xvvn,DixieNormous76,Not cherry picking. Just pointing out how others have fallen for conspiracies before.,Not cherry picking. Just pointing out how others have fallen for conspiracies before.,15,2022-05-11 02:54:59,<praw.models.comment_forest.CommentForest object at 0x000001BA5D2127F0>,umyjua,wallstreetbets,t5_2th52,,False,True,t3_umyjua,t1_i84xht0,/r/wallstreetbets/comments/umyjua/did_some_digging_did_you_know_the_theories_gme/i84xvvn/
134,i84uu3b,ManicmondayNFB,"Some fuxking Italian probably 

You get what I mean","Some fuxking Italian probably 

You get what I mean",0,2022-05-11 02:31:19,<praw.models.comment_forest.CommentForest object at 0x000001BA5D2120D0>,umyjua,wallstreetbets,t5_2th52,,False,False,t3_umyjua,t1_i84uq0v,/r/wallstreetbets/comments/umyjua/did_some_digging_did_you_know_the_theories_gme/i84uu3b/
135,ia2s6u7,syntheticsponge,Narrator: They had not read the report,Narrator: They had not read the report,2,2022-05-26 15:38:30,<praw.models.comment_forest.CommentForest object at 0x000001BA5D200AF0>,umyjua,wallstreetbets,t5_2th52,,False,False,t3_umyjua,t1_i850on2,/r/wallstreetbets/comments/umyjua/did_some_digging_did_you_know_the_theories_gme/ia2s6u7/
136,i850onq,AutoModerator,"Squeeze these nuts you fuckin nerd.

*I am a bot, and this action was performed automatically. Please [contact the moderators of this subreddit](/message/compose/?to=/r/wallstreetbets) if you have any questions or concerns.*","Squeeze these nuts you fuckin nerd.

*I am a bot, and this action was performed automatically. Please [contact the moderators of this subreddit](/message/compose/?to=/r/wallstreetbets) if you have any questions or concerns.*",0,2022-05-11 03:18:08,<praw.models.comment_forest.CommentForest object at 0x000001BA5D2001F0>,umyjua,wallstreetbets,t5_2th52,moderator,False,False,t3_umyjua,t1_i850on2,/r/wallstreetbets/comments/umyjua/did_some_digging_did_you_know_the_theories_gme/i850onq/
