,ID,Author,body,Comment,Score,Created On,Replies,Submission,Subreddit,Subreddit_ID,Distinguished,Edited,Is_submitter,link_id,Parent_id,Permalink
0,i84pe2d,VisualMod,"
**User Report**| | | |
:--|:--|:--|:--
**Total Submissions**|4|**First Seen In WSB**|1 month ago
**Total Comments**|8|**Previous DD**|[x](https://www.reddit.com/gallery/umydgn) [x](https://www.reddit.com/r/wallstreetbets/comments/umyjua/did_some_digging_did_you_know_the_theories_gme/) 
**Account Age**|7 months|[^scan ^comment ](https://www.reddit.com/message/compose/?to=VisualMod&subject=scan_comment&message=Replace%20this%20text%20with%20a%20comment%20ID%20(which%20looks%20like%20h26cq3k\)%20to%20have%20the%20bot%20scan%20your%20comment%20and%20correct%20your%20first%20seen%20date.)|[^scan ^submission ](https://www.reddit.com/message/compose/?to=VisualMod&subject=scan_submission&message=Replace%20this%20text%20with%20a%20submission%20ID%20(which%20looks%20like%20h26cq3k\)%20to%20have%20the%20bot%20scan%20your%20submission%20and%20correct%20your%20first%20seen%20date.)
**Vote Spam (NEW)**|[Click to Vote](https://www.reddit.com/message/compose/?to=VisualMod&subject=vote_spam&message=umyjua)|**Vote Approve (NEW)**|[Click to Vote](https://www.reddit.com/message/compose/?to=VisualMod&subject=vote_approve&message=umyjua)
    
Hey /u/DixieNormous76, **positions or ban.** Reply to this with a screenshot of your entry/exit.","
**User Report**| | | |
:--|:--|:--|:--
**Total Submissions**|4|**First Seen In WSB**|1 month ago
**Total Comments**|8|**Previous DD**|[x](https://www.reddit.com/gallery/umydgn) [x](https://www.reddit.com/r/wallstreetbets/comments/umyjua/did_some_digging_did_you_know_the_theories_gme/) 
**Account Age**|7 months|[^scan ^comment ](https://www.reddit.com/message/compose/?to=VisualMod&subject=scan_comment&message=Replace%20this%20text%20with%20a%20comment%20ID%20(which%20looks%20like%20h26cq3k\)%20to%20have%20the%20bot%20scan%20your%20comment%20and%20correct%20your%20first%20seen%20date.)|[^scan ^submission ](https://www.reddit.com/message/compose/?to=VisualMod&subject=scan_submission&message=Replace%20this%20text%20with%20a%20submission%20ID%20(which%20looks%20like%20h26cq3k\)%20to%20have%20the%20bot%20scan%20your%20submission%20and%20correct%20your%20first%20seen%20date.)
**Vote Spam (NEW)**|[Click to Vote](https://www.reddit.com/message/compose/?to=VisualMod&subject=vote_spam&message=umyjua)|**Vote Approve (NEW)**|[Click to Vote](https://www.reddit.com/message/compose/?to=VisualMod&subject=vote_approve&message=umyjua)
    
Hey /u/DixieNormous76, **positions or ban.** Reply to this with a screenshot of your entry/exit.",1,2022-05-11 01:49:51,<praw.models.comment_forest.CommentForest object at 0x000001BA5D218DF0>,umyjua,wallstreetbets,t5_2th52,moderator,False,False,t3_umyjua,t3_umyjua,/r/wallstreetbets/comments/umyjua/did_some_digging_did_you_know_the_theories_gme/i84pe2d/
1,i85lpf7,revenreven333,That guy must be rich if he held,That guy must be rich if he held,9,2022-05-11 06:57:09,<praw.models.comment_forest.CommentForest object at 0x000001BA5D218BE0>,umyjua,wallstreetbets,t5_2th52,,False,False,t3_umyjua,t3_umyjua,/r/wallstreetbets/comments/umyjua/did_some_digging_did_you_know_the_theories_gme/i85lpf7/
2,i84t9om,,[deleted],[deleted],40,2022-05-11 02:19:25,<praw.models.comment_forest.CommentForest object at 0x000001BA5D218A90>,umyjua,wallstreetbets,t5_2th52,,False,False,t3_umyjua,t3_umyjua,/r/wallstreetbets/comments/umyjua/did_some_digging_did_you_know_the_theories_gme/i84t9om/
3,i85ou7a,AttentionBig4233,This entire thread is just the king of the hill “those kids would be really mad if they could read” meme,This entire thread is just the king of the hill “those kids would be really mad if they could read” meme,10,2022-05-11 07:39:58,<praw.models.comment_forest.CommentForest object at 0x000001BA5D218D90>,umyjua,wallstreetbets,t5_2th52,,False,False,t3_umyjua,t3_umyjua,/r/wallstreetbets/comments/umyjua/did_some_digging_did_you_know_the_theories_gme/i85ou7a/
4,i84t8c6,LikeWhite0nRice,Been seeing a lot of posts against meme stocks lately. Makes me want to load up on even more.,Been seeing a lot of posts against meme stocks lately. Makes me want to load up on even more.,59,2022-05-11 02:19:08,<praw.models.comment_forest.CommentForest object at 0x000001BA5D218FD0>,umyjua,wallstreetbets,t5_2th52,,False,False,t3_umyjua,t3_umyjua,/r/wallstreetbets/comments/umyjua/did_some_digging_did_you_know_the_theories_gme/i84t8c6/
5,i85mmxv,Badgerv12,"Whoa, the sentiment against gme is picking up again, ive been here before, boys we going up again soon","Whoa, the sentiment against gme is picking up again, ive been here before, boys we going up again soon",15,2022-05-11 07:09:29,<praw.models.comment_forest.CommentForest object at 0x000001BA5D218C10>,umyjua,wallstreetbets,t5_2th52,,False,False,t3_umyjua,t3_umyjua,/r/wallstreetbets/comments/umyjua/did_some_digging_did_you_know_the_theories_gme/i85mmxv/
6,i84psag,dirka_lurka_dirka_st,Didn’t realize decades ago they removed the buy button from a digital application. That’s wild. And wild they were mad about it then.,Didn’t realize decades ago they removed the buy button from a digital application. That’s wild. And wild they were mad about it then.,32,2022-05-11 01:52:53,<praw.models.comment_forest.CommentForest object at 0x000001BA5D218580>,umyjua,wallstreetbets,t5_2th52,,False,False,t3_umyjua,t3_umyjua,/r/wallstreetbets/comments/umyjua/did_some_digging_did_you_know_the_theories_gme/i84psag/
7,i851ix7,QuarterDoge,"I was part of the Piggly Wiggly Short Squeeze of 1918.    The largest Short Squeeze in world history.   We had them naked shorters by the short and curlies alright.   About to initiate the grandest squeeze in history.    And Uncle Sam stepped in and delisted the company,  the stocks become worthless paper,   The Naked Shorters cut their checks to the politicians.","I was part of the Piggly Wiggly Short Squeeze of 1918.    The largest Short Squeeze in world history.   We had them naked shorters by the short and curlies alright.   About to initiate the grandest squeeze in history.    And Uncle Sam stepped in and delisted the company,  the stocks become worthless paper,   The Naked Shorters cut their checks to the politicians.",8,2022-05-11 03:25:11,<praw.models.comment_forest.CommentForest object at 0x000001BA5D21AF40>,umyjua,wallstreetbets,t5_2th52,,False,False,t3_umyjua,t3_umyjua,/r/wallstreetbets/comments/umyjua/did_some_digging_did_you_know_the_theories_gme/i851ix7/
8,i84qqdz,appmapper,"Their whole theory is predicated on some counterparty that is okay with not getting paid. If their positions are still open, who is the counterparty that is remaining silent? If the positions were still open it would be reflected in the payments made between the two parties. We are not seeing that. If the counterparty was owed payments, and wasn't receiving those payments, they would make it known.","Their whole theory is predicated on some counterparty that is okay with not getting paid. If their positions are still open, who is the counterparty that is remaining silent? If the positions were still open it would be reflected in the payments made between the two parties. We are not seeing that. If the counterparty was owed payments, and wasn't receiving those payments, they would make it known.",14,2022-05-11 02:00:04,<praw.models.comment_forest.CommentForest object at 0x000001BA5D21A850>,umyjua,wallstreetbets,t5_2th52,,False,False,t3_umyjua,t3_umyjua,/r/wallstreetbets/comments/umyjua/did_some_digging_did_you_know_the_theories_gme/i84qqdz/
9,i84v1q8,Pestelence2020,"Interesting all this negative sentiment all of a sudden that magically coincides with a massive short selling push.

This whole thread’s premise is “short and distort”

@doj_enforcement","Interesting all this negative sentiment all of a sudden that magically coincides with a massive short selling push.

This whole thread’s premise is “short and distort”

@doj_enforcement",20,2022-05-11 02:32:56,<praw.models.comment_forest.CommentForest object at 0x000001BA5D21A040>,umyjua,wallstreetbets,t5_2th52,,False,False,t3_umyjua,t3_umyjua,/r/wallstreetbets/comments/umyjua/did_some_digging_did_you_know_the_theories_gme/i84v1q8/
10,i84rk3q,MortalDanger00,"Yet another comparison to Flat Earthers.  

You just can't fix stupid, it's ingrained in some people's very being.","Yet another comparison to Flat Earthers.  

You just can't fix stupid, it's ingrained in some people's very being.",11,2022-05-11 02:06:21,<praw.models.comment_forest.CommentForest object at 0x000001BA5D212970>,umyjua,wallstreetbets,t5_2th52,,False,False,t3_umyjua,t3_umyjua,/r/wallstreetbets/comments/umyjua/did_some_digging_did_you_know_the_theories_gme/i84rk3q/
11,i9ken8d,tommygunz007,It's as if they only shorted one single stock ever. What a noob. Duh. They have been shorting for ages. Nothing to see here. Move along.,It's as if they only shorted one single stock ever. What a noob. Duh. They have been shorting for ages. Nothing to see here. Move along.,2,2022-05-22 14:27:54,<praw.models.comment_forest.CommentForest object at 0x000001BA5D2126A0>,umyjua,wallstreetbets,t5_2th52,,False,False,t3_umyjua,t3_umyjua,/r/wallstreetbets/comments/umyjua/did_some_digging_did_you_know_the_theories_gme/i9ken8d/
12,i85lojd,Badgerv12,"They disabled the buy button last january right in the middle of the squeeze, thats says alot","They disabled the buy button last january right in the middle of the squeeze, thats says alot",6,2022-05-11 06:56:49,<praw.models.comment_forest.CommentForest object at 0x000001BA5D212610>,umyjua,wallstreetbets,t5_2th52,,False,False,t3_umyjua,t3_umyjua,/r/wallstreetbets/comments/umyjua/did_some_digging_did_you_know_the_theories_gme/i85lojd/
13,i85cn8f,Legitimate-Bird2030,Well the SEC actually admitted last October in the GME report it was shorted a 140%. That is not a conspiracy that is naked shorting of 40% more of outstanding shares. Go ahead and look up Lehman brothers naked shorting. It’s the entire reason reg SHO. Those examples you use are week to make a point regardless if someone else put it in a bullshit DD.,Well the SEC actually admitted last October in the GME report it was shorted a 140%. That is not a conspiracy that is naked shorting of 40% more of outstanding shares. Go ahead and look up Lehman brothers naked shorting. It’s the entire reason reg SHO. Those examples you use are week to make a point regardless if someone else put it in a bullshit DD.,8,2022-05-11 05:09:17,<praw.models.comment_forest.CommentForest object at 0x000001BA5D212760>,umyjua,wallstreetbets,t5_2th52,,False,False,t3_umyjua,t3_umyjua,/r/wallstreetbets/comments/umyjua/did_some_digging_did_you_know_the_theories_gme/i85cn8f/
14,i84umk4,Woodythebartender,Why does anyone care how other people invest their money? Never seen so many good samaritans looking out for the little guy. Warms my cockles.,Why does anyone care how other people invest their money? Never seen so many good samaritans looking out for the little guy. Warms my cockles.,12,2022-05-11 02:29:41,<praw.models.comment_forest.CommentForest object at 0x000001BA5D2000D0>,umyjua,wallstreetbets,t5_2th52,,False,False,t3_umyjua,t3_umyjua,/r/wallstreetbets/comments/umyjua/did_some_digging_did_you_know_the_theories_gme/i84umk4/
15,i85hehi,Silver-Channel-5476,"I am a good for nuthin Wendy’s dumpster diving degenerate just like the rest of ya!!
How come when I tap the wallstreetsbets link I get sent to shit from a year ago?","I am a good for nuthin Wendy’s dumpster diving degenerate just like the rest of ya!!
How come when I tap the wallstreetsbets link I get sent to shit from a year ago?",2,2022-05-11 06:03:20,<praw.models.comment_forest.CommentForest object at 0x000001BA5D200C40>,umyjua,wallstreetbets,t5_2th52,,False,False,t3_umyjua,t3_umyjua,/r/wallstreetbets/comments/umyjua/did_some_digging_did_you_know_the_theories_gme/i85hehi/
16,i851dz2,Habooboo5,"I don’t get your point. No one was saying GME was the first and only instance of fuckery in the market, and anyone that’s been following the market over the past 2 decades has been aware of real and perceived instances where short sellers fucked with stock prices","I don’t get your point. No one was saying GME was the first and only instance of fuckery in the market, and anyone that’s been following the market over the past 2 decades has been aware of real and perceived instances where short sellers fucked with stock prices",2,2022-05-11 03:24:03,<praw.models.comment_forest.CommentForest object at 0x000001BA5D200E80>,umyjua,wallstreetbets,t5_2th52,,False,False,t3_umyjua,t3_umyjua,/r/wallstreetbets/comments/umyjua/did_some_digging_did_you_know_the_theories_gme/i851dz2/
17,i84vwft,,[deleted],[deleted],4,2022-05-11 02:39:39,<praw.models.comment_forest.CommentForest object at 0x000001BA5D2005B0>,umyjua,wallstreetbets,t5_2th52,,False,False,t3_umyjua,t3_umyjua,/r/wallstreetbets/comments/umyjua/did_some_digging_did_you_know_the_theories_gme/i84vwft/
18,i85f1sr,Electrical-Amoeba245,Do you really believe that cmkm shareholders were as stubbornly autistic as gme hodlers? 🚀🚀🚀🚀🦍🦍🦍,Do you really believe that cmkm shareholders were as stubbornly autistic as gme hodlers? 🚀🚀🚀🚀🦍🦍🦍,4,2022-05-11 05:35:47,<praw.models.comment_forest.CommentForest object at 0x000001BA5D200700>,umyjua,wallstreetbets,t5_2th52,,False,False,t3_umyjua,t3_umyjua,/r/wallstreetbets/comments/umyjua/did_some_digging_did_you_know_the_theories_gme/i85f1sr/
19,i85tjxd,Hebnaamnodig,"Seeing how active you are on the Meltdown sub, why not just stick there?","Seeing how active you are on the Meltdown sub, why not just stick there?",3,2022-05-11 08:48:38,<praw.models.comment_forest.CommentForest object at 0x000001BA5D2003D0>,umyjua,wallstreetbets,t5_2th52,,False,False,t3_umyjua,t3_umyjua,/r/wallstreetbets/comments/umyjua/did_some_digging_did_you_know_the_theories_gme/i85tjxd/
20,i84xvtj,LaserShields,It’s not a theory make short selling is obviously happening.,It’s not a theory make short selling is obviously happening.,1,2022-05-11 02:54:59,<praw.models.comment_forest.CommentForest object at 0x000001BA5D2004C0>,umyjua,wallstreetbets,t5_2th52,,False,False,t3_umyjua,t3_umyjua,/r/wallstreetbets/comments/umyjua/did_some_digging_did_you_know_the_theories_gme/i84xvtj/
21,i852bp3,Baked_potato___,Guess we’ll find out soon Jim,Guess we’ll find out soon Jim,2,2022-05-11 03:32:01,<praw.models.comment_forest.CommentForest object at 0x000001BA5D200310>,umyjua,wallstreetbets,t5_2th52,,False,False,t3_umyjua,t3_umyjua,/r/wallstreetbets/comments/umyjua/did_some_digging_did_you_know_the_theories_gme/i852bp3/
22,i84v8fd,Puritopian,conspiracies like [this](https://www.rollingstone.com/politics/politics-news/accidentally-released-and-incredibly-embarrassing-documents-show-how-goldman-et-al-engaged-in-naked-short-selling-244035/) ?,conspiracies like [this](https://www.rollingstone.com/politics/politics-news/accidentally-released-and-incredibly-embarrassing-documents-show-how-goldman-et-al-engaged-in-naked-short-selling-244035/) ?,1,2022-05-11 02:34:23,<praw.models.comment_forest.CommentForest object at 0x000001BA5D200100>,umyjua,wallstreetbets,t5_2th52,,False,False,t3_umyjua,t3_umyjua,/r/wallstreetbets/comments/umyjua/did_some_digging_did_you_know_the_theories_gme/i84v8fd/
23,i8553ya,Fibocrypto,Markets drop because of a lack of buyers,Markets drop because of a lack of buyers,2,2022-05-11 03:56:01,<praw.models.comment_forest.CommentForest object at 0x000001BA5D200250>,umyjua,wallstreetbets,t5_2th52,,False,False,t3_umyjua,t3_umyjua,/r/wallstreetbets/comments/umyjua/did_some_digging_did_you_know_the_theories_gme/i8553ya/
24,i85cgqb,RelativeEchidna4547,Interesting….This goes deeper than I thought.,Interesting….This goes deeper than I thought.,1,2022-05-11 05:07:19,<praw.models.comment_forest.CommentForest object at 0x000001BA5D200280>,umyjua,wallstreetbets,t5_2th52,,False,False,t3_umyjua,t3_umyjua,/r/wallstreetbets/comments/umyjua/did_some_digging_did_you_know_the_theories_gme/i85cgqb/
25,i85f2ha,Electrical-Amoeba245,!remind me in 60 days!,!remind me in 60 days!,1,2022-05-11 05:36:01,<praw.models.comment_forest.CommentForest object at 0x000001BA62A41E50>,umyjua,wallstreetbets,t5_2th52,,False,False,t3_umyjua,t3_umyjua,/r/wallstreetbets/comments/umyjua/did_some_digging_did_you_know_the_theories_gme/i85f2ha/
26,i89gdq6,AyumiHikaru,"Becasue the problem, illegal naked shorting, has never be solved. lol","Becasue the problem, illegal naked shorting, has never be solved. lol",1,2022-05-12 01:25:11,<praw.models.comment_forest.CommentForest object at 0x000001BA62A41E20>,umyjua,wallstreetbets,t5_2th52,,False,False,t3_umyjua,t3_umyjua,/r/wallstreetbets/comments/umyjua/did_some_digging_did_you_know_the_theories_gme/i89gdq6/
27,i855nua,,🏳️‍🌈🧸🔥🐠,🏳️‍🌈🧸🔥🐠,-1,2022-05-11 04:00:57,<praw.models.comment_forest.CommentForest object at 0x000001BA62A41E80>,umyjua,wallstreetbets,t5_2th52,,False,False,t3_umyjua,t3_umyjua,/r/wallstreetbets/comments/umyjua/did_some_digging_did_you_know_the_theories_gme/i855nua/
28,i855xgn,,https://m.youtube.com/watch?v=q8-JO3g5bm4,https://m.youtube.com/watch?v=q8-JO3g5bm4,0,2022-05-11 04:03:17,<praw.models.comment_forest.CommentForest object at 0x000001BA62A41B20>,umyjua,wallstreetbets,t5_2th52,,False,False,t3_umyjua,t3_umyjua,/r/wallstreetbets/comments/umyjua/did_some_digging_did_you_know_the_theories_gme/i855xgn/
29,i9jaepz,tommygunz007,"The price action is mostly driven by ETF's and that's where it becomes sketchy that you can hypothetically create more short shares than actual real shares. 

Nothing is illegal til the SEC says it is.","The price action is mostly driven by ETF's and that's where it becomes sketchy that you can hypothetically create more short shares than actual real shares. 

Nothing is illegal til the SEC says it is.",0,2022-05-22 06:10:16,<praw.models.comment_forest.CommentForest object at 0x000001BA62A41D00>,umyjua,wallstreetbets,t5_2th52,,False,False,t3_umyjua,t3_umyjua,/r/wallstreetbets/comments/umyjua/did_some_digging_did_you_know_the_theories_gme/i9jaepz/
30,i85235v,bigmommashouse777,Wow this guy found an article from god know where during the biggest scandal of wallstreet in 2020.  He must be looking for a way out of prison,Wow this guy found an article from god know where during the biggest scandal of wallstreet in 2020.  He must be looking for a way out of prison,-7,2022-05-11 03:29:58,<praw.models.comment_forest.CommentForest object at 0x000001BA62A41C10>,umyjua,wallstreetbets,t5_2th52,,False,False,t3_umyjua,t3_umyjua,/r/wallstreetbets/comments/umyjua/did_some_digging_did_you_know_the_theories_gme/i85235v/
31,i869isk,IcedOutGucciWatch,suck my ass Kenny and pay me already,suck my ass Kenny and pay me already,-1,2022-05-11 12:03:02,<praw.models.comment_forest.CommentForest object at 0x000001BA62A41A60>,umyjua,wallstreetbets,t5_2th52,,False,False,t3_umyjua,t3_umyjua,/r/wallstreetbets/comments/umyjua/did_some_digging_did_you_know_the_theories_gme/i869isk/
32,i88dm81,,Kind of just like this DD pinned with no likes,Kind of just like this DD pinned with no likes,1,2022-05-11 20:41:01,<praw.models.comment_forest.CommentForest object at 0x000001BA62A41B50>,umyjua,wallstreetbets,t5_2th52,,False,False,t3_umyjua,t3_umyjua,/r/wallstreetbets/comments/umyjua/did_some_digging_did_you_know_the_theories_gme/i88dm81/
33,i85b6em,DixieNormous76,I hold no position in GME. This is counter DD because I am extremely interested in the conspiracy that has developed.,I hold no position in GME. This is counter DD because I am extremely interested in the conspiracy that has developed.,0,2022-05-11 04:53:54,<praw.models.comment_forest.CommentForest object at 0x000001BA5D218700>,umyjua,wallstreetbets,t5_2th52,,False,True,t3_umyjua,t1_i84pe2d,/r/wallstreetbets/comments/umyjua/did_some_digging_did_you_know_the_theories_gme/i85b6em/
34,i85b3ce,DixieNormous76,"BTW cmkm was the example used by one of the God tier DD writers to convince apes to DRS their shares. Even though the directors of the company were indicted for fraud, the apes still believed them. 

https://imgur.com/a/h440zUD","BTW cmkm was the example used by one of the God tier DD writers to convince apes to DRS their shares. Even though the directors of the company were indicted for fraud, the apes still believed them. 

https://imgur.com/a/h440zUD",13,2022-05-11 04:53:00,<praw.models.comment_forest.CommentForest object at 0x000001BA5D218D00>,umyjua,wallstreetbets,t5_2th52,,False,True,t3_umyjua,t1_i84t9om,/r/wallstreetbets/comments/umyjua/did_some_digging_did_you_know_the_theories_gme/i85b3ce/
35,i8589ye,IBMformatted,"I don't think they ever claimed naked short selling was new. Part of the due diligence was finding other cases of naked short selling where regulators did NOTHING about it. Idk about you, but I refuse to invest in a market where my position can get attacked thru illegal means and the perpetrator won't be prosecuted.","I don't think they ever claimed naked short selling was new. Part of the due diligence was finding other cases of naked short selling where regulators did NOTHING about it. Idk about you, but I refuse to invest in a market where my position can get attacked thru illegal means and the perpetrator won't be prosecuted.",1,2022-05-11 04:24:55,<praw.models.comment_forest.CommentForest object at 0x000001BA5D218460>,umyjua,wallstreetbets,t5_2th52,,False,False,t3_umyjua,t1_i84t9om,/r/wallstreetbets/comments/umyjua/did_some_digging_did_you_know_the_theories_gme/i8589ye/
36,i84uj41,MortalDanger00,That's such a unique investing strategy.,That's such a unique investing strategy.,62,2022-05-11 02:28:56,<praw.models.comment_forest.CommentForest object at 0x000001BA5D218E20>,umyjua,wallstreetbets,t5_2th52,,False,False,t3_umyjua,t1_i84t8c6,/r/wallstreetbets/comments/umyjua/did_some_digging_did_you_know_the_theories_gme/i84uj41/
37,i85ac3k,AdMore3461,"I think that’s a brilliant idea, and I think you should go max leverage with margin to help the cause as much as you can. You will miss out on guaranteed fortunes if you don’t take the opportunity to leverage.","I think that’s a brilliant idea, and I think you should go max leverage with margin to help the cause as much as you can. You will miss out on guaranteed fortunes if you don’t take the opportunity to leverage.",22,2022-05-11 04:45:15,<praw.models.comment_forest.CommentForest object at 0x000001BA5D218A60>,umyjua,wallstreetbets,t5_2th52,,False,False,t3_umyjua,t1_i84t8c6,/r/wallstreetbets/comments/umyjua/did_some_digging_did_you_know_the_theories_gme/i85ac3k/
38,i8l28c9,Thenachopacho,Please do and take out some loans and margin while you’re at it,Please do and take out some loans and margin while you’re at it,2,2022-05-14 15:18:36,<praw.models.comment_forest.CommentForest object at 0x000001BA5D218040>,umyjua,wallstreetbets,t5_2th52,,False,False,t3_umyjua,t1_i84t8c6,/r/wallstreetbets/comments/umyjua/did_some_digging_did_you_know_the_theories_gme/i8l28c9/
39,i862mum,Hedonisticbiped,Look at OPs history. Ez spotted troll or shill,Look at OPs history. Ez spotted troll or shill,-2,2022-05-11 10:51:51,<praw.models.comment_forest.CommentForest object at 0x000001BA5D218310>,umyjua,wallstreetbets,t5_2th52,,False,False,t3_umyjua,t1_i84t8c6,/r/wallstreetbets/comments/umyjua/did_some_digging_did_you_know_the_theories_gme/i862mum/
40,i9jaic0,tommygunz007,This,This,1,2022-05-22 06:11:42,<praw.models.comment_forest.CommentForest object at 0x000001BA5D218220>,umyjua,wallstreetbets,t5_2th52,,False,False,t3_umyjua,t1_i85mmxv,/r/wallstreetbets/comments/umyjua/did_some_digging_did_you_know_the_theories_gme/i9jaic0/
41,i87npnb,Electrical-Amoeba245,🚀🚀🚀🚀🚀🚀,🚀🚀🚀🚀🚀🚀,-1,2022-05-11 17:51:17,<praw.models.comment_forest.CommentForest object at 0x000001BA5D218100>,umyjua,wallstreetbets,t5_2th52,,False,False,t3_umyjua,t1_i85mmxv,/r/wallstreetbets/comments/umyjua/did_some_digging_did_you_know_the_theories_gme/i87npnb/
42,i85zlos,pqisp0,For the millionth time: COL-LA-TER-AL. This really has been explained over and over again. In extreme market stress this does happen.,For the millionth time: COL-LA-TER-AL. This really has been explained over and over again. In extreme market stress this does happen.,9,2022-05-11 10:14:15,<praw.models.comment_forest.CommentForest object at 0x000001BA5D21AF10>,umyjua,wallstreetbets,t5_2th52,,False,False,t3_umyjua,t1_i84psag,/r/wallstreetbets/comments/umyjua/did_some_digging_did_you_know_the_theories_gme/i85zlos/
43,i84q30d,DixieNormous76,Not saying they should have done that but the conspiracies those actions birthed are exactly the same.,Not saying they should have done that but the conspiracies those actions birthed are exactly the same.,14,2022-05-11 01:55:07,<praw.models.comment_forest.CommentForest object at 0x000001BA5D21AFA0>,umyjua,wallstreetbets,t5_2th52,,False,True,t3_umyjua,t1_i84psag,/r/wallstreetbets/comments/umyjua/did_some_digging_did_you_know_the_theories_gme/i84q30d/
44,i84sjjw,QSX_The_White__,"robinhood removed the buy button because they're incompetent, not because they're evil","robinhood removed the buy button because they're incompetent, not because they're evil",16,2022-05-11 02:13:55,<praw.models.comment_forest.CommentForest object at 0x000001BA5D21AB20>,umyjua,wallstreetbets,t5_2th52,,False,False,t3_umyjua,t1_i84psag,/r/wallstreetbets/comments/umyjua/did_some_digging_did_you_know_the_theories_gme/i84sjjw/
