,ID,Author,body,Comment,Score,Created On,Replies,Submission,Subreddit,Subreddit_ID,Distinguished,Edited,Is_submitter,link_id,Parent_id,Permalink
126,ivzieyc,AutoModerator,"If the content doesn't belong, use the report button or [modmail us](https://www.reddit.com/message/compose?to=%2Fr%2Fwoahdude) the link.

Please avoid [backseat moderating](https://www.reddit.com/r/woahdude/wiki/index#wiki_rule_9_-_no_back-seat_modding).


*I am a bot, and this action was performed automatically. Please [contact the moderators of this subreddit](/message/compose/?to=/r/woahdude) if you have any questions or concerns.*","If the content doesn't belong, use the report button or [modmail us](https://www.reddit.com/message/compose?to=%2Fr%2Fwoahdude) the link.

Please avoid [backseat moderating](https://www.reddit.com/r/woahdude/wiki/index#wiki_rule_9_-_no_back-seat_modding).


*I am a bot, and this action was performed automatically. Please [contact the moderators of this subreddit](/message/compose/?to=/r/woahdude) if you have any questions or concerns.*",1,2022-11-11 19:46:08,<praw.models.comment_forest.CommentForest object at 0x0000022EEE6477F0>,yse3mv,woahdude,t5_2r8tu,moderator,False,False,t3_yse3mv,t1_ivzieww,/r/woahdude/comments/yse3mv/its_recording_her_reaction/ivzieyc/
127,ii0o7zj,AutoModerator,"Welcome to /r/WoahDude! 

* Check out what counts as ""woahdude material"" in our [**wiki**](https://www.reddit.com/r/woahdude/wiki/index#wiki_woahdude_material).


*I am a bot, and this action was performed automatically. Please [contact the moderators of this subreddit](/message/compose/?to=/r/woahdude) if you have any questions or concerns.*","Welcome to /r/WoahDude! 

* Check out what counts as ""woahdude material"" in our [**wiki**](https://www.reddit.com/r/woahdude/wiki/index#wiki_woahdude_material).


*I am a bot, and this action was performed automatically. Please [contact the moderators of this subreddit](/message/compose/?to=/r/woahdude) if you have any questions or concerns.*",1,2022-07-28 17:49:11,<praw.models.comment_forest.CommentForest object at 0x0000022EEE646220>,wagbdc,woahdude,t5_2r8tu,moderator,False,False,t3_wagbdc,t3_wagbdc,/r/woahdude/comments/wagbdc/the_new_gorillaz_video_is_out_d/ii0o7zj/
128,ii1wxyr,hippychemist,"Actual song here, if anyone doesn't want to listen to Kesha.

https://youtu.be/S03T47hapAc","Actual song here, if anyone doesn't want to listen to Kesha.

https://youtu.be/S03T47hapAc",110,2022-07-28 22:42:42,<praw.models.comment_forest.CommentForest object at 0x0000022EEE646250>,wagbdc,woahdude,t5_2r8tu,,False,False,t3_wagbdc,t3_wagbdc,/r/woahdude/comments/wagbdc/the_new_gorillaz_video_is_out_d/ii1wxyr/
129,ii16jid,msargo15,Lol why is it Kesha,Lol why is it Kesha,39,2022-07-28 19:47:28,<praw.models.comment_forest.CommentForest object at 0x0000022EEE6463D0>,wagbdc,woahdude,t5_2r8tu,,False,False,t3_wagbdc,t3_wagbdc,/r/woahdude/comments/wagbdc/the_new_gorillaz_video_is_out_d/ii16jid/
130,ii19scm,gurrra,This do NOT sound like Gorillaz. What is this crap?,This do NOT sound like Gorillaz. What is this crap?,13,2022-07-28 20:08:19,<praw.models.comment_forest.CommentForest object at 0x0000022EEE646790>,wagbdc,woahdude,t5_2r8tu,,False,False,t3_wagbdc,t3_wagbdc,/r/woahdude/comments/wagbdc/the_new_gorillaz_video_is_out_d/ii19scm/
131,ii3q6mh,ConsciousFractals,Very curious to hear the story of how a Kesha track ended up on this video LOL,Very curious to hear the story of how a Kesha track ended up on this video LOL,4,2022-07-29 08:31:49,<praw.models.comment_forest.CommentForest object at 0x0000022EEE646850>,wagbdc,woahdude,t5_2r8tu,,False,False,t3_wagbdc,t3_wagbdc,/r/woahdude/comments/wagbdc/the_new_gorillaz_video_is_out_d/ii3q6mh/
132,ii2ws30,Arcagebus77,Is she back?? That's sad.,Is she back?? That's sad.,3,2022-07-29 03:17:27,<praw.models.comment_forest.CommentForest object at 0x0000022EEE6469D0>,wagbdc,woahdude,t5_2r8tu,,False,False,t3_wagbdc,t3_wagbdc,/r/woahdude/comments/wagbdc/the_new_gorillaz_video_is_out_d/ii2ws30/
133,ii41sad,NihilistPunk69,Why the fuck is Kesha playing? JFC,Why the fuck is Kesha playing? JFC,2,2022-07-29 10:59:28,<praw.models.comment_forest.CommentForest object at 0x0000022EEE646A30>,wagbdc,woahdude,t5_2r8tu,,False,False,t3_wagbdc,t3_wagbdc,/r/woahdude/comments/wagbdc/the_new_gorillaz_video_is_out_d/ii41sad/
134,ii5ehqp,TylerBaraby,I literally *just* fucking joined this reddit and you've already got me leaving.,I literally *just* fucking joined this reddit and you've already got me leaving.,2,2022-07-29 17:01:03,<praw.models.comment_forest.CommentForest object at 0x0000022EEE646A90>,wagbdc,woahdude,t5_2r8tu,,False,False,t3_wagbdc,t3_wagbdc,/r/woahdude/comments/wagbdc/the_new_gorillaz_video_is_out_d/ii5ehqp/
135,ii1hbtx,CaineTheGamerYT,"Imagine making animations that cleanly translates to 3d, damn good job","Imagine making animations that cleanly translates to 3d, damn good job",1,2022-07-28 20:56:46,<praw.models.comment_forest.CommentForest object at 0x0000022EEE646AF0>,wagbdc,woahdude,t5_2r8tu,,False,False,t3_wagbdc,t3_wagbdc,/r/woahdude/comments/wagbdc/the_new_gorillaz_video_is_out_d/ii1hbtx/
136,ii1fgvi,BrahtzDoll,This song was a huge part of my childhood-😭,This song was a huge part of my childhood-😭,-2,2022-07-28 20:44:46,<praw.models.comment_forest.CommentForest object at 0x0000022EEE646B50>,wagbdc,woahdude,t5_2r8tu,,False,False,t3_wagbdc,t3_wagbdc,/r/woahdude/comments/wagbdc/the_new_gorillaz_video_is_out_d/ii1fgvi/
137,ii5guea,Emicro,Why the hell did they put another song over this video….,Why the hell did they put another song over this video….,1,2022-07-29 17:16:19,<praw.models.comment_forest.CommentForest object at 0x0000022EEE646BB0>,wagbdc,woahdude,t5_2r8tu,,False,False,t3_wagbdc,t3_wagbdc,/r/woahdude/comments/wagbdc/the_new_gorillaz_video_is_out_d/ii5guea/
138,ii25wwl,nooshaw,Now that's Gorillaz! OP's video had me thinking Gorillaz's going down hill.,Now that's Gorillaz! OP's video had me thinking Gorillaz's going down hill.,54,2022-07-28 23:48:56,<praw.models.comment_forest.CommentForest object at 0x0000022EEE646430>,wagbdc,woahdude,t5_2r8tu,,False,False,t3_wagbdc,t1_ii1wxyr,/r/woahdude/comments/wagbdc/the_new_gorillaz_video_is_out_d/ii25wwl/
139,ii2x0jf,Arcagebus77,"Thank you. I'd lost hope in humanity at first.  
The real one is a banger.","Thank you. I'd lost hope in humanity at first.  
The real one is a banger.",11,2022-07-29 03:19:25,<praw.models.comment_forest.CommentForest object at 0x0000022EEE646490>,wagbdc,woahdude,t5_2r8tu,,False,False,t3_wagbdc,t1_ii1wxyr,/r/woahdude/comments/wagbdc/the_new_gorillaz_video_is_out_d/ii2x0jf/
140,ii2p1bq,nanaben,Thank you so damn much,Thank you so damn much,6,2022-07-29 02:15:24,<praw.models.comment_forest.CommentForest object at 0x0000022EEE646550>,wagbdc,woahdude,t5_2r8tu,,False,False,t3_wagbdc,t1_ii1wxyr,/r/woahdude/comments/wagbdc/the_new_gorillaz_video_is_out_d/ii2p1bq/
141,ii2qb7m,Casper823,Thx you da real mvp,Thx you da real mvp,2,2022-07-29 02:25:19,<praw.models.comment_forest.CommentForest object at 0x0000022EEE646610>,wagbdc,woahdude,t5_2r8tu,,False,False,t3_wagbdc,t1_ii1wxyr,/r/woahdude/comments/wagbdc/the_new_gorillaz_video_is_out_d/ii2qb7m/
142,ii3b05m,feelinandreelin,Thanks. I was about to give up on them,Thanks. I was about to give up on them,2,2022-07-29 05:29:42,<praw.models.comment_forest.CommentForest object at 0x0000022EEE646670>,wagbdc,woahdude,t5_2r8tu,,False,False,t3_wagbdc,t1_ii1wxyr,/r/woahdude/comments/wagbdc/the_new_gorillaz_video_is_out_d/ii3b05m/
143,ii23qj6,zacrl1230,"This needs to be higher!   


Thank you!","This needs to be higher!   


Thank you!",0,2022-07-28 23:32:36,<praw.models.comment_forest.CommentForest object at 0x0000022EEE6466D0>,wagbdc,woahdude,t5_2r8tu,,False,False,t3_wagbdc,t1_ii1wxyr,/r/woahdude/comments/wagbdc/the_new_gorillaz_video_is_out_d/ii23qj6/
144,ii3wldp,TeeMannn,Oh thank god. I thought theyd lost it,Oh thank god. I thought theyd lost it,1,2022-07-29 09:57:26,<praw.models.comment_forest.CommentForest object at 0x0000022EEE646730>,wagbdc,woahdude,t5_2r8tu,,False,False,t3_wagbdc,t1_ii1wxyr,/r/woahdude/comments/wagbdc/the_new_gorillaz_video_is_out_d/ii3wldp/
145,ii2x658,Arcagebus77,"Real song  
https://www.youtube.com/watch?v=S03T47hapAc&ab\_channel=Gorillaz","Real song  
https://www.youtube.com/watch?v=S03T47hapAc&ab\_channel=Gorillaz",8,2022-07-29 03:20:42,<praw.models.comment_forest.CommentForest object at 0x0000022EEE6467F0>,wagbdc,woahdude,t5_2r8tu,,False,False,t3_wagbdc,t1_ii16jid,/r/woahdude/comments/wagbdc/the_new_gorillaz_video_is_out_d/ii2x658/
146,ii2x7qw,Arcagebus77,"You're welcome  
https://www.youtube.com/watch?v=S03T47hapAc&ab\_channel=Gorillaz","You're welcome  
https://www.youtube.com/watch?v=S03T47hapAc&ab\_channel=Gorillaz",5,2022-07-29 03:21:03,<praw.models.comment_forest.CommentForest object at 0x0000022EEE646910>,wagbdc,woahdude,t5_2r8tu,,False,False,t3_wagbdc,t1_ii19scm,/r/woahdude/comments/wagbdc/the_new_gorillaz_video_is_out_d/ii2x7qw/
147,ii2x9d6,imBobertRobert,Music in the reddit vid isn't the same as the actual music video,Music in the reddit vid isn't the same as the actual music video,2,2022-07-29 03:21:25,<praw.models.comment_forest.CommentForest object at 0x0000022EEE646970>,wagbdc,woahdude,t5_2r8tu,,False,False,t3_wagbdc,t1_ii19scm,/r/woahdude/comments/wagbdc/the_new_gorillaz_video_is_out_d/ii2x9d6/
148,ii237ic,Shadowman761,It only just dropped wdym,It only just dropped wdym,-3,2022-07-28 23:28:36,<praw.models.comment_forest.CommentForest object at 0x0000022EEE646C10>,wagbdc,woahdude,t5_2r8tu,,False,False,t3_wagbdc,t1_ii1fgvi,/r/woahdude/comments/wagbdc/the_new_gorillaz_video_is_out_d/ii237ic/
149,ii2662s,hippychemist,"Even if they did suck that hard now, why wouldn't the animators sync the mouths?  I went searching for answers, and I found them.","Even if they did suck that hard now, why wouldn't the animators sync the mouths?  I went searching for answers, and I found them.",8,2022-07-28 23:50:50,<praw.models.comment_forest.CommentForest object at 0x0000022EEE6464F0>,wagbdc,woahdude,t5_2r8tu,,False,False,t3_wagbdc,t1_ii25wwl,/r/woahdude/comments/wagbdc/the_new_gorillaz_video_is_out_d/ii2662s/
150,ii47ofa,lordlossxp,Thank you. Much better,Thank you. Much better,2,2022-07-29 11:59:32,<praw.models.comment_forest.CommentForest object at 0x0000022EEE6468B0>,wagbdc,woahdude,t5_2r8tu,,False,False,t3_wagbdc,t1_ii2x658,/r/woahdude/comments/wagbdc/the_new_gorillaz_video_is_out_d/ii47ofa/
151,ii2cpg1,BrahtzDoll,"No like the song, not this video. The song is Crazy Kids by Kesha. Came out 10 or so years ago","No like the song, not this video. The song is Crazy Kids by Kesha. Came out 10 or so years ago",3,2022-07-29 00:41:24,<praw.models.comment_forest.CommentForest object at 0x0000022EEE646CD0>,wagbdc,woahdude,t5_2r8tu,,False,False,t3_wagbdc,t1_ii237ic,/r/woahdude/comments/wagbdc/the_new_gorillaz_video_is_out_d/ii2cpg1/
152,ii2x3qd,Arcagebus77,Do tell.,Do tell.,1,2022-07-29 03:20:09,<praw.models.comment_forest.CommentForest object at 0x0000022EEE6465B0>,wagbdc,woahdude,t5_2r8tu,,False,False,t3_wagbdc,t1_ii2662s,/r/woahdude/comments/wagbdc/the_new_gorillaz_video_is_out_d/ii2x3qd/
153,k309xi1,AutoModerator,"Welcome to /r/WoahDude! 

* Check out what counts as ""woahdude material"" in our [**wiki**](https://www.reddit.com/r/woahdude/wiki/index#wiki_woahdude_material).


*I am a bot, and this action was performed automatically. Please [contact the moderators of this subreddit](/message/compose/?to=/r/woahdude) if you have any questions or concerns.*","Welcome to /r/WoahDude! 

* Check out what counts as ""woahdude material"" in our [**wiki**](https://www.reddit.com/r/woahdude/wiki/index#wiki_woahdude_material).


*I am a bot, and this action was performed automatically. Please [contact the moderators of this subreddit](/message/compose/?to=/r/woahdude) if you have any questions or concerns.*",1,2023-10-01 15:11:40,<praw.models.comment_forest.CommentForest object at 0x0000022EEE65A7F0>,16x3qx5,woahdude,t5_2r8tu,moderator,False,False,t3_16x3qx5,t3_16x3qx5,/r/woahdude/comments/16x3qx5/sailing_the_seas_of_cheese/k309xi1/
154,k30dprt,slowpr0,I want what OP is smoking,I want what OP is smoking,16,2023-10-01 15:36:52,<praw.models.comment_forest.CommentForest object at 0x0000022EEE65A850>,16x3qx5,woahdude,t5_2r8tu,,False,False,t3_16x3qx5,t3_16x3qx5,/r/woahdude/comments/16x3qx5/sailing_the_seas_of_cheese/k30dprt/
155,k30lzyg,NovemberComingFire,Primus sucks!,Primus sucks!,11,2023-10-01 16:29:55,<praw.models.comment_forest.CommentForest object at 0x0000022EEE65A8B0>,16x3qx5,woahdude,t5_2r8tu,,False,False,t3_16x3qx5,t3_16x3qx5,/r/woahdude/comments/16x3qx5/sailing_the_seas_of_cheese/k30lzyg/
156,k30k2x2,sh0eh0rn,"Here come the bastards.  I heard it from a confidant, who heard it from a confidant, they're definitely on their way.","Here come the bastards.  I heard it from a confidant, who heard it from a confidant, they're definitely on their way.",3,2023-10-01 16:17:45,<praw.models.comment_forest.CommentForest object at 0x0000022EEE65A970>,16x3qx5,woahdude,t5_2r8tu,,False,False,t3_16x3qx5,t3_16x3qx5,/r/woahdude/comments/16x3qx5/sailing_the_seas_of_cheese/k30k2x2/
157,k30tq5v,TheForbiddenFool,Primus sucks!!!,Primus sucks!!!,4,2023-10-01 17:18:28,<praw.models.comment_forest.CommentForest object at 0x0000022EEE65A9D0>,16x3qx5,woahdude,t5_2r8tu,,False,False,t3_16x3qx5,t3_16x3qx5,/r/woahdude/comments/16x3qx5/sailing_the_seas_of_cheese/k30tq5v/
158,k30yqdq,OrganizationWide1560,Bleu,Bleu,2,2023-10-01 17:47:32,<praw.models.comment_forest.CommentForest object at 0x0000022EEE65AA30>,16x3qx5,woahdude,t5_2r8tu,,False,False,t3_16x3qx5,t3_16x3qx5,/r/woahdude/comments/16x3qx5/sailing_the_seas_of_cheese/k30yqdq/
159,k339xi2,harbib,The great state of Vermont will not apologize for its cheese.,The great state of Vermont will not apologize for its cheese.,2,2023-10-02 02:46:37,<praw.models.comment_forest.CommentForest object at 0x0000022EEE65AA90>,16x3qx5,woahdude,t5_2r8tu,,False,False,t3_16x3qx5,t3_16x3qx5,/r/woahdude/comments/16x3qx5/sailing_the_seas_of_cheese/k339xi2/
160,k30v2en,Refun712,Is that you Sgt. Baker?,Is that you Sgt. Baker?,1,2023-10-01 17:26:25,<praw.models.comment_forest.CommentForest object at 0x0000022EEE65AAF0>,16x3qx5,woahdude,t5_2r8tu,,False,False,t3_16x3qx5,t3_16x3qx5,/r/woahdude/comments/16x3qx5/sailing_the_seas_of_cheese/k30v2en/
161,k34d6qo,Renegade-Rooster,the cold wind of conformity is nipping at your nose,the cold wind of conformity is nipping at your nose,1,2023-10-02 10:04:01,<praw.models.comment_forest.CommentForest object at 0x0000022EEE65AB50>,16x3qx5,woahdude,t5_2r8tu,,False,False,t3_16x3qx5,t3_16x3qx5,/r/woahdude/comments/16x3qx5/sailing_the_seas_of_cheese/k34d6qo/
162,k34d2lt,Renegade-Rooster,blue cheese,blue cheese,1,2023-10-02 10:02:32,<praw.models.comment_forest.CommentForest object at 0x0000022EEE65A910>,16x3qx5,woahdude,t5_2r8tu,,False,False,t3_16x3qx5,t1_k30dprt,/r/woahdude/comments/16x3qx5/sailing_the_seas_of_cheese/k34d2lt/
163,i8wedc7,lowerthanrich,Now that a steep learning curve,Now that a steep learning curve,0,2022-05-17 02:26:09,<praw.models.comment_forest.CommentForest object at 0x0000022EEE65AEE0>,urc2l9,woahdude,t5_2r8tu,,False,False,t3_urc2l9,t3_urc2l9,/r/woahdude/comments/urc2l9/learning_on_a_curve/i8wedc7/
