,ID,Author,body,Comment,Score,Created On,Replies,Submission,Subreddit,Subreddit_ID,Distinguished,Edited,Is_submitter,link_id,Parent_id,Permalink
0,ihhfkzr,AutoModerator,"Welcome to /r/WoahDude! 

* Check out what counts as ""woahdude material"" in our [**wiki**](https://www.reddit.com/r/woahdude/wiki/index#wiki_woahdude_material).


*I am a bot, and this action was performed automatically. Please [contact the moderators of this subreddit](/message/compose/?to=/r/woahdude) if you have any questions or concerns.*","Welcome to /r/WoahDude! 

* Check out what counts as ""woahdude material"" in our [**wiki**](https://www.reddit.com/r/woahdude/wiki/index#wiki_woahdude_material).


*I am a bot, and this action was performed automatically. Please [contact the moderators of this subreddit](/message/compose/?to=/r/woahdude) if you have any questions or concerns.*",1,2022-07-24 19:21:59,<praw.models.comment_forest.CommentForest object at 0x0000022EF0D22640>,w73iad,woahdude,t5_2r8tu,moderator,False,False,t3_w73iad,t3_w73iad,/r/woahdude/comments/w73iad/trippy_psychedelic_effects_in_sour_magics_new/ihhfkzr/
1,ihhz32w,capman511,His 52 listeners are enthralled I'm sure.,His 52 listeners are enthralled I'm sure.,50,2022-07-24 21:38:11,<praw.models.comment_forest.CommentForest object at 0x0000022EF0D226A0>,w73iad,woahdude,t5_2r8tu,,False,False,t3_w73iad,t3_w73iad,/r/woahdude/comments/w73iad/trippy_psychedelic_effects_in_sour_magics_new/ihhz32w/
2,ihi6zl4,cdawg2112,OP is definitely just promoting his own band. Fire your creative director cause they’re ass,OP is definitely just promoting his own band. Fire your creative director cause they’re ass,66,2022-07-24 22:35:01,<praw.models.comment_forest.CommentForest object at 0x0000022EF0D22700>,w73iad,woahdude,t5_2r8tu,,False,False,t3_w73iad,t3_w73iad,/r/woahdude/comments/w73iad/trippy_psychedelic_effects_in_sour_magics_new/ihi6zl4/
3,ihi1vf6,,This shit is ass OP,This shit is ass OP,76,2022-07-24 21:57:55,<praw.models.comment_forest.CommentForest object at 0x0000022EF0D227C0>,w73iad,woahdude,t5_2r8tu,,False,False,t3_w73iad,t3_w73iad,/r/woahdude/comments/w73iad/trippy_psychedelic_effects_in_sour_magics_new/ihi1vf6/
4,ihi6znc,Oatmeal_Raison,Me when I figure out opacity and green screen effects,Me when I figure out opacity and green screen effects,20,2022-07-24 22:35:02,<praw.models.comment_forest.CommentForest object at 0x0000022EF0D22880>,w73iad,woahdude,t5_2r8tu,,False,False,t3_w73iad,t3_w73iad,/r/woahdude/comments/w73iad/trippy_psychedelic_effects_in_sour_magics_new/ihi6znc/
5,ihibub2,,"I like the shoegaze aesthetic of the music, but the 1990 effects are not good.","I like the shoegaze aesthetic of the music, but the 1990 effects are not good.",14,2022-07-24 23:11:17,<praw.models.comment_forest.CommentForest object at 0x0000022EF0D229A0>,w73iad,woahdude,t5_2r8tu,,False,False,t3_w73iad,t3_w73iad,/r/woahdude/comments/w73iad/trippy_psychedelic_effects_in_sour_magics_new/ihibub2/
6,ihhwgox,Low_Reference_6316,Are you not supposed to hear the lyrics for trippy music?,Are you not supposed to hear the lyrics for trippy music?,12,2022-07-24 21:19:47,<praw.models.comment_forest.CommentForest object at 0x0000022EF0D22A00>,w73iad,woahdude,t5_2r8tu,,False,False,t3_w73iad,t3_w73iad,/r/woahdude/comments/w73iad/trippy_psychedelic_effects_in_sour_magics_new/ihhwgox/
7,ihi419c,stripedpixel,I guarantee the editor got underpaid,I guarantee the editor got underpaid,8,2022-07-24 22:13:29,<praw.models.comment_forest.CommentForest object at 0x0000022EF0D22A60>,w73iad,woahdude,t5_2r8tu,,False,False,t3_w73iad,t3_w73iad,/r/woahdude/comments/w73iad/trippy_psychedelic_effects_in_sour_magics_new/ihi419c/
8,ihjidpo,TheLazyHumanist,Whoa dude! This is absolute trash.,Whoa dude! This is absolute trash.,3,2022-07-25 05:08:15,<praw.models.comment_forest.CommentForest object at 0x0000022EF0D22AC0>,w73iad,woahdude,t5_2r8tu,,False,False,t3_w73iad,t3_w73iad,/r/woahdude/comments/w73iad/trippy_psychedelic_effects_in_sour_magics_new/ihjidpo/
9,ihifxj2,tmnt88,Man this has 90s pop punk vibes all over it...not sure if it's a good thing or a bad thing but it reminded me of being a kid watching MTV before school,Man this has 90s pop punk vibes all over it...not sure if it's a good thing or a bad thing but it reminded me of being a kid watching MTV before school,0,2022-07-24 23:42:39,<praw.models.comment_forest.CommentForest object at 0x0000022EF0D22B20>,w73iad,woahdude,t5_2r8tu,,False,False,t3_w73iad,t3_w73iad,/r/woahdude/comments/w73iad/trippy_psychedelic_effects_in_sour_magics_new/ihifxj2/
10,ihibt2a,daftpunko,Damn you got hated on hard.  I liked it.  Vocalist is a bit too quiet to hear though.  He sounds like Thom Yorke,Damn you got hated on hard.  I liked it.  Vocalist is a bit too quiet to hear though.  He sounds like Thom Yorke,-2,2022-07-24 23:11:02,<praw.models.comment_forest.CommentForest object at 0x0000022EF0D22B80>,w73iad,woahdude,t5_2r8tu,,False,False,t3_w73iad,t3_w73iad,/r/woahdude/comments/w73iad/trippy_psychedelic_effects_in_sour_magics_new/ihibt2a/
11,ihioib2,,"sure, kid. Good stuff, Champ","sure, kid. Good stuff, Champ",-1,2022-07-25 00:50:01,<praw.models.comment_forest.CommentForest object at 0x0000022EF0D22BE0>,w73iad,woahdude,t5_2r8tu,,False,False,t3_w73iad,t3_w73iad,/r/woahdude/comments/w73iad/trippy_psychedelic_effects_in_sour_magics_new/ihioib2/
12,ihk4v1f,thehimalayansaiyan,*I wanna be adored*,*I wanna be adored*,1,2022-07-25 09:56:45,<praw.models.comment_forest.CommentForest object at 0x0000022EF0D22CA0>,w73iad,woahdude,t5_2r8tu,,False,False,t3_w73iad,t3_w73iad,/r/woahdude/comments/w73iad/trippy_psychedelic_effects_in_sour_magics_new/ihk4v1f/
13,ihkmb33,RecommendationFunny5,Wtf is he saying ??.?.?.?,Wtf is he saying ??.?.?.?,1,2022-07-25 12:59:16,<praw.models.comment_forest.CommentForest object at 0x0000022EF0D22D00>,w73iad,woahdude,t5_2r8tu,,False,False,t3_w73iad,t3_w73iad,/r/woahdude/comments/w73iad/trippy_psychedelic_effects_in_sour_magics_new/ihkmb33/
14,ihw6irr,,Did they make this at Six Flags?,Did they make this at Six Flags?,1,2022-07-27 19:37:47,<praw.models.comment_forest.CommentForest object at 0x0000022EF0D22D60>,w73iad,woahdude,t5_2r8tu,,False,False,t3_w73iad,t3_w73iad,/r/woahdude/comments/w73iad/trippy_psychedelic_effects_in_sour_magics_new/ihw6irr/
15,ihmi7kt,use_vpn_orlozeacount,"lol pretty close

https://i.imgur.com/oa9fVC3.jpeg","lol pretty close

https://i.imgur.com/oa9fVC3.jpeg",5,2022-07-25 20:28:41,<praw.models.comment_forest.CommentForest object at 0x0000022EF0D22760>,w73iad,woahdude,t5_2r8tu,,False,False,t3_w73iad,t1_ihhz32w,/r/woahdude/comments/w73iad/trippy_psychedelic_effects_in_sour_magics_new/ihmi7kt/
16,ihi6sdc,such_karma,Yeah low quality af,Yeah low quality af,15,2022-07-24 22:33:35,<praw.models.comment_forest.CommentForest object at 0x0000022EF0D228E0>,w73iad,woahdude,t5_2r8tu,,False,False,t3_w73iad,t1_ihi1vf6,/r/woahdude/comments/w73iad/trippy_psychedelic_effects_in_sour_magics_new/ihi6sdc/
17,ihisp0t,theabstractpyro,Yeah that's what I was thinking,Yeah that's what I was thinking,4,2022-07-25 01:22:51,<praw.models.comment_forest.CommentForest object at 0x0000022EF0D22940>,w73iad,woahdude,t5_2r8tu,,False,False,t3_w73iad,t1_ihi1vf6,/r/woahdude/comments/w73iad/trippy_psychedelic_effects_in_sour_magics_new/ihisp0t/
18,ihjnykn,RedLimbo,"Bruh, we listening to the same Thom Yorke?","Bruh, we listening to the same Thom Yorke?",4,2022-07-25 06:11:22,<praw.models.comment_forest.CommentForest object at 0x0000022EF0D22C40>,w73iad,woahdude,t5_2r8tu,,False,False,t3_w73iad,t1_ihibt2a,/r/woahdude/comments/w73iad/trippy_psychedelic_effects_in_sour_magics_new/ihjnykn/
19,ihmied4,capman511,"Would you look at that, he gained 5 since yesterday.","Would you look at that, he gained 5 since yesterday.",3,2022-07-25 20:29:50,<praw.models.comment_forest.CommentForest object at 0x0000022EF0D22820>,w73iad,woahdude,t5_2r8tu,,False,False,t3_w73iad,t1_ihmi7kt,/r/woahdude/comments/w73iad/trippy_psychedelic_effects_in_sour_magics_new/ihmied4/
20,iypwpxe,AutoModerator,"Welcome to /r/WoahDude! 

* Check out what counts as ""woahdude material"" in our [**wiki**](https://www.reddit.com/r/woahdude/wiki/index#wiki_woahdude_material).


*I am a bot, and this action was performed automatically. Please [contact the moderators of this subreddit](/message/compose/?to=/r/woahdude) if you have any questions or concerns.*","Welcome to /r/WoahDude! 

* Check out what counts as ""woahdude material"" in our [**wiki**](https://www.reddit.com/r/woahdude/wiki/index#wiki_woahdude_material).


*I am a bot, and this action was performed automatically. Please [contact the moderators of this subreddit](/message/compose/?to=/r/woahdude) if you have any questions or concerns.*",1,2022-12-03 05:51:17,<praw.models.comment_forest.CommentForest object at 0x0000022EF0D198E0>,zb912d,woahdude,t5_2r8tu,moderator,False,False,t3_zb912d,t3_zb912d,/r/woahdude/comments/zb912d/trippy_tree_love/iypwpxe/
21,iyq3pfo,Adorable-Ad-3223,Man. Maybe you have had enough drugs for the night. Go to sleep.,Man. Maybe you have had enough drugs for the night. Go to sleep.,33,2022-12-03 07:19:09,<praw.models.comment_forest.CommentForest object at 0x0000022EF0D19940>,zb912d,woahdude,t5_2r8tu,,False,False,t3_zb912d,t3_zb912d,/r/woahdude/comments/zb912d/trippy_tree_love/iyq3pfo/
22,iyrazdp,littletoaster3,Filters are cool,Filters are cool,16,2022-12-03 15:43:06,<praw.models.comment_forest.CommentForest object at 0x0000022EF0D199A0>,zb912d,woahdude,t5_2r8tu,,False,False,t3_zb912d,t3_zb912d,/r/woahdude/comments/zb912d/trippy_tree_love/iyrazdp/
23,iyrwizd,2manyfelines,How is that tree ever going to find a job with this on the internet?,How is that tree ever going to find a job with this on the internet?,7,2022-12-03 18:09:20,<praw.models.comment_forest.CommentForest object at 0x0000022EF0D19A00>,zb912d,woahdude,t5_2r8tu,,False,False,t3_zb912d,t3_zb912d,/r/woahdude/comments/zb912d/trippy_tree_love/iyrwizd/
24,iyqxxwp,jimboslice29,Boomers,Boomers,14,2022-12-03 13:57:31,<praw.models.comment_forest.CommentForest object at 0x0000022EF0D19AC0>,zb912d,woahdude,t5_2r8tu,,False,False,t3_zb912d,t3_zb912d,/r/woahdude/comments/zb912d/trippy_tree_love/iyqxxwp/
25,iytg9lw,HoundNZ_2022,Op's probably high as fuck. It's a fucking tree with some very shitty filter behind it. Sorry if I'm being harsh but like um.. wtf?,Op's probably high as fuck. It's a fucking tree with some very shitty filter behind it. Sorry if I'm being harsh but like um.. wtf?,6,2022-12-04 00:54:42,<praw.models.comment_forest.CommentForest object at 0x0000022EF0D19B20>,zb912d,woahdude,t5_2r8tu,,False,False,t3_zb912d,t3_zb912d,/r/woahdude/comments/zb912d/trippy_tree_love/iytg9lw/
26,iyt07d8,gnarkill6,What's that song? It's neat and stimulating.,What's that song? It's neat and stimulating.,-1,2022-12-03 22:49:53,<praw.models.comment_forest.CommentForest object at 0x0000022EF0D19B80>,zb912d,woahdude,t5_2r8tu,,False,False,t3_zb912d,t3_zb912d,/r/woahdude/comments/zb912d/trippy_tree_love/iyt07d8/
27,iyswstt,C_l_oCkSuCkEr,Wtf was that supposed to mean?,Wtf was that supposed to mean?,1,2022-12-03 22:24:15,<praw.models.comment_forest.CommentForest object at 0x0000022EF0D19BE0>,zb912d,woahdude,t5_2r8tu,,False,False,t3_zb912d,t3_zb912d,/r/woahdude/comments/zb912d/trippy_tree_love/iyswstt/
28,iytoag1,LSDREAMN,“The quartz crystal can feel the tree’s intentions”,“The quartz crystal can feel the tree’s intentions”,1,2022-12-04 02:00:04,<praw.models.comment_forest.CommentForest object at 0x0000022EF0D19C40>,zb912d,woahdude,t5_2r8tu,,False,False,t3_zb912d,t3_zb912d,/r/woahdude/comments/zb912d/trippy_tree_love/iytoag1/
29,iysq2n1,FaeryLynne,Filters are really fun when you're high af,Filters are really fun when you're high af,2,2022-12-03 21:34:42,<praw.models.comment_forest.CommentForest object at 0x0000022EF0D19A60>,zb912d,woahdude,t5_2r8tu,,False,False,t3_zb912d,t1_iyrazdp,/r/woahdude/comments/zb912d/trippy_tree_love/iysq2n1/
30,j7yvtj5,AutoModerator,"Welcome to /r/WoahDude! 

* Check out what counts as ""woahdude material"" in our [**wiki**](https://www.reddit.com/r/woahdude/wiki/index#wiki_woahdude_material).


*I am a bot, and this action was performed automatically. Please [contact the moderators of this subreddit](/message/compose/?to=/r/woahdude) if you have any questions or concerns.*","Welcome to /r/WoahDude! 

* Check out what counts as ""woahdude material"" in our [**wiki**](https://www.reddit.com/r/woahdude/wiki/index#wiki_woahdude_material).


*I am a bot, and this action was performed automatically. Please [contact the moderators of this subreddit](/message/compose/?to=/r/woahdude) if you have any questions or concerns.*",1,2023-02-10 11:43:22,<praw.models.comment_forest.CommentForest object at 0x0000022EEE1CDAF0>,10ypwqr,woahdude,t5_2r8tu,moderator,False,False,t3_10ypwqr,t3_10ypwqr,/r/woahdude/comments/10ypwqr/the_land_effect_this_is_not_a_colour_imagethere/j7yvtj5/
31,j7zj15f,slacky,Does OP think red is not a colour?,Does OP think red is not a colour?,332,2023-02-10 15:03:00,<praw.models.comment_forest.CommentForest object at 0x0000022EEE1CDB50>,10ypwqr,woahdude,t5_2r8tu,,False,False,t3_10ypwqr,t3_10ypwqr,/r/woahdude/comments/10ypwqr/the_land_effect_this_is_not_a_colour_imagethere/j7zj15f/
32,j80sgdq,DecentUserName0000,It looks grey and red,It looks grey and red,282,2023-02-10 19:59:42,<praw.models.comment_forest.CommentForest object at 0x0000022EEE1CDBB0>,10ypwqr,woahdude,t5_2r8tu,,False,False,t3_10ypwqr,t3_10ypwqr,/r/woahdude/comments/10ypwqr/the_land_effect_this_is_not_a_colour_imagethere/j80sgdq/
33,j7zrexw,NarwhalAttack,Not sure if it's an effect that's exactly what it looks like...,Not sure if it's an effect that's exactly what it looks like...,123,2023-02-10 15:59:17,<praw.models.comment_forest.CommentForest object at 0x0000022EEE1CDC10>,10ypwqr,woahdude,t5_2r8tu,,False,False,t3_10ypwqr,t3_10ypwqr,/r/woahdude/comments/10ypwqr/the_land_effect_this_is_not_a_colour_imagethere/j7zrexw/
34,j81k8s0,kontpab,Tell me you’re colorblind without telling me you’re colorblind.,Tell me you’re colorblind without telling me you’re colorblind.,100,2023-02-10 23:06:36,<praw.models.comment_forest.CommentForest object at 0x0000022EEE1CDCD0>,10ypwqr,woahdude,t5_2r8tu,,False,False,t3_10ypwqr,t3_10ypwqr,/r/woahdude/comments/10ypwqr/the_land_effect_this_is_not_a_colour_imagethere/j81k8s0/
35,j81oa0z,Darth_Boognish,I dont get it,I dont get it,50,2023-02-10 23:35:34,<praw.models.comment_forest.CommentForest object at 0x0000022EEE1CDD30>,10ypwqr,woahdude,t5_2r8tu,,False,False,t3_10ypwqr,t3_10ypwqr,/r/woahdude/comments/10ypwqr/the_land_effect_this_is_not_a_colour_imagethere/j81oa0z/
36,j82h23f,PorkyFishFish,I don't see anything weird here it just looks like red and gray,I don't see anything weird here it just looks like red and gray,40,2023-02-11 03:21:09,<praw.models.comment_forest.CommentForest object at 0x0000022EEE1CDD90>,10ypwqr,woahdude,t5_2r8tu,,False,False,t3_10ypwqr,t3_10ypwqr,/r/woahdude/comments/10ypwqr/the_land_effect_this_is_not_a_colour_imagethere/j82h23f/
37,j84032r,sup_with_you,This comment is only black and white. Zoom in and see for yourself.,This comment is only black and white. Zoom in and see for yourself.,27,2023-02-11 14:01:14,<praw.models.comment_forest.CommentForest object at 0x0000022EEE1CDDC0>,10ypwqr,woahdude,t5_2r8tu,,False,False,t3_10ypwqr,t3_10ypwqr,/r/woahdude/comments/10ypwqr/the_land_effect_this_is_not_a_colour_imagethere/j84032r/
38,j8287lg,SHANKUMS11,You need to get your eyes checked.,You need to get your eyes checked.,21,2023-02-11 02:08:00,<praw.models.comment_forest.CommentForest object at 0x0000022EEE1CDE50>,10ypwqr,woahdude,t5_2r8tu,,False,False,t3_10ypwqr,t3_10ypwqr,/r/woahdude/comments/10ypwqr/the_land_effect_this_is_not_a_colour_imagethere/j8287lg/
39,j83h68e,caidicus,I don't get it. All I see is red and grey. Are my eyes broken?,I don't get it. All I see is red and grey. Are my eyes broken?,9,2023-02-11 10:20:43,<praw.models.comment_forest.CommentForest object at 0x0000022EEE1CDEB0>,10ypwqr,woahdude,t5_2r8tu,,False,False,t3_10ypwqr,t3_10ypwqr,/r/woahdude/comments/10ypwqr/the_land_effect_this_is_not_a_colour_imagethere/j83h68e/
40,j8191a8,lcdabest,"they really need a walmart with a massive parking lot, an interstate, a target, best buy, lowe’s, home depot, and single family homes everywhere instead of that pond and all those trees","they really need a walmart with a massive parking lot, an interstate, a target, best buy, lowe’s, home depot, and single family homes everywhere instead of that pond and all those trees",22,2023-02-10 21:47:54,<praw.models.comment_forest.CommentForest object at 0x0000022EEE1CDF10>,10ypwqr,woahdude,t5_2r8tu,,False,False,t3_10ypwqr,t3_10ypwqr,/r/woahdude/comments/10ypwqr/the_land_effect_this_is_not_a_colour_imagethere/j8191a8/
41,j802zpo,Volluskrassos,I can see green.,I can see green.,7,2023-02-10 17:14:24,<praw.models.comment_forest.CommentForest object at 0x0000022EEE1CDF70>,10ypwqr,woahdude,t5_2r8tu,,False,False,t3_10ypwqr,t3_10ypwqr,/r/woahdude/comments/10ypwqr/the_land_effect_this_is_not_a_colour_imagethere/j802zpo/
42,j84e0vz,Imcoleyourenot,Well it looks very much red and grey 🤣,Well it looks very much red and grey 🤣,5,2023-02-11 15:21:14,<praw.models.comment_forest.CommentForest object at 0x0000022EEE1CA0A0>,10ypwqr,woahdude,t5_2r8tu,,False,False,t3_10ypwqr,t3_10ypwqr,/r/woahdude/comments/10ypwqr/the_land_effect_this_is_not_a_colour_imagethere/j84e0vz/
43,j84j4ak,EvenBetterCool,I don't need to zoom in to believe this.,I don't need to zoom in to believe this.,6,2023-02-11 15:56:34,<praw.models.comment_forest.CommentForest object at 0x0000022EEE1CA100>,10ypwqr,woahdude,t5_2r8tu,,False,False,t3_10ypwqr,t3_10ypwqr,/r/woahdude/comments/10ypwqr/the_land_effect_this_is_not_a_colour_imagethere/j84j4ak/
44,j83ix21,LoveFi,Im color blind idk if this is a joke or if im just not able to see the full thing,Im color blind idk if this is a joke or if im just not able to see the full thing,5,2023-02-11 10:46:47,<praw.models.comment_forest.CommentForest object at 0x0000022EEE1CA190>,10ypwqr,woahdude,t5_2r8tu,,False,False,t3_10ypwqr,t3_10ypwqr,/r/woahdude/comments/10ypwqr/the_land_effect_this_is_not_a_colour_imagethere/j83ix21/
45,j83nk17,Aggravating_Tap7220,"If you actually want to test that, you can just open the picture in a program like gimp or even MS-Paint, and sample the colour.

>!The blue is low, but not 0.!<","If you actually want to test that, you can just open the picture in a program like gimp or even MS-Paint, and sample the colour.

>!The blue is low, but not 0.!<",3,2023-02-11 11:50:21,<praw.models.comment_forest.CommentForest object at 0x0000022EEE1CA1C0>,10ypwqr,woahdude,t5_2r8tu,,False,False,t3_10ypwqr,t3_10ypwqr,/r/woahdude/comments/10ypwqr/the_land_effect_this_is_not_a_colour_imagethere/j83nk17/
46,j82ud6w,Dumpling_Killer,That shade of grey is blue…,That shade of grey is blue…,2,2023-02-11 05:25:17,<praw.models.comment_forest.CommentForest object at 0x0000022EEE1CA220>,10ypwqr,woahdude,t5_2r8tu,,False,False,t3_10ypwqr,t3_10ypwqr,/r/woahdude/comments/10ypwqr/the_land_effect_this_is_not_a_colour_imagethere/j82ud6w/
47,j853qqm,robokai,Virtual Boy Filter,Virtual Boy Filter,2,2023-02-11 18:17:57,<praw.models.comment_forest.CommentForest object at 0x0000022EEE1CA280>,10ypwqr,woahdude,t5_2r8tu,,False,False,t3_10ypwqr,t3_10ypwqr,/r/woahdude/comments/10ypwqr/the_land_effect_this_is_not_a_colour_imagethere/j853qqm/
48,j8afp3l,schuyywalker,Isn’t this how my dog sees things?,Isn’t this how my dog sees things?,2,2023-02-12 21:28:18,<praw.models.comment_forest.CommentForest object at 0x0000022EEE1CA2E0>,10ypwqr,woahdude,t5_2r8tu,,False,False,t3_10ypwqr,t3_10ypwqr,/r/woahdude/comments/10ypwqr/the_land_effect_this_is_not_a_colour_imagethere/j8afp3l/
49,j815sum,FrillyLlama,OP is trying to whitewash nature just like our history.🙃,OP is trying to whitewash nature just like our history.🙃,-11,2023-02-10 21:26:43,<praw.models.comment_forest.CommentForest object at 0x0000022EEE1CA340>,10ypwqr,woahdude,t5_2r8tu,,False,False,t3_10ypwqr,t3_10ypwqr,/r/woahdude/comments/10ypwqr/the_land_effect_this_is_not_a_colour_imagethere/j815sum/
50,j82f8c4,ctfks,Pink black and grey,Pink black and grey,1,2023-02-11 03:05:36,<praw.models.comment_forest.CommentForest object at 0x0000022EEE1CA3A0>,10ypwqr,woahdude,t5_2r8tu,,False,False,t3_10ypwqr,t3_10ypwqr,/r/woahdude/comments/10ypwqr/the_land_effect_this_is_not_a_colour_imagethere/j82f8c4/
51,j83y71y,RolandofLineEld,Wtf,Wtf,1,2023-02-11 13:45:06,<praw.models.comment_forest.CommentForest object at 0x0000022EEE1CA460>,10ypwqr,woahdude,t5_2r8tu,,False,False,t3_10ypwqr,t3_10ypwqr,/r/woahdude/comments/10ypwqr/the_land_effect_this_is_not_a_colour_imagethere/j83y71y/
52,j85yau8,DamionDreggs,"I get it, it's a psychological effect, where you have expectations based on the context, so your brain fills in the gaps by mentally compensating for the environmental lighting.

Same deal with that black and blue dress from a bunch of years back... the lighting insinuated a context, and your brain tries to normalize.","I get it, it's a psychological effect, where you have expectations based on the context, so your brain fills in the gaps by mentally compensating for the environmental lighting.

Same deal with that black and blue dress from a bunch of years back... the lighting insinuated a context, and your brain tries to normalize.",1,2023-02-11 21:52:56,<praw.models.comment_forest.CommentForest object at 0x0000022EEE1CA4C0>,10ypwqr,woahdude,t5_2r8tu,,False,False,t3_10ypwqr,t3_10ypwqr,/r/woahdude/comments/10ypwqr/the_land_effect_this_is_not_a_colour_imagethere/j85yau8/
53,j86uirw,9793287233,I've seen it before but for some reason this one just isn't working,I've seen it before but for some reason this one just isn't working,1,2023-02-12 01:59:58,<praw.models.comment_forest.CommentForest object at 0x0000022EEE1CA520>,10ypwqr,woahdude,t5_2r8tu,,False,False,t3_10ypwqr,t3_10ypwqr,/r/woahdude/comments/10ypwqr/the_land_effect_this_is_not_a_colour_imagethere/j86uirw/
54,j8btfr3,GooseMay0,"I red, black, grey, white. So pink is just a shade of red?","I red, black, grey, white. So pink is just a shade of red?",1,2023-02-13 03:28:50,<praw.models.comment_forest.CommentForest object at 0x0000022EEE1CA5E0>,10ypwqr,woahdude,t5_2r8tu,,False,False,t3_10ypwqr,t3_10ypwqr,/r/woahdude/comments/10ypwqr/the_land_effect_this_is_not_a_colour_imagethere/j8btfr3/
55,j84k69i,LaceSexDoctor,"I thought I was going crazy cuz I was like, yup I only see red and gray","I thought I was going crazy cuz I was like, yup I only see red and gray",39,2023-02-11 16:04:15,<praw.models.comment_forest.CommentForest object at 0x0000022EEE1CDC70>,10ypwqr,woahdude,t5_2r8tu,,False,False,t3_10ypwqr,t1_j80sgdq,/r/woahdude/comments/10ypwqr/the_land_effect_this_is_not_a_colour_imagethere/j84k69i/
56,j82kjuh,dooblusdoofus,don’t forget a highway interchange that is as big as a town,don’t forget a highway interchange that is as big as a town,4,2023-02-11 03:51:20,<praw.models.comment_forest.CommentForest object at 0x0000022EEE1CDFD0>,10ypwqr,woahdude,t5_2r8tu,,False,False,t3_10ypwqr,t1_j8191a8,/r/woahdude/comments/10ypwqr/the_land_effect_this_is_not_a_colour_imagethere/j82kjuh/
57,j83uqh8,lauriebugggo,Don't forget the liquor stores!!,Don't forget the liquor stores!!,3,2023-02-11 13:12:04,<praw.models.comment_forest.CommentForest object at 0x0000022EEE1CA040>,10ypwqr,woahdude,t5_2r8tu,,False,False,t3_10ypwqr,t1_j8191a8,/r/woahdude/comments/10ypwqr/the_land_effect_this_is_not_a_colour_imagethere/j83uqh8/
58,j81kxis,ciddlefush,LMAO more like redwash,LMAO more like redwash,5,2023-02-10 23:11:30,<praw.models.comment_forest.CommentForest object at 0x0000022EEE1CA400>,10ypwqr,woahdude,t5_2r8tu,,False,False,t3_10ypwqr,t1_j815sum,/r/woahdude/comments/10ypwqr/the_land_effect_this_is_not_a_colour_imagethere/j81kxis/
59,j8aen53,YetiTrix,Maybe most people just see red and grey cause they looked at the picture without reading the title.,Maybe most people just see red and grey cause they looked at the picture without reading the title.,1,2023-02-12 21:21:07,<praw.models.comment_forest.CommentForest object at 0x0000022EEE1CA580>,10ypwqr,woahdude,t5_2r8tu,,False,False,t3_10ypwqr,t1_j85yau8,/r/woahdude/comments/10ypwqr/the_land_effect_this_is_not_a_colour_imagethere/j8aen53/
60,iz2hy8w,AutoModerator,"Welcome to /r/WoahDude! 

* Check out what counts as ""woahdude material"" in our [**wiki**](https://www.reddit.com/r/woahdude/wiki/index#wiki_woahdude_material).


*I am a bot, and this action was performed automatically. Please [contact the moderators of this subreddit](/message/compose/?to=/r/woahdude) if you have any questions or concerns.*","Welcome to /r/WoahDude! 

* Check out what counts as ""woahdude material"" in our [**wiki**](https://www.reddit.com/r/woahdude/wiki/index#wiki_woahdude_material).


*I am a bot, and this action was performed automatically. Please [contact the moderators of this subreddit](/message/compose/?to=/r/woahdude) if you have any questions or concerns.*",1,2022-12-05 23:55:22,<praw.models.comment_forest.CommentForest object at 0x0000022EEE1CADC0>,zdolrp,woahdude,t5_2r8tu,moderator,False,False,t3_zdolrp,t3_zdolrp,/r/woahdude/comments/zdolrp/fresh_air/iz2hy8w/
61,iz3i709,LuxuryRhythm,"Ah yes the illusion is that the grid is actually not moving at all, but your brain makes you think it's waving. Don't believe me? Shove the nearest water bottle into your rectum","Ah yes the illusion is that the grid is actually not moving at all, but your brain makes you think it's waving. Don't believe me? Shove the nearest water bottle into your rectum",12,2022-12-06 04:40:45,<praw.models.comment_forest.CommentForest object at 0x0000022EEE1CAEB0>,zdolrp,woahdude,t5_2r8tu,,False,False,t3_zdolrp,t3_zdolrp,/r/woahdude/comments/zdolrp/fresh_air/iz3i709/
