,ID,Author,body,Comment,Score,Created On,Replies,Submission,Subreddit,Subreddit_ID,Distinguished,Edited,Is_submitter,link_id,Parent_id,Permalink
0,iyab3kn,Books_Music_RedWine,![img](emote|t5_2qh1o|13384),![img](emote|t5_2qh1o|13384),1,2022-11-29 22:33:17,<praw.models.comment_forest.CommentForest object at 0x000002547ACD2FA0>,z87y6f,aww,t5_2qh1o,,False,False,t3_z87y6f,t3_z87y6f,/r/aww/comments/z87y6f/my_son_is_breathtaking_oc/iyab3kn/
1,iydpnaw,Talcarin,I like turtles too.,I like turtles too.,2,2022-11-30 17:14:06,<praw.models.comment_forest.CommentForest object at 0x000002547ACD29D0>,z87y6f,aww,t5_2qh1o,,False,False,t3_z87y6f,t1_iyab3kn,/r/aww/comments/z87y6f/my_son_is_breathtaking_oc/iydpnaw/
2,isaabi0,,[removed],[removed],6,2022-10-14 13:20:28,<praw.models.comment_forest.CommentForest object at 0x000002547ACEB640>,y3suzs,aww,t5_2qh1o,,False,False,t3_y3suzs,t3_y3suzs,/r/aww/comments/y3suzs/can_never_have_to_many_pibble_pictures_heres_my/isaabi0/
3,isa8841,rockthrowing,Aww he’s all curled up with a pillow. How sweet.,Aww he’s all curled up with a pillow. How sweet.,-4,2022-10-14 13:04:12,<praw.models.comment_forest.CommentForest object at 0x000002547ACEB730>,y3suzs,aww,t5_2qh1o,,False,False,t3_y3suzs,t3_y3suzs,/r/aww/comments/y3suzs/can_never_have_to_many_pibble_pictures_heres_my/isa8841/
4,isaen3r,hEYiTSbEEEE,r/shrimping,r/shrimping,-2,2022-10-14 13:52:25,<praw.models.comment_forest.CommentForest object at 0x000002547ACEB7C0>,y3suzs,aww,t5_2qh1o,,False,False,t3_y3suzs,t3_y3suzs,/r/aww/comments/y3suzs/can_never_have_to_many_pibble_pictures_heres_my/isaen3r/
5,isa5dy0,SaScrewaround,Prepare for lockdown,Prepare for lockdown,-9,2022-10-14 12:41:01,<praw.models.comment_forest.CommentForest object at 0x000002547ACEB880>,y3suzs,aww,t5_2qh1o,,False,False,t3_y3suzs,t3_y3suzs,/r/aww/comments/y3suzs/can_never_have_to_many_pibble_pictures_heres_my/isa5dy0/
6,isajvgy,,A sleepy baby... give him a kiss on the head from me!,A sleepy baby... give him a kiss on the head from me!,-2,2022-10-14 14:28:45,<praw.models.comment_forest.CommentForest object at 0x000002547ACEB8E0>,y3suzs,aww,t5_2qh1o,,False,False,t3_y3suzs,t3_y3suzs,/r/aww/comments/y3suzs/can_never_have_to_many_pibble_pictures_heres_my/isajvgy/
7,isaa4ig,FattyMcCocks,"Get him a blanket now, hurry","Get him a blanket now, hurry",-9,2022-10-14 13:18:59,<praw.models.comment_forest.CommentForest object at 0x000002547ACEB9A0>,y3suzs,aww,t5_2qh1o,,False,False,t3_y3suzs,t3_y3suzs,/r/aww/comments/y3suzs/can_never_have_to_many_pibble_pictures_heres_my/isaa4ig/
8,isas7cg,McSkillet2323,I swear he's not spoiled,I swear he's not spoiled,-4,2022-10-14 15:24:31,<praw.models.comment_forest.CommentForest object at 0x000002547ACEB820>,y3suzs,aww,t5_2qh1o,,False,True,t3_y3suzs,t1_isa8841,/r/aww/comments/y3suzs/can_never_have_to_many_pibble_pictures_heres_my/isas7cg/
9,isa5j7e,McSkillet2323,Fuck it. Haters gonna hate.,Fuck it. Haters gonna hate.,-11,2022-10-14 12:42:14,<praw.models.comment_forest.CommentForest object at 0x000002547ACEB940>,y3suzs,aww,t5_2qh1o,,False,True,t3_y3suzs,t1_isa5dy0,/r/aww/comments/y3suzs/can_never_have_to_many_pibble_pictures_heres_my/isa5j7e/
10,isbqjya,FattyMcCocks,Didn't realize yall was against tucked in dogs smh,Didn't realize yall was against tucked in dogs smh,-1,2022-10-14 19:14:46,<praw.models.comment_forest.CommentForest object at 0x000002547ACEBA60>,y3suzs,aww,t5_2qh1o,,False,False,t3_y3suzs,t1_isaa4ig,/r/aww/comments/y3suzs/can_never_have_to_many_pibble_pictures_heres_my/isbqjya/
11,iscu33z,reganmcneal,Got my 🍿,Got my 🍿,4,2022-10-14 23:55:55,<praw.models.comment_forest.CommentForest object at 0x000002547ACEBFA0>,y47xzu,aww,t5_2qh1o,,False,False,t3_y47xzu,t3_y47xzu,/r/aww/comments/y47xzu/my_big_boy_watching_out_for_me_alerted_me_before/iscu33z/
12,iscqpzz,,[removed],[removed],2,2022-10-14 23:29:08,<praw.models.comment_forest.CommentForest object at 0x000002547ACEBC70>,y47xzu,aww,t5_2qh1o,,False,False,t3_y47xzu,t3_y47xzu,/r/aww/comments/y47xzu/my_big_boy_watching_out_for_me_alerted_me_before/iscqpzz/
13,iscqayr,greenhornblue,Good doggo.,Good doggo.,-5,2022-10-14 23:25:50,<praw.models.comment_forest.CommentForest object at 0x000002547ACEBF40>,y47xzu,aww,t5_2qh1o,,False,False,t3_y47xzu,t3_y47xzu,/r/aww/comments/y47xzu/my_big_boy_watching_out_for_me_alerted_me_before/iscqayr/
14,iscqvst,nobodyspecial247365,??,??,-11,2022-10-14 23:30:25,<praw.models.comment_forest.CommentForest object at 0x000002547ACFA130>,y47xzu,aww,t5_2qh1o,,False,True,t3_y47xzu,t1_iscqpzz,/r/aww/comments/y47xzu/my_big_boy_watching_out_for_me_alerted_me_before/iscqvst/
15,h2r4a0n,Retard_Obliterator69,I downvoted this,I downvoted this,22,2021-06-23 10:20:36,<praw.models.comment_forest.CommentForest object at 0x000002547ACA65E0>,o5rac2,aww,t5_2qh1o,,False,False,t3_o5rac2,t3_o5rac2,/r/aww/comments/o5rac2/what_is_your_best_pregnancy_photo/h2r4a0n/
16,j5jn9d4,SirJamesTheMighty,Is she looking at a child in the distance lol.,Is she looking at a child in the distance lol.,9,2023-01-23 14:08:49,<praw.models.comment_forest.CommentForest object at 0x000002547ACFAB80>,10hw5nu,aww,t5_2qh1o,,False,False,t3_10hw5nu,t3_10hw5nu,/r/aww/comments/10hw5nu/mama_pitbull_had_12_puppies/j5jn9d4/
17,j5cnpe7,hatesnoisybitches,"This isn’t cute, shelters are overrun with pit bulls nobody wants and you’re breeding more?","This isn’t cute, shelters are overrun with pit bulls nobody wants and you’re breeding more?",13,2023-01-22 01:00:51,<praw.models.comment_forest.CommentForest object at 0x000002547ACFAE50>,10hw5nu,aww,t5_2qh1o,,False,False,t3_10hw5nu,t3_10hw5nu,/r/aww/comments/10hw5nu/mama_pitbull_had_12_puppies/j5cnpe7/
18,j5cx59m,Massive_Ad_8856,"I had to do a double take.  Looks exactly like my dog .. he is male though !🤣

Congratulations on your babies … sweet girl ! ♥️","I had to do a double take.  Looks exactly like my dog .. he is male though !🤣

Congratulations on your babies … sweet girl ! ♥️",2,2023-01-22 02:10:52,<praw.models.comment_forest.CommentForest object at 0x000002547ACFAEE0>,10hw5nu,aww,t5_2qh1o,,False,False,t3_10hw5nu,t3_10hw5nu,/r/aww/comments/10hw5nu/mama_pitbull_had_12_puppies/j5cx59m/
19,j5cljsu,,[removed],[removed],1,2023-01-22 00:45:05,<praw.models.comment_forest.CommentForest object at 0x000002547ACFAFA0>,10hw5nu,aww,t5_2qh1o,,False,False,t3_10hw5nu,t3_10hw5nu,/r/aww/comments/10hw5nu/mama_pitbull_had_12_puppies/j5cljsu/
20,j5cp3f4,Reazor16,This isn't a breeding situation. Wife's parents are fostering them from someone who left the mama when she was pregnant at a shelter.,This isn't a breeding situation. Wife's parents are fostering them from someone who left the mama when she was pregnant at a shelter.,2,2023-01-22 01:11:17,<praw.models.comment_forest.CommentForest object at 0x000002547ACFAF40>,10hw5nu,aww,t5_2qh1o,,False,True,t3_10hw5nu,t1_j5cnpe7,/r/aww/comments/10hw5nu/mama_pitbull_had_12_puppies/j5cp3f4/
21,j5zkyfk,Euthanase_All_Pitts,Sweet until a first killed child,Sweet until a first killed child,4,2023-01-26 17:44:48,<praw.models.comment_forest.CommentForest object at 0x000002547ACF10A0>,10hw5nu,aww,t5_2qh1o,,False,False,t3_10hw5nu,t1_j5cx59m,/r/aww/comments/10hw5nu/mama_pitbull_had_12_puppies/j5zkyfk/
22,j5cn3hu,,[removed],[removed],-1,2023-01-22 00:56:16,<praw.models.comment_forest.CommentForest object at 0x000002547ACF1220>,10hw5nu,aww,t5_2qh1o,,False,False,t3_10hw5nu,t1_j5cljsu,/r/aww/comments/10hw5nu/mama_pitbull_had_12_puppies/j5cn3hu/
23,j5cxamo,hatesnoisybitches,Then I hope they know what they got themselves into.,Then I hope they know what they got themselves into.,7,2023-01-22 02:11:56,<praw.models.comment_forest.CommentForest object at 0x000002547ACF1040>,10hw5nu,aww,t5_2qh1o,,False,False,t3_10hw5nu,t1_j5cp3f4,/r/aww/comments/10hw5nu/mama_pitbull_had_12_puppies/j5cxamo/
24,j5zupnt,Massive_Ad_8856,Ignorant comment!,Ignorant comment!,3,2023-01-26 18:45:12,<praw.models.comment_forest.CommentForest object at 0x000002547ACF11C0>,10hw5nu,aww,t5_2qh1o,,False,False,t3_10hw5nu,t1_j5zkyfk,/r/aww/comments/10hw5nu/mama_pitbull_had_12_puppies/j5zupnt/
25,j5d14s4,Reazor16,They do. They don't work so are able to take care of them properly.  Already have trusted people lined up for adoptions. All is well.  Best for these dogs.,They do. They don't work so are able to take care of them properly.  Already have trusted people lined up for adoptions. All is well.  Best for these dogs.,2,2023-01-22 02:40:11,<praw.models.comment_forest.CommentForest object at 0x000002547ACF1100>,10hw5nu,aww,t5_2qh1o,,False,True,t3_10hw5nu,t1_j5cxamo,/r/aww/comments/10hw5nu/mama_pitbull_had_12_puppies/j5d14s4/
26,jiedn9r,ultrafidianx,idk how to explain but he looks just like you,idk how to explain but he looks just like you,15,2023-05-01 05:33:43,<praw.models.comment_forest.CommentForest object at 0x000002547AD1DEE0>,134dhv3,aww,t5_2qh1o,,False,False,t3_134dhv3,t3_134dhv3,/r/aww/comments/134dhv3/just_me_and_my_weird_son_oc/jiedn9r/
27,jielit6,whatdid-it,This is ... A choice image lol,This is ... A choice image lol,8,2023-05-01 07:22:51,<praw.models.comment_forest.CommentForest object at 0x000002547AD1DF40>,134dhv3,aww,t5_2qh1o,,False,False,t3_134dhv3,t3_134dhv3,/r/aww/comments/134dhv3/just_me_and_my_weird_son_oc/jielit6/
28,jiefiq2,ickebn,Ngl the cats not that normal either,Ngl the cats not that normal either,5,2023-05-01 05:58:12,<praw.models.comment_forest.CommentForest object at 0x000002547AD1E100>,134dhv3,aww,t5_2qh1o,,False,False,t3_134dhv3,t3_134dhv3,/r/aww/comments/134dhv3/just_me_and_my_weird_son_oc/jiefiq2/
29,jieh2rz,TokoloshNr1,Which one is which now?😁,Which one is which now?😁,4,2023-05-01 06:19:30,<praw.models.comment_forest.CommentForest object at 0x000002547AD1E1C0>,134dhv3,aww,t5_2qh1o,,False,False,t3_134dhv3,t3_134dhv3,/r/aww/comments/134dhv3/just_me_and_my_weird_son_oc/jieh2rz/
30,jieqnee,anitadykshyt,Good luck with this one schnoodle,Good luck with this one schnoodle,5,2023-05-01 08:40:22,<praw.models.comment_forest.CommentForest object at 0x000002547AD1E2E0>,134dhv3,aww,t5_2qh1o,,False,False,t3_134dhv3,t3_134dhv3,/r/aww/comments/134dhv3/just_me_and_my_weird_son_oc/jieqnee/
31,jiexv72,,It'd been okay to crop the crotch out of this photo,It'd been okay to crop the crotch out of this photo,4,2023-05-01 10:24:20,<praw.models.comment_forest.CommentForest object at 0x000002547AD1E3A0>,134dhv3,aww,t5_2qh1o,,False,False,t3_134dhv3,t3_134dhv3,/r/aww/comments/134dhv3/just_me_and_my_weird_son_oc/jiexv72/
32,jieda91,FlyingInNeverland,What is his name?? I love Sphynx kitties!,What is his name?? I love Sphynx kitties!,2,2023-05-01 05:29:08,<praw.models.comment_forest.CommentForest object at 0x000002547AD1E400>,134dhv3,aww,t5_2qh1o,,False,False,t3_134dhv3,t3_134dhv3,/r/aww/comments/134dhv3/just_me_and_my_weird_son_oc/jieda91/
33,jifxjqn,Vahagn323,"Pets and owners almost always look alike.

I wonder if that is a psychological thing, even when picking them out as lil babays.","Pets and owners almost always look alike.

I wonder if that is a psychological thing, even when picking them out as lil babays.",2,2023-05-01 15:35:08,<praw.models.comment_forest.CommentForest object at 0x000002547AD1E520>,134dhv3,aww,t5_2qh1o,,False,False,t3_134dhv3,t3_134dhv3,/r/aww/comments/134dhv3/just_me_and_my_weird_son_oc/jifxjqn/
34,jig9ulr,mentally-sick-bitch,You're doing a great job taking care of your human son for sure,You're doing a great job taking care of your human son for sure,2,2023-05-01 16:56:25,<praw.models.comment_forest.CommentForest object at 0x000002547AD1E5E0>,134dhv3,aww,t5_2qh1o,,False,False,t3_134dhv3,t3_134dhv3,/r/aww/comments/134dhv3/just_me_and_my_weird_son_oc/jig9ulr/
35,jifk2q0,anzhela_777777,GUF,GUF,0,2023-05-01 13:59:42,<praw.models.comment_forest.CommentForest object at 0x000002547AD1E6A0>,134dhv3,aww,t5_2qh1o,,False,False,t3_134dhv3,t3_134dhv3,/r/aww/comments/134dhv3/just_me_and_my_weird_son_oc/jifk2q0/
36,jietwh2,tibicentibicen,Are you the cat?,Are you the cat?,1,2023-05-01 09:28:51,<praw.models.comment_forest.CommentForest object at 0x000002547AD1E760>,134dhv3,aww,t5_2qh1o,,False,False,t3_134dhv3,t3_134dhv3,/r/aww/comments/134dhv3/just_me_and_my_weird_son_oc/jietwh2/
37,jifhh8t,shadowtheimpure,"I didn't know that cats could sire humans, but eh shows what I know.","I didn't know that cats could sire humans, but eh shows what I know.",1,2023-05-01 13:39:38,<praw.models.comment_forest.CommentForest object at 0x000002547AD1E820>,134dhv3,aww,t5_2qh1o,,False,False,t3_134dhv3,t3_134dhv3,/r/aww/comments/134dhv3/just_me_and_my_weird_son_oc/jifhh8t/
38,jij1ond,sAndstOne646464,Pets that look like their owners,Pets that look like their owners,1,2023-05-02 05:14:35,<praw.models.comment_forest.CommentForest object at 0x000002547AD1EA60>,134dhv3,aww,t5_2qh1o,,False,False,t3_134dhv3,t3_134dhv3,/r/aww/comments/134dhv3/just_me_and_my_weird_son_oc/jij1ond/
39,jiedy4p,Ok-Welcome-5103,I’ve gotten that before lol we go nicely together,I’ve gotten that before lol we go nicely together,4,2023-05-01 05:37:36,<praw.models.comment_forest.CommentForest object at 0x000002547AD1DFA0>,134dhv3,aww,t5_2qh1o,,False,True,t3_134dhv3,t1_jiedn9r,/r/aww/comments/134dhv3/just_me_and_my_weird_son_oc/jiedy4p/
40,jij3t8f,,Both have no hair,Both have no hair,1,2023-05-02 05:40:19,<praw.models.comment_forest.CommentForest object at 0x000002547AD1E040>,134dhv3,aww,t5_2qh1o,,False,False,t3_134dhv3,t1_jiedn9r,/r/aww/comments/134dhv3/just_me_and_my_weird_son_oc/jij3t8f/
41,jiefpd0,Ok-Welcome-5103,He’s an odd looking fella but he really is the best cat I’ve had,He’s an odd looking fella but he really is the best cat I’ve had,3,2023-05-01 06:00:41,<praw.models.comment_forest.CommentForest object at 0x000002547AD1E280>,134dhv3,aww,t5_2qh1o,,False,True,t3_134dhv3,t1_jiefiq2,/r/aww/comments/134dhv3/just_me_and_my_weird_son_oc/jiefpd0/
42,jiiiifs,Ok-Welcome-5103,My sons the cat lol,My sons the cat lol,2,2023-05-02 02:18:52,<praw.models.comment_forest.CommentForest object at 0x000002547AD1E340>,134dhv3,aww,t5_2qh1o,,False,True,t3_134dhv3,t1_jieh2rz,/r/aww/comments/134dhv3/just_me_and_my_weird_son_oc/jiiiifs/
43,jiixeqs,dawgmama62,Someone finally said it.,Someone finally said it.,2,2023-05-02 04:28:08,<praw.models.comment_forest.CommentForest object at 0x000002547AD1E460>,134dhv3,aww,t5_2qh1o,,False,False,t3_134dhv3,t1_jiexv72,/r/aww/comments/134dhv3/just_me_and_my_weird_son_oc/jiixeqs/
44,jieze5b,Ok-Welcome-5103,I’m wearing shorts..,I’m wearing shorts..,2,2023-05-01 10:44:09,<praw.models.comment_forest.CommentForest object at 0x000002547AD1E4C0>,134dhv3,aww,t5_2qh1o,,False,True,t3_134dhv3,t1_jiexv72,/r/aww/comments/134dhv3/just_me_and_my_weird_son_oc/jieze5b/
45,jiedwuu,Ok-Welcome-5103,His names goblin:),His names goblin:),1,2023-05-01 05:37:08,<praw.models.comment_forest.CommentForest object at 0x000002547AD1E580>,134dhv3,aww,t5_2qh1o,,False,True,t3_134dhv3,t1_jieda91,/r/aww/comments/134dhv3/just_me_and_my_weird_son_oc/jiedwuu/
46,jiiikph,Ok-Welcome-5103,"I’m the human, my cat is my son lol","I’m the human, my cat is my son lol",1,2023-05-02 02:19:21,<praw.models.comment_forest.CommentForest object at 0x000002547AD1E700>,134dhv3,aww,t5_2qh1o,,False,True,t3_134dhv3,t1_jig9ulr,/r/aww/comments/134dhv3/just_me_and_my_weird_son_oc/jiiikph/
47,jifm9lw,Ok-Welcome-5103,Guf??,Guf??,0,2023-05-01 14:15:58,<praw.models.comment_forest.CommentForest object at 0x000002547AD1E7C0>,134dhv3,aww,t5_2qh1o,,False,True,t3_134dhv3,t1_jifk2q0,/r/aww/comments/134dhv3/just_me_and_my_weird_son_oc/jifm9lw/
48,jietzzy,Ok-Welcome-5103,Nope I’m the guy holding it,Nope I’m the guy holding it,1,2023-05-01 09:30:19,<praw.models.comment_forest.CommentForest object at 0x000002547AD1E8E0>,134dhv3,aww,t5_2qh1o,,False,True,t3_134dhv3,t1_jietwh2,/r/aww/comments/134dhv3/just_me_and_my_weird_son_oc/jietzzy/
49,jieu0rn,Ok-Welcome-5103,Nope I’m the guy holding it,Nope I’m the guy holding it,0,2023-05-01 09:30:39,<praw.models.comment_forest.CommentForest object at 0x000002547AD1E9A0>,134dhv3,aww,t5_2qh1o,,False,True,t3_134dhv3,t1_jietwh2,/r/aww/comments/134dhv3/just_me_and_my_weird_son_oc/jieu0rn/
50,jiee1aa,ultrafidianx,he's wearing that sweater like it's prada,he's wearing that sweater like it's prada,2,2023-05-01 05:38:43,<praw.models.comment_forest.CommentForest object at 0x000002547AD1E0A0>,134dhv3,aww,t5_2qh1o,,False,False,t3_134dhv3,t1_jiedy4p,/r/aww/comments/134dhv3/just_me_and_my_weird_son_oc/jiee1aa/
51,jieeucq,FlyingInNeverland,That seriously fits him perfectly hahaha I love it,That seriously fits him perfectly hahaha I love it,2,2023-05-01 05:49:13,<praw.models.comment_forest.CommentForest object at 0x000002547AD1E640>,134dhv3,aww,t5_2qh1o,,False,False,t3_134dhv3,t1_jiedwuu,/r/aww/comments/134dhv3/just_me_and_my_weird_son_oc/jieeucq/
52,jifmc4h,anzhela_777777,Yeah haha it’s a Russian raper,Yeah haha it’s a Russian raper,2,2023-05-01 14:16:29,<praw.models.comment_forest.CommentForest object at 0x000002547AD1E880>,134dhv3,aww,t5_2qh1o,,False,False,t3_134dhv3,t1_jifm9lw,/r/aww/comments/134dhv3/just_me_and_my_weird_son_oc/jifmc4h/
53,jieej32,Ok-Welcome-5103,"Isn’t he so handsome, he loves his sweaters","Isn’t he so handsome, he loves his sweaters",1,2023-05-01 05:45:06,<praw.models.comment_forest.CommentForest object at 0x000002547AD1E160>,134dhv3,aww,t5_2qh1o,,False,True,t3_134dhv3,t1_jiee1aa,/r/aww/comments/134dhv3/just_me_and_my_weird_son_oc/jieej32/
54,jifmq3m,Ok-Welcome-5103,Just looked him up we do look similar haha,Just looked him up we do look similar haha,1,2023-05-01 14:19:21,<praw.models.comment_forest.CommentForest object at 0x000002547AD1E940>,134dhv3,aww,t5_2qh1o,,False,True,t3_134dhv3,t1_jifmc4h,/r/aww/comments/134dhv3/just_me_and_my_weird_son_oc/jifmq3m/
55,jieeqc3,ultrafidianx,🔥,🔥,1,2023-05-01 05:47:45,<praw.models.comment_forest.CommentForest object at 0x000002547AD1E220>,134dhv3,aww,t5_2qh1o,,False,False,t3_134dhv3,t1_jieej32,/r/aww/comments/134dhv3/just_me_and_my_weird_son_oc/jieeqc3/
56,jifmux5,anzhela_777777,Ahaha yeah someway,Ahaha yeah someway,0,2023-05-01 14:20:18,<praw.models.comment_forest.CommentForest object at 0x000002547AD1EA00>,134dhv3,aww,t5_2qh1o,,False,False,t3_134dhv3,t1_jifmq3m,/r/aww/comments/134dhv3/just_me_and_my_weird_son_oc/jifmux5/
57,iscw3cg,Dank_sniggity,"The jowels blank out the light, the drool helps hydrate","The jowels blank out the light, the drool helps hydrate",1,2022-10-15 00:12:07,<praw.models.comment_forest.CommentForest object at 0x000002547ACF1280>,y4837w,aww,t5_2qh1o,,False,False,t3_y4837w,t3_y4837w,/r/aww/comments/y4837w/diy_hangover_goggles/iscw3cg/
58,isda41e,Careless_Dependent94,Here before this gets locked,Here before this gets locked,1,2022-10-15 02:06:04,<praw.models.comment_forest.CommentForest object at 0x000002547ACF12B0>,y4837w,aww,t5_2qh1o,,False,False,t3_y4837w,t3_y4837w,/r/aww/comments/y4837w/diy_hangover_goggles/isda41e/
59,iscrspc,ktaylortwinsmom,"Lol, also check out r/velvethippos and r/pittbulls","Lol, also check out r/velvethippos and r/pittbulls",-10,2022-10-14 23:37:37,<praw.models.comment_forest.CommentForest object at 0x000002547AD09190>,y4837w,aww,t5_2qh1o,,False,False,t3_y4837w,t3_y4837w,/r/aww/comments/y4837w/diy_hangover_goggles/iscrspc/
60,isd0zb5,,I know the pieces fit..,I know the pieces fit..,-2,2022-10-15 00:51:25,<praw.models.comment_forest.CommentForest object at 0x000002547AD090A0>,y4837w,aww,t5_2qh1o,,False,False,t3_y4837w,t3_y4837w,/r/aww/comments/y4837w/diy_hangover_goggles/isd0zb5/
61,isdsudv,EmperorGeek,Adorable!!,Adorable!!,-8,2022-10-15 05:04:19,<praw.models.comment_forest.CommentForest object at 0x000002547AD09880>,y4el0y,aww,t5_2qh1o,,False,False,t3_y4el0y,t3_y4el0y,/r/aww/comments/y4el0y/honey_got_a_new_raincoat_oc/isdsudv/
62,isdujr3,WiseChoices,"That much cute ought to end a drought.

Praying for RAIN 🌧 in California!","That much cute ought to end a drought.

Praying for RAIN 🌧 in California!",-7,2022-10-15 05:24:27,<praw.models.comment_forest.CommentForest object at 0x000002547AD098B0>,y4el0y,aww,t5_2qh1o,,False,False,t3_y4el0y,t3_y4el0y,/r/aww/comments/y4el0y/honey_got_a_new_raincoat_oc/isdujr3/
63,ise1wx7,Bobpie,Leaving my updoot before 🔒 award,Leaving my updoot before 🔒 award,-8,2022-10-15 07:01:00,<praw.models.comment_forest.CommentForest object at 0x000002547AD09A90>,y4el0y,aww,t5_2qh1o,,False,False,t3_y4el0y,t3_y4el0y,/r/aww/comments/y4el0y/honey_got_a_new_raincoat_oc/ise1wx7/
64,ish6j6k,smittyhotep,Haha! He loves it! Honey is a sweetheart.,Haha! He loves it! Honey is a sweetheart.,1,2022-10-15 23:24:08,<praw.models.comment_forest.CommentForest object at 0x000002547AD09AF0>,y4el0y,aww,t5_2qh1o,,False,False,t3_y4el0y,t3_y4el0y,/r/aww/comments/y4el0y/honey_got_a_new_raincoat_oc/ish6j6k/
65,isdt4f2,actualbike91078,It really is,It really is,-9,2022-10-15 05:07:34,<praw.models.comment_forest.CommentForest object at 0x000002547AD09A30>,y4el0y,aww,t5_2qh1o,,False,False,t3_y4el0y,t1_isdsudv,/r/aww/comments/y4el0y/honey_got_a_new_raincoat_oc/isdt4f2/
66,isgorcu,liberalated,"What does that mean? (Sorry, I’m kind of out of the loop.)","What does that mean? (Sorry, I’m kind of out of the loop.)",1,2022-10-15 21:13:01,<praw.models.comment_forest.CommentForest object at 0x000002547AD09B50>,y4el0y,aww,t5_2qh1o,,False,True,t3_y4el0y,t1_ise1wx7,/r/aww/comments/y4el0y/honey_got_a_new_raincoat_oc/isgorcu/
67,isgq3vm,Bobpie,"A lot of post supposedly are both getting botted with downvotes then locked by mods
(Pit bull post to be exact)","A lot of post supposedly are both getting botted with downvotes then locked by mods
(Pit bull post to be exact)",2,2022-10-15 21:22:42,<praw.models.comment_forest.CommentForest object at 0x000002547AD09C10>,y4el0y,aww,t5_2qh1o,,False,False,t3_y4el0y,t1_isgorcu,/r/aww/comments/y4el0y/honey_got_a_new_raincoat_oc/isgq3vm/
68,jpqrdjs,AutoModerator,"On July 1st, a [change to Reddit's API pricing](https://www.reddit.com/r/reddit/comments/12qwagm/an_update_regarding_reddits_api/) will come into effect. [Several developers](https://www.reddit.com/r/redditisfun/comments/144gmfq/rif_will_shut_down_on_june_30_2023_in_response_to/) of commercial third-party apps have announced that this change will compel them to shut down their apps. At least [one accessibility-focused non-commercial third party app](https://www.reddit.com/r/DystopiaForReddit/comments/145e9sk/update_dystopia_will_continue_operating_for_free/) will continue to be available free of charge.

If you want to express your strong disagreement with the API pricing change or with Reddit's response to the backlash, you may want to consider the following options:

1. Limiting your involvement with Reddit, or
2. Temporarily refraining from using Reddit, or
3. Cancelling your subscription of Reddit Premium

as a way to voice your protest.  You can also join us on Discord here:  https://discord.gg/UXfd5Pn

/r/aww is protesting by only allowing content featuring John Oliver, [as voted by the community.](https://www.reddit.com/r/aww/comments/14bt0c1/poll_decide_on_the_future_of_raww/)  If this post does not include John Oliver, please report it.  More information [here.](https://www.reddit.com/r/aww/comments/14cgp6d/henceforth_raww_will_only_feature_john_oliver/)


*I am a bot, and this action was performed automatically. Please [contact the moderators of this subreddit](/message/compose/?to=/r/aww) if you have any questions or concerns.*","On July 1st, a [change to Reddit's API pricing](https://www.reddit.com/r/reddit/comments/12qwagm/an_update_regarding_reddits_api/) will come into effect. [Several developers](https://www.reddit.com/r/redditisfun/comments/144gmfq/rif_will_shut_down_on_june_30_2023_in_response_to/) of commercial third-party apps have announced that this change will compel them to shut down their apps. At least [one accessibility-focused non-commercial third party app](https://www.reddit.com/r/DystopiaForReddit/comments/145e9sk/update_dystopia_will_continue_operating_for_free/) will continue to be available free of charge.

If you want to express your strong disagreement with the API pricing change or with Reddit's response to the backlash, you may want to consider the following options:

1. Limiting your involvement with Reddit, or
2. Temporarily refraining from using Reddit, or
3. Cancelling your subscription of Reddit Premium

as a way to voice your protest.  You can also join us on Discord here:  https://discord.gg/UXfd5Pn

/r/aww is protesting by only allowing content featuring John Oliver, [as voted by the community.](https://www.reddit.com/r/aww/comments/14bt0c1/poll_decide_on_the_future_of_raww/)  If this post does not include John Oliver, please report it.  More information [here.](https://www.reddit.com/r/aww/comments/14cgp6d/henceforth_raww_will_only_feature_john_oliver/)


*I am a bot, and this action was performed automatically. Please [contact the moderators of this subreddit](/message/compose/?to=/r/aww) if you have any questions or concerns.*",1,2023-06-27 17:01:53,<praw.models.comment_forest.CommentForest object at 0x000002547AD09E50>,14kj6xi,aww,t5_2qh1o,moderator,False,False,t3_14kj6xi,t3_14kj6xi,/r/aww/comments/14kj6xi/calm_down_big_boy_dont_be_angry_at_john_oliver_oc/jpqrdjs/
69,fk92rnz,2wheelsor911,"Seriously, I’ve seen three “...with my X karma...” posts in the last 60 seconds - this is the only one that was worth the upvote! Well done!!","Seriously, I’ve seen three “...with my X karma...” posts in the last 60 seconds - this is the only one that was worth the upvote! Well done!!",8,2020-03-11 22:59:07,<praw.models.comment_forest.CommentForest object at 0x000002547AD23760>,fh5zyx,aww,t5_2qh1o,,False,False,t3_fh5zyx,t3_fh5zyx,/r/aww/comments/fh5zyx/after_65_years_of_being_on_reddit_with_4_karma/fk92rnz/
