,ID,Author,body,Comment,Score,Created On,Replies,Submission,Subreddit,Subreddit_ID,Distinguished,Edited,Is_submitter,link_id,Parent_id,Permalink
131,fi0t79w,HouseCravenRaw,"I am not a black man, so my opinion is going to be the Reddit Special: ""I am not an X but...""

I think that you would experience significant push-back against ""White <plural-gender> are Awesome"" shirts, and likely be lumped in with racists/supremacists.

The words used are correct in both cases.  Race doesn't make someone awesome, so a White Men are Awesome shirt should be logically as valid as a Black Men are Awesome shirt.

However that ignores the context of the message and only focuses on the technicalities.

The *context* of the message is clear: a group that has faced significant oppression is making a statement that *shouldn't* be inflammatory or extraordinary, but is.  Saying ""black <plural-gender> are awesome"" *should* be about as interesting as ""Hats are awesome"".  And yet, that isn't the case.  People of color are often vilified and marginalized, necessitating some form of push back just to reach equality.  This shirt says ""Black <plural-gender> are awesome"" but it means ""black people are not less valuable than white people"".

This is the same story with Straight Pride or Blue Lives Matters.  These are pushing for groups that already have the majority of the power.  They are only pushing back against those pushing for equality.  That of course means they are pushing to maintain or increase the inequality that they gain privilege from.

The observation that no one is making is that these shirts aren't exclusionary - they don't say ""Black <plural gender> are the Only Awesome ones"".  These shirts would be unchanged if they appended the word ""too"" to the end.  ""Black Women are Awesome too"".   However that doesn't look as good, it sounds weaker and is unnecessary.  White women can be awesome.  Black women can be awesome.  These shirts don't say that only one of these options are allowed to be awesome.

And while that may cause someone to say ""you are right!  It isn't an exclusionary statement, therefore having the White version is also acceptable!"" ignores the previous portion where I identified that the context of the message was the important part, not just the words themselves.

These shirts would be super weird if they were worn by black people in a country where black people were the majority and the laws were predominately in their favor.","I am not a black man, so my opinion is going to be the Reddit Special: ""I am not an X but...""

I think that you would experience significant push-back against ""White <plural-gender> are Awesome"" shirts, and likely be lumped in with racists/supremacists.

The words used are correct in both cases.  Race doesn't make someone awesome, so a White Men are Awesome shirt should be logically as valid as a Black Men are Awesome shirt.

However that ignores the context of the message and only focuses on the technicalities.

The *context* of the message is clear: a group that has faced significant oppression is making a statement that *shouldn't* be inflammatory or extraordinary, but is.  Saying ""black <plural-gender> are awesome"" *should* be about as interesting as ""Hats are awesome"".  And yet, that isn't the case.  People of color are often vilified and marginalized, necessitating some form of push back just to reach equality.  This shirt says ""Black <plural-gender> are awesome"" but it means ""black people are not less valuable than white people"".

This is the same story with Straight Pride or Blue Lives Matters.  These are pushing for groups that already have the majority of the power.  They are only pushing back against those pushing for equality.  That of course means they are pushing to maintain or increase the inequality that they gain privilege from.

The observation that no one is making is that these shirts aren't exclusionary - they don't say ""Black <plural gender> are the Only Awesome ones"".  These shirts would be unchanged if they appended the word ""too"" to the end.  ""Black Women are Awesome too"".   However that doesn't look as good, it sounds weaker and is unnecessary.  White women can be awesome.  Black women can be awesome.  These shirts don't say that only one of these options are allowed to be awesome.

And while that may cause someone to say ""you are right!  It isn't an exclusionary statement, therefore having the White version is also acceptable!"" ignores the previous portion where I identified that the context of the message was the important part, not just the words themselves.

These shirts would be super weird if they were worn by black people in a country where black people were the majority and the laws were predominately in their favor.",90,2020-02-18 16:44:41,<praw.models.comment_forest.CommentForest object at 0x000002547ADDADF0>,f5swgb,aww,t5_2qh1o,,False,False,t3_f5swgb,t1_fi0pcno,/r/aww/comments/f5swgb/my_amazing_family/fi0t79w/
132,fi0ptcl,big-pounder,Well said,Well said,37,2020-02-18 16:11:39,<praw.models.comment_forest.CommentForest object at 0x000002547ADDC4F0>,f5swgb,aww,t5_2qh1o,,False,False,t3_f5swgb,t1_fi0pcno,/r/aww/comments/f5swgb/my_amazing_family/fi0ptcl/
133,fietrxk,Kazeshio,"Okay, constructive reply

In theory theres absolutely nothing wrong with it; it's just in practice, ""white pride"" has been, and still is being, tarnished by racists who use ""white pride"" as their phrase for ""White's are better.""

When a black family does it, they say ""we're not subhuman."" Nobody told white people they're subhuman; nobody with the power to take away their ability to refute it, anyway.


My dad is in the KKK (I've long since left the house) and my SO is mixed Native and Black.","Okay, constructive reply

In theory theres absolutely nothing wrong with it; it's just in practice, ""white pride"" has been, and still is being, tarnished by racists who use ""white pride"" as their phrase for ""White's are better.""

When a black family does it, they say ""we're not subhuman."" Nobody told white people they're subhuman; nobody with the power to take away their ability to refute it, anyway.


My dad is in the KKK (I've long since left the house) and my SO is mixed Native and Black.",5,2020-02-22 14:41:04,<praw.models.comment_forest.CommentForest object at 0x000002547ADDCBB0>,f5swgb,aww,t5_2qh1o,,False,False,t3_f5swgb,t1_fi0pcno,/r/aww/comments/f5swgb/my_amazing_family/fietrxk/
134,fi0ql7a,zylophom,Was wondering the same.,Was wondering the same.,11,2020-02-18 16:19:17,<praw.models.comment_forest.CommentForest object at 0x000002547ADDCC10>,f5swgb,aww,t5_2qh1o,,False,False,t3_f5swgb,t1_fi0pcno,/r/aww/comments/f5swgb/my_amazing_family/fi0ql7a/
135,fi0yz6t,BigAtun,"I'm Italian-American. Do you have any idea how many shirts, flags, etc that resemble and sometimes blatantly call out my pride? Ever seen shirts that say kiss me I'm irish not being worn on st. Patty's day? White people do it all the time, we just call attention to our individual ethnicities. You know what you don't see though? WASP pride. Why? Well it's because they've aided in the oppression of every single ethnic group that's stepped foot in this country. Italians, Irish, Polish, and Germans were all treated pretty poorly and some were even lynched. Blacks, Asians, Jews, and Hispanics/Latinos have gotten it the worst because it's harder to whitewash them. WASPs had a tough voyage here, had a helluva time stealing the land from the natives, and then went to war against their own race for control of the country and freedom from taxation and British oppression. Then they set up the country whilst still fighting natives and then...they fought themselves again. And the whole time they did it, they were building the country on the backs of blacks, irish, and asians. Systemic racism is still very much alive today and the reason why it's okay for black people to wear shirts that say shit like this, is because they actually have oppression to overcome, white people just arent used to being equals with everyone, so it seems like to them that the minorities are rising above them.","I'm Italian-American. Do you have any idea how many shirts, flags, etc that resemble and sometimes blatantly call out my pride? Ever seen shirts that say kiss me I'm irish not being worn on st. Patty's day? White people do it all the time, we just call attention to our individual ethnicities. You know what you don't see though? WASP pride. Why? Well it's because they've aided in the oppression of every single ethnic group that's stepped foot in this country. Italians, Irish, Polish, and Germans were all treated pretty poorly and some were even lynched. Blacks, Asians, Jews, and Hispanics/Latinos have gotten it the worst because it's harder to whitewash them. WASPs had a tough voyage here, had a helluva time stealing the land from the natives, and then went to war against their own race for control of the country and freedom from taxation and British oppression. Then they set up the country whilst still fighting natives and then...they fought themselves again. And the whole time they did it, they were building the country on the backs of blacks, irish, and asians. Systemic racism is still very much alive today and the reason why it's okay for black people to wear shirts that say shit like this, is because they actually have oppression to overcome, white people just arent used to being equals with everyone, so it seems like to them that the minorities are rising above them.",15,2020-02-18 17:37:47,<praw.models.comment_forest.CommentForest object at 0x000002547ADDCC70>,f5swgb,aww,t5_2qh1o,,False,False,t3_f5swgb,t1_fi0pcno,/r/aww/comments/f5swgb/my_amazing_family/fi0yz6t/
136,fi283ei,EktarPross,"The argument against this usually comes down to black people being a marginalized group, and black pride being a fight back against power, where as white ""pride"" has historically been a front for racism.

I used to think this wss bullshit, and I still sorta do, but I get where it comes from.","The argument against this usually comes down to black people being a marginalized group, and black pride being a fight back against power, where as white ""pride"" has historically been a front for racism.

I used to think this wss bullshit, and I still sorta do, but I get where it comes from.",4,2020-02-19 00:54:06,<praw.models.comment_forest.CommentForest object at 0x000002547ADDCCD0>,f5swgb,aww,t5_2qh1o,,False,False,t3_f5swgb,t1_fi0pcno,/r/aww/comments/f5swgb/my_amazing_family/fi283ei/
137,fio0l6h,iheartcrack666,"I think their shirts are justified because of the whole history of slavery, segregation and oppression if black people in the United States. I mean, it was just 65 years ago that black people were legally not allowed to use white people restrooms. If that all happened to white americans then a white man wearing a White People Are Dope shirt wouldn't be seen as white supremacist.","I think their shirts are justified because of the whole history of slavery, segregation and oppression if black people in the United States. I mean, it was just 65 years ago that black people were legally not allowed to use white people restrooms. If that all happened to white americans then a white man wearing a White People Are Dope shirt wouldn't be seen as white supremacist.",2,2020-02-24 19:52:27,<praw.models.comment_forest.CommentForest object at 0x000002547ADDCD90>,f5swgb,aww,t5_2qh1o,,False,False,t3_f5swgb,t1_fi0pcno,/r/aww/comments/f5swgb/my_amazing_family/fio0l6h/
138,fiv95rd,villain75,"If white people were considered less than human for centuries, and are only now starting to feel equal enough to proclaim that they can be great, then I don't think anybody would have a problem with them being outwardly proud.","If white people were considered less than human for centuries, and are only now starting to feel equal enough to proclaim that they can be great, then I don't think anybody would have a problem with them being outwardly proud.",2,2020-02-26 22:29:41,<praw.models.comment_forest.CommentForest object at 0x000002547ADDCF70>,f5swgb,aww,t5_2qh1o,,False,False,t3_f5swgb,t1_fi0pcno,/r/aww/comments/f5swgb/my_amazing_family/fiv95rd/
139,fi1asbo,,It would be game over,It would be game over,4,2020-02-18 19:27:20,<praw.models.comment_forest.CommentForest object at 0x000002547ADDCFD0>,f5swgb,aww,t5_2qh1o,,False,False,t3_f5swgb,t1_fi0pcno,/r/aww/comments/f5swgb/my_amazing_family/fi1asbo/
140,fi0qpmb,JimGerm,Very telling OP hasn't responded.,Very telling OP hasn't responded.,9,2020-02-18 16:20:30,<praw.models.comment_forest.CommentForest object at 0x000002547ADE0070>,f5swgb,aww,t5_2qh1o,,False,False,t3_f5swgb,t1_fi0pcno,/r/aww/comments/f5swgb/my_amazing_family/fi0qpmb/
141,fi9gog7,battlefrisk,"I think if a white persona did it, I’d assuming their celebrating their genetics which... seems not ok for some reason. Black is its own culture. So I’d think of it more like if someone was in all green saying their Irish heritage made them dope.","I think if a white persona did it, I’d assuming their celebrating their genetics which... seems not ok for some reason. Black is its own culture. So I’d think of it more like if someone was in all green saying their Irish heritage made them dope.",1,2020-02-21 06:07:23,<praw.models.comment_forest.CommentForest object at 0x000002547ADE00D0>,f5swgb,aww,t5_2qh1o,,False,False,t3_f5swgb,t1_fi0pcno,/r/aww/comments/f5swgb/my_amazing_family/fi9gog7/
142,fi0t1tq,Ayrnas,Same for gay pride and straight people.,Same for gay pride and straight people.,2,2020-02-18 16:43:13,<praw.models.comment_forest.CommentForest object at 0x000002547ADE0190>,f5swgb,aww,t5_2qh1o,,False,False,t3_f5swgb,t1_fi0pcno,/r/aww/comments/f5swgb/my_amazing_family/fi0t1tq/
143,fi0quql,,[removed],[removed],-31,2020-02-18 16:21:54,<praw.models.comment_forest.CommentForest object at 0x000002547ADE0250>,f5swgb,aww,t5_2qh1o,,1582043519.0,False,t3_f5swgb,t1_fi0pcno,/r/aww/comments/f5swgb/my_amazing_family/fi0quql/
144,fi0qp73,MeepleMan1,What he (or she) said,What he (or she) said,-9,2020-02-18 16:20:23,<praw.models.comment_forest.CommentForest object at 0x000002547ADE0310>,f5swgb,aww,t5_2qh1o,,False,False,t3_f5swgb,t1_fi0pcno,/r/aww/comments/f5swgb/my_amazing_family/fi0qp73/
145,fi0seh2,,[removed],[removed],-33,2020-02-18 16:36:58,<praw.models.comment_forest.CommentForest object at 0x000002547ADE03D0>,f5swgb,aww,t5_2qh1o,,False,False,t3_f5swgb,t1_fi0pcno,/r/aww/comments/f5swgb/my_amazing_family/fi0seh2/
146,fi2ftwy,6BlackKidsAndAWife,"Firstly, in my experience, When people see a beautiful family, they sometimes say, “aww, what a beautiful family”

Secondly, Why not? It was approved by whoever runs this thread. 

Thirdly, Why do you care? You put effort into responding to something you didn’t have to. If you’re not with it, give it an arrow down or, better yet, don’t respond.","Firstly, in my experience, When people see a beautiful family, they sometimes say, “aww, what a beautiful family”

Secondly, Why not? It was approved by whoever runs this thread. 

Thirdly, Why do you care? You put effort into responding to something you didn’t have to. If you’re not with it, give it an arrow down or, better yet, don’t respond.",-1,2020-02-19 02:19:40,<praw.models.comment_forest.CommentForest object at 0x000002547ADE0550>,f5swgb,aww,t5_2qh1o,,False,True,t3_f5swgb,t1_fi0qjsc,/r/aww/comments/f5swgb/my_amazing_family/fi2ftwy/
147,fi0ij1z,6BlackKidsAndAWife,"LOL, that's the usual response!","LOL, that's the usual response!",16,2020-02-18 14:56:21,<praw.models.comment_forest.CommentForest object at 0x000002547ADE0670>,f5swgb,aww,t5_2qh1o,,False,True,t3_f5swgb,t1_fi0ic9y,/r/aww/comments/f5swgb/my_amazing_family/fi0ij1z/
148,fi21n5i,6BlackKidsAndAWife,"Says you? I happen to work with, teach, and share family with some dope white people","Says you? I happen to work with, teach, and share family with some dope white people",2,2020-02-18 23:43:46,<praw.models.comment_forest.CommentForest object at 0x000002547ADE0850>,f5swgb,aww,t5_2qh1o,,False,True,t3_f5swgb,t1_fi1ze5j,/r/aww/comments/f5swgb/my_amazing_family/fi21n5i/
149,fi0r1xe,6BlackKidsAndAWife,"I'm just trying to instill a sense of self love and empowerment in my kids. Society, as a norm, doesn't always show black girls and boys in the most positive of lights so it's my job as their father to let them know that they are beautiful, dope, seen, valued, treasured, important, loved. 

Yes, you're correct, we do want to be treated equally but the truth of the matter is, we aren't. Are you familiar with how blacks have been treated in this country? We're not ashamed to be set apart because we're black. Whether you judge people based on their color, or not, does not negate the fact that color exists. 

When you don't see people who look like you on TV and in magazines and when you don't see any dolls that look like you on the shelves and when you see how the wealth and privilege of this country is distributed, one may begin to think that they don't matter. 

I appreciate your curiosity and respectful question. Being that you're white, you wouldn't understand our perspective. 

By the way, White Boys are Dope!","I'm just trying to instill a sense of self love and empowerment in my kids. Society, as a norm, doesn't always show black girls and boys in the most positive of lights so it's my job as their father to let them know that they are beautiful, dope, seen, valued, treasured, important, loved. 

Yes, you're correct, we do want to be treated equally but the truth of the matter is, we aren't. Are you familiar with how blacks have been treated in this country? We're not ashamed to be set apart because we're black. Whether you judge people based on their color, or not, does not negate the fact that color exists. 

When you don't see people who look like you on TV and in magazines and when you don't see any dolls that look like you on the shelves and when you see how the wealth and privilege of this country is distributed, one may begin to think that they don't matter. 

I appreciate your curiosity and respectful question. Being that you're white, you wouldn't understand our perspective. 

By the way, White Boys are Dope!",33,2020-02-18 16:23:51,<praw.models.comment_forest.CommentForest object at 0x000002547ADE0970>,f5swgb,aww,t5_2qh1o,,False,True,t3_f5swgb,t1_fi0pijs,/r/aww/comments/f5swgb/my_amazing_family/fi0r1xe/
150,fi21jaq,,[removed],[removed],1,2020-02-18 23:42:38,<praw.models.comment_forest.CommentForest object at 0x000002547ADE24F0>,f5swgb,aww,t5_2qh1o,,False,False,t3_f5swgb,t1_fi1yuh3,/r/aww/comments/f5swgb/my_amazing_family/fi21jaq/
151,fi0pn9r,,[removed],[removed],35,2020-02-18 16:09:59,<praw.models.comment_forest.CommentForest object at 0x000002547ADE2910>,f5swgb,aww,t5_2qh1o,,False,False,t3_f5swgb,t1_fi0pf8t,/r/aww/comments/f5swgb/my_amazing_family/fi0pn9r/
152,fi0t2yi,,[removed],[removed],8,2020-02-18 16:43:32,<praw.models.comment_forest.CommentForest object at 0x000002547ADE2970>,f5swgb,aww,t5_2qh1o,,False,False,t3_f5swgb,t1_fi0pf8t,/r/aww/comments/f5swgb/my_amazing_family/fi0t2yi/
153,fi14fck,,[removed],[removed],6,2020-02-18 18:26:52,<praw.models.comment_forest.CommentForest object at 0x000002547ADE2A30>,f5swgb,aww,t5_2qh1o,,False,False,t3_f5swgb,t1_fi0pf8t,/r/aww/comments/f5swgb/my_amazing_family/fi14fck/
154,fi19o3n,,[removed],[removed],0,2020-02-18 19:16:45,<praw.models.comment_forest.CommentForest object at 0x000002547ADE2D90>,f5swgb,aww,t5_2qh1o,,False,False,t3_f5swgb,t1_fi0pf8t,/r/aww/comments/f5swgb/my_amazing_family/fi19o3n/
155,fi19mw3,6BlackKidsAndAWife,LOL We try to mix it up and support each other. We gotta uplift our women because they lift us up.,LOL We try to mix it up and support each other. We gotta uplift our women because they lift us up.,6,2020-02-18 19:16:26,<praw.models.comment_forest.CommentForest object at 0x000002547ADE45B0>,f5swgb,aww,t5_2qh1o,,False,True,t3_f5swgb,t1_fi0qsg3,/r/aww/comments/f5swgb/my_amazing_family/fi19mw3/
156,fi1al5g,6BlackKidsAndAWife,We do have one. Don't know the brand name but we have one.,We do have one. Don't know the brand name but we have one.,3,2020-02-18 19:25:29,<praw.models.comment_forest.CommentForest object at 0x000002547ADE46D0>,f5swgb,aww,t5_2qh1o,,False,True,t3_f5swgb,t1_fi184rz,/r/aww/comments/f5swgb/my_amazing_family/fi1al5g/
157,fi1dwsk,6BlackKidsAndAWife,it's a factual statement,it's a factual statement,2,2020-02-18 19:56:49,<praw.models.comment_forest.CommentForest object at 0x000002547ADE4790>,f5swgb,aww,t5_2qh1o,,False,True,t3_f5swgb,t1_fi1dk1l,/r/aww/comments/f5swgb/my_amazing_family/fi1dwsk/
158,fi3t79f,6BlackKidsAndAWife,"cool, valued, beautiful, neat, interesting, nice, tubular, awesome, unique, hot... get it?","cool, valued, beautiful, neat, interesting, nice, tubular, awesome, unique, hot... get it?",1,2020-02-19 15:45:36,<praw.models.comment_forest.CommentForest object at 0x000002547ADE4850>,f5swgb,aww,t5_2qh1o,,False,True,t3_f5swgb,t1_fi3szxz,/r/aww/comments/f5swgb/my_amazing_family/fi3t79f/
159,fi0imjp,6BlackKidsAndAWife,LOL! She can sleep when we're 90.,LOL! She can sleep when we're 90.,10,2020-02-18 14:57:25,<praw.models.comment_forest.CommentForest object at 0x000002547ADE4970>,f5swgb,aww,t5_2qh1o,,False,True,t3_f5swgb,t1_fi0i94f,/r/aww/comments/f5swgb/my_amazing_family/fi0imjp/
160,fi21g43,,[removed],[removed],2,2020-02-18 23:41:43,<praw.models.comment_forest.CommentForest object at 0x000002547ADE4B50>,f5swgb,aww,t5_2qh1o,,False,False,t3_f5swgb,t1_fi1y7sv,/r/aww/comments/f5swgb/my_amazing_family/fi21g43/
161,fi19dx8,6BlackKidsAndAWife,Thank you man! Twins?! I couldn't! I'm a one-at-a-time kinda guy! How old are your babies? How long you been married?,Thank you man! Twins?! I couldn't! I'm a one-at-a-time kinda guy! How old are your babies? How long you been married?,2,2020-02-18 19:14:04,<praw.models.comment_forest.CommentForest object at 0x000002547ADE4C70>,f5swgb,aww,t5_2qh1o,,False,True,t3_f5swgb,t1_fi0ov4w,/r/aww/comments/f5swgb/my_amazing_family/fi19dx8/
162,fi15bie,,[removed],[removed],0,2020-02-18 18:35:30,<praw.models.comment_forest.CommentForest object at 0x000002547ADE4E50>,f5swgb,aww,t5_2qh1o,,False,False,t3_f5swgb,t1_fi0sa5k,/r/aww/comments/f5swgb/my_amazing_family/fi15bie/
163,fi0nv2n,6BlackKidsAndAWife,It does take some getting used to and it requires a lot of work but it's doable with the right partner and support system.,It does take some getting used to and it requires a lot of work but it's doable with the right partner and support system.,11,2020-02-18 15:52:19,<praw.models.comment_forest.CommentForest object at 0x000002547ADE4F10>,f5swgb,aww,t5_2qh1o,,False,True,t3_f5swgb,t1_fi0krt2,/r/aww/comments/f5swgb/my_amazing_family/fi0nv2n/
164,fi0s5lx,,Imagine six kids under three /s,Imagine six kids under three /s,2,2020-02-18 16:34:36,<praw.models.comment_forest.CommentForest object at 0x000002547ADE4F70>,f5swgb,aww,t5_2qh1o,,False,False,t3_f5swgb,t1_fi0krt2,/r/aww/comments/f5swgb/my_amazing_family/fi0s5lx/
165,fi19hge,,[removed],[removed],5,2020-02-18 19:14:59,<praw.models.comment_forest.CommentForest object at 0x000002547ADE70D0>,f5swgb,aww,t5_2qh1o,,False,False,t3_f5swgb,t1_fi0u8v9,/r/aww/comments/f5swgb/my_amazing_family/fi19hge/
166,fi0nw7m,6BlackKidsAndAWife,Thank you! God bless.,Thank you! God bless.,11,2020-02-18 15:52:38,<praw.models.comment_forest.CommentForest object at 0x000002547ADE7190>,f5swgb,aww,t5_2qh1o,,False,True,t3_f5swgb,t1_fi0knt1,/r/aww/comments/f5swgb/my_amazing_family/fi0nw7m/
167,fi0nmpy,6BlackKidsAndAWife,thank you so much!,thank you so much!,9,2020-02-18 15:50:02,<praw.models.comment_forest.CommentForest object at 0x000002547ADE7250>,f5swgb,aww,t5_2qh1o,,False,True,t3_f5swgb,t1_fi0j00s,/r/aww/comments/f5swgb/my_amazing_family/fi0nmpy/
168,fi9wpaj,FeltMtn,Would you say the same thing if a white family did this?,Would you say the same thing if a white family did this?,2,2020-02-21 11:47:27,<praw.models.comment_forest.CommentForest object at 0x000002547ADE7310>,f5swgb,aww,t5_2qh1o,,False,False,t3_f5swgb,t1_fi0rjzi,/r/aww/comments/f5swgb/my_amazing_family/fi9wpaj/
169,fi15bro,,[removed],[removed],20,2020-02-18 18:35:34,<praw.models.comment_forest.CommentForest object at 0x000002547ADE73D0>,f5swgb,aww,t5_2qh1o,,False,False,t3_f5swgb,t1_fi0v0m2,/r/aww/comments/f5swgb/my_amazing_family/fi15bro/
170,fi18gk2,grannysmudflaps,"They are sick people..

They don't want to see color, but its *exactly* what they see first..

Live your life with your beautiful family, bro..

You do *not* need acceptance from sensitive ""why can't i do it too"" types..they'll never get it and so what if they do or don't..

Life will go on!","They are sick people..

They don't want to see color, but its *exactly* what they see first..

Live your life with your beautiful family, bro..

You do *not* need acceptance from sensitive ""why can't i do it too"" types..they'll never get it and so what if they do or don't..

Life will go on!",-2,2020-02-18 19:05:12,<praw.models.comment_forest.CommentForest object at 0x000002547ADE7430>,f5swgb,aww,t5_2qh1o,,False,False,t3_f5swgb,t1_fi0v0m2,/r/aww/comments/f5swgb/my_amazing_family/fi18gk2/
171,fi0nqjk,,[removed],[removed],9,2020-02-18 15:51:05,<praw.models.comment_forest.CommentForest object at 0x000002547ADE76D0>,f5swgb,aww,t5_2qh1o,,False,False,t3_f5swgb,t1_fi0mipk,/r/aww/comments/f5swgb/my_amazing_family/fi0nqjk/
172,fi28hd9,,[removed],[removed],1,2020-02-19 00:58:26,<praw.models.comment_forest.CommentForest object at 0x000002547ADE78B0>,f5swgb,aww,t5_2qh1o,,False,False,t3_f5swgb,t1_fi27z3f,/r/aww/comments/f5swgb/my_amazing_family/fi28hd9/
