,ID,Author,body,Comment,Score,Created On,Replies,Submission,Subreddit,Subreddit_ID,Distinguished,Edited,Is_submitter,link_id,Parent_id,Permalink
233,fi1e69g,terminally_cheap,"Personally I don't celebrate having white skin. I celebrate traditions of my various European ancestors - mainly in their delicious foods, to be honest. Most other ethnicities have experienced some form of colonialism or oppression by people with white skin, so find something else to be proud of. I personally haven't oppressed anyone, but I accept that people that look like me have, and still are.","Personally I don't celebrate having white skin. I celebrate traditions of my various European ancestors - mainly in their delicious foods, to be honest. Most other ethnicities have experienced some form of colonialism or oppression by people with white skin, so find something else to be proud of. I personally haven't oppressed anyone, but I accept that people that look like me have, and still are.",0,2020-02-18 19:59:20,<praw.models.comment_forest.CommentForest object at 0x000002547ADDC220>,f5swgb,aww,t5_2qh1o,,False,False,t3_f5swgb,t1_fi0tev6,/r/aww/comments/f5swgb/my_amazing_family/fi1e69g/
234,fi0slin,,"Would you consider a white family wearing matching t-shirts saying ""white pride"" to have no racial undertones?","Would you consider a white family wearing matching t-shirts saying ""white pride"" to have no racial undertones?",15,2020-02-18 16:38:51,<praw.models.comment_forest.CommentForest object at 0x000002547ADDC460>,f5swgb,aww,t5_2qh1o,,1582044256.0,False,t3_f5swgb,t1_fi0rakf,/r/aww/comments/f5swgb/my_amazing_family/fi0slin/
235,fi0tld7,Press-A,"Yes, but i don't think any white person would actually make a picture like this and post it with pride without something being wrong in their head and using a username specifying their white skin colour. 


Any white person showing any pride of their skin colour is branded a racist, but if a black person does it it's celebrated. 

I'm not from America, and I know things might be fucked up there.. but if I was walking down town and I'd see a group of black people wear a shirt like this I'd feel very uncomfortable.","Yes, but i don't think any white person would actually make a picture like this and post it with pride without something being wrong in their head and using a username specifying their white skin colour. 


Any white person showing any pride of their skin colour is branded a racist, but if a black person does it it's celebrated. 

I'm not from America, and I know things might be fucked up there.. but if I was walking down town and I'd see a group of black people wear a shirt like this I'd feel very uncomfortable.",23,2020-02-18 16:48:29,<praw.models.comment_forest.CommentForest object at 0x000002547ADDC5B0>,f5swgb,aww,t5_2qh1o,,False,False,t3_f5swgb,t1_fi0szbo,/r/aww/comments/f5swgb/my_amazing_family/fi0tld7/
236,fi15md3,HouseCravenRaw,You are welcome.,You are welcome.,2,2020-02-18 18:38:22,<praw.models.comment_forest.CommentForest object at 0x000002547ADDC970>,f5swgb,aww,t5_2qh1o,,False,False,t3_f5swgb,t1_fi14ws3,/r/aww/comments/f5swgb/my_amazing_family/fi15md3/
237,fi15l3j,HouseCravenRaw,Thank you.,Thank you.,-1,2020-02-18 18:38:02,<praw.models.comment_forest.CommentForest object at 0x000002547ADDCA90>,f5swgb,aww,t5_2qh1o,,False,False,t3_f5swgb,t1_fi11osv,/r/aww/comments/f5swgb/my_amazing_family/fi15l3j/
238,fi1rgya,BigAtun,"Ya, but the internet ya know. I feel you shouldn't have to defend posting something as harmless as this...but
..the internet ya know.","Ya, but the internet ya know. I feel you shouldn't have to defend posting something as harmless as this...but
..the internet ya know.",1,2020-02-18 22:01:58,<praw.models.comment_forest.CommentForest object at 0x000002547ADDCDF0>,f5swgb,aww,t5_2qh1o,,False,False,t3_f5swgb,t1_fi189ql,/r/aww/comments/f5swgb/my_amazing_family/fi1rgya/
239,fi21vjh,,[removed],[removed],0,2020-02-18 23:46:18,<praw.models.comment_forest.CommentForest object at 0x000002547ADDCE50>,f5swgb,aww,t5_2qh1o,,False,False,t3_f5swgb,t1_fi189ql,/r/aww/comments/f5swgb/my_amazing_family/fi21vjh/
240,fi6j809,FeltMtn,What does your skin color have anything to do with your family members being awesome? Don't you think it's a bit reductive to think of it this way?,What does your skin color have anything to do with your family members being awesome? Don't you think it's a bit reductive to think of it this way?,2,2020-02-20 11:16:51,<praw.models.comment_forest.CommentForest object at 0x000002547ADE01F0>,f5swgb,aww,t5_2qh1o,,False,False,t3_f5swgb,t1_fi1820e,/r/aww/comments/f5swgb/my_amazing_family/fi6j809/
241,fi0uqxi,,[removed],[removed],-5,2020-02-18 16:59:36,<praw.models.comment_forest.CommentForest object at 0x000002547ADE0430>,f5swgb,aww,t5_2qh1o,,False,False,t3_f5swgb,t1_fi0tqvk,/r/aww/comments/f5swgb/my_amazing_family/fi0uqxi/
242,fi0o2qf,6BlackKidsAndAWife,"a lot of prayer and hard work but it's the most fulfilling job I have, next to being a husband.","a lot of prayer and hard work but it's the most fulfilling job I have, next to being a husband.",6,2020-02-18 15:54:28,<praw.models.comment_forest.CommentForest object at 0x000002547ADE07F0>,f5swgb,aww,t5_2qh1o,,False,True,t3_f5swgb,t1_fi0ilws,/r/aww/comments/f5swgb/my_amazing_family/fi0o2qf/
243,fi2f31s,Lilmaggot,You are a well- spoken 21 year old. My hope for the future is a little brighter after reading your eloquent comment.,You are a well- spoken 21 year old. My hope for the future is a little brighter after reading your eloquent comment.,10,2020-02-19 02:11:26,<praw.models.comment_forest.CommentForest object at 0x000002547ADE0AF0>,f5swgb,aww,t5_2qh1o,,False,False,t3_f5swgb,t1_fi0uvfx,/r/aww/comments/f5swgb/my_amazing_family/fi2f31s/
244,fivfccy,villain75,"While you have some points here, I think the fact that for almost half of your life we had a Black President, and that the efforts to improve Black lives have been paying off well.  You didn't live through the 80s or 90s.  I think if you saw how the media treated Black people, and the level of racial stereotypes we had to fight through, you wouldn't have a problem with this.  

Black people have been maligned in the media for centuries. We're still the butt of ALL the 'absent father' jokes, we're still constantly called 'ghetto' or 'thugs' for no real reason, we're still considered dangerous or criminal, people still believe we don't care about school and we drop out and join gangs, or live off of welfare having 5 kids by age 20 just for the check...

This beautiful intact family is one of many positive images of what most of us represent, but you can tell by the comments here and elsewhere people don't accept this.  This is why we have to affirm ourselves.","While you have some points here, I think the fact that for almost half of your life we had a Black President, and that the efforts to improve Black lives have been paying off well.  You didn't live through the 80s or 90s.  I think if you saw how the media treated Black people, and the level of racial stereotypes we had to fight through, you wouldn't have a problem with this.  

Black people have been maligned in the media for centuries. We're still the butt of ALL the 'absent father' jokes, we're still constantly called 'ghetto' or 'thugs' for no real reason, we're still considered dangerous or criminal, people still believe we don't care about school and we drop out and join gangs, or live off of welfare having 5 kids by age 20 just for the check...

This beautiful intact family is one of many positive images of what most of us represent, but you can tell by the comments here and elsewhere people don't accept this.  This is why we have to affirm ourselves.",1,2020-02-26 23:21:58,<praw.models.comment_forest.CommentForest object at 0x000002547ADE0B50>,f5swgb,aww,t5_2qh1o,,False,False,t3_f5swgb,t1_fi0uvfx,/r/aww/comments/f5swgb/my_amazing_family/fivfccy/
245,fi1mf12,6BlackKidsAndAWife,What white Americans have faced racial discrimination?,What white Americans have faced racial discrimination?,-7,2020-02-18 21:16:16,<praw.models.comment_forest.CommentForest object at 0x000002547ADE0C70>,f5swgb,aww,t5_2qh1o,,False,True,t3_f5swgb,t1_fi1lc47,/r/aww/comments/f5swgb/my_amazing_family/fi1mf12/
246,fi0s9tl,treatyrself,"Exactly! It’s the same people who say “why not white history month??” After white people have been systematically oppressed for hundreds of years, then we can talk","Exactly! It’s the same people who say “why not white history month??” After white people have been systematically oppressed for hundreds of years, then we can talk",-2,2020-02-18 16:35:44,<praw.models.comment_forest.CommentForest object at 0x000002547ADE0D90>,f5swgb,aww,t5_2qh1o,,False,False,t3_f5swgb,t1_fi0rte3,/r/aww/comments/f5swgb/my_amazing_family/fi0s9tl/
247,fi16mq7,,"

With historical context, colonialism and other major historical events affects us all, not just one group. America is majority Christian because early settlers were Christian and wanted religious freedom (later on down the line). African slaves were stripped of their culture, they were forced to be religious and then they just passed it down. As the generations went by, any original culture slaves had from Africa was lost or modified to fit their American environment. Parents pass on their beliefs to their kids and the idea of god was (and still is To a lot of people) comforting. And since America was and still is majority Christian than most black people remained Christian, Whoever they worshipped beforehand is mostly lost. It’s been hundreds of years! 
A lot of black people today (myself included) don’t try to reconnect with their African roots because we’re so far removed from Africans. Any traditions the original slaves had were either lost or modified into something else (folk songs come to mine). My stepmom is from Kenya, she’s an actual African thus she has a greater connection to that culture. Most African Americans don’t because it’s been hundreds of years since our families have set foot in Africa. There have been some people who are able to trace their lines all the way back and that’s pretty cool ngl. 

Religion is an affect of colonialism and it never went away. That’s just how it is. If a black person knew that and decided to become agnostic than that’s their business. The entire black race doesn’t have to drop religion because of that fact, especially since it’s so engrained in *American* culture, not just black culture. 


-sincerely, a black agnostic (a choice I made for my own personal reasons, not because of history)","

With historical context, colonialism and other major historical events affects us all, not just one group. America is majority Christian because early settlers were Christian and wanted religious freedom (later on down the line). African slaves were stripped of their culture, they were forced to be religious and then they just passed it down. As the generations went by, any original culture slaves had from Africa was lost or modified to fit their American environment. Parents pass on their beliefs to their kids and the idea of god was (and still is To a lot of people) comforting. And since America was and still is majority Christian than most black people remained Christian, Whoever they worshipped beforehand is mostly lost. It’s been hundreds of years! 
A lot of black people today (myself included) don’t try to reconnect with their African roots because we’re so far removed from Africans. Any traditions the original slaves had were either lost or modified into something else (folk songs come to mine). My stepmom is from Kenya, she’s an actual African thus she has a greater connection to that culture. Most African Americans don’t because it’s been hundreds of years since our families have set foot in Africa. There have been some people who are able to trace their lines all the way back and that’s pretty cool ngl. 

Religion is an affect of colonialism and it never went away. That’s just how it is. If a black person knew that and decided to become agnostic than that’s their business. The entire black race doesn’t have to drop religion because of that fact, especially since it’s so engrained in *American* culture, not just black culture. 


-sincerely, a black agnostic (a choice I made for my own personal reasons, not because of history)",1,2020-02-18 18:47:50,<praw.models.comment_forest.CommentForest object at 0x000002547ADE0F10>,f5swgb,aww,t5_2qh1o,,False,False,t3_f5swgb,t1_fi0tbkj,/r/aww/comments/f5swgb/my_amazing_family/fi16mq7/
248,fi17vrx,grannysmudflaps,"For control, what other reason would it be? When you take *everything* from someone, their culture, their language, their customs and utterly debase and dehumanize them, what's left?

They controlled their minds and induced passivity, while at the same time, not following the book themselves.

How does one preach about ""salvation"" and ""redemption"" when earlier that day they just bought 2 human beings like cattle, split their family up and brought untold permanent heartache and damage to them just so they can have someone work *free* from sunup to sun down, while they sit on their asses all day and got money?

Religion IS an opiate of the masses and when you have nothing left to hold on to, you hold onto *hope*..

Even if that hope is given to you by your enemy..

Nat Turner didn't have that problem, tho..","For control, what other reason would it be? When you take *everything* from someone, their culture, their language, their customs and utterly debase and dehumanize them, what's left?

They controlled their minds and induced passivity, while at the same time, not following the book themselves.

How does one preach about ""salvation"" and ""redemption"" when earlier that day they just bought 2 human beings like cattle, split their family up and brought untold permanent heartache and damage to them just so they can have someone work *free* from sunup to sun down, while they sit on their asses all day and got money?

Religion IS an opiate of the masses and when you have nothing left to hold on to, you hold onto *hope*..

Even if that hope is given to you by your enemy..

Nat Turner didn't have that problem, tho..",-1,2020-02-18 18:59:40,<praw.models.comment_forest.CommentForest object at 0x000002547ADE0FD0>,f5swgb,aww,t5_2qh1o,,False,False,t3_f5swgb,t1_fi0tbkj,/r/aww/comments/f5swgb/my_amazing_family/fi17vrx/
249,fi3x0sa,6BlackKidsAndAWife,"You and your teammates are racists, which go against the rules. I didn't delete anything. You're going out of your way to say something hateful to me and I'm pathetic? LOL God loves you.","You and your teammates are racists, which go against the rules. I didn't delete anything. You're going out of your way to say something hateful to me and I'm pathetic? LOL God loves you.",0,2020-02-19 16:23:55,<praw.models.comment_forest.CommentForest object at 0x000002547ADE21F0>,f5swgb,aww,t5_2qh1o,,False,True,t3_f5swgb,t1_fi3wmyd,/r/aww/comments/f5swgb/my_amazing_family/fi3x0sa/
250,fi6pje3,6BlackKidsAndAWife,You hit the nail on the head. Most people commenting and complaining about a shirt aren’t that smart so they don’t get it,You hit the nail on the head. Most people commenting and complaining about a shirt aren’t that smart so they don’t get it,2,2020-02-20 13:04:42,<praw.models.comment_forest.CommentForest object at 0x000002547ADE2310>,f5swgb,aww,t5_2qh1o,,False,True,t3_f5swgb,t1_fi684gp,/r/aww/comments/f5swgb/my_amazing_family/fi6pje3/
251,fjdbjlg,6BlackKidsAndAWife,😂,😂,1,2020-03-03 15:38:29,<praw.models.comment_forest.CommentForest object at 0x000002547ADE2490>,f5swgb,aww,t5_2qh1o,,False,True,t3_f5swgb,t1_fjbfpft,/r/aww/comments/f5swgb/my_amazing_family/fjdbjlg/
252,fi0u6dr,6BlackKidsAndAWife,LOL but all black aren't athletes. Nice try though.,LOL but all black aren't athletes. Nice try though.,-1,2020-02-18 16:54:04,<praw.models.comment_forest.CommentForest object at 0x000002547ADE25B0>,f5swgb,aww,t5_2qh1o,,False,True,t3_f5swgb,t1_fi0t3n1,/r/aww/comments/f5swgb/my_amazing_family/fi0u6dr/
253,fi0r5cq,,[removed],[removed],7,2020-02-18 16:24:47,<praw.models.comment_forest.CommentForest object at 0x000002547ADE2A90>,f5swgb,aww,t5_2qh1o,,False,False,t3_f5swgb,t1_fi0qll4,/r/aww/comments/f5swgb/my_amazing_family/fi0r5cq/
254,fi1zi9u,,[removed],[removed],-5,2020-02-18 23:21:22,<praw.models.comment_forest.CommentForest object at 0x000002547ADE2AF0>,f5swgb,aww,t5_2qh1o,,False,False,t3_f5swgb,t1_fi0qll4,/r/aww/comments/f5swgb/my_amazing_family/fi1zi9u/
255,fi0x96o,,[removed],[removed],-19,2020-02-18 17:23:12,<praw.models.comment_forest.CommentForest object at 0x000002547ADE2CD0>,f5swgb,aww,t5_2qh1o,,False,False,t3_f5swgb,t1_fi0wjt3,/r/aww/comments/f5swgb/my_amazing_family/fi0x96o/
256,fi17u19,,[removed],[removed],-2,2020-02-18 18:59:12,<praw.models.comment_forest.CommentForest object at 0x000002547ADE2F10>,f5swgb,aww,t5_2qh1o,,False,False,t3_f5swgb,t1_fi151zj,/r/aww/comments/f5swgb/my_amazing_family/fi17u19/
257,fi1a6bw,,[removed],[removed],-4,2020-02-18 19:21:35,<praw.models.comment_forest.CommentForest object at 0x000002547ADE4370>,f5swgb,aww,t5_2qh1o,,False,False,t3_f5swgb,t1_fi19c7n,/r/aww/comments/f5swgb/my_amazing_family/fi1a6bw/
258,fi3x7bo,6BlackKidsAndAWife,yup,yup,1,2020-02-19 16:25:45,<praw.models.comment_forest.CommentForest object at 0x000002547ADE49D0>,f5swgb,aww,t5_2qh1o,,False,True,t3_f5swgb,t1_fi3v8wh,/r/aww/comments/f5swgb/my_amazing_family/fi3x7bo/
259,fi1dvo1,6BlackKidsAndAWife,God bless y'all! Thanks for sharing with me.,God bless y'all! Thanks for sharing with me.,1,2020-02-18 19:56:32,<praw.models.comment_forest.CommentForest object at 0x000002547ADE4DF0>,f5swgb,aww,t5_2qh1o,,False,True,t3_f5swgb,t1_fi1dlez,/r/aww/comments/f5swgb/my_amazing_family/fi1dvo1/
260,fi1dje9,,"Yes, but it also has pretty obvious undertones.","Yes, but it also has pretty obvious undertones.",7,2020-02-18 19:53:17,<praw.models.comment_forest.CommentForest object at 0x000002547ADE7550>,f5swgb,aww,t5_2qh1o,,False,False,t3_f5swgb,t1_fi174ey,/r/aww/comments/f5swgb/my_amazing_family/fi1dje9/
261,fi1z25c,grannysmudflaps,"Still hollering, hit dog? Lol","Still hollering, hit dog? Lol",-1,2020-02-18 23:16:38,<praw.models.comment_forest.CommentForest object at 0x000002547ADE7670>,f5swgb,aww,t5_2qh1o,,False,False,t3_f5swgb,t1_fi1wcr5,/r/aww/comments/f5swgb/my_amazing_family/fi1z25c/
262,fi1b3hj,grannysmudflaps,"They're not bothered by a shirt..

They're bothered by *truth* and what it stands for..

Hypocrites (and roaches) hate the light..

Shine on, brother! 🙏🏿","They're not bothered by a shirt..

They're bothered by *truth* and what it stands for..

Hypocrites (and roaches) hate the light..

Shine on, brother! 🙏🏿",-5,2020-02-18 19:30:14,<praw.models.comment_forest.CommentForest object at 0x000002547ADE7730>,f5swgb,aww,t5_2qh1o,,False,False,t3_f5swgb,t1_fi1aigm,/r/aww/comments/f5swgb/my_amazing_family/fi1b3hj/
263,fi2k751,6BlackKidsAndAWife,You’re so cool.,You’re so cool.,1,2020-02-19 03:08:01,<praw.models.comment_forest.CommentForest object at 0x000002547ADE9190>,f5swgb,aww,t5_2qh1o,,False,True,t3_f5swgb,t1_fi2hoix,/r/aww/comments/f5swgb/my_amazing_family/fi2k751/
264,fi0xd9l,,[removed],[removed],4,2020-02-18 17:24:10,<praw.models.comment_forest.CommentForest object at 0x000002547ADE9550>,f5swgb,aww,t5_2qh1o,,False,False,t3_f5swgb,t1_fi0xb1z,/r/aww/comments/f5swgb/my_amazing_family/fi0xd9l/
265,fi1j1bg,,[removed],[removed],-2,2020-02-18 20:45:22,<praw.models.comment_forest.CommentForest object at 0x000002547ADE9730>,f5swgb,aww,t5_2qh1o,,1582059238.0,False,t3_f5swgb,t1_fi1iyd7,/r/aww/comments/f5swgb/my_amazing_family/fi1j1bg/
266,fi25772,VelvetThunder11789,"Also not from America, but if white people celebrating themselves makes you uncomfortable, you're in the wrong, if black people celebrating themselves makes you uncomfortable, you're in the wrong.","Also not from America, but if white people celebrating themselves makes you uncomfortable, you're in the wrong, if black people celebrating themselves makes you uncomfortable, you're in the wrong.",1,2020-02-19 00:22:08,<praw.models.comment_forest.CommentForest object at 0x000002547ADDC6D0>,f5swgb,aww,t5_2qh1o,,False,False,t3_f5swgb,t1_fi0tld7,/r/aww/comments/f5swgb/my_amazing_family/fi25772/
267,fi0ws7g,,[removed],[removed],-8,2020-02-18 17:18:59,<praw.models.comment_forest.CommentForest object at 0x000002547ADDC730>,f5swgb,aww,t5_2qh1o,,1582046869.0,False,t3_f5swgb,t1_fi0tld7,/r/aww/comments/f5swgb/my_amazing_family/fi0ws7g/
268,fi1rkc9,6BlackKidsAndAWife,The friggin internet,The friggin internet,-2,2020-02-18 22:02:50,<praw.models.comment_forest.CommentForest object at 0x000002547ADDCEB0>,f5swgb,aww,t5_2qh1o,,False,True,t3_f5swgb,t1_fi1rgya,/r/aww/comments/f5swgb/my_amazing_family/fi1rkc9/
269,fi0w43i,,[removed],[removed],0,2020-02-18 17:12:53,<praw.models.comment_forest.CommentForest object at 0x000002547ADE04F0>,f5swgb,aww,t5_2qh1o,,False,False,t3_f5swgb,t1_fi0uqxi,/r/aww/comments/f5swgb/my_amazing_family/fi0w43i/
270,fi21uj9,malec84,"I have. I'm half White and half Mexican. I look white (my Mexican-born mother was light skinned). I grew up and lived most of my life in southern Texas. I can't even begin to explain how many times I was ostracized for not being a ""full-blooded"" Mexican, both around my extended family and at my job. Believe it or not, every race has people that are racist against another culture. Black people who believe black people are the only people in the world who face racial discrimination need to educate themselves. 

Generally speaking, Japanese do not like Chinese people. That's racist. In my extended family of ""pure Mexicans,"" most of my cousins and such hated black people. That's racist. 

But overall, people are free to agree to disagree, but I did want to say I do think you have a beautiful family that you certainly should be proud of!","I have. I'm half White and half Mexican. I look white (my Mexican-born mother was light skinned). I grew up and lived most of my life in southern Texas. I can't even begin to explain how many times I was ostracized for not being a ""full-blooded"" Mexican, both around my extended family and at my job. Believe it or not, every race has people that are racist against another culture. Black people who believe black people are the only people in the world who face racial discrimination need to educate themselves. 

Generally speaking, Japanese do not like Chinese people. That's racist. In my extended family of ""pure Mexicans,"" most of my cousins and such hated black people. That's racist. 

But overall, people are free to agree to disagree, but I did want to say I do think you have a beautiful family that you certainly should be proud of!",7,2020-02-18 23:46:00,<praw.models.comment_forest.CommentForest object at 0x000002547ADE0D30>,f5swgb,aww,t5_2qh1o,,False,False,t3_f5swgb,t1_fi1mf12,/r/aww/comments/f5swgb/my_amazing_family/fi21uj9/
271,fi0sy2f,,[removed],[removed],2,2020-02-18 16:42:13,<praw.models.comment_forest.CommentForest object at 0x000002547ADE0EB0>,f5swgb,aww,t5_2qh1o,,False,False,t3_f5swgb,t1_fi0s9tl,/r/aww/comments/f5swgb/my_amazing_family/fi0sy2f/
272,fi3x585,,[removed],[removed],3,2020-02-19 16:25:10,<praw.models.comment_forest.CommentForest object at 0x000002547ADE22B0>,f5swgb,aww,t5_2qh1o,,False,False,t3_f5swgb,t1_fi3x0sa,/r/aww/comments/f5swgb/my_amazing_family/fi3x585/
273,fi79l0n,aubman02,Thx I appreciate that.,Thx I appreciate that.,1,2020-02-20 16:44:22,<praw.models.comment_forest.CommentForest object at 0x000002547ADE2430>,f5swgb,aww,t5_2qh1o,,False,False,t3_f5swgb,t1_fi6pje3,/r/aww/comments/f5swgb/my_amazing_family/fi79l0n/
274,fjdiz27,CayenneHybridSE,Are you a victim?,Are you a victim?,1,2020-03-03 16:39:18,<praw.models.comment_forest.CommentForest object at 0x000002547ADE2550>,f5swgb,aww,t5_2qh1o,,False,False,t3_f5swgb,t1_fjdbjlg,/r/aww/comments/f5swgb/my_amazing_family/fjdiz27/
275,fi0w1en,,[deleted],[deleted],0,2020-02-18 17:12:09,<praw.models.comment_forest.CommentForest object at 0x000002547ADE2730>,f5swgb,aww,t5_2qh1o,,1582046456.0,False,t3_f5swgb,t1_fi0u6dr,/r/aww/comments/f5swgb/my_amazing_family/fi0w1en/
276,fi1zz1v,,[removed],[removed],0,2020-02-18 23:26:14,<praw.models.comment_forest.CommentForest object at 0x000002547ADE2BB0>,f5swgb,aww,t5_2qh1o,,False,False,t3_f5swgb,t1_fi1zi9u,/r/aww/comments/f5swgb/my_amazing_family/fi1zz1v/
277,fi10fe4,,[removed],[removed],18,2020-02-18 17:50:24,<praw.models.comment_forest.CommentForest object at 0x000002547ADE2DF0>,f5swgb,aww,t5_2qh1o,,False,False,t3_f5swgb,t1_fi0x96o,/r/aww/comments/f5swgb/my_amazing_family/fi10fe4/
278,fi16u6l,,[removed],[removed],-10,2020-02-18 18:49:47,<praw.models.comment_forest.CommentForest object at 0x000002547ADE2E50>,f5swgb,aww,t5_2qh1o,,False,False,t3_f5swgb,t1_fi0x96o,/r/aww/comments/f5swgb/my_amazing_family/fi16u6l/
279,fi27njc,,[deleted],[deleted],4,2020-02-19 00:49:18,<praw.models.comment_forest.CommentForest object at 0x000002547ADE4550>,f5swgb,aww,t5_2qh1o,,False,False,t3_f5swgb,t1_fi1a6bw,/r/aww/comments/f5swgb/my_amazing_family/fi27njc/
280,fi2q2jk,,You're welcome,You're welcome,1,2020-02-19 04:18:04,<praw.models.comment_forest.CommentForest object at 0x000002547ADE9250>,f5swgb,aww,t5_2qh1o,,False,False,t3_f5swgb,t1_fi2k751,/r/aww/comments/f5swgb/my_amazing_family/fi2q2jk/
281,fi0xuln,,[removed],[removed],4,2020-02-18 17:28:16,<praw.models.comment_forest.CommentForest object at 0x000002547ADE9610>,f5swgb,aww,t5_2qh1o,,1582047378.0,False,t3_f5swgb,t1_fi0xd9l,/r/aww/comments/f5swgb/my_amazing_family/fi0xuln/
282,fi1jd2a,,[removed],[removed],1,2020-02-18 20:48:19,<praw.models.comment_forest.CommentForest object at 0x000002547ADE98B0>,f5swgb,aww,t5_2qh1o,,False,False,t3_f5swgb,t1_fi1j1bg,/r/aww/comments/f5swgb/my_amazing_family/fi1jd2a/
