,ID,Author,body,Comment,Score,Created On,Replies,Submission,Subreddit,Subreddit_ID,Distinguished,Edited,Is_submitter,link_id,Parent_id,Permalink
98,k04yzeo,PowerfulTarget3304,Then it’s just a different kind of hard,Then it’s just a different kind of hard,2,2023-09-11 17:34:53,<praw.models.comment_forest.CommentForest object at 0x000002541EDC0A90>,16fyq11,Showerthoughts,t5_2szyo,,False,False,t3_16fyq11,t3_16fyq11,/r/Showerthoughts/comments/16fyq11/amateur_is_a_hard_word_to_spell_unless_that_is/k04yzeo/
99,k055udu,HWNY506,Real Homemade Amateur…. Whoa forgot where I was for a sec.,Real Homemade Amateur…. Whoa forgot where I was for a sec.,2,2023-09-11 18:15:40,<praw.models.comment_forest.CommentForest object at 0x000002541EDC0F70>,16fyq11,Showerthoughts,t5_2szyo,,False,False,t3_16fyq11,t3_16fyq11,/r/Showerthoughts/comments/16fyq11/amateur_is_a_hard_word_to_spell_unless_that_is/k055udu/
100,k056cnl,,Or unless you’re French,Or unless you’re French,2,2023-09-11 18:18:44,<praw.models.comment_forest.CommentForest object at 0x000002541EDC0FD0>,16fyq11,Showerthoughts,t5_2szyo,,False,False,t3_16fyq11,t3_16fyq11,/r/Showerthoughts/comments/16fyq11/amateur_is_a_hard_word_to_spell_unless_that_is/k056cnl/
101,k058ytg,sten_ake_strid,"Coming from a professional connoisseur, I presume?","Coming from a professional connoisseur, I presume?",2,2023-09-11 18:34:21,<praw.models.comment_forest.CommentForest object at 0x000002541EDC6070>,16fyq11,Showerthoughts,t5_2szyo,,False,False,t3_16fyq11,t3_16fyq11,/r/Showerthoughts/comments/16fyq11/amateur_is_a_hard_word_to_spell_unless_that_is/k058ytg/
102,k05czgf,Cichlidsaremyjam,"I swear I you had a gun to my head, I'd die twice before being able to spell Amateur or Restaurant (even with the first word being in the post, spell check had to catch both of them). It's some kind of mental block, I swear.","I swear I you had a gun to my head, I'd die twice before being able to spell Amateur or Restaurant (even with the first word being in the post, spell check had to catch both of them). It's some kind of mental block, I swear.",2,2023-09-11 18:57:53,<praw.models.comment_forest.CommentForest object at 0x000002541EDC60D0>,16fyq11,Showerthoughts,t5_2szyo,,False,False,t3_16fyq11,t3_16fyq11,/r/Showerthoughts/comments/16fyq11/amateur_is_a_hard_word_to_spell_unless_that_is/k05czgf/
103,k04iuzz,Opening-Pitch,Just spit out my coffee.  That some funny right there. (and true),Just spit out my coffee.  That some funny right there. (and true),1,2023-09-11 15:57:54,<praw.models.comment_forest.CommentForest object at 0x000002541EDC6130>,16fyq11,Showerthoughts,t5_2szyo,,False,False,t3_16fyq11,t3_16fyq11,/r/Showerthoughts/comments/16fyq11/amateur_is_a_hard_word_to_spell_unless_that_is/k04iuzz/
104,k06bxj7,yourannadean,Or if you speak French,Or if you speak French,1,2023-09-11 22:27:59,<praw.models.comment_forest.CommentForest object at 0x000002541EDC6250>,16fyq11,Showerthoughts,t5_2szyo,,False,False,t3_16fyq11,t3_16fyq11,/r/Showerthoughts/comments/16fyq11/amateur_is_a_hard_word_to_spell_unless_that_is/k06bxj7/
105,k14tchn,15287331,What if you partake in the Amateur Radio hobby?,What if you partake in the Amateur Radio hobby?,1,2023-09-18 14:56:13,<praw.models.comment_forest.CommentForest object at 0x000002541EDC62B0>,16fyq11,Showerthoughts,t5_2szyo,,False,False,t3_16fyq11,t3_16fyq11,/r/Showerthoughts/comments/16fyq11/amateur_is_a_hard_word_to_spell_unless_that_is/k14tchn/
106,k04q7py,Cfam96,"I mean, this post is coming from u/0ldpenis …","I mean, this post is coming from u/0ldpenis …",29,2023-09-11 16:42:27,<praw.models.comment_forest.CommentForest object at 0x000002541EDC0610>,16fyq11,Showerthoughts,t5_2szyo,,False,False,t3_16fyq11,t1_k04mq7r,/r/Showerthoughts/comments/16fyq11/amateur_is_a_hard_word_to_spell_unless_that_is/k04q7py/
107,k0t2q55,Freakshow85,"For whatever reason, I have an eidetic memory when it comes to spelling.  I won my middle school spelling bee in 6th grade against kids 4 years older than me.

However, the 8th grader I beat was a girl (I was a boy)(Edit: WAIT WAIT.. I'm STILL a male, I'm just a man, now, not a boy lol) so... all she had to do was cry and they let her go on to the finals in another school.  I got to tag along and watch her lose, though.  Yay.  I remember spelling the word to Ms. Jones beside me right as she misspelled it.

We take ACTs ""down here.""  35 is the highest score you can make on each ACT portion.  I made a 35 on my English portion of the ACT.

I wonder if Lauren will ever see this.  Remember that Lauren lol?  It sure must have been nice to go cry to Ms. Jones and take my first place win because you were mad an 11 year old could spell better than all the 11-14 year old boys and girls.","For whatever reason, I have an eidetic memory when it comes to spelling.  I won my middle school spelling bee in 6th grade against kids 4 years older than me.

However, the 8th grader I beat was a girl (I was a boy)(Edit: WAIT WAIT.. I'm STILL a male, I'm just a man, now, not a boy lol) so... all she had to do was cry and they let her go on to the finals in another school.  I got to tag along and watch her lose, though.  Yay.  I remember spelling the word to Ms. Jones beside me right as she misspelled it.

We take ACTs ""down here.""  35 is the highest score you can make on each ACT portion.  I made a 35 on my English portion of the ACT.

I wonder if Lauren will ever see this.  Remember that Lauren lol?  It sure must have been nice to go cry to Ms. Jones and take my first place win because you were mad an 11 year old could spell better than all the 11-14 year old boys and girls.",1,2023-09-16 06:54:18,<praw.models.comment_forest.CommentForest object at 0x000002541EDC0730>,16fyq11,Showerthoughts,t5_2szyo,,1694847797.0,False,t3_16fyq11,t1_k0519ei,/r/Showerthoughts/comments/16fyq11/amateur_is_a_hard_word_to_spell_unless_that_is/k0t2q55/
108,k04y46z,RunnyDischarge,"Amateur is a word of French origin that is now an English word.  And one that's not hard to spell, either.","Amateur is a word of French origin that is now an English word.  And one that's not hard to spell, either.",17,2023-09-11 17:29:42,<praw.models.comment_forest.CommentForest object at 0x000002541EDC0910>,16fyq11,Showerthoughts,t5_2szyo,,False,False,t3_16fyq11,t1_k04kimj,/r/Showerthoughts/comments/16fyq11/amateur_is_a_hard_word_to_spell_unless_that_is/k04y46z/
109,k04mgu6,Doom7331,"*French

The spelling and pronounciation are much more sensible for this word.  Which is suprising given that French typicially has just about 0 connection between written and spoken words lol","*French

The spelling and pronounciation are much more sensible for this word.  Which is suprising given that French typicially has just about 0 connection between written and spoken words lol",-11,2023-09-11 16:19:49,<praw.models.comment_forest.CommentForest object at 0x000002541EDC0970>,16fyq11,Showerthoughts,t5_2szyo,,False,False,t3_16fyq11,t1_k04kimj,/r/Showerthoughts/comments/16fyq11/amateur_is_a_hard_word_to_spell_unless_that_is/k04mgu6/
110,k05ossm,Dadsandaboy,Yeah user 0ldpenis isn’t hiding it at all,Yeah user 0ldpenis isn’t hiding it at all,3,2023-09-11 20:07:18,<praw.models.comment_forest.CommentForest object at 0x000002541EDC0C10>,16fyq11,Showerthoughts,t5_2szyo,,False,False,t3_16fyq11,t1_k05a0g2,/r/Showerthoughts/comments/16fyq11/amateur_is_a_hard_word_to_spell_unless_that_is/k05ossm/
111,k05vig5,JonnySnowflake,You Google amateur sports often?,You Google amateur sports often?,3,2023-09-11 20:46:08,<praw.models.comment_forest.CommentForest object at 0x000002541EDC0F10>,16fyq11,Showerthoughts,t5_2szyo,,False,False,t3_16fyq11,t1_k05a0g2,/r/Showerthoughts/comments/16fyq11/amateur_is_a_hard_word_to_spell_unless_that_is/k05vig5/
112,k0t3ten,Freakshow85,"Spellcheck is what's causing younger kids to spell so bad if you ask me.  I mean, it's helpful for typos AND for words you may not know how to spell...

But my lord, have you seen how kids spell these days?  They are relying on spellcheck to just fix everything for them.  I don't think they even get taught about ""their, they're, there"" anymore.

I honestly judge a person's intelligence when I see them type something like ""It was there fault.  Your welcome.  Yo there still over their.  You and you're boys gonna go get em?""

lol.. I had to type the wrong words over and over because I naturally have the correct spellings memorized and ingrained in my brain from school.","Spellcheck is what's causing younger kids to spell so bad if you ask me.  I mean, it's helpful for typos AND for words you may not know how to spell...

But my lord, have you seen how kids spell these days?  They are relying on spellcheck to just fix everything for them.  I don't think they even get taught about ""their, they're, there"" anymore.

I honestly judge a person's intelligence when I see them type something like ""It was there fault.  Your welcome.  Yo there still over their.  You and you're boys gonna go get em?""

lol.. I had to type the wrong words over and over because I naturally have the correct spellings memorized and ingrained in my brain from school.",2,2023-09-16 07:08:00,<praw.models.comment_forest.CommentForest object at 0x000002541EDC6190>,16fyq11,Showerthoughts,t5_2szyo,,False,False,t3_16fyq11,t1_k05czgf,/r/Showerthoughts/comments/16fyq11/amateur_is_a_hard_word_to_spell_unless_that_is/k0t3ten/
113,k05vmit,JonnySnowflake,"I went to law school, and I'd fail the same test with decision (spellcheck had to save me)","I went to law school, and I'd fail the same test with decision (spellcheck had to save me)",1,2023-09-11 20:46:48,<praw.models.comment_forest.CommentForest object at 0x000002541EDC61F0>,16fyq11,Showerthoughts,t5_2szyo,,False,False,t3_16fyq11,t1_k05czgf,/r/Showerthoughts/comments/16fyq11/amateur_is_a_hard_word_to_spell_unless_that_is/k05vmit/
114,k05mqwg,0ldpenis,"*appears*

Hello.","*appears*

Hello.",11,2023-09-11 19:55:24,<praw.models.comment_forest.CommentForest object at 0x000002541EDC06D0>,16fyq11,Showerthoughts,t5_2szyo,,False,True,t3_16fyq11,t1_k04q7py,/r/Showerthoughts/comments/16fyq11/amateur_is_a_hard_word_to_spell_unless_that_is/k05mqwg/
115,k04r5up,Aioros_Y,"What? French is way more consistent then English with pronunciation vs spelling, it's not even close.","What? French is way more consistent then English with pronunciation vs spelling, it's not even close.",11,2023-09-11 16:48:11,<praw.models.comment_forest.CommentForest object at 0x000002541EDC0A30>,16fyq11,Showerthoughts,t5_2szyo,,False,False,t3_16fyq11,t1_k04mgu6,/r/Showerthoughts/comments/16fyq11/amateur_is_a_hard_word_to_spell_unless_that_is/k04r5up/
116,k0ejbli,Rei_Rodentia,r/usernamechecksout,r/usernamechecksout,2,2023-09-13 13:38:02,<praw.models.comment_forest.CommentForest object at 0x000002541EDC0790>,16fyq11,Showerthoughts,t5_2szyo,,False,False,t3_16fyq11,t1_k05mqwg,/r/Showerthoughts/comments/16fyq11/amateur_is_a_hard_word_to_spell_unless_that_is/k0ejbli/
117,k05m9th,Doom7331,Conjugaison would like to have a word with you.,Conjugaison would like to have a word with you.,0,2023-09-11 19:52:40,<praw.models.comment_forest.CommentForest object at 0x000002541EDC0AF0>,16fyq11,Showerthoughts,t5_2szyo,,False,False,t3_16fyq11,t1_k04r5up,/r/Showerthoughts/comments/16fyq11/amateur_is_a_hard_word_to_spell_unless_that_is/k05m9th/
118,k04zdn2,Minimum_Box4491,"“Oiseaux.”

Not a single letter is pronounced the way it’s written. 

And there are *seven* of them.","“Oiseaux.”

Not a single letter is pronounced the way it’s written. 

And there are *seven* of them.",-10,2023-09-11 17:37:12,<praw.models.comment_forest.CommentForest object at 0x000002541EDC0B50>,16fyq11,Showerthoughts,t5_2szyo,,False,False,t3_16fyq11,t1_k04r5up,/r/Showerthoughts/comments/16fyq11/amateur_is_a_hard_word_to_spell_unless_that_is/k04zdn2/
119,k05oy7a,Aioros_Y,What's wrong with it? I never heard anyone say it and the pronunciation that I hear from online dictionaries is exactly what I expected by reading the word.,What's wrong with it? I never heard anyone say it and the pronunciation that I hear from online dictionaries is exactly what I expected by reading the word.,0,2023-09-11 20:08:10,<praw.models.comment_forest.CommentForest object at 0x000002541EDC0BB0>,16fyq11,Showerthoughts,t5_2szyo,,False,False,t3_16fyq11,t1_k05m9th,/r/Showerthoughts/comments/16fyq11/amateur_is_a_hard_word_to_spell_unless_that_is/k05oy7a/
120,k050gij,Last_republic,"They're all pronounced how you would expect them to be pronounced in french though. Oi makes a ""wa"" sound, s can make a ""z"" sound when surrounded by vowels, eau makes an ""o"" sound and x is a typical marker of the plural and is never pronounced in this context. It's all very standard stuff and you could expect a frenchman to get it right on the first try even if they had never heard the word before, you're just unfamiliar with the rules of french that's all","They're all pronounced how you would expect them to be pronounced in french though. Oi makes a ""wa"" sound, s can make a ""z"" sound when surrounded by vowels, eau makes an ""o"" sound and x is a typical marker of the plural and is never pronounced in this context. It's all very standard stuff and you could expect a frenchman to get it right on the first try even if they had never heard the word before, you're just unfamiliar with the rules of french that's all",14,2023-09-11 17:43:35,<praw.models.comment_forest.CommentForest object at 0x000002541EDC0CD0>,16fyq11,Showerthoughts,t5_2szyo,,False,False,t3_16fyq11,t1_k04zdn2,/r/Showerthoughts/comments/16fyq11/amateur_is_a_hard_word_to_spell_unless_that_is/k050gij/
121,k050weh,metijhn,"Not a single letter is pronounced the way it's written IN ENGLISH.

Letters make different sounds in different languages, is that such a hard concept to grasp? Oiseaux is pronounced 100% correct according to French language rules. If anything, French is thousand times more consistent in its pronunciation than English, where 'ou' in though, tough and sour are pronounced differently.","Not a single letter is pronounced the way it's written IN ENGLISH.

Letters make different sounds in different languages, is that such a hard concept to grasp? Oiseaux is pronounced 100% correct according to French language rules. If anything, French is thousand times more consistent in its pronunciation than English, where 'ou' in though, tough and sour are pronounced differently.",9,2023-09-11 17:46:14,<praw.models.comment_forest.CommentForest object at 0x000002541EDC0D30>,16fyq11,Showerthoughts,t5_2szyo,,False,False,t3_16fyq11,t1_k04zdn2,/r/Showerthoughts/comments/16fyq11/amateur_is_a_hard_word_to_spell_unless_that_is/k050weh/
122,k05144d,RunnyDischarge,"This is going to come as a great shock, but French isn't spelled and pronounced the same way as English!

It's pronounced and spelled exactly like other French words

loi (law) = lwa

eau (water) = long o

eaux (waters) = long o, pronounced the same but x makes it plural","This is going to come as a great shock, but French isn't spelled and pronounced the same way as English!

It's pronounced and spelled exactly like other French words

loi (law) = lwa

eau (water) = long o

eaux (waters) = long o, pronounced the same but x makes it plural",5,2023-09-11 17:47:30,<praw.models.comment_forest.CommentForest object at 0x000002541EDC0D90>,16fyq11,Showerthoughts,t5_2szyo,,False,False,t3_16fyq11,t1_k04zdn2,/r/Showerthoughts/comments/16fyq11/amateur_is_a_hard_word_to_spell_unless_that_is/k05144d/
123,k05032i,Aioros_Y,"But ""the way it's written"" doesn't mean much. What I'm saying is that there are consistent pronunciation rules, so if you see a word that you don't know, you always know how to read it. That's not the case in English.","But ""the way it's written"" doesn't mean much. What I'm saying is that there are consistent pronunciation rules, so if you see a word that you don't know, you always know how to read it. That's not the case in English.",4,2023-09-11 17:41:23,<praw.models.comment_forest.CommentForest object at 0x000002541EDC0DF0>,16fyq11,Showerthoughts,t5_2szyo,,False,False,t3_16fyq11,t1_k04zdn2,/r/Showerthoughts/comments/16fyq11/amateur_is_a_hard_word_to_spell_unless_that_is/k05032i/
124,k053zvj,Deviant_7666,"The word perfectly follows rules of french, youre just stupid","The word perfectly follows rules of french, youre just stupid",1,2023-09-11 18:04:34,<praw.models.comment_forest.CommentForest object at 0x000002541EDC0E50>,16fyq11,Showerthoughts,t5_2szyo,,False,False,t3_16fyq11,t1_k04zdn2,/r/Showerthoughts/comments/16fyq11/amateur_is_a_hard_word_to_spell_unless_that_is/k053zvj/
125,k05qflt,Doom7331,"ait, ais, aient for instance 

This is not a problem for reading, but for writing it is.","ait, ais, aient for instance 

This is not a problem for reading, but for writing it is.",1,2023-09-11 20:16:49,<praw.models.comment_forest.CommentForest object at 0x000002541EDC0C70>,16fyq11,Showerthoughts,t5_2szyo,,False,False,t3_16fyq11,t1_k05oy7a,/r/Showerthoughts/comments/16fyq11/amateur_is_a_hard_word_to_spell_unless_that_is/k05qflt/
126,k079ccm,Minimum_Box4491,"That’s the point though. Both English and French are presumptive languages. One has to know the sound of the word inherently, one can’t always get it right by seeing it/writing it. 

Unlike, say, Spanish which sounds pretty much exactly the way it’s written, phonetically (apart from the LLs and the Js).","That’s the point though. Both English and French are presumptive languages. One has to know the sound of the word inherently, one can’t always get it right by seeing it/writing it. 

Unlike, say, Spanish which sounds pretty much exactly the way it’s written, phonetically (apart from the LLs and the Js).",0,2023-09-12 02:12:15,<praw.models.comment_forest.CommentForest object at 0x000002541EDC0EB0>,16fyq11,Showerthoughts,t5_2szyo,,False,False,t3_16fyq11,t1_k05032i,/r/Showerthoughts/comments/16fyq11/amateur_is_a_hard_word_to_spell_unless_that_is/k079ccm/
127,j8vqn1a,Showerthoughts_Mod,"This is a friendly reminder to [read our rules](https://www.reddit.com/r/Showerthoughts/wiki/rules).

Remember, /r/Showerthoughts is for showerthoughts, not ""thoughts had in the shower!""

(For an explanation of what a ""showerthought"" is, [please read this page](https://www.reddit.com/r/Showerthoughts/wiki/overview).)

**Rule-breaking posts may result in bans.**","This is a friendly reminder to [read our rules](https://www.reddit.com/r/Showerthoughts/wiki/rules).

Remember, /r/Showerthoughts is for showerthoughts, not ""thoughts had in the shower!""

(For an explanation of what a ""showerthought"" is, [please read this page](https://www.reddit.com/r/Showerthoughts/wiki/overview).)

**Rule-breaking posts may result in bans.**",1,2023-02-17 07:59:32,<praw.models.comment_forest.CommentForest object at 0x000002547AE70430>,114e1mh,Showerthoughts,t5_2szyo,moderator,False,False,t3_114e1mh,t3_114e1mh,/r/Showerthoughts/comments/114e1mh/well_have_true_gender_equality_when_a_woman_who/j8vqn1a/
128,j8vthd8,sirlarkstolemy_u,"Ah, so true gender equality has been achieved in the civil/public service then. #sarcasm","Ah, so true gender equality has been achieved in the civil/public service then. #sarcasm",50,2023-02-17 08:37:34,<praw.models.comment_forest.CommentForest object at 0x000002547AE70640>,114e1mh,Showerthoughts,t5_2szyo,,False,False,t3_114e1mh,t3_114e1mh,/r/Showerthoughts/comments/114e1mh/well_have_true_gender_equality_when_a_woman_who/j8vthd8/
129,j8vyeqm,GreyKnight1337,"Fuck no. True equality is fireing anyone who is utterly useless at a given job, irrespective of gender, skincoloure or nationality.","Fuck no. True equality is fireing anyone who is utterly useless at a given job, irrespective of gender, skincoloure or nationality.",79,2023-02-17 09:46:12,<praw.models.comment_forest.CommentForest object at 0x000002547AE706D0>,114e1mh,Showerthoughts,t5_2szyo,,False,False,t3_114e1mh,t3_114e1mh,/r/Showerthoughts/comments/114e1mh/well_have_true_gender_equality_when_a_woman_who/j8vyeqm/
130,j8vsmha,PinkPlumPie,"LOL you should meet some old coworkers at my former jobs 😭 (before you get mad, I am also a woman)","LOL you should meet some old coworkers at my former jobs 😭 (before you get mad, I am also a woman)",37,2023-02-17 08:26:00,<praw.models.comment_forest.CommentForest object at 0x000002547AE70790>,114e1mh,Showerthoughts,t5_2szyo,,False,False,t3_114e1mh,t3_114e1mh,/r/Showerthoughts/comments/114e1mh/well_have_true_gender_equality_when_a_woman_who/j8vsmha/
131,j8xb44n,Melopahn1,"Already a thing that most working adults have encountered. 

OP solved it already by boiling it down to a completely worthless metric.","Already a thing that most working adults have encountered. 

OP solved it already by boiling it down to a completely worthless metric.",6,2023-02-17 16:48:46,<praw.models.comment_forest.CommentForest object at 0x000002547AE70910>,114e1mh,Showerthoughts,t5_2szyo,,False,False,t3_114e1mh,t3_114e1mh,/r/Showerthoughts/comments/114e1mh/well_have_true_gender_equality_when_a_woman_who/j8xb44n/
132,j8vzd5b,Lyinv,I've seen men chewed out for lesser mistakes whilst women getting off with just a small note in my industry (construction).,I've seen men chewed out for lesser mistakes whilst women getting off with just a small note in my industry (construction).,8,2023-02-17 09:59:24,<praw.models.comment_forest.CommentForest object at 0x000002547AE70A30>,114e1mh,Showerthoughts,t5_2szyo,,False,False,t3_114e1mh,t3_114e1mh,/r/Showerthoughts/comments/114e1mh/well_have_true_gender_equality_when_a_woman_who/j8vzd5b/
133,j8wnwn6,,"When I went to welding school 18 years ago, there was a lady that was also taking the course, I watched her walk up the our instructor, on her third and final attempt at a weld test, and she said “I’m not showing you my weld, unless I get a passing grade” and without looking away from what the instructor was doing, he said “72%”
After the course was done, she was automatically hired, straight out of school, to a well paying position (about 10 dollars an hour more than what I managed to find) based on the fact that the company she was hired by, had a minimum quota of female employees to hire. Now this might sound crazy, but i believe we as a society might have already figured all this out already, and people need to stop beating a dead horse. We as a whole, have a far better quality of life than people from all over the rest of the world.","When I went to welding school 18 years ago, there was a lady that was also taking the course, I watched her walk up the our instructor, on her third and final attempt at a weld test, and she said “I’m not showing you my weld, unless I get a passing grade” and without looking away from what the instructor was doing, he said “72%”
After the course was done, she was automatically hired, straight out of school, to a well paying position (about 10 dollars an hour more than what I managed to find) based on the fact that the company she was hired by, had a minimum quota of female employees to hire. Now this might sound crazy, but i believe we as a society might have already figured all this out already, and people need to stop beating a dead horse. We as a whole, have a far better quality of life than people from all over the rest of the world.",12,2023-02-17 14:13:33,<praw.models.comment_forest.CommentForest object at 0x000002547AE70BB0>,114e1mh,Showerthoughts,t5_2szyo,,False,False,t3_114e1mh,t3_114e1mh,/r/Showerthoughts/comments/114e1mh/well_have_true_gender_equality_when_a_woman_who/j8wnwn6/
134,j8vx1r6,,"Ah yes, the fight for women to be as bad as the ficticious men in your mind. Truly a 21st century statement.","Ah yes, the fight for women to be as bad as the ficticious men in your mind. Truly a 21st century statement.",19,2023-02-17 09:26:56,<praw.models.comment_forest.CommentForest object at 0x000002547AE70D30>,114e1mh,Showerthoughts,t5_2szyo,,False,False,t3_114e1mh,t3_114e1mh,/r/Showerthoughts/comments/114e1mh/well_have_true_gender_equality_when_a_woman_who/j8vx1r6/
