,ID,Author,body,Comment,Score,Created On,Replies,Submission,Subreddit,Subreddit_ID,Distinguished,Edited,Is_submitter,link_id,Parent_id,Permalink
135,j8vxho3,SouthFar412,"I don't think men are allowed to be utterly useless.   But I do believe there are studies that show people will think a man is better and thus will be more likely to pick them for leadership positions,  believe they can fulfil roles if given a promotion, more so than women.  

I don't know why that is, but I have a theory.   I call it the 'daddy's home' theory.   And what happens is this.  During a lot of women's lives, they have children with a husband.  When the children are young they stay home with mummy or she at the very least cuts down her hours so she is there for a lot more time than daddy.   So mum becomes boring,  uninteresting.

But at the end of the day when daddy pulls in the driveway, outcomes the words,  usually in an excited for children voice.

&#x200B;

Daddy's Home!!!!!!!!!!!!

But daddy isn't boring.  Oh, it's daddy.  He's the one that does things.  Mummy is boring.  Daddy he's tall.   Oh, daddy is a butcher.   Daddy is so smart.  And this embedded in children from as early as they can remember.

And from daddy comes men.  So men are smart,  men are funny,  men are interesting.   From mummy comes women - women are boring,  women do easy things.

I hope that makes sense.  Because a lot of the bias is subconscious.    Tests show it is there, but people will swear black and blue it isn't.","I don't think men are allowed to be utterly useless.   But I do believe there are studies that show people will think a man is better and thus will be more likely to pick them for leadership positions,  believe they can fulfil roles if given a promotion, more so than women.  

I don't know why that is, but I have a theory.   I call it the 'daddy's home' theory.   And what happens is this.  During a lot of women's lives, they have children with a husband.  When the children are young they stay home with mummy or she at the very least cuts down her hours so she is there for a lot more time than daddy.   So mum becomes boring,  uninteresting.

But at the end of the day when daddy pulls in the driveway, outcomes the words,  usually in an excited for children voice.

&#x200B;

Daddy's Home!!!!!!!!!!!!

But daddy isn't boring.  Oh, it's daddy.  He's the one that does things.  Mummy is boring.  Daddy he's tall.   Oh, daddy is a butcher.   Daddy is so smart.  And this embedded in children from as early as they can remember.

And from daddy comes men.  So men are smart,  men are funny,  men are interesting.   From mummy comes women - women are boring,  women do easy things.

I hope that makes sense.  Because a lot of the bias is subconscious.    Tests show it is there, but people will swear black and blue it isn't.",8,2023-02-17 09:33:16,<praw.models.comment_forest.CommentForest object at 0x000002547AE70DF0>,114e1mh,Showerthoughts,t5_2szyo,,False,False,t3_114e1mh,t3_114e1mh,/r/Showerthoughts/comments/114e1mh/well_have_true_gender_equality_when_a_woman_who/j8vxho3/
136,j8w8c7h,ash_vn,True gender equality will be when jobs done by women traditionally will not be considered inferior to men and women would not have to do men's jobs just to prove their worth.,True gender equality will be when jobs done by women traditionally will not be considered inferior to men and women would not have to do men's jobs just to prove their worth.,4,2023-02-17 11:54:28,<praw.models.comment_forest.CommentForest object at 0x000002547AE70F70>,114e1mh,Showerthoughts,t5_2szyo,,False,False,t3_114e1mh,t3_114e1mh,/r/Showerthoughts/comments/114e1mh/well_have_true_gender_equality_when_a_woman_who/j8w8c7h/
137,j8wet20,LooseLeaf24,"We will hit true gender equality when we create exoskeletons that make women as strong as men. 

This world would be WILDLY different if women were the stronger sex

You see it with guys. I was listening to two people arguing on the train the other day, and one was factually correct. The other guy said idc fuck you I can beat your ass. That was the end of it. The smaller person who was 100% correct stopped arguing because he knew the bigger stupid person could be at his ass","We will hit true gender equality when we create exoskeletons that make women as strong as men. 

This world would be WILDLY different if women were the stronger sex

You see it with guys. I was listening to two people arguing on the train the other day, and one was factually correct. The other guy said idc fuck you I can beat your ass. That was the end of it. The smaller person who was 100% correct stopped arguing because he knew the bigger stupid person could be at his ass",3,2023-02-17 12:59:10,<praw.models.comment_forest.CommentForest object at 0x000002547AE72130>,114e1mh,Showerthoughts,t5_2szyo,,False,False,t3_114e1mh,t3_114e1mh,/r/Showerthoughts/comments/114e1mh/well_have_true_gender_equality_when_a_woman_who/j8wet20/
138,j8wbijs,drillluminati,Women are mostly useless at work these days with their Starbucks on their desk. Ask Elon,Women are mostly useless at work these days with their Starbucks on their desk. Ask Elon,3,2023-02-17 12:27:50,<praw.models.comment_forest.CommentForest object at 0x000002547AE722B0>,114e1mh,Showerthoughts,t5_2szyo,,False,False,t3_114e1mh,t3_114e1mh,/r/Showerthoughts/comments/114e1mh/well_have_true_gender_equality_when_a_woman_who/j8wbijs/
139,j8wg7nu,yohananloukas116,"Hilarious... and I see what you're saying. There are many men who can show up to a field dominated by men, be useless, without getting fired. If a woman tried that in the same field, she'd be fired for being useless. True equality would be keeping her too LOL","Hilarious... and I see what you're saying. There are many men who can show up to a field dominated by men, be useless, without getting fired. If a woman tried that in the same field, she'd be fired for being useless. True equality would be keeping her too LOL",1,2023-02-17 13:11:43,<praw.models.comment_forest.CommentForest object at 0x000002547AE72520>,114e1mh,Showerthoughts,t5_2szyo,,False,False,t3_114e1mh,t3_114e1mh,/r/Showerthoughts/comments/114e1mh/well_have_true_gender_equality_when_a_woman_who/j8wg7nu/
140,j8vvdlq,Dr_DMT,"This exists in a lot of places.

People gotta eat though 🤷‍♂️","This exists in a lot of places.

People gotta eat though 🤷‍♂️",1,2023-02-17 09:03:36,<praw.models.comment_forest.CommentForest object at 0x000002547AE725E0>,114e1mh,Showerthoughts,t5_2szyo,,False,False,t3_114e1mh,t3_114e1mh,/r/Showerthoughts/comments/114e1mh/well_have_true_gender_equality_when_a_woman_who/j8vvdlq/
141,j8zomem,PiccoloTiccolo,I don’t understand what this is saying can someone paint a picture,I don’t understand what this is saying can someone paint a picture,1,2023-02-18 02:46:59,<praw.models.comment_forest.CommentForest object at 0x000002547AE727C0>,114e1mh,Showerthoughts,t5_2szyo,,False,False,t3_114e1mh,t3_114e1mh,/r/Showerthoughts/comments/114e1mh/well_have_true_gender_equality_when_a_woman_who/j8zomem/
142,j90fpnn,SirLoremIpsum,"You just don't need to go negative... 

Too many men see women's issues in a negative light like this. ""oh equality? I can hit women then?!?""

""Equality? Oh they can get fired""

Think in positive light, not negative. Better mindset to take.","You just don't need to go negative... 

Too many men see women's issues in a negative light like this. ""oh equality? I can hit women then?!?""

""Equality? Oh they can get fired""

Think in positive light, not negative. Better mindset to take.",1,2023-02-18 07:27:01,<praw.models.comment_forest.CommentForest object at 0x000002547AE728E0>,114e1mh,Showerthoughts,t5_2szyo,,False,False,t3_114e1mh,t3_114e1mh,/r/Showerthoughts/comments/114e1mh/well_have_true_gender_equality_when_a_woman_who/j90fpnn/
143,j8wwsst,HiddenCity,You say sarcasm but I say you're probably right at the lower end.,You say sarcasm but I say you're probably right at the lower end.,5,2023-02-17 15:15:40,<praw.models.comment_forest.CommentForest object at 0x000002547AE70730>,114e1mh,Showerthoughts,t5_2szyo,,False,False,t3_114e1mh,t1_j8vthd8,/r/Showerthoughts/comments/114e1mh/well_have_true_gender_equality_when_a_woman_who/j8wwsst/
144,j8wx34l,plafki,Lmao u didnt get the joke about feminism,Lmao u didnt get the joke about feminism,10,2023-02-17 15:17:35,<praw.models.comment_forest.CommentForest object at 0x000002547AE707F0>,114e1mh,Showerthoughts,t5_2szyo,,False,False,t3_114e1mh,t1_j8vyeqm,/r/Showerthoughts/comments/114e1mh/well_have_true_gender_equality_when_a_woman_who/j8wx34l/
145,j8vyiuz,Kaepora25,I agree with that,I agree with that,4,2023-02-17 09:47:46,<praw.models.comment_forest.CommentForest object at 0x000002547AE70850>,114e1mh,Showerthoughts,t5_2szyo,,False,True,t3_114e1mh,t1_j8vyeqm,/r/Showerthoughts/comments/114e1mh/well_have_true_gender_equality_when_a_woman_who/j8vyiuz/
146,j8zbdxi,,That would require eliminating quite a few useless positions,That would require eliminating quite a few useless positions,1,2023-02-18 00:58:21,<praw.models.comment_forest.CommentForest object at 0x000002547AE708B0>,114e1mh,Showerthoughts,t5_2szyo,,False,False,t3_114e1mh,t1_j8vyeqm,/r/Showerthoughts/comments/114e1mh/well_have_true_gender_equality_when_a_woman_who/j8zbdxi/
147,j8vsrmz,Kaepora25,Were your coworkers women or men I'm not sure to understand,Were your coworkers women or men I'm not sure to understand,-25,2023-02-17 08:27:56,<praw.models.comment_forest.CommentForest object at 0x000002547AE709D0>,114e1mh,Showerthoughts,t5_2szyo,,False,True,t3_114e1mh,t1_j8vsmha,/r/Showerthoughts/comments/114e1mh/well_have_true_gender_equality_when_a_woman_who/j8vsrmz/
148,j8x24rp,,Quotas over qualifications is one of the dumbest ideas implemented,Quotas over qualifications is one of the dumbest ideas implemented,6,2023-02-17 15:50:55,<praw.models.comment_forest.CommentForest object at 0x000002547AE70D90>,114e1mh,Showerthoughts,t5_2szyo,,False,False,t3_114e1mh,t1_j8wnwn6,/r/Showerthoughts/comments/114e1mh/well_have_true_gender_equality_when_a_woman_who/j8x24rp/
149,j8vy35r,Kaepora25,"I am myself a man.

I don't think women are fighting to be ""as bad"" as some fictitious man. That's not what I said nor what I meant.","I am myself a man.

I don't think women are fighting to be ""as bad"" as some fictitious man. That's not what I said nor what I meant.",-5,2023-02-17 09:41:36,<praw.models.comment_forest.CommentForest object at 0x000002547AE70EB0>,114e1mh,Showerthoughts,t5_2szyo,,False,True,t3_114e1mh,t1_j8vx1r6,/r/Showerthoughts/comments/114e1mh/well_have_true_gender_equality_when_a_woman_who/j8vy35r/
150,j8vxo78,Kaepora25,Well that's an interesting theory. Have you seen this being discussed elsewhere?,Well that's an interesting theory. Have you seen this being discussed elsewhere?,3,2023-02-17 09:35:53,<praw.models.comment_forest.CommentForest object at 0x000002547AE72070>,114e1mh,Showerthoughts,t5_2szyo,,False,True,t3_114e1mh,t1_j8vxho3,/r/Showerthoughts/comments/114e1mh/well_have_true_gender_equality_when_a_woman_who/j8vxo78/
151,j8wwbsm,,What jobs that are predominantly female do you feel like men do not respect as a whole?,What jobs that are predominantly female do you feel like men do not respect as a whole?,2,2023-02-17 15:12:29,<praw.models.comment_forest.CommentForest object at 0x000002547AE721F0>,114e1mh,Showerthoughts,t5_2szyo,,False,False,t3_114e1mh,t1_j8w8c7h,/r/Showerthoughts/comments/114e1mh/well_have_true_gender_equality_when_a_woman_who/j8wwbsm/
152,j8wxv04,,"I mean, the world would also be different if we could all fly...","I mean, the world would also be different if we could all fly...",4,2023-02-17 15:22:46,<praw.models.comment_forest.CommentForest object at 0x000002547AE72460>,114e1mh,Showerthoughts,t5_2szyo,,False,False,t3_114e1mh,t1_j8wet20,/r/Showerthoughts/comments/114e1mh/well_have_true_gender_equality_when_a_woman_who/j8wxv04/
153,j8xyyev,JCPRuckus,"Go to a construction site. Literally the opposite of how it really works. Men get shitcanned constantly, because there's a 1000 other men to take their place. The few women hang on despite most of them being mostly useless, because someone wants to prove they're progressive by forcefeeding women into the industry.

Now, I'm not saying that all of the women are useless. In fact, some are better than most of the men. But most are absolutely less productive than the average male employee and wouldn't have jobs if they were men.","Go to a construction site. Literally the opposite of how it really works. Men get shitcanned constantly, because there's a 1000 other men to take their place. The few women hang on despite most of them being mostly useless, because someone wants to prove they're progressive by forcefeeding women into the industry.

Now, I'm not saying that all of the women are useless. In fact, some are better than most of the men. But most are absolutely less productive than the average male employee and wouldn't have jobs if they were men.",3,2023-02-17 19:19:39,<praw.models.comment_forest.CommentForest object at 0x000002547AE726A0>,114e1mh,Showerthoughts,t5_2szyo,,False,False,t3_114e1mh,t1_j8wg7nu,/r/Showerthoughts/comments/114e1mh/well_have_true_gender_equality_when_a_woman_who/j8xyyev/
154,j8wxk73,,"It can't be equality if only some people do it though, That's preferential treatment. True equality would be firing them both. And honestly, that is probably what actually happens in real life anyways.","It can't be equality if only some people do it though, That's preferential treatment. True equality would be firing them both. And honestly, that is probably what actually happens in real life anyways.",1,2023-02-17 15:20:46,<praw.models.comment_forest.CommentForest object at 0x000002547AE72760>,114e1mh,Showerthoughts,t5_2szyo,,False,False,t3_114e1mh,t1_j8wg7nu,/r/Showerthoughts/comments/114e1mh/well_have_true_gender_equality_when_a_woman_who/j8wxk73/
155,j8vvrts,Kaepora25,"I think people misunderstood what I meant. I'm trying to say that as it stands, men can be terrible at their job without getting fired but a woman in a ""men"" job has to perform because she has to ""prove her worth"" for some stupid reason. If a woman is terrible at her job while surrounded by men, it's not gonna go unnoticed.","I think people misunderstood what I meant. I'm trying to say that as it stands, men can be terrible at their job without getting fired but a woman in a ""men"" job has to perform because she has to ""prove her worth"" for some stupid reason. If a woman is terrible at her job while surrounded by men, it's not gonna go unnoticed.",-10,2023-02-17 09:09:05,<praw.models.comment_forest.CommentForest object at 0x000002547AE72880>,114e1mh,Showerthoughts,t5_2szyo,,False,True,t3_114e1mh,t1_j8vvdlq,/r/Showerthoughts/comments/114e1mh/well_have_true_gender_equality_when_a_woman_who/j8vvrts/
156,j90otib,Kaepora25,"I agree with this, I think my statement wasn't understood in the way I meant it.","I agree with this, I think my statement wasn't understood in the way I meant it.",1,2023-02-18 09:32:21,<praw.models.comment_forest.CommentForest object at 0x000002547AE72C40>,114e1mh,Showerthoughts,t5_2szyo,,False,True,t3_114e1mh,t1_j90fpnn,/r/Showerthoughts/comments/114e1mh/well_have_true_gender_equality_when_a_woman_who/j90otib/
157,jsjfwwe,GarlicBreadId,I can eliminate them. Let me get my assault rifle and hand greanade,I can eliminate them. Let me get my assault rifle and hand greanade,0,2023-07-19 02:36:35,<praw.models.comment_forest.CommentForest object at 0x000002547AE70970>,114e1mh,Showerthoughts,t5_2szyo,,False,False,t3_114e1mh,t1_j8zbdxi,/r/Showerthoughts/comments/114e1mh/well_have_true_gender_equality_when_a_woman_who/jsjfwwe/
158,j8vstwr,PinkPlumPie,women but there was useless both,women but there was useless both,12,2023-02-17 08:28:47,<praw.models.comment_forest.CommentForest object at 0x000002547AE70A90>,114e1mh,Showerthoughts,t5_2szyo,,False,False,t3_114e1mh,t1_j8vsrmz,/r/Showerthoughts/comments/114e1mh/well_have_true_gender_equality_when_a_woman_who/j8vstwr/
159,j8yxjtd,Ok-Contribution7622,Why the downvote brigade?,Why the downvote brigade?,0,2023-02-17 23:13:08,<praw.models.comment_forest.CommentForest object at 0x000002547AE70AF0>,114e1mh,Showerthoughts,t5_2szyo,,False,False,t3_114e1mh,t1_j8vsrmz,/r/Showerthoughts/comments/114e1mh/well_have_true_gender_equality_when_a_woman_who/j8yxjtd/
160,j8xi0je,,"I’m over it, I became highly skilled in my trade, and surpassed the quotas. But for people getting into the trade, it is definitely a slap in the face that someone gets preferential treatment, based on who they are.","I’m over it, I became highly skilled in my trade, and surpassed the quotas. But for people getting into the trade, it is definitely a slap in the face that someone gets preferential treatment, based on who they are.",5,2023-02-17 17:32:13,<praw.models.comment_forest.CommentForest object at 0x000002547AE70E50>,114e1mh,Showerthoughts,t5_2szyo,,False,False,t3_114e1mh,t1_j8x24rp,/r/Showerthoughts/comments/114e1mh/well_have_true_gender_equality_when_a_woman_who/j8xi0je/
161,j8vymmj,,"I know they aren't. Your perception of the situation being equality is wrong because you are implying that every man is useless in male dominated fields and therefore if every woman is useless then that is okay.

If you weren't saying every man is useless, then that wouldn't be equality either because then all women could do something that not all men are.

We live in a society where it doesn't matter what you meant, it matters what you said, always.","I know they aren't. Your perception of the situation being equality is wrong because you are implying that every man is useless in male dominated fields and therefore if every woman is useless then that is okay.

If you weren't saying every man is useless, then that wouldn't be equality either because then all women could do something that not all men are.

We live in a society where it doesn't matter what you meant, it matters what you said, always.",1,2023-02-17 09:49:15,<praw.models.comment_forest.CommentForest object at 0x000002547AE70FD0>,114e1mh,Showerthoughts,t5_2szyo,,False,False,t3_114e1mh,t1_j8vy35r,/r/Showerthoughts/comments/114e1mh/well_have_true_gender_equality_when_a_woman_who/j8vymmj/
162,j8x6lbz,ash_vn,"Not just men, women too. traditionally women have been home makers I don't think any gender male or female either respects the job enough. Full time job with no pay.","Not just men, women too. traditionally women have been home makers I don't think any gender male or female either respects the job enough. Full time job with no pay.",1,2023-02-17 16:19:54,<praw.models.comment_forest.CommentForest object at 0x000002547AE723A0>,114e1mh,Showerthoughts,t5_2szyo,,False,False,t3_114e1mh,t1_j8wwbsm,/r/Showerthoughts/comments/114e1mh/well_have_true_gender_equality_when_a_woman_who/j8x6lbz/
163,j8wy1b3,LooseLeaf24,Yes. But there are birds of different sizes. A eagle and a sparrow have two very different lives and fears,Yes. But there are birds of different sizes. A eagle and a sparrow have two very different lives and fears,1,2023-02-17 15:23:56,<praw.models.comment_forest.CommentForest object at 0x000002547AE72580>,114e1mh,Showerthoughts,t5_2szyo,,False,False,t3_114e1mh,t1_j8wxv04,/r/Showerthoughts/comments/114e1mh/well_have_true_gender_equality_when_a_woman_who/j8wy1b3/
164,j8wy0b0,yohananloukas116,"Of course true, but reality is this doesn't happen anyway. All I'm saying is I get what OP said.","Of course true, but reality is this doesn't happen anyway. All I'm saying is I get what OP said.",1,2023-02-17 15:23:45,<praw.models.comment_forest.CommentForest object at 0x000002547AE72820>,114e1mh,Showerthoughts,t5_2szyo,,False,False,t3_114e1mh,t1_j8wxk73,/r/Showerthoughts/comments/114e1mh/well_have_true_gender_equality_when_a_woman_who/j8wy0b0/
165,j8vwzrz,Zinderend,May I ask where you live? Maybe this is a cultural thing where you live so I just want to check,May I ask where you live? Maybe this is a cultural thing where you live so I just want to check,3,2023-02-17 09:26:10,<praw.models.comment_forest.CommentForest object at 0x000002547AE72940>,114e1mh,Showerthoughts,t5_2szyo,,False,False,t3_114e1mh,t1_j8vvrts,/r/Showerthoughts/comments/114e1mh/well_have_true_gender_equality_when_a_woman_who/j8vwzrz/
166,j8y0x2x,aganesh8,You're generalizing based off your experience which is incorrect. I have the opposite. Do you even know what the tech industry looks like right now?,You're generalizing based off your experience which is incorrect. I have the opposite. Do you even know what the tech industry looks like right now?,1,2023-02-17 19:32:24,<praw.models.comment_forest.CommentForest object at 0x000002547AE729A0>,114e1mh,Showerthoughts,t5_2szyo,,False,False,t3_114e1mh,t1_j8vvrts,/r/Showerthoughts/comments/114e1mh/well_have_true_gender_equality_when_a_woman_who/j8y0x2x/
167,j8z485u,ravioliguy,"> If a woman is terrible at her job while surrounded by men, it's not gonna go unnoticed.

If a man is terrible at his job while surrounded by women, he would be fired yesterday lol","> If a woman is terrible at her job while surrounded by men, it's not gonna go unnoticed.

If a man is terrible at his job while surrounded by women, he would be fired yesterday lol",1,2023-02-18 00:02:55,<praw.models.comment_forest.CommentForest object at 0x000002547AE72A60>,114e1mh,Showerthoughts,t5_2szyo,,False,False,t3_114e1mh,t1_j8vvrts,/r/Showerthoughts/comments/114e1mh/well_have_true_gender_equality_when_a_woman_who/j8z485u/
168,j8vsx2s,Kaepora25,Oh ok. What was the job I'm curious?,Oh ok. What was the job I'm curious?,-14,2023-02-17 08:29:55,<praw.models.comment_forest.CommentForest object at 0x000002547AE70B50>,114e1mh,Showerthoughts,t5_2szyo,,False,True,t3_114e1mh,t1_j8vstwr,/r/Showerthoughts/comments/114e1mh/well_have_true_gender_equality_when_a_woman_who/j8vsx2s/
169,j8z1mhp,Kaepora25,Reddit hivemind I guess idk man,Reddit hivemind I guess idk man,1,2023-02-17 23:43:20,<praw.models.comment_forest.CommentForest object at 0x000002547AE70C70>,114e1mh,Showerthoughts,t5_2szyo,,False,True,t3_114e1mh,t1_j8yxjtd,/r/Showerthoughts/comments/114e1mh/well_have_true_gender_equality_when_a_woman_who/j8z1mhp/
170,j8yirzh,capGpriv,"Firstly I absolutely support the work to get more women into my field


The main difficulty with any job is getting the first job. Getting that start is awful these days


It’s a competitive world and when you spend a day per application only to be filtered out by idiotic games claiming to be tests, it can be pretty infuriating 


I remember seeing one company I applied to showing off it’s new graduate scheme starts, all female in a highly male dominated field. 
When you are already frustrated this kind of statistical anomaly can be painful to watch, and breeds resentment.


While I and all my white male friends have been fine, all my Indian male friends (mostly very clever) are still looking for jobs. I understand the need for some quotas but I feel they miss the picture and just lead to more discrimination.","Firstly I absolutely support the work to get more women into my field


The main difficulty with any job is getting the first job. Getting that start is awful these days


It’s a competitive world and when you spend a day per application only to be filtered out by idiotic games claiming to be tests, it can be pretty infuriating 


I remember seeing one company I applied to showing off it’s new graduate scheme starts, all female in a highly male dominated field. 
When you are already frustrated this kind of statistical anomaly can be painful to watch, and breeds resentment.


While I and all my white male friends have been fine, all my Indian male friends (mostly very clever) are still looking for jobs. I understand the need for some quotas but I feel they miss the picture and just lead to more discrimination.",1,2023-02-17 21:29:12,<praw.models.comment_forest.CommentForest object at 0x000002547AE70F10>,114e1mh,Showerthoughts,t5_2szyo,,False,False,t3_114e1mh,t1_j8xi0je,/r/Showerthoughts/comments/114e1mh/well_have_true_gender_equality_when_a_woman_who/j8yirzh/
171,j8vz0sy,Kaepora25,What I said never implied that every man was useless. At this point you're just making the worst interpretation you can possibly make out of everything I could have said.,What I said never implied that every man was useless. At this point you're just making the worst interpretation you can possibly make out of everything I could have said.,1,2023-02-17 09:54:40,<praw.models.comment_forest.CommentForest object at 0x000002547AE720D0>,114e1mh,Showerthoughts,t5_2szyo,,False,True,t3_114e1mh,t1_j8vymmj,/r/Showerthoughts/comments/114e1mh/well_have_true_gender_equality_when_a_woman_who/j8vz0sy/
172,j8wy9qa,,Do you think sparrows complain about being sparrows?,Do you think sparrows complain about being sparrows?,1,2023-02-17 15:25:28,<praw.models.comment_forest.CommentForest object at 0x000002547AE72670>,114e1mh,Showerthoughts,t5_2szyo,,False,False,t3_114e1mh,t1_j8wy1b3,/r/Showerthoughts/comments/114e1mh/well_have_true_gender_equality_when_a_woman_who/j8wy9qa/
