,ID,Author,body,Comment,Score,Created On,Replies,Submission,Subreddit,Subreddit_ID,Distinguished,Edited,Is_submitter,link_id,Parent_id,Permalink
49,jzg8kvq,JJ82DMC,"I had a DeLorean for a few years - as part of my username might casually give away.

I said years ago ""most people aren't going to like owning a stainless steel vehicle.""

You have to wash it with the grain. 

You have to dry it with the grain.

It's somehow a fingerprint magnet even if you don't directly touch it.

But I long to have a decently restored DeLorean again. I'm not getting near a Cybertruck. Fuck that.","I had a DeLorean for a few years - as part of my username might casually give away.

I said years ago ""most people aren't going to like owning a stainless steel vehicle.""

You have to wash it with the grain. 

You have to dry it with the grain.

It's somehow a fingerprint magnet even if you don't directly touch it.

But I long to have a decently restored DeLorean again. I'm not getting near a Cybertruck. Fuck that.",25,2023-09-06 23:03:56,<praw.models.comment_forest.CommentForest object at 0x000002541B06A130>,16bn6as,Showerthoughts,t5_2szyo,,False,False,t3_16bn6as,t1_jze5acu,/r/Showerthoughts/comments/16bn6as/the_cybertruck_is_the_delorean_of_our_generation/jzg8kvq/
50,jzf6opl,Pasta-hobo,"It won't be around later on, planned obsolescence is a plague on modern cars, especially electric ones.","It won't be around later on, planned obsolescence is a plague on modern cars, especially electric ones.",25,2023-09-06 19:17:33,<praw.models.comment_forest.CommentForest object at 0x000002541B06A190>,16bn6as,Showerthoughts,t5_2szyo,,False,False,t3_16bn6as,t1_jze5acu,/r/Showerthoughts/comments/16bn6as/the_cybertruck_is_the_delorean_of_our_generation/jzf6opl/
51,jzgnpc6,ANAL_WIZARD_MONGER,Have you ever farted out of your duck,Have you ever farted out of your duck,1,2023-09-07 00:49:08,<praw.models.comment_forest.CommentForest object at 0x000002541B06A250>,16bn6as,Showerthoughts,t5_2szyo,,False,False,t3_16bn6as,t1_jze5acu,/r/Showerthoughts/comments/16bn6as/the_cybertruck_is_the_delorean_of_our_generation/jzgnpc6/
52,jzi266a,RoastedHunter,We just need to make a movie with it,We just need to make a movie with it,1,2023-09-07 08:35:34,<praw.models.comment_forest.CommentForest object at 0x000002541B06A490>,16bn6as,Showerthoughts,t5_2szyo,,False,False,t3_16bn6as,t1_jze5acu,/r/Showerthoughts/comments/16bn6as/the_cybertruck_is_the_delorean_of_our_generation/jzi266a/
53,jzetwj6,SternLecture,agreed. thats its most positive trait. the tesla truck looks like a design a truck company would use to make fun of a competitor.,agreed. thats its most positive trait. the tesla truck looks like a design a truck company would use to make fun of a competitor.,32,2023-09-06 18:03:00,<praw.models.comment_forest.CommentForest object at 0x000002541B06A550>,16bn6as,Showerthoughts,t5_2szyo,,False,False,t3_16bn6as,t1_jzemaqd,/r/Showerthoughts/comments/16bn6as/the_cybertruck_is_the_delorean_of_our_generation/jzetwj6/
54,jzewl8k,ZoomZoom_Driver,"Except the Aztec was a pioneer. Every SUV/CUV on the market today looks precisely how the aztec did. The proportions, the layout, the ideal...

I highly doubt the cybertruck is the future of looks for trucks or vehicles. 

A PT cruiser, as another commenter suggested, is a better mark imho. 😉","Except the Aztec was a pioneer. Every SUV/CUV on the market today looks precisely how the aztec did. The proportions, the layout, the ideal...

I highly doubt the cybertruck is the future of looks for trucks or vehicles. 

A PT cruiser, as another commenter suggested, is a better mark imho. 😉",13,2023-09-06 18:18:49,<praw.models.comment_forest.CommentForest object at 0x000002541B06A730>,16bn6as,Showerthoughts,t5_2szyo,,False,False,t3_16bn6as,t1_jzekcg6,/r/Showerthoughts/comments/16bn6as/the_cybertruck_is_the_delorean_of_our_generation/jzewl8k/
55,jzemilo,Flash635,"That's more like it.
Or the PT Cruiser.","That's more like it.
Or the PT Cruiser.",22,2023-09-06 17:20:16,<praw.models.comment_forest.CommentForest object at 0x000002541B06AA30>,16bn6as,Showerthoughts,t5_2szyo,,False,False,t3_16bn6as,t1_jzekcg6,/r/Showerthoughts/comments/16bn6as/the_cybertruck_is_the_delorean_of_our_generation/jzemilo/
56,jzey7vd,stillnotelf,"I took a trip to Orlando once.

We saw so many ~~piss~~ banana yellow Aztecs.  They stood out.  You could see like 5 at a time in a Disney parking lot.

It must have been a rental fleet.  Pontiac couldn't sell them to individuals so they offloaded them to rental companies.","I took a trip to Orlando once.

We saw so many ~~piss~~ banana yellow Aztecs.  They stood out.  You could see like 5 at a time in a Disney parking lot.

It must have been a rental fleet.  Pontiac couldn't sell them to individuals so they offloaded them to rental companies.",4,2023-09-06 18:28:23,<praw.models.comment_forest.CommentForest object at 0x000002541B06AAF0>,16bn6as,Showerthoughts,t5_2szyo,,False,False,t3_16bn6as,t1_jzekcg6,/r/Showerthoughts/comments/16bn6as/the_cybertruck_is_the_delorean_of_our_generation/jzey7vd/
57,jzf27x3,,Much more accurate,Much more accurate,1,2023-09-06 18:51:38,<praw.models.comment_forest.CommentForest object at 0x000002541B06ACD0>,16bn6as,Showerthoughts,t5_2szyo,,False,False,t3_16bn6as,t1_jzekcg6,/r/Showerthoughts/comments/16bn6as/the_cybertruck_is_the_delorean_of_our_generation/jzf27x3/
58,jzflofv,Puzzleheaded-Fan-208,"At DMV, we called them The Ugly Stick","At DMV, we called them The Ugly Stick",1,2023-09-06 20:42:48,<praw.models.comment_forest.CommentForest object at 0x000002541B06AD90>,16bn6as,Showerthoughts,t5_2szyo,,False,False,t3_16bn6as,t1_jzekcg6,/r/Showerthoughts/comments/16bn6as/the_cybertruck_is_the_delorean_of_our_generation/jzflofv/
59,jzg7zb1,TWVer,Nothing beats the [FIAT Multipla](https://en.wikipedia.org/wiki/Fiat_Multipla).,Nothing beats the [FIAT Multipla](https://en.wikipedia.org/wiki/Fiat_Multipla).,1,2023-09-06 22:59:47,<praw.models.comment_forest.CommentForest object at 0x000002541B06ADF0>,16bn6as,Showerthoughts,t5_2szyo,,False,False,t3_16bn6as,t1_jzekcg6,/r/Showerthoughts/comments/16bn6as/the_cybertruck_is_the_delorean_of_our_generation/jzg7zb1/
60,jzfy87l,ccooffee,"Yeah, if it wasn't for Back to the Future, no one these days below a certain age would even know what a DeLorian was or what it looked like. It would be a footnote in car history.","Yeah, if it wasn't for Back to the Future, no one these days below a certain age would even know what a DeLorian was or what it looked like. It would be a footnote in car history.",6,2023-09-06 21:55:37,<praw.models.comment_forest.CommentForest object at 0x000002541B06AEB0>,16bn6as,Showerthoughts,t5_2szyo,,False,False,t3_16bn6as,t1_jzemilu,/r/Showerthoughts/comments/16bn6as/the_cybertruck_is_the_delorean_of_our_generation/jzfy87l/
61,jzg0s0z,Sameon104,"Eh, my dad as a kid before back to the future thought deloreans were awesome","Eh, my dad as a kid before back to the future thought deloreans were awesome",2,2023-09-06 22:11:46,<praw.models.comment_forest.CommentForest object at 0x000002541B06AF10>,16bn6as,Showerthoughts,t5_2szyo,,False,False,t3_16bn6as,t1_jzemilu,/r/Showerthoughts/comments/16bn6as/the_cybertruck_is_the_delorean_of_our_generation/jzg0s0z/
62,jzeq9d5,TurbulentPromise4812,If I ever see one driving down the street I'll want to follow behind it with a bell repeating Shame,If I ever see one driving down the street I'll want to follow behind it with a bell repeating Shame,3,2023-09-06 17:41:56,<praw.models.comment_forest.CommentForest object at 0x000002541B06AF70>,16bn6as,Showerthoughts,t5_2szyo,,False,False,t3_16bn6as,t1_jzemilu,/r/Showerthoughts/comments/16bn6as/the_cybertruck_is_the_delorean_of_our_generation/jzeq9d5/
63,jzgkqyq,powerlesshero111,"If the glass really was unbreakable, the cybertruck would just be a coffin on wheels when you got into a moderate or severe car accident. Imagine bleeding from the head and being trapped in your vehicle because the paramedics/firefighters can't break the glass to get you out.","If the glass really was unbreakable, the cybertruck would just be a coffin on wheels when you got into a moderate or severe car accident. Imagine bleeding from the head and being trapped in your vehicle because the paramedics/firefighters can't break the glass to get you out.",3,2023-09-07 00:28:30,<praw.models.comment_forest.CommentForest object at 0x000002541B0810D0>,16bn6as,Showerthoughts,t5_2szyo,,False,False,t3_16bn6as,t1_jzeixl1,/r/Showerthoughts/comments/16bn6as/the_cybertruck_is_the_delorean_of_our_generation/jzgkqyq/
64,jzfq9va,vipersrt6,And it actually exists,And it actually exists,3,2023-09-06 21:08:50,<praw.models.comment_forest.CommentForest object at 0x000002541B081610>,16bn6as,Showerthoughts,t5_2szyo,,False,False,t3_16bn6as,t1_jze7bot,/r/Showerthoughts/comments/16bn6as/the_cybertruck_is_the_delorean_of_our_generation/jzfq9va/
65,jzeber2,Kooky_Inevitable5648,Plus the stainless steel body,Plus the stainless steel body,1,2023-09-06 16:15:03,<praw.models.comment_forest.CommentForest object at 0x000002541B081850>,16bn6as,Showerthoughts,t5_2szyo,,False,False,t3_16bn6as,t1_jzeam92,/r/Showerthoughts/comments/16bn6as/the_cybertruck_is_the_delorean_of_our_generation/jzeber2/
66,jzetxdb,Mrfish31,My first thought when I saw one was one of those dog like murder robots in Black Mirror: *Metalhead*. Definitely not an endearing design.,My first thought when I saw one was one of those dog like murder robots in Black Mirror: *Metalhead*. Definitely not an endearing design.,0,2023-09-06 18:03:08,<praw.models.comment_forest.CommentForest object at 0x000002541B0818B0>,16bn6as,Showerthoughts,t5_2szyo,,False,False,t3_16bn6as,t1_jzeam92,/r/Showerthoughts/comments/16bn6as/the_cybertruck_is_the_delorean_of_our_generation/jzetxdb/
67,jzgfdnx,No_Mistake5238,I would love to have a DeLorean except for the bad engine output. Not sure what I would want to put in it instead though.,I would love to have a DeLorean except for the bad engine output. Not sure what I would want to put in it instead though.,2,2023-09-06 23:50:57,<praw.models.comment_forest.CommentForest object at 0x000002541B06A1F0>,16bn6as,Showerthoughts,t5_2szyo,,False,False,t3_16bn6as,t1_jzg8kvq,/r/Showerthoughts/comments/16bn6as/the_cybertruck_is_the_delorean_of_our_generation/jzgfdnx/
68,jzfcy4l,Ozcogger,Especially since they have kill switches in them that Elon can just flick and the poor craftsmanship will make these things disappear before we settle Mars.,Especially since they have kill switches in them that Elon can just flick and the poor craftsmanship will make these things disappear before we settle Mars.,2,2023-09-06 19:53:49,<praw.models.comment_forest.CommentForest object at 0x000002541B06A430>,16bn6as,Showerthoughts,t5_2szyo,,False,False,t3_16bn6as,t1_jzf6opl,/r/Showerthoughts/comments/16bn6as/the_cybertruck_is_the_delorean_of_our_generation/jzfcy4l/
69,jzeu93n,Flash635,I didn't believe it at first.,I didn't believe it at first.,10,2023-09-06 18:05:02,<praw.models.comment_forest.CommentForest object at 0x000002541B06A610>,16bn6as,Showerthoughts,t5_2szyo,,False,False,t3_16bn6as,t1_jzetwj6,/r/Showerthoughts/comments/16bn6as/the_cybertruck_is_the_delorean_of_our_generation/jzeu93n/
70,jzfcrwf,Ozcogger,Tbh I just see over engineered screaming at me. They spent so much time planning it all they didn't stop to think if they should.,Tbh I just see over engineered screaming at me. They spent so much time planning it all they didn't stop to think if they should.,2,2023-09-06 19:52:50,<praw.models.comment_forest.CommentForest object at 0x000002541B06A670>,16bn6as,Showerthoughts,t5_2szyo,,False,False,t3_16bn6as,t1_jzetwj6,/r/Showerthoughts/comments/16bn6as/the_cybertruck_is_the_delorean_of_our_generation/jzfcrwf/
71,jzfnka7,Cautemoc,Or the Nissan Cube ... I remember that thing being pushed so hard on commercials then never seeing one anywhere in real life.,Or the Nissan Cube ... I remember that thing being pushed so hard on commercials then never seeing one anywhere in real life.,2,2023-09-06 20:53:19,<praw.models.comment_forest.CommentForest object at 0x000002541B06AA90>,16bn6as,Showerthoughts,t5_2szyo,,False,False,t3_16bn6as,t1_jzewl8k,/r/Showerthoughts/comments/16bn6as/the_cybertruck_is_the_delorean_of_our_generation/jzfnka7/
72,jzfb7tl,OriginalBud,My buddy used to have one and he called it the Party Time Cruiser lol,My buddy used to have one and he called it the Party Time Cruiser lol,6,2023-09-06 19:43:56,<praw.models.comment_forest.CommentForest object at 0x000002541B06ABB0>,16bn6as,Showerthoughts,t5_2szyo,,False,False,t3_16bn6as,t1_jzemilo,/r/Showerthoughts/comments/16bn6as/the_cybertruck_is_the_delorean_of_our_generation/jzfb7tl/
73,jzflz9p,Puzzleheaded-Fan-208,"PT's were actually pretty useful if not beautiful.  The HHR drove like a freaking dream, and as soon as I knew that and was thinking about buying one, they discontinued them...","PT's were actually pretty useful if not beautiful.  The HHR drove like a freaking dream, and as soon as I knew that and was thinking about buying one, they discontinued them...",3,2023-09-06 20:44:30,<praw.models.comment_forest.CommentForest object at 0x000002541B06AC10>,16bn6as,Showerthoughts,t5_2szyo,,False,False,t3_16bn6as,t1_jzemilo,/r/Showerthoughts/comments/16bn6as/the_cybertruck_is_the_delorean_of_our_generation/jzflz9p/
74,jzqfgav,VanillaBoxCake,Prescient!,Prescient!,1,2023-09-08 21:49:16,<praw.models.comment_forest.CommentForest object at 0x000002541B06AFD0>,16bn6as,Showerthoughts,t5_2szyo,,False,False,t3_16bn6as,t1_jzg0s0z,/r/Showerthoughts/comments/16bn6as/the_cybertruck_is_the_delorean_of_our_generation/jzqfgav/
75,jzgle7p,Zeksama,And this is exactly WHY unbreakable glass isn’t available in any commercially available vehicle.,And this is exactly WHY unbreakable glass isn’t available in any commercially available vehicle.,5,2023-09-07 00:32:59,<praw.models.comment_forest.CommentForest object at 0x000002541B081190>,16bn6as,Showerthoughts,t5_2szyo,,False,False,t3_16bn6as,t1_jzgkqyq,/r/Showerthoughts/comments/16bn6as/the_cybertruck_is_the_delorean_of_our_generation/jzgle7p/
76,jzh7ked,Some-Philly-Dude,A flux capacitor duh,A flux capacitor duh,5,2023-09-07 03:12:38,<praw.models.comment_forest.CommentForest object at 0x000002541B06A2B0>,16bn6as,Showerthoughts,t5_2szyo,,False,False,t3_16bn6as,t1_jzgfdnx,/r/Showerthoughts/comments/16bn6as/the_cybertruck_is_the_delorean_of_our_generation/jzh7ked/
77,jzh7o3j,TUNGSTEN_WOOKIE,"An LS1, what else is there? Lol","An LS1, what else is there? Lol",2,2023-09-07 03:13:28,<praw.models.comment_forest.CommentForest object at 0x000002541B06A310>,16bn6as,Showerthoughts,t5_2szyo,,False,False,t3_16bn6as,t1_jzgfdnx,/r/Showerthoughts/comments/16bn6as/the_cybertruck_is_the_delorean_of_our_generation/jzh7o3j/
78,jzhqkz7,ReaperEngine,"""Let's see if you bastards can do 90"" is a very funny phrase now.","""Let's see if you bastards can do 90"" is a very funny phrase now.",1,2023-09-07 06:11:55,<praw.models.comment_forest.CommentForest object at 0x000002541B06A370>,16bn6as,Showerthoughts,t5_2szyo,,False,False,t3_16bn6as,t1_jzgfdnx,/r/Showerthoughts/comments/16bn6as/the_cybertruck_is_the_delorean_of_our_generation/jzhqkz7/
79,jzlr0w9,JJ82DMC,"Back when I had facebook (at the time I owned it), I was 'friends' with someone that dropped an LS-1 into it for...I believe it was their mechanical engineering capstone project. You can find videos on YouTube about test drives for it.

There are other companies like DeLorean Performance Industries that will do crazy stuff if you've got the coin - upgrade it to EFI, drop in an EcoBoost engine, some pretty wild stuff.

I personally exited the whole ordeal when my transmission (automatic) - began to fail in a pretty spectacular fashion if going on a drive longer than say, 5 miles or above 60 MPH. I wasn't adverse not owning a manual, I learned to drive a manual F-250 with one when I was 12, but considering the lack of power steering in the vehicle (that's a kit you can have installed in a DeLorean now too, btw), I didn't want to mess with both at the same time.

Being a DeLorean, absolutely no transmission shop would accept my car for service. I live in the DFW metro, and called far and wide.

Then DPI sends me a pic of an auto transmission completely rebuilt and said ""it's yours for 5 grand!""

I'm sorry but a transmission for 3 months worth of mortgage payments? That's a no from me fam. I sold it on eBay as-is.","Back when I had facebook (at the time I owned it), I was 'friends' with someone that dropped an LS-1 into it for...I believe it was their mechanical engineering capstone project. You can find videos on YouTube about test drives for it.

There are other companies like DeLorean Performance Industries that will do crazy stuff if you've got the coin - upgrade it to EFI, drop in an EcoBoost engine, some pretty wild stuff.

I personally exited the whole ordeal when my transmission (automatic) - began to fail in a pretty spectacular fashion if going on a drive longer than say, 5 miles or above 60 MPH. I wasn't adverse not owning a manual, I learned to drive a manual F-250 with one when I was 12, but considering the lack of power steering in the vehicle (that's a kit you can have installed in a DeLorean now too, btw), I didn't want to mess with both at the same time.

Being a DeLorean, absolutely no transmission shop would accept my car for service. I live in the DFW metro, and called far and wide.

Then DPI sends me a pic of an auto transmission completely rebuilt and said ""it's yours for 5 grand!""

I'm sorry but a transmission for 3 months worth of mortgage payments? That's a no from me fam. I sold it on eBay as-is.",1,2023-09-08 00:17:37,<praw.models.comment_forest.CommentForest object at 0x000002541B06A3D0>,16bn6as,Showerthoughts,t5_2szyo,,1694135081.0,False,t3_16bn6as,t1_jzgfdnx,/r/Showerthoughts/comments/16bn6as/the_cybertruck_is_the_delorean_of_our_generation/jzlr0w9/
80,jzfifwk,SternLecture,i still really cant believe it. its just so bad. everything is just so fundamentally ugly. its like a joke that only exists to shock.,i still really cant believe it. its just so bad. everything is just so fundamentally ugly. its like a joke that only exists to shock.,7,2023-09-06 20:24:27,<praw.models.comment_forest.CommentForest object at 0x000002541B06A6D0>,16bn6as,Showerthoughts,t5_2szyo,,False,False,t3_16bn6as,t1_jzeu93n,/r/Showerthoughts/comments/16bn6as/the_cybertruck_is_the_delorean_of_our_generation/jzfifwk/
81,jzfgnwt,SternLecture,"it should never have left the toilet where the scribbled on piece of toilet paper was rightfully placed.

the general shape is just egregiously ugly. there is nothing reddeming about it. loke the donald trump of trucks.","it should never have left the toilet where the scribbled on piece of toilet paper was rightfully placed.

the general shape is just egregiously ugly. there is nothing reddeming about it. loke the donald trump of trucks.",6,2023-09-06 20:15:08,<praw.models.comment_forest.CommentForest object at 0x000002541B06A7F0>,16bn6as,Showerthoughts,t5_2szyo,,False,False,t3_16bn6as,t1_jzfcrwf,/r/Showerthoughts/comments/16bn6as/the_cybertruck_is_the_delorean_of_our_generation/jzfgnwt/
82,jzfoe20,Cautemoc,"Worst part, imo, is how high an angle the windshield is at. It's angled so tightly it's going to make any rain, dirt, scratches incredibly obvious and distracting, along with having a slight distortion on the light coming in. I would never want a windshield at that acute of an angle.","Worst part, imo, is how high an angle the windshield is at. It's angled so tightly it's going to make any rain, dirt, scratches incredibly obvious and distracting, along with having a slight distortion on the light coming in. I would never want a windshield at that acute of an angle.",0,2023-09-06 20:58:01,<praw.models.comment_forest.CommentForest object at 0x000002541B06A8B0>,16bn6as,Showerthoughts,t5_2szyo,,False,False,t3_16bn6as,t1_jzfcrwf,/r/Showerthoughts/comments/16bn6as/the_cybertruck_is_the_delorean_of_our_generation/jzfoe20/
83,jzh2ze7,CharisMatticOfficial,I’m fairly sure I designed it in Paint when I was 5…,I’m fairly sure I designed it in Paint when I was 5…,1,2023-09-07 02:38:12,<praw.models.comment_forest.CommentForest object at 0x000002541B06A970>,16bn6as,Showerthoughts,t5_2szyo,,False,False,t3_16bn6as,t1_jzfcrwf,/r/Showerthoughts/comments/16bn6as/the_cybertruck_is_the_delorean_of_our_generation/jzh2ze7/
84,jzhyk78,crimony70,There are a fair number of Nissan Cubes in Australia.,There are a fair number of Nissan Cubes in Australia.,1,2023-09-07 07:50:03,<praw.models.comment_forest.CommentForest object at 0x000002541B06AB50>,16bn6as,Showerthoughts,t5_2szyo,,False,False,t3_16bn6as,t1_jzfnka7,/r/Showerthoughts/comments/16bn6as/the_cybertruck_is_the_delorean_of_our_generation/jzhyk78/
85,jzglin6,mr_ji,More like Porcelain Tub Cruiser,More like Porcelain Tub Cruiser,1,2023-09-07 00:33:51,<praw.models.comment_forest.CommentForest object at 0x000002541B06AC70>,16bn6as,Showerthoughts,t5_2szyo,,False,False,t3_16bn6as,t1_jzfb7tl,/r/Showerthoughts/comments/16bn6as/the_cybertruck_is_the_delorean_of_our_generation/jzglin6/
86,jzg7zq0,deciduouscoast,I drove an HHR delivering papers for awhile. Loved that thing. I still look at them and consider buying one from time to time.,I drove an HHR delivering papers for awhile. Loved that thing. I still look at them and consider buying one from time to time.,1,2023-09-06 22:59:51,<praw.models.comment_forest.CommentForest object at 0x000002541B06AD30>,16bn6as,Showerthoughts,t5_2szyo,,False,False,t3_16bn6as,t1_jzflz9p,/r/Showerthoughts/comments/16bn6as/the_cybertruck_is_the_delorean_of_our_generation/jzg7zq0/
87,jzfo1gr,sik_dik,classic edgelord elon,classic edgelord elon,5,2023-09-06 20:55:59,<praw.models.comment_forest.CommentForest object at 0x000002541B06A790>,16bn6as,Showerthoughts,t5_2szyo,,False,False,t3_16bn6as,t1_jzfifwk,/r/Showerthoughts/comments/16bn6as/the_cybertruck_is_the_delorean_of_our_generation/jzfo1gr/
88,jzhyhmv,crimony70,It should never have gotten any further than an intrusive thought.,It should never have gotten any further than an intrusive thought.,2,2023-09-07 07:49:08,<praw.models.comment_forest.CommentForest object at 0x000002541B06A910>,16bn6as,Showerthoughts,t5_2szyo,,False,False,t3_16bn6as,t1_jzfgnwt,/r/Showerthoughts/comments/16bn6as/the_cybertruck_is_the_delorean_of_our_generation/jzhyhmv/
89,jzg3r24,SternLecture,yeah exaclty.,yeah exaclty.,2,2023-09-06 22:31:13,<praw.models.comment_forest.CommentForest object at 0x000002541B06A850>,16bn6as,Showerthoughts,t5_2szyo,,False,False,t3_16bn6as,t1_jzfo1gr,/r/Showerthoughts/comments/16bn6as/the_cybertruck_is_the_delorean_of_our_generation/jzg3r24/
90,jzjh2vx,SternLecture,haha well said.,haha well said.,1,2023-09-07 15:24:57,<praw.models.comment_forest.CommentForest object at 0x000002541B06A9D0>,16bn6as,Showerthoughts,t5_2szyo,,False,False,t3_16bn6as,t1_jzhyhmv,/r/Showerthoughts/comments/16bn6as/the_cybertruck_is_the_delorean_of_our_generation/jzjh2vx/
91,k04mq7r,MetalTimster,The word amateur only makes you think of porn if you watch too much porn,The word amateur only makes you think of porn if you watch too much porn,98,2023-09-11 16:21:23,<praw.models.comment_forest.CommentForest object at 0x000002541EDC0550>,16fyq11,Showerthoughts,t5_2szyo,,False,False,t3_16fyq11,t3_16fyq11,/r/Showerthoughts/comments/16fyq11/amateur_is_a_hard_word_to_spell_unless_that_is/k04mq7r/
92,k0519ei,Shutterbug927,"A Mate U R 

Easy Peasy","A Mate U R 

Easy Peasy",15,2023-09-11 17:48:22,<praw.models.comment_forest.CommentForest object at 0x000002541EDC05B0>,16fyq11,Showerthoughts,t5_2szyo,,False,False,t3_16fyq11,t3_16fyq11,/r/Showerthoughts/comments/16fyq11/amateur_is_a_hard_word_to_spell_unless_that_is/k0519ei/
93,k05l7mv,fallen17754,OP deserves negative karma,OP deserves negative karma,15,2023-09-11 19:46:34,<praw.models.comment_forest.CommentForest object at 0x000002541EDC0670>,16fyq11,Showerthoughts,t5_2szyo,,False,False,t3_16fyq11,t3_16fyq11,/r/Showerthoughts/comments/16fyq11/amateur_is_a_hard_word_to_spell_unless_that_is/k05l7mv/
94,k05c5hn,RanielDoelofs,What... are you talking about,What... are you talking about,4,2023-09-11 18:53:01,<praw.models.comment_forest.CommentForest object at 0x000002541EDC07F0>,16fyq11,Showerthoughts,t5_2szyo,,False,False,t3_16fyq11,t3_16fyq11,/r/Showerthoughts/comments/16fyq11/amateur_is_a_hard_word_to_spell_unless_that_is/k05c5hn/
95,k04kimj,RunnyDischarge,Amateur is a hard word to spell if you don’t speak English,Amateur is a hard word to spell if you don’t speak English,19,2023-09-11 16:07:57,<praw.models.comment_forest.CommentForest object at 0x000002541EDC0850>,16fyq11,Showerthoughts,t5_2szyo,,False,False,t3_16fyq11,t3_16fyq11,/r/Showerthoughts/comments/16fyq11/amateur_is_a_hard_word_to_spell_unless_that_is/k04kimj/
96,k054trx,sambarjo,It is also easy to spell if you speak French.,It is also easy to spell if you speak French.,4,2023-09-11 18:09:32,<praw.models.comment_forest.CommentForest object at 0x000002541EDC08B0>,16fyq11,Showerthoughts,t5_2szyo,,False,False,t3_16fyq11,t3_16fyq11,/r/Showerthoughts/comments/16fyq11/amateur_is_a_hard_word_to_spell_unless_that_is/k054trx/
97,k05a0g2,Charadin,"OP is really telling on themself here since ""amateur sports"" and the like is also a very commonly used term.","OP is really telling on themself here since ""amateur sports"" and the like is also a very commonly used term.",6,2023-09-11 18:40:31,<praw.models.comment_forest.CommentForest object at 0x000002541EDC09D0>,16fyq11,Showerthoughts,t5_2szyo,,False,False,t3_16fyq11,t3_16fyq11,/r/Showerthoughts/comments/16fyq11/amateur_is_a_hard_word_to_spell_unless_that_is/k05a0g2/
