,ID,Author,body,Comment,Score,Created On,Replies,Submission,Subreddit,Subreddit_ID,Distinguished,Edited,Is_submitter,link_id,Parent_id,Permalink
0,jzet5p9,blueB0wser,"The DeLorean was a key part in a cool movie series.

The cyber truck is one of an idiot billionaire's failed passion projects.

Not really the same imo","The DeLorean was a key part in a cool movie series.

The cyber truck is one of an idiot billionaire's failed passion projects.

Not really the same imo",40,2023-09-06 17:58:41,<praw.models.comment_forest.CommentForest object at 0x000002541B058F10>,16bn6as,Showerthoughts,t5_2szyo,,False,False,t3_16bn6as,t3_16bn6as,/r/Showerthoughts/comments/16bn6as/the_cybertruck_is_the_delorean_of_our_generation/jzet5p9/
1,jze5acu,crazedhatter,"Nah, it'll never be remembered that fondly later on.","Nah, it'll never be remembered that fondly later on.",210,2023-09-06 15:38:44,<praw.models.comment_forest.CommentForest object at 0x000002541B058F70>,16bn6as,Showerthoughts,t5_2szyo,,False,False,t3_16bn6as,t3_16bn6as,/r/Showerthoughts/comments/16bn6as/the_cybertruck_is_the_delorean_of_our_generation/jze5acu/
2,jzemaqd,Flash635,No. A DeLorean actually looks pretty decent in the flesh.,No. A DeLorean actually looks pretty decent in the flesh.,109,2023-09-06 17:19:00,<praw.models.comment_forest.CommentForest object at 0x000002541B06A0D0>,16bn6as,Showerthoughts,t5_2szyo,,False,False,t3_16bn6as,t3_16bn6as,/r/Showerthoughts/comments/16bn6as/the_cybertruck_is_the_delorean_of_our_generation/jzemaqd/
3,jzekcg6,blechusdotter,The cyber truck is the Pontiac Aztec of our generation,The cyber truck is the Pontiac Aztec of our generation,90,2023-09-06 17:07:42,<praw.models.comment_forest.CommentForest object at 0x000002541B06A4F0>,16bn6as,Showerthoughts,t5_2szyo,,False,False,t3_16bn6as,t3_16bn6as,/r/Showerthoughts/comments/16bn6as/the_cybertruck_is_the_delorean_of_our_generation/jzekcg6/
4,jzemilu,VanillaBoxCake,"Not unless it becomes timeless by being featured in a popular movie. Also the DeLorean BOMBED in sales, and the truck hasn't even been released yet.","Not unless it becomes timeless by being featured in a popular movie. Also the DeLorean BOMBED in sales, and the truck hasn't even been released yet.",32,2023-09-06 17:20:16,<praw.models.comment_forest.CommentForest object at 0x000002541B06A5B0>,16bn6as,Showerthoughts,t5_2szyo,,False,False,t3_16bn6as,t3_16bn6as,/r/Showerthoughts/comments/16bn6as/the_cybertruck_is_the_delorean_of_our_generation/jzemilu/
5,jzeixl1,Zeksama,"Nope, the DeLorean is a wonderful collector car. The cybertruck will always be remembered for its “Unbreakable glass” and “Within 10 microns” accuracy.","Nope, the DeLorean is a wonderful collector car. The cybertruck will always be remembered for its “Unbreakable glass” and “Within 10 microns” accuracy.",14,2023-09-06 16:59:21,<praw.models.comment_forest.CommentForest object at 0x000002541B06AE50>,16bn6as,Showerthoughts,t5_2szyo,,False,False,t3_16bn6as,t3_16bn6as,/r/Showerthoughts/comments/16bn6as/the_cybertruck_is_the_delorean_of_our_generation/jzeixl1/
6,jze867e,SoloCongaLineChamp,"So Musk is going to get carted off to jail for trafficking cocaine? 

I could be okay with that.","So Musk is going to get carted off to jail for trafficking cocaine? 

I could be okay with that.",30,2023-09-06 15:55:48,<praw.models.comment_forest.CommentForest object at 0x000002541B081070>,16bn6as,Showerthoughts,t5_2szyo,,False,False,t3_16bn6as,t3_16bn6as,/r/Showerthoughts/comments/16bn6as/the_cybertruck_is_the_delorean_of_our_generation/jze867e/
7,jzekivw,StalledAgate832,"Nah, that's honestly an insult to the DeLorean lol.


It actually looks dope, unlike the Cybertruck.","Nah, that's honestly an insult to the DeLorean lol.


It actually looks dope, unlike the Cybertruck.",12,2023-09-06 17:08:45,<praw.models.comment_forest.CommentForest object at 0x000002541B081130>,16bn6as,Showerthoughts,t5_2szyo,,False,False,t3_16bn6as,t3_16bn6as,/r/Showerthoughts/comments/16bn6as/the_cybertruck_is_the_delorean_of_our_generation/jzekivw/
8,jzfb4xm,AduroTri,Cybertruck looks hideous. DeLoreans look fucking awesome.,Cybertruck looks hideous. DeLoreans look fucking awesome.,10,2023-09-06 19:43:26,<praw.models.comment_forest.CommentForest object at 0x000002541B0811F0>,16bn6as,Showerthoughts,t5_2szyo,,False,False,t3_16bn6as,t3_16bn6as,/r/Showerthoughts/comments/16bn6as/the_cybertruck_is_the_delorean_of_our_generation/jzfb4xm/
9,jzgrb9m,dewayneestes,Delorean is much more attractive. Performance is probably similar though.,Delorean is much more attractive. Performance is probably similar though.,5,2023-09-07 01:14:43,<praw.models.comment_forest.CommentForest object at 0x000002541B081250>,16bn6as,Showerthoughts,t5_2szyo,,False,False,t3_16bn6as,t3_16bn6as,/r/Showerthoughts/comments/16bn6as/the_cybertruck_is_the_delorean_of_our_generation/jzgrb9m/
10,jze5z75,South5,"How dare you. Take that back, now!","How dare you. Take that back, now!",9,2023-09-06 15:42:49,<praw.models.comment_forest.CommentForest object at 0x000002541B0812B0>,16bn6as,Showerthoughts,t5_2szyo,,False,False,t3_16bn6as,t3_16bn6as,/r/Showerthoughts/comments/16bn6as/the_cybertruck_is_the_delorean_of_our_generation/jze5z75/
11,jzfi286,InViSiB0B,More like the Penny Farthing bicycles back in the 1800s.,More like the Penny Farthing bicycles back in the 1800s.,3,2023-09-06 20:22:19,<praw.models.comment_forest.CommentForest object at 0x000002541B081310>,16bn6as,Showerthoughts,t5_2szyo,,False,False,t3_16bn6as,t3_16bn6as,/r/Showerthoughts/comments/16bn6as/the_cybertruck_is_the_delorean_of_our_generation/jzfi286/
12,jzg82h5,ghostfeather69,Cyber truck is what Elon came up with to get attention on the internet.,Cyber truck is what Elon came up with to get attention on the internet.,3,2023-09-06 23:00:22,<praw.models.comment_forest.CommentForest object at 0x000002541B081370>,16bn6as,Showerthoughts,t5_2szyo,,False,False,t3_16bn6as,t3_16bn6as,/r/Showerthoughts/comments/16bn6as/the_cybertruck_is_the_delorean_of_our_generation/jzg82h5/
13,jzg9vgt,Sailorman2300,"Lol...no. Not even close. 

The cybertruck is the cybertruck of our generation. An ugly impractical automotive vaporware with notoriously fragile windows. 

The DeLorean was/is cool. The cybertruck is most definitely not cool. Even the name is dumb.","Lol...no. Not even close. 

The cybertruck is the cybertruck of our generation. An ugly impractical automotive vaporware with notoriously fragile windows. 

The DeLorean was/is cool. The cybertruck is most definitely not cool. Even the name is dumb.",3,2023-09-06 23:12:43,<praw.models.comment_forest.CommentForest object at 0x000002541B0813D0>,16bn6as,Showerthoughts,t5_2szyo,,False,False,t3_16bn6as,t3_16bn6as,/r/Showerthoughts/comments/16bn6as/the_cybertruck_is_the_delorean_of_our_generation/jzg9vgt/
14,jzgit1g,IWearBones138__,DeLoreans were cool though.,DeLoreans were cool though.,3,2023-09-07 00:14:59,<praw.models.comment_forest.CommentForest object at 0x000002541B081430>,16bn6as,Showerthoughts,t5_2szyo,,False,False,t3_16bn6as,t3_16bn6as,/r/Showerthoughts/comments/16bn6as/the_cybertruck_is_the_delorean_of_our_generation/jzgit1g/
15,jzgvhrj,ColdEngineBadBrakes,The DeLorean was cool.,The DeLorean was cool.,3,2023-09-07 01:44:30,<praw.models.comment_forest.CommentForest object at 0x000002541B081490>,16bn6as,Showerthoughts,t5_2szyo,,False,False,t3_16bn6as,t3_16bn6as,/r/Showerthoughts/comments/16bn6as/the_cybertruck_is_the_delorean_of_our_generation/jzgvhrj/
16,jzevkn0,TheGinger_Ninja0,I don't think it can be the anything of our generation when it hasn't released yet,I don't think it can be the anything of our generation when it hasn't released yet,4,2023-09-06 18:12:52,<praw.models.comment_forest.CommentForest object at 0x000002541B0814F0>,16bn6as,Showerthoughts,t5_2szyo,,False,False,t3_16bn6as,t3_16bn6as,/r/Showerthoughts/comments/16bn6as/the_cybertruck_is_the_delorean_of_our_generation/jzevkn0/
17,jze7bot,MarioKing1137,The difference is that the Delorean actually had style to it,The difference is that the Delorean actually had style to it,5,2023-09-06 15:50:50,<praw.models.comment_forest.CommentForest object at 0x000002541B081550>,16bn6as,Showerthoughts,t5_2szyo,,False,False,t3_16bn6as,t3_16bn6as,/r/Showerthoughts/comments/16bn6as/the_cybertruck_is_the_delorean_of_our_generation/jze7bot/
18,jzfadn5,HordeMaster-50_12,Seeing Musk arrested for cocaine trafficking would be so sweet...,Seeing Musk arrested for cocaine trafficking would be so sweet...,2,2023-09-06 19:38:58,<praw.models.comment_forest.CommentForest object at 0x000002541B0815B0>,16bn6as,Showerthoughts,t5_2szyo,,False,False,t3_16bn6as,t3_16bn6as,/r/Showerthoughts/comments/16bn6as/the_cybertruck_is_the_delorean_of_our_generation/jzfadn5/
19,jzfdy1z,ArmedBull,"No, our DeLorean is the 2004 Pontiac Aztek","No, our DeLorean is the 2004 Pontiac Aztek",2,2023-09-06 19:59:30,<praw.models.comment_forest.CommentForest object at 0x000002541B081670>,16bn6as,Showerthoughts,t5_2szyo,,False,False,t3_16bn6as,t3_16bn6as,/r/Showerthoughts/comments/16bn6as/the_cybertruck_is_the_delorean_of_our_generation/jzfdy1z/
20,jze9yw4,Molwar,"Not really, everyone's wanted a DeLorean since the 80s, only a specific few wants a Cybertruck.","Not really, everyone's wanted a DeLorean since the 80s, only a specific few wants a Cybertruck.",2,2023-09-06 16:06:25,<praw.models.comment_forest.CommentForest object at 0x000002541B0816D0>,16bn6as,Showerthoughts,t5_2szyo,,False,False,t3_16bn6as,t3_16bn6as,/r/Showerthoughts/comments/16bn6as/the_cybertruck_is_the_delorean_of_our_generation/jze9yw4/
21,jzevqdt,ScottOld,The cyber truck is the Nissan juke of this decade,The cyber truck is the Nissan juke of this decade,1,2023-09-06 18:13:49,<praw.models.comment_forest.CommentForest object at 0x000002541B081730>,16bn6as,Showerthoughts,t5_2szyo,,False,False,t3_16bn6as,t3_16bn6as,/r/Showerthoughts/comments/16bn6as/the_cybertruck_is_the_delorean_of_our_generation/jzevqdt/
22,jzeam92,unbibium,"well they both look like 1980s movies but the similarity ends there

DeLorean: looks like that movie trilogy where Michael J Fox time traveled and hoverboarded and went to the Old West and imagine the possibilities!

Cybertruck: looks like every Paul Verhoeven movie where everything is gray and bullets and there's a CEO whose fortune comes from making everyone miserable.","well they both look like 1980s movies but the similarity ends there

DeLorean: looks like that movie trilogy where Michael J Fox time traveled and hoverboarded and went to the Old West and imagine the possibilities!

Cybertruck: looks like every Paul Verhoeven movie where everything is gray and bullets and there's a CEO whose fortune comes from making everyone miserable.",1,2023-09-06 16:10:17,<praw.models.comment_forest.CommentForest object at 0x000002541B081790>,16bn6as,Showerthoughts,t5_2szyo,,False,False,t3_16bn6as,t3_16bn6as,/r/Showerthoughts/comments/16bn6as/the_cybertruck_is_the_delorean_of_our_generation/jzeam92/
23,jzeuqmp,Asterisk49,I don't think it will ever be as iconic,I don't think it will ever be as iconic,1,2023-09-06 18:07:56,<praw.models.comment_forest.CommentForest object at 0x000002541B0817F0>,16bn6as,Showerthoughts,t5_2szyo,,False,False,t3_16bn6as,t3_16bn6as,/r/Showerthoughts/comments/16bn6as/the_cybertruck_is_the_delorean_of_our_generation/jzeuqmp/
24,jzev0pd,Bing_Bong_the_Archer,Thats very generous of you,Thats very generous of you,1,2023-09-06 18:09:36,<praw.models.comment_forest.CommentForest object at 0x000002541B081910>,16bn6as,Showerthoughts,t5_2szyo,,False,False,t3_16bn6as,t3_16bn6as,/r/Showerthoughts/comments/16bn6as/the_cybertruck_is_the_delorean_of_our_generation/jzev0pd/
25,jzf0zld,ricdesi,A giant piece of shit that is only liked from afar by people who don't own one?,A giant piece of shit that is only liked from afar by people who don't own one?,1,2023-09-06 18:44:30,<praw.models.comment_forest.CommentForest object at 0x000002541B081970>,16bn6as,Showerthoughts,t5_2szyo,,False,False,t3_16bn6as,t3_16bn6as,/r/Showerthoughts/comments/16bn6as/the_cybertruck_is_the_delorean_of_our_generation/jzf0zld/
26,jzf8bbi,MortalPhantom,"If you mean a complete failure, just as the Delorean was in it's time until it was made famous by the movie, then yes.","If you mean a complete failure, just as the Delorean was in it's time until it was made famous by the movie, then yes.",1,2023-09-06 19:27:00,<praw.models.comment_forest.CommentForest object at 0x000002541B0819D0>,16bn6as,Showerthoughts,t5_2szyo,,False,False,t3_16bn6as,t3_16bn6as,/r/Showerthoughts/comments/16bn6as/the_cybertruck_is_the_delorean_of_our_generation/jzf8bbi/
27,jzfchz4,masuski1969,Elon tried to finance it with cocaine sales?,Elon tried to finance it with cocaine sales?,1,2023-09-06 19:51:15,<praw.models.comment_forest.CommentForest object at 0x000002541B081A30>,16bn6as,Showerthoughts,t5_2szyo,,False,False,t3_16bn6as,t3_16bn6as,/r/Showerthoughts/comments/16bn6as/the_cybertruck_is_the_delorean_of_our_generation/jzfchz4/
28,jzfhhza,CashDefault,Except much much uglier,Except much much uglier,1,2023-09-06 20:19:07,<praw.models.comment_forest.CommentForest object at 0x000002541B081A90>,16bn6as,Showerthoughts,t5_2szyo,,False,False,t3_16bn6as,t3_16bn6as,/r/Showerthoughts/comments/16bn6as/the_cybertruck_is_the_delorean_of_our_generation/jzfhhza/
29,jzfkoel,uncool_LA_boy,Elon Haters are the haters of our generation.,Elon Haters are the haters of our generation.,-3,2023-09-06 20:37:08,<praw.models.comment_forest.CommentForest object at 0x000002541B081AF0>,16bn6as,Showerthoughts,t5_2szyo,,False,False,t3_16bn6as,t3_16bn6as,/r/Showerthoughts/comments/16bn6as/the_cybertruck_is_the_delorean_of_our_generation/jzfkoel/
30,jzet4sd,Viridionplague,".01 profile tolerance across the entire truck. 

Literally cannot be done. 

But Lego does it so we can too right....  right guys....",".01 profile tolerance across the entire truck. 

Literally cannot be done. 

But Lego does it so we can too right....  right guys....",0,2023-09-06 17:58:32,<praw.models.comment_forest.CommentForest object at 0x000002541B081B50>,16bn6as,Showerthoughts,t5_2szyo,,False,False,t3_16bn6as,t3_16bn6as,/r/Showerthoughts/comments/16bn6as/the_cybertruck_is_the_delorean_of_our_generation/jzet4sd/
31,jzf5r7x,boilerpsych,"I saw a DeLorean in Tennessee the a few nights ago driving down the road and I got more excited than I thought I would.  I totally agree with this post, the DeLorean was, by all accounts, a pretty terrible car but the uniqueness of it has made seeing one a true treasure.  If the Cybertruck does as poorly as I think it will it will be just as rare (and bold by design standards) that spotting one 30 years from now will be a collector's dream!","I saw a DeLorean in Tennessee the a few nights ago driving down the road and I got more excited than I thought I would.  I totally agree with this post, the DeLorean was, by all accounts, a pretty terrible car but the uniqueness of it has made seeing one a true treasure.  If the Cybertruck does as poorly as I think it will it will be just as rare (and bold by design standards) that spotting one 30 years from now will be a collector's dream!",0,2023-09-06 19:12:05,<praw.models.comment_forest.CommentForest object at 0x000002541B081BB0>,16bn6as,Showerthoughts,t5_2szyo,,False,False,t3_16bn6as,t3_16bn6as,/r/Showerthoughts/comments/16bn6as/the_cybertruck_is_the_delorean_of_our_generation/jzf5r7x/
32,jzflopi,johnmarkfoley,"god, that thing is ugly. what an absolute massive blunder. who the heck is that thing actually for? did he focus group the design at all? it looks like the first draft of a joke submission to a design contest for a device that tells the sex of a baby dolphin.","god, that thing is ugly. what an absolute massive blunder. who the heck is that thing actually for? did he focus group the design at all? it looks like the first draft of a joke submission to a design contest for a device that tells the sex of a baby dolphin.",0,2023-09-06 20:42:51,<praw.models.comment_forest.CommentForest object at 0x000002541B081C10>,16bn6as,Showerthoughts,t5_2szyo,,False,False,t3_16bn6as,t3_16bn6as,/r/Showerthoughts/comments/16bn6as/the_cybertruck_is_the_delorean_of_our_generation/jzflopi/
33,jzfmpd5,Puzzleheaded-Fan-208,"The only thing that the Cyber Truck has going for it is Elon/Tesla fanboy hype.  It's ugly as shit, does not appear to me to be primarily designed to be used, you know, as a pickup--as opposed to a fanboy trophy/fetish item, and it's overpriced and a Tesla, so you are paying the ""everybody will think i am so cool"" premium.  That asshole can do for the auto industry what he did for Twitter!","The only thing that the Cyber Truck has going for it is Elon/Tesla fanboy hype.  It's ugly as shit, does not appear to me to be primarily designed to be used, you know, as a pickup--as opposed to a fanboy trophy/fetish item, and it's overpriced and a Tesla, so you are paying the ""everybody will think i am so cool"" premium.  That asshole can do for the auto industry what he did for Twitter!",0,2023-09-06 20:48:38,<praw.models.comment_forest.CommentForest object at 0x000002541B081C70>,16bn6as,Showerthoughts,t5_2szyo,,False,False,t3_16bn6as,t3_16bn6as,/r/Showerthoughts/comments/16bn6as/the_cybertruck_is_the_delorean_of_our_generation/jzfmpd5/
34,jzfq6tp,vipersrt6,"How's that possible? The delorean was actually produced

The cybertruck isn't even a real thing","How's that possible? The delorean was actually produced

The cybertruck isn't even a real thing",0,2023-09-06 21:08:21,<praw.models.comment_forest.CommentForest object at 0x000002541B081CD0>,16bn6as,Showerthoughts,t5_2szyo,,False,False,t3_16bn6as,t3_16bn6as,/r/Showerthoughts/comments/16bn6as/the_cybertruck_is_the_delorean_of_our_generation/jzfq6tp/
35,jzez4e5,dacreativeguy,"People are going to be surprised when the rednecks and MAGA crowd embrace the Cybertruck. Looks like a tank, drives like a space ship, and BUILT 100% in TEXAS! Elon's no dummy.","People are going to be surprised when the rednecks and MAGA crowd embrace the Cybertruck. Looks like a tank, drives like a space ship, and BUILT 100% in TEXAS! Elon's no dummy.",-4,2023-09-06 18:33:39,<praw.models.comment_forest.CommentForest object at 0x000002541B081D30>,16bn6as,Showerthoughts,t5_2szyo,,False,False,t3_16bn6as,t3_16bn6as,/r/Showerthoughts/comments/16bn6as/the_cybertruck_is_the_delorean_of_our_generation/jzez4e5/
36,jzerzhd,DucksItUp,DeLorean is iconic the Cybertruck is a breadbox with wheels,DeLorean is iconic the Cybertruck is a breadbox with wheels,1,2023-09-06 17:51:52,<praw.models.comment_forest.CommentForest object at 0x000002541B081D90>,16bn6as,Showerthoughts,t5_2szyo,,False,False,t3_16bn6as,t3_16bn6as,/r/Showerthoughts/comments/16bn6as/the_cybertruck_is_the_delorean_of_our_generation/jzerzhd/
37,jzflkr9,Puzzleheaded-Fan-208,"nah, Volkswagen Thing

[https://upload.wikimedia.org/wikipedia/commons/7/71/Vw\_181\_v\_sst.jpg](https://upload.wikimedia.org/wikipedia/commons/7/71/Vw_181_v_sst.jpg)

Deloreans were cool.","nah, Volkswagen Thing

[https://upload.wikimedia.org/wikipedia/commons/7/71/Vw\_181\_v\_sst.jpg](https://upload.wikimedia.org/wikipedia/commons/7/71/Vw_181_v_sst.jpg)

Deloreans were cool.",1,2023-09-06 20:42:14,<praw.models.comment_forest.CommentForest object at 0x000002541B081DF0>,16bn6as,Showerthoughts,t5_2szyo,,False,False,t3_16bn6as,t3_16bn6as,/r/Showerthoughts/comments/16bn6as/the_cybertruck_is_the_delorean_of_our_generation/jzflkr9/
38,jzfr6f1,stupled,It just needs a movie.,It just needs a movie.,1,2023-09-06 21:14:09,<praw.models.comment_forest.CommentForest object at 0x000002541B081E50>,16bn6as,Showerthoughts,t5_2szyo,,False,False,t3_16bn6as,t3_16bn6as,/r/Showerthoughts/comments/16bn6as/the_cybertruck_is_the_delorean_of_our_generation/jzfr6f1/
39,jzfrevg,Chevalier_Lecteur,"No, the DeLorean is the DeLorean of our generation.","No, the DeLorean is the DeLorean of our generation.",1,2023-09-06 21:15:32,<praw.models.comment_forest.CommentForest object at 0x000002541B081EB0>,16bn6as,Showerthoughts,t5_2szyo,,False,False,t3_16bn6as,t3_16bn6as,/r/Showerthoughts/comments/16bn6as/the_cybertruck_is_the_delorean_of_our_generation/jzfrevg/
40,jzfxqls,Economy-Current8427,"You take that back, Sir!","You take that back, Sir!",1,2023-09-06 21:52:40,<praw.models.comment_forest.CommentForest object at 0x000002541B081F10>,16bn6as,Showerthoughts,t5_2szyo,,False,False,t3_16bn6as,t3_16bn6as,/r/Showerthoughts/comments/16bn6as/the_cybertruck_is_the_delorean_of_our_generation/jzfxqls/
41,jzg0vre,Indiana-Cook,It most definitely is not,It most definitely is not,1,2023-09-06 22:12:27,<praw.models.comment_forest.CommentForest object at 0x000002541B081F70>,16bn6as,Showerthoughts,t5_2szyo,,False,False,t3_16bn6as,t3_16bn6as,/r/Showerthoughts/comments/16bn6as/the_cybertruck_is_the_delorean_of_our_generation/jzg0vre/
42,jzg42g4,ADresden,"Disagreed. It's neither revolutionary or beloved in any way. It will be remembered with the opposite of fondness, and if it's ever in a movie it'll be as a joke","Disagreed. It's neither revolutionary or beloved in any way. It will be remembered with the opposite of fondness, and if it's ever in a movie it'll be as a joke",1,2023-09-06 22:33:23,<praw.models.comment_forest.CommentForest object at 0x000002541B081FD0>,16bn6as,Showerthoughts,t5_2szyo,,False,False,t3_16bn6as,t3_16bn6as,/r/Showerthoughts/comments/16bn6as/the_cybertruck_is_the_delorean_of_our_generation/jzg42g4/
43,jzglgt1,Bacon626,The hottest of takes.,The hottest of takes.,1,2023-09-07 00:33:30,<praw.models.comment_forest.CommentForest object at 0x000002541EDD4040>,16bn6as,Showerthoughts,t5_2szyo,,False,False,t3_16bn6as,t3_16bn6as,/r/Showerthoughts/comments/16bn6as/the_cybertruck_is_the_delorean_of_our_generation/jzglgt1/
44,jzi2mtz,RoastedHunter,Nobody here seems to realize the Delorean was a joke before the movie was made,Nobody here seems to realize the Delorean was a joke before the movie was made,1,2023-09-07 08:41:15,<praw.models.comment_forest.CommentForest object at 0x000002541EDD40A0>,16bn6as,Showerthoughts,t5_2szyo,,False,False,t3_16bn6as,t3_16bn6as,/r/Showerthoughts/comments/16bn6as/the_cybertruck_is_the_delorean_of_our_generation/jzi2mtz/
45,jzieln4,ChampionshipBig8290,"Well..  Delorean was made famous by the movie back to the future.  Prior to that, they didn't sell. Nobody wanted one until the movie came out by then. It was too late.

Cybertruck does share some cosmetic similarities,  but that is where it stops. Cybertruck has over 1.2 million preorders. There were around 9,000 deloreans made in total. They didn't sell, and the company died.

So if 1.2 million + people are just actually just tricking and tesla goes out of business as a result 🤔 

Then yeah, they will be remembered in a remarkable similar fashion. 

If only there was a Delorean in orbit...","Well..  Delorean was made famous by the movie back to the future.  Prior to that, they didn't sell. Nobody wanted one until the movie came out by then. It was too late.

Cybertruck does share some cosmetic similarities,  but that is where it stops. Cybertruck has over 1.2 million preorders. There were around 9,000 deloreans made in total. They didn't sell, and the company died.

So if 1.2 million + people are just actually just tricking and tesla goes out of business as a result 🤔 

Then yeah, they will be remembered in a remarkable similar fashion. 

If only there was a Delorean in orbit...",1,2023-09-07 10:58:25,<praw.models.comment_forest.CommentForest object at 0x000002541EDD4100>,16bn6as,Showerthoughts,t5_2szyo,,False,False,t3_16bn6as,t3_16bn6as,/r/Showerthoughts/comments/16bn6as/the_cybertruck_is_the_delorean_of_our_generation/jzieln4/
46,jzig6w8,mrbignaughtyboy,The NEW DeLorean is the DeLorean of THIS generation.,The NEW DeLorean is the DeLorean of THIS generation.,1,2023-09-07 11:12:56,<praw.models.comment_forest.CommentForest object at 0x000002541EDD4160>,16bn6as,Showerthoughts,t5_2szyo,,False,False,t3_16bn6as,t3_16bn6as,/r/Showerthoughts/comments/16bn6as/the_cybertruck_is_the_delorean_of_our_generation/jzig6w8/
47,jzfyd49,ccooffee,How long before Elon decides to make a time travel movie featuring a Cybertruck?,How long before Elon decides to make a time travel movie featuring a Cybertruck?,6,2023-09-06 21:56:28,<praw.models.comment_forest.CommentForest object at 0x000002541B058FD0>,16bn6as,Showerthoughts,t5_2szyo,,False,False,t3_16bn6as,t1_jzet5p9,/r/Showerthoughts/comments/16bn6as/the_cybertruck_is_the_delorean_of_our_generation/jzfyd49/
48,jzi2c4x,RoastedHunter,"It was originally used sort of as a joke, and to further highlight the idea that docs time machine was a ""Thing"". A piece of junk made by an old slightly crazy garage scientist. The delorean was a piece of shit before the movie made it famous. The same thing could theoretically happen with the cyber truck","It was originally used sort of as a joke, and to further highlight the idea that docs time machine was a ""Thing"". A piece of junk made by an old slightly crazy garage scientist. The delorean was a piece of shit before the movie made it famous. The same thing could theoretically happen with the cyber truck",3,2023-09-07 08:37:29,<praw.models.comment_forest.CommentForest object at 0x000002541B06A070>,16bn6as,Showerthoughts,t5_2szyo,,False,False,t3_16bn6as,t1_jzet5p9,/r/Showerthoughts/comments/16bn6as/the_cybertruck_is_the_delorean_of_our_generation/jzi2c4x/
