,ID,Author,body,Comment,Score,Created On,Replies,Submission,Subreddit,Subreddit_ID,Distinguished,Edited,Is_submitter,link_id,Parent_id,Permalink
172,irrvufa,bromygod203,"I will say there are some shows that look absolutely incredible on my OLED and my 75"" Sony 4k. Physical discs definitely look better but things like Stranger Things was a completely different experience on my OLED vs the old TV I had in my bedroom back in July","I will say there are some shows that look absolutely incredible on my OLED and my 75"" Sony 4k. Physical discs definitely look better but things like Stranger Things was a completely different experience on my OLED vs the old TV I had in my bedroom back in July",10,2022-10-10 15:55:21,<praw.models.comment_forest.CommentForest object at 0x0000021CD52083D0>,y0cw8f,gadgets,t5_2qgzt,,False,False,t3_y0cw8f,t1_irrvn8y,/r/gadgets/comments/y0cw8f/lgs_97inch_g2_oled_is_actually_a_bargain_at_25k/irrvufa/
173,iru92nb,Bob_Chris,Completely untrue when it comes to OLED,Completely untrue when it comes to OLED,2,2022-10-11 02:05:12,<praw.models.comment_forest.CommentForest object at 0x0000021CD5208430>,y0cw8f,gadgets,t5_2qgzt,,False,False,t3_y0cw8f,t1_irrvn8y,/r/gadgets/comments/y0cw8f/lgs_97inch_g2_oled_is_actually_a_bargain_at_25k/iru92nb/
174,irsf9f3,bromygod203,"That's weird, was it a Magnolia or Magnolia Design Center? Because the MDC employees make commission the Magnolia Employees don't. But either way a $50k sale (even with different commission rates in different products and brands) wouldn't make you less then ""an amp"" that employee sounds like a bad employee to me quite honestly","That's weird, was it a Magnolia or Magnolia Design Center? Because the MDC employees make commission the Magnolia Employees don't. But either way a $50k sale (even with different commission rates in different products and brands) wouldn't make you less then ""an amp"" that employee sounds like a bad employee to me quite honestly",4,2022-10-10 18:04:54,<praw.models.comment_forest.CommentForest object at 0x0000021CD52084F0>,y0cw8f,gadgets,t5_2qgzt,,False,False,t3_y0cw8f,t1_irseuze,/r/gadgets/comments/y0cw8f/lgs_97inch_g2_oled_is_actually_a_bargain_at_25k/irsf9f3/
175,irremli,Crankshaft1337,The 65 inch c1 is at Costco on sale for 855,The 65 inch c1 is at Costco on sale for 855,6,2022-10-10 13:53:42,<praw.models.comment_forest.CommentForest object at 0x0000021CD5208610>,y0cw8f,gadgets,t5_2qgzt,,False,False,t3_y0cw8f,t1_irr7ya3,/r/gadgets/comments/y0cw8f/lgs_97inch_g2_oled_is_actually_a_bargain_at_25k/irremli/
176,irrdifc,yeahyeahyeah00002,"I recently got a 55"" lg g1 oled for $999 at bestbuy.  It costed LESS than the 55"" c1 at the time.","I recently got a 55"" lg g1 oled for $999 at bestbuy.  It costed LESS than the 55"" c1 at the time.",1,2022-10-10 13:44:55,<praw.models.comment_forest.CommentForest object at 0x0000021CD5208670>,y0cw8f,gadgets,t5_2qgzt,,False,False,t3_y0cw8f,t1_irr7ya3,/r/gadgets/comments/y0cw8f/lgs_97inch_g2_oled_is_actually_a_bargain_at_25k/irrdifc/
177,irrlwku,gdubh,It looked great.,It looked great.,-2,2022-10-10 14:47:45,<praw.models.comment_forest.CommentForest object at 0x0000021CD5208A30>,y0cw8f,gadgets,t5_2qgzt,,False,False,t3_y0cw8f,t1_irrggn9,/r/gadgets/comments/y0cw8f/lgs_97inch_g2_oled_is_actually_a_bargain_at_25k/irrlwku/
178,irra18n,gdubh,I just sent it to you in chat.,I just sent it to you in chat.,4,2022-10-10 13:16:09,<praw.models.comment_forest.CommentForest object at 0x0000021CD50F6100>,y0cw8f,gadgets,t5_2qgzt,,False,False,t3_y0cw8f,t1_irr974t,/r/gadgets/comments/y0cw8f/lgs_97inch_g2_oled_is_actually_a_bargain_at_25k/irra18n/
179,irrbicz,MichaelChinigo,Ok I'll bite… why?,Ok I'll bite… why?,3,2022-10-10 13:28:33,<praw.models.comment_forest.CommentForest object at 0x0000021CD50F6520>,y0cw8f,gadgets,t5_2qgzt,,False,False,t3_y0cw8f,t1_irrbc45,/r/gadgets/comments/y0cw8f/lgs_97inch_g2_oled_is_actually_a_bargain_at_25k/irrbicz/
180,irrc8dq,TNAEnigma,you own a what?,you own a what?,2,2022-10-10 13:34:37,<praw.models.comment_forest.CommentForest object at 0x0000021CD50F6BB0>,y0cw8f,gadgets,t5_2qgzt,,False,False,t3_y0cw8f,t1_irrbc45,/r/gadgets/comments/y0cw8f/lgs_97inch_g2_oled_is_actually_a_bargain_at_25k/irrc8dq/
181,irrdqcd,yeahyeahyeah00002,Do you use it?  What for?  Does it help?   My friend was gonna do hyperbaric treatments for a wound that wouldn't heal.,Do you use it?  What for?  Does it help?   My friend was gonna do hyperbaric treatments for a wound that wouldn't heal.,1,2022-10-10 13:46:39,<praw.models.comment_forest.CommentForest object at 0x0000021CD50F6B20>,y0cw8f,gadgets,t5_2qgzt,,False,False,t3_y0cw8f,t1_irrbc45,/r/gadgets/comments/y0cw8f/lgs_97inch_g2_oled_is_actually_a_bargain_at_25k/irrdqcd/
182,irrevss,Crankshaft1337,I actually thought about buying one. Does it seem to work?,I actually thought about buying one. Does it seem to work?,1,2022-10-10 13:55:44,<praw.models.comment_forest.CommentForest object at 0x0000021CD50F6EB0>,y0cw8f,gadgets,t5_2qgzt,,False,False,t3_y0cw8f,t1_irrbc45,/r/gadgets/comments/y0cw8f/lgs_97inch_g2_oled_is_actually_a_bargain_at_25k/irrevss/
183,irrbbeo,5DollarHitJob,Did she get upset when you said yes?,Did she get upset when you said yes?,3,2022-10-10 13:26:56,<praw.models.comment_forest.CommentForest object at 0x0000021CD5164250>,y0cw8f,gadgets,t5_2qgzt,,False,False,t3_y0cw8f,t1_irraqxr,/r/gadgets/comments/y0cw8f/lgs_97inch_g2_oled_is_actually_a_bargain_at_25k/irrbbeo/
184,irrdll6,MatthewCrawley,What did her boyfriend say?,What did her boyfriend say?,2,2022-10-10 13:45:36,<praw.models.comment_forest.CommentForest object at 0x0000021CD5164850>,y0cw8f,gadgets,t5_2qgzt,,False,False,t3_y0cw8f,t1_irraqxr,/r/gadgets/comments/y0cw8f/lgs_97inch_g2_oled_is_actually_a_bargain_at_25k/irrdll6/
185,irr6s36,wildwildwaste,People that have $25k as pocket money and people that use emulators to play PS2 games aren't in the same category. There is zero overlap in that Venn diagram.,People that have $25k as pocket money and people that use emulators to play PS2 games aren't in the same category. There is zero overlap in that Venn diagram.,6,2022-10-10 12:47:41,<praw.models.comment_forest.CommentForest object at 0x0000021CD5164E80>,y0cw8f,gadgets,t5_2qgzt,,False,False,t3_y0cw8f,t1_irr4is4,/r/gadgets/comments/y0cw8f/lgs_97inch_g2_oled_is_actually_a_bargain_at_25k/irr6s36/
186,irr7j9d,,Nice!,Nice!,0,2022-10-10 12:54:24,<praw.models.comment_forest.CommentForest object at 0x0000021CD5164F40>,y0cw8f,gadgets,t5_2qgzt,,False,False,t3_y0cw8f,t1_irr4is4,/r/gadgets/comments/y0cw8f/lgs_97inch_g2_oled_is_actually_a_bargain_at_25k/irr7j9d/
187,irr5fiv,CrazyEyedApollo,Start thinking about others more.,Start thinking about others more.,-3,2022-10-10 12:35:20,<praw.models.comment_forest.CommentForest object at 0x0000021CD5164B50>,y0cw8f,gadgets,t5_2qgzt,,False,False,t3_y0cw8f,t1_irr4is4,/r/gadgets/comments/y0cw8f/lgs_97inch_g2_oled_is_actually_a_bargain_at_25k/irr5fiv/
188,irrcdq1,ajv6200,If 25k is pocket money then you wouldn’t be wasting your time on Reddit. Simple as that.,If 25k is pocket money then you wouldn’t be wasting your time on Reddit. Simple as that.,1,2022-10-10 13:35:47,<praw.models.comment_forest.CommentForest object at 0x0000021CD5164190>,y0cw8f,gadgets,t5_2qgzt,,False,False,t3_y0cw8f,t1_irr4is4,/r/gadgets/comments/y0cw8f/lgs_97inch_g2_oled_is_actually_a_bargain_at_25k/irrcdq1/
189,irrd2dc,aioncan,There isn’t that many options if you’re looking for a near 100” TV.,There isn’t that many options if you’re looking for a near 100” TV.,1,2022-10-10 13:41:22,<praw.models.comment_forest.CommentForest object at 0x0000021CD516A2E0>,y0cw8f,gadgets,t5_2qgzt,,False,False,t3_y0cw8f,t1_irrb0xi,/r/gadgets/comments/y0cw8f/lgs_97inch_g2_oled_is_actually_a_bargain_at_25k/irrd2dc/
190,irs09p3,niralamba,"Agreed. I've got a flagship phone and it's not all that. $400 phones are the sweet spot, but they should all be cheaper. Plus cell phones are so detrimental to mental health, even moreso than televisions.","Agreed. I've got a flagship phone and it's not all that. $400 phones are the sweet spot, but they should all be cheaper. Plus cell phones are so detrimental to mental health, even moreso than televisions.",1,2022-10-10 16:25:00,<praw.models.comment_forest.CommentForest object at 0x0000021CD516A3D0>,y0cw8f,gadgets,t5_2qgzt,,False,False,t3_y0cw8f,t1_irrffta,/r/gadgets/comments/y0cw8f/lgs_97inch_g2_oled_is_actually_a_bargain_at_25k/irs09p3/
191,irsquf4,DarkLord55_,Nah just don’t like EVs,Nah just don’t like EVs,0,2022-10-10 19:23:19,<praw.models.comment_forest.CommentForest object at 0x0000021CD516AEE0>,y0cw8f,gadgets,t5_2qgzt,,False,False,t3_y0cw8f,t1_irsnpqo,/r/gadgets/comments/y0cw8f/lgs_97inch_g2_oled_is_actually_a_bargain_at_25k/irsquf4/
192,irtuut8,drewret,i just looked and i don’t believe you,i just looked and i don’t believe you,3,2022-10-11 00:16:30,<praw.models.comment_forest.CommentForest object at 0x0000021CD52086D0>,y0cw8f,gadgets,t5_2qgzt,,False,False,t3_y0cw8f,t1_irremli,/r/gadgets/comments/y0cw8f/lgs_97inch_g2_oled_is_actually_a_bargain_at_25k/irtuut8/
193,iru97zk,Bob_Chris,"Hahaha no.  Maybe there is one demo model somewhere that is close to that but it certainly isn't replicable by 99. 99% of buyers.

I did see the demo model of the A80CJ marked down to $900.   My issue is you have  no idea of how many hours are on the panel.","Hahaha no.  Maybe there is one demo model somewhere that is close to that but it certainly isn't replicable by 99. 99% of buyers.

I did see the demo model of the A80CJ marked down to $900.   My issue is you have  no idea of how many hours are on the panel.",3,2022-10-11 02:06:22,<praw.models.comment_forest.CommentForest object at 0x0000021CD5208730>,y0cw8f,gadgets,t5_2qgzt,,1665454182.0,False,t3_y0cw8f,t1_irremli,/r/gadgets/comments/y0cw8f/lgs_97inch_g2_oled_is_actually_a_bargain_at_25k/iru97zk/
194,irrgfj9,ShawnyMcKnight,I saw that deal. I wish I waited for that. I got the C1 55 inch during the holiday season thinking $1300 was as good as it gets for a while. The G1 is very impressive,I saw that deal. I wish I waited for that. I got the C1 55 inch during the holiday season thinking $1300 was as good as it gets for a while. The G1 is very impressive,1,2022-10-10 14:07:45,<praw.models.comment_forest.CommentForest object at 0x0000021CD5208850>,y0cw8f,gadgets,t5_2qgzt,,False,False,t3_y0cw8f,t1_irrdifc,/r/gadgets/comments/y0cw8f/lgs_97inch_g2_oled_is_actually_a_bargain_at_25k/irrgfj9/
195,irrmpy0,happybarfday,"I'm sure it looked great relatively speaking. Any modern 4K OLED TV looks amazing compared to LCDs or HD TVs from a few years back. But if you put it side-by-side with a top of the line latest LG model or whatever that's calibrated properly, then you'd see clear differences in what you're missing. Again, not a big deal for regular joe's who don't know or care about the ins-and-outs of picture quality, but there IS a difference.","I'm sure it looked great relatively speaking. Any modern 4K OLED TV looks amazing compared to LCDs or HD TVs from a few years back. But if you put it side-by-side with a top of the line latest LG model or whatever that's calibrated properly, then you'd see clear differences in what you're missing. Again, not a big deal for regular joe's who don't know or care about the ins-and-outs of picture quality, but there IS a difference.",3,2022-10-10 14:53:27,<praw.models.comment_forest.CommentForest object at 0x0000021CD5208AF0>,y0cw8f,gadgets,t5_2qgzt,,False,False,t3_y0cw8f,t1_irrlwku,/r/gadgets/comments/y0cw8f/lgs_97inch_g2_oled_is_actually_a_bargain_at_25k/irrmpy0/
196,irrc807,,The cell games are in a week and we need at least a year of training,The cell games are in a week and we need at least a year of training,15,2022-10-10 13:34:32,<praw.models.comment_forest.CommentForest object at 0x0000021CD50F6C40>,y0cw8f,gadgets,t5_2qgzt,,False,False,t3_y0cw8f,t1_irrbicz,/r/gadgets/comments/y0cw8f/lgs_97inch_g2_oled_is_actually_a_bargain_at_25k/irrc807/
197,irrds64,drleeisinsurgery,It's supposed to help with healing,It's supposed to help with healing,2,2022-10-10 13:47:03,<praw.models.comment_forest.CommentForest object at 0x0000021CD50F6C70>,y0cw8f,gadgets,t5_2qgzt,,False,False,t3_y0cw8f,t1_irrbicz,/r/gadgets/comments/y0cw8f/lgs_97inch_g2_oled_is_actually_a_bargain_at_25k/irrds64/
198,irrdpxb,drleeisinsurgery,"It's a high pressure, 100 percent oxygen chamber for health","It's a high pressure, 100 percent oxygen chamber for health",2,2022-10-10 13:46:34,<praw.models.comment_forest.CommentForest object at 0x0000021CD50F6B50>,y0cw8f,gadgets,t5_2qgzt,,False,False,t3_y0cw8f,t1_irrc8dq,/r/gadgets/comments/y0cw8f/lgs_97inch_g2_oled_is_actually_a_bargain_at_25k/irrdpxb/
199,irrf3br,drleeisinsurgery,"I have a bunch of accumulated injuries from a lot of exercise and sports over the years. Also I feel mentally sharper afterwards.

There was a study that came out a few years ago that showed hyperbaric chamber treatments increased telomere length. Basically telomeres are part of your body's mechanism to stop DNA decay from copying over and over again. This is one of the theories of aging.","I have a bunch of accumulated injuries from a lot of exercise and sports over the years. Also I feel mentally sharper afterwards.

There was a study that came out a few years ago that showed hyperbaric chamber treatments increased telomere length. Basically telomeres are part of your body's mechanism to stop DNA decay from copying over and over again. This is one of the theories of aging.",2,2022-10-10 13:57:22,<praw.models.comment_forest.CommentForest object at 0x0000021CD50F6BE0>,y0cw8f,gadgets,t5_2qgzt,,False,False,t3_y0cw8f,t1_irrdqcd,/r/gadgets/comments/y0cw8f/lgs_97inch_g2_oled_is_actually_a_bargain_at_25k/irrf3br/
200,irrf9hm,drleeisinsurgery,"Maybe it's just placebo, but it definitely seems to help my little aches and pains. I also feel mentally clearer afterwards.","Maybe it's just placebo, but it definitely seems to help my little aches and pains. I also feel mentally clearer afterwards.",1,2022-10-10 13:58:42,<praw.models.comment_forest.CommentForest object at 0x0000021CD5164460>,y0cw8f,gadgets,t5_2qgzt,,False,False,t3_y0cw8f,t1_irrevss,/r/gadgets/comments/y0cw8f/lgs_97inch_g2_oled_is_actually_a_bargain_at_25k/irrf9hm/
201,irre10c,drleeisinsurgery,She does similar things. We got into a fight once and she came back with a new Porsche.,She does similar things. We got into a fight once and she came back with a new Porsche.,0,2022-10-10 13:49:00,<praw.models.comment_forest.CommentForest object at 0x0000021CD51647F0>,y0cw8f,gadgets,t5_2qgzt,,False,False,t3_y0cw8f,t1_irrbbeo,/r/gadgets/comments/y0cw8f/lgs_97inch_g2_oled_is_actually_a_bargain_at_25k/irre10c/
202,irr7i92,LostMyGunInACardGame,I weep for the children as I savor my $300 glass of whiskey /s,I weep for the children as I savor my $300 glass of whiskey /s,6,2022-10-10 12:54:09,<praw.models.comment_forest.CommentForest object at 0x0000021CD5164A60>,y0cw8f,gadgets,t5_2qgzt,,False,False,t3_y0cw8f,t1_irr5fiv,/r/gadgets/comments/y0cw8f/lgs_97inch_g2_oled_is_actually_a_bargain_at_25k/irr7i92/
203,irr5tfm,,[deleted],[deleted],-10,2022-10-10 12:38:56,<praw.models.comment_forest.CommentForest object at 0x0000021CD50E8BB0>,y0cw8f,gadgets,t5_2qgzt,,False,False,t3_y0cw8f,t1_irr5fiv,/r/gadgets/comments/y0cw8f/lgs_97inch_g2_oled_is_actually_a_bargain_at_25k/irr5tfm/
204,is2zbxh,Beznia,"I picked up a C8 from a Best Buy in 2020 for $898. Floor model, listed online for $1098. Went to pick it up and saw a sticker showing $898. They said it was an accident but still matched the price.

Brought it home, it had over 14,000 hours in the previous 2 years being used as a floor model, so it was on just about 24/7 for 2 years. It had the ""Best Buy"" logo burned in covering a good portion of the screen.

I called up LG and reported burn-in, and knowing they offer 1 free panel replacement even outside warranty, they actually sent out a technician to swap it out. It's sitting at almost 19K hours now and perfect :)","I picked up a C8 from a Best Buy in 2020 for $898. Floor model, listed online for $1098. Went to pick it up and saw a sticker showing $898. They said it was an accident but still matched the price.

Brought it home, it had over 14,000 hours in the previous 2 years being used as a floor model, so it was on just about 24/7 for 2 years. It had the ""Best Buy"" logo burned in covering a good portion of the screen.

I called up LG and reported burn-in, and knowing they offer 1 free panel replacement even outside warranty, they actually sent out a technician to swap it out. It's sitting at almost 19K hours now and perfect :)",4,2022-10-12 22:40:11,<praw.models.comment_forest.CommentForest object at 0x0000021CD52087F0>,y0cw8f,gadgets,t5_2qgzt,,False,False,t3_y0cw8f,t1_iru97zk,/r/gadgets/comments/y0cw8f/lgs_97inch_g2_oled_is_actually_a_bargain_at_25k/is2zbxh/
205,irvxv7a,yeahyeahyeah00002,One thing that bugs me is that you can't hook up audio through the optical output AND have Bluetooth surround speakers.   It's only the TV speakers + bt speakers.  I want to use all 3 audio outputs.,One thing that bugs me is that you can't hook up audio through the optical output AND have Bluetooth surround speakers.   It's only the TV speakers + bt speakers.  I want to use all 3 audio outputs.,1,2022-10-11 13:26:51,<praw.models.comment_forest.CommentForest object at 0x0000021CD5208970>,y0cw8f,gadgets,t5_2qgzt,,False,False,t3_y0cw8f,t1_irrgfj9,/r/gadgets/comments/y0cw8f/lgs_97inch_g2_oled_is_actually_a_bargain_at_25k/irvxv7a/
206,irrncci,gdubh,I’m squarely in the regular Joe camp. But I’ll just trust you that I’m missing nuances of The Office on my 10th rewatch.,I’m squarely in the regular Joe camp. But I’ll just trust you that I’m missing nuances of The Office on my 10th rewatch.,4,2022-10-10 14:57:47,<praw.models.comment_forest.CommentForest object at 0x0000021CD5208BB0>,y0cw8f,gadgets,t5_2qgzt,,False,False,t3_y0cw8f,t1_irrmpy0,/r/gadgets/comments/y0cw8f/lgs_97inch_g2_oled_is_actually_a_bargain_at_25k/irrncci/
207,irroisd,aVRAddict,The difference in tvs is so small now it isn't worth it even oled vs lcd. The tech is old shit anyways I use my VR headset for any watching now it's just better to have my own theater.,The difference in tvs is so small now it isn't worth it even oled vs lcd. The tech is old shit anyways I use my VR headset for any watching now it's just better to have my own theater.,-2,2022-10-10 15:06:03,<praw.models.comment_forest.CommentForest object at 0x0000021CD50F6A60>,y0cw8f,gadgets,t5_2qgzt,,False,False,t3_y0cw8f,t1_irrmpy0,/r/gadgets/comments/y0cw8f/lgs_97inch_g2_oled_is_actually_a_bargain_at_25k/irroisd/
208,irrfzu5,Emu_milking_god,Bingston fucking gets it guys!,Bingston fucking gets it guys!,0,2022-10-10 14:04:24,<praw.models.comment_forest.CommentForest object at 0x0000021CD50F6550>,y0cw8f,gadgets,t5_2qgzt,,False,False,t3_y0cw8f,t1_irrc807,/r/gadgets/comments/y0cw8f/lgs_97inch_g2_oled_is_actually_a_bargain_at_25k/irrfzu5/
209,irrfuo1,D_bAg_Tr0LL,"I have ocean front property in Arizona I think you'd be interested in. Someone saw you coming a mile away. Genius, oxygen is one of the most corrosive elements in the table of elements lol. Go read some science and take a crash course in physics. Better yet, go ask a doctor or scientist in the field of biology if pure oxidants or antioxidants are better for your health. And what exactly oxidants we consume on a daily basis due to our cells inside our bodies lol. 😆😆","I have ocean front property in Arizona I think you'd be interested in. Someone saw you coming a mile away. Genius, oxygen is one of the most corrosive elements in the table of elements lol. Go read some science and take a crash course in physics. Better yet, go ask a doctor or scientist in the field of biology if pure oxidants or antioxidants are better for your health. And what exactly oxidants we consume on a daily basis due to our cells inside our bodies lol. 😆😆",-3,2022-10-10 14:03:17,<praw.models.comment_forest.CommentForest object at 0x0000021CD50F6F10>,y0cw8f,gadgets,t5_2qgzt,,False,False,t3_y0cw8f,t1_irrdpxb,/r/gadgets/comments/y0cw8f/lgs_97inch_g2_oled_is_actually_a_bargain_at_25k/irrfuo1/
210,irrdrr4,TNAEnigma,damn sounds dope,damn sounds dope,0,2022-10-10 13:46:57,<praw.models.comment_forest.CommentForest object at 0x0000021CD50F6250>,y0cw8f,gadgets,t5_2qgzt,,False,False,t3_y0cw8f,t1_irrdpxb,/r/gadgets/comments/y0cw8f/lgs_97inch_g2_oled_is_actually_a_bargain_at_25k/irrdrr4/
211,irrg0te,whateverthefuck212,Is this what Joe Rogan is always going off about? What about those tanks with salt water that you float in in complete darkness?,Is this what Joe Rogan is always going off about? What about those tanks with salt water that you float in in complete darkness?,0,2022-10-10 14:04:38,<praw.models.comment_forest.CommentForest object at 0x0000021CD51641C0>,y0cw8f,gadgets,t5_2qgzt,,False,False,t3_y0cw8f,t1_irrf3br,/r/gadgets/comments/y0cw8f/lgs_97inch_g2_oled_is_actually_a_bargain_at_25k/irrg0te/
212,irvxghf,yeahyeahyeah00002,I remember reading about the DNA thing.  I would love one of those chambers.   Can you get one for under $3000?  Maybe a used one?   Oh shit! Today is amazon prime day!  Lol,I remember reading about the DNA thing.  I would love one of those chambers.   Can you get one for under $3000?  Maybe a used one?   Oh shit! Today is amazon prime day!  Lol,1,2022-10-11 13:23:38,<praw.models.comment_forest.CommentForest object at 0x0000021CD51640D0>,y0cw8f,gadgets,t5_2qgzt,,False,False,t3_y0cw8f,t1_irrf3br,/r/gadgets/comments/y0cw8f/lgs_97inch_g2_oled_is_actually_a_bargain_at_25k/irvxghf/
213,irrgt50,5DollarHitJob,Yiiiikes. How long you been married?,Yiiiikes. How long you been married?,2,2022-10-10 14:10:37,<praw.models.comment_forest.CommentForest object at 0x0000021CD5164550>,y0cw8f,gadgets,t5_2qgzt,,False,False,t3_y0cw8f,t1_irre10c,/r/gadgets/comments/y0cw8f/lgs_97inch_g2_oled_is_actually_a_bargain_at_25k/irrgt50/
214,irr8nlz,C0rn3j,"I'll take 1 grand for a 55"" OLED for myself.

Actually make that 2 grand, my grandparents could update their old plasma.","I'll take 1 grand for a 55"" OLED for myself.

Actually make that 2 grand, my grandparents could update their old plasma.",2,2022-10-10 13:04:19,<praw.models.comment_forest.CommentForest object at 0x0000021CD50E8B50>,y0cw8f,gadgets,t5_2qgzt,,False,False,t3_y0cw8f,t1_irr5tfm,/r/gadgets/comments/y0cw8f/lgs_97inch_g2_oled_is_actually_a_bargain_at_25k/irr8nlz/
215,is3hou3,Bob_Chris,Maybe I should have grabbed the A80J lol.  Not that Sony would do a panel swap,Maybe I should have grabbed the A80J lol.  Not that Sony would do a panel swap,1,2022-10-13 00:56:02,<praw.models.comment_forest.CommentForest object at 0x0000021CD52088B0>,y0cw8f,gadgets,t5_2qgzt,,False,False,t3_y0cw8f,t1_is2zbxh,/r/gadgets/comments/y0cw8f/lgs_97inch_g2_oled_is_actually_a_bargain_at_25k/is3hou3/
216,irro5r6,happybarfday,"Yeah I mean, again I didn’t say there’s anything wrong with being a regular Joe with regular Joe needs who watches regular Joe shows like The Office, but then regular Joe also should understand there are reasons why film buffs or whatever want to pay more and it’s not a waste of money to them.

It’s like people who don’t care about cars and just want an econobox to get to and from work. That’s fine, but there’s a reason car freaks will pay 4x as much for a car that doesn’t look all that much different on the exterior but has a clear difference under the hood.","Yeah I mean, again I didn’t say there’s anything wrong with being a regular Joe with regular Joe needs who watches regular Joe shows like The Office, but then regular Joe also should understand there are reasons why film buffs or whatever want to pay more and it’s not a waste of money to them.

It’s like people who don’t care about cars and just want an econobox to get to and from work. That’s fine, but there’s a reason car freaks will pay 4x as much for a car that doesn’t look all that much different on the exterior but has a clear difference under the hood.",4,2022-10-10 15:03:31,<praw.models.comment_forest.CommentForest object at 0x0000021CD50F6AC0>,y0cw8f,gadgets,t5_2qgzt,,False,False,t3_y0cw8f,t1_irrncci,/r/gadgets/comments/y0cw8f/lgs_97inch_g2_oled_is_actually_a_bargain_at_25k/irro5r6/
217,irrvrnr,happybarfday,Lol okay bud,Lol okay bud,2,2022-10-10 15:54:51,<praw.models.comment_forest.CommentForest object at 0x0000021CD50F6700>,y0cw8f,gadgets,t5_2qgzt,,False,False,t3_y0cw8f,t1_irroisd,/r/gadgets/comments/y0cw8f/lgs_97inch_g2_oled_is_actually_a_bargain_at_25k/irrvrnr/
218,irshnk2,rakehellion,lol no,lol no,3,2022-10-10 18:20:55,<praw.models.comment_forest.CommentForest object at 0x0000021CD50F61C0>,y0cw8f,gadgets,t5_2qgzt,,False,False,t3_y0cw8f,t1_irroisd,/r/gadgets/comments/y0cw8f/lgs_97inch_g2_oled_is_actually_a_bargain_at_25k/irshnk2/
219,irrf628,drleeisinsurgery,LeBron has one so I figure it's worth a try,LeBron has one so I figure it's worth a try,2,2022-10-10 13:57:57,<praw.models.comment_forest.CommentForest object at 0x0000021CD50F6340>,y0cw8f,gadgets,t5_2qgzt,,False,False,t3_y0cw8f,t1_irrdrr4,/r/gadgets/comments/y0cw8f/lgs_97inch_g2_oled_is_actually_a_bargain_at_25k/irrf628/
220,irrg8u4,drleeisinsurgery,"No that's a sensory deprivation chamber. In the absence of any outside stimulus, your mind can make up things. Joe is all about hallucinogenic stuff.","No that's a sensory deprivation chamber. In the absence of any outside stimulus, your mind can make up things. Joe is all about hallucinogenic stuff.",1,2022-10-10 14:06:20,<praw.models.comment_forest.CommentForest object at 0x0000021CD5164310>,y0cw8f,gadgets,t5_2qgzt,,False,False,t3_y0cw8f,t1_irrg0te,/r/gadgets/comments/y0cw8f/lgs_97inch_g2_oled_is_actually_a_bargain_at_25k/irrg8u4/
