,ID,Author,body,Comment,Score,Created On,Replies,Submission,Subreddit,Subreddit_ID,Distinguished,Edited,Is_submitter,link_id,Parent_id,Permalink
74,jbfujyo,DarthBuzzard,"This is all true, it's just that people often forget that this is how things used to be early on. People imagine that emerging hardware comes out and either improves rapidly or was always launched as a viable mass market product from the start.

It took a long time for PCs to progress beyond their clunky interfaces and into the realm of mouse and GUI, and later on with the inclusion of the Internet.

VR is making a lot of advancements behind the scenes, and some of these are hitting premium products like Quest Pro, with most of the larger advances still cooking, so companies are very much working on things and are very aware that this isn't where VR needs to be.","This is all true, it's just that people often forget that this is how things used to be early on. People imagine that emerging hardware comes out and either improves rapidly or was always launched as a viable mass market product from the start.

It took a long time for PCs to progress beyond their clunky interfaces and into the realm of mouse and GUI, and later on with the inclusion of the Internet.

VR is making a lot of advancements behind the scenes, and some of these are hitting premium products like Quest Pro, with most of the larger advances still cooking, so companies are very much working on things and are very aware that this isn't where VR needs to be.",2,2023-03-08 19:17:29,<praw.models.comment_forest.CommentForest object at 0x0000021CD51BFF70>,11h2dvn,gadgets,t5_2qgzt,,False,False,t3_11h2dvn,t1_jbfs62q,/r/gadgets/comments/11h2dvn/mark_zuckerberg_quietly_buries_the_metaverse/jbfujyo/
75,jarrh52,titsandtitsandmore,Supposedly Tom goes to Southeast Asia and brutally fucks women of a dubious age 😬,Supposedly Tom goes to Southeast Asia and brutally fucks women of a dubious age 😬,1,2023-03-03 16:20:45,<praw.models.comment_forest.CommentForest object at 0x0000021CD51C12B0>,11h2dvn,gadgets,t5_2qgzt,,False,False,t3_11h2dvn,t1_jarkzpm,/r/gadgets/comments/11h2dvn/mark_zuckerberg_quietly_buries_the_metaverse/jarrh52/
76,jaro8zj,Eyeofodin29,I'm sure you have seen a lot of 3D movies to have this very thought out view. Are all 3D movies great? No. There are some 3D movies are better in 3D than their 2D counterpart. A great example of this is A Christmas Carol (2009),I'm sure you have seen a lot of 3D movies to have this very thought out view. Are all 3D movies great? No. There are some 3D movies are better in 3D than their 2D counterpart. A great example of this is A Christmas Carol (2009),0,2023-03-03 15:59:21,<praw.models.comment_forest.CommentForest object at 0x0000021CD51C13D0>,11h2dvn,gadgets,t5_2qgzt,,False,False,t3_11h2dvn,t1_jarlr0g,/r/gadgets/comments/11h2dvn/mark_zuckerberg_quietly_buries_the_metaverse/jaro8zj/
77,jasjg3s,Parabola_Cunt,FP/S has nothing to do with adoption. It was and is a stupid technology for movie theaters. It doesn’t look 3D. It looks like poor layers of 2D.,FP/S has nothing to do with adoption. It was and is a stupid technology for movie theaters. It doesn’t look 3D. It looks like poor layers of 2D.,1,2023-03-03 19:22:33,<praw.models.comment_forest.CommentForest object at 0x0000021CD51C14F0>,11h2dvn,gadgets,t5_2qgzt,,False,False,t3_11h2dvn,t1_jarvqbo,/r/gadgets/comments/11h2dvn/mark_zuckerberg_quietly_buries_the_metaverse/jasjg3s/
78,jarp914,,[deleted],[deleted],2,2023-03-03 16:06:00,<praw.models.comment_forest.CommentForest object at 0x0000021CD51BDB50>,11h2dvn,gadgets,t5_2qgzt,,False,False,t3_11h2dvn,t1_jaroj16,/r/gadgets/comments/11h2dvn/mark_zuckerberg_quietly_buries_the_metaverse/jarp914/
79,jarslxj,bjornnsky,"To be fair, it’s very common to hear the word, and much less common to read. Just passing the education forward.","To be fair, it’s very common to hear the word, and much less common to read. Just passing the education forward.",6,2023-03-03 16:28:14,<praw.models.comment_forest.CommentForest object at 0x0000021CD51BDD30>,11h2dvn,gadgets,t5_2qgzt,,False,False,t3_11h2dvn,t1_jarolj3,/r/gadgets/comments/11h2dvn/mark_zuckerberg_quietly_buries_the_metaverse/jarslxj/
80,jb0krjo,Voodoo_Masta,Federal Trade Commission vs. Meta Platforms Inc.,Federal Trade Commission vs. Meta Platforms Inc.,0,2023-03-05 14:50:24,<praw.models.comment_forest.CommentForest object at 0x0000021CD51BF850>,11h2dvn,gadgets,t5_2qgzt,,False,False,t3_11h2dvn,t1_jb0fosw,/r/gadgets/comments/11h2dvn/mark_zuckerberg_quietly_buries_the_metaverse/jb0krjo/
81,jarzlr9,SwivelingToast,"But it's nothing. Like you can change your skin and play some crappy games, but VR chat is mainly just kids yelling at each other. Meta is going to have a really hard time convincing me that it's beneficial and not just another way for them to push ads in your face and collect information.","But it's nothing. Like you can change your skin and play some crappy games, but VR chat is mainly just kids yelling at each other. Meta is going to have a really hard time convincing me that it's beneficial and not just another way for them to push ads in your face and collect information.",2,2023-03-03 17:13:29,<praw.models.comment_forest.CommentForest object at 0x0000021CD51BFE50>,11h2dvn,gadgets,t5_2qgzt,,False,False,t3_11h2dvn,t1_jarrnx5,/r/gadgets/comments/11h2dvn/mark_zuckerberg_quietly_buries_the_metaverse/jarzlr9/
82,jarpuhv,ZellNorth,I mean I’ve seen Avatar and isn’t that supposed to be the big triumph of 3D movies? Lol. Preferred watching it normally.,I mean I’ve seen Avatar and isn’t that supposed to be the big triumph of 3D movies? Lol. Preferred watching it normally.,2,2023-03-03 16:09:58,<praw.models.comment_forest.CommentForest object at 0x0000021CD51C1490>,11h2dvn,gadgets,t5_2qgzt,,False,False,t3_11h2dvn,t1_jaro8zj,/r/gadgets/comments/11h2dvn/mark_zuckerberg_quietly_buries_the_metaverse/jarpuhv/
83,jav3gl3,davidw_-,"I agree with 24 fps, but did you see avatar 2 in 48fps and in 3D? It’s just not the same","I agree with 24 fps, but did you see avatar 2 in 48fps and in 3D? It’s just not the same",1,2023-03-04 08:08:48,<praw.models.comment_forest.CommentForest object at 0x0000021CD51C1670>,11h2dvn,gadgets,t5_2qgzt,,False,False,t3_11h2dvn,t1_jasjg3s,/r/gadgets/comments/11h2dvn/mark_zuckerberg_quietly_buries_the_metaverse/jav3gl3/
84,jbftjde,AkirIkasu,"u/davidw is somewhat right. Avatars 1 and 2 did it right by shooting the movie and doing all of the effects in 3D to begin with. The reason why so many 3D movie releases look like cardboard cutouts is because they basically are; they 'converted' 2D video into stereo 3D video, and it always looks shit.

The problem was that none of the studios wanted to spend the money to shoot in 3D first, so instead they flooded the market with crappy 3D conversions and there were basically no ways to know which were natively shot as 3D or were conversions without doing research ahead of time.

I personally think that Disney deserves most of the blame; they did 3D conversions for all the marvel movies and that's the reason why most people hate 3D movies.","u/davidw is somewhat right. Avatars 1 and 2 did it right by shooting the movie and doing all of the effects in 3D to begin with. The reason why so many 3D movie releases look like cardboard cutouts is because they basically are; they 'converted' 2D video into stereo 3D video, and it always looks shit.

The problem was that none of the studios wanted to spend the money to shoot in 3D first, so instead they flooded the market with crappy 3D conversions and there were basically no ways to know which were natively shot as 3D or were conversions without doing research ahead of time.

I personally think that Disney deserves most of the blame; they did 3D conversions for all the marvel movies and that's the reason why most people hate 3D movies.",1,2023-03-08 19:10:57,<praw.models.comment_forest.CommentForest object at 0x0000021CD51C16D0>,11h2dvn,gadgets,t5_2qgzt,,False,False,t3_11h2dvn,t1_jasjg3s,/r/gadgets/comments/11h2dvn/mark_zuckerberg_quietly_buries_the_metaverse/jbftjde/
85,jarv5vs,DarkHater,"I agree. It's hard to sell something that requires experiencing it, and even then there's no compelling long term use case. HL: Alyx is breathtaking, but you need something like a next level WoW. I don't see a productivity use case, at least not until mouse and keyboard are surpassed by... Neural interface?

Or something where you literally have an upgraded ChatGPT analog interpret your verbal commands and in-VR touch and eye commands to parse code and run it. Maybe video editing on a mass level, like for surveillance?

There are use cases, but for off the shelf consumers, they are few and underdeveloped presently. That said, VR is a lot of fun!🤷","I agree. It's hard to sell something that requires experiencing it, and even then there's no compelling long term use case. HL: Alyx is breathtaking, but you need something like a next level WoW. I don't see a productivity use case, at least not until mouse and keyboard are surpassed by... Neural interface?

Or something where you literally have an upgraded ChatGPT analog interpret your verbal commands and in-VR touch and eye commands to parse code and run it. Maybe video editing on a mass level, like for surveillance?

There are use cases, but for off the shelf consumers, they are few and underdeveloped presently. That said, VR is a lot of fun!🤷",1,2023-03-03 16:44:57,<praw.models.comment_forest.CommentForest object at 0x0000021CD51BDC10>,11h2dvn,gadgets,t5_2qgzt,,False,False,t3_11h2dvn,t1_jarp914,/r/gadgets/comments/11h2dvn/mark_zuckerberg_quietly_buries_the_metaverse/jarv5vs/
86,jaxgicy,FixTheGrammar,And I’m just telling a stupid joke.,And I’m just telling a stupid joke.,2,2023-03-04 20:40:51,<praw.models.comment_forest.CommentForest object at 0x0000021CD51BDEB0>,11h2dvn,gadgets,t5_2qgzt,,False,False,t3_11h2dvn,t1_jarslxj,/r/gadgets/comments/11h2dvn/mark_zuckerberg_quietly_buries_the_metaverse/jaxgicy/
87,jb1rnmt,I_Was_Fox,That's just words. Not a source,That's just words. Not a source,1,2023-03-05 19:48:49,<praw.models.comment_forest.CommentForest object at 0x0000021CD51BF910>,11h2dvn,gadgets,t5_2qgzt,,False,False,t3_11h2dvn,t1_jb0krjo,/r/gadgets/comments/11h2dvn/mark_zuckerberg_quietly_buries_the_metaverse/jb1rnmt/
88,jas3tec,aVRAddict,"That's absolutely wrong. There are many different communities from roleplaying, education, clubbing, etc. The annoying kids are only in public lobbies everyone else only goes to private ones with friends and their communities. People spend a lot of money for avatars and avatar accessories and meta wants that. Their stuff is going to be full corporate though so it will be a different demographic I think.","That's absolutely wrong. There are many different communities from roleplaying, education, clubbing, etc. The annoying kids are only in public lobbies everyone else only goes to private ones with friends and their communities. People spend a lot of money for avatars and avatar accessories and meta wants that. Their stuff is going to be full corporate though so it will be a different demographic I think.",1,2023-03-03 17:40:33,<praw.models.comment_forest.CommentForest object at 0x0000021CD51BFF10>,11h2dvn,gadgets,t5_2qgzt,,False,False,t3_11h2dvn,t1_jarzlr9,/r/gadgets/comments/11h2dvn/mark_zuckerberg_quietly_buries_the_metaverse/jas3tec/
89,jarqht9,ClittoryHinton,Why watch a 3d movie when you can take some shrooms and watch it in 4d,Why watch a 3d movie when you can take some shrooms and watch it in 4d,3,2023-03-03 16:14:15,<praw.models.comment_forest.CommentForest object at 0x0000021CD51C1550>,11h2dvn,gadgets,t5_2qgzt,,False,False,t3_11h2dvn,t1_jarpuhv,/r/gadgets/comments/11h2dvn/mark_zuckerberg_quietly_buries_the_metaverse/jarqht9/
90,jbfuho2,davidw,"Wrong davidw, but your point sounds sensible.","Wrong davidw, but your point sounds sensible.",1,2023-03-08 19:17:04,<praw.models.comment_forest.CommentForest object at 0x0000021CD51C1790>,11h2dvn,gadgets,t5_2qgzt,,False,False,t3_11h2dvn,t1_jbftjde,/r/gadgets/comments/11h2dvn/mark_zuckerberg_quietly_buries_the_metaverse/jbfuho2/
91,jarw02l,,[deleted],[deleted],1,2023-03-03 16:50:20,<praw.models.comment_forest.CommentForest object at 0x0000021CD51BDCD0>,11h2dvn,gadgets,t5_2qgzt,,False,False,t3_11h2dvn,t1_jarv5vs,/r/gadgets/comments/11h2dvn/mark_zuckerberg_quietly_buries_the_metaverse/jarw02l/
92,jaxr2b6,bjornnsky,"I didn’t downvote you, for the record","I didn’t downvote you, for the record",2,2023-03-04 21:54:13,<praw.models.comment_forest.CommentForest object at 0x0000021CD51BDFD0>,11h2dvn,gadgets,t5_2qgzt,,False,False,t3_11h2dvn,t1_jaxgicy,/r/gadgets/comments/11h2dvn/mark_zuckerberg_quietly_buries_the_metaverse/jaxr2b6/
93,jb1rqgp,Voodoo_Masta,Just google it ya lazy fuck,Just google it ya lazy fuck,0,2023-03-05 19:49:22,<praw.models.comment_forest.CommentForest object at 0x0000021CD51BF9D0>,11h2dvn,gadgets,t5_2qgzt,,False,False,t3_11h2dvn,t1_jb1rnmt,/r/gadgets/comments/11h2dvn/mark_zuckerberg_quietly_buries_the_metaverse/jb1rqgp/
94,jasa2tm,swalsh21,"Sooo, it's the same shit you can do anywhere with early 2000s graphics and a bunch of annoying kids all while paying extra for it. Sounds awesome, VR addict!","Sooo, it's the same shit you can do anywhere with early 2000s graphics and a bunch of annoying kids all while paying extra for it. Sounds awesome, VR addict!",1,2023-03-03 18:21:15,<praw.models.comment_forest.CommentForest object at 0x0000021CD51BFFD0>,11h2dvn,gadgets,t5_2qgzt,,False,False,t3_11h2dvn,t1_jas3tec,/r/gadgets/comments/11h2dvn/mark_zuckerberg_quietly_buries_the_metaverse/jasa2tm/
95,jarqpuh,ZellNorth,I kinda wanna do that with cocaine bear. I hear it’s fun to watch high.,I kinda wanna do that with cocaine bear. I hear it’s fun to watch high.,2,2023-03-03 16:15:44,<praw.models.comment_forest.CommentForest object at 0x0000021CD51C1610>,11h2dvn,gadgets,t5_2qgzt,,False,False,t3_11h2dvn,t1_jarqht9,/r/gadgets/comments/11h2dvn/mark_zuckerberg_quietly_buries_the_metaverse/jarqpuh/
96,jas2s46,DarkHater,"Those are accessories without a use case, the peripherals exist already. There is no software that exists that compellingly employs in a manner that will maintain user engagement.

For example, would those features make the Metaverse compelling to you? How much would you pay for that experience?","Those are accessories without a use case, the peripherals exist already. There is no software that exists that compellingly employs in a manner that will maintain user engagement.

For example, would those features make the Metaverse compelling to you? How much would you pay for that experience?",1,2023-03-03 17:33:52,<praw.models.comment_forest.CommentForest object at 0x0000021CD51BDD90>,11h2dvn,gadgets,t5_2qgzt,,1677865080.0,False,t3_11h2dvn,t1_jarw02l,/r/gadgets/comments/11h2dvn/mark_zuckerberg_quietly_buries_the_metaverse/jas2s46/
97,jazkgx5,newgrounds,I got both of you; no worries.,I got both of you; no worries.,2,2023-03-05 07:33:51,<praw.models.comment_forest.CommentForest object at 0x0000021CD51BF0D0>,11h2dvn,gadgets,t5_2qgzt,,False,False,t3_11h2dvn,t1_jaxr2b6,/r/gadgets/comments/11h2dvn/mark_zuckerberg_quietly_buries_the_metaverse/jazkgx5/
98,jb217a2,I_Was_Fox,"Aka ""I don't actually have proof, I'm just gonna double down and start yelling at people who challenge me""","Aka ""I don't actually have proof, I'm just gonna double down and start yelling at people who challenge me""",1,2023-03-05 20:54:51,<praw.models.comment_forest.CommentForest object at 0x0000021CD51BFA90>,11h2dvn,gadgets,t5_2qgzt,,False,False,t3_11h2dvn,t1_jb1rqgp,/r/gadgets/comments/11h2dvn/mark_zuckerberg_quietly_buries_the_metaverse/jb217a2/
99,jasbb0i,,[removed],[removed],1,2023-03-03 18:29:09,<praw.models.comment_forest.CommentForest object at 0x0000021CD51C10D0>,11h2dvn,gadgets,t5_2qgzt,,False,False,t3_11h2dvn,t1_jasa2tm,/r/gadgets/comments/11h2dvn/mark_zuckerberg_quietly_buries_the_metaverse/jasbb0i/
100,jasc8oo,aVRAddict,You can't do any of that anywhere. That's the point of VR to see cool places that can't exist.  The graphics are not early 2000s they can be AAA 2023 graphics it just depends on the person making it.,You can't do any of that anywhere. That's the point of VR to see cool places that can't exist.  The graphics are not early 2000s they can be AAA 2023 graphics it just depends on the person making it.,1,2023-03-03 18:35:18,<praw.models.comment_forest.CommentForest object at 0x0000021CD51C1130>,11h2dvn,gadgets,t5_2qgzt,,False,False,t3_11h2dvn,t1_jasa2tm,/r/gadgets/comments/11h2dvn/mark_zuckerberg_quietly_buries_the_metaverse/jasc8oo/
101,jas3nrv,,[deleted],[deleted],3,2023-03-03 17:39:31,<praw.models.comment_forest.CommentForest object at 0x0000021CD51BDE50>,11h2dvn,gadgets,t5_2qgzt,,False,False,t3_11h2dvn,t1_jas2s46,/r/gadgets/comments/11h2dvn/mark_zuckerberg_quietly_buries_the_metaverse/jas3nrv/
102,jb23e2s,Voodoo_Masta,Aka “you might be right but I’ll be damned if I’ll lift a finger to find out”,Aka “you might be right but I’ll be damned if I’ll lift a finger to find out”,0,2023-03-05 21:09:59,<praw.models.comment_forest.CommentForest object at 0x0000021CD51BFB50>,11h2dvn,gadgets,t5_2qgzt,,False,False,t3_11h2dvn,t1_jb217a2,/r/gadgets/comments/11h2dvn/mark_zuckerberg_quietly_buries_the_metaverse/jb23e2s/
103,jasbb28,AutoModerator,"Your comment has been automatically removed.

Social media and social networking links are not allowed in /r/gadgets, as they almost always contain personal information and therefore break the [rules of reddit](http://reddit.com/rules).


*I am a bot, and this action was performed automatically. Please [contact the moderators of this subreddit](/message/compose/?to=/r/gadgets) if you have any questions or concerns.*","Your comment has been automatically removed.

Social media and social networking links are not allowed in /r/gadgets, as they almost always contain personal information and therefore break the [rules of reddit](http://reddit.com/rules).


*I am a bot, and this action was performed automatically. Please [contact the moderators of this subreddit](/message/compose/?to=/r/gadgets) if you have any questions or concerns.*",1,2023-03-03 18:29:09,<praw.models.comment_forest.CommentForest object at 0x0000021CD51C1190>,11h2dvn,gadgets,t5_2qgzt,moderator,False,False,t3_11h2dvn,t1_jasbb0i,/r/gadgets/comments/11h2dvn/mark_zuckerberg_quietly_buries_the_metaverse/jasbb28/
104,jascqv0,swalsh21,"The metaverse has AAA 2023 graphics? I certainly haven't seen that. I know VR in general is cool, I just said that in a previous comment. I am referring only to the Meta/Suckerberg product","The metaverse has AAA 2023 graphics? I certainly haven't seen that. I know VR in general is cool, I just said that in a previous comment. I am referring only to the Meta/Suckerberg product",1,2023-03-03 18:38:35,<praw.models.comment_forest.CommentForest object at 0x0000021CD51C1250>,11h2dvn,gadgets,t5_2qgzt,,False,False,t3_11h2dvn,t1_jasc8oo,/r/gadgets/comments/11h2dvn/mark_zuckerberg_quietly_buries_the_metaverse/jascqv0/
105,jas5yds,DarkHater,"A WoW equivalent, perhaps. People already complain about the cost as a barrier to entry. That said, if you could compel the Peloton demo to pay similar startup and SaaS prices for the kit and household space it may be a winner.

I don't know how you interest that demo, maybe some type of fitness use case. Standing and gaming for long periods of time is tiring. I experience it with the Valve Index, and I am in pretty good shape. It would be cool to have touch feedback with gloves or something, but walking locomotion would be difficult as it takes up a lot of room and is expensive. *Maybe* if it were affordable and shoe sized, somehow, that could have market penetration.

If the Metaverse had been something more akin to a Unity style engine designed to create compelling games and experiences that allow the easy porting of new peripherals into all games, versus Second Life VR. Maybe that would work. I don't know, I want it to be good and exist, but it's uncharted territory!","A WoW equivalent, perhaps. People already complain about the cost as a barrier to entry. That said, if you could compel the Peloton demo to pay similar startup and SaaS prices for the kit and household space it may be a winner.

I don't know how you interest that demo, maybe some type of fitness use case. Standing and gaming for long periods of time is tiring. I experience it with the Valve Index, and I am in pretty good shape. It would be cool to have touch feedback with gloves or something, but walking locomotion would be difficult as it takes up a lot of room and is expensive. *Maybe* if it were affordable and shoe sized, somehow, that could have market penetration.

If the Metaverse had been something more akin to a Unity style engine designed to create compelling games and experiences that allow the easy porting of new peripherals into all games, versus Second Life VR. Maybe that would work. I don't know, I want it to be good and exist, but it's uncharted territory!",2,2023-03-03 17:54:18,<praw.models.comment_forest.CommentForest object at 0x0000021CD51BDF10>,11h2dvn,gadgets,t5_2qgzt,,1677866286.0,False,t3_11h2dvn,t1_jas3nrv,/r/gadgets/comments/11h2dvn/mark_zuckerberg_quietly_buries_the_metaverse/jas5yds/
106,jb32mn0,I_Was_Fox,I would love for you to prove yourself right. I have no problem admitting when I'm wrong. But your refusal to provide proof just makes you a clown,I would love for you to prove yourself right. I have no problem admitting when I'm wrong. But your refusal to provide proof just makes you a clown,1,2023-03-06 01:36:00,<praw.models.comment_forest.CommentForest object at 0x0000021CD51BFC10>,11h2dvn,gadgets,t5_2qgzt,,False,False,t3_11h2dvn,t1_jb23e2s,/r/gadgets/comments/11h2dvn/mark_zuckerberg_quietly_buries_the_metaverse/jb32mn0/
107,irr2jv9,Komikaze06,"From what they used to be yes, but most people don't spend over 1k for tvs","From what they used to be yes, but most people don't spend over 1k for tvs",98,2022-10-10 12:07:02,<praw.models.comment_forest.CommentForest object at 0x0000021CD5208190>,y0cw8f,gadgets,t5_2qgzt,,False,False,t3_y0cw8f,t3_y0cw8f,/r/gadgets/comments/y0cw8f/lgs_97inch_g2_oled_is_actually_a_bargain_at_25k/irr2jv9/
108,irr43zi,Llama-Lamp-,I guess it might be a bargain for the 2 people in the market looking to buy one,I guess it might be a bargain for the 2 people in the market looking to buy one,33,2022-10-10 12:22:35,<praw.models.comment_forest.CommentForest object at 0x0000021CD50F63D0>,y0cw8f,gadgets,t5_2qgzt,,False,False,t3_y0cw8f,t3_y0cw8f,/r/gadgets/comments/y0cw8f/lgs_97inch_g2_oled_is_actually_a_bargain_at_25k/irr43zi/
109,irr7s8g,drleeisinsurgery,"I have a 6 year old lg 98 inch 4k.

I got it when my wife was away and hoped she wouldn't notice.","I have a 6 year old lg 98 inch 4k.

I got it when my wife was away and hoped she wouldn't notice.",19,2022-10-10 12:56:39,<praw.models.comment_forest.CommentForest object at 0x0000021CD50F6CD0>,y0cw8f,gadgets,t5_2qgzt,,False,False,t3_y0cw8f,t3_y0cw8f,/r/gadgets/comments/y0cw8f/lgs_97inch_g2_oled_is_actually_a_bargain_at_25k/irr7s8g/
110,irr4eqi,Calamity_Carrot,Eh I'll wait 1 year for the 98inch,Eh I'll wait 1 year for the 98inch,9,2022-10-10 12:25:29,<praw.models.comment_forest.CommentForest object at 0x0000021CD50F6E20>,y0cw8f,gadgets,t5_2qgzt,,False,False,t3_y0cw8f,t3_y0cw8f,/r/gadgets/comments/y0cw8f/lgs_97inch_g2_oled_is_actually_a_bargain_at_25k/irr4eqi/
111,irr99t8,virgilreality,"Very true.  Buy the TV, and live in the box.  

""Cheap homes in your area!  Starting at $25K!""","Very true.  Buy the TV, and live in the box.  

""Cheap homes in your area!  Starting at $25K!""",5,2022-10-10 13:09:38,<praw.models.comment_forest.CommentForest object at 0x0000021CD5164760>,y0cw8f,gadgets,t5_2qgzt,,False,False,t3_y0cw8f,t3_y0cw8f,/r/gadgets/comments/y0cw8f/lgs_97inch_g2_oled_is_actually_a_bargain_at_25k/irr99t8/
112,irrdvxo,srebew,"I'm old enough to remember $25,000 40"" 720P LCD TVs","I'm old enough to remember $25,000 40"" 720P LCD TVs",5,2022-10-10 13:47:53,<praw.models.comment_forest.CommentForest object at 0x0000021CD5164280>,y0cw8f,gadgets,t5_2qgzt,,False,False,t3_y0cw8f,t3_y0cw8f,/r/gadgets/comments/y0cw8f/lgs_97inch_g2_oled_is_actually_a_bargain_at_25k/irrdvxo/
113,irr2n1j,bemenaker,"A bargain at 25k? Are you fucking insane? GTFO

Edit

Yes, the article is very tongue in cheek, he doens't really mean it's a bargain.","A bargain at 25k? Are you fucking insane? GTFO

Edit

Yes, the article is very tongue in cheek, he doens't really mean it's a bargain.",28,2022-10-10 12:07:57,<praw.models.comment_forest.CommentForest object at 0x0000021CD5164520>,y0cw8f,gadgets,t5_2qgzt,,1665410639.0,False,t3_y0cw8f,t3_y0cw8f,/r/gadgets/comments/y0cw8f/lgs_97inch_g2_oled_is_actually_a_bargain_at_25k/irr2n1j/
114,irr85js,,[removed],[removed],8,2022-10-10 12:59:54,<praw.models.comment_forest.CommentForest object at 0x0000021CD51649D0>,y0cw8f,gadgets,t5_2qgzt,,False,False,t3_y0cw8f,t3_y0cw8f,/r/gadgets/comments/y0cw8f/lgs_97inch_g2_oled_is_actually_a_bargain_at_25k/irr85js/
115,irr4lts,niralamba,Imagine seeing a television for $25k as a bargain. Then realize you paid more for your phone than your television.,Imagine seeing a television for $25k as a bargain. Then realize you paid more for your phone than your television.,8,2022-10-10 12:27:25,<praw.models.comment_forest.CommentForest object at 0x0000021CD5164D60>,y0cw8f,gadgets,t5_2qgzt,,False,False,t3_y0cw8f,t3_y0cw8f,/r/gadgets/comments/y0cw8f/lgs_97inch_g2_oled_is_actually_a_bargain_at_25k/irr4lts/
