,ID,Author,body,Comment,Score,Created On,Replies,Submission,Subreddit,Subreddit_ID,Distinguished,Edited,Is_submitter,link_id,Parent_id,Permalink
37,jarilaj,DarthBuzzard,"A lot of people said the same thing about PCs in the home. ""Who wants to spend months learning how to use this large clunky machine that's only good for storing recipes and managing finances? Not me.""

Market research for new paradigm shifts cannot take much into account what people think/say about the new tech, because people tend to only think of faster horses, not automobiles. As Steve Jobs said, you have to give people what they want before they know they want it, not what they ask for right here and now.

Market research therefore becomes the realm of finding the needs of users and meeting those needs in ways the users didn't expect/ask for. Again, the faster horses example.

Interacting in VR/AR social apps as the tech matures is going to be an important milestone in human communication technology, because we are social creatures and want to communicate face to face - VR/AR allow this to be done for the first done virtually.","A lot of people said the same thing about PCs in the home. ""Who wants to spend months learning how to use this large clunky machine that's only good for storing recipes and managing finances? Not me.""

Market research for new paradigm shifts cannot take much into account what people think/say about the new tech, because people tend to only think of faster horses, not automobiles. As Steve Jobs said, you have to give people what they want before they know they want it, not what they ask for right here and now.

Market research therefore becomes the realm of finding the needs of users and meeting those needs in ways the users didn't expect/ask for. Again, the faster horses example.

Interacting in VR/AR social apps as the tech matures is going to be an important milestone in human communication technology, because we are social creatures and want to communicate face to face - VR/AR allow this to be done for the first done virtually.",6,2023-03-03 15:21:45,<praw.models.comment_forest.CommentForest object at 0x0000021CD51BFC70>,11h2dvn,gadgets,t5_2qgzt,,1677860318.0,False,t3_11h2dvn,t1_jare99x,/r/gadgets/comments/11h2dvn/mark_zuckerberg_quietly_buries_the_metaverse/jarilaj/
38,jaril5t,emergent_segfault,"He's just another dipshit who found himself in the right place at the right time.

I remember people calling this clown a ""genius"" for building(allegedly) yet another shitty LAMP stack app that did absolutely nothing outside of allow users to post pictures of themselves,  while allowing people to leave comments (back then it didn't even have a real time messenger feature).

What people don't know that the only reason why  FaceBook remained a thing after the late mid aughts is because MySpace was bought and completely ruined by Rupert Murdoch and Peter Thiel knew Zuckerberg.","He's just another dipshit who found himself in the right place at the right time.

I remember people calling this clown a ""genius"" for building(allegedly) yet another shitty LAMP stack app that did absolutely nothing outside of allow users to post pictures of themselves,  while allowing people to leave comments (back then it didn't even have a real time messenger feature).

What people don't know that the only reason why  FaceBook remained a thing after the late mid aughts is because MySpace was bought and completely ruined by Rupert Murdoch and Peter Thiel knew Zuckerberg.",1,2023-03-03 15:21:44,<praw.models.comment_forest.CommentForest object at 0x0000021CD51BFD30>,11h2dvn,gadgets,t5_2qgzt,,False,False,t3_11h2dvn,t1_jare99x,/r/gadgets/comments/11h2dvn/mark_zuckerberg_quietly_buries_the_metaverse/jaril5t/
39,jarhr2o,Eyeofodin29,"I always see this compared to 3D movies, but I don't really see that as a good comparison. 3D movies are awesome. It is a great way to experience the same movie in a different way.","I always see this compared to 3D movies, but I don't really see that as a good comparison. 3D movies are awesome. It is a great way to experience the same movie in a different way.",1,2023-03-03 15:16:02,<praw.models.comment_forest.CommentForest object at 0x0000021CD51BFEB0>,11h2dvn,gadgets,t5_2qgzt,,False,False,t3_11h2dvn,t1_jare99x,/r/gadgets/comments/11h2dvn/mark_zuckerberg_quietly_buries_the_metaverse/jarhr2o/
40,jargo60,HaAnotherLlama,"Yes, that idiot billionaire, what a dumbass!","Yes, that idiot billionaire, what a dumbass!",-1,2023-03-03 15:08:39,<praw.models.comment_forest.CommentForest object at 0x0000021CD51C11F0>,11h2dvn,gadgets,t5_2qgzt,,False,False,t3_11h2dvn,t1_jare99x,/r/gadgets/comments/11h2dvn/mark_zuckerberg_quietly_buries_the_metaverse/jargo60/
41,jargjky,asund_,"Hey, I’d give it a shot if they had anything compelling to show me. How I can do my job in half the time. Things that make my life better that I couldn’t even imagine before. They didn’t do any work on that part.","Hey, I’d give it a shot if they had anything compelling to show me. How I can do my job in half the time. Things that make my life better that I couldn’t even imagine before. They didn’t do any work on that part.",1,2023-03-03 15:07:46,<praw.models.comment_forest.CommentForest object at 0x0000021CD51C1430>,11h2dvn,gadgets,t5_2qgzt,,False,False,t3_11h2dvn,t1_jare99x,/r/gadgets/comments/11h2dvn/mark_zuckerberg_quietly_buries_the_metaverse/jargjky/
42,jashrcl,jfp1992,"Pretty sure the story is that he had the idea to be a cool way to do meetings, then the board members ran with it hard. 

I would blame them more than the lizard man. Pretty sure he knew it was a shit idea past using it for meetings but had tied hands.","Pretty sure the story is that he had the idea to be a cool way to do meetings, then the board members ran with it hard. 

I would blame them more than the lizard man. Pretty sure he knew it was a shit idea past using it for meetings but had tied hands.",1,2023-03-03 19:11:16,<praw.models.comment_forest.CommentForest object at 0x0000021CD51C15B0>,11h2dvn,gadgets,t5_2qgzt,,False,False,t3_11h2dvn,t1_jare99x,/r/gadgets/comments/11h2dvn/mark_zuckerberg_quietly_buries_the_metaverse/jashrcl/
43,jars6c4,aVRAddict,Those sound like useless gimmicks.,Those sound like useless gimmicks.,1,2023-03-03 16:25:22,<praw.models.comment_forest.CommentForest object at 0x0000021CD51C17F0>,11h2dvn,gadgets,t5_2qgzt,,False,False,t3_11h2dvn,t1_jarp1ss,/r/gadgets/comments/11h2dvn/mark_zuckerberg_quietly_buries_the_metaverse/jars6c4/
44,jarmv2h,DarkHater,"Top down, Corporate hierarchical structure is not conducive to generating the best and most creative ideas, **full stop**.

Ideas/products/companies don't get *better* solely by virtue of throwing more money at it. When the focus is on monetizing the vision of a founder ""thar lies monsters"".

There is a survivorship bias of startup great ideas that went big, this is the inverse. VR/AR is certainly compelling, but the experiences are difficult to pitch in 2D and there still isn't a killer unified experience.

Even fantasy in movies/books has trouble pitching it. The world had to get to dystopian levels for folks to fully engage in lifelike VR in Ready Player One as a means of escape. Maybe that's why the tech billionaires aren't invested in saving the planet!😮‍💨","Top down, Corporate hierarchical structure is not conducive to generating the best and most creative ideas, **full stop**.

Ideas/products/companies don't get *better* solely by virtue of throwing more money at it. When the focus is on monetizing the vision of a founder ""thar lies monsters"".

There is a survivorship bias of startup great ideas that went big, this is the inverse. VR/AR is certainly compelling, but the experiences are difficult to pitch in 2D and there still isn't a killer unified experience.

Even fantasy in movies/books has trouble pitching it. The world had to get to dystopian levels for folks to fully engage in lifelike VR in Ready Player One as a means of escape. Maybe that's why the tech billionaires aren't invested in saving the planet!😮‍💨",4,2023-03-03 15:50:17,<praw.models.comment_forest.CommentForest object at 0x0000021CD51C18B0>,11h2dvn,gadgets,t5_2qgzt,,False,False,t3_11h2dvn,t1_jarjng4,/r/gadgets/comments/11h2dvn/mark_zuckerberg_quietly_buries_the_metaverse/jarmv2h/
45,jarmhvc,Abba_Fiskbullar,"The Meta headsets are run on mediocre mobile hardware, they just aren't very capable graphically. I have that one guy who's super into VR as a friend, and he says that after getting PSVR2 he's never touching his Occullus again.","The Meta headsets are run on mediocre mobile hardware, they just aren't very capable graphically. I have that one guy who's super into VR as a friend, and he says that after getting PSVR2 he's never touching his Occullus again.",1,2023-03-03 15:47:54,<praw.models.comment_forest.CommentForest object at 0x0000021CD51C1910>,11h2dvn,gadgets,t5_2qgzt,,False,False,t3_11h2dvn,t1_jarjng4,/r/gadgets/comments/11h2dvn/mark_zuckerberg_quietly_buries_the_metaverse/jarmhvc/
46,jarrxy1,aVRAddict,They spend the money on hardware and AI stuff not the horizons app. You can see exactly what they spend money on if you look at their research videos.,They spend the money on hardware and AI stuff not the horizons app. You can see exactly what they spend money on if you look at their research videos.,1,2023-03-03 16:23:50,<praw.models.comment_forest.CommentForest object at 0x0000021CD51C1970>,11h2dvn,gadgets,t5_2qgzt,,False,False,t3_11h2dvn,t1_jarjng4,/r/gadgets/comments/11h2dvn/mark_zuckerberg_quietly_buries_the_metaverse/jarrxy1/
47,jarvidw,davidw_-,Sorry but some people like me actually find the app useful,Sorry but some people like me actually find the app useful,1,2023-03-03 16:47:10,<praw.models.comment_forest.CommentForest object at 0x0000021CD51C1A30>,11h2dvn,gadgets,t5_2qgzt,,False,False,t3_11h2dvn,t1_jarmolb,/r/gadgets/comments/11h2dvn/mark_zuckerberg_quietly_buries_the_metaverse/jarvidw/
48,jarrdlz,DarthBuzzard,"It doesn't exist yet. The crypto apps are just cashing in on a trend (and are doing it badly), and any existing apps from Meta are just social apps, not the metaverse which is meant to be a 3D web structure some time in the future - years away.","It doesn't exist yet. The crypto apps are just cashing in on a trend (and are doing it badly), and any existing apps from Meta are just social apps, not the metaverse which is meant to be a 3D web structure some time in the future - years away.",1,2023-03-03 16:20:05,<praw.models.comment_forest.CommentForest object at 0x0000021CD51C1B50>,11h2dvn,gadgets,t5_2qgzt,,False,False,t3_11h2dvn,t1_jarlppb,/r/gadgets/comments/11h2dvn/mark_zuckerberg_quietly_buries_the_metaverse/jarrdlz/
49,jartzr6,Udzinraski2,or the old chapelle bit where the internet is an actual place and its just a shitty mall where you get harrassed.,or the old chapelle bit where the internet is an actual place and its just a shitty mall where you get harrassed.,9,2023-03-03 16:37:24,<praw.models.comment_forest.CommentForest object at 0x0000021CD51BD910>,11h2dvn,gadgets,t5_2qgzt,,False,False,t3_11h2dvn,t1_jarm1mh,/r/gadgets/comments/11h2dvn/mark_zuckerberg_quietly_buries_the_metaverse/jartzr6/
50,jarm3vc,,[deleted],[deleted],9,2023-03-03 15:45:22,<praw.models.comment_forest.CommentForest object at 0x0000021CD51BD9D0>,11h2dvn,gadgets,t5_2qgzt,,False,False,t3_11h2dvn,t1_jaridi3,/r/gadgets/comments/11h2dvn/mark_zuckerberg_quietly_buries_the_metaverse/jarm3vc/
51,jarky1o,bjornnsky,Piqued* your interest,Piqued* your interest,15,2023-03-03 15:37:35,<praw.models.comment_forest.CommentForest object at 0x0000021CD51BDA30>,11h2dvn,gadgets,t5_2qgzt,,False,False,t3_11h2dvn,t1_jaridi3,/r/gadgets/comments/11h2dvn/mark_zuckerberg_quietly_buries_the_metaverse/jarky1o/
52,jarj8yv,NoobasaurusWrexx,"This already exists. It’s called universe sandbox 2, and it is pretty neat.","This already exists. It’s called universe sandbox 2, and it is pretty neat.",4,2023-03-03 15:26:09,<praw.models.comment_forest.CommentForest object at 0x0000021CD51BDAF0>,11h2dvn,gadgets,t5_2qgzt,,False,False,t3_11h2dvn,t1_jaridi3,/r/gadgets/comments/11h2dvn/mark_zuckerberg_quietly_buries_the_metaverse/jarj8yv/
53,jarpn2e,MyNameIsRay,"The more important fact here is that there's already multiple VR apps, completely unrelated to the Metaverse, that let you explore the solar system.

Solar System VR, Our Solar System, and solAR for example. (And those are just VR headset specific, there's dozens of interractive 3-d solar system educational programs that run on normal screens).

The Metaverse really doesn't provide much value when they're basically just promising to deliver what you already have in your app store.","The more important fact here is that there's already multiple VR apps, completely unrelated to the Metaverse, that let you explore the solar system.

Solar System VR, Our Solar System, and solAR for example. (And those are just VR headset specific, there's dozens of interractive 3-d solar system educational programs that run on normal screens).

The Metaverse really doesn't provide much value when they're basically just promising to deliver what you already have in your app store.",3,2023-03-03 16:08:36,<praw.models.comment_forest.CommentForest object at 0x0000021CD51BDC70>,11h2dvn,gadgets,t5_2qgzt,,False,False,t3_11h2dvn,t1_jaridi3,/r/gadgets/comments/11h2dvn/mark_zuckerberg_quietly_buries_the_metaverse/jarpn2e/
54,jas1gwf,Thorusss,"Universe Simulator has been available for years in VR and it is pretty great.

No need for facebook","Universe Simulator has been available for years in VR and it is pretty great.

No need for facebook",2,2023-03-03 17:25:26,<praw.models.comment_forest.CommentForest object at 0x0000021CD51BF070>,11h2dvn,gadgets,t5_2qgzt,,False,False,t3_11h2dvn,t1_jaridi3,/r/gadgets/comments/11h2dvn/mark_zuckerberg_quietly_buries_the_metaverse/jas1gwf/
55,jarmo53,David254xxx,It didn’t peak your interest. It might have piqued your interest.,It didn’t peak your interest. It might have piqued your interest.,1,2023-03-03 15:49:01,<praw.models.comment_forest.CommentForest object at 0x0000021CD51BF130>,11h2dvn,gadgets,t5_2qgzt,,False,False,t3_11h2dvn,t1_jaridi3,/r/gadgets/comments/11h2dvn/mark_zuckerberg_quietly_buries_the_metaverse/jarmo53/
56,jasvs69,youruswithwe,I think the recommendation is usually 12 years old and older,I think the recommendation is usually 12 years old and older,1,2023-03-03 20:43:32,<praw.models.comment_forest.CommentForest object at 0x0000021CD51BF190>,11h2dvn,gadgets,t5_2qgzt,,False,False,t3_11h2dvn,t1_jaridi3,/r/gadgets/comments/11h2dvn/mark_zuckerberg_quietly_buries_the_metaverse/jasvs69/
57,jb265gu,jl2352,"> Honestly, the idea of exploring the solar system in VR sounds like a really good use of VR.

It reminds me of those Imax and 3D educational films that school would take kids to see. Exploring the ocean or the solar system.

It works, but it's just a novelty.","> Honestly, the idea of exploring the solar system in VR sounds like a really good use of VR.

It reminds me of those Imax and 3D educational films that school would take kids to see. Exploring the ocean or the solar system.

It works, but it's just a novelty.",1,2023-03-05 21:29:12,<praw.models.comment_forest.CommentForest object at 0x0000021CD51BF1F0>,11h2dvn,gadgets,t5_2qgzt,,False,False,t3_11h2dvn,t1_jaridi3,/r/gadgets/comments/11h2dvn/mark_zuckerberg_quietly_buries_the_metaverse/jb265gu/
58,jarl7c5,Art_way,I can imagine being able to stand at a crosswalk and looking around as a human would naturally gives you more information than looking at it on a flatscreen.,I can imagine being able to stand at a crosswalk and looking around as a human would naturally gives you more information than looking at it on a flatscreen.,2,2023-03-03 15:39:19,<praw.models.comment_forest.CommentForest object at 0x0000021CD51BF2B0>,11h2dvn,gadgets,t5_2qgzt,,False,False,t3_11h2dvn,t1_jarir6a,/r/gadgets/comments/11h2dvn/mark_zuckerberg_quietly_buries_the_metaverse/jarl7c5/
59,jb05dbg,Voodoo_Masta,The FTC begs to differ.,The FTC begs to differ.,1,2023-03-05 12:23:04,<praw.models.comment_forest.CommentForest object at 0x0000021CD51BF6D0>,11h2dvn,gadgets,t5_2qgzt,,False,False,t3_11h2dvn,t1_jazc2bq,/r/gadgets/comments/11h2dvn/mark_zuckerberg_quietly_buries_the_metaverse/jb05dbg/
60,jarlhly,NewDad907,"It’s become the digital retirement home for the 60+ crowd. And home to a ton of ads and bots/fake accounts. 

“Go yell at the sky on Facebook, Grandma”","It’s become the digital retirement home for the 60+ crowd. And home to a ton of ads and bots/fake accounts. 

“Go yell at the sky on Facebook, Grandma”",3,2023-03-03 15:41:15,<praw.models.comment_forest.CommentForest object at 0x0000021CD51BF970>,11h2dvn,gadgets,t5_2qgzt,,False,False,t3_11h2dvn,t1_jargso1,/r/gadgets/comments/11h2dvn/mark_zuckerberg_quietly_buries_the_metaverse/jarlhly/
61,jarkzzr,MacDugin,"I stopped using FB it’s fucking horrible. People spouting their political bullshit, thinking they are going to convince someone of something.","I stopped using FB it’s fucking horrible. People spouting their political bullshit, thinking they are going to convince someone of something.",2,2023-03-03 15:37:57,<praw.models.comment_forest.CommentForest object at 0x0000021CD51BFA30>,11h2dvn,gadgets,t5_2qgzt,,False,False,t3_11h2dvn,t1_jargso1,/r/gadgets/comments/11h2dvn/mark_zuckerberg_quietly_buries_the_metaverse/jarkzzr/
62,jarnmbk,swalsh21,VR is cool. Using it to be on the metaverse is fucking dumb.,VR is cool. Using it to be on the metaverse is fucking dumb.,2,2023-03-03 15:55:13,<praw.models.comment_forest.CommentForest object at 0x0000021CD51BFCD0>,11h2dvn,gadgets,t5_2qgzt,,False,False,t3_11h2dvn,t1_jarjpoa,/r/gadgets/comments/11h2dvn/mark_zuckerberg_quietly_buries_the_metaverse/jarnmbk/
63,jbfs62q,AkirIkasu,"> A lot of people said the same thing about PCs in the home. ""Who wants to spend months learning how to use this large clunky machine that's only good for storing recipes and managing finances? Not me.""

Here's the thing, though; they were kind of right.

Tech companies didn't wait for people to train themselves how to use their products. They changed their products until they were made intuitive enough that nobody needed to be trained on them anymore.

The current wave of VR headsets is a major milestone in VR technology, but right now it's really not set up to be this one-size-fits-all product that improves people's lives.

That's why a number of the players in the early stages of this era in VR and AR tech have decided to change course away from consumer markets and into enterprise and business applications. Everyone talks about Google Glass as if it was a huge failure on Google's part, but they're completely ignoring the fact that [they're still working on the product for an enterprise audience](https://www.google.com/glass/start/).","> A lot of people said the same thing about PCs in the home. ""Who wants to spend months learning how to use this large clunky machine that's only good for storing recipes and managing finances? Not me.""

Here's the thing, though; they were kind of right.

Tech companies didn't wait for people to train themselves how to use their products. They changed their products until they were made intuitive enough that nobody needed to be trained on them anymore.

The current wave of VR headsets is a major milestone in VR technology, but right now it's really not set up to be this one-size-fits-all product that improves people's lives.

That's why a number of the players in the early stages of this era in VR and AR tech have decided to change course away from consumer markets and into enterprise and business applications. Everyone talks about Google Glass as if it was a huge failure on Google's part, but they're completely ignoring the fact that [they're still working on the product for an enterprise audience](https://www.google.com/glass/start/).",2,2023-03-08 19:02:17,<praw.models.comment_forest.CommentForest object at 0x0000021CD51BFDF0>,11h2dvn,gadgets,t5_2qgzt,,False,False,t3_11h2dvn,t1_jarilaj,/r/gadgets/comments/11h2dvn/mark_zuckerberg_quietly_buries_the_metaverse/jbfs62q/
64,jarkzpm,DarkHater,"And that's why we still love Tom!

He sold it off and then we never had to learn about what a piece of shit he (probably) is.😋","And that's why we still love Tom!

He sold it off and then we never had to learn about what a piece of shit he (probably) is.😋",2,2023-03-03 15:37:54,<praw.models.comment_forest.CommentForest object at 0x0000021CD51C1070>,11h2dvn,gadgets,t5_2qgzt,,False,False,t3_11h2dvn,t1_jaril5t,/r/gadgets/comments/11h2dvn/mark_zuckerberg_quietly_buries_the_metaverse/jarkzpm/
65,jarlr0g,ZellNorth,3D movies suck lol,3D movies suck lol,1,2023-03-03 15:43:00,<praw.models.comment_forest.CommentForest object at 0x0000021CD51C1310>,11h2dvn,gadgets,t5_2qgzt,,False,False,t3_11h2dvn,t1_jarhr2o,/r/gadgets/comments/11h2dvn/mark_zuckerberg_quietly_buries_the_metaverse/jarlr0g/
66,jarvqbo,davidw_-,3D movies were badly sold because most movies were and are still 24fps. The latest avatar 2 changed that by releasing the movie in 48 fps and now 3D is starting to get interesting,3D movies were badly sold because most movies were and are still 24fps. The latest avatar 2 changed that by releasing the movie in 48 fps and now 3D is starting to get interesting,1,2023-03-03 16:48:35,<praw.models.comment_forest.CommentForest object at 0x0000021CD51C1370>,11h2dvn,gadgets,t5_2qgzt,,False,False,t3_11h2dvn,t1_jarhr2o,/r/gadgets/comments/11h2dvn/mark_zuckerberg_quietly_buries_the_metaverse/jarvqbo/
67,jaroj16,DarkHater,"Utilizing VR to generate actual 3D and then playing with scale in compelling real time is a benefit. Certainly from an awe-inducing standpoint.

There is a VR program which provided a fascinating way to visualize 4th dimensional space, represented in fantastical 3D. That was really cool! Having the actual 3D with head tracking and 6DoF definitely added to the immersion. Certainly not *necessary*, but that can be argued for most things.

Many interesting VR experiences involve changes in scale, from say macro to micro, and having it exist in the same instance. I don't know what the killer experience is, it doesn't seem to be VR Second Life, but could very well be VR WoW.","Utilizing VR to generate actual 3D and then playing with scale in compelling real time is a benefit. Certainly from an awe-inducing standpoint.

There is a VR program which provided a fascinating way to visualize 4th dimensional space, represented in fantastical 3D. That was really cool! Having the actual 3D with head tracking and 6DoF definitely added to the immersion. Certainly not *necessary*, but that can be argued for most things.

Many interesting VR experiences involve changes in scale, from say macro to micro, and having it exist in the same instance. I don't know what the killer experience is, it doesn't seem to be VR Second Life, but could very well be VR WoW.",2,2023-03-03 16:01:12,<praw.models.comment_forest.CommentForest object at 0x0000021CD51BDA90>,11h2dvn,gadgets,t5_2qgzt,,False,False,t3_11h2dvn,t1_jarm3vc,/r/gadgets/comments/11h2dvn/mark_zuckerberg_quietly_buries_the_metaverse/jaroj16/
68,jarolj3,FixTheGrammar,Maybe some VR education could have taught him English a bit better.,Maybe some VR education could have taught him English a bit better.,4,2023-03-03 16:01:39,<praw.models.comment_forest.CommentForest object at 0x0000021CD51BDBB0>,11h2dvn,gadgets,t5_2qgzt,,False,False,t3_11h2dvn,t1_jarky1o,/r/gadgets/comments/11h2dvn/mark_zuckerberg_quietly_buries_the_metaverse/jarolj3/
69,jaros0h,smokumjoe,"Hell, there's a solar system to see in Valve's free ""The Lab"" on Steam.","Hell, there's a solar system to see in Valve's free ""The Lab"" on Steam.",4,2023-03-03 16:02:52,<praw.models.comment_forest.CommentForest object at 0x0000021CD51BDDF0>,11h2dvn,gadgets,t5_2qgzt,,False,False,t3_11h2dvn,t1_jarj8yv,/r/gadgets/comments/11h2dvn/mark_zuckerberg_quietly_buries_the_metaverse/jaros0h/
70,jarrff1,aVRAddict,The real  vr space  sim is space engine. Everyone should play it and it's free,The real  vr space  sim is space engine. Everyone should play it and it's free,2,2023-03-03 16:20:25,<praw.models.comment_forest.CommentForest object at 0x0000021CD51BDF70>,11h2dvn,gadgets,t5_2qgzt,,False,False,t3_11h2dvn,t1_jarj8yv,/r/gadgets/comments/11h2dvn/mark_zuckerberg_quietly_buries_the_metaverse/jarrff1/
71,jb0fosw,I_Was_Fox,You got a source on that?,You got a source on that?,1,2023-03-05 14:08:21,<praw.models.comment_forest.CommentForest object at 0x0000021CD51BF790>,11h2dvn,gadgets,t5_2qgzt,,False,False,t3_11h2dvn,t1_jb05dbg,/r/gadgets/comments/11h2dvn/mark_zuckerberg_quietly_buries_the_metaverse/jb0fosw/
72,jarn3mr,Xu_Lin,So FB is the Florida of the internet then? :’),So FB is the Florida of the internet then? :’),3,2023-03-03 15:51:49,<praw.models.comment_forest.CommentForest object at 0x0000021CD51BFAF0>,11h2dvn,gadgets,t5_2qgzt,,False,False,t3_11h2dvn,t1_jarlhly,/r/gadgets/comments/11h2dvn/mark_zuckerberg_quietly_buries_the_metaverse/jarn3mr/
73,jarrnx5,aVRAddict,No it isn't. Just look at VRchat it's the top VR game by far and it's exactly what meta wants to build.,No it isn't. Just look at VRchat it's the top VR game by far and it's exactly what meta wants to build.,1,2023-03-03 16:22:00,<praw.models.comment_forest.CommentForest object at 0x0000021CD51BFD90>,11h2dvn,gadgets,t5_2qgzt,,False,False,t3_11h2dvn,t1_jarnmbk,/r/gadgets/comments/11h2dvn/mark_zuckerberg_quietly_buries_the_metaverse/jarrnx5/
