,ID,Author,body,Comment,Score,Created On,Replies,Submission,Subreddit,Subreddit_ID,Distinguished,Edited,Is_submitter,link_id,Parent_id,Permalink
0,jargq8y,HaAnotherLlama,"TLDR-

""Trust me bro.""

lol what a stupid article.","TLDR-

""Trust me bro.""

lol what a stupid article.",242,2023-03-03 15:09:02,<praw.models.comment_forest.CommentForest object at 0x0000021CD51BD6D0>,11h2dvn,gadgets,t5_2qgzt,,False,False,t3_11h2dvn,t3_11h2dvn,/r/gadgets/comments/11h2dvn/mark_zuckerberg_quietly_buries_the_metaverse/jargq8y/
1,jarh3sz,TechyDad,"I used to see ads for the Metaverse in a game I play. I willingly watch ads in this game for in-game rewards. I can ignore a 30 second ad quite easily, but the Metaverse ones caught my attention. And not in a good way.

The ads kept touting all the things that you'd be able to do in the Metaverse one day. Not what you could do now, but that might someday be available. Worse, they were all stuff you could do on computers and/or on the Internet today - just in the Metaverse. 

Stuff like city planners being able to plan roads for less traffic. Pretty sure you don't need fancy 3D headsets for this. You can use a normal computer screen and program. Or a child learning about the solar system. There are many ways to do this that don't involve an expensive VR headset.

If the best they were able to do was ""buy our product because it might be useful one day,"" then I definitely wasn't going to be spending my money on it.","I used to see ads for the Metaverse in a game I play. I willingly watch ads in this game for in-game rewards. I can ignore a 30 second ad quite easily, but the Metaverse ones caught my attention. And not in a good way.

The ads kept touting all the things that you'd be able to do in the Metaverse one day. Not what you could do now, but that might someday be available. Worse, they were all stuff you could do on computers and/or on the Internet today - just in the Metaverse. 

Stuff like city planners being able to plan roads for less traffic. Pretty sure you don't need fancy 3D headsets for this. You can use a normal computer screen and program. Or a child learning about the solar system. There are many ways to do this that don't involve an expensive VR headset.

If the best they were able to do was ""buy our product because it might be useful one day,"" then I definitely wasn't going to be spending my money on it.",85,2023-03-03 15:11:38,<praw.models.comment_forest.CommentForest object at 0x0000021CD51BD730>,11h2dvn,gadgets,t5_2qgzt,,False,False,t3_11h2dvn,t3_11h2dvn,/r/gadgets/comments/11h2dvn/mark_zuckerberg_quietly_buries_the_metaverse/jarh3sz/
2,jarhxs6,DarthBuzzard,"What's with this article? Yes, Zuck is spending more resources on AI, specifically for LLMs, but at no point has he said or even acted in a way that the metaverse is buried or less priotized.

The article says that he's decreasing Reality Labs investment, and yet he's actually *increasing it* this year.

Lastly, Zuck knows that AI and VR/AR/Social apps/Metaverse etc go hand-in-hand like cookies and cream.","What's with this article? Yes, Zuck is spending more resources on AI, specifically for LLMs, but at no point has he said or even acted in a way that the metaverse is buried or less priotized.

The article says that he's decreasing Reality Labs investment, and yet he's actually *increasing it* this year.

Lastly, Zuck knows that AI and VR/AR/Social apps/Metaverse etc go hand-in-hand like cookies and cream.",24,2023-03-03 15:17:19,<praw.models.comment_forest.CommentForest object at 0x0000021CD51BD7F0>,11h2dvn,gadgets,t5_2qgzt,,False,False,t3_11h2dvn,t3_11h2dvn,/r/gadgets/comments/11h2dvn/mark_zuckerberg_quietly_buries_the_metaverse/jarhxs6/
3,jarv4nh,drewbiez,"I found the part about AI and creating AI personas more interesting...

Hey, I have a great, lets use our wealth of human interaction to build AI models to create AI help bots. Next thing you know, the damn bot is arguing with you about election fraud when all you want is to order a pair of fucking socks.","I found the part about AI and creating AI personas more interesting...

Hey, I have a great, lets use our wealth of human interaction to build AI models to create AI help bots. Next thing you know, the damn bot is arguing with you about election fraud when all you want is to order a pair of fucking socks.",3,2023-03-03 16:44:43,<praw.models.comment_forest.CommentForest object at 0x0000021CD51BF430>,11h2dvn,gadgets,t5_2qgzt,,False,False,t3_11h2dvn,t3_11h2dvn,/r/gadgets/comments/11h2dvn/mark_zuckerberg_quietly_buries_the_metaverse/jarv4nh/
4,jaryygm,Voodoo_Masta,Meta getting into the generative AI game is way more dystopian and terrifying than even their hideous Metaverse abomination. Meta is a monopoly and needs to be broken up.,Meta getting into the generative AI game is way more dystopian and terrifying than even their hideous Metaverse abomination. Meta is a monopoly and needs to be broken up.,3,2023-03-03 17:09:14,<praw.models.comment_forest.CommentForest object at 0x0000021CD51BF550>,11h2dvn,gadgets,t5_2qgzt,,False,False,t3_11h2dvn,t3_11h2dvn,/r/gadgets/comments/11h2dvn/mark_zuckerberg_quietly_buries_the_metaverse/jaryygm/
5,jardyul,ZentriX21,"Finally, hope his company dies with it and buries itself beside its zombie.","Finally, hope his company dies with it and buries itself beside its zombie.",14,2023-03-03 14:49:41,<praw.models.comment_forest.CommentForest object at 0x0000021CD51BF5B0>,11h2dvn,gadgets,t5_2qgzt,,False,False,t3_11h2dvn,t3_11h2dvn,/r/gadgets/comments/11h2dvn/mark_zuckerberg_quietly_buries_the_metaverse/jardyul/
6,jare99x,,"Just goes to show what a fucking idiot Suckerberg is. Who the fuck wants to wear something on their head in order to 'interact' with anything? It's like 3d movies - did *anyone* actually ""do"" any market research before trying to shove it down everyone's throat? Of course not, and look - same result!","Just goes to show what a fucking idiot Suckerberg is. Who the fuck wants to wear something on their head in order to 'interact' with anything? It's like 3d movies - did *anyone* actually ""do"" any market research before trying to shove it down everyone's throat? Of course not, and look - same result!",9,2023-03-03 14:51:44,<praw.models.comment_forest.CommentForest object at 0x0000021CD51BF670>,11h2dvn,gadgets,t5_2qgzt,,False,False,t3_11h2dvn,t3_11h2dvn,/r/gadgets/comments/11h2dvn/mark_zuckerberg_quietly_buries_the_metaverse/jare99x/
7,jarp1ss,grantnaps,Don't care about VR but AR could make life more efficient. Would love to be able to mow my lawn with AR glasses that changed the yard into pac man. Would be cool if AR automatically told me the most efficient route to mow. I think AR is more practical in what it can be applied to.,Don't care about VR but AR could make life more efficient. Would love to be able to mow my lawn with AR glasses that changed the yard into pac man. Would be cool if AR automatically told me the most efficient route to mow. I think AR is more practical in what it can be applied to.,1,2023-03-03 16:04:40,<praw.models.comment_forest.CommentForest object at 0x0000021CD51BF8B0>,11h2dvn,gadgets,t5_2qgzt,,False,False,t3_11h2dvn,t3_11h2dvn,/r/gadgets/comments/11h2dvn/mark_zuckerberg_quietly_buries_the_metaverse/jarp1ss/
8,jarjng4,PhasmaFelis,"I don't understand how Facebook's Metaverse is so bad. Like, not *profitable,* I can see, if they made something cool but drastically overestimated their audience. But they spent billions of dollars and somehow got something that looks like a plucky indie team with three dudes getting ready to launch their Kickstarter. How does that happen?

Whatever I think of Facebook and Zuckerberg, they're not some fly-by-night operation pulling a Theranos with investor money. They're one of the biggest corporations in the world, and they know how to get shit done...or they used to. It just doesn't make sense to me.","I don't understand how Facebook's Metaverse is so bad. Like, not *profitable,* I can see, if they made something cool but drastically overestimated their audience. But they spent billions of dollars and somehow got something that looks like a plucky indie team with three dudes getting ready to launch their Kickstarter. How does that happen?

Whatever I think of Facebook and Zuckerberg, they're not some fly-by-night operation pulling a Theranos with investor money. They're one of the biggest corporations in the world, and they know how to get shit done...or they used to. It just doesn't make sense to me.",1,2023-03-03 15:28:52,<praw.models.comment_forest.CommentForest object at 0x0000021CD51C1730>,11h2dvn,gadgets,t5_2qgzt,,False,False,t3_11h2dvn,t3_11h2dvn,/r/gadgets/comments/11h2dvn/mark_zuckerberg_quietly_buries_the_metaverse/jarjng4/
9,jarmolb,bored123abc,Kindly do the same for Facebook.,Kindly do the same for Facebook.,0,2023-03-03 15:49:06,<praw.models.comment_forest.CommentForest object at 0x0000021CD51C1850>,11h2dvn,gadgets,t5_2qgzt,,False,False,t3_11h2dvn,t3_11h2dvn,/r/gadgets/comments/11h2dvn/mark_zuckerberg_quietly_buries_the_metaverse/jarmolb/
10,jarh1lf,Scouse1960,"Maybe he should concentrate on getting WhatsApp working on multiple devices like telegram and signal, he can’t even get that working 🤷🏻‍♂️","Maybe he should concentrate on getting WhatsApp working on multiple devices like telegram and signal, he can’t even get that working 🤷🏻‍♂️",-1,2023-03-03 15:11:13,<praw.models.comment_forest.CommentForest object at 0x0000021CD51C19D0>,11h2dvn,gadgets,t5_2qgzt,,False,False,t3_11h2dvn,t3_11h2dvn,/r/gadgets/comments/11h2dvn/mark_zuckerberg_quietly_buries_the_metaverse/jarh1lf/
11,jarlppb,,[deleted],[deleted],0,2023-03-03 15:42:46,<praw.models.comment_forest.CommentForest object at 0x0000021CD51C1A90>,11h2dvn,gadgets,t5_2qgzt,,1677936798.0,False,t3_11h2dvn,t3_11h2dvn,/r/gadgets/comments/11h2dvn/mark_zuckerberg_quietly_buries_the_metaverse/jarlppb/
12,jarmk5o,100YearsRicknMorty,Literally the most dogshit article Ive read in weeks.,Literally the most dogshit article Ive read in weeks.,1,2023-03-03 15:48:18,<praw.models.comment_forest.CommentForest object at 0x0000021CD51C1AF0>,11h2dvn,gadgets,t5_2qgzt,,False,False,t3_11h2dvn,t3_11h2dvn,/r/gadgets/comments/11h2dvn/mark_zuckerberg_quietly_buries_the_metaverse/jarmk5o/
13,jarofcl,boopinmybop,Saw a commercial for it last night… buried or?,Saw a commercial for it last night… buried or?,1,2023-03-03 16:00:31,<praw.models.comment_forest.CommentForest object at 0x0000021CD51C1BB0>,11h2dvn,gadgets,t5_2qgzt,,False,False,t3_11h2dvn,t3_11h2dvn,/r/gadgets/comments/11h2dvn/mark_zuckerberg_quietly_buries_the_metaverse/jarofcl/
14,jarrlj5,Z-man1973,What no more of them stupid commercials lol,What no more of them stupid commercials lol,1,2023-03-03 16:21:33,<praw.models.comment_forest.CommentForest object at 0x0000021CD51C1C10>,11h2dvn,gadgets,t5_2qgzt,,False,False,t3_11h2dvn,t3_11h2dvn,/r/gadgets/comments/11h2dvn/mark_zuckerberg_quietly_buries_the_metaverse/jarrlj5/
15,jarsxcw,genkaiX1,Clickbait,Clickbait,1,2023-03-03 16:30:21,<praw.models.comment_forest.CommentForest object at 0x0000021CD51C1C70>,11h2dvn,gadgets,t5_2qgzt,,False,False,t3_11h2dvn,t3_11h2dvn,/r/gadgets/comments/11h2dvn/mark_zuckerberg_quietly_buries_the_metaverse/jarsxcw/
16,jaruw4x,EVOSexyBeast,"> We are also getting closer to AGI, or artificial general intelligence, which means highly autonomous systems that emulate and outperform humans at most economically valuable work. 


Lol this article knows nothing","> We are also getting closer to AGI, or artificial general intelligence, which means highly autonomous systems that emulate and outperform humans at most economically valuable work. 


Lol this article knows nothing",1,2023-03-03 16:43:11,<praw.models.comment_forest.CommentForest object at 0x0000021CD51C1CD0>,11h2dvn,gadgets,t5_2qgzt,,False,False,t3_11h2dvn,t3_11h2dvn,/r/gadgets/comments/11h2dvn/mark_zuckerberg_quietly_buries_the_metaverse/jaruw4x/
17,jas749a,Netplorer,Wow ... what a 0 value piece.,Wow ... what a 0 value piece.,1,2023-03-03 18:01:51,<praw.models.comment_forest.CommentForest object at 0x0000021CD51C1D30>,11h2dvn,gadgets,t5_2qgzt,,False,False,t3_11h2dvn,t3_11h2dvn,/r/gadgets/comments/11h2dvn/mark_zuckerberg_quietly_buries_the_metaverse/jas749a/
18,jas9o31,habu-sr71,"Yes, a very stupid article says this former SV techie.","Yes, a very stupid article says this former SV techie.",1,2023-03-03 18:18:36,<praw.models.comment_forest.CommentForest object at 0x0000021CD51C1D90>,11h2dvn,gadgets,t5_2qgzt,,False,False,t3_11h2dvn,t3_11h2dvn,/r/gadgets/comments/11h2dvn/mark_zuckerberg_quietly_buries_the_metaverse/jas9o31/
19,jass018,DestroyerOfIphone,I actually doubt he's going to abandon the metaverse. I think he's going to pump ai into everything but we'll probably see a lull in development until AIBurg is complete.,I actually doubt he's going to abandon the metaverse. I think he's going to pump ai into everything but we'll probably see a lull in development until AIBurg is complete.,1,2023-03-03 20:19:01,<praw.models.comment_forest.CommentForest object at 0x0000021CD51C1DF0>,11h2dvn,gadgets,t5_2qgzt,,False,False,t3_11h2dvn,t3_11h2dvn,/r/gadgets/comments/11h2dvn/mark_zuckerberg_quietly_buries_the_metaverse/jass018/
20,jau5pjg,bartlettdmoore,"Let's write him a song about it...

a kind of ""meta verse""...","Let's write him a song about it...

a kind of ""meta verse""...",1,2023-03-04 02:22:13,<praw.models.comment_forest.CommentForest object at 0x0000021CD51C1E50>,11h2dvn,gadgets,t5_2qgzt,,False,False,t3_11h2dvn,t3_11h2dvn,/r/gadgets/comments/11h2dvn/mark_zuckerberg_quietly_buries_the_metaverse/jau5pjg/
21,javaujd,AluOwt,This is leading false news. AI and Metaverse are directly connected. Metaverse depends on AI technology but not the other way around. What is seemingly actual is that they're now focusing more on AI.,This is leading false news. AI and Metaverse are directly connected. Metaverse depends on AI technology but not the other way around. What is seemingly actual is that they're now focusing more on AI.,1,2023-03-04 09:53:59,<praw.models.comment_forest.CommentForest object at 0x0000021CD51C1EB0>,11h2dvn,gadgets,t5_2qgzt,,False,False,t3_11h2dvn,t3_11h2dvn,/r/gadgets/comments/11h2dvn/mark_zuckerberg_quietly_buries_the_metaverse/javaujd/
22,jbmt6rt,Ok-Teaching-983,"Nice move zuck, one of the dumbest ideas and wastes of money ever","Nice move zuck, one of the dumbest ideas and wastes of money ever",1,2023-03-10 04:02:12,<praw.models.comment_forest.CommentForest object at 0x0000021CD51C1F10>,11h2dvn,gadgets,t5_2qgzt,,False,False,t3_11h2dvn,t3_11h2dvn,/r/gadgets/comments/11h2dvn/mark_zuckerberg_quietly_buries_the_metaverse/jbmt6rt/
23,jari8cs,DudesworthMannington,"Yeah, clickbaity shit.  Just because he's developing AI doesn't mean shit.  He'd be stupid not to when the other tech giants are.","Yeah, clickbaity shit.  Just because he's developing AI doesn't mean shit.  He'd be stupid not to when the other tech giants are.",42,2023-03-03 15:19:19,<praw.models.comment_forest.CommentForest object at 0x0000021CD51BD790>,11h2dvn,gadgets,t5_2qgzt,,False,False,t3_11h2dvn,t1_jargq8y,/r/gadgets/comments/11h2dvn/mark_zuckerberg_quietly_buries_the_metaverse/jari8cs/
24,jarm1mh,dont_shoot_jr,"All the demos reminded me of that episode of Community where the Dean gets a 90s style virtual reality set but it takes him a long ass time to do normal computer things

“AND JESUS WEPT!!!”","All the demos reminded me of that episode of Community where the Dean gets a 90s style virtual reality set but it takes him a long ass time to do normal computer things

“AND JESUS WEPT!!!”",45,2023-03-03 15:44:57,<praw.models.comment_forest.CommentForest object at 0x0000021CD51BD850>,11h2dvn,gadgets,t5_2qgzt,,False,False,t3_11h2dvn,t1_jarh3sz,/r/gadgets/comments/11h2dvn/mark_zuckerberg_quietly_buries_the_metaverse/jarm1mh/
25,jaridi3,boosthungry,"Honestly, the idea of exploring the solar system in VR sounds like a really good use of VR.  Though 1) I'm not sure VR is actually recommended for kids, is it?  2) A VR app that shows the Solar System should be completely unrelated to the ""Metaverse"", it should just be a VR app.  

(In case it wasn't clear, I completely agree with you.  This idea of exploring the solar system in VR just peaked my interest.)","Honestly, the idea of exploring the solar system in VR sounds like a really good use of VR.  Though 1) I'm not sure VR is actually recommended for kids, is it?  2) A VR app that shows the Solar System should be completely unrelated to the ""Metaverse"", it should just be a VR app.  

(In case it wasn't clear, I completely agree with you.  This idea of exploring the solar system in VR just peaked my interest.)",20,2023-03-03 15:20:18,<praw.models.comment_forest.CommentForest object at 0x0000021CD51BD8B0>,11h2dvn,gadgets,t5_2qgzt,,False,False,t3_11h2dvn,t1_jarh3sz,/r/gadgets/comments/11h2dvn/mark_zuckerberg_quietly_buries_the_metaverse/jaridi3/
26,jarir6a,DarthBuzzard,"> Stuff like city planners being able to plan roads for less traffic. Pretty sure you don't need fancy 3D headsets for this. You can use a normal computer screen and program. Or a child learning about the solar system. There are many ways to do this that don't involve an expensive VR headset.

You can do those things with a book and don't need a computer, but having additional tools only helps the process. Same with VR/AR headsets - they will improve on what we have for education and digital twins.","> Stuff like city planners being able to plan roads for less traffic. Pretty sure you don't need fancy 3D headsets for this. You can use a normal computer screen and program. Or a child learning about the solar system. There are many ways to do this that don't involve an expensive VR headset.

You can do those things with a book and don't need a computer, but having additional tools only helps the process. Same with VR/AR headsets - they will improve on what we have for education and digital twins.",8,2023-03-03 15:22:52,<praw.models.comment_forest.CommentForest object at 0x0000021CD51BD970>,11h2dvn,gadgets,t5_2qgzt,,False,False,t3_11h2dvn,t1_jarh3sz,/r/gadgets/comments/11h2dvn/mark_zuckerberg_quietly_buries_the_metaverse/jarir6a/
27,jarojhb,kompootor,">city planners being able to plan roads for less traffic.

They use VR for finding solutions to protein folding. ... for the past 20 years. And AI's now surpassed humans at it finally, it seems.

Some might object that protein folding is a more complex problem than finding optimal traffic solutions. Yes, inherently, but you'd also be surprised how bad/interesting [traffic can get from first principles](https://www.math.auckland.ac.nz/mathwiki/images/4/4c/Trafficflow.pdf) (and those are done on regular or square grids with no pedestrians) (see also an [AMS article on a geometric non-PDE explanation of the traffic model](https://www.ams.org/publicoutreach/feature-column/fc-2019-12)).

I disagree with your characterization of a VR headset as ""expensive"", especially from the point of view of a research or professional setting. If a VR program for optimizing, say, road design around some arbitrary parameters were inherently cheaper and came out-of-the-box versus a custom-built AI solution, then that would be a very attractive product.",">city planners being able to plan roads for less traffic.

They use VR for finding solutions to protein folding. ... for the past 20 years. And AI's now surpassed humans at it finally, it seems.

Some might object that protein folding is a more complex problem than finding optimal traffic solutions. Yes, inherently, but you'd also be surprised how bad/interesting [traffic can get from first principles](https://www.math.auckland.ac.nz/mathwiki/images/4/4c/Trafficflow.pdf) (and those are done on regular or square grids with no pedestrians) (see also an [AMS article on a geometric non-PDE explanation of the traffic model](https://www.ams.org/publicoutreach/feature-column/fc-2019-12)).

I disagree with your characterization of a VR headset as ""expensive"", especially from the point of view of a research or professional setting. If a VR program for optimizing, say, road design around some arbitrary parameters were inherently cheaper and came out-of-the-box versus a custom-built AI solution, then that would be a very attractive product.",3,2023-03-03 16:01:17,<praw.models.comment_forest.CommentForest object at 0x0000021CD51BF250>,11h2dvn,gadgets,t5_2qgzt,,False,False,t3_11h2dvn,t1_jarh3sz,/r/gadgets/comments/11h2dvn/mark_zuckerberg_quietly_buries_the_metaverse/jarojhb/
28,jas2upe,Gibbonici,"Yeah, that's the thing with the whole metaverse thing - there is nothing you could do in it that you can't already do without it. In effect it was just a fancy menu system for apps.

Just to be clear, I love VR and I think there are a lot of use cases that we haven't figured out yet, but it's going to take more imagination to get there than copying an idea from an early 90s novel and expecting it to work in the real world of the 2020s.","Yeah, that's the thing with the whole metaverse thing - there is nothing you could do in it that you can't already do without it. In effect it was just a fancy menu system for apps.

Just to be clear, I love VR and I think there are a lot of use cases that we haven't figured out yet, but it's going to take more imagination to get there than copying an idea from an early 90s novel and expecting it to work in the real world of the 2020s.",3,2023-03-03 17:34:20,<praw.models.comment_forest.CommentForest object at 0x0000021CD51BF310>,11h2dvn,gadgets,t5_2qgzt,,False,False,t3_11h2dvn,t1_jarh3sz,/r/gadgets/comments/11h2dvn/mark_zuckerberg_quietly_buries_the_metaverse/jas2upe/
29,jarr6q5,TheBioethicist87,They can’t even figure out legs.,They can’t even figure out legs.,1,2023-03-03 16:18:50,<praw.models.comment_forest.CommentForest object at 0x0000021CD51BF370>,11h2dvn,gadgets,t5_2qgzt,,False,False,t3_11h2dvn,t1_jarh3sz,/r/gadgets/comments/11h2dvn/mark_zuckerberg_quietly_buries_the_metaverse/jarr6q5/
30,jb04qro,infodawg,This needs to be one of those voiceover testimonials that they play on PSAs to warn consumers of scams. Perfectly ironic.,This needs to be one of those voiceover testimonials that they play on PSAs to warn consumers of scams. Perfectly ironic.,1,2023-03-05 12:15:20,<praw.models.comment_forest.CommentForest object at 0x0000021CD51BF3D0>,11h2dvn,gadgets,t5_2qgzt,,False,False,t3_11h2dvn,t1_jarh3sz,/r/gadgets/comments/11h2dvn/mark_zuckerberg_quietly_buries_the_metaverse/jb04qro/
31,jarjfhd,bf3h62u1a4j9hy6y95mz,And this is the only source on this I've found.,And this is the only source on this I've found.,4,2023-03-03 15:27:23,<praw.models.comment_forest.CommentForest object at 0x0000021CD51BF490>,11h2dvn,gadgets,t5_2qgzt,,False,False,t3_11h2dvn,t1_jarhxs6,/r/gadgets/comments/11h2dvn/mark_zuckerberg_quietly_buries_the_metaverse/jarjfhd/
32,jarolf4,Newpocky,"Apparently Facebook can’t do AI and VR at the same time according to this guy. Hell, AI may make VR development cheaper in the future.","Apparently Facebook can’t do AI and VR at the same time according to this guy. Hell, AI may make VR development cheaper in the future.",4,2023-03-03 16:01:38,<praw.models.comment_forest.CommentForest object at 0x0000021CD51BF4F0>,11h2dvn,gadgets,t5_2qgzt,,False,False,t3_11h2dvn,t1_jarhxs6,/r/gadgets/comments/11h2dvn/mark_zuckerberg_quietly_buries_the_metaverse/jarolf4/
33,jazc2bq,I_Was_Fox,"I hate Meta as much or more than your average redditor, but calling them a monopoly is pretty silly. There isn't a single thing that they do that could be considered a monopoly. Social media? Not really. VR? Not really. AI? Not really.","I hate Meta as much or more than your average redditor, but calling them a monopoly is pretty silly. There isn't a single thing that they do that could be considered a monopoly. Social media? Not really. VR? Not really. AI? Not really.",1,2023-03-05 05:54:18,<praw.models.comment_forest.CommentForest object at 0x0000021CD51BF610>,11h2dvn,gadgets,t5_2qgzt,,False,False,t3_11h2dvn,t1_jaryygm,/r/gadgets/comments/11h2dvn/mark_zuckerberg_quietly_buries_the_metaverse/jazc2bq/
34,jargxh0,HaAnotherLlama,Meta isn't over though... the article is purely an opinion piece.,Meta isn't over though... the article is purely an opinion piece.,17,2023-03-03 15:10:27,<praw.models.comment_forest.CommentForest object at 0x0000021CD51BF730>,11h2dvn,gadgets,t5_2qgzt,,False,False,t3_11h2dvn,t1_jardyul,/r/gadgets/comments/11h2dvn/mark_zuckerberg_quietly_buries_the_metaverse/jargxh0/
35,jargso1,Xu_Lin,Agreed. FB is cancer,Agreed. FB is cancer,4,2023-03-03 15:09:31,<praw.models.comment_forest.CommentForest object at 0x0000021CD51BF7F0>,11h2dvn,gadgets,t5_2qgzt,,False,False,t3_11h2dvn,t1_jardyul,/r/gadgets/comments/11h2dvn/mark_zuckerberg_quietly_buries_the_metaverse/jargso1/
36,jarjpoa,HRApprovedUsername,Have you used a VR headset? They're kinda fun.,Have you used a VR headset? They're kinda fun.,7,2023-03-03 15:29:17,<praw.models.comment_forest.CommentForest object at 0x0000021CD51BFBB0>,11h2dvn,gadgets,t5_2qgzt,,False,False,t3_11h2dvn,t1_jare99x,/r/gadgets/comments/11h2dvn/mark_zuckerberg_quietly_buries_the_metaverse/jarjpoa/
