,ID,Author,body,Comment,Score,Created On,Replies,Submission,Subreddit,Subreddit_ID,Distinguished,Edited,Is_submitter,link_id,Parent_id,Permalink
321,ictx1lo,Hakairoku,"Wait, so the 6 is worse than the 4a in terms of customizability?","Wait, so the 6 is worse than the 4a in terms of customizability?",1,2022-06-18 13:34:55,<praw.models.comment_forest.CommentForest object at 0x0000021CD74A6D30>,vezgll,gadgets,t5_2qgzt,,False,False,t3_vezgll,t1_ictmszo,/r/gadgets/comments/vezgll/the_pixel_watch_could_be_googles_most/ictx1lo/
322,icudsue,KlondikeDrool,But.. but..  you can put any color case you want on a Pixel phone. That is peak customization by their silly logic!,But.. but..  you can put any color case you want on a Pixel phone. That is peak customization by their silly logic!,2,2022-06-18 15:56:40,<praw.models.comment_forest.CommentForest object at 0x0000021CD74A6FD0>,vezgll,gadgets,t5_2qgzt,,False,False,t3_vezgll,t1_icu63pp,/r/gadgets/comments/vezgll/the_pixel_watch_could_be_googles_most/icudsue/
323,icu8uu8,Jarvdoge,"Good point, there's that too.

Don't get me wrong, I'm really hoping these do well as it would push wear os into the limelight and hopefully get the development of the platform moving faster. The thing is, Google doesn't always have the best track record with hardware so I'll I'm not expecting much from the pixel watch in the long term. Samsung on the other hand has been making solid watches for years so hopefully they will be able to move things forward but only time will tell.","Good point, there's that too.

Don't get me wrong, I'm really hoping these do well as it would push wear os into the limelight and hopefully get the development of the platform moving faster. The thing is, Google doesn't always have the best track record with hardware so I'll I'm not expecting much from the pixel watch in the long term. Samsung on the other hand has been making solid watches for years so hopefully they will be able to move things forward but only time will tell.",1,2022-06-18 15:16:50,<praw.models.comment_forest.CommentForest object at 0x0000021CD74A81F0>,vezgll,gadgets,t5_2qgzt,,False,False,t3_vezgll,t1_ictua9h,/r/gadgets/comments/vezgll/the_pixel_watch_could_be_googles_most/icu8uu8/
324,icts1df,TheAmorphous,"Not just hardware. They abandon every project they start these days. I would never start using a new Google service now, since I know it will just have features removed until it's killed off completely.","Not just hardware. They abandon every project they start these days. I would never start using a new Google service now, since I know it will just have features removed until it's killed off completely.",10,2022-06-18 12:45:15,<praw.models.comment_forest.CommentForest object at 0x0000021CD74A8490>,vezgll,gadgets,t5_2qgzt,,False,False,t3_vezgll,t1_ictrlba,/r/gadgets/comments/vezgll/the_pixel_watch_could_be_googles_most/icts1df/
325,idbpgzg,Testastic,Owning Android means they'll always be in the phone game,Owning Android means they'll always be in the phone game,0,2022-06-22 16:57:52,<praw.models.comment_forest.CommentForest object at 0x0000021CD74A85B0>,vezgll,gadgets,t5_2qgzt,,False,False,t3_vezgll,t1_icubtgx,/r/gadgets/comments/vezgll/the_pixel_watch_could_be_googles_most/idbpgzg/
326,ictlmi5,Cwlcymro,"I understand the sceptism for sure, but Pixel is one place that Google have shown a willingness to keep at it even when it isn't getting huge sales. We're on the 7th year of phones, plus 4 years of the A series, plus 4 versions of earbuds.","I understand the sceptism for sure, but Pixel is one place that Google have shown a willingness to keep at it even when it isn't getting huge sales. We're on the 7th year of phones, plus 4 years of the A series, plus 4 versions of earbuds.",10,2022-06-18 11:31:10,<praw.models.comment_forest.CommentForest object at 0x0000021CD74A8790>,vezgll,gadgets,t5_2qgzt,,False,False,t3_vezgll,t1_ictilh1,/r/gadgets/comments/vezgll/the_pixel_watch_could_be_googles_most/ictlmi5/
327,ictpf5t,tennisgirlal,"They are starting to have a better track record though. When the first pixel came out they weren't sought out by everyone, but Google stuck with their phones, I think they will stick with the watch too. Maybe I'm just thinking too much on the bright side though.","They are starting to have a better track record though. When the first pixel came out they weren't sought out by everyone, but Google stuck with their phones, I think they will stick with the watch too. Maybe I'm just thinking too much on the bright side though.",4,2022-06-18 12:16:35,<praw.models.comment_forest.CommentForest object at 0x0000021CD74A87F0>,vezgll,gadgets,t5_2qgzt,,False,False,t3_vezgll,t1_ictilh1,/r/gadgets/comments/vezgll/the_pixel_watch_could_be_googles_most/ictpf5t/
328,ictpk5c,notluciferforreal,Like pixel phones?,Like pixel phones?,1,2022-06-18 12:18:11,<praw.models.comment_forest.CommentForest object at 0x0000021CD74A8BB0>,vezgll,gadgets,t5_2qgzt,,False,False,t3_vezgll,t1_ictilh1,/r/gadgets/comments/vezgll/the_pixel_watch_could_be_googles_most/ictpk5c/
329,icttouj,sikosmurf,Unique comment,Unique comment,0,2022-06-18 13:02:07,<praw.models.comment_forest.CommentForest object at 0x0000021CD74A8C70>,vezgll,gadgets,t5_2qgzt,,False,False,t3_vezgll,t1_ictilh1,/r/gadgets/comments/vezgll/the_pixel_watch_could_be_googles_most/icttouj/
330,icubocn,jellybon,">but you can switch your Apple Watch strap in mere seconds

Which is also possible on many traditional watches using leather or cloth straps.",">but you can switch your Apple Watch strap in mere seconds

Which is also possible on many traditional watches using leather or cloth straps.",3,2022-06-18 15:39:48,<praw.models.comment_forest.CommentForest object at 0x0000021CD74A8D90>,vezgll,gadgets,t5_2qgzt,,False,False,t3_vezgll,t1_ictzjea,/r/gadgets/comments/vezgll/the_pixel_watch_could_be_googles_most/icubocn/
331,ictpes4,GreatAndPowerfulNixy,"Highly recommend checking out Garmin watches. Not all of them have touch interfaces (my Forerunner 245 Music doesn't and I love it!) but most of them have smartwatch features now, and the Connect IQ library is pretty extensive for apps/faces and other features.","Highly recommend checking out Garmin watches. Not all of them have touch interfaces (my Forerunner 245 Music doesn't and I love it!) but most of them have smartwatch features now, and the Connect IQ library is pretty extensive for apps/faces and other features.",3,2022-06-18 12:16:27,<praw.models.comment_forest.CommentForest object at 0x0000021CD74A8EB0>,vezgll,gadgets,t5_2qgzt,,False,False,t3_vezgll,t1_ictkl36,/r/gadgets/comments/vezgll/the_pixel_watch_could_be_googles_most/ictpes4/
332,ictpmmy,MisterEChops,"And yet, pretty much flawless fit and finish due to the design tolerances.","And yet, pretty much flawless fit and finish due to the design tolerances.",1,2022-06-18 12:18:56,<praw.models.comment_forest.CommentForest object at 0x0000021CD74AB0D0>,vezgll,gadgets,t5_2qgzt,,False,False,t3_vezgll,t1_ictp2zb,/r/gadgets/comments/vezgll/the_pixel_watch_could_be_googles_most/ictpmmy/
333,ictpyly,Ilruz,Built in China != Chinese.,Built in China != Chinese.,0,2022-06-18 12:22:36,<praw.models.comment_forest.CommentForest object at 0x0000021CD74AB250>,vezgll,gadgets,t5_2qgzt,,False,False,t3_vezgll,t1_ictp2zb,/r/gadgets/comments/vezgll/the_pixel_watch_could_be_googles_most/ictpyly/
334,ictkvbb,,"True! When I think of quality assurance, china comes to mind!","True! When I think of quality assurance, china comes to mind!",5,2022-06-18 11:21:07,<praw.models.comment_forest.CommentForest object at 0x0000021CD74AB3D0>,vezgll,gadgets,t5_2qgzt,,False,False,t3_vezgll,t1_ictioau,/r/gadgets/comments/vezgll/the_pixel_watch_could_be_googles_most/ictkvbb/
335,ictopvx,ConciselyVerbose,"Ignoring that the software is the product, the raw hardware isn’t good either.","Ignoring that the software is the product, the raw hardware isn’t good either.",1,2022-06-18 12:08:42,<praw.models.comment_forest.CommentForest object at 0x0000021CD74AB430>,vezgll,gadgets,t5_2qgzt,,False,False,t3_vezgll,t1_ictioau,/r/gadgets/comments/vezgll/the_pixel_watch_could_be_googles_most/ictopvx/
336,ict3a0v,RockstarAgent,"I think Samsung, gotta find them wherever I left them to confirm. 

For me specifically, sweat is what destroyed them. The 1st one the battery fried from sweat that leaked in, the 2nd one, the sweat loosened the cover on the wrist side and then the screen died.","I think Samsung, gotta find them wherever I left them to confirm. 

For me specifically, sweat is what destroyed them. The 1st one the battery fried from sweat that leaked in, the 2nd one, the sweat loosened the cover on the wrist side and then the screen died.",-5,2022-06-18 07:00:09,<praw.models.comment_forest.CommentForest object at 0x0000021CD74AB790>,vezgll,gadgets,t5_2qgzt,,False,False,t3_vezgll,t1_ict2ucz,/r/gadgets/comments/vezgll/the_pixel_watch_could_be_googles_most/ict3a0v/
337,ict98pa,Mhutton25,What’s an iwatch?,What’s an iwatch?,2,2022-06-18 08:27:56,<praw.models.comment_forest.CommentForest object at 0x0000021CD74AB9D0>,vezgll,gadgets,t5_2qgzt,,False,False,t3_vezgll,t1_ict7kcl,/r/gadgets/comments/vezgll/the_pixel_watch_could_be_googles_most/ict98pa/
338,icttsta,RockstarAgent,"I found out the Shazam app has a glitch, after you use the watch to identify a song, it can play the song from the speaker...","I found out the Shazam app has a glitch, after you use the watch to identify a song, it can play the song from the speaker...",2,2022-06-18 13:03:13,<praw.models.comment_forest.CommentForest object at 0x0000021CD74ABA90>,vezgll,gadgets,t5_2qgzt,,False,False,t3_vezgll,t1_ictajtj,/r/gadgets/comments/vezgll/the_pixel_watch_could_be_googles_most/icttsta/
339,ictu1bx,Wetzilla,"Also, you totally can remove those from the phone by using a third party launcher? I haven't used the pixel launcher since the first month I got my Pixel 2 XL.","Also, you totally can remove those from the phone by using a third party launcher? I haven't used the pixel launcher since the first month I got my Pixel 2 XL.",1,2022-06-18 13:05:31,<praw.models.comment_forest.CommentForest object at 0x0000021CD74ABD30>,vezgll,gadgets,t5_2qgzt,,False,False,t3_vezgll,t1_ictqlir,/r/gadgets/comments/vezgll/the_pixel_watch_could_be_googles_most/ictu1bx/
340,ict43tl,Tyler119,That is surprising. Had mine for a couple of months and I've found it excellent.,That is surprising. Had mine for a couple of months and I've found it excellent.,16,2022-06-18 07:11:46,<praw.models.comment_forest.CommentForest object at 0x0000021CD74AD0D0>,vezgll,gadgets,t5_2qgzt,,False,False,t3_vezgll,t1_ict3yl2,/r/gadgets/comments/vezgll/the_pixel_watch_could_be_googles_most/ict43tl/
341,ictpto0,notluciferforreal,"No, you didn't. You ""got"" one just for this comment.","No, you didn't. You ""got"" one just for this comment.",1,2022-06-18 12:21:03,<praw.models.comment_forest.CommentForest object at 0x0000021CD74AD130>,vezgll,gadgets,t5_2qgzt,,False,False,t3_vezgll,t1_ict3yl2,/r/gadgets/comments/vezgll/the_pixel_watch_could_be_googles_most/ictpto0/
342,ictpyb0,MisterEChops,">	Apple Watch doesn’t hold a candle to the garmin Fenix solar 

As a lifestyle watch? It isn’t even close. Apple Watch hands down when used with iOS.",">	Apple Watch doesn’t hold a candle to the garmin Fenix solar 

As a lifestyle watch? It isn’t even close. Apple Watch hands down when used with iOS.",1,2022-06-18 12:22:30,<praw.models.comment_forest.CommentForest object at 0x0000021CD74AD9D0>,vezgll,gadgets,t5_2qgzt,,False,False,t3_vezgll,t1_ictcqpu,/r/gadgets/comments/vezgll/the_pixel_watch_could_be_googles_most/ictpyb0/
343,icvdrk1,,I mean sure but let’s take for example my Apple Watch. I was using the default silicone band for a while but even at a optimal tightness was causing an issue with my wrist. I went to find a nato strap and found some decent ones but I honestly think that’s because I was using a mainstream watch. If though you had a smart watch that uses spring bars you could literally use an enormous amount of straps and wouldn’t even have to worry about whether it was designed for apple or Samsung or whatever,I mean sure but let’s take for example my Apple Watch. I was using the default silicone band for a while but even at a optimal tightness was causing an issue with my wrist. I went to find a nato strap and found some decent ones but I honestly think that’s because I was using a mainstream watch. If though you had a smart watch that uses spring bars you could literally use an enormous amount of straps and wouldn’t even have to worry about whether it was designed for apple or Samsung or whatever,4,2022-06-18 20:43:44,<praw.models.comment_forest.CommentForest object at 0x0000021CD74A4A30>,vezgll,gadgets,t5_2qgzt,,False,False,t3_vezgll,t1_icv7v8l,/r/gadgets/comments/vezgll/the_pixel_watch_could_be_googles_most/icvdrk1/
344,icubd20,OG_CheddarGoblin,Nice username,Nice username,1,2022-06-18 15:37:15,<praw.models.comment_forest.CommentForest object at 0x0000021CD74A4C70>,vezgll,gadgets,t5_2qgzt,,False,False,t3_vezgll,t1_ictwo1s,/r/gadgets/comments/vezgll/the_pixel_watch_could_be_googles_most/icubd20/
345,ictwsq3,kupernicus,You know it's a proprietary connector right?,You know it's a proprietary connector right?,-28,2022-06-18 13:32:35,<praw.models.comment_forest.CommentForest object at 0x0000021CD74A4D90>,vezgll,gadgets,t5_2qgzt,,False,False,t3_vezgll,t1_ictvp6k,/r/gadgets/comments/vezgll/the_pixel_watch_could_be_googles_most/ictwsq3/
346,icuf408,tennisgirlal,Well they don't have to but it would be encouraged because quality third party companies have never liked to make accessories for Google products. More have done it lately but it takes time.,Well they don't have to but it would be encouraged because quality third party companies have never liked to make accessories for Google products. More have done it lately but it takes time.,0,2022-06-18 16:06:59,<praw.models.comment_forest.CommentForest object at 0x0000021CD74A4F70>,vezgll,gadgets,t5_2qgzt,,False,False,t3_vezgll,t1_icu4ost,/r/gadgets/comments/vezgll/the_pixel_watch_could_be_googles_most/icuf408/
347,icu07un,hacky_potter,The real question is will they drop it before it comes out.,The real question is will they drop it before it comes out.,14,2022-06-18 14:04:01,<praw.models.comment_forest.CommentForest object at 0x0000021CD74A6250>,vezgll,gadgets,t5_2qgzt,,False,False,t3_vezgll,t1_ictmxe3,/r/gadgets/comments/vezgll/the_pixel_watch_could_be_googles_most/icu07un/
348,idbp1rq,Testastic,Galaxy Active 2?,Galaxy Active 2?,2,2022-06-22 16:54:55,<praw.models.comment_forest.CommentForest object at 0x0000021CD74A6610>,vezgll,gadgets,t5_2qgzt,,False,False,t3_vezgll,t1_ictv4zo,/r/gadgets/comments/vezgll/the_pixel_watch_could_be_googles_most/idbp1rq/
349,ictm1hk,w3gg001,Well I DO thrive with disappointment …,Well I DO thrive with disappointment …,8,2022-06-18 11:36:26,<praw.models.comment_forest.CommentForest object at 0x0000021CD74A6730>,vezgll,gadgets,t5_2qgzt,,False,False,t3_vezgll,t1_ictkfij,/r/gadgets/comments/vezgll/the_pixel_watch_could_be_googles_most/ictm1hk/
350,ictl2vo,,[deleted],[deleted],4,2022-06-18 11:23:52,<praw.models.comment_forest.CommentForest object at 0x0000021CD74A68B0>,vezgll,gadgets,t5_2qgzt,,False,False,t3_vezgll,t1_ictkhge,/r/gadgets/comments/vezgll/the_pixel_watch_could_be_googles_most/ictl2vo/
351,ictlj4f,3percentinvisible,"I'd argue the Huawei's are pretty good. But on the whole, yes","I'd argue the Huawei's are pretty good. But on the whole, yes",-1,2022-06-18 11:29:56,<praw.models.comment_forest.CommentForest object at 0x0000021CD74A6910>,vezgll,gadgets,t5_2qgzt,,False,False,t3_vezgll,t1_ictkhge,/r/gadgets/comments/vezgll/the_pixel_watch_could_be_googles_most/ictlj4f/
352,icu1ty6,Nine_Inch_Nintendos,"Can't speak for customization but the 6 line is glitchy af. The 4a was peak google phone and it's been sliding since. I'd post all the issues I've been having with my 6 and 6 pro but reddit has a character limit per post of like 10,000","Can't speak for customization but the 6 line is glitchy af. The 4a was peak google phone and it's been sliding since. I'd post all the issues I've been having with my 6 and 6 pro but reddit has a character limit per post of like 10,000",1,2022-06-18 14:18:09,<praw.models.comment_forest.CommentForest object at 0x0000021CD74A6DF0>,vezgll,gadgets,t5_2qgzt,,False,False,t3_vezgll,t1_ictx1lo,/r/gadgets/comments/vezgll/the_pixel_watch_could_be_googles_most/icu1ty6/
353,icvn0pg,lps2,"No, that said, I liked my 3XL far more than my 6 Pro. It's just much more of a walled garden now and it's pretty glitchy","No, that said, I liked my 3XL far more than my 6 Pro. It's just much more of a walled garden now and it's pretty glitchy",1,2022-06-18 21:58:37,<praw.models.comment_forest.CommentForest object at 0x0000021CD74A6E50>,vezgll,gadgets,t5_2qgzt,,1655666212.0,False,t3_vezgll,t1_ictx1lo,/r/gadgets/comments/vezgll/the_pixel_watch_could_be_googles_most/icvn0pg/
354,icygpu4,tismsia,"Me too. 

I'm just super sad. Before the announcement, I was looking forward to buying the second gen watch (was debating how badly I wanted the watch vs being a ""beta"" user). 

After this announcement, I'm not even looking forward to even buying second gen watch. I mean, after the release, I know I can be convinced, but it'll be harder for Google's marketing team to sway me because I'm not even anticipating it at the moment.","Me too. 

I'm just super sad. Before the announcement, I was looking forward to buying the second gen watch (was debating how badly I wanted the watch vs being a ""beta"" user). 

After this announcement, I'm not even looking forward to even buying second gen watch. I mean, after the release, I know I can be convinced, but it'll be harder for Google's marketing team to sway me because I'm not even anticipating it at the moment.",1,2022-06-19 16:10:11,<praw.models.comment_forest.CommentForest object at 0x0000021CD74A82B0>,vezgll,gadgets,t5_2qgzt,,False,False,t3_vezgll,t1_icu8uu8,/r/gadgets/comments/vezgll/the_pixel_watch_could_be_googles_most/icygpu4/
355,ictzd7y,,[deleted],[deleted],1,2022-06-18 13:56:27,<praw.models.comment_forest.CommentForest object at 0x0000021CD74A8550>,vezgll,gadgets,t5_2qgzt,,False,False,t3_vezgll,t1_icts1df,/r/gadgets/comments/vezgll/the_pixel_watch_could_be_googles_most/ictzd7y/
356,icto75x,Prof_Fancy_Pants,"The phones themselves tend not to last very long with their bugs and slow downs. Pixel 2xl did Tom hat to me after a year and it was very annoying. 

Recent Mibhd video on the recent pixel was the same. He switched back and was annoyed at problems still not fixed.","The phones themselves tend not to last very long with their bugs and slow downs. Pixel 2xl did Tom hat to me after a year and it was very annoying. 

Recent Mibhd video on the recent pixel was the same. He switched back and was annoyed at problems still not fixed.",-9,2022-06-18 12:02:52,<praw.models.comment_forest.CommentForest object at 0x0000021CD74A8850>,vezgll,gadgets,t5_2qgzt,,False,False,t3_vezgll,t1_ictlmi5,/r/gadgets/comments/vezgll/the_pixel_watch_could_be_googles_most/icto75x/
357,icubc1g,F-21,"That said, the Pixel is very far from being the first google branded phone...","That said, the Pixel is very far from being the first google branded phone...",1,2022-06-18 15:37:00,<praw.models.comment_forest.CommentForest object at 0x0000021CD74A88B0>,vezgll,gadgets,t5_2qgzt,,False,False,t3_vezgll,t1_ictlmi5,/r/gadgets/comments/vezgll/the_pixel_watch_could_be_googles_most/icubc1g/
358,ictqobz,Buzstringer,"The Garmins are a nice choice, but I'm going for a Mi Band next, for $30 it doesn't matter if it gets scratched up and ruined before next year's release. 

For the price of a Garmin or fitbit i could buy a new model Mi Band every year for the next 4 years.","The Garmins are a nice choice, but I'm going for a Mi Band next, for $30 it doesn't matter if it gets scratched up and ruined before next year's release. 

For the price of a Garmin or fitbit i could buy a new model Mi Band every year for the next 4 years.",1,2022-06-18 12:30:34,<praw.models.comment_forest.CommentForest object at 0x0000021CD74A8F70>,vezgll,gadgets,t5_2qgzt,,False,False,t3_vezgll,t1_ictpes4,/r/gadgets/comments/vezgll/the_pixel_watch_could_be_googles_most/ictqobz/
359,ictmvad,Ilruz,Not to mention customer care and after sale support.,Not to mention customer care and after sale support.,3,2022-06-18 11:46:50,<praw.models.comment_forest.CommentForest object at 0x0000021CD74AB490>,vezgll,gadgets,t5_2qgzt,,False,False,t3_vezgll,t1_ictkvbb,/r/gadgets/comments/vezgll/the_pixel_watch_could_be_googles_most/ictmvad/
360,ict7b13,super_nicktendo22,"There's been waterproof android/tizen watches for a while now - I've had my Gear S3 for 5 years and while not waterproof, it's withstood daily use/sweat/abuse and still going strong.","There's been waterproof android/tizen watches for a while now - I've had my Gear S3 for 5 years and while not waterproof, it's withstood daily use/sweat/abuse and still going strong.",13,2022-06-18 07:59:01,<praw.models.comment_forest.CommentForest object at 0x0000021CD74AB850>,vezgll,gadgets,t5_2qgzt,,False,False,t3_vezgll,t1_ict3a0v,/r/gadgets/comments/vezgll/the_pixel_watch_could_be_googles_most/ict7b13/
361,ictfbuy,makomirocket,These both sound like warranty issues that should be been pressed for repair or replacements,These both sound like warranty issues that should be been pressed for repair or replacements,5,2022-06-18 10:02:07,<praw.models.comment_forest.CommentForest object at 0x0000021CD74AB8B0>,vezgll,gadgets,t5_2qgzt,,False,False,t3_vezgll,t1_ict3a0v,/r/gadgets/comments/vezgll/the_pixel_watch_could_be_googles_most/ictfbuy/
362,ict9trm,isjahammer,Same. Mine is fine. I didn't experience any bugs. Only thing that is not great is the responsiveness of the fingerprint sensor.,Same. Mine is fine. I didn't experience any bugs. Only thing that is not great is the responsiveness of the fingerprint sensor.,15,2022-06-18 08:36:49,<praw.models.comment_forest.CommentForest object at 0x0000021CD74AD190>,vezgll,gadgets,t5_2qgzt,,False,False,t3_vezgll,t1_ict43tl,/r/gadgets/comments/vezgll/the_pixel_watch_could_be_googles_most/ict9trm/
363,ictu15c,UsEdScR,"I love the picture quality and other features but it's been buggy for me. Random crashes happen frequently and it's been laggy.  Maybe I got a defective one or something because I still see people praising the phone. :/

What a shitty salty sub . I'm literally stating the issues I have and you guys just down vote. Jesus Christ fucking god forbid I tell the fucking truth","I love the picture quality and other features but it's been buggy for me. Random crashes happen frequently and it's been laggy.  Maybe I got a defective one or something because I still see people praising the phone. :/

What a shitty salty sub . I'm literally stating the issues I have and you guys just down vote. Jesus Christ fucking god forbid I tell the fucking truth",3,2022-06-18 13:05:28,<praw.models.comment_forest.CommentForest object at 0x0000021CD74AD1F0>,vezgll,gadgets,t5_2qgzt,,1655559000.0,False,t3_vezgll,t1_ict43tl,/r/gadgets/comments/vezgll/the_pixel_watch_could_be_googles_most/ictu15c/
364,icu1c5n,ConvictedOrigins,"Constant screen glitches, fingerprint bullshit, a drop of water on the screen and it goes haywire, terrible battery life,  and don't get me started on the dumbass google assistant for a flagship the Google 6pro isn't good at all.","Constant screen glitches, fingerprint bullshit, a drop of water on the screen and it goes haywire, terrible battery life,  and don't get me started on the dumbass google assistant for a flagship the Google 6pro isn't good at all.",1,2022-06-18 14:13:50,<praw.models.comment_forest.CommentForest object at 0x0000021CD74AD250>,vezgll,gadgets,t5_2qgzt,,False,False,t3_vezgll,t1_ict43tl,/r/gadgets/comments/vezgll/the_pixel_watch_could_be_googles_most/icu1c5n/
365,ictthzl,UsEdScR,"That's such a stupid thing to say. 

Yes. I ""got"" one .

Imagine starting your morning saying some dumb ass stuff like this.","That's such a stupid thing to say. 

Yes. I ""got"" one .

Imagine starting your morning saying some dumb ass stuff like this.",0,2022-06-18 13:00:14,<praw.models.comment_forest.CommentForest object at 0x0000021CD74AD370>,vezgll,gadgets,t5_2qgzt,,False,False,t3_vezgll,t1_ictpto0,/r/gadgets/comments/vezgll/the_pixel_watch_could_be_googles_most/ictthzl/
366,icujh46,BurgerMcKinley,"If you need a small iPhone on your wrist. If you want a rugged, solar, activity tracker with satellite navigation, It’s garmin.","If you need a small iPhone on your wrist. If you want a rugged, solar, activity tracker with satellite navigation, It’s garmin.",1,2022-06-18 16:41:22,<praw.models.comment_forest.CommentForest object at 0x0000021CD74ADA90>,vezgll,gadgets,t5_2qgzt,,False,False,t3_vezgll,t1_ictpyb0,/r/gadgets/comments/vezgll/the_pixel_watch_could_be_googles_most/icujh46/
367,icukpda,TheBigCheeseGoblin,A gentleman (gentlegoblin?) of culture,A gentleman (gentlegoblin?) of culture,1,2022-06-18 16:51:02,<praw.models.comment_forest.CommentForest object at 0x0000021CD74A4D30>,vezgll,gadgets,t5_2qgzt,,False,False,t3_vezgll,t1_icubd20,/r/gadgets/comments/vezgll/the_pixel_watch_could_be_googles_most/icukpda/
