,ID,Author,body,Comment,Score,Created On,Replies,Submission,Subreddit,Subreddit_ID,Distinguished,Edited,Is_submitter,link_id,Parent_id,Permalink
80,g4fgk9e,driftingfornow,"I feel like nobody answered your question satisfactorily so I will shoot. 

I am a musician and record and produce my own music. 

When I am looking at headphones, I want and expect things like increased bass response to get some oomph on bumpy things, I like closed back so I can listen on public transport without annoying the person next to me, and in general I expect the “fingerprint” of the sum of the drivers and wiring+circuitry to focus on things like polishing a signal to what that manufacturer sees as good, with each manufacturer having different little traits to appeal to different sorts. Maybe I would get something with active noise cancelling and Bluetooth so I don’t have to fiddle provided the protocol for Bluetooth doesn’t decrease quality too much. Oh, folding ones are nice for storage and portability, and I am willing to have a company skimp on drivers from the money I’m paying to also pay keen attention to build quality as it needs to survive being taken around, flown in, slept with on a bus, dropped, backpacks, etc. 

Comparatively:

My studio monitoring headphones have (ideally) a flat response and don’t add extra ass in the bass for my pleasure. It tries to tell me as accurately as possible inbetween all systems what is going on. Different systems attenuate different frequencies differently. If I mixed on headphones that artificially inflate the bass, maybe when I migrate to another system that doesn’t do that, there’s no bass because it’s not getting enough amplification to cut through the mix. 

So that’s the rough idea behind flat response and I will try to be shorter for the rest. Folding just makes noise that shows up on recordings IMO, Bluetooth isn’t as accurate of a picture and I need that. Close backed decreases sense of stereo field and if you’re mixing on headphones you’re already compromising because actual speaker monitors are better for this, so close back just makes a downside even worse. Noise masking also isn’t a problem in a studio typically and shouldn’t be if it is; means bad location. My studio cans also stay in the studio so most of the money was in drivers and the build quality isn’t tank like but also I didn’t pay enough to feel that I was owed that. Oh, Bluetooth again, that shit adds way too much latency to record with yet that I know of. Maybe someone got it done but not cheap enough I can afford. You would not at this juncture want to mix with Bluetooth headphones but honestly if someone did crack affordable no latency monitoring Bluetooth headphones I would pick them up just to be free of wires during that stage of things. 


I hope this gives you insight into the characteristics that someone deciding monitors or headphones might take into consideration when deciding what to get and why. My list wasn’t comprehensive but should give a good idea.","I feel like nobody answered your question satisfactorily so I will shoot. 

I am a musician and record and produce my own music. 

When I am looking at headphones, I want and expect things like increased bass response to get some oomph on bumpy things, I like closed back so I can listen on public transport without annoying the person next to me, and in general I expect the “fingerprint” of the sum of the drivers and wiring+circuitry to focus on things like polishing a signal to what that manufacturer sees as good, with each manufacturer having different little traits to appeal to different sorts. Maybe I would get something with active noise cancelling and Bluetooth so I don’t have to fiddle provided the protocol for Bluetooth doesn’t decrease quality too much. Oh, folding ones are nice for storage and portability, and I am willing to have a company skimp on drivers from the money I’m paying to also pay keen attention to build quality as it needs to survive being taken around, flown in, slept with on a bus, dropped, backpacks, etc. 

Comparatively:

My studio monitoring headphones have (ideally) a flat response and don’t add extra ass in the bass for my pleasure. It tries to tell me as accurately as possible inbetween all systems what is going on. Different systems attenuate different frequencies differently. If I mixed on headphones that artificially inflate the bass, maybe when I migrate to another system that doesn’t do that, there’s no bass because it’s not getting enough amplification to cut through the mix. 

So that’s the rough idea behind flat response and I will try to be shorter for the rest. Folding just makes noise that shows up on recordings IMO, Bluetooth isn’t as accurate of a picture and I need that. Close backed decreases sense of stereo field and if you’re mixing on headphones you’re already compromising because actual speaker monitors are better for this, so close back just makes a downside even worse. Noise masking also isn’t a problem in a studio typically and shouldn’t be if it is; means bad location. My studio cans also stay in the studio so most of the money was in drivers and the build quality isn’t tank like but also I didn’t pay enough to feel that I was owed that. Oh, Bluetooth again, that shit adds way too much latency to record with yet that I know of. Maybe someone got it done but not cheap enough I can afford. You would not at this juncture want to mix with Bluetooth headphones but honestly if someone did crack affordable no latency monitoring Bluetooth headphones I would pick them up just to be free of wires during that stage of things. 


I hope this gives you insight into the characteristics that someone deciding monitors or headphones might take into consideration when deciding what to get and why. My list wasn’t comprehensive but should give a good idea.",1,2020-09-08 10:35:12,<praw.models.comment_forest.CommentForest object at 0x0000021CD741CB50>,io8cpr,gadgets,t5_2qgzt,,False,False,t3_io8cpr,t1_g4d17cn,/r/gadgets/comments/io8cpr/akg_k371bt_headphones_review_quality_portable/g4fgk9e/
81,g4e0l8a,tehifi,"Most manufacturers are, if we're honest. A decent headphone is a cheap thing to make. Most companies have made them cheaper to build over the years, but jacked up the price while the build quality has gone as low as it can go.","Most manufacturers are, if we're honest. A decent headphone is a cheap thing to make. Most companies have made them cheaper to build over the years, but jacked up the price while the build quality has gone as low as it can go.",1,2020-09-07 23:20:10,<praw.models.comment_forest.CommentForest object at 0x0000021CD741CC70>,io8cpr,gadgets,t5_2qgzt,,False,False,t3_io8cpr,t1_g4d6ifv,/r/gadgets/comments/io8cpr/akg_k371bt_headphones_review_quality_portable/g4e0l8a/
82,g4ffshz,driftingfornow,I have some “new” AKG’s (post change) and they’re good. That said they’re just (330’s?) so I had reasonable expectations.,I have some “new” AKG’s (post change) and they’re good. That said they’re just (330’s?) so I had reasonable expectations.,1,2020-09-08 10:21:22,<praw.models.comment_forest.CommentForest object at 0x0000021CD741CCD0>,io8cpr,gadgets,t5_2qgzt,,False,False,t3_io8cpr,t1_g4d6ifv,/r/gadgets/comments/io8cpr/akg_k371bt_headphones_review_quality_portable/g4ffshz/
83,g4ffcfj,driftingfornow,I mean you can pick at AKG for some things but monitoring headphones are flat response lol... shouldn’t have too crazy of bass.,I mean you can pick at AKG for some things but monitoring headphones are flat response lol... shouldn’t have too crazy of bass.,1,2020-09-08 10:13:18,<praw.models.comment_forest.CommentForest object at 0x0000021CD741CF70>,io8cpr,gadgets,t5_2qgzt,,False,False,t3_io8cpr,t1_g4euhvs,/r/gadgets/comments/io8cpr/akg_k371bt_headphones_review_quality_portable/g4ffcfj/
84,g4d6qd9,iridisss,"I was in the same boat as you; recently pulled the trigger on a set of K712 Pros, coming from HD598s. The difference is almost night and day, and the 598s feel almost cramped when I tried them again. I certainly won't look back, and I think you'll be quite happy with them once you make the move.","I was in the same boat as you; recently pulled the trigger on a set of K712 Pros, coming from HD598s. The difference is almost night and day, and the 598s feel almost cramped when I tried them again. I certainly won't look back, and I think you'll be quite happy with them once you make the move.",4,2020-09-07 19:18:00,<praw.models.comment_forest.CommentForest object at 0x0000021CD741F2B0>,io8cpr,gadgets,t5_2qgzt,,False,False,t3_io8cpr,t1_g4d1qre,/r/gadgets/comments/io8cpr/akg_k371bt_headphones_review_quality_portable/g4d6qd9/
85,g4e03y5,tehifi,"Get a decent used pair of K340's, if you like AKG stuff. The pair I use at work is about 40 years old.","Get a decent used pair of K340's, if you like AKG stuff. The pair I use at work is about 40 years old.",1,2020-09-07 23:15:22,<praw.models.comment_forest.CommentForest object at 0x0000021CD741F310>,io8cpr,gadgets,t5_2qgzt,,False,False,t3_io8cpr,t1_g4d1qre,/r/gadgets/comments/io8cpr/akg_k371bt_headphones_review_quality_portable/g4e03y5/
86,g4f3l6s,max_costco,The 598 is better than the 7XX. I’d avoid that particular model since Drops retune wasn’t that great.,The 598 is better than the 7XX. I’d avoid that particular model since Drops retune wasn’t that great.,1,2020-09-08 06:38:13,<praw.models.comment_forest.CommentForest object at 0x0000021CD741F3D0>,io8cpr,gadgets,t5_2qgzt,,False,False,t3_io8cpr,t1_g4d1qre,/r/gadgets/comments/io8cpr/akg_k371bt_headphones_review_quality_portable/g4f3l6s/
87,g4cnth2,dangil,Always has been,Always has been,188,2020-09-07 17:05:52,<praw.models.comment_forest.CommentForest object at 0x0000021CD7415910>,io8cpr,gadgets,t5_2qgzt,,False,False,t3_io8cpr,t1_g4cl0e2,/r/gadgets/comments/io8cpr/akg_k371bt_headphones_review_quality_portable/g4cnth2/
88,g4ht5dj,TattedUp,"Yep, and this reminder is my cue to unsubscribe.","Yep, and this reminder is my cue to unsubscribe.",3,2020-09-08 23:38:12,<praw.models.comment_forest.CommentForest object at 0x0000021CD7415970>,io8cpr,gadgets,t5_2qgzt,,False,False,t3_io8cpr,t1_g4cl0e2,/r/gadgets/comments/io8cpr/akg_k371bt_headphones_review_quality_portable/g4ht5dj/
89,g4d1d6y,Geoff_Uckersilf,Why do I get this weird deja vu feeling...,Why do I get this weird deja vu feeling...,4,2020-09-07 18:39:21,<praw.models.comment_forest.CommentForest object at 0x0000021CD7415B50>,io8cpr,gadgets,t5_2qgzt,,False,False,t3_io8cpr,t1_g4cl0e2,/r/gadgets/comments/io8cpr/akg_k371bt_headphones_review_quality_portable/g4d1d6y/
90,g4cotz5,2spicy4dapepper,I think you’ll find life is a highway,I think you’ll find life is a highway,24,2020-09-07 17:12:45,<praw.models.comment_forest.CommentForest object at 0x0000021CD7415D90>,io8cpr,gadgets,t5_2qgzt,,False,False,t3_io8cpr,t1_g4compz,/r/gadgets/comments/io8cpr/akg_k371bt_headphones_review_quality_portable/g4cotz5/
91,g4cpcou,,That’s an idiotic statement. Life existed long before advertising.,That’s an idiotic statement. Life existed long before advertising.,-3,2020-09-07 17:16:37,<praw.models.comment_forest.CommentForest object at 0x0000021CD7415DF0>,io8cpr,gadgets,t5_2qgzt,,False,False,t3_io8cpr,t1_g4compz,/r/gadgets/comments/io8cpr/akg_k371bt_headphones_review_quality_portable/g4cpcou/
92,g4d1okk,Baud_Olofsson,Some members of the former core team did an AMA a couple of years ago after forming their own company after the buyout: https://www.reddit.com/r/IAmA/comments/7ktk7e/we_are_austrian_audio_gmbh_a_team_of_many_of_the/,Some members of the former core team did an AMA a couple of years ago after forming their own company after the buyout: https://www.reddit.com/r/IAmA/comments/7ktk7e/we_are_austrian_audio_gmbh_a_team_of_many_of_the/,24,2020-09-07 18:41:41,<praw.models.comment_forest.CommentForest object at 0x0000021CD7418310>,io8cpr,gadgets,t5_2qgzt,,False,False,t3_io8cpr,t1_g4cvylv,/r/gadgets/comments/io8cpr/akg_k371bt_headphones_review_quality_portable/g4d1okk/
93,g4d20v5,glambx,Shame.  I used to own the legendary K1000 back in the day.  They were a revelation..,Shame.  I used to own the legendary K1000 back in the day.  They were a revelation..,10,2020-09-07 18:44:13,<praw.models.comment_forest.CommentForest object at 0x0000021CD7418370>,io8cpr,gadgets,t5_2qgzt,,False,False,t3_io8cpr,t1_g4cvylv,/r/gadgets/comments/io8cpr/akg_k371bt_headphones_review_quality_portable/g4d20v5/
94,g4enlfn,vagrantist,So glad I purchased that matched pair of c414’s years ago.,So glad I purchased that matched pair of c414’s years ago.,3,2020-09-08 03:07:43,<praw.models.comment_forest.CommentForest object at 0x0000021CD74183D0>,io8cpr,gadgets,t5_2qgzt,,False,False,t3_io8cpr,t1_g4cvylv,/r/gadgets/comments/io8cpr/akg_k371bt_headphones_review_quality_portable/g4enlfn/
95,g4fcsle,,oh what the fuck,oh what the fuck,2,2020-09-08 09:25:13,<praw.models.comment_forest.CommentForest object at 0x0000021CD7418490>,io8cpr,gadgets,t5_2qgzt,,False,False,t3_io8cpr,t1_g4cvylv,/r/gadgets/comments/io8cpr/akg_k371bt_headphones_review_quality_portable/g4fcsle/
96,g4dff0c,MagicHamsta,"He's all about that bass. 'Bout that bass, no treble.","He's all about that bass. 'Bout that bass, no treble.",8,2020-09-07 20:18:21,<praw.models.comment_forest.CommentForest object at 0x0000021CD74187F0>,io8cpr,gadgets,t5_2qgzt,,False,False,t3_io8cpr,t1_g4csra4,/r/gadgets/comments/io8cpr/akg_k371bt_headphones_review_quality_portable/g4dff0c/
97,g4cudah,phatelectribe,"Ok never is a bit strong but treble is a musical and Hifi term. Engineers at a precise and pedantic bunch where outdated terms like treble aren’t preferred. They’ll talk specifics in terms of hi’s, mid hi’s or even frequency bands. One legendary engineer said you can always spot the rookie by the terms the use. Duct tape instead of gaffer tape. Treble instead of hi’s.","Ok never is a bit strong but treble is a musical and Hifi term. Engineers at a precise and pedantic bunch where outdated terms like treble aren’t preferred. They’ll talk specifics in terms of hi’s, mid hi’s or even frequency bands. One legendary engineer said you can always spot the rookie by the terms the use. Duct tape instead of gaffer tape. Treble instead of hi’s.",27,2020-09-07 17:49:13,<praw.models.comment_forest.CommentForest object at 0x0000021CD7418850>,io8cpr,gadgets,t5_2qgzt,,False,False,t3_io8cpr,t1_g4csra4,/r/gadgets/comments/io8cpr/akg_k371bt_headphones_review_quality_portable/g4cudah/
98,g4f9tc6,,"Treble is a musical term, not an audio term. A recording engineer will refer to the highs as *the highs*, not as treble. Treble isn’t a specific pitch or frequency band, it’s an octave. If the headphones sound harsh around the 5K range, I’ll just say that instead of referring to it as “treble” because treble isn’t specific enough. When dealing with something as abstract as sound, it’s important that your language is specific so it doesn’t just add another layer of abstraction to things.

If someone tells me something sounds “muddy” I’ll have to pry the specifics out of them. Maybe they want the low-mids brought down. Maybe they want the mid-highs brought up. Maybe they want the reverb to decay faster. Maybe they don’t like the mic used, and want to use a condenser instead of a dynamic mic. 

Because they weren’t specific, I don’t immediately know what they’re referring to. In this example, “muddy” could mean different things to different people, so it’s a bad term to use if you’re trying to explain how something sounds. Maybe to me, I think it sounds tinny, or sharp, or dull, or flat, or any number of descriptors. But none of those will communicate what I want changed; If I’m trying to explain something to my recording engineer, I wouldn’t just stop at one of those descriptors and let them guess-and-check their way to a good mix. The same goes with headphones. I wouldn’t say that my studio monitors sound muddy, or that the treble needs to be adjusted. I’d say the high-mids need to be EQ’ed up by 3dB.","Treble is a musical term, not an audio term. A recording engineer will refer to the highs as *the highs*, not as treble. Treble isn’t a specific pitch or frequency band, it’s an octave. If the headphones sound harsh around the 5K range, I’ll just say that instead of referring to it as “treble” because treble isn’t specific enough. When dealing with something as abstract as sound, it’s important that your language is specific so it doesn’t just add another layer of abstraction to things.

If someone tells me something sounds “muddy” I’ll have to pry the specifics out of them. Maybe they want the low-mids brought down. Maybe they want the mid-highs brought up. Maybe they want the reverb to decay faster. Maybe they don’t like the mic used, and want to use a condenser instead of a dynamic mic. 

Because they weren’t specific, I don’t immediately know what they’re referring to. In this example, “muddy” could mean different things to different people, so it’s a bad term to use if you’re trying to explain how something sounds. Maybe to me, I think it sounds tinny, or sharp, or dull, or flat, or any number of descriptors. But none of those will communicate what I want changed; If I’m trying to explain something to my recording engineer, I wouldn’t just stop at one of those descriptors and let them guess-and-check their way to a good mix. The same goes with headphones. I wouldn’t say that my studio monitors sound muddy, or that the treble needs to be adjusted. I’d say the high-mids need to be EQ’ed up by 3dB.",2,2020-09-08 08:27:34,<praw.models.comment_forest.CommentForest object at 0x0000021CD74188B0>,io8cpr,gadgets,t5_2qgzt,,False,False,t3_io8cpr,t1_g4csra4,/r/gadgets/comments/io8cpr/akg_k371bt_headphones_review_quality_portable/g4f9tc6/
99,g4ct14u,phatelectribe,"Musical. Not engineering, definitely not pro audio. Icy is meaningless when you can use technical language that is accurate. He also says low bass when studio monitors are meant to be flat. I can pick out so many more things (like who in a professional environment gives a shit about unboxing?) but it’s obvious this is someone that wouldn’t know pro audio if they woke up in a dub stage.","Musical. Not engineering, definitely not pro audio. Icy is meaningless when you can use technical language that is accurate. He also says low bass when studio monitors are meant to be flat. I can pick out so many more things (like who in a professional environment gives a shit about unboxing?) but it’s obvious this is someone that wouldn’t know pro audio if they woke up in a dub stage.",18,2020-09-07 17:40:17,<praw.models.comment_forest.CommentForest object at 0x0000021CD741A190>,io8cpr,gadgets,t5_2qgzt,,False,False,t3_io8cpr,t1_g4crfe4,/r/gadgets/comments/io8cpr/akg_k371bt_headphones_review_quality_portable/g4ct14u/
100,g4dgj2v,tekzenmusic,"yea he's right. Musician and sound engineer here, I wouldn't use treble in an engineering way, it's a musical term and a very basic non-specific one at that. It doesn't really have meaning in an engineering sense, because the tonal center of the note doesn't really relate to its frequencies. For example, you might have an electric bass playing a low bass note, but when it's recorded it will have frequencies all the way up to 20khz or whatever, so asking me to turn up the treble when someone wants more high end on the bass doesn't make sense. Make sense?! lol.

EDIT: Gotta love reddit, I've been doing this 25 yrs at the top level of the music industry yet some dude who ""knows some engineers"" is apparently correct. You did it reddit, great job lol!","yea he's right. Musician and sound engineer here, I wouldn't use treble in an engineering way, it's a musical term and a very basic non-specific one at that. It doesn't really have meaning in an engineering sense, because the tonal center of the note doesn't really relate to its frequencies. For example, you might have an electric bass playing a low bass note, but when it's recorded it will have frequencies all the way up to 20khz or whatever, so asking me to turn up the treble when someone wants more high end on the bass doesn't make sense. Make sense?! lol.

EDIT: Gotta love reddit, I've been doing this 25 yrs at the top level of the music industry yet some dude who ""knows some engineers"" is apparently correct. You did it reddit, great job lol!",-8,2020-09-07 20:26:15,<praw.models.comment_forest.CommentForest object at 0x0000021CD741A250>,io8cpr,gadgets,t5_2qgzt,,1599606262.0,False,t3_io8cpr,t1_g4crfe4,/r/gadgets/comments/io8cpr/akg_k371bt_headphones_review_quality_portable/g4dgj2v/
101,g4ctblq,phatelectribe,"Exactly. He would be commenting on their deviation from flatness now saying their bass is low but if he  knew anything about listening curves he would have written the review that way. And that’s fine, just don’t be reviewing pro audio “studio monitors” (sic) when you don’t know what they are.","Exactly. He would be commenting on their deviation from flatness now saying their bass is low but if he  knew anything about listening curves he would have written the review that way. And that’s fine, just don’t be reviewing pro audio “studio monitors” (sic) when you don’t know what they are.",2,2020-09-07 17:42:08,<praw.models.comment_forest.CommentForest object at 0x0000021CD741A5B0>,io8cpr,gadgets,t5_2qgzt,,False,False,t3_io8cpr,t1_g4crz5j,/r/gadgets/comments/io8cpr/akg_k371bt_headphones_review_quality_portable/g4ctblq/
102,g4crog4,Wuzzy_Gee,"The latency would not be an issue for mixing, but recording/performing over Bluetooth is impossible to do properly.  Also, any semi-pro or better will absolutely NEVER mix over headphones (this is a 101 thing in music production) so the whole term “studio monitors”  in regards to headphones is just marketing fluff.  Any closed headphones producing a reasonably clear and unexaggerated response would be suitable for recording.

Edit.a word","The latency would not be an issue for mixing, but recording/performing over Bluetooth is impossible to do properly.  Also, any semi-pro or better will absolutely NEVER mix over headphones (this is a 101 thing in music production) so the whole term “studio monitors”  in regards to headphones is just marketing fluff.  Any closed headphones producing a reasonably clear and unexaggerated response would be suitable for recording.

Edit.a word",8,2020-09-07 17:31:22,<praw.models.comment_forest.CommentForest object at 0x0000021CD741AAF0>,io8cpr,gadgets,t5_2qgzt,,False,False,t3_io8cpr,t1_g4cqi0x,/r/gadgets/comments/io8cpr/akg_k371bt_headphones_review_quality_portable/g4crog4/
103,g4cr4mg,100catactivs,Latency is only a consideration for live musician recording; it doesn’t interfere with tasks such as mixing/mastering or non-live music production.,Latency is only a consideration for live musician recording; it doesn’t interfere with tasks such as mixing/mastering or non-live music production.,6,2020-09-07 17:27:44,<praw.models.comment_forest.CommentForest object at 0x0000021CD741AC10>,io8cpr,gadgets,t5_2qgzt,,False,False,t3_io8cpr,t1_g4cqi0x,/r/gadgets/comments/io8cpr/akg_k371bt_headphones_review_quality_portable/g4cr4mg/
104,g4epg0n,wannabpm,How many AKG’s have you listened to?,How many AKG’s have you listened to?,3,2020-09-08 03:28:10,<praw.models.comment_forest.CommentForest object at 0x0000021CD741C430>,io8cpr,gadgets,t5_2qgzt,,False,False,t3_io8cpr,t1_g4ed02m,/r/gadgets/comments/io8cpr/akg_k371bt_headphones_review_quality_portable/g4epg0n/
105,g4csl7m,Inspector_Bloor,thanks for the input! I’ve long used akg closed ears but they were always lose because I also hate feeling clamped in headphones. I really want to try open ear,thanks for the input! I’ve long used akg closed ears but they were always lose because I also hate feeling clamped in headphones. I really want to try open ear,0,2020-09-07 17:37:32,<praw.models.comment_forest.CommentForest object at 0x0000021CD741C850>,io8cpr,gadgets,t5_2qgzt,,False,False,t3_io8cpr,t1_g4cs09k,/r/gadgets/comments/io8cpr/akg_k371bt_headphones_review_quality_portable/g4csl7m/
106,g4f3iob,max_costco,Honestly 770s and 990s get crushed by the K371. Beyerdynamic need to kill the treble on their headphones. They’re durable but they’re a newcomer trap through and through. The 880 is good though.,Honestly 770s and 990s get crushed by the K371. Beyerdynamic need to kill the treble on their headphones. They’re durable but they’re a newcomer trap through and through. The 880 is good though.,1,2020-09-08 06:37:11,<praw.models.comment_forest.CommentForest object at 0x0000021CD741CA30>,io8cpr,gadgets,t5_2qgzt,,False,False,t3_io8cpr,t1_g4dzrem,/r/gadgets/comments/io8cpr/akg_k371bt_headphones_review_quality_portable/g4f3iob/
