,ID,Author,body,Comment,Score,Created On,Replies,Submission,Subreddit,Subreddit_ID,Distinguished,Edited,Is_submitter,link_id,Parent_id,Permalink
0,jw4f98n,Advanced-Blackberry,Seems significantly more practical to just use BT or plug in USB. This looks terrible.,Seems significantly more practical to just use BT or plug in USB. This looks terrible.,12,2023-08-14 10:41:24,<praw.models.comment_forest.CommentForest object at 0x0000021CD73F47F0>,15qqqtd,gadgets,t5_2qgzt,,False,False,t3_15qqqtd,t3_15qqqtd,/r/gadgets/comments/15qqqtd/use_your_desktop_keyboard_overon_your_laptop/jw4f98n/
1,jw557yt,bryptobrazy,HHKB fits perfectly over laptop keyboards!,HHKB fits perfectly over laptop keyboards!,3,2023-08-14 14:18:30,<praw.models.comment_forest.CommentForest object at 0x0000021CD73F48E0>,15qqqtd,gadgets,t5_2qgzt,,False,False,t3_15qqqtd,t3_15qqqtd,/r/gadgets/comments/15qqqtd/use_your_desktop_keyboard_overon_your_laptop/jw557yt/
2,jw5jpe0,Zev,"I use an app called Karabiner which disables my mac keyboard when I plug in a USB keyboard. I put my preonic directly on top of the build in keyboard and it works like a charm. The 4 rubber feet touch keys, but it sits firmly and feels great to type on, and the trackpad is totally useable.","I use an app called Karabiner which disables my mac keyboard when I plug in a USB keyboard. I put my preonic directly on top of the build in keyboard and it works like a charm. The 4 rubber feet touch keys, but it sits firmly and feels great to type on, and the trackpad is totally useable.",2,2023-08-14 15:50:26,<praw.models.comment_forest.CommentForest object at 0x0000021CD73F49D0>,15qqqtd,gadgets,t5_2qgzt,,False,False,t3_15qqqtd,t3_15qqqtd,/r/gadgets/comments/15qqqtd/use_your_desktop_keyboard_overon_your_laptop/jw5jpe0/
3,jwpvesl,PM_ME_CUTE_SM1LE,we have achieved new levels of pretentiousness for starbucks macbook hipsters. Now they are also going to be loud with their $1000 custom mechanical keyboards,we have achieved new levels of pretentiousness for starbucks macbook hipsters. Now they are also going to be loud with their $1000 custom mechanical keyboards,2,2023-08-18 13:29:18,<praw.models.comment_forest.CommentForest object at 0x0000021CD73F4C70>,15qqqtd,gadgets,t5_2qgzt,,False,False,t3_15qqqtd,t3_15qqqtd,/r/gadgets/comments/15qqqtd/use_your_desktop_keyboard_overon_your_laptop/jwpvesl/
4,jw4fxru,giuliomagnifico,"Yes obviously, but put a desktop keyboard over the laptop keyboard is way more handful because it uses less space, you are less far from the display and you can use the trackpad under the keyboard.","Yes obviously, but put a desktop keyboard over the laptop keyboard is way more handful because it uses less space, you are less far from the display and you can use the trackpad under the keyboard.",-10,2023-08-14 10:48:59,<praw.models.comment_forest.CommentForest object at 0x0000021CD73F4970>,15qqqtd,gadgets,t5_2qgzt,,False,True,t3_15qqqtd,t1_jw4f98n,/r/gadgets/comments/15qqqtd/use_your_desktop_keyboard_overon_your_laptop/jw4fxru/
5,jw89cfr,brit953,"So does a BT keyboard with some spacers added to each end. And it's full size, easily replaced and probably cheaper.","So does a BT keyboard with some spacers added to each end. And it's full size, easily replaced and probably cheaper.",3,2023-08-15 02:03:17,<praw.models.comment_forest.CommentForest object at 0x0000021CD73F4BB0>,15qqqtd,gadgets,t5_2qgzt,,False,False,t3_15qqqtd,t1_jw557yt,/r/gadgets/comments/15qqqtd/use_your_desktop_keyboard_overon_your_laptop/jw89cfr/
6,jx06nsh,certainlyforgetful,Hey I was loud before it was cool with my 2012/13 MBP with the butterfly keys.,Hey I was loud before it was cool with my 2012/13 MBP with the butterfly keys.,1,2023-08-20 15:05:45,<praw.models.comment_forest.CommentForest object at 0x0000021CD73F4D30>,15qqqtd,gadgets,t5_2qgzt,,False,False,t3_15qqqtd,t1_jwpvesl,/r/gadgets/comments/15qqqtd/use_your_desktop_keyboard_overon_your_laptop/jx06nsh/
7,jw79tj8,TacTurtle,"Or you get a docking station to a full sized monitor pair, keyboard, and mouse like an adult.","Or you get a docking station to a full sized monitor pair, keyboard, and mouse like an adult.",3,2023-08-14 22:01:48,<praw.models.comment_forest.CommentForest object at 0x0000021CD73F4A30>,15qqqtd,gadgets,t5_2qgzt,,False,False,t3_15qqqtd,t1_jw4fxru,/r/gadgets/comments/15qqqtd/use_your_desktop_keyboard_overon_your_laptop/jw79tj8/
8,jw4s1t5,Barnezhilton,"You just put the USB keyboard on the laptop too. What's all this about being farther nonsense.

It's the exact same idea. You can set your laptop to disable the keys when an external device is plugged in (I always use an USB mouse with my laptop because I hate trackpads, and once i plug in the mouse it shuts off the trackpad)","You just put the USB keyboard on the laptop too. What's all this about being farther nonsense.

It's the exact same idea. You can set your laptop to disable the keys when an external device is plugged in (I always use an USB mouse with my laptop because I hate trackpads, and once i plug in the mouse it shuts off the trackpad)",1,2023-08-14 12:42:03,<praw.models.comment_forest.CommentForest object at 0x0000021CD73F4A90>,15qqqtd,gadgets,t5_2qgzt,,False,False,t3_15qqqtd,t1_jw4fxru,/r/gadgets/comments/15qqqtd/use_your_desktop_keyboard_overon_your_laptop/jw4s1t5/
9,jw4rbpq,ntdrk,this person gets it,this person gets it,-1,2023-08-14 12:36:08,<praw.models.comment_forest.CommentForest object at 0x0000021CD73F4AF0>,15qqqtd,gadgets,t5_2qgzt,,False,False,t3_15qqqtd,t1_jw4fxru,/r/gadgets/comments/15qqqtd/use_your_desktop_keyboard_overon_your_laptop/jw4rbpq/
10,jw4wa2b,Arzemna,Most keyboard will push on the laptop keys while you type if you do this. If you look at the article there are little stands this keyboard has to prevent this,Most keyboard will push on the laptop keys while you type if you do this. If you look at the article there are little stands this keyboard has to prevent this,1,2023-08-14 13:15:05,<praw.models.comment_forest.CommentForest object at 0x0000021CD73F4B50>,15qqqtd,gadgets,t5_2qgzt,,False,False,t3_15qqqtd,t1_jw4s1t5,/r/gadgets/comments/15qqqtd/use_your_desktop_keyboard_overon_your_laptop/jw4wa2b/
11,jw534z8,Barnezhilton,Not if you have the auto disable option setup when a keyboard device is plugged in,Not if you have the auto disable option setup when a keyboard device is plugged in,2,2023-08-14 14:04:25,<praw.models.comment_forest.CommentForest object at 0x0000021CD73F4C10>,15qqqtd,gadgets,t5_2qgzt,,False,False,t3_15qqqtd,t1_jw4wa2b,/r/gadgets/comments/15qqqtd/use_your_desktop_keyboard_overon_your_laptop/jw534z8/
12,fx7yeuu,CommunismIsForLosers,"It's like they're selling a new phone to replace it soon or something.

How is this journalism?","It's like they're selling a new phone to replace it soon or something.

How is this journalism?",8,2020-07-07 16:49:35,<praw.models.comment_forest.CommentForest object at 0x0000021CD7718130>,hmfbtc,gadgets,t5_2qgzt,,False,False,t3_hmfbtc,t3_hmfbtc,/r/gadgets/comments/hmfbtc/google_shows_its_not_a_hardware_company_with_dead/fx7yeuu/
13,fx4yhi2,,"> In the meantime, budget buyers will have to shift their focus to the lovely Apple iPhone SE.

Already one step ahead of you, pal.","> In the meantime, budget buyers will have to shift their focus to the lovely Apple iPhone SE.

Already one step ahead of you, pal.",12,2020-07-06 20:53:49,<praw.models.comment_forest.CommentForest object at 0x0000021CD7718190>,hmfbtc,gadgets,t5_2qgzt,,False,False,t3_hmfbtc,t3_hmfbtc,/r/gadgets/comments/hmfbtc/google_shows_its_not_a_hardware_company_with_dead/fx4yhi2/
14,fx641g8,WhisperScream92,"God what a stretch......  I just don't understand the constant need to make anything Google does in the hardware business a negative. They are already relatively small in the phone business and then 3a was a hit. Why can't the story be ""Googles *hit* P3a sells out before the 4a can even get here!"" But no. Apparently because of Covid and then delaying the 4a this has turned into Google hating the business they entered.","God what a stretch......  I just don't understand the constant need to make anything Google does in the hardware business a negative. They are already relatively small in the phone business and then 3a was a hit. Why can't the story be ""Googles *hit* P3a sells out before the 4a can even get here!"" But no. Apparently because of Covid and then delaying the 4a this has turned into Google hating the business they entered.",7,2020-07-07 03:19:08,<praw.models.comment_forest.CommentForest object at 0x0000021CD7718250>,hmfbtc,gadgets,t5_2qgzt,,False,False,t3_hmfbtc,t3_hmfbtc,/r/gadgets/comments/hmfbtc/google_shows_its_not_a_hardware_company_with_dead/fx641g8/
15,fx5tfnq,wmailniyonita_,Hello,Hello,1,2020-07-07 01:32:05,<praw.models.comment_forest.CommentForest object at 0x0000021CD7718370>,hmfbtc,gadgets,t5_2qgzt,,False,False,t3_hmfbtc,t3_hmfbtc,/r/gadgets/comments/hmfbtc/google_shows_its_not_a_hardware_company_with_dead/fx5tfnq/
16,fx56xv7,cypresstreesaretall,"Honestly everyone was talking abt pixel 4a like it was already out and now we don’t even know if the pixel line will survive

edit: pixel 4a not 4","Honestly everyone was talking abt pixel 4a like it was already out and now we don’t even know if the pixel line will survive

edit: pixel 4a not 4",1,2020-07-06 22:03:43,<praw.models.comment_forest.CommentForest object at 0x0000021CD77183D0>,hmfbtc,gadgets,t5_2qgzt,,1594142536.0,False,t3_hmfbtc,t3_hmfbtc,/r/gadgets/comments/hmfbtc/google_shows_its_not_a_hardware_company_with_dead/fx56xv7/
17,fx4sac1,AutoModerator,"We're giving away an Honor 9A this month! Check out the [entry thread](https://redd.it/hlo1no) for more info. 

&#x200B;


*I am a bot, and this action was performed automatically. Please [contact the moderators of this subreddit](/message/compose/?to=/r/gadgets) if you have any questions or concerns.*","We're giving away an Honor 9A this month! Check out the [entry thread](https://redd.it/hlo1no) for more info. 

&#x200B;


*I am a bot, and this action was performed automatically. Please [contact the moderators of this subreddit](/message/compose/?to=/r/gadgets) if you have any questions or concerns.*",1,2020-07-06 20:03:14,<praw.models.comment_forest.CommentForest object at 0x0000021CD7718430>,hmfbtc,gadgets,t5_2qgzt,moderator,False,False,t3_hmfbtc,t3_hmfbtc,/r/gadgets/comments/hmfbtc/google_shows_its_not_a_hardware_company_with_dead/fx4sac1/
18,fx9nn69,atb12688,"Apple supports devices for 5+ years and with Google you get what 2 years, maybe 3?","Apple supports devices for 5+ years and with Google you get what 2 years, maybe 3?",1,2020-07-08 01:26:14,<praw.models.comment_forest.CommentForest object at 0x0000021CD77181F0>,hmfbtc,gadgets,t5_2qgzt,,False,False,t3_hmfbtc,t1_fx7yeuu,/r/gadgets/comments/hmfbtc/google_shows_its_not_a_hardware_company_with_dead/fx9nn69/
19,fx9nxgm,atb12688,"At least you'll get many, many years of updates.","At least you'll get many, many years of updates.",3,2020-07-08 01:29:04,<praw.models.comment_forest.CommentForest object at 0x0000021CD7718310>,hmfbtc,gadgets,t5_2qgzt,,False,False,t3_hmfbtc,t1_fx4yhi2,/r/gadgets/comments/hmfbtc/google_shows_its_not_a_hardware_company_with_dead/fx9nxgm/
20,fx6y7bs,bartturner,"Pixel 4 has been out for over 8 months now.  The Pixel 4A has passed the FCC certification a couple of weeks ago.

https://en.wikipedia.org/wiki/Pixel_4

""Google Pixel 4a arrives at FCC in latest step toward launch""

https://9to5google.com/2020/06/25/pixel-4a-fcc/

Pixel line apparently is doing pretty well and grew sales 52% last year

""Market research firm International Data Corporation (IDC) has today revealed that Google shipped an impressive 7.2 million Pixel smartphones between January and December 2019. That number is up 52% year-on-year from the 4.7 million devices sold in 2018.""","Pixel 4 has been out for over 8 months now.  The Pixel 4A has passed the FCC certification a couple of weeks ago.

https://en.wikipedia.org/wiki/Pixel_4

""Google Pixel 4a arrives at FCC in latest step toward launch""

https://9to5google.com/2020/06/25/pixel-4a-fcc/

Pixel line apparently is doing pretty well and grew sales 52% last year

""Market research firm International Data Corporation (IDC) has today revealed that Google shipped an impressive 7.2 million Pixel smartphones between January and December 2019. That number is up 52% year-on-year from the 4.7 million devices sold in 2018.""",3,2020-07-07 10:35:02,<praw.models.comment_forest.CommentForest object at 0x0000021CD7718490>,hmfbtc,gadgets,t5_2qgzt,,1594118309.0,False,t3_hmfbtc,t1_fx56xv7,/r/gadgets/comments/hmfbtc/google_shows_its_not_a_hardware_company_with_dead/fx6y7bs/
21,fx9o4ms,CommunismIsForLosers,"That's an entirely different point though, right?

This article makes it sound like a common occurrence (discontinuing one hardware line shortly before the launch of its successor) is some kind of sign that Google is throwing in the towel.  I dissected and dismissed this ""article"" in 30 seconds.","That's an entirely different point though, right?

This article makes it sound like a common occurrence (discontinuing one hardware line shortly before the launch of its successor) is some kind of sign that Google is throwing in the towel.  I dissected and dismissed this ""article"" in 30 seconds.",1,2020-07-08 01:31:03,<praw.models.comment_forest.CommentForest object at 0x0000021CD77182B0>,hmfbtc,gadgets,t5_2qgzt,,False,False,t3_hmfbtc,t1_fx9nn69,/r/gadgets/comments/hmfbtc/google_shows_its_not_a_hardware_company_with_dead/fx9o4ms/
22,g4ckphm,SoiledPlumbus,is reddit not even tagging these as advertisements now? cmon,is reddit not even tagging these as advertisements now? cmon,838,2020-09-07 16:42:36,<praw.models.comment_forest.CommentForest object at 0x0000021CD7415790>,io8cpr,gadgets,t5_2qgzt,,False,False,t3_io8cpr,t3_io8cpr,/r/gadgets/comments/io8cpr/akg_k371bt_headphones_review_quality_portable/g4ckphm/
23,g4cm262,glambx,"I was seriously interested till I discovered no Apt-X (/hd) or LDAC. :(

What a strange choice for a company like AKG.","I was seriously interested till I discovered no Apt-X (/hd) or LDAC. :(

What a strange choice for a company like AKG.",93,2020-09-07 16:53:14,<praw.models.comment_forest.CommentForest object at 0x0000021CD74157F0>,io8cpr,gadgets,t5_2qgzt,,False,False,t3_io8cpr,t3_io8cpr,/r/gadgets/comments/io8cpr/akg_k371bt_headphones_review_quality_portable/g4cm262/
24,g4d8m5g,trustmebuddy,As reviewed by digitaltrends. OP you absolute Muppet. Why are you like this?,As reviewed by digitaltrends. OP you absolute Muppet. Why are you like this?,26,2020-09-07 19:31:29,<praw.models.comment_forest.CommentForest object at 0x0000021CD74181F0>,io8cpr,gadgets,t5_2qgzt,,False,False,t3_io8cpr,t3_io8cpr,/r/gadgets/comments/io8cpr/akg_k371bt_headphones_review_quality_portable/g4d8m5g/
25,g4cqjrt,SEND_ME_UR_SONGS,It feels like this post is wayyyy out of the vote threshold for the normal r/gadgets post that will appear in my feed.,It feels like this post is wayyyy out of the vote threshold for the normal r/gadgets post that will appear in my feed.,39,2020-09-07 17:24:05,<praw.models.comment_forest.CommentForest object at 0x0000021CD74182B0>,io8cpr,gadgets,t5_2qgzt,,False,False,t3_io8cpr,t3_io8cpr,/r/gadgets/comments/io8cpr/akg_k371bt_headphones_review_quality_portable/g4cqjrt/
26,g4cov68,phatelectribe,"This is a such a nonsense review; you can tell by the terms used here it’s not a pro audio review but a consumer review poorly trying to masquerade as one (you’ll never find a studio engineer use terms like treble or icy etc). Furthermore they claim they are studio monitors. That’s a misnomer in itself but worst of all they are talking about non LDAC, standard Bluetooth protocols which are never “studio grade” in terms of quality due to the compression / distortion introduced by the BT codecs. Sound gets better when you plug the cable in? No shit!","This is a such a nonsense review; you can tell by the terms used here it’s not a pro audio review but a consumer review poorly trying to masquerade as one (you’ll never find a studio engineer use terms like treble or icy etc). Furthermore they claim they are studio monitors. That’s a misnomer in itself but worst of all they are talking about non LDAC, standard Bluetooth protocols which are never “studio grade” in terms of quality due to the compression / distortion introduced by the BT codecs. Sound gets better when you plug the cable in? No shit!",260,2020-09-07 17:13:02,<praw.models.comment_forest.CommentForest object at 0x0000021CD7418670>,io8cpr,gadgets,t5_2qgzt,,1599500134.0,False,t3_io8cpr,t3_io8cpr,/r/gadgets/comments/io8cpr/akg_k371bt_headphones_review_quality_portable/g4cov68/
27,g4e4a9a,,[deleted],[deleted],13,2020-09-07 23:57:07,<praw.models.comment_forest.CommentForest object at 0x0000021CD74186D0>,io8cpr,gadgets,t5_2qgzt,,False,False,t3_io8cpr,t3_io8cpr,/r/gadgets/comments/io8cpr/akg_k371bt_headphones_review_quality_portable/g4e4a9a/
28,g4dmac1,TomTom_ZH,"Bruh. „Weak Bass“

What about neutral? It‘s literally spot on the Harman Curve, flat af and reproducing tracks as they‘re supposed to be. 

Bad sign in author doesn‘t know what good bass is.","Bruh. „Weak Bass“

What about neutral? It‘s literally spot on the Harman Curve, flat af and reproducing tracks as they‘re supposed to be. 

Bad sign in author doesn‘t know what good bass is.",18,2020-09-07 21:06:40,<praw.models.comment_forest.CommentForest object at 0x0000021CD741ACD0>,io8cpr,gadgets,t5_2qgzt,,False,False,t3_io8cpr,t3_io8cpr,/r/gadgets/comments/io8cpr/akg_k371bt_headphones_review_quality_portable/g4dmac1/
29,g4duq3o,MarcusXL,"PASS.  
From the ad: *""Those headphones, however, are not only very expensive but also not tailored to everyday use.""*","PASS.  
From the ad: *""Those headphones, however, are not only very expensive but also not tailored to everyday use.""*",6,2020-09-07 22:21:48,<praw.models.comment_forest.CommentForest object at 0x0000021CD741C1F0>,io8cpr,gadgets,t5_2qgzt,,False,False,t3_io8cpr,t3_io8cpr,/r/gadgets/comments/io8cpr/akg_k371bt_headphones_review_quality_portable/g4duq3o/
30,g4ds3xc,ArtistNRG,Reddit gotta get paid some how to up keep the site and keep there lights on,Reddit gotta get paid some how to up keep the site and keep there lights on,5,2020-09-07 21:56:00,<praw.models.comment_forest.CommentForest object at 0x0000021CD741C3D0>,io8cpr,gadgets,t5_2qgzt,,False,False,t3_io8cpr,t3_io8cpr,/r/gadgets/comments/io8cpr/akg_k371bt_headphones_review_quality_portable/g4ds3xc/
31,g4e0ine,,What the fuck are shit quality headphones doing on the front page?,What the fuck are shit quality headphones doing on the front page?,5,2020-09-07 23:19:26,<praw.models.comment_forest.CommentForest object at 0x0000021CD741C490>,io8cpr,gadgets,t5_2qgzt,,False,False,t3_io8cpr,t3_io8cpr,/r/gadgets/comments/io8cpr/akg_k371bt_headphones_review_quality_portable/g4e0ine/
32,g4e7ht3,Tackedonforsure,"Not gonna lie, the wired K371's have shit build quality but AMAZING sound. Flat response (according to the Harman curve), perfect for working in music/sound design, and fantastic listening quality. Not perfect for just listening to music compared to a pair of Sennheiser HD 660s but they get pretty close for $150 compared to $400.","Not gonna lie, the wired K371's have shit build quality but AMAZING sound. Flat response (according to the Harman curve), perfect for working in music/sound design, and fantastic listening quality. Not perfect for just listening to music compared to a pair of Sennheiser HD 660s but they get pretty close for $150 compared to $400.",2,2020-09-08 00:24:19,<praw.models.comment_forest.CommentForest object at 0x0000021CD741C4F0>,io8cpr,gadgets,t5_2qgzt,,False,False,t3_io8cpr,t3_io8cpr,/r/gadgets/comments/io8cpr/akg_k371bt_headphones_review_quality_portable/g4e7ht3/
33,g4cjglz,IGmeanwell,This is something I was hoping Sony would release with their Pro headphones. The uneven pressure is a no go for me... It’s the reason why I don’t use noise canceling headphones unless it’s passive.,This is something I was hoping Sony would release with their Pro headphones. The uneven pressure is a no go for me... It’s the reason why I don’t use noise canceling headphones unless it’s passive.,3,2020-09-07 16:32:58,<praw.models.comment_forest.CommentForest object at 0x0000021CD741C5B0>,io8cpr,gadgets,t5_2qgzt,,False,False,t3_io8cpr,t3_io8cpr,/r/gadgets/comments/io8cpr/akg_k371bt_headphones_review_quality_portable/g4cjglz/
34,g4coosb,Inspector_Bloor,I really want a new pair of headphones for mixing/recording but there are so many options and everyone has a different ear preferences.,I really want a new pair of headphones for mixing/recording but there are so many options and everyone has a different ear preferences.,2,2020-09-07 17:11:46,<praw.models.comment_forest.CommentForest object at 0x0000021CD741C610>,io8cpr,gadgets,t5_2qgzt,,False,False,t3_io8cpr,t3_io8cpr,/r/gadgets/comments/io8cpr/akg_k371bt_headphones_review_quality_portable/g4coosb/
35,g4d17cn,Khal_Doggo,Only recently subbed to r/gadgets. Can someone quickly explain why we call them 'monitors' and not just headphones?,Only recently subbed to r/gadgets. Can someone quickly explain why we call them 'monitors' and not just headphones?,2,2020-09-07 18:38:13,<praw.models.comment_forest.CommentForest object at 0x0000021CD741C6D0>,io8cpr,gadgets,t5_2qgzt,,False,False,t3_io8cpr,t3_io8cpr,/r/gadgets/comments/io8cpr/akg_k371bt_headphones_review_quality_portable/g4d17cn/
36,g4d6ifv,ser_renely,Aren't akg crap now?,Aren't akg crap now?,2,2020-09-07 19:16:25,<praw.models.comment_forest.CommentForest object at 0x0000021CD741C9D0>,io8cpr,gadgets,t5_2qgzt,,False,False,t3_io8cpr,t3_io8cpr,/r/gadgets/comments/io8cpr/akg_k371bt_headphones_review_quality_portable/g4d6ifv/
37,g4dv2tj,Slashbond007,How are they compared to wh-1000xm3?,How are they compared to wh-1000xm3?,1,2020-09-07 22:25:21,<praw.models.comment_forest.CommentForest object at 0x0000021CD741CC10>,io8cpr,gadgets,t5_2qgzt,,False,False,t3_io8cpr,t3_io8cpr,/r/gadgets/comments/io8cpr/akg_k371bt_headphones_review_quality_portable/g4dv2tj/
38,g4ebykz,tgodxy,I thought for a second AKG K371-BT was the name of elongated muskrat’s newest child,I thought for a second AKG K371-BT was the name of elongated muskrat’s newest child,1,2020-09-08 01:09:20,<praw.models.comment_forest.CommentForest object at 0x0000021CD741CD30>,io8cpr,gadgets,t5_2qgzt,,False,False,t3_io8cpr,t3_io8cpr,/r/gadgets/comments/io8cpr/akg_k371bt_headphones_review_quality_portable/g4ebykz/
39,g4ed69g,MalaysianOfficial_1,Samsung removing headphones jacks on phones so they can sell you more Bluetooth headphones,Samsung removing headphones jacks on phones so they can sell you more Bluetooth headphones,1,2020-09-08 01:21:35,<praw.models.comment_forest.CommentForest object at 0x0000021CD741CD90>,io8cpr,gadgets,t5_2qgzt,,False,False,t3_io8cpr,t3_io8cpr,/r/gadgets/comments/io8cpr/akg_k371bt_headphones_review_quality_portable/g4ed69g/
40,g4es468,vagrantist,AKG = Samsung,AKG = Samsung,1,2020-09-08 03:58:29,<praw.models.comment_forest.CommentForest object at 0x0000021CD741CDF0>,io8cpr,gadgets,t5_2qgzt,,False,False,t3_io8cpr,t3_io8cpr,/r/gadgets/comments/io8cpr/akg_k371bt_headphones_review_quality_portable/g4es468/
41,g4es6yp,Lpsgia,That man in that photo hates life probably,That man in that photo hates life probably,1,2020-09-08 03:59:24,<praw.models.comment_forest.CommentForest object at 0x0000021CD741CE50>,io8cpr,gadgets,t5_2qgzt,,False,False,t3_io8cpr,t3_io8cpr,/r/gadgets/comments/io8cpr/akg_k371bt_headphones_review_quality_portable/g4es6yp/
42,g4euhvs,,"“Weak bass”

Lol. Quality?","“Weak bass”

Lol. Quality?",1,2020-09-08 04:27:56,<praw.models.comment_forest.CommentForest object at 0x0000021CD741CEB0>,io8cpr,gadgets,t5_2qgzt,,False,False,t3_io8cpr,t3_io8cpr,/r/gadgets/comments/io8cpr/akg_k371bt_headphones_review_quality_portable/g4euhvs/
43,g4eurcl,MinnesotaMikeP,"Is it possible to block a subreddit?
These ads annoy me.","Is it possible to block a subreddit?
These ads annoy me.",1,2020-09-08 04:31:18,<praw.models.comment_forest.CommentForest object at 0x0000021CD741CF10>,io8cpr,gadgets,t5_2qgzt,,False,False,t3_io8cpr,t3_io8cpr,/r/gadgets/comments/io8cpr/akg_k371bt_headphones_review_quality_portable/g4eurcl/
44,g4exnfs,lies_about_flossing,This is news how?,This is news how?,1,2020-09-08 05:10:00,<praw.models.comment_forest.CommentForest object at 0x0000021CD741CFD0>,io8cpr,gadgets,t5_2qgzt,,False,False,t3_io8cpr,t3_io8cpr,/r/gadgets/comments/io8cpr/akg_k371bt_headphones_review_quality_portable/g4exnfs/
45,g4ey77v,bloodbarn,So basically this is an ad ?,So basically this is an ad ?,1,2020-09-08 05:17:40,<praw.models.comment_forest.CommentForest object at 0x0000021CD741F070>,io8cpr,gadgets,t5_2qgzt,,False,False,t3_io8cpr,t3_io8cpr,/r/gadgets/comments/io8cpr/akg_k371bt_headphones_review_quality_portable/g4ey77v/
46,g4eyi7t,,Do a side by side review with someone who has a tiny head.,Do a side by side review with someone who has a tiny head.,1,2020-09-08 05:21:58,<praw.models.comment_forest.CommentForest object at 0x0000021CD741F0D0>,io8cpr,gadgets,t5_2qgzt,,False,False,t3_io8cpr,t3_io8cpr,/r/gadgets/comments/io8cpr/akg_k371bt_headphones_review_quality_portable/g4eyi7t/
