,ID,Author,body,Comment,Score,Created On,Replies,Submission,Subreddit,Subreddit_ID,Distinguished,Edited,Is_submitter,link_id,Parent_id,Permalink
181,g4gm25e,the-incredible-ape,I don't think I would necessarily agree with that. Latency on conference calls where those things happen can be WAY more than 0.1s.  You don't even easily notice problems with lip sync in video with that much delay.,I don't think I would necessarily agree with that. Latency on conference calls where those things happen can be WAY more than 0.1s.  You don't even easily notice problems with lip sync in video with that much delay.,1,2020-09-08 17:42:41,<praw.models.comment_forest.CommentForest object at 0x0000021CD741C310>,io8cpr,gadgets,t5_2qgzt,,False,False,t3_io8cpr,t1_g4gklfy,/r/gadgets/comments/io8cpr/akg_k371bt_headphones_review_quality_portable/g4gm25e/
182,g4g7be1,,[deleted],[deleted],1,2020-09-08 15:37:40,<praw.models.comment_forest.CommentForest object at 0x0000021CD7415760>,io8cpr,gadgets,t5_2qgzt,,False,False,t3_io8cpr,t1_g4duuch,/r/gadgets/comments/io8cpr/akg_k371bt_headphones_review_quality_portable/g4g7be1/
183,g4g8ciu,poopwithjelly,"Dingus is usually a cheap boss, but your point stands.","Dingus is usually a cheap boss, but your point stands.",1,2020-09-08 15:46:33,<praw.models.comment_forest.CommentForest object at 0x0000021CD740CE80>,io8cpr,gadgets,t5_2qgzt,,False,False,t3_io8cpr,t1_g4g76xm,/r/gadgets/comments/io8cpr/akg_k371bt_headphones_review_quality_portable/g4g8ciu/
184,g4dpp2q,antiquegeek,"People who are directly in the music business who directly work with audio engineers regularly are ignorant? I'm sorry what is your job? The only thing you've been able to say is that you ""know some audio engineers who say treble"". And it's been explained to you multiple times that they wouldn't and why they wouldn't. Keep talking out of your ass though it is really funny.","People who are directly in the music business who directly work with audio engineers regularly are ignorant? I'm sorry what is your job? The only thing you've been able to say is that you ""know some audio engineers who say treble"". And it's been explained to you multiple times that they wouldn't and why they wouldn't. Keep talking out of your ass though it is really funny.",4,2020-09-07 21:32:50,<praw.models.comment_forest.CommentForest object at 0x0000021CD7718A30>,io8cpr,gadgets,t5_2qgzt,,False,False,t3_io8cpr,t1_g4dpf9z,/r/gadgets/comments/io8cpr/akg_k371bt_headphones_review_quality_portable/g4dpp2q/
185,g4egv1o,tekzenmusic,"There are courses and “degrees” galore throughout the world and they’re happy to take your money. It’s an art not a science though and if there’s no prerequisite of artistic ability on enrollment (which there isn’t, refer to point A $) then getting a degree just means you passed the course which anyone can. Like I could pass a fine art course but it wouldn’t make me a great artist. The only difference between this example is that a fine art course from a pedigree university wouldn’t take me just because I wanted to do it. I would need to demonstrate ability.","There are courses and “degrees” galore throughout the world and they’re happy to take your money. It’s an art not a science though and if there’s no prerequisite of artistic ability on enrollment (which there isn’t, refer to point A $) then getting a degree just means you passed the course which anyone can. Like I could pass a fine art course but it wouldn’t make me a great artist. The only difference between this example is that a fine art course from a pedigree university wouldn’t take me just because I wanted to do it. I would need to demonstrate ability.",-1,2020-09-08 01:58:22,<praw.models.comment_forest.CommentForest object at 0x0000021CD7405F70>,io8cpr,gadgets,t5_2qgzt,,False,False,t3_io8cpr,t1_g4edrzi,/r/gadgets/comments/io8cpr/akg_k371bt_headphones_review_quality_portable/g4egv1o/
186,g4e4qht,tekzenmusic,"Well I'm the former, and you can google me if you'd like, this isn't an anonymous account. 

But anyways, it was just to establish credibility because an audio engineering degree is literally useless. It was not to brag, if I wanted to do that I could've said a lot more hah!

No but seriously, it's not a big deal, I've done well in my career but so have a million other people, trust me, it's not that exciting","Well I'm the former, and you can google me if you'd like, this isn't an anonymous account. 

But anyways, it was just to establish credibility because an audio engineering degree is literally useless. It was not to brag, if I wanted to do that I could've said a lot more hah!

No but seriously, it's not a big deal, I've done well in my career but so have a million other people, trust me, it's not that exciting",0,2020-09-08 00:01:22,<praw.models.comment_forest.CommentForest object at 0x0000021CD740F100>,io8cpr,gadgets,t5_2qgzt,,1599524058.0,False,t3_io8cpr,t1_g4e2dyt,/r/gadgets/comments/io8cpr/akg_k371bt_headphones_review_quality_portable/g4e4qht/
187,g4eanw5,zxzxzxzxxcxxxxxxxcxx,"Whether he is what he says he is or just a 14 year old, he’s still correct","Whether he is what he says he is or just a 14 year old, he’s still correct",-1,2020-09-08 00:56:10,<praw.models.comment_forest.CommentForest object at 0x0000021CD741FFD0>,io8cpr,gadgets,t5_2qgzt,,False,False,t3_io8cpr,t1_g4e2dyt,/r/gadgets/comments/io8cpr/akg_k371bt_headphones_review_quality_portable/g4eanw5/
188,g4gmefc,100catactivs,"Well, agree to disagree then.","Well, agree to disagree then.",1,2020-09-08 17:45:33,<praw.models.comment_forest.CommentForest object at 0x0000021CD5A69550>,io8cpr,gadgets,t5_2qgzt,,False,False,t3_io8cpr,t1_g4gm25e,/r/gadgets/comments/io8cpr/akg_k371bt_headphones_review_quality_portable/g4gmefc/
189,g4g85de,phatelectribe,Or you could just use the right tape and not have to.,Or you could just use the right tape and not have to.,1,2020-09-08 15:44:50,<praw.models.comment_forest.CommentForest object at 0x0000021CD741F4C0>,io8cpr,gadgets,t5_2qgzt,,False,False,t3_io8cpr,t1_g4g7be1,/r/gadgets/comments/io8cpr/akg_k371bt_headphones_review_quality_portable/g4g85de/
190,g4eic2w,,"Then you really need to work on having  a life, since you can buy basically whatever you want. Buy a 40 footer and a slip on Catalina. The rest of us are here because we largely have none of the things you do, but enjoy the human interaction. If you are what you say you are, you're just a loser.","Then you really need to work on having  a life, since you can buy basically whatever you want. Buy a 40 footer and a slip on Catalina. The rest of us are here because we largely have none of the things you do, but enjoy the human interaction. If you are what you say you are, you're just a loser.",1,2020-09-08 02:13:23,<praw.models.comment_forest.CommentForest object at 0x0000021CD741F4F0>,io8cpr,gadgets,t5_2qgzt,,False,False,t3_io8cpr,t1_g4e4qht,/r/gadgets/comments/io8cpr/akg_k371bt_headphones_review_quality_portable/g4eic2w/
191,g4kvoew,tekzenmusic,"Well according to the court of reddit, the guy who ""knows some engineers"" is correct over an actual engineer who's been doing it professionally for 25 yrs. lol","Well according to the court of reddit, the guy who ""knows some engineers"" is correct over an actual engineer who's been doing it professionally for 25 yrs. lol",1,2020-09-09 20:00:22,<praw.models.comment_forest.CommentForest object at 0x0000021CD741F880>,io8cpr,gadgets,t5_2qgzt,,False,False,t3_io8cpr,t1_g4eanw5,/r/gadgets/comments/io8cpr/akg_k371bt_headphones_review_quality_portable/g4kvoew/
192,g4eig52,tekzenmusic,lol what are you actually talking about dude? Legit don't understand your negativity,lol what are you actually talking about dude? Legit don't understand your negativity,0,2020-09-08 02:14:32,<praw.models.comment_forest.CommentForest object at 0x0000021CD741FAC0>,io8cpr,gadgets,t5_2qgzt,,False,False,t3_io8cpr,t1_g4eic2w,/r/gadgets/comments/io8cpr/akg_k371bt_headphones_review_quality_portable/g4eig52/
193,g4en5ts,,"The fact you have no idea what I'm talking about says much more about you than it does me.
You're also a liar.","The fact you have no idea what I'm talking about says much more about you than it does me.
You're also a liar.",1,2020-09-08 03:02:56,<praw.models.comment_forest.CommentForest object at 0x0000021CD741FEB0>,io8cpr,gadgets,t5_2qgzt,,False,False,t3_io8cpr,t1_g4eig52,/r/gadgets/comments/io8cpr/akg_k371bt_headphones_review_quality_portable/g4en5ts/
194,g4en7d1,tekzenmusic,Huh? What assumptions are you making about me?,Huh? What assumptions are you making about me?,1,2020-09-08 03:03:24,<praw.models.comment_forest.CommentForest object at 0x0000021CD741FC70>,io8cpr,gadgets,t5_2qgzt,,False,False,t3_io8cpr,t1_g4en5ts,/r/gadgets/comments/io8cpr/akg_k371bt_headphones_review_quality_portable/g4en7d1/
195,jscd1w2,AutoModerator,"
We have a giveaway running, be sure to enter in the post linked below!

[Revopoint POP 3 3D Scanner](https://www.reddit.com/r/gadgets/comments/14y2hpt/giveaway_revopoint_pop_3_3d_scanner_giveaway/)


*I am a bot, and this action was performed automatically. Please [contact the moderators of this subreddit](/message/compose/?to=/r/gadgets) if you have any questions or concerns.*","
We have a giveaway running, be sure to enter in the post linked below!

[Revopoint POP 3 3D Scanner](https://www.reddit.com/r/gadgets/comments/14y2hpt/giveaway_revopoint_pop_3_3d_scanner_giveaway/)


*I am a bot, and this action was performed automatically. Please [contact the moderators of this subreddit](/message/compose/?to=/r/gadgets) if you have any questions or concerns.*",1,2023-07-17 17:18:39,<praw.models.comment_forest.CommentForest object at 0x0000021CD7429C40>,15280i6,gadgets,t5_2qgzt,moderator,False,False,t3_15280i6,t3_15280i6,/r/gadgets/comments/15280i6/theres_no_wrong_way_to_load_this_new_evolution_of/jscd1w2/
196,jsceqr9,OneHumanPeOple,I’m not going to read an article-length dishwasher advertisement.,I’m not going to read an article-length dishwasher advertisement.,50,2023-07-17 17:29:14,<praw.models.comment_forest.CommentForest object at 0x0000021CD7429CA0>,15280i6,gadgets,t5_2qgzt,,False,False,t3_15280i6,t3_15280i6,/r/gadgets/comments/15280i6/theres_no_wrong_way_to_load_this_new_evolution_of/jsceqr9/
197,jscenjy,ThirstyOne,"There is always an infinite amount of wrong ways to load a dishwasher, and goddamn it my girlfriend will find them all come hell or high water.","There is always an infinite amount of wrong ways to load a dishwasher, and goddamn it my girlfriend will find them all come hell or high water.",26,2023-07-17 17:28:40,<praw.models.comment_forest.CommentForest object at 0x0000021CD7429D00>,15280i6,gadgets,t5_2qgzt,,False,False,t3_15280i6,t3_15280i6,/r/gadgets/comments/15280i6/theres_no_wrong_way_to_load_this_new_evolution_of/jscenjy/
198,jscna67,Unlikely_Layer_2268,Dishwashers have only evolved to shorter life spans and repair bills that nearly reach a new model’s cost,Dishwashers have only evolved to shorter life spans and repair bills that nearly reach a new model’s cost,3,2023-07-17 18:23:18,<praw.models.comment_forest.CommentForest object at 0x0000021CD7429DC0>,15280i6,gadgets,t5_2qgzt,,False,False,t3_15280i6,t3_15280i6,/r/gadgets/comments/15280i6/theres_no_wrong_way_to_load_this_new_evolution_of/jscna67/
199,jscp84d,Bgrngod,">as long as that place is on the bottom rack

So there is in fact a pretty major way to load it wrong?",">as long as that place is on the bottom rack

So there is in fact a pretty major way to load it wrong?",3,2023-07-17 18:35:37,<praw.models.comment_forest.CommentForest object at 0x0000021CD7429E80>,15280i6,gadgets,t5_2qgzt,,False,False,t3_15280i6,t3_15280i6,/r/gadgets/comments/15280i6/theres_no_wrong_way_to_load_this_new_evolution_of/jscp84d/
200,jsce84e,_Face,"It’s about getting it all in there, and still having it get clean. So yes there will always be an optimal way to load a dishwasher.","It’s about getting it all in there, and still having it get clean. So yes there will always be an optimal way to load a dishwasher.",5,2023-07-17 17:25:59,<praw.models.comment_forest.CommentForest object at 0x0000021CD7429F40>,15280i6,gadgets,t5_2qgzt,,False,False,t3_15280i6,t3_15280i6,/r/gadgets/comments/15280i6/theres_no_wrong_way_to_load_this_new_evolution_of/jsce84e/
201,jscfyt9,cecilkorik,"It's The Verge, they probably think there's no wrong way to apply thermal paste to a PC either. But if there is, don't worry, they'll find it, and record it, and put it on the Internet.","It's The Verge, they probably think there's no wrong way to apply thermal paste to a PC either. But if there is, don't worry, they'll find it, and record it, and put it on the Internet.",3,2023-07-17 17:37:04,<praw.models.comment_forest.CommentForest object at 0x0000021CD7429FA0>,15280i6,gadgets,t5_2qgzt,,False,False,t3_15280i6,t3_15280i6,/r/gadgets/comments/15280i6/theres_no_wrong_way_to_load_this_new_evolution_of/jscfyt9/
202,jscqmuk,HumpieDouglas,Obviously the person who wrote that article has never been married and never been told they load the dishwasher wrong while their spouse unloads it and reloads.,Obviously the person who wrote that article has never been married and never been told they load the dishwasher wrong while their spouse unloads it and reloads.,2,2023-07-17 18:44:40,<praw.models.comment_forest.CommentForest object at 0x0000021CD7428040>,15280i6,gadgets,t5_2qgzt,,False,False,t3_15280i6,t3_15280i6,/r/gadgets/comments/15280i6/theres_no_wrong_way_to_load_this_new_evolution_of/jscqmuk/
203,jscf2n2,squeakybeak,"Yes there is, and my wife will find it.","Yes there is, and my wife will find it.",1,2023-07-17 17:31:20,<praw.models.comment_forest.CommentForest object at 0x0000021CD74280A0>,15280i6,gadgets,t5_2qgzt,,False,False,t3_15280i6,t3_15280i6,/r/gadgets/comments/15280i6/theres_no_wrong_way_to_load_this_new_evolution_of/jscf2n2/
204,jscneqp,asaripot,"Ask anyone in my house, the dishwasher is also a garbage disposal.","Ask anyone in my house, the dishwasher is also a garbage disposal.",1,2023-07-17 18:24:06,<praw.models.comment_forest.CommentForest object at 0x0000021CD7428100>,15280i6,gadgets,t5_2qgzt,,False,False,t3_15280i6,t3_15280i6,/r/gadgets/comments/15280i6/theres_no_wrong_way_to_load_this_new_evolution_of/jscneqp/
205,jse0krf,SpezEatsScat,"my ex loved all the things I did for her around her place when I was over. However, she always complained on how I loaded the dishwasher. 

ALWAYS! Lol","my ex loved all the things I did for her around her place when I was over. However, she always complained on how I loaded the dishwasher. 

ALWAYS! Lol",0,2023-07-17 23:53:46,<praw.models.comment_forest.CommentForest object at 0x0000021CD7428160>,15280i6,gadgets,t5_2qgzt,,False,False,t3_15280i6,t3_15280i6,/r/gadgets/comments/15280i6/theres_no_wrong_way_to_load_this_new_evolution_of/jse0krf/
206,jsclj78,TheKramer89,You’re out of your damned mind.,You’re out of your damned mind.,1,2023-07-17 18:12:06,<praw.models.comment_forest.CommentForest object at 0x0000021CD7428280>,15280i6,gadgets,t5_2qgzt,,False,False,t3_15280i6,t3_15280i6,/r/gadgets/comments/15280i6/theres_no_wrong_way_to_load_this_new_evolution_of/jsclj78/
207,jscwk3b,ForgottenForce,So I can load the dishwasher but chucking the dishes as hard as I can,So I can load the dishwasher but chucking the dishes as hard as I can,1,2023-07-17 19:22:23,<praw.models.comment_forest.CommentForest object at 0x0000021CD74282E0>,15280i6,gadgets,t5_2qgzt,,False,False,t3_15280i6,t3_15280i6,/r/gadgets/comments/15280i6/theres_no_wrong_way_to_load_this_new_evolution_of/jscwk3b/
208,jsdoop7,jjj49er,I bet it wouldn't clean them if you just stacked them in there like you do in the cupboard.,I bet it wouldn't clean them if you just stacked them in there like you do in the cupboard.,1,2023-07-17 22:26:37,<praw.models.comment_forest.CommentForest object at 0x0000021CD7428340>,15280i6,gadgets,t5_2qgzt,,False,False,t3_15280i6,t3_15280i6,/r/gadgets/comments/15280i6/theres_no_wrong_way_to_load_this_new_evolution_of/jsdoop7/
209,jsexh80,drakenoftamarac,Wouldn’t the asymmetric arms cause extra motor wear?,Wouldn’t the asymmetric arms cause extra motor wear?,1,2023-07-18 04:24:44,<praw.models.comment_forest.CommentForest object at 0x0000021CD74283A0>,15280i6,gadgets,t5_2qgzt,,False,False,t3_15280i6,t3_15280i6,/r/gadgets/comments/15280i6/theres_no_wrong_way_to_load_this_new_evolution_of/jsexh80/
210,jsgsn8s,noronto,"After 8 years of trying to explain to my partner the proper way to load a dishwasher, I had to replace it and now the new lessons are commencing.","After 8 years of trying to explain to my partner the proper way to load a dishwasher, I had to replace it and now the new lessons are commencing.",1,2023-07-18 15:45:17,<praw.models.comment_forest.CommentForest object at 0x0000021CD7428400>,15280i6,gadgets,t5_2qgzt,,False,False,t3_15280i6,t3_15280i6,/r/gadgets/comments/15280i6/theres_no_wrong_way_to_load_this_new_evolution_of/jsgsn8s/
211,jscha7t,garry4321,I use to get mad at people just advertising for free as if it was real content. Now im just glad Reddit isnt getting their ad revenue.,I use to get mad at people just advertising for free as if it was real content. Now im just glad Reddit isnt getting their ad revenue.,7,2023-07-17 17:45:22,<praw.models.comment_forest.CommentForest object at 0x0000021CD7429D60>,15280i6,gadgets,t5_2qgzt,,False,False,t3_15280i6,t1_jsceqr9,/r/gadgets/comments/15280i6/theres_no_wrong_way_to_load_this_new_evolution_of/jscha7t/
212,jsfaz4m,likewhatever33,"I´ve seen a regular pattern of female bad dishwasher loaders, I´m starting to think dishwasher loading is one of the mental activities in which sexual dimorfism shows more clearly. I mean, there are sexual differences in chess playing for example but not as striking a difference as in dishwasher loading...","I´ve seen a regular pattern of female bad dishwasher loaders, I´m starting to think dishwasher loading is one of the mental activities in which sexual dimorfism shows more clearly. I mean, there are sexual differences in chess playing for example but not as striking a difference as in dishwasher loading...",2,2023-07-18 06:59:58,<praw.models.comment_forest.CommentForest object at 0x0000021CD7429E20>,15280i6,gadgets,t5_2qgzt,,False,False,t3_15280i6,t1_jscenjy,/r/gadgets/comments/15280i6/theres_no_wrong_way_to_load_this_new_evolution_of/jsfaz4m/
213,jse3ziw,,"Unless you have a Bosch, there's a good chance it actually is. Many dishwashers have small plastic blades on the impeller to chop up bits of food as they're pulled into the pump. Bosch just uses a filter.","Unless you have a Bosch, there's a good chance it actually is. Many dishwashers have small plastic blades on the impeller to chop up bits of food as they're pulled into the pump. Bosch just uses a filter.",2,2023-07-18 00:19:39,<praw.models.comment_forest.CommentForest object at 0x0000021CD74281C0>,15280i6,gadgets,t5_2qgzt,,False,False,t3_15280i6,t1_jscneqp,/r/gadgets/comments/15280i6/theres_no_wrong_way_to_load_this_new_evolution_of/jse3ziw/
214,jse2kih,drtitus,That's a very well trained dog.,That's a very well trained dog.,1,2023-07-18 00:08:44,<praw.models.comment_forest.CommentForest object at 0x0000021CD7428220>,15280i6,gadgets,t5_2qgzt,,False,False,t3_15280i6,t1_jscneqp,/r/gadgets/comments/15280i6/theres_no_wrong_way_to_load_this_new_evolution_of/jse2kih/
215,jsgq6ty,gregusmeus,My wife loads the dishwasher as if she's hurling the stuff in from the other side of the room.,My wife loads the dishwasher as if she's hurling the stuff in from the other side of the room.,1,2023-07-18 15:29:07,<praw.models.comment_forest.CommentForest object at 0x0000021CD7429EE0>,15280i6,gadgets,t5_2qgzt,,False,False,t3_15280i6,t1_jsfaz4m,/r/gadgets/comments/15280i6/theres_no_wrong_way_to_load_this_new_evolution_of/jsgq6ty/
216,ictgu0w,Kidneydog,"I'm sorry, but watch bands are the last part of this gadget I care about. The entire article is just about all the different band options. Guess what, when it comes out there will be unlimited third party options.  I thought I was going to read about cool features not different fashion styles.","I'm sorry, but watch bands are the last part of this gadget I care about. The entire article is just about all the different band options. Guess what, when it comes out there will be unlimited third party options.  I thought I was going to read about cool features not different fashion styles.",495,2022-06-18 10:24:53,<praw.models.comment_forest.CommentForest object at 0x0000021CD74A4790>,vezgll,gadgets,t5_2qgzt,,False,False,t3_vezgll,t3_vezgll,/r/gadgets/comments/vezgll/the_pixel_watch_could_be_googles_most/ictgu0w/
217,ict0auy,ColoquialQueso,Neat ad,Neat ad,400,2022-06-18 06:18:39,<praw.models.comment_forest.CommentForest object at 0x0000021CD74A47F0>,vezgll,gadgets,t5_2qgzt,,False,False,t3_vezgll,t3_vezgll,/r/gadgets/comments/vezgll/the_pixel_watch_could_be_googles_most/ict0auy/
218,ict2f36,ucyu,More customizable than their smartphones?,More customizable than their smartphones?,54,2022-06-18 06:48:06,<praw.models.comment_forest.CommentForest object at 0x0000021CD74A6070>,vezgll,gadgets,t5_2qgzt,,False,False,t3_vezgll,t3_vezgll,/r/gadgets/comments/vezgll/the_pixel_watch_could_be_googles_most/ict2f36/
219,ictkxbq,Jarvdoge,"While that's a factually correct headline, the idea quickly falls apart when you realise that this watch is replying on a proprietary mechanism for the straps. If you go for an option from the likes of Samsung, Fossil or pretty much any of the other wear os watches you can instantly get a third party strap as they use the same mechanism as other watches and smart watches. We'll be relying on Google supporting the watch itself and third parties designing their own watch straps with the new mechanism. At best we'll have a small selection of the watch takes off, if not I think people will be tied down to a very limited range of options.","While that's a factually correct headline, the idea quickly falls apart when you realise that this watch is replying on a proprietary mechanism for the straps. If you go for an option from the likes of Samsung, Fossil or pretty much any of the other wear os watches you can instantly get a third party strap as they use the same mechanism as other watches and smart watches. We'll be relying on Google supporting the watch itself and third parties designing their own watch straps with the new mechanism. At best we'll have a small selection of the watch takes off, if not I think people will be tied down to a very limited range of options.",14,2022-06-18 11:21:51,<praw.models.comment_forest.CommentForest object at 0x0000021CD74A6430>,vezgll,gadgets,t5_2qgzt,,False,False,t3_vezgll,t3_vezgll,/r/gadgets/comments/vezgll/the_pixel_watch_could_be_googles_most/ictkxbq/
220,ict2rpy,castagan,"Until they stop supporting it six weeks after release, then disown it completely once they get sued by whoever they stole the main features from, finally completing the Google hardware cycle by disavowing all knowledge of its existence when customers come screaming for support.","Until they stop supporting it six weeks after release, then disown it completely once they get sued by whoever they stole the main features from, finally completing the Google hardware cycle by disavowing all knowledge of its existence when customers come screaming for support.",114,2022-06-18 06:52:55,<praw.models.comment_forest.CommentForest object at 0x0000021CD74A6D90>,vezgll,gadgets,t5_2qgzt,,False,False,t3_vezgll,t3_vezgll,/r/gadgets/comments/vezgll/the_pixel_watch_could_be_googles_most/ict2rpy/
221,ictihai,,Low bar.,Low bar.,9,2022-06-18 10:48:50,<praw.models.comment_forest.CommentForest object at 0x0000021CD74A8250>,vezgll,gadgets,t5_2qgzt,,False,False,t3_vezgll,t3_vezgll,/r/gadgets/comments/vezgll/the_pixel_watch_could_be_googles_most/ictihai/
222,ict39wf,Cwlcymro,"Whilst I don't expect this first iteration to blow anything out of the water, let's be honest the Apple Watch will be the king fora few years yet at least, It's great to finally have a first party watch for Pixels!","Whilst I don't expect this first iteration to blow anything out of the water, let's be honest the Apple Watch will be the king fora few years yet at least, It's great to finally have a first party watch for Pixels!",15,2022-06-18 07:00:06,<praw.models.comment_forest.CommentForest object at 0x0000021CD74A84F0>,vezgll,gadgets,t5_2qgzt,,False,False,t3_vezgll,t3_vezgll,/r/gadgets/comments/vezgll/the_pixel_watch_could_be_googles_most/ict39wf/
223,ictu91p,Wetzilla,">Many of these bands have something in common: matching pre-existing Apple Watch bands you've probably seen before.

Apparently Apple invented watch bands.",">Many of these bands have something in common: matching pre-existing Apple Watch bands you've probably seen before.

Apparently Apple invented watch bands.",5,2022-06-18 13:07:39,<praw.models.comment_forest.CommentForest object at 0x0000021CD74A8670>,vezgll,gadgets,t5_2qgzt,,False,False,t3_vezgll,t3_vezgll,/r/gadgets/comments/vezgll/the_pixel_watch_could_be_googles_most/ictu91p/
224,ict1wwe,Ilruz,"I stopped believing in Google's hardware long ago. They all are rare to find, they have fatal flaws and little to no support.
They started wonderfully years ago, now they are flagship priced with subchinese standards.","I stopped believing in Google's hardware long ago. They all are rare to find, they have fatal flaws and little to no support.
They started wonderfully years ago, now they are flagship priced with subchinese standards.",40,2022-06-18 06:40:56,<praw.models.comment_forest.CommentForest object at 0x0000021CD74A8730>,vezgll,gadgets,t5_2qgzt,,False,False,t3_vezgll,t3_vezgll,/r/gadgets/comments/vezgll/the_pixel_watch_could_be_googles_most/ict1wwe/
