,ID,Author,body,Comment,Score,Created On,Replies,Submission,Subreddit,Subreddit_ID,Distinguished,Edited,Is_submitter,link_id,Parent_id,Permalink
376,if3dy90,Trial_by_Combat_,"I think if you wash them every time, blowing on them wouldn't matter.  But tapping them so the makeup falls into the sink is probably easier to clean up than blowing powder all over.","I think if you wash them every time, blowing on them wouldn't matter.  But tapping them so the makeup falls into the sink is probably easier to clean up than blowing powder all over.",8,2022-07-06 16:41:37,<praw.models.comment_forest.CommentForest object at 0x0000022EF512E520>,vsrcw5,MakeupAddiction,t5_2rww2,,False,False,t3_vsrcw5,t1_if3csu6,/r/MakeupAddiction/comments/vsrcw5/stop_blowing_on_your_makeup_tools_regardless_if/if3dy90/
377,if3jvog,totes-potatoes,"regardless if you wash your brushes every after use or not, if you blow on them there's a chance you will dip your blowed brushes on some makeup products and therefore contaminating them. so instead of trying to keep track of which brushes were blown or not, just don't blow on them. it's more hygienic, tidy, proper, & more pro that way.","regardless if you wash your brushes every after use or not, if you blow on them there's a chance you will dip your blowed brushes on some makeup products and therefore contaminating them. so instead of trying to keep track of which brushes were blown or not, just don't blow on them. it's more hygienic, tidy, proper, & more pro that way.",-27,2022-07-06 17:20:39,<praw.models.comment_forest.CommentForest object at 0x0000022EF512E580>,vsrcw5,MakeupAddiction,t5_2rww2,,1657128434.0,True,t3_vsrcw5,t1_if3csu6,/r/MakeupAddiction/comments/vsrcw5/stop_blowing_on_your_makeup_tools_regardless_if/if3jvog/
378,if4hbxi,Trial_by_Combat_,Whatever works for you.  It's your responsibility to manage your time.,Whatever works for you.  It's your responsibility to manage your time.,-15,2022-07-06 21:12:03,<praw.models.comment_forest.CommentForest object at 0x0000022EF512E8E0>,vsrcw5,MakeupAddiction,t5_2rww2,,False,False,t3_vsrcw5,t1_if4et1y,/r/MakeupAddiction/comments/vsrcw5/stop_blowing_on_your_makeup_tools_regardless_if/if4hbxi/
379,if36tow,Sleepyandworried,i love washing my brushes,i love washing my brushes,5,2022-07-06 15:55:36,<praw.models.comment_forest.CommentForest object at 0x0000022EF512ECA0>,vsrcw5,MakeupAddiction,t5_2rww2,,False,False,t3_vsrcw5,t1_if339rt,/r/MakeupAddiction/comments/vsrcw5/stop_blowing_on_your_makeup_tools_regardless_if/if36tow/
380,if3b8v2,Attemptathappiness,Das gross friend,Das gross friend,5,2022-07-06 16:24:10,<praw.models.comment_forest.CommentForest object at 0x0000022EF512ED60>,vsrcw5,MakeupAddiction,t5_2rww2,,False,False,t3_vsrcw5,t1_if339rt,/r/MakeupAddiction/comments/vsrcw5/stop_blowing_on_your_makeup_tools_regardless_if/if3b8v2/
381,if56v8t,Darkmagosan,"At least I can spell. 

Seriously, who the hell blows on brushes? It's not going to get excess greasepaint off the brush and it wastes powder.","At least I can spell. 

Seriously, who the hell blows on brushes? It's not going to get excess greasepaint off the brush and it wastes powder.",-4,2022-07-07 00:16:28,<praw.models.comment_forest.CommentForest object at 0x0000022EF5130D00>,vsrcw5,MakeupAddiction,t5_2rww2,,False,False,t3_vsrcw5,t1_if53t84,/r/MakeupAddiction/comments/vsrcw5/stop_blowing_on_your_makeup_tools_regardless_if/if56v8t/
382,if4elhs,xxivtarotmagic_,Thank you!,Thank you!,1,2022-07-06 20:53:02,<praw.models.comment_forest.CommentForest object at 0x0000022EF5130EE0>,vsrcw5,MakeupAddiction,t5_2rww2,,False,False,t3_vsrcw5,t1_if3jcj4,/r/MakeupAddiction/comments/vsrcw5/stop_blowing_on_your_makeup_tools_regardless_if/if4elhs/
383,ifej1uy,,They probably do but I like the airbrush effect it gives.,They probably do but I like the airbrush effect it gives.,1,2022-07-08 22:28:30,<praw.models.comment_forest.CommentForest object at 0x0000022EF5133040>,vsrcw5,MakeupAddiction,t5_2rww2,,False,False,t3_vsrcw5,t1_if7h04i,/r/MakeupAddiction/comments/vsrcw5/stop_blowing_on_your_makeup_tools_regardless_if/ifej1uy/
384,if3fotn,JerryHasACubeButt,"That’s true, I agree. The argument isn’t usually about making a mess though, it’s about being unsanitary, which… it’s not unsanitary if you just use your tools the way you’re supposed to in the first place? Gaga is a multimillionaire with her own makeup line, I’m going to go out on a limb and assume she either washes her brushes regularly or someone does it for her, in which case this is a total non-issue lol","That’s true, I agree. The argument isn’t usually about making a mess though, it’s about being unsanitary, which… it’s not unsanitary if you just use your tools the way you’re supposed to in the first place? Gaga is a multimillionaire with her own makeup line, I’m going to go out on a limb and assume she either washes her brushes regularly or someone does it for her, in which case this is a total non-issue lol",7,2022-07-06 16:52:48,<praw.models.comment_forest.CommentForest object at 0x0000022EF512E5E0>,vsrcw5,MakeupAddiction,t5_2rww2,,False,False,t3_vsrcw5,t1_if3dy90,/r/MakeupAddiction/comments/vsrcw5/stop_blowing_on_your_makeup_tools_regardless_if/if3fotn/
385,if3lzov,,"But, are you going to wash them before you touch your eyes or face with the makeup you just loaded on? You just blew whatever bacteria on there and then smear it on. I mean, I assume we all are clean people, but that one time you get pink eye or your friend putting makeup on you is sick, it's gonna suck.","But, are you going to wash them before you touch your eyes or face with the makeup you just loaded on? You just blew whatever bacteria on there and then smear it on. I mean, I assume we all are clean people, but that one time you get pink eye or your friend putting makeup on you is sick, it's gonna suck.",-2,2022-07-06 17:34:40,<praw.models.comment_forest.CommentForest object at 0x0000022EF512E640>,vsrcw5,MakeupAddiction,t5_2rww2,,False,False,t3_vsrcw5,t1_if3dy90,/r/MakeupAddiction/comments/vsrcw5/stop_blowing_on_your_makeup_tools_regardless_if/if3lzov/
386,if4n4x9,eolaiocht,Bacteria in and on your body generally have their niches though. Skin fauna is gonna differ from what you find in your mouth. So really you should be more concerned about contaminating your makeup by using your brush on your face and then putting it back in the pan.,Bacteria in and on your body generally have their niches though. Skin fauna is gonna differ from what you find in your mouth. So really you should be more concerned about contaminating your makeup by using your brush on your face and then putting it back in the pan.,11,2022-07-06 21:52:27,<praw.models.comment_forest.CommentForest object at 0x0000022EF512E7C0>,vsrcw5,MakeupAddiction,t5_2rww2,,False,False,t3_vsrcw5,t1_if3jvog,/r/MakeupAddiction/comments/vsrcw5/stop_blowing_on_your_makeup_tools_regardless_if/if4n4x9/
387,if5a1yh,JerryHasACubeButt,"Which is why I also regularly sanitize my palettes... like you're supposed to. Again, I'm not a brush blower, but I still don't see that as an issue if you're doing everything as you should. So this really just supports that blowing on brushes only seems to become unhygienic if you're already doing other unhygienic things in combination with it","Which is why I also regularly sanitize my palettes... like you're supposed to. Again, I'm not a brush blower, but I still don't see that as an issue if you're doing everything as you should. So this really just supports that blowing on brushes only seems to become unhygienic if you're already doing other unhygienic things in combination with it",2,2022-07-07 00:40:25,<praw.models.comment_forest.CommentForest object at 0x0000022EF512E880>,vsrcw5,MakeupAddiction,t5_2rww2,,False,False,t3_vsrcw5,t1_if3jvog,/r/MakeupAddiction/comments/vsrcw5/stop_blowing_on_your_makeup_tools_regardless_if/if5a1yh/
388,if4pvw0,tabruss,sure it is. But I guess some people have more free time than others.,sure it is. But I guess some people have more free time than others.,7,2022-07-06 22:11:52,<praw.models.comment_forest.CommentForest object at 0x0000022EF512EA60>,vsrcw5,MakeupAddiction,t5_2rww2,,False,False,t3_vsrcw5,t1_if4hbxi,/r/MakeupAddiction/comments/vsrcw5/stop_blowing_on_your_makeup_tools_regardless_if/if4pvw0/
389,if38bsv,bcmarss,"i really do need to, what do you use for that?","i really do need to, what do you use for that?",3,2022-07-06 16:05:19,<praw.models.comment_forest.CommentForest object at 0x0000022EF512EDC0>,vsrcw5,MakeupAddiction,t5_2rww2,,False,False,t3_vsrcw5,t1_if36tow,/r/MakeupAddiction/comments/vsrcw5/stop_blowing_on_your_makeup_tools_regardless_if/if38bsv/
390,if56zzd,theblonddeath,That’s the point. To get rid of the excess powder. I’m sorry I could really care less to spell out “you”. You’re not that important,That’s the point. To get rid of the excess powder. I’m sorry I could really care less to spell out “you”. You’re not that important,6,2022-07-07 00:17:29,<praw.models.comment_forest.CommentForest object at 0x0000022EF5130DC0>,vsrcw5,MakeupAddiction,t5_2rww2,,False,False,t3_vsrcw5,t1_if56v8t,/r/MakeupAddiction/comments/vsrcw5/stop_blowing_on_your_makeup_tools_regardless_if/if56zzd/
391,iffvl45,New-Lie9111,"oh lol, i thought you were implying you prefer beauty blender because they’re cleaner than brushes. my bad","oh lol, i thought you were implying you prefer beauty blender because they’re cleaner than brushes. my bad",2,2022-07-09 05:21:22,<praw.models.comment_forest.CommentForest object at 0x0000022EF5133100>,vsrcw5,MakeupAddiction,t5_2rww2,,False,False,t3_vsrcw5,t1_ifej1uy,/r/MakeupAddiction/comments/vsrcw5/stop_blowing_on_your_makeup_tools_regardless_if/iffvl45/
392,if3g2d8,Trial_by_Combat_,LOL good point,LOL good point,3,2022-07-06 16:55:14,<praw.models.comment_forest.CommentForest object at 0x0000022EF512E6A0>,vsrcw5,MakeupAddiction,t5_2rww2,,False,False,t3_vsrcw5,t1_if3fotn,/r/MakeupAddiction/comments/vsrcw5/stop_blowing_on_your_makeup_tools_regardless_if/if3g2d8/
393,if58nk6,JerryHasACubeButt,"We are constantly exposed to our own breath though. I have a hard time believing a little bit of bacteria or whatever else you might breathe onto a brush and then immediately apply to your face would be *that* detrimental. Think of all the nasty stuff that must get on your face when you cover a cough or sneeze, I very much doubt blowing on a makeup brush is nearly as bad as that. As I have always understood it, the main worry is that once a brush is inoculated with your breath, if it isn't washed, it can *grow whole colonies of bacteria* which you are then applying to your face next time. The colonies are the problem, not one or two random bacteria.


That said, I hadn't considered your point before so I searched to see if it had ever actually been studied, and couldn't find anything. So I suppose it's possible that it's also an issue, but eh. Like most people, I don't wash my whole face every time I sneeze, so if I were a brush blower I doubt the idea that I might accidentally get *my own breath* on me would be enough to convince me to stop


Doing it when putting makeup on other people is gross though. I hadn't even considered that anyone might do that. Exposure to your own germs is very different from exposure to someone else's. That's like gross moms who lick their finger and use it to wipe stuff off their kid's face. Hard agree with you there lol","We are constantly exposed to our own breath though. I have a hard time believing a little bit of bacteria or whatever else you might breathe onto a brush and then immediately apply to your face would be *that* detrimental. Think of all the nasty stuff that must get on your face when you cover a cough or sneeze, I very much doubt blowing on a makeup brush is nearly as bad as that. As I have always understood it, the main worry is that once a brush is inoculated with your breath, if it isn't washed, it can *grow whole colonies of bacteria* which you are then applying to your face next time. The colonies are the problem, not one or two random bacteria.


That said, I hadn't considered your point before so I searched to see if it had ever actually been studied, and couldn't find anything. So I suppose it's possible that it's also an issue, but eh. Like most people, I don't wash my whole face every time I sneeze, so if I were a brush blower I doubt the idea that I might accidentally get *my own breath* on me would be enough to convince me to stop


Doing it when putting makeup on other people is gross though. I hadn't even considered that anyone might do that. Exposure to your own germs is very different from exposure to someone else's. That's like gross moms who lick their finger and use it to wipe stuff off their kid's face. Hard agree with you there lol",4,2022-07-07 00:29:57,<praw.models.comment_forest.CommentForest object at 0x0000022EF512E760>,vsrcw5,MakeupAddiction,t5_2rww2,,False,False,t3_vsrcw5,t1_if3lzov,/r/MakeupAddiction/comments/vsrcw5/stop_blowing_on_your_makeup_tools_regardless_if/if58nk6/
394,if633f5,kfarrel3,"Okay, maybe I am outing myself as a gross person. How does one sanitize a palette? Genuine question, I didn't realize this was something I was supposed to do, especially since I'm the only one that uses them.","Okay, maybe I am outing myself as a gross person. How does one sanitize a palette? Genuine question, I didn't realize this was something I was supposed to do, especially since I'm the only one that uses them.",1,2022-07-07 04:38:26,<praw.models.comment_forest.CommentForest object at 0x0000022EF512E940>,vsrcw5,MakeupAddiction,t5_2rww2,,False,False,t3_vsrcw5,t1_if5a1yh,/r/MakeupAddiction/comments/vsrcw5/stop_blowing_on_your_makeup_tools_regardless_if/if633f5/
395,if3ct68,Sleepyandworried,i buy a solid brush cleaner. right now i’m using one by It. Before that beauty blender. i get whatever is on sale haha. works a lot better than more “diy” options imo ¯\_(ツ)_/¯,i buy a solid brush cleaner. right now i’m using one by It. Before that beauty blender. i get whatever is on sale haha. works a lot better than more “diy” options imo ¯\_(ツ)_/¯,4,2022-07-06 16:34:16,<praw.models.comment_forest.CommentForest object at 0x0000022EF512EE80>,vsrcw5,MakeupAddiction,t5_2rww2,,False,False,t3_vsrcw5,t1_if38bsv,/r/MakeupAddiction/comments/vsrcw5/stop_blowing_on_your_makeup_tools_regardless_if/if3ct68/
396,if4kzzv,BabyGirlBlondie,"Jamie Genevieve (creator of UK makeup brand Vieve) has a really cool system I love for cleaning makeup brushes using a gentle, easy to find soap! If you search on YouTube “Jamie Genevieve Washing Makeup Brushes,” you’ll come across her Vieve tutorial for washing their brushes and she shows off her whole system. Highly recommended!","Jamie Genevieve (creator of UK makeup brand Vieve) has a really cool system I love for cleaning makeup brushes using a gentle, easy to find soap! If you search on YouTube “Jamie Genevieve Washing Makeup Brushes,” you’ll come across her Vieve tutorial for washing their brushes and she shows off her whole system. Highly recommended!",3,2022-07-06 21:37:33,<praw.models.comment_forest.CommentForest object at 0x0000022EF512EEE0>,vsrcw5,MakeupAddiction,t5_2rww2,,False,False,t3_vsrcw5,t1_if38bsv,/r/MakeupAddiction/comments/vsrcw5/stop_blowing_on_your_makeup_tools_regardless_if/if4kzzv/
397,if3axr8,cuntaloupemelon,"If you don't want to buy a dedicated brush cleaner a mild shampoo, like baby shampoo, works well.

Not cleaning your brushes puts you at serious risk of eye and skin infections so definitely make it a priority to start!","If you don't want to buy a dedicated brush cleaner a mild shampoo, like baby shampoo, works well.

Not cleaning your brushes puts you at serious risk of eye and skin infections so definitely make it a priority to start!",4,2022-07-06 16:22:12,<praw.models.comment_forest.CommentForest object at 0x0000022EF512EF40>,vsrcw5,MakeupAddiction,t5_2rww2,,False,False,t3_vsrcw5,t1_if38bsv,/r/MakeupAddiction/comments/vsrcw5/stop_blowing_on_your_makeup_tools_regardless_if/if3axr8/
398,if4bi82,Darkmagosan,"I use a moderate sized drop of dishwashing liquid, like Palmolive or Dawn. Really roll the brush around in the soap to get the bristles clean down to the ferrule, then rinse. Rinse rinse rinse. You'll know it's clean when you rub it into your palm and no traces of makeup remain. Then take your fingers, gently squeeze out the excess water to shape your brush to its proper form, and let it dry flat on the counter. It should be dry in a couple hours. 

I use oil base stage makeup almost exclusively and this gets my brushes clean as the proverbial whistle. I clean them as soon as I'm done using them. Always.","I use a moderate sized drop of dishwashing liquid, like Palmolive or Dawn. Really roll the brush around in the soap to get the bristles clean down to the ferrule, then rinse. Rinse rinse rinse. You'll know it's clean when you rub it into your palm and no traces of makeup remain. Then take your fingers, gently squeeze out the excess water to shape your brush to its proper form, and let it dry flat on the counter. It should be dry in a couple hours. 

I use oil base stage makeup almost exclusively and this gets my brushes clean as the proverbial whistle. I clean them as soon as I'm done using them. Always.",2,2022-07-06 20:31:47,<praw.models.comment_forest.CommentForest object at 0x0000022EF512EFA0>,vsrcw5,MakeupAddiction,t5_2rww2,,False,False,t3_vsrcw5,t1_if38bsv,/r/MakeupAddiction/comments/vsrcw5/stop_blowing_on_your_makeup_tools_regardless_if/if4bi82/
399,if3bbmm,Trial_by_Combat_,I also use baby wash.,I also use baby wash.,1,2022-07-06 16:24:40,<praw.models.comment_forest.CommentForest object at 0x0000022EF5130040>,vsrcw5,MakeupAddiction,t5_2rww2,,False,False,t3_vsrcw5,t1_if38bsv,/r/MakeupAddiction/comments/vsrcw5/stop_blowing_on_your_makeup_tools_regardless_if/if3bbmm/
400,if7g75x,New-Lie9111,i bought a shampoo that i didn’t quite like the fragrance of so i just use it as a brush cleaner now,i bought a shampoo that i didn’t quite like the fragrance of so i just use it as a brush cleaner now,1,2022-07-07 13:48:17,<praw.models.comment_forest.CommentForest object at 0x0000022EF51300A0>,vsrcw5,MakeupAddiction,t5_2rww2,,False,False,t3_vsrcw5,t1_if38bsv,/r/MakeupAddiction/comments/vsrcw5/stop_blowing_on_your_makeup_tools_regardless_if/if7g75x/
401,if57f8o,Darkmagosan,"No shit, Sherlock. You want to waste your powder, be my guest. I'm going to tap off the excess back into its container so 1) I'm not cleaning it off my counter and 2) it's not going to waste. If you want to burn money, knock yourself out. I'm going to use my products as efficiently as I can.","No shit, Sherlock. You want to waste your powder, be my guest. I'm going to tap off the excess back into its container so 1) I'm not cleaning it off my counter and 2) it's not going to waste. If you want to burn money, knock yourself out. I'm going to use my products as efficiently as I can.",-5,2022-07-07 00:20:43,<praw.models.comment_forest.CommentForest object at 0x0000022EF5130E80>,vsrcw5,MakeupAddiction,t5_2rww2,,False,False,t3_vsrcw5,t1_if56zzd,/r/MakeupAddiction/comments/vsrcw5/stop_blowing_on_your_makeup_tools_regardless_if/if57f8o/
402,iffxavj,,"No, sponges definitely carry more bacteria. I do rotate and clean mine as best as they can be cleaned. I do find that they give a better airbrushed look and easy to make foundation look like real skin effect. Sorry for the misunderstanding.","No, sponges definitely carry more bacteria. I do rotate and clean mine as best as they can be cleaned. I do find that they give a better airbrushed look and easy to make foundation look like real skin effect. Sorry for the misunderstanding.",1,2022-07-09 05:40:45,<praw.models.comment_forest.CommentForest object at 0x0000022EF51331C0>,vsrcw5,MakeupAddiction,t5_2rww2,,False,False,t3_vsrcw5,t1_iffvl45,/r/MakeupAddiction/comments/vsrcw5/stop_blowing_on_your_makeup_tools_regardless_if/iffxavj/
403,if7hmel,,UGHHHH. Yes! My mom used to do that all the dang time. ICK factor times a million.,UGHHHH. Yes! My mom used to do that all the dang time. ICK factor times a million.,1,2022-07-07 13:58:46,<praw.models.comment_forest.CommentForest object at 0x0000022EF512E820>,vsrcw5,MakeupAddiction,t5_2rww2,,False,False,t3_vsrcw5,t1_if58nk6,/r/MakeupAddiction/comments/vsrcw5/stop_blowing_on_your_makeup_tools_regardless_if/if7hmel/
404,if657w8,JerryHasACubeButt,"70% isopropyl alcohol in a spray bottle, just spray them until they’re visibly wet and then let them dry and you’re good to go.

You’re not outing yourself as a gross person, it’s not like there is a set curriculum for using makeup, you’re allowed to not know things (and you asked a question so you could adopt a more hygienic habit, which is the opposite of gross). The key difference is you didn’t make an entire post criticizing other people’s makeup habits lol","70% isopropyl alcohol in a spray bottle, just spray them until they’re visibly wet and then let them dry and you’re good to go.

You’re not outing yourself as a gross person, it’s not like there is a set curriculum for using makeup, you’re allowed to not know things (and you asked a question so you could adopt a more hygienic habit, which is the opposite of gross). The key difference is you didn’t make an entire post criticizing other people’s makeup habits lol",2,2022-07-07 05:00:18,<praw.models.comment_forest.CommentForest object at 0x0000022EF512EA00>,vsrcw5,MakeupAddiction,t5_2rww2,,False,False,t3_vsrcw5,t1_if633f5,/r/MakeupAddiction/comments/vsrcw5/stop_blowing_on_your_makeup_tools_regardless_if/if657w8/
405,if7fzka,New-Lie9111,does the alcohol change the formula of the product? like if it’s a wetter formula is there a chance that the alcohol will dry it out?,does the alcohol change the formula of the product? like if it’s a wetter formula is there a chance that the alcohol will dry it out?,1,2022-07-07 13:46:41,<praw.models.comment_forest.CommentForest object at 0x0000022EF512EAC0>,vsrcw5,MakeupAddiction,t5_2rww2,,False,False,t3_vsrcw5,t1_if657w8,/r/MakeupAddiction/comments/vsrcw5/stop_blowing_on_your_makeup_tools_regardless_if/if7fzka/
406,if7kwmm,JerryHasACubeButt,"I only do the spray for powders. Sorry, I only have powder palettes and it didn’t occur to me that anything at all wet would come in a palette lol

For more liquidy things like a cream blush or foundation that still comes in a palette or compact where you are continuously contaminating it with use, I have heard it’s better to wipe the surface with an alcohol wipe instead, so you’re just removing stuff from the top without permeating the rest of the product, but all my products are either powders or actual liquids that don’t get contaminated via application, so I haven’t tried that","I only do the spray for powders. Sorry, I only have powder palettes and it didn’t occur to me that anything at all wet would come in a palette lol

For more liquidy things like a cream blush or foundation that still comes in a palette or compact where you are continuously contaminating it with use, I have heard it’s better to wipe the surface with an alcohol wipe instead, so you’re just removing stuff from the top without permeating the rest of the product, but all my products are either powders or actual liquids that don’t get contaminated via application, so I haven’t tried that",1,2022-07-07 14:22:38,<praw.models.comment_forest.CommentForest object at 0x0000022EF512EB80>,vsrcw5,MakeupAddiction,t5_2rww2,,False,False,t3_vsrcw5,t1_if7fzka,/r/MakeupAddiction/comments/vsrcw5/stop_blowing_on_your_makeup_tools_regardless_if/if7kwmm/
407,if7mgla,New-Lie9111,"i think i phrased my question badly😅 i’m talking about powder formulas that are softer and kinda almost creamy? similar to colourpop’s super shock shadows. the alcohol wipe idea sounds interesting, thanks!","i think i phrased my question badly😅 i’m talking about powder formulas that are softer and kinda almost creamy? similar to colourpop’s super shock shadows. the alcohol wipe idea sounds interesting, thanks!",2,2022-07-07 14:33:40,<praw.models.comment_forest.CommentForest object at 0x0000022EF512EC40>,vsrcw5,MakeupAddiction,t5_2rww2,,False,False,t3_vsrcw5,t1_if7kwmm,/r/MakeupAddiction/comments/vsrcw5/stop_blowing_on_your_makeup_tools_regardless_if/if7mgla/
408,if7pu11,JerryHasACubeButt,"Ah ok, I haven’t tried those. I’m a ball of oil, so I need like, the driest, most powdery of powders lol. I would imagine any powder would likely be fine with just a spritz, you just have to get the surface wet so even if it messes with the formula a little bit, it’s just a thin layer, it’s not gonna ruin the product, but I don’t know. I’m sure an actual working MUA could give a better answer than me, since they would be using and sanitizing all kinds of different products frequently","Ah ok, I haven’t tried those. I’m a ball of oil, so I need like, the driest, most powdery of powders lol. I would imagine any powder would likely be fine with just a spritz, you just have to get the surface wet so even if it messes with the formula a little bit, it’s just a thin layer, it’s not gonna ruin the product, but I don’t know. I’m sure an actual working MUA could give a better answer than me, since they would be using and sanitizing all kinds of different products frequently",1,2022-07-07 14:56:40,<praw.models.comment_forest.CommentForest object at 0x0000022EF512ED00>,vsrcw5,MakeupAddiction,t5_2rww2,,False,False,t3_vsrcw5,t1_if7mgla,/r/MakeupAddiction/comments/vsrcw5/stop_blowing_on_your_makeup_tools_regardless_if/if7pu11/
