,ID,Author,body,Comment,Score,Created On,Replies,Submission,Subreddit,Subreddit_ID,Distinguished,Edited,Is_submitter,link_id,Parent_id,Permalink
216,j6hyj8s,iliketreesandbeaches,"I personally think over a certain age, you shouldn’t do both dark lip and dark eyes.  Chose one feature to highlight, not both.","I personally think over a certain age, you shouldn’t do both dark lip and dark eyes.  Chose one feature to highlight, not both.",7,2023-01-30 13:43:31,<praw.models.comment_forest.CommentForest object at 0x0000022EF510DCD0>,10orw1o,MakeupAddiction,t5_2rww2,,False,False,t3_10orw1o,t3_10orw1o,/r/MakeupAddiction/comments/10orw1o/experimenting_with_heavy_makeup_under_my_eyes_how/j6hyj8s/
217,j6gilzz,AutoModerator,"***Thank you for contributing to MUA! If this is your first post, please be sure to check out our rules in the subreddit sidebar. If you are on mobile, they can be viewed by tapping the*** ⓘ ***symbol.***

**A few quick highlights:**

• Looks, hauls, and flatlays require a [product list in the comments, complete with shade names within 20 minutes of posting.](https://www.reddit.com/r/MakeupAddiction/wiki/productlist)

• Photos must not be [edited or filtered. This includes automatic beauty and portrait modes found on many phones and newer cameras.](https://www.reddit.com/r/MakeupAddiction/wiki/photoediting)

• Lastly, our [Helpful Guides for Navigating MUA](https://www.reddit.com/r/MakeupAddiction/wiki/helpfulguides) in the sidebar explains some of the basics of the community as well as commonly misinterpreted rules.

**Is your post just a search away?**

Before you make a post, search with Reddit's search feature or use this handy [customised Google search.](https://cse.google.com/cse?cx=008480394191906358284:aflieg73nqm)


*I am a bot, and this action was performed automatically. Please [contact the moderators of this subreddit](/message/compose/?to=/r/MakeupAddiction) if you have any questions or concerns.*","***Thank you for contributing to MUA! If this is your first post, please be sure to check out our rules in the subreddit sidebar. If you are on mobile, they can be viewed by tapping the*** ⓘ ***symbol.***

**A few quick highlights:**

• Looks, hauls, and flatlays require a [product list in the comments, complete with shade names within 20 minutes of posting.](https://www.reddit.com/r/MakeupAddiction/wiki/productlist)

• Photos must not be [edited or filtered. This includes automatic beauty and portrait modes found on many phones and newer cameras.](https://www.reddit.com/r/MakeupAddiction/wiki/photoediting)

• Lastly, our [Helpful Guides for Navigating MUA](https://www.reddit.com/r/MakeupAddiction/wiki/helpfulguides) in the sidebar explains some of the basics of the community as well as commonly misinterpreted rules.

**Is your post just a search away?**

Before you make a post, search with Reddit's search feature or use this handy [customised Google search.](https://cse.google.com/cse?cx=008480394191906358284:aflieg73nqm)


*I am a bot, and this action was performed automatically. Please [contact the moderators of this subreddit](/message/compose/?to=/r/MakeupAddiction) if you have any questions or concerns.*",2,2023-01-30 03:49:38,<praw.models.comment_forest.CommentForest object at 0x0000022EF510DD90>,10orw1o,MakeupAddiction,t5_2rww2,moderator,False,False,t3_10orw1o,t3_10orw1o,/r/MakeupAddiction/comments/10orw1o/experimenting_with_heavy_makeup_under_my_eyes_how/j6gilzz/
218,j6hkff2,Minimum_Raccoon8558,"Filling to much eyes makes you age a bit I noticed that, try softer colors on the eyelids like light brown, pink or gold, and a eyeliner. For lips I would use plumb color","Filling to much eyes makes you age a bit I noticed that, try softer colors on the eyelids like light brown, pink or gold, and a eyeliner. For lips I would use plumb color",2,2023-01-30 11:17:29,<praw.models.comment_forest.CommentForest object at 0x0000022EF510DE50>,10orw1o,MakeupAddiction,t5_2rww2,,False,False,t3_10orw1o,t3_10orw1o,/r/MakeupAddiction/comments/10orw1o/experimenting_with_heavy_makeup_under_my_eyes_how/j6hkff2/
219,j6idqdt,,"Here’s my go to makeups I’ve used for years. Since it seems like your also wondering about makeups. I use nyx can’t stop won’t stop foundation. Can be found at Walmart. Tarte shape tape ultra concealer (it is pricey but there are knock offs available) cover girl clean powder (from Walmart) a milani matte blush (from Walmart) and Anastasia Beverly Hills brow pomeade. (Ordered online from ulta). I’m pretty sure you can get all these things from ulta or Walmart.com.     I’ve noticed with a good base/brow, it can make any lipstick and eyeshadow more flattering. Also as a fellow person who struggles with picking at my face. Try putting a good healing moisturizing lotion on after you take a shower or wash your face and try your best not to pick. It’s the only thing that healed my skin and stopped it from breaking out. Which made my makeup application much much better. Hope this helps. And doesn’t come off as judgmental at all. Makeup takes time and is different for everyone. But it can be such a good confidence booster and doing it daily can encourage you to take better care of your face and overall health. Sending love ❤️","Here’s my go to makeups I’ve used for years. Since it seems like your also wondering about makeups. I use nyx can’t stop won’t stop foundation. Can be found at Walmart. Tarte shape tape ultra concealer (it is pricey but there are knock offs available) cover girl clean powder (from Walmart) a milani matte blush (from Walmart) and Anastasia Beverly Hills brow pomeade. (Ordered online from ulta). I’m pretty sure you can get all these things from ulta or Walmart.com.     I’ve noticed with a good base/brow, it can make any lipstick and eyeshadow more flattering. Also as a fellow person who struggles with picking at my face. Try putting a good healing moisturizing lotion on after you take a shower or wash your face and try your best not to pick. It’s the only thing that healed my skin and stopped it from breaking out. Which made my makeup application much much better. Hope this helps. And doesn’t come off as judgmental at all. Makeup takes time and is different for everyone. But it can be such a good confidence booster and doing it daily can encourage you to take better care of your face and overall health. Sending love ❤️",2,2023-01-30 15:35:37,<praw.models.comment_forest.CommentForest object at 0x0000022EF510DEB0>,10orw1o,MakeupAddiction,t5_2rww2,,False,False,t3_10orw1o,t3_10orw1o,/r/MakeupAddiction/comments/10orw1o/experimenting_with_heavy_makeup_under_my_eyes_how/j6idqdt/
220,j6n1qnd,CaptainWeezy,"I think for me, it’s the blue tones that make it not work. Your hair and eyes are definitely on the warm side, skin is more neutral. I would say you’re more of a soft autumn. This is why the dark is too dark and blue/grays are too blue. Your contrast between hair and skin is more subtle so the darkness is swallowing you up. The blue on your shirt, while it’s a lovely color, does not go well with your skin tone. It’s a bright cool blue, which is almost opposite of your colors. 

“Colors to Avoid as a Soft Autumn

Stay away from stark white, black, and any jewel tones like emerald or sapphire.”

Check out this for colors:

[https://imgur.com/gallery/kJSxlla](https://imgur.com/gallery/kJSxlla)

It has some good examples of the full rainbow of what may look better on you. For blues, keeping to the teal or blue-green side would be more flattering. As for contrast, keep it slightly muted, doesn’t have to be pale but shouldn’t be too bright. A deep burgundy lip, like the color example would be great on you. That being said, if you’re looking for a dramatic look, go ahead and do dark eyes with a dark lip, just try to have one stick out more than the other. For a more wearable look, definitely keep focus on one area. Dramatic eyes & neutral lip, or neutral eyes & dramatic lips. Usually with a full dramatic eye and lip combo, everything else will be done up too: eyebrows, eyelashes, and foundation. Personally, I don’t wear foundation at all but some mascara and a brow pencil would complete the look! and Technique will get better with more practice, of course watching lots of YouTube videos specifically about dark eye or lip looks will help too!","I think for me, it’s the blue tones that make it not work. Your hair and eyes are definitely on the warm side, skin is more neutral. I would say you’re more of a soft autumn. This is why the dark is too dark and blue/grays are too blue. Your contrast between hair and skin is more subtle so the darkness is swallowing you up. The blue on your shirt, while it’s a lovely color, does not go well with your skin tone. It’s a bright cool blue, which is almost opposite of your colors. 

“Colors to Avoid as a Soft Autumn

Stay away from stark white, black, and any jewel tones like emerald or sapphire.”

Check out this for colors:

[https://imgur.com/gallery/kJSxlla](https://imgur.com/gallery/kJSxlla)

It has some good examples of the full rainbow of what may look better on you. For blues, keeping to the teal or blue-green side would be more flattering. As for contrast, keep it slightly muted, doesn’t have to be pale but shouldn’t be too bright. A deep burgundy lip, like the color example would be great on you. That being said, if you’re looking for a dramatic look, go ahead and do dark eyes with a dark lip, just try to have one stick out more than the other. For a more wearable look, definitely keep focus on one area. Dramatic eyes & neutral lip, or neutral eyes & dramatic lips. Usually with a full dramatic eye and lip combo, everything else will be done up too: eyebrows, eyelashes, and foundation. Personally, I don’t wear foundation at all but some mascara and a brow pencil would complete the look! and Technique will get better with more practice, of course watching lots of YouTube videos specifically about dark eye or lip looks will help too!",2,2023-01-31 14:27:50,<praw.models.comment_forest.CommentForest object at 0x0000022EF510DF70>,10orw1o,MakeupAddiction,t5_2rww2,,False,False,t3_10orw1o,t3_10orw1o,/r/MakeupAddiction/comments/10orw1o/experimenting_with_heavy_makeup_under_my_eyes_how/j6n1qnd/
221,j6ppol3,,"Eye liner on the top of your eyes is done good. You can see in the picture with your eyes closed it looks very even and good. 
Eye liner on the bottom is droopy and heavy, as pictured with your eyes open, you just need to take very minimal from the sides at the bottom to lift your eyes up into that cat eye!","Eye liner on the top of your eyes is done good. You can see in the picture with your eyes closed it looks very even and good. 
Eye liner on the bottom is droopy and heavy, as pictured with your eyes open, you just need to take very minimal from the sides at the bottom to lift your eyes up into that cat eye!",2,2023-02-01 00:38:53,<praw.models.comment_forest.CommentForest object at 0x0000022EF510F070>,10orw1o,MakeupAddiction,t5_2rww2,,False,False,t3_10orw1o,t3_10orw1o,/r/MakeupAddiction/comments/10orw1o/experimenting_with_heavy_makeup_under_my_eyes_how/j6ppol3/
222,j6jnctz,mushygirl20,To elevate the look I would add some black pencil eyeliner on the outer corner half of your water line to create a cat eye affect. You can also add white or cream pencil liner in the inner corner of the water line to open your eye there. Also I recommend investing in a smudging brush or a small precision blending brush so you can have more control with smoking out shadows underneath your eyes. Couldn’t tell if you did this or not but whenever I use a very dark color I always use a lighter color as a transition shade and draw the shape out before I go in with the heavier color. For example if I’m going to do a black Smokey eye I will go in with a neutral brown or light grey and then layer the black making a gradient effect. Also when you go to pick up pigment always tap the brush and build up the colors slowly. Hope this helps💗,To elevate the look I would add some black pencil eyeliner on the outer corner half of your water line to create a cat eye affect. You can also add white or cream pencil liner in the inner corner of the water line to open your eye there. Also I recommend investing in a smudging brush or a small precision blending brush so you can have more control with smoking out shadows underneath your eyes. Couldn’t tell if you did this or not but whenever I use a very dark color I always use a lighter color as a transition shade and draw the shape out before I go in with the heavier color. For example if I’m going to do a black Smokey eye I will go in with a neutral brown or light grey and then layer the black making a gradient effect. Also when you go to pick up pigment always tap the brush and build up the colors slowly. Hope this helps💗,2,2023-01-30 20:22:14,<praw.models.comment_forest.CommentForest object at 0x0000022EF510F1F0>,10orw1o,MakeupAddiction,t5_2rww2,,False,False,t3_10orw1o,t3_10orw1o,/r/MakeupAddiction/comments/10orw1o/experimenting_with_heavy_makeup_under_my_eyes_how/j6jnctz/
223,j6gjiqs,Excellent_Law6906,"Eyes:

NYX Jumbo Eye Pencil in Cobalt
Wet 'n'Wild single eyeshadow in Moonchild
Too Faced Diamond Light Highlighter
Rimmel Wonder Ombre Eyeliner in Purple Prism
Rimmel Stay Glossy in Halo

Lips:

NYX Liquid Suede in Foulmouth
Wet 'n'Wild single Eyeshadow in Moonchild


Face:

Too Faced Diamond Light Highlighter","Eyes:

NYX Jumbo Eye Pencil in Cobalt
Wet 'n'Wild single eyeshadow in Moonchild
Too Faced Diamond Light Highlighter
Rimmel Wonder Ombre Eyeliner in Purple Prism
Rimmel Stay Glossy in Halo

Lips:

NYX Liquid Suede in Foulmouth
Wet 'n'Wild single Eyeshadow in Moonchild


Face:

Too Faced Diamond Light Highlighter",1,2023-01-30 03:56:48,<praw.models.comment_forest.CommentForest object at 0x0000022EF510F2B0>,10orw1o,MakeupAddiction,t5_2rww2,,False,True,t3_10orw1o,t3_10orw1o,/r/MakeupAddiction/comments/10orw1o/experimenting_with_heavy_makeup_under_my_eyes_how/j6gjiqs/
224,j6jgh62,Crafty-Childhood7871,Could become a signature look.,Could become a signature look.,1,2023-01-30 19:39:34,<praw.models.comment_forest.CommentForest object at 0x0000022EF510F310>,10orw1o,MakeupAddiction,t5_2rww2,,False,False,t3_10orw1o,t3_10orw1o,/r/MakeupAddiction/comments/10orw1o/experimenting_with_heavy_makeup_under_my_eyes_how/j6jgh62/
225,j6go4ik,Any-Manufacturer-795,"Come on now, that's way too much eye makeup, less is more, it's giving raccoon and it should be giving smoky. Black lips don't work in the real world, on anyone. Squeeze the top of your index finger, that's your perfect lip colour.","Come on now, that's way too much eye makeup, less is more, it's giving raccoon and it should be giving smoky. Black lips don't work in the real world, on anyone. Squeeze the top of your index finger, that's your perfect lip colour.",-16,2023-01-30 04:35:34,<praw.models.comment_forest.CommentForest object at 0x0000022EF510F370>,10orw1o,MakeupAddiction,t5_2rww2,,False,False,t3_10orw1o,t3_10orw1o,/r/MakeupAddiction/comments/10orw1o/experimenting_with_heavy_makeup_under_my_eyes_how/j6go4ik/
226,j6hy0vt,lunasusu2u,You do you and don't worry what others think... It really doesn't matter.,You do you and don't worry what others think... It really doesn't matter.,0,2023-01-30 13:39:13,<praw.models.comment_forest.CommentForest object at 0x0000022EF510F3D0>,10orw1o,MakeupAddiction,t5_2rww2,,False,False,t3_10orw1o,t3_10orw1o,/r/MakeupAddiction/comments/10orw1o/experimenting_with_heavy_makeup_under_my_eyes_how/j6hy0vt/
227,j6i09dh,girlonthemoon2020,I think you’re very pretty ☺️,I think you’re very pretty ☺️,-1,2023-01-30 13:57:30,<praw.models.comment_forest.CommentForest object at 0x0000022EF510F610>,10orw1o,MakeupAddiction,t5_2rww2,,False,False,t3_10orw1o,t3_10orw1o,/r/MakeupAddiction/comments/10orw1o/experimenting_with_heavy_makeup_under_my_eyes_how/j6i09dh/
228,j6gxsjy,FrostedFruityPebbles,"It looks great! I love the dark smoky eye look, and what I like to do which is a fun addition is adding a bit of highlighter onto the v corner of your eye nearest your nose with a small brush. It tends to pull the eyes into a pretty shape, and then I run a q-tip under just the very end of my liner and shadow to pull it into a sharp line at the edge. Great look on you, but if the darkness of the shadow scares you I might try to do that elongated version!","It looks great! I love the dark smoky eye look, and what I like to do which is a fun addition is adding a bit of highlighter onto the v corner of your eye nearest your nose with a small brush. It tends to pull the eyes into a pretty shape, and then I run a q-tip under just the very end of my liner and shadow to pull it into a sharp line at the edge. Great look on you, but if the darkness of the shadow scares you I might try to do that elongated version!",-10,2023-01-30 06:11:59,<praw.models.comment_forest.CommentForest object at 0x0000022EF510F850>,10orw1o,MakeupAddiction,t5_2rww2,,False,False,t3_10orw1o,t3_10orw1o,/r/MakeupAddiction/comments/10orw1o/experimenting_with_heavy_makeup_under_my_eyes_how/j6gxsjy/
229,j6i1j79,PierogiesNSourCream,"I think the eye make-up is fun, but it would look sophisticated on a smaller scale.  Maybe more gray shadow and the black area being thinner?  Don't lose your fun vibe by any means!","I think the eye make-up is fun, but it would look sophisticated on a smaller scale.  Maybe more gray shadow and the black area being thinner?  Don't lose your fun vibe by any means!",1,2023-01-30 14:07:44,<praw.models.comment_forest.CommentForest object at 0x0000022EF510F910>,10orw1o,MakeupAddiction,t5_2rww2,,False,False,t3_10orw1o,t3_10orw1o,/r/MakeupAddiction/comments/10orw1o/experimenting_with_heavy_makeup_under_my_eyes_how/j6i1j79/
230,j6ifpub,Opposite-Beat-5243,"Your almost there I feel like. Your eye shape is beautiful and you have great shape to work with. Maybe try a neutral base first then use that to blend out using very little black, build up little by little. I've recently been trying to get back to my goth teen years too. Omg I remember the heavy eye liner😆😆😆","Your almost there I feel like. Your eye shape is beautiful and you have great shape to work with. Maybe try a neutral base first then use that to blend out using very little black, build up little by little. I've recently been trying to get back to my goth teen years too. Omg I remember the heavy eye liner😆😆😆",1,2023-01-30 15:48:49,<praw.models.comment_forest.CommentForest object at 0x0000022EF510FA90>,10orw1o,MakeupAddiction,t5_2rww2,,False,False,t3_10orw1o,t3_10orw1o,/r/MakeupAddiction/comments/10orw1o/experimenting_with_heavy_makeup_under_my_eyes_how/j6ifpub/
231,j6ix77r,Silly_Relative8838,"I would use tape to make a sharp precise edge to the Smokey eye. There are videos on YouTube for this, and you can use regular tape you don’t need to buy cosmetic tapes. I would start with just a little shadow , blend a lot, and add more. Keep it darker near the lash line and blend it out as it moves away from the last line so it gets lighter moving up - it can and will still be a bold look!!! I would use a concealer brush after applying the lipstick and go around the lips with foundation on the concealer brush - it makes a nice clean edge to the lipstick. Definitely fill in the whole brow, plus add tails to the brows - I also don’t have tails on my brows. It allows freedom to do cool shit with your brows and not have the same ones all the time which to me is fun lol. 

For the face , idk if you use primer but it really helps. And later on foundation in THIN layers. Applying more to areas that need more but not over saturating the entire face.  Some well blended contour would be nice too! 

You’re beautiful! Have fun playing with makeup.","I would use tape to make a sharp precise edge to the Smokey eye. There are videos on YouTube for this, and you can use regular tape you don’t need to buy cosmetic tapes. I would start with just a little shadow , blend a lot, and add more. Keep it darker near the lash line and blend it out as it moves away from the last line so it gets lighter moving up - it can and will still be a bold look!!! I would use a concealer brush after applying the lipstick and go around the lips with foundation on the concealer brush - it makes a nice clean edge to the lipstick. Definitely fill in the whole brow, plus add tails to the brows - I also don’t have tails on my brows. It allows freedom to do cool shit with your brows and not have the same ones all the time which to me is fun lol. 

For the face , idk if you use primer but it really helps. And later on foundation in THIN layers. Applying more to areas that need more but not over saturating the entire face.  Some well blended contour would be nice too! 

You’re beautiful! Have fun playing with makeup.",1,2023-01-30 17:40:11,<praw.models.comment_forest.CommentForest object at 0x0000022EF510FB50>,10orw1o,MakeupAddiction,t5_2rww2,,False,False,t3_10orw1o,t3_10orw1o,/r/MakeupAddiction/comments/10orw1o/experimenting_with_heavy_makeup_under_my_eyes_how/j6ix77r/
232,j6kcv5q,Sunnydaynot0107,You have great features!  I would trim the bottom eye liner 1/4 of an inch and bring it in on the sides the same amount.  Use a primer so it doesn’t smudge.  I get why you want to do it so your eyes pop with your glasses on.  The black lipstick is bad and gives off negative energy.  Fill in eye brows a little bit on the sides.  You remind me of a 40’s movie star.,You have great features!  I would trim the bottom eye liner 1/4 of an inch and bring it in on the sides the same amount.  Use a primer so it doesn’t smudge.  I get why you want to do it so your eyes pop with your glasses on.  The black lipstick is bad and gives off negative energy.  Fill in eye brows a little bit on the sides.  You remind me of a 40’s movie star.,1,2023-01-30 23:03:00,<praw.models.comment_forest.CommentForest object at 0x0000022EF510FC10>,10orw1o,MakeupAddiction,t5_2rww2,,False,False,t3_10orw1o,t3_10orw1o,/r/MakeupAddiction/comments/10orw1o/experimenting_with_heavy_makeup_under_my_eyes_how/j6kcv5q/
233,j6hxqkj,peacheskeen1,"I also think the look looks unfinished because of the lack of foundation/concealer (in addition to what you said). I agree this could look great on you but it does have to be all or nothing. Halfway in the middle can sometimes give 15-year-old who just discovered makeup vibes.

I might also recommend updating the glasses! A nice horn rimmed one would look cute on you I think! I think the glasses also take away from the look as-is.","I also think the look looks unfinished because of the lack of foundation/concealer (in addition to what you said). I agree this could look great on you but it does have to be all or nothing. Halfway in the middle can sometimes give 15-year-old who just discovered makeup vibes.

I might also recommend updating the glasses! A nice horn rimmed one would look cute on you I think! I think the glasses also take away from the look as-is.",100,2023-01-30 13:36:49,<praw.models.comment_forest.CommentForest object at 0x0000022EF510AF70>,10orw1o,MakeupAddiction,t5_2rww2,,False,False,t3_10orw1o,t1_j6gqrbl,/r/MakeupAddiction/comments/10orw1o/experimenting_with_heavy_makeup_under_my_eyes_how/j6hxqkj/
234,j6gxaf5,Excellent_Law6906,"I think you're totally right in your other comment, that the soft sweep over one eye is better hair for this.

And I'm glad to see support for a black lip!  I've always loved it.  Foulmouth is actually a weird off-purple... Or is it dark enough to be an off-black?  Maybe I'm splitting hairs.","I think you're totally right in your other comment, that the soft sweep over one eye is better hair for this.

And I'm glad to see support for a black lip!  I've always loved it.  Foulmouth is actually a weird off-purple... Or is it dark enough to be an off-black?  Maybe I'm splitting hairs.",14,2023-01-30 06:06:21,<praw.models.comment_forest.CommentForest object at 0x0000022EF510AFD0>,10orw1o,MakeupAddiction,t5_2rww2,,False,True,t3_10orw1o,t1_j6gqrbl,/r/MakeupAddiction/comments/10orw1o/experimenting_with_heavy_makeup_under_my_eyes_how/j6gxaf5/
235,j6gtpg5,Excellent_Law6906,"I was more wondering if the heavy lower eyeliner totally pulled my face down, but thanks for the tip!  I'm right at the age where people are surprised to hear how old I am (in better lighting for me than this! 😬) so I'm fascinated to know what pushes it one way or the other.

The brows are experimental, too, and got too small as I tried to make sure they were even, you know how that shit goes.  I'm looking forward to finding or making little stencils so I can put hearts or stars or whatever up there.","I was more wondering if the heavy lower eyeliner totally pulled my face down, but thanks for the tip!  I'm right at the age where people are surprised to hear how old I am (in better lighting for me than this! 😬) so I'm fascinated to know what pushes it one way or the other.

The brows are experimental, too, and got too small as I tried to make sure they were even, you know how that shit goes.  I'm looking forward to finding or making little stencils so I can put hearts or stars or whatever up there.",9,2023-01-30 05:28:22,<praw.models.comment_forest.CommentForest object at 0x0000022EF510D130>,10orw1o,MakeupAddiction,t5_2rww2,,False,True,t3_10orw1o,t1_j6gtbd9,/r/MakeupAddiction/comments/10orw1o/experimenting_with_heavy_makeup_under_my_eyes_how/j6gtpg5/
