,ID,Author,body,Comment,Score,Created On,Replies,Submission,Subreddit,Subreddit_ID,Distinguished,Edited,Is_submitter,link_id,Parent_id,Permalink
0,j72zt7n,3MeerkatsInACoat,It’s supposed to be a dupe of a Nars lipstick so maybe that’s how they’re hinting at it? Since Nars is known for… well… marketing like this.,It’s supposed to be a dupe of a Nars lipstick so maybe that’s how they’re hinting at it? Since Nars is known for… well… marketing like this.,521,2023-02-03 18:27:36,<praw.models.comment_forest.CommentForest object at 0x0000022EF3B02E20>,10sppm1,MakeupAddiction,t5_2rww2,,False,False,t3_10sppm1,t3_10sppm1,/r/MakeupAddiction/comments/10sppm1/what_in_the_f_elf/j72zt7n/
1,j731gxn,sirhollandaise,$9.00 for Elf lipstick was the most shocking part of this for me. Those prices are climbing.,$9.00 for Elf lipstick was the most shocking part of this for me. Those prices are climbing.,136,2023-02-03 18:38:10,<praw.models.comment_forest.CommentForest object at 0x0000022EF3B02E50>,10sppm1,MakeupAddiction,t5_2rww2,,False,False,t3_10sppm1,t3_10sppm1,/r/MakeupAddiction/comments/10sppm1/what_in_the_f_elf/j731gxn/
2,j75ji65,girlwthegreenscarf,The real crime here is $9 for Elf,The real crime here is $9 for Elf,114,2023-02-04 05:49:17,<praw.models.comment_forest.CommentForest object at 0x0000022EF3B10AC0>,10sppm1,MakeupAddiction,t5_2rww2,,False,False,t3_10sppm1,t3_10sppm1,/r/MakeupAddiction/comments/10sppm1/what_in_the_f_elf/j75ji65/
3,j731y7f,mariemarymaria,"https://preview.redd.it/mn06xmij82ga1.png?width=863&format=pjpg&auto=webp&s=9580c1e73c8108e90f666f49ed68406a7e2bd642

Gee I wonder what the shade colors are named 🙄

ETA: added shade list... Not as bad as I thought. I'll take this over NYX ""cottage cheese"" eye shadow stick","https://preview.redd.it/mn06xmij82ga1.png?width=863&format=pjpg&auto=webp&s=9580c1e73c8108e90f666f49ed68406a7e2bd642

Gee I wonder what the shade colors are named 🙄

ETA: added shade list... Not as bad as I thought. I'll take this over NYX ""cottage cheese"" eye shadow stick",199,2023-02-03 18:41:13,<praw.models.comment_forest.CommentForest object at 0x0000022EEC435640>,10sppm1,MakeupAddiction,t5_2rww2,,False,False,t3_10sppm1,t3_10sppm1,/r/MakeupAddiction/comments/10sppm1/what_in_the_f_elf/j731y7f/
4,j73m5mj,mumboitaliano,"I’m not even remotely a prude, but messaging like this in makeup (regardless of brand or price point) makes me roll my eyes.

It honestly feels sort of dated? Like this would be a campaign Mel Gibson’s character came up with in What Women Want","I’m not even remotely a prude, but messaging like this in makeup (regardless of brand or price point) makes me roll my eyes.

It honestly feels sort of dated? Like this would be a campaign Mel Gibson’s character came up with in What Women Want",256,2023-02-03 20:49:20,<praw.models.comment_forest.CommentForest object at 0x0000022EEC435550>,10sppm1,MakeupAddiction,t5_2rww2,,False,False,t3_10sppm1,t3_10sppm1,/r/MakeupAddiction/comments/10sppm1/what_in_the_f_elf/j73m5mj/
5,j74805f,lightblackmagicwoman,Maybe I’m a bit desensitized but this isn’t even the worst I’ve seen anymore,Maybe I’m a bit desensitized but this isn’t even the worst I’ve seen anymore,117,2023-02-03 23:14:56,<praw.models.comment_forest.CommentForest object at 0x0000022EEC3D5A60>,10sppm1,MakeupAddiction,t5_2rww2,,False,False,t3_10sppm1,t3_10sppm1,/r/MakeupAddiction/comments/10sppm1/what_in_the_f_elf/j74805f/
6,j752qsh,secretarriettea,\*laughs in Nars orgasm blush\*,\*laughs in Nars orgasm blush\*,54,2023-02-04 03:11:32,<praw.models.comment_forest.CommentForest object at 0x0000022EEC3D5A30>,10sppm1,MakeupAddiction,t5_2rww2,,False,False,t3_10sppm1,t3_10sppm1,/r/MakeupAddiction/comments/10sppm1/what_in_the_f_elf/j752qsh/
7,j742tbs,Grouchy_Pirate2724,Too Faced Better Than Sex mascara is in all the young girls makeup bags already.,Too Faced Better Than Sex mascara is in all the young girls makeup bags already.,107,2023-02-03 22:38:45,<praw.models.comment_forest.CommentForest object at 0x0000022EEC3D5730>,10sppm1,MakeupAddiction,t5_2rww2,,False,False,t3_10sppm1,t3_10sppm1,/r/MakeupAddiction/comments/10sppm1/what_in_the_f_elf/j742tbs/
8,j72ws3u,KestrelGirl,"You know, I don't like this stuff either, but you should see the product names from places like Urban Decay and NARS. It's *all* like that.","You know, I don't like this stuff either, but you should see the product names from places like Urban Decay and NARS. It's *all* like that.",52,2023-02-03 18:08:22,<praw.models.comment_forest.CommentForest object at 0x0000022EEC3D5670>,10sppm1,MakeupAddiction,t5_2rww2,,False,False,t3_10sppm1,t3_10sppm1,/r/MakeupAddiction/comments/10sppm1/what_in_the_f_elf/j72ws3u/
9,j78hf06,celolex,"I love hyper-sexualized makeup names! They’re just what you want to casually drop in conversations with coworkers and acquaintances:

“Oooh, your lipgloss is so pretty! What is it?”

“Thanks, it’s anilingus brown from the Too Faced throatfuck line ☺️”","I love hyper-sexualized makeup names! They’re just what you want to casually drop in conversations with coworkers and acquaintances:

“Oooh, your lipgloss is so pretty! What is it?”

“Thanks, it’s anilingus brown from the Too Faced throatfuck line ☺️”",34,2023-02-04 21:55:49,<praw.models.comment_forest.CommentForest object at 0x0000022EF3B124C0>,10sppm1,MakeupAddiction,t5_2rww2,,False,False,t3_10sppm1,t3_10sppm1,/r/MakeupAddiction/comments/10sppm1/what_in_the_f_elf/j78hf06/
10,j730rdn,jenny-thatsnotmyname,"I get what you’re saying and I’m a prude myself so most of these kind of makes make me mildly uncomfortable, but as a grown ass woman, 75% of my excessive collection is drugstore, so it’s not just aimed at girls and young women. Grown ass people shop there too.

Edited to correct myself to say grown ass people, not just women.","I get what you’re saying and I’m a prude myself so most of these kind of makes make me mildly uncomfortable, but as a grown ass woman, 75% of my excessive collection is drugstore, so it’s not just aimed at girls and young women. Grown ass people shop there too.

Edited to correct myself to say grown ass people, not just women.",107,2023-02-03 18:33:41,<praw.models.comment_forest.CommentForest object at 0x0000022EF3B21340>,10sppm1,MakeupAddiction,t5_2rww2,,False,False,t3_10sppm1,t3_10sppm1,/r/MakeupAddiction/comments/10sppm1/what_in_the_f_elf/j730rdn/
11,j774uif,ApplesaucePenguin75,I’m sick of acting like sex is the only thing. Boring. Come up with a new way to sell stuff.  We’re worth more than this.,I’m sick of acting like sex is the only thing. Boring. Come up with a new way to sell stuff.  We’re worth more than this.,20,2023-02-04 16:20:40,<praw.models.comment_forest.CommentForest object at 0x0000022EF3B18430>,10sppm1,MakeupAddiction,t5_2rww2,,False,False,t3_10sppm1,t3_10sppm1,/r/MakeupAddiction/comments/10sppm1/what_in_the_f_elf/j774uif/
12,j756y53,nekocorps3,why y’all mad 😭,why y’all mad 😭,52,2023-02-04 03:48:23,<praw.models.comment_forest.CommentForest object at 0x0000022EF3B2C100>,10sppm1,MakeupAddiction,t5_2rww2,,False,False,t3_10sppm1,t3_10sppm1,/r/MakeupAddiction/comments/10sppm1/what_in_the_f_elf/j756y53/
13,j73u6ta,,Omg SEX?! Hold my pearls!,Omg SEX?! Hold my pearls!,167,2023-02-03 21:41:00,<praw.models.comment_forest.CommentForest object at 0x0000022EF3B2CB50>,10sppm1,MakeupAddiction,t5_2rww2,,False,False,t3_10sppm1,t3_10sppm1,/r/MakeupAddiction/comments/10sppm1/what_in_the_f_elf/j73u6ta/
14,j73dml5,,I don’t see anything wrong with the marketing language at all. 🤷‍♀️,I don’t see anything wrong with the marketing language at all. 🤷‍♀️,57,2023-02-03 19:55:11,<praw.models.comment_forest.CommentForest object at 0x0000022EF3B33340>,10sppm1,MakeupAddiction,t5_2rww2,,False,False,t3_10sppm1,t3_10sppm1,/r/MakeupAddiction/comments/10sppm1/what_in_the_f_elf/j73dml5/
15,j76h1np,,"It feels like lazy advertising at this point. 25 years ago, this would have been great.","It feels like lazy advertising at this point. 25 years ago, this would have been great.",14,2023-02-04 13:14:22,<praw.models.comment_forest.CommentForest object at 0x0000022EF3B519A0>,10sppm1,MakeupAddiction,t5_2rww2,,False,False,t3_10sppm1,t3_10sppm1,/r/MakeupAddiction/comments/10sppm1/what_in_the_f_elf/j76h1np/
16,j74u4fr,courtarchive,who cares,who cares,39,2023-02-04 02:01:19,<praw.models.comment_forest.CommentForest object at 0x0000022EF3B51C10>,10sppm1,MakeupAddiction,t5_2rww2,,False,False,t3_10sppm1,t3_10sppm1,/r/MakeupAddiction/comments/10sppm1/what_in_the_f_elf/j74u4fr/
17,j7avc7g,StayCee35,"Just chiming in to say that people of all ages buy ELF and other drug store brands, and cheeky names and products aren't reserved for people who can drop $32 on orgasm blush. Your pearl clutching is prudish and classist. I wish my biggest problem in life was a marketing strategy that's been around since pretty much the advent of cosmetics.","Just chiming in to say that people of all ages buy ELF and other drug store brands, and cheeky names and products aren't reserved for people who can drop $32 on orgasm blush. Your pearl clutching is prudish and classist. I wish my biggest problem in life was a marketing strategy that's been around since pretty much the advent of cosmetics.",12,2023-02-05 12:29:53,<praw.models.comment_forest.CommentForest object at 0x0000022EF3B51FD0>,10sppm1,MakeupAddiction,t5_2rww2,,False,False,t3_10sppm1,t3_10sppm1,/r/MakeupAddiction/comments/10sppm1/what_in_the_f_elf/j7avc7g/
18,j742hkm,SushiKabab11,"I worked at a Mecca that sells brands like TooFaced and Nars and they used a lot of sexualising language and honestly I've never had an issue. I talk to the customers about it and use the name and if you're not being like 'hehe sex' no one cares, it's Make-up, who cares what it's called when it's on your face, tell people what it's called, no one will give a shit unless you're acting weird about it.","I worked at a Mecca that sells brands like TooFaced and Nars and they used a lot of sexualising language and honestly I've never had an issue. I talk to the customers about it and use the name and if you're not being like 'hehe sex' no one cares, it's Make-up, who cares what it's called when it's on your face, tell people what it's called, no one will give a shit unless you're acting weird about it.",19,2023-02-03 22:36:32,<praw.models.comment_forest.CommentForest object at 0x0000022EF3B49220>,10sppm1,MakeupAddiction,t5_2rww2,,False,False,t3_10sppm1,t3_10sppm1,/r/MakeupAddiction/comments/10sppm1/what_in_the_f_elf/j742hkm/
19,j74hc9c,Confident-Ad-2706,A lot of the elf products are so good. The putty primers are in my opinion just as good as the tatcha one. I love their setting spray. Also their Blush and bronzer duo is the best I've used and I've used so so many brands.,A lot of the elf products are so good. The putty primers are in my opinion just as good as the tatcha one. I love their setting spray. Also their Blush and bronzer duo is the best I've used and I've used so so many brands.,9,2023-02-04 00:21:54,<praw.models.comment_forest.CommentForest object at 0x0000022EF3B49340>,10sppm1,MakeupAddiction,t5_2rww2,,False,False,t3_10sppm1,t3_10sppm1,/r/MakeupAddiction/comments/10sppm1/what_in_the_f_elf/j74hc9c/
20,j79cdgx,,I think it’s tacky but “inexcusably inappropriate” is a little silly,I think it’s tacky but “inexcusably inappropriate” is a little silly,7,2023-02-05 01:57:00,<praw.models.comment_forest.CommentForest object at 0x0000022EF3B49550>,10sppm1,MakeupAddiction,t5_2rww2,,False,False,t3_10sppm1,t3_10sppm1,/r/MakeupAddiction/comments/10sppm1/what_in_the_f_elf/j79cdgx/
21,j734v55,,Lol you’ve never seen Too Faced products have you,Lol you’ve never seen Too Faced products have you,46,2023-02-03 18:59:41,<praw.models.comment_forest.CommentForest object at 0x0000022EF3B49520>,10sppm1,MakeupAddiction,t5_2rww2,,False,False,t3_10sppm1,t3_10sppm1,/r/MakeupAddiction/comments/10sppm1/what_in_the_f_elf/j734v55/
22,j747sox,PauI_MuadDib,"Well, at least it's not that $95 penis shaped lipstick.  

https://www.reddit.com/r/BeautyGuruChatter/comments/10ryrsr/isamayas_latest_drop_is_interestingly_shaped/","Well, at least it's not that $95 penis shaped lipstick.  

https://www.reddit.com/r/BeautyGuruChatter/comments/10ryrsr/isamayas_latest_drop_is_interestingly_shaped/",16,2023-02-03 23:13:27,<praw.models.comment_forest.CommentForest object at 0x0000022EF3B49D90>,10sppm1,MakeupAddiction,t5_2rww2,,False,False,t3_10sppm1,t3_10sppm1,/r/MakeupAddiction/comments/10sppm1/what_in_the_f_elf/j747sox/
23,j75sfxv,,[deleted],[deleted],8,2023-02-04 07:41:46,<praw.models.comment_forest.CommentForest object at 0x0000022EF3B68670>,10sppm1,MakeupAddiction,t5_2rww2,,False,False,t3_10sppm1,t3_10sppm1,/r/MakeupAddiction/comments/10sppm1/what_in_the_f_elf/j75sfxv/
24,j74p0ss,nochnoyvangogh,I watched an actual review from an expert and it's worth its price on the material it's made of and not that much on the colour,I watched an actual review from an expert and it's worth its price on the material it's made of and not that much on the colour,7,2023-02-04 01:21:10,<praw.models.comment_forest.CommentForest object at 0x0000022EF3B68CA0>,10sppm1,MakeupAddiction,t5_2rww2,,False,False,t3_10sppm1,t3_10sppm1,/r/MakeupAddiction/comments/10sppm1/what_in_the_f_elf/j74p0ss/
25,j77u7ta,yamyambaby,I’ll take this over deep throat,I’ll take this over deep throat,6,2023-02-04 19:10:18,<praw.models.comment_forest.CommentForest object at 0x0000022EF3B68310>,10sppm1,MakeupAddiction,t5_2rww2,,False,False,t3_10sppm1,t3_10sppm1,/r/MakeupAddiction/comments/10sppm1/what_in_the_f_elf/j77u7ta/
26,j77uv4k,anneanamouse,"Wait until OP sees the phallic lipsticks that just Isamay just released 😂🍆 

I don’t really care about sex in marketing. I’m more annoyed by a lack of inclusivity, false advertising, and marketing that preys on/cultivates insecurities.","Wait until OP sees the phallic lipsticks that just Isamay just released 😂🍆 

I don’t really care about sex in marketing. I’m more annoyed by a lack of inclusivity, false advertising, and marketing that preys on/cultivates insecurities.",5,2023-02-04 19:14:55,<praw.models.comment_forest.CommentForest object at 0x0000022EF3B31130>,10sppm1,MakeupAddiction,t5_2rww2,,False,False,t3_10sppm1,t3_10sppm1,/r/MakeupAddiction/comments/10sppm1/what_in_the_f_elf/j77uv4k/
27,j75edoq,OnlyPopcorn,It's annoying as fuck.  It's like a teenager with too much energy acting stupid.,It's annoying as fuck.  It's like a teenager with too much energy acting stupid.,15,2023-02-04 04:54:06,<praw.models.comment_forest.CommentForest object at 0x0000022EF3B31970>,10sppm1,MakeupAddiction,t5_2rww2,,False,False,t3_10sppm1,t3_10sppm1,/r/MakeupAddiction/comments/10sppm1/what_in_the_f_elf/j75edoq/
28,j7ayvwe,isabella_sunrise,I honestly don’t think sex is shameful so this doesn’t bother me.,I honestly don’t think sex is shameful so this doesn’t bother me.,4,2023-02-05 13:09:43,<praw.models.comment_forest.CommentForest object at 0x0000022EF3B31A30>,10sppm1,MakeupAddiction,t5_2rww2,,False,False,t3_10sppm1,t3_10sppm1,/r/MakeupAddiction/comments/10sppm1/what_in_the_f_elf/j7ayvwe/
29,j7dgxl1,speaknowow,"theres a simple solution to this, if you don’t like it then don’t buy it and move on.","theres a simple solution to this, if you don’t like it then don’t buy it and move on.",6,2023-02-05 23:58:13,<praw.models.comment_forest.CommentForest object at 0x0000022EF3B31AF0>,10sppm1,MakeupAddiction,t5_2rww2,,False,False,t3_10sppm1,t3_10sppm1,/r/MakeupAddiction/comments/10sppm1/what_in_the_f_elf/j7dgxl1/
30,j7505o1,143queen,You're being waaaaay overdramatic. May I suggest clutching your pearls while you wait to speak with the manager?,You're being waaaaay overdramatic. May I suggest clutching your pearls while you wait to speak with the manager?,36,2023-02-04 02:50:10,<praw.models.comment_forest.CommentForest object at 0x0000022EF3B317C0>,10sppm1,MakeupAddiction,t5_2rww2,,False,False,t3_10sppm1,t3_10sppm1,/r/MakeupAddiction/comments/10sppm1/what_in_the_f_elf/j7505o1/
31,j79ph05,sleepygirrrl,I get where your coming from but i’m pretty sure the girls that get the references are already having sex lol. And women need someone advocating for them to have orgasms honestly because it’s still not the norm!,I get where your coming from but i’m pretty sure the girls that get the references are already having sex lol. And women need someone advocating for them to have orgasms honestly because it’s still not the norm!,2,2023-02-05 03:49:21,<praw.models.comment_forest.CommentForest object at 0x0000022EF3B78550>,10sppm1,MakeupAddiction,t5_2rww2,,False,False,t3_10sppm1,t3_10sppm1,/r/MakeupAddiction/comments/10sppm1/what_in_the_f_elf/j79ph05/
32,j7bztew,DankPeachees,What’s the problem?,What’s the problem?,6,2023-02-05 17:51:29,<praw.models.comment_forest.CommentForest object at 0x0000022EF3B78310>,10sppm1,MakeupAddiction,t5_2rww2,,False,False,t3_10sppm1,t3_10sppm1,/r/MakeupAddiction/comments/10sppm1/what_in_the_f_elf/j7bztew/
33,j738lfq,WhiningforWine,I saw this lipstick at the store this week and the name of it made me feel empowered. Plus they have a shade I’ve been trying to find for three years. To each their own 🤷🏼‍♀️,I saw this lipstick at the store this week and the name of it made me feel empowered. Plus they have a shade I’ve been trying to find for three years. To each their own 🤷🏼‍♀️,21,2023-02-03 19:23:18,<praw.models.comment_forest.CommentForest object at 0x0000022EF3B58580>,10sppm1,MakeupAddiction,t5_2rww2,,False,False,t3_10sppm1,t3_10sppm1,/r/MakeupAddiction/comments/10sppm1/what_in_the_f_elf/j738lfq/
34,j731lg1,Interesting-Dog-2448,"I'm pretty young and this creeps me out, so I wouldn't say you're being a prude. I feel like too much of advertisements are sexualized, it's really tiring to see everywhere. I'm tired of the ''sex sells,'' adverts. Young girls should not be sexualized, etc. I feel like the sexualized adverts are being targeted towards younger and younger people as time goes on. Being a woman should not be defaulted to being sexualized, it feels really gross to have women in advertisements mostly portrayed like this.","I'm pretty young and this creeps me out, so I wouldn't say you're being a prude. I feel like too much of advertisements are sexualized, it's really tiring to see everywhere. I'm tired of the ''sex sells,'' adverts. Young girls should not be sexualized, etc. I feel like the sexualized adverts are being targeted towards younger and younger people as time goes on. Being a woman should not be defaulted to being sexualized, it feels really gross to have women in advertisements mostly portrayed like this.",10,2023-02-03 18:38:58,<praw.models.comment_forest.CommentForest object at 0x0000022EF3B58550>,10sppm1,MakeupAddiction,t5_2rww2,,1675449803.0,False,t3_10sppm1,t3_10sppm1,/r/MakeupAddiction/comments/10sppm1/what_in_the_f_elf/j731lg1/
35,j77nvyy,Chiara706,It really is a good lipstick tho 🤷🏻‍♀️,It really is a good lipstick tho 🤷🏻‍♀️,3,2023-02-04 18:27:13,<praw.models.comment_forest.CommentForest object at 0x0000022EF3B58D30>,10sppm1,MakeupAddiction,t5_2rww2,,False,False,t3_10sppm1,t3_10sppm1,/r/MakeupAddiction/comments/10sppm1/what_in_the_f_elf/j77nvyy/
36,j79hmdp,Astickintheboo,"To be fair a lot of makeup is named after and marketed with pretty crude language. I never understood why, and I don’t think anyone really wants it.","To be fair a lot of makeup is named after and marketed with pretty crude language. I never understood why, and I don’t think anyone really wants it.",3,2023-02-05 02:40:33,<praw.models.comment_forest.CommentForest object at 0x0000022EF3B61640>,10sppm1,MakeupAddiction,t5_2rww2,,False,False,t3_10sppm1,t3_10sppm1,/r/MakeupAddiction/comments/10sppm1/what_in_the_f_elf/j79hmdp/
37,j7aor6f,fabderpyturtle,elf is not the first makeup brand to sexualize makeup products. nars has before but im not sure if they were the first,elf is not the first makeup brand to sexualize makeup products. nars has before but im not sure if they were the first,3,2023-02-05 11:01:55,<praw.models.comment_forest.CommentForest object at 0x0000022EF3B61EB0>,10sppm1,MakeupAddiction,t5_2rww2,,False,False,t3_10sppm1,t3_10sppm1,/r/MakeupAddiction/comments/10sppm1/what_in_the_f_elf/j7aor6f/
38,j765li2,,"Sure a little distasteful if you really care about things like that, but I don’t know if it’s something to be outraged about 😂

Just don’t buy the lipstick or block the ad 🤷🏻‍♀️","Sure a little distasteful if you really care about things like that, but I don’t know if it’s something to be outraged about 😂

Just don’t buy the lipstick or block the ad 🤷🏻‍♀️",8,2023-02-04 10:52:15,<praw.models.comment_forest.CommentForest object at 0x0000022EF3B712E0>,10sppm1,MakeupAddiction,t5_2rww2,,False,False,t3_10sppm1,t3_10sppm1,/r/MakeupAddiction/comments/10sppm1/what_in_the_f_elf/j765li2/
39,j758lpb,princessalyss_,"I mean, there was a literal dick and balls lipstick for $95 posted a day or so ago. NARS has their whole thing. This is nothing.","I mean, there was a literal dick and balls lipstick for $95 posted a day or so ago. NARS has their whole thing. This is nothing.",4,2023-02-04 04:03:30,<praw.models.comment_forest.CommentForest object at 0x0000022EF3B719D0>,10sppm1,MakeupAddiction,t5_2rww2,,False,False,t3_10sppm1,t3_10sppm1,/r/MakeupAddiction/comments/10sppm1/what_in_the_f_elf/j758lpb/
40,j75eo9w,Alarming-Woodpecker9,For me it’s because it’s weird coming from elf. Love their products but they don’t need to be doing all that now,For me it’s because it’s weird coming from elf. Love their products but they don’t need to be doing all that now,3,2023-02-04 04:57:05,<praw.models.comment_forest.CommentForest object at 0x0000022EF3B71070>,10sppm1,MakeupAddiction,t5_2rww2,,False,False,t3_10sppm1,t3_10sppm1,/r/MakeupAddiction/comments/10sppm1/what_in_the_f_elf/j75eo9w/
41,j75zwnw,lakeslikeoceans,"Idk why all these makeup companies like equating makeup and sex. Like I can’t really think of a worse time to be wearing makeup tbh, it would get all over everything and ruin the sheets. I much prefer the high end ads of people going out to events and showing off different looks/attitudes you can create with the products, or the drugstore products that are aimed at the professional makeup artist clients that can also be sold to regular people so that they can get the same professional results. I think those are really easy demographics to target, so I really don’t understand brands like NARS and this Elf line.","Idk why all these makeup companies like equating makeup and sex. Like I can’t really think of a worse time to be wearing makeup tbh, it would get all over everything and ruin the sheets. I much prefer the high end ads of people going out to events and showing off different looks/attitudes you can create with the products, or the drugstore products that are aimed at the professional makeup artist clients that can also be sold to regular people so that they can get the same professional results. I think those are really easy demographics to target, so I really don’t understand brands like NARS and this Elf line.",5,2023-02-04 09:28:34,<praw.models.comment_forest.CommentForest object at 0x0000022EF3B71B20>,10sppm1,MakeupAddiction,t5_2rww2,,False,False,t3_10sppm1,t3_10sppm1,/r/MakeupAddiction/comments/10sppm1/what_in_the_f_elf/j75zwnw/
42,j76ote2,macaron1113,"There is nothing wrong with this, it can make women feel sexy 🤷🏼‍♀️","There is nothing wrong with this, it can make women feel sexy 🤷🏼‍♀️",4,2023-02-04 14:24:03,<praw.models.comment_forest.CommentForest object at 0x0000022EF3B71D00>,10sppm1,MakeupAddiction,t5_2rww2,,False,False,t3_10sppm1,t3_10sppm1,/r/MakeupAddiction/comments/10sppm1/what_in_the_f_elf/j76ote2/
43,j75q43p,Trivialfrou,Honestly if feels even tackier right before Valentine’s Day,Honestly if feels even tackier right before Valentine’s Day,7,2023-02-04 07:10:21,<praw.models.comment_forest.CommentForest object at 0x0000022EF3B713A0>,10sppm1,MakeupAddiction,t5_2rww2,,False,False,t3_10sppm1,t3_10sppm1,/r/MakeupAddiction/comments/10sppm1/what_in_the_f_elf/j75q43p/
44,j74q2fu,GiffyGinger,Have you never heard of Nars’s makeup shade names? Or Kat Von D pre KVD era? It was weird for me at first. But you get used to it 🤷🏻‍♀️,Have you never heard of Nars’s makeup shade names? Or Kat Von D pre KVD era? It was weird for me at first. But you get used to it 🤷🏻‍♀️,5,2023-02-04 01:29:30,<praw.models.comment_forest.CommentForest object at 0x0000022EF3B87280>,10sppm1,MakeupAddiction,t5_2rww2,,False,False,t3_10sppm1,t3_10sppm1,/r/MakeupAddiction/comments/10sppm1/what_in_the_f_elf/j74q2fu/
