,ID,Author,body,Comment,Score,Created On,Replies,Submission,Subreddit,Subreddit_ID,Distinguished,Edited,Is_submitter,link_id,Parent_id,Permalink
557,jpa80ba,dumbbitchWAP,"I saw in another comment that you were going for a “simple grunge” look! A couple of things I would change / add: 1) I wouldn’t make the line the same thickness throughout; I would make the line towards your tear duct / inner corner a smidge thinner and let it get thicker as you get closer towards the end. 2) I would add a thin liner on your bottom lash area that connects the the wing, and smudge it a little bit with some black eyeshadow. That way it’s not a clean cut line and it looks a little messy (on purpose). I think you did a good job, don’t be too hard on yourself and do whatever you want!","I saw in another comment that you were going for a “simple grunge” look! A couple of things I would change / add: 1) I wouldn’t make the line the same thickness throughout; I would make the line towards your tear duct / inner corner a smidge thinner and let it get thicker as you get closer towards the end. 2) I would add a thin liner on your bottom lash area that connects the the wing, and smudge it a little bit with some black eyeshadow. That way it’s not a clean cut line and it looks a little messy (on purpose). I think you did a good job, don’t be too hard on yourself and do whatever you want!",1,2023-06-23 22:58:40,<praw.models.comment_forest.CommentForest object at 0x0000022EF51A0EB0>,14ha8pp,MakeupAddiction,t5_2rww2,,False,False,t3_14ha8pp,t3_14ha8pp,/r/MakeupAddiction/comments/14ha8pp/be_honest_does_my_eyeliner_look_good/jpa80ba/
558,jpaaqm6,MochaSublime,"You could do it however you feel comfortable it's not bad keep playing with it, thin out the line maybe clean up the wing with concealer or foundation but it's good","You could do it however you feel comfortable it's not bad keep playing with it, thin out the line maybe clean up the wing with concealer or foundation but it's good",1,2023-06-23 23:20:12,<praw.models.comment_forest.CommentForest object at 0x0000022EF51A0F10>,14ha8pp,MakeupAddiction,t5_2rww2,,False,False,t3_14ha8pp,t3_14ha8pp,/r/MakeupAddiction/comments/14ha8pp/be_honest_does_my_eyeliner_look_good/jpaaqm6/
559,jpam3es,gimmetheteanow,You have a little gap on the upper lash line and maybe if you went a tad thinner on the upper lid…but I’m obsessed with the shape so pretty and it looks great either way!! + your eyes are absolutely gorgeous!! 🩷,You have a little gap on the upper lash line and maybe if you went a tad thinner on the upper lid…but I’m obsessed with the shape so pretty and it looks great either way!! + your eyes are absolutely gorgeous!! 🩷,1,2023-06-24 00:52:42,<praw.models.comment_forest.CommentForest object at 0x0000022EF51A0F70>,14ha8pp,MakeupAddiction,t5_2rww2,,False,False,t3_14ha8pp,t3_14ha8pp,/r/MakeupAddiction/comments/14ha8pp/be_honest_does_my_eyeliner_look_good/jpam3es/
560,jpaspu3,Own_Fun503,"maybe if you do another line next to the eyelashes, it would have a better finish, but it's not bad ✨","maybe if you do another line next to the eyelashes, it would have a better finish, but it's not bad ✨",1,2023-06-24 01:49:34,<praw.models.comment_forest.CommentForest object at 0x0000022EF51A0FD0>,14ha8pp,MakeupAddiction,t5_2rww2,,False,False,t3_14ha8pp,t3_14ha8pp,/r/MakeupAddiction/comments/14ha8pp/be_honest_does_my_eyeliner_look_good/jpaspu3/
561,jpcad0v,Kriegsmachine81,"It depends what you are after.
In my opinion: no.

What I would try: bring the liner further down to the lashes - with lining under the lashes. 
Experiment with black eyeshadow kinda softening a thinner (but still thick) liner. 

This stuff doesn’ t work on me due to hooded lids, but I have seen some tutorials where it looks great. If that technique looks off, then try just a thicker cateye like half of what you have now.

Try using things like tape, or cleansing the lines with a cotton bud (with primer on, not makeup remover) and concealer.","It depends what you are after.
In my opinion: no.

What I would try: bring the liner further down to the lashes - with lining under the lashes. 
Experiment with black eyeshadow kinda softening a thinner (but still thick) liner. 

This stuff doesn’ t work on me due to hooded lids, but I have seen some tutorials where it looks great. If that technique looks off, then try just a thicker cateye like half of what you have now.

Try using things like tape, or cleansing the lines with a cotton bud (with primer on, not makeup remover) and concealer.",1,2023-06-24 12:21:02,<praw.models.comment_forest.CommentForest object at 0x0000022EF51A4070>,14ha8pp,MakeupAddiction,t5_2rww2,,False,False,t3_14ha8pp,t3_14ha8pp,/r/MakeupAddiction/comments/14ha8pp/be_honest_does_my_eyeliner_look_good/jpcad0v/
562,jpcjfun,cancerianangel,no. it's covering your whole eyelid yet theres a very apparent gap between your lashline and the makeup. maybe smoke it out with a shadow and fill in the gap.,no. it's covering your whole eyelid yet theres a very apparent gap between your lashline and the makeup. maybe smoke it out with a shadow and fill in the gap.,1,2023-06-24 13:46:09,<praw.models.comment_forest.CommentForest object at 0x0000022EF51A40D0>,14ha8pp,MakeupAddiction,t5_2rww2,,False,False,t3_14ha8pp,t3_14ha8pp,/r/MakeupAddiction/comments/14ha8pp/be_honest_does_my_eyeliner_look_good/jpcjfun/
563,jpcm9dt,Forsaken_Box_94,stick it in the upper waterline as well and you're good to go,stick it in the upper waterline as well and you're good to go,1,2023-06-24 14:09:49,<praw.models.comment_forest.CommentForest object at 0x0000022EF51A4130>,14ha8pp,MakeupAddiction,t5_2rww2,,False,False,t3_14ha8pp,t3_14ha8pp,/r/MakeupAddiction/comments/14ha8pp/be_honest_does_my_eyeliner_look_good/jpcm9dt/
564,jpcyckz,AbsolutelyAstray,"You kind of missed the main part where liner is intended to go - the lash line. This looks more like a liner-as-shadow look than actual liner, since you didn't line the lash line. Not sure if that's intentional","You kind of missed the main part where liner is intended to go - the lash line. This looks more like a liner-as-shadow look than actual liner, since you didn't line the lash line. Not sure if that's intentional",1,2023-06-24 15:44:12,<praw.models.comment_forest.CommentForest object at 0x0000022EF51A4190>,14ha8pp,MakeupAddiction,t5_2rww2,,False,False,t3_14ha8pp,t3_14ha8pp,/r/MakeupAddiction/comments/14ha8pp/be_honest_does_my_eyeliner_look_good/jpcyckz/
565,jpd0no9,kittycdr,"I think if you're going for a look this heavy, you should add that to others parts of your makeup too (like your brows, a lip, your base, etc.) 

Of course what you do specifically will depend on what kind of thing you're going for (grunge might call for a more natural bushy brow than a gothic look, for example), but I think if you add heavy components to the rest of your makeup, it'll look good!

Again, place your liner closer to your lashes, maybe add liner to your upper waterline too!","I think if you're going for a look this heavy, you should add that to others parts of your makeup too (like your brows, a lip, your base, etc.) 

Of course what you do specifically will depend on what kind of thing you're going for (grunge might call for a more natural bushy brow than a gothic look, for example), but I think if you add heavy components to the rest of your makeup, it'll look good!

Again, place your liner closer to your lashes, maybe add liner to your upper waterline too!",1,2023-06-24 16:01:13,<praw.models.comment_forest.CommentForest object at 0x0000022EF51A41F0>,14ha8pp,MakeupAddiction,t5_2rww2,,False,False,t3_14ha8pp,t3_14ha8pp,/r/MakeupAddiction/comments/14ha8pp/be_honest_does_my_eyeliner_look_good/jpd0no9/
566,jpd6t5m,First_Play5335,you have hooded eyes (I do too) so it looks like eyeshadow as opposed to liner. I agree with the closer to the lash line comments.,you have hooded eyes (I do too) so it looks like eyeshadow as opposed to liner. I agree with the closer to the lash line comments.,1,2023-06-24 16:46:37,<praw.models.comment_forest.CommentForest object at 0x0000022EF51A4250>,14ha8pp,MakeupAddiction,t5_2rww2,,False,False,t3_14ha8pp,t3_14ha8pp,/r/MakeupAddiction/comments/14ha8pp/be_honest_does_my_eyeliner_look_good/jpd6t5m/
567,jpdfk0b,Adela_Arceo,"It looks like you have semi-hooded eyes like me. Start from the edge and go inward, and make sure your pencil is sharpened so you can get a nice clean thin line. Otherwise when you look up and then down you’ll have black in your crease lol.","It looks like you have semi-hooded eyes like me. Start from the edge and go inward, and make sure your pencil is sharpened so you can get a nice clean thin line. Otherwise when you look up and then down you’ll have black in your crease lol.",1,2023-06-24 17:51:08,<praw.models.comment_forest.CommentForest object at 0x0000022EF51A42B0>,14ha8pp,MakeupAddiction,t5_2rww2,,False,False,t3_14ha8pp,t3_14ha8pp,/r/MakeupAddiction/comments/14ha8pp/be_honest_does_my_eyeliner_look_good/jpdfk0b/
568,jpe3x1z,5x5LemonLimeSlime,"Only 2 things with an optional 3rd I have to say for improvement because you’re doing good so far. Get your lash line, even if you have to go in from underneath the lashes to draw on the lash line like I do, it will do you a lot of improvement. I also noticed that the top part dips abit and then swooshes up. Usually I draw cat eyes as almost an extension of the bottom lid if that makes sense? Like the angle of the bottom part of the eye. The third bit is simply, play around with smudging instead of just painting it on thick. You can be grunge with thin or thick makeup it just depends on your preferences.

Have fun and remember that practice is key to most problems","Only 2 things with an optional 3rd I have to say for improvement because you’re doing good so far. Get your lash line, even if you have to go in from underneath the lashes to draw on the lash line like I do, it will do you a lot of improvement. I also noticed that the top part dips abit and then swooshes up. Usually I draw cat eyes as almost an extension of the bottom lid if that makes sense? Like the angle of the bottom part of the eye. The third bit is simply, play around with smudging instead of just painting it on thick. You can be grunge with thin or thick makeup it just depends on your preferences.

Have fun and remember that practice is key to most problems",1,2023-06-24 20:56:51,<praw.models.comment_forest.CommentForest object at 0x0000022EF51A4310>,14ha8pp,MakeupAddiction,t5_2rww2,,False,False,t3_14ha8pp,t3_14ha8pp,/r/MakeupAddiction/comments/14ha8pp/be_honest_does_my_eyeliner_look_good/jpe3x1z/
569,jpe5xi6,,"I have hooded eyes just like you and I do this with a lot of my eyeshadows. So for example I would do all navy blue like you have it and then clean up the tail at the end where you hooded eye ends, but that's just my preference. I don't know about you but I tried doing three eyeshadows but my hooded eyes are always an issue so I always revert to what you are doing up above or put another color on the middle of the eyelid to wear two colors and sometimes I do three if I am feeling fancy. But I don't ever put colors above because of how little I have to work with above the fold and may put like a pop of color in the corner.  But I think you look great!","I have hooded eyes just like you and I do this with a lot of my eyeshadows. So for example I would do all navy blue like you have it and then clean up the tail at the end where you hooded eye ends, but that's just my preference. I don't know about you but I tried doing three eyeshadows but my hooded eyes are always an issue so I always revert to what you are doing up above or put another color on the middle of the eyelid to wear two colors and sometimes I do three if I am feeling fancy. But I don't ever put colors above because of how little I have to work with above the fold and may put like a pop of color in the corner.  But I think you look great!",1,2023-06-24 21:12:32,<praw.models.comment_forest.CommentForest object at 0x0000022EF51A4370>,14ha8pp,MakeupAddiction,t5_2rww2,,False,False,t3_14ha8pp,t3_14ha8pp,/r/MakeupAddiction/comments/14ha8pp/be_honest_does_my_eyeliner_look_good/jpe5xi6/
570,jpgwcug,SunflowerFreckles,"A soft no. It's too thick, not all the way to the lash line, and the angle of things isn't complimentary to your eye","A soft no. It's too thick, not all the way to the lash line, and the angle of things isn't complimentary to your eye",1,2023-06-25 14:23:16,<praw.models.comment_forest.CommentForest object at 0x0000022EF51A43D0>,14ha8pp,MakeupAddiction,t5_2rww2,,False,False,t3_14ha8pp,t3_14ha8pp,/r/MakeupAddiction/comments/14ha8pp/be_honest_does_my_eyeliner_look_good/jpgwcug/
571,jpom0fi,LITTLE-MISS-SUICIDAL,I like iit! It looks very 80s and if thats the look ur going for then it looks great! If its not then perhaps try other techniques but personally I like it,I like iit! It looks very 80s and if thats the look ur going for then it looks great! If its not then perhaps try other techniques but personally I like it,1,2023-06-27 04:39:45,<praw.models.comment_forest.CommentForest object at 0x0000022EF51A4430>,14ha8pp,MakeupAddiction,t5_2rww2,,False,False,t3_14ha8pp,t3_14ha8pp,/r/MakeupAddiction/comments/14ha8pp/be_honest_does_my_eyeliner_look_good/jpom0fi/
572,jp9vsr2,faore4,Simple grunge,Simple grunge,1,2023-06-23 21:28:14,<praw.models.comment_forest.CommentForest object at 0x0000022EF51A0790>,14ha8pp,MakeupAddiction,t5_2rww2,,False,True,t3_14ha8pp,t1_jp9vqlh,/r/MakeupAddiction/comments/14ha8pp/be_honest_does_my_eyeliner_look_good/jp9vsr2/
573,jp9w048,antameow,"Probably more messy or smoked out look then, you can fill upper lash line with soft pencil or brush if that’s easier","Probably more messy or smoked out look then, you can fill upper lash line with soft pencil or brush if that’s easier",4,2023-06-23 21:29:40,<praw.models.comment_forest.CommentForest object at 0x0000022EF51A0850>,14ha8pp,MakeupAddiction,t5_2rww2,,False,False,t3_14ha8pp,t1_jp9vsr2,/r/MakeupAddiction/comments/14ha8pp/be_honest_does_my_eyeliner_look_good/jp9w048/
574,jp9wk74,antameow,https://vm.tiktok.com/ZGJC4bT7S/ grunge is very simple to do,https://vm.tiktok.com/ZGJC4bT7S/ grunge is very simple to do,1,2023-06-23 21:33:40,<praw.models.comment_forest.CommentForest object at 0x0000022EF51A0910>,14ha8pp,MakeupAddiction,t5_2rww2,,False,False,t3_14ha8pp,t1_jp9w048,/r/MakeupAddiction/comments/14ha8pp/be_honest_does_my_eyeliner_look_good/jp9wk74/
575,jo38nps,bee-sting,"I think some inner eye brightness would really help pull the look together 

either concealer around the eye/nose area or some highlight or light eyeshadow","I think some inner eye brightness would really help pull the look together 

either concealer around the eye/nose area or some highlight or light eyeshadow",12,2023-06-14 11:05:40,<praw.models.comment_forest.CommentForest object at 0x0000022EF51B0820>,1494ygj,MakeupAddiction,t5_2rww2,,False,False,t3_1494ygj,t3_1494ygj,/r/MakeupAddiction/comments/1494ygj/very_new_to_makeup_would_love_advice/jo38nps/
576,jo39mqe,Anhedonic_chonk,"I think you would benefit from having your eyebrows shaped. Not too much, as you have great volume, but just tied up and given a feminine shape. I have mine threaded. 

For makeup, I can’t tell if you have undereye circles or if it’s product, but maybe a little less product under the eyes, or just the outer half. 

A little blush would help soften out the foundation. And I think a tinted lip gloss would be more forgiving than lipstick. 

You look great! Keep practicing.","I think you would benefit from having your eyebrows shaped. Not too much, as you have great volume, but just tied up and given a feminine shape. I have mine threaded. 

For makeup, I can’t tell if you have undereye circles or if it’s product, but maybe a little less product under the eyes, or just the outer half. 

A little blush would help soften out the foundation. And I think a tinted lip gloss would be more forgiving than lipstick. 

You look great! Keep practicing.",7,2023-06-14 11:17:20,<praw.models.comment_forest.CommentForest object at 0x0000022EF51B0880>,1494ygj,MakeupAddiction,t5_2rww2,,False,False,t3_1494ygj,t3_1494ygj,/r/MakeupAddiction/comments/1494ygj/very_new_to_makeup_would_love_advice/jo39mqe/
577,jo3adi6,FlyingFrog99,"Practice doing a staple winged eyeliner with a brush on liquid. There's ways of bracing your hand and drawing the lines that take a bit of finesse but are worth learning. Also a bit of blush is very feminizing.

Also (I know it's not makeup but...) everyone looks better if you don't use the wide angle selfie cam, it distorts the face quite a bit. (try taking a pic in a mirror to get some more space between you and the camera if you don't have the telephoto option on your phone) you will get a more accurate idea of how you look to other people. 

Congrats on living your best life. 
You got this girlfriend .
💪🏳️‍⚧️💪","Practice doing a staple winged eyeliner with a brush on liquid. There's ways of bracing your hand and drawing the lines that take a bit of finesse but are worth learning. Also a bit of blush is very feminizing.

Also (I know it's not makeup but...) everyone looks better if you don't use the wide angle selfie cam, it distorts the face quite a bit. (try taking a pic in a mirror to get some more space between you and the camera if you don't have the telephoto option on your phone) you will get a more accurate idea of how you look to other people. 

Congrats on living your best life. 
You got this girlfriend .
💪🏳️‍⚧️💪",2,2023-06-14 11:26:01,<praw.models.comment_forest.CommentForest object at 0x0000022EF51B0940>,1494ygj,MakeupAddiction,t5_2rww2,,1686742145.0,False,t3_1494ygj,t3_1494ygj,/r/MakeupAddiction/comments/1494ygj/very_new_to_makeup_would_love_advice/jo3adi6/
578,jo3c3t7,SnooAdvice321,"Fellow trans woman here 🙋🏻‍♀️… although I am 10 years older haha.

I’d recommend cleaning up your eyebrows a bit, having them shaped will do wonders. More brightness on the inner corner of your eyes and with under eye concealer will nicely help open up your face! I’d also recommend adding some color to the face, a little blush goes a long way!!

Finally I’d say don’t be afraid to experiment with makeup. While it’s there to enhance our beauty, it should also be fun!","Fellow trans woman here 🙋🏻‍♀️… although I am 10 years older haha.

I’d recommend cleaning up your eyebrows a bit, having them shaped will do wonders. More brightness on the inner corner of your eyes and with under eye concealer will nicely help open up your face! I’d also recommend adding some color to the face, a little blush goes a long way!!

Finally I’d say don’t be afraid to experiment with makeup. While it’s there to enhance our beauty, it should also be fun!",4,2023-06-14 11:45:22,<praw.models.comment_forest.CommentForest object at 0x0000022EF51B0A60>,1494ygj,MakeupAddiction,t5_2rww2,,False,False,t3_1494ygj,t3_1494ygj,/r/MakeupAddiction/comments/1494ygj/very_new_to_makeup_would_love_advice/jo3c3t7/
579,jo38ek4,AutoModerator,"***Thank you for contributing to MUA! If this is your first post, please be sure to check out our rules in the subreddit sidebar. If you are on mobile, they can be viewed by tapping the*** ⓘ ***symbol.***

**A few quick highlights:**
•  

• Looks, hauls, and flatlays require a [product list in the comments, complete with shade names within 20 minutes of posting.](https://www.reddit.com/r/MakeupAddiction/wiki/productlist)

• Photos must not be [edited or filtered. This includes automatic beauty and portrait modes found on many phones and newer cameras.](https://www.reddit.com/r/MakeupAddiction/wiki/photoediting)

• Lastly, our [Helpful Guides for Navigating MUA](https://www.reddit.com/r/MakeupAddiction/wiki/helpfulguides) in the sidebar explains some of the basics of the community as well as commonly misinterpreted rules.

**Is your post just a search away?**

Before you make a post, search with Reddit's search feature or use this handy [customised Google search.](https://cse.google.com/cse?cx=008480394191906358284:aflieg73nqm)


*I am a bot, and this action was performed automatically. Please [contact the moderators of this subreddit](/message/compose/?to=/r/MakeupAddiction) if you have any questions or concerns.*","***Thank you for contributing to MUA! If this is your first post, please be sure to check out our rules in the subreddit sidebar. If you are on mobile, they can be viewed by tapping the*** ⓘ ***symbol.***

**A few quick highlights:**
•  

• Looks, hauls, and flatlays require a [product list in the comments, complete with shade names within 20 minutes of posting.](https://www.reddit.com/r/MakeupAddiction/wiki/productlist)

• Photos must not be [edited or filtered. This includes automatic beauty and portrait modes found on many phones and newer cameras.](https://www.reddit.com/r/MakeupAddiction/wiki/photoediting)

• Lastly, our [Helpful Guides for Navigating MUA](https://www.reddit.com/r/MakeupAddiction/wiki/helpfulguides) in the sidebar explains some of the basics of the community as well as commonly misinterpreted rules.

**Is your post just a search away?**

Before you make a post, search with Reddit's search feature or use this handy [customised Google search.](https://cse.google.com/cse?cx=008480394191906358284:aflieg73nqm)


*I am a bot, and this action was performed automatically. Please [contact the moderators of this subreddit](/message/compose/?to=/r/MakeupAddiction) if you have any questions or concerns.*",1,2023-06-14 11:02:32,<praw.models.comment_forest.CommentForest object at 0x0000022EF51B0B80>,1494ygj,MakeupAddiction,t5_2rww2,moderator,False,False,t3_1494ygj,t3_1494ygj,/r/MakeupAddiction/comments/1494ygj/very_new_to_makeup_would_love_advice/jo38ek4/
580,jo38ekj,AutoModerator,"Hi! This post was submitted during Pride Month 2023. If you have a look to share, please feel free to enter it in our [Pride Month Contest](https://www.reddit.com/r/MakeupAddiction/comments/13xm7a9/pride_2023_contest/)! If you don't have a look to share, that's okay, but you should still check our contest out!!

*I am a bot, and this action was performed automatically. Please [contact the moderators of this subreddit](/message/compose/?to=/r/MakeupAddiction) if you have any questions or concerns.*","Hi! This post was submitted during Pride Month 2023. If you have a look to share, please feel free to enter it in our [Pride Month Contest](https://www.reddit.com/r/MakeupAddiction/comments/13xm7a9/pride_2023_contest/)! If you don't have a look to share, that's okay, but you should still check our contest out!!

*I am a bot, and this action was performed automatically. Please [contact the moderators of this subreddit](/message/compose/?to=/r/MakeupAddiction) if you have any questions or concerns.*",1,2023-06-14 11:02:32,<praw.models.comment_forest.CommentForest object at 0x0000022EF51B0CA0>,1494ygj,MakeupAddiction,t5_2rww2,moderator,False,False,t3_1494ygj,t3_1494ygj,/r/MakeupAddiction/comments/1494ygj/very_new_to_makeup_would_love_advice/jo38ekj/
581,jo3ot5x,memopepito,"Wow, you have beautiful eyes and brows!! I love the gems you added 💕 you don’t need much honestly, I would say maybe just a little under eye concealer to brighten up your look. Your brows are so beautiful! You have enough brow to shape a little bit, & I think they would look really amazing with some clear brow-gel. That’s all you need! 🥰","Wow, you have beautiful eyes and brows!! I love the gems you added 💕 you don’t need much honestly, I would say maybe just a little under eye concealer to brighten up your look. Your brows are so beautiful! You have enough brow to shape a little bit, & I think they would look really amazing with some clear brow-gel. That’s all you need! 🥰",1,2023-06-14 13:43:44,<praw.models.comment_forest.CommentForest object at 0x0000022EF51B0D60>,1494ygj,MakeupAddiction,t5_2rww2,,False,False,t3_1494ygj,t3_1494ygj,/r/MakeupAddiction/comments/1494ygj/very_new_to_makeup_would_love_advice/jo3ot5x/
582,jo3pz39,nim_run16,Cleaning up eyebrows with threading would help!,Cleaning up eyebrows with threading would help!,1,2023-06-14 13:53:06,<praw.models.comment_forest.CommentForest object at 0x0000022EF51B0DC0>,1494ygj,MakeupAddiction,t5_2rww2,,False,False,t3_1494ygj,t3_1494ygj,/r/MakeupAddiction/comments/1494ygj/very_new_to_makeup_would_love_advice/jo3pz39/
