,ID,Author,body,Comment,Score,Created On,Replies,Submission,Subreddit,Subreddit_ID,Distinguished,Edited,Is_submitter,link_id,Parent_id,Permalink
0,h1gcbvv,,"One of the uglier aspects of this conflict is how aggressively Palestinian children are indoctrinated from a young age (practically from birth. Being raised on hatred doesn’t teach a generation to value each other’s well being, only the *glorious struggle*.

Anthony Boursin touched on this in his Jerusalem episode (during his Gaza visit) and was basically met with blank stare reactions when suggesting NOT teaching your 5 year olds that murdering enemies is good.

The system in place keeps Hamas in power, and gives the far right Israelis a valid claim to power in the name of security. Breaking the cycle needs to start at this juncture- when toddlers begin learning hatred.","One of the uglier aspects of this conflict is how aggressively Palestinian children are indoctrinated from a young age (practically from birth. Being raised on hatred doesn’t teach a generation to value each other’s well being, only the *glorious struggle*.

Anthony Boursin touched on this in his Jerusalem episode (during his Gaza visit) and was basically met with blank stare reactions when suggesting NOT teaching your 5 year olds that murdering enemies is good.

The system in place keeps Hamas in power, and gives the far right Israelis a valid claim to power in the name of security. Breaking the cycle needs to start at this juncture- when toddlers begin learning hatred.",13,2021-06-11 22:01:29,<praw.models.comment_forest.CommentForest object at 0x0000021CD96DF460>,nxqx5w,worldnews,t5_2qh13,,False,False,t3_nxqx5w,t3_nxqx5w,/r/worldnews/comments/nxqx5w/usfunded_palestinian_ngos_introduced_children_to/h1gcbvv/
1,h1ghvph,waiver,"Yeah, the NGO Monitor is certainly not an unbiased source


https://en.wikipedia.org/wiki/NGO_Monitor

Neither is the Jpost for that matter.","Yeah, the NGO Monitor is certainly not an unbiased source


https://en.wikipedia.org/wiki/NGO_Monitor

Neither is the Jpost for that matter.",3,2021-06-11 22:49:39,<praw.models.comment_forest.CommentForest object at 0x0000021CD96DF6A0>,nxqx5w,worldnews,t5_2qh13,,1623453593.0,False,t3_nxqx5w,t3_nxqx5w,/r/worldnews/comments/nxqx5w/usfunded_palestinian_ngos_introduced_children_to/h1ghvph/
2,h1ga1iu,k68fc7h,Being a Palestinian who happens to be alive and living in Palestine is viewed as terrorism to Israel so big deal.,Being a Palestinian who happens to be alive and living in Palestine is viewed as terrorism to Israel so big deal.,2,2021-06-11 21:42:44,<praw.models.comment_forest.CommentForest object at 0x0000021CD96DFAF0>,nxqx5w,worldnews,t5_2qh13,,False,False,t3_nxqx5w,t3_nxqx5w,/r/worldnews/comments/nxqx5w/usfunded_palestinian_ngos_introduced_children_to/h1ga1iu/
3,h1ge7gp,Max_Fenig,"[Oh, hey, look!](https://www.readingthepictures.org/files/bagnews/images/bombsigning1.jpg)! It's a picture of Israeli children being indoctrinated into hatred and bloodlust...","[Oh, hey, look!](https://www.readingthepictures.org/files/bagnews/images/bombsigning1.jpg)! It's a picture of Israeli children being indoctrinated into hatred and bloodlust...",7,2021-06-11 22:17:31,<praw.models.comment_forest.CommentForest object at 0x0000021CD96DF700>,nxqx5w,worldnews,t5_2qh13,,False,False,t3_nxqx5w,t1_h1gcbvv,/r/worldnews/comments/nxqx5w/usfunded_palestinian_ngos_introduced_children_to/h1ge7gp/
4,h1ged7u,Wyvz,"It's a win win situation for the terror organizations - if those kids successively carry out some form of terror attack - they get positive PR in the Palestinian community (and the media won't cover it much), and if they get killed in the proccess - they get positive PR internationally.
Downvote me all you want but this is the truth.","It's a win win situation for the terror organizations - if those kids successively carry out some form of terror attack - they get positive PR in the Palestinian community (and the media won't cover it much), and if they get killed in the proccess - they get positive PR internationally.
Downvote me all you want but this is the truth.",-2,2021-06-11 22:18:53,<praw.models.comment_forest.CommentForest object at 0x0000021CD96DF790>,nxqx5w,worldnews,t5_2qh13,,1623453739.0,False,t3_nxqx5w,t1_h1gcbvv,/r/worldnews/comments/nxqx5w/usfunded_palestinian_ngos_introduced_children_to/h1ged7u/
5,h1gk4sv,Ebscriptwalker,Totally sounds like the worst kind of propaganda rag lol.,Totally sounds like the worst kind of propaganda rag lol.,2,2021-06-11 23:11:54,<praw.models.comment_forest.CommentForest object at 0x0000021CD96DFCA0>,nxqx5w,worldnews,t5_2qh13,,False,False,t3_nxqx5w,t1_h1ghvph,/r/worldnews/comments/nxqx5w/usfunded_palestinian_ngos_introduced_children_to/h1gk4sv/
6,h2lqxlo,MacNuttyOne,"I no longer trust anything in J Post, haven't for some time now.","I no longer trust anything in J Post, haven't for some time now.",1,2021-06-22 01:25:56,<praw.models.comment_forest.CommentForest object at 0x0000021CD96DFD60>,nxqx5w,worldnews,t5_2qh13,,False,False,t3_nxqx5w,t1_h1ghvph,/r/worldnews/comments/nxqx5w/usfunded_palestinian_ngos_introduced_children_to/h2lqxlo/
7,h1gb6ya,Entwaldung,">The terrorists were imprisoned for various acts, including shooting attacks, stabbings, arms-smuggling, funding terror organizations, kidnapping and murdering of Israeli citizens, a minister, IDF soldiers as well as tourists.

Are you implying this describes the average ""Palestinian who happens to be alive and living in Palestine""?",">The terrorists were imprisoned for various acts, including shooting attacks, stabbings, arms-smuggling, funding terror organizations, kidnapping and murdering of Israeli citizens, a minister, IDF soldiers as well as tourists.

Are you implying this describes the average ""Palestinian who happens to be alive and living in Palestine""?",21,2021-06-11 21:52:05,<praw.models.comment_forest.CommentForest object at 0x0000021CD96DFE20>,nxqx5w,worldnews,t5_2qh13,,False,False,t3_nxqx5w,t1_h1ga1iu,/r/worldnews/comments/nxqx5w/usfunded_palestinian_ngos_introduced_children_to/h1gb6ya/
8,h1glsvs,Wyvz,"Nice whataboutism.
By the way, drawing on an artillery shell isnt really comparable to glorify stabbings and suicide bombing and sending kids to riots, 10/10 for effort though.","Nice whataboutism.
By the way, drawing on an artillery shell isnt really comparable to glorify stabbings and suicide bombing and sending kids to riots, 10/10 for effort though.",-2,2021-06-11 23:29:12,<praw.models.comment_forest.CommentForest object at 0x0000021CD96DF9D0>,nxqx5w,worldnews,t5_2qh13,,False,False,t3_nxqx5w,t1_h1ge7gp,/r/worldnews/comments/nxqx5w/usfunded_palestinian_ngos_introduced_children_to/h1glsvs/
9,h1gdmpg,Max_Fenig,I don't think a conviction of a Palestinian in Israel is worth a damn thing.,I don't think a conviction of a Palestinian in Israel is worth a damn thing.,1,2021-06-11 22:12:34,<praw.models.comment_forest.CommentForest object at 0x0000021CD96DFF10>,nxqx5w,worldnews,t5_2qh13,,False,False,t3_nxqx5w,t1_h1gb6ya,/r/worldnews/comments/nxqx5w/usfunded_palestinian_ngos_introduced_children_to/h1gdmpg/
10,h1gbs0y,k68fc7h,"I'm saying that the average Palestinians are abused and arrested for being ""terrorists"" while doing sweet fuck all so this means bupkiss.","I'm saying that the average Palestinians are abused and arrested for being ""terrorists"" while doing sweet fuck all so this means bupkiss.",-5,2021-06-11 21:56:52,<praw.models.comment_forest.CommentForest object at 0x0000021CD96DFF70>,nxqx5w,worldnews,t5_2qh13,,False,False,t3_nxqx5w,t1_h1gb6ya,/r/worldnews/comments/nxqx5w/usfunded_palestinian_ngos_introduced_children_to/h1gbs0y/
11,h1gmiga,Max_Fenig,Right. Their violence is bad. Your violence is good. Got it.,Right. Their violence is bad. Your violence is good. Got it.,8,2021-06-11 23:36:11,<praw.models.comment_forest.CommentForest object at 0x0000021CD96DFBB0>,nxqx5w,worldnews,t5_2qh13,,False,False,t3_nxqx5w,t1_h1glsvs,/r/worldnews/comments/nxqx5w/usfunded_palestinian_ngos_introduced_children_to/h1gmiga/
12,h1gqnvx,fury420,"It's not like we can rely on the Palestinian ""legal system"", what with things like the Palestinian Martyrs Fund: 

https://en.m.wikipedia.org/wiki/Palestinian_Authority_Martyrs_Fund

And a literal death sentence / life in prison for the ""crime"" of selling land to foreigners: 

https://www.timesofisrael.com/family-surprised-by-life-sentence-for-palestinian-american-over-land-sale/

https://abcnews.go.com/International/wireStory/palestinian-life-sentence-land-sale-israelis-60091516","It's not like we can rely on the Palestinian ""legal system"", what with things like the Palestinian Martyrs Fund: 

https://en.m.wikipedia.org/wiki/Palestinian_Authority_Martyrs_Fund

And a literal death sentence / life in prison for the ""crime"" of selling land to foreigners: 

https://www.timesofisrael.com/family-surprised-by-life-sentence-for-palestinian-american-over-land-sale/

https://abcnews.go.com/International/wireStory/palestinian-life-sentence-land-sale-israelis-60091516",12,2021-06-12 00:15:25,<praw.models.comment_forest.CommentForest object at 0x0000021CD96DFFD0>,nxqx5w,worldnews,t5_2qh13,,False,False,t3_nxqx5w,t1_h1gdmpg,/r/worldnews/comments/nxqx5w/usfunded_palestinian_ngos_introduced_children_to/h1gqnvx/
13,h231ql0,ExoticCard,"you are absolutely right brotha, men in my family were jailed with no charge alllll the time","you are absolutely right brotha, men in my family were jailed with no charge alllll the time",2,2021-06-17 12:59:50,<praw.models.comment_forest.CommentForest object at 0x0000021CD5AB53D0>,nxqx5w,worldnews,t5_2qh13,,False,False,t3_nxqx5w,t1_h1gbs0y,/r/worldnews/comments/nxqx5w/usfunded_palestinian_ngos_introduced_children_to/h231ql0/
14,h1i2fp2,,How is an out of context picture even slightly comparable?,How is an out of context picture even slightly comparable?,4,2021-06-12 09:58:14,<praw.models.comment_forest.CommentForest object at 0x0000021CD96DFD30>,nxqx5w,worldnews,t5_2qh13,,False,False,t3_nxqx5w,t1_h1gmiga,/r/worldnews/comments/nxqx5w/usfunded_palestinian_ngos_introduced_children_to/h1i2fp2/
