,ID,Author,body,Comment,Score,Created On,Replies,Submission,Subreddit,Subreddit_ID,Distinguished,Edited,Is_submitter,link_id,Parent_id,Permalink
141,jcq5h4q,GreenJinni,"It’s lack of trying. As someone pointed out earlier I have not had a single gym class where I wasn’t told girls can do knee pushups. I couldn’t do push ups at the start of last summer. After focusing on changing that for 2 months, I could do 30 push ups in good form, and a pull up (which a pull up I thought I would NEVER be able to do). I do believe the center of gravity difference is relevant but it’s by no means stopping any women from doing push ups. U just gotta want it and put some work into it.","It’s lack of trying. As someone pointed out earlier I have not had a single gym class where I wasn’t told girls can do knee pushups. I couldn’t do push ups at the start of last summer. After focusing on changing that for 2 months, I could do 30 push ups in good form, and a pull up (which a pull up I thought I would NEVER be able to do). I do believe the center of gravity difference is relevant but it’s by no means stopping any women from doing push ups. U just gotta want it and put some work into it.",4,2023-03-18 18:21:37,<praw.models.comment_forest.CommentForest object at 0x0000022EEDBA95E0>,11utbgt,bodyweightfitness,t5_2tf0a,,False,False,t3_11utbgt,t3_11utbgt,/r/bodyweightfitness/comments/11utbgt/most_females_cant_do_one_pushup/jcq5h4q/
142,jcpt9ld,TheDumbAsk,"I would think most women can't do a proper push up, body control is a big problem as you say with the proper form there. Really though it is how weak we have all become.  Are you able to do pull ups? Most men can't even do that.","I would think most women can't do a proper push up, body control is a big problem as you say with the proper form there. Really though it is how weak we have all become.  Are you able to do pull ups? Most men can't even do that.",4,2023-03-18 16:58:51,<praw.models.comment_forest.CommentForest object at 0x0000022EEDBA9640>,11utbgt,bodyweightfitness,t5_2tf0a,,False,False,t3_11utbgt,t3_11utbgt,/r/bodyweightfitness/comments/11utbgt/most_females_cant_do_one_pushup/jcpt9ld/
143,jcq4l0n,Anachronism--,I was in the festival area of an obstacle course race and the DJ was running a push-up contest. The men where doing the worst excuse for pushups I had ever seen in my life. Then the women got up there. I never would have been able to figure out they where doing push-ups if I didn’t already know.,I was in the festival area of an obstacle course race and the DJ was running a push-up contest. The men where doing the worst excuse for pushups I had ever seen in my life. Then the women got up there. I never would have been able to figure out they where doing push-ups if I didn’t already know.,2,2023-03-18 18:15:34,<praw.models.comment_forest.CommentForest object at 0x0000022EEDBA9700>,11utbgt,bodyweightfitness,t5_2tf0a,,False,False,t3_11utbgt,t3_11utbgt,/r/bodyweightfitness/comments/11utbgt/most_females_cant_do_one_pushup/jcq4l0n/
144,jcq515e,Raspberrry314,"I've never been able to do one, not even on my knees. I'm generally quite weak compared to the average female and my extremely long arms don't help at all!

When I was a kid, I was never able to do monkey bars yet kids my age were able to freely swing from bar to bar.... I think it's just genetic and some people have a really high natural baseline of strength and fitness...

I often think about how some people become personal trainers, athletes or bodybuilders - it's because their bodies are built for that. Even if I trained everyday and took a bunch of supplements, I don't think I'll ever be extremely strong or muscular.","I've never been able to do one, not even on my knees. I'm generally quite weak compared to the average female and my extremely long arms don't help at all!

When I was a kid, I was never able to do monkey bars yet kids my age were able to freely swing from bar to bar.... I think it's just genetic and some people have a really high natural baseline of strength and fitness...

I often think about how some people become personal trainers, athletes or bodybuilders - it's because their bodies are built for that. Even if I trained everyday and took a bunch of supplements, I don't think I'll ever be extremely strong or muscular.",2,2023-03-18 18:18:37,<praw.models.comment_forest.CommentForest object at 0x0000022EEDBA9880>,11utbgt,bodyweightfitness,t5_2tf0a,,False,False,t3_11utbgt,t3_11utbgt,/r/bodyweightfitness/comments/11utbgt/most_females_cant_do_one_pushup/jcq515e/
145,jcqrb1c,Flakeypastry7,"It’s a myth that women ‘don’t have any upper body strength’. However, from young we’re told that we have to do knee push ups, and can’t do normal ones. If you never train your upper body of course you won’t build any strength in that area.

Also, like a lot of people have said in this thread; there are a lot of men and women out there doing awful push ups.","It’s a myth that women ‘don’t have any upper body strength’. However, from young we’re told that we have to do knee push ups, and can’t do normal ones. If you never train your upper body of course you won’t build any strength in that area.

Also, like a lot of people have said in this thread; there are a lot of men and women out there doing awful push ups.",2,2023-03-18 20:55:32,<praw.models.comment_forest.CommentForest object at 0x0000022EEDBA98E0>,11utbgt,bodyweightfitness,t5_2tf0a,,False,False,t3_11utbgt,t3_11utbgt,/r/bodyweightfitness/comments/11utbgt/most_females_cant_do_one_pushup/jcqrb1c/
146,jcq97ec,kimmytwoshoes,Stop flattering yourself lol,Stop flattering yourself lol,3,2023-03-18 18:47:22,<praw.models.comment_forest.CommentForest object at 0x0000022EEDBA99A0>,11utbgt,bodyweightfitness,t5_2tf0a,,False,False,t3_11utbgt,t3_11utbgt,/r/bodyweightfitness/comments/11utbgt/most_females_cant_do_one_pushup/jcq97ec/
147,jcq0max,willdeletetheacc,Us women don't have testosterone. Ask any trans person. They know how powerful that thing is.,Us women don't have testosterone. Ask any trans person. They know how powerful that thing is.,1,2023-03-18 17:48:36,<praw.models.comment_forest.CommentForest object at 0x0000022EEDBA9A00>,11utbgt,bodyweightfitness,t5_2tf0a,,False,False,t3_11utbgt,t3_11utbgt,/r/bodyweightfitness/comments/11utbgt/most_females_cant_do_one_pushup/jcq0max/
148,jcqakci,ma7ad04,Torn rotator cuff,Torn rotator cuff,1,2023-03-18 18:56:54,<praw.models.comment_forest.CommentForest object at 0x0000022EEDBA9AC0>,11utbgt,bodyweightfitness,t5_2tf0a,,False,False,t3_11utbgt,t3_11utbgt,/r/bodyweightfitness/comments/11utbgt/most_females_cant_do_one_pushup/jcqakci/
149,jcqe0wd,Prowland12,"I think we wildly underestimate women's capacity for pressing strength. I actually just finished watching a video of Inga Simning doing a set of 22 one arm pushups. Besides that, there's the powerlifters like Jen Thompson benching 300+ lbs. 

In my opinion, it's always been cultural. We're still challenging these silly deeply engrained ideas about femininity and weakness. Although in the US, I think things like Title IX have helped make great strides in dispelling that myth among younger generations.

There are of course differences in anatomy, but the gap is far from insurmountable. 

https://youtu.be/li1L2Ng8vIE
https://youtube.com/shorts/vbefIlfYFdY?feature=share","I think we wildly underestimate women's capacity for pressing strength. I actually just finished watching a video of Inga Simning doing a set of 22 one arm pushups. Besides that, there's the powerlifters like Jen Thompson benching 300+ lbs. 

In my opinion, it's always been cultural. We're still challenging these silly deeply engrained ideas about femininity and weakness. Although in the US, I think things like Title IX have helped make great strides in dispelling that myth among younger generations.

There are of course differences in anatomy, but the gap is far from insurmountable. 

https://youtu.be/li1L2Ng8vIE
https://youtube.com/shorts/vbefIlfYFdY?feature=share",1,2023-03-18 19:20:54,<praw.models.comment_forest.CommentForest object at 0x0000022EEDBA91C0>,11utbgt,bodyweightfitness,t5_2tf0a,,False,False,t3_11utbgt,t3_11utbgt,/r/bodyweightfitness/comments/11utbgt/most_females_cant_do_one_pushup/jcqe0wd/
150,jcq3que,rockinvet02,"It is all about muscle mass and to lesser extent your body shape and to a greater extent, you body composition.

If it's easy for you without trying then you won the DNA lottery.  Thank you parents.","It is all about muscle mass and to lesser extent your body shape and to a greater extent, you body composition.

If it's easy for you without trying then you won the DNA lottery.  Thank you parents.",1,2023-03-18 18:09:44,<praw.models.comment_forest.CommentForest object at 0x0000022EEDBA9C40>,11utbgt,bodyweightfitness,t5_2tf0a,,False,False,t3_11utbgt,t3_11utbgt,/r/bodyweightfitness/comments/11utbgt/most_females_cant_do_one_pushup/jcq3que/
151,jcqxk8t,Alternative_Draft_76,9/10 people can’t do a single pull-up.,9/10 people can’t do a single pull-up.,1,2023-03-18 21:42:02,<praw.models.comment_forest.CommentForest object at 0x0000022EEDBA9D00>,11utbgt,bodyweightfitness,t5_2tf0a,,False,False,t3_11utbgt,t3_11utbgt,/r/bodyweightfitness/comments/11utbgt/most_females_cant_do_one_pushup/jcqxk8t/
152,jcqzujt,EducationalPublic321,"Well first of all, it is not just women. A perfectly executed push up is not easy at all, a lot of guys cannot do them without fucking with the form ( I honestly think your perspective is kinda biased because you work with soldiers). To me there is also this idea that push ups are easy because people make them easy: there is a very wide range of push up techniques without even getting into the variations. The easier ones have limited ROM, are done quickly so you can spam them easily without any time under tension and rise with that weird cobra form. These can be used if you are 1-weak 2- not flexible or 3- trying to work explosive strength ( that’s only for the speed component, rom and straight back should be maintained if you’re strong enough that you include this kind of technique work) but for most people, they are just too easy (most guys do easily 25+ using that type of form). Perfect push ups however have a 4/5 second controlled eccentric, wide hands and make you go forward as you lower yourself down(almost like a pseudo planche variation) all the way until your chest lays flat on the ground. Using this style, I can assure you even most stronger men get humbled pretty quickly(for example, as an amateur powerlifter who spends 10 hours a week in the gym and benches over 100kg, I cannot do more than 15 of these). So yeah, lots of people can’t do push ups if you expect strict form, it’s nothing new or surprising ^^. 


The fact that women in particular struggle with it more is obviously due to their anatomy (lots of fat tissue in the breasts means less room for larger pecs, this is why women tend to be relatively close in terms of back and leg strength to men (reflected by their strong showing in deadlifts and squats in powerlifting records) but struggle a lot more with pushing strength) but also part cultural: most young men practice a sport and even if they don’t, tend to play more physical as kids and as such start with at least some general muscular fitness. This is very often not the case with younger women as our culture is not about that for them.","Well first of all, it is not just women. A perfectly executed push up is not easy at all, a lot of guys cannot do them without fucking with the form ( I honestly think your perspective is kinda biased because you work with soldiers). To me there is also this idea that push ups are easy because people make them easy: there is a very wide range of push up techniques without even getting into the variations. The easier ones have limited ROM, are done quickly so you can spam them easily without any time under tension and rise with that weird cobra form. These can be used if you are 1-weak 2- not flexible or 3- trying to work explosive strength ( that’s only for the speed component, rom and straight back should be maintained if you’re strong enough that you include this kind of technique work) but for most people, they are just too easy (most guys do easily 25+ using that type of form). Perfect push ups however have a 4/5 second controlled eccentric, wide hands and make you go forward as you lower yourself down(almost like a pseudo planche variation) all the way until your chest lays flat on the ground. Using this style, I can assure you even most stronger men get humbled pretty quickly(for example, as an amateur powerlifter who spends 10 hours a week in the gym and benches over 100kg, I cannot do more than 15 of these). So yeah, lots of people can’t do push ups if you expect strict form, it’s nothing new or surprising ^^. 


The fact that women in particular struggle with it more is obviously due to their anatomy (lots of fat tissue in the breasts means less room for larger pecs, this is why women tend to be relatively close in terms of back and leg strength to men (reflected by their strong showing in deadlifts and squats in powerlifting records) but struggle a lot more with pushing strength) but also part cultural: most young men practice a sport and even if they don’t, tend to play more physical as kids and as such start with at least some general muscular fitness. This is very often not the case with younger women as our culture is not about that for them.",1,2023-03-18 21:59:25,<praw.models.comment_forest.CommentForest object at 0x0000022EEDBA9D60>,11utbgt,bodyweightfitness,t5_2tf0a,,False,False,t3_11utbgt,t3_11utbgt,/r/bodyweightfitness/comments/11utbgt/most_females_cant_do_one_pushup/jcqzujt/
153,jcr133y,hikehikebaby,"I am a woman who can do push ups with one arm... Most Americans are not fit, ~2/3 American adults are overweight or obese. The minimum fitness standards to join the military are minimum standards - most healthy people can pass by design. A lot of military service members are not fit, and many people who are overweight make weight/tape and meet minimum fitness standards to stay in the military. 

There's nothing particularly hard about pushups, and most women can do pullups as well with a little training. These women have bad form and can hurt themselves. Unfortunately, the military also isn't great at preventing injury and teaching good form. There's no secret here, just people with low muscle mass and poor form who haven't been taught better form or coached properly to develop the necessary fitness.

Edit: just to really drive the point home -  healthy young people join our military and 4 years later they leave with disability checks because the military does not help people develop the strength that they need to do their job without injury or care about injury prevention. I'm not talking about people who are injured in combat, I'm talking about people who are disabled because of repetitive motion injuries, being forced to carry weights that they are not strong enough to carry, lack of appropriate PPE,  and shitty PT. It's infuriating.  The military would rather pay disability money than invest in preventing highly preventable and predictable injuries. So many people I care about have suffered from this.","I am a woman who can do push ups with one arm... Most Americans are not fit, ~2/3 American adults are overweight or obese. The minimum fitness standards to join the military are minimum standards - most healthy people can pass by design. A lot of military service members are not fit, and many people who are overweight make weight/tape and meet minimum fitness standards to stay in the military. 

There's nothing particularly hard about pushups, and most women can do pullups as well with a little training. These women have bad form and can hurt themselves. Unfortunately, the military also isn't great at preventing injury and teaching good form. There's no secret here, just people with low muscle mass and poor form who haven't been taught better form or coached properly to develop the necessary fitness.

Edit: just to really drive the point home -  healthy young people join our military and 4 years later they leave with disability checks because the military does not help people develop the strength that they need to do their job without injury or care about injury prevention. I'm not talking about people who are injured in combat, I'm talking about people who are disabled because of repetitive motion injuries, being forced to carry weights that they are not strong enough to carry, lack of appropriate PPE,  and shitty PT. It's infuriating.  The military would rather pay disability money than invest in preventing highly preventable and predictable injuries. So many people I care about have suffered from this.",1,2023-03-18 22:09:00,<praw.models.comment_forest.CommentForest object at 0x0000022EEDBA9DC0>,11utbgt,bodyweightfitness,t5_2tf0a,,1679178165.0,False,t3_11utbgt,t3_11utbgt,/r/bodyweightfitness/comments/11utbgt/most_females_cant_do_one_pushup/jcr133y/
154,jctekaz,Tiistitanium,My normal push ups are probably my weakest part of my calisthenics skills. I have great vertical push abilities from handstands and find psiedo planche push-ups straightforward but ask me to 10 normal pushups and my form goes to pot. I have no real interest in doing lots of pushups so I don’t feel bad about it,My normal push ups are probably my weakest part of my calisthenics skills. I have great vertical push abilities from handstands and find psiedo planche push-ups straightforward but ask me to 10 normal pushups and my form goes to pot. I have no real interest in doing lots of pushups so I don’t feel bad about it,1,2023-03-19 12:47:26,<praw.models.comment_forest.CommentForest object at 0x0000022EEDBA9E20>,11utbgt,bodyweightfitness,t5_2tf0a,,False,False,t3_11utbgt,t3_11utbgt,/r/bodyweightfitness/comments/11utbgt/most_females_cant_do_one_pushup/jctekaz/
155,jcy0az8,Yo-Yo-Hell-No,"I can do full push-ups fairly well when I am lighter, say 140lbs. But at 5'6 and 180lbs, it is a hell of a lot of weight for me to lift. Even from my knees at my current weight is a challenge to knock out 10 reps","I can do full push-ups fairly well when I am lighter, say 140lbs. But at 5'6 and 180lbs, it is a hell of a lot of weight for me to lift. Even from my knees at my current weight is a challenge to knock out 10 reps",1,2023-03-20 12:56:53,<praw.models.comment_forest.CommentForest object at 0x0000022EEDBA9E80>,11utbgt,bodyweightfitness,t5_2tf0a,,False,False,t3_11utbgt,t3_11utbgt,/r/bodyweightfitness/comments/11utbgt/most_females_cant_do_one_pushup/jcy0az8/
156,jcq068o,PoopIsAlwaysSunny,"Even “fit” ones that do a lot of “push-ups”.

Like, sorry bro but idk what that shit is but your elbows are all over the place, your pelvis is tilted, and your back is round. Sure you can do fifty of those, but they’re not push-ups.","Even “fit” ones that do a lot of “push-ups”.

Like, sorry bro but idk what that shit is but your elbows are all over the place, your pelvis is tilted, and your back is round. Sure you can do fifty of those, but they’re not push-ups.",47,2023-03-18 17:45:35,<praw.models.comment_forest.CommentForest object at 0x0000022EEDBA08E0>,11utbgt,bodyweightfitness,t5_2tf0a,,False,False,t3_11utbgt,t1_jcpt0gv,/r/bodyweightfitness/comments/11utbgt/most_females_cant_do_one_pushup/jcq068o/
157,jcpuasq,jdt2112,I can barely do one lol,I can barely do one lol,15,2023-03-18 17:05:45,<praw.models.comment_forest.CommentForest object at 0x0000022EEDBA0940>,11utbgt,bodyweightfitness,t5_2tf0a,,False,False,t3_11utbgt,t1_jcpt0gv,/r/bodyweightfitness/comments/11utbgt/most_females_cant_do_one_pushup/jcpuasq/
158,jcqdekq,0ct0c4t9000,"if i'd like to last 4 sets, i wouldn't be able to do more than 10 each set, probably 8 and still keep form for the last one, and then i'd be lying on the floor for a while after that. so i better do 12/15 but elevated on a 15cm height step, so i can move on to other excercises following that.","if i'd like to last 4 sets, i wouldn't be able to do more than 10 each set, probably 8 and still keep form for the last one, and then i'd be lying on the floor for a while after that. so i better do 12/15 but elevated on a 15cm height step, so i can move on to other excercises following that.",6,2023-03-18 19:16:38,<praw.models.comment_forest.CommentForest object at 0x0000022EEDBA0AC0>,11utbgt,bodyweightfitness,t5_2tf0a,,False,False,t3_11utbgt,t1_jcpt0gv,/r/bodyweightfitness/comments/11utbgt/most_females_cant_do_one_pushup/jcqdekq/
159,jcpt5b3,Key_Part_402,I guess that’s true lol.,I guess that’s true lol.,3,2023-03-18 16:58:03,<praw.models.comment_forest.CommentForest object at 0x0000022EEDBA0CA0>,11utbgt,bodyweightfitness,t5_2tf0a,,False,True,t3_11utbgt,t1_jcpt0gv,/r/bodyweightfitness/comments/11utbgt/most_females_cant_do_one_pushup/jcpt5b3/
160,jcq5jvx,blue_27,This is a terrible counter argument.,This is a terrible counter argument.,0,2023-03-18 18:22:08,<praw.models.comment_forest.CommentForest object at 0x0000022EEDBA0DC0>,11utbgt,bodyweightfitness,t5_2tf0a,,False,False,t3_11utbgt,t1_jcpt0gv,/r/bodyweightfitness/comments/11utbgt/most_females_cant_do_one_pushup/jcq5jvx/
161,jcqdpkn,nonunionLeakey,Unless you’re very fat it’s very easy to do one as a male,Unless you’re very fat it’s very easy to do one as a male,-1,2023-03-18 19:18:47,<praw.models.comment_forest.CommentForest object at 0x0000022EEDBA0E50>,11utbgt,bodyweightfitness,t5_2tf0a,,False,False,t3_11utbgt,t1_jcpt0gv,/r/bodyweightfitness/comments/11utbgt/most_females_cant_do_one_pushup/jcqdpkn/
162,jcqa7a8,MicahsNao,I really doubt a large percentage of people women included cannot do a pushup. It doesn't take much at all,I really doubt a large percentage of people women included cannot do a pushup. It doesn't take much at all,6,2023-03-18 18:54:19,<praw.models.comment_forest.CommentForest object at 0x0000022EEDBA0F40>,11utbgt,bodyweightfitness,t5_2tf0a,,False,False,t3_11utbgt,t1_jcpvfku,/r/bodyweightfitness/comments/11utbgt/most_females_cant_do_one_pushup/jcqa7a8/
163,jcpx1jt,,"When comparing man and women of normal BMI, more man than women can do push ups. Upper body strength  is far greater for man. Man have also a higher muscle density over all compared to women. The average body fat % for man with normal BMI, is 5 to 10% lower than women.","When comparing man and women of normal BMI, more man than women can do push ups. Upper body strength  is far greater for man. Man have also a higher muscle density over all compared to women. The average body fat % for man with normal BMI, is 5 to 10% lower than women.",26,2023-03-18 17:24:27,<praw.models.comment_forest.CommentForest object at 0x0000022EEDBC8070>,11utbgt,bodyweightfitness,t5_2tf0a,,False,False,t3_11utbgt,t1_jcpsssm,/r/bodyweightfitness/comments/11utbgt/most_females_cant_do_one_pushup/jcpx1jt/
164,jcpt2l7,Key_Part_402,"I mean that’s true, as it can apply to anyone. But but a lot of females can’t even lift themselves up at all.","I mean that’s true, as it can apply to anyone. But but a lot of females can’t even lift themselves up at all.",4,2023-03-18 16:57:34,<praw.models.comment_forest.CommentForest object at 0x0000022EEDBC81F0>,11utbgt,bodyweightfitness,t5_2tf0a,,False,True,t3_11utbgt,t1_jcpsssm,/r/bodyweightfitness/comments/11utbgt/most_females_cant_do_one_pushup/jcpt2l7/
165,jcq25pn,Key_Part_402,That does play a part (extra weight all in the chest lol),That does play a part (extra weight all in the chest lol),4,2023-03-18 17:58:59,<praw.models.comment_forest.CommentForest object at 0x0000022EEDBC8310>,11utbgt,bodyweightfitness,t5_2tf0a,,False,True,t3_11utbgt,t1_jcq1ppp,/r/bodyweightfitness/comments/11utbgt/most_females_cant_do_one_pushup/jcq25pn/
166,jcpvlvs,Key_Part_402,"Also, that’s awesome progress! Did progression stuff help you out? I ask because I currently have a soldier who I’ve tried progression stuff with and it’s doesn’t seem to be working with her. Also, how long did it take for you to make that progress?","Also, that’s awesome progress! Did progression stuff help you out? I ask because I currently have a soldier who I’ve tried progression stuff with and it’s doesn’t seem to be working with her. Also, how long did it take for you to make that progress?",4,2023-03-18 17:14:39,<praw.models.comment_forest.CommentForest object at 0x0000022EEDBC8670>,11utbgt,bodyweightfitness,t5_2tf0a,,False,True,t3_11utbgt,t1_jcpukf7,/r/bodyweightfitness/comments/11utbgt/most_females_cant_do_one_pushup/jcpvlvs/
167,jcpvb6f,Key_Part_402,"That’s primarily how I do them, with my elbows tucked close at my sides bc it’s the “army way” it’s called a [PRT Push Up](https://youtu.be/IVE--yvsDB0)","That’s primarily how I do them, with my elbows tucked close at my sides bc it’s the “army way” it’s called a [PRT Push Up](https://youtu.be/IVE--yvsDB0)",4,2023-03-18 17:12:36,<praw.models.comment_forest.CommentForest object at 0x0000022EEDBC86D0>,11utbgt,bodyweightfitness,t5_2tf0a,,False,True,t3_11utbgt,t1_jcpukf7,/r/bodyweightfitness/comments/11utbgt/most_females_cant_do_one_pushup/jcpvb6f/
