,ID,Author,body,Comment,Score,Created On,Replies,Submission,Subreddit,Subreddit_ID,Distinguished,Edited,Is_submitter,link_id,Parent_id,Permalink
510,hfmus52,,"Feelsbad that this is an unpopular opinion in fitness community. First of all, if you're not 200lbs lean, people ask DYEL, what's up with that? Some people just don't want or even can't eat that much. Even if they could/wanted, sometimes they can't afford. I tried bulking, after a month I gained like crazy 10lbs, but had moral issues with it. Who am I to eat to the point I want to vomit, while so many others starve?

My message to you (and everyone else) is that fitness is a journey you're supposed to enjoy. If you want to train, but not eat like a bodybuilder, you will still gain an estetic physique. Keep on keeping on, and don't let others tell you what's right, as long as you are healthy, my dude.","Feelsbad that this is an unpopular opinion in fitness community. First of all, if you're not 200lbs lean, people ask DYEL, what's up with that? Some people just don't want or even can't eat that much. Even if they could/wanted, sometimes they can't afford. I tried bulking, after a month I gained like crazy 10lbs, but had moral issues with it. Who am I to eat to the point I want to vomit, while so many others starve?

My message to you (and everyone else) is that fitness is a journey you're supposed to enjoy. If you want to train, but not eat like a bodybuilder, you will still gain an estetic physique. Keep on keeping on, and don't let others tell you what's right, as long as you are healthy, my dude.",1,2021-10-06 18:33:14,<praw.models.comment_forest.CommentForest object at 0x0000022EEE361E80>,q2kvpz,bodyweightfitness,t5_2tf0a,,False,False,t3_q2kvpz,t3_q2kvpz,/r/bodyweightfitness/comments/q2kvpz/who_else_dont_like_the_overconsumption_of_food/hfmus52/
511,hflznlb,,"The reality of bulking is that 90%+ of the 'gains' are fat. You won't put on muscle any faster by eating too much. Just make sure you get enough protein and sleep, you will be fine.

And with calisthenics you don't want a bunch of extra dead weight anyway.

Your body will tell you if you need to eat more by being sore and hungry.","The reality of bulking is that 90%+ of the 'gains' are fat. You won't put on muscle any faster by eating too much. Just make sure you get enough protein and sleep, you will be fine.

And with calisthenics you don't want a bunch of extra dead weight anyway.

Your body will tell you if you need to eat more by being sore and hungry.",-5,2021-10-06 14:56:17,<praw.models.comment_forest.CommentForest object at 0x0000022EEE361310>,q2kvpz,bodyweightfitness,t5_2tf0a,,False,False,t3_q2kvpz,t3_q2kvpz,/r/bodyweightfitness/comments/q2kvpz/who_else_dont_like_the_overconsumption_of_food/hflznlb/
512,hfmlv0s,Dry_Peanut4060,"You don't need to bulk in order to gain muscle, you need to achieve positive nitrogen balance.","You don't need to bulk in order to gain muscle, you need to achieve positive nitrogen balance.",0,2021-10-06 17:28:54,<praw.models.comment_forest.CommentForest object at 0x0000022EEE361190>,q2kvpz,bodyweightfitness,t5_2tf0a,,False,False,t3_q2kvpz,t3_q2kvpz,/r/bodyweightfitness/comments/q2kvpz/who_else_dont_like_the_overconsumption_of_food/hfmlv0s/
513,hfpze91,VittelBadoit,"You just have to eat like 100-200kcal surplus (even 50kcal if you prefer). I gained a bit less than 1kg in 2months of training. I'm not feeling like I am going to explode all the time because of eating too much, and as I have a lot of protein intake (well I said a lot but I'm at 2g/kg of BW, so not that high) I stay lean and I'm achieving skills I planned to reach on a 6 months schedule from mid August. At the end I got my stradle FL 3 weeks ago and now I hold FL for more or less 5s. So at the end, what's matter is how good you feel when you're training, and being slightly in a calories surplus with enough proteins, which doesn't equal to ""eat every fucking hours"" and ""you should be close to vomit when lying on your back"" ^^","You just have to eat like 100-200kcal surplus (even 50kcal if you prefer). I gained a bit less than 1kg in 2months of training. I'm not feeling like I am going to explode all the time because of eating too much, and as I have a lot of protein intake (well I said a lot but I'm at 2g/kg of BW, so not that high) I stay lean and I'm achieving skills I planned to reach on a 6 months schedule from mid August. At the end I got my stradle FL 3 weeks ago and now I hold FL for more or less 5s. So at the end, what's matter is how good you feel when you're training, and being slightly in a calories surplus with enough proteins, which doesn't equal to ""eat every fucking hours"" and ""you should be close to vomit when lying on your back"" ^^",0,2021-10-07 12:34:46,<praw.models.comment_forest.CommentForest object at 0x0000022EEE361220>,q2kvpz,bodyweightfitness,t5_2tf0a,,False,False,t3_q2kvpz,t3_q2kvpz,/r/bodyweightfitness/comments/q2kvpz/who_else_dont_like_the_overconsumption_of_food/hfpze91/
514,hflxccm,Snif3425,There is more and more data that shows that less food equals longer life.,There is more and more data that shows that less food equals longer life.,-6,2021-10-06 14:40:05,<praw.models.comment_forest.CommentForest object at 0x0000022EEE361D60>,q2kvpz,bodyweightfitness,t5_2tf0a,,False,False,t3_q2kvpz,t3_q2kvpz,/r/bodyweightfitness/comments/q2kvpz/who_else_dont_like_the_overconsumption_of_food/hflxccm/
515,hfpqo3w,Ninety-Degree-Squat,Two words. Greg Doucette.,Two words. Greg Doucette.,-1,2021-10-07 11:03:19,<praw.models.comment_forest.CommentForest object at 0x0000022EEE361FD0>,q2kvpz,bodyweightfitness,t5_2tf0a,,False,False,t3_q2kvpz,t3_q2kvpz,/r/bodyweightfitness/comments/q2kvpz/who_else_dont_like_the_overconsumption_of_food/hfpqo3w/
516,hfnq795,messmaker523,There are ways to consume high amounts of quality calories without too much volume.,There are ways to consume high amounts of quality calories without too much volume.,1,2021-10-06 22:17:45,<praw.models.comment_forest.CommentForest object at 0x0000022EEE361490>,q2kvpz,bodyweightfitness,t5_2tf0a,,False,False,t3_q2kvpz,t3_q2kvpz,/r/bodyweightfitness/comments/q2kvpz/who_else_dont_like_the_overconsumption_of_food/hfnq795/
517,hfovj1h,onforspin,Just do whatever you want to do. Crazy idea isn’t it.,Just do whatever you want to do. Crazy idea isn’t it.,1,2021-10-07 04:03:17,<praw.models.comment_forest.CommentForest object at 0x0000022EEE364070>,q2kvpz,bodyweightfitness,t5_2tf0a,,False,False,t3_q2kvpz,t3_q2kvpz,/r/bodyweightfitness/comments/q2kvpz/who_else_dont_like_the_overconsumption_of_food/hfovj1h/
518,hfph838,Less-Board-5636,"I don't like it either. Stay trim and lean, unless it's some sort of competition, all this bulk doesnt matter.  Plus this is bodyweight fitness, it helps to have a good strength to weight ratio","I don't like it either. Stay trim and lean, unless it's some sort of competition, all this bulk doesnt matter.  Plus this is bodyweight fitness, it helps to have a good strength to weight ratio",1,2021-10-07 08:43:40,<praw.models.comment_forest.CommentForest object at 0x0000022EEE364430>,q2kvpz,bodyweightfitness,t5_2tf0a,,False,False,t3_q2kvpz,t3_q2kvpz,/r/bodyweightfitness/comments/q2kvpz/who_else_dont_like_the_overconsumption_of_food/hfph838/
519,hfprwum,CeCeGallagher,Try low volume foods that are high in calories. Also Peanut butter and oats are not much.,Try low volume foods that are high in calories. Also Peanut butter and oats are not much.,1,2021-10-07 11:18:13,<praw.models.comment_forest.CommentForest object at 0x0000022EEE364490>,q2kvpz,bodyweightfitness,t5_2tf0a,,False,False,t3_q2kvpz,t3_q2kvpz,/r/bodyweightfitness/comments/q2kvpz/who_else_dont_like_the_overconsumption_of_food/hfprwum/
520,hfn17jp,PoopIsAlwaysSunny,"Ignoring the rest of this, how tf would someone notice gaining 300g in a month? I’ve gained like 3kg in a meal. My weight fluctuates by 4-5kg some weeks.","Ignoring the rest of this, how tf would someone notice gaining 300g in a month? I’ve gained like 3kg in a meal. My weight fluctuates by 4-5kg some weeks.",4,2021-10-06 19:18:01,<praw.models.comment_forest.CommentForest object at 0x0000022EEE377700>,q2kvpz,bodyweightfitness,t5_2tf0a,,False,False,t3_q2kvpz,t1_hflvba5,/r/bodyweightfitness/comments/q2kvpz/who_else_dont_like_the_overconsumption_of_food/hfn17jp/
521,hfmln38,Dry_Peanut4060,"You need a positive nitrogen balance in order to build muscle, not a calorie surplus.","You need a positive nitrogen balance in order to build muscle, not a calorie surplus.",-7,2021-10-06 17:27:22,<praw.models.comment_forest.CommentForest object at 0x0000022EEE3776A0>,q2kvpz,bodyweightfitness,t5_2tf0a,,False,False,t3_q2kvpz,t1_hflvba5,/r/bodyweightfitness/comments/q2kvpz/who_else_dont_like_the_overconsumption_of_food/hfmln38/
522,hfluyur,RiskOfRains,Again i dont have the money for it. I dont know when i will. Bulking is honestly a economic question and then again its not that healthy or sustainable,Again i dont have the money for it. I dont know when i will. Bulking is honestly a economic question and then again its not that healthy or sustainable,-19,2021-10-06 14:22:49,<praw.models.comment_forest.CommentForest object at 0x0000022EEE377910>,q2kvpz,bodyweightfitness,t5_2tf0a,,False,True,t3_q2kvpz,t1_hflu9yv,/r/bodyweightfitness/comments/q2kvpz/who_else_dont_like_the_overconsumption_of_food/hfluyur/
523,hfm6gfe,R2W1E9,"Maintenance is based on TDEE which should include training expenditure. Surplus is on top of that, which he has a problem with.","Maintenance is based on TDEE which should include training expenditure. Surplus is on top of that, which he has a problem with.",1,2021-10-06 15:44:12,<praw.models.comment_forest.CommentForest object at 0x0000022EEE361670>,q2kvpz,bodyweightfitness,t5_2tf0a,,False,False,t3_q2kvpz,t1_hfm0irn,/r/bodyweightfitness/comments/q2kvpz/who_else_dont_like_the_overconsumption_of_food/hfm6gfe/
524,hfm2lxd,RiskOfRains,Question then. Are drinikng/spoon of oil with peanut butter a Good option for fast calories?,Question then. Are drinikng/spoon of oil with peanut butter a Good option for fast calories?,1,2021-10-06 15:17:14,<praw.models.comment_forest.CommentForest object at 0x0000022EEE361400>,q2kvpz,bodyweightfitness,t5_2tf0a,,False,True,t3_q2kvpz,t1_hflz3i5,/r/bodyweightfitness/comments/q2kvpz/who_else_dont_like_the_overconsumption_of_food/hfm2lxd/
525,hfq1s6y,No-Zombie-1990,Bulking is pretty expensive! Alternatives should help keep the budget low while gaining the same results. Sometime I wish youtubers would give alternatives !,Bulking is pretty expensive! Alternatives should help keep the budget low while gaining the same results. Sometime I wish youtubers would give alternatives !,0,2021-10-07 12:55:59,<praw.models.comment_forest.CommentForest object at 0x0000022EEE361850>,q2kvpz,bodyweightfitness,t5_2tf0a,,False,False,t3_q2kvpz,t1_hflz3i5,/r/bodyweightfitness/comments/q2kvpz/who_else_dont_like_the_overconsumption_of_food/hfq1s6y/
526,hfn5jaf,G_no_sis,Little man wants everyone to congratulate him on his cheap beans and potatoes farts basically,Little man wants everyone to congratulate him on his cheap beans and potatoes farts basically,5,2021-10-06 19:48:10,<praw.models.comment_forest.CommentForest object at 0x0000022EEE361CA0>,q2kvpz,bodyweightfitness,t5_2tf0a,,False,False,t3_q2kvpz,t1_hfmfgw7,/r/bodyweightfitness/comments/q2kvpz/who_else_dont_like_the_overconsumption_of_food/hfn5jaf/
527,hflrkes,RiskOfRains,"THANK YOU! Like no one like at least form what i have watched mentions that. They just say just bulk bro eat bro. 

&#x200B;

Even people i train with say that and look at me like im some sort of idiot when i say that i dont bulk.","THANK YOU! Like no one like at least form what i have watched mentions that. They just say just bulk bro eat bro. 

&#x200B;

Even people i train with say that and look at me like im some sort of idiot when i say that i dont bulk.",-8,2021-10-06 13:57:29,<praw.models.comment_forest.CommentForest object at 0x0000022EEE361160>,q2kvpz,bodyweightfitness,t5_2tf0a,,False,True,t3_q2kvpz,t1_hflqxh3,/r/bodyweightfitness/comments/q2kvpz/who_else_dont_like_the_overconsumption_of_food/hflrkes/
528,hfmg71q,force522001,"When i was a teen and into fitness, i ate when i was hungry and was skinny as hell. Now in my 20s i eat at a slight calorie surplus and my gains are incredible. I am lean without that fat you are talking. If i kept eating when i was hungry i would still be skinny.","When i was a teen and into fitness, i ate when i was hungry and was skinny as hell. Now in my 20s i eat at a slight calorie surplus and my gains are incredible. I am lean without that fat you are talking. If i kept eating when i was hungry i would still be skinny.",4,2021-10-06 16:50:21,<praw.models.comment_forest.CommentForest object at 0x0000022EEE361DC0>,q2kvpz,bodyweightfitness,t5_2tf0a,,False,False,t3_q2kvpz,t1_hflznlb,/r/bodyweightfitness/comments/q2kvpz/who_else_dont_like_the_overconsumption_of_food/hfmg71q/
529,hfm19a1,,[deleted],[deleted],1,2021-10-06 15:07:35,<praw.models.comment_forest.CommentForest object at 0x0000022EEE361430>,q2kvpz,bodyweightfitness,t5_2tf0a,,False,False,t3_q2kvpz,t1_hflznlb,/r/bodyweightfitness/comments/q2kvpz/who_else_dont_like_the_overconsumption_of_food/hfm19a1/
530,hfm6tsz,AdministrativeSwim44,Millions of people starving to death would disagree.,Millions of people starving to death would disagree.,6,2021-10-06 15:46:43,<praw.models.comment_forest.CommentForest object at 0x0000022EEE361550>,q2kvpz,bodyweightfitness,t5_2tf0a,,False,False,t3_q2kvpz,t1_hflxccm,/r/bodyweightfitness/comments/q2kvpz/who_else_dont_like_the_overconsumption_of_food/hfm6tsz/
531,hfq7z2u,surr34lity,Two words. Bull shit,Two words. Bull shit,2,2021-10-07 13:47:26,<praw.models.comment_forest.CommentForest object at 0x0000022EEE361280>,q2kvpz,bodyweightfitness,t5_2tf0a,,False,False,t3_q2kvpz,t1_hfpqo3w,/r/bodyweightfitness/comments/q2kvpz/who_else_dont_like_the_overconsumption_of_food/hfq7z2u/
532,hfpqu8w,RiskOfRains,Maingaining😎,Maingaining😎,1,2021-10-07 11:05:19,<praw.models.comment_forest.CommentForest object at 0x0000022EEE3612B0>,q2kvpz,bodyweightfitness,t5_2tf0a,,False,True,t3_q2kvpz,t1_hfpqo3w,/r/bodyweightfitness/comments/q2kvpz/who_else_dont_like_the_overconsumption_of_food/hfpqu8w/
533,hfnyc7w,RiskOfRains,Any recommendations?,Any recommendations?,1,2021-10-06 23:22:50,<praw.models.comment_forest.CommentForest object at 0x0000022EEE364550>,q2kvpz,bodyweightfitness,t5_2tf0a,,False,True,t3_q2kvpz,t1_hfnq795,/r/bodyweightfitness/comments/q2kvpz/who_else_dont_like_the_overconsumption_of_food/hfnyc7w/
534,hfpijhw,RiskOfRains,"I agree. Since i started and tried bulking i cant even do more then 10 pull ups im so fking heavy. And i prefer being lean. My body type looks better lean then bloated? Like fitness is so many different ways. And honestly bulking just dont feel that good.

&#x200B;

And again overconsumption dont sit well with me. When people around the world have a hard time getting food. And all the food we waste overall in the western countires it just makes me angry! Eat what you need too feel good dont over eat.","I agree. Since i started and tried bulking i cant even do more then 10 pull ups im so fking heavy. And i prefer being lean. My body type looks better lean then bloated? Like fitness is so many different ways. And honestly bulking just dont feel that good.

&#x200B;

And again overconsumption dont sit well with me. When people around the world have a hard time getting food. And all the food we waste overall in the western countires it just makes me angry! Eat what you need too feel good dont over eat.",2,2021-10-07 09:05:03,<praw.models.comment_forest.CommentForest object at 0x0000022EEE3647F0>,q2kvpz,bodyweightfitness,t5_2tf0a,,False,True,t3_q2kvpz,t1_hfph838,/r/bodyweightfitness/comments/q2kvpz/who_else_dont_like_the_overconsumption_of_food/hfpijhw/
535,hfn5pau,AIkazarr,"That is not really normal. 4-5kg per week has to be the difference in maybe water weight and different times if the measurement before/after a meal might add 1kg maybe ?

For most of us it is a steady progress","That is not really normal. 4-5kg per week has to be the difference in maybe water weight and different times if the measurement before/after a meal might add 1kg maybe ?

For most of us it is a steady progress",1,2021-10-06 19:49:18,<praw.models.comment_forest.CommentForest object at 0x0000022EEE377730>,q2kvpz,bodyweightfitness,t5_2tf0a,,False,False,t3_q2kvpz,t1_hfn17jp,/r/bodyweightfitness/comments/q2kvpz/who_else_dont_like_the_overconsumption_of_food/hfn5pau/
536,hfmpr0o,Striking-Tip7504,"Interesting, and how do you get a positive nitrogen balance? 

(Also quite curious how you think the answer you provide and this level of detail would help a beginner. And not just overwhelm them with information)","Interesting, and how do you get a positive nitrogen balance? 

(Also quite curious how you think the answer you provide and this level of detail would help a beginner. And not just overwhelm them with information)",8,2021-10-06 17:55:38,<praw.models.comment_forest.CommentForest object at 0x0000022EEE3778E0>,q2kvpz,bodyweightfitness,t5_2tf0a,,False,False,t3_q2kvpz,t1_hfmln38,/r/bodyweightfitness/comments/q2kvpz/who_else_dont_like_the_overconsumption_of_food/hfmpr0o/
537,hfm89eh,AdministrativeSwim44,"There are plenty of ways to eat in a surplus while on a budget. But if you don't want to, then don't. The only person  you have to please is yourself.","There are plenty of ways to eat in a surplus while on a budget. But if you don't want to, then don't. The only person  you have to please is yourself.",14,2021-10-06 15:56:20,<praw.models.comment_forest.CommentForest object at 0x0000022EEE377C10>,q2kvpz,bodyweightfitness,t5_2tf0a,,False,False,t3_q2kvpz,t1_hfluyur,/r/bodyweightfitness/comments/q2kvpz/who_else_dont_like_the_overconsumption_of_food/hfm89eh/
538,hflxbn0,big_nick_1,So why are you blaming fitness influencers because you don't have money?,So why are you blaming fitness influencers because you don't have money?,18,2021-10-06 14:39:57,<praw.models.comment_forest.CommentForest object at 0x0000022EEE377B80>,q2kvpz,bodyweightfitness,t5_2tf0a,,False,False,t3_q2kvpz,t1_hfluyur,/r/bodyweightfitness/comments/q2kvpz/who_else_dont_like_the_overconsumption_of_food/hflxbn0/
539,hfmflp4,force522001,"Oats, milk,eggs, bread and beans are cheap as hell.","Oats, milk,eggs, bread and beans are cheap as hell.",7,2021-10-06 16:46:19,<praw.models.comment_forest.CommentForest object at 0x0000022EEE377CA0>,q2kvpz,bodyweightfitness,t5_2tf0a,,False,False,t3_q2kvpz,t1_hfluyur,/r/bodyweightfitness/comments/q2kvpz/who_else_dont_like_the_overconsumption_of_food/hfmflp4/
540,hfogyi0,AzeTheGreat,"Buy a $4 jar of peanut butter from Walmart.  Eat two servings per day.  There's your 380 Cal surplus at $1.6 per week.  If that's genuinely too much money for you, you can go to a food bank.","Buy a $4 jar of peanut butter from Walmart.  Eat two servings per day.  There's your 380 Cal surplus at $1.6 per week.  If that's genuinely too much money for you, you can go to a food bank.",2,2021-10-07 01:49:42,<praw.models.comment_forest.CommentForest object at 0x0000022EEE377C40>,q2kvpz,bodyweightfitness,t5_2tf0a,,False,False,t3_q2kvpz,t1_hfluyur,/r/bodyweightfitness/comments/q2kvpz/who_else_dont_like_the_overconsumption_of_food/hfogyi0/
541,hfqc3o0,EspacioBlanq,"Even if you were eating 1000 calories extra a day, that's like a dollar worth of rice a day","Even if you were eating 1000 calories extra a day, that's like a dollar worth of rice a day",1,2021-10-07 14:19:24,<praw.models.comment_forest.CommentForest object at 0x0000022EEE361B80>,q2kvpz,bodyweightfitness,t5_2tf0a,,False,False,t3_q2kvpz,t1_hfluyur,/r/bodyweightfitness/comments/q2kvpz/who_else_dont_like_the_overconsumption_of_food/hfqc3o0/
542,hfm7tnm,SpaceJunk645,TDEE I still think of as existing since you used that energy over the day and it has to be coming from somewhere,TDEE I still think of as existing since you used that energy over the day and it has to be coming from somewhere,1,2021-10-06 15:53:24,<praw.models.comment_forest.CommentForest object at 0x0000022EEE361970>,q2kvpz,bodyweightfitness,t5_2tf0a,,False,False,t3_q2kvpz,t1_hfm6gfe,/r/bodyweightfitness/comments/q2kvpz/who_else_dont_like_the_overconsumption_of_food/hfm7tnm/
543,hfm35qw,surr34lity,"Peanutbutter yes PBJ for example is good and cheap. Look up the shunt shake. Easy 1000kcal. Eat oatmeal. Low-fat quark is Great for protein and damn cheap.  
I used to bulk on a college students budget without working a side job. It’s absolutely doable.

Oil? Read too much on gainit lol  
Do yourself and your toilet a favor and don’t.","Peanutbutter yes PBJ for example is good and cheap. Look up the shunt shake. Easy 1000kcal. Eat oatmeal. Low-fat quark is Great for protein and damn cheap.  
I used to bulk on a college students budget without working a side job. It’s absolutely doable.

Oil? Read too much on gainit lol  
Do yourself and your toilet a favor and don’t.",6,2021-10-06 15:21:04,<praw.models.comment_forest.CommentForest object at 0x0000022EEE361DF0>,q2kvpz,bodyweightfitness,t5_2tf0a,,False,False,t3_q2kvpz,t1_hfm2lxd,/r/bodyweightfitness/comments/q2kvpz/who_else_dont_like_the_overconsumption_of_food/hfm35qw/
544,hfnhub6,,"> drinikng/spoon of oil with peanut butter

no wonder you hate bulking if you give yourself diarrhea","> drinikng/spoon of oil with peanut butter

no wonder you hate bulking if you give yourself diarrhea",5,2021-10-06 21:15:08,<praw.models.comment_forest.CommentForest object at 0x0000022EEE3617F0>,q2kvpz,bodyweightfitness,t5_2tf0a,,False,False,t3_q2kvpz,t1_hfm2lxd,/r/bodyweightfitness/comments/q2kvpz/who_else_dont_like_the_overconsumption_of_food/hfnhub6/
545,hfqi382,surr34lity,"It’s really not. 500g oats are like 40ct, 1L milk is 69ct if you don’t buy bio. Sugar is somewhere in a similar range. So for under 2€ you get 5 days worth of 500kcal surplus. As the sugar lasts longer after that you’ll be at ~ 1€ for five days that’s a little over 20ct per day. So tell me again how bulking is expensive","It’s really not. 500g oats are like 40ct, 1L milk is 69ct if you don’t buy bio. Sugar is somewhere in a similar range. So for under 2€ you get 5 days worth of 500kcal surplus. As the sugar lasts longer after that you’ll be at ~ 1€ for five days that’s a little over 20ct per day. So tell me again how bulking is expensive",1,2021-10-07 15:02:50,<praw.models.comment_forest.CommentForest object at 0x0000022EEE361F40>,q2kvpz,bodyweightfitness,t5_2tf0a,,False,False,t3_q2kvpz,t1_hfq1s6y,/r/bodyweightfitness/comments/q2kvpz/who_else_dont_like_the_overconsumption_of_food/hfqi382/
546,hfna3qn,force522001,I for real dont understand the meaning of this post.,I for real dont understand the meaning of this post.,2,2021-10-06 20:19:52,<praw.models.comment_forest.CommentForest object at 0x0000022EEE3615B0>,q2kvpz,bodyweightfitness,t5_2tf0a,,False,False,t3_q2kvpz,t1_hfn5jaf,/r/bodyweightfitness/comments/q2kvpz/who_else_dont_like_the_overconsumption_of_food/hfna3qn/
547,hflshdv,uvreactive,I bet there are other folks out there making youtube videos that espouse different viewpoints! The youtube algorithm does suggest videos based on your history though so that's probably why it seems like everyone has the same viewpoint,I bet there are other folks out there making youtube videos that espouse different viewpoints! The youtube algorithm does suggest videos based on your history though so that's probably why it seems like everyone has the same viewpoint,7,2021-10-06 14:04:30,<praw.models.comment_forest.CommentForest object at 0x0000022EEE361790>,q2kvpz,bodyweightfitness,t5_2tf0a,,False,False,t3_q2kvpz,t1_hflrkes,/r/bodyweightfitness/comments/q2kvpz/who_else_dont_like_the_overconsumption_of_food/hflshdv/
548,hfm1d26,,Whatever you say,Whatever you say,-2,2021-10-06 15:08:21,<praw.models.comment_forest.CommentForest object at 0x0000022EEE3610A0>,q2kvpz,bodyweightfitness,t5_2tf0a,,False,False,t3_q2kvpz,t1_hfm19a1,/r/bodyweightfitness/comments/q2kvpz/who_else_dont_like_the_overconsumption_of_food/hfm1d26/
549,hfmg85h,Snif3425,Don't be obtuse. You know what I meant.,Don't be obtuse. You know what I meant.,2,2021-10-06 16:50:33,<praw.models.comment_forest.CommentForest object at 0x0000022EEE361640>,q2kvpz,bodyweightfitness,t5_2tf0a,,False,False,t3_q2kvpz,t1_hfm6tsz,/r/bodyweightfitness/comments/q2kvpz/who_else_dont_like_the_overconsumption_of_food/hfmg85h/
550,hfq81du,Ninety-Degree-Squat,I’m open to learning. Why bullshit?,I’m open to learning. Why bullshit?,1,2021-10-07 13:47:57,<praw.models.comment_forest.CommentForest object at 0x0000022EEE3649D0>,q2kvpz,bodyweightfitness,t5_2tf0a,,False,False,t3_q2kvpz,t1_hfq7z2u,/r/bodyweightfitness/comments/q2kvpz/who_else_dont_like_the_overconsumption_of_food/hfq81du/
