,ID,Author,body,Comment,Score,Created On,Replies,Submission,Subreddit,Subreddit_ID,Distinguished,Edited,Is_submitter,link_id,Parent_id,Permalink
0,hbxpxwm,,Have you tried getting a permit?,Have you tried getting a permit?,121,2021-09-07 14:43:47,<praw.models.comment_forest.CommentForest object at 0x0000022EEE4C9790>,pjodqj,bodyweightfitness,t5_2tf0a,,False,False,t3_pjodqj,t3_pjodqj,/r/bodyweightfitness/comments/pjodqj/park_manager_claims_we_arent_allowed_to_hang/hbxpxwm/
1,hby3dfp,,"This will sound bitchy. Sorry.

I've read all of your comments here. You sound like a teenager trying to argue their way out of some arbitrary rule instead of just doing what the parent has demanded. It doesn't matter what you think is fair, logical, or any of the other examples you cited. The park manager has told you what is required.

&#x200B;

>\[Getting a permit is\] a long process and costs money

You have two real choices:

1. Attempt to get a permit. I assume you're correct in that it will take some time and cost money.
2. Fight this legally which... will take time and money.

An alternative decision is to flout the rules and hope you don't get caught and fined.

Displaced\_in\_Space has what I think is the best solution for potential long term success, which will still take time and money. Call the manager's bluff. If you get a citation, it will have to reference the statute of which you are supposedly in violation. For example, if you don't obey a stop sign, you have ""failed to obey a traffic control device,"" which is the legalese of the statute. Once you have that, then you can fight it, either for your specific circumstance or to get the law changed for everyone.

Of course, ideally you can get the manager to *tell* you the statute so you don't have to deal with a fine and those legal repercussions, but it doesn't sound like they're cooperating.

There is also the local news, which can be used as a tool in situations like these. It all depends on what you're willing to go through for what you want.","This will sound bitchy. Sorry.

I've read all of your comments here. You sound like a teenager trying to argue their way out of some arbitrary rule instead of just doing what the parent has demanded. It doesn't matter what you think is fair, logical, or any of the other examples you cited. The park manager has told you what is required.

&#x200B;

>\[Getting a permit is\] a long process and costs money

You have two real choices:

1. Attempt to get a permit. I assume you're correct in that it will take some time and cost money.
2. Fight this legally which... will take time and money.

An alternative decision is to flout the rules and hope you don't get caught and fined.

Displaced\_in\_Space has what I think is the best solution for potential long term success, which will still take time and money. Call the manager's bluff. If you get a citation, it will have to reference the statute of which you are supposedly in violation. For example, if you don't obey a stop sign, you have ""failed to obey a traffic control device,"" which is the legalese of the statute. Once you have that, then you can fight it, either for your specific circumstance or to get the law changed for everyone.

Of course, ideally you can get the manager to *tell* you the statute so you don't have to deal with a fine and those legal repercussions, but it doesn't sound like they're cooperating.

There is also the local news, which can be used as a tool in situations like these. It all depends on what you're willing to go through for what you want.",94,2021-09-07 16:16:28,<praw.models.comment_forest.CommentForest object at 0x0000022EEE4C97F0>,pjodqj,bodyweightfitness,t5_2tf0a,,1631031799.0,False,t3_pjodqj,t3_pjodqj,/r/bodyweightfitness/comments/pjodqj/park_manager_claims_we_arent_allowed_to_hang/hby3dfp/
2,hby8yaz,kj_003,"In semi-defense of OP, I hang a hammock at my local park between trees and have never had an issue with park management telling me to take it down. Might be luck on my end, or my city just might not care.

To OP: I understand you’re frustrated, but it seems like there is not much you can do outside of the parameters outlined already. You can try and get a permit, or you can carry on as you are and risk being barred from the park. It sucks, but that’s bureaucracy for you. Good luck.","In semi-defense of OP, I hang a hammock at my local park between trees and have never had an issue with park management telling me to take it down. Might be luck on my end, or my city just might not care.

To OP: I understand you’re frustrated, but it seems like there is not much you can do outside of the parameters outlined already. You can try and get a permit, or you can carry on as you are and risk being barred from the park. It sucks, but that’s bureaucracy for you. Good luck.",16,2021-09-07 16:54:34,<praw.models.comment_forest.CommentForest object at 0x0000022EEE4C99D0>,pjodqj,bodyweightfitness,t5_2tf0a,,False,False,t3_pjodqj,t3_pjodqj,/r/bodyweightfitness/comments/pjodqj/park_manager_claims_we_arent_allowed_to_hang/hby8yaz/
3,hby6ife,_Lane_,"Ask your local city councillor’s office (or state rep’s office, it’s a regional park) (or the non-US equivalent in your area) for help. They like to do constituent service and this one frankly sounds like it could be an easy win for them.","Ask your local city councillor’s office (or state rep’s office, it’s a regional park) (or the non-US equivalent in your area) for help. They like to do constituent service and this one frankly sounds like it could be an easy win for them.",13,2021-09-07 16:37:53,<praw.models.comment_forest.CommentForest object at 0x0000022EEE4D4580>,pjodqj,bodyweightfitness,t5_2tf0a,,False,False,t3_pjodqj,t3_pjodqj,/r/bodyweightfitness/comments/pjodqj/park_manager_claims_we_arent_allowed_to_hang/hby6ife/
4,hbyduaf,justanotherlead,Your county/park likely has a public nuisance statue that is at the discretion of the park manager or park and rec department manager. Either way your remedy is to get a permit or continue as you please and hope there are no ramifications.,Your county/park likely has a public nuisance statue that is at the discretion of the park manager or park and rec department manager. Either way your remedy is to get a permit or continue as you please and hope there are no ramifications.,7,2021-09-07 17:28:03,<praw.models.comment_forest.CommentForest object at 0x0000022EEE4D47C0>,pjodqj,bodyweightfitness,t5_2tf0a,,False,False,t3_pjodqj,t3_pjodqj,/r/bodyweightfitness/comments/pjodqj/park_manager_claims_we_arent_allowed_to_hang/hbyduaf/
5,hbxsj7h,Displaced_in_Space,"Ask them for the code citation she is enforcing or to issue you a ticket.  

Then research and fight that with whatever agency (most likely city) she works for.   If you are t leaving them permanently affixed, she’s likely full if shit.","Ask them for the code citation she is enforcing or to issue you a ticket.  

Then research and fight that with whatever agency (most likely city) she works for.   If you are t leaving them permanently affixed, she’s likely full if shit.",33,2021-09-07 15:02:16,<praw.models.comment_forest.CommentForest object at 0x0000022EEE4D4A00>,pjodqj,bodyweightfitness,t5_2tf0a,,False,False,t3_pjodqj,t3_pjodqj,/r/bodyweightfitness/comments/pjodqj/park_manager_claims_we_arent_allowed_to_hang/hbxsj7h/
6,hby8tzj,LibRAWRian,"I work with our city for planning large outdoor events. Every person/group/act playing in the bandshell has to carry $10,000 in liability insurance. And this scenario has no people trying to turn the bandshell into their personal CrossFit gym.

You have zero control over what other people do. You claim that you’ll sign waivers. Well, those aren’t always enforceable. We have people sign waivers and if someone was grievously injured they can still turn around and sue. Now, if they let you sign waivers they’d be admitting that you’re doing something potentially dangerous. They’re covering their asses, and you can’t see where their coming from?","I work with our city for planning large outdoor events. Every person/group/act playing in the bandshell has to carry $10,000 in liability insurance. And this scenario has no people trying to turn the bandshell into their personal CrossFit gym.

You have zero control over what other people do. You claim that you’ll sign waivers. Well, those aren’t always enforceable. We have people sign waivers and if someone was grievously injured they can still turn around and sue. Now, if they let you sign waivers they’d be admitting that you’re doing something potentially dangerous. They’re covering their asses, and you can’t see where their coming from?",16,2021-09-07 16:53:45,<praw.models.comment_forest.CommentForest object at 0x0000022EEE4D4A60>,pjodqj,bodyweightfitness,t5_2tf0a,,False,False,t3_pjodqj,t3_pjodqj,/r/bodyweightfitness/comments/pjodqj/park_manager_claims_we_arent_allowed_to_hang/hby8tzj/
7,hbz5roy,Ok-Personality-9920,Why the hell does that post have so many dislikes?,Why the hell does that post have so many dislikes?,6,2021-09-07 20:39:45,<praw.models.comment_forest.CommentForest object at 0x0000022EEE4D4B20>,pjodqj,bodyweightfitness,t5_2tf0a,,False,False,t3_pjodqj,t3_pjodqj,/r/bodyweightfitness/comments/pjodqj/park_manager_claims_we_arent_allowed_to_hang/hbz5roy/
8,hbyestm,phixional,"What happens when in the slightest of chance one of you fall and break you leg, arm or neck? Yeah I know the likelihood is basically zero, but there is a chance. They have to cover their ass as dumb as it may seem to you.","What happens when in the slightest of chance one of you fall and break you leg, arm or neck? Yeah I know the likelihood is basically zero, but there is a chance. They have to cover their ass as dumb as it may seem to you.",13,2021-09-07 17:34:36,<praw.models.comment_forest.CommentForest object at 0x0000022EEE4D4B80>,pjodqj,bodyweightfitness,t5_2tf0a,,False,False,t3_pjodqj,t3_pjodqj,/r/bodyweightfitness/comments/pjodqj/park_manager_claims_we_arent_allowed_to_hang/hbyestm/
9,hbxth7i,Kaitensatsuma,"Ask her to tell you exactly what form you'd need to fill out.

Either there will be such a permit form which you would then fill out, or she's full of crap.

There is ***some*** truth to what she says, but in the same way the city might be held for ***negligence*** and other claims if they, for example [didn't properly secure a gate](https://www.mercurynews.com/2021/06/16/family-sues-after-newlywed-is-killed-by-swinging-gate-at-arches-national-park/) the state **wouldn't** be as easily held responsible for someone doing something that wouldn't have been considered a regular risk.","Ask her to tell you exactly what form you'd need to fill out.

Either there will be such a permit form which you would then fill out, or she's full of crap.

There is ***some*** truth to what she says, but in the same way the city might be held for ***negligence*** and other claims if they, for example [didn't properly secure a gate](https://www.mercurynews.com/2021/06/16/family-sues-after-newlywed-is-killed-by-swinging-gate-at-arches-national-park/) the state **wouldn't** be as easily held responsible for someone doing something that wouldn't have been considered a regular risk.",15,2021-09-07 15:08:54,<praw.models.comment_forest.CommentForest object at 0x0000022EEE4D4C40>,pjodqj,bodyweightfitness,t5_2tf0a,,1631032769.0,False,t3_pjodqj,t3_pjodqj,/r/bodyweightfitness/comments/pjodqj/park_manager_claims_we_arent_allowed_to_hang/hbxth7i/
10,hbys1zu,Legendary_Hercules,"Considering how argumentative you are in the comments, you must have been a pleasure to deal with for the park manager.","Considering how argumentative you are in the comments, you must have been a pleasure to deal with for the park manager.",11,2021-09-07 19:06:22,<praw.models.comment_forest.CommentForest object at 0x0000022EEE4D4E20>,pjodqj,bodyweightfitness,t5_2tf0a,,False,False,t3_pjodqj,t3_pjodqj,/r/bodyweightfitness/comments/pjodqj/park_manager_claims_we_arent_allowed_to_hang/hbys1zu/
11,hbykplj,GlossySubstrate," Ask again in writing for the policy or ordinance that requires you to get a permit and also ask what the permitting process is. 

If that doesn’t work, talk to your elected official. It’s occasionally amazing how flexible bureaucracies can be when an elected official gets involved. Be sure to mention how unhappy you are and how you feel that so-and-so in the parks dept is being unreasonably obstructionary.

As a last resort, and it’s almost definitely not worth doing, lawyer up. You could build a great home gym with ring mounts galore for what an attorney will cost you, but your problem would likely go away.




It’s almost definitely not worth lawyering up for this."," Ask again in writing for the policy or ordinance that requires you to get a permit and also ask what the permitting process is. 

If that doesn’t work, talk to your elected official. It’s occasionally amazing how flexible bureaucracies can be when an elected official gets involved. Be sure to mention how unhappy you are and how you feel that so-and-so in the parks dept is being unreasonably obstructionary.

As a last resort, and it’s almost definitely not worth doing, lawyer up. You could build a great home gym with ring mounts galore for what an attorney will cost you, but your problem would likely go away.




It’s almost definitely not worth lawyering up for this.",3,2021-09-07 18:15:28,<praw.models.comment_forest.CommentForest object at 0x0000022EEE4D3220>,pjodqj,bodyweightfitness,t5_2tf0a,,False,False,t3_pjodqj,t3_pjodqj,/r/bodyweightfitness/comments/pjodqj/park_manager_claims_we_arent_allowed_to_hang/hbykplj/
12,hbys9x7,AnarchoMcTasteeFreez,Fill out the relevant Gains Form - GNZ-23(d) - listing types and amounts of gains. Make sure to itemize your Gains.,Fill out the relevant Gains Form - GNZ-23(d) - listing types and amounts of gains. Make sure to itemize your Gains.,3,2021-09-07 19:07:54,<praw.models.comment_forest.CommentForest object at 0x0000022EEE4D3490>,pjodqj,bodyweightfitness,t5_2tf0a,,False,False,t3_pjodqj,t3_pjodqj,/r/bodyweightfitness/comments/pjodqj/park_manager_claims_we_arent_allowed_to_hang/hbys9x7/
13,hby98iv,Fuenllana,Karen don´t surf,Karen don´t surf,5,2021-09-07 16:56:29,<praw.models.comment_forest.CommentForest object at 0x0000022EEE4D35B0>,pjodqj,bodyweightfitness,t5_2tf0a,,False,False,t3_pjodqj,t3_pjodqj,/r/bodyweightfitness/comments/pjodqj/park_manager_claims_we_arent_allowed_to_hang/hby98iv/
14,hbyc86c,Way-Reasonable,"This same thing happened to me in Toronto.  I found trees hidden away from where they would go (not the easiest), or exercised at night where I  could see car lights coming from far off.

Then I realized that Toronto had callisthenics parks with high pull-up bars.  So that's where I go now, however, I usually prefer the swing set in the adjacent playground.","This same thing happened to me in Toronto.  I found trees hidden away from where they would go (not the easiest), or exercised at night where I  could see car lights coming from far off.

Then I realized that Toronto had callisthenics parks with high pull-up bars.  So that's where I go now, however, I usually prefer the swing set in the adjacent playground.",2,2021-09-07 17:17:01,<praw.models.comment_forest.CommentForest object at 0x0000022EEE4D36D0>,pjodqj,bodyweightfitness,t5_2tf0a,,False,False,t3_pjodqj,t3_pjodqj,/r/bodyweightfitness/comments/pjodqj/park_manager_claims_we_arent_allowed_to_hang/hbyc86c/
15,hbxr0z2,larvarto,I would try to figure out the permitting process and go from there. Alternatively change the time you’re going or find another park. If you’re going at off hours how is there a park manager there to witness the infraction? Is the park only open when there are rangers there?,I would try to figure out the permitting process and go from there. Alternatively change the time you’re going or find another park. If you’re going at off hours how is there a park manager there to witness the infraction? Is the park only open when there are rangers there?,4,2021-09-07 14:51:38,<praw.models.comment_forest.CommentForest object at 0x0000022EEE4D3760>,pjodqj,bodyweightfitness,t5_2tf0a,,False,False,t3_pjodqj,t3_pjodqj,/r/bodyweightfitness/comments/pjodqj/park_manager_claims_we_arent_allowed_to_hang/hbxr0z2/
16,hby6tm2,,Keep doing it and ignore her until she writes you a ticket which sites the exact regulation.,Keep doing it and ignore her until she writes you a ticket which sites the exact regulation.,2,2021-09-07 16:40:03,<praw.models.comment_forest.CommentForest object at 0x0000022EEE4D37F0>,pjodqj,bodyweightfitness,t5_2tf0a,,False,False,t3_pjodqj,t3_pjodqj,/r/bodyweightfitness/comments/pjodqj/park_manager_claims_we_arent_allowed_to_hang/hby6tm2/
17,hbyuid2,IH8DwnvoteComplainrs,My question is who is going to enforce it and what is the penalty...,My question is who is going to enforce it and what is the penalty...,1,2021-09-07 19:23:16,<praw.models.comment_forest.CommentForest object at 0x0000022EEE4D3850>,pjodqj,bodyweightfitness,t5_2tf0a,,False,False,t3_pjodqj,t3_pjodqj,/r/bodyweightfitness/comments/pjodqj/park_manager_claims_we_arent_allowed_to_hang/hbyuid2/
18,hbydqk7,gimmiethesauce,"I feel for you dude. Honestly that sounds like an overzealous employee power tripping, but if she has a leg to stand on I guess you have to deal with it. 

Seems like a topic for a sub similar to r/legaladvice though, but I think that other replies are steering you in the right direction.

I do empathize with this; definitely a frustrating situation and I don't know why people are calling you a child for talking about it, as if insulting people is not childish.","I feel for you dude. Honestly that sounds like an overzealous employee power tripping, but if she has a leg to stand on I guess you have to deal with it. 

Seems like a topic for a sub similar to r/legaladvice though, but I think that other replies are steering you in the right direction.

I do empathize with this; definitely a frustrating situation and I don't know why people are calling you a child for talking about it, as if insulting people is not childish.",1,2021-09-07 17:27:22,<praw.models.comment_forest.CommentForest object at 0x0000022EEE4D38B0>,pjodqj,bodyweightfitness,t5_2tf0a,,False,False,t3_pjodqj,t3_pjodqj,/r/bodyweightfitness/comments/pjodqj/park_manager_claims_we_arent_allowed_to_hang/hbydqk7/
19,hby79at,Stavkat,"""I asked what rule it was breaking, or where it said we couldn't hang   
them, and there was no answer beyond ""liability to the city and you'd   
need a permit/permission/etc"". She didn't seem to want to budge. ""

If they can't point to a rule, do it until they tell you the rule, lol.  (Maybe do you own rule review research first too)","""I asked what rule it was breaking, or where it said we couldn't hang   
them, and there was no answer beyond ""liability to the city and you'd   
need a permit/permission/etc"". She didn't seem to want to budge. ""

If they can't point to a rule, do it until they tell you the rule, lol.  (Maybe do you own rule review research first too)",-2,2021-09-07 16:43:02,<praw.models.comment_forest.CommentForest object at 0x0000022EEE4D39A0>,pjodqj,bodyweightfitness,t5_2tf0a,,False,False,t3_pjodqj,t3_pjodqj,/r/bodyweightfitness/comments/pjodqj/park_manager_claims_we_arent_allowed_to_hang/hby79at/
20,hbypc88,NeatTransportation11,Might be worth receiving an infraction notice and then taking it to court.,Might be worth receiving an infraction notice and then taking it to court.,-1,2021-09-07 18:47:42,<praw.models.comment_forest.CommentForest object at 0x0000022EEE4D3A60>,pjodqj,bodyweightfitness,t5_2tf0a,,False,False,t3_pjodqj,t3_pjodqj,/r/bodyweightfitness/comments/pjodqj/park_manager_claims_we_arent_allowed_to_hang/hbypc88/
21,hbyej3n,,[deleted],[deleted],-2,2021-09-07 17:32:46,<praw.models.comment_forest.CommentForest object at 0x0000022EEE4D3B20>,pjodqj,bodyweightfitness,t5_2tf0a,,False,False,t3_pjodqj,t3_pjodqj,/r/bodyweightfitness/comments/pjodqj/park_manager_claims_we_arent_allowed_to_hang/hbyej3n/
22,hbxw983,Ready_Ad_4874,"Lmao wtf tell em to frick off. 

At the start of the pandemic, me and a few other people started jogging at the local high school. Every other time, the cops showed up and gave us the same speech. It's trespassing, it's illegal. Please go. But they really don't care if you're exercising","Lmao wtf tell em to frick off. 

At the start of the pandemic, me and a few other people started jogging at the local high school. Every other time, the cops showed up and gave us the same speech. It's trespassing, it's illegal. Please go. But they really don't care if you're exercising",-19,2021-09-07 15:27:56,<praw.models.comment_forest.CommentForest object at 0x0000022EEE4D3B80>,pjodqj,bodyweightfitness,t5_2tf0a,,False,False,t3_pjodqj,t3_pjodqj,/r/bodyweightfitness/comments/pjodqj/park_manager_claims_we_arent_allowed_to_hang/hbxw983/
23,hbzkf8m,Thomas_Eee,"As far as they're concerned, you're rings could be a pipe bomb. It doesn't matter that they're rings, they're yours, not the parks. If a someone manages to injure themselves, you are liable and they want their i's dotted and t's crossed should that ever happen.

To make it simple.

If it's deemed as yours, you're liable.

If it's not deemed as yours, it's their problem, and they're liable. 

They don't want it to be their problem. So it's yours.","As far as they're concerned, you're rings could be a pipe bomb. It doesn't matter that they're rings, they're yours, not the parks. If a someone manages to injure themselves, you are liable and they want their i's dotted and t's crossed should that ever happen.

To make it simple.

If it's deemed as yours, you're liable.

If it's not deemed as yours, it's their problem, and they're liable. 

They don't want it to be their problem. So it's yours.",-1,2021-09-07 22:27:01,<praw.models.comment_forest.CommentForest object at 0x0000022EEE4D3C70>,pjodqj,bodyweightfitness,t5_2tf0a,,False,False,t3_pjodqj,t3_pjodqj,/r/bodyweightfitness/comments/pjodqj/park_manager_claims_we_arent_allowed_to_hang/hbzkf8m/
24,hby4qdv,Zero219,Just tell him to fuck off. You are not doing anything illegal.,Just tell him to fuck off. You are not doing anything illegal.,-16,2021-09-07 16:25:48,<praw.models.comment_forest.CommentForest object at 0x0000022EEE4D3CA0>,pjodqj,bodyweightfitness,t5_2tf0a,,False,False,t3_pjodqj,t3_pjodqj,/r/bodyweightfitness/comments/pjodqj/park_manager_claims_we_arent_allowed_to_hang/hby4qdv/
25,hbzypy4,thebigeverybody,"You have two options:

1. Get a permit and continue working out because you've decided that building your body is important and this particular battle against society is not

2. Repost this to r/legaladvice ( or some sov cit subreddits if that suits your anger better) and go from there. I think you'd fit right in as a sov cit.","You have two options:

1. Get a permit and continue working out because you've decided that building your body is important and this particular battle against society is not

2. Repost this to r/legaladvice ( or some sov cit subreddits if that suits your anger better) and go from there. I think you'd fit right in as a sov cit.",1,2021-09-08 00:16:41,<praw.models.comment_forest.CommentForest object at 0x0000022EEE4D3D60>,pjodqj,bodyweightfitness,t5_2tf0a,,1631060715.0,False,t3_pjodqj,t3_pjodqj,/r/bodyweightfitness/comments/pjodqj/park_manager_claims_we_arent_allowed_to_hang/hbzypy4/
26,hc01ar8,gear64,"My daughters and I got ran off an empty at the time stretch of ball fields for flying kites. We made no argument and immediately started complying,  but the guy was still being a jerk for not reeling them in fast enough. One adult and two young kids. We went to a different area of the very large park. On the way out we passed the fields to see handful of guys playing catch with a football, a guy doing tricks with his dog, and another guy flying RC plane. The violation was not the kites it was being on the field at all. I would bet money no one else had one either. I'm sure they're only given out for organized sports and events. It is what it is, unless you want to formally fight to change policy.","My daughters and I got ran off an empty at the time stretch of ball fields for flying kites. We made no argument and immediately started complying,  but the guy was still being a jerk for not reeling them in fast enough. One adult and two young kids. We went to a different area of the very large park. On the way out we passed the fields to see handful of guys playing catch with a football, a guy doing tricks with his dog, and another guy flying RC plane. The violation was not the kites it was being on the field at all. I would bet money no one else had one either. I'm sure they're only given out for organized sports and events. It is what it is, unless you want to formally fight to change policy.",1,2021-09-08 00:36:38,<praw.models.comment_forest.CommentForest object at 0x0000022EEE4D3FA0>,pjodqj,bodyweightfitness,t5_2tf0a,,False,False,t3_pjodqj,t3_pjodqj,/r/bodyweightfitness/comments/pjodqj/park_manager_claims_we_arent_allowed_to_hang/hc01ar8/
